index,종류별,상황별,재료별,방법별,글 제목,레시피이름,레시피이미지,조회수,조리시간,난이도,인분,재료,소개글,조리순서
50541,국/탕,영양식,닭고기,끓이기,몸보신요리 닭백숙 맛있게 끓이는 법 마무리는 닭죽으로,닭백숙,https://recipe1.ezmember.co.kr/cache/recipe/2016/05/30/c9d2422b3bc8c8feb37a015ba5eed9591.jpg,"543,094",90분 이내,아무나,2인분,"[('하림토종닭백숙', ''), ('파', '1대'), ('양파', '1개'), ('통마늘', '5~6알'), ('찹쌀', ''), ('양파', ''), ('당근', ''), ('부추', ''), ('닭 가슴살', '약간')]",둥이들이 번갈아 가며 열이 나고 목이 부어서 그런지 밥을 통 안 먹더라고요 그래서 울 둥이들을 위해 몸보신요리를 해줬답니다 고기를 좋아라해서 닭백숙을 만들어봤어요 재료도 간단하고 맛도 좋고 ^.^,"[{'step_number': 1, 'description': '백숙을 만들기 전에 닭 손질을 해줘야해요 일단 이 꽁무니를 과감하게 잘라주세요 그래야 냄새 없고 맛있는 백숙이 된답니다', 'image_url': 'https://recipe1.ezmember.co.kr/cache/recipe/2016/08/05/5982c79ef52eb14e3d15ad57010844bd1.jpg'}, {'step_number': 2, 'description': '그리고 목 부분과 꽁무니쪽 보면 하얀 기름덩어리가 있는데 제거해주세요', 'image_url': 'https://recipe1.ezmember.co.kr/cache/recipe/2016/08/05/9a436c348947ae782f7b91b25ed405b31.jpg'}, {'step_number': 3, 'description': '필요 없는 기름기와 꽁무니를 제거했는데 양이 꽤 되죠? 그리고 흐르는 물에 깨끗하게 구석구석 씻어주세요', 'image_url': 'https://recipe1.ezmember.co.kr/cache/recipe/2016/08/05/59f345a5b14a2af830e0b7c8382e1e3a1.jpg'}, {'step_number': 4, 'description': '닭이 들어갈 수 있는 큰 냄비를 준비하시고 토종닭과 부재료, 파 1대, 양파 1개, 통마늘 5~6알 정도 넣고 재료가 잠길 정도의 물을 넣어주세요 ~ 압력솥을 이용하면 더 맛있지만 저는 아직 압력솥 사용하기에 겁 많은 주부인지라 ㅋㅋㅋ 아주 푹 고았어요', 'image_url': 'https://recipe1.ezmember.co.kr/cache/recipe/2016/08/05/cd657f2a4fcea2e864aa9aaf5c7ee9931.jpg'}, {'step_number': 5, 'description': '센 불에서 20분정도 끓여주고 중간불에서 40분정도 끓여주었어요', 'image_url': 'https://recipe1.ezmember.co.kr/cache/recipe/2016/08/05/96ed943e5d9ff4b4d007c21f659be0d51.jpg'}, {'step_number': 6, 'description': '짜잔 ~ 몸보신요리 닭백숙 완성이요 ~ 푹 고아서 그런지 다리가 쏙 빠지더라고요 ㅋㅋ 살도 부들부들한게 너무 맛있네용', 'image_url': 'https://recipe1.ezmember.co.kr/cache/recipe/2016/08/05/ca286eadca097e717f7a3a169c84ef7f1.jpg'}, {'step_number': 7, 'description': '둥이들 먹일 닭 가슴살도 찢어놓고, 죽에 넣을 고기도 따로 찢어 놓았어요', 'image_url': 'https://recipe1.ezmember.co.kr/cache/recipe/2016/08/05/c232b850b4cbb86c3f42e89f2d3d64e61.jpg'}, {'step_number': 8, 'description': '고기를 다 먹고, 아쉬우니 닭죽으로 마무리해야죠 ?ㅋㅋ 찹쌀은 1시간정도 물에 불려 놓았어요', 'image_url': 'https://recipe1.ezmember.co.kr/cache/recipe/2016/08/05/93c708f2aeb9e7dc629fe102129e7fe91.jpg'}, {'step_number': 9, 'description': '불린 찹쌀은 물을 약간넣고 볶아주다', 'image_url': 'https://recipe1.ezmember.co.kr/cache/recipe/2016/08/05/c70a9c8347855c637aef0588fe0dd2821.jpg'}, {'step_number': 10, 'description': '닭 삶은 물을 넣고 찹쌀이 퍼질때까지 끓여주세요', 'image_url': 'https://recipe1.ezmember.co.kr/cache/recipe/2016/08/05/83d059347b2638fde93bd84e78f845601.jpg'}, {'step_number': 11, 'description': '어느정도 찹쌀이 퍼지면 야채와 고기를 넣고 눌러붙지 않게 저어주면 끝!!', 'image_url': 'https://recipe1.ezmember.co.kr/cache/recipe/2016/08/05/0792cda96090cdd50779b3e11d4b823c1.jpg'}, {'step_number': 12, 'description': '맛있는 닭죽까지 완성이 되었네요 ^^', 'image_url': 'https://recipe1.ezmember.co.kr/cache/recipe/2016/08/05/87dc5b09562b9217646542b2f5ba98b91.jpg'}]"
50542,국/탕,영양식,닭고기,끓이기,닭백숙보다 진한 여름보양식 닭곰탕 만드는법 닭곰탕 레시피,닭곰탕,https://recipe1.ezmember.co.kr/cache/recipe/2024/07/10/51de561a805b5facc01805682ac17d411.png,"2,861",None,None,None,"[('닭                                                                                1Kg', '1마리'), ('대파', '1개'), ('양파                                                                                클때는 1/2개', '1개'), ('마늘                                                                                12~15개', '1줌'), ('통후추', '1T'), ('한약재                                                                                삼계탕용 35g', '1개'), ('물', '2600ml'), ('멸치다시마 육수', '1000ml'), ('감자                                                                                선택사항', '2개'), ('무                                                                                200g/ 선택사항', '1토막'), ('다진파', ''), ('국간장', ''), ('소금', ''), ('후춧가루', ''), ('닭육수', '3T'), ('고춧가루', '1.5T'), ('국간장', '1T'), ('다진마늘', '1/2T'), ('후춧가루', '소량')]",닭백숙보다 진한 여름보양식 닭곰탕 만드는법 닭곰탕 레시피,"[{'step_number': 1, 'description': '닭1마리 백숙용으로 1키로 구입후 손질합니다. 닭의 꽁지부분이나 날개끝부분 제거하고 기름기 많은 부위 제거하고 내장부위 깨끗하게 세척해줍니다.스텐트레이 , 주방가위', 'image_url': 'https://recipe1.ezmember.co.kr/cache/recipe/2024/07/10/7f6cecb3dbb07398fdba913b726b2e8a1.png'}, {'step_number': 2, 'description': '큰 냄비에 손질한 닭을 넣고요~ 삼계탕용팩1개 넣고요~ 대파1개 토막낸거. 양파1개 토막낸거(클때는 반개만 넣으세요). 깐마늘 한줌(12~15개). 통후추1T를 넣고요~ 물2600ml에 멸치다시마육수1000ml를 부어줍니다.냄비 , 도마 , 조리용나이프', 'image_url': 'https://recipe1.ezmember.co.kr/cache/recipe/2024/07/10/17e80729148bb6c57df3e25825d78fb51.jpg'}, {'step_number': 3, 'description': '뚜껑은 덮고요~ 센불에서 끓어오르면 중약불로 줄여 40분정도 푹 끓여줍니다. 만약 토종닭인 경우에는 1시간 끓여주시고요~ 토종닭은 물의 양도 추가하세요~ 4. 40분 끓인후 닭은 건져주시고요~ 육수는 고운체로 걸러줍니다.채반 , 요리집게', 'image_url': 'https://recipe1.ezmember.co.kr/cache/recipe/2024/07/10/a361c1ff48d09cd62357d504f8b3e0621.jpg'}, {'step_number': 4, 'description': '양파를 껍질채 넣고~멸치다시마육수를 넣어서 육수가 색이 갈색빛이 날겁니다. 걸러낸 육수를 기름기만 걷어낸후 바로 끓여도 되는데요~ 시간이 된다면 차갑게 식혀준후 냉장고에 넣고 하얗게 뜨는 기름기 제거해주면 느끼하지 않고 더 좋답니다.볼', 'image_url': 'https://recipe1.ezmember.co.kr/cache/recipe/2024/07/10/846eaf3d85c24ba92f7dafb578c6ee641.png'}, {'step_number': 5, 'description': '건져낸 닭은 뼈에서 살만 발라서 먹기 좋게 찢어줍니다. 저는 닭껍질 싫어해서 버렸어요 닭껍질 좋아하시는 분들은 넣으셔도 됩니다.니트릴장갑 , 볼', 'image_url': 'https://recipe1.ezmember.co.kr/cache/recipe/2024/07/10/a7e6c6f5ea0a2d89087deec74b647c201.jpg'}, {'step_number': 6, 'description': '양념장(다대기) 만들기: 그릇에 식힌 닭육수3T. 고춧가루1T반.다진마늘1/2T.국간장1T.후춧가루소량 넣고 섞어 양념장을 만들어줍니다.소스볼 , 스푼', 'image_url': 'https://recipe1.ezmember.co.kr/cache/recipe/2024/07/10/eff340e5a302f65c1c00d0e89e9112ac1.png'}, {'step_number': 7, 'description': '무1토막(200g) 나박하게 썰어주시고요~ 감자2개 먹기 좋게 썰어준후 찬물에 담궈 녹말기를 제거합니다.도마 , 조리용나이프', 'image_url': 'https://recipe1.ezmember.co.kr/cache/recipe/2024/07/10/5222c34bfaa4a09ed3ce04e1da24542e1.jpg'}, {'step_number': 8, 'description': '기름기 걷어낸 닭육수를 냄비에 붓고 준비한 무와 감자를 넣은후 센불에서 끓으면 중불로 줄여 5분정도 끓이다가~ 찢어 놓은 닭살을 넣어줍니다. 닭살을 넣기전에 소금,국간장으로 대충 간을 맞춰주시고요~ 닭살을 넣은후 2분정도 끓여주면 완성입니다. 드실때 뚝배기같은 그릇에 닭곰탕 넣고요~ 다진파.후춧가루.양념장을 곁들여서 드시면 됩니다. 매운것을 즐기는 분들은 청양고추 총총 썰어서 곁들여도 좋습니다.냄비', 'image_url': 'https://recipe1.ezmember.co.kr/cache/recipe/2024/07/10/9a1569bdd2b3c3493ea058b56c13f2e41.jpg'}, {'step_number': 9, 'description': '여름철 닭백숙보다 진한 닭곰탕 드시고요~ 힘불끈 화이팅하세요!!!국자 , 뚝배기', 'image_url': 'https://recipe1.ezmember.co.kr/cache/recipe/2024/07/10/d24b405834576b7a489967e3c2c439dd1.jpg'}]"
50543,국/탕,영양식,닭고기,끓이기,완전 초간단 들깨삼계탕 레시피!,들깨삼계탕,https://recipe1.ezmember.co.kr/cache/recipe/2022/03/18/05c5d70af0b9076d9ff37a0ba90843821.jpg,"4,126",60분 이내,초급,2인분,"[('생닭', '2마리'), ('물', '2L'), ('한약재', '100g'), ('파', '1쪽'), ('들깨가루', '4국자')]",완전 초간단 들깨삼계탕 레시피 입니다.,"[{'step_number': 1, 'description': '닭은 영계닭을 사용 했어요. 한마리당 무게가 500g 입니다. \n닭은 물에 깨끗하게 세척하면서 날개 위 뾰족한 뼈는 가위로 잘라주세요.', 'image_url': 'https://recipe1.ezmember.co.kr/cache/recipe/2022/03/18/7c152a05d2e78cccd436c70d55fc4aff1.jpg'}, {'step_number': 2, 'description': '엉덩이쪽 비계도 깔끔하게 정리 해줍니다. \n저는 초간단 들깨 삼계탕이라서 속 내용물을 하나도 넣지 않았습니다.', 'image_url': 'https://recipe1.ezmember.co.kr/cache/recipe/2022/03/18/18e860adc12f7bc53f4920710baae5d51.jpg'}, {'step_number': 3, 'description': '시중에 판매하고 있는 한약재(팩)를 물 2L 넣은 냄비에 넣어주세요.', 'image_url': 'https://recipe1.ezmember.co.kr/cache/recipe/2022/03/18/8ed5dece865600d419c9b6b528e2125b1.jpg'}, {'step_number': 4, 'description': '그리고, 닭 2마리도 넣어줍니다.', 'image_url': 'https://recipe1.ezmember.co.kr/cache/recipe/2022/03/18/979c9ddfbd15de7c92ab758b9fd8049b1.jpg'}, {'step_number': 5, 'description': '가스레인지 강불로 한다음 물이 끓기 시작하면 중불로 낮춰서 뚜껑을 반쯤 덮어주세요. 대략 40~45분 정도 삶습니다.', 'image_url': 'https://recipe1.ezmember.co.kr/cache/recipe/2022/03/18/fca64efcb403f2168fad6ec0d12257501.jpg'}, {'step_number': 6, 'description': '그동안 대파 1쪽 쫑쫑~ 썰어서 손질해주세요.대파 손질법 레시피', 'image_url': 'https://recipe1.ezmember.co.kr/cache/recipe/2022/03/18/faa0eba06a9945de165228922c937a7a1.jpg'}, {'step_number': 7, 'description': '닭이 다 익었으면 들깨가루 4국자 넣어주세요. 들깨가루가 많이 들어가야지 국물이 걸죽하면서 맛있어요.', 'image_url': 'https://recipe1.ezmember.co.kr/cache/recipe/2022/03/18/f0f15277754e62e91eab187fac0ce7bf1.jpg'}, {'step_number': 8, 'description': '한소큼 다시 끓기 시작하면 가스레인지 불을 끕니다.', 'image_url': 'https://recipe1.ezmember.co.kr/cache/recipe/2022/03/18/f47c35692ce30a5813b0e2589adbc9481.jpg'}, {'step_number': 9, 'description': '먹기 좋게 1인분씩 덜어서 그 위에 파 송송 올려주면 완성!', 'image_url': 'https://recipe1.ezmember.co.kr/cache/recipe/2022/03/18/9b2ca167acc688476172dfd7fea5548a1.jpg'}]"
50544,국/탕,영양식,닭고기,끓이기,#담백한 닭곰탕만들기 #닭한마리로 만드는 시원하게 추운 몸을 풀어주는 진한 닭곰탕~~,닭곰탕,https://recipe1.ezmember.co.kr/cache/recipe/2016/12/13/3a56ad8fe88ae881ed1ea3529a1ac7371.jpg,"5,071",90분 이내,초급,2인분,"[('9호 닭', '1마리'), ('통마늘', '4개'), ('통후추', '1큰술'), ('대파', '2뿌리'), ('소금', '약간'), ('후추', '약간'), ('양파', '1/2개'), ('월계수잎', '2장'), ('청주', '2큰술'), ('봄동배추', '적당량')]",닭한마리로 담백하고 진한 닭곰탕으로 몸보신도 하고 남은 국물로 닭죽도 해서 먹을 수 있습니다. 닭고기살을 무쳐서 닭무침도 만들 수 있어요.,"[{'step_number': 1, 'description': '큰냄비에 양파, 대파, 통마늘, 통후추를 넣어 줍니다. 담백하면서도 닭의 누린내를 잡기 위함이지요.', 'image_url': 'https://recipe1.ezmember.co.kr/cache/recipe/2016/12/13/d8d65e07ba732f08177b9e775a1834bc1.jpg'}, {'step_number': 2, 'description': '깨끗이 씻어서 손질한 닭한마리를 넣어 줍니다. 기름은 조금씩 제거를 해주었어요. 좀더 담백하고 기름기 없는 곰탕을 만들기 위해서요. 닭사이즈는 9호입니다.', 'image_url': 'https://recipe1.ezmember.co.kr/cache/recipe/2016/12/13/087ca14e7265faaf178b4976bf834c271.jpg'}, {'step_number': 3, 'description': '이제 청주와 물을 넣어 주고는 팔팔 끓여 줍니다.', 'image_url': 'https://recipe1.ezmember.co.kr/cache/recipe/2016/12/13/77518e34beb6dde405a78602bbf340ea1.jpg'}, {'step_number': 4, 'description': '중간중간 거품이 올라오는 것을 걷어 주시고요. 강불에서 끓이다가는 중불로 옮겨서 진득하게 끓여 줍니다.', 'image_url': 'https://recipe1.ezmember.co.kr/cache/recipe/2016/12/13/d3e77c23f9a92f815cf79862094cde701.jpg'}, {'step_number': 5, 'description': '닭이 다 익었습니다. 그 닭을 꺼내어 줍니다. 그리고는 빼와 살을 발라 줍니다.', 'image_url': 'https://recipe1.ezmember.co.kr/cache/recipe/2016/12/13/960a56ca08788a56b63ee520f8041a831.jpg'}, {'step_number': 6, 'description': '닭한마리를 넣고 끓여낸 육수는 그대로 두시고요.', 'image_url': 'https://recipe1.ezmember.co.kr/cache/recipe/2016/12/13/55d9ebd77d204add52f567ca9b9404101.jpg'}, {'step_number': 7, 'description': '살을 발라서 먹기 좋게 찢어 주시고요.', 'image_url': 'https://recipe1.ezmember.co.kr/cache/recipe/2016/12/13/e0a757e01b94bf90e5f2c214aef645af1.jpg'}, {'step_number': 8, 'description': '살을 발라내고 남은 닭뼈를 다시 육수에 넣어 주세요. 그리고는 진득하니 끓여 주면 더욱 진한 육수를 만드실 수 있지요.', 'image_url': 'https://recipe1.ezmember.co.kr/cache/recipe/2016/12/13/bf3e28f2f1e264995105f669f38d4fe41.jpg'}, {'step_number': 9, 'description': '이제 닭뼈와 건더기를 모두 건져 내어 주시고요. 더욱 깨끗한 국물을 원하시면 체에 한번 걸러서 사용하세요. 그리고 찢은 닭살 투하해 줍니다.', 'image_url': 'https://recipe1.ezmember.co.kr/cache/recipe/2016/12/13/2cd63880c8f068fe53d386469ee29b6f1.jpg'}, {'step_number': 10, 'description': '팔팔 끓어오르면서 올라오는 거품은 일일히 제거해 주세요. 그래야 맑은 닭곰탕을 만드실 수 있거든요.', 'image_url': 'https://recipe1.ezmember.co.kr/cache/recipe/2016/12/13/20946befa319c953f4eea7a7e96c9a4b1.jpg'}, {'step_number': 11, 'description': '어느정도 육수가 다 만들어졌다면 이제 배추나 봄동을 넣어서 같이 끓여 주세요. 없으시면 패스하셔도 됩니다.', 'image_url': 'https://recipe1.ezmember.co.kr/cache/recipe/2016/12/13/03cf126042c9ab2aa83014c38ce463011.jpg'}, {'step_number': 12, 'description': '마지막으로 소금간을 해주시면 닭곰탕 완성입니다. 육수만들고 끓이는데에 1시간30분이상은 소요가 된 것 같네요.', 'image_url': 'https://recipe1.ezmember.co.kr/cache/recipe/2016/12/13/7f83af5a2d9421535138a9b73fc984bb1.jpg'}, {'step_number': 13, 'description': '마지막으로 기름 제거하고 불순물도 제거해 주시고요. 그럼 좀더 맑은 국물이 되었죠.', 'image_url': 'https://recipe1.ezmember.co.kr/cache/recipe/2016/12/13/a8febcdbde812012f4a7fd754a9200141.jpg'}, {'step_number': 14, 'description': '맑은 국물의 닭곰탕과 대파를 준비해 놓으면 시원하고 담백하고 진한 닭곰탕이 완성되는 것이죠.', 'image_url': 'https://recipe1.ezmember.co.kr/cache/recipe/2016/12/13/71ccc1cbdbd1be7f99ca1621c5c4122d1.jpg'}, {'step_number': 15, 'description': '대파를 듬뿍 넣어서 대파향이 물씬 풍기게 닭곰탕을 마무리해 주었습니다.', 'image_url': 'https://recipe1.ezmember.co.kr/cache/recipe/2016/12/13/0235adc079a2d498ef4361d4e3ec1fcb1.jpg'}]"
50545,국/탕,영양식,닭고기,끓이기,닭한마리 양념장 레시피 :: 말복 보양식 만들기,닭한마리,https://recipe1.ezmember.co.kr/cache/recipe/2020/08/17/5228592847af13f66cdc880aa7fbb3b91.jpg,"11,875",90분 이내,초급,2인분,"[('볶음탕용 닭', '1.2kg'), ('대파', '1대'), ('양배추', '1/4개'), ('양파', '1/2개'), ('감자', ''), ('청양고추', ''), ('칼국수', ''), ('수제비', ''), ('양파', '1개'), ('대파', '1대'), ('통후추', '1큰술'), ('맛술', '1/2컵'), ('다진 마늘', '1큰술'), ('액젓', '2큰술'), ('후춧가루', '약간'), ('물', '1컵'), ('진간장', '1/2컵'), ('식초', '1/4컵'), ('매실액', '1큰술'), ('고춧가루', '3큰술'), ('다진 마늘', '1큰술'), ('설탕', '1큰술'), ('연겨자', '1큰술')]","외국인이 좋아하는 한국 음식 10위안에
닭한마리라는 음식이 있더라구요

평상시에도 닭백숙을 자주 해 먹는 편이라
집에서도 충분히 해 먹을 수 있을 듯해서 만들어봤습니다","[{'step_number': 1, 'description': '한 마리 통으로 된 생닭을 사용해도 되지만\n먹기 편하게 볶음탕용 닭으로 가져왔습니다 :D', 'image_url': 'https://recipe1.ezmember.co.kr/cache/recipe/2020/08/17/f0267cbeba4d3da78b713f7b560916e41.jpg'}, {'step_number': 2, 'description': '· 소주나 맛술 1/2컵을 같이 넣어 팔팔 끓여준 뒤\n(오래 끓일 필요 없이 약 5분)\n끓이면서 나온 불순물을 찬물에 깨끗이 씻어줍니다', 'image_url': 'https://recipe1.ezmember.co.kr/cache/recipe/2020/08/17/90472c0ad1430c472dfc7622d1af80201.jpg'}, {'step_number': 3, 'description': '· 잡내 제거 재료를 넣고\n재료가 충분히 잠길 만큼 물을 넣고\n중불에서 푸욱 끓여줍니다\n※ 잡내 제거 재료\n【 양파 1개, 대파 1대, 통후추 1 큰 술, 맛술 1/2컵 】', 'image_url': 'https://recipe1.ezmember.co.kr/cache/recipe/2020/08/17/be65aa97f1f5ce2921ff1a324060f9451.jpg'}, {'step_number': 4, 'description': '통후추와 통마늘은\n티백 주머니나 다시팩에 넣어서 끓여주면\n나중에 빼내기 훨씬 편하겠죠??!!', 'image_url': 'https://recipe1.ezmember.co.kr/cache/recipe/2020/08/17/59e30294441eb7261c3d8f36d8a0c80a1.jpg'}, {'step_number': 5, 'description': '삶아질 동안 곁들여 먹을 채소를 준비합니다\n· 양배추 1/4개와 양파 1/2개를 얇게 채 썰어줍니다\n저는 채칼에 삭삭 갈아줬습니다많이 드시고 싶으신 분들은 더 많이 넉넉히 준비해주세용', 'image_url': 'https://recipe1.ezmember.co.kr/cache/recipe/2020/08/17/013a36b095b15aaf5093936e2f35968f1.jpg'}, {'step_number': 6, 'description': '이 요리의 핵심 메뉴인 양념장!!\n· 닭한마리 양념장을 만들어줍니다\n※ 닭한마리 다대기\n【 물 1 컵, 진간장 1/2컵, 식초 1/4컵, 매실액 1 큰 술, 고춧가루 3 큰 술, 다진 마늘 1 큰 술, 설탕 1 큰 술, 연겨자 1 큰 술 】\n-밥숟가락 계량\n( 입맛에 따라 원하는 양념을 가감해 주세요 :D)연겨자는 잘 안 녹기 때문에\n양념에 같이 넣고 풀지 말고,\n물 조금에 미리 풀어준 뒤 넣어주세요', 'image_url': 'https://recipe1.ezmember.co.kr/cache/recipe/2020/08/17/4b4818ef580614ee407530df2b3ec1a91.jpg'}, {'step_number': 7, 'description': '· 대파가 흐물해질때까지 푹 삶아지면\n(물이 끓기 시작한 후 약 10분)', 'image_url': 'https://recipe1.ezmember.co.kr/cache/recipe/2020/08/17/f9b09bd04f50e46193ac311e8a1796f61.jpg'}, {'step_number': 8, 'description': '같이 넣은 채소들과 통후추, 통마늘을 빼 줍니다', 'image_url': 'https://recipe1.ezmember.co.kr/cache/recipe/2020/08/17/2f55352b0e794edd414938cddd05730d1.jpg'}, {'step_number': 9, 'description': '· 물을 조금 더 추가해 주고(저는 약 300ml)', 'image_url': 'https://recipe1.ezmember.co.kr/cache/recipe/2020/08/17/0cc69ac4dc5530db20249e4604fdaccc1.jpg'}, {'step_number': 10, 'description': '대파 1대 큼직하게 썰어서 넣어주고\n- 간은 다진 마늘 1 큰 술, 액젓 2 큰 술, 후춧가루 약간 넣어 줬습니다추가로 먹고 싶은 감자나 당근, 청양고추 등등\n선택 재료를 넣고 끓이면서 재료가 다 익으면 완성!!\n\n- 닭고기는 양념장에 찍어 먹을 테니\n간은 약간 싱거워도 괜찮습니다 :)\n\n- 국물을 좋아하시는 분들은\n국물이 많이 싱거우면 소금으로 추가 간해주세요', 'image_url': 'https://recipe1.ezmember.co.kr/cache/recipe/2020/08/17/940c4f8eef363753b02f9ab9a5807bbc1.jpg'}, {'step_number': 11, 'description': '테이블에서 끓이면서 먹을 수 있는\n버너나 전기레인지 놓고 끓이면서 먹으면\n더 진하고 뜨끈하게 먹을 수 있습니다', 'image_url': 'https://recipe1.ezmember.co.kr/cache/recipe/2020/08/17/12afb8e049b24f5f2eff3dbaeae48bac1.jpg'}, {'step_number': 12, 'description': '양념장은 국그릇같이 큰 접시에\n한 사람당 하나씩 나눠 담아 줍니다', 'image_url': 'https://recipe1.ezmember.co.kr/cache/recipe/2020/08/17/0129bd309e91fd90d1cfd82715ebf5d61.jpg'}, {'step_number': 13, 'description': '그 양념장에 채 썬 채소를 넣고 푹 적셔주세요', 'image_url': 'https://recipe1.ezmember.co.kr/cache/recipe/2020/08/17/e2d5779b37970a2e93a6e356f3fbcb881.jpg'}, {'step_number': 14, 'description': '이 양념장에 닭고기를 찍어 먹거나\n채 썬 채소와 같이 먹으면 음청 맛있어용!!연겨자나 식초를 가감해\n취향에 맞춰 양념장을 만들어 드세요 :)\n저희 신랑은 연겨자 더 추가해서 먹더라구요 ㅎㅎ', 'image_url': 'https://recipe1.ezmember.co.kr/cache/recipe/2020/08/17/046cc6be9c9c1953d2620d1660f4e5021.jpg'}, {'step_number': 15, 'description': '닭고기를 어느 정도 건져먹고 나면\n칼국수 넣어 끓여 먹어야쥬??!!!', 'image_url': 'https://recipe1.ezmember.co.kr/cache/recipe/2020/08/17/f3acd94c93e71e395363ea70061af9ac1.jpg'}, {'step_number': 16, 'description': '칼국수 넣어 끓여 먹고\n남은 국물에 죽까지 끓여 먹어야 합니당\n남은 국물에 찬밥 넣고 끓이다가\n팔팔 끓으면 달걀 하나 풀고\n참기름 1 큰 술 + 김가루 넣고 끓여서\n죽까지 맛있게 만들어 드세욤!!ㅎㅎ', 'image_url': 'https://recipe1.ezmember.co.kr/cache/recipe/2020/08/17/b2303402dc74627c4acf0ba0840823521.jpg'}]"
