index,종류별,상황별,재료별,방법별,글 제목,레시피이름,레시피이미지,조회수,조리시간,난이도,인분,재료,소개글,조리순서
150008,퓨전,일상,소고기,볶음,불고기 퀘사디아 만들기 ~초간편 멕시코음식 비프 퀘사디아 레시피,불고기퀘사디아,https://recipe1.ezmember.co.kr/cache/recipe/2022/07/06/16def000195831a3ce5094d91a463f0a1.jpg,"6,397",20분 이내,아무나,1인분,"[('또띠아 10인치', '1장'), ('소고기다짐육', '100g'), ('빨간파프리카', '1/3개'), ('노란파프리카', '1/3개'), ('양파', '1/2개'), ('통후추', '적당량'), ('다진마늘', '1큰술'), ('올리브유', '2큰술'), ('스리라차소스', '1.5큰술'), ('케찹', '2.5큰술'), ('굴소스', '0.5큰술'), ('체다치즈', '2장'), ('피자치즈', '적당량')]",간단하게 브런치로 즐기기위해 불고기퀘사디아를 만들어 먹었답니다 ~,"[{'step_number': 1, 'description': '양파와 파프리카는 잘게 다져주세요', 'image_url': 'https://recipe1.ezmember.co.kr/cache/recipe/2022/07/06/782ec568e953e6fafd5367b885b684b61.jpg'}, {'step_number': 2, 'description': '후라이팬에 다진마늘을 넣어 마늘기름을 내주세요', 'image_url': 'https://recipe1.ezmember.co.kr/cache/recipe/2022/07/06/23a85028757b60d3cc0eea3148ce62281.jpg'}, {'step_number': 3, 'description': '마늘향이 올라오면 소고기다짐육을 넣어줍니다', 'image_url': 'https://recipe1.ezmember.co.kr/cache/recipe/2022/07/06/31d6376faf1ccbdc72d63a753aff0ec51.jpg'}, {'step_number': 4, 'description': '통후추를 넣고 젓가락을 이용해 소고기를 익혀주세요', 'image_url': 'https://recipe1.ezmember.co.kr/cache/recipe/2022/07/06/41a8c70849e3a9d4e6f72c3841048bcc1.jpg'}, {'step_number': 5, 'description': '소고기의 핏기가 사라지면 그때 다져놓은 야채를 넣어줍니다', 'image_url': 'https://recipe1.ezmember.co.kr/cache/recipe/2022/07/06/ffe6703aef77a7e9519df88367814a921.jpg'}, {'step_number': 6, 'description': '케찹과 스라리차소스를 넣어주세요', 'image_url': 'https://recipe1.ezmember.co.kr/cache/recipe/2022/07/06/63a44766ac6669d96e1011857baedc0b1.jpg'}, {'step_number': 7, 'description': '간을 본 후 모자란간을 맞춰주세요 \n조금 싱거워서 굴소스 반큰술을 넣었답니다 \n3분정도 볶아 수분을 날려주세요', 'image_url': 'https://recipe1.ezmember.co.kr/cache/recipe/2022/07/06/67f5d3ee863f6c58bdcd8e69134da66e1.jpg'}, {'step_number': 8, 'description': '아무것도 두르지 않은 후라이팬에 또띠아 한장을 올려 앞뒤로 구워준 후 한쪽면에 체다치즈를 올려줍니다가장가장약한불을 이용해주세요 !!', 'image_url': 'https://recipe1.ezmember.co.kr/cache/recipe/2022/07/06/4339c54eb2205c3c0f9e0b8f3de8e4b01.jpg'}, {'step_number': 9, 'description': '만들어낸 소고기소스를 치즈위에 올려주세요', 'image_url': 'https://recipe1.ezmember.co.kr/cache/recipe/2022/07/06/fcad626ca803816d5a0748a4554a5c6d1.jpg'}, {'step_number': 10, 'description': '모짜렐라치즈를 취향껏 올려주세요 ~', 'image_url': 'https://recipe1.ezmember.co.kr/cache/recipe/2022/07/06/6061236850a2d7a400fd8ef7c2c52b2d1.jpg'}, {'step_number': 11, 'description': '반으로 접어 노릇하게 구워냅니다', 'image_url': 'https://recipe1.ezmember.co.kr/cache/recipe/2022/07/06/568b670fce4c2f397e2f6b4b4eaa85321.jpg'}, {'step_number': 12, 'description': '먹기좋은 크기로 잘라 그릇에 담아내세요 ~', 'image_url': 'https://recipe1.ezmember.co.kr/cache/recipe/2022/07/06/26788ffb47bcb4cdcf999689d052064e1.jpg'}]"
150009,퓨전,일상,소고기,볶음,크림소스 불고기 리조또 [온가족 입맛 사로잡는 주말 특별식!],크림리조또,https://recipe1.ezmember.co.kr/cache/recipe/2021/10/08/bbfe40a8683c270eba7dd4ce5f4b218b1.jpg,"1,388",30분 이내,중급,1인분,"[('불고기용소고기', '1종이컵'), ('크림파스타소스', '1종이컵'), ('밥', '1인분'), ('빨간 파프리카', '1/4개'), ('노란 파프리카', '1/4개'), ('피망', '1/4개'), ('양파', '1/4개'), ('모짜렐라치즈', '1/2컵'), ('소금', '2꼬집'), ('후추', '2꼬집'), ('진간장', '2스푼'), ('맛술', '1스푼'), ('올리고당', '1스푼'), ('매실청', '1스푼'), ('참기름', '1스푼'), ('후추', '2꼬집')]","소고기로 만든 불고기 참 맛있죠? 맛있게 볶은 불고기와 밥만 먹어도 맛있잖아요? 오늘은 불고기를 활용해서 더 맛있는 요리를 만들었어요. 

불고기에 채소를 넣어서 불고기볶음밥을 만들고, 거기에 크림소스까지 넣어서 리조또를 만들었어요. 그리고 ​오븐그릇에 담아서 모짜렐라치즈 듬뿍 올려서 구워냈죠. 

6살 딸은 아직은 채소를 즐기지 않거든요? 그런데 불고기를 넣어서 만들어서 그런지 잘 먹네요. 다른 어떤 음식보다 고기요리를 즐기는 아가씨거든요. 엄마 마음이야 딸 입에 밥 들어가는 것보다 기분 좋은 일이 없죠. 제가 만들어 주는 음식을 잘 먹어주는 딸이 참 예뻐요. 

​","[{'step_number': 1, 'description': '불고기 먼저 재울게요. 불고기를 재우는 동안 다른 재료를 손질하면 시간 절약이 되겠죠?\n불고기용 소고기 1컵에 \n진간장 2스푼, 맛술, 1스푼, 올리고당 1스푼, 매실청 1스푼, 참기름 1스푼, 후추 약간\n모든 양념을 넣고 조물조물 무쳐 절여둘게요.', 'image_url': 'https://recipe1.ezmember.co.kr/cache/recipe/2021/10/08/751b51b036487b7d0556c01a9f66c0361.jpg'}, {'step_number': 2, 'description': '빨간 파프리카, 노란 파프리카, 피망, 양파를 잘게 다져 주세요. \n이때 사용하는 채소는 냉장고에 있는 어떤 채소라도 상관없겠죠? 자투리 채소를 소진할 수 있는 기회가 될 것 같네요.', 'image_url': 'https://recipe1.ezmember.co.kr/cache/recipe/2021/10/08/e23f7b1f03470d341a60eb03f9660fc51.jpg'}, {'step_number': 3, 'description': '기름 두른 팬에 다진 채소를 넣어 주시고요. 소금, 후추 간을 한 다음 골고루 섞으며 볶아주세요. \n이때 채소를 완전히 익혀버리면 식감이 다 사라져버리니까 채소가 익으려고 할 때까지만 볶을게요.', 'image_url': 'https://recipe1.ezmember.co.kr/cache/recipe/2021/10/08/5d9b8122322519cbc320ec46178ed18c1.jpg'}, {'step_number': 4, 'description': '채소가 익기 시작하면 재워뒀던 소고기를 넣고 함께 볶아주세요.\n제가 사용한 소고기는 앞다리살이거든요? 애초에 불고기용으로 구입한 거라서 크기가 커요. 절이기 전에 미리 잘라주시거나, 볶은 후에 먹기 좋게 잘라주시면 돼요. 소고기 다짐육을 사용하면 편하고요. 사진은 못 찍었는데, 저는 볶은 후에 먹기 좋게 잘랐어요.', 'image_url': 'https://recipe1.ezmember.co.kr/cache/recipe/2021/10/08/31bbca4c1597873b86d001b7c00a137b1.jpg'}, {'step_number': 5, 'description': '소고기가 익으면 밥을 넣고 볶아주세요. 불고기의 양념이 밥에 잘 스며들도록 골고루 섞으면서 볶아주세요.', 'image_url': 'https://recipe1.ezmember.co.kr/cache/recipe/2021/10/08/bb9ce033a1dce621cd94d6286306bc3a1.jpg'}, {'step_number': 6, 'description': '이제 크림소스 넣고 골고루 섞어주면 리조또가 완성돼요.', 'image_url': 'https://recipe1.ezmember.co.kr/cache/recipe/2021/10/08/77762efc2e0b346295486a5e2b52cf511.jpg'}, {'step_number': 7, 'description': '완성된 리조또를 오븐 그릇에 넣어주세요. 그 위에 모짜렐라치즈를 올려주시면 돼요. \n저는 모짜렐라치즈 좋아하니까 많~이 올렸어요.', 'image_url': 'https://recipe1.ezmember.co.kr/cache/recipe/2021/10/08/c795f3a360ccbee5f61d8baec50a4b101.jpg'}, {'step_number': 8, 'description': '180도 오븐에서 10분 구웠어요.\n집집마다 오븐 사양이 다르니까 자주 확인하면서 모짜렐라치즈의 익힘 정도를 확인해 주세요.오븐', 'image_url': 'https://recipe1.ezmember.co.kr/cache/recipe/2021/10/08/4f542d0c2b5ffe1c942f900be7df86a91.jpg'}]"
150010,퓨전,일상,소고기,볶음,하나만 먹어도 든든한 또띠아 롤 내맘대로 만들기,또띠아롤,https://recipe1.ezmember.co.kr/cache/recipe/2022/10/02/5681df944235cd801eae632d1861c9581.jpg,"1,154",30분 이내,초급,3인분,"[('소고기', '200~300g'), ('달걀', '3개'), ('당근', '조금'), ('양파', '1/2개'), ('토마토', '1개'), ('상추', '적당량'), ('새송이버섯 조림', '적당량'), ('또띠아', '5장'), ('꽃소금', '톡톡'), ('다진마늘', '약간'), ('후춧가루', '톡톡'), ('생강가루', '톡톡'), ('스위트칠리소스', ''), ('돈까스소스', ''), ('샐러드드레싱', ''), ('케찹', ''), ('머스타드', '')]","내맘대로 말아먹는 또띠아롤 또 먹고싶은 또말이 ~!
말이 필요없어요","[{'step_number': 1, 'description': '달걀 3개를 곱게 풀어 주세요 식용유를 두르고 예열한 팬에 달걀물의 반을 넣고', 'image_url': 'https://recipe1.ezmember.co.kr/cache/recipe/2022/10/02/8c22e9a1d79710579975e1129907c5481.jpg'}, {'step_number': 2, 'description': '불을 줄이고 접어주세요', 'image_url': 'https://recipe1.ezmember.co.kr/cache/recipe/2022/10/02/1049cd029b5786938e7afbbbdabf57821.jpg'}, {'step_number': 3, 'description': '접은 달걀을 앞으로 밀고 나머지 달걀물을 부어주세요', 'image_url': 'https://recipe1.ezmember.co.kr/cache/recipe/2022/10/02/b71a7f7d2eb0034c644683541865953e1.jpg'}, {'step_number': 4, 'description': '접어주세요 불을 끄고 한김 식으면 한입크기로 썰어주세요', 'image_url': 'https://recipe1.ezmember.co.kr/cache/recipe/2022/10/02/9aa785f7c8d50d9a59be9d3ccf0be41a1.jpg'}, {'step_number': 5, 'description': '채썬 당근과 양파를 팬에 넣고 볶다가 식용유를 두르고 익혀주세요', 'image_url': 'https://recipe1.ezmember.co.kr/cache/recipe/2022/10/02/1929c428205456af61e31893ac356cb91.jpg'}, {'step_number': 6, 'description': '볶은 야채를 앞으로 밀고 샤브샤브용 소고기를 얇게 펴서 넣고', 'image_url': 'https://recipe1.ezmember.co.kr/cache/recipe/2022/10/02/0b6e2a548b78c9ef2285a409a8035dac1.jpg'}, {'step_number': 7, 'description': '꽃소금 후춧가루 생강가루 다진마늘을 넣고 앞뒤로 구워주세요', 'image_url': 'https://recipe1.ezmember.co.kr/cache/recipe/2022/10/02/80f12b9bc98e83b87c88d8f6f95b8ea61.jpg'}, {'step_number': 8, 'description': '또띠아롤 팬에 넣고 앞뒤로 구워주세요', 'image_url': 'https://recipe1.ezmember.co.kr/cache/recipe/2022/10/02/7d5ded768015c79e6b6a5902eae69a8f1.jpg'}, {'step_number': 9, 'description': '토마토와 상추를 먹기 좋게 썰어주세요', 'image_url': 'https://recipe1.ezmember.co.kr/cache/recipe/2022/10/02/f1471eedca6b4771b75e03faae5a97ad1.jpg'}, {'step_number': 10, 'description': '소스는 취향대로 스윗칠리 샐러드 드레싱 돈까스 소스 케찹 등 넣어 주세요', 'image_url': 'https://recipe1.ezmember.co.kr/cache/recipe/2022/10/02/ad4d4bd4ccd7a54b568bade756aa73821.jpg'}, {'step_number': 11, 'description': '구운 또띠아 위에 좋아하는 속재료를 넣고 소스를 뿌리고 둘둘 말아서 맛있게 먹어요!', 'image_url': 'https://recipe1.ezmember.co.kr/cache/recipe/2022/10/02/032f050cb54653dfe8af32fb44c845711.jpg'}]"
150011,퓨전,일상,소고기,볶음,파스타 # 소고기 파스타 # 치즈 파스타 # 오일파스타,소고기오일파스타,https://recipe1.ezmember.co.kr/cache/recipe/2021/08/16/e5f4080c245cb578cd60fa5743dd6b271.jpg,"1,390",30분 이내,초급,4인분,"[('스파게티 면', '400g'), ('소고기 부채살', '2조각'), ('마늘', '8개'), ('피망', '1/4개'), ('고추', '1개'), ('모짜렐라 치즈', '적당량'), ('천일염', '2T'), ('올리브유                                                                                1T', '1/2컵'), ('후춧가루', '적당량'), ('바질가루', '적당량')]",매콤함과 오일에 코팅된 꼬들한 면발에 부드러운 소고기를 맛볼수 있어요,"[{'step_number': 1, 'description': '재료를 준비합니다', 'image_url': 'https://recipe1.ezmember.co.kr/cache/recipe/2021/08/16/e339de30a22cd06934fae923129ecce21.jpg'}, {'step_number': 2, 'description': '물 800ml(4컵)에 천일염 1T 넣고 끓여주세요', 'image_url': 'https://recipe1.ezmember.co.kr/cache/recipe/2021/08/16/b4011eb508685f1613c2407d737f099a1.jpg'}, {'step_number': 3, 'description': '올리브유 반컵에 납작하게 썬 마늘을 넣고 그 다음 약불을 켜서 마늘을 익혀주세요', 'image_url': 'https://recipe1.ezmember.co.kr/cache/recipe/2021/08/16/98f1c0188d36d91eef510ad4882a55fc1.jpg'}, {'step_number': 4, 'description': '물이 끓으면 면을 넓게 펼쳐서 넣고', 'image_url': 'https://recipe1.ezmember.co.kr/cache/recipe/2021/08/16/9c45fa0c287378de27b4700a31d0276b1.jpg'}, {'step_number': 5, 'description': '모두 잠기게 넣고 7분 끓여주세요', 'image_url': 'https://recipe1.ezmember.co.kr/cache/recipe/2021/08/16/f6ca7bdfd0371df352d55a9a8b781f5c1.jpg'}, {'step_number': 6, 'description': '마늘 냄새가 솔솔 풍기네요', 'image_url': 'https://recipe1.ezmember.co.kr/cache/recipe/2021/08/16/3e4d824e993eb5e1e547b1f7c336d79d1.jpg'}, {'step_number': 7, 'description': '기름이 보글보글 올라오면 불을 꺼둡니다 취향껏 노릇하게 익히셔도 되세요', 'image_url': 'https://recipe1.ezmember.co.kr/cache/recipe/2021/08/16/d7dc335b7f91689ed6c646aae068c4be1.jpg'}, {'step_number': 8, 'description': '면만 건져주세요', 'image_url': 'https://recipe1.ezmember.co.kr/cache/recipe/2021/08/16/90f45637887eac1b6417a94f0fde71551.jpg'}, {'step_number': 9, 'description': '미리 상온에 꺼내둔 고기에 앞뒤로 천일염을 뿌려 둡니다', 'image_url': 'https://recipe1.ezmember.co.kr/cache/recipe/2021/08/16/08736c75dfb096400e99e5d166243b811.jpg'}, {'step_number': 10, 'description': '팬을 뜨겁게 달군 다음 올리브유 1T 정도 넣고 고기를 구워주세요 (소금이 튀므로 주의하세요)', 'image_url': 'https://recipe1.ezmember.co.kr/cache/recipe/2021/08/16/eb2a5149f860934d972f499b123689041.jpg'}, {'step_number': 11, 'description': '앞뒤옆을 구워주세요', 'image_url': 'https://recipe1.ezmember.co.kr/cache/recipe/2021/08/16/27c960e4f0d546341b579639acb590d21.jpg'}, {'step_number': 12, 'description': '잠시 두세요(resting)', 'image_url': 'https://recipe1.ezmember.co.kr/cache/recipe/2021/08/16/b71f7501f60cb2ef83f78654f92e7fee1.jpg'}, {'step_number': 13, 'description': '모짜렐라 치즈를 얇게 펴줍니다 후춧가루와 바질가루를 뿌리고', 'image_url': 'https://recipe1.ezmember.co.kr/cache/recipe/2021/08/16/c663a2d4325e202702602ffe7f6080411.jpg'}, {'step_number': 14, 'description': '치즈가 녹으면 작게 썬 고추와 피망을 넣고 불을 끕니다', 'image_url': 'https://recipe1.ezmember.co.kr/cache/recipe/2021/08/16/48be4d21f3376069bee7013674f909371.jpg'}, {'step_number': 15, 'description': '팬을 달궈 길이로 자른 고기와 한입크기의 고기 겉면을 익혀주세요', 'image_url': 'https://recipe1.ezmember.co.kr/cache/recipe/2021/08/16/ce82458fcf227722fdcf9fc9dabcbce41.jpg'}, {'step_number': 16, 'description': '치즈 위에 고기를 넣고 말아주세요', 'image_url': 'https://recipe1.ezmember.co.kr/cache/recipe/2021/08/16/c51ae29e93da3b109682f943b0d11ea31.jpg'}, {'step_number': 17, 'description': '치즈를 조금씩 넣고 후춧가루 바질가루를 뿌리고 잘게 썬 고추와 피망을 넣고 치즈를 녹여주세요', 'image_url': 'https://recipe1.ezmember.co.kr/cache/recipe/2021/08/16/2814d271ec990baf50747058e7a9443e1.jpg'}, {'step_number': 18, 'description': '불을 끄고 고기를 올린 후 오무려 주세요', 'image_url': 'https://recipe1.ezmember.co.kr/cache/recipe/2021/08/16/2cfa6dda4c1fd2854ce82220f188ce4a1.jpg'}, {'step_number': 19, 'description': '마늘 익힌 올리브유 팬에 면을 넣고 센불에 오일을 코팅시키면서 볶아주세요', 'image_url': 'https://recipe1.ezmember.co.kr/cache/recipe/2021/08/16/488079e7a4f8996646593e66fa11cf421.jpg'}, {'step_number': 20, 'description': '썰어 놓은 고추를 넣고 (매운맛을 더하려면 고추를 넉넉히 넣어요) 붙어있는 면을 오일에 적셔서 피면서 섞어주세요 \n( 이때 맛을 보고 추가간이 필요하면 소금을 뿌려 주세요 ) 치즈가 짭잘해서 저는 추가하지 않았어요', 'image_url': 'https://recipe1.ezmember.co.kr/cache/recipe/2021/08/16/49e99f3f4885718147ae5da8681b29e91.jpg'}, {'step_number': 21, 'description': '고기를 썰어서 파스타와 같이 먹어요 피망도 곁들여 줍니다', 'image_url': 'https://recipe1.ezmember.co.kr/cache/recipe/2021/08/16/feebded83845e7928e6e6b0064e2816e1.jpg'}]"
150012,퓨전,일상,소고기,볶음,"불고기 크림리조또 만들기, 밥블레스유 크림볶음밥!",불고기크림리조또,https://recipe1.ezmember.co.kr/cache/recipe/2023/02/07/a0455912913000bea1a2881695598cde1.jpg,"3,321",20분 이내,중급,2인분,"[('소고기 불고기용', '150g'), ('다진마늘', '1T'), ('설탕', '1/2T'), ('간장', '3T'), ('매실청', '1T'), ('후추', '약간'), ('밥', '300g'), ('파', '1개'), ('양파', '1/2개'), ('우유', '50ml'), ('생크림', '150ml'), ('청양고추', '1개'), ('굴소스', '1/2T'), ('소금', '약간'), ('모짜렐라치즈', '약간'), ('파마산치즈', '1T'), ('후추', '약간'), ('기름', '3T')]","불고기를 좋아해서 자주 먹는데 한 번씩 애매하게 남더라구요
그럴 때 활용해도 되고 그냥 크림리조또가 먹고 싶을 때 조금 더 맛있게 먹을 수 있는 불고기 크림리조또입니다!
크림의 고소한 맛, 불고기의 달달하고 짭조름한 맛, 한번씩 씹히는 청양고추의 매콤한 맛까지 거의 모든 맛이 들어있어요","[{'step_number': 1, 'description': '불고기거리를 한입보다 작은 크기로 썰어준 뒤 다진마늘, 설탕, 간장, 매실청, 후추를 넣고 버무려줍니다양념에 재워도 되지만 바로 사용하셔도 돼요\n불고기로 먹는게 아니라 리조또에 넣어 먹기 때문에 고기는 한입보다 작게 잘라주세요', 'image_url': 'https://recipe1.ezmember.co.kr/cache/recipe/2023/02/07/0e44132b18182e0d65f5965c13de980b1.jpg'}, {'step_number': 2, 'description': '양파와 대파는 잘게 썰어주시면 됩니다\n대파는 송송 썰었고 양파는 다지듯이 썰었어요', 'image_url': 'https://recipe1.ezmember.co.kr/cache/recipe/2023/02/07/fad4739850094d2bf8fcd390225060fa1.jpg'}, {'step_number': 3, 'description': '후라이팬에 기름을 두르고 열이 오르면 파와 양파를 볶아 향을 내줍니다', 'image_url': 'https://recipe1.ezmember.co.kr/cache/recipe/2023/02/07/fec13242291439e1643404d917c320ec1.jpg'}, {'step_number': 4, 'description': '파와 양파가 어느정도 익으면 불고기를 넣고 잘 볶아주세요', 'image_url': 'https://recipe1.ezmember.co.kr/cache/recipe/2023/02/07/ee4dc1c5be3052e445d1fd391d1e78a21.jpg'}, {'step_number': 5, 'description': '불고기에 붉은기가 없어지면 청양고추를 썰어 넣고 밥도 함께 넣어줍니다1개도 괜찮았지만 저는 2개정도 넣어도 맛있을 것 같았어요', 'image_url': 'https://recipe1.ezmember.co.kr/cache/recipe/2023/02/07/effb546529ed7f3528f84e700ef60d701.jpg'}, {'step_number': 6, 'description': '여기에 굴소스와 소금으로 간을 해주세요우유와 생크림을 넣을꺼라 간을 조금 쎄게 해주셔도 됩니다', 'image_url': 'https://recipe1.ezmember.co.kr/cache/recipe/2023/02/07/27fb8a84ed2f41eb838014be7443ec901.jpg'}, {'step_number': 7, 'description': '우유와 생크림을 넣어주세요\n우유와 생크림 합친 양을 200ML정도 넣어주시면 됩니다저는 꾸덕한 크림리조또를 먹고 싶어서 생크림 양을 150으로 잡았어요\n조금 더 가볍게 먹고 싶으면 우유 양을 늘리고 생크림 양을 줄여주세요', 'image_url': 'https://recipe1.ezmember.co.kr/cache/recipe/2023/02/07/dd8e6d76e7335a69de735d801488fee41.jpg'}, {'step_number': 8, 'description': '중간 불에서 한 번 바글바글 끓으면 파마산치즈와 모짜렐라를 올려주고 뚜껑을 덮어 치즈를 녹여주세요\n여기에 후추를 뿌려 마무리하면 됩니다위에 파슬리나 쪽파, 청양고추를 다져 올리면 더 예쁘게 플레이팅 할 수 있어요', 'image_url': 'https://recipe1.ezmember.co.kr/cache/recipe/2023/02/07/59520a918f4473a61f779a7551603eee1.jpg'}]"
150013,퓨전,일상,소고기,볶음,낙지 소불고기 만드는법 불고기양념레시피,낙지소불고기,https://recipe1.ezmember.co.kr/cache/recipe/2024/04/29/ce72cae486401d9a2a1f2b1c025afe8e1.jpg,372,60분 이내,중급,4인분,"[('소고기 불고기용', '500g'), ('낙지', '6마리'), ('양파', '1/2개'), ('대파', '1대'), ('참기름', '1'), ('통깨', '1'), ('진간장', '5T'), ('멸치액젓', '1T'), ('설탕', '2.5스푼'), ('물엿', '1T'), ('다진마늘', '1T'), ('참기름', '2T'), ('후추', '')]",한국인이 가장 좋아하는 음식이 불고기에요 정육점에 가면 소고기 국거리보다 더 자주 사오는게 불고기거리입니다. 소고기 부위 중에서 가격이 저렴하기도 하고 빠르고 쉽게 요리를 할 수 있어서 계획 없이 사 올 때가 많아요 이번에는 평소에 먹던 소불고기가 아닌 낙지 소불고기입니다. 재래시장을 다녀왔어요 주꾸미도 사고 낙지도 사고 냉동 낙지이지만 가격이 나쁘지 않아서 사 왔어요 낙지 요놈 볶아 먹으면 맛있는데 주꾸미볶음을 만들어 먹고 해물짬뽕에 몇마리 넣었더니 6마리 밖에 되지 않아서 불고기에 넣어서 낙지불고기를 만들었어요 ​,"[{'step_number': 1, 'description': '낙지는 머리 부분을 가위로 자른 다음 내장을 꺼 내 준후 눈과 입을 가위를 사용해서 잘라주세요주방가위낙지 손질법', 'image_url': 'https://recipe1.ezmember.co.kr/cache/recipe/2024/04/29/75aa1798627ca70c2ea4594a06666d6a1.jpg'}, {'step_number': 2, 'description': '밀가루 3스푼을 넣어주고 조물조물 문지른 후에 물로 깨끗하게 씻어 주세요믹싱볼', 'image_url': 'https://recipe1.ezmember.co.kr/cache/recipe/2024/04/29/81e36c7cdc43b1a13466ff62a240e7601.jpg'}, {'step_number': 3, 'description': '소고기는 키친타월을 사용해서 핏물을 제거해 줍니다.키친타올', 'image_url': 'https://recipe1.ezmember.co.kr/cache/recipe/2024/04/29/623ebd493eff18dfae11fa4a70652d391.jpg'}, {'step_number': 4, 'description': '설탕 2스푼반 물엿 1스푼을 넣어주세요', 'image_url': 'https://recipe1.ezmember.co.kr/cache/recipe/2024/04/29/d4f48a6579ad3f506f4eb6a256503c841.jpg'}, {'step_number': 5, 'description': '다진마늘 1스푼을 넣어서 조물조물 무쳐주세요 소고기 불고기거리는 지방이 많이 들어 있지 않은 부위이기 때문에 미리 설탕으로 부드럽게 만들어 주세요', 'image_url': 'https://recipe1.ezmember.co.kr/cache/recipe/2024/04/29/c222e8c889d7d78bf3acdba10019e2fb1.jpg'}, {'step_number': 6, 'description': '소고기를 부드럽게 만드는 동안 대파와 양파를 채 썰어줍니다도마 , 조리용나이프양파 손질법', 'image_url': 'https://recipe1.ezmember.co.kr/cache/recipe/2024/04/29/08ebb226bada0846d66c336ecb0bb8a71.jpg'}, {'step_number': 7, 'description': '간장 5스푼과 참기름 2스푼 후춧가루를 톡톡톡톡 넣어주세요', 'image_url': 'https://recipe1.ezmember.co.kr/cache/recipe/2024/04/29/fdb27f26b4e942c9be33ddbdc0a755201.jpg'}, {'step_number': 8, 'description': '조물조물 양념이 잘 배이게 무쳐줍니다.', 'image_url': 'https://recipe1.ezmember.co.kr/cache/recipe/2024/04/29/3490cc44b0dd500b10313da245e67e7d1.jpg'}, {'step_number': 9, 'description': '속이 깊은 후라이팬 궁중팬을 준비해 줍니다. 가스불을 켜고 소고기와 대파 양파를 넣어주고 볶아주세요궁중팬', 'image_url': 'https://recipe1.ezmember.co.kr/cache/recipe/2024/04/29/6a22439d4a1c980f036a1b8c680bc2ce1.jpg'}, {'step_number': 10, 'description': '소고기는 불고기 거리여서 얇아요 볶을 때 젓가락과 숟가락을 사용해서 뭉쳐 있는 소고기를 살살 풀어주면서 볶아주세요 소고기 색이 빨간색에서 갈색으로 변할 때까지 볶아줍니다.요리젓가락', 'image_url': 'https://recipe1.ezmember.co.kr/cache/recipe/2024/04/29/8cf8e9b7c2c7865d408b87c16d20d5461.jpg'}, {'step_number': 11, 'description': '소고기가 거의 다 익어갈 때쯤 낙지를 넣어줍니다. 볶아주세요 낙지를 넣어주고 난 후에 멸치액젓 1스푼을 넣어주세요', 'image_url': 'https://recipe1.ezmember.co.kr/cache/recipe/2024/04/29/53fde18c8fd482f366b34b10495a87071.jpg'}, {'step_number': 12, 'description': '마지막은 참기름과 통깨를 뿌려서 마무리해 주세요', 'image_url': 'https://recipe1.ezmember.co.kr/cache/recipe/2024/04/29/54d3b6747b899390386dd9c4d253ebb81.jpg'}]"
