index,종류별,상황별,재료별,방법별,글 제목,레시피이름,레시피이미지,조회수,조리시간,난이도,인분,재료,소개글,조리순서
55320,디저트,초스피드,달걀/유제품,끓이기,냉장고를 부탁해 - 바나나우유 푸딩 만들기 (노오븐 디저트),바나나우유푸딩,https://recipe1.ezmember.co.kr/cache/recipe/2017/04/27/ea248e9455e97a7ce8791bba158766001.jpg,"15,462",10분 이내,아무나,1인분,"[('바나나우유', '1개'), ('전분가루                                                                                크게', '1스푼'), ('딸기', '3개'), ('아몬드                                                                                선택', '3개')]","'냉장고를 부탁해' 방송에서 미카엘 쉐프가
바나나우유 푸딩 만드는 걸 보고
슈가롱도 바로 도전해봤답니당!*.*

만들기도 쉬운데, 비쥬얼까지 좋아서
완전 슈가롱 취향저격 탕탕♡","[{'step_number': 1, 'description': '바나나우유를 냄비에 부어 약한 불에 끓여주세요*슈가롱은 참고용으로 찍었을 뿐!\n컵이 아니라 냄비에 부어주세용', 'image_url': 'https://recipe1.ezmember.co.kr/cache/recipe/2017/04/27/3f3fc93bc4ffdb89941831783f41f4b01.jpg'}, {'step_number': 2, 'description': '바나나우유가 보글보글 끓기전에\n전분가루 큰 한스푼을 넣고 섞어주세요', 'image_url': 'https://recipe1.ezmember.co.kr/cache/recipe/2017/04/27/5cfbcafc5ce8f47232421ef18e4d11791.jpg'}, {'step_number': 3, 'description': '바나나우유가 보글보글 끓고 질감이 걸죽해졌을 때, 이렇게 그릇에 쏟아넣은 후 냉장고에서 10분 정도 차갑게 식혀주세요', 'image_url': 'https://recipe1.ezmember.co.kr/cache/recipe/2017/04/27/981dd61dbad0df73e56232e5b0a742bd1.jpg'}, {'step_number': 4, 'description': '바나나우유 푸딩이 식어가는 동안\n딸기를 손질해주세요\n- 딸기 한개만 반으로 잘라주고,\n나머지는 이렇게 잘게 조각조각 내주세요', 'image_url': 'https://recipe1.ezmember.co.kr/cache/recipe/2017/04/27/e107182ced59c5645f2a31331015fbd71.jpg'}, {'step_number': 5, 'description': '딸기를 이용해 예쁘게 데코해주면 완성>_집에 남는 견과류가 있다면\n그걸 잘게 조각내서 딸기와 함께 뿌려줘도\n모양도 좋고 맛도 더 좋아진답니다', 'image_url': 'https://recipe1.ezmember.co.kr/cache/recipe/2017/04/27/df9cd3e20cafa1365063744cf57a21ca1.jpg'}]"
55321,디저트,초스피드,달걀/유제품,끓이기,달걀푸딩 컵라면용기와 달걀만 있으면 ok,달걀푸딩,https://recipe1.ezmember.co.kr/cache/recipe/2015/03/26/587fe2a305ede7beaecebf47eb1859b51.jpg,"34,178",None,None,None,"[('계란', '3개'), ('뜨거운물', ''), ('후추', '약간'), ('고운 소금', '약간'), ('파마산치즈가루', '약간')]","부드러워 쏘옥 ~ 넘어가는 간식 '온천달걀' 
컵라면용기와 계란만 있음 집에서도 캠핑에서도 어디서든 만들어서 드실수 있어요","[{'step_number': 1, 'description': '계란은 잠시 상온에 1-2시간 정도 두고 컵라면 용기 깨끗이 씻어 준비 완료 ~! 컵라면 용기가 쓰레기로만 생각하셨죠 ^^ 온천달걀 만들때 아주 유용한 팁 이랍니다', 'image_url': 'https://recipe1.ezmember.co.kr/cache/recipe/2015/03/26/6ad65770920701874c9724c9f8131a771.jpg'}, {'step_number': 2, 'description': '용기에 계란 3-4개 정도가 적당해요 ~! 너무 많이 넣으면 잘 안되더라구요 ~ 100도시로 끓인 물을 가득 부어 주세요 ~!', 'image_url': 'https://recipe1.ezmember.co.kr/cache/recipe/2015/03/26/eff480e2847adad26129f661acd08ba91.jpg'}, {'step_number': 3, 'description': '그런 다음 랩으로 씌우고', 'image_url': 'https://recipe1.ezmember.co.kr/cache/recipe/2015/03/26/d8be1d809a8003a25bedb194aa49efa21.jpg'}, {'step_number': 4, 'description': '20분간 방치 합니다.', 'image_url': 'https://recipe1.ezmember.co.kr/cache/recipe/2015/03/26/6cf3b5dc62e6e9d00fea8f14419661261.jpg'}, {'step_number': 5, 'description': '물이 미지근해 졌어요. 뜨거운물에서 꺼낸 계란을 껍질이 잘 까지지 않아요 찬물에 살짝 담갔다 꺼내면 그마나 잘 까집니다. 보들보들 흰자반숙 보이시나요 ^^', 'image_url': 'https://recipe1.ezmember.co.kr/cache/recipe/2015/03/26/e5b52cde7978abde9fd371cf5bc951a51.jpg'}, {'step_number': 6, 'description': '윗부분만 약간 까서 후루룩 마셔도 좋지만 푸키베베가 먹는 스타일로 소개해 드릴게요 ~! 작은 접시에 담고 ~~ 보세요 이렇게 쏘옥 깨끗이 빠져요', 'image_url': 'https://recipe1.ezmember.co.kr/cache/recipe/2015/03/26/cfc3d0c4272cc99fc7eb0e71b875f7821.jpg'}, {'step_number': 7, 'description': '노른자는 반숙으로 탱글탱글 잘 익었습니다. ^^ 여기에 후추 약간과 고운 소금 약간 해서 먹음 됩니다. ~!', 'image_url': 'https://recipe1.ezmember.co.kr/cache/recipe/2015/03/26/4f4d316a0972c41bbb8acdcc067e72c61.jpg'}, {'step_number': 8, 'description': '근데 푸키베베는 갠적으로 요 스타일이 맛이 좋더라구요 바로 후추 약간 파마산 치주가루 티스푼으로 1/3정도 넣어서 살살 비벼 먹음 고소하면서도 보들보들 한게 ~ 3개는 거뜬히 혼자 다 먹어요 ^^', 'image_url': 'https://recipe1.ezmember.co.kr/cache/recipe/2015/03/26/61d3670c099faf5d1d37d0c8d2d264981.jpg'}]"
