index,종류별,상황별,재료별,방법별,글 제목,레시피이름,레시피이미지,조회수,조리시간,난이도,인분,재료,소개글,조리순서
50672,국/탕,영양식,닭고기,끓이기,녹두 닭백숙 녹두 닭죽 만들기 여름 보양식 초복 음식,녹두닭백숙,https://recipe1.ezmember.co.kr/cache/recipe/2023/07/05/391d0f998463ee379ce3c875fa730ac31.jpg,"4,595",120분 이내,초급,4인분,"[('닭', '1kg'), ('찹쌀', '140g'), ('거피 녹두', '140g'), ('대추', '40g'), ('한약재 다시팩', '1개'), ('마늘', '100g'), ('대파', '1뿌리'), ('물', '1.3L'), ('맛술', '2큰술'), ('후추', '톡톡'), ('소금', '적당량')]",몸에 좋은 녹두와 닭으로 만든 녹두 닭백숙입니다. 녹두 듬뿍 넣어서 무지 고소해요. 오는 초복에는 녹두 닭백숙 만들어서 맛있게 드세요!,"[{'step_number': 1, 'description': '중간 크기 1kg인 닭 준비했어요.', 'image_url': 'https://recipe1.ezmember.co.kr/cache/recipe/2023/07/05/796aa23169a16d662d67d54b529dc02e1.jpg'}, {'step_number': 2, 'description': '닭의 날개 끝부분과 기름기를 잘라내고 흐르는 물에서 닭의 뱃속까지 깨끗이 씻어주세요.', 'image_url': 'https://recipe1.ezmember.co.kr/cache/recipe/2023/07/05/49d0bcce0be8354b479b1fa9d7a398721.jpg'}, {'step_number': 3, 'description': '찹쌀과 거피 녹두는 대여섯번 씻은 후 물에 한시간동안 담구어서 불려줍니다.', 'image_url': 'https://recipe1.ezmember.co.kr/cache/recipe/2023/07/05/b113248b3c21c7a208a81420d319cdbe1.jpg'}, {'step_number': 4, 'description': '닭의 뱃속에 불린 찹쌀을 3/2 정도로 채워주시고 마늘 2개도 넣어주세요. 닭의 양 다리 안쪽 껍질 부분에 구멍을 조금 뚫어서 다리를 지그재그로 넣어주세요.', 'image_url': 'https://recipe1.ezmember.co.kr/cache/recipe/2023/07/05/cfc412b10869422d6074fa091ee6d3a21.jpg'}, {'step_number': 5, 'description': '구멍은 이렇게 내시면 됩니다.', 'image_url': 'https://recipe1.ezmember.co.kr/cache/recipe/2023/07/05/525dc563f051d2d026dccbfe62c73ddf1.jpg'}, {'step_number': 6, 'description': '다시팩으로 되어있는 한약재 준비했어요. 오리백숙용에 같이 들어있던거예요.', 'image_url': 'https://recipe1.ezmember.co.kr/cache/recipe/2023/07/05/9a650b2a3df6e1d37d07e49e2a5b59681.jpg'}, {'step_number': 7, 'description': '대추는 흐르는 물에서 두손으로 비비면서 씻고 통마늘도 준비합니다.', 'image_url': 'https://recipe1.ezmember.co.kr/cache/recipe/2023/07/05/593a7f50003a7c9361a44edec56f7de71.jpg'}, {'step_number': 8, 'description': '넉넉히 큰 냄비에 닭, 불린 녹두, 대추, 마늘, 한약재 다시팩, 대파 넣고, 물 1.3L 넣어주세요.', 'image_url': 'https://recipe1.ezmember.co.kr/cache/recipe/2023/07/05/218428b5f82309e663d6e975488ba0211.jpg'}, {'step_number': 9, 'description': '센불에서 끓여줍니다.센불', 'image_url': 'https://recipe1.ezmember.co.kr/cache/recipe/2023/07/05/cbb2d748ef96aff2e25878c4e932c95f1.jpg'}, {'step_number': 10, 'description': '끓으면 중불로 줄이고 떠오르는 거품은 걷어내어줍니다.중불', 'image_url': 'https://recipe1.ezmember.co.kr/cache/recipe/2023/07/05/fa63d06914fb4da722dace7dcb8184881.jpg'}, {'step_number': 11, 'description': '1시간 20분 정도 끓였더니 잘 익었어요. 맛술 2큰술 넣고 소금으로 간을 맞추어주세요. 저는 소금 0.8큰술 넣으니까 간이 잘 맞더라구요.', 'image_url': 'https://recipe1.ezmember.co.kr/cache/recipe/2023/07/05/9c88bb9766bb184dfe59290ff34c27aa1.jpg'}, {'step_number': 12, 'description': '불 끄고 대파와 다시팩은 건져내고 후추 톡톡 뿌려줍니다.', 'image_url': 'https://recipe1.ezmember.co.kr/cache/recipe/2023/07/05/85e61a6c9702b5113caed40872bef2ce1.jpg'}, {'step_number': 13, 'description': '녹두 닭백숙 완성입니다.', 'image_url': 'https://recipe1.ezmember.co.kr/cache/recipe/2023/07/05/75e62477bc36a4f31625fa5973aac49f1.jpg'}, {'step_number': 14, 'description': '그릇에 담고 위에 영양부추무침을 올렸습니다. 영양부추 된장무침과 함께 드시면 정말 맛있답니다. 영양부추 된장무침 레시피 링크 첨부해드려요:  @7005418', 'image_url': 'https://recipe1.ezmember.co.kr/cache/recipe/2023/07/05/cb7f0635bfcef88540060c112d7bee0f1.jpg'}, {'step_number': 15, 'description': '목장갑 끼고 위생장갑을 덧 낀후 닭을 해체했어요. 오는 초복에는 복달임음식 맛있게 드시고 건강한 여름 나시기를 바랍니다.', 'image_url': 'https://recipe1.ezmember.co.kr/cache/recipe/2023/07/05/6e55076ac22f7305b7a0fc72d9aa24291.jpg'}]"
50673,국/탕,영양식,닭고기,끓이기,딱지와 함께하는 요리교실- 봄철 보양식 끝판왕 \'해신탕\',해신탕,https://recipe1.ezmember.co.kr/cache/recipe/2023/07/19/5a28a26df0c857939f14876fc6b2c5c01.jpg,"1,158",60분 이내,초급,2인분,"[('닭', '1마리'), ('삼계탕 한방재료', ''), ('찹쌀', '적당량'), ('데친 문어 다리', '1마리'), ('굵은소금', ''), ('전복', ''), ('부추', ''), ('표고버섯', ''), ('통마늘', ''), ('홍고추', '')]",오늘은 봄철에 먹기 좋은 음식 해신탕을 하면서 레시피를 가져왔습니다~ㅎㅎ 계절마다 적당한 보양식이 있다고 하더라고요! 봄철에는 해신탕!!!!,"[{'step_number': 1, 'description': '찹쌀은 미리 세척 후 30-1시간 정도 불려주시면 됩니다.스텐세척볼 , 요리스푼', 'image_url': 'https://recipe1.ezmember.co.kr/cache/recipe/2023/07/19/d65fe1d232a02d7dbc54a8c206a247231.jpg'}, {'step_number': 2, 'description': '닭도 손질을 좀 해야 하는데 지방을 잘라서 제거를 해주셔야 하는데요 목 주변, 밑부분 주변, 닭 배 옆부분에 지방을 제거해 주시면 됩니다!! 안쪽도 손을 집어넣어서 깨끗하게 세척해 주셔야 해요~~ 핏덩이가 있을 수 있으니까요!!!! 닭 목 쪽에 구멍은 파나 마늘로 막아주시면 됩니다~', 'image_url': None}, {'step_number': 3, 'description': '그 후 찹쌀을 이렇게 닭 속에 넣어주시면 됩니다. 그 후 허벅지 바깥쪽 한 부분을 칼로 흠집을 내주신 후 반대쪽 다리를 꽂아주시면 끝!유리믹싱볼', 'image_url': 'https://recipe1.ezmember.co.kr/cache/recipe/2023/07/19/03a9120de6c782c6b2fcf765ff1033a51.jpg'}, {'step_number': 4, 'description': '우선 1차로 닭을 압력밥솥에 넣고 푹 삶아 주시면 됩니다. 센 불로 삶아주시고 추가 빠르게 움직이면 중불로 8분 그 후 김빠질 때까지 기다려주시면 됩니다~ 20 ~ 30분 정도 걸리더라고요!! 그 시간 동안 남은 재료들을 준비해 주시면 됩니다~압력밥솥', 'image_url': 'https://recipe1.ezmember.co.kr/cache/recipe/2023/07/19/961d416e5904a3f2035a78985829a6321.gif'}, {'step_number': 5, 'description': '만약에 낙지를 이용하신다면 밀가루를 이용하여 깨끗하게 빨래 빨듯 세척해 주시고 물로 3-4번 다시 헹궈주시면 됩니다.', 'image_url': None}, {'step_number': 6, 'description': '전복은 국내산 완도 전복으로 3개를 구매했습니다. 안 쓰는 칫솔을 이용하여 열심히 닦아주었어요전복솔', 'image_url': 'https://recipe1.ezmember.co.kr/cache/recipe/2023/07/19/fdc0353074727d47143d4e77022e2b9b1.jpg'}, {'step_number': 7, 'description': '국내산 왕흰다리새우는 소금물에 우선 세척해 주시고 두 번째 마디를 이쑤시개를 이용하여 내장을 제거해 주시면 됩니다', 'image_url': 'https://recipe1.ezmember.co.kr/cache/recipe/2023/07/19/121a5d715937832d3b79542482f343ba1.jpg'}, {'step_number': 8, 'description': '새우도 까다롭고 머리 부분에 뿔(?) 때문에 좀 애를 먹었습니다', 'image_url': 'https://recipe1.ezmember.co.kr/cache/recipe/2023/07/19/d0d737c89ec6b00221c2dfea8f0248d81.jpg'}, {'step_number': 9, 'description': '김이 다 빠지면 닭은 따로 꺼내고 남은 해물들을 넣고 삶아주시면 됩니다!! 5분 정도면 익습니다!!!!', 'image_url': 'https://recipe1.ezmember.co.kr/cache/recipe/2023/07/19/3d7a5bbce59f24a635744c240565c9481.jpg'}, {'step_number': 10, 'description': '이쁘게 세팅해 주시고 식탁에 버너를 놓고 따뜻하게 먹어주면 끝!! 국물은 별도로 소금 간을 해주셔야 합니다!!!!', 'image_url': 'https://recipe1.ezmember.co.kr/cache/recipe/2023/07/19/711437b93aadc76479d7af39c01369a71.jpg'}, {'step_number': 11, 'description': '따로 소스는 없이 소금과 후추를 섞어서 찍어 먹었습니다 앗 참고로 저는 소금을 안 찍어 먹어서 ㅎㅎ', 'image_url': 'https://recipe1.ezmember.co.kr/cache/recipe/2023/07/19/a19f5bec4292da03033189435a4cef381.jpg'}]"
50674,국/탕,영양식,닭고기,끓이기,#닭요리 #복날요리 #삼계탕만들기 #삼계재료로간단하게만드는삼계탕 #복날에는삼계탕,삼계탕,https://recipe1.ezmember.co.kr/cache/recipe/2023/07/26/a08024c8cea6618da3b691f4fa9b22a71.jpg,840,60분 이내,아무나,1인분,"[('닭', '1마리'), ('삼계재료', '1팩'), ('찹쌀', '20g'), ('통후추', '2큰술'), ('마늘', '4개'), ('위스키', '2큰술'), ('코인육수', '1알'), ('썬파', '2큰술')]","참으로 복날도 많습니다. 초복, 중복, 말복,,,,, 뭔 복이 그리도 많은지.. 그건 아마도 땀을 많이 흘리면서 기력이 떨어지는 여름이라서 그런 듯 싶겠죠. ​ 기력이 떨어지면 생각나는 것이 가장 기본인 삼계탕입니다. 우와 삼계탕 집에서 끓인지 진정 오래되었습니다. ​ 통마늘도 없고,,있는 것이라고는 닭과 삼계재료뿐이네요. 다만,, 통후추와 편마늘은 있어서 그것으로 진득하게 우러낸 삼계탕을 만들었습니다. ​ 몸보신하시죠 ^^","[{'step_number': 1, 'description': '찹쌀을 물에 불려 줍니다. 그렇다고 씻은 후에 물에 불리는 것이 아니라 씻은 후에 체에 걸러서 물기가 마를때까지 물려 주는 것입니다.', 'image_url': 'https://recipe1.ezmember.co.kr/cache/recipe/2023/07/26/8dffa69c5b959a729a51872d0d4a12cc1.jpg'}, {'step_number': 2, 'description': '삼계재료입니다. 1인용이지요. 닭한마리에 들어가는 양입니다.', 'image_url': 'https://recipe1.ezmember.co.kr/cache/recipe/2023/07/26/857158cdeb9ee328b1d55ca5f73b0dce1.jpg'}, {'step_number': 3, 'description': '냄비에 통후추, 편마늘, 한알육수, 삼계재료를 넣어 줍니다.', 'image_url': 'https://recipe1.ezmember.co.kr/cache/recipe/2023/07/26/32b8db4c64350f429f6eb0ebb7d1a5c21.jpg'}, {'step_number': 4, 'description': '삼계탕용 닭한마리를 손질해 줍니다. 똥꼬 떼어내주고, 그 주위에 있는 기름도 제거하고 속 내장도 제거해 주고는 찬물에 속까지 깔끔하게 씻어 줍니다.', 'image_url': 'https://recipe1.ezmember.co.kr/cache/recipe/2023/07/26/85602198f75f8140e2f077981693c1fd1.jpg'}, {'step_number': 5, 'description': '그런 후에 불린 찹쌀을 닭 속에 넣어 주고는 다리를 모아서 무명실로 묶어 줍니다. 그리고 벌려진 다리사이는 이쑤시개를 이용해서 모아 줍니다. 냄비에 넣어 줍니다.', 'image_url': 'https://recipe1.ezmember.co.kr/cache/recipe/2023/07/26/115f874c923d6d82c75083dcbf0e9e991.jpg'}, {'step_number': 6, 'description': '위스키나 소주를 넣어 주고는 물을 넣고는 뚜껑을 닫고 팔팔 센불에서 40분 정도 끓여 줍니다. 그런 후, 중불로 옮겨서는 서서히 진한 국물이 나오도록 끓여 줍니다. 총 1시간 20분동안 끓여 주었습니다.', 'image_url': 'https://recipe1.ezmember.co.kr/cache/recipe/2023/07/26/6d7a8b6bab30b48acaeacfb41a58fa041.jpg'}, {'step_number': 7, 'description': '압력솥이라면 20분내에 할 수 있지만, 냄비라서 오랜 시간을 두고 푹 익혀 준 삼계탕입니다. 국물부터가 뽀얗색을 띠고 있습니다.', 'image_url': 'https://recipe1.ezmember.co.kr/cache/recipe/2023/07/26/b8e7b93bda3673fccde561ea9e3977ba1.jpg'}, {'step_number': 8, 'description': '완성그릇에 담아 주고 국물도 충분히 넣어 준 후 썬파를 소로록 뿌려 줍니다. 그럼 뜨거운 열기에 자연스럽게 파향이 나면서 익게 됩니다. 별다른 재료없이 끓여낸 여름 보양식인 삼계탕 완성입니다. 사실 삼계탕만한 것이 없고, 가장 서민적이기도 하지요. ^^', 'image_url': 'https://recipe1.ezmember.co.kr/cache/recipe/2023/07/26/b9fa9b02411c7124977cee5f9e39ba451.jpg'}]"
50675,국/탕,영양식,닭고기,끓이기,단호박 찜닭 만들기 닭볶음탕 닭도리탕 황금레시피 여름 보양식 말복음식,단호박찜닭,https://recipe1.ezmember.co.kr/cache/recipe/2023/08/08/292e5eb791f2c43b81961f4a24d05de51.jpg,"1,841",60분 이내,초급,4인분,"[('닭고기', '1kg'), ('당면', '120g'), ('밤호박', '250g'), ('감자', '220g'), ('양파', '250g'), ('당근', '210g'), ('대파', '100g'), ('홍고추', '1개'), ('대추', '30g'), ('다진마늘', '7큰술'), ('다진생강', '1큰술'), ('진간장', '10큰술'), ('굴소스', '1큰술'), ('매실청', '5큰술'), ('물엿', '3큰술'), ('참기름', '2큰술'), ('참깨', '2큰술'), ('카레가루', '1큰술'), ('후추', '톡톡'), ('맛술', '3큰술'), ('식초', '2큰술'), ('물', '250ml')]",요즘 한창 제철인 미니단호박과 감자 듬뿍 넣어서 찜닭 맛있게 만들었어요. 여름 보양식 말복음식으로 추천드려요.,"[{'step_number': 1, 'description': '찜닭 만들 재료 준비했어요.', 'image_url': 'https://recipe1.ezmember.co.kr/cache/recipe/2023/08/08/5be95f94e46784e015cc478b3154a07d1.jpg'}, {'step_number': 2, 'description': '당면은 한시간 정도 물에 담구어 불려줍니다. 불린 당면은 10센치 길이로 잘라주었어요.', 'image_url': 'https://recipe1.ezmember.co.kr/cache/recipe/2023/08/08/370ea1ac7197c464cfbe969bf392cb1d1.jpg'}, {'step_number': 3, 'description': '닭고기는 씻은 후 냄비에 닭고기가 잠기도록 물 넣고 센불에서 끓으면 불을 끕니다. 초벌삶기 한 닭은 흐르는 물에서 씻어서 준비합니다.냄비센불', 'image_url': 'https://recipe1.ezmember.co.kr/cache/recipe/2023/08/08/a900bae0d34a949de055d78c1ec8e2121.jpg'}, {'step_number': 4, 'description': '다진마늘 7큰술, 다진생강 1큰술, 진간장 10큰술, 굴소스 1큰술, 매실청 5큰술, 물엿 3큰술, 참기름 2큰술, 참깨 2큰술, 카레가루 1큰술, 후추 톡톡, 맛술 3큰술, 식초 2큰술 넣고 물 250ml도 넣은 후 잘 섞어서 양념소스 만들어주세요.', 'image_url': 'https://recipe1.ezmember.co.kr/cache/recipe/2023/08/08/f6a0419fcf7b1b57a09c99b3a5c1e1361.jpg'}, {'step_number': 5, 'description': '감자, 당근, 양파는 한입 크기로 썰고 호박은 큼직하게 썰었습니다. 대파, 홍고추는 송송 썰어주세요.', 'image_url': 'https://recipe1.ezmember.co.kr/cache/recipe/2023/08/08/ef6f0e5c53faf3a1f339ca9f2730e98c1.jpg'}, {'step_number': 6, 'description': '준비된 닭에 양념소스 넣고 뚜껑 닫아서 센불에서 끓여주세요.센불', 'image_url': 'https://recipe1.ezmember.co.kr/cache/recipe/2023/08/08/488c11aa3839f6b5ae874729b74eee401.jpg'}, {'step_number': 7, 'description': '끓으면 중불에서 15분간 더 끓여주어요.중불', 'image_url': 'https://recipe1.ezmember.co.kr/cache/recipe/2023/08/08/31aae27e3424d79d1f78864eb4ccf1e21.jpg'}, {'step_number': 8, 'description': '감자, 당근, 호박 넣고 10분간 끓이면 야채가 절반쯤 익을거예요.', 'image_url': 'https://recipe1.ezmember.co.kr/cache/recipe/2023/08/08/10ae1c35ac8e7dd4b79c9b1e05af14b71.jpg'}, {'step_number': 9, 'description': '양파 넣고 5분 더 끓입니다. 당근 찔러보니 잘 익었어요.', 'image_url': 'https://recipe1.ezmember.co.kr/cache/recipe/2023/08/08/acd05d23da4805bc9c95010fea2d28771.jpg'}, {'step_number': 10, 'description': '불린 당면 넣고 소스에 뒤적여주고 2분간 더 끓이면 당면이 잘 익는답니다.', 'image_url': 'https://recipe1.ezmember.co.kr/cache/recipe/2023/08/08/046880566fd82196654bbca38e94c78d1.jpg'}, {'step_number': 11, 'description': '대파, 홍고추 넣고 1분만 더 익히면 완성입니다.', 'image_url': 'https://recipe1.ezmember.co.kr/cache/recipe/2023/08/08/5ad99c4af90deab510e6d8071ca9449e1.jpg'}, {'step_number': 12, 'description': '양념이 쏙 배인 찰진 당면도 맛있고 단호박, 감자 건져먹는 맛도 좋고 쫄깃하고 부드러운 닭고기도 참 맛있네요. 오는 말복에는 단호박 찜닭 만들어서 맛있게 드세요.', 'image_url': 'https://recipe1.ezmember.co.kr/cache/recipe/2023/08/08/67050d30dd2aa58786f61d815989e5831.jpg'}]"
50676,국/탕,영양식,닭고기,끓이기,누룽지백숙 만들기 + 찹쌀누룽지 만드는법,누룽지백숙,https://recipe1.ezmember.co.kr/cache/recipe/2023/08/27/708a199d69e93cbb366b6ddbfbf9edd61.jpg,"2,940",90분 이내,중급,4인분,"[('닭', '1kg'), ('대추', '5개'), ('마늘', '10알'), ('양파', '1개'), ('대파', '2대'), ('삼계탕용 약재', '1봉'), ('소금', '1/2T'), ('물', '2.5L'), ('찹쌀', '1컵'), ('물', '0.8컵')]",이번에는 냄비에 삼계탕을 끓이고 제가 애정하는 스타우브 냄비에 찹쌀로 누룽지를 만들어 보았아요 찹쌀밥도 먹고 누룽지도 먹고 일석이조 누룽지 삼계탕 알려드릴게요,"[{'step_number': 1, 'description': '닭 1kg짜리 한 마리를 사용했어요 지방이 많은 꽁지 쪽과 목부분 껍질과 냄새나는 날개 끝부분은 잘라주시고', 'image_url': 'https://recipe1.ezmember.co.kr/cache/recipe/2023/08/27/eb435af4a7e65c48a24ade83eab539121.jpg'}, {'step_number': 2, 'description': '다리에서 안쪽으로 붙어있는 부분에도 지방이 많으니 잘 제거해 주시고 껍질을 안 드시는 분은 역시 벗겨주세요 저희는 좋아해서 껍질은 남겨두었어요 닭 뱃속에 손을 넣어 등 쪽의 내장과 이물질도 긁어내어 제거해 주세요 흐르는 찬물에 세척하여 주세요', 'image_url': 'https://recipe1.ezmember.co.kr/cache/recipe/2023/08/27/a4eba7d20213a1c2724c13fb807701ce1.jpg'}, {'step_number': 3, 'description': '재료를 모두 넣어주세요대추 5개, 마늘 10알, 작은 양파 1개, 삼계탕용 티백 1봉, 소금 1/2T', 'image_url': 'https://recipe1.ezmember.co.kr/cache/recipe/2023/08/27/ceda6c992feb31d46ef816bd66fbcee51.jpg'}, {'step_number': 4, 'description': '대파 1대 ,물 2.5L 넣고 뚜껑을 열고 15분가량 중강불로 끓여주세요 잡내가 날아가도록 뚜껑을 열고 끓여주세요', 'image_url': 'https://recipe1.ezmember.co.kr/cache/recipe/2023/08/27/a48345a28ab0785daa5353a980b87c691.jpg'}, {'step_number': 5, 'description': '15분 후 뚜껑을 닫고 중약불로 3-40분 삶아주세요', 'image_url': 'https://recipe1.ezmember.co.kr/cache/recipe/2023/08/27/5c3fa4b4e2d36a8767564850ffe8fd741.jpg'}, {'step_number': 6, 'description': '3~40분 후 불을 끄고 닭은 건져 낸 후 육수는 체에 걸러서 준비해 주세요', 'image_url': 'https://recipe1.ezmember.co.kr/cache/recipe/2023/08/27/b7eb8ac357e2101ce73f721f0cc4b7b81.jpg'}, {'step_number': 7, 'description': '스타우브 냄비에 찹쌀누룽지를 만들어 볼게요 스타우브 냄비에 찹쌀 1컵 물 0.8컵 을 넣고 중불로 끓여주세요찹쌀은 맵쌀보다 수분함량이 높기에 물양을 적게 잡아주세요', 'image_url': 'https://recipe1.ezmember.co.kr/cache/recipe/2023/08/27/9fbcb718ae5495fb6ecd5e150712e9e61.jpg'}, {'step_number': 8, 'description': '보글보글 끓으면 뚜껑 닫고 20분간 약불로 끓여주세요', 'image_url': 'https://recipe1.ezmember.co.kr/cache/recipe/2023/08/27/82d11deb10f5dfc805b31efc85cdb97c1.jpg'}, {'step_number': 9, 'description': '20분 후 윗부분의 찹쌀밥은 덜어내어 주세요', 'image_url': 'https://recipe1.ezmember.co.kr/cache/recipe/2023/08/27/aec1c2e1043356cc9e666560da8fbb321.jpg'}, {'step_number': 10, 'description': '바닥에 눌은 누룽지는 벽 부분 경계를 살살 주걱으로 긁어주면면 쉽게 분리가 되어요 바삭한 누룽지를 드시려면 이대로 꺼내어 삼계탕과 함께 드시면 되구요 저는 촉촉하게 먹으려고 조리를 약간만 더 해주었어요', 'image_url': 'https://recipe1.ezmember.co.kr/cache/recipe/2023/08/27/96e260b10f2d6e240c23074bf65e37a01.jpg'}, {'step_number': 11, 'description': '누룽지에 삼계탕 육수를 자작하게 부어주고 약불에 5~15분가량 끓여 내어 주세요너무 오래 끓이면 죽이 되니 적당히 끓여주세요', 'image_url': 'https://recipe1.ezmember.co.kr/cache/recipe/2023/08/27/46ac9dbd3a3d5a153f70e61f4b558faa1.jpg'}, {'step_number': 12, 'description': '접시에 잘 삶겨진 닭을 놓아주고 누룽지도 부어주세요 부추도 약간 올려보았어요', 'image_url': 'https://recipe1.ezmember.co.kr/cache/recipe/2023/08/27/b22321668761fc4d27b110b3f2dd5d761.jpg'}]"
50677,국/탕,영양식,닭고기,끓이기,전기밥솥요리 삼계탕,삼계탕,https://recipe1.ezmember.co.kr/cache/recipe/2019/05/16/6487adbd17e498873e55f597a8c064e71.jpg,"7,468",60분 이내,초급,2인분,"[('닭', '2마리'), ('인삼', '3뿌리'), ('대추', '5개'), ('통마늘', '5개'), ('찹쌀', '2큰술')]",몸이 허할때 가끔씩 해먹는 요리 입니다,"[{'step_number': 1, 'description': '찹쌀은 씻어서 물에 불려놓는다\n닭도 깨끗히 씻어서 준비한다\n통마늘도 꼭지를 따서 준비하고 \n대추는 씨를 발라서 준비한다\n삼도 깨끗히 씻어서 준비한다', 'image_url': 'https://recipe1.ezmember.co.kr/cache/recipe/2019/05/16/648a4b247c1cc03d6f4739f89b0ccf8d1.jpg'}, {'step_number': 2, 'description': '모든재료를 준비해서 닭배속에다가 찹쌀과 마늘을 넣고 \n다리를 맞붙여서 넣은다음\n물을 붓고 나머지 재료를 넣어서 \n전기밥솥으로 삼계탕 코너 로 눌러주면 끝', 'image_url': 'https://recipe1.ezmember.co.kr/cache/recipe/2019/05/16/a58f033130efb4056641104cd9060e9f1.jpg'}, {'step_number': 3, 'description': '다 만들은 닭을 전기밥솥에 넣고 물을 붓고 나머지 재료를 넣는다', 'image_url': 'https://recipe1.ezmember.co.kr/cache/recipe/2019/05/16/dc16f836461f8ac3367551fb6b72e2271.jpg'}, {'step_number': 4, 'description': '전기밥솥 삼계탕 코스로 누르면 끝', 'image_url': 'https://recipe1.ezmember.co.kr/cache/recipe/2019/05/16/a9de8a6c9fae79f53fe496412b03e8fd1.jpg'}, {'step_number': 5, 'description': '삼계탕 완성', 'image_url': 'https://recipe1.ezmember.co.kr/cache/recipe/2019/05/16/9aa0a5fa12b186cf1ffc6dbfe703f7a71.jpg'}]"
50678,국/탕,영양식,닭고기,끓이기,보양식으로 좋은 삼계탕,삼계탕,https://recipe1.ezmember.co.kr/cache/recipe/2019/06/01/2f2a550636cf3eea402087bbcec895721.jpg,"6,585",60분 이내,초급,2인분,"[('닭                                                                                900g', '1마리'), ('수삼', '2뿌리'), ('마늘', '1줌'), ('대추', '5개'), ('대파', '1뿌리'), ('양파', '1개')]","여름이 다가오니 보양식으로 좋은 수삼삼계탕으로 몸보신을 해야할것 같아
준비했어요.","[{'step_number': 1, 'description': '닭은 깨끗하게 손질해서 준비합니다', 'image_url': 'https://recipe1.ezmember.co.kr/cache/recipe/2019/06/01/20b6e68e39e18580dd5a1c914f54c7401.jpg'}, {'step_number': 2, 'description': '수삼은 겉에 묻은 흙이 남지 않도록 닦아주고\n대추, 마늘도 씻어 준비합니다.', 'image_url': 'https://recipe1.ezmember.co.kr/cache/recipe/2019/06/01/80dd98ad8192fcf0c25a1aca1e413bf31.jpg'}, {'step_number': 3, 'description': '압력솥에 닭을 넣고 닭이 반쯤 잠기도록 물을 붓고\n양파, 대파, 마늘, 대추를 넣고 10분을 끓여줍니다.', 'image_url': 'https://recipe1.ezmember.co.kr/cache/recipe/2019/06/01/88f2143a9b6b1952bc9a9ef83f279afa1.jpg'}, {'step_number': 4, 'description': '압력솥에서 10분 삶아주고 뚜껑을 열어\n기름을 제거하고 10분 더 끓여줍니다.', 'image_url': 'https://recipe1.ezmember.co.kr/cache/recipe/2019/06/01/0df42a1ecd57f71bfc42111ff6d511b41.jpg'}, {'step_number': 5, 'description': '인삼을 넣고 일반 냄비 뚜껑을 덮어서\n10분을 더 끓여줍니다.', 'image_url': 'https://recipe1.ezmember.co.kr/cache/recipe/2019/06/01/27b08b62eec984b826b890272c9dd0221.jpg'}, {'step_number': 6, 'description': '그럼 정말 쫄깃하면서 부드러운 삼계텅이 완성이 되는데 진한 육수 역시도 죽을 끓이게 되면 구수하게 드실 수 있답니다.', 'image_url': 'https://recipe1.ezmember.co.kr/cache/recipe/2019/06/01/565c1acee37dd6dadff3f6bbfc145d201.jpg'}]"
