index,종류별,상황별,재료별,방법별,글 제목,레시피이름,레시피이미지,조회수,조리시간,난이도,인분,재료,소개글,조리순서
65634,면/만두,손님접대,채소류,굽기,#폰타나 #볼로네제파스타소스 #치즈오븐파스타만들기 #토마토소스만으로도 맛있게 만들 수 있는 치즈오븐토마토파스타!!,치즈오븐파스타,https://recipe1.ezmember.co.kr/cache/recipe/2019/06/25/2d74d8085b48b5d069cb58663ae6453f1.jpg,"7,183",30분 이내,아무나,2인분,"[('냉동모둠 야채', '2컵'), ('다진 마늘', '1작은술'), ('스파게티소스', '1컵'), ('스파게티', '2인분'), ('소금', '1작은술'), ('3분 치즈', '2장'), ('갈은 고다 치즈', '1큰술'), ('파슬리가루', '1작은술')]","주말에 같이 밥을 먹으니까 날 잡아서는 파스타와 피자를 만들었습니다.

피자도우는 이태리식 도우를 쿠팡에서 주문했고요.

파스타는 단순하게 대신 치즈가 올라가져 있는

폰타나 볼로네제소스를 이용해서 치즈오븐파스타를 만들었습니다.

​

볼로네제파스타소스를 사용한 이유는 단순하게 만들기 위해서요.

해물도 안 들어가고 미트볼도 안 들어간 오로지 토마토소스의 맛으로 먹는 파스타이지요.

대신 볼로네제파스타 소스를 선택한 이유는 볶은고기가 들어가고 청키토마토의 신선함이 있어서 선택하게 된 것이지요.

그러니 추가로 다른 재료들을 넣을 필요는 없었지만 그래도 색을 위해서

냉동모둠채소를 넣어서 만들어 주었어요.","[{'step_number': 1, 'description': '올리브오일을 달궈진 팬에 둘러 주고 다진마늘과 냉동모둠채소를 넣어 줍니다. 그냥 초간단으로 하고자 합니다.', 'image_url': 'https://recipe1.ezmember.co.kr/cache/recipe/2019/06/25/355538953bbe353fe81168dc24963cb21.jpg'}, {'step_number': 2, 'description': '옆에서는 팔팔 끓은 물에 파스타를 삶고 있어요. 소금 당연히 넣어 주시고요. 파스타면은 그냥 무난한 스파게티면으로 선택했습니다. 굵은면을 잘 먹지 않더라구요. 지난번에 토장을 구입하면서 같이 산 폰타나 캄파니아 이탈리아 스파게티이지요. 면수를 버리시면 안됩니다. 면수도 소스에 넣어 줄 예정이니까요.', 'image_url': 'https://recipe1.ezmember.co.kr/cache/recipe/2019/06/25/bbfd63fe94ed80f9fa5cef369a5d244b1.jpg'}, {'step_number': 3, 'description': '볼로네제 파스타소스를 넣어 줍니다. 같이 볶아줍니다. 여기에 면수 1국자를 넣어 주세요.', 'image_url': 'https://recipe1.ezmember.co.kr/cache/recipe/2019/06/25/f992310bdff3f4526e31495f4bff58811.jpg'}, {'step_number': 4, 'description': '그리고 삶아낸 파스타를 넣어 줍니다. 파스타면은 좀 덜 삶으시는 것이 좋겠네요. 여기에서 한번 더 볶고 치즈를 올려서 오븐에 한번더 구울 예정이니 너무 삶아지면 나중엔 퍼진 면이 될 수 있으니까요.', 'image_url': 'https://recipe1.ezmember.co.kr/cache/recipe/2019/06/25/4dd9b2150327a927e459013afddcfb0a1.jpg'}, {'step_number': 5, 'description': '파스타면을 잘 섞어서 한번 확 끓여 준 후에 오븐그릇에 담아 줍니다. 그리고 3층치즈를 위에 올려 줍니다. 그냥 편하게 손으로 찢어서 넣어 주었어요.', 'image_url': 'https://recipe1.ezmember.co.kr/cache/recipe/2019/06/25/6018bc8b891bf8fc1017551a4a50a2f31.jpg'}, {'step_number': 6, 'description': '그리고 고다치즈를 위에 눈이 내리는 것처럼 뿌려 줍니다. 고다치즈는 고체형이라서 갈아서 넣어 주었습니다. 이 상태 그대로 180도 예열된 오븐에 넣고 구워 줍니다. 치즈만 녹으면 되니 오븐을 위쪽으로만 향하게 하고는 구워 주세요. 7분 정도면 충분할 듯 싶습니다.오븐', 'image_url': 'https://recipe1.ezmember.co.kr/cache/recipe/2019/06/25/1711e069917c2a37d6e56cb31f2345461.jpg'}, {'step_number': 7, 'description': '폰타나 볼로네제파스타소스로 간단하게 만든 파스타를 이용해서 치즈오븐파스타 후다닥 완성했습니다. 치즈가 제대로 지대로 익었습니다.', 'image_url': 'https://recipe1.ezmember.co.kr/cache/recipe/2019/06/25/4f49148c585827658d46c32244830d1f1.jpg'}]"
65635,면/만두,손님접대,채소류,굽기,단호박 밀전병 / 손님 초대요리,단호박밀전병,https://recipe1.ezmember.co.kr/cache/recipe/2017/08/22/490c3d2489d1474c5f74124d69daf7d51.jpg,"13,019",60분 이내,초급,2인분,"[('단호박 (소)', '1개'), ('소고기                                                                                잡채용', '100g'), ('사과', '1/2개'), ('파프리카 (빨간색)', '1/4개'), ('대파', '1토막'), ('무순', '1/3팩'), ('깻잎', '적당량'), ('식용유', '적당량'), ('간장', '1/3스푼'), ('설탕', '1/3스푼'), ('청주', '1스푼'), ('소금', '약간'), ('다진파', '1스푼'), ('다진 마늘', '1/3스푼'), ('다진 생강', '약간'), ('참기름', '약간'), ('후춧가루', '약간'), ('연겨자', '2/3스푼'), ('설탕', '1스푼'), ('일반 식초', '1스푼'), ('2배식초', '1스푼'), ('다진 마늘', '1/3스푼'), ('생수', '1스푼'), ('찐 단호박', '1개'), ('밀가루                                                                                수북이', '3큰술'), ('소금', '2꼬집'), ('달걀', '1개'), ('물', '8큰술')]",손님 초대요리로 좋은 밀전병은 상큼한 사과를 넣어 만들어 채소 고기의 씹히는 식감도 맛있는 단호박 밀전병을 소개합니다,"[{'step_number': 1, 'description': '단호박은 속을 파내고 6~8등분으로 잘라주어요 김이 오른 찜기에 8~10분간 쪄주세요 고기는 키친타월에 올려 핏물을 제거해주고, 사과,파프리카,무순, 대파 준비해요', 'image_url': 'https://recipe1.ezmember.co.kr/cache/recipe/2017/08/22/5778e3fa33aa88a9dce3b2cef604bd7c1.jpg'}, {'step_number': 2, 'description': '핏물제거된 고기는 밑간(양념) 다진 파 분량의 재료를 넣고 조물조물 재워주어요 분량의 겨자 소스는 미리 만들어 주면 좋아요겨자 소스의 겨자와 식초는 취향것 가감 하심돼요~', 'image_url': 'https://recipe1.ezmember.co.kr/cache/recipe/2017/08/22/4e061d741d23481dcdabcfa11225fd6d1.jpg'}, {'step_number': 3, 'description': '맛있게 찐 단호박은 겉껍질은 제거해 볼에 담아 스푼으로 으깨 주었어요 으깨는 도구를 사용해도 돼요단호박은 뜨거울때 으깨주어야 잘 으깨져요~', 'image_url': 'https://recipe1.ezmember.co.kr/cache/recipe/2017/08/22/3f3cb6f329f94a170ca3a231df8fa45c1.jpg'}, {'step_number': 4, 'description': '으깬 단호박에 밀가루3,달걀1,소금 두꼬집,물8큰 술 넣고 섞은 후 체에 부어 주걱이나 스푼을 사용해서 한 번 내려주어요 체에 내려주면 입자가 고와져요체로 내리면서 체의 아래부분을 살살 긁어 주면서 내려주면 쉽게 내릴 수 있어요', 'image_url': 'https://recipe1.ezmember.co.kr/cache/recipe/2017/08/22/e3f0609f33bc47d12e309cc51b722dcf1.jpg'}, {'step_number': 5, 'description': '부치기-약한불에 팬을 달군 후 기름을 조금만 두른 다음 키친 타월로 살짝만 닦아주고 반죽은 스푼으로 떠서 두세 번을 스푼을 돌리면서 원을 만들어 얇게 부칩니다작은 그릇에 기름약간을 넣고 키친타월을 접어 담가서 팬에 기름칠을 하면서 부치면 좋아요 반죽 넣을때는 달궈진 팬을 옆으로 옮긴 후 반죽을 올려 모양을 만들면 잘 됩니다', 'image_url': 'https://recipe1.ezmember.co.kr/cache/recipe/2017/08/22/c3f218f777073cb325c744e3cc8110b41.jpg'}, {'step_number': 6, 'description': '앞뒤로 살짝 익혀주어요', 'image_url': 'https://recipe1.ezmember.co.kr/cache/recipe/2017/08/22/b000af705fcf58d3c3ec88f23fe924db1.jpg'}, {'step_number': 7, 'description': '익힌 재료는 식혀주세요', 'image_url': 'https://recipe1.ezmember.co.kr/cache/recipe/2017/08/22/2b93fa874216245de1950d894fa372ec1.jpg'}, {'step_number': 8, 'description': '고기 볶기- 팬은 달군 후 밑간한 고기를 넣고 중불에서 소스가 없어지도록 달달 볶아줍니다센 불~중불', 'image_url': 'https://recipe1.ezmember.co.kr/cache/recipe/2017/08/22/bc5e694acc2dbe1a825c042f949ee3f41.jpg'}, {'step_number': 9, 'description': '두 재료 식히는동안 채소 손질하기-깻잎은 2~4등분 길이로 자르고 사과,파프리카 굵은 채 썰고, 무순 씻어 준비하고사과의 갈변방지 하는방법-볼에 사과와 물을 담고 설탕 1큰 술 넣어 주면 색이 변하는 (갈변)을 막을 수 있어요', 'image_url': 'https://recipe1.ezmember.co.kr/cache/recipe/2017/08/22/1401d4eea75a46153ea8916db539929f1.jpg'}, {'step_number': 10, 'description': '돌돌말기- 반죽 (예쁜쪽) 이 밖으로 가게 하고 고기와 채소를 올려 돌돌 말아줍니다', 'image_url': 'https://recipe1.ezmember.co.kr/cache/recipe/2017/08/22/5a76cf066b14c2a9d26aea2d9ce30c691.jpg'}, {'step_number': 11, 'description': '단단히 말아주었어요', 'image_url': 'https://recipe1.ezmember.co.kr/cache/recipe/2017/08/22/649e0a57165bcfcf4f59b4eecbe1ad311.jpg'}, {'step_number': 12, 'description': '모양있게 완성그릇에 담아 겨자 소스와 곁들여 냅니다~', 'image_url': 'https://recipe1.ezmember.co.kr/cache/recipe/2017/08/22/ddef85eafb4ded5620d81e77098362351.jpg'}]"
