index,종류별,상황별,재료별,방법별,글 제목,레시피이름,레시피이미지,조회수,조리시간,난이도,인분,재료,소개글,조리순서
37537,메인반찬,술안주,돼지고기,볶음,매운맛이 땡길때 찾는 매콤한 오돌뼈 만드는법 스트레스가 확 달아나는 맛있는 오돌뼈볶음레시피,오돌뼈볶음,https://recipe1.ezmember.co.kr/cache/recipe/2022/04/07/aa1abd8aed69cda8198bd2d0dfead2fe1.jpg,"4,671",30분 이내,초급,2인분,"[('돼지고기 오돌뼈', '350g'), ('맛술', '1소주컵'), ('물', '100ml'), ('일반 고춧가루', '1큰술'), ('매운 베트남 고춧가루', '3큰술'), ('설탕', '2큰술'), ('고추장', '0.5큰술'), ('굴소스', '2큰술'), ('치킨스톡', '1티스푼'), ('다진파', '약간'), ('다진마늘', '1~2큰술'), ('양파', '1/2개'), ('식용유', '2~3큰술')]","출산전, 매운요리를 너무 좋아하던 저인데 출산을 하고 나서 어느덧 맵찔이가 되어 매운맛을 즐기지 못했어요 
집에서 간단하게 오돌뼈볶음을 만들어 봤는데 제 입맛에 맞게 볶아내니 더욱 맛있더라구요 !","[{'step_number': 1, 'description': '사용한 돼지 오돌뼈가 크고 긴편이라 한입사이즈로 잘라주었어요', 'image_url': 'https://recipe1.ezmember.co.kr/cache/recipe/2022/04/07/585e79ad72b22efdb8a652b5f11df0511.jpg'}, {'step_number': 2, 'description': '오돌뼈는 잡내제거를 위해 맛술 소주컵 1잔과 물 100ml를 넣고 살짝 삶듯 익혀낸후 물로 한번 헹구어 불순물을 제거해주었어요물이 끓고 나면 1~2분안에 불을 꺼주세요', 'image_url': 'https://recipe1.ezmember.co.kr/cache/recipe/2022/04/07/5421885e8daf8febcff5afd1651e0ea71.jpg'}, {'step_number': 3, 'description': '살짝 데쳐낸 오돌뼈에 고춧가루 (매운 + 기본) 와 설탕을 넣어 조물조물 버무려줍니다', 'image_url': 'https://recipe1.ezmember.co.kr/cache/recipe/2022/04/07/4e8ce40b90b1d9ea4d3526ddbdc6083f1.jpg'}, {'step_number': 4, 'description': '양파는 체를 썰어 준비해주세요', 'image_url': 'https://recipe1.ezmember.co.kr/cache/recipe/2022/04/07/f0f2cf9aeef14c552c9439307a0e59541.jpg'}, {'step_number': 5, 'description': '후라이팬에 다진마늘과 다진파 그리고 식용유를 넣고 먼저 파기름, 마늘기름을 내어주세요', 'image_url': 'https://recipe1.ezmember.co.kr/cache/recipe/2022/04/07/915e8ea5d0d07a575af87563f783ae4d1.jpg'}, {'step_number': 6, 'description': '미리 고춧가루 양념을 해둔 오돌뼈를 넣어 5분가량 볶아줍니다중간불고춧가루를 볶아내는거이기 때문에 매운냄새가 계속올라와요 ~ 환풍기 틀고하세요 !', 'image_url': 'https://recipe1.ezmember.co.kr/cache/recipe/2022/04/07/d9ae1b3ef32c350ac2e116cb1d3c9d741.jpg'}, {'step_number': 7, 'description': '5분이 지난후 양파를 넣고 치킨스톡을 넣어주었어요', 'image_url': 'https://recipe1.ezmember.co.kr/cache/recipe/2022/04/07/aa965064589a3e3273c6c733db11130a1.jpg'}, {'step_number': 8, 'description': '그리고 맛술 , 고추장, 굴소스를 넣고 3분가량 볶아줍니다만약, 싱겁다면 간은 굴소스로 맞추세요 ~', 'image_url': 'https://recipe1.ezmember.co.kr/cache/recipe/2022/04/07/312750ee8c8bb7fcae9fbc34a6d8ca151.jpg'}, {'step_number': 9, 'description': '윤기가 자르르르 한 오돌뼈에 통깨 또는 참기름을 첨가해주셔도 좋아요 ~ \n그릇에 담아 맛있게 즐기세요 !', 'image_url': 'https://recipe1.ezmember.co.kr/cache/recipe/2022/04/07/353abcea4339718de2f950083c454fb71.jpg'}]"
37538,메인반찬,술안주,돼지고기,볶음,집에서 술안주 쌈장범벅 항정살 레시피 하나로 해결,쌈장항정살,https://recipe1.ezmember.co.kr/cache/recipe/2023/03/23/204e7802fe600ffce4adf18e7f4ec01d1.jpg,482,20분 이내,아무나,3인분,"[('항정살', '600g'), ('파프리카', '1/2개'), ('양배추', '1주먹'), ('청양고추', '2개'), ('애호박', '1/4개'), ('당근', '조금'), ('양파', '1/2개'), ('새송이버섯', '1개'), ('마늘', '1주먹'), ('쌈장', '3숟가락'), ('미림', '10숟가락'), ('설탕', '1숟가락'), ('미원', '1/3숟가락')]",든든하게 먹을 수 있는 술안주,"[{'step_number': 1, 'description': '고기 덩어리째 갖고 온 분들이라면 먹기 좋은 사이즈로 잘라주세요', 'image_url': 'https://recipe1.ezmember.co.kr/cache/recipe/2023/03/23/1dc038ef8f8693a5c5a49256c8dda8631.jpg'}, {'step_number': 2, 'description': '재료는 깍뚝썰기로 준비해주세요', 'image_url': 'https://recipe1.ezmember.co.kr/cache/recipe/2023/03/23/909fa68f6c7ff1dc5f439402cde059671.jpg'}, {'step_number': 3, 'description': '마늘은 통마늘 추천드립니다', 'image_url': 'https://recipe1.ezmember.co.kr/cache/recipe/2023/03/23/299fa99b5bba5ce1065dcf63f1af40f01.jpg'}, {'step_number': 4, 'description': '팬에 기름 두르지 않고 고기를 올려서 중불에서 구워주세요', 'image_url': 'https://recipe1.ezmember.co.kr/cache/recipe/2023/03/23/66fc213552f3e0538328718f4755d0d11.jpg'}, {'step_number': 5, 'description': '양념재료 다 넣어서 섞어주세요', 'image_url': 'https://recipe1.ezmember.co.kr/cache/recipe/2023/03/23/64c06c74a7d5b74aa5b7dac85beb6a1f1.jpg'}, {'step_number': 6, 'description': '다 구어진 항정살은 따로 빼주시고 남은 기름에 채소 넣고 볶아주세요 기름이 너무 많다면 키친타월로 조금 닦아내주세요', 'image_url': 'https://recipe1.ezmember.co.kr/cache/recipe/2023/03/23/ed969ace520c2904a2c44cd51d9bc66d1.jpg'}, {'step_number': 7, 'description': '채소가 반이상 익었을 때 구워놨던 고기 넣고 양념 다 넣어주세요 그리고 달달 볶아주세요', 'image_url': 'https://recipe1.ezmember.co.kr/cache/recipe/2023/03/23/2d4c99bff3f14bded71187762b4428d01.jpg'}]"
37539,메인반찬,술안주,돼지고기,볶음,"마라등갈비볶음 레시피, 뜯어야 제맛! 화끈한 등갈비!",마라등갈비볶음,https://recipe1.ezmember.co.kr/cache/recipe/2022/09/29/3a902dab3d1584a9fbd7edd5d382c8161.jpg,843,30분 이내,중급,2인분,"[('돼지등갈비', '600g'), ('마라소스', '90g'), ('베트남고추', '20개'), ('다진마늘', '30g'), ('청피망', '30g'), ('홍피망', '50g'), ('양파', '50g'), ('월계수잎', ''), ('쪽파', ''), ('참깨', '약간')]","술 한 잔에 맛있고 매콤한 안주가
먹고 싶을 때도 제격인 마라등갈비볶음 레시피!","[{'step_number': 1, 'description': '등갈비는 앞쪽에 붙은 기름기와\n뒷쪽 근막을 제거해주세요.\n근막을 벗기지 않으면 고기가\n질겨질 수 있으니 제거해주시는 것이 좋아요^^한 쪽 끝에 칼집을 낸 후\n손으로 잡아 쭈~욱 벗겨내주시면\n어렵지 않게 손질 하실 수 있답니다~!', 'image_url': 'https://recipe1.ezmember.co.kr/cache/recipe/2022/09/29/d232a4f119ec8aa3b1a76232ea27cb331.jpg'}, {'step_number': 2, 'description': '뼈 사이를 발라줍니다.\n자르지 않고 통으로 핏물을 뺄 수도 있지만, 미리 잘라주면 핏물 빼는 시간이 단축 된답니다^^핏물은 30분 정도만 빼주세요.', 'image_url': 'https://recipe1.ezmember.co.kr/cache/recipe/2022/09/29/6327137fe50d2f66e72ff2beb743f9411.jpg'}, {'step_number': 3, 'description': '냄비에 찬물, 월계수잎, 통후추,\n깐마늘, 대파 등을 함께 넣어줍니다.\n물이 조금 끓어오르면 등갈비를 넣고,\n3~40분 정도 푸욱 삶아주세요.중간중간 올라오는\n거품은 건져내주세요~!', 'image_url': 'https://recipe1.ezmember.co.kr/cache/recipe/2022/09/29/a5e2be4b14340bef786ac1b8cf8367d71.jpg'}, {'step_number': 4, 'description': '함께 볶아 줄 야채들을 준비해줍니다.\n양파는 잘게 다지고\n홍피망 청피망은 심지를 잘라내고\n잘게 다져주세요.', 'image_url': 'https://recipe1.ezmember.co.kr/cache/recipe/2022/09/29/2ecb244d945f4cce0564b11929be854e1.jpg'}, {'step_number': 5, 'description': '팬에 기름을 두르고 재료를 넣고 볶아줍니다.\n마늘, 양파, 홍피망, 청피망,\n마지막으로 베트남 고추를 넣고 볶아주세요~!', 'image_url': 'https://recipe1.ezmember.co.kr/cache/recipe/2022/09/29/d438f1afc6bfae7570b7cf4bd302a13a1.jpg'}, {'step_number': 6, 'description': '야채가 어느정도 볶아지면\n등갈비를 넣어줍니다.', 'image_url': 'https://recipe1.ezmember.co.kr/cache/recipe/2022/09/29/ed5a603621d1622279983b83a1e485c11.jpg'}, {'step_number': 7, 'description': '하오츠 마라소스를 듬뿍 넣고\n양념이 골고루 배이도록\n잘 저어가며 익혀주면 완성입니다.', 'image_url': 'https://recipe1.ezmember.co.kr/cache/recipe/2022/09/29/1f681a95bfb132673428e9299b426dfb1.jpg'}, {'step_number': 8, 'description': '보기에 좋은 것이 먹기도 좋다고~\n화려한 중국접시에 담고\n야채를 듬뿍 올려주세요.통깨도 살짝 뿌려주세요.', 'image_url': 'https://recipe1.ezmember.co.kr/cache/recipe/2022/09/29/67c2e1c424589db5c7d4b507c357991f1.jpg'}, {'step_number': 9, 'description': '마라향이 입안 가득 퍼지는\n마라등갈비볶음이 완성~!', 'image_url': 'https://recipe1.ezmember.co.kr/cache/recipe/2022/09/29/bf555d59deb94d6179e305fe0940e4b21.jpg'}]"
37540,메인반찬,술안주,돼지고기,볶음,단짠의 매력! 돼지 등갈비 조림 구이 만들기,돼지등갈비조림,https://recipe1.ezmember.co.kr/cache/recipe/2023/04/25/77bfcf185886eea2c9bc7044419c9f631.jpg,932,60분 이내,아무나,2인분,"[('등갈비', '1.5kg'), ('맥주                                                                                또는 콜라', '500ml'), ('베트남 고추', '4개'), ('물', '400ml'), ('간장', '6T'), ('굴소스', '2T'), ('맛술', '3T'), ('매실청', '1T'), ('오렌지마멀레이드                                                                                또는 유자청', '3T'), ('간마늘', '1T'), ('생강가루', '조금'), ('대파 흰부분', '1/2대')]",돼지는 참 다양한 부위로 맛있게 요리에 활용할 수 있어서 자주 찾지요. 그 중에서도 뼈에 붙은 살코기를 즐기기 좋은 진한 육즙의 부드러운 등갈비 ! 보통 맵싹 칼칼하게 밥도둑으로다가 김치찜으로 자주 해먹었는데요. 오늘은 이색적인 느낌으로 특별하게 단짠으로 솜씨를 내어봤어요. 돼지등갈비조림만들기 레시피 소개해 드립니다. 쉽고 간단해요.,"[{'step_number': 1, 'description': '등갈비는 통으로 구매시 안쪽 근막을 벗겨주시면 더욱 부드럽게 즐길 수 있습니다. 전 편리하고 간단하게 개별로 잘려있는 제품으로 샀지요. 찬물에 한 30분 담구어 핏물을 뺐습니다. 고명으로 쓸 대파도 잘게 다져주었습니다.', 'image_url': 'https://recipe1.ezmember.co.kr/cache/recipe/2023/04/25/399f39f086269c7f198a0d70e9a234ea1.jpg'}, {'step_number': 2, 'description': '고기에 자작하게 콜라나 맥주를 부어 한 7~8분간 바글바글 끓여주세요.잡내 제거 및 부드러워지는 과정입니다.', 'image_url': 'https://recipe1.ezmember.co.kr/cache/recipe/2023/04/25/a150d172e1991cc3cfb8c030dcd199d61.jpg'}, {'step_number': 3, 'description': '후다닥 양념 계량을 해서 대기했어요~물400ml, 간장 6T, 굴소스 2T, 맛술 3T, 매실청 1T, 오렌지마멀레이드or유자청 3T, 간마늘 1T, 생강가루 조금', 'image_url': 'https://recipe1.ezmember.co.kr/cache/recipe/2023/04/25/8a226e284a0e5f6609617558949097631.jpg'}, {'step_number': 4, 'description': '초벌을 한 등갈비는 찬물에 구석구석 깨끗히 씻어주구요.', 'image_url': 'https://recipe1.ezmember.co.kr/cache/recipe/2023/04/25/e64c09efd2f080a88909d1764d8429e61.jpg'}, {'step_number': 5, 'description': '개인취향으로다가 약간 매운풍미를 주고자 베트남고추를 부숴서 기름에 볶았습니다. 얼큰한 향미가 올라오면~ 고기를 투하~', 'image_url': 'https://recipe1.ezmember.co.kr/cache/recipe/2023/04/25/9dc42356c43c3ffef48e1e9f5d4e9b631.jpg'}, {'step_number': 6, 'description': '양념을 웍 테두리에다 둘러주어 바글바글 끓여줘요. 양념이 자작해질때까지 잘 저어가며 양념이 잘 베이도록 도와줍니다. 전 어느정도 졸인 뒤 살짝 겉에 바삭하게 해주려고 에프에 앞 뒷면 3분씩 170도로 돌려주어 완성했어요.촉촉하게 드시려면 더 볶아서 익혀주시면 됩니다. 너무 졸면 짜질 수 있으니 물을 조금씩 가감하며 조절해주세요.', 'image_url': 'https://recipe1.ezmember.co.kr/cache/recipe/2023/04/25/2ca8babf7ba6d7df89424b19fa602d9b1.jpg'}, {'step_number': 7, 'description': '저는 한입 먹어보고 당장 대파고명 추가했잖아유~ 향긋한 파고명과 갈비맛이 환상의 궁합입니다. 맥주안주로다가 아주 딱!!!', 'image_url': 'https://recipe1.ezmember.co.kr/cache/recipe/2023/04/25/15b040105cfd3e9cb7fbf0501c6d3a891.jpg'}]"
37541,메인반찬,술안주,돼지고기,볶음,"백종원 돼지고기 요리, 꽈리고추 삼겹살볶음!",꽈리고추삼겹살볶음,https://recipe1.ezmember.co.kr/cache/recipe/2023/01/08/23fec2fb8a2c614920ef849acf7cd41b1.jpg,"4,017",20분 이내,중급,2인분,"[('꽈리고추', '150g'), ('삼겹살', '600g'), ('대파', '30g'), ('청양고추', '30g'), ('간마늘', '30g'), ('황설탕', '30g'), ('진간장', '60ml')]","돼지고기요리 는 언제 먹어도 맛있지만 한 번씩 느끼할 때가 있죠
그런 느끼함을 잡아줄 꽈리고추를 곁들인 꽈리고추삼겹살 볶음입니다
백종원님의 레시피이구요

재료도 많지 않고 과정도 간단한 삼겹살볶음입니다","[{'step_number': 1, 'description': '꽈리고추는 2cm 손가락 한마디정도로 자르고 청양고추는 얇게 썰어주세요\n청양고추가 씹히는게 싫다 하시면 다져도 됩니다꽈리고추는 살짝 매콤하고 아삭아삭 씹는 맛\n청양고추가 매운 맛을 담당하기 때문에 매운 맛은 청양고추로 조절해주세요\n청양고추는 없어도 됩니다', 'image_url': 'https://recipe1.ezmember.co.kr/cache/recipe/2023/01/08/6e064854995719fdd33e454629ab5e891.jpg'}, {'step_number': 2, 'description': '간마늘이 나와있어서 간마늘을 사용했는데 통마늘을 굵게 다져서 쓰는게 더 좋다고 하네요\n그리고 대파도 얇게 채썰어서 준비해주세요', 'image_url': 'https://recipe1.ezmember.co.kr/cache/recipe/2023/01/08/4bce236f1c31860ad752fe1d03b19dd21.jpg'}, {'step_number': 3, 'description': '삼겹살은 한 입에 들어갈 크기로 잘라서 전체적으로 노릇노릇하게 구워주세요웍돼지고기 요리인만큼 삼겹살 대신 전지나 목살 등 다양한 부위를 사용하시면 됩니다', 'image_url': 'https://recipe1.ezmember.co.kr/cache/recipe/2023/01/08/08ca728316f0933fef83053ca5b361d31.jpg'}, {'step_number': 4, 'description': '삼겹살이 노릇노릇 익어서 먹어도 될 것 같을 때 자른 대파와 설탕을 넣어 볶아줍니다\n웍질을 하면서 향을 입혀주면 더 맛있습니다', 'image_url': 'https://recipe1.ezmember.co.kr/cache/recipe/2023/01/08/2d5a15082db67319a6884b6f6ef6519f1.jpg'}, {'step_number': 5, 'description': '다진마늘 넣고 살짝 튀기듯이 구워준 다음\n한 쪽으로 고기 몰아서 기름 모아주고 간장을 넣어 튀기듯이 볶아주세요', 'image_url': 'https://recipe1.ezmember.co.kr/cache/recipe/2023/01/08/de9074285089521a8d2cadd6be6ce7011.jpg'}, {'step_number': 6, 'description': '꽈리고추와 청양을 넣고 볶으면 꽈리고추 삼겹살볶음 완성!꽈리고추가 숨 죽을 때까지 익히면 안되고 꽈리고추가 아삭하게 씹힐 때 끝내셔야 성공!', 'image_url': 'https://recipe1.ezmember.co.kr/cache/recipe/2023/01/08/637176f7f889292e3a5f4a86a5ced70a1.jpg'}]"
37542,메인반찬,술안주,돼지고기,볶음,돼지 간 고추 볶음 돼지 간 요리,돼지간고추볶음,https://recipe1.ezmember.co.kr/cache/recipe/2023/02/02/d7f195d91752ac5fb41c417f8c27008a1.jpg,"1,652",15분 이내,아무나,4인분,"[('돼지 간', '1개'), ('청양고추', '4개'), ('마늘', '4쪽'), ('소금', '1/2스푼'), ('간장', '1스푼')]","분식집에서 먹는 삶은 돼지 간 맛이 푸석푸석해서 덜 푸석하게 볶음으로 먹으면 맛있어요.설음식으로 좋고 술안주,손님대접으로도 좋은 돼지 간 볶음이에요.","[{'step_number': 1, 'description': '남자 주먹만한 간을 먼저 얇게 썰고 다시 절반으로 썰었어요.', 'image_url': 'https://recipe1.ezmember.co.kr/cache/recipe/2023/02/02/d660c747e578611286eeb4161b61ee3b1.jpg'}, {'step_number': 2, 'description': '청양고추와 마늘은 사진처럼 썰고', 'image_url': 'https://recipe1.ezmember.co.kr/cache/recipe/2023/02/02/09b682e714f8b3fbefd49786bb392bc91.jpg'}, {'step_number': 3, 'description': '기름이 달아 올라면 마늘을 넣어서 달달달 볶아요.', 'image_url': 'https://recipe1.ezmember.co.kr/cache/recipe/2023/02/02/f2ba627181a3d92dc73eefa4d69e48e31.jpg'}, {'step_number': 4, 'description': '그리고 돼지간을 넣고 볶으면 됩니다.', 'image_url': 'https://recipe1.ezmember.co.kr/cache/recipe/2023/02/02/839b26eb5c12f86c76ce7a71066b182c1.jpg'}, {'step_number': 5, 'description': '돼지 간 바로 청양고추를 넣어도 되고요.\n볶다가 넣어도 됩니다.', 'image_url': 'https://recipe1.ezmember.co.kr/cache/recipe/2023/02/02/9d84114186484e6b86137fdba4f3b1341.jpg'}, {'step_number': 6, 'description': '간 맞추려고 소금을 반스푼 넣었어요.', 'image_url': 'https://recipe1.ezmember.co.kr/cache/recipe/2023/02/02/39dd25097fc03add71871a5dc5d303ba1.jpg'}, {'step_number': 7, 'description': '간장은 한스푼 넣어서 다시 달달달 볶아서 간이 베이면 불을 끄면 됩니다.', 'image_url': 'https://recipe1.ezmember.co.kr/cache/recipe/2023/02/02/f96d116225ed7006d766c56258fcc9781.jpg'}, {'step_number': 8, 'description': '그릇에 옮겨서 완성했어요.', 'image_url': 'https://recipe1.ezmember.co.kr/cache/recipe/2023/02/02/b4e98fcc46004cd83d380306e114063b1.jpg'}]"
37543,메인반찬,술안주,돼지고기,볶음,# 김치요리 #돼지고기요리 #돼지고기김치볶음만들기 #남은고기활용요리 #목살김치볶음,돼지고기김치볶음,https://recipe1.ezmember.co.kr/cache/recipe/2022/09/23/a94609ac59f9d713e412a2d7c039ed6d1.jpg,"2,280",30분 이내,아무나,2인분,"[('돼지고기목살', '2덩어리'), ('김치', '5큰술'), ('설탕', '1큰술'), ('참기름', '1작은술'), ('두부', '1모'), ('통깨', '1작은술'), ('쪽파', '1개')]","#두부요리 # 김치요리 #돼지고기요리 #돼지고기김치볶음만들기

#남은고기활용요리 #목살김치볶음 #두부김치 #막걸리안주

#목살김치볶음과두부 #초간단김치볶음

​

​

삼겹살과 목살을 구워 먹고 두점이 남았습니다.

이 두점으로 뭘할까 고민하다가

구워 먹기에도 애매하지요.

​

그래서 김치는 있으니 김치랑 고기랑 섞어서 돼지고기김치볶음을 하고

거기에 두부를 곁들였습니다. 돼지고기김치볶음과 두부입니다.

두부김치이겠죠. 초간단하게 만들었습니다.","[{'step_number': 1, 'description': '가장 먼저 목살부터 구워 줍니다. 기름은 필요없습니다.', 'image_url': 'https://recipe1.ezmember.co.kr/cache/recipe/2022/09/23/db066d8525fa497719402955abdd0b0d1.jpg'}, {'step_number': 2, 'description': '앞뒤로 잘 구운 후에 잘라 줍니다.', 'image_url': 'https://recipe1.ezmember.co.kr/cache/recipe/2022/09/23/28579653569812c4f1c5bee1d1e9c1b61.jpg'}, {'step_number': 3, 'description': '구워진 목살에 김치를 넣어 줍니다. 맛김치이라서 굳이 썰을 필요는 없었습니다. 김칫국물도 같이 넣어 줍니다. 달달 볶아 줍니다.', 'image_url': 'https://recipe1.ezmember.co.kr/cache/recipe/2022/09/23/aa220003f8a982d73e4792ac309513d51.jpg'}, {'step_number': 4, 'description': '설탕을 넣어 줍니다. 설탕이 싫으시면 매실액도 좋고요. 신맛과 느끼한 맛을 잡아 주는 것이 설탕이나 매실액입니다. 후추도 조금 뿌려 줍니다. 참기름은 가장 마지막에 둘러 줍니다. 참기름 두르고 불을 끈 후에 섞어 주세요. 잔열로 볶아 줍니다.', 'image_url': 'https://recipe1.ezmember.co.kr/cache/recipe/2022/09/23/ea3712a6d9b285a6a8ce7efce05c04cc1.jpg'}, {'step_number': 5, 'description': '두부를 썰어서는 한번 전자렌지에 데워 줍니다.전자레인지', 'image_url': 'https://recipe1.ezmember.co.kr/cache/recipe/2022/09/23/648b0a506162b429357ce2f1c08ab2c91.jpg'}, {'step_number': 6, 'description': '그리고 볶아낸 돼지고기김치볶음을 올려 줍니다. 쪽파 썬것을 올려 주고 볶음깨와 참기름을 둘러 줍니다. 막걸리안주로도 좋고 반찬으로도 좋은 초간단 남은고기를 활용해서 만든 돼지고기두부김치입니다. 완성이지요.', 'image_url': 'https://recipe1.ezmember.co.kr/cache/recipe/2022/09/23/b7d3dcf40e2ca13f1f7dfa5ae6eef7b01.jpg'}]"
37544,메인반찬,술안주,돼지고기,볶음,이자카야요리 <삼겹살숙주볶음> 대패삼겹살과 숙주의 콜라보!,삼겹살숙주볶음,https://recipe1.ezmember.co.kr/cache/recipe/2020/01/09/b838389a077385ee65e657f046f8d7aa1.jpg,"18,541",30분 이내,중급,3인분,"[('대패삼겹살', '300g'), ('숙주', '150g'), ('양파', '1/2개'), ('대파', '1/2대'), ('부추', '1줌'), ('양배추채', '1줌'), ('다진마늘', '1큰술'), ('청고추', '2개'), ('홍고추', '1개'), ('간장', '1큰술'), ('굴소스', '3큰술'), ('맛술', '1큰술'), ('올리고당', '1큰술'), ('소금', '1작은술'), ('후추', '1작은술')]","집에서도 즐기는 이자카야메뉴 삼겹살숙주볶음입니다. 아삭아삭 숙주가 살아있는 삼겹살숙주볶음을 만들어볼텐데요, 대패삼겹살로 만드는게 빨리 익고 야채의 맛을 더 살릴 수 있어서 좋습니다. 먹다 남은 저장중인 삼겹살이 있다면 활용하기에 아주 좋겠죠. 삼겹살은 먹고 싶은데 기름기가 너무 부담된다! 이럴 때 삼겹살숙주볶음으로 만들어 보세요. 숙주와 다른 채소들의 조합이 느끼함을 많이 덜어 주어서 삼겹살은 아주 훌륭한 요리로 탄생합니다~","[{'step_number': 1, 'description': '대패삼겹살과 숙주를 준비해 주세요', 'image_url': 'https://recipe1.ezmember.co.kr/cache/recipe/2020/01/09/b07a8666c3e03badd228be0d68f908d81.jpg'}, {'step_number': 2, 'description': '삼겹살 숙주볶음의 채소\n숙주 깨끗이 다듬기\n양파 채썰기\n부추, 양배추 먹기 좋은 크기\n대파,고추 어슷썰기\n마늘 다지기', 'image_url': 'https://recipe1.ezmember.co.kr/cache/recipe/2020/01/09/b9a363cea0dc889c78aa34e923e249251.jpg'}, {'step_number': 3, 'description': '팬이 달궈지면 삼겹살, 다진마늘, 소금, 후추를 넣어서 볶아 주세요.', 'image_url': 'https://recipe1.ezmember.co.kr/cache/recipe/2020/01/09/ee65d44fdf02e91d10a1cf26331e5a711.jpg'}, {'step_number': 4, 'description': '삼겹살이 살짝 볶아지면 숙주를 넣어서 볶아 주세요.', 'image_url': 'https://recipe1.ezmember.co.kr/cache/recipe/2020/01/09/870d7a16ae2cc8f86d7c56d363874d2f1.jpg'}, {'step_number': 5, 'description': '삼겹살, 숙주를 볶다가 양파, 양배추, 부추를 넣고 양념을 넣어서 볶아 주세요.\n[양념]간장1큰술, 굴소스3큰술, 맛술1큰술, 올리고당1큰술', 'image_url': 'https://recipe1.ezmember.co.kr/cache/recipe/2020/01/09/7481e66fee89bd11b897b21bee19c21b1.jpg'}, {'step_number': 6, 'description': '양념을 넣어 잘 섞어지면 청고추, 홍고추, 대파를 넣어 볶아 주세요.', 'image_url': 'https://recipe1.ezmember.co.kr/cache/recipe/2020/01/09/2c1999db162a4b2056ba8db091eab15a1.jpg'}, {'step_number': 7, 'description': '삽겹살 숙주볶음에 야채 숨이 죽으면 불을 꺼 주세요.', 'image_url': 'https://recipe1.ezmember.co.kr/cache/recipe/2020/01/09/410df70f1fd0b4e40776e71b6ffb9edd1.jpg'}, {'step_number': 8, 'description': '삼삼한 맛의 삼겹살숙주볶음이 완성되었습니다. 매콤한 맛으로 즐기기 보다는 이 자체로 먹는 것이 훨씬 더 맛이 좋아요. 빨간요리로 만들면 자칫 제육볶음이 될 수 있거든요^^;', 'image_url': 'https://recipe1.ezmember.co.kr/cache/recipe/2020/01/09/737ec8c9864ed106af92d223519ae2901.jpg'}]"
