index,종류별,상황별,재료별,방법별,글 제목,레시피이름,레시피이미지,조회수,조리시간,난이도,인분,재료,소개글,조리순서
42457,메인반찬,영양식,해물류,무침,새우낙지해물겨자채,새우낙지해물겨자채,https://recipe1.ezmember.co.kr/cache/recipe/2016/06/14/e16d2f145e38d0173eb19654712a7c3e1.jpg,"7,705",15분 이내,초급,5인분,"[('중하', '15마리'), ('낙지', '2마리'), ('오이', '1개'), ('당근', '1/2개'), ('붉은파프리카', '1개'), ('피망', '1개'), ('쪽파', '3뿌리'), ('설탕', '2아빠숟가락'), ('식초', '2아빠숟가락'), ('연겨자', '1아빠숟가락'), ('갈은마늘', '1아빠숟가락'), ('마성의맛간장', '1스푼'), ('소금', '1t'), ('깨소금', '1t')]",입맛이없는 여름철에 간단하게 입맛돋구는 새우 낙지겨자채를 해봤네요,"[{'step_number': 1, 'description': '새우는 끓는물에 소금 와인or맛술 삶아 식혀 꼬리만 남기고 껍질을벗겨놓는다 낙지도 새우삶은 물에 데쳐놓는다', 'image_url': 'https://recipe1.ezmember.co.kr/cache/recipe/2016/06/14/bcb6a53be0130048eaee435aa067b96c1.jpg'}, {'step_number': 2, 'description': '오이와 당근 파프리카 피망 쪽파를 적당한 크기로 썰어 놓는다', 'image_url': 'https://recipe1.ezmember.co.kr/cache/recipe/2016/06/14/56ac08da917ad4c22472be9a49be4fc81.jpg'}, {'step_number': 3, 'description': '준비해놓은 새우.낙지 야채를 볼에 넣고', 'image_url': 'https://recipe1.ezmember.co.kr/cache/recipe/2016/06/14/ec60ce47aff5a76fe7d8126155d113761.jpg'}, {'step_number': 4, 'description': '겨자 소스를 분량대로 섞어놓고 버무려준다', 'image_url': 'https://recipe1.ezmember.co.kr/cache/recipe/2016/06/14/29c088978a8c5076f26e84fe9b2bc9ac1.jpg'}]"
42458,메인반찬,영양식,해물류,무침,톳부추부침개:톳의 영양을 맛있게 섭취해요,톳두부무침,https://recipe1.ezmember.co.kr/cache/recipe/2019/12/13/8b189653eba18dcef2ceb2fc974fef881.jpg,"3,044",30분 이내,중급,2인분,"[('부추', ''), ('양파', ''), ('데친 톳', '적당히'), ('홍고추', ''), ('밀가루', ''), ('물', ''), ('소금', ''), ('빵가루', ''), ('식용유', '')]","톳은 항암,혈관질환,뼈건강,다이어트 등에 효능효과가 있는 건강식품이라고 해요. 단 무기비소라는 독성이 있어서 한번 데쳐서 조리하는 것이 좋고 너무 많은 양을 섭취하는 것이 좋지 않다고 해요. 하지만 우리가 톳을 얼마나 자주 많이 먹겠어요. 다양한 방법으로 꾸준히 섭취하도록 하는 게 좋겠지요? 하여 톳을 부담없이 먹을 수 있는 부침개로 만들어 보았어요.","[{'step_number': 1, 'description': '톳은 끓는 물에 데쳐 헹군 후 잘게 썰고', 'image_url': 'https://recipe1.ezmember.co.kr/cache/recipe/2019/12/13/9e08209483de72af57f65d4f241dbe5e1.jpg'}, {'step_number': 2, 'description': '부추는 다듬어 적당한 길이로 썬다.양파도 채썰고 홍고추도 썬다.', 'image_url': 'https://recipe1.ezmember.co.kr/cache/recipe/2019/12/13/b1582b63b40c8f34e3659e3da73675fc1.jpg'}, {'step_number': 3, 'description': '볼에 부침개 재료를 담고 밀가루와 물을 넣고 가볍게 섞은 후 빵가루도 넣어 섞는다.소금간을 한다.밀가루와 물은 재료를 엉기기에는 좀 부족한듯 넣었고 대신 빵가루를 더해 바삭함을 추가해 주었어요', 'image_url': 'https://recipe1.ezmember.co.kr/cache/recipe/2019/12/13/e20746c731b04bb66fbeea384bd7ad661.jpg'}, {'step_number': 4, 'description': '팬에 식용유를 두르고 기름온도가 올라가면 부침개 반죽을 고르게 펼쳐담은 후 앞뒤로 노릇하게 부친다.밀가루가 적게 들어가서 흐트러지기 쉬우므로 뒷면이 완전히 익었다 싶을 때 뒤집어주셔야 해요. 딱 한번만 뒤집는다는 생각으로~', 'image_url': 'https://recipe1.ezmember.co.kr/cache/recipe/2019/12/13/787c1725592f2b78ca3fba70b498b7c81.jpg'}]"
42459,메인반찬,영양식,해물류,무침,"굴무침, 제철굴로 만든 수육과 어울리는 굴무침 만들어요~",굴무침,https://recipe1.ezmember.co.kr/cache/recipe/2019/11/28/cdb8b1c52942de7df0542930af6882e11.jpg,"63,240",15분 이내,초급,4인분,"[('\u200b 굴', '500g'), ('무', '200g'), ('소금', '1큰술'), ('고춧가루', '5큰술'), ('새우젓', '1큰술'), ('액젓', '1.5큰술'), ('사이다', '1컵'), ('설탕', '3큰술'), ('다진 마늘', '2큰술'), ('쪽파', '1줌')]",제철굴 듬뿍 넣고 만든 맛있는 굴무침! ​ 밥도둑 제대로예요. ​,"[{'step_number': 1, 'description': '굴김치처럼 먹기 위해 양념장에 액젓도 넣어주었어요. 멸치 액젓, 까나리액젓 어떤 것도 좋아요.', 'image_url': 'https://recipe1.ezmember.co.kr/cache/recipe/2019/12/02/9ef2e3980fa3919462112e5ae4347e751.jpg'}, {'step_number': 2, 'description': '양념한 후 맛을 보면 설탕이 아직 덜 녹아서 맛이 겉돌아요. 그래서 저는 미리 그 전날 만들어 두었는데요. 양념장은 그 전날 만들어두시면 숙성이 되어서 훨씬 맛나답니다.', 'image_url': 'https://recipe1.ezmember.co.kr/cache/recipe/2019/12/02/c06958dd9c1a6ba9359da2d7fd84906b1.jpg'}, {'step_number': 3, 'description': '굴세척 방법은 흐르는 물에 씻기도 하지만 최대한 상처 없이 세척하려면 손대신 젓가락을 사용하는것이 좋아요. 간 무, 소금물에 5분 간 담근 후 살짝 씻어 물기 제거가 팁! 손으로 할 땐 상처가 나면서 따스한 손의 온기로 oyster의 신선도가 떨어진다고 합니다. 굵은 소금 1큰술 넣은 물에 잠깐 담궈두면 불순물이 빠져서 간편하고요. 무를 쓸때는 강판에 갈아서 그대로 넣어주심되어요. 저는 무생채도 할 예정이라 소금대신 써볼께요. 대신 무를갈아서 세척시 성분으로 인해 좀더 탱글탱글함과 비린맛도 제거가 된다고해요.', 'image_url': 'https://recipe1.ezmember.co.kr/cache/recipe/2019/12/02/6384aacb8e582e5067e57bac5f9503461.jpg'}, {'step_number': 4, 'description': '간 무 넣고 5분 지나니 이물질이 올라오니 보이는 거 있죠. 봉지에 담긴건 이미 한번은 세척된굴 이라서 조금만 유통기한 임박해도 신선도가 떨어지고 시간이 될수록 oyster속에 글리코겐성분이 빠져나와 물이 뿌옇게 변하는데요. (그래서 봉지에 담긴걸 살때는 최대한 물이 맑은걸 사세요.) 봉지껄 안사고 산지에서 시켰더니 크기도 커고 역시 신선해서 맘에 쏙~', 'image_url': 'https://recipe1.ezmember.co.kr/cache/recipe/2019/12/02/1d0f76df4dbdef3ee06450547aba4a091.jpg'}, {'step_number': 5, 'description': '요렇게 거뭇거뭇 무 즙이 검게 변하면 물 받아서 2번 정도 헹군 후 채반에 받혀 물기 쏙 빼주세요.', 'image_url': 'https://recipe1.ezmember.co.kr/cache/recipe/2019/12/02/0aeb90a82f5e27aa806c9ae33443fe511.jpg'}, {'step_number': 6, 'description': '채소는 미나리나 쪽파도 향긋하니 굴의 바다향을 상승시켜준답니다. 배, 사과 등을 곱게 채 썰어도 좋아요. 냉장고에 사과 넘쳐나는데 깜빡하고 못 넣고 나중에 무친 후 다시 넣었는데 맛나더라고요.', 'image_url': 'https://recipe1.ezmember.co.kr/cache/recipe/2019/12/02/3e82a8f7a6ab341161cc88a6271f239f1.jpg'}, {'step_number': 7, 'description': '우선 도톰한 듯 썰어준 무는 소금에 절여줄 거예요. 소금에 절이면 보드라워져 잘 휘기에 두께 0.5cm보다 좀 더 크게 썰어주었어요.', 'image_url': 'https://recipe1.ezmember.co.kr/cache/recipe/2019/12/02/5b800bd2a4cbc0492da97256edeb6a141.jpg'}, {'step_number': 8, 'description': '시원한 무와 oyster는 궁합도 좋아요. 굴무침에 쪽파, 미나리, 사과, 배 곁들임 채소나 과일 없어도 무는 꼭 넣어주셔요. 10분 절인 후 씻을 필요 없이 물기는 꼭~~짜주면 된답니다. 절대 씻지 마셔요~~', 'image_url': 'https://recipe1.ezmember.co.kr/cache/recipe/2019/12/02/f510a2af65e934f796141c318924d9a31.jpg'}, {'step_number': 9, 'description': '양념을 굴과 채소, 함께 넣고 버무리면 지금까지 아기 다루듯 했던 굴이 어스러질 수 있고요. 그래서 무 부터 먼저 양념 후 넣어주심 되어요. 알맹이가 터지면 물이 많이 생겨요. 무, 채소 또한 양념 옷 입으면 물이 생길 수 있으니 먹기 전 버무리시는 걸 권해드려요. 무가 빨갛게 옷을 입으면 이제 넣어 가볍게 버무려주세요.', 'image_url': 'https://recipe1.ezmember.co.kr/cache/recipe/2019/12/02/96e352015446d2f1dbda3ee07ab07e9e1.jpg'}, {'step_number': 10, 'description': '이렇게 양념이 적게 묻어도 채소 넣어서 한번 더 무치심 빨갛게 된답니다. 저는 쪽파 넣었는데요. 아삭한 배추(알배기배추도 좋아요)를 쭉쭉 찢어서 함께 양념하셔도 아삭함 더해져서 너무너무 맛나답니다.', 'image_url': 'https://recipe1.ezmember.co.kr/cache/recipe/2019/12/02/c5f09ff7ab32bf0646c74e13262b702b1.jpg'}]"
42460,메인반찬,영양식,해물류,무침,새콤달콤 낙지 초무침,낙지초무침,https://recipe1.ezmember.co.kr/cache/recipe/2015/05/11/db8e3efcb9ccbf1fac1ab033f3951b231.jpg,"19,884",30분 이내,초급,2인분,"[('낙지', '1마리'), ('미나리', '1묶음'), ('고추가루', '2큰술'), ('마늘', '1ts'), ('양파', '1개'), ('깨', ''), ('참기름', '3~4방울'), ('매실액', '1'), ('물엿', '1ts'), ('식초', '2~3방울')]",상큼한 봄에 어울리는 낙지미나리 초무침입니다.,"[{'step_number': 1, 'description': '낙지를 잘 손질해서 빨판에 이물질을 반드시 제거하고, 머리를 가위를 잘라서 안에 내장이 터지지 않게 조심해서 떼어내면 되겠어요. 그다음 끓는 물에 살짝 데쳐서 건져주세요.낙지 손질법 레시피', 'image_url': 'https://recipe1.ezmember.co.kr/cache/recipe/2015/05/11/d57319ebf8cb33a6d13604902cd37afa1.jpg'}, {'step_number': 2, 'description': '미나리도 잎은 모두 제거하고 살짝 데쳐서 물기를 꽉 짜서 준비하고요. 양파는 채썰어 준비해요.', 'image_url': 'https://recipe1.ezmember.co.kr/cache/recipe/2015/05/11/1b131949fac4825da556d449af509c681.jpg'}, {'step_number': 3, 'description': '낙지, 야채를 넣고 준비한 양념을 넣고 살살 무쳐주면 되겠어요.', 'image_url': 'https://recipe1.ezmember.co.kr/cache/recipe/2015/05/11/d9ba72b672d9287d8eb64d854dcb9fe81.jpg'}, {'step_number': 4, 'description': '마지막엔 통깨를 뿌리고요. 먹기 직전에 참기름을 살짝 뿌려주세요.', 'image_url': 'https://recipe1.ezmember.co.kr/cache/recipe/2015/05/11/fce2ff2609b5f4f701c7c311fa50adbd1.jpg'}]"
42461,메인반찬,영양식,해물류,무침,오징어 파프리카 초무침/백종원 맛남의 광장레시피 응용,오징어파프리카초무침,https://recipe1.ezmember.co.kr/cache/recipe/2020/07/22/951ed426dc17fcc24f0292325137c03c1.jpg,"2,365",30분 이내,초급,4인분,"[('오징어', '2마리'), ('빨강파프리카', '1/2개'), ('양파', '1/2개'), ('오이', '1/2~1개'), ('노랑파프리카', '1/2개'), ('주황파프리카', '1/2개'), ('간장', '2T'), ('설탕', '3T'), ('고추가루', '2T'), ('고추장', '3T'), ('다진마늘', '1T'), ('식초', '4T'), ('맛소금', '1t'), ('후추', ''), ('통깨', ''), ('참기름', '1T')]",후덥지근한 날씨에 떨어진 입 맛을 살려 주는 초무침 요리 ! 오징어와 파프리카를 넣어 단백질과 비타민을 한꺼번에 먹을수 있는 오징어 초무침 요리 백종원 레시피로 응용해서 만들어 봤어요~,"[{'step_number': 1, 'description': '야채는 기호에 따라 가감하셔도 되고 청양고추를 첨가 하셔서 맵게 즐겨도 좋아요', 'image_url': 'https://recipe1.ezmember.co.kr/cache/recipe/2020/07/22/48da64207a89c3e3e7cef305903e65c61.jpg'}, {'step_number': 2, 'description': '오징어는 냉동일 경우 끓는 물에 살짝만 데쳐서 찬물에 한번 행궈 주세요 그래야 깔끔합니다', 'image_url': 'https://recipe1.ezmember.co.kr/cache/recipe/2020/07/22/9c5586429938e14b73125e26183f34041.jpg'}, {'step_number': 3, 'description': '파프리카도 씨를 제거하고 채썰어 주세요', 'image_url': 'https://recipe1.ezmember.co.kr/cache/recipe/2020/07/22/68114f6e4fc274fdde25ac6b6f1aadce1.jpg'}, {'step_number': 4, 'description': '오이와 양파는 소금에 살짝 절였다가 해도 되지만 금방 무쳐 먹을 경우 그냥 하셔도 좋아요', 'image_url': 'https://recipe1.ezmember.co.kr/cache/recipe/2020/07/22/48dac2f30912a1976769365cc6092b3d1.jpg'}, {'step_number': 5, 'description': '분량의 양념 만들어 주시고.\n단맛은 조절하세요\n소면이랑 비벼 먹을거라 양이 넉넉합니다', 'image_url': 'https://recipe1.ezmember.co.kr/cache/recipe/2020/07/22/fbc7b9f839f08a70f1fac72bff7b59a61.jpg'}, {'step_number': 6, 'description': '국수는 팔팔 끓으면 찬물 끼얹기를 3번 반복하시고 익었는지 확인 한뒤 찬물에서 빡빡 문질러 전분기를 빼줍니다', 'image_url': 'https://recipe1.ezmember.co.kr/cache/recipe/2020/07/22/fd28285cfacdd051a3b8cb2136fc092a1.jpg'}, {'step_number': 7, 'description': '양념에 조물조물 무쳐 주세요\n모자라는 간은 소금으로 하시고 괜찮으면 생략하세요', 'image_url': 'https://recipe1.ezmember.co.kr/cache/recipe/2020/07/22/6f71818cf060864774b8dfb93dfd72f01.jpg'}, {'step_number': 8, 'description': '깨도 솔솔~', 'image_url': 'https://recipe1.ezmember.co.kr/cache/recipe/2020/07/22/2379fff8595d4be3c20fcd144c93babf1.jpg'}, {'step_number': 9, 'description': '야식에 술안주로도 너무 좋은 메뉴고 야채가 많이 들어가서 아침에 얼굴도 붓지 않아요ㅎㅎ', 'image_url': 'https://recipe1.ezmember.co.kr/cache/recipe/2020/07/22/b4af1a421ba4de52bdd3882a6d0b9df91.jpg'}]"
42462,메인반찬,영양식,해물류,무침,세모가사리무침:암을이기는 해초,세모가사리무침,https://recipe1.ezmember.co.kr/cache/recipe/2020/02/24/f78d8d8c33902b34148a490482c228e01.jpg,"3,402",15분 이내,초급,4인분,"[('세모가사리', ''), ('고추장', '1큰술'), ('다진마늘', '1작은술'), ('생강청', '1작은술'), ('양파청', '2큰술'), ('식초', '1큰술'), ('양조간장', '1/2큰술'), ('깨소금', '')]",세모가사리는 해초류 중 유일하게 지방을 흡착해서 배출시키는 우수한 디톡스 제품이라고 합니다.,"[{'step_number': 1, 'description': '완도지역 특산물인 세모가사리', 'image_url': 'https://recipe1.ezmember.co.kr/cache/recipe/2020/02/24/f4fc7dd329c9e2bf9ed6d2a01d25645c1.jpg'}, {'step_number': 2, 'description': '불리지 말고 콩나물씻듯 여러번 헹궈낸다', 'image_url': 'https://recipe1.ezmember.co.kr/cache/recipe/2020/02/24/e5f27c28de1a3605764794d7b77db7321.jpg'}, {'step_number': 3, 'description': '양념재료를 섞어 초고추장을 만든다', 'image_url': 'https://recipe1.ezmember.co.kr/cache/recipe/2020/02/24/49cea57e2ffac0faa33e726e0abda8c11.jpg'}, {'step_number': 4, 'description': '세모가사리를 양념장에 조물조물 무친다', 'image_url': 'https://recipe1.ezmember.co.kr/cache/recipe/2020/02/24/9b0b0647c95beab9a6f4a96a3e527f6d1.jpg'}, {'step_number': 5, 'description': '깨소금을 뿌린다', 'image_url': 'https://recipe1.ezmember.co.kr/cache/recipe/2020/02/24/d9b38b7b903e5987cc7c166f4cc775b21.jpg'}]"
42463,메인반찬,영양식,해물류,무침,꼬막 삶는법 해감 꼬막무침 만드는법 양념장 레시피,꼬막무침,https://recipe1.ezmember.co.kr/cache/recipe/2024/01/24/2aacdf41822247800ea177d2307247761.jpg,"3,564",2시간 이상,중급,2인분,"[('꼬막', ''), ('소금', '2T'), ('물', '1L'), ('소주', '2T'), ('달래', '1줌'), ('간장', '3T'), ('고춧가루', '1T'), ('매실청', '1T'), ('설탕', '0.5T'), ('다진마늘', '0.3T'), ('참기름', '1T'), ('통깨', '1T')]","꼬막은 2~3월에 살이 차오르면서 제철 시기에요 ​ 오늘은 꼬막 해감부터 삶는 법, 그리고 꼬막 양념장까지 모두 알려드릴게요","[{'step_number': 1, 'description': '먼저 꼬막에 굵은소금 1스푼 넣고 고무장갑을 낀 뒤 바락바락 씻어주세요 이때 탁한 물이 나오는데 탁한 물이 안 나올 때까지 여러 번 헹궈주세요 믹싱볼 , 고무장갑', 'image_url': 'https://recipe1.ezmember.co.kr/cache/recipe/2024/01/24/f8a836325af57968756ff491fd9c52e31.jpg'}, {'step_number': 2, 'description': '이후 꼬막이 잠길 만큼 물을 넣고 (1L) 소금 1스푼을 넣어 잘 녹여준 뒤 쇠숟가락을 중간에 넣어주세요 소금을 넣어 바닷물과 비슷한 염도를 만들어 주어야 꼬막이 머금고 있는 이물질을 뱉어내고, 마찬가지로 숟가락의 스테인리스 성분이 산화 반응으로 이물질을 더 잘 뱉어낸다고 해요숟가락식초를 넣어주면 식초의 강한 향으로 인해 이물질을 더 잘 뱉기 때문에\n해감시간을 30분정도 단축시킬 수 있답니다', 'image_url': 'https://recipe1.ezmember.co.kr/cache/recipe/2024/01/24/ce0da16c163156916ef70703b4baa7f41.jpg'}, {'step_number': 3, 'description': '그리고 바닷속과 비슷한 환경을 만들어 주기 위해 빛을 차단해줄 검은봉지나 호일로 덮어주세요 크기가 작다면 2시간 크다면 2시간 30분 정도시간을 두고 해감해 주세요비닐봉지오랜 시간 동안 해감하면 살이 물러지고 맛이 떨어지니 시간을 잘 지켜주는 게 포인트에요!', 'image_url': 'https://recipe1.ezmember.co.kr/cache/recipe/2024/01/24/de47a331a4b79ab389217c9abcc56ca71.jpg'}, {'step_number': 4, 'description': '해감이 된 꼬막은 한 번 더 맑은 물이 나올 때까지 흐르는 물에 바락바락 씻어주세요', 'image_url': 'https://recipe1.ezmember.co.kr/cache/recipe/2024/01/24/11c2626292831522b7bb70ca7eba20f51.jpg'}, {'step_number': 5, 'description': '다시 냄비에 물 1리터와 소주 2스푼, 소금 1스푼을 넣고 (소주, 소금 생략가능)냄비', 'image_url': 'https://recipe1.ezmember.co.kr/cache/recipe/2024/01/24/0ad8d9c893c8b103c247264059b387ba1.jpg'}, {'step_number': 6, 'description': '물이 끓어오르면 꼬막을 넣어 삶아주세요', 'image_url': 'https://recipe1.ezmember.co.kr/cache/recipe/2024/01/24/0921bfdaf3780cd6838367170c3ceffc1.jpg'}, {'step_number': 7, 'description': '이때 꼬막을 한쪽 방향으로 빙글빙글 휘저어 주며 삶아야 꼬막 살이 한쪽 껍데기에만 붙어서 껍질을 깠을 때 먹기가 수월하답니다 조리주걱', 'image_url': 'https://recipe1.ezmember.co.kr/cache/recipe/2024/01/24/c28d223d9ad1d61b152e041fad9d051a1.jpg'}, {'step_number': 8, 'description': '4~5개 정도 입을 벌리면 가스불을 끄고 꼬막만 따로 건져내세요 삶은 물은 버리지 않아야 해요', 'image_url': 'https://recipe1.ezmember.co.kr/cache/recipe/2024/01/24/c87d17767e85cd1017a30d22abd401e41.jpg'}, {'step_number': 9, 'description': '삶은 꼬막은 육즙이 빠져나가지 않게 찬물에 한 번만 휘리릭 헹궈낸 뒤채반', 'image_url': 'https://recipe1.ezmember.co.kr/cache/recipe/2024/01/24/062ef06173399cd1cb35a5b72fadf25c1.jpg'}, {'step_number': 10, 'description': '꼬막 뒤쪽 홈에 숟가락을 맞춘 뒤 비틀어서 한쪽 껍질을 제거해 주세요', 'image_url': 'https://recipe1.ezmember.co.kr/cache/recipe/2024/01/24/3f347e4d4955867015996d866af830571.jpg'}, {'step_number': 11, 'description': '손질이 끝난 꼬막은 삶았던 물에 살랑살랑 흔들어 이물질에서 헹궈주세요 아래 가라앉은 이물질이 섞이지 않게 위에 육수만 다른 곳에 부어서 헹궈주는 게 좋아요', 'image_url': 'https://recipe1.ezmember.co.kr/cache/recipe/2024/01/24/30caac2b9a9383039b0a2c4e2d4e25d31.jpg'}, {'step_number': 12, 'description': '꼬막 한 접시가 완성되었어요접시', 'image_url': 'https://recipe1.ezmember.co.kr/cache/recipe/2024/01/24/7ebc563496f4c05ebcc1dfc282243ee51.jpg'}, {'step_number': 13, 'description': '다음은 곁들어 먹을 꼬막 달래 양념장 만들기예요 달래는 물에 여러 번 헹군 뒤 먹기 좋게 1cm 간격으로 잘라주세요도마 , 조리용나이프 , 볼', 'image_url': 'https://recipe1.ezmember.co.kr/cache/recipe/2024/01/24/2439e042e77a9c4da77a4c60367bc0091.jpg'}, {'step_number': 14, 'description': '간장 3스푼, 고춧가루 1스푼, 매실청 1스푼, 설탕 0.5스푼, 다진 마늘 0.3스푼, 참기름 1스푼, 통깨를 넣어 만들어주세요', 'image_url': 'https://recipe1.ezmember.co.kr/cache/recipe/2024/01/24/9709bab7afcaabe914ba37d68a95a5851.jpg'}, {'step_number': 15, 'description': '접시에 꼬막을 한 층만 깔아주고', 'image_url': 'https://recipe1.ezmember.co.kr/cache/recipe/2024/01/24/b19d9340b859fcd336803586c9bc41821.jpg'}, {'step_number': 16, 'description': '그 위에 만든 꼬막 양념장을 숟가락을 이용하여 조금씩 올려주세요', 'image_url': 'https://recipe1.ezmember.co.kr/cache/recipe/2024/01/24/c79a4023046351b8c863e506cdcccbda1.jpg'}, {'step_number': 17, 'description': '반복해서 만들면 완성이랍니다. 달래 양념장은 꼬막 양념뿐만 아니라 밥과 함께 비벼 먹어도 맛있는 밥도둑 양념장이에요', 'image_url': 'https://recipe1.ezmember.co.kr/cache/recipe/2024/01/24/c9209d281a496fa99e588038df5cf6b11.jpg'}, {'step_number': 18, 'description': '꼬막 헹구기부터 해감하기 그리고 삶기, 껍질 까기까지 긴 시간의 노력이 들어가서 어쩐지 더 맛있는 꼬막무침 맛있게 만들어드세요~!', 'image_url': 'https://recipe1.ezmember.co.kr/cache/recipe/2024/01/24/9659bd3873eac6f2d99de25633048a331.jpg'}]"
42464,메인반찬,영양식,해물류,무침,간 건강 좋다고 하는 새콤 달콤 다슬기 무침,다슬기무침,https://recipe1.ezmember.co.kr/cache/recipe/2018/01/01/982e03928ee3a06a70c2fe363ab47d8e1.jpg,"3,524",30분 이내,초급,2인분,"[('다슬기살                                                                                껍질뺀', '1컵'), ('양파', '1/4개'), ('당근', '1/3개'), ('풋고추', '2개'), ('양상추', '1장'), ('고추장', '1큰술'), ('고운고추가루', '2큰술'), ('간장', '1큰술'), ('식초', '2큰술'), ('매실청', '2큰술'), ('조미술', '1큰술'), ('다진마늘', '1큰술'), ('깨소금', '1큰술'), ('참치액', '1큰술'), ('후추', '약간'), ('들기름', '1큰술')]",지난해 가을 우연히 아이들과 물놀이 갔다가 사람들 따라 얼떨결에 잡아온 다슬기입니다.삶아 손질해서 다슬기살만 냉동해 두었다가 오늘 해동해서 새콤 달콤 무침을 했습니다.,"[{'step_number': 1, 'description': '다슬기는 깨끗히 씻어 체반에 받쳐 물기를 빼줍니다.', 'image_url': 'https://recipe1.ezmember.co.kr/cache/recipe/2018/01/01/b7f756dfff4bc3e19f1c83de18d165151.jpg'}, {'step_number': 2, 'description': '고추는 어슷 썰고 양상추는 적당한 크기로 썰어 놓고', 'image_url': 'https://recipe1.ezmember.co.kr/cache/recipe/2018/01/01/ec79e83625738a92f1840f28196ac03d1.jpg'}, {'step_number': 3, 'description': '양파와 당근은 가늘게 채썰어 놓습니다.', 'image_url': 'https://recipe1.ezmember.co.kr/cache/recipe/2018/01/01/b90e4a44dc9728da4144603299ca03591.jpg'}, {'step_number': 4, 'description': '볼에 다슬기와 썰어둔 야채를 넣고 위분량의 양념넣고 살살 버무려 줍니다.', 'image_url': 'https://recipe1.ezmember.co.kr/cache/recipe/2018/01/01/1947b9acf02235f83be9d0b6a11e20511.jpg'}]"
