index,종류별,상황별,재료별,방법별,글 제목,레시피이름,레시피이미지,조회수,조리시간,난이도,인분,재료,소개글,조리순서
17063,밑반찬,명절,돼지고기,부침,은은한 깻잎향이 매력적인 깻잎전 만들기,깻잎전,https://recipe1.ezmember.co.kr/cache/recipe/2020/01/23/fb54bb4e78d4361b7d119375d5548c451.jpg,"10,926",60분 이내,아무나,4인분,"[('다진돼지고기', '700g'), ('양파', '1/2개'), ('대파', '1/2개'), ('진간장', '50g'), ('설탕', '30g'), ('후추', '2g'), ('다진마늘', '50g'), ('계란', '2개'), ('깻잎', '50장')]","깻잎안에 양념한 돼지고기를 넣어 고소한 기름에 부쳐먹는 전이에요
먹을때마다 은은히 느껴지는 깻잎향이 너무좋아요
완자전 만들때 같이 만들어보세요 
푸짐하고 넉넉한 양이에요","[{'step_number': 1, 'description': '양파와 대파를 잘게 썰어주세요', 'image_url': 'https://recipe1.ezmember.co.kr/cache/recipe/2020/01/23/6426c2d81f9991bf98848505b699d5ea1.jpg'}, {'step_number': 2, 'description': '다진양파와 대파를 다진 돼지고기에 넣어주세요', 'image_url': 'https://recipe1.ezmember.co.kr/cache/recipe/2020/01/23/729a4887afbfd2a9697debe8903bb9da1.jpg'}, {'step_number': 3, 'description': '간장,설탕,후추,다진마늘을 넣어주세요', 'image_url': 'https://recipe1.ezmember.co.kr/cache/recipe/2020/01/23/f25af1d6355d6600112f63fa5bd7f5a71.jpg'}, {'step_number': 4, 'description': '골고루 섞어주세요', 'image_url': 'https://recipe1.ezmember.co.kr/cache/recipe/2020/01/23/f9856b96486c250b0bd43815381f793f1.jpg'}, {'step_number': 5, 'description': '깻잎은 잘씻은후 꼭지부분을 제거해 주세요', 'image_url': 'https://recipe1.ezmember.co.kr/cache/recipe/2020/01/23/a4f02097a7583a8176ca970b5756ab761.jpg'}, {'step_number': 6, 'description': '밀가루를 뭍혀주세요', 'image_url': 'https://recipe1.ezmember.co.kr/cache/recipe/2020/01/23/eee1e1c16a27f7bd5cf398853ca14ec21.jpg'}, {'step_number': 7, 'description': '고기를 반숟가락정도 넣어주세요', 'image_url': 'https://recipe1.ezmember.co.kr/cache/recipe/2020/01/23/eb477dd278366e1b324cb4b6ceb4e5471.jpg'}, {'step_number': 8, 'description': '반으로접은후 살짝만 눌러주세요', 'image_url': 'https://recipe1.ezmember.co.kr/cache/recipe/2020/01/23/57f53d942de44a29fda31e36815e3fbd1.jpg'}, {'step_number': 9, 'description': '밀가루를 뭍혀주세요', 'image_url': 'https://recipe1.ezmember.co.kr/cache/recipe/2020/01/23/25390ababb4adaec927a605387b4f35b1.jpg'}, {'step_number': 10, 'description': '계란물을 풀어주세요', 'image_url': 'https://recipe1.ezmember.co.kr/cache/recipe/2020/01/23/c55a6b4bd32db828930f966f650cf8761.jpg'}, {'step_number': 11, 'description': '계란물을 뭍혀주세요', 'image_url': 'https://recipe1.ezmember.co.kr/cache/recipe/2020/01/23/cd5bde48c5c8ee69cd0b94c3c333a7871.jpg'}, {'step_number': 12, 'description': '팬에 기름을 두르고 앞뒤로 노릇하게 구워주세요', 'image_url': 'https://recipe1.ezmember.co.kr/cache/recipe/2020/01/23/db45810dc73cffad1bb8c97d4e2348ae1.jpg'}]"
17064,밑반찬,명절,돼지고기,부침,"돼지고기 삼각깻잎전 만들기, 설날 명절 음식 맛있게",돼지고기삼각깻잎전,https://recipe1.ezmember.co.kr/cache/recipe/2020/01/13/0ace05890e978d2f8ae278a13488c0a01.jpg,"6,279",60분 이내,초급,6인분 이상,"[('깻잎', '27~30장'), ('부침가루', '1/2컵'), ('달걀', '4개'), ('흰대파', '1대'), ('편생강', '8쪽'), ('홍고추', '1개'), ('다진 돼지고기', '300g'), ('다진 대파', '1/3컵'), ('다진 양파', '1/2컵'), ('다진 당근', '2T'), ('다진 마늘', '1T'), ('다진 생강', '1/2t'), ('청양고추', '1개'), ('간장', '1T'), ('참기름', '1/2t'), ('후추', '조금'), ('간장', '1T'), ('식초', '1T'), ('통깨', '약간')]","막 부쳐 따뜻할 때 먹어도 맛나고, 차갑게 식어도 너무 맛난 깻잎전♡ ​ 여러분도 요렇게 예쁘고 맛깔나게 부쳐서, 설날 명절에 맛있게 즐겨보는 건 어떠세요~♬ ​","[{'step_number': 1, 'description': 'https://youtu.be/AsmJHkOCIUg 더욱 자세한 레시피는 동영상을 참조!!', 'image_url': 'https://recipe1.ezmember.co.kr/cache/recipe/2020/01/13/b38c2c4a432bb7c7b3d088b10ae76e421.jpg'}, {'step_number': 2, 'description': '먼저 고기소에 들어갈 양파, 당근, 대파, 청양고추, 마늘, 생강은 잘게 다져주세요.', 'image_url': 'https://recipe1.ezmember.co.kr/cache/recipe/2020/01/13/e222a308c7d62e6a1f137630048d43071.jpg'}, {'step_number': 3, 'description': '그리고 고기소 재료들을 다 넣고 열심히 치대주시면 준비 끝. *찰기가 생길 때까지, 주물러주는 게 중요하겠죠!!', 'image_url': 'https://recipe1.ezmember.co.kr/cache/recipe/2020/01/13/b75ab98ab27e67b9ff17e3454984bff21.jpg'}, {'step_number': 4, 'description': '대파는 적당한 크기로 썰고, 생강은 채썰기, 홍고추도 얇게 썰어주면 OK.', 'image_url': 'https://recipe1.ezmember.co.kr/cache/recipe/2020/01/13/827a3631c7d91ae1f83209e0b1b179f61.jpg'}, {'step_number': 5, 'description': '먼저 삼각형 모양으로 깻잎전을 만들어보도록 할까요. 깻잎의 줄기 쪽 부분에 고기소를 적당히 올려준 다음, 뾰족한 윗부분을 올려주세요.', 'image_url': 'https://recipe1.ezmember.co.kr/cache/recipe/2020/01/13/efc51d985b40f612c4939059fa2935661.jpg'}, {'step_number': 6, 'description': '그리고 양옆을 접어, 삼각형으로 만들어주면 다음, 튀어나온 부분은 가위로 잘라주시면 OK.', 'image_url': 'https://recipe1.ezmember.co.kr/cache/recipe/2020/01/13/60cff0837673660a928eee66c8edd0d71.jpg'}, {'step_number': 7, 'description': '물론 가장 쉬운 방법은, 고기소 반을 채워 넣은 다음 접어주시면 된다는 것!!', 'image_url': 'https://recipe1.ezmember.co.kr/cache/recipe/2020/01/13/baa71f31b0dca3334f2c76030e218c5e1.jpg'}, {'step_number': 8, 'description': '그다음 깻잎전을 부침가루 → 달걀물 순서대로 겉면을 입혀주시면 준비 끝.', 'image_url': 'https://recipe1.ezmember.co.kr/cache/recipe/2020/01/13/1fae74d85f4d02c593f6fd1eb259441b1.jpg'}, {'step_number': 9, 'description': '예열된 프라이팬에 식용유를 두른 다음, 대파와 생강을 넣어주세요. 이렇게 하면 기름에 향이 더해져, 식어도 느끼하지 않고 맛나게 즐길 수 있답니다!', 'image_url': 'https://recipe1.ezmember.co.kr/cache/recipe/2020/01/13/764f74b162f7c87b6e4c4507dc390db61.jpg'}, {'step_number': 10, 'description': '그리고 기름이 따뜻하게 달궈졌으면, 깻잎을 올리고 약중불에서 노릇노릇하게 부쳐주시면 된답니다.', 'image_url': 'https://recipe1.ezmember.co.kr/cache/recipe/2020/01/13/50ef293e9b60f8c3e6c1de40583e4c541.jpg'}, {'step_number': 11, 'description': '그리고 전을 한 번 부치고 나면, 기름이 이렇게 지저분해지니. 키친타월로 닦아준 다음, 다시 기름을 둘러주는 게 좋답니다!! (그러니 함께 넣을 대파와 생강은 조금씩 새 기름에 넣어주는 걸 추천.)', 'image_url': 'https://recipe1.ezmember.co.kr/cache/recipe/2020/01/13/89de89bd61026aebb01ca941d6b689551.jpg'}, {'step_number': 12, 'description': '그다음 키친타월 위에 올려 기름기를 살짝 빼주시면 OK.', 'image_url': 'https://recipe1.ezmember.co.kr/cache/recipe/2020/01/13/3ddb9ff2282b0fd26ea2182bb16d4e6d1.jpg'}, {'step_number': 13, 'description': '그리고 남은 부침가루와 달걀은 이대로 버리기 아까우니. 부침가루, 달걀물, 물을 넣고 잘 섞어 반죽을 만들어준 다음 깻잎만 절반 접어 담가주세요.', 'image_url': 'https://recipe1.ezmember.co.kr/cache/recipe/2020/01/13/abcc7024b4b31fbf0f6adfecb90a48231.jpg'}, {'step_number': 14, 'description': '예열된 프라이팬에 깻잎을 올려 중불에서 양면 노릇노릇하게 부치고, 키친타월 위에 올려 기름기를 빼주면 끝. *이러면 고기 없이도 깔끔하고 맛 좋은 깻잎 전은 즐길 수 있겠죠ㅎㅎ', 'image_url': 'https://recipe1.ezmember.co.kr/cache/recipe/2020/01/13/4c3c20807df9e94349c5cf79c6a5b0df1.jpg'}]"
17065,밑반찬,명절,돼지고기,부침,명절뿐 아니라 평상시에도 유용한 사각동그랑땡 만드는 법 *^^*,동그랑땡,https://recipe1.ezmember.co.kr/cache/recipe/2019/01/29/9ce7c3205c00ab4681fd92010a7829621.jpg,"10,400",30분 이내,초급,4인분,"[('돼지고기 갈은거', '200g'), ('쇠고기 갈은거', '100g'), ('두부', '1/2모'), ('다진파', '3T'), ('다진마늘', '1T'), ('고운소금', '1/2T'), ('참기름', '1T'), ('후추가루', '소량'), ('달걀', ''), ('식용유', '')]","설명절이 며칠 안남았네요..
오늘은 제목 그대로...명절뿐아니라 평상시에도 만들어 놓으면 편하게 먹을수 있는 동그랑땡 만드는 법입니다.
보통 동그랑땡은 동그란 동전모양이잖아요..그런데 오늘은 사각모양입니다.
그래서 제 마음대로 사각동그랑땡이라고 이름 지었습니다.
쿠킹호일 다 사용하고 빈용기에 동그랑땡 반죽을 넣어 냉동후... 사각모양으로 먹기 좋게 썰은후 달걀옷만 입혀
 부쳐주는 건데요.. 냉동한 상태로 보관하셔도 좋고요..사각모양으로 썰어서 위생팩에 담아 냉동보관후
 급하실때 꺼내서 달걀옷만 입혀 부쳐주면 평상시에도 유용하실겁니다.","[{'step_number': 1, 'description': '1. 두부1/2모는 칼등으로 으깨어준후.. 젖은면보에 넣어 살짝 눌러 물기를 짜줍니다.\n키친타올위에 돼지고기 갈은거. 쇠고기 갈은것을 올려 핏기를 제거해줍니다.\n==> 돼지고기는 뒷다리살이고요.. 쇠고기는 홍두깨살입니다. \n2. 그릇에 으깬두부.갈은 돼지고기, 쇠고기 넣고 다진마늘1T. 다진파3T. 고운소금1/2T정도.참기름1T. 후추가루 소량을 넣고 조물조물 섞어 줍니다.\n=> 소금은 1/2T가 조금 못되어 넣어주세요. 동그랑땡 반죽에는 간장보다는 소금으로 간을 하시는 것이 좋습니다.', 'image_url': 'https://recipe1.ezmember.co.kr/cache/recipe/2019/01/29/fb2516e34864ec9b0ac85390f34d5ec81.jpg'}, {'step_number': 2, 'description': '3. 반죽을 손으로 잘 치대듯 섞어줍니다.\n이 상태로 동글넓적하게 모양을 만들어 부침가루 입히고 달걀옷 입혀서 부치면 일반 동그랑땡이 됩니다.\n오늘은 이 반죽을 쿠킹호일 용기에 넣어 냉동보관할겁니다.', 'image_url': 'https://recipe1.ezmember.co.kr/cache/recipe/2019/01/29/df4d8b7771cdaadb9221777e96a2ce6b1.jpg'}, {'step_number': 3, 'description': '4. 빈 쿠킹호일 상자속에 랩을 깔아 준후 반죽을 꽉 채워준후 냉동보관합니다.\n==> 쿠킹호일이 없을때는 김발위에 랩을 깔고..반죽을 올린후..김발로 돌돌 말아 냉동보관하셔도 좋습니다.\n냉동한 반죽을 냉장실에 30분정도 꺼내어 놓은후 살짝 겉면이 녹으면 썰어서 달걀옷만 입혀 부쳐주시면 되는데요\n저는 썰은 양이 많아서요.. 한번 먹을것만 부치고 나머지는 위생팩에 담아 냉동보관했습니다.\n이렇게 냉동보관후 필요할때마다 꺼내서 달걀옷만 입혀서 부쳐주면 편리합니다.\n==> 이렇게 냉동실에 얼렸다가 동그랑땡을 만들면 모양잡기는 편한데요 부칠때 수분기가 많이 나와요..\n그래서 명절때처럼 다량의 동그랑땡을 만들때는요 냉동실에 3~4시간만 넣어 살짝 얼려준후(완전히 얼리지 않는거죠)\n한입크기로 썰어서 부침가루 묻히고 달걀옷 입혀서 부쳐주면 수분기도 나오지 않고 모양잡기도 좋답니다.', 'image_url': 'https://recipe1.ezmember.co.kr/cache/recipe/2019/01/29/ad985962c8a1b1fbe3f1faada483aae81.jpg'}, {'step_number': 4, 'description': '5.썰은 동그랑땡에 달걀옷을 입혀준후 \n팬에 식용유를 넣고 약불에서 달아오르면 반죽을 넣은후 앞뒤면 노릇하게 부쳐주면 완성입니다.\n==> 부칠때요...달걀옷 입힌 동그랑땡을 팬의 가장자리부터 넣어준후 마지막에 팬의 가운데부분에 넣어주세요.\n팬의 가운데 부분이 가스불 열기가 가장 세기때문에요..이렇게 가장자리부터 동그랑땡을 올려주시는것 좋습니다. \n==> 약한불에서 속까지 익을수 있게 천천히 부쳐주세요.', 'image_url': 'https://recipe1.ezmember.co.kr/cache/recipe/2019/01/29/e8ed5e06963edd20c5cfdbc86cc044981.jpg'}]"
17066,밑반찬,명절,돼지고기,부침,깻잎 전 만들기,깻잎전,https://recipe1.ezmember.co.kr/cache/recipe/2021/07/20/795d3239734fb1b573f92f92f9cd7d5e1.jpg,"4,383",120분 이내,아무나,6인분 이상,"[('깻잎', '32장'), ('다진돼지고기', '400g'), ('양파', '1/2개'), ('당근', '1/3개'), ('청양고추', '3개'), ('두부', '1/2모'), ('대파', '1대'), ('계란', '3개'), ('부침가루', '1컵'), ('소금', '약간'), ('식용유', '적당량'), ('청주', '2숟가락'), ('후추', '약간')]","시어머니께서 텃밭에서 키운 유기농 깻잎을 한가득 주셨어요. 
쌈으로 소진 시키기에는 다소 많은 양이라 깻잎김치와 깻잎 전을 만들었어요.","[{'step_number': 1, 'description': '먼저 깻잎을 깨끗이 씻은 다음 물기를 제거해 주세요.', 'image_url': 'https://recipe1.ezmember.co.kr/cache/recipe/2021/07/20/5eb20178de86795094df182f26a7e0e61.jpg'}, {'step_number': 2, 'description': '돼지고기 잡내 제거를 위해 키친타월로 핏물을 꼼꼼히 제거해 주세요.', 'image_url': 'https://recipe1.ezmember.co.kr/cache/recipe/2021/07/20/94a0c5239e3ddedc35b5708c21add5691.jpg'}, {'step_number': 3, 'description': '핏물을 제거한 돼지고기를 볼에 담고 청주(맛술) 2숟가락, 후추 적당량을 넣고 밑간을 해주세요.', 'image_url': 'https://recipe1.ezmember.co.kr/cache/recipe/2021/07/20/6d8a45ef926d3f5e67438327a5ffe74e1.jpg'}, {'step_number': 4, 'description': '양파, 청양고추, 당근, 대파는 잘게 잘라 준비해 주세요.', 'image_url': 'https://recipe1.ezmember.co.kr/cache/recipe/2021/07/20/44d2c64bdc1fed970e95df462bcb7d8a1.jpg'}, {'step_number': 5, 'description': '두부는 면포에 싸서 물기를 꼭 짜주세요.', 'image_url': 'https://recipe1.ezmember.co.kr/cache/recipe/2021/07/20/012515ede12aa0058435245f8b648dff1.jpg'}, {'step_number': 6, 'description': '볼에 고기와 양파, 대파, 청양고추, 당근, 두부를 넣은 다음 약간의 소금을 넣어주세요.', 'image_url': 'https://recipe1.ezmember.co.kr/cache/recipe/2021/07/20/5fb649d5444a3c7eba2b3a97c4e983f61.jpg'}, {'step_number': 7, 'description': '재료가 잘 섞이도록 치대주세요.', 'image_url': 'https://recipe1.ezmember.co.kr/cache/recipe/2021/07/20/ce560d1ca449a1e8e5c7ed2316277e981.jpg'}, {'step_number': 8, 'description': '깻잎 앞 뒤쪽에 부침가루를 묻힌 다음 고기 반죽을 삼각형 모양으로 깻잎 위로 올려주고요.\n왼쪽과 오른쪽 깻잎을 마주보게 접고 나머지 깻잎을 위로 올려주면 삼각형 모양이돼요.', 'image_url': 'https://recipe1.ezmember.co.kr/cache/recipe/2021/07/20/d8afbba767a8e27a8ba2ffbf09580e0b1.jpg'}, {'step_number': 9, 'description': '깻잎 앞뒤에 부침가루를 묻히고 깻잎 뒷면이 위로 보이게 한 다음 적당량의 반죽을 올리고 반을 접어주세요.', 'image_url': 'https://recipe1.ezmember.co.kr/cache/recipe/2021/07/20/8bc825cba1ac8336f09ffa8911df974e1.jpg'}, {'step_number': 10, 'description': '삼각형 모양으로 접은 쪽이 아래쪽으로 가게 놓아야 풀어지지 않아요.', 'image_url': 'https://recipe1.ezmember.co.kr/cache/recipe/2021/07/20/c98f5f8f62735cea16b627b7fc54d79d1.jpg'}, {'step_number': 11, 'description': '달걀물로 옷을 입힌 다음 예열한 팬에 식용유를 두르고 앞뒤 노릇노릇해지도록 약불로 익혀주세요.', 'image_url': 'https://recipe1.ezmember.co.kr/cache/recipe/2021/07/20/3a003b11f78b6e2c82c6d3f719240e791.jpg'}, {'step_number': 12, 'description': '완성된 깻잎 전은 키친타월에 올려 기름을 제거해 주세요.', 'image_url': 'https://recipe1.ezmember.co.kr/cache/recipe/2021/07/20/e3ef49ab9b110d232c6e7892ebde21631.jpg'}, {'step_number': 13, 'description': '새콤달콤 장아찌 소스와 곁들여 주었어요.\n은은한 깻잎 향과 담백한 맛이 밥반찬으로도 좋아요.', 'image_url': 'https://recipe1.ezmember.co.kr/cache/recipe/2021/07/20/7466a824fdeace6428fdeadac31d57511.jpg'}]"
17067,밑반찬,명절,돼지고기,부침,인기만점인 동그랑땡 만들기,동그랑땡,https://recipe1.ezmember.co.kr/cache/recipe/2021/09/22/0d4f453c5f246391487a28cd339e64da1.jpg,"5,366",120분 이내,초급,6인분 이상,"[('돼지고기다짐육', '600g'), ('다진양파', '110g'), ('두부', '200g'), ('다진 당근', '60g'), ('썰은 쪽파', '30g'), ('부침가루', '5T'), ('통깨', '1T'), ('식용유', '적당량'), ('다진마늘', '1T'), ('후추', '약간'), ('생강가루', '약간'), ('죽염', '1t'), ('맛술', '2t'), ('참기름', '1T'), ('계란', '3개'), ('죽염', '0.5t'), ('백후추', '약간')]","추석차례는 안하지만 식구들이
먹고 싶다고 하여 만들어 보았어요","[{'step_number': 1, 'description': '재료는깨끗이 손질하여 홍당무,양파는', 'image_url': 'https://recipe1.ezmember.co.kr/cache/recipe/2021/09/22/a3a4549eeaca29232c1d275ab8c044c01.jpg'}, {'step_number': 2, 'description': '곱게 다져 주세요', 'image_url': 'https://recipe1.ezmember.co.kr/cache/recipe/2021/09/22/0d59e749acc25dcd9c0aa52fd349b5cc1.jpg'}, {'step_number': 3, 'description': '쪽파는 작게 송송 썰어 주고 ~', 'image_url': 'https://recipe1.ezmember.co.kr/cache/recipe/2021/09/22/7cab44aafce849b1f42d034149fcaa951.jpg'}, {'step_number': 4, 'description': '두부는 면보에 물기 꼭 짜 주세요\n(두부는 물기 짜기전 200g입니다)', 'image_url': 'https://recipe1.ezmember.co.kr/cache/recipe/2021/09/22/3cd2818ac178fab385258f0f918e8cd71.jpg'}, {'step_number': 5, 'description': '볼에 다짐육 담고\n양념 넣어서\n많이 치데어 주세요', 'image_url': 'https://recipe1.ezmember.co.kr/cache/recipe/2021/09/22/a6429a11140d5245c6537b13e00516651.jpg'}, {'step_number': 6, 'description': '다짐육에 재료 다진것 \n넣어 주고 \n통깨 넣고 ~', 'image_url': 'https://recipe1.ezmember.co.kr/cache/recipe/2021/09/22/fa788729fbd535ff1b39909acc23e7571.jpg'}, {'step_number': 7, 'description': '조물조물 섞어 주세요', 'image_url': 'https://recipe1.ezmember.co.kr/cache/recipe/2021/09/22/a1c91be8fe9121330dcd2d552c24d57b1.jpg'}, {'step_number': 8, 'description': '조물조물 섞어 주고~\n랲을 씌어서 냉장고에\n30분 숙성 시켜 주세요', 'image_url': 'https://recipe1.ezmember.co.kr/cache/recipe/2021/09/22/d765ad1544a7246623c0d894a79b96fc1.jpg'}, {'step_number': 9, 'description': '계란물 만들고 ~', 'image_url': 'https://recipe1.ezmember.co.kr/cache/recipe/2021/09/22/7b079d2f51f9c33b4fd28b2b2b699c341.jpg'}, {'step_number': 10, 'description': '쟁반에 부침가루\n뿌려 주고\n손으로 다짐육 적당하게\n잡아서 동그넙적하게 만들어\n쟁반에 담아 주고 ~', 'image_url': 'https://recipe1.ezmember.co.kr/cache/recipe/2021/09/22/29e27c28391c786dd02abf861260e5e31.jpg'}, {'step_number': 11, 'description': '동그랑땡 위쪽에도\n솔솔 부침가루 뿌려 주세요', 'image_url': 'https://recipe1.ezmember.co.kr/cache/recipe/2021/09/22/58d432ff0a57b930392058627ddf8dd01.jpg'}, {'step_number': 12, 'description': '다른쟁반에 옮기면서\n손으로 다시 한번 모양을\n잡아 주고 ~\n(팬에 부칠 수 있는 양만큼만\n그때그때 만들어 줍니다\n만들어 놓으면 부침가루가 스며 들어 좀 맛이 없어요)', 'image_url': 'https://recipe1.ezmember.co.kr/cache/recipe/2021/09/22/e8a4e8568f225586e11f5d6069a2ed9e1.jpg'}, {'step_number': 13, 'description': '팬에 열기가 오르면 불을\n약으로 줄이고\n식용유 두르고\n계란물 옷 입혀서 올려 줍니다', 'image_url': 'https://recipe1.ezmember.co.kr/cache/recipe/2021/09/22/eecff31317e4d8b68150fc2d3c813ae31.jpg'}, {'step_number': 14, 'description': '동그랑땡 한쪽면이 살짝\n계란물 옷이 익었으면\n바로 뒤집어 주세요\n(번거롭지만 동그랑땡에\n계란물 옷이 이쁘답니다)', 'image_url': 'https://recipe1.ezmember.co.kr/cache/recipe/2021/09/22/2849bf2e18c4c90e3b856f5fe8f3062f1.jpg'}, {'step_number': 15, 'description': '노릇노릇 익혀 주고 ~\n(한판 부치는데 20분 정도\n걸려요)', 'image_url': 'https://recipe1.ezmember.co.kr/cache/recipe/2021/09/22/81f2bdb12da383af83fe3d9f0c65ddbe1.jpg'}, {'step_number': 16, 'description': '기름기 제거 해 주고 ~', 'image_url': 'https://recipe1.ezmember.co.kr/cache/recipe/2021/09/22/0ea942d88d7f4ae04a701de74670062a1.jpg'}, {'step_number': 17, 'description': '접시에 담아 주면 됩니다', 'image_url': 'https://recipe1.ezmember.co.kr/cache/recipe/2021/09/22/8f6da7d2d2b274dae689e507f16edead1.jpg'}]"
17068,밑반찬,명절,돼지고기,부침,먹다 남은 다짐육으로 만든 동그랑땡,동그랑땡,https://recipe1.ezmember.co.kr/cache/recipe/2018/04/16/25fc4846320f825249d6eda3ac6ea12a1.jpg,"20,258",60분 이내,아무나,5인분,"[('돼지고기', '200g'), ('두부', '1모'), ('다진당근', '조금'), ('다진마늘', '1티스푼'), ('쪽파', '3대'), ('양파', '1/4개'), ('생강술', '1티스푼'), ('소금', '1큰술'), ('후춧가루', '조금'), ('달걀', '1개'), ('빵가루', '1큰술'), ('전분가루', '2큰술'), ('달걀', '3개'), ('식용유', '넉넉히')]",순두부찌개 끓여 먹고 남은 다짐육으로 동그랑땡 만들어봤어요~,"[{'step_number': 1, 'description': '우선 두부 한모는 면보에 넣어 물기를 꽉 짜줍니다.', 'image_url': 'https://recipe1.ezmember.co.kr/cache/recipe/2018/04/16/c24b044d797b7e8fb4bfa5f77ee7daac1.jpg'}, {'step_number': 2, 'description': '볼에 물기 짠 두부와 돼지고기 다짐육을 넣고요..', 'image_url': 'https://recipe1.ezmember.co.kr/cache/recipe/2018/04/16/abce7d03a8119177ae663e82b2eaa4fb1.jpg'}, {'step_number': 3, 'description': '당근은 짜투리로 남은거 다져서 넣었어요.\n양파도 1/4개 다졌구요.\n쪽파는 3대 다졌어요.\n다진마늘 1티스푼 넣어주었어요.', 'image_url': 'https://recipe1.ezmember.co.kr/cache/recipe/2018/04/16/4cddf968f16accc53eb927c54d485c851.jpg'}, {'step_number': 4, 'description': '생강술 1티스푼 넣어주고, 소금과 후추를 넣어 간을 하였답니다.소금은 한꺼번에 다 넣지 말고 조금씩 넣어가며 간을 맞추어야해요~', 'image_url': 'https://recipe1.ezmember.co.kr/cache/recipe/2018/04/16/7dda5972fccf37bf2d8fe412b21fbe321.jpg'}, {'step_number': 5, 'description': '다 넣었다면 골고루 버무려주고 치대줍니다. 그러고 나서 달걀 1개 깨뜨려 넣고 다시 치대줍니다.\n달걀이 들어가면 잘 뭉쳐져요~', 'image_url': 'https://recipe1.ezmember.co.kr/cache/recipe/2018/04/16/680989b4ae23c4c6769c7ffbfae508b81.jpg'}, {'step_number': 6, 'description': '그래도 안 뭉쳐질땐 빵가루 1큰술과 전분가루 2큰술 정도 넣고 치대주면 잘 뭉칠 수 있어요~', 'image_url': 'https://recipe1.ezmember.co.kr/cache/recipe/2018/04/16/798b81459c43c45a8ef6a9e44f2ae4f51.jpg'}, {'step_number': 7, 'description': '이제 조금씩 떼어낸 다음 동그랗게 빚여줍니다.', 'image_url': 'https://recipe1.ezmember.co.kr/cache/recipe/2018/04/16/4b913007f56d528bcf78868db4935ae31.jpg'}, {'step_number': 8, 'description': '반죽을 다 빚으니 양은 이만큼이네요..', 'image_url': 'https://recipe1.ezmember.co.kr/cache/recipe/2018/04/16/b6865b1458d054dced368a02610f92de1.jpg'}, {'step_number': 9, 'description': '달걀 3개를 깨뜨려 풀어준뒤 후라이팬에 기름 둘러 달군 다음 빚어 놓은 동그랑땡 하나씩 넣어 계란물 입혀줍니다.', 'image_url': 'https://recipe1.ezmember.co.kr/cache/recipe/2018/04/16/468319390620663998f506f057f4ccd41.jpg'}, {'step_number': 10, 'description': '이렇게 하나씩 부쳐주면 동그랑땡 완성입니다~다 부친 동그랑땡은 키친타월에 올려 기름을 빼주는게 좋아요~', 'image_url': 'https://recipe1.ezmember.co.kr/cache/recipe/2018/04/16/6259609af991a0360345dedd8dbe47ec1.jpg'}]"
