index,종류별,상황별,재료별,방법별,글 제목,레시피이름,레시피이미지,조회수,조리시간,난이도,인분,재료,소개글,조리순서
76214,밥/죽/떡,초스피드,채소류,비빔,명란 아보카도 비빔밥 초간단 한그릇요리,명란아보카도비빔밥,https://recipe1.ezmember.co.kr/cache/recipe/2020/07/01/d8c8678b0d55eb3c9252ad2e342812ba1.jpg,"1,527",10분 이내,아무나,1인분,"[('아보카도', ''), ('명란', ''), ('계란', ''), ('김가루', ''), ('푸른잎채소', ''), ('맛간장', ''), ('참기름', ''), ('깨', ''), ('쪽파', '송송')]","아보카도 처음에는 조금 어려웠던 재료인데
건강을 위해 아보카도를 시작한 우리집
가장 만만하고 널리 알려진 레시피대로 명란아보카도비빔밥을 해봤어요
야채도 듬뿍 넣어 영양가있는 아보카도 즐기기
한그릇요리로 제격
근사한데 맛까지 부드럽고 맛있어요","[{'step_number': 1, 'description': '반으로 갈라주면 이렇게 쩍하고 씨가 나옵니다\n으헤헤헤헹\n그러면 씨를 제거하는 방법은 여러가지인데요\n아보카도가 너무 잘익어서 뭉개질까봐 살살하니라고 진땀\n칼로 씨를 찍어주시면 칼이 박히는데요\n쏘옥 뽑아주시면 됩니다\n이게 부담스러우시다면 숟가락으로 씨만 떠내셔도 됩니다', 'image_url': 'https://recipe1.ezmember.co.kr/cache/recipe/2020/07/01/9882923493b09e6091c4e81a098f11b21.jpg'}, {'step_number': 2, 'description': '그런다음에 손으로 껍질을 벗겨내시면 됩니다\n푹있어서 그런지 잘 벗겨져요\n그게 너무 푹익었나 싶을정도로 손톱자국까지 푹푹 패이는게 맴이 찢어질라고해요\n푹익힌 아보카도는 부드러워서\n조금만 힘줘도 뭉개져서 조심조심 또조심\n+_+\n껍질까지 완벽제거한 아보카도\n초보도 쉽게 할수 있어서 좋으네요', 'image_url': 'https://recipe1.ezmember.co.kr/cache/recipe/2020/07/01/0ad11d1a11975c8dfa49dc79a90ddcf51.jpg'}, {'step_number': 3, 'description': '아보카도 꽃을 만들어볼건데요\n아보카도꽃만들기 한번 해봤는데 쉬워요\n어렵지않아요\n일단 최대한 얇게 슬라이스를 쳐주세요!\n얇게 할수록 예쁩니다\n얇게 자른 아보카도를 옆으로 주욱 펼쳐주세요\n그런다음 조심이 손으로 말아주시면 됩니다\n참 쉽죠잉...', 'image_url': 'https://recipe1.ezmember.co.kr/cache/recipe/2020/07/01/5867635686d81863b618c27fd829655e1.jpg'}, {'step_number': 4, 'description': '자 밥그릇에 밥을 담아주세요\n그런 다음 계란후라이도해서 올려주시고\n김가루도 올리고\n아보카도 꽃 만든것도 올려주시고\n명란젓갈도 껍질을 벗겨서 알만 한숟가락 퍼서 올려주세요\n꽃위에 올리니 꽃 예쁜 꽃이 핀거 같아요\n히히히\n명란을 못드시는 어머님을 위해\n간장:참기름 = 1:1 비율로 섞고 깨랑 쪽파 뿌린 간장도 만들어서 내었어요 :)\n마지막에 쪽파 솔솔 뿌리고\n어린잎채소 있으시면 살짝 올려주심 완벽한 데코지요', 'image_url': 'https://recipe1.ezmember.co.kr/cache/recipe/2020/07/01/2c3fc8817d597f2faddd9bc51309ba471.jpg'}]"
76215,밥/죽/떡,초스피드,채소류,비빔,김치 비빔밥 만들어 보기 #간단한요리 #비빔밥 #두리문,김치비빔밥,https://recipe1.ezmember.co.kr/cache/recipe/2022/07/10/a8111d44c901f8ee4b351b2bc30b93171.jpg,"1,399",30분 이내,아무나,3인분,"[('김장 김치', '1쪽'), ('설탕', '1/2숟가락'), ('마늘', '2쪽'), ('김', '1장'), ('깻잎', '10장'), ('계란', '3개'), ('참기름', '약간')]","점심을 아주 간단하게 먹으면서 영양식으로 먹고 싶을 때 딱인 김치비빔밥입니다.
간단하니 점심으로 얼른 만들어 보세요.","[{'step_number': 1, 'description': '작년 김장 김치입니다.\n집에서 기른 배추라 작습니다.\n다루기는 쉬워요.', 'image_url': 'https://recipe1.ezmember.co.kr/cache/recipe/2022/07/10/2a1438ca97627d9d91d80b8dec51186f1.jpg'}, {'step_number': 2, 'description': '김치 비빔밥에는 잘게 썰어진 것이 먹기도 좋으니\n총총 썰어 줍니다.', 'image_url': 'https://recipe1.ezmember.co.kr/cache/recipe/2022/07/10/05e8d754d09ba214eadce4a83ca269b41.jpg'}, {'step_number': 3, 'description': '마늘 2 쪽을 채 썰어서 넣어 줍니다.', 'image_url': 'https://recipe1.ezmember.co.kr/cache/recipe/2022/07/10/79e38b42a0c39f628cb8a7d9e88722501.jpg'}, {'step_number': 4, 'description': '그리고 설탕을 1/2 숟가락도 넣어 주세요.\n달콤한 맛을 더 좋아하면 더 넣으세요.\n그러나\n배추김치 크기가 크면 더 넣으셔야 합니다.', 'image_url': 'https://recipe1.ezmember.co.kr/cache/recipe/2022/07/10/64dde2fcfd3f176dafe155496b33feb71.jpg'}, {'step_number': 5, 'description': '마늘과 설탕을 넣어서 무칩니다.', 'image_url': 'https://recipe1.ezmember.co.kr/cache/recipe/2022/07/10/32286f388648a9391f14781011861b561.jpg'}, {'step_number': 6, 'description': '깻잎의 향이 좋잖아요.\n10장을 썰어 줍니다.\n더 넣으셔도 물론 되죠.', 'image_url': 'https://recipe1.ezmember.co.kr/cache/recipe/2022/07/10/3daa225c216f1a7957649ab98773968b1.jpg'}, {'step_number': 7, 'description': '김은 살짝 구워 가위로 잘게 자릅니다.\n이 김은 안 구워도 되지만\n구수한 맛을 더 내기 위해 한 번 구웠습니다.\n맛김으로도 좋아요.', 'image_url': 'https://recipe1.ezmember.co.kr/cache/recipe/2022/07/10/8d6701d9d22312f3e33051458eb6fa2c1.jpg'}, {'step_number': 8, 'description': '계란 프라이도 준비합니다.\n반숙으로 구워도 좋아요.', 'image_url': 'https://recipe1.ezmember.co.kr/cache/recipe/2022/07/10/87419b9aedc53863559310865de97e5a1.jpg'}, {'step_number': 9, 'description': '밥에다 김치와 깻잎을 넣습니다.', 'image_url': 'https://recipe1.ezmember.co.kr/cache/recipe/2022/07/10/0c4c961a091a971b8a3ef40abfcf09441.jpg'}, {'step_number': 10, 'description': '계란 프라이까지 덮습니다.', 'image_url': 'https://recipe1.ezmember.co.kr/cache/recipe/2022/07/10/23f954046e777b5ecf8099bd1920d8b81.jpg'}, {'step_number': 11, 'description': '살짝 간 통깨도 넣어 줍니다.\n완성~~~~', 'image_url': 'https://recipe1.ezmember.co.kr/cache/recipe/2022/07/10/d06ad0e8a5e1ddade1a5bb25949cb0b31.jpg'}, {'step_number': 12, 'description': '김치 비빔밥과 단배추 물김치와 같이 먹습니다.\n두리문 김치비빔밥 완성~~', 'image_url': 'https://recipe1.ezmember.co.kr/cache/recipe/2022/07/10/0ea752fe0225f656451e22ade6f5a86e1.jpg'}]"
76216,밥/죽/떡,초스피드,채소류,비빔,우엉 조림 덮밥 -초 간단 우아한 혼밥,우엉조림덮밥,https://recipe1.ezmember.co.kr/cache/recipe/2020/09/11/e12e32795d2551625cb62347ab4e55a41.jpg,664,10분 이내,아무나,1인분,"[('밥', '1공기'), ('우엉 조림', '2-3젓가락'), ('참기름', '1작은술'), ('깨', '1작은술'), ('소금', '1/4작은술')]","마트에 가면 우엉 두 뿌리를 한 세트로 판다. 우엉 조림 한 통 해 놓으면 이리 해 먹고 저리 해 먹고 찬 없는 밥에는 딱이다.

​

​

​

어느 날 갑작스레 점심 한 끼를 드려야 하는 분이 있어 살짝 간 한 밥에 우엉 조림을 얹어 덮밥으로 드렸더니 아삭 아삭 색다른 맛이라며 감탄을...ㅋㅋ
(근데 요거 기대 이상으로 꽤 맛있어요~)

​

​

​

나는 또 생각한다. 요리는 창작이라며....ㅋㅋㅋㅋ

​

​

​

어린애 장난 같은 나의 끼니 이야기 끝~

우엉 조림 황금 레시피 보러 가기  @6942894","[{'step_number': 1, 'description': '준비한 잡곡 밥 한 공기는', 'image_url': 'https://recipe1.ezmember.co.kr/cache/recipe/2020/09/11/b854398eaef2b846064dd8be790f43751.jpg'}, {'step_number': 2, 'description': '분량의 양념으로 간 하여 골고루 잘 비벼 줍니다.', 'image_url': 'https://recipe1.ezmember.co.kr/cache/recipe/2020/09/11/85fa5d84f4c2e1b9c59145ae7b92f4901.jpg'}, {'step_number': 3, 'description': '양념한 밥을 담고 밥 위에 우엉 조림을 예쁘게 얹어 줍니다.\n(잉? 끝? 너무 쉬워 죄송합니다...)', 'image_url': 'https://recipe1.ezmember.co.kr/cache/recipe/2020/09/11/7e0dbece81bfe8cebc1157186c660fb91.jpg'}]"
76217,밥/죽/떡,초스피드,채소류,비빔,부추된장비빔밥 고추장 대신 된장양념 부추비빔밥 다이어트 비빔밥,부추비빔밥,https://recipe1.ezmember.co.kr/cache/recipe/2024/07/02/d922456dba2a7d8422f691af2825afe61.jpg,82,10분 이내,아무나,2인분,"[('부추', '50g'), ('참치캔                                                                                1개', '85g'), ('계란', '1개'), ('밥', '1공기'), ('청양고추', '1/3개'), ('범일콩된장', '1큰술'), ('식초', '1큰술'), ('다진 마늘', '1/3큰술'), ('들기름', '1큰술'), ('매실청', '1/2큰술')]",여름이라 차가운 음식 많이 드실 텐데요 부추는 몸을 따듯하게 해주어 냉방병 예방에 좋으니 더운 여름 부추는 필수로 먹어주세요,"[{'step_number': 1, 'description': '참치는 기름을 빼고 준비하고 청양고추와 부추는 종종 썰어주세요.도마 , 조리용나이프부추 손질법', 'image_url': 'https://recipe1.ezmember.co.kr/cache/recipe/2024/07/02/fb3394a2c4ff8b6775b90968ab1647261.jpg'}, {'step_number': 2, 'description': '분량의 양념과 다진 청양고추를 섞어 비빔양념장을 만들어주세요.볼 , 숟가락', 'image_url': 'https://recipe1.ezmember.co.kr/cache/recipe/2024/07/02/74f8f4c6a638aba1a1a9e046ba4ce3f61.jpg'}, {'step_number': 3, 'description': '밥 위에 부추, 참치, 계란후라이, 양념장을 올려 맛있게 비벼드세요.완성그릇', 'image_url': 'https://recipe1.ezmember.co.kr/cache/recipe/2024/07/02/1b945c8daf1d8f16d0f21d91c5686c5e1.jpg'}]"
76218,밥/죽/떡,초스피드,채소류,비빔,None,None,None,None,None,None,None,[],,[]
76219,밥/죽/떡,초스피드,채소류,비빔,10분만에 만드는 초스피드 비빔밥,비빔밥,https://recipe1.ezmember.co.kr/cache/recipe/2020/05/11/5bfd1ff95ba561af3f746ce78c51d6bb1.jpg,"1,861",10분 이내,아무나,2인분,"[('식용유', ''), ('다진파', ''), ('버섯', '넉넉히'), ('쥬키니호박', '1/2'), ('당근', '1개'), ('마늘', '2쪽'), ('시금치', '80g'), ('달걀', '3개'), ('소금', '1꼬집'), ('간장', '1TS'), ('고추장', '1TS'), ('참기름', '1ts'), ('다진 돼지고기', '100g'), ('설탕', '1/2TS'), ('간장', '1TS'), ('후추', '약간')]","10분만에 만드는 초스피드 비빔밥 레시피입니다.
너무 쉽고 간단해서 깜짝 놀라실걸요?
이제 번거롭게 재료 하나씩 볶지 말고 간단하게 한번에 만들어서 드세요!","[{'step_number': 1, 'description': '모든 채소를 적당한 크기로 슬라이스한다.', 'image_url': None}, {'step_number': 2, 'description': '팬에 기름을 두르고 파를 살짝 볶다가 모든 재료를 한번에 다 넣고 볶는다.', 'image_url': None}, {'step_number': 3, 'description': '소금과 간장을 넣고 볶는다.', 'image_url': None}, {'step_number': 4, 'description': '밥위에 볶아진 채소를 올리고 계란후라이와 참기름을 넣고 비빈다', 'image_url': None}, {'step_number': 5, 'description': '맛있게 먹는다.', 'image_url': None}]"
76220,밥/죽/떡,초스피드,채소류,비빔,우아한 혼밥 - 내 맘대로 비빔밥,비빔밥,https://recipe1.ezmember.co.kr/cache/recipe/2020/07/17/bf7e1c1fa966a0e1d8f9256f6a1caa0f1.jpg,422,15분 이내,아무나,1인분,"[('냉장고속채소', '약간'), ('상치 등 텃밭 채소', '약간'), ('계란', '1개'), ('고추장', '3큰술'), ('참기름', '1큰술'), ('설탕', '1.5-2큰술'), ('깨 가루', '1작은술')]","한 놈은 나가고 한 놈은 주무시는 늦은 오후, 종일 굶은 뱃속에선 뭘 좀 먹자는 요청이 들어 온다. 이미 7킬로의 살을 사재기 하듯 몸 여기 저기에 과다 저장해 놓았기 때문에 며칠은 쉬어도 충분히 될 법한데도 말이다.

혼자 먹자고 뭘 하기도 그렇고 라면이나 먹을까 생각하며 뒷마당을 내려다 보고 섰노라니 올 여름 직접 씨 뿌려 놓은 적상치가 눈에 들어 온다. 또 냉장고를 뒤져 보니 까 놓은 양파 반개와 몽당 연필 같은 당근 한 쪼가리, 그리고 한 뼘도 안 되는 애 호박 하나가 있다.

그래! 결심했어!!
냉장고에서 뒤져낸 몽당 채소들을 채 쳐 볶고 텃밭에 나가 상치, 겨자 잎, 깻 잎, 치커리 등을 조금 조금 거둬 들여 비빔밥을 만들기로 했다.

우리 집은 평소에도 꼭 식판을 깔고 아무리 허접한 찬이라도 꼭 통에서 덜어 예쁜 접시에 담아 놓고 먹지만 나 혼자 먹을 땐 가끔 덜어 놓은 김치 통이나 작은 반찬 통을 통째 놓고 먹는 일이 있다. 특히 라면을 먹을 때 그러는데 먹으면서도 참 교양 없네 하는 생각을 하며 먹는다..ㅜㅜ

한 숟갈 분량의 야채 세 가지를 썰고 볶는데 10분이면 충분하다. 맛 있게 비빔 고추장 만들어 나를 위한 혼 밥을 준비한다.
잠깐의 귀차니즘만 극복하면 혼밥도 우아해 진다.
라면 끓여 아무케나 먹을 뻔한 오늘의 점심은 내 맘대로 비빔밥~","[{'step_number': 1, 'description': '자투리 채소 (호박,당근, 양파 등)는 채 썰어 소금간 살짝 해서 볶아 준다.', 'image_url': 'https://recipe1.ezmember.co.kr/cache/recipe/2020/07/17/cebeb0cde43092e1572137552838c6411.jpg'}, {'step_number': 2, 'description': '고추장은 분량의 재료를 섞어 준비한다.', 'image_url': 'https://recipe1.ezmember.co.kr/cache/recipe/2020/07/17/b09471264394765195c7aa22571a002c1.jpg'}, {'step_number': 3, 'description': '밥 위에 계란 프라이 하나를 얹고 나머지 재료를 올린다.', 'image_url': 'https://recipe1.ezmember.co.kr/cache/recipe/2020/07/17/3b4631190146b4b586417d7d67e318fb1.jpg'}, {'step_number': 4, 'description': '밥이나 계란이 한 김 빠진 후에 야채를 채 썰거나 적당한 크기로 뜯어 넣고 비벼 준다.', 'image_url': 'https://recipe1.ezmember.co.kr/cache/recipe/2020/07/17/7a6fa5955ea4ea61c57c445f089745be1.jpg'}]"
76221,밥/죽/떡,초스피드,채소류,비빔,나물비빔밥 양푼비빔밥 건강한 한끼,나물비빔밥,https://recipe1.ezmember.co.kr/cache/recipe/2020/07/03/cc66561acf0ba38e060228f7f7dbee291.jpg,"5,177",20분 이내,초급,3인분,"[('시금치', '1단'), ('간마늘', '1T'), ('소금', '톡톡'), ('참기름', '1T'), ('들기름', '1T'), ('고사리', ''), ('파', '1대'), ('국간장', '1.5T'), ('소금', '톡톡'), ('간마늘', '1T'), ('콩나물', '1봉지'), ('소금', '톡톡'), ('참기름', '1T'), ('간마늘', '1T'), ('채썬무', '1/3개'), ('소금', '1T'), ('식초', '2T'), ('설탕', '1T'), ('참기름', '1T'), ('간마늘', '1T'), ('고추가루', '1T')]","비빔밥 다들 좋아라하시나요?

나물이나 채소종류를 너무나 좋아하는 꽃줌마는 최애 음식이 나물 가득 들어간 비빔밥인데요~

콩나물 천원, 시금치 천원, 고사리 삼천원

저렴하게 사서 집에서 언능 나물 무치고 볶아서 맛있는 비빔밥해서 양푼에 슥슥 비벼 배터지게 먹었는데요~

비빔밥은 언제먹어도 사랑이네요

나물 듬뿍 들어간 나물비빔밥

사실 요리하는데 한시간 걸렸는데요

이정도 시간이면 사먹는거보다 집에서 해먹는게 더 비용적이나 맛부분에서도 개이득 아닌가 생각해봅니다

지금부터 비빔밥 만들러 가봅시다!!!!","[{'step_number': 1, 'description': '시금치는 깨끗하게 다듬어서 씻어주시고\n끓는물에 소금 한숟가락 넣어서 데쳐주세요\n오래 데칠필요는 없고 살짝 넣었다 뺀다는 느낌으로\n데친 시금치는 찬물샤워 후\n꼬옥 짜서 물기를 제거해주시면 된답니다', 'image_url': 'https://recipe1.ezmember.co.kr/cache/recipe/2020/07/03/43e33f4c524220d924370fa9c8529afd1.jpg'}, {'step_number': 2, 'description': '물기를 짠 시금치에 소금,간마늘,참기름을 넣고 조물조물 무쳐주시면 시금치무침은 완성입니다\n참 쉽죠~\n통깨 뿌리셔도 되고\n파를 다져서 넣으셔도 좋습니다', 'image_url': 'https://recipe1.ezmember.co.kr/cache/recipe/2020/07/03/c15ff5ad905a428f3acc06aa2209e0771.jpg'}, {'step_number': 3, 'description': '불린 고사리를 깨끗한물에 여러번 헹궈주시고 채반에 받쳐 물기를 제거해주세요~\n물기를 제거한 고사리는 적당한 크기로 썰어주시구요!', 'image_url': 'https://recipe1.ezmember.co.kr/cache/recipe/2020/07/03/913bd4d8bff5d30aefa154494acb18001.jpg'}, {'step_number': 4, 'description': '후라이팬에 들기름을 두르고 간마늘1T와 다진파를 넣고 볶아주다가 향이 올라오면 썰어둔 고사리를 넣고 볶아주세요~', 'image_url': 'https://recipe1.ezmember.co.kr/cache/recipe/2020/07/03/455c5a4bec7e8a2f188712c7d6aeb1fe1.jpg'}, {'step_number': 5, 'description': '볶은 고사리에 물반컵을 넣어서 국물이 자작하게 해주시고~ 간장과 소금으로 간을 맞춰주세요\n간장으로만 간하셔도 되요', 'image_url': 'https://recipe1.ezmember.co.kr/cache/recipe/2020/07/03/b6d35082cdc7de396b1faa0c9cb812471.jpg'}, {'step_number': 6, 'description': '자글자글하게 끓이면서 푹 익혀주시면 됩니다\n고사리나물볶음 완성!', 'image_url': 'https://recipe1.ezmember.co.kr/cache/recipe/2020/07/03/ee4948bb242cf09f9f15bf2486eced4d1.jpg'}, {'step_number': 7, 'description': '냄비에 콩나물을 삶아주세요!\n뭐\n특별한 기술은 없습니다\n그냥 삶아주시면 됩니다', 'image_url': 'https://recipe1.ezmember.co.kr/cache/recipe/2020/07/03/b4ffb868cdd247bdc3a473032a082a5b1.jpg'}, {'step_number': 8, 'description': '삶은 콩나물을 차가운물에 한번 헹궈주세요\n그리고 채반에 받쳐 물기를 제거해주시면 되는데요\n물기를 제거한 콩나물에\n다진파, 간마늘, 소금, 참기름을 넣어서 조물조물 무쳐주세요\n고추가루넣어도 괜찮아요 :D', 'image_url': 'https://recipe1.ezmember.co.kr/cache/recipe/2020/07/03/fa07031147a1945354e0177e21202fc91.jpg'}, {'step_number': 9, 'description': '무를 가늘게 채 썰어서 소금을 뿌려서 절여두세요\n물기가 쭉 빠지면 무를 꼬옥 짜서\n물기를 마저 제거해주시면 된답니다', 'image_url': 'https://recipe1.ezmember.co.kr/cache/recipe/2020/07/03/ecbaa00af991c8176bdfd0ac653599171.jpg'}, {'step_number': 10, 'description': '물기를 짠 무채에 고추가루, 간마늘, 설탕, 식초를 넣고 조물조물 무쳐주세요~\n새콤달콤한 무생채가 완성됩니다\n무는 집에 있어서 비용이 안들었어요 :D\n집에 있는 재료를 활요해서 만드는것도 중요하죠', 'image_url': 'https://recipe1.ezmember.co.kr/cache/recipe/2020/07/03/5aa71f11160ca5c4ce45450ca9eeef241.jpg'}, {'step_number': 11, 'description': '짜잔, 네가지 나물 준비 완료!!\n사실 한시간밖에 안걸렸어요ㅋㅋㅋ\n사진찍고 난리부르스쳐서 오래걸릴줄 알았는데\n금방 끝나네요', 'image_url': 'https://recipe1.ezmember.co.kr/cache/recipe/2020/07/03/fa6f63c6f410429a8be9432e184a8c8f1.jpg'}, {'step_number': 12, 'description': '후라이팬에 기름을 두르고 계란후라이 해주세요!\n계란후라이 필수지요 :D', 'image_url': 'https://recipe1.ezmember.co.kr/cache/recipe/2020/07/03/ca8b51d0bc9636f4221aadc773ae7c9d1.jpg'}, {'step_number': 13, 'description': '양푼에 밥을 넣고 나물을 올려주세요\n듬뿍 듬뿍\n밥보다 나물이 더 많았다는건 안비밀입니다ㅋ\n진짜 나물 비빔밥 너무너무 좋아요', 'image_url': 'https://recipe1.ezmember.co.kr/cache/recipe/2020/07/03/c675267fba7ba5a00311aaa59b4a0eba1.jpg'}, {'step_number': 14, 'description': '계란후라이도 올리고\n거기에 돌자반까지 올리면 최고지요\n완전 진짜 너무너무 맛있었어요\n돌자반도 듬뿍 올려줍니다\n김가루도 좋아요!!', 'image_url': 'https://recipe1.ezmember.co.kr/cache/recipe/2020/07/03/e1e9f14d82bdb1f992730f3147bfe0cb1.jpg'}, {'step_number': 15, 'description': '맛있는 고추장도 한숟가락 듬뿍 떠서 올려주는데요~ 참기름도 한바퀴 둘러도 너무너무 좋지요\n고추장이 맛있어서 비비니까 꿀맛이네요', 'image_url': 'https://recipe1.ezmember.co.kr/cache/recipe/2020/07/03/eab1f5ad1e0d42a3ae4717cac5fae3221.jpg'}, {'step_number': 16, 'description': '나물 듬뿍넣어 만든 비빔밥 나물비빔밥\n으헤헤헤헹\n슥슥 비벼서 먹으니까 너무 맛있어요', 'image_url': 'https://recipe1.ezmember.co.kr/cache/recipe/2020/07/03/efcd0d2f50015e3fd561bc604ed182b01.jpg'}]"
76222,밥/죽/떡,초스피드,채소류,비빔,초간단 새싹 비빔밥,새싹비빔밥,https://recipe1.ezmember.co.kr/cache/recipe/2023/09/04/ce0822b1d8d3467cfb7669aa1f5f98ab1.jpg,563,5분 이내,아무나,2인분,"[('밥', '2공기'), ('계란', '2개'), ('올리브 오일', '조금'), ('모듬새싹', '가득'), ('고추장', '2큰술'), ('참기름', '넉넉히'), ('깨', '조금')]",초간단 새싹 비빔밥을 만들어 맛있게 먹어 볼게요,"[{'step_number': 1, 'description': '기름을 두른 프라이팬에 계란 후라이를 해주세요', 'image_url': 'https://recipe1.ezmember.co.kr/cache/recipe/2023/09/04/d1555d8ffa182c15a3b8f6d67923bf271.jpg'}, {'step_number': 2, 'description': '밥을 1공기 넓은 볼에 담아 주세요', 'image_url': 'https://recipe1.ezmember.co.kr/cache/recipe/2023/09/04/f5455d9aecbd0d52aeb4fc6a7a02059f1.jpg'}, {'step_number': 3, 'description': '밥 위에 계란 후라이를 올려 주세요', 'image_url': 'https://recipe1.ezmember.co.kr/cache/recipe/2023/09/04/323155b27b22fda255ea16a16ef4e4db1.jpg'}, {'step_number': 4, 'description': '새싹을 가득 올리고 고추장 1큰술', 'image_url': 'https://recipe1.ezmember.co.kr/cache/recipe/2023/09/04/5d7ce5e3d00606bd749ce794a8f6d1d91.jpg'}, {'step_number': 5, 'description': '참기름을 둘러주고 깨로 마무리~', 'image_url': 'https://recipe1.ezmember.co.kr/cache/recipe/2023/09/04/1cfb3b31f8460c48d0e6463f27fc865f1.jpg'}, {'step_number': 6, 'description': '초간단 새싹 비빔밥이 완성 되었습니다', 'image_url': 'https://recipe1.ezmember.co.kr/cache/recipe/2023/09/04/d18f8d0915fc05e48722cd685c6798811.jpg'}, {'step_number': 7, 'description': '슥슥 비벼서 맛있게 ^^ 초간단 레시피로 맛있는 식사 하세요', 'image_url': 'https://recipe1.ezmember.co.kr/cache/recipe/2023/09/04/f88398c881650c495c269a27d40f8e141.jpg'}]"
76223,밥/죽/떡,초스피드,채소류,비빔,알토란 5분 콩나물밥 양념장 초간단 레시피 찬밥 feat. 전자레인지,콩나물밥,https://recipe1.ezmember.co.kr/cache/recipe/2023/10/07/7b11764c61664fe16f517ae85ee1e05b1.jpg,"1,733",5분 이내,아무나,2인분,"[('밥', '1공기'), ('돼지고기 다짐육', '100g'), ('콩나물', '150g'), ('간장', '3T'), ('설탕', '1/2T'), ('맛술', '3T'), ('통깨', '1T'), ('참기름', '1T'), ('마늘', '1/2T'), ('양파', '1/2개'), ('청양고추', '1개'), ('홍고추', '1/2개')]",찬밥과 남은 콩나물만 있으면 5분 만에 완성되는 초간단 한그릇요리!!,"[{'step_number': 1, 'description': '그릇에 찬밥 1공기를 담고 밥 위에 씻은 콩나물 150g을 올린 후 랩을 씌워 구멍을 낸 뒤 전자레인지에 5분간 돌린다. * 물을 넣지 않아도 찬밥을 데움과 동시에 콩나물도 데치는 방법', 'image_url': 'https://recipe1.ezmember.co.kr/cache/recipe/2023/10/08/eb232781ed836d17c768fb920bde33051.jpg'}, {'step_number': 2, 'description': '청양고추 1개, 홍고추 1/2개를 다진다.', 'image_url': 'https://recipe1.ezmember.co.kr/cache/recipe/2023/10/08/aed9de04ce204fca551041e39a2392e11.jpg'}, {'step_number': 3, 'description': '양파 1/2개를 다진다.', 'image_url': 'https://recipe1.ezmember.co.kr/cache/recipe/2023/10/08/87d692dbb41ff646d20306dfc856e6ec1.jpg'}, {'step_number': 4, 'description': '그릇에 다진 청양고추, 홍고추를 담고, 다진 마늘 1/2T, 간장 3T, 맛술 3T, 설탕 1/2T, 통깨 1T, 참기름 1T를 넣고 섞는다.', 'image_url': 'https://recipe1.ezmember.co.kr/cache/recipe/2023/10/08/d43ad2e20883e59137e4f7869e314d201.jpg'}, {'step_number': 5, 'description': '다진 돼지고기 100g에 양념장 3을 넣고 볶다가 물 2T를 넣고 익을 때까지 볶는다. * 식용유를 넣지 않아도 돼지고기에서 나오는 기름을 활용, 물을 넣으면 고기의 연육 작용 효과가 있어 부드럽게 익힐 수 있음', 'image_url': 'https://recipe1.ezmember.co.kr/cache/recipe/2023/10/08/b9b892a6a288e699f629397f3deed6981.jpg'}, {'step_number': 6, 'description': '전자레인지에 익힌 콩나물과 밥을 잘 섞은 뒤 돼지고기 볶음장을 올려내면 초간단 콩나물밥이 완성된다.', 'image_url': 'https://recipe1.ezmember.co.kr/cache/recipe/2023/10/08/1e493ca4f3c08c7e64af9e3d0adcd2e01.jpg'}]"
