index,종류별,상황별,재료별,방법별,글 제목,레시피이름,레시피이미지,조회수,조리시간,난이도,인분,재료,소개글,조리순서
79512,밥/죽/떡,영양식,채소류,볶음,고소한 케일쌈밥과 진저잼 넣은 두부 강된장,케일쌈밥,https://recipe1.ezmember.co.kr/cache/recipe/2023/08/15/88a66560115af0cd5ea95d2e66b74f211.jpg,341,30분 이내,아무나,1인분,"[('재래식 된장', '1.5스푼'), ('고춧가루', '1스푼'), ('두부', '1/4모'), ('진저잼', '1티스푼'), ('양파', '1/4개'), ('파', '1/4'), ('호박', '30g'), ('마늘', '1톨'), ('청양고추', '1개'), ('물', '1/4컵'), ('케일', '10장'), ('현미밥', '1공기')]","자투리 채소들과 두부 잘게 다져 된장과 볶아주면 짜지 않고 맛있는 강된장이 되지요. 밥에 강된장을 올리고 찐 케일로 감싸 촉촉하고 고소한 케일쌈밥, 건강하게 드세요.","[{'step_number': 1, 'description': '두부는 물기를 제거한 후 으깨준다.볼 , 포크', 'image_url': 'https://recipe1.ezmember.co.kr/cache/recipe/2023/12/13/77d4b302287fcc533b2ee5cc56501a4a1.jpg'}, {'step_number': 2, 'description': '깨끗하게 세척한 케일은 쪄낸 후 식혀둔다.※ 전자레인지용 찜기 사용함.내열용기 , 전자레인지', 'image_url': 'https://recipe1.ezmember.co.kr/cache/recipe/2023/12/13/77de690b724b92e6e9e2db2e1cee07551.jpg'}, {'step_number': 3, 'description': '양파, 파, 호박, 청양고추, 마늘을 잘게 다져준다.도마 , 조리용나이프', 'image_url': 'https://recipe1.ezmember.co.kr/cache/recipe/2023/12/13/83059e3506287599c174e47f75f1e69b1.jpg'}, {'step_number': 4, 'description': '참기름 1스푼을 넣고 다진 야채를 넣어 볶아준다.냄비 , 요리스푼', 'image_url': 'https://recipe1.ezmember.co.kr/cache/recipe/2023/12/13/716fbf3a571c7236b95125d3f28b94c51.jpg'}, {'step_number': 5, 'description': '호박이 어느 정도 익으면 다진 두부를 넣고 볶는다.', 'image_url': 'https://recipe1.ezmember.co.kr/cache/recipe/2023/12/13/77681d92b7dd7fc93101c7fc17261d501.jpg'}, {'step_number': 6, 'description': '된장, 고춧가루, 진저잼을 넣고 잘 섞어준다.', 'image_url': 'https://recipe1.ezmember.co.kr/cache/recipe/2023/12/13/c8b2e646b17380976b4143a05549a0dd1.jpg'}, {'step_number': 7, 'description': '물을 넣고 되직해질때까지 졸여준다.', 'image_url': 'https://recipe1.ezmember.co.kr/cache/recipe/2023/12/13/1164cb5fb24250cb3f3295933146cd351.jpg'}, {'step_number': 8, 'description': '뒷면이 보이게 케일을 놓는다.', 'image_url': 'https://recipe1.ezmember.co.kr/cache/recipe/2023/12/13/97494878043cfa6e34ed2a5cc7ac041b1.jpg'}, {'step_number': 9, 'description': '현미밥을 올리고 케일 잎에 올리고 강된장 1/3 티스푼을 밥 위에 올린다.강된장의 짠맛에 따라 양을 조절하고 쌈밥 안에는 적게 넣은 후 먹을 때 쌈밥 위에 강된장을 추가해서 먹는다.', 'image_url': 'https://recipe1.ezmember.co.kr/cache/recipe/2023/12/13/f59ecfe2c4e355d5b42b907719a35ab01.jpg'}, {'step_number': 10, 'description': '줄기 부분을 접어 올리고 케일 잎으로 밥을 한 번 말아주고, 옆면으로 밥이 나오지 않도록 양쪽 옆면의 케일을 접어 올린다.', 'image_url': 'https://recipe1.ezmember.co.kr/cache/recipe/2023/12/13/11ceed0e039f7129e00760bbd9d24cdb1.jpg'}, {'step_number': 11, 'description': '그대로 돌돌 말아 케일쌈밥 을 완성한다.', 'image_url': 'https://recipe1.ezmember.co.kr/cache/recipe/2023/12/13/7dd929e5f377b0be1ef8caed86cc79361.jpg'}]"
79513,밥/죽/떡,영양식,채소류,볶음,영양 가득 애호박야채볶음밥,애호박야채볶음밥,https://recipe1.ezmember.co.kr/cache/recipe/2020/09/19/610bfe07267ca91244f162f30a60fe741.png,"2,621",20분 이내,초급,1인분,"[('밥', '1공기'), ('당근', '20g'), ('애호박', '50g'), ('양파', '1/4개'), ('계란', '1개'), ('굴소스', '1.5T'), ('참기름', '1T'), ('소금', '1꼬집'), ('후추', '적당량'), ('식용유', '2T')]",애호박을 메인으로 야채를 넣어 볶음밥을 만들어 봤어요~ 아이들 및 온 가족이 함께 먹기 좋은 요리입니다.,"[{'step_number': 1, 'description': '당근을 잘게 다져주세요.', 'image_url': 'https://recipe1.ezmember.co.kr/cache/recipe/2020/09/19/2498cdac9198ba74c002f82b2a5591eb1.jpg'}, {'step_number': 2, 'description': '양파를 잘게 다져주세요.', 'image_url': 'https://recipe1.ezmember.co.kr/cache/recipe/2020/09/19/c31e2959d6c0042b58e569aa3fedb5241.jpg'}, {'step_number': 3, 'description': '애호박은 먹기 좋은 크기로 채썰어 준비해주세요.', 'image_url': 'https://recipe1.ezmember.co.kr/cache/recipe/2020/09/19/5b21a97489a979d914b5a0e0025dea1b1.jpg'}, {'step_number': 4, 'description': '프라이팬에 식용유를 두르고 중불에서 당근, 양파, 애호박을 넣어주고 소금, 후추를 넣어 밑간 한 뒤 볶아주세요.', 'image_url': 'https://recipe1.ezmember.co.kr/cache/recipe/2020/09/19/fffefaaecabde292a92e040bf101a6e51.jpg'}, {'step_number': 5, 'description': '야채 표면이 노릇해지면 팬 가운데에 계란을 넣고 스크럼블 하듯이 볶아준 뒤 야채와 함께 섞어 볶아주세요.', 'image_url': 'https://recipe1.ezmember.co.kr/cache/recipe/2020/09/19/01c896ccf176aa20448d49999dc3a7ff1.jpg'}, {'step_number': 6, 'description': '계란이 다 익으면 밥 한공기를 넣고 굴소스를 넣어 볶아주세요.골고루 볶아주신 뒤 간을 보시고 싱거울 땐 굴소스를 조금 더 넣어주세요.', 'image_url': 'https://recipe1.ezmember.co.kr/cache/recipe/2020/09/19/a0e8c1cc9dd903030a6ba10b4b769cff1.jpg'}, {'step_number': 7, 'description': '야채와 밥이 골고루 볶아지면 불을 끄고 참기름을 둘러 섞어주면 완성입니다.', 'image_url': 'https://recipe1.ezmember.co.kr/cache/recipe/2020/09/19/dc607304f9c9d31ac3b862a4220145f11.jpg'}]"
79514,밥/죽/떡,영양식,채소류,볶음,솔여시의 211김밥과 계란국 맛있게 만들기,김밥,https://recipe1.ezmember.co.kr/cache/recipe/2016/09/22/641cfa5335352427e50b901eb3d3fcc01.jpg,"5,928",30분 이내,아무나,2인분,"[('밥', '1공기'), ('김', '3장'), ('애호박', '53g'), ('노랑파프리카', '44g'), ('양파', '36g'), ('데친 양배추', '59g'), ('홍파프리카', '26g'), ('구운전지불고기', '62g'), ('총각김치', '50g'), ('참기름', '1/2T'), ('천연가루                                                                                또는 후리카게 등', '1/2T'), ('후추', '약간'), ('소금', '1꼬집'), ('육수', '500ml'), ('계란', '1개'), ('쫑썬대파', '2꼬집'), ('천연가루                                                                                또는시판용', '1/4T'), ('소금', '1/4T'), ('설탕', '1/2꼬집')]","다이어트를 시작하고 식단을 조정하면서 이왕이면 좀 더 건강하게 식단을 조절해보자 해서
여기저기 인터넷 검색을 하니 요즘 211식사법 캠페인을 하더라고요^^
211식사란 야채 2 : 곡류 1 : 육류 1에 비율로 식사를 하는 건데요^^
이게 생가가만큼 쉬지가 않네요^^..... 딱 보기에는 뭐 그냥 야채 많이 먹고 거기에 밥이랑 고기 조금 먹음 되겠네~ 그. 러. 나 절대로 그런 게 아니더라 이거지요^^... ㅋㅋㅋ
글타고 제가 뭐 그걸 정확히 하고 있다는 건 아니고요^^..... 하려고 노력은 하지요^^
근데 김밥이 의외로 요 211식사 법을 맞추기가 수월하네요^^ 그래서 제 스스로 211김밥이라 명명하고 
만들어본 김밥이네요^^","[{'step_number': 1, 'description': '속 재료는 보통 김밥에 들어가는 거랑은 좀 다른데요^^\n이 야채들은 먹을 사람이 좋아하는 야채로 대체하심 좋겠고요^^... 이제 정답은 아니에요^^\n그리고 고기가 62g인데요^^.... 밥 한 공기랑 열량이 엇비슷할 것 같네요^^\n모든 야채들은 채를 쳐서 준비해주세요^^', 'image_url': 'https://recipe1.ezmember.co.kr/cache/recipe/2016/09/22/684ab9da6c27f6a9ec8699d2f7b3ac911.jpg'}, {'step_number': 2, 'description': '물론 요 총각김치도 채쳐주세요^^', 'image_url': 'https://recipe1.ezmember.co.kr/cache/recipe/2016/09/22/839110b59eb8bce243c6970f4deee69a1.jpg'}, {'step_number': 3, 'description': '데친 양배추와 충각 김치만 빼고 나머지 야채들은 물볶음 할 건데요^^\n물과 맛술을 2 : 1비율로 희석한 물로 채 썬 야채들을 한 팬에 몽창 넣고 \n후추와 소금만 넣고 볶아주세요^^', 'image_url': 'https://recipe1.ezmember.co.kr/cache/recipe/2016/09/22/f7cf5e9669feb87705823628560b44461.jpg'}, {'step_number': 4, 'description': '그리고 체에 밭쳐 여분에 수분도 빼주세요^^..야채에 수분을 빼는 동안', 'image_url': 'https://recipe1.ezmember.co.kr/cache/recipe/2016/09/22/f99c3efa041226993be892e12080c73f1.jpg'}, {'step_number': 5, 'description': '고기를 팬에 최대한 수분이 없게끔 해소 볶아주세요^^', 'image_url': 'https://recipe1.ezmember.co.kr/cache/recipe/2016/09/22/d4ee3d35b6f2760b94dfec736fc480d11.jpg'}, {'step_number': 6, 'description': '밥은 한 공기를 준비했고요^^', 'image_url': 'https://recipe1.ezmember.co.kr/cache/recipe/2016/09/22/f8a329a3d05d129f82cd6746cec0181f1.jpg'}, {'step_number': 7, 'description': '거기에 참기름과 천연가루 저는 제 천연가루를 사용했는데요^^\n요즘은 후리카게도 좋은거 많고 부꾸시 아니 부꾸미던가..... 아님 마트에 가심 아이들 밥 비벼주는 믹서 가루들 있잖아요^^\n그거 넣으셔도 돼요^^..... \n이렇게 넣고', 'image_url': 'https://recipe1.ezmember.co.kr/cache/recipe/2016/09/22/1d47516e5bcc6a43c63c2f9b84d692ab1.jpg'}, {'step_number': 8, 'description': '잘 비벼 석어주세요^^.... 요고만 먹었는데 갓 지은 밥이라 꼬소하고 달큰하고 \n그렇더라구요^^', 'image_url': 'https://recipe1.ezmember.co.kr/cache/recipe/2016/09/22/f741c2256b4d8de1b0b5a509d8d5cfbb1.jpg'}, {'step_number': 9, 'description': '김은 3장을 준비했는데요^^\n저는 김밥은 두 줄 말 건데요^^...... 한 장은 반 갈라 사진처럼 밥 위에 놓고 그 위에 김밥 속을 넣을 거예요^^\n요로케 준비한 재료들을 넣고 똘똘 말아주면~^^', 'image_url': 'https://recipe1.ezmember.co.kr/cache/recipe/2016/09/22/077259fd52e56c5ea74d88290bda4aea1.jpg'}, {'step_number': 10, 'description': 'ㅎㅎ 분명 211인데 왜 이리 밥이 많아보이지...ㅋㅋ\n요로케 말아지는 거예요^^..... 모양은 안 이쁘지만 그래도 아주 건강한 김밥이 완성되었어요^^\n근데 이것만 먹음 목막히잖아요^^\n그래서 아주 건강한 계란국도 함게 끓여보아요^^', 'image_url': 'https://recipe1.ezmember.co.kr/cache/recipe/2016/09/22/e4b8f25f748b554e0111e0042eac9fff1.jpg'}, {'step_number': 11, 'description': '저는 늘 아침마다 다시육수를 끓여 놓는데요^^\n이제 아시는 분들은 아실 거예요^^\n제 육수는 물 3L에 다시마 다시멸치 말린표고 대파뿌리를 넣고 끓인 육수라는거~....\n그 육수 500ml에 사진처럼 쳔연가루 소금 1/4T씩 넣고 설탕은 반꼬집만 넣어주세요^^\n요 설탕이 계란에 비릿한 맛을 잡아줄거예요^^\n그리고 국물이 팔팔 끓으면 따로 풀어놓은 계란을 가만히 넣어주세요^^', 'image_url': 'https://recipe1.ezmember.co.kr/cache/recipe/2016/09/22/6f5104f7b0846a23ff90f3e61098267a1.jpg'}, {'step_number': 12, 'description': '그리고 여기서 뽀인뚜 계란을 넣고 절대로 젓지 마세요^^\n그럼 가란 이 다 깨져서 지져분하게 가루가 돼요^^\n이렇게 우르를 하면 블을 끄시고 쫑썬 대파를 두꼬집정도 휘릭 뿌려', 'image_url': 'https://recipe1.ezmember.co.kr/cache/recipe/2016/09/22/7a94529b5bf694017efe55651adc61f21.jpg'}, {'step_number': 13, 'description': '요레 차려내시면 아주 건강한 211김밥 한 상이 차려졌네요^^\n모두 건강한 식사하시고 활기찬 하루들 되세요^^', 'image_url': 'https://recipe1.ezmember.co.kr/cache/recipe/2016/09/22/c1727c8ec3b38282c7dba0cf9a07cd2e1.jpg'}]"
79515,밥/죽/떡,영양식,채소류,볶음,파프리카볶음밥도리아,파프리카볶음밥도리아,https://recipe1.ezmember.co.kr/cache/recipe/2017/09/22/e0b63262e0d410c1225a9c6107b6d3111.png,"1,085",15분 이내,아무나,3인분,"[('빨강 파프리카', '1개'), ('주황 파프리카', '1개'), ('노랑 파프리카', '1개'), ('밥', '3공기'), ('양파', '1개'), ('호박', '1/3개'), ('새우살                                                                                껍질을 벗긴 잔새우', '1컵'), ('식용유', '적당량'), ('굴소스', '2큰술'), ('모짜렐라 치즈', '100g'), ('소금', '약간'), ('후춧가루', '약간')]","색색의 파프리카볶음밥을 파프리카를 그릇삼아 담아낸 ""파프리카볶음밥도리아""
파프리카 볶음밥 위에 치즈를 듬~뿍 뿌려 노릇하게 구워내면, 아이들뿐만 아니라 남녀노소 누구나 좋아하는 볶음밥이 완성!!","[{'step_number': 1, 'description': '깨끗이 씻은 양파와 호박은 사방 0.5cm 크기의 주사위 모양으로 자른다.', 'image_url': 'https://recipe1.ezmember.co.kr/cache/recipe/2017/09/22/7e909c16a3083965a71db4011f3fbc191.png'}, {'step_number': 2, 'description': '파프리카는 반을 갈라 씨를 털어낸 후 각각 1/3에 해당하는 분량은 1과 같은 크기로 자른다.', 'image_url': 'https://recipe1.ezmember.co.kr/cache/recipe/2017/09/22/9573876030fca4d10f7cffcac7365c351.jpg'}, {'step_number': 3, 'description': '새우는 찬물에 흔들어 씻어 체에 밭쳐 물기를 털어낸다.', 'image_url': None}, {'step_number': 4, 'description': '달군 팬에 식용유를 두르고 양파를 넣어 볶다가 손질한 새우를 넣어 볶는다.\n새우가 어느정도 익으면 호박, 파프리카를 넣어 함게 볶는다.', 'image_url': None}, {'step_number': 5, 'description': '4의 팬에 준비한 밥을 넣고 잘 섞은 후 굴소스를 넣어 양념한 후 소금, 후춧가루로 간을 한다.', 'image_url': None}, {'step_number': 6, 'description': '파프리카 반쪽에 볶은 밥을 가득 채워 담은 후 모짜렐라 치즈를 듬뿍 얹어준다.\n200도로 예열한 오븐에 넣어 치즈가 노릇하게 구워지면 오븐에서 꺼낸다.\n(전자레인지 3-4분 700W기준으로 대체하여도 좋습니다)전자레인지 , 오븐', 'image_url': None}]"
79516,밥/죽/떡,영양식,채소류,볶음,뿌리채소영양밥,뿌리채소밥,https://recipe1.ezmember.co.kr/cache/recipe/2017/11/19/69654ae73c361ffae9edc66e2d44d4d11.jpg,"5,243",30분 이내,아무나,2인분,"[('연근채', '1/4개'), ('도라지채                                                                                또는 우엉채', '50g'), ('당근', '1/4개'), ('느타리버섯', '1/4개'), ('옥수수콘', '20g'), ('쌀', '2컵')]","가을에 제대로 맛과 영양을 갖춘 뿌리채소를 듬뿍 넣고 맛있는 영양밥을 지었습니다.
양념 간장을 곁들여 보양식 같은 뿌리채소영양밥 한그릇 만들어 보세요~!","[{'step_number': 1, 'description': '도라지채, 연근채, 느타리버섯, 당근, 옥수수콘을 준비해요.', 'image_url': 'https://recipe1.ezmember.co.kr/cache/recipe/2017/11/19/cfed7ba6d1015baa1df44c5d9f2c18dc1.jpg'}, {'step_number': 2, 'description': '쌀은 깨끗이 씻어 체에 받쳐 불려주세요.', 'image_url': 'https://recipe1.ezmember.co.kr/cache/recipe/2017/11/19/272898d9fc2ff7bc9b480044981f217d1.jpg'}, {'step_number': 3, 'description': '연근, 도라지,당근, 버섯은 한입크기로 잘게 썰어주세요.', 'image_url': 'https://recipe1.ezmember.co.kr/cache/recipe/2017/11/19/f0da1c60edebd8cc0e0bc1a5043a49681.jpg'}, {'step_number': 4, 'description': '밥솥에 불린쌀을 담고 연근,도라지,당근,버섯,옥수수콘을 올린 후 30분 취사버튼을 눌러주세요.', 'image_url': 'https://recipe1.ezmember.co.kr/cache/recipe/2017/11/19/056b2010f305739dc6628148b06260191.jpg'}, {'step_number': 5, 'description': '양념간장을 만들어 그릇에 담으면 완성입니다.', 'image_url': 'https://recipe1.ezmember.co.kr/cache/recipe/2017/11/19/75d3c3743b0caedc3cbc5fe5b65079eb1.jpg'}]"
79517,밥/죽/떡,영양식,채소류,볶음,당뇨에 좋은 우리밀 짜장 만드는법/고구마 짜장밥,고구마짜장밥,https://recipe1.ezmember.co.kr/cache/recipe/2018/03/16/b18e482094cf4ff0acc151a5af6947501.jpg,"5,021",30분 이내,초급,4인분,"[('돼지고기', '150g'), ('고구마', '1개'), ('당근', '1/2개'), ('양파', '1개'), ('미니 양배추', '3개'), ('콘옥수수', '20g'), ('다진 마늘', '1스푼'), ('기름', '1스푼'), ('짜장가루', '200g'), ('굴소스', '1스푼'), ('청주', '1큰술'), ('소금', '약간'), ('후추', '약간'), ('전분', '3큰술'), ('물', '3큰술')]","국내산 유기농 우리밀을 사용한 우리밀 짜장가루로 만든 고구마 짜장밥이랍니다
감자 대신 고구마를 사용해 달콤한 맛이 나는 짜장밥이랍니다
달콤한 고구마랑 자극적이지 않고 부드러운 짜장이라
아이, 어른 누구나 좋아할 맛의 짜장밥이랍니다^^

가족모두 엄지척한 달콤한 고구마 짜장밥 소개시켜 드릴게요~","[{'step_number': 1, 'description': '재료를 준비해 주세요~', 'image_url': 'https://recipe1.ezmember.co.kr/cache/recipe/2018/03/16/9f74e707a565850ddc066d4370d8bc1c1.jpg'}, {'step_number': 2, 'description': '전문물은 전분과 물 1대 1 동량으로 넣어 잘 풀어 만들어 두고\n돼지고기는 청주, 소금, 후추로 밑간해 잠시 두세요~돼지고기 밑간할때 다진생강 추가해도 좋아요!', 'image_url': 'https://recipe1.ezmember.co.kr/cache/recipe/2018/03/16/865551d3055a2cfdcca4b667980d04131.jpg'}, {'step_number': 3, 'description': '당근, 양파, 고구마, 미니 양배추는\n모두 비슷한 크기로 먹기 좋게 썰어 주세요~', 'image_url': 'https://recipe1.ezmember.co.kr/cache/recipe/2018/03/16/2ff64317b6339ce4d6907b562ed2d5711.jpg'}, {'step_number': 4, 'description': '짜장가루는 물 100ml 넣고 잘 풀어 두세요~', 'image_url': 'https://recipe1.ezmember.co.kr/cache/recipe/2018/03/16/e41117b9be267d396d567c22656523671.jpg'}, {'step_number': 5, 'description': '팬이 뜨거워지면 다진 마늘을 넣고 볶아 마늘향을 내 주고\n돼지고기, 고구마, 당근, 양파, 미니 양배추 순으로 넣어 볶아 주세요~', 'image_url': 'https://recipe1.ezmember.co.kr/cache/recipe/2018/03/16/de099640903a5a3e52f332f385930e151.jpg'}, {'step_number': 6, 'description': '물 700ml를 부어 채소가 완전히 익도록 끓여 주세요~', 'image_url': 'https://recipe1.ezmember.co.kr/cache/recipe/2018/03/16/8484c3bd52145317a6f750ea8f06b30b1.jpg'}, {'step_number': 7, 'description': '불을 끈 다음 물에 풀어 둔 짜장가루를 넣고 \n볶은 재료와 잘 섞어 주세요~', 'image_url': 'https://recipe1.ezmember.co.kr/cache/recipe/2018/03/16/bdd493800618ac6e2abfa3c95a997acb1.jpg'}, {'step_number': 8, 'description': '불을 다시 켠 후 전분물로 짜장 농도를 맞춰 주세요~', 'image_url': 'https://recipe1.ezmember.co.kr/cache/recipe/2018/03/16/a371ec58064e1cdf258eb9662642e0881.jpg'}, {'step_number': 9, 'description': '굴소스를 1스푼 넣어 2분만 더 볶아 주세요~', 'image_url': 'https://recipe1.ezmember.co.kr/cache/recipe/2018/03/16/f9a06e6147343dd2698d4521730335691.jpg'}, {'step_number': 10, 'description': '맛있는 짜장소스가 완성되었어요~', 'image_url': 'https://recipe1.ezmember.co.kr/cache/recipe/2018/03/16/7f5f63b58fe6ecda06fd603ee162dbdd1.jpg'}, {'step_number': 11, 'description': '그릇에 밥을 담고 짜장소스 담고 콘옥수수 뿌려 내면 \n보기도 먹음직스런 입과 눈이 즐거운 고구마 짜장밥입니다', 'image_url': 'https://recipe1.ezmember.co.kr/cache/recipe/2018/03/16/166194d238de63130e0f4c2927dbf2581.jpg'}]"
79518,밥/죽/떡,영양식,채소류,볶음,건강한 제철재료 한끼_표고버섯무덮밥,표고버섯무덮밥,https://recipe1.ezmember.co.kr/cache/recipe/2020/12/17/5810c8c9b0ee034d1a59051354487dfb1.jpg,810,20분 이내,아무나,1인분,"[('무', '1/4개'), ('표고버섯', '2개'), ('마늘', '5알'), ('들기름', '2큰술'), ('간장', '1큰술'), ('깨', '조금')]",집에 있는 제철재료 무와 표고버섯으로 만든 건강한 한 끼 덮밥입니다.,"[{'step_number': 1, 'description': '무는 채썰어주고 표고버섯도 씻어서 썰어줍니다.', 'image_url': 'https://recipe1.ezmember.co.kr/cache/recipe/2020/12/21/87f104a4adfa505c3da629ff3484dea91.jpg'}, {'step_number': 2, 'description': '후라이팬에 들기름을 두르고', 'image_url': 'https://recipe1.ezmember.co.kr/cache/recipe/2020/12/21/b9126844c14417e83ce029cc953b9eb21.jpg'}, {'step_number': 3, 'description': '무를 넣어서 볶아줍니다.', 'image_url': 'https://recipe1.ezmember.co.kr/cache/recipe/2020/12/21/c7daf3ca5c4bc14c6360375cce7e179c1.jpg'}, {'step_number': 4, 'description': '간장 1큰술 넣어 좀 더 볶다가', 'image_url': 'https://recipe1.ezmember.co.kr/cache/recipe/2020/12/21/5a59339b4dd32276147259efde1b4c381.jpg'}, {'step_number': 5, 'description': '표고버섯을 넣어 볶아줍니다.', 'image_url': 'https://recipe1.ezmember.co.kr/cache/recipe/2020/12/21/6e97109ecfc3b5808e274c2788ff54ae1.jpg'}, {'step_number': 6, 'description': '물을 재료가 잠길만큼 부어주고', 'image_url': 'https://recipe1.ezmember.co.kr/cache/recipe/2020/12/21/0ff8709da803236a43229c1d9366992b1.jpg'}, {'step_number': 7, 'description': '뚜껑닫아서 숨죽이며 익혀줍니다.', 'image_url': 'https://recipe1.ezmember.co.kr/cache/recipe/2020/12/21/e57f732ba15bab7994bdbebafe291b371.jpg'}, {'step_number': 8, 'description': '무가 투명해지면', 'image_url': 'https://recipe1.ezmember.co.kr/cache/recipe/2020/12/21/557b555514003b53ce549baf8fa2f03e1.jpg'}, {'step_number': 9, 'description': '다진마늘과 물을 조금 부어서 좀 더 익혀줍니다.', 'image_url': 'https://recipe1.ezmember.co.kr/cache/recipe/2020/12/21/6581f5473da23b528fc215aca179ec381.jpg'}, {'step_number': 10, 'description': '무가 푹익으면 완성!', 'image_url': 'https://recipe1.ezmember.co.kr/cache/recipe/2020/12/21/d319a3887179f145ffbece03d2f1d4fb1.jpg'}, {'step_number': 11, 'description': '밥 위에', 'image_url': 'https://recipe1.ezmember.co.kr/cache/recipe/2020/12/21/50e21f576d0b925d931605f8ebbfda041.jpg'}, {'step_number': 12, 'description': '볶은 재료를 올려주고 깨뿌리면 완성!!', 'image_url': 'https://recipe1.ezmember.co.kr/cache/recipe/2020/12/21/87ae4b7331fc32b7cfd5606ffcb39db61.jpg'}]"
