index,종류별,상황별,재료별,방법별,글 제목,레시피이름,레시피이미지,조회수,조리시간,난이도,인분,재료,소개글,조리순서
35304,메인반찬,손님접대,닭고기,굽기,오븐구이 치킨,치킨오븐구이,https://recipe1.ezmember.co.kr/cache/recipe/2015/06/08/d578666453996489866e3e903409dafb1.jpg,"37,920",2시간 이상,중급,2인분,"[('닭', '1마리'), ('단호박', '1/2'), ('올리브유', '2'), ('간장', '2'), ('마늘', '1'), ('맛술', '2'), ('허브솔트', '2'), ('양파원액', '2'), ('바질', '1/2'), ('굴소스', ''), ('올리고당', '')]",오븐으로 기름을 쫙 뺀 오븐구이치킨이랍니다.,"[{'step_number': 1, 'description': '닭은 깨끗하게 손질한 후 포크로 사정없이 찔러주었답니다. 그래야 양념이 쏙쏙 잘 베어들기 때문이에요.', 'image_url': 'https://recipe1.ezmember.co.kr/cache/recipe/2015/06/08/bd964b48115eee60e310d043970e263f1.JPG'}, {'step_number': 2, 'description': '허브소금, 바질가루 맛술 양파원액을 넣고 5시간정도 재워두었답니다. 양파원액은 고기요리하는데 넣으니 좋더라구요. 그래서 요즘엔 매실원액보다는 양파원액을 더많이 사용하고 있답니다.', 'image_url': 'https://recipe1.ezmember.co.kr/cache/recipe/2015/06/08/22cf25a6995d840731323120d57ce8a41.JPG'}, {'step_number': 3, 'description': '단호박은 깨끗하게 씻어서 전자렌지에 1분정도 돌려서 준비해 두었답니다. 요거 닭속으로 들어가야 하거든요.전자레인지', 'image_url': 'https://recipe1.ezmember.co.kr/cache/recipe/2015/06/08/cbc0e9518820696bfe68ef8e17538a141.JPG'}, {'step_number': 4, 'description': '재워둔 닭은 한시간에 한번씩 뒤집어 주면서 양념이 쏙쏙 잘 들어갈수 있도록 마사지를 해주었답니다. 톡톡 치고 조물조물 호박은 굽기전에 닭속에 꾹꾹 넣어주었어요.', 'image_url': 'https://recipe1.ezmember.co.kr/cache/recipe/2015/06/08/f123ac7b1796f4c8e29e26759e8fecfc1.JPG'}, {'step_number': 5, 'description': '오븐에 굽기전에 올리브유를 골고루 꼼꼼하게 발라주었답니다. 올리브유를 발라주면 윤기도 살려주고 그리고 올리브유 특유의 향이 있어서 맛을 한결 더 좋게 해준답니다. 오븐기능중에 콤비기능으로 20분을 구워주었어요~', 'image_url': 'https://recipe1.ezmember.co.kr/cache/recipe/2015/06/08/0e750beec669b6308573f2c3bcfd859e1.JPG'}, {'step_number': 6, 'description': '오븐에서 구워지는 사이 중간에 꺼내서 오븐구이에 발라줄 양념을 만들었답니다.', 'image_url': 'https://recipe1.ezmember.co.kr/cache/recipe/2015/06/08/d780ffaf3e7e4ae6e0964c9e4d39907d1.JPG'}, {'step_number': 7, 'description': '20분쯤에서 꺼내서 준비된 간장양념을 골고루 잘 발라주었답니다. 다시 오븐에 넣고 5분정도 더 돌려주면 완성이 된답니다. 준비된 양배추를 바닥에 깔아주고 간장레몬드레싱으로 뿌려준 후에~ 그위에 오븐구이치킨을 올려주었어요.오븐', 'image_url': 'https://recipe1.ezmember.co.kr/cache/recipe/2015/06/08/107f8e6e7f88df5ceaf6ab9b560398171.JPG'}]"
35305,메인반찬,손님접대,닭고기,굽기,로스트치킨,로스트치킨,https://recipe1.ezmember.co.kr/cache/recipe/2018/01/14/b6a513edb22e3796d3774c074720022a1.jpg,"5,078",90분 이내,초급,3인분,"[('닭', '1마리'), ('로즈메리잎', '약간'), ('청주', '2~3큰술'), ('후춧가루', '약간'), ('소금', '조금'), ('각종야채', '적당량'), ('밥', '1공기'), ('굴소스', '2큰술'), ('후춧가루', '약간'), ('참기름', '조금')]",야채볶음밥을 채워 더욱 푸짐한 로스트치킨요리!!,"[{'step_number': 1, 'description': '닭은 어느정도 기름을 제거후에 껍질과 살 사이를 벌린다\n뜨거운 물로 껍질과 살 사이에 부어주고, 안쪽에도 골고루 부어준다 (뜨거운물로 인해서 기름이 녹아 내리고, 구울때 바삭한 껍질을 맛볼수 있다)\n닭은 그릇에 담아 청주, 로즈메리잎, 후춧가루를 뿌려 잠시 재워둔다', 'image_url': 'https://recipe1.ezmember.co.kr/cache/recipe/2018/01/14/40b94d5a559e84e693732baef72a3f411.jpg'}, {'step_number': 2, 'description': '야채는 가늘게 채썰어 후라이팬에 담아 후춧가루, 식용유 넣어 볶다가 밥과 굴소스를 넣어 고루 섞어가며 볶는다\n마지막에 참기름 넣어 섞어준다', 'image_url': 'https://recipe1.ezmember.co.kr/cache/recipe/2018/01/14/4fd1f402c602911f44b5faa916ed4def1.jpg'}, {'step_number': 3, 'description': '오븐팬에 물을 자작하게 붓고, 채망을 얹어 준비한다\n닭 안쪽에 볶음밥을 가득 채운다\n볶음밥 채운 닭은 채망위에 올려 놓고 로즈메리잎을 뿌린후 호일을 덮는다\n예열된 오븐에 넣어 굽는데 호일을 덮어서 30분 구운후, 호일을 벗기고 30분을 굽는다 (처음부터 호일을 덮지 않으면 껍질만 타버리게 된다)오븐', 'image_url': 'https://recipe1.ezmember.co.kr/cache/recipe/2018/01/14/e9ad99f65e38cacf454e6d4e9286eb4d1.jpg'}, {'step_number': 4, 'description': '다 구워지면 접시에 담고 먹기 좋은 크기로 잘라준다\n새해맞이 근사한 식사를 원하거나, 손님이 오셨다거나\n기념일에 특별한 요리를 하고 싶을때 만든다면 더할수 없이 좋은 요리이지요...\n닭은 부드럽고 고소하고, 볶음밥은 졸깃하고 따뜻하게 드실수 있답니다\n기름에 튀기지 않아서 몸에도 물론 참 좋겠죠!!!', 'image_url': 'https://recipe1.ezmember.co.kr/cache/recipe/2018/01/14/8bfb9d41f2b6558c639484f079046a961.jpg'}]"
35306,메인반찬,손님접대,닭고기,굽기,"술안주, 간식, 집에서 에어프라이기로 치킨만들기",치킨,https://recipe1.ezmember.co.kr/cache/recipe/2019/10/13/24433daa6177bed44c3f04dffc042d851.jpg,"5,849",120분 이내,아무나,3인분,"[('닭다리', '10개'), ('우유', '300ml'), ('라면스프', '1/2봉지'), ('매실청', '3T'), ('맛술', '1T'), ('올리브유', '1T'), ('간마늘', '1T')]","#에어프라이기치킨
라면스프로 간단하게 만드는 럽
맛없는게 반칙!","[{'step_number': 1, 'description': '우유에 최소30분정도 재워준뒤 양념재료를 넣고 섞어주세요', 'image_url': 'https://recipe1.ezmember.co.kr/cache/recipe/2019/10/13/4f562027376045dd73113496330a8d121.jpg'}, {'step_number': 2, 'description': '섞어둔 재료를 잠시 냉장고에서 숙성시켜주세요.\n-30분이상.', 'image_url': 'https://recipe1.ezmember.co.kr/cache/recipe/2019/10/13/60e7fd8c5e113fb4021dea951acfb2bd1.jpg'}, {'step_number': 3, 'description': '가지런히 올려놓은후 190도에서 10분간 에어프라이기로 구워주세요.에어프라이어', 'image_url': 'https://recipe1.ezmember.co.kr/cache/recipe/2019/10/13/56668c7cfc3b87fc0b0ee5a74a9d0b6a1.jpg'}, {'step_number': 4, 'description': '고루 익도록 섞어서 바닥에 있던 닭을 위로 올려주세요.\n-다시 190도로 5분간 돌린후 고루 섞어주고 다시 5분간 돌려주세요.', 'image_url': 'https://recipe1.ezmember.co.kr/cache/recipe/2019/10/13/9963c797365856cd3230f6c84d8ce9fb1.jpg'}, {'step_number': 5, 'description': '고루섞어준뒤 온도를 175도로 낮춘후 5분간 속까지 촉촉하게 익도록 한번더 해주세요.\n-다리 하나를 잘라서 익힘정도 확인 한번 해주세요.', 'image_url': 'https://recipe1.ezmember.co.kr/cache/recipe/2019/10/13/ec1e5daca8b37a85ca38fa025fdc3d991.jpg'}, {'step_number': 6, 'description': '165도로 낮춘후 5분더 익혀주세요.\n-익힘정도에따라 온도와 시간을 조절해주세요.', 'image_url': 'https://recipe1.ezmember.co.kr/cache/recipe/2019/10/13/3af50ffeeb9a6e882a940280222509dd1.jpg'}, {'step_number': 7, 'description': '그릇으로만 옮겨담으면 완성입니다.', 'image_url': 'https://recipe1.ezmember.co.kr/cache/recipe/2019/10/13/6bb098724fbb1e4f67115b3b21fc599e1.jpg'}]"
35307,메인반찬,손님접대,닭고기,굽기,치킨스테이크(집에서도 맛있게 되는~~),치킨스테이크,https://recipe1.ezmember.co.kr/cache/recipe/2018/12/14/1d9efe65832739a2b7df97eeb95af59f1.jpg,"2,074",15분 이내,초급,2인분,"[('닭다리살', '1덩이'), ('양파', '1/4개'), ('파프리카', '1/4개'), ('감자전분', '100ml'), ('소금', '1/2작은술'), ('후추', '1/2작은술'), ('스테이크소스', '100ml'), ('올리고당(설탕)', '20ml')]","집에서 바삭하니 구워~~ 간단하게 활용한 스테이크소스~~로 만든 치킨스테이크♡♡♡
방법은 간단해도 맛은 명품","[{'step_number': 1, 'description': '닭다리살의 기름이랑 꽁지힘줄 떼내고 얇게 포떠요\n소금과 후추가루로 밑간해요', 'image_url': 'https://recipe1.ezmember.co.kr/cache/recipe/2018/12/14/b45b4ea9b4e1bd644eed64f3b6b3bf661.jpg'}, {'step_number': 2, 'description': '전분가루를 앞뒤로 묻혀요', 'image_url': 'https://recipe1.ezmember.co.kr/cache/recipe/2018/12/14/f62df2a21fe2ca693c2a6a60e722aec81.jpg'}, {'step_number': 3, 'description': '달군 팬에 식용유 두르고\n손에 물을 묻혀 전분가루를\n살짝 적셔요', 'image_url': 'https://recipe1.ezmember.co.kr/cache/recipe/2018/12/14/bd562de0453d2911f3a478019651fd0b1.jpg'}, {'step_number': 4, 'description': '앞뒤로 구워요', 'image_url': 'https://recipe1.ezmember.co.kr/cache/recipe/2018/12/14/4940b953b064fdc4cc6f449b781dce4f1.jpg'}, {'step_number': 5, 'description': '노릇하게 바삭하게 구워요\n속이 익었나 궁금하면 잘라봐요', 'image_url': 'https://recipe1.ezmember.co.kr/cache/recipe/2018/12/14/76f2cface98b7f50c08a59579ca88e811.jpg'}, {'step_number': 6, 'description': '양파,파프리카를 살짝 볶아요', 'image_url': 'https://recipe1.ezmember.co.kr/cache/recipe/2018/12/14/a0a71863c9fb310c49fc0527cd4384bd1.jpg'}, {'step_number': 7, 'description': '스테이크소스와 물엿의 비율을 5:1로 해서 전자렌지에 1분 돌려요\n바글바글전자레인지', 'image_url': 'https://recipe1.ezmember.co.kr/cache/recipe/2018/12/14/2bf12385a4aa60e227c756492d216bc01.jpg'}, {'step_number': 8, 'description': '접시에 편하게 담아요', 'image_url': 'https://recipe1.ezmember.co.kr/cache/recipe/2018/12/14/86b4b23316d5b266caa934486f3937181.jpg'}, {'step_number': 9, 'description': '소스를 얹어요~', 'image_url': 'https://recipe1.ezmember.co.kr/cache/recipe/2018/12/14/296596a254d1b172ed10ac090e67e46a1.jpg'}]"
35308,메인반찬,손님접대,닭고기,굽기,닭불고기,닭불고기,https://recipe1.ezmember.co.kr/cache/recipe/2020/12/30/9c0d2be25ef828b71496f371f6060b331.jpg,"2,116",30분 이내,초급,4인분,"[('닭다리 정육', '500g'), ('양배추', '100g'), ('양파', '1/4개'), ('대파', '1대'), ('마늘', '8쪽'), ('후추', '1작은술'), ('간장', '3큰술'), ('고추장', '1큰술'), ('고추가루', '3큰술'), ('술', '2큰술'), ('설탕', '2큰술'), ('참기름', '1큰술'), ('참깨', '1큰술')]","집밥을 많이 해먹는 요즘 치킨에 물리시지는 않은가요?

닭다리정육을 가지고 집밥에 어울리면서 맛나는 닭불고기 어떠세요?

​

닭다리정육500g, 양배추100g, 대파1대, 양파1/4개, 마늘8쪽, 후추1작은술

간장3큰술, 고추장1큰술, 고추가루3큰술, 술2큰술, 설탕2큰술

​

닭다리정육과 양배추를 뺀 다파, 양파, 마늘을 양념과 함께 믹서기에 돌려 양념장을 만들어요 닭정육살은 칼로 두들기거나 칼집을 내어 부드럽게 한 다음 양념장에 발라 팬에 구워주세요

상황에 따라 중불이나 약불로 불 조절 해가면서 구워주세요

양배추는 채썰어 접시에 깔고 그 위에 구운닭고기를 담아내주세요

드실 때 양배추와 같이 드시면 느끼한 맛도 없고 개운합니다","[{'step_number': 1, 'description': '양배추를 뺀 나머지를 양념과 함께 믹서기에 모두 넣어 갈아서 양념장을 만들어요 이 양념장은 다 넣어도 되지만 좀 많아서 나누어서 다음에 또 사용하셔도 될 듯요믹서기 ,  핸드믹서 ,  도깨비방망이도 괜찮아요', 'image_url': 'https://recipe1.ezmember.co.kr/cache/recipe/2020/12/30/b98b050267c2a47cfe22689db07789521.jpg'}, {'step_number': 2, 'description': '닭다리 정육은 칼집을 내어주세요', 'image_url': 'https://recipe1.ezmember.co.kr/cache/recipe/2020/12/30/a51af32261cae7195e04f3ded0e72f811.jpg'}, {'step_number': 3, 'description': '양념장에 버무려 기름 두른 팬에 구워요\n처음부터 약불에 하지 마세요\n중불>>약불>>중불 상황에 따라 변동해주세요처음부터 약불에 하면 육즙이 빠져 맛이 없어요', 'image_url': 'https://recipe1.ezmember.co.kr/cache/recipe/2020/12/30/5e83231a04fe9cd02c18e1795fb185891.jpg'}, {'step_number': 4, 'description': '먹기좋게 잘라주면서 익었는지 확인합니다', 'image_url': 'https://recipe1.ezmember.co.kr/cache/recipe/2020/12/30/f2dd4c1a61ce14084f57cdd0d21dabcc1.jpg'}]"
35309,메인반찬,손님접대,닭고기,굽기,대파 둥지위에 된장옷을 입은 닭맥적구이 ★,닭맥적구이,https://recipe1.ezmember.co.kr/cache/recipe/2019/07/10/2433be62b278433e4484a32f07388d361.jpg,"9,683",60분 이내,아무나,4인분,"[('닭다리살', '500g'), ('양파', '1/4개'), ('대파', '3대'), ('식용유', '약간'), ('맛술', '2숟가락'), ('사과즙', '3숟가락'), ('된장', '1.5숟가락'), ('간장', '1숟가락'), ('다진 마늘', '1/2숟가락'), ('참기름', '1/2숟가락'), ('다진 생강', '약간'), ('후춧가루', '약간')]","손님초대요리로 쵝오인 닭구이 ★
된장소스로 재워 누린내는 걱정 말랴규 ★ 
세상의 모든 레시피 만개의레시피","[{'step_number': 1, 'description': '양파, 대파는 얇게 채 썬 뒤 각각 찬물에 담가 매운맛을 뺀다.', 'image_url': 'https://recipe1.ezmember.co.kr/cache/recipe/2019/07/10/b80d2ce295b8a1afd96a6a1eeaf0ca9e1.jpg'}, {'step_number': 2, 'description': '양념장재료는 잘 섞는다.사과즙 대신 동량의 배즙을 넣거나 설탕 약간을 넣어도 돼요.', 'image_url': 'https://recipe1.ezmember.co.kr/cache/recipe/2019/07/10/7421b6c26097ca74e74313fcb2d49cdf1.jpg'}, {'step_number': 3, 'description': '기름기를 제거한 닭다릿살은 양념장에 담가 20분 이상 재운다.', 'image_url': 'https://recipe1.ezmember.co.kr/cache/recipe/2019/07/10/a8e8992c0ad6be861806e818fdb8243f1.jpg'}, {'step_number': 4, 'description': '중간 불로 달군 팬에 식용유를 두르고 재운 닭다리살을 노릇하게 굽는다.팬겉이 익으면 약한 불로 줄여 속까지 고루 익혀요.', 'image_url': 'https://recipe1.ezmember.co.kr/cache/recipe/2019/07/10/072db01f6a829c618f08a92986a0f4111.jpg'}, {'step_number': 5, 'description': '대파 > 맥적구이 > 양파 순으로 접시에 담아 완성한다.접시', 'image_url': 'https://recipe1.ezmember.co.kr/cache/recipe/2019/07/10/faebe5c558de0d29774aa516175dbb561.jpg'}]"
35310,메인반찬,손님접대,닭고기,굽기,닭다리살맛 닭가슴살스테이크와 오렌지소스 만들기,닭가슴살스테이크,https://recipe1.ezmember.co.kr/cache/recipe/2021/07/07/97b2adddd4502a461745b9cae64a1a151.jpg,"2,779",2시간 이상,아무나,4인분,"[('닭가슴살', '5덩이'), ('허브솔트', ''), ('마늘가루', ''), ('버터', '2밥숟가락'), ('다진마늘', '1밥숟가락'), ('올리브유', ''), ('물', '1L'), ('베이킹소다', '25g'), ('오렌지 주스', '2컵'), ('양파', '1/4개'), ('설탕', '0.5~1밥숟가락'), ('소금', '2꼬집'), ('전분', '1밥숟가락'), ('물', '2밥숟가락')]","닭가슴살이 닭다리살처럼 쫄깃해지는 베이킹소다 연육법과
오렌지소스 만들기. 바로 천국가는 환상의 스테이크를 만들어 보세요~~","[{'step_number': 1, 'description': '먼저 닭가슴살을 연육시켜줍니다.\n시간은 오래 걸리지만 어렵진 않아요.\n간단하게 설명드리자면\n베이킹소다 25g을 섞은 물 1리터에\n닭가슴살을 8시간 동안 담가두었다가\n헹구지 말고 물기를 빼주세요.', 'image_url': None}, {'step_number': 2, 'description': '자세한 방법은 초록색 박스를 눌러서 이동하면 상세히 보실 수 있어요.\n@6960898', 'image_url': None}, {'step_number': 3, 'description': '연육 후 물기를 뺀 닭가슴살은\n허브솔트와 마늘가루를 앞뒤로\n골고루 뿌린 다음 올리브유를\n휘휘 둘러 시즈닝 해 두어요.\n양념의 양은 정해진 것 없이 표면에\n골고루 뿌린다고 생각하시면 되고\n시간적 여유가 된다면 냉장실에서\n반나절 정도 숙성시켜 주면 더 맛있어요 :)', 'image_url': 'https://recipe1.ezmember.co.kr/cache/recipe/2021/07/07/54865c2485a8bbf66a6cec0d778aea5d1.jpg'}, {'step_number': 4, 'description': '고기에 간이 배는 동안\n가니시는 취향에 맞게 준비하고\n오렌지 주스를 이용한 소스를 만들게요', 'image_url': 'https://recipe1.ezmember.co.kr/cache/recipe/2021/07/07/21b03581289f366cb7a9425c29239be71.jpg'}, {'step_number': 5, 'description': '소스에 넣을 양파 1/4개는 잘게 다지고\n전분가루 1 + 물 2큰술을 섞은\n전분물을 미리 준비해 둡니다', 'image_url': 'https://recipe1.ezmember.co.kr/cache/recipe/2021/07/07/6400e240dac8e5634b10a552ca1a95c91.jpg'}, {'step_number': 6, 'description': '작은팬에 오일 반 큰술을 두르고\n양파를 볶다가 양파가 노릇하게 익으면\n오렌지주스 2컵을 부어 중불로 조려줍니다.', 'image_url': 'https://recipe1.ezmember.co.kr/cache/recipe/2021/07/07/6bbed30b92ca42f1baec340ee4dd3dd21.jpg'}, {'step_number': 7, 'description': '대략 6분 정도 지나 어느 정도 조려지면\n소금 2꼬집, 기호에 맞게 설탕을 넣어\n간을 맞추고 만들어 두었던 전분물을 넣고\n재빨리 저어서 걸쭉한 농도로 만들어요\n이렇게 완성한 오렌지 소스는\n\n잠시 뚜껑을 덮어두고\n\n고기를 구워줄게요', 'image_url': 'https://recipe1.ezmember.co.kr/cache/recipe/2021/07/07/4c27f8876a287d98db3f806a73e67d601.jpg'}, {'step_number': 8, 'description': '중강불로 아주 뜨겁게 달군 팬에\n기름 3큰술을 두르고 닭가슴살을\n올려 앞뒤로 노릇하게 구워주세요중강불', 'image_url': 'https://recipe1.ezmember.co.kr/cache/recipe/2021/07/07/92a2c32120f06f231fa3e11ac7ead6881.jpg'}, {'step_number': 9, 'description': '고기의 양면이 반드시 짙은 갈색이 되도록\n익으면 버터 2큰술을 넣어 녹여주고\n뚜껑을 덮은 다음 약불로 줄여\n앞뒤로 10분 정도 더 구워주면\n닭가슴살 스테이크 굽기 완성이에요 :)', 'image_url': 'https://recipe1.ezmember.co.kr/cache/recipe/2021/07/07/e88343a3e1f6ac4573b576c2c382fad21.jpg'}, {'step_number': 10, 'description': '다 익은 고기는 도마로 옮겨\n육즙이 퍼지게 잠시 레스팅 해두고\n고기를 구웠던 팬에 채소를 올려\n살짝만 구워내면 끝이랍니다~', 'image_url': 'https://recipe1.ezmember.co.kr/cache/recipe/2021/07/07/e39073db3f6757dd46be3ce88d5d5d9e1.jpg'}, {'step_number': 11, 'description': '레스팅을 끝낸 닭가슴살은\n통으로 내셔도 되고\n사선으로 슬라이스해도 좋아요.', 'image_url': 'https://recipe1.ezmember.co.kr/cache/recipe/2021/07/07/39054ea5bbdd5f598102e4ee88b922141.jpg'}, {'step_number': 12, 'description': '접시의 바닥이나 가장자리에\n소스를 깔고 구워진 음식들을\n먹음직스럽게 올려주면 된답니다 :)\n노랑노랑 소스가\n닭고기와 정말 잘 어울리죠?', 'image_url': 'https://recipe1.ezmember.co.kr/cache/recipe/2021/07/07/626965cac9fe0d9a1671566b43d1c5901.jpg'}, {'step_number': 13, 'description': '이건 진짜 말이 필요 없는 맛.\n소스 없이 먹어도 맛있고\n소스는 시판 제품을 이용해서\n간단하게 즐겨도 좋은 #닭가슴살스테이크', 'image_url': 'https://recipe1.ezmember.co.kr/cache/recipe/2021/07/07/461ba5d054f807607673e5824222c0731.jpg'}, {'step_number': 14, 'description': '소스 없이 먹어도 맛있고\n소스는 시판 제품을 이용해서\n간단하게 즐겨도 좋은 #닭가슴살스테이크\n코시국이 정말 심상치 않은데\n위험한 집 밖의 외식 대신\n멋있고 안전한 홈스토랑 열어보세요~', 'image_url': 'https://recipe1.ezmember.co.kr/cache/recipe/2021/07/07/e2984654587118c13d16bd4954b60cb01.jpg'}]"
35311,메인반찬,손님접대,닭고기,굽기,파닭,파닭,https://recipe1.ezmember.co.kr/cache/recipe/2015/06/08/2039bb510d9b32cd9fbcdcfef38f839c.jpg,"8,393",60분 이내,중급,2인분,"[('닭다리살', '300g'), ('대파', '2대'), ('녹말가루', '2큰술'), ('식용유', '2큰술'), ('밑간용 청주', '1큰술'), ('소금', '1/2작은술'), ('후춧가루', '1/3작은술'), ('다진마늘', '1큰술'), ('설탕', '1/2큰술'), ('매실액', '2큰술'), ('양조간장', '3큰술'), ('식용유', '1큰술'), ('식초', '1+2/3큰술'), ('소금', '1/3작은술'), ('다진마늘', '1/2작은술'), ('연겨자', '1작은술'), ('참기름', '1.5작은술')]",어렵지 않으면서 반찬으로도 괜찮고 손님맞이 음식으로도 훌륭한 메뉴랍니다.,"[{'step_number': 1, 'description': '분량의 소스재료를 섞어 잘 저어주세요. 간장과 매실액-소금, 연겨자-식초-다진마늘-기름 순으로 넣으시고 설탕은 식성에 따라 조절해서 넣어주세요. 항상 소스를 먼저 만들어 놓는 편이에요. 숙성 시킬 필요가 있기도 하고, 보통 양념병들이 종류별로 다 나와서 좁은 주방이 더 어수선해지고, 바로 소스를 끼얹어야 하는 경우는 메인 요리가 식어버리기도 하기 때문에 먼저 만들어 놓는답니다. 대신 참기름이나 들기름이 들어가는 소스의 경우에는 미리 다 만들어 놓고 음식에 섞기 직전이나 마지막에 넣어주는게 더 맛나요.', 'image_url': 'https://recipe1.ezmember.co.kr/cache/recipe/2015/08/31/c4867dbb7014842e322e6cea7be00f861.jpg'}, {'step_number': 2, 'description': '닭다리살을 손질할꺼에요. 아래 사진처럼 다리 아래부분을 돌아가며 칼집을 넣어주세요.', 'image_url': 'https://recipe1.ezmember.co.kr/cache/recipe/2015/08/31/2bc408b456add49c711128616ddf63d51.jpg'}, {'step_number': 3, 'description': '닭다리살에 세로로 칼집을 넣고 뼈에서 살을 긁어내며 뼈를 발라주세요. 중간중간 있는 힘줄은 제거해주세요.', 'image_url': 'https://recipe1.ezmember.co.kr/cache/recipe/2015/08/31/4a05a0d302da188cec5569d2ad2086471.jpg'}, {'step_number': 4, 'description': '발라낸 다리살과 준비한 가슴살은 3~4cm 정도 크기로 썰어서 청주,소금,후춧가루, 다진마늘로 10~15분 정도 밑간해두세요.', 'image_url': 'https://recipe1.ezmember.co.kr/cache/recipe/2015/08/31/d32e9431c2b3aed1d917fbc36beb1a211.jpg'}, {'step_number': 5, 'description': '대파 흰부분을 5cm 정도로 잘라 가운데 심을 빼고 곱게 체친후 10분정도 물에 담가 두세요. 이 과정에서 대파에 끈적한 진액과 매운맛이 어느 정도 제거 된답니다.', 'image_url': 'https://recipe1.ezmember.co.kr/cache/recipe/2015/08/31/0c77e3aaaca85e3b79d508f55a75d83c1.jpg'}, {'step_number': 6, 'description': '밑간 한 닭고기는 전분가루를 앞뒤로 골고루 묻혀준 후 가볍게 털어 여분의 가루를 털어내주세요.', 'image_url': 'https://recipe1.ezmember.co.kr/cache/recipe/2015/08/31/645b35033f9877a480ed3a656533d9491.jpg'}, {'step_number': 7, 'description': '기름을 두른 팬이 달궈지면 중불로 낮춘후 닭고기를 올리고 앞뒤로 각 3분 정도 노릇하게 구워주세요. 타지않게 불조절을 잘 해주셔야해요.', 'image_url': 'https://recipe1.ezmember.co.kr/cache/recipe/2015/08/31/2d30ae7df435d0b1acc4797abe18df7b1.jpg'}, {'step_number': 8, 'description': '노릇하게 구워진 닭고기를 살짝 깊이가 있는 그릇에 담고 물기를 완전히 제거한 대파채를 올려준 후 소스를 넉넉히 끼얹어 주면 완성.', 'image_url': 'https://recipe1.ezmember.co.kr/cache/recipe/2015/08/31/273d1afb4c60431bd47ad4a89f35cacc1.jpg'}]"
