index,종류별,상황별,재료별,방법별,글 제목,레시피이름,레시피이미지,조회수,조리시간,난이도,인분,재료,소개글,조리순서
151801,양념/잼/소스,일상,채소류,끓이기,진하게 우린 육수로 잔치국수 만들어 먹었어요:),잔치국수육수,https://recipe1.ezmember.co.kr/cache/recipe/2016/10/14/8796955e541143f8a1da84602679f1641.jpg,"9,951",30분 이내,초급,3인분,"[('물', '3L'), ('대파', '5줄'), ('양파', '1개'), ('무                                                                                엄지손가락길이', '1'), ('청양고추', '2개'), ('멸치', '1/2종이컵'), ('북어포', '1/2종이컵'), ('마늘', '5개'), ('다시마                                                                                손바닥크기', '1장'), ('면(제일제면소)', '3덩어리'), ('사각어묵', '2장'), ('계란지단', '1장'), ('호박 양파 볶음', '1접시'), ('소금', '1/2숟가락')]",이렇게 추운날은 뜨끈한 국물을 먹어야 맛있죠!,"[{'step_number': 1, 'description': '냄비에 물을 넣고 위에 말한 재료를을 넣어 끓여줍니다.', 'image_url': 'https://recipe1.ezmember.co.kr/cache/recipe/2016/10/14/170ed5c1adae01e55ee172969651890b1.jpg'}, {'step_number': 2, 'description': '육수가 충분히 우러나면 건져줍니다.\n다시마는 더 일찍 건지셔서 잘라서 고명으로 썼어요.', 'image_url': 'https://recipe1.ezmember.co.kr/cache/recipe/2016/10/14/5bacdaef940faa1fd11f837c623ddcfe1.jpg'}, {'step_number': 3, 'description': '면을 준비합니다.', 'image_url': 'https://recipe1.ezmember.co.kr/cache/recipe/2016/10/14/7667cc0920994eb8f44c4c91eb0af6791.jpg'}, {'step_number': 4, 'description': '다건진 육수에 면을 넣고 소금으로 간을 해줍니다.', 'image_url': 'https://recipe1.ezmember.co.kr/cache/recipe/2016/10/14/55d5c67ef09915bff7ae32fc46e9838d1.jpg'}, {'step_number': 5, 'description': '젓가락으로 호이호이 저어 익혀줍니다.', 'image_url': 'https://recipe1.ezmember.co.kr/cache/recipe/2016/10/14/91586fd93cfa2b9ca4ccb9ed099607b01.jpg'}, {'step_number': 6, 'description': '어묵을 채썰어 넣고 끓여줍니다.', 'image_url': 'https://recipe1.ezmember.co.kr/cache/recipe/2016/10/14/90b77edb249dc1e70d04769f9998255e1.jpg'}, {'step_number': 7, 'description': '그릇에 면과 어묵을 담아준 후에', 'image_url': 'https://recipe1.ezmember.co.kr/cache/recipe/2016/10/14/200e012610100694700def28f73259021.jpg'}, {'step_number': 8, 'description': '집에 있는 고명으로 장식합니다.\n저는 호박양파볶음, 계란지단을 부쳐서 채썰었어요. 다시마도 함께 올려주었어요.', 'image_url': 'https://recipe1.ezmember.co.kr/cache/recipe/2016/10/14/64303f02b3b0cb66b6ad9d6d7efc25061.jpg'}, {'step_number': 9, 'description': '양념장을 풀어서 드셔도 되고,\n김치랑 함께 드셔도 맛있어요!', 'image_url': 'https://recipe1.ezmember.co.kr/cache/recipe/2016/10/14/65878fd616bdb67f6852f8de72aba7931.jpg'}]"
151802,양념/잼/소스,일상,채소류,끓이기,"장아찌용 간장소스 만들기....두릅장아찌&양파,마늘장아찌(강추)",None,https://recipe1.ezmember.co.kr/cache/recipe/2016/05/16/9911fa70a6a6e566f85f2371882ea4361.jpg,"17,905",None,None,None,"[('맛간장', '0.5컵'), ('식초', '1컵'), ('아가베시럽 (올리고당)', '1C'), ('물', '3컵'), ('진간장', '2C'), ('와인', '1/2컵'), ('사과', '1/2개'), ('양파', '1/2개'), ('마늘', '5개'), ('표고버섯', '3개'), ('통후추', '20개'), ('식초', '1컵'), ('아가베시럽', '1C'), ('물', '3컵')]",,[]
151803,양념/잼/소스,일상,채소류,끓이기,국물요리 필수품! 만능육수 만들기,만능육수,https://recipe1.ezmember.co.kr/cache/recipe/2016/03/28/d435c53df7214729914b6c20e7c0a2ba1.jpg,"13,698",2시간 이상,중급,6인분 이상,"[('물', '6L'), ('다시마', '50g'), ('대파', '2~3뿌리'), ('건표고버섯', '50g'), ('마늘', '20쪽'), ('양파', '3개'), ('소주', '1/2병'), ('무', '1/2쪽'), ('간장', '600ml'), ('소금', '200g'), ('설탕', '200g'), ('가쓰오부시', '250g')]",오늘은 맛있는 육수 만드는 비법! 그리고 보관 비법을 알려드리려고 해요,"[{'step_number': 1, 'description': '마체프로가 알려드리는 만능 육수는 요리에 사용하는 육수보다 7-8배 정도 진하게 만들거에요\n그래서 냉장이나 냉동으로 보관해 놓으셨다가 물을 희석해서 쓰일 수 있는 거죠\n그럼 마체프 들통을 먼저 준비해 주세요\n재료양이 워낙 많다보니 가장 큰 사이즈의 냄비를 준비했구요', 'image_url': 'https://recipe1.ezmember.co.kr/cache/recipe/2016/03/28/0882b2dc2a9f83388ec04d11906ce82a1.jpg'}, {'step_number': 2, 'description': '마체프 들통에 찬물과 다시마를 넣고 끓인다음, 물이 끓으면 다시마는 건져주세요\n다시마는 너무 오래 끓이면 끈적해지니깐 물이 끓으면 바로 건져주시는게 좋아요\n무, 대파, 표고, 양파, 마늘 넣고 강한불에서 끓이다가 \n끓으면 약한불로 줄이고\n야채가 뭉근해 질때까지 오래 끓여주셔야 해요', 'image_url': 'https://recipe1.ezmember.co.kr/cache/recipe/2016/03/28/2cc40225066bb40772cdff5d261a833a1.jpg'}, {'step_number': 3, 'description': '야채가 푹 물러지면 견져내고 간장, 소금, 설탕, 소주 넣고 한번 더 끓이세요\n이 과정을 오래~오래~ 하실 수록 맛이 깊어지니\n3-4시간 이상 푸욱 끓여주세요\n마체프 전기렌지는 4시간까지 타이머를 설정해 놓을 수 있기 때문에\n4시간 타이머 해놓고, 잔열에 좀 더 끓여주시면 되겠죠', 'image_url': 'https://recipe1.ezmember.co.kr/cache/recipe/2016/03/28/fecf93b2ac8781f2e0c1f593270a2a2a1.jpg'}, {'step_number': 4, 'description': '농도가 조금 걸쭉하게 졸인 다음 불을 끄고 가쓰오브시를 넣구요\n가쓰오브시를 넣고 1시간 정도 둔 후 체로 견져내고\n맑은 육수만 식혀서 냉장 보관하고 1:8 또는 1:7 비율로 희석해 사용하시면 된답니다', 'image_url': 'https://recipe1.ezmember.co.kr/cache/recipe/2016/03/28/bd66e804b8660a410a428eafdf4f981f1.jpg'}, {'step_number': 5, 'description': '이렇게 진~하게 우려낸 육수를\n물을 7배 넣어서 희석한 상태인데요\n여기에 국수만 넣어도 맛있고, 야챔나 넣어도 맛난 샤브샤브가 된다니~\n정말 만능 육수죠? ^^\n이렇게 만들어 놓으시고 소분해서 냉동 보관해놓으시면\n뜨끈한 국물요리를 언제든 쉽게 만드실 수 있으니, 정말 꼭 만들어 보시길 강추할께요~', 'image_url': 'https://recipe1.ezmember.co.kr/cache/recipe/2016/03/28/ba5659a2ab16fb71cfcfe1edc771fdaa1.jpg'}]"
151804,양념/잼/소스,일상,채소류,끓이기,토마토소스만들기 베이컨넣어 풍미가 좋아요!,토마토소스,https://recipe1.ezmember.co.kr/cache/recipe/2015/10/23/b5f411d36848e825d98c8704c8d8f0ac1.jpg,"2,958",30분 이내,초급,3인분,"[('자세한 재료는 본문내용에서 확인해보실수있습니다', '')]","오늘은 몸에도 좋고 맛도 좋은
토마토 소스 만들기 레시피로
여러분과 함께하려고 합니다.
특히, 오늘의 포인트는
토마토 과육 제품을 사용하는 것!
별것 아닌 부분같지만
소스의 풍미를 매우 높여줍니다.
저는 개인적으로 스모키한
베이컨을 사용해서 만드는 것이
오히려 소고기를 넣은 것 보다
풍미가 좋게 느껴지더라구요.
함께 만들어볼까요?","[{'step_number': 1, 'description': '예상소요시간 약25분', 'image_url': 'https://recipe1.ezmember.co.kr/cache/recipe/2015/10/23/5e7d76e1ddcbcad7be02615813c4d8dc1.png'}, {'step_number': 2, 'description': '먼저 손을 깨끗하게 씻고\n필요한 재료를 준비 해 주세요.', 'image_url': 'https://recipe1.ezmember.co.kr/cache/recipe/2015/10/23/de28d7d79bc59fb826b84a43c9d503a01.jpg'}, {'step_number': 3, 'description': '+Tip 오늘 요리 포인트!\n토마토 과육 사용하기!\n생토마토라면 더욱 좋지만\n이렇게 통조림 제품도 상관없어요!', 'image_url': 'https://recipe1.ezmember.co.kr/cache/recipe/2015/10/23/f9b762c01c24f5a08724dde3a2dbff001.jpg'}, {'step_number': 4, 'description': '양파는 사방0.5cm정도로 다져주시고\n양송이는 4등분해서 준비해주세요.\n그리고, 통마늘은 얇게\n편썰기해서 준비할게요.', 'image_url': 'https://recipe1.ezmember.co.kr/cache/recipe/2015/10/23/2fa0d32768d395c34ef29380a7262e141.gif'}, {'step_number': 5, 'description': '소스의 풍미를 더욱 깊게 만들\n베이컨은 양파와 비슷한 크기로\n잘게 다져서 준비 해 주세요.\n오늘 소스에 사용하는 베이컨은\n씹는 맛이나 본연의 맛을\n즐기는 것 보다는\n스모키한 향을 더해서\n완성도롤 높이는 것에 목적이 있습니다.', 'image_url': 'https://recipe1.ezmember.co.kr/cache/recipe/2015/10/23/db8f6a3c223ccae3322850cb398017d61.gif'}, {'step_number': 6, 'description': '기름없이, \n베이컨먼저 노릇하게 볶다가\n양파와 마늘을 넣고\n노릇해질때까지 볶아주세요.', 'image_url': 'https://recipe1.ezmember.co.kr/cache/recipe/2015/10/23/413c404f531a5a9729f5f8063ad318d11.gif'}, {'step_number': 7, 'description': '그리고 토마토소스와\n토마토 다이스 제품을 넣고\n뭉근하게 끓여주세요.\n소스가 튈 염려가 있으니\n불은 중불이하로 낮추어주세요.', 'image_url': 'https://recipe1.ezmember.co.kr/cache/recipe/2015/10/23/bf3b07e1725152160e72b843a920c10c1.gif'}, {'step_number': 8, 'description': '버섯까지 넣고\n후추와 소금 약간을\n간을 맞추어 주세요.\n기호에 따라 소금은\n넣지 않으셔도 관계없습니다.', 'image_url': 'https://recipe1.ezmember.co.kr/cache/recipe/2015/10/23/f1c39229ab1fa6c58887dbce51f8f2461.gif'}, {'step_number': 9, 'description': '버섯의 수분이\n소스에 그대로 베어나오도록\n7분정도 뭉근하게 끓여주시면 Okay!', 'image_url': 'https://recipe1.ezmember.co.kr/cache/recipe/2015/10/23/60c2c59c90a1d077973946b4591e58471.gif'}, {'step_number': 10, 'description': '+Tip 완성된 토마토 소스를 활용하여\n스파게티를 만드실 때\n가볍게 토핑으로 원하는 식재료를 구워\n곁들여 주시면 더욱 푸짐해요!', 'image_url': 'https://recipe1.ezmember.co.kr/cache/recipe/2015/10/23/daa753a38b387d833c5f88fc818277c21.gif'}, {'step_number': 11, 'description': '이렇게 정성이 가득한\n깊고 진한 토마토 소스 만들기 완성!', 'image_url': 'https://recipe1.ezmember.co.kr/cache/recipe/2015/10/23/c36c4df7b5ebe84034652c5e575c82871.gif'}, {'step_number': 12, 'description': '구운 새우만 곁들였을뿐인데\n더욱 고급스러워졌죠?', 'image_url': 'https://recipe1.ezmember.co.kr/cache/recipe/2015/10/23/46172d5b0b4a842c7e5176dffc69d61c1.gif'}]"
151805,양념/잼/소스,일상,채소류,끓이기,활용도가 많은 토마토소스 만들기,토마토소스,https://recipe1.ezmember.co.kr/cache/recipe/2015/06/20/2d8c180b5d48682e7a65d347ef19f6ab1.jpg,"15,450",90분 이내,초급,6인분 이상,"[('토마토', ''), ('양파', ''), ('양송이버섯', ''), ('파프리카', ''), ('다진마늘', ''), ('월계수잎', ''), ('진간장(우스터소스)', ''), ('소금', ''), ('설탕', ''), ('통후추', '')]","라이코펜이 풍부한 토마토는 익혀먹는것이 더 좋다하지요~ 파스타, 피자등에 활용도가 높은 토마토소스를 가정에서도 손쉽게 만들수있답니다.","[{'step_number': 1, 'description': '빨갛게 잘 익은 완숙토마토는 윗부분에 십자로 칼집을 넣어 끓는물에 데쳐주시면 껍질을 쉽게 벗기실수가있답니다~', 'image_url': 'https://recipe1.ezmember.co.kr/cache/recipe/2015/06/22/ba0deec0a444a1015e84268122c0ec491.jpg'}, {'step_number': 2, 'description': '웍에 올리브유를 두르시고 다진마늘과 양파를 넣어 향이 충분히 우러나올수있도록 볶아줍니다~', 'image_url': 'https://recipe1.ezmember.co.kr/cache/recipe/2015/06/22/f98a3d84fb760043d09902900b9530291.jpg'}, {'step_number': 3, 'description': '다져놓은 파프리카와 양송이버섯을 넣어주시고요~', 'image_url': 'https://recipe1.ezmember.co.kr/cache/recipe/2015/06/22/6ab4d9ed5bf98e6988aaa8dcaf6d986f1.jpg'}, {'step_number': 4, 'description': '껍질을 벗긴 토마토도 잘게 다져 함께 넣고 끓이기 시작합니다~ 각종 채소들과 토마토에서 나오는 수분으로 충분히 조림이 가능하니 물은 따로 넣지않아요~', 'image_url': 'https://recipe1.ezmember.co.kr/cache/recipe/2015/06/22/d7354cde9f7ac969964d9637621aec181.jpg'}, {'step_number': 5, 'description': '월계수잎을 넣어주시고 진간장, 설탕, 소금, 통후추갈은것을 넣어 간을 맞춰주세요~ 원래는 우스터소스를 넣어 간을 맞추지만 우스터소스대신 진간장으로 대신하실수있고요~ 간장이나 우스터소스로만 간을하시게되면 토마토소스의 색이 검어질수있으니 간장과 소금을 섞어 간을해주세요~', 'image_url': 'https://recipe1.ezmember.co.kr/cache/recipe/2015/06/22/6f6c44a7d763c244b3b7608f5bdd043f1.jpg'}, {'step_number': 6, 'description': '뭉근한불에서 충분히 졸여진 토마토소스는 월계수잎을 걷어내시고 완전히 식힌후 병에 담아 냉장보관하시면 필요하실때 쉽게 꺼내 사용하실수있어요.', 'image_url': 'https://recipe1.ezmember.co.kr/cache/recipe/2015/06/22/94248e47f7dd0c023296df53901b9f3b1.jpg'}]"
151806,양념/잼/소스,일상,채소류,끓이기,"시원한 육수 만들기 황금레시피(feat. 물떡, 어묵 칼국수 육수사용)",육수,https://recipe1.ezmember.co.kr/cache/recipe/2017/11/07/3ce9d5de26e71143d07ea7622c573e3e1.jpg,"15,755",60분 이내,초급,6인분 이상,"[('파', '3뼘'), ('무', '1뼘'), ('양파', '2개'), ('양파껍질', '2개'), ('표고버섯', '5개'), ('청양고추', '5개'), ('북어포', '1종이컵'), ('멸치', '1종이컵'), ('물', '4L'), ('다시마', '2개')]","시원한 육수 한통 만들어 두면 여기저기 사용하기 편할꺼에요~



지난번에 시골 갔을때 육수 만들어서 어묵탕도 해먹고 국수도 삶아 먹었는데...

지역 음식인데~ 부산에서는 가래떡을 어묵, 오뎅에 넣고 끓여서 물떡으로 먹거든요~



서울 사는 쌤이 물떡이 뭐에요? 한번도 안먹어 봤는데... 

먹어보고 싶어요~ 해서..



시골집 다녀 올때 챙겨올테니 한번 먹어요~

그렇게 시작해서 주말에 시골집 갔다가 

시원한 육수만들기 위해 시골집 뒷밭에서 최대한 육수 재료를 챙겨서 서울 왔지요!!



시원한 육수 만들기 황금레시피 재료 소개할깨요~

응용편으로 물떡, 어묵 칼국수 육수 사용 가능해요:)","[{'step_number': 1, 'description': '냄비에 재료를 다 넣어줍니다.', 'image_url': 'https://recipe1.ezmember.co.kr/cache/recipe/2017/11/07/162c20ab93391cbce8676e69c9a560641.jpg'}, {'step_number': 2, 'description': '건새우 등 추가적인걸 기호에 따라 가미하세요.\n육수는 그냥 냉장고에 있는걸 다 넣어주면 됩니다.\n육수를 내고 그걸로 된장찌개, 어묵탕, 계란찜을 만들어 드실 수 있어요!', 'image_url': 'https://recipe1.ezmember.co.kr/cache/recipe/2017/11/07/1b9d18e51cbb25aa5954388c649533811.jpg'}, {'step_number': 3, 'description': '저는 육수를 내서 꼬지에 어묵을 껴서', 'image_url': 'https://recipe1.ezmember.co.kr/cache/recipe/2017/11/07/ef4ff93c572837534153767b248658681.jpg'}, {'step_number': 4, 'description': '육수에 오뎅꼬지끼고 가래떡 넣어서', 'image_url': 'https://recipe1.ezmember.co.kr/cache/recipe/2017/11/07/123dd7f3c5859aa9c33921a96198e0c51.jpg'}, {'step_number': 5, 'description': '추운 지금에 딱 맞는 어묵꼬지, 물떡을 먹기도 했어요!', 'image_url': 'https://recipe1.ezmember.co.kr/cache/recipe/2017/11/07/eefed9ede1006bbb159b37db877bdc711.jpg'}, {'step_number': 6, 'description': '남은 육수는 칼국수 면을 삶고 사각 어묵을 데쳐서 채썰고 쪽파와 삼진어묵에서 구매한 어묵을 넣어서 양념장에 잔치국수처럼 어묵칼국수를 만들어 먹었어요!', 'image_url': 'https://recipe1.ezmember.co.kr/cache/recipe/2017/11/07/025347273aaa190a653d3a3033aaa8a31.jpg'}, {'step_number': 7, 'description': '위 육수로 소면이나 칼국수면 삶고 고명 넣어서 양념장만 만들면 됩니다. 송송이양념장레시피는 간장, 까나리액젓, 고추가루, 깨소금, 양파, 쪽파, 참기름입니다!', 'image_url': 'https://recipe1.ezmember.co.kr/cache/recipe/2017/11/07/8308e09977ee8510375cb1ba2ca57fbe1.jpg'}, {'step_number': 8, 'description': '그렇게 남은 시원한 육수에 양념장 간장, 까나리액젓, 고추가루, 깨소금, 양파, 쪽파, 참기름 올려서', 'image_url': 'https://recipe1.ezmember.co.kr/cache/recipe/2017/11/07/e363492e0569c34cd78cc478680c29a81.jpg'}, {'step_number': 9, 'description': '시원하게 섞어드시면 완전 맛있어요! 육수 한봉다리 남아서 복직한 팀장님 챙겨드렸는데... 양념 하나 없이 시원한 육수 만들기 황금레시피로 남편분이랑 어묵칼국수 만들어 드셨다고 하더라구요! 첨엔 남편분이 칼국수에 어묵있는거 보고 어? 뭐지? 뭔데? 이러다가 육수가 시원하고 감칠맛 나면서 맛있다고 잘드셨다고 하네요:)', 'image_url': 'https://recipe1.ezmember.co.kr/cache/recipe/2017/11/07/8b1d85185ca2b62979345d59d20a76371.jpg'}]"
151807,양념/잼/소스,일상,채소류,끓이기,제철 토마토로 쓸모있는 소스 만들기,None,https://recipe1.ezmember.co.kr/cache/recipe/2015/06/05/04ca95112e3bb43af297d087f83ff131.jpg,"6,134",None,None,None,[],,[]
151808,양념/잼/소스,일상,채소류,끓이기,#고춧기름_만들기 #배추찜_만들기 #매콤한 고춧기름에 짭쪼름한 소스와 매콤한 고추가 어우러진 중국 배추찜,고추기름,https://recipe1.ezmember.co.kr/cache/recipe/2018/02/08/60c1752cbb679812e424972e8475adb01.jpg,"2,083",30분 이내,아무나,2인분,"[('고춧가루', '1컵'), ('식용유', '1컵'), ('대파', '1/3대'), ('알배기배추', '1/2통'), ('고춧기름', '1컵'), ('굴소스', '2큰술'), ('홍고추', '1개'), ('청양고추', '2개'), ('썬파', '1큰술')]",직접 고춧기름을 내어서는 거기에 굴소스와 매콤한 고추를 넣고 만든 소스를 뿌려서 먹는 것이죠. 배추의 단맛을 느낄 수 있는 이연복셰프의 배추찜입니다.,"[{'step_number': 1, 'description': '가장 먼저 해야할 것이 바로 고춧기름을 만드는 것입니다. 고춧기름으로 배추찜 소스를 만드는데 만들때에 많이 만들어서는 소스로 사용하고 남은 고춧기름을 통에 담아 놓으면 두고두고 고춧기름을 사용할 수 있지요. 팬에 기름을 넉넉하게 넣어 주시고요. 그리고 대파는 손가락크기하게 썬 후에 굵게 채썰어서 기름에 넣어 줍니다. 그리고 고춧가루 듬뿍 넣어 주시고는 중불에서 은근하게 끓여 주세요. 센불에 하시면 고춧가루가 금방 탈 수 있으니 중불에서 시작하세요.', 'image_url': 'https://recipe1.ezmember.co.kr/cache/recipe/2018/02/08/cf2b0b408cb48978696961fb30bdc7dd1.jpg'}, {'step_number': 2, 'description': '그렇게 팔팔 끓어오르면 점점 기름의 색이 붉은 빛을 띠면서 파향이 들어간 고춧기름이 만들어지지요. 팔팔 끓어오르게 되면 불을 끄시고요. 1~2분 두었다가 안의 내용물을 체에 걸러서 기름을 빼내어 줍니다. 건더기는 버리시면 되고요.', 'image_url': 'https://recipe1.ezmember.co.kr/cache/recipe/2018/02/08/4364913462d08b3b12d78a0911719a0c1.jpg'}, {'step_number': 3, 'description': '그렇게 빼낸 고춧기름입니다. 색이 너무 예쁘죠. 투명한 붉은빛을 띠고 있는 고춧기름입니다. 파향이 가득한 고춧기름이죠. 이렇게 만들어서 통에 담아서는 두고두고 사용하시면 됩니다.', 'image_url': 'https://recipe1.ezmember.co.kr/cache/recipe/2018/02/08/9cb9064fb1612e91d8b6d7b78e3cfc451.jpg'}, {'step_number': 4, 'description': '고춧기름도 만들었으니 본격적으로 배춧찜을 만들어 볼까요. 먼저 고춧기름에 썬파를 넣어 줍니다.', 'image_url': 'https://recipe1.ezmember.co.kr/cache/recipe/2018/02/08/cdea3d98d9e9bab545b54bbaef5f60581.jpg'}, {'step_number': 5, 'description': '그리고 청양고추 2개를 다져서는 넣어 줍니다.', 'image_url': 'https://recipe1.ezmember.co.kr/cache/recipe/2018/02/08/d74b352f8444efcc336561eb5f0972d41.jpg'}, {'step_number': 6, 'description': '그리고 홍고추도 다져서 넣어 줍니다. 잘 섞어주세요.', 'image_url': 'https://recipe1.ezmember.co.kr/cache/recipe/2018/02/08/859f69b40e2322bbac8cd07386fcf8411.jpg'}, {'step_number': 7, 'description': '마지막으로 간은 굴소스로 합니다. 굴소스를 넣고는 잘 섞어주세요. 그런데 기름이다보니 내용물이 가라앉게 되지요. 배추에 뿌릴때에 다시한번 섞어서 넣어 주시면 됩니다.', 'image_url': 'https://recipe1.ezmember.co.kr/cache/recipe/2018/02/08/716397b3547ba0a7313dc2b8c0c5831f1.jpg'}, {'step_number': 8, 'description': '배추찜에 들어가는 소스 완성입니다. 고춧기름만 만들어 놓으면 소스는 금방 만들게 되지요.', 'image_url': 'https://recipe1.ezmember.co.kr/cache/recipe/2018/02/08/a18aabf4ce6b2ae4805100f9672f46991.jpg'}, {'step_number': 9, 'description': '알배기 배추 1개를 1/4로 등분을 해서 찜통에서 쪄 줍니다. 젓가락을 눌러 보았을때 ~~ 특히 윗쪽 흰부분을 눌러보았을때에 쑥 들어가면 다 익은 것입니다. 익었다면 바로 바로 꺼내어서 완성접시에 담아주세요.', 'image_url': 'https://recipe1.ezmember.co.kr/cache/recipe/2018/02/08/adef470e79d01f0143562c57fc909cff1.jpg'}, {'step_number': 10, 'description': '먹기 좋게 다시 반으로 썰어서 담아 주었습니다. 찜통에서 바로 꺼내어야 하는 이유는 잔열로 배추가 더 익기 때문이예요. 그럼 지나치게 쪄지기 때문에 숨이 많이 죽게 되거든요. 그래서 바로바로 찜통에서 꺼내어서는 식혀 두시는 것이 좋습니다.', 'image_url': 'https://recipe1.ezmember.co.kr/cache/recipe/2018/02/08/4bd4b38cd31cfb41af0352d149a55e361.jpg'}, {'step_number': 11, 'description': '그리고 만들어 놓았던 고춧기름소스를 한번 저어 준 후에 충분히 배추가 적혀질 수 있도록 뿌려 줍니다. 배추에는 간이 전혀 되어 있지 않기 때문에 소스를 충분히 많이 뿌려 주시는 것이 좋아요. 이연복셰프의 배추찜 완성입니다.', 'image_url': 'https://recipe1.ezmember.co.kr/cache/recipe/2018/02/08/140832e34f53db41fc25f88cc4bcefcd1.jpg'}]"
