index,종류별,상황별,재료별,방법별,글 제목,레시피이름,레시피이미지,조회수,조리시간,난이도,인분,재료,소개글,조리순서
151820,양념/잼/소스,일상,채소류,끓이기,토마토소스 Ver.3,토마토소스,https://recipe1.ezmember.co.kr/cache/recipe/2020/07/27/c7c9efd754e07ae3942af14f8a7b9e511.jpg,"2,279",10분 이내,아무나,2인분,"[('홀 토마토', '1캔'), ('마늘', '2~3쪽'), ('양파', '1/2개'), ('월계수잎', '2~3장'), ('올리브유', '적정량'), ('바질', '약간'), ('설탕', '약간'), ('소금', '약간'), ('후추', '약간')]",토마토를 베이스로 해서 만든 가장 기본적인 파스타 소스,"[{'step_number': 1, 'description': '마늘은 으깨고 양파는 잘게 다진다.마늘 2~3쪽, 양파 1/2개도마 ,  칼', 'image_url': 'https://recipe1.ezmember.co.kr/cache/recipe/2020/07/27/b5d0dec921f650f01124bd4b645b83951.jpg'}, {'step_number': 2, 'description': '냄비에 올리브유를 두르고 다진 마늘과 양파를 넣고 향은 낸 뒤 약간의 물을 넣고 단맛이 잘 우러나오도록 수분이 완전히 없어질 때 까지 충분히 볶는다.마늘 2~3쪽, 양파 1/2개, 올리브유냄비 ,  고무주걱센불', 'image_url': 'https://recipe1.ezmember.co.kr/cache/recipe/2020/07/27/2e02de93195b93c72d2c274a16382dae1.jpg'}, {'step_number': 3, 'description': '홀 토마토는 통조림을 따서 손으로 으깬 다음 월계수잎과 함께 냄비에 넣고 원하는 농도가 될 때까지 끓인다.홀 토마토 1캔그릇', 'image_url': 'https://recipe1.ezmember.co.kr/cache/recipe/2020/07/27/030c4a9354144ac4370e11f6656feed01.jpg'}, {'step_number': 4, 'description': '원하는 농도가 되면 월계수잎을 건진 뒤 소금과 후추, 설탕을 넣고 잘 혼합한다.홀 토마토 1캔, 마늘 2~3쪽, 양파 1/2개, 올리브유, 월계수잎, 설탕, 소금, 후추냄비 ,  고무주걱약불', 'image_url': 'https://recipe1.ezmember.co.kr/cache/recipe/2020/07/27/981e96818f3cc631eccc9fe5272243551.jpg'}, {'step_number': 5, 'description': '불을 끄고 한 김 식힌 뒤 핸드블랜더로 갈아준다.홀 토마토 1캔, 마늘 2~3쪽, 양파 1/2개, 올리브유, 월계수잎, 설탕, 소금, 후추냄비 ,  핸드블랜더', 'image_url': 'https://recipe1.ezmember.co.kr/cache/recipe/2020/07/27/a4c0b8e419abdc150f85f5d4fe0e24e51.jpg'}, {'step_number': 6, 'description': '약간의 올리브유와 바질을 넣고 잘 섞어 보관한다.홀 토마토 1캔, 마늘 2~3쪽, 양파 1/2개, 올리브유, 월계수잎, 바질, 설탕, 소금, 후추', 'image_url': 'https://recipe1.ezmember.co.kr/cache/recipe/2020/07/27/73dfeea4a51023211f22654473f3dbf81.jpg'}]"
151821,양념/잼/소스,일상,채소류,끓이기,"집밥 메뉴/ 육수내리기 / 멸치와 야채, 건어물",육수,https://recipe1.ezmember.co.kr/cache/recipe/2020/07/25/c054bb241412d995454bff99f8d7156f1.jpg,838,30분 이내,초급,4인분,"[('무', '200g'), ('대파', '1줄기'), ('표고버섯 기둥 말린것', '7개'), ('생선 대가리', '2개'), ('다시마', '25g'), ('양파', '1/2개'), ('멸치', '10g')]","찌개를 끓일때나 잔치국수 만들때, 김치 담글때 고춧가루를
불리는 작업을 할 때 사용하는 나만의 레시피.
육수 내리기 ~. 만들어서 김치 냉장고에 넣어 두면 
아주 편리하다.","[{'step_number': 1, 'description': '무 한토막(200g), 대파 1줄기, 생선 대가리 2개,\n물 끓여 먹으려고 말린 표고버섯 기둥 7개,\n다시마 25g, 양파 1/2개, 멸치 한줌 (10g)을\n넣고 냄비에 물을 붓고 10분 정도 끓여 준다.', 'image_url': 'https://recipe1.ezmember.co.kr/cache/recipe/2020/07/25/3a43622016b6fc6ed8631381ce37d9f81.jpg'}, {'step_number': 2, 'description': '중간에 다시마는 꺼내주고 중간 불에서\n계속 끓여준다.', 'image_url': 'https://recipe1.ezmember.co.kr/cache/recipe/2020/07/25/ce8216c33654c7cb8f876f24e00a3de91.jpg'}, {'step_number': 3, 'description': '끓이면서 생기는 거품은 걷어내 주는것이\n깔끔하고 개운하다.', 'image_url': 'https://recipe1.ezmember.co.kr/cache/recipe/2020/07/25/45f47038094233e09cf5d10a2ed218e41.jpg'}, {'step_number': 4, 'description': '걷어 낸 거품 사진.', 'image_url': 'https://recipe1.ezmember.co.kr/cache/recipe/2020/07/25/920ba94f3348d8f773d31a56dc3db11f1.jpg'}, {'step_number': 5, 'description': '완성 되면 식혀서 김치냉장고에 보관하여\n요리할때 시용하면 훨씬 깊은 맛이난다.', 'image_url': 'https://recipe1.ezmember.co.kr/cache/recipe/2020/07/25/3b2e0bf4fd5babfdc7a70268662ef95c1.jpg'}, {'step_number': 6, 'description': '삶은 무는 생선조림이나 그냥 조려 먹으면\n좋다.', 'image_url': 'https://recipe1.ezmember.co.kr/cache/recipe/2020/07/25/3da8b6e1594a1ffc45d2a4a4368d6e5e1.jpg'}, {'step_number': 7, 'description': '멸치 대가리도 버리지 말고 모여 두었다가 육수\n내릴때 사용 하고, 맑은 지리 전골을 끓일때는\n고추씨를 넣어서 끓이면 매콤한 맛을 낼수 있다.', 'image_url': 'https://recipe1.ezmember.co.kr/cache/recipe/2020/07/25/805f39dfa1a613dcb4166cd8bf32e1a31.jpg'}]"
151822,양념/잼/소스,일상,채소류,끓이기,[살림꽝 꽁블의 지구촌 집밥] 만능 토마토 소스 - Tomato Sauce,토마토소스,https://recipe1.ezmember.co.kr/cache/recipe/2018/12/30/98faf7ece88406378e871d31537863771.jpg,"1,237",60분 이내,초급,6인분 이상,"[('홀토마토캔', '400ml'), ('방울 토마토                                                                                100g', '6-10개'), ('양파', '1/2개'), ('통마늘', '3-5개'), ('소금', '2/3t'), ('마스코바도', '1T'), ('드라이 오레가노', '1t'), ('후추', '3~4T'), ('올리브오일', '3~4T')]","꽁블의 쿠킹클래스 
다양한 이탈리아 요리에 활용할 수 있는 
토마토 소스를 만들어 보았습니다.

피자, 파스타, 라자냐, 그라탕 등 각종 이탈리아요리와 해산물 스튜 등에 자주 사용되는 만능 토마토 소스를 만들어 보는 시간입니다. 만든 후 냉동 보관 하시면 한 달 정도 드실 수 있습니다. 어렵지 않으니 한번 만들어 보세요~","[{'step_number': 1, 'description': '깨끗하게 씻어 물기를 제거한 방울 토마토는 4등분하고, 양파는 굵게 채썰고, 마늘은 2등분한후 오븐팬에 담아 올리브오일 1T정도를 뿌려 210도로 예열된 오븐에 20-25분 노릇하게 굽는다.오븐', 'image_url': 'https://recipe1.ezmember.co.kr/cache/recipe/2018/12/30/db1d2d6627b7edc1863317e5579789181.png'}, {'step_number': 2, 'description': '넉한 소스팬에 올리브 오일3T정도를 두르고 홀토마토 통조림+ 1의 구운야채를 함께 핸드블렌더로 갈아준것을 넣고 강중불에 끓기 시작하면 마스코바도,소금,오레가노를 넣고 잘 섞어주고 뚜껑을 연채로 30~40분 졸여준다.', 'image_url': 'https://recipe1.ezmember.co.kr/cache/recipe/2018/12/30/0ea8e6e17a5394af0030e0057e14bde61.png'}, {'step_number': 3, 'description': '마지막에 후추조금 뿌려준다.', 'image_url': 'https://recipe1.ezmember.co.kr/cache/recipe/2018/12/30/89f116ddce4c9cc0f3e1807a1d26831c1.png'}]"
151823,양념/잼/소스,일상,채소류,끓이기,토마토 잼 시들해진 토마토 요리 토마토 쨈,토마토잼,https://recipe1.ezmember.co.kr/cache/recipe/2023/07/01/a2988f5516f7a36d651a2e780c5738c51.jpg,964,60분 이내,초급,6인분 이상,"[('토마토', '6개'), ('레몬청', '2큰술'), ('레몬즙', '2큰술'), ('소금', '조금'), ('설탕', '1컵')]",토마토가 상하고 시들해져서 토마토 쨈으로 만들었어요,"[{'step_number': 1, 'description': '매일 토마토를 갈아 먹는데 박스로 배송받으니 상한 것도 오기도 하고요. 한 쪽이 조금 상해서 상한 부분은 도려내고 조릴 거랍니다', 'image_url': 'https://recipe1.ezmember.co.kr/cache/recipe/2023/07/01/32eb28cfcd7705a50067ebaa1117c5fc1.jpg'}, {'step_number': 2, 'description': '깨끗이 씻은 토마토는 상한 부분은 도려내고요', 'image_url': 'https://recipe1.ezmember.co.kr/cache/recipe/2023/07/01/4b1539fa902270d0672fd291d87ffbee1.jpg'}, {'step_number': 3, 'description': '가운데 심지 부분도 질겨서 사과 씨 빼는 도구로 빼 냈어요', 'image_url': 'https://recipe1.ezmember.co.kr/cache/recipe/2023/07/01/2e2308cd40d374d8343ec9ce76d7913b1.jpg'}, {'step_number': 4, 'description': '데쳐낼 거라서, 밑에 (+) 열 십자로 칼집을 줘서, 준비합니다', 'image_url': 'https://recipe1.ezmember.co.kr/cache/recipe/2023/07/01/0978b5cc6cd240b4e88c7e348b7ad0b31.jpg'}, {'step_number': 5, 'description': '물이 끓으면 소금을 조금만 넣고, 토마토를 데쳐냅니다 다시 끓일 거라서, 껍질이 살짝 벗겨지면, 꺼내세요', 'image_url': 'https://recipe1.ezmember.co.kr/cache/recipe/2023/07/01/fe761ae994bc7ef33053c6fbceefcffb1.jpg'}, {'step_number': 6, 'description': '데친 토마토는, 껍질을 벗겨내고요', 'image_url': 'https://recipe1.ezmember.co.kr/cache/recipe/2023/07/01/5511e8df344706e8816b6094320afd7d1.jpg'}, {'step_number': 7, 'description': '작게 잘라줍니다', 'image_url': 'https://recipe1.ezmember.co.kr/cache/recipe/2023/07/01/f0a932e9f1276ce34fdd556960f9a7f21.jpg'}, {'step_number': 8, 'description': '핸드 블랜드나 믹서에 곱게 갈아주세요.', 'image_url': 'https://recipe1.ezmember.co.kr/cache/recipe/2023/07/01/48e4a9777e3aa62b749ec8d365846b981.jpg'}, {'step_number': 9, 'description': '웍에 간 토마토를 넣고 끓여 줍니다', 'image_url': 'https://recipe1.ezmember.co.kr/cache/recipe/2023/07/01/ae3d55e01a5c7d79ac6d49b6a96b6a471.jpg'}, {'step_number': 10, 'description': '처음에는 수분이 많아서, 끓으면서 여기저기 튀니까, 뚜껑을 덮고 끓여주세요', 'image_url': 'https://recipe1.ezmember.co.kr/cache/recipe/2023/07/01/11e3166fd5e9173edaf454d7a868d95c1.jpg'}, {'step_number': 11, 'description': '토마토가 어느 정도 줄어들면, 레몬즙 1 큰술, 소금 반 작은술, 설탕 1 컵을 넣어줍니다. 저는 만들어 놓은 레몬청도 있어서 넣어 주었답니다. 없으시면 레몬즙만 넣으셔도 되세요.레몬즙에 들어있는 펙틴 성분이 응고를 도와 쨈을 젤리처럼 굳게 만든답니다', 'image_url': 'https://recipe1.ezmember.co.kr/cache/recipe/2023/07/01/d79d147bc3ff1f1bd0a90222a2f16b201.jpg'}, {'step_number': 12, 'description': '토마토 양이 1/4로 줄어들면, 뚜껑을 열고, 타지 않게, 계속 저어줍니다. 저으면서 요렇게 갈라진 곳이 금방 돌아오지 않고, 그대로 있으면 잼이 다 완성된 거랍니다', 'image_url': 'https://recipe1.ezmember.co.kr/cache/recipe/2023/07/01/9f5746b56e41d4756e19aa522fd0db0a1.jpg'}, {'step_number': 13, 'description': '잼 담을 병은, 열탕 소독해서 말려서 준비합니다', 'image_url': 'https://recipe1.ezmember.co.kr/cache/recipe/2023/07/01/a054b12d535f614e3b699f2d88e313121.jpg'}, {'step_number': 14, 'description': '토마토쨈 완성입니다', 'image_url': 'https://recipe1.ezmember.co.kr/cache/recipe/2023/07/01/cfbfd210552ebee6182fe0826bc80daa1.jpg'}]"
151824,양념/잼/소스,일상,채소류,끓이기,서진이네 비빔밥 양념 약고추장 만들기,약고추장,https://recipe1.ezmember.co.kr/cache/recipe/2024/07/26/110c2dca21217fe3c3842145788b00511.jpg,"1,614",60분 이내,초급,6인분 이상,"[('토마토', '160g'), ('배 음료', '300ml'), ('빨간 파프리카', '210g'), ('양파', '100g'), ('대파', '20g'), ('표고버섯', '70g'), ('다진 마늘', '20g'), ('고추장', '300g'), ('진간장', '30ml'), ('설탕', '20g'), ('식용유', '약간')]",서진이네2에서 새롭게 선보인 채식 비빔밥~ 여기에 찰떡 궁합인 약고추장이 있죠! 짜지 않고 감칠맛이 좋아서 많이 넣어도 괜찮아요! 나물 몇 개만 넣어서 약고추장에 슥슥 비비면 완전 맛있어요!,"[{'step_number': 1, 'description': '토마토는 + 모양으로 칼집을 내서 끓는 물에 넣고 데굴데굴 굴려가며 1분간 데쳐준 뒤 껍질을 벗겨줍니다.토마토 160g도마 , 조리용나이프 , 냄비 , 요리스푼칼집을 낸 부분의 껍질이 벌어지며 또르르 말리면 꺼내주세요.토마토 손질법', 'image_url': 'https://recipe1.ezmember.co.kr/cache/recipe/2024/07/26/1c0ec52254d39e7d658d303a69a698f11.jpg'}, {'step_number': 2, 'description': '토마토는 듬성듬성 잘라주고 배음료와 함께 넣어 믹서기에 갈아줍니다.토마토 160g, 배음료 300ml믹서기', 'image_url': 'https://recipe1.ezmember.co.kr/cache/recipe/2024/07/26/5715e6bbbcef8cef56adeec0a5329a991.jpg'}, {'step_number': 3, 'description': '빨간 파프리카는 토치로 겉면을 까맣게 태워준 뒤 물로 씻어 껍질을 벗겨줍니다.빨간 파프리카 210g식힘망 , 토치', 'image_url': 'https://recipe1.ezmember.co.kr/cache/recipe/2024/07/26/a3815d4a33c2bacf4cbb16fd3072b4c31.jpg'}, {'step_number': 4, 'description': '파프리카는 심을 빼내고 잘게 다져줍니다.파프리카 손질법', 'image_url': 'https://recipe1.ezmember.co.kr/cache/recipe/2024/07/26/e73717fc8113d14a6b77edf58fa176c51.jpg'}, {'step_number': 5, 'description': '대파, 표고버섯, 양파도 마찬가지로 잘게 다져줍니다.빨간 파프리카 210g, 양파 100g, 대파 20g, 표고버섯 70g표고버섯 손질법', 'image_url': 'https://recipe1.ezmember.co.kr/cache/recipe/2024/07/26/c0eddf591848f53e3b8dc638ccdc8cb21.jpg'}, {'step_number': 6, 'description': '식용유 두른 팬에 파프리카, 대파, 양파, 표고버섯, 다진마늘을 넣고 중불에서 양파가 투명해질때까지 볶아줍니다.식용유 약간, 빨간 파프리카 210g, 양파 100g, 대파 20g, 표고버섯 70g, 다진마늘 20g프라이팬 , 요리스푼중불', 'image_url': 'https://recipe1.ezmember.co.kr/cache/recipe/2024/07/26/fde5e632a35d9058702933b62cd0b4fc1.jpg'}, {'step_number': 7, 'description': '배음료와 토마토 간 것과 고추장, 설탕, 진간장을 넣어서 잘 섞어줍니다.배음료와 토마토 간 것, 고추장 300g, 진간장 30ml, 설탕 20g', 'image_url': 'https://recipe1.ezmember.co.kr/cache/recipe/2024/07/26/20bbc0713916570ac64de6416ab244b61.jpg'}, {'step_number': 8, 'description': '중약불에서 밑이 눌어붙지 않게 중간중간 저어가며 고추장을 떴을 때 주르륵~ 흘러내릴 정도의 농도로 끓여주면 끝!', 'image_url': 'https://recipe1.ezmember.co.kr/cache/recipe/2024/07/26/39c3f03c6e1bde62775f65b11c6a1a5f1.jpg'}]"
151825,양념/잼/소스,일상,채소류,끓이기,[토마토 캔닝]토마토 오래 보관하고 더 건강하게 먹는 방법,토마토캔닝,https://recipe1.ezmember.co.kr/cache/recipe/2024/07/30/04a1de1809df45ec9365b6e851ba3cde1.jpg,229,30분 이내,초급,6인분 이상,"[('손질한 토마토', '3kg'), ('올리브유', '6T'), ('소금', '1t')]",토마토에 들어있는 항산화 물질 인 라이코펜 은 지용성 이기 때문에 올리브유 와 함께 먹으면 흡수율을 최대 5배 높여줄 수 있다고 합니다. 시댁과 친정에서 보내주신 노지 토마토에 올리브유 넣어 토마토 캔닝 만들어봤습니다.,"[{'step_number': 1, 'description': '토마토를 세척액 또는 베이킹파우더 등을 이용해 깨끗이 세척해 주세요.볼', 'image_url': 'https://recipe1.ezmember.co.kr/cache/recipe/2024/07/30/56e99999a388bff066ede621222376931.jpg'}, {'step_number': 2, 'description': '큰 냄비에 물을 넣고 강불에 끓여줍니다.냄비', 'image_url': 'https://recipe1.ezmember.co.kr/cache/recipe/2024/07/30/519b112e414db3b312e5af61dece997e1.jpg'}, {'step_number': 3, 'description': '토마토 껍질 제거를 위해 토마토 머리 부분에 십자모양으로 칼집을 내주세요.도마 , 조리용나이프완숙 토마토 이거나 토마토 껍질이 얇다면 이 과정은 생략 하셔도 됩니다.토마토 손질법', 'image_url': 'https://recipe1.ezmember.co.kr/cache/recipe/2024/07/30/248cfdc72fa5dac5786966d61c62c43d1.jpg'}, {'step_number': 4, 'description': '큰 보울에 차가운 얼음물을 준비합니다.', 'image_url': 'https://recipe1.ezmember.co.kr/cache/recipe/2024/07/30/4320001559b7dad9b4f8a5186c54d2271.jpg'}, {'step_number': 5, 'description': '냄비의 물이 팔팔 끓어오르면 칼집 낸 토마토를 넣어주세요.요리집게', 'image_url': 'https://recipe1.ezmember.co.kr/cache/recipe/2024/07/30/d68c02674945c01e694f8987e763814a1.jpg'}, {'step_number': 6, 'description': '토마토의 익음 정도나 껍질의 두께에 따라 다르지만 평균 2분가량 가열해줍니다.', 'image_url': 'https://recipe1.ezmember.co.kr/cache/recipe/2024/07/30/7bc6a9e20ffef5bde6af2a022058864c1.jpg'}, {'step_number': 7, 'description': '칼집따라 토마토 껍질이 갈라지며 분리된 토마토는 냄비에서 건져낸 후 찬물에 담궈줍니다,', 'image_url': 'https://recipe1.ezmember.co.kr/cache/recipe/2024/07/30/ab2bd1fefef2528f3daf70101771769c1.jpg'}, {'step_number': 8, 'description': '찬물에 담궜다 건져낸 토마토는 껍질을 벗겨내주세요. 껍질이 잘 안벗겨지는 꼭지 부분은 과도를 이용해 살살 벗겨내주세면 됩니다.', 'image_url': 'https://recipe1.ezmember.co.kr/cache/recipe/2024/07/30/41a45ed8fcea37d2325baf6abbd2d8ad1.jpg'}, {'step_number': 9, 'description': '껍질을 모두 제거한 토마토는 절반 또는 4등분 한 후 꼭지를 제거해줍니다.', 'image_url': 'https://recipe1.ezmember.co.kr/cache/recipe/2024/07/30/c464234300bd9b65478e0010a71d3aa31.jpg'}, {'step_number': 10, 'description': '손질 완료 된 토마토를 큰 냄비에 담아주세요.', 'image_url': 'https://recipe1.ezmember.co.kr/cache/recipe/2024/07/30/5198a02740b33f9819bf940c2268a9841.jpg'}, {'step_number': 11, 'description': '핸드블랜더 또는 믹서기를 이용해 토마토를 모두 갈아줍니다.핸드블렌더핸드블랜더나 믹서기가 없다면 칼로 잘게 다져서 사용하셔도 됩니다.', 'image_url': 'https://recipe1.ezmember.co.kr/cache/recipe/2024/07/30/015b886bd9c07e810ba1dc0a653dbf0c1.jpg'}, {'step_number': 12, 'description': '다 갈아준 토마토 입니다. 약간의 덩어리가 남아도 상관 없습니다. 이제 냄비에 불을 강불로 올려 끓여주세요.', 'image_url': 'https://recipe1.ezmember.co.kr/cache/recipe/2024/07/30/2fb1128a2c696c1318acaba2c07d012d1.jpg'}, {'step_number': 13, 'description': '토마토가 끓기 시작하면 올리브유 6T 넣은 후 15분 강불에서 끓여주세요.조리주걱 , 계량스푼올리브유는 손질 마친 토마토 1kg 기준으로 2T 잡아주시면 됩니다.', 'image_url': 'https://recipe1.ezmember.co.kr/cache/recipe/2024/07/30/4288c8edd0917ff74ceb7153098e53f21.jpg'}, {'step_number': 14, 'description': '소금도 1t넣어주세요.', 'image_url': 'https://recipe1.ezmember.co.kr/cache/recipe/2024/07/30/1dfeab1aab4f6a88d0ad4c731e6f3a031.jpg'}, {'step_number': 15, 'description': '올리브유 와 소금을 넣은 토마토는 끓이는 중간중간 저어주세요.', 'image_url': 'https://recipe1.ezmember.co.kr/cache/recipe/2024/07/30/756b51cd0768ff525c6fb30895043cd81.jpg'}, {'step_number': 16, 'description': '15분간 끓여준 토마토 입니다. 이제 불을 꺼주세요.', 'image_url': 'https://recipe1.ezmember.co.kr/cache/recipe/2024/07/30/796d50b090369094bb41baffea0c7e871.jpg'}, {'step_number': 17, 'description': '깨긋하게 세척하거나 열탕소독 마친 병을 준비해 주세요.유리병', 'image_url': 'https://recipe1.ezmember.co.kr/cache/recipe/2024/07/30/1c8e9cc76d5ae7750dcfd0303706a7df1.jpg'}, {'step_number': 18, 'description': '토마토가 뜨거울 때 병에 넣어주세요.', 'image_url': 'https://recipe1.ezmember.co.kr/cache/recipe/2024/07/30/54cc4e7526e3a7d0fac42bb0490a36d11.jpg'}, {'step_number': 19, 'description': '병입 마친 토마토는 한김 식힌 후 뚜껑을 완전히 닫아주세요!', 'image_url': 'https://recipe1.ezmember.co.kr/cache/recipe/2024/07/30/a5f433595c69e89402895084d41287df1.jpg'}, {'step_number': 20, 'description': '진공화 시키기 위해 뚜껑닫은 토마토 는 거꾸로 세워 실온에서 식혀줍니다. 다 식으면 다시 뒤집어주시면 됩니다. 토마토 캔닝 만들기 완성 되었습니다.', 'image_url': 'https://recipe1.ezmember.co.kr/cache/recipe/2024/07/30/8d4369fa338f2e08765ed82f7b9e2f7d1.jpg'}, {'step_number': 21, 'description': '완성된 토마토 캔닝 은 미개봉시 약 3개월 보관 가능하며, 개봉 후 에는 1주일 이내 소진 해주시면 됩니다.실온보관 가능하지만, 안전을 위해 냉장고 깊숙한 곳 에 보관하셔도 됩니다.', 'image_url': 'https://recipe1.ezmember.co.kr/cache/recipe/2024/07/30/75536ab98a5bedc6785f00cf0eb404781.jpg'}]"
151826,양념/잼/소스,일상,채소류,끓이기,꼬마새송이버섯카레,꼬마새송이버섯카레,https://recipe1.ezmember.co.kr/cache/recipe/2024/08/19/df11a3d2edb8dbddef2a1c0b475222c91.jpg,49,20분 이내,아무나,3인분,"[('꼬마새송이버섯', '듬뿍'), ('감자', '2개'), ('당근', '1/2개'), ('식용유', ''), ('카레가루', '')]",꼬마새송이버섯의 씹히는 식감이 참 좋아요!! 오늘은 꼬마새송이버섯으로 맛있는 카레 만들어보아요.,"[{'step_number': 1, 'description': '감자 썰어 준비해요.도마 , 조리용나이프', 'image_url': 'https://recipe1.ezmember.co.kr/cache/recipe/2024/08/19/4a29af5734a50b1e9c9a8aa9727defb71.jpg'}, {'step_number': 2, 'description': '당근 썰어 준비해요.', 'image_url': 'https://recipe1.ezmember.co.kr/cache/recipe/2024/08/19/e900e29d231766f02a3c850eb8c9ce051.jpg'}, {'step_number': 3, 'description': '버섯 얇게 썰어 준비해요.', 'image_url': 'https://recipe1.ezmember.co.kr/cache/recipe/2024/08/19/a9061d70b224af20093d17a976d646901.jpg'}, {'step_number': 4, 'description': '식용유 살짝 두르고 감자, 당근 볶아요. 감자의 겉이 투명해질때까지 볶아요.냄비 , 조리주걱', 'image_url': 'https://recipe1.ezmember.co.kr/cache/recipe/2024/08/19/b75a482b5a2e926eac228fe4127295071.jpg'}, {'step_number': 5, 'description': '감자가 투명해지면 버섯을 넣고 볶아요.', 'image_url': 'https://recipe1.ezmember.co.kr/cache/recipe/2024/08/19/f9e29a064e9a555f6118e7a402286ecc1.jpg'}, {'step_number': 6, 'description': '물을 넣고 끓여요.', 'image_url': 'https://recipe1.ezmember.co.kr/cache/recipe/2024/08/19/5611424212dfa6121f0cedaf563315311.jpg'}, {'step_number': 7, 'description': '물을 넣고 재료를 익힌 후 재료가 익으면 카레가루를 넣고 휘리릭 저어요.국자 , 완성그릇', 'image_url': 'https://recipe1.ezmember.co.kr/cache/recipe/2024/08/19/78e574c058bdc34c20298eadd2b54eba1.jpg'}]"
