index,종류별,상황별,재료별,방법별,글 제목,레시피이름,레시피이미지,조회수,조리시간,난이도,인분,재료,소개글,조리순서
71432,밥/죽/떡,일상,해물류,볶음,대게볶음밥 [대게 내장과 대게살까지 듬뿍 넣고 만든 리얼 대게 볶음밥! 고소한 감칠맛이 일품!],대게볶음밥,https://recipe1.ezmember.co.kr/cache/recipe/2022/04/13/f8bf9000ca649690f14ec3239ad3425b1.jpg,"12,957",30분 이내,아무나,2인분,"[('대게 내장', '2개'), ('대게살', '2스푼'), ('양파', '1/4개'), ('당근', '5cm'), ('표고버섯', '2개'), ('대파', '1/3개'), ('밥', '1.5컵'), ('진간장', '2스푼'), ('맛술', '2스푼'), ('설탕', '1/2스푼'), ('참기름', '1스푼'), ('깨', '1/2스푼')]","​

오늘은 대게볶음밥 레시피를 소개할게요.

​

대게 등딱지의 내장과

대게살 듬뿍 넣고

고소하게 볶은 볶음밥이에요.

​

냉장고 속 자투리채소 넣고 만드니

냉장고 정리에도 도움이 되고

맛도 더해지는 것 같더라고요.","[{'step_number': 1, 'description': '대게 2마리를 준비했어요.\n등딱지의 내장도 최대한 남기고요.', 'image_url': 'https://recipe1.ezmember.co.kr/cache/recipe/2022/04/13/2d34cded1998ce8d7d3a61a2ab42b09c1.jpg'}, {'step_number': 2, 'description': '양파 1/4개, 당근 5cm,\n표고버섯 2개\n잘게 다져주시고요.\n대파 1/3개는 송송 썰어주세요.', 'image_url': 'https://recipe1.ezmember.co.kr/cache/recipe/2022/04/13/28460c177929ff121e6433f13be7e31e1.jpg'}, {'step_number': 3, 'description': '진간장 2스푼, 맛술 2스푼, 설탕 1/2스푼, \n참기름 1스푼, 깨 1/2스푼\n모두 넣고 골고루 섞어주세요.', 'image_url': 'https://recipe1.ezmember.co.kr/cache/recipe/2022/04/13/7debdc58870a991b26cd8c13ded9f2041.jpg'}, {'step_number': 4, 'description': '향을 위해서 \n대파와 양파 먼저 볶을게요.', 'image_url': 'https://recipe1.ezmember.co.kr/cache/recipe/2022/04/13/961ecc7c8b45a88e3362bc91453316ac1.jpg'}, {'step_number': 5, 'description': '대파와 양파가 투명해지기 시작하면\n표고버섯과 당근도 함께 넣어주세요.\n표고버섯과 당근이 익을 때까지\n볶아주시고요.', 'image_url': 'https://recipe1.ezmember.co.kr/cache/recipe/2022/04/13/49972b929472a2a3fa933958f53e73371.jpg'}, {'step_number': 6, 'description': '채소가 익으면\n대게 내장을 넣어주시고요.\n함께 볶아주세요.\n대게내장에는\n어느정도 간이 되어 있으니까\n소금 1꼬집, 후추 1꼬집 넣고\n살짝만 밑간해 주세요.', 'image_url': 'https://recipe1.ezmember.co.kr/cache/recipe/2022/04/13/642f765972cc4f1db1855f8d16db33fd1.jpg'}, {'step_number': 7, 'description': '밥 1.5컵을 넣어주시고요.\n미리 만들어 둔 양념도 넣어주세요.\n모든 재료들이 잘 섞이도록\n골고루 저으며 볶아주세요.', 'image_url': 'https://recipe1.ezmember.co.kr/cache/recipe/2022/04/13/203eef8222f1a2513951465b9c679a0b1.jpg'}, {'step_number': 8, 'description': '고소한 대게 내장과 대게살,\n다양한 채소 넣고 만든\n대게볶음밥이 완성됐어요.\n고슬고슬한 밥 넣고\n간장양념도 넣고 \n고소하게 볶은 대게볶음밥!\n대게내장과 대게살 넣고 만들었더니,\n역시나 감칠맛 폭발하는 \n맛있는 볶음밥이네요.', 'image_url': 'https://recipe1.ezmember.co.kr/cache/recipe/2022/04/13/f32324d08cbf3714c43548c53a90f3541.jpg'}]"
71433,밥/죽/떡,일상,해물류,볶음,해물짜장볶음밥,해물짜장볶음밥,https://recipe1.ezmember.co.kr/cache/recipe/2015/06/12/fef7f87f2915e69f14c3f893fd6925b8.jpg,"23,202",15분 이내,초급,1인분,"[('돼지고기', '100g'), ('양파', '150g'), ('애호박', '50g'), ('새우', '50g'), ('낙지', '50g'), ('밥', '1공기'), ('계란', '1개'), ('매운고추', ''), ('짜장파우더', '20g')]",고소하고 간단한 짜장볶음밥입니다.,"[{'step_number': 1, 'description': '애호박, 양파, 새우, 낙지, 돼지고기는 적당히 다져줍니다.', 'image_url': 'https://recipe1.ezmember.co.kr/cache/recipe/2015/06/12/8746cecd08f82d0852fcf08d871394d81.JPG'}, {'step_number': 2, 'description': '팬에 기름을 두르고 매운고추를 넣어 볶습니다. 매운향이 올라오면 매운 맛이 올라오면 돼지고기를 볶다 단파와 애호박을 넣고 볶아줍니다, 거기에 해물 넣고 볶아줍니다.', 'image_url': 'https://recipe1.ezmember.co.kr/cache/recipe/2015/06/12/146538c235911570140a36e585b4fc101.jpg'}, {'step_number': 3, 'description': '해물과 고기등이 어느 정도 익으면 밥한공기와 짜장파우더를 넣고 볶아줍니다.', 'image_url': 'https://recipe1.ezmember.co.kr/cache/recipe/2015/06/12/977663d5a696d4e52234435a7ca657d61.JPG'}, {'step_number': 4, 'description': '계란은 풀어 에그 스크램블을 만들어줍니다.', 'image_url': 'https://recipe1.ezmember.co.kr/cache/recipe/2015/06/12/ddaaeb98b759057137b319e1dea9dbf31.JPG'}]"
71434,밥/죽/떡,일상,해물류,볶음,리조또 만들기,리조또,https://recipe1.ezmember.co.kr/cache/recipe/2015/05/14/978e747de04a83b6609cf87a77146d131.jpg,"6,551",60분 이내,중급,1인분,"[('새우', '5마리'), ('아스파라거스', '1줄기'), ('양파', '1/3개'), ('쌀', '2/3컵'), ('마늘', '6개'), ('물', '350ml'), ('토마토소스', '300ml'), ('올리브유', '1T'), ('후추', '1/3t'), ('화이트와인', '1T')]","새우의 진한 풍미가 더해진 리조또인데요~ 특별한 날, 혹은 주말에 만드셔서 건강하고 색다르게 즐겨보셔도 좋을 것 같습니다.","[{'step_number': 1, 'description': '먼저 손을 깨끗하게 씻고필요한 재료를 준비해주세요! 쌀은 불려서 사용하지 않고 차가운 물에 수차례 헹궈 체에 바쳐 물기 없이 준비해주세요.', 'image_url': 'https://recipe1.ezmember.co.kr/cache/recipe/2015/05/15/3fa573e46d62c72a59cf8292b62789551.jpg'}, {'step_number': 2, 'description': '양파는 사방1cm정도 크기로 각지게 잘라 주시구요. 아스파라거스는 어슷하게0.5cm두께로 슬라이스 해 보겠습니다.', 'image_url': 'https://recipe1.ezmember.co.kr/cache/recipe/2015/05/15/e562c8fee5d6d82218994961a84ddee01.jpg'}, {'step_number': 3, 'description': '잡내를 잡아주고 풍미를 더해 줄 마늘은 0.2cm두께로 편썰어서 준비해 두겠습니다.', 'image_url': 'https://recipe1.ezmember.co.kr/cache/recipe/2015/05/15/dc580679954ee85e83bca52312c6eb701.jpg'}, {'step_number': 4, 'description': '새우는 껍질을 벗겨 주시고,가능하시면 이쑤시개로 내장을 제거해주세요! 번거로우시다면 생략은 가능하지만,혹시 사용하시는 새우의 크기가 큰 편이라면 제거해 주시는 편이 좋습니다 .큰 새우의 내장은 마치 해감이 덜 된 조개처럼 이물감이 느껴질 수 있거든요~ 껍질과 대가리는 따로 모아주세요. 육수로 활용해 볼거에요~', 'image_url': 'https://recipe1.ezmember.co.kr/cache/recipe/2015/05/15/596dd10f86cdf6ba9eb171f320665d9c1.jpg'}, {'step_number': 5, 'description': '따로 준비해 둔 새우껍질과 대가리는 물350ml를 넣고 끓여주세요. 전체 양이 2/3정도로 줄어 들 때까지, 우르르 끓어오른 시점을 기준으로 10분정도 중불에서 더 끓여주세요.', 'image_url': 'https://recipe1.ezmember.co.kr/cache/recipe/2015/05/15/23db46e92ab6bae5fd8c24c612b0b6411.jpg'}, {'step_number': 6, 'description': '자, 이제 냄비를 하나 준비해주시고 중불에서 3분간 예열하신 다음 올리브유1T를 넣고 양파와 마늘을 먼저 함께 볶다가 아스파라거스도 넣어주세요. 불을 강불로 올려주시고, 새우로 이때 넣겠습니다. 잡내를 잡아 줄 화이트 와인1T도 넣어주시고 새우의 표면이 살짝 붉게 변하면 씻어 놓은 쌀을 넣고 볶기 시작하겠습니다.', 'image_url': 'https://recipe1.ezmember.co.kr/cache/recipe/2015/05/15/b577af45d5c5ad28748a6955e5cc0dec1.jpg'}, {'step_number': 7, 'description': '이쯤 되면, 새우육수가 잘 끓어오르고 있을거에요. 중간 중간 불순물 한번씩 제거 해 주시면 좋겠죠?', 'image_url': 'https://recipe1.ezmember.co.kr/cache/recipe/2015/05/15/bcb087cf64aa3ec9ca319a6f997f91351.jpg'}, {'step_number': 8, 'description': '육수는 좀더 바글바글 끓여주시고, 쌀알을 볶다가 조금 투명해 질 때, 바로 토마토소스를 넣어주세요! 이 때 부터, 다시 불은 중불로 낮춰주시고 타지않게 계속해서 저어주셔야합니다.', 'image_url': 'https://recipe1.ezmember.co.kr/cache/recipe/2015/05/15/d2eae10144630716162a74a73b3e1b171.jpg'}, {'step_number': 9, 'description': '2/3정도의 양으로 줄어든 새우 육수를 부어주시고 잘 섞어가면서 익히기 시작해 보겠습니다.', 'image_url': 'https://recipe1.ezmember.co.kr/cache/recipe/2015/05/15/d136417b483ab6d9377d23afcdb1c4a91.jpg'}, {'step_number': 10, 'description': '0] 육수를 넣은 뒤 한번 끓어올랐을 때, 간을 보시고 부족한 간은 소금과 후추로 더해주세요. 그리고, 중불을 유지해 가면서 수분이 완전히 쌀알에 배어들 때 까지 열심히 저어가면서 익혀주시면 됩니다 .15분~20분정도 소요되는 것 같아요! 가장 확실한 방법은, 먹어 보는 것 이겠죠? 쌀알이 잘 익었다면, 그릇에 담아 새우와 함께 올려주세요~저는 쑥갓 잎을 조금 뜯어서 곁들여봤습니다.정성이 가득한,홈메이드 리조또 만들기 끝입니다!!', 'image_url': 'https://recipe1.ezmember.co.kr/cache/recipe/2015/05/15/6adc15e14fdded31a653689562e02cb81.jpg'}]"
71435,밥/죽/떡,일상,해물류,볶음,"전복볶음밥, 원기회복에 좋은 음식 전복내장볶음밥, 전복요리 만들기",전복볶음밥,https://recipe1.ezmember.co.kr/cache/recipe/2016/10/13/cc0a6a227822b59de5bd9331dde572411.jpg,"14,410",30분 이내,초급,2인분,"[('밥', '2공기'), ('전복', '3개'), ('양파', '적당량'), ('당근', '적당량'), ('참기름', '2'), ('소금', '적당량'), ('굴소스', '0.5'), ('후춧가루', '')]","8~10월이 제철인 전복은 다른 어류보다 단백질 함량이 높고, 다양한 아미노산이 풍부한데 피로 해소에 좋은 아르기닌과 타우린이 등이 대표적이에요.
또한 원기회복에 좋은 전복내장 버리지 말고 요리에 이용하세요.
전복의 깊은 맛을 새롭게 느낄 수 있어요.","[{'step_number': 1, 'description': '전복은 살살 문질러 검은색이 없도록 깨끗이 씻은 다음, 껍데기가 얇은 쪽에 수저를 넣어 떠내 듯 전복 살을 떼어낸다.', 'image_url': 'https://recipe1.ezmember.co.kr/cache/recipe/2016/10/13/c159dc459d67baf20ea8ee4a225a6de71.jpg'}, {'step_number': 2, 'description': '전복 내장은 따로 떼어 내고 전복 끝부분의 입은 잘라 버린 다음, 먹기 좋은 크기로 썬다.', 'image_url': 'https://recipe1.ezmember.co.kr/cache/recipe/2016/10/13/ff00bb1ce36c83108b312f7a475381ea1.jpg'}, {'step_number': 3, 'description': '전복 내장은 믹서기에 곱게 간다.\n이때 물을 한 숟갈 넣어주면 더 잘 갈린다.', 'image_url': 'https://recipe1.ezmember.co.kr/cache/recipe/2016/10/13/8991b50fd324c37907ca93889a39186d1.jpg'}, {'step_number': 4, 'description': '야채는 잘게 다진다.', 'image_url': 'https://recipe1.ezmember.co.kr/cache/recipe/2016/10/13/2b5193e091f5b59d5acd52e1822c8f231.jpg'}, {'step_number': 5, 'description': '팬에 참기름 2를 두르고 전복을 볶는다.', 'image_url': 'https://recipe1.ezmember.co.kr/cache/recipe/2016/10/13/d72d14b79e1509407410444315ad58a81.jpg'}, {'step_number': 6, 'description': '준비한 야채를 넣고 소금 간을 살짝 해 볶는다.', 'image_url': 'https://recipe1.ezmember.co.kr/cache/recipe/2016/10/13/5bd10fcbadb81157bfc4893db45dfcf01.jpg'}, {'step_number': 7, 'description': '갈아둔 전복내장을 넣고, 후춧가루를 넣어 달달 볶는다.', 'image_url': 'https://recipe1.ezmember.co.kr/cache/recipe/2016/10/13/eaa03cff7743ab09c9365e1aa12bd2c21.jpg'}, {'step_number': 8, 'description': '밥 2공기를 넣고, 굴 소스 0.5를 넣어 볶는다.\n모자란 간은 소금으로 한다.\n굴 소스가 없다면 소금으로만 간 한다.', 'image_url': 'https://recipe1.ezmember.co.kr/cache/recipe/2016/10/13/e34acd3055a267fd48b1f7480fccf2791.jpg'}]"
71436,밥/죽/떡,일상,해물류,볶음,매콤하게 끌리는 간장오징어볶음덮밥,간장오징어볶음덮밥,https://recipe1.ezmember.co.kr/cache/recipe/2015/07/16/44d89d19c3fc1cf6fc8396b2b8d495fe.jpg,"16,004",15분 이내,초급,2인분,"[('오징어', '1마리'), ('숙주', '1줌'), ('양배추', ''), ('양파', ''), ('고추기름', '1T'), ('오일', '1T'), ('참기름', '약간'), ('간장', '3T'), ('고추가루', '1/2T'), ('맛술', '1T'), ('설탕', '1T'), ('다진 청양고추', '1개'), ('다진파', '1.5T'), ('다진마늘', '1T'), ('다진생강', '1/2ts'), ('후추가루', '약간')]",훌륭한 한끼식사인 간장오징어볶음덮밥입니다.,"[{'step_number': 1, 'description': '양념장을 미리 만들어 놓습니다.', 'image_url': 'https://recipe1.ezmember.co.kr/cache/recipe/2015/07/16/f86fdd5958ebfdf5c43455074dba501a1.jpg'}, {'step_number': 2, 'description': '오징어는 깨끗히 씻어서 먹기좋게 손질해둡니다.오징어 손질법 레시피', 'image_url': 'https://recipe1.ezmember.co.kr/cache/recipe/2015/07/16/0066a37b68be1e7d7ebe615b16c96a3d1.jpg'}, {'step_number': 3, 'description': '간단히 야채를 준비해주세요.', 'image_url': 'https://recipe1.ezmember.co.kr/cache/recipe/2015/07/16/bf2dea446b6082ed4da18d1ed1da6fcb1.jpg'}, {'step_number': 4, 'description': '웍에 고추기름과 오일을 두르시고, 숙주를 제외한 야채를 먼저 볶아줍니다.', 'image_url': 'https://recipe1.ezmember.co.kr/cache/recipe/2015/07/16/816803c3d3385aa44426b4d592b7f6d01.jpg'}, {'step_number': 5, 'description': '손질해놓은 오징어를 넣고 미리 만들어 놓은 양념장 넣어 볶아줍니다.', 'image_url': 'https://recipe1.ezmember.co.kr/cache/recipe/2015/07/16/67fa6dd917a8b19b45725be090ed966f1.jpg'}, {'step_number': 6, 'description': '오징어가 익으면 숙주를 넣어주고 마지막에 참기름을 둘러주어 마무리해주세요.', 'image_url': 'https://recipe1.ezmember.co.kr/cache/recipe/2015/07/16/51821fcdc57b69c1ae857cb5d0c3b8161.jpg'}]"
71437,밥/죽/떡,일상,해물류,볶음,참치와 간장의 조합! 버섯참치 간장볶음밥 ^^,버섯참치간장볶음밥,https://recipe1.ezmember.co.kr/cache/recipe/2016/02/06/0da680c2211e7e5a9b3ed4b76ff275471.jpg,"7,695",30분 이내,아무나,2인분,"[('참치', '1캔'), ('파', '1대'), ('양파(소)', '1.5'), ('당근', '1/3개'), ('감자(중)', '1개'), ('버섯', '2개'), ('애호박', '조금'), ('콘', '조금'), ('매운고추', '조금'), ('간장', '2T'), ('참기름', '1t'), ('소금', '2꼬집'), ('버터', '1t'), ('후추', '1/2t')]","색다른 조합의 볶음밥 레시피를 소개합니다! 참치와 버섯을 주재료로 만든 볶음밥에, 간장파소스를 곁들여 먹는 정말 맛있는 볶음밥이에요~^^ 색다른 볶음밥 레시피에 도전해보세요!","[{'step_number': 1, 'description': '재료를 준비해주세요~!', 'image_url': 'https://recipe1.ezmember.co.kr/cache/recipe/2016/02/06/f06da2fd329be5a938956af45c7d82a61.jpg'}, {'step_number': 2, 'description': '재료들은 썰어서 볶기 좋게 담아둡니다. 볶음밥 용으로 너무 크지 않게 썰어주세요.', 'image_url': 'https://recipe1.ezmember.co.kr/cache/recipe/2016/02/06/1ccf45ea2bbc311671e2c3349c789daa1.jpg'}, {'step_number': 3, 'description': '볶음밥과 곁들일 파간장소스를 만듭니다. 잘게 썰어놓은 파를 종지그릇에 넣어주세요.', 'image_url': 'https://recipe1.ezmember.co.kr/cache/recipe/2016/02/06/79661b669f2bdfbd37c34578eba3dcf21.jpg'}, {'step_number': 4, 'description': '간장 2T / 참기름 1t / 소금 두 꼬집(생략가능) 을 넣고 잘섞어주면 양념장은 완성입니다.', 'image_url': 'https://recipe1.ezmember.co.kr/cache/recipe/2016/02/06/9f80f0fee126aad53d0dabaab21248841.jpg'}, {'step_number': 5, 'description': '넉넉한 크기의 팬에 기름을 넉넉히 두르고 감자랑 당근부터 볶아주세요.', 'image_url': 'https://recipe1.ezmember.co.kr/cache/recipe/2016/02/06/0d278de58390af9d635e5e93976f5d6d1.jpg'}, {'step_number': 6, 'description': '감자가 투명해질 즈음, 양파와 애호박을 넣고 볶아줍니다.', 'image_url': 'https://recipe1.ezmember.co.kr/cache/recipe/2016/02/06/0ddad39d6f56136780fb31e6fe116f091.jpg'}, {'step_number': 7, 'description': '나머지 재료들을 모두 넣고 마저 볶아주세요.', 'image_url': 'https://recipe1.ezmember.co.kr/cache/recipe/2016/02/06/735742657e0fcff3a5f3d59b14978da61.jpg'}, {'step_number': 8, 'description': '참치는 체에 걸러서 물기를 빼고 난 뒤, 팬에 옮겨담아주세요. 통후추를(1/2t) 갈아 넣고 함께 볶습니다.', 'image_url': 'https://recipe1.ezmember.co.kr/cache/recipe/2016/02/06/7448a2760334475474a5934fdc8f26551.jpg'}, {'step_number': 9, 'description': '밥도 한 공기 반 담아주세요. 버터 1t를 넣어 향을내며 함께 볶습니다.', 'image_url': 'https://recipe1.ezmember.co.kr/cache/recipe/2016/02/06/268e86511a4cbdfec1a75bfed5dd56091.jpg'}, {'step_number': 10, 'description': '고루 잘 볶아주면 완성입니다 :)', 'image_url': 'https://recipe1.ezmember.co.kr/cache/recipe/2016/02/06/1bb0dcc2403638e49b13363de9a095511.jpg'}]"
71438,밥/죽/떡,일상,해물류,볶음,오징어 덮밥,오징어덮밥,https://recipe1.ezmember.co.kr/cache/recipe/2016/02/24/1e5d579caead4a69f3d69d200f9928411.jpg,"3,041",15분 이내,초급,3인분,"[('오징어', '1마리'), ('양파', '1/2'), ('양배추', '1/4'), ('풋고추', '1개'), ('파프리카', '1/4'), ('멸치 육수', '1/2컵'), ('간장', '1수저'), ('고추장', '1수저'), ('고추가루', '1수저'), ('참기름', ''), ('식용유', ''), ('마늘다진것', ''), ('파', ''), ('깨소금', ''), ('설탕', ''), ('맛술', '')]",저녁거리가 마당치안아 냉동실에 오징어와 냉장실에 야채로 오징어 볶음을 만들었습니다.,"[{'step_number': 1, 'description': '오징어. 양배추. 양파. 파. 마늘 다진것. 고추장. 고추가루. 식용유.참기름 .깨소금. 간장. 후추를 준비합니다.', 'image_url': 'https://recipe1.ezmember.co.kr/cache/recipe/2016/02/24/9b612bf64fcf3000c1c8b8cf1e7752e51.jpg'}, {'step_number': 2, 'description': '식용유에 마늘을 넣고 마늘 기름을 만듭니다.', 'image_url': 'https://recipe1.ezmember.co.kr/cache/recipe/2016/02/24/672b30e60cd5be197db5867108ff1f301.jpg'}, {'step_number': 3, 'description': '2에 양념한 오징어를 볶습니다.', 'image_url': 'https://recipe1.ezmember.co.kr/cache/recipe/2016/02/24/7ed2169f5b1258b66643dcc91e6e9aca1.jpg'}, {'step_number': 4, 'description': '오징어가 반쯤 익으면 준비된 야채를 넣고 볶고 다익으면 멸치육수를 붓고 한번더 볶습니다.', 'image_url': 'https://recipe1.ezmember.co.kr/cache/recipe/2016/02/24/a1383d065a4521500c9423a4292e55431.jpg'}, {'step_number': 5, 'description': '4를 밥위에 같이 놓습니다. 깨소금으로 장식하면 맛있는 오징어 덮밥이 됩니다.', 'image_url': 'https://recipe1.ezmember.co.kr/cache/recipe/2016/02/24/55405e3b2de80329651172d37844b58c1.jpg'}]"
71439,밥/죽/떡,일상,해물류,볶음,오징어덮밥,오징어덮밥,https://recipe1.ezmember.co.kr/cache/recipe/2015/08/24/5bb20cb9e8fcf3fccd9003244e1711d6.jpg,"8,779",30분 이내,초급,4인분,"[('오징어', '2마리'), ('대파', ''), ('당근', ''), ('호박', ''), ('양파', ''), ('고추장', '4큰술'), ('고춧가루', '1큰술'), ('설탕', '4큰술'), ('다진마늘', '3큰술'), ('간장', '3큰술'), ('조미술', '2큰술'), ('후추', '약간')]",쫄깃하고 매콤한 오징어 덮밥입니다.,"[{'step_number': 1, 'description': '오징어 2마리는 살짝 얼린 상태에서 껍질 반대쪽에 촘촘하게 칼집을 넣어요. 일반 식도로 한줄씩 칼집을 넣으려면 시간도 오래 걸리고 일정한 간격으로 칼집넣기 힘드니까 파채칼로 칼집을 넣으면 쉽답니다. 대파도 어슷썰어 준비해놓고 당근, 호박, 양파도 적당한 크기로 썰어 준비합니다.', 'image_url': 'https://recipe1.ezmember.co.kr/cache/recipe/2015/08/26/13c89a28e2f21100f01abdacf5e154791.jpg'}, {'step_number': 2, 'description': '칼집넣은 오징어는 끓는물에 살짝 데쳐서 볶을거에요. 물이 끓을때 오징어를 넣고 바로 불을 끈후에 남은 열로 질기지않게 데친후 물기를 빼줍니다. 오징어를 넣고 팔팔 끓이면 질겨져서 안되고, 생물 오징어를 그대로 볶으면 물기가 많이 생겨요.', 'image_url': 'https://recipe1.ezmember.co.kr/cache/recipe/2015/08/26/67916c1b2e95b429a8b3ea6db1053efd1.jpg'}, {'step_number': 3, 'description': '고추장 4큰술, 고추가루 1큰술, 설탕 4큰술, 다진마늘 3큰술, 간장 3큰술, 조미술 2큰술, 후추 약간 저는 양념양을 좀 많이 넣는 편이에요. 너무 매운게 싫으시면 고추장 양을 좀 줄여서 넣으세요.', 'image_url': 'https://recipe1.ezmember.co.kr/cache/recipe/2015/08/26/557f8441f947049669b0ae77007ee71a1.jpg'}, {'step_number': 4, 'description': '데친 오징어와 양념을 넣고 계속 센불을 유지하면서 볶아주세요. 야채 볶는 순간부터 완성할때까지 센불을 유지해야 하는거 잊지마세요.', 'image_url': 'https://recipe1.ezmember.co.kr/cache/recipe/2015/08/26/be07f1466e17258ac8ad6277b473fc911.jpg'}, {'step_number': 5, 'description': '국물이 흥건한 오징어 볶음을 원하시면 오징어 데치지않거나 불 세기를 중간불로 하시면 좋은데 저는 이번에 약간의 불맛이 나면서 빡빡한 오징어 볶음을 원해서 요렇게 만들었어요.', 'image_url': 'https://recipe1.ezmember.co.kr/cache/recipe/2015/08/26/125dbf9b1f2dc279fdc2fce45e55612a1.jpg'}]"
71440,밥/죽/떡,일상,해물류,볶음,유산슬덮밥 : 중국집 배달시켜면 비싼 유산슬! 집에서 푸짐하게 유산슬만들기,유산슬덮밥,https://recipe1.ezmember.co.kr/cache/recipe/2020/04/16/e18babb50f613a083632cd15ef98b2c91.png,"53,826",20분 이내,아무나,2인분,"[('돼지고기', '100g'), ('양파', '1/4개'), ('표고버섯', '2개'), ('죽순', '1/4개'), ('불린 해삼', '1/6개'), ('새우', '5마리'), ('팽이버섯', '1/2봉'), ('마늘', '3톨'), ('대파', '1/2대'), ('굴소스', '1숟가락'), ('간장', '1숟가락'), ('청주', '1숟가락'), ('설탕', '1/2숟가락'), ('소금', '약간'), ('후추', '약간'), ('치킨육수', '2종이컵'), ('생강', '1쪽'), ('식용유', '적당량'), ('간장', '1숟가락'), ('설탕', '1/2숟가락'), ('청주', '1숟가락'), ('전분', '1숟가락'), ('물', '2숟가락'), ('전분', '1숟가락')]","돼지고기와 해산물을 길게 채 썰어 만든 중국요리 중 하나! 
"" 유산슬 "" 비싸서 가끔씩 시켜먹었다면 ㅜㅜ
이젠 집에서도 중식요리를 만들어 보아요! 
세상의 모든 레시피 만개의레시피","[{'step_number': 1, 'description': '대파는 반으로 갈라 5cm 길이로 썰고, 마늘, 생강 편 썬다.', 'image_url': 'https://recipe1.ezmember.co.kr/cache/recipe/2020/04/16/73ea552c35c52472f82d899799cb44d71.png'}, {'step_number': 2, 'description': '양파, 표고버섯, 해삼, 죽순은 채 썬다.', 'image_url': 'https://recipe1.ezmember.co.kr/cache/recipe/2020/04/16/b18bc2c918697836c4374a916b2a71811.png'}, {'step_number': 3, 'description': '돼지고기는 밑간 재료를 넣고 고루 섞는다.', 'image_url': 'https://recipe1.ezmember.co.kr/cache/recipe/2020/04/16/2ea73a2dc0a1b9af4845311c11b2a87f1.png'}, {'step_number': 4, 'description': '팬에 기름을 넉넉히 두르고 돼지고기를 데치듯이 볶아 건진다.팬', 'image_url': 'https://recipe1.ezmember.co.kr/cache/recipe/2020/04/16/940a9b858be463dd111f748c53f4b7a31.png'}, {'step_number': 5, 'description': '달군 팬에 기름을 두르고 대파, 생강, 마늘을 볶는다.팬', 'image_url': 'https://recipe1.ezmember.co.kr/cache/recipe/2020/04/16/d5786a968e0c3484572fe35421eff4ee1.png'}, {'step_number': 6, 'description': '기름에 데친 돼지고기를 넣고 양파, 죽순, 해삼, 표고버섯, 팽이버섯을 넣고 볶는다.', 'image_url': 'https://recipe1.ezmember.co.kr/cache/recipe/2020/04/16/430995356adb530843762a8fff1a43aa1.png'}, {'step_number': 7, 'description': '간장, 청주, 굴소스, 설탕, 치킨육수를 넣고 끓인다.', 'image_url': 'https://recipe1.ezmember.co.kr/cache/recipe/2020/04/16/174e0e684bc1ae581012f52848f3361e1.png'}, {'step_number': 8, 'description': '전분 물로 농도를 맞춘 후 소금, 후추를 넣고 간을 맞춰 완성한다.', 'image_url': 'https://recipe1.ezmember.co.kr/cache/recipe/2020/04/16/2f3aaf502962fd51615a7b7854d5297d1.png'}]"
