index,종류별,상황별,재료별,방법별,글 제목,레시피이름,레시피이미지,조회수,조리시간,난이도,인분,재료,소개글,조리순서
159627,샐러드,다이어트,해물류,무침,요즘같이 더운 날 입맛 없을 땐? 새콤달콤한 해파리냉채!,해파리냉채,https://recipe1.ezmember.co.kr/cache/recipe/2016/07/21/3c4c80ecacb9add0bcb3f4bee40193581.jpg,"21,849",15분 이내,초급,2인분,"[('손질된 해파리', '150g'), ('오이(소)', '1개'), ('마늘', '4쪽'), ('설탕', '2T'), ('간장', '2T'), ('식초', '2T'), ('물', '5T'), ('겨자가루', '1/2t'), ('참기름', '1/2T')]","요즘 같이 더운 날 지치고 입맛도 없으시죠? 만들기도 초간단, 살도 안찌는 새콤한 해파리냉채로 집 나간 입맛을 되돌려 보세요 :)","[{'step_number': 1, 'description': '재료를 준비해주세요.\n(저는 염장해파리를 찬물에 1시간 정도 담가 두어 미리 소금기를 빼주었습니다)', 'image_url': 'https://recipe1.ezmember.co.kr/cache/recipe/2016/07/21/8e84a6cf59de0a6b17364ebdc81653361.jpg'}, {'step_number': 2, 'description': '손질 된 해파리 150g을 끓는 물에 데쳐주시는데요, 딱 8초 간만 데치시고 재빨리 꺼내어서', 'image_url': 'https://recipe1.ezmember.co.kr/cache/recipe/2016/07/21/16db86328fa21ecc5c91e0663e9309d61.jpg'}, {'step_number': 3, 'description': '찬물에 헹구어 열기를 빼주세요.', 'image_url': 'https://recipe1.ezmember.co.kr/cache/recipe/2016/07/21/4312784b83dc76328f031d2a5c2b076e1.jpg'}, {'step_number': 4, 'description': '데친 해파리는 바로 사용하면 비린내가 나므로 다른 재료를 손질 할 동안 찬물에 담가 비린맛을 날려주세요.해파리 손질법 레시피', 'image_url': 'https://recipe1.ezmember.co.kr/cache/recipe/2016/07/21/e97bdfc28ef63fd02a96e01e0c294fba1.jpg'}, {'step_number': 5, 'description': '오이는 소금으로 문질러 씻어 곱게 채 썰어주세요.', 'image_url': 'https://recipe1.ezmember.co.kr/cache/recipe/2016/07/21/14a581aa8cb4c83e06eac9ba792dc3641.jpg'}, {'step_number': 6, 'description': '마늘도 곱게 다져주세요.', 'image_url': 'https://recipe1.ezmember.co.kr/cache/recipe/2016/07/21/6401d2a2dfba4b990cec082420919df61.jpg'}, {'step_number': 7, 'description': '양념장을 만들어볼게요. 물 5T,', 'image_url': 'https://recipe1.ezmember.co.kr/cache/recipe/2016/07/21/18fbcb45b3fadbdac69294626ff9a0fa1.jpg'}, {'step_number': 8, 'description': '설탕 2T,', 'image_url': 'https://recipe1.ezmember.co.kr/cache/recipe/2016/07/21/1d3d22b60d779bd9bc1b6401af6f14411.jpg'}, {'step_number': 9, 'description': '간장 2T,', 'image_url': 'https://recipe1.ezmember.co.kr/cache/recipe/2016/07/21/2df63010140858741240780e34a5d0bc1.jpg'}, {'step_number': 10, 'description': '식초도 2T,', 'image_url': 'https://recipe1.ezmember.co.kr/cache/recipe/2016/07/21/537c0284d8aee7ab090e4db15e5041c91.jpg'}, {'step_number': 11, 'description': '다져둔 마늘, 겨자가루 1/2t, 참기름 1/2T를 넣어 잘 섞어주세요.', 'image_url': 'https://recipe1.ezmember.co.kr/cache/recipe/2016/07/21/fd3c82a4c17e91c697a1b1d74598568f1.jpg'}, {'step_number': 12, 'description': '데쳐서 찬물에 담가 둔 해파리는 체에 받쳐 물기를 빼주세요. 이제 채 썰어 둔 오이와 함께 양념장을 넣고 조물조물 무칠거예요.', 'image_url': 'https://recipe1.ezmember.co.kr/cache/recipe/2016/07/21/81beae735ccb8569f9e94ea2fec260731.jpg'}, {'step_number': 13, 'description': '오목한 볼에 해파리를 담아주세요. 저는 먹음직스럽게 담으려고 고명용으로 해파리를 약간 빼두었어요 :)', 'image_url': 'https://recipe1.ezmember.co.kr/cache/recipe/2016/07/21/e3908926ffff19564e27c8a5745e5de01.jpg'}, {'step_number': 14, 'description': '볼에 오이채, 만들어 둔 양념장 1/2을 넣어주시고 조물조물, 맛있게 버무려주세요.', 'image_url': 'https://recipe1.ezmember.co.kr/cache/recipe/2016/07/21/af3e0ca7d2492cfda74e2ed653e6bf951.jpg'}, {'step_number': 15, 'description': '무쳐낸 해파리를 그릇에 보기좋게 담아내시고 아까 고명용으로 남겨둔 해파리를 살짝 올려 준 뒤, 남은 양념장을 끼얹어 주시면 완성입니다 :)', 'image_url': 'https://recipe1.ezmember.co.kr/cache/recipe/2016/07/21/fbf015b5c4d1a8da470634255c441c921.jpg'}]"
159628,샐러드,다이어트,해물류,무침,오징어샐러드 쫄깃쫄깃 타우린 가득!,오징어샐러드,https://recipe1.ezmember.co.kr/cache/recipe/2019/01/02/7e414d06a7718ead5f3fc8c6cbf1df711.jpg,"52,226",20분 이내,아무나,2인분,"[('오징어', '1마리'), ('샐러드 채소                                                                                80g', '2줌'), ('양파', '1/4개'), ('방울토마토', '4개'), ('소금', '1/3숟가락'), ('맛술', '1숟가락'), ('올리브유', '2숟가락'), ('발사믹식초', '3숟가락'), ('올리고당', '2숟가락'), ('레몬즙', '1숟가락'), ('소금', '약간'), ('후추', '약간'), ('통깨', '1/2숟가락')]","피로회복에 좋은 타우린이 가득한 
오징어로만든 건강하고 상큼한 샐러드! 

세상의 모든 레시피 만개의레시피","[{'step_number': 1, 'description': '양파는 채 썰어 찬물에 10분 담가 건진다.양파를 찬물에 담가주면 매운맛이 빠져요.', 'image_url': 'https://recipe1.ezmember.co.kr/cache/recipe/2019/01/02/7926c5890873b080183952980dc594541.jpg'}, {'step_number': 2, 'description': '손질한 오징어는 한 입 크기로 썰고 끓는 물에 소금, 맛술을 넣고 1~2분간 데친다.오래 데치면 질겨지니 오징어가 익었을때 바로 건져주세요. 오징어손질법', 'image_url': 'https://recipe1.ezmember.co.kr/cache/recipe/2019/01/02/896ae8eb14e01e49143226e7edbe37f31.jpg'}, {'step_number': 3, 'description': '볼에 양념 재료를 넣고 양념장을 만든다.볼', 'image_url': 'https://recipe1.ezmember.co.kr/cache/recipe/2019/01/02/960faf058b6e7ff69644f92ff0f390541.jpg'}, {'step_number': 4, 'description': '그릇에 샐러드채소를 담고 양파, 방울토마토, 오징어를 넣은 후 소스를 뿌려 완성한다.그릇', 'image_url': 'https://recipe1.ezmember.co.kr/cache/recipe/2019/01/02/5f4dbbb08afdcff8abf5a46f9b3feeda1.jpg'}]"
159629,샐러드,다이어트,해물류,무침,관자와 청상추 아보카도 샐러드♥,관자아보카도샐러드,https://recipe1.ezmember.co.kr/cache/recipe/2018/04/03/3c73aac3e0dcfce80c53163ad0aa00c71.jpg,"3,088",15분 이내,초급,3인분,"[('키조개 관자                                                                                150-200g', '2개'), ('청상추', '1줌'), ('아보카도', '1/2개'), ('플레인 요구르트', '3T'), ('올리브 오일', '1T'), ('올리고당', '2t'), ('레몬즙', '1t'), ('소금', '1꼬집'), ('레몬즙', '1t'), ('홀그레인 머스터드', '1/2t'), ('간마늘', '1/2t')]","키조개 관자의 볼륨감이 눈이 즐거운 샐러드♥
청상추의 상큼함과, 아보카도의 마일드함이 잘어울리는 한 접시! 식탁의 주인공이 되어준답니다:)","[{'step_number': 1, 'description': '청상추는 먹기 좋게 잘라줍니다. 아보카도는 씨를 빼고 껍질을 벗겨 먹기 편한 크기로 잘라주세요.', 'image_url': 'https://recipe1.ezmember.co.kr/cache/recipe/2018/04/03/3ed97f2d266835febb2fb205826ce4ed1.jpg'}, {'step_number': 2, 'description': '분량의 드레싱 재료를 넣고 잘 섞어주세요.', 'image_url': 'https://recipe1.ezmember.co.kr/cache/recipe/2018/04/03/0e72e5a761000ea0d3290c11a685f7601.jpg'}, {'step_number': 3, 'description': '끓는물에 조개관자를 결대로 채썰어 넣어 완저히 익혀주고,', 'image_url': 'https://recipe1.ezmember.co.kr/cache/recipe/2018/04/03/1cdea315684b6dc8e95c8af5accc16c11.jpg'}, {'step_number': 4, 'description': '청상추, 아보카도, 키조개 관자를 접시에 담고 드레싱을 뿌려주시면 끄읕~!!\n기호에 따라 허브나 페퍼로치노홀등을 뿌려 주셔도 좋아요\n:)', 'image_url': 'https://recipe1.ezmember.co.kr/cache/recipe/2018/04/03/794f249bcaeea995f2a11a06474029451.jpg'}]"
159630,샐러드,다이어트,해물류,무침,꼬시래기 곤약 샐러드 /해초 샐러드/ 해초요리,꼬시래기곤약샐러드,https://recipe1.ezmember.co.kr/cache/recipe/2022/08/16/ceb169891a9027b83574e360b513f59d1.jpg,"1,294",20분 이내,초급,2인분,"[('꼬시래기', '40g'), ('곤약', '40g'), ('당근', '30g'), ('맛살', '60g'), ('마요네즈', '5큰술'), ('설탕', '1티스푼'), ('파슬리', '1/2티스푼'), ('소금', '1/3티스푼'), ('깨소금', '')]",꼬시래기의 꼬들꼬들한 식감과 곤약의 쫀득한 식감이 샐러드와 너무 잘 어울립니다.그리고 다이어트 하시는 분들께도 좋습니다.,"[{'step_number': 1, 'description': '염장 된 꼬시래기를 찬물에 20 분간 담구어 짠맛을 제거한 후 끓는 물에 넣었다가 바로 찬물에 2~3번 씻어 줍니다.센 불에서 데쳐 줍니다.', 'image_url': 'https://recipe1.ezmember.co.kr/cache/recipe/2022/08/15/c95034a0d82ace42440f686efcfba9da1.jpg'}, {'step_number': 2, 'description': '꼬시래기의 물기를 뺀 후 먹기 좋은 크기로 잘라서 준비를 합니다.', 'image_url': 'https://recipe1.ezmember.co.kr/cache/recipe/2022/08/15/852c500e0690a9e0a083079c0cbb766a1.jpg'}, {'step_number': 3, 'description': '곤약은 끓는물에 데쳐 준 후 물기를 빼줍니다.센 불에서 데쳐 줍니다.', 'image_url': 'https://recipe1.ezmember.co.kr/cache/recipe/2022/08/15/6ecb922842ce486bc8a6b6c22910bd761.jpg'}, {'step_number': 4, 'description': '물기가 빠지면 곤약을 얇게 채 썰어줍니다.', 'image_url': 'https://recipe1.ezmember.co.kr/cache/recipe/2022/08/15/9acf898820a02d23882cad845db792de1.jpg'}, {'step_number': 5, 'description': '맛살은 비닐을 벗기고 먹기 좋게 찢어줍니다.', 'image_url': 'https://recipe1.ezmember.co.kr/cache/recipe/2022/08/15/f8cfcb55132ccabc8c54a8c9124012f51.jpg'}, {'step_number': 6, 'description': '당근은 얇게 채를 썰어 줍니다.', 'image_url': 'https://recipe1.ezmember.co.kr/cache/recipe/2022/08/15/fb469f1348a12371fa7171fff2e6f5b11.jpg'}, {'step_number': 7, 'description': '그릇에 꼬시래기,맛살,당근,곤약을 넣은 후 양념 재료를 넣고 살짝 버무려 줍니다.', 'image_url': 'https://recipe1.ezmember.co.kr/cache/recipe/2022/08/15/ce14747e69e978dc9524021ceb635a111.jpg'}, {'step_number': 8, 'description': '꼬시래기곤약샐러드를 그릇에 옮겨 담아 줍니다.', 'image_url': 'https://recipe1.ezmember.co.kr/cache/recipe/2022/08/15/1bb2899b59ea2a7b5107e3f0b4496c2e1.jpg'}]"
159631,샐러드,다이어트,해물류,무침,담백한 새우샐러드,새우샐러드,https://recipe1.ezmember.co.kr/cache/recipe/2023/11/17/8444b386c1ea0e2f2aea942ba603034b1.jpg,340,30분 이내,초급,3인분,"[('새우', '300g'), ('두부', '300g'), ('베이비 루꼴라', '50g'), ('코코넛 요거트', '5T'), ('요거트(쌀누룩)', '5T'), ('올리고당', '3T'), ('소금누룩', '1T'), ('바질페스토', '5T'), ('천연식초', '5T'), ('냉압착올리브유', '5T')]",육고기를 싫어하고 후각이 예민한 가족을 위해 해산물 새우를 사용하여 요리한 건강 샐러드 입니다. 새우의 비릿함을 청주와 바질페스토를 써서 완화시키고 코코넛 요거트와 바질페스토를 이용하여 건강소스를 만들었습니다.,"[{'step_number': 1, 'description': '껍질깐 새우를 씻어 청주넣고 새우가 붉은기가 돌 정도로\n만 삶아준다.냄비', 'image_url': 'https://recipe1.ezmember.co.kr/cache/recipe/2023/11/17/7617645783b1c98a8ad7cabf312ac4271.jpg'}, {'step_number': 2, 'description': '바질페스토5T와 코코넛요거트5T+쌀누룩 요거트5T(or시판요거트10T), 천연식초5T(or레몬즙),올리고당3T,소금누룩1T(or소금1t),냉압착올리브유5T.볼', 'image_url': 'https://recipe1.ezmember.co.kr/cache/recipe/2023/11/17/340e84d84751fea42df7524efc159e061.jpg'}, {'step_number': 3, 'description': '두부를 물기제거 후 중불에 부쳐준다. (소금간을 하지 않아도 소스에 충분하다)도마 , 조리용나이프 , 프라이팬', 'image_url': 'https://recipe1.ezmember.co.kr/cache/recipe/2023/11/17/701697aecb2be0fbd8e4135fb95e07591.jpg'}, {'step_number': 4, 'description': '베이비 루꼴라를 잘 씻어 물기를 뺀다.(or샐러드 채소)채반', 'image_url': 'https://recipe1.ezmember.co.kr/cache/recipe/2023/11/17/ec6de19f9acc65d957bfb99e93535d141.jpg'}, {'step_number': 5, 'description': '자른두부,익혀 식힌 새우,씻은베이비 루꼴라를 차례를 샐러드접시에 담는다.완성접시', 'image_url': 'https://recipe1.ezmember.co.kr/cache/recipe/2023/11/17/3f19f79005c929ef3f09017d65643f081.jpg'}, {'step_number': 6, 'description': '소스를 저그에 담아낸다.시럽볼', 'image_url': 'https://recipe1.ezmember.co.kr/cache/recipe/2023/11/17/ff09f0ddabdda87782e4a56fbac478741.jpg'}, {'step_number': 7, 'description': '소스를 부어 잘 섞어 맛있게 먹는다.', 'image_url': 'https://recipe1.ezmember.co.kr/cache/recipe/2023/11/17/debccf1a72702c47603e9371187fc6331.jpg'}, {'step_number': 8, 'description': '베이비 루꼴라는 더 추가하 여 더 많은 야채를 섭취하면 유익하다.', 'image_url': 'https://recipe1.ezmember.co.kr/cache/recipe/2023/11/17/b975f5ee310168aa11923ba043be58351.jpg'}, {'step_number': 9, 'description': '아이들 간식,다이어트,건강식,아침식으로 좋은 새우레시피다.', 'image_url': 'https://recipe1.ezmember.co.kr/cache/recipe/2023/11/17/6287bb9a997c11906caea28a628916391.jpg'}]"
159632,샐러드,다이어트,해물류,무침,와인과 맥주를 부르는 문어 감자 샐러드 (Feat. 차지키 소스) 뿔뽀샐러드,문어감자샐러드,https://recipe1.ezmember.co.kr/cache/recipe/2024/06/07/e91d3aad655f3622a0ffab13b64448e31.jpg,172,15분 이내,아무나,2인분,"[('감자                                                                                사이즈에 따라 가감', '2개'), ('자숙문어다리                                                                                사이즈에 따라 가감', '1개'), ('버터', '1스푼'), ('파슬리가루', '조금'), ('소금', '1티스푼'), ('차지키소스', '2스푼'), ('당근라페', '조금')]",유럽에서 살 때 여름이면 입맛이 없고 불 앞에서 요리하기가 너무 싫어서 자주 해 먹던 문어 샐러드가 생각났어요. 원래 해 먹던 샐러드가 아니라 차지키소스와 당근라페를 함께 먹으면 더 맛있을 것 같아서 만들어봤는데 역시나 너무 맛있어서 한그릇 뚝딱 해버렸어요! 주변에선 먹자마자 이거 와인 마셔야 한다고 난리난 레시피 공개해 드릴게요!,"[{'step_number': 1, 'description': '1. 감자 익히기 +껍질을 벗겨서 끓는 물에 삶아주세요. 이따 소금 한 꼬집 넣어주세요! 삶지 않고 쪄주셔도 무관해요~!!냄비감자 손질법', 'image_url': 'https://recipe1.ezmember.co.kr/cache/recipe/2024/06/07/84a5c9661f57437537fc4b0a92f0ba311.png'}, {'step_number': 2, 'description': '2. 문어 익히기- 자숙문어를 사용했지만 한번 데쳐서 사용해줄게요! 마찬가지로 끓는 물에 소금 한꼬집 넣고 약 1~2분 간 데쳐주세요.', 'image_url': 'https://recipe1.ezmember.co.kr/cache/recipe/2024/06/07/fc867055efe1c9cdd155bd04148f71a61.png'}, {'step_number': 3, 'description': '3. 감자 잘라주기- 감자는 한김 식혀서 잘라주셔야 으깨지지 않아요. 뜨거운 김이 어느정도 나갔다면 감자를 적당한 사이즈로 잘라주세요. 너무 작지 않아야 씹는 맛이 있어 좋아요! \n*문어도 마찬가지로 잘라주세요!도마 , 조리용나이프', 'image_url': 'https://recipe1.ezmember.co.kr/cache/recipe/2024/06/07/0067adc9152bcfa3443410cb9ad2586a1.png'}, {'step_number': 4, 'description': '4. 감자 구워주기- 예열된 프라이펜을 중불로 줄여주고 버터를 녹여주세요. 잘라놓은 감자를 넣고 골고루 구워주세요. 버터향이 입혀질 정도로 구워주면 됩니다!조리용집게 , 프라이팬', 'image_url': 'https://recipe1.ezmember.co.kr/cache/recipe/2024/06/07/82618e87f6769b716e74dad656e959681.png'}, {'step_number': 5, 'description': '5. 문어 볶아주기- 마찬가지로 예열된 프라이펜을 중불로 줄여주고 버터를 녹여주세요. 잘라놓은 문어를 넣고 버터향이 입힐 정도만 구워주세요. 너무 오래 익히면 질겨질 수 있어요!', 'image_url': 'https://recipe1.ezmember.co.kr/cache/recipe/2024/06/07/79f4872bbd430f9f6e9ac8752eb33b6c1.png'}, {'step_number': 6, 'description': '6. 파슬리 가루 뿌리기- 파슬리 가루를 뿌려서 버무려주세요!접시', 'image_url': 'https://recipe1.ezmember.co.kr/cache/recipe/2024/06/07/d9ca0845eb38fbd5303d46e208112dd81.png'}, {'step_number': 7, 'description': '7. 완성!! 차지키 소스를 깔고 라페를 올려주세요. 그 위에 버무려 놓은 문어감자를 올려주시면 완성!!', 'image_url': 'https://recipe1.ezmember.co.kr/cache/recipe/2024/06/07/d92a0146a17a9d3f59e74ea07c911ed51.jpg'}]"
159633,샐러드,다이어트,해물류,무침,곤약 오징어냉채,곤약오징어냉채,https://recipe1.ezmember.co.kr/cache/recipe/2016/05/25/9838ce108c1ff82f7dc5dbcacdd420d21.jpg,"6,600",10분 이내,아무나,2인분,"[('곤약', '250g'), ('식초', '1큰술'), ('오징어 몸통                                                                                260g', '2마리'), ('식초', '5큰술'), ('매실청', '2큰술'), ('설탕', '1작은술'), ('연와사비', '1작은술'), ('소금', '1/2작은술'), ('다진마늘', '1큰술'), ('갈은 깨', '1큰술'), ('채썬 채소', '1줌')]",날이 점점 더워지고 있어요. 이번 여름이 얼마나 더울지 걱정입니다. 더운날 시원하게 한끼 식사도 해결하면서 다이어트에도 좋은 곤약과 오징어로 냉채 만들었습니다.,"[{'step_number': 1, 'description': '곤약 250g을 곱게 채썰어 줍니다.', 'image_url': 'https://recipe1.ezmember.co.kr/cache/recipe/2016/06/13/f77d9e9d966a930aa245f1260f8574931.jpg'}, {'step_number': 2, 'description': '그리고 팔팔 끓는 물에 식초 1큰술을 넣고 채썬 곤약을 넣어 삶아 주세요.', 'image_url': 'https://recipe1.ezmember.co.kr/cache/recipe/2016/06/13/73838db24d985e5a947560365ed800251.jpg'}, {'step_number': 3, 'description': '물이 팔팔 끓을때 곤약을 넣고 물이 다시 팔팔 끓을때까지 삶아 줍니다. 그래야 곤약 특유의 냄새가 없어 지고 쫀득한 식감도 더 생깁니다.', 'image_url': 'https://recipe1.ezmember.co.kr/cache/recipe/2016/06/13/8b65a8797a96874f6c792ed09aa619361.jpg'}, {'step_number': 4, 'description': '그리고 체에 건져 찬물에 샤워를 시켜주시고 물기를 최대한 빼 냉장고에 넣어 시원하게 준비해 줍니다.', 'image_url': 'https://recipe1.ezmember.co.kr/cache/recipe/2016/06/13/fbac863e6cf992d6bb082839aace3e091.jpg'}, {'step_number': 5, 'description': '오징어 몸통 두마리 260g을 준비해 껍질 그대로 곱게 채썰어 줍니다.', 'image_url': 'https://recipe1.ezmember.co.kr/cache/recipe/2016/06/13/bf9443ebb4838a9359ba8584b275199f1.jpg'}, {'step_number': 6, 'description': '그리고 끓는 물에 채썬 오징어를 넣고 물이 다시 고르게 팔팔 끓을 동안 삶아 줍니다.', 'image_url': 'https://recipe1.ezmember.co.kr/cache/recipe/2016/06/13/463cbd0eda945bf5495954fcf837e6971.jpg'}, {'step_number': 7, 'description': '삶아진 오징어는 체에 건져 찬물로 샤워를 시키고 충분히 식으면 물기를 빼고 냉장고에 넣어 차게 준비해 줍니다.', 'image_url': 'https://recipe1.ezmember.co.kr/cache/recipe/2016/06/13/7a906f585b46ddaa4d4c5609c24e93481.jpg'}, {'step_number': 8, 'description': '그릇에 식초 5큰술, 매실청 2큰술, 설탕 1작은술, 연와사비 1작은술, 소금 1/2작은술, 다진마늘 1큰술, 갈은깨 1큰술 을 넣고 섞어 소스를 만들어 줍니다.', 'image_url': 'https://recipe1.ezmember.co.kr/cache/recipe/2016/06/13/8adc76a090ed77d2ddbc954287361bca1.jpg'}, {'step_number': 9, 'description': '그리고 차게 준비한 곤약과 오징어를 넣고', 'image_url': 'https://recipe1.ezmember.co.kr/cache/recipe/2016/06/13/526daaa9da3f42f0c10c504358e717b21.jpg'}, {'step_number': 10, 'description': '소스에 고루 버무려 줍니다.', 'image_url': 'https://recipe1.ezmember.co.kr/cache/recipe/2016/06/13/0c7575052940260893b7672b68428c3a1.jpg'}, {'step_number': 11, 'description': '양파 1/2개, 양배추 1/8통, 적채 1/4통 을 채칼로 곱게 채썰고 당근 1/2개는 채칼로 얇게 슬라이스해 곱게 채썰고 깻잎 10장은 돌 말아 곱게 채썰어 줍니다.', 'image_url': 'https://recipe1.ezmember.co.kr/cache/recipe/2016/06/13/78c550bb2d04267db37af7d504a85de61.jpg'}, {'step_number': 12, 'description': '그리고 채썬 채소를 찬물에 담궈 아삭해 지면 탈수기에 돌려 물기를 최대한 없애고 비닐팩에 담아 냉장고에 넣어 두면 4~5일정도 보관이 된답니다. 요렇게 준비하면 그때 그때 바로 꺼내 사용하기 참 좋습니다.', 'image_url': 'https://recipe1.ezmember.co.kr/cache/recipe/2016/06/13/00a630bca391c2325dd42f29161171b31.jpg'}, {'step_number': 13, 'description': '그리고 채썬 채소 1줌을 소스에 버무린 오징어와 곤약에 넣고 한번 더 버무려 주시면 되겠습니다.', 'image_url': 'https://recipe1.ezmember.co.kr/cache/recipe/2016/06/13/8d392c503eeabcc3efafc12111833c1e1.jpg'}, {'step_number': 14, 'description': '여름날 한끼 식사로도 좋고 다이어트 식으로 먹어도 좋아요.', 'image_url': 'https://recipe1.ezmember.co.kr/cache/recipe/2016/06/13/cd6ad6b5aecd717a0b27e16d193e594c1.jpg'}]"
