index,종류별,상황별,재료별,방법별,글 제목,레시피이름,레시피이미지,조회수,조리시간,난이도,인분,재료,소개글,조리순서
150390,퓨전,일상,해물류,삶기,[해양수산부 이달의 수산물 6월] 갑오징어 뱃속에 고구마가 쏘오옥 ★ 갑오징어순대,갑오징어순대,https://recipe1.ezmember.co.kr/cache/recipe/2019/06/03/5808543ff99286e001e4924d22d07cfe1.jpg,912,30분 이내,아무나,1인분,"[('갑오징어', '3마리'), ('버터', '30g'), ('스트링치즈', '3개'), ('스파게티소스', '4숟가락'), ('고구마', '300g'), ('무순', '약간'), ('꿀', '')]","쫄깃쫄깃 갑오징어 고구마를 채워 찜기에 쪄주면 ???

자를때마다 환호성이????? 다이어트식단으로도 나쁘지 않은걸??? 

세상의 모든 레시피 만개의레시피","[{'step_number': 1, 'description': '효능 : 저지방, 저칼로리, 고단백의 대표 수산물로 다이어트와 건강을 챙기는 최고의 식재료. 타우린 성분이 다량 함유되어 있어 성인병 예방에도 좋다.', 'image_url': 'https://recipe1.ezmember.co.kr/cache/recipe/2019/06/03/2aab3d7b05f40ea83c9dbf847c8b64da1.jpg'}, {'step_number': 2, 'description': '고구마를 작게 잘라 전자레인지에 약 3~4분 익혀낸다.전자레인지', 'image_url': 'https://recipe1.ezmember.co.kr/cache/recipe/2019/06/03/e3646ddfc5a39d889d1e1e551dd2275e1.jpg'}, {'step_number': 3, 'description': '껍질을 제거하고 버터를 넣어 으깬다.더 달콤하게 드시고 싶을 때 꿀을 넣어주세요.\n취향에 따라 고구마 속에 파프리카나 당근을 넣어주어도 좋아요.', 'image_url': 'https://recipe1.ezmember.co.kr/cache/recipe/2019/06/03/65f611598dc2479e829a6609cec2903f1.jpg'}, {'step_number': 4, 'description': '갑오징어의 몸통 안에 스트링치즈와 으깬 고구마를 넣어 채워 이쑤시개로 막는다.갑오징어의 몸통에 여러군데 구멍을 내어주면 수분이 빠져나와 통오징어의 모양이 터지지 않아요.', 'image_url': 'https://recipe1.ezmember.co.kr/cache/recipe/2019/06/03/d569c0489f9418dcfb3a4afe28c1ddd31.jpg'}, {'step_number': 5, 'description': '찜 솥에 갑오징어를 넣고 중불로 7분가량 쪄낸다.찜통에 물을 넣을때 청주를 넣어 끓이면 비린내 제거에 도움이 되요.', 'image_url': 'https://recipe1.ezmember.co.kr/cache/recipe/2019/06/03/8cd0ec3fc5f0b98eb9c270805094a8b71.jpg'}, {'step_number': 6, 'description': '완성된 갑오징어를 한입 크기로 썬다.뜨거우면 고구마가 나올수 있으니 한김 식혀 썰어주세요.', 'image_url': 'https://recipe1.ezmember.co.kr/cache/recipe/2019/06/03/4da7297ad0f52ccffa7c69e0769e1cac1.jpg'}, {'step_number': 7, 'description': '갑오징어 순대 위에 따뜻하게 끓인 크림파스타 소스를 뿌린다.', 'image_url': 'https://recipe1.ezmember.co.kr/cache/recipe/2019/06/03/c5df13427a0f5d6b8dcda22cdf4dcb6d1.jpg'}, {'step_number': 8, 'description': '무순이나 오이채를 올려 완성한다.', 'image_url': 'https://recipe1.ezmember.co.kr/cache/recipe/2019/06/03/c1b87d119ddd2657fe1a887961d570a21.jpg'}]"
150391,퓨전,일상,해물류,삶기,간장게장 파스타 - 익스큐수미: 일단 잡숴봐 3화,간장게장파스타,https://recipe1.ezmember.co.kr/cache/recipe/2023/09/06/f6b020a29c1ad4846f47fd9e5742b3541.jpg,"1,543",20분 이내,초급,1인분,"[('간장게장', '2국자'), ('파스타 면', '1인분'), ('깻잎', ''), ('홍고추', ''), ('청고추', ''), ('올리브유', ''), ('참기름', '1바퀴'), ('소금', '1꼬집'), ('통깨', '')]","매주 목 밤 8시 40분 E채널 [익스큐수미: 일단 잡숴봐] 3회
수미의 야심작! 간장게장 파스타","[{'step_number': 1, 'description': '소금을 넣은 물에 파스타 면을 8분 삶아 건져낸다.파스타 면, 소금', 'image_url': 'https://recipe1.ezmember.co.kr/cache/recipe/2023/09/06/68a7966fee4439f5fa261426e37cad701.jpg'}, {'step_number': 2, 'description': '삶은 면을 찬 물로 헹군 후 물기를 제거하고 달라붙지 않도록 올리브유를 뿌린 뒤 버무려 식힌다.올리브유', 'image_url': 'https://recipe1.ezmember.co.kr/cache/recipe/2023/09/06/66aeac848ed66b441e615c04803d7ec41.jpg'}, {'step_number': 3, 'description': '식힌 면에 참기름 한바퀴, 소금 한꼬집, 간장게장 국물 두국자 뿌려 버무려주기참기름, 소금, 간장게장 국물', 'image_url': 'https://recipe1.ezmember.co.kr/cache/recipe/2023/09/06/6e08cbf8e5e6b54b005d7312aca615531.jpg'}, {'step_number': 4, 'description': '게장 딱지를 떼고 파스타 면 위에 살만 쭉 짜기', 'image_url': 'https://recipe1.ezmember.co.kr/cache/recipe/2023/09/06/f9ecb328740f5a3907a800cabe052d4b1.jpg'}, {'step_number': 5, 'description': '깨, 홍고추, 청고추, 파, 백김치 등 취향에 맞게 고명을 올리면 완성!', 'image_url': 'https://recipe1.ezmember.co.kr/cache/recipe/2023/09/06/f32210b8f7d19d380bfae885f38a96931.jpg'}]"
