index,종류별,상황별,재료별,방법별,글 제목,레시피이름,레시피이미지,조회수,조리시간,난이도,인분,재료,소개글,조리순서
169582,차/음료/술,일상,과일류,절임,레몬청 만들기,레몬청,https://recipe1.ezmember.co.kr/cache/recipe/2015/11/28/b00dd7372baac364dfe0cbec9f8722c01.jpg,"7,249",30분 이내,아무나,6인분 이상,"[('레몬', '500g'), ('베이킹소다', ''), ('설탕', '500g')]",요리나 음료로 먹으면 좋은 상큼 달달한 레몬청입니다.,"[{'step_number': 1, 'description': '먼저 레몬을 베이킹소다로 깨끗하게 씻어줍니다. 레몬청 만들기에서 제일 중요한 부분은 세척이죠.', 'image_url': 'https://recipe1.ezmember.co.kr/cache/recipe/2015/11/30/acf2a8eff179b34575b48ded7d5d6aab1.jpg'}, {'step_number': 2, 'description': '끓는 물에 한 번 살짝 데쳐보기로 해요. 2-3초 정도 샤샤샥 해주고 바로 꺼내요.', 'image_url': 'https://recipe1.ezmember.co.kr/cache/recipe/2015/11/30/a26360b0354f8a1f373bf44550e651311.jpg'}, {'step_number': 3, 'description': '괜히 불안해서 한 번 더 소금으로 빡빡 문질렀어요.', 'image_url': 'https://recipe1.ezmember.co.kr/cache/recipe/2015/11/30/3094e809ae65d028dbbf8014d153a08c1.jpg'}, {'step_number': 4, 'description': '그리고 레몬청 담을 유리병은 열탕소독해줍니다.', 'image_url': 'https://recipe1.ezmember.co.kr/cache/recipe/2015/11/30/12fd164d0c01be83750103a484e3a60b1.jpg'}, {'step_number': 5, 'description': '레몬청 만들기 할 때 주의할 점은 이거라고 해요. 쓴맛 나지 않도록 꼭지와 씨를 제거해주는 것. 슬라이스 해줬어요.', 'image_url': 'https://recipe1.ezmember.co.kr/cache/recipe/2015/11/30/cfa22a5d3d3b2c60e97a0c9dd039fff31.jpg'}, {'step_number': 6, 'description': '여기 위에 설탕을 부어서 막 섞어줬답니다.', 'image_url': 'https://recipe1.ezmember.co.kr/cache/recipe/2015/11/30/6c22fd8577f83e6e01a41f66ba61e99d1.jpg'}, {'step_number': 7, 'description': '차곡 차곡 담아줬는데요. 간단하죠? 알고보니 이 방법은 대량으로 청 만들기할 때 쓰이는 방법이라네요. 그냥 할 때는 설탕을 바닥에 깔아주고, 위에 레몬넣고, 설탕 이렇게 층층이 해서 뒀다가 먹으면 된다고 해요. 위에 설탕으로 마무리 해줍니다. 그리고 수제청 숙성기간! 설탕이 다 녹으면 안으로 냉장보관해서 드시면 된다고 해요! 근데 저는 이미 버무려서 설탕이 다 녹은 상태~~ 근데 좀 덜 달아서 설탕 자꾸 추가했어여.', 'image_url': 'https://recipe1.ezmember.co.kr/cache/recipe/2015/11/30/da245bd245cc2b561e1ea51eb79f5bda1.jpg'}]"
169583,차/음료/술,일상,과일류,절임,석류레몬청,석류레몬청,https://recipe1.ezmember.co.kr/cache/recipe/2015/12/30/9b993e05a8f60ac4c3d8cdc04bcf3c6f1.jpg,"4,723",30분 이내,초급,6인분 이상,"[('석류', '2개'), ('레몬', '8개'), ('설탕', '1')]","결혼하고 처음만들어본 과일청
인터넷에서 레시피 보고 따라만들어봤어요^^
레몬만 닦는것도 일이더라구요ㅠㅠ","[{'step_number': 1, 'description': '껍질벗긴 석류를 그릇에 담아 설탕이랑 버무려 주세요. 쉽게 까는방법은 인터넷에 많이나와요ㅎ\n설탕은 석류에80프로 정도 부어줬어요', 'image_url': 'https://recipe1.ezmember.co.kr/cache/recipe/2015/12/30/9b2980e814ecbbf5cfb8470ee05f74321.jpg'}, {'step_number': 2, 'description': '레몬은 베이킹소다에 10분정도 담궜다가, 굵은소금으로 아주빡빡! 닦은다음 뜨거운물에 살짝데쳤어요ㅎ\n유리병도 뜨거운물로 살짝 소독해주시고~~\n레몬을 얇게 썰어주세요ㅎ', 'image_url': 'https://recipe1.ezmember.co.kr/cache/recipe/2015/12/30/2c74794a3dd6dd209627c9a999460dd81.jpg'}, {'step_number': 3, 'description': '바닥에 설탕 한주먹 뿌려넣고, 석류깔고, 레몬 올리고,석류 올리고 설탕좀 뿌리면 완성됩니다ㅋㅋ\n(저는 귀찮아서 그냥 막넣었어요ㅎ)\n완성되면 상온에 하루정도 보관 하시구요', 'image_url': 'https://recipe1.ezmember.co.kr/cache/recipe/2015/12/30/80c70c15372c2eeb1abcd35e04f124081.jpg'}, {'step_number': 4, 'description': '설탕이 가라앉아있어서 가끔 병을 뒤집어 놓기도했어요! \n상온에 하루 뒀다가 냉장고에 넣어두고 반나절 지나서 보니까 ~\n색깔이 너무이뿌게 변했더라구요ㅎㅎ\n아직 맛은 못봤는데......뭐 맛있겠죠ㅋㅋㅋ', 'image_url': 'https://recipe1.ezmember.co.kr/cache/recipe/2015/12/30/e5fb5b9479284f04cd3ff56d2f6364021.jpg'}]"
169584,차/음료/술,일상,과일류,절임,<긴급공지>풋매실의 독성..매실의 품종을 알고 매실청 담그기.(수정본),None,https://recipe1.ezmember.co.kr/cache/recipe/2016/06/10/d57793aada0ba933d3561d6f3b77ebbc1.jpg,"11,280",None,None,None,"[('풋매실이 아닌 청매실                                                                                or 황매실', '5kg'), ('설탕', '5kg'), ('식초', ''), ('키친타월', ''), ('베이킹소다', '')]",,[]
169585,차/음료/술,일상,과일류,절임,레몬청,레몬청,https://recipe1.ezmember.co.kr/cache/recipe/2015/07/15/7502f12a3c00b51c08bdfb7722de8b491.jpg,"9,000",15분 이내,아무나,6인분 이상,"[('레몬', ''), ('베이킹소다', ''), ('굵은소금', ''), ('식초', ''), ('설탕', ''), ('깨끗한고무장갑', ''), ('저울', '')]",상큼 터지는 레몬청 만들기 알려드릴께요.,"[{'step_number': 1, 'description': '먼저 물에 레몬을 담궈 주세요.', 'image_url': 'https://recipe1.ezmember.co.kr/cache/recipe/2015/07/15/e30626cd3e2fac7cdea826c43c2c31471.jpg'}, {'step_number': 2, 'description': '젤먼저 준비한 베이킹소다를 뿌려줍니다. 베이킹소다를 뿌린 레몬을 빡빡 문질러줍니다. 껍질을 사용해서 레몬청을 만들기때문에 정성껏 문질러주세요. 그리고 다 닦은 레몬을 물에 씻인후 물기를 제거해주세요.', 'image_url': 'https://recipe1.ezmember.co.kr/cache/recipe/2015/07/15/c1215da2ff8be0fd17238d6b3c2b48e11.jpg'}, {'step_number': 3, 'description': '굵은 소금을 준비합니다. 마찬가지로 최선을 다해서 뻑뻑 문지르세요. 그리고 물로 한번 씻어주세요, 그리고 또 물기를 싹! 닦아주세요.', 'image_url': 'https://recipe1.ezmember.co.kr/cache/recipe/2015/07/15/87ac5155cf14326dd11b61b60c2b27371.jpg'}, {'step_number': 4, 'description': '식초를 약간 탄 끓는 물에 레몬을 10~15초정도 굴려주세요. 그리고 다시 물로 헹군후 물기를 제거해주세요!', 'image_url': 'https://recipe1.ezmember.co.kr/cache/recipe/2015/07/15/3e693aea76fdebc76b3e399ef9ef46081.jpg'}, {'step_number': 5, 'description': '레몬의 양쪽을 이렇게 꼭지를 제거해주세요.', 'image_url': 'https://recipe1.ezmember.co.kr/cache/recipe/2015/07/15/bfd602a36db9477a37932a9e0e2e901b1.jpg'}, {'step_number': 6, 'description': '이렇게 잘라서 담으면 더 많은 양이 들어가고 먹기도 편하더라구요.', 'image_url': 'https://recipe1.ezmember.co.kr/cache/recipe/2015/07/15/6f4b46f9964bbb3f7f82bfffbbcd4b501.jpg'}, {'step_number': 7, 'description': '레몬과 설탕은 1:1로 준비해주세요. 보통 레몬과 설탕을 층층이 쌓기도하는데 전 이렇게 한번 버물였어요.', 'image_url': 'https://recipe1.ezmember.co.kr/cache/recipe/2015/07/15/c2ad1ac07e92c5a73fd5955ec4636f591.jpg'}, {'step_number': 8, 'description': '그리고 젤 위에는 남은 설탕을 싹~ 뿌려주고 뚜껑을 덮고, 시원한 해가 안드는 베란다에 보관, 낮에 만들어서 저녁에 잠들기전 아래위로 설탕이 녹기 쉽게 저어주고 아침에 일어나서 또 저어주고 오후쯤 소독한 유리병에 넣고 냉장보관하면 되요.', 'image_url': 'https://recipe1.ezmember.co.kr/cache/recipe/2015/07/15/cc48f1cff2b9cbfcc86a502a45468e211.jpg'}]"
169586,차/음료/술,일상,과일류,절임,새콤달콤한 레몬청 만들기,레몬청,https://recipe1.ezmember.co.kr/cache/recipe/2015/08/06/eb1c87866e96d0ca4579f60b8a6b9c6a1.jpg,"16,560",60분 이내,초급,6인분 이상,"[('레몬', '8개'), ('식초', '적당히'), ('설탕                                                                                레몬만큼', '')]","무더운 여름 제철과일인 레몬으로 몸도 마음도 기분 up
새콤하면서 달콤한 레몬청으로 다양하게 즐겨보세요!","[{'step_number': 1, 'description': '물로 한번 헹구어 낸 레몬8개를 식초를 희석한 물에 담아 20분간 방치해주세요.', 'image_url': 'https://recipe1.ezmember.co.kr/cache/recipe/2015/08/06/a45c8e78151e2fcf228cd738391251c61.jpg'}, {'step_number': 2, 'description': '레몬을 기다리는 동안 유리공병을 뜨거운 물에 소독해주세요. (소독하지 않을 시 곰팡이나 세균 번식 우려가 있어요.)', 'image_url': 'https://recipe1.ezmember.co.kr/cache/recipe/2015/08/06/f1b2b46d29ab78e61da10efcf2eb33761.jpg'}, {'step_number': 3, 'description': '굵은 꽃 소금으로 레몬을 빡빡 문질러주세요. (이때 고무장갑을 꼭 착용하고 하시는 것을 추천해드려요.)', 'image_url': 'https://recipe1.ezmember.co.kr/cache/recipe/2015/08/06/72b7502ffe43baf30d17c20df7aa30611.jpg'}, {'step_number': 4, 'description': '한번 더 식초를 희석한 물에 10분정도 방치해두었어요.', 'image_url': 'https://recipe1.ezmember.co.kr/cache/recipe/2015/08/06/2bf835514b74448730d5baf5586ddfd31.jpg'}, {'step_number': 5, 'description': '그런 다음 레몬을 식초를 넣고 끓인 뜨거운물에 7초정도 데굴데굴 굴려주세요.', 'image_url': 'https://recipe1.ezmember.co.kr/cache/recipe/2015/08/06/19904a0769c35290fdfc1f50907a975e1.jpg'}, {'step_number': 6, 'description': '세척한 레몬을 슬라이스로 얇게 잘라주세요. ( 이때 레몬청이 써지는 것을 막기위해 레몬 씨를 반드시 제거해주셔야해요.)', 'image_url': 'https://recipe1.ezmember.co.kr/cache/recipe/2015/08/06/c1c1e099ee5685b04573f6c0b8577ff91.jpg'}, {'step_number': 7, 'description': '유리병에 설탕→레몬→설탕→레몬 순으로 차곡차곡 병을 채워가면됩니당. (저는 이쁘게 만들기 위해서 겉은 레몬을 저렇게 세워주었어요.)', 'image_url': 'https://recipe1.ezmember.co.kr/cache/recipe/2015/08/06/32ba6b5e98991ce9f637fd728331292e1.jpg'}, {'step_number': 8, 'description': '차곡차곡 쌓다보면 어느새 용기가 가득찬답니다.', 'image_url': 'https://recipe1.ezmember.co.kr/cache/recipe/2015/08/06/13a394f4c0785ede8f5cd5ccc29338581.jpg'}, {'step_number': 9, 'description': '마지막으로 뚜껑을 덮으면 레몬청 만들기 끝~\n실온에서 2~3일 정도 숙성시키고 냉장고에서7일정도\n더 숙성시키면 맛있는 레몬청이 완성됩니당', 'image_url': 'https://recipe1.ezmember.co.kr/cache/recipe/2015/08/06/6c78ff4cebd7cc76d721acf14c6d76051.jpg'}]"
169587,차/음료/술,일상,과일류,절임,매실청 거르기 벌써 90일 매실장아찌는 덤이네,매실장아찌,https://recipe1.ezmember.co.kr/cache/recipe/2020/09/10/8ec25680be63cb8f199072fff5d3c2a81.jpg,"6,779",2시간 이상,초급,4인분,"[('매실청', ''), ('고추장', '1컵')]","요즘 6월에서 7월 초여름이면 집집마다 매실엑기스 많이 담그실 텐데요. 은하계맘도 6월 초에 단양 청매실 사다가 매실청 담그기 했답니다. 항상 친정엄마께서 보내주시는 것만 먹다가 결혼하고 처음으로 매실효소를 담가보려고 도전을 했어요. 처음 담가본 거라서 노하우가 없는지라 실수도 조금 있었어요. 과발효로 인한 거품, 하얀 곰팡이가 대표적인 예이지요. 초반에 약간의 문제점이 있었지만 잘 극복하고 3개월이 지난 지금 아주 잘 숙성되었답니다.","[{'step_number': 1, 'description': '처음 2주 동안은 누름돌을 잘 눌러주었다.', 'image_url': 'https://recipe1.ezmember.co.kr/cache/recipe/2020/09/25/fd17f019fedc18cb8c83fb09d7e48fdd1.jpg'}, {'step_number': 2, 'description': '누름돌을 제거한 후에는 소주에 헹군 기다란 주걱으로 일주일에 한 번씩 설탕과 매실이 잘 섞이도록 저어주었다.', 'image_url': 'https://recipe1.ezmember.co.kr/cache/recipe/2020/09/25/b3fa8887bf1b0d3180ec52f8f87481811.jpg'}, {'step_number': 3, 'description': '유리병 & 도구 세척 및 소독하기 저는 이런 스테인리스 깔때기를 준비했어요. 거름망까지 있어서 편리하더라고요. 다만 이물질, 연마 제등이 묻어있을 수 있으므로 깨끗하게 세척하는 게 중요하죠. 베이킹소다를 푼 물에 10분 정도 담가둔 후 중성세제를 이용해서 닦아주고~ 뜨거운 물에 헹구어주었어요.', 'image_url': 'https://recipe1.ezmember.co.kr/cache/recipe/2020/09/25/1fc82749fff0662ff02bb6642d1da76a1.jpg'}, {'step_number': 4, 'description': '유리병에 깔때기를 끼우고 조심스럽게 액기스를 부어줍니다. 넘쳐흐르지 않도록 천천히 내려가는 걸 확인하면서 부어야지 아깝게 흘려서 버리는 일이 없겠죠?', 'image_url': 'https://recipe1.ezmember.co.kr/cache/recipe/2020/09/25/2857e2b89fbaaa0240262db8d04b7a5d1.jpg'}, {'step_number': 5, 'description': '서늘하고 직사광선이 없는 곳에서 매실청을 1년간 숙성을 합니다. 바로 먹는 것보다는 1년 더 숙성하고 내년에 드시면 효과가 더 좋다고 해요.1차로 거른 후에 1년 더 숙성해서 드시기 바라요.', 'image_url': 'https://recipe1.ezmember.co.kr/cache/recipe/2020/09/25/1791dba987148b379fdc9699201a78e11.jpg'}, {'step_number': 6, 'description': '1) 매실 절임에서 씨앗과 과육을 분리한다. 이때 과도를 이용하면 조금 더 수월하게 껍질을 벗길 수 있어요. 하나 집어서 맛을 보면 달달한 젤리 같아요.', 'image_url': 'https://recipe1.ezmember.co.kr/cache/recipe/2020/09/25/927830350baf4c4ea320d244338e077a1.jpg'}, {'step_number': 7, 'description': '2) 매실과 육 2컵, 고추장 1컵 가량 넣고 잘 버무려주었어요. 이렇게 해서 작은 유리병에 고추장 매실장아찌를 넣어두었어요.', 'image_url': 'https://recipe1.ezmember.co.kr/cache/recipe/2020/09/25/7d2c3a2a98f7533965104094d0bf4fd31.jpg'}]"
169588,차/음료/술,일상,과일류,절임,귤청 겨울철 귤로 만드는 감귤에이드 홈카페 좋다,귤청,https://recipe1.ezmember.co.kr/cache/recipe/2021/01/06/d6026ffb17f4b66bc5814f09116784731.jpg,"1,809",30분 이내,아무나,6인분 이상,"[('귤', '10개'), ('설탕                                                                                귤과동량', ''), ('귤 청', '2T'), ('탄산수', '1병'), ('얼음', '')]","집에 뒹굴어 다니는 귤들이 많아서 뭘할까 하다가

귤청을 만들자 했어요

사실 청귤 나올때 만들어두고 에이드 만들어먹는거 좋아하는데

집근처 카페에서 청귤에이드 한잔 시키면.. 가격이 어마어마 하더라구요 후덜덜덜

그래서 귤청을 만들어두고 아침에도 한잔

저녁에도 한잔

따뜻하게도 타먹고 탄산수에 시원하게도 타먹으니 좋으네요

출근하는 신랑도 보틀에 타서 주니 엄청 좋아하구요

귤청만들기 참 쉽죠잉

이렇게 집에서 설탕만 있음 만들수있으니 좋고

뭐니뭐니해도 맛이 있어요

귤의 상큼함과 탄산수의 톡쏘는 맛이 합쳐져서 귤청에이드... 아 너무나 좋다

한병 만들어놓고 야금야금 먹는중입니다

맛있어요

겨울철 별미지요","[{'step_number': 1, 'description': '일단 공병을 소독을 해줘야합니다\n아무래도 그냥 사용하면 균이나 미생물때문에 쉽게 상하기 쉽기 때문에 열탕 소독을 해줍니다\n뜨거운 물에 공병을 뒤집어놓고 팔팔 끓이시면 됩니다', 'image_url': 'https://recipe1.ezmember.co.kr/cache/recipe/2021/01/06/6c5b3e2d2662d57d036fb8ffeefdd6c81.jpg'}, {'step_number': 2, 'description': '뜨거운 병을 소독을 해서 그냥 뒤집어 놓으면\n뜨거운 열기때문에 알아서 마릅니다\n닦을필요 없어요', 'image_url': 'https://recipe1.ezmember.co.kr/cache/recipe/2021/01/06/93b003a6724f3103ee28dd76a5add6c11.jpg'}, {'step_number': 3, 'description': '귤 10개를 준비해주세요\n귤은 베이킹파우더를 이용해서 깨끗하게 씻어주었답니다\n껍질을 제거하고 만들수도 있는데\n귤 껍질에도 좋은 성분이 많아 같이 넣을거라 세척에 조금더 신경을 썼답니다\n과일세척제나 베이킹소다 같은것들을 이용해서\n귤을 깨끗하게 세척을 해주시고 물기를 제거해주세요', 'image_url': 'https://recipe1.ezmember.co.kr/cache/recipe/2021/01/06/1bfeeef6f7398f88ceaace27174f71be1.jpg'}, {'step_number': 4, 'description': '껍질을 제거하지않고 얇게 슬라이스를 했어요\n전부다 슬라이스치기에는 조금 그래서\n짜투리는 껍질을 까서 넣어주었구요\n반은 껍질째 슬라이스하고\n반은 껍질을 까서 토막토막 내주었다고 보시면 됩니다', 'image_url': 'https://recipe1.ezmember.co.kr/cache/recipe/2021/01/06/1a8aedc08598b347587410154f4c09cb1.jpg'}, {'step_number': 5, 'description': '그렇게 손질한 귤에 설탕을 뿌려주세요\n귤과 설탕의 무게는 1:1로 하시면 되는데요\n너무 단거 싫어하시면 설탕양을 줄이시면 됩니다\n설탕을 많이 넣으면 저장성이 좋아지지만 건강에는 좋지 않기 때문에\n설탕양을 줄이시는것도 추천해드려요\n귤과 설탕 6:4도 많이들 하시고\n7:3도 많이 하십니다', 'image_url': 'https://recipe1.ezmember.co.kr/cache/recipe/2021/01/06/640739964dd0d53615e86700076d0a661.jpg'}, {'step_number': 6, 'description': '열탕소독해둔 병에 잘 담아주세요\n귤청 만들기 별거없지용', 'image_url': 'https://recipe1.ezmember.co.kr/cache/recipe/2021/01/06/bf2dbb18d8dc4564a4a05a4d17b808331.jpg'}, {'step_number': 7, 'description': '귤청을 담아주시고 위에 설탕을 덮어주세요\n아무래도 공기와의 마찰을 줄여야 상하지않고 혹시모를 오염도 막아주고 낫더라구요\n금방 만들어 양이 적게 하셨다면 설탕 안올리셔도 좋고\n공기와 노출이 되면 곰팡이도 피고 그럴수 있으니\n설탕으로 덮어주세용', 'image_url': 'https://recipe1.ezmember.co.kr/cache/recipe/2021/01/06/21d3ecef5b070ed0896d354614c3f6e31.jpg'}, {'step_number': 8, 'description': '귤청 완성..\n유리병 가득 만들고도 조금 남아서 작은병 하나 급하게 더 소독해서 넣었답니다 ㅎㅎㅎ\n냉장고에서 3일 숙성해주세요\n하루만 하셔도 좋습닏', 'image_url': 'https://recipe1.ezmember.co.kr/cache/recipe/2021/01/06/1630b5a8a2e91a4c45ef74855ada43e11.jpg'}, {'step_number': 9, 'description': '귤청 2숟가락 정도 넣고 탄산수 넣으면 귤청에이드', 'image_url': 'https://recipe1.ezmember.co.kr/cache/recipe/2021/01/06/26e2c675480f113f6a17bedfacb1863d1.jpg'}, {'step_number': 10, 'description': '귤청 2T에 얼음 탄산수 넣으면 에이드 완료', 'image_url': 'https://recipe1.ezmember.co.kr/cache/recipe/2021/01/06/6a4a4d444d01baa290e2ef35f2749c9e1.jpg'}]"
169589,차/음료/술,일상,과일류,절임,"시들시들 귤 활용하기 : 귤청 만들어 
달콤 상큼한 귤차 타임~ㅎ",귤청,https://recipe1.ezmember.co.kr/cache/recipe/2021/01/09/6bce620c0a38d9c22163a84dad08e1e11.jpg,"4,305",60분 이내,아무나,6인분 이상,"[('귤', '1kg'), ('자일로스설탕', '1kg'), ('레몬즙', '2ts'), ('베이킹소다', '1밥숟가락')]","베란다 한켠에서 시들어가는 귤을 활용해 
귤청을 만들어보았어요.","[{'step_number': 1, 'description': '먼저 귤청\xa0담을 용기를 열탕소독해주세요.\n열탕소독이 끝난 유리용기는\xa0물기가 마른 상태에서 사용해주시구요.', 'image_url': 'https://recipe1.ezmember.co.kr/cache/recipe/2021/01/09/a80974f1b4923f5952ffdd15e0b0a5021.jpg'}, {'step_number': 2, 'description': '귤을 슬라이스했을 때 크기가 큰 것 보다는\xa0작은 귤이 모양이 흐트러 지지않아\xa0작은귤 위주로 사용했어요.', 'image_url': 'https://recipe1.ezmember.co.kr/cache/recipe/2021/01/09/a7eed88834fb41440ee9e0706bcbace81.jpg'}, {'step_number': 3, 'description': '무농약, 무착색 유기농 귤이지만\xa0껍질까지 사용하기위해 베이킹소다 1숟가락을 물에 희석해\n10분간 담궈주었어요.', 'image_url': 'https://recipe1.ezmember.co.kr/cache/recipe/2021/01/09/13077dd4e11135bc8eeeb4954c4dfdfa1.jpg'}, {'step_number': 4, 'description': '귤을 깨끗이 씻어 채반에 담아 물기를 뺀다음\xa0 남은 물기까지 꼼꼼히 제거해주세요.', 'image_url': 'https://recipe1.ezmember.co.kr/cache/recipe/2021/01/09/d5489aec99bc561108439f12fafcaa471.jpg'}, {'step_number': 5, 'description': '귤 양쪽 끝을 잘라내고\xa0\n얇게 슬라이스 한다음 설탕과 함께 버무려주구요.\n설탕과 귤 비율은 1:1로 해주세요.', 'image_url': 'https://recipe1.ezmember.co.kr/cache/recipe/2021/01/09/c9413d005155efb1eb83e609a63c01581.jpg'}, {'step_number': 6, 'description': '상큼한 맛도내고 좀더 오래 보관하기 위해 레몬즙을 넣어 주었어요.', 'image_url': 'https://recipe1.ezmember.co.kr/cache/recipe/2021/01/09/9b883df2e13c5da6af4c108ce8aaacac1.jpg'}, {'step_number': 7, 'description': '샬균한 유리병에 넣고 실온에서 하루이틀 방치한 후(설탕이 녹은다음) 냉장보관해주세요.', 'image_url': 'https://recipe1.ezmember.co.kr/cache/recipe/2021/01/09/235de221409019c3c53a87e5defd974f1.jpg'}, {'step_number': 8, 'description': '따뜻한 귤차 혹은\xa0탄산수+얼음을 넣어 에이드로\xa0즐겨도 좋아요^^', 'image_url': 'https://recipe1.ezmember.co.kr/cache/recipe/2021/01/09/90c88f780b35714e181d6de493b29c8f1.jpg'}]"
