index,종류별,상황별,재료별,방법별,글 제목,레시피이름,레시피이미지,조회수,조리시간,난이도,인분,재료,소개글,조리순서
37520,메인반찬,술안주,돼지고기,볶음,술안주 매운 오돌뼈 볶음 만들기 돼지 오돌뼈 볶음 소주 안주,매운오돌뼈볶음,https://recipe1.ezmember.co.kr/cache/recipe/2024/06/23/74f2fab3f11283e88f45ac568ebf50941.jpg,224,60분 이내,중급,4인분,"[('돼지 오돌뼈', '1kg'), ('양파', '1.5개'), ('깻잎', ''), ('쌀뜨물                                                                                소주+물 대체가능', '1.2L'), ('다진마늘', '1.5'), ('미림', '2'), ('간장', '2'), ('고추장', '2'), ('고춧가루', '2'), ('설탕', '1'), ('굴소스', '1'), ('올리고당', '1'), ('참기름', '1'), ('깨', '약간')]",비싸고 자극적인 오돌뼈 사먹지 마세요! 집에서 외식하는 저렴하고 감칠맛나는 술안주 소주안주!,"[{'step_number': 1, 'description': '돼지 오돌뼈 1kg, 양파 1.5개, 깻잎을 준비해 주세요.양파, 깻잎은 취향에 따라 양을 준비해 주세요.', 'image_url': 'https://recipe1.ezmember.co.kr/cache/recipe/2024/06/23/8e320c7b095293eef2070adbd441c2d11.jpg'}, {'step_number': 2, 'description': '돼지 오돌뼈는 적당한 크기로 썰어주고 쌀뜨물에 20분 정도 해동해 주세요.도마 , 조리용나이프 , 볼물,소주로 해주셔도 좋습니다.', 'image_url': 'https://recipe1.ezmember.co.kr/cache/recipe/2024/06/23/5d79d7b40589c7aa8c04d9a3c6a0b7421.jpg'}, {'step_number': 3, 'description': '양파는 채 썰어 주시고 깻잎은 일부는 쌈 싸 먹으려 빼놓고 10장 정도는 채 썰어주었어요. 깻잎을 넣어 파를 넣지 않았어요. 파를 같이 넣어주셔도 좋습니다~도마 , 조리용나이프 , 쟁반', 'image_url': 'https://recipe1.ezmember.co.kr/cache/recipe/2024/06/23/cb3c3ed4e3c60dc68a8fc5bf6f5fde841.jpg'}, {'step_number': 4, 'description': '해동된 돼지 오돌뼈는 물기를 제거하고 팬에 넣어 다진 마늘 1.5, 미림 2를 넣어 볶아주세요. 볶이시면 수분이 생기는데 수분이 없을 때까지 센 불로 볶아주시면 되어요.볶음팬 , 요리스푼', 'image_url': 'https://recipe1.ezmember.co.kr/cache/recipe/2024/06/23/821f971c19439c87a25bc906dc2d1b161.jpg'}, {'step_number': 5, 'description': '수분이 없어졌으면 간장 2를 팬에 가에 쪽에 넣어주고 지글지글 타기 전까지 끓여주시면 불 맛이 나요. 이제 오돌뼈에 간이 배어들게 볶아주세요.', 'image_url': 'https://recipe1.ezmember.co.kr/cache/recipe/2024/06/23/fc612ac40ad3ac5f187e43c7fc73559c1.jpg'}, {'step_number': 6, 'description': '설탕 1, 고추장 2, 고춧가루 2, 굴 소스 1을 넣어 양념을 잘 섞어주세요. 매운고춧가루, 매운고추장을 사용했어요.', 'image_url': 'https://recipe1.ezmember.co.kr/cache/recipe/2024/06/23/fe83e274dcd343067ed119048d8de2351.jpg'}, {'step_number': 7, 'description': '중불로 잘 볶아주시다가 양파를 넣어 익을 때까지 볶아주세요.매콤함을 원하시면 고추를 양파 넣을 때같이 넣어주셔도 좋아요.', 'image_url': 'https://recipe1.ezmember.co.kr/cache/recipe/2024/06/23/79ca357094475bbc6789e3198914ebb41.jpg'}, {'step_number': 8, 'description': '양파가 익었으면 불을 끄시고 올리고당 1, 참기름 1, 후추 약간, 깨와 채 썬 깻잎 반 정도 넣어서 섞어주세요.', 'image_url': 'https://recipe1.ezmember.co.kr/cache/recipe/2024/06/23/8ecef58bb8a0ecde4ab260473df7c6de1.jpg'}, {'step_number': 9, 'description': '그릇에 담아 채 썬 깻잎 반을 올려주시면 더 먹음직스럽게 플레이팅 하실 수 있어요. 계란찜이나 주먹밥이랑 같이 드시면 더 좋습니다!', 'image_url': 'https://recipe1.ezmember.co.kr/cache/recipe/2024/06/23/a1e184a2dfc9dfe6c95c59c21ebcb8341.jpg'}]"
37521,메인반찬,술안주,돼지고기,볶음,오삼불고기 오삼불고기양념,오삼불고기,https://recipe1.ezmember.co.kr/cache/recipe/2024/08/16/9f1edb87dd728ea2341449bac37c72d61.jpg,118,60분 이내,초급,3인분,"[('오징어                                                                                중', '2마리'), ('삼겹살', '200g'), ('양파                                                                                대', '1/3'), ('대파', '1대'), ('청양고추', '2개'), ('식용유', '1T'), ('고추장', '1T'), ('고춧가루', '2T'), ('다진마늘', '1T'), ('원당', '1T'), ('맛술', '2T'), ('진간장', '1T'), ('매실액', '1T')]","우리나라 사람들이 가장 좋아하는 음식중 하나인 삼겹살, 삼겹살과 오징어를 매콤하게 볶으면 이만큼 환상적인 조합이 없죠~~술안주로도 환영받는 오삼불고기 만들어봐요","[{'step_number': 1, 'description': '내장과 입, 뼈를 제거한 오징어 몸통에 사선으로 칼집을 냅니다\nㅡ칼집을 내면 양념이 잘 배고 부드러워요도마 , 조리용나이프', 'image_url': 'https://recipe1.ezmember.co.kr/cache/recipe/2024/08/16/fdd9e111761ad1cd23d480baf686241c1.jpg'}, {'step_number': 2, 'description': '오징어 긴다리는 반으로 자르고 몸통도 반 가른 후 1cm정도 넓이로 자릅니다볼오징어 손질법', 'image_url': 'https://recipe1.ezmember.co.kr/cache/recipe/2024/08/16/dfd9a7d306b9a784644663540ed6a0dc1.jpg'}, {'step_number': 3, 'description': '오징어에 원당을 먼저 넣고 5분정도 둔 후조리용스푼', 'image_url': 'https://recipe1.ezmember.co.kr/cache/recipe/2024/08/16/af4ce0c250439c345de1d20587d1e4321.jpg'}, {'step_number': 4, 'description': '고추장, 고춧가루, 다진마늘, 맛술, 매실액을 넣고 버무립니다', 'image_url': 'https://recipe1.ezmember.co.kr/cache/recipe/2024/08/16/d1df526640b5134ad8cb4eb7d093fc4e1.jpg'}, {'step_number': 5, 'description': '양파는 채썰고 대파와 청양고추는 어슷썰고 마늘은 반 자릅니다대파 손질법', 'image_url': 'https://recipe1.ezmember.co.kr/cache/recipe/2024/08/16/2a659bb63288220afe66ab92117d88e11.jpg'}, {'step_number': 6, 'description': '팬에 후추를 뿌린 삼겹살을 넣고 앞뒤로 노릇하게 구워 식힙니다프라이팬 , 키친타월', 'image_url': 'https://recipe1.ezmember.co.kr/cache/recipe/2024/08/16/46f61492b7dff421120371a04b36854b1.jpg'}, {'step_number': 7, 'description': '삼겹살 기름을 닦아낸 팬에 식용유를 두르고 양파, 마늘, 대파, 청양고추를 넣고 볶다가 팬가장자리에 진간장을 넣고 간장이 끓으면', 'image_url': 'https://recipe1.ezmember.co.kr/cache/recipe/2024/08/16/7c016a82a7b01dae90afddc3071e13741.jpg'}, {'step_number': 8, 'description': '양념한 오징어를 넣고 볶아요', 'image_url': 'https://recipe1.ezmember.co.kr/cache/recipe/2024/08/16/9e65e97ea5cf917f049f2da1426778d51.jpg'}, {'step_number': 9, 'description': '오징어가 익으면 먹기좋게 자른 삼겹살을 넣고 양념이 고루 배도록 버무린 후 불을 끄고 참기름과 통깨를 뿌립니다조리용가위', 'image_url': 'https://recipe1.ezmember.co.kr/cache/recipe/2024/08/16/f5e4bccc425060b45c38ad0e7d8ccbb41.jpg'}, {'step_number': 10, 'description': '감칠맛 나는 매콤한 오삼불고기 완성~접시', 'image_url': 'https://recipe1.ezmember.co.kr/cache/recipe/2024/08/16/55a113b0ab1ed2636f28a20b3870d3dc1.jpg'}]"
37522,메인반찬,술안주,돼지고기,볶음,#돼지사태요리 #마라요리 #마라사태볶음만들기 #중국고기볶음 #사태수육으로만드는마라사태볶음,마라사태볶음,https://recipe1.ezmember.co.kr/cache/recipe/2024/09/26/9a38cc96147ae13a94d577f9b4c008641.jpg,32,120분 이내,아무나,4인분,"[('수육                                                                                돼지 사태수육', '400g'), ('당근', '1/2개'), ('양파', '1개'), ('쪽파', '5줄기'), ('풋고추', '2개'), ('파기름', '2큰술'), ('고춧기름', '2큰술'), ('마라상궈소스', '5큰술'), ('마늘', '3개'), ('다진생강', '1작은술'), ('대파', '1대'), ('라조유', '2큰술')]","사태수육을 만들고는 일부러 남겨 놓았습니다. 그 사태수육으로 양꼬치집에서 만드는 소배필요리를 따라해서 만들어 보았습니다. ​ 그런데 매콤한 양념으로 마라상궈소스를 사용했고, 라조유를 사용해서 매콤하게 만든 마라사태볶음입니다. ​ 그렇다고 눈물 콧물이 쏟아질 정도의 매운 맛은 전혀 아닙니다. ^^","[{'step_number': 1, 'description': '돼지고기사태수육과 당근, 양파입니다. 여기에 추가로 고추가 2개 들어가는데 말은 풋고추이지만 맵습니다. 양파는 굵직하게 채썰어 주고, 당근은 어슷하게 편으로 썬 후 반으로 썰어 주시면 됩니다. 돼지고기사태는 된장 넣고 된장수육으로 만들어 준 것입니다. 1시간30분 삶아 주었습니다.도마 , 조리용나이프', 'image_url': 'https://recipe1.ezmember.co.kr/cache/recipe/2024/09/26/e5be99c9f0b5f784815a62b6b9d3a99f1.jpg'}, {'step_number': 2, 'description': '달궈진 팬에 고춧기름, 파기름, 대파를 길쭉하게 등분한 후 채썰어 넣어 주고, 거기에 마늘를 썰어서 넣어 줍니다. 다진생강도 넣어 줍니다. 그런 후 맛을 좌우하는 라조유를 넣어서 같이 달달 볶아 줍니다. 그런 전체적으로 고춧기름이 풍성하게 나는 양념이 됩니다.프라이팬 , 조리용스푼', 'image_url': 'https://recipe1.ezmember.co.kr/cache/recipe/2024/09/26/b675bd84568be2126e590816f07bbf0e1.jpg'}, {'step_number': 3, 'description': '잘 볶아졌다면 당근, 양파, 쪽파를 넣어 줍니다. 쪽파는 다듬어서 씻어 준 후 2등분해 주었습니다.', 'image_url': 'https://recipe1.ezmember.co.kr/cache/recipe/2024/09/26/d1cacb8d03761f646beed51afa54264f1.jpg'}, {'step_number': 4, 'description': '여기에 매콤한 맛고 모양을 위해서 고추를 어슷하게 썰어서 넣어 주고 드디어 맛의 한폭을 완성하는 간으로 마라상궈소스를 넣어 줍니다.', 'image_url': 'https://recipe1.ezmember.co.kr/cache/recipe/2024/09/26/25535df075398e8a736266694f5f131c1.jpg'}, {'step_number': 5, 'description': '당근이 충분히 익을때까지 달달 볶아 줍니다. 이번에는 수분이 나오지 않았기 때문에 전분물은 사용하지 않았습니다. 달달 볶은 후에 마지막으로 참기름을 한바퀴 둘러 줍니다. 매운 맛을 조금이나마 잡기 위함입니다.', 'image_url': 'https://recipe1.ezmember.co.kr/cache/recipe/2024/09/26/0fd7d9a45acdaf087ca7e48a48ff765f1.jpg'}, {'step_number': 6, 'description': '완성접시에 고기랑 각종 야채랑 함께 담아 줍니다. 소배필요리를 따라해서 만든 마라사태볶음 완성입니다. 은근히 매콤한 향만 날뿐이고 그렇게 확 맵지는 않습니다.접시', 'image_url': 'https://recipe1.ezmember.co.kr/cache/recipe/2024/09/26/6eed4b2ee2300f66f8b8627ff99724a61.jpg'}]"
37523,메인반찬,술안주,돼지고기,볶음,대패 삼겹살 두부김치,대패삼겹살두부김치,https://recipe1.ezmember.co.kr/cache/recipe/2015/12/11/99c7c07182c72964cdf5d51bab371a501.jpg,"14,606",15분 이내,초급,4인분,"[('배추김치', '1/5포기'), ('대패 삼겹살', '6줄'), ('두부', '1모'), ('양파', '1/2개'), ('대파', '1/2대'), ('홍고추', '1/2개'), ('풋고추', '1/2개'), ('식용유', '1/2큰술'), ('황설탕', '1큰술'), ('다진마늘', '1/2큰술'), ('맛술', '1큰술'), ('고춧가루', '3큰술'), ('진간장', '1큰술'), ('참기름', '1큰술'), ('통깨', '1큰술')]","두부는 고단백식품으로 근육 만들기 등 몸매를 가꾸는데도 도움이 되며, 다이어트에도 도움이 된답니다. 특히 리놀산을 함유하고 있어서 콜레스테롤을 낮춰주고 올리고당이 장의 움직임을 활성화하여 소화흡수를 도와 줍니다. 생으로도 먹고 찌개, 부침 등 다양하게 먹을 수 있는 것도 두부의 매력이구요.~~~ 오늘은 두부와 곁들여내는 두부 김치를 만들어 보겠습니다. 요거 술집에 베스트 메뉴 중 하나죠.~~ 저희 가족은 식사로 먹었네요. 그럼 보시죠.~~","[{'step_number': 1, 'description': '재료들을 한번에 모아 놓으면 요리할 때 빠뜨리는 재료가 없어서 편하지요. 김치나 대패 삼겹살은 약간 작게 썰어주는 것이 먹기가 편하더라구요.', 'image_url': 'https://recipe1.ezmember.co.kr/cache/recipe/2015/12/30/167a95cd7877f034feaf68c4486716b91.jpg'}, {'step_number': 2, 'description': '두부도 준비하시구요.', 'image_url': 'https://recipe1.ezmember.co.kr/cache/recipe/2015/12/30/255fc79396f012a555b12f75d4881d1f1.jpg'}, {'step_number': 3, 'description': '대패 삼겹살에서도 기름이 나오므로 식용유는 반큰술만 넣어 조리합니다. 팬을 달군 뒤에 기름을 넣어야 기름이 타지 않아 좋구요. 대패 삼겹살은 불이 세면 타기 쉬우니 불을 조절해가면서 먼저 볶아준 뒤에 반 이상 익었을 때 김치를 넣어 볶아줍니다. 김치가 볶아지면 양파를 넣어주고요.', 'image_url': 'https://recipe1.ezmember.co.kr/cache/recipe/2015/12/30/061eaaf644e5bc3dcf96888d6f2d632a1.jpg'}, {'step_number': 4, 'description': '양념은 설탕을 제일 먼저 넣어주는 것이 양념이 잘 배인답니다. 설탕 1큰술을 넣어 고루 섞어준 뒤에 다진 마늘 반큰술을 넣어줍니다. 김치에도 이미 마늘이 들어 갔으므로 많이 넣지는 마세요. 맛술 1큰술을 넣어주고요. 고추가루는 3큰술을 넣고 ( 취향껏 가감하시면 됩니다. ) 간장 1큰술로 간을 해줍니다. 여기에 대파, 고추류를 넣어주고 마지막에 참기름과 통깨로 완성합니다.', 'image_url': 'https://recipe1.ezmember.co.kr/cache/recipe/2015/12/30/1b98d75ea368296ada31da4468eaaadc1.jpg'}, {'step_number': 5, 'description': '볶아지면서 양이 많이 줄었지요. 요렇게 양이 줄어야 김치도 잘 볶아져서 더 맛있죠.', 'image_url': 'https://recipe1.ezmember.co.kr/cache/recipe/2015/12/30/6c27186887afdf99b1b4025ef1f1567c1.jpg'}, {'step_number': 6, 'description': '두부는 뜨겁게 데쳐서 드시면 맛있구요. 체에 받쳐 물기를 잘 빼주세요.', 'image_url': 'https://recipe1.ezmember.co.kr/cache/recipe/2015/12/30/a6f295703b5fa3fa23300fa39c0a8c9a1.jpg'}, {'step_number': 7, 'description': '먹기 좋은 크기로 잘라주시구요. 양이 적은 것 같지만, 두부 1모 양입니다.', 'image_url': 'https://recipe1.ezmember.co.kr/cache/recipe/2015/12/30/0001f1d6e337e04a2f50d993d9fb6d971.jpg'}, {'step_number': 8, 'description': '두부 김치가 완성되었습니다. 따끈한 두부도 맛있구요. 잘 볶아진 김치를 먹는 맛이 아주 끝내줍니다. 얇은 대패 삼겹살은 부드러워서 먹기가 편하구요. 두부에 올려 먹으면 환상 궁합이지요.', 'image_url': 'https://recipe1.ezmember.co.kr/cache/recipe/2015/12/30/dbed9f73138c96d806c8070c0e585a2e1.jpg'}]"
37524,메인반찬,술안주,돼지고기,볶음,제육볶음 황금레시피~~다오네만능간장으로 간단하고 쉽게제육볶음 황금레시피 도전하기,간장제육볶음,https://recipe1.ezmember.co.kr/cache/recipe/2017/01/25/35105da58a6760f21cc75288b97171361.jpg,"8,684",30분 이내,아무나,6인분 이상,"[('돼지고기', ''), ('만능간장', ''), ('고추장', ''), ('고춧가루', ''), ('양파', ''), ('당근', ''), ('대파', '')]",육볶음 황금레시피 다오네 만능간장으로 도전해보세요 오늘은 떡국떡과 돼지고기를 넣고 제육볶음을 만들어 보았습니다 맛있게 만들어 저녁을 먹고 기분좋은 전화를 받아 넘 보람을 느끼며 즐거운 마음으로 포스팅을 한답니다 다오네만능간장이 넘 맛있다 하시며 전화가 와 한참을 통화하였답니다 간단하고 쉽게 다오네만능간장으로 제육볶음 황금레시피 들어갑니다^^,"[{'step_number': 1, 'description': '실온에서 약간을 두면 고기가 녹는답니다 녹은고기를 반을 잘라서 준비합니다~~', 'image_url': 'https://recipe1.ezmember.co.kr/cache/recipe/2017/01/26/40d1473a4d27fdb6b21aa006172747f91.jpg'}, {'step_number': 2, 'description': '제육볶음 황금레시피 고기에 만능간장 3컵을 넣고 조물조물해주세요~~(소주컵)', 'image_url': 'https://recipe1.ezmember.co.kr/cache/recipe/2017/01/26/776775340b6d209b3104ac34275437821.jpg'}, {'step_number': 3, 'description': '여기에 고추장3스푼,고추가루3스푼,참기름 1스푼을 넣고 조물조물~~', 'image_url': 'https://recipe1.ezmember.co.kr/cache/recipe/2017/01/26/f2d950b669ff1f47a909c24cf9a904d81.jpg'}, {'step_number': 4, 'description': '야채를 손질할 동안 재워주세요 당근1개,양파2개,대파를 적당한 크기로 잘라서 준비합니다 청량고추가 있으면 같이 넣어주시면 좋구요~~', 'image_url': 'https://recipe1.ezmember.co.kr/cache/recipe/2017/01/26/77fafc4e84febd50aa7ed4af52fc6f211.jpg'}, {'step_number': 5, 'description': '준비한 야채를 재워둔고기에 넣고 다오네만응간장1컵 고추장1스푼,고추가루1스푼을 넣고 주물러주세요~`하루정도 재워두시고 드시면 더욱 맛있어요~~', 'image_url': 'https://recipe1.ezmember.co.kr/cache/recipe/2017/01/26/9b1a2bfd68cb34005756e736beabd8011.jpg'}, {'step_number': 6, 'description': '준비한 야채를 재워둔고기에 넣고 다오네만응간장1컵 고추장1스푼,고추가루1스푼을 넣고 주물러주세요~`하루정도 재워두시고 드시면 더욱 맛있어요~~', 'image_url': 'https://recipe1.ezmember.co.kr/cache/recipe/2017/01/26/62d9ff4716c64ac24dcd982d89374a321.jpg'}, {'step_number': 7, 'description': '팬에 약간에 기름을 두르고 볶아주세요 고기가 어느정도 익은후에 떡국용떡을 넣고 같이 볶아주시구요~~', 'image_url': 'https://recipe1.ezmember.co.kr/cache/recipe/2017/01/26/bfdf023392f38f8341bf6c85bfa137961.jpg'}]"
37525,메인반찬,술안주,돼지고기,볶음,삼겹살. 김치. 오징어볶음. 만들기,None,https://recipe1.ezmember.co.kr/cache/recipe/2016/12/22/84ab7be09280c63c7d9195366e0997241.jpg,"5,351",None,None,None,"[('삼겹살', '110g'), ('김치                                                                                썬 것', '1컵'), ('오징어', '40g'), ('쪽파', '2큰술'), ('불고기양념장', '1큰술'), ('고춧가루', '1큰술'), ('마늘', '1통'), ('식용유', '1큰술'), ('참기름', '1큰술'), ('통깨', '약간')]",,[]
37526,메인반찬,술안주,돼지고기,볶음,간단한 소주안주로 추천! 매콤 쫄깃한 돼지껍데기볶음,돼지껍데기볶음,https://recipe1.ezmember.co.kr/cache/recipe/2017/01/10/6b67d77130207e02c244ebc7e021b4be1.jpg,"7,445",10분 이내,아무나,2인분,"[('청정원 안주야 매운 껍데기', '1개'), ('부추', '1줌'), ('당근', '1/4개'), ('오이', '1/4개'), ('양상추', '2장'), ('콩가루', '1큰술')]","손쉽게 뚝딱 만들 수 있는 매콤한 요리 한가지만 알고 있다면 언제 어디서든 맛있는 밥반찬으로 술안주로 즐겨볼 수 있는데요. 그 중 여자들이 은근히 좋아하는 음식! 돼지껍데기 볶음 레시피를 가져와봤어요. 집에서 돼지껍데기를 직접 요리하는 것은 생각보다 어려워요. 그래서 정원이의 야심찬 킥! 청정원 안주야 제품으로 요리해보겠습니다. 뜨거운 팬에 휘리릭 볶아 부추와 콩가루를 솔솔 뿌려주면 여느 안주 부럽지 않은 간단한 혼술안주가 완성된답니다! 자, 그럼 침이 꼴깍 넘어가는 매콤 쫄깃 돼지껍데기볶음을 만나보세요~","[{'step_number': 1, 'description': '1. 부추를 5cm 길이로 자르고 당근, 오이를 한입크기로 자른다.', 'image_url': 'https://recipe1.ezmember.co.kr/cache/recipe/2017/01/10/7f6fb1e302ac3cf98d1242c79c5708681.jpg'}, {'step_number': 2, 'description': '2. 팬에 껍데기를 넣고 약불로 약 3~4분간 볶다가 부추를 넣고 살짝 볶는다.', 'image_url': 'https://recipe1.ezmember.co.kr/cache/recipe/2017/01/10/8b1546eb71443c7a62f0cef30244b4ed1.jpg'}, {'step_number': 3, 'description': '3. 접시에 양상추를 깔고 껍데기 볶음, 콩가루, 오이, 당근을 올려 완성한다', 'image_url': 'https://recipe1.ezmember.co.kr/cache/recipe/2017/01/10/f2a12fda3805b6ae82436e752dc3799b1.jpg'}]"
37527,메인반찬,술안주,돼지고기,볶음,치즈 범벅 칠리소스 돼지고기,단호박돼지고기,https://recipe1.ezmember.co.kr/cache/recipe/2016/09/26/95e056f170eecb74805b27cf57b2e4921.jpg,"2,243",60분 이내,중급,3인분,"[('돼지고기 등심                                                                                손바닥 크기', '8장'), ('단호박', '1개'), ('계란 노른자', '1개'), ('녹말가루', '1큰술'), ('튀김가루', '3큰술'), ('파프리카', '1/4개'), ('양파', '1/4개'), ('버섯', '약간'), ('캔 옥수수', '3~4큰술'), ('모짜렐라 치즈', '1장'), ('체다 슬라이스 치즈', '1장'), ('다진 마늘', '1.5큰술'), ('다진 양파', '2큰술'), ('연생강', '1/2큰술'), ('케찹', '3큰술'), ('두반장', '1.5큰술'), ('연두', '1큰술'), ('설탕', '2큰술'), ('식초', '2큰술'), ('닭 육수', '1컵'), ('녹말물', '2큰술'), ('참기름', '약간'), ('소금', '약간'), ('후추', '약간'), ('맛술', '2큰술')]","가을에 좋은 단호박이 많이 보이는 것 같더라구요. 
술안주로도 좋고, 메인 메뉴로도 좋은 매콤한 단호박 돼지고기에요.","[{'step_number': 1, 'description': '돼지고기 등심은 손바닥만한 크기로 8장을 준비했어요.\n두께는 많이 두껍지 않구요,\n먹기 좋은 크기로 길이대로 잘라서 준비를 합니다.', 'image_url': 'https://recipe1.ezmember.co.kr/cache/recipe/2016/09/26/13e07530490605103824eeccd1551a7a1.jpg'}, {'step_number': 2, 'description': '자른 돼지고기에 소금, 후추, 맛술로 밑간을 합니다.', 'image_url': 'https://recipe1.ezmember.co.kr/cache/recipe/2016/09/26/d64474ed886a88bcf477cb2ac9c1cf121.jpg'}, {'step_number': 3, 'description': '돼지고기를 살짝 재울동안 \n단호박을 전자렌지에서 4~5분간 조리한 후,\n윗 부분을 자르고, 속을 파내어 준비를 했어요.전자레인지', 'image_url': 'https://recipe1.ezmember.co.kr/cache/recipe/2016/09/26/aa1a31b492d99ad47e4a0a4ee6f7305b1.jpg'}, {'step_number': 4, 'description': '잠시 재워둔 돼지고기에 노른자만 넣고 조물조물 버무리다가', 'image_url': 'https://recipe1.ezmember.co.kr/cache/recipe/2016/09/26/4480381e89c6a77cedea88dbdac98d761.jpg'}, {'step_number': 5, 'description': '녹말가루 1큰술, 튀김가루 3큰술을 넣고 같이 버무려줍니다.', 'image_url': 'https://recipe1.ezmember.co.kr/cache/recipe/2016/09/26/d2967270a9af0051da25a81ad7f84d081.jpg'}, {'step_number': 6, 'description': '적당한 온도의 기름에 돼지고기를 한 번 튀겨내고, 건져내었다가 다시 튀겨서 키친타올에 올려 기름을 뺍니다.', 'image_url': 'https://recipe1.ezmember.co.kr/cache/recipe/2016/09/26/c7290738d363c85e7a837a13ba07aa4f1.jpg'}, {'step_number': 7, 'description': '달군 팬에 식용유 1큰술을 두르고, 다진 마늘 1큰술 반, 다진 양파 2큰술, 연생강 반큰술을 넣고 타지 않도록 볶습니다.', 'image_url': 'https://recipe1.ezmember.co.kr/cache/recipe/2016/09/26/cf09af0654dd11b186f033b5964157ce1.jpg'}, {'step_number': 8, 'description': '케찹 3큰술, 두반장1큰술 반, 연두 1큰술, 설탕 2큰술, 식초2큰술, 닭 육수 1컵을 붓고 끓입니다.\n(식초의 양은 식성에 맞게 조절하셔도 됩니다.)', 'image_url': 'https://recipe1.ezmember.co.kr/cache/recipe/2016/09/26/b14dc47456aa73339f9c7f4d37255d001.jpg'}, {'step_number': 9, 'description': '파프리카 1/4개, 양파 1/4개, 버섯 약간을 넣고 같이 끓이다가', 'image_url': 'https://recipe1.ezmember.co.kr/cache/recipe/2016/09/26/5711aef29a56761f1d2e568fa55db5d21.jpg'}, {'step_number': 10, 'description': '녹말물 2큰술을 부어 농도를 조절합니다.', 'image_url': 'https://recipe1.ezmember.co.kr/cache/recipe/2016/09/26/0c454aee2b9314f1a370e1ccac2464231.jpg'}, {'step_number': 11, 'description': '소스가 걸쭉해지면 기름기를 뺀 돼지고기를 넣고 소스와 잘 버무립니다.', 'image_url': 'https://recipe1.ezmember.co.kr/cache/recipe/2016/09/26/345f1d4252e4fed98c02c315f06f577f1.jpg'}, {'step_number': 12, 'description': '마지막에 참기름 약간을 떨어뜨려 섞어줍니다.', 'image_url': 'https://recipe1.ezmember.co.kr/cache/recipe/2016/09/26/4980a11496da6300c71472b9fbc0dad11.jpg'}, {'step_number': 13, 'description': '속을 파낸 단호박 속에 칠리소스 돼지고기를 담고, 캔 옥수수도 조금씩 섞어서 넣어주었어요.', 'image_url': 'https://recipe1.ezmember.co.kr/cache/recipe/2016/09/26/6d6ea8073bb0841b4180a2a596c231b71.jpg'}, {'step_number': 14, 'description': '모짜렐라 치즈와 체다 슬라이스 치즈를 넣어 뚜껑을 덮어 오븐에서 구웠어요.', 'image_url': 'https://recipe1.ezmember.co.kr/cache/recipe/2016/09/26/fe25bb26416615078dd02f50fac1721e1.jpg'}, {'step_number': 15, 'description': '180도로 예열한 오븐에서 약 15분간 굽습니다.\n오븐 온도마다 틀리니 조절하세요~오븐', 'image_url': 'https://recipe1.ezmember.co.kr/cache/recipe/2016/09/26/e93cc498bd30a23aefed3a34cd786a171.jpg'}]"
