index,종류별,상황별,재료별,방법별,글 제목,레시피이름,레시피이미지,조회수,조리시간,난이도,인분,재료,소개글,조리순서
42370,메인반찬,영양식,해물류,끓이기,#봄제철요리 #쭈꾸미샤브샤브만들기 #구수한 조개육수에 싱싱한 쭈꾸미와 시금치랑 같이 먹는 쭈꾸미샤브샤브,주꾸미샤브샤브,https://recipe1.ezmember.co.kr/cache/recipe/2020/04/17/2501c49c6505175391df24960e201a0a1.jpg,"7,180",15분 이내,아무나,2인분,"[('쭈꾸미', '1kg'), ('시금치', '1/2단'), ('조개육수', '1L'), ('라면', '1개'), ('초고추장', '4큰술')]","봄이 되면 통통하게 알이 꽉찬 쭈꾸미를 구워서 먹거나 샤브샤브로 먹지요.

가을에는 낙지이고요. ㅎㅎ

​

주문한 쭈꾸미는 큼지막하고 살도 튼실한데 아쉽게도 알을 다 빼서

손질해 놓고는 보냈더라구요. 에구궁..그럼 봄철쭈꾸미가 아닌지!!!!

​

그래도 뭐 쫄깃쫄깃한 식감으로 된장육수에 넣어서는

시금치와 함께 초고추장에 찍어 먹는 맛이요. 그맛에 먹는 것이죠.

만약 알이 있었다면 대가리는 따로 잘라내고 나중에 라면를 넣고 같이 먹으면 정말 끝내주는 맛이지요.

​

육수는 간편하게 바지락과 꼬막을 삶아낸 조개육수를 사용하였고

쭈꾸미샤브샤브에는 꼭 들어가는 것이 시금치이지요 ^^","[{'step_number': 1, 'description': '손질된 쭈꾸미이지만 그래도 두서너번 박박 씻어서 물기를 빼 줍니다.', 'image_url': 'https://recipe1.ezmember.co.kr/cache/recipe/2020/04/17/b1be0c56bbc393117a4c8d564e9f04161.jpg'}, {'step_number': 2, 'description': '육수는 조개육수입니다. 바지락과 꼬막을 삶아낸 육수이지요. 간은 조개육수 자체의 바다짠맛이 있기 때문에 해주지 않았습니다. 슴슴한 상태에서 샤브샤브를 하고 나중에 라면을 넣어서 끓여 드시면 딱 좋은 간이 됩니다.', 'image_url': 'https://recipe1.ezmember.co.kr/cache/recipe/2020/04/17/23e3bdc22265f14136992b9e2b2d66251.jpg'}, {'step_number': 3, 'description': '샤브샤브이기 때문에 물기를 빼 준 쭈꾸미를 준비해 놓습니다. 그릇에 잘 담아서 준비해 놓습니다.', 'image_url': 'https://recipe1.ezmember.co.kr/cache/recipe/2020/04/17/f7df88f36811a24f54d5e535239860851.jpg'}, {'step_number': 4, 'description': '그리고 손질하고 씻어낸 시금치도 준비해 놓고요. 시금치는 통째로 넣지 마시고 한잎 한잎 뜯어서 준비해 놓습니다. 시금치가 아주아주 실하고 고소합니다.', 'image_url': 'https://recipe1.ezmember.co.kr/cache/recipe/2020/04/17/b1662943ace5a8b0102ff9b52bfc20361.jpg'}, {'step_number': 5, 'description': '쭈꾸미샤브샤브를 위한 밥상이 준비되었습니다. 찬들도 있지만 육수를 먼저 끓여 주고요.', 'image_url': 'https://recipe1.ezmember.co.kr/cache/recipe/2020/04/17/034ad778f6892993a464107edaac4b3f1.jpg'}, {'step_number': 6, 'description': '육수가 팔팔 끓어오르면 먼저 시금치부터 넣어 줍니다.', 'image_url': 'https://recipe1.ezmember.co.kr/cache/recipe/2020/04/17/909847425d2ff52982bbca426f2e99ab1.jpg'}, {'step_number': 7, 'description': '그리고 쭈구미도 투하!! 쭈꾸미는 1분정도면 충분히 쫄깃하면서도 부드러운 상태가 됩니다. 바로바로 건져내어서 초고추장에 찍어 드시면 됩니다. 시금치와 함께요.', 'image_url': 'https://recipe1.ezmember.co.kr/cache/recipe/2020/04/17/edee434e24ef7f0584763e00d340872e1.jpg'}, {'step_number': 8, 'description': '어느 정도 쭈꾸미를 먹었다면 이제 라면스프를 넣어서 다시한번 끓여 줍니다. 마무리를 라면이지요. 자체내에 간을 하지 않은 조개육수이기 때문에 라면스프 하나를 그냥 다 넣어 주었습니다.', 'image_url': 'https://recipe1.ezmember.co.kr/cache/recipe/2020/04/17/0789aa46d8888ba2337455047b6766201.jpg'}, {'step_number': 9, 'description': '팔팔 끓어 오르면 라면사리를 넣어서 끓여 줍니다. 라면과 함께 먹는 쭈꾸미의 맛!!! 거기에 쭈꾸미에서 우러나온 시금치에서 우러나온 육수의 맛이 끝내 주는 맛입니다. 조개육수로 하기를 잘했다고 생각이 들었습니다. 깔끔하게 떨어지는 시원한 육수맛이였어요.', 'image_url': 'https://recipe1.ezmember.co.kr/cache/recipe/2020/04/17/ab5fb7de8709c61981e46bdc111d2b151.jpg'}]"
42371,메인반찬,영양식,해물류,끓이기,불낙전골 만드는법. 낙지 손질법.,불고기낙지전골,https://recipe1.ezmember.co.kr/cache/recipe/2020/04/21/fb06ba310bd1ee34f37dd28e75bd6d3a1.jpg,"2,938",30분 이내,아무나,4인분,"[('낙지', '4마리'), ('소고기', '300g'), ('콩나물', '150g'), ('주키니 호박', '1/3개'), ('양파', '1/2개'), ('미나리', '5줄'), ('느타리 버섯', '1줌'), ('무', '150g'), ('다시마', '1장'), ('생강청', '1T'), ('맛술', '1T'), ('올리고당', '1T'), ('간장', '1T'), ('후추', ''), ('고춧가루', '2T'), ('멸치 액젓', '2T'), ('다진마늘', '1T')]","코로나로 일상에 지친 남편과 아이들을 위해 힘내라고 불낙전골을 만들었어요.
맵고 짠음식을 싫어하는 남편 입에 맞췄으니 싱거우면 새우젓이나 소금을 더 넣어 주세요.","[{'step_number': 1, 'description': '낙지는 밀가루를 넣어 빨판을 위주로\n훓어가며 깨끗이 씻어 주세요.', 'image_url': 'https://recipe1.ezmember.co.kr/cache/recipe/2020/04/21/029df460082a1c21e3dcafd0bbdda4471.jpg'}, {'step_number': 2, 'description': '씻은 낙지는 머리에 있는 내장을 꺼내고 눈도 잘라냅니다.', 'image_url': 'https://recipe1.ezmember.co.kr/cache/recipe/2020/04/21/5fb5fa941fcea3080110271b3609d8961.jpg'}, {'step_number': 3, 'description': '소고기 불고기 감에 생강청, 맛술,후추,올리고당,후추로 양념해 재워 둡니다.\n*설탕 대신 생강청과 올리고당을 넣었더니 훨씬 맛있더라구요.', 'image_url': 'https://recipe1.ezmember.co.kr/cache/recipe/2020/04/21/f8112c8903570ecfdcdfbf6c9a8d35db1.jpg'}, {'step_number': 4, 'description': '콩나물 뿌리는 그냥 해도 되지만 너무 길면 먹을때 걸리니 뿌리를 잘라내고 깨끗이 씻어 주세요.\n*귀찮으면 그냥 하셔도 상관 없습니다.', 'image_url': 'https://recipe1.ezmember.co.kr/cache/recipe/2020/04/21/61392b2663a98c5cbfcb8cd5b6c94f981.jpg'}, {'step_number': 5, 'description': '주키니 호박은 반갈라 반달 썰기 합니다.', 'image_url': 'https://recipe1.ezmember.co.kr/cache/recipe/2020/04/21/a2bb90a3b7d396edaf7f00876d67d8381.jpg'}, {'step_number': 6, 'description': '무도 반갈라 큼직하게 썰어 주세요.', 'image_url': 'https://recipe1.ezmember.co.kr/cache/recipe/2020/04/21/5545342f196f32fb89b168b239b31acd1.jpg'}, {'step_number': 7, 'description': '양파는 채 썰어 주세요.', 'image_url': 'https://recipe1.ezmember.co.kr/cache/recipe/2020/04/21/6938668a30a5278b8218845aa1b1c3391.jpg'}, {'step_number': 8, 'description': '고추는 어슷 썹니다.', 'image_url': 'https://recipe1.ezmember.co.kr/cache/recipe/2020/04/21/dd43f79a3b65ccaad09097525d2500b41.jpg'}, {'step_number': 9, 'description': '미나리는 2cm 길이로 잘라 주세요.', 'image_url': 'https://recipe1.ezmember.co.kr/cache/recipe/2020/04/21/03fc4ea6b90ea240fcc2606eae5cc3231.jpg'}, {'step_number': 10, 'description': '느타리 버섯은 손으로 떼어 둡니다.', 'image_url': 'https://recipe1.ezmember.co.kr/cache/recipe/2020/04/21/194279f127da12a1433e3fa5473ad5761.jpg'}, {'step_number': 11, 'description': '냄비 바닥에 무를 가지런히 깔고 콩나물,다시마,물을 넣어 끓여 주세요.\n*끓으면 바로 다시마를 꺼내지 말고 콩나물이 익은 냄새가 나면 뚜껑 열어 꺼내 주세요.', 'image_url': 'https://recipe1.ezmember.co.kr/cache/recipe/2020/04/21/2ced0ebe25986f65ccfa6420216c73f21.jpg'}, {'step_number': 12, 'description': '끓으면 다시마 건져내고 불고기,낙지,호박,양파,다진마늘,고춧가루,멸치액젓으로 간 맞춰 푹 끓입니다.\n*간이 부족하면 소금이나 새우젓을 넣어 맞춰 보세요..\n*새우젓을 넣으면 감칠맛이 나서 더 맛있더라구요.\n전 딸이 간이 맞다고 해서 안넣었어요.', 'image_url': 'https://recipe1.ezmember.co.kr/cache/recipe/2020/04/21/b0b784e67d671f4a440b50c9ac67b6f71.jpg'}, {'step_number': 13, 'description': '고기가 익었으면 느타리 버섯,청양고추,미나리 넣어 완성합니다.', 'image_url': 'https://recipe1.ezmember.co.kr/cache/recipe/2020/04/21/992ab422181c7af5e4214ce288f152021.jpg'}]"
42372,메인반찬,영양식,해물류,끓이기,홍가리비 찌는법 가리비 삶는법 칼국수 만드는법,홍가리비찌는법,https://recipe1.ezmember.co.kr/cache/recipe/2024/01/05/00f0d2f30016b7cd0817ef7a77324a0b1.jpg,"1,693",20분 이내,초급,2인분,"[('홍 가리비', '2~3kg')]",오늘은 11월~3월까지 제철인 홍가리비 찜과 홍가리비 육수로 만든 칼국수 요리를 알려드릴게요 조개 요리라고 해서 겁먹을 필요 없을 정도로 초보자분들도 쉽게 따라 할 수 있을 만큼 간단한 레시피랍니다,"[{'step_number': 1, 'description': '가리비는 해감할 필요가 없다고하는데 찝찝하신 분들은 가리비를 물에 잠길만큼 넣고, 소금 1스푼을 넣고 뚜껑이나 검은봉지를 덮어 30~1시간동안 놔두시면 약간의 이물질이 나오면서 해감이 됩니다.믹싱볼', 'image_url': 'https://recipe1.ezmember.co.kr/cache/recipe/2024/01/05/3c28e0d76d5c4ed2eeedc345f5e1f46a1.jpg'}, {'step_number': 2, 'description': '해감한 홍가리비는 표면은 가정용 솔로 닦아 이물질을 제거해주고찜기 , 조개세척솔', 'image_url': 'https://recipe1.ezmember.co.kr/cache/recipe/2024/01/05/9df7d19248718c490c5702edab1997831.jpg'}, {'step_number': 3, 'description': '물에 맛술 2스푼 넣어 약간의 비린내도 잡아주었어요 냄비', 'image_url': 'https://recipe1.ezmember.co.kr/cache/recipe/2024/01/05/b5948dfb55c731af1a644d42315993b51.jpg'}, {'step_number': 4, 'description': '그 위에 찜기용 채반 올려주세요 냄비엔 물이 넘치지 않을 정도로만 물을 담아주세요', 'image_url': 'https://recipe1.ezmember.co.kr/cache/recipe/2024/01/05/d9057784cadaeaf465094be8284ea9c21.jpg'}, {'step_number': 5, 'description': '물이 끓으면 씻어둔 홍가리비의 입 방향이 위로 올라가도록 모두 올려주세요 저는 한 번에 안 들어가서 2회에 걸쳐서 쪄줬어요', 'image_url': 'https://recipe1.ezmember.co.kr/cache/recipe/2024/01/05/5c3c408a11e022a46610033dc5feadf31.jpg'}, {'step_number': 6, 'description': '뚜껑 닫고 7~8분 동안 팔팔 끓이다 보면 가리비 입이 쩍쩍 벌려져요10분이 넘어가면 가리비가 수분기 없이\n질겨지면서 맛이 떨어지니\n시간을 잘 맞춰주세요', 'image_url': 'https://recipe1.ezmember.co.kr/cache/recipe/2024/01/05/212f426d3fbdf2dc30c7c37deea39f9e1.jpg'}, {'step_number': 7, 'description': '저는 보기에도 좋고 먹기에도 좋게 가리비 한쪽 껍질은 따로 빼서 버렸어요접시', 'image_url': 'https://recipe1.ezmember.co.kr/cache/recipe/2024/01/05/045f31315798e8cfb971c1707acfb1b41.jpg'}, {'step_number': 8, 'description': '소스로는 초고추장이나, 핫 소스 또는 간장과 와사비 조합으로 먹을 수 있어요 저는 조개 자체만으로도 짭짤하고 달큰한 맛이 간이 딱 알맞아서 따로 소스와 먹지 않아도 충분했어요', 'image_url': 'https://recipe1.ezmember.co.kr/cache/recipe/2024/01/05/a1054b75dfff79a1a17d14f17e775ce31.jpg'}, {'step_number': 9, 'description': '조개 삶고 나온 물은 버리지 않고 칼국수를 끓여드시면 진국이랍니다.', 'image_url': 'https://recipe1.ezmember.co.kr/cache/recipe/2024/01/05/4906c323ee1d980fe46d35989654347f1.jpg'}, {'step_number': 10, 'description': '버섯, 양파, 다진마늘 반스푼 정도 넣고 모자란 간은 소금을 약간 더 넣어주시고 칼국수를 넣어 끓여드시면 맛있답니다', 'image_url': 'https://recipe1.ezmember.co.kr/cache/recipe/2024/01/05/ac61e940f096c087c0a5775b50cc713b1.jpg'}, {'step_number': 11, 'description': '가리비 찜하고 먹고 남은 알맹이도 몇 개 넣어줬어요 맛있게 드세요~!', 'image_url': 'https://recipe1.ezmember.co.kr/cache/recipe/2024/01/05/a6dd9f660fff0c9353b3327f0f7428be1.jpg'}]"
42373,메인반찬,영양식,해물류,끓이기,채소 쌈과 잘 어울리는 우렁이 쌈장 만들기,우렁이쌈장,https://recipe1.ezmember.co.kr/cache/recipe/2021/01/22/638aeb3fa5af286f47ef01598d4ddcbf1.jpg,"2,477",30분 이내,아무나,4인분,"[('우렁이살', ''), ('돼지고기다짐육', ''), ('된장', ''), ('고추장', ''), ('설탕', ''), ('다진마늘', ''), ('멸치육수', ''), ('매운고추', ''), ('양파', ''), ('호박', ''), ('대파', ''), ('표고버섯', ''), ('들기름', ''), ('깨소금', ''), ('양배추', ''), ('근대', '')]",한인마트에 우렁이를 보고 얼마나 반가운지 가격 또한 적당해서 한 팩 사 왔어요^^ 날씨가 쌀쌀하니 생채소 보다 살짝 쪄서 쌈장과 함께 먹으면 밥도둑이 따로 없지요.. 그리고 우렁이는 된장과 아주 잘어울린는 식재료로 쌈장의 재료로 아주 좋습니다... 그래서 준비했답니다~ ​ 채소 잎에 따뜻한 밥과 쫄깃한 우렁이살이 들어있는 쌈장을 얹어 싸먹으면 고기를 따로 곁들이지 않아도 맛있어요~ 매콤한 맛을 좋아하는 식구들을 위해 매운 고추도 넣고 돼지고기 다짐육도 넣어 고기 맛도 내줬답니다.,"[{'step_number': 1, 'description': '호박, 파, 버섯, 양파 등을 잘게 썰어 준비해 둡니다.', 'image_url': 'https://recipe1.ezmember.co.kr/cache/recipe/2021/01/22/07e74356ce103296554665e4a544f1941.jpg'}, {'step_number': 2, 'description': '기름을 두른 팬에 양파와 마늘을 넣고 볶아줍니다. 양파가 투명해지면 돼지고기 다짐 육을 넣어줘요', 'image_url': 'https://recipe1.ezmember.co.kr/cache/recipe/2021/01/22/02408bf77532019a9fac37e739dfa36c1.jpg'}, {'step_number': 3, 'description': '고기가 어느 정도 익은 후 표고버섯을 넣고', 'image_url': 'https://recipe1.ezmember.co.kr/cache/recipe/2021/01/22/4cc8a2f18f0890df2672e55668d8f0871.jpg'}, {'step_number': 4, 'description': '된장, 고추장, 들기름, 매운 고추 등 양념류를 넣어 볶아줍니다.', 'image_url': 'https://recipe1.ezmember.co.kr/cache/recipe/2021/01/22/3ab40242be12d6048f50e9f94ad5cef41.jpg'}, {'step_number': 5, 'description': '준비해둔 멸치, 다시마, 황태로 우린 육수를 220ml를 넣어줘요', 'image_url': 'https://recipe1.ezmember.co.kr/cache/recipe/2021/01/22/1e87f793e7f14976dff03450147687831.jpg'}, {'step_number': 6, 'description': '육수를 넣고 자박자박 끓으면 마지막에 설탕과 우렁이를 넣어줍니다,', 'image_url': 'https://recipe1.ezmember.co.kr/cache/recipe/2021/01/22/4ad6134420c425479b827042a0dbcb611.jpg'}, {'step_number': 7, 'description': '우렁이를 넣고 5-7분 정도 끓은 후 마지막에 깨를 넣어 완성시킵니다. 간을 보아 기호에 맞게 조절하세요!!', 'image_url': 'https://recipe1.ezmember.co.kr/cache/recipe/2021/01/22/a41075607e8bd70a9b70351461493cf01.jpg'}]"
42374,메인반찬,영양식,해물류,끓이기,"물 없이 만드는 ""우렁이 강된장""",우렁이강된장,https://recipe1.ezmember.co.kr/cache/recipe/2021/01/26/8ebaead4b88344bf6c0fd4584bbcd0f61.jpg,"3,173",20분 이내,아무나,4인분,"[('우렁이', '400g'), ('새송이버섯', '4개'), ('양파', '1개'), ('청양고추', '3개'), ('대파', '1개'), ('된장', '2스푼'), ('고춧가루', '2스푼'), ('설탕', '1스푼'), ('다진 마늘', '1스푼'), ('참기름', '1스푼'), ('찹쌀가루', '1스푼'), ('후추', '조금')]","가벼운 한 끼 식사를 고민해 보다가 ""우렁이 강된장""을 만들어 보았습니다.

※ 우렁이 효능
연체동물에 속하는 우렁이는 단백질, 칼슘, 철분을 함유하고 있어서 빈혈 예방 및 성장기 어린이 골격 형성에 이로운 작용을 하며, 이뇨작용을 촉진하여 부종을 예방하고, 독소 배출을 도와 음주 후 숙취해소에 좋습니다. 또한, 각종 비타민 및 무기질을 함유하여 체내 독소 해독을 돕고, 활성산소 제거에도 이로운 작용을 합니다.
​","[{'step_number': 1, 'description': '우렁이는 채에 받혀서 흐르는 물에 4~5번 충분히 씻어 줍니다. 씻을 때 이물질을 최대한 많이 빼주기 위해 구멍이 넓은 채를 사용했어요 / 밀가루를 0.5컵 넣고 무친뒤에 씻어 주셔도 도움이 많이 됩니다.', 'image_url': 'https://recipe1.ezmember.co.kr/cache/recipe/2021/01/26/7a4753c9edb8b193dbfedfc92287f9361.jpg'}, {'step_number': 2, 'description': '별도로 물을 넣지 않고 버섯과 양파에서 나오는 물로 자작하게 끓여야 강된장이 진하고 맛이 좋습니다. 새송이버섯 4개, 양파 1개, 파 1개, 청양고추 3개를 씻어서 준비해 줍니다.', 'image_url': 'https://recipe1.ezmember.co.kr/cache/recipe/2021/01/26/7fad4fa0d3f6262ba114847ab137ccf91.jpg'}, {'step_number': 3, 'description': '버섯과 채소를 모두 잘게 다져서 준비해 줍니다.', 'image_url': 'https://recipe1.ezmember.co.kr/cache/recipe/2021/01/26/443b3eb143ac92f6fd7478fa3c6367291.jpg'}, {'step_number': 4, 'description': '잘게 다져진 채소를 먼저 밑에 담고 세척한 우렁이를 위에 쌓아 줍니다.', 'image_url': 'https://recipe1.ezmember.co.kr/cache/recipe/2021/01/26/c0307ec66c08d53758252f33bf6750801.jpg'}, {'step_number': 5, 'description': '된장 2스푼, 고춧가루 2스푼, 설탕 1스푼 다진 마늘 1스푼, 참기를 1스푼을 올려서 중불에 올려 줍니다.', 'image_url': 'https://recipe1.ezmember.co.kr/cache/recipe/2021/01/26/724093b2efccd085e6ff22ea6b1774661.jpg'}, {'step_number': 6, 'description': '물이나 육수를 따로 넣지 않아도 중불에 5분 정도 끓이면 채소의 부피가 줄어들면서 자작하게 물이 나오게 됩니다.', 'image_url': 'https://recipe1.ezmember.co.kr/cache/recipe/2021/01/26/cfcd9ad325fb7696d33a8eb192d8c6421.jpg'}, {'step_number': 7, 'description': '찹쌀가루 1스푼과 후추를 조금 넣고 중불에서 10분 더 끓이면서 졸여주면 완성입니다. 중불에 10분 졸이는 동안에는 아랫부분이 타지 않도록 계속 저어 주어야 합니다. 냄비 위쪽까지 쌓여 있던 내용물이 냄비 중간까지 줄어들어 있는데요 카레나 짜장밥처럼 밥을 비벼도 될 정도로 국물이 거의 없을 때까지 졸여주시면 됩니다.', 'image_url': 'https://recipe1.ezmember.co.kr/cache/recipe/2021/01/26/1c1897339abb23288b01c14dd953e1c01.jpg'}]"
42375,메인반찬,영양식,해물류,끓이기,연어장 간단하게 만드는 연어요리,연어장,https://recipe1.ezmember.co.kr/cache/recipe/2021/01/28/dbd0e06735605ac31d8f52c0ced74fc61.jpg,"4,534",2시간 이상,아무나,4인분,"[('연어', '600g'), ('청양고추                                                                                또는 청고추', '2개'), ('양파', '1/2개'), ('간장', '1.5종이컵'), ('참치액                                                                                또는 저염액젓', '2큰술'), ('설탕', '1큰술'), ('맛술', '2큰술'), ('청주', '2큰술'), ('물', '3종이컵'), ('양파', '1/2개'), ('사과', '1/2개'), ('대파', '1/2대'), ('다시마', '3쪽'), ('통마늘', '5개')]","간장게장도 새우장도 밥도둑의 일인자가 맞는데요, 요 연어장도 과히 어깨를 겨눌만한 밥도둑 이랍니다. 생연어 썰어서 맛간장 넉넉하게 끓여서 붓기만 하면 되는 초간단 연어레시피로 덮밥 으로도 고급스러우면서 간단하게 먹기 좋은 연어요리 랍니다.","[{'step_number': 1, 'description': '맛간장을 만들어 줍니다. 냄비에 간장 1.5종이컵, 참치액or저염액젓 2큰술, 설탕 1큰술, 맛술 2큰술, 청주 2큰술, 물 3종이컵을 넣고 양파 1/2개, 사과 1/2개, 대파 1/2대, 다시마 3쪽, 통마늘 5개를 넣어 줍니다. 기호에 따라 칼칼한 맛을 좋아하시면 청양고추나 홍고추를 추가해서 넣어주셔도 되어요. 저는 위의 분량보다 더 많이 만들었어요. 맛간장은 넉넉히 만들어서 간장게장이나 새우장, 계란장 등 다양한 조림반찬에 사용하면 좋아요.', 'image_url': 'https://recipe1.ezmember.co.kr/cache/recipe/2021/01/28/3c128d1b99ec9916d8f5ec185dc315211.jpg'}, {'step_number': 2, 'description': '끓기 시작하면 센불을 중불로 줄여서 약 10분간 팔팔 끓여서 식혀줍니다.', 'image_url': 'https://recipe1.ezmember.co.kr/cache/recipe/2021/01/28/cd89aaeb11336a33e7b408c5565565fa1.jpg'}, {'step_number': 3, 'description': '생연어는 키친타올로 살짝이 눌러 줍니다.', 'image_url': 'https://recipe1.ezmember.co.kr/cache/recipe/2021/01/28/60d8687a56be5462c9720de966d75b2b1.jpg'}, {'step_number': 4, 'description': '적당히 먹기 좋은 크기로 약 5mm 두께로 썰어 주시면 된답니다.', 'image_url': 'https://recipe1.ezmember.co.kr/cache/recipe/2021/01/28/399b850346be57b3eef06f43cdf267531.jpg'}, {'step_number': 5, 'description': '청양고추나 청고추를 송송 썰고 양파 반개는 얇게 슬라이스해서 준비합니다.', 'image_url': 'https://recipe1.ezmember.co.kr/cache/recipe/2021/01/28/b426b6abeecc5e8a78e1975fa071380e1.jpg'}, {'step_number': 6, 'description': '통에 연어를 담아줍니다.', 'image_url': 'https://recipe1.ezmember.co.kr/cache/recipe/2021/01/28/bc21d047f6427d9ee719ad9cf6e4d57f1.jpg'}, {'step_number': 7, 'description': '그 위에 슬라이스한 양파와 송송 썬 청양고추를 넣어 줍니다.', 'image_url': 'https://recipe1.ezmember.co.kr/cache/recipe/2021/01/28/a9ad5da554df970990f3be2d0d1b02a21.jpg'}, {'step_number': 8, 'description': '식힌 맛간장은 건더기를 건져 줍니다.', 'image_url': 'https://recipe1.ezmember.co.kr/cache/recipe/2021/01/28/af7c5eca56551a8306c071c17397b5e41.jpg'}, {'step_number': 9, 'description': '연어에 맛간장을 부어 주고 냉장고에서 약 7~8시간 숙성후에 드시면 된답니다.', 'image_url': 'https://recipe1.ezmember.co.kr/cache/recipe/2021/01/28/8fea96b1c044a679a02805b218631b641.jpg'}]"
42376,메인반찬,영양식,해물류,끓이기,<면역력증진> 이보다 더 없을 보양식~해신탕!,해신탕,https://recipe1.ezmember.co.kr/cache/recipe/2020/03/10/03104d17956cd2237c05ef4b7f0706b91.jpg,"6,639",90분 이내,아무나,4인분,"[('삼계탕용닭', '1마리'), ('문어', '1마리'), ('전복', '10마리'), ('백합', '20개'), ('흰다리새우', '4마리'), ('부추', '1줌'), ('건대추', '1줌'), ('통마늘', '15개'), ('삼계탕약재티팩', '1봉지'), ('밀가루', '2큰술'), ('생강술                                                                                or 맛술 소주', '4큰술'), ('후추가루', '조금'), ('소금', '조금')]",면역력증진이 중요한 이시기에 보양식으로 좋다하는것으로만 넣어서 만들어본 해신탕이네요,"[{'step_number': 1, 'description': '인터넷에 해신탕재료라고 검색하니 많이 나오네요 생물로 다 포장이 되어서 배송이 되네요', 'image_url': 'https://recipe1.ezmember.co.kr/cache/recipe/2020/03/10/c5ffe346a0de43f83ec2131d209aaee01.jpg'}, {'step_number': 2, 'description': '문어에는 밀가루2큰술을 뿌려서 잘비벼서 문질러준후 깨끗하게 씻어주세요\n전복/흰다리새우도 깨끗하게 문질러서 씻어주세요', 'image_url': 'https://recipe1.ezmember.co.kr/cache/recipe/2020/03/10/3e018f268373e238cc7e11cf7a1175d91.jpg'}, {'step_number': 3, 'description': '백합도 비벼서 씻어주시고 생닭은 꼬리/목에 붙어있는 지방을 제거후 안에 붙어있는 내장찌꺼기도 깨끗하게 씻어주세요', 'image_url': 'https://recipe1.ezmember.co.kr/cache/recipe/2020/03/10/83052d9dd8c596415117414001c9443f1.jpg'}, {'step_number': 4, 'description': '큰냄비에 손질한 생닭을 넣고 약재티팩을 넣고 통마늘/건대추를 넣고 펄펄 끓여주세요', 'image_url': 'https://recipe1.ezmember.co.kr/cache/recipe/2020/03/10/95dc258303255b8b8a01443ede4d2e8d1.jpg'}, {'step_number': 5, 'description': '4번이 한소큼 끓어오르면 손질한 전복을 넣어주세요', 'image_url': 'https://recipe1.ezmember.co.kr/cache/recipe/2020/03/10/c6f53bd526e021a477b79972cd66c3d41.jpg'}, {'step_number': 6, 'description': '전복과함께 백합/새우도 넣어주시고 생강술을 넣어주세요\n40~50분을 펄펄 끓여주세요', 'image_url': 'https://recipe1.ezmember.co.kr/cache/recipe/2020/03/10/30e44f9be568b4c314231980542cc7201.jpg'}, {'step_number': 7, 'description': '문어는 드시기전에 넣어서 5~10분을 끓여 문어색이 빨갛게 변하면 부추한줌을 넣고 소금/후추가루를 넣어서 입맛에 맛게 간을 하신후 드시면 되세요', 'image_url': 'https://recipe1.ezmember.co.kr/cache/recipe/2020/03/10/f73a6490c4adfcdee0fe45119a1232471.jpg'}, {'step_number': 8, 'description': '눈으로보는 즐거움과 골라먹는재미와 맛까지 해산물과 닭에서 국물이 진하게 우러나와서 너무 맛있네요\n저는 살짝은 얼큰한게 좋아서 청양고추를 추가했더니 완전 술을 부르는 맛이네요ㅎ\n몸보신용으로도 손님접대요리에도 좋을듯하네요', 'image_url': 'https://recipe1.ezmember.co.kr/cache/recipe/2020/03/10/8944d685605cf2274a816370d1dd644c1.jpg'}]"
