index,종류별,상황별,재료별,방법별,글 제목,레시피이름,레시피이미지,조회수,조리시간,난이도,인분,재료,소개글,조리순서
155798,양식,손님접대,돼지고기,볶음,[간단 자취요리] 저렴하고 맛있는 찹스테이크 만들기 / 돼지고기 찹스테이크,돼지고기찹스테이크,https://recipe1.ezmember.co.kr/cache/recipe/2017/06/20/fa85c3bc7470c6a7b79f99cce58e55741.jpg,"116,564",30분 이내,초급,2인분,"[('목살', '400g'), ('파프리카', '1개'), ('양파 작은거                                                                                중간크기 반개', '1개'), ('소금', '1/2t'), ('후추                                                                                티스푼에 깎아서 반정도', '1/2t'), ('돈가스소스', '6T'), ('굴소스', '2T'), ('설탕', '1T'), ('케찹', '2T'), ('다진마늘', '1T')]","안녕하세요 여러분!!
오늘은 찹스테이크 만들기입니다 :D

찹스테이크는 소고기로 만드는 메뉴인데요~
자취 버전으로 저렴하게 돼지고기를 사용해서 만들어 봤어요!
큐브 모양의 돼지고기가 씹히는 맛도 아주 좋아요!","[{'step_number': 1, 'description': '파프리카는 속에 하얀 부분을 제거한 뒤, 먹기 좋게 썰어주세요!', 'image_url': 'https://recipe1.ezmember.co.kr/cache/recipe/2017/06/20/f840671f40fbb8753239c3f4ea8396af1.png'}, {'step_number': 2, 'description': '양파도 같은 크기로 썰어주세요', 'image_url': 'https://recipe1.ezmember.co.kr/cache/recipe/2017/06/20/fcb43e236fbb6d2728d3fc4de022cad41.png'}, {'step_number': 3, 'description': '목살도 한입 크기로 썰어주세요도톰하게 썰면 식감은 더 좋지만 익히는데 시간이 더 걸려요!', 'image_url': 'https://recipe1.ezmember.co.kr/cache/recipe/2017/06/20/1525ea3bd4dbda81aebade9fd9c9b6791.png'}, {'step_number': 4, 'description': '고기에 소금, 후추로 밑간 해줍니다!', 'image_url': 'https://recipe1.ezmember.co.kr/cache/recipe/2017/06/20/f66c50dc23eb31c230ec04902512d3291.png'}, {'step_number': 5, 'description': '팬에 기름을 두르고 고기를 넣어주세요강불기름이 많은 목살이라면 생략해도 됩니다.', 'image_url': 'https://recipe1.ezmember.co.kr/cache/recipe/2017/06/20/08037118fb43c444806ff33fd762f48f1.png'}, {'step_number': 6, 'description': '최고 강불에서, 모든 겉면을 노릇하게 익혀주세요!', 'image_url': 'https://recipe1.ezmember.co.kr/cache/recipe/2017/06/20/02ad0603466d2a3105debcbf3c6e92fc1.png'}, {'step_number': 7, 'description': '다시 중불로 줄여서 속까지 익도록 볶아줍니다', 'image_url': 'https://recipe1.ezmember.co.kr/cache/recipe/2017/06/20/1da58f38952e4dcef634e4df978162631.png'}, {'step_number': 8, 'description': '고기가 속까지 다 익으면 야채를 넣어주세요', 'image_url': 'https://recipe1.ezmember.co.kr/cache/recipe/2017/06/20/4d32c8977b4484910e534c02ed94000b1.png'}, {'step_number': 9, 'description': '준비한 양념들도 넣어 볶아줍니다', 'image_url': 'https://recipe1.ezmember.co.kr/cache/recipe/2017/06/20/6287c75fa065c0d29f7cd9b84ada337c1.png'}]"
155799,양식,손님접대,돼지고기,볶음,굴소스로 목살찹스테이크 만들기,목살찹스테이크,https://recipe1.ezmember.co.kr/cache/recipe/2016/07/13/a070c4ce7791157808df44c0c9052c371.jpg,"75,001",30분 이내,초급,2인분,"[('목살', '2장'), ('노랑파프리카', ''), ('주황파프리카', ''), ('파', '약간'), ('양파', '1/2개'), ('굴소스', '3T'), ('케첩', '2T'), ('다진마늘', '0.5T'), ('간장', '0.5T'), ('설탕', '1T'), ('올리고당', '1.5T'), ('청주', '1T'), ('후추', '약간')]",스테이크소스를 굴소스로 대체하여 목살찹스테이크 만들기.,"[{'step_number': 1, 'description': '굴소스, 케첩, 다진마늘, 간장, 설탕, 올리고당, 후추, 청주를 넣고 소스를 만들어주세요.', 'image_url': 'https://recipe1.ezmember.co.kr/cache/recipe/2016/07/13/7dc7a267749df1b7fb2498d04a598f251.jpg'}, {'step_number': 2, 'description': '양파와 파프리카는 적당한 크기로 썰어주세요.', 'image_url': 'https://recipe1.ezmember.co.kr/cache/recipe/2016/07/13/fc31e068d58e5f53357674f820ef47871.jpg'}, {'step_number': 3, 'description': '목살에 소금, 후추로 약간 밑간을 해주신 후 적당한 크기로 썰어서 팬에 구워주세요.', 'image_url': 'https://recipe1.ezmember.co.kr/cache/recipe/2016/07/13/feedf7a9adc9b43b647db1f08ca1f5701.jpg'}, {'step_number': 4, 'description': '고기의 핏기가 사라지면 양파, 파프리카를 넣고 볶아주세요.', 'image_url': 'https://recipe1.ezmember.co.kr/cache/recipe/2016/07/13/b1f77de952290bce8f88872c0987bf061.jpg'}, {'step_number': 5, 'description': '만들어둔 소스와 파를 넣고 섞어주세요.', 'image_url': 'https://recipe1.ezmember.co.kr/cache/recipe/2016/07/13/9099c60f5e3cae94c18622b560b0f5b11.jpg'}, {'step_number': 6, 'description': '고기가 다 익고 소스가 잘 섞어지면 완성입니다 :D', 'image_url': 'https://recipe1.ezmember.co.kr/cache/recipe/2016/07/13/c3fbb7305f7c8f99fc8462eea91667891.jpg'}]"
155800,양식,손님접대,돼지고기,볶음,돼지고기 찹스테이크 만들기,돼지고기찹스테이크,https://recipe1.ezmember.co.kr/cache/recipe/2015/04/28/ff6564276ecb38c59d77866bf943177e1.jpg,"69,871",None,None,None,"[('돼지고기 안심', '400g'), ('빨강 파프리카', '1/2개'), ('노랑 파프리카', '1/2개'), ('청피망', '1/2개'), ('양파', '1/3개'), ('참기름', '약간'), ('올리브유', '2큰술'), ('소금', '약간'), ('후추', '약간'), ('간장', '1큰술'), ('굴소스', '2큰술'), ('요리술', '1큰술'), ('올리고당', '4작은술'), ('다진마늘', '2작은술')]",보들보들한 안심으로 만들어서 촉촉하고 고소해요~ 채소의 상큼함과 달큰함이 잘 어울리는 돼지고기 찹스테이크!,"[{'step_number': 1, 'description': '돼지고기는 먹기 좋은 크기로 썰어 올리브유에 소금과 후추를 넣어 골고루 섞은 뒤 돼지고기를 넣고 30분 이상을 재워줍니다.', 'image_url': 'https://recipe1.ezmember.co.kr/cache/recipe/2015/04/28/c316c93e259b18aa8c35c0a0247f46b61.jpg'}, {'step_number': 2, 'description': '양파, 파프리카, 피망도 먹기 좋은 크기로 썰어주고...', 'image_url': 'https://recipe1.ezmember.co.kr/cache/recipe/2015/04/28/d312a3f1829e5aa95e4830c05ef866351.jpg'}, {'step_number': 3, 'description': '위의 레시피대로 볶음 양념장도 준비합니다.', 'image_url': 'https://recipe1.ezmember.co.kr/cache/recipe/2015/04/28/2c00679a40ae1181036b8c90e2640b991.jpg'}, {'step_number': 4, 'description': '달궈진 팬에 고기를 넣어 자주 뒤집지 말고 한면이 익으면 뒤집어 마저 익혀줍니다.', 'image_url': 'https://recipe1.ezmember.co.kr/cache/recipe/2015/04/28/f5f4cdca94deac439fe393ba174371eb1.jpg'}, {'step_number': 5, 'description': '돼지고기가 90%정도 익으면 양파, 파프리카, 피망을 넣어 1분여 정도를 볶고... 바로 양념장을 넣어 강불에서 재빠르게 또 볶아줍니다.', 'image_url': 'https://recipe1.ezmember.co.kr/cache/recipe/2015/04/28/88f2f02d66abaefaa47483354c41add41.jpg'}, {'step_number': 6, 'description': '이 과정에서 수분이 약간 나오는데 그냥 드셔도 되지만... 녹말물을 만들어 1큰술 정도 넣어주면 수분이 잡히면서 윤기도 돌고 양념도 잘 배어 더 맛있게 드실 수 있습니다. 그런 뒤,,, 마지막으로 참기름 살짝 둘러주면...', 'image_url': 'https://recipe1.ezmember.co.kr/cache/recipe/2015/04/28/cb2a8b5af61fe20fb003c2cefac257351.jpg'}, {'step_number': 7, 'description': '돼지고기 찹스테이크 완성!', 'image_url': 'https://recipe1.ezmember.co.kr/cache/recipe/2015/04/28/356beed64cf850d1fcc2b55cb2d380d91.jpg'}]"
155801,양식,손님접대,돼지고기,볶음,돼지목살 요리 찹스테이크 간단하게 만들기,찹스테이크,https://recipe1.ezmember.co.kr/cache/recipe/2018/01/29/4a857d50dbad66babb8c9dfde3a88bbf1.jpg,"27,923",30분 이내,아무나,3인분,"[('돼지고기 목살', '300g'), ('버터', '약간'), ('양파', '1/2개'), ('파프리카', '약간'), ('당근', '약간'), ('소금', '약간'), ('후추', '약간'), ('스테이크소스', '2큰술'), ('굴소스', '2큰술'), ('올리고당', '1큰술'), ('케찹', '1/2큰술')]","돼지목살로 만드는 찹스테이크 !
부드럽고 맛있어요 :)","[{'step_number': 1, 'description': '목살은 두툼하게 잘라주고\n후추와 소금을 약간 넣어 밑간을 해주세요\n저는 소금을 두꼬집 정도 넣어줬고\n후추는 세네번 톡톡 두드려 넣어줬어요', 'image_url': 'https://recipe1.ezmember.co.kr/cache/recipe/2018/01/29/c30e1885dfba3bfce3e02bab00365ec01.jpg'}, {'step_number': 2, 'description': '고기 밑간을 다한 후 찹스테이크에 들어갈 양념도 미리 준비해주세요\n스테이크소스 2큰술, 굴소스 2큰술, 올리고당 1큰술, 케찹 1/2큰술 넣고\n섞어서 준비해줬어요\n올리고당 대신 꿀을 사용하셔도 좋아요 ~\n전 마침 꿀이 똑떨어져서 올리고당으로 대체해줬어요', 'image_url': 'https://recipe1.ezmember.co.kr/cache/recipe/2018/01/29/f64babc069039df04873e7acdfea9cf81.jpg'}, {'step_number': 3, 'description': '같이 넣을 야채는 취향대로 준비해주시고요\n저는 냉장고에 있던 재료 사용해서 미리 잘라서 준비해주었어요\n당근도 대충 썰어주려다가 쿠킹틀로 살짝 찍어서 모양좀 내봤어요 ㅎㅎ', 'image_url': 'https://recipe1.ezmember.co.kr/cache/recipe/2018/01/29/904aada0f65c9234fabd71cba5048f751.jpg'}, {'step_number': 4, 'description': '모든 재료가 다 준비가 되면 후라이팬에 버터를 녹여서\n돼지고기 목살을 익혀줄꺼예요', 'image_url': 'https://recipe1.ezmember.co.kr/cache/recipe/2018/01/29/484fab364a40b798cc58155361b5aad31.jpg'}, {'step_number': 5, 'description': '버터를 녹이고 고기를 익혀주세요\n소고기로 할경우엔 살짝만 익혀서 먹어도 되지만\n돼지고기이니깐 속까지 다 익도록 충분히 익혀주셔야되요 ~', 'image_url': 'https://recipe1.ezmember.co.kr/cache/recipe/2018/01/29/78bef541e24898f1c7457f0a717556d21.jpg'}, {'step_number': 6, 'description': '목살이 익으면 양파와 당근을 먼저넣고\n양파가 투명해질정도로 볶아주시고요', 'image_url': 'https://recipe1.ezmember.co.kr/cache/recipe/2018/01/29/5e5c07cfb61364c1f2e4bc1f70c69cea1.jpg'}, {'step_number': 7, 'description': '양파가 어느정도 투명하게 변하면\n미리 준비해둔 양념을 넣고 같이 볶아주세요', 'image_url': 'https://recipe1.ezmember.co.kr/cache/recipe/2018/01/29/b4593ba4d78c1783ddcc5b666e091c401.jpg'}, {'step_number': 8, 'description': '골고루 양념이 베이면 마지막에\n파프리카를 넣고 살짝만 더 볶아서\n마무리 해주시면 되요', 'image_url': 'https://recipe1.ezmember.co.kr/cache/recipe/2018/01/29/e04c6c6fcae1db24cd6f8ad6c9fa20be1.jpg'}, {'step_number': 9, 'description': '돼지목살 찹스테이크 완성입니다 :)\n양념이 적절히 조화를 이뤄서 메인반찬으로 딱 내놓기 좋은데요\n여느반찬 다 제껴두고 아이들도 요거하나만 가지고 밥먹더라고요 ㅎㅎ', 'image_url': 'https://recipe1.ezmember.co.kr/cache/recipe/2018/01/29/25605c5bc48b6f6f3272271c44ad322e1.jpg'}]"
155802,양식,손님접대,돼지고기,볶음,백종원 찹스테이크 만들기 쉽고 간단해,찹스테이크,https://recipe1.ezmember.co.kr/cache/recipe/2020/12/29/9554df2c42dd731f9655a1247694753d1.jpg,"9,060",30분 이내,아무나,3인분,"[('부채살', '500g'), ('파프리카', ''), ('양파', ''), ('애호박', ''), ('브로콜리', ''), ('버터', ''), ('편마늘', ''), ('굴소스', '2숟가락'), ('스테이크소스', '4숟가락'), ('케찹', '2숟가락'), ('꿀', '1숟가락'), ('다진마늘', '1t'), ('후추', '약간'), ('후추', ''), ('올리브유', ''), ('소금', '')]","후다닥 만들어 근사하게 차려낼 수 있는 요리가 있어요 부채살 사둔걸로 #찹스테이크만들기 쉽고 간단한 백종원 레시피로 했어요 냉장고 자투리 채소 활용도 했고 금방 만들어 담아내니 맛도 참 좋았어요 안심찹스테이크도 맛있지만 등심,채끝,부채살 부위도 찹스테이크로 괜찮답니다 여러가지 야채들과 함께 맛있는 소스로 맛있게 만들어 볼께요","[{'step_number': 1, 'description': '백종원 찹스테이크 만들기 고기는 키친타올로 핏물을 꼼꼼히 제거해 주고 먹기좋은 크기로 썰어서 소금,후추,올리브유를 넣어 밑간을 해 둡니다 부채살에 기름기가 적고 살도 부드러워 안심 못지 않아요 ㅋ 핏물을 잘 제거 해 주어야 누린내가 나지 않고 맛있는 찹스테이크 만들 수 있어요', 'image_url': 'https://recipe1.ezmember.co.kr/cache/recipe/2020/12/30/51f725a2a15e55ebec3e00d9aa15fd191.jpg'}, {'step_number': 2, 'description': '큼직하게 썰어 올리브유,후추,소금 넣고 버무려 줍니다', 'image_url': 'https://recipe1.ezmember.co.kr/cache/recipe/2020/12/30/46f0612d3cf4c7eb8985cc1636acc4461.jpg'}, {'step_number': 3, 'description': '버터에 편마늘을 넣고 볶아 마늘 향을 낸 후 ~~ 썰어둔 고기를 넣어 함께 볶아주었어요 그릴팬에 따로 볶아 넣음 비주얼이 좀더 좋겠지만 고기 먼저 볶고 한켠에 야채를 볶아도 괜찮답니다 바쁜 아침에는 재빨리 쉽고 간단하게 만드는게 최고인듯요', 'image_url': 'https://recipe1.ezmember.co.kr/cache/recipe/2020/12/30/55a95da22b9cd871a2b0ed4f7793dc4e1.jpg'}, {'step_number': 4, 'description': '겉이 노릇하니 구워지면 야채를 넣어주면 되는데 고기가 너무 익게 되면 맛이 덜하니 야채와 소스를 넣고는 휘리릭 재빨리 볶아 주는게 좋아요', 'image_url': 'https://recipe1.ezmember.co.kr/cache/recipe/2020/12/30/e233ad524d6bf65d046618e39dbb6fd21.jpg'}, {'step_number': 5, 'description': '지글지글 고기 구워지는 맛있는 소리로 충분히 식욕이 돋아요', 'image_url': 'https://recipe1.ezmember.co.kr/cache/recipe/2020/12/30/2a6fa17ab5500ccd17e0f94dca69c11b1.jpg'}, {'step_number': 6, 'description': '야채를 넣고는 쎈불에 재빨리 볶아 냅니다 빨강파프리카가 없으니 허전한데 모듬야채가 조금 남아 있어서 아쉬운대로 넣었어요', 'image_url': 'https://recipe1.ezmember.co.kr/cache/recipe/2020/12/30/00d0e82e7d47f2c1ae9cdea7052c9f8b1.jpg'}, {'step_number': 7, 'description': '고기가 잘 볶아지면 분량의 소스를 넣어 주고 휘리릭 섞어 줍니다 입맛 취향껏~~ 홀그레인 씨겨자를 한스푼 넣어 만든 소스도 맛있어요', 'image_url': 'https://recipe1.ezmember.co.kr/cache/recipe/2020/12/30/e8d731e8fe0dac4f084328ff296b74381.jpg'}, {'step_number': 8, 'description': '사르르한 부드러운 고기에 야채들이 어우러져 영양듬뿍 ~~ 먹음직스럽게 볶아졌어요 밥위에 올려 한그릇 요리로 완성해도 훌륭하답니다', 'image_url': 'https://recipe1.ezmember.co.kr/cache/recipe/2020/12/30/b40b5925b93ec4981733e21c38c12b071.jpg'}]"
155803,양식,손님접대,돼지고기,볶음,목살폭찹 스테이크 챱챱챱챱 맛있어!!!!,목살폭찹스테이크,https://recipe1.ezmember.co.kr/cache/recipe/2018/12/07/41b022a1ffdbd321ddc6c650c15d22f51.png,"56,489",30분 이내,중급,2인분,"[('돼지목살', '300g'), ('양파', '1/2개'), ('빨간파프리카', '1/2개'), ('노란파프리카', '1/2개'), ('청피망', '1/2개'), ('양송이버섯', '5개'), ('소금', '약간'), ('후춧가루', '약간'), ('올리브유', '1숟가락'), ('맛술', '2숟가락'), ('다진마늘', '1숟가락'), ('다진양파', '1숟가락'), ('토마토케찹', '1.5종이컵'), ('고추장', '2숟가락'), ('물엿', '2숟가락'), ('물', '1.5종이컵'), ('후추', '약간'), ('올리브유', '1숟가락'), ('소금', '약간'), ('후추', '약간')]","고기덕후들 모여라~~
챱챱챱챱 손을 멈출수없게 만드는 맛!

세상의 모든 레시피 만개의레시피","[{'step_number': 1, 'description': '채소와 목살은 한 입 크기로 썰어 준비한다.', 'image_url': 'https://recipe1.ezmember.co.kr/cache/recipe/2018/12/07/7be066949579dd52128bd9177f892f811.png'}, {'step_number': 2, 'description': '목살은 밑간 하여 버무린다.간이 배도록 30분 정도 재웠다가 사용하면 좋아요.', 'image_url': 'https://recipe1.ezmember.co.kr/cache/recipe/2018/12/07/33130e9670ddb2e6d2d0b6d7589ba3db1.png'}, {'step_number': 3, 'description': '센 불로 달군 팬에 올리브유를 두른 뒤 양파, 버섯, 피망, 파프리카 순으로 넣고 소금 약간, 후추 약간을 뿌려가며 반정도만 익혀 볶아 건진다.팬', 'image_url': 'https://recipe1.ezmember.co.kr/cache/recipe/2018/12/07/7545f372baaef89d81ad7479a3c50c471.png'}, {'step_number': 4, 'description': '팬을 센 불로 다시 예열 한 뒤 밑간한 목살을 겉만 노릇하게 익혀 건진다.', 'image_url': 'https://recipe1.ezmember.co.kr/cache/recipe/2018/12/07/d03d8b4019033a0dd99f9524157b3c111.png'}, {'step_number': 5, 'description': '팬에 올리브유를 두른 뒤 다진 마늘, 다진 양파를 약한 불로 볶아 노릇해지면 나머지 소스 재료를 넣고 중간 불로 끓인다.팬중간중간에 눌러 붙지 않도록 저어가며 끓여요.', 'image_url': 'https://recipe1.ezmember.co.kr/cache/recipe/2018/12/07/ec5c8c213719c7718d2ceb3fe73635981.png'}, {'step_number': 6, 'description': '소스가 2/3 정도로 졸아들면 구워 둔 목살과 채소를 넣고 간이 배도록 끓여 마무리.', 'image_url': 'https://recipe1.ezmember.co.kr/cache/recipe/2018/12/07/b162c0d047ad2d083dcdbef1814329011.png'}]"
155804,양식,손님접대,돼지고기,볶음,찌개용 돼지고기를 이용한 찹스테이크 만들기 ♪,찹스테이크,https://recipe1.ezmember.co.kr/cache/recipe/2016/04/30/23a3324ee75decebb8ea33fb349956041.jpg,"15,997",30분 이내,아무나,2인분,"[('돼지고기                                                                                찌개용', ''), ('소금', ''), ('후추', ''), ('버터', '4조각'), ('마늘', ''), ('양파', ''), ('돈까스소스', '4스푼'), ('굴소스', '2스푼'), ('케찹', '1.5스푼'), ('올리고당', '2스푼')]",찌개에 넣어먹으려고 산 돼지고기지만 한번 색다르게 먹을수 없을까? 하다가 신선하게 찹스테이크를 만들어 보았어요 ​ 찹스테이크라고 하면 보통은 소고기를 넣어 만들지만 저는 찌개용 돼지고기를 넣어 만들어 봤답니다^^ ​ 신랑이 밖에서 사먹는것보다 100배는 더 맛있다고 칭찬한 돼지고기 찹스테이크 맛있게 만드는법 알려드릴께요 :),"[{'step_number': 1, 'description': '먼저 고기는 후추.소금을 뿌려 밑간을 해두었어요.', 'image_url': 'https://recipe1.ezmember.co.kr/cache/recipe/2016/08/02/ca86527ea7488c364681c4cd4b10932e1.jpg'}, {'step_number': 2, 'description': '버터는 잘라서 작게 4조각 준비해주고 마늘은 슬라이스 / 양파는 먹기좋게 썰어주었어요. 참고로 저는 냉동마늘을 해동시켜 썬거라 색깔이 좀 그러네요ㅋㅋ;;', 'image_url': 'https://recipe1.ezmember.co.kr/cache/recipe/2016/08/02/bb851c1196c330615d880389971a6f1b1.jpg'}, {'step_number': 3, 'description': '그리고 찹스테이크 소스 만들어주기~!!', 'image_url': 'https://recipe1.ezmember.co.kr/cache/recipe/2016/08/02/199d71b412c5882071c85e11a2a875e11.jpg'}, {'step_number': 4, 'description': '모두 다 준비가 되었으면 후라이팬에 기름대신 버터를 넣어 녹여주고~ 슬라이스한 마늘을 넣어 볶아주었어요.', 'image_url': 'https://recipe1.ezmember.co.kr/cache/recipe/2016/08/02/bc409272484d591b2b85b4e9056fea811.jpg'}, {'step_number': 5, 'description': '그리고 고기를 넣어 같이 볶아주고~~ \n 고기가 반정도 익었을때 야채들을 넣어주었어요. 야채는 양파만 준비했다가 냉장고에 새송이버섯 있는거 급 생각나서 썰어 넣었어요 ㅎㅎ 역시 고기엔 버섯이 같이 있어줘야 맛이 배가 되는것 같아요!', 'image_url': 'https://recipe1.ezmember.co.kr/cache/recipe/2016/08/02/1eede8e4d94ee70deaef1cb27cf0cec01.jpg'}, {'step_number': 6, 'description': '그리고 야채도 어느정도 볶다가 소스 부어서 볶아주기 :) 이제 잘 섞이게 맛있게 볶아주기만 하면되요^^ 소고기면 살짝 휘리릭~ 하고 불을 끄면 될테지만 돼지고기는 덜익으면 안되니깐 꼼꼼히 익혀주었어요.', 'image_url': 'https://recipe1.ezmember.co.kr/cache/recipe/2016/08/02/7e9ac4e140144dd12e70e45141a20fd01.jpg'}, {'step_number': 7, 'description': '그릇에 담아 후추 살짝 톡톡 해주고 파슬리가루 살짝 뿌려주니 넘 맛나보여요^^', 'image_url': 'https://recipe1.ezmember.co.kr/cache/recipe/2016/08/02/f47ee6fad6d75a0f7621beebfbee9a2d1.jpg'}]"
155805,양식,손님접대,돼지고기,볶음,목살 폭찹스테이크,목살폭찹스테이크,https://recipe1.ezmember.co.kr/cache/recipe/2015/07/06/81b6358741988c3c3d96c7e546e8bbdc1.jpg,"23,872",60분 이내,중급,2인분,"[('돼지고기목살', '300g'), ('노란 파프리카', '1/2개'), ('빨간 파프리카', '1/2개'), ('청피팡', '1/2개'), ('양송이버섯', '5개'), ('양파', '1T'), ('후추', '조금'), ('소금', '조금'), ('올리브유', '조금'), ('케첩', '2컵'), ('고추장', '2T'), ('올리고당', '2T'), ('물', '2컵'), ('다진마늘', '1T'), ('다진양파', '1T')]",호텔세프에게 전수받은 특제폭찹소스의 목살 스테이크 레시피를 공개합니다!,"[{'step_number': 1, 'description': '야채는 깍뚝 썰기한다.', 'image_url': 'https://recipe1.ezmember.co.kr/cache/recipe/2015/07/07/a36143809366cc2ba2c9b8539db25a871.jpg'}, {'step_number': 2, 'description': '목살을 깍뚝 썰기 한 후, 후추두꼬집 소금두꼬집 살짝 간을 하고 올리브유로 살짝 코팅해준다. (30분정도 재워주세요.마리네이드 과정이라고 하죠)', 'image_url': 'https://recipe1.ezmember.co.kr/cache/recipe/2015/07/07/fd9bbbeb6184527c045e1f448753e2be1.jpg'}, {'step_number': 3, 'description': '펜에 올리브유 ½T를 두르고 야채를 양파, 버섯, 피망, 파프리카 순으로 넣고 \n소금 후추 간을 해준 후, 반만 익혀 따로 준비해 둔다.', 'image_url': 'https://recipe1.ezmember.co.kr/cache/recipe/2015/07/07/a2a5ae0f3fcd030416740b9e6cccb9ee1.jpg'}, {'step_number': 4, 'description': '팬에 센불에 목살을 구워준다.\n겉표면이 노릇하게 익어지면 불을끄고 따로 담아 놓는다.', 'image_url': 'https://recipe1.ezmember.co.kr/cache/recipe/2015/07/07/002c5b86c65691ba87c20a182b7cddaf1.jpg'}, {'step_number': 5, 'description': '★소스만들기\n펜에 올리브유 ½T 두르고 마늘1T,다진양파1T를 노릇하게 익힌후 약불로 줄이고 케찹2컵, 고추장 2T, 올리고당2T(or설탕3T) ,물2컵 넣어서 중불로 ⅔정도 졸여준다.', 'image_url': 'https://recipe1.ezmember.co.kr/cache/recipe/2015/07/07/d33902d8f280bfe827dd0d27d279770a1.jpg'}, {'step_number': 6, 'description': '소스가 다 만들어지면 소스에 준비해둔 고기 야채를 넣고 고기가 완전히 익을때까지 더 끓여준다.', 'image_url': 'https://recipe1.ezmember.co.kr/cache/recipe/2015/07/07/714d7b9cc7ccfefaf0fcfd08a204c2531.jpg'}, {'step_number': 7, 'description': '예쁜그릇에 담아 먹는다.', 'image_url': 'https://recipe1.ezmember.co.kr/cache/recipe/2015/07/07/d9fc4c7f5e34dad177321ffa8cefa6ba1.jpg'}]"
155806,양식,손님접대,돼지고기,볶음,돼지고기 찹스테이크 만들기 목살요리,돼지고기찹스테이크,https://recipe1.ezmember.co.kr/cache/recipe/2017/07/31/3d6105fd2d418330e84d516093d85d7b1.jpg,"20,947",30분 이내,초급,2인분,"[('돼지고기 목살', '350g'), ('후추', '약간'), ('소금', '약간'), ('양파', '1/2개'), ('파프리카', ''), ('버터', '1/2스푼'), ('스테이크소스', '4스푼'), ('굴소스', '2스푼'), ('케찹', '1/3스푼'), ('올리고당', '2스푼'), ('다진마늘', '1스푼')]",소고기 아니라도 돼지고기 목살로도 맛있는 찹스테이크 만들수 있어요! 완전 초간단 레시피 랍니다 :),"[{'step_number': 1, 'description': '목살은 먹기좋게 썰어서 소금.후추로 밑간을 해줍니다.', 'image_url': 'https://recipe1.ezmember.co.kr/cache/recipe/2017/08/07/67d1202e384ebdb03bc70a90be0600581.jpg'}, {'step_number': 2, 'description': '양파와 파프리카도 먹기좋게 썰어 준비합니다.', 'image_url': 'https://recipe1.ezmember.co.kr/cache/recipe/2017/08/07/9a87cf1f3270876eeaaa7744d262d7551.jpg'}, {'step_number': 3, 'description': '분량의 재료를 넣어 소스를 만들어줍니다.', 'image_url': 'https://recipe1.ezmember.co.kr/cache/recipe/2017/08/07/1432026a672eb672a15c2309a6ad3cbd1.jpg'}, {'step_number': 4, 'description': '버터 반스푼을 팬에 올리고 밑간 해둔 고기를 넣어 볶아줍니다.', 'image_url': 'https://recipe1.ezmember.co.kr/cache/recipe/2017/08/07/a6e8dcd4bb731f59f367a68ececa05811.jpg'}, {'step_number': 5, 'description': '고기가 얼추 익으면 양파를 먼저 넣어 볶아주구요. 양파가 투명해지면 만들어둔 소스를 투하~', 'image_url': 'https://recipe1.ezmember.co.kr/cache/recipe/2017/08/07/709a790c0491399674e6a028dcf3c2281.jpg'}, {'step_number': 6, 'description': '소스넣고 양념 잘 베이게 볶다가 마지막에 파프리카 넣어 한번더 휘리릭 볶아주면 돼지고기 찹스테이크 완성!', 'image_url': 'https://recipe1.ezmember.co.kr/cache/recipe/2017/08/07/f0e19a3ff21ba22bba0c1d4d081c74d71.jpg'}]"
