index,종류별,상황별,재료별,방법별,글 제목,레시피이름,레시피이미지,조회수,조리시간,난이도,인분,재료,소개글,조리순서
160637,스프,초스피드,해물류,끓이기,"이보다 쉬울 수 없는 초간단 ""게살스프""",게살스프,https://recipe1.ezmember.co.kr/cache/recipe/2020/03/23/ebe99225839e01b34b8e46117448fda11.jpg,"3,164",10분 이내,아무나,2인분,"[('크래미', '2개'), ('전분가루', '2수저'), ('물', '3컵'), ('치킨스톡', '2수저'), ('계란', '1알'), ('액젓', '1/2수저'), ('후추', '1/2수저')]","치킨스톡으로 간단하게 만드는 ""게살스프""","[{'step_number': 1, 'description': '전분가루를 물1/2컵에 풀어 놓는다', 'image_url': 'https://recipe1.ezmember.co.kr/cache/recipe/2020/03/23/9c4d51a1c4441413169da8fcdd0185b41.jpg'}, {'step_number': 2, 'description': '크래미를 잘게 찢어 놓는다', 'image_url': 'https://recipe1.ezmember.co.kr/cache/recipe/2020/03/23/4034356f57efabe0614e850a2c2d5fd81.jpg'}, {'step_number': 3, 'description': '계란을 흰자와 노른자가 잘 섞이게 풀어 놓는다', 'image_url': 'https://recipe1.ezmember.co.kr/cache/recipe/2020/03/23/ec0844fc0b5500119c3d2b5c72a02bc41.jpg'}, {'step_number': 4, 'description': '물 3컵을 넣고 치킨스톡 2수저를 넣어준다', 'image_url': 'https://recipe1.ezmember.co.kr/cache/recipe/2020/03/23/8e70b35792ba58af9506aff41dda83ee1.jpg'}, {'step_number': 5, 'description': '물이 끓어 오르면 액젓 1/2수저를 넣어준다', 'image_url': 'https://recipe1.ezmember.co.kr/cache/recipe/2020/03/23/04bdf97a15a57c083b77791bce32d19a1.jpg'}, {'step_number': 6, 'description': '후추 1/2수저를 넣어준다', 'image_url': 'https://recipe1.ezmember.co.kr/cache/recipe/2020/03/23/411271a2518cefcf7d05d911d306e6af1.jpg'}, {'step_number': 7, 'description': '크래미를 넣어준다', 'image_url': 'https://recipe1.ezmember.co.kr/cache/recipe/2020/03/23/5c5aebca9ea44e7cb33bdc2d130575a41.jpg'}, {'step_number': 8, 'description': '계란물을 넣을 땐 절대 저어주지 않는다', 'image_url': 'https://recipe1.ezmember.co.kr/cache/recipe/2020/03/23/73c2fca06984cf8e1c76e9badf7eff741.jpg'}, {'step_number': 9, 'description': '계란이 떠오르면 전분물을 넣어 농도를 맞춰준다', 'image_url': 'https://recipe1.ezmember.co.kr/cache/recipe/2020/03/23/3a29e830db5455bfdba1039fe167a1211.jpg'}]"
160638,스프,초스피드,해물류,끓이기,게살스프,게살스프,https://recipe1.ezmember.co.kr/cache/recipe/2022/03/23/c42f8dddc42d4a7ec4536455b5b211fe1.jpg,"4,524",20분 이내,초급,2인분,"[('게살', '200g'), ('팽이버섯', '1/3봉지'), ('대파', '1뿌리'), ('죽순 통조림', '3조각'), ('표고버섯', '1개'), ('양파', '1/4조각'), ('계란흰자', '2알'), ('다진마늘', '1/2스푼'), ('다진파', '1/2스푼'), ('치킨스톡큐브', '1개'), ('전분물', '3스푼')]","코로나로 배달음식도 많이먹다보니 질리기 시작해
집에서 중식요리도 도전 ㅋ ㅋ ㅋ
어쩌다보니 집에 먹다남은 킹크랩이
이게 요즘 말하는 Flex~~나도 플렉스~~ㅋㅋ
예전에 크래미와 새우로 간단한 게살스프와 중화우동을 만들었었는데 이번에는 제대로 정통 게살 스프를 만들어 보기로 ^.^
킹크랩 협찬은 남동생님~ 감사감사~
뭘 이런걸다 들고오고~ 기냥 와도 괜찮은데 ㅋㅋㅋㅋ","[{'step_number': 1, 'description': '야패는 길이가 비슷하게 채썰어 준비해요.\n게살은 풀어지지 않게 덩어리고 준비해요. 끓으면서 덩어리가 풀어지니 미리 찢어놓으면 끓을 때 흔적을 찾을 수 없을지도 몰라요.집에 킹크랩이나 게살이 있기 쉽지 않죠? 이럴땐 킹크랩맛살을 준비해 주세요~ 맛의 큰 차이 없어요. ^.^', 'image_url': 'https://recipe1.ezmember.co.kr/cache/recipe/2022/03/23/cd06fdd77b6e78e7cfabfb33b0c018db1.jpg'}, {'step_number': 2, 'description': '국물요리니까 웍에 기름 조금 두르고 다진 마늘과 다진파로 항 내다가 양파, 대파, 죽순 살짝 볶아요.', 'image_url': 'https://recipe1.ezmember.co.kr/cache/recipe/2022/03/23/8a21c5a2adaa18ccfd82f129bd96a2b91.jpg'}, {'step_number': 3, 'description': '육수 없이 물을 500ml 정도 넣고 치킨스톡 한개 톡~ 추가!!\n물이 끓을때 계란흰자 돌려가며 넣어주고 팽이버섯과 표고버섯, 킹크랩 살 넣어 한소끔 끓여 소금으로 간하고 후추톡톡~센불새우나 오징어를 살짝 데쳐 넣으면 진정한 중식해물스프를 만들 수 있어요. 냉동실을 뒤져보세요~', 'image_url': 'https://recipe1.ezmember.co.kr/cache/recipe/2022/03/23/4c592fb676ff3341f882fe95617ad7941.jpg'}, {'step_number': 4, 'description': '간을 다하고 난 다음 녹말 3스푼에 물 3스푼 넣어 물 녹말 만든 다음 조금씩 넣어주며 농도가 걸쭉해져 중국집에서 먹던 게살 스프 느낌이 나도록 ^.^ 이렇게 하면 끝!', 'image_url': 'https://recipe1.ezmember.co.kr/cache/recipe/2022/03/23/fedeb5554812cbf579d20b1082d9a0271.jpg'}]"
160639,스프,초스피드,해물류,끓이기,여행지에서 간단한 급조 요리 ~ 해산물 치즈 토마토 스프 끓이기,해산물치즈토마토스프,https://recipe1.ezmember.co.kr/cache/recipe/2023/12/06/de674aecb05c4b5efab034c6d9aa1e341.jpg,242,15분 이내,초급,1인분,"[('쭈꾸미다리', '100g'), ('미니 양배추', '5-6개'), ('토마토소스', '100ml'), ('물', '200ml'), ('토마토 케첩', '15g'), ('바질 페스토', '1스푼'), ('브리치즈', '2조각'), ('소금', '1꼬집'), ('후추', '약간')]",유럽 여행하면서 미니 밥솥과 미니 인덕션을 끌고 다니면서 현지 슈퍼마켓에 있는 싱싱한 이국적인 야채와 생선등을 활용해 요리를 해봤어요. 바로 옆에 큰 마트가 있어서 신선 재료가 가득. 미니 인덕션에 작은 칼라마리 (오징어종류)다리 한팩 사와서 전날 안주로 먹다가 남아서 싸온 브리치즈 두덩어리를 넣고 토마토 스프를 끓였더니 넘 맛있고 고급진 씨푸드 치즈 토마토스프가 되었어요.^^ 외국 어느 여행지를 가도 토마토 소스는 구하기 쉽고 맛도 좋고 건강에도 좋아서 간단한 요리로 제격인 거 같아요.,"[{'step_number': 1, 'description': '미니 양배추를 반 잘라 씻어 주세요.도마 , 조리용나이프', 'image_url': 'https://recipe1.ezmember.co.kr/cache/recipe/2023/12/06/5a644ed0a6e6821a5fc64b529b2a6bce1.jpg'}, {'step_number': 2, 'description': '냄비에 물 200ml 넣고 미니 양배추를 넣고 소금 한꼬집 넣고 5분 정도 끓여 주세요.\n냄비', 'image_url': 'https://recipe1.ezmember.co.kr/cache/recipe/2023/12/06/6b6dc3ed10b0d43d208e1c619e3c948a1.jpg'}, {'step_number': 3, 'description': '깨끗하게 손질된 꼴뚜기 다리도 물에 한번 냄비에 헹궈 넣어 주세요.', 'image_url': 'https://recipe1.ezmember.co.kr/cache/recipe/2023/12/06/c8f9eaeeba131c65adb03f25cb3863701.jpg'}, {'step_number': 4, 'description': '토마토 소스와 케첩을 넣어 잘 저어 주세요.요리스푼', 'image_url': 'https://recipe1.ezmember.co.kr/cache/recipe/2023/12/06/c76e5da9552f6d58d32b2ec1f9fce8901.jpg'}, {'step_number': 5, 'description': '치즈 넣고 후추 넣고 5분 정도 끓여 줬어요.', 'image_url': 'https://recipe1.ezmember.co.kr/cache/recipe/2023/12/06/9206db0dd99c04b8dc5fcc32fd0408c61.jpg'}]"
160640,스프,초스피드,해물류,끓이기,아침식사로 좋은 영양만점 씨푸드차우더,차우더,https://recipe1.ezmember.co.kr/cache/recipe/2017/12/08/55e0d350abc6baca69a398e1460795821.jpg,"3,203",30분 이내,초급,3인분,"[('감자 큰 것', '1개'), ('양파', '1/2개'), ('올리브오일', '1T'), ('크림', '100ml'), ('육수                                                                                3컵', '1L'), ('와인                                                                                or 미림', '1T'), ('해산물 믹스', '100g'), ('마늘', '1쪽'), ('파슬리', '조금'), ('후추', '약간'), ('소금', '약간'), ('양송이 수프 가루', '3T')]",아침식사로 좋은 영양만점 씨푸드 차우더를 얼렁뚱땅 약식으로 간편하게 아침에 끓여냅니다. 테이블 세팅한다고 이른 아침부터 정원에 나가 수국 잘라오고 저도 참 정성입니다~~~간단하게 끓여낸 씨푸드 차우더 한 그릇이면 아침부터 속이 든든합니다. 약식으로 끓여냈다고 맛없는 것은 절대로 아닙니다..,"[{'step_number': 1, 'description': '오늘 준비한 씨푸드는 호키라는 생선과 홍합 뉴질랜드 초록 홍합 호키는 뉴질랜드에서 잡히는 생선인데 한국에 있는지 모르겠네요. 아마 없는 것으로 사료됨', 'image_url': 'https://recipe1.ezmember.co.kr/cache/recipe/2017/12/12/e33ffdbaf10841188e6735d5f25a0c931.jpg'}, {'step_number': 2, 'description': '초록 잎 홍합 사이즈가 대 한 입에 먹기는 너무 커서 3등분 해주고 생선도 한 입 크기로', 'image_url': 'https://recipe1.ezmember.co.kr/cache/recipe/2017/12/12/72bb675aad226e24471775c0744ad5e01.jpg'}, {'step_number': 3, 'description': '마늘은 채 썰어 주고', 'image_url': 'https://recipe1.ezmember.co.kr/cache/recipe/2017/12/12/bb476c0106716d7ea099225157ef041e1.jpg'}, {'step_number': 4, 'description': '열 올린 냄비에 올리브오일 두르고 마늘 채 썰어 놓은 것 넣어 볶다가 마늘 향미가 피어오르면', 'image_url': 'https://recipe1.ezmember.co.kr/cache/recipe/2017/12/12/155bca034302764c0a951cba5269a24d1.jpg'}, {'step_number': 5, 'description': '해물에 미림도 넣어주고요~', 'image_url': 'https://recipe1.ezmember.co.kr/cache/recipe/2017/12/12/ce9dafa9021e4358066513c46b330b7e1.jpg'}, {'step_number': 6, 'description': '납작납작 썰어준 감자, 당근, 양파를 넣고 함께 달달~', 'image_url': 'https://recipe1.ezmember.co.kr/cache/recipe/2017/12/12/b169952480d9964c8291732e547da3fe1.jpg'}, {'step_number': 7, 'description': '모든 재료가 잘 어우러지면 육수를 넣어 부르르 끓여줍니다. 간편식으로 만드는 씨푸드차우더 라서 육수도 치킨스톡 가루를 풀어서~~~끓여줄랍니다. 물 3C에 치킨스톡 1T', 'image_url': 'https://recipe1.ezmember.co.kr/cache/recipe/2017/12/12/9f42de21717b67f862f5178ff319f5111.jpg'}, {'step_number': 8, 'description': '아침부터 화이트 루 만들기 귀찮음 이럴 때 시중에 판매되는 양송이 수프 가루 3T 육수 넣고 풀어서', 'image_url': 'https://recipe1.ezmember.co.kr/cache/recipe/2017/12/12/fb4edc6374ace0892bc3457ec8007a0b1.jpg'}, {'step_number': 9, 'description': '끓고 있는 씨푸드 차우더에 넣어서 휘리릭 풀어 끓이다가', 'image_url': 'https://recipe1.ezmember.co.kr/cache/recipe/2017/12/12/1a1c5ab156f1bc7e5c96d9337d2fbbd31.jpg'}, {'step_number': 10, 'description': '후추&소금으로 간하고 파슬리 가루도 넣고 후추 투하', 'image_url': 'https://recipe1.ezmember.co.kr/cache/recipe/2017/12/12/4a4c88cf938d43a0a8be05ac1b16e6c31.jpg'}, {'step_number': 11, 'description': '보글보글 끓고 있는 냄비에 잘 풀어 넣고 끓이다가 마지막 단계 생크림 넣고', 'image_url': 'https://recipe1.ezmember.co.kr/cache/recipe/2017/12/12/74a533068b8b42005104493735ec45661.jpg'}, {'step_number': 12, 'description': '불에 서 내려서 그릇에 담아 내면 손쉽게 얼렁뚱땅 끓여낸 씨푸드 차우더 완성', 'image_url': 'https://recipe1.ezmember.co.kr/cache/recipe/2017/12/12/7b66d1d28a8b8c0fd7fdcef6bdb61ce31.jpg'}]"
160641,스프,초스피드,해물류,끓이기,#맛살을 이용한 걸쭉한 게살해물스프만들기 #치킨스톡을 넣어서 더욱 진한 국물맛의 게살해물스프!,게살해물스프,https://recipe1.ezmember.co.kr/cache/recipe/2017/12/30/8ea9b4c5a5cc355120024b697fbbf8781.jpg,"5,851",30분 이내,아무나,4인분,"[('맛살', '1팩'), ('해물믹스', '1/3컵'), ('미역', '1/3컵'), ('다진마늘', '1작은술'), ('썬파', '1큰술'), ('치킨스톡', '1큰술'), ('소금', '1꼬집'), ('후추', '1t'), ('참기름', '1방울'), ('전분물                                                                                농도에맞춰서', '')]","맛살과 해물을 넣고 거기에 시원한 미역까지 넣어서 만든
걸쭉하고 진한 맛의 게살해물스프로 닭육수 대신에 치킨스톡으로 간편하게 진한 국물을 낸 게살해물스프입니다.","[{'step_number': 1, 'description': '불린 미역을 먹기 좋게 썰어 주시고 여기에 썬파와 다진마늘을 넣어 줍니다. 그리고 참기름을 넣고 볶아 주세요.', 'image_url': 'https://recipe1.ezmember.co.kr/cache/recipe/2017/12/30/1dbfed180a1dcc1b40e77bc64ed4f3241.jpg'}, {'step_number': 2, 'description': '맛살은 미리미리 찢어서 준비해 놓습니다. 가닥가닥 잘게 찢어 주시는 것이 좀더 더 부드러운 게살스프를 드실 수 있어요.', 'image_url': 'https://recipe1.ezmember.co.kr/cache/recipe/2017/12/30/df86e8b990f9e87b9b4fd2e7111d4da71.jpg'}, {'step_number': 3, 'description': '볶아낸 미역에 찢어 놓은 게살과 해물 조금 넣어 주었어요.', 'image_url': 'https://recipe1.ezmember.co.kr/cache/recipe/2017/12/30/bcd7095bb9408a8b4baea119da5066391.jpg'}, {'step_number': 4, 'description': '그리고 물을 부어서 끓여 줍니다. 참기름으로 볶았기 때문에 참기름의 향이 나서 아주 고소해요.', 'image_url': 'https://recipe1.ezmember.co.kr/cache/recipe/2017/12/30/13b7e04cecfeada0097b949130afc8561.jpg'}, {'step_number': 5, 'description': '팔팔 끓어 올랐다면 치킨스톡과 함께 후추, 소금으로 간을 해 줍니다. 치킨스톡이 약간 간이 쌘편이기 때문에 소금은 아주 소량만 넣어 주세요.', 'image_url': 'https://recipe1.ezmember.co.kr/cache/recipe/2017/12/30/9d6379f6b1486c5c1c9bf0106d1c007e1.jpg'}, {'step_number': 6, 'description': '마지막으로 전분물을 넣어서 걸쭉하게 농도를 맞춰 줍니다. 팔팔 끓어 오르면 완성이지요. 중국음식과 잘 어울리는 진하면서도 부드러운 게살해물스프 완성입니다.', 'image_url': 'https://recipe1.ezmember.co.kr/cache/recipe/2017/12/30/504779a4694ca4a3a5b7d6af7bf91e321.jpg'}]"
