index,종류별,상황별,재료별,방법별,글 제목,레시피이름,레시피이미지,조회수,조리시간,난이도,인분,재료,소개글,조리순서
7684,밑반찬,일상,달걀/유제품,부침,계란말이~야채듬뿍 도톰하고 맛있는 계란말이,야채계란말이,https://recipe1.ezmember.co.kr/cache/recipe/2015/08/20/c31b542ed2e87cd32b21f1c3e7ec1c2a1.jpg,"3,001",15분 이내,아무나,2인분,"[('계란', '4개'), ('청양고추', '2개'), ('깻잎', '5장'), ('맛술', '1큰술'), ('빨간 파프리카', '1/2개'), ('노란 파프리카', '1/2개'), ('소금', '1꼬집'), ('카놀라유', '1작은술')]","오늘은 텃밭채소 듬뿍 넣어 계란말이를 만들었지요~!~~

남편이 좋아하는데 귀차니즘에 안 해주어 미안하기도 해서 마음먹고 했지요~!~
도톰하게 만들었더니 맛있네요~!~
오랜만에 계란말이를 만들었더니 남편이 맛있게 먹어주며 엄지척해주네요~!~

더운데 불앞에 서서 만든 보람이 있네요~!~","[{'step_number': 1, 'description': '재료를 준비해 놓았어요\n파프리카는 텃밭에서 따다가 반씩 잘라 놓았어요~!~', 'image_url': 'https://recipe1.ezmember.co.kr/cache/recipe/2015/08/20/20e62e25dc2319ed9ef188a34ed5ed081.jpg'}, {'step_number': 2, 'description': '계란은 4개를 깨뜨려 젓가락으로 저어서 잘풀어 줍니다\n파프리카와 깻잎은 잘게 다져 놓았어요~!~', 'image_url': 'https://recipe1.ezmember.co.kr/cache/recipe/2015/08/20/53f330c7ee81be4cb37c3c10c91b2cc41.jpg'}, {'step_number': 3, 'description': '계란 풀어놓은 것에 야채를 넣고 모두 섞어준 다음 소금 한 꼬집을 넣어주었어요~!!~\n계란 비린내를 잡아주려고 맛술 1 큰 술을 넣어줍니다~!~\n팬에 카놀라유를 넣고 달군 다음 휴지로 닦아내고 불을 약불로 낮추어준 다음 \n계란 물 1/3 정도를 부어줍니다~!~', 'image_url': 'https://recipe1.ezmember.co.kr/cache/recipe/2015/08/20/af553a036035843087c57f8e1a17f0111.jpg'}, {'step_number': 4, 'description': '잘 말아준 다음 가장자리로 옮기고 남은 계란물을 부어주어 돌돌 말아주었어요\n세 번을 반복해서 말아주었더니 도톰한 계란말이 완성이지요~!~', 'image_url': 'https://recipe1.ezmember.co.kr/cache/recipe/2015/08/20/3f425d16b3d5565681dbfc426d8725431.jpg'}, {'step_number': 5, 'description': '깔끔한 계란말이가 완성되었지요~!~\n계란말이가 식은 다음에 썰어야 예쁘게 잘 썰 수 있어요~!~\n써는 과정 사진이 없네요~!~\n접시에 예쁘게 담았어요~!~\n방울토마토 1개를 칼집을 넣어 꽃 모양을 만든다고 만들었는데 별로 안 예쁘네요~!~', 'image_url': 'https://recipe1.ezmember.co.kr/cache/recipe/2015/08/20/01467dbb63299367cfb4201f1f3d743d1.jpg'}]"
7685,밑반찬,일상,달걀/유제품,부침,이색계란말이 스팸과 깻잎이 환상궁합,스팸계란말이,https://recipe1.ezmember.co.kr/cache/recipe/2016/09/24/d6411895093cedc93e8747c7bfa9e8b81.jpg,"7,049",15분 이내,아무나,1인분,"[('달걀', '3개'), ('스팸', '1/4조각'), ('깻잎', '4장')]","반찬으로 자주내는 계란말이지만,
오늘은 색다르게 만들어봤어요
스팸을 도톰하게 잘라 넣으니
달걀에 소금간도 안해도 되구요
담백하니 넘 맛있더라구요 ^^
이 세가지 궁합이
어쩜 이리 잘어울리는지 
만들어놓고도 괜히 뿌듯 - !
(자화자찬ㅋㅋㅋㅋㅋ)","[{'step_number': 1, 'description': '계란에 소금간 없이\n한입에 쏘옥 - 넣어 먹으려면\n도톰하게 잘라야 해요\n캔햄을 꺼내 1/4등분 한 뒤\n등분한 햄은 4등분으로 잘라주세요\n(사진처럼 - )', 'image_url': 'https://recipe1.ezmember.co.kr/cache/recipe/2016/09/24/9f806d0d3c1698b1b0002b2a4741e3ac1.jpg'}, {'step_number': 2, 'description': '깻잎 4장을 위의 사진처럼 펼쳐준 후 \n잘라놓은 햄을 올려주세요', 'image_url': 'https://recipe1.ezmember.co.kr/cache/recipe/2016/09/24/45ab842d073c81f1b1c16a7395237eac1.jpg'}, {'step_number': 3, 'description': '돌돌 말아서~', 'image_url': 'https://recipe1.ezmember.co.kr/cache/recipe/2016/09/24/6ddb63a644e5664a26a5826c8d1fa3d61.jpg'}, {'step_number': 4, 'description': '계란 3개를 풀어주세요\n(소금간 x)', 'image_url': 'https://recipe1.ezmember.co.kr/cache/recipe/2016/09/24/c173c7b5a9ec31500eb93645227f333f1.jpg'}, {'step_number': 5, 'description': 'tip. 계란말이나 오믈렛만들 때는\n식용유를 팬에 부은 뒤 \n키친타월로 한번 닦아주셔야\n기포도 안생기고 \n깔끔한 계란말이를 만들 수 있어요 \n계란물 2/3 을 팬에 부어준 뒤 ...', 'image_url': 'https://recipe1.ezmember.co.kr/cache/recipe/2016/09/24/2f5ac63cf5c99eda50360aec43a68e741.jpg'}, {'step_number': 6, 'description': '햄을 말아놓은 깻잎을 올리고 \n돌돌 말아 주세요\n나머지 계란물 1/3을 붓고\n한번 더 말아주면 완성입니다 ^^', 'image_url': 'https://recipe1.ezmember.co.kr/cache/recipe/2016/09/24/62d280230a5bd4d5ba534d59b6b879d41.jpg'}, {'step_number': 7, 'description': '한김 식혀준 뒤 \n자르면 ...', 'image_url': 'https://recipe1.ezmember.co.kr/cache/recipe/2016/09/24/ae663ab2bb74c62a920bcc7b87ba4d951.jpg'}, {'step_number': 8, 'description': '요로코롬 네모진 스팸이 귀엽게 짜잔 ~~계란말이, 스팸은 찬으로\n늘 같이 따라내는 반찬 중 하나 잖아요\n한번에 넣어 더 맛있게 !\n이색적으로 ! 드실 수 있을 것 같아요 ^^오늘 저녁반찬으로 당첨 ~~ \n맛나게 드셔요 ^^', 'image_url': 'https://recipe1.ezmember.co.kr/cache/recipe/2016/09/24/05efcca8e0c91d81be8835609e8b59671.jpg'}]"
7686,밑반찬,일상,달걀/유제품,부침,맛살달걀말이! (반찬 요리),맛살달걀말이,https://recipe1.ezmember.co.kr/cache/recipe/2016/12/12/dc7ee35f9f31c86a51e2aa9680ea92241.jpg,"5,872",60분 이내,아무나,3인분,"[('달걀', '4개'), ('맛살', '2개'), ('청주', '1작은술'), ('소금', '조금')]","맛있는 달걀말이는 어떤 재료를 넣는야에따라 맛이 살짝살짝 달라지지요?
오늘 아침, 가시장미는 김밥 싸고 남은 맛살을 넣어 달걀말이를 했어요.","[{'step_number': 1, 'description': '제가 준비한 재료들이에요. \n달걀은 일어나자마자 바로 꺼내두어 냉장고 속 찬기를 조금 빼줬어요.', 'image_url': 'https://recipe1.ezmember.co.kr/cache/recipe/2016/12/14/11d1f6604d44b6cfb5a60485a82c4dd61.jpg'}, {'step_number': 2, 'description': '달걀은 풀어 체에 한번 걸러준 뒤,\n청주와 소금을 넣고 섞어주세요.', 'image_url': 'https://recipe1.ezmember.co.kr/cache/recipe/2016/12/14/e690dd7a61464a0679b7243fb09c62341.jpg'}, {'step_number': 3, 'description': '맛살은 얇게 썰거나 찢어 준비해주세요.', 'image_url': 'https://recipe1.ezmember.co.kr/cache/recipe/2016/12/14/bd72727b94048cc43586290afb0e815d1.jpg'}, {'step_number': 4, 'description': '전용 달걀말이(계란말이)팬을 불에 올려 달궈준 뒤,\n달걀물을 얇게 펴 주세요.', 'image_url': 'https://recipe1.ezmember.co.kr/cache/recipe/2016/12/14/196654e68731edc80d5cb31b12bd7bd61.jpg'}, {'step_number': 5, 'description': '그 위에 맛살을 올리고 살짝살짝 눌러주면서 돌돌 말아주세요.', 'image_url': 'https://recipe1.ezmember.co.kr/cache/recipe/2016/12/14/af9a5d261a91b708cd34c38ced428fd11.jpg'}, {'step_number': 6, 'description': '달걀물을 조금씩 추가해가면서 돌돌 말아주세요.맛살에 달걀물을 살짝 뿌려주고 말면 조금 쉽더라고요.', 'image_url': 'https://recipe1.ezmember.co.kr/cache/recipe/2016/12/14/1e6c6b07905df0e57a1dda23a1f2fe461.jpg'}, {'step_number': 7, 'description': '마지막엔 위, 아래, 옆을 차례로 조금씩 눌러가며 각을 잡아주세요.\n아님, 한소끔 식혀 김발에 넣고 꾹꾹 눌러주셔도 돼요.', 'image_url': 'https://recipe1.ezmember.co.kr/cache/recipe/2016/12/14/7a81f3b8ebf1b4988cece63af7a03f8a1.jpg'}]"
7687,밑반찬,일상,달걀/유제품,부침,계란말이황금레시피와 김치가 쏙 들어있는 살사소스만들기!,계란말이,https://recipe1.ezmember.co.kr/cache/recipe/2017/01/02/37cd798c74aec7e7432e5684b3ada1211.jpg,"1,647",15분 이내,아무나,2인분,"[('계란', '4개'), ('생크림                                                                                or 우유', '2큰술'), ('청정원 구운소금', '약간'), ('청정원 요리통후추', '약간'), ('버터', '1큰술'), ('냉동감자튀김', '1컵'), ('소고기(다짐육)', '150g'), ('배추김치', '100g'), ('다진 파슬리', '1작은술'), ('청정원 살사케찹 핫&스파이시', '5큰술'), ('청정원 구운소금', '약간'), ('청정원 요리통후추', '약간')]","부드러운 계란말이 만들기, 생각보다 여간 쉬운 게 아니에요~ 여기저기 방송을 보면 폭신폭신한 부드러운 계란말이황금레시피가 많이 나오지만, 생각만큼 방송처럼 잘 완성되지가 않죠~ 그래서 이 정원이가 계란말이황금레시피를 보여드릴 예정이라는 점! :) 계란말이가 어려우셨던 분들에게 부드러운 계란말이를 쉽게 만들 수 있는 계란말이황금레시피와 어디에나 잘 어울리는 김치 살사소스만들기를 소개해 드릴 텐데요. 한국인의 힘! 김치가 쏙 들어있는 김치 살사소스만들기는 너무너무 간편한데다가 감자튀김, 나쵸, 계란후라이 등 다양한 요리와 잘 어울려서 한번 만들어놓으시면 여기저기 사용하실 수 있을 거에요~","[{'step_number': 1, 'description': '볼에 계란, 소금, 후추, 생크림을 넣고 거품기로 유연하게 젓다가 체에 걸러 알끈을 제거한다. \n팬을 버터를 녹이고 얇게 계란 물을 넣어 약 불로 한쪽 면을 굽다가 돌돌 말아 계란말이를 완성한다.', 'image_url': 'https://recipe1.ezmember.co.kr/cache/recipe/2017/01/02/77fc2e614a702fe5ad522acf4869f7721.jpg'}, {'step_number': 2, 'description': '3. 잘 익은 배추김치를 잘게 다진다.', 'image_url': 'https://recipe1.ezmember.co.kr/cache/recipe/2017/01/02/ce4f080dcdd044dec797b462a2dee7f11.jpg'}, {'step_number': 3, 'description': '팬에 버터를 녹이고 소고기, 배추김치, 소금, 후추를 넣고 센 불로 약 2분간 볶다가 살사케찹을 넣어 다시 볶는다.', 'image_url': 'https://recipe1.ezmember.co.kr/cache/recipe/2017/01/02/5af1c24b6e378837da67b08b91a7dd7c1.jpg'}, {'step_number': 4, 'description': '냉동 감자튀김을 노릇하게 튀겨 접시에 담고 계란말이, 김치 살사소스, 다진 파슬리를 뿌려 완성한다.', 'image_url': 'https://recipe1.ezmember.co.kr/cache/recipe/2017/01/02/3ac082db3dd6f4df298cd6d2a3726a371.jpg'}]"
7688,밑반찬,일상,달걀/유제품,부침,계란말이 만드는법,계란말이,https://recipe1.ezmember.co.kr/cache/recipe/2017/01/04/1dbeddfa609f3b583328b0a379ae59ed1.jpg,"5,819",15분 이내,아무나,2인분,"[('달걀', '4개'), ('자투리채소', ''), ('소금', ''), ('미림', '')]","한판 냉장고에 넣어두면 든든한 반찬이었던 달걀이,, 이젠 마트에 가도 구하기가 어렵네요 예전처럼 팍팍 먹고 싶다는,,","[{'step_number': 1, 'description': '흰자. 노른자 분리해서 준비', 'image_url': 'https://recipe1.ezmember.co.kr/cache/recipe/2017/01/06/bc778c201bb37ec31c45575d0e7264d91.jpg'}, {'step_number': 2, 'description': '자투리 채소가 있다면 잘게 다져서 넣어주세요 깻잎이랑 당근을 잘게 다져서~ (채소 안 먹는 아이 먹이기 위해~~) 소금도 살짝 넣어줬어요', 'image_url': 'https://recipe1.ezmember.co.kr/cache/recipe/2017/01/06/a2fa03800dc49678b5fa141c0ab772b51.jpg'}, {'step_number': 3, 'description': '팬을 달군 후 계란 흰자부터 돌돌 말아주세요, 숟가락과 뒤집게를 이용해 양손으로 말면 더 잘 말아져요 계란이 너무 익으면 풀어지니 자신 없으면 불을 끄거나, 약불에서 하심 돼요', 'image_url': 'https://recipe1.ezmember.co.kr/cache/recipe/2017/01/06/b7f9c0bf4cb380b27c26b3e87f6907b51.jpg'}, {'step_number': 4, 'description': '흰자처럼 동일하게 돌돌 말아주면 돼요 노른자는 뻑뻑해서 미림 1, 5T를 넣어줬어요 소금도 살짝!', 'image_url': 'https://recipe1.ezmember.co.kr/cache/recipe/2017/01/06/dbec8cfc5f46af7f41a29558c71e67041.jpg'}]"
7689,밑반찬,일상,달걀/유제품,부침,"하트계란말이 만들기, 계란말이 만들기 [요리다나와]",하트계란말이,https://recipe1.ezmember.co.kr/cache/recipe/2016/07/19/dfb2f6e3b7ca7d3f60ce083838c97fbf1.jpg,"6,333",15분 이내,초급,2인분,"[('달걀', '4개'), ('양파', '1/4개'), ('당근', '약간'), ('소세지', '1/2개'), ('마요네즈', '약간'), ('소금', '약간'), ('슬라이스 치즈', '1장')]",하트계란말이를 만들어보겠습니다♡,"[{'step_number': 1, 'description': '양파 1/4개, 당근 약간, 소세지 1/2개는 잘게 다져주세요. 달걀말이에 넣을 재료는 취향에 맞게 준비해주세요!양파 1/4개, 당근 약간, 소세지 1/2개', 'image_url': 'https://recipe1.ezmember.co.kr/cache/recipe/2016/07/19/0be758f2f5e2efe126e7415cc16e31c21.jpg'}, {'step_number': 2, 'description': '달걀 4개는 마요네즈 약간과달걀 4개, 마요네즈 약간', 'image_url': 'https://recipe1.ezmember.co.kr/cache/recipe/2016/07/19/b9372da93dd9ec3e1a82e68a74037d4d1.jpg'}, {'step_number': 3, 'description': '약간의 소금을 넣고 풀고 잘 풀어주세요.소금 약간', 'image_url': 'https://recipe1.ezmember.co.kr/cache/recipe/2016/07/19/ad4f9700fde81ac1bf48a0b6992889371.jpg'}, {'step_number': 4, 'description': '다져놓은 재료를 달걀물에 넣은 다음 잘 섞어줍니다.', 'image_url': 'https://recipe1.ezmember.co.kr/cache/recipe/2016/07/19/41263e0fda4a05978a00d66f26754aad1.jpg'}, {'step_number': 5, 'description': '팬에 기름을 두르고 키친타올로 가장자리까지 꼼꼼하게 기름을 펴발라주세요.', 'image_url': 'https://recipe1.ezmember.co.kr/cache/recipe/2016/07/19/9b4b0fd2ecbfb8fbe2994967f42c95821.jpg'}, {'step_number': 6, 'description': '팬이 채워질만큼만 달걀물을 부어준 다음 달걀이 익으면 가장자리부터 말아줍니다.약불', 'image_url': 'https://recipe1.ezmember.co.kr/cache/recipe/2016/07/19/9c6f58baa0589e684bd97c1d78cc27101.jpg'}, {'step_number': 7, 'description': '끝까지 말아준 달걀을 팬 반대쪽으로 당겨서 공간을 만들어주세요. 빈 공간에 다시 달걀물을 채우고 달걀물이 익으면 말아주는 과정을 반복합니다.', 'image_url': 'https://recipe1.ezmember.co.kr/cache/recipe/2016/07/19/6965852250e688e4fb805469b9b5c3241.jpg'}, {'step_number': 8, 'description': '완성된 댤걀말이는 도톰하게 썰어주세요.', 'image_url': 'https://recipe1.ezmember.co.kr/cache/recipe/2016/07/19/183640cb0dbdb647114376631b6737681.jpg'}, {'step_number': 9, 'description': '달걀말이를 대각선으로 잘라서', 'image_url': 'https://recipe1.ezmember.co.kr/cache/recipe/2016/07/19/4da36e3baa39929877501ebca38773e91.jpg'}, {'step_number': 10, 'description': '단면을 맞대면 하트모양이 됩니다.', 'image_url': 'https://recipe1.ezmember.co.kr/cache/recipe/2016/07/19/ee6aaefbd592b348b19cbcc1101832d41.jpg'}, {'step_number': 11, 'description': '접착을 위해 슬라이스 치즈를 달걀말이 크기에 맞게 잘라서 윗면에 붙여주고 잔열로 치즈를 녹여줍니다.', 'image_url': 'https://recipe1.ezmember.co.kr/cache/recipe/2016/07/19/2aeea6e0e711a75f168ab763147a53bd1.jpg'}]"
