index,종류별,상황별,재료별,방법별,글 제목,레시피이름,레시피이미지,조회수,조리시간,난이도,인분,재료,소개글,조리순서
67022,면/만두,명절,소고기,끓이기,소고기떡국 끓이는 법 소고기양지육수 떡국꾸미 떡만두국 레시피,떡만두국,https://recipe1.ezmember.co.kr/cache/recipe/2024/02/21/d8bc90e2ff74b6c1142e8e0e55fa01b31.jpg,"1,722",15분 이내,아무나,2인분,"[('양지', '300g'), ('진간장', '2스푼'), ('다진마늘', '1스푼'), ('황설탕', '1스푼'), ('청주', '2스푼'), ('참기름', '1스푼'), ('후추', '조금'), ('떡국떡', '200g'), ('만두', '3개'), ('소고기육수', '400ml'), ('국간장', '1스푼'), ('다진마늘', '1스푼'), ('떡국꾸미', ''), ('후추', ''), ('소고기', ''), ('계란지단', ''), ('조미김', ''), ('대파 썬 것', '2스푼')]",소고기 떡국 끓이는 법 떡만둣국 끓이는 법양지 육수 떡만두국 끓이는 법소고기양지고명 떡국 끓이는 법 지방에 따라 떡국 끓이는 법도 다르기도 하지요 떡국 고명을 예쁘게 만드는 방법부터 꽃지단 그리고 소고기 육수 만드는 법도 오늘 자세하게 알려드릴게요 요즘은 시판용 사골육수도 맛있고 괜찮아서 많이들 이용하고 계시지요 떡국구미 만드는 법 다짐육으로 만들어도 좋지만 양지를 푹 고아서 육수 만들고 고기는 양념한 다음 떡국에 올리면 더욱 맛있는 떡국을 드실 수 있어요 ​,"[{'step_number': 1, 'description': '이번에 떡국 고명을 만들면서 소고기를 커터기로 다져서 만들기도 하고 양지를 푹 고아서 맑은 육수 만들고 고기는 결대로 찢거나 부드럽게 드시려면 결 반대 방향으로 썰어서 양념해 놓으면 떡국 고명으로 더할 나위 없지요 이번 떡국 고명 꾸미는 양지를 푹 끓여서 만든 고명을 올린 새해 떡국입니다', 'image_url': 'https://recipe1.ezmember.co.kr/cache/recipe/2024/02/21/6e8b3831eeb3d01ca17cba423e6305ac1.jpg'}, {'step_number': 2, 'description': '소고기 양지는 물에 씻어 핏물을 제거해 준 다음 물기를 빼줍니다\n볼 , 키친타올', 'image_url': 'https://recipe1.ezmember.co.kr/cache/recipe/2024/02/21/066a49bc62f9a746f1c765347831fe351.jpg'}, {'step_number': 3, 'description': '육수를 만들 때 고기를 맛있게 먹기 위해선 물이 팔팔 끓을 때 고기를 넣어 삶아주어야 하고 국물을 맛있게 먹으려면 처음부터 찬물에 고기를 넣고 끓여줍니다 저는 고기를 먹기 위함이라 물이 팔팔 끓을 때 소고기를 넣고 끓이면서 올라오는 거품은 걷어냈어요 냄비', 'image_url': 'https://recipe1.ezmember.co.kr/cache/recipe/2024/02/21/3d258c1ee4a78fd8c3fce4500fbf417c1.jpg'}, {'step_number': 4, 'description': '고기가 익었는지 확인하는 방법은 젓가락으로 고기를 찔렀을 때 핏물이 올라오지 않으면 고기가 익은 거예요 고기가 잘 익었으면 고기를 꺼내서 식힌 다음 손으로 결대로 찢어주던가 고기를 질기지 않고 부드럽게 드시려면 결 반대 방향으로 썰어주면 됩니다 고기를 삶은 육수는 면포에 걸러서 냉장고에 넣어두면 기름은 하얗게 굳어서 걷어내면 맑은 소고기 육수가 됩니다도마 , 조리용나이프', 'image_url': 'https://recipe1.ezmember.co.kr/cache/recipe/2024/02/21/5dc85e6ef15cac8679f19073875c4a8b1.jpg'}, {'step_number': 5, 'description': '썰어놓은 고기는 그대로 떡국에 넣는 것보다 고기에 진간장과 황설탕 다진 마늘 참기름 등을 넣어 잘 섞어준 다음 팬에 한번 볶아서 수분을 날려주면 조금 더 오래 보관할 수 있어요 이렇게 볶아 놓으면 조금 더 맛있고 오래 보관할 수 있어요', 'image_url': 'https://recipe1.ezmember.co.kr/cache/recipe/2024/02/21/68b40c068f7f048934d361dc1eef954a1.jpg'}, {'step_number': 6, 'description': '떡국 떡은 흐르는 물에 헹구어 물기를 빼줍니다 대파는 송송 썰어 준비합니다 꽃지단을 부치는 법은 아래 링크를 참고하시면 됩니다 떡국 재료 떡 200g, 시판용 만두 3개, 소고기 육수 400ml, 국간장 1스푼, 다진 마늘 1스푼, 고명:소고기고먕2스푼,대파2스푼,꽃지단,조미김가루를 준비했어요 채반', 'image_url': 'https://recipe1.ezmember.co.kr/cache/recipe/2024/02/21/3f55c2fb68883558dca31ecd593d7cf11.jpg'}, {'step_number': 7, 'description': '소고기 육수를 냄비에 붓고 끓여줍니다 육수가 꿇으면 떡국떡을 넣고 시판용 만두도 넣어줍니다', 'image_url': 'https://recipe1.ezmember.co.kr/cache/recipe/2024/02/21/75030a27b42ee86d10be2c377005674f1.jpg'}, {'step_number': 8, 'description': '다진 마늘과 국간장을 넣고 끓여줍니다 부족한 간은 소금을 넣어주시면 됩니다', 'image_url': 'https://recipe1.ezmember.co.kr/cache/recipe/2024/02/21/cd4201f408a4e11664bcb6a6bf6c36b61.jpg'}, {'step_number': 9, 'description': '후추를 넣어주고 끓어오르면 거품은 걷어냅니다 떡이 떠오르면 불을 꺼주면 됩니다국자', 'image_url': 'https://recipe1.ezmember.co.kr/cache/recipe/2024/02/21/734462f90808c023371fe099e97d5a841.jpg'}, {'step_number': 10, 'description': '그릇에 떡만두국을 떠준 다음 떡 고명 꾸미를 올려줍니다면기', 'image_url': 'https://recipe1.ezmember.co.kr/cache/recipe/2024/02/21/3e86eb277dc4fefe49eb42eb7f8b21ea1.jpg'}, {'step_number': 11, 'description': '떡국 레시피 떡만두국 비주얼도 찐 맛있는 떡국 떡만두국 완성입니다 떡국을 먹어야 나이 한 살을 먹게 되는데 나이는 안 먹고 좋아하는 떡국은 한 그릇이 아니라 두 그릇도 먹고 싶답니다', 'image_url': 'https://recipe1.ezmember.co.kr/cache/recipe/2024/02/21/e0e67c2f4a571ea122e29fb523ac5d5d1.jpg'}]"
67023,면/만두,명절,소고기,끓이기,얼큰불고기전골 수제비!!,불고기전골수제비,https://recipe1.ezmember.co.kr/cache/recipe/2017/10/14/0ecce8afd2d5f696c1c3dd8ffbc528161.jpg,"2,184",60분 이내,아무나,1인분,"[('불고기', '100g'), ('잡채', '100g'), ('당근', '1/3개'), ('양파', '1/2개'), ('김치', '100g'), ('고추', '2개'), ('파', '조금'), ('마늘', '1개'), ('밀가루(중력분)', '1컵'), ('간장', '2숟갈'), ('고추장', '2숟갈'), ('설탕', '기호에맞게'), ('고춧가루', '2숟갈'), ('참기름', '1숟갈')]","명절이 끝나고 기름기 많은것을 먹고 나면 좀 느끼하잖아요! 
이 때 남은 불고기 잡채 집에있는 김치를 이용하여 얼큰한 수제비를 먹으면!! 
속도 든든하고 풀리는 하루가 될 수 있습니다!","[{'step_number': 1, 'description': '재료를 준비 씻어서 준비해주세요!\n당근과 양파는 조금 두껍게 채썰어주시고 고추 마늘 파는 다져주세요.', 'image_url': 'https://recipe1.ezmember.co.kr/cache/recipe/2017/10/14/f630123795897075073e9d56f4edf62a1.jpg'}, {'step_number': 2, 'description': '중력분100그람에 물 30미리를 넣고, 치대어 비닐봉지에 30분정도 숙성해줍니다.', 'image_url': 'https://recipe1.ezmember.co.kr/cache/recipe/2017/10/14/d67b5fe8c6446919273dfc33449ea4571.jpg'}, {'step_number': 3, 'description': '참기름에 썬 김치를 볶아주세요.', 'image_url': 'https://recipe1.ezmember.co.kr/cache/recipe/2017/10/14/7b84277fd8b34f72719342676c4d1dcc1.jpg'}, {'step_number': 4, 'description': '그리고 물을 넣고 끓여주세요.', 'image_url': 'https://recipe1.ezmember.co.kr/cache/recipe/2017/10/14/8dc7138f38c0a08dadf10d07597cdfa71.jpg'}, {'step_number': 5, 'description': '끓는다면 불고기를 넣고 약불에서 끏여주세요!\n(익힌 불고기도 괜찮아요)', 'image_url': 'https://recipe1.ezmember.co.kr/cache/recipe/2017/10/14/4b46aee48df0e9429faae5aa596b4ba61.jpg'}, {'step_number': 6, 'description': '당근을 넣고 익혀주세요.', 'image_url': 'https://recipe1.ezmember.co.kr/cache/recipe/2017/10/14/33623ff82931a35339144f83da3d7e1c1.jpg'}, {'step_number': 7, 'description': '수제비를 떼어서 넣고 끏여주세요!\n이때 양파랑 남은 잡채도 넣어주세요.', 'image_url': 'https://recipe1.ezmember.co.kr/cache/recipe/2017/10/14/2551ae9d22840e465d2fda6a1b546c371.jpg'}, {'step_number': 8, 'description': '끓는다면 간장과 고추장을 넣고 간을 해주세요. \n설탕은 기호에 맞게 넣어주세요', 'image_url': 'https://recipe1.ezmember.co.kr/cache/recipe/2017/10/14/354b58581a6654fc118b728bfe19a7ac1.jpg'}, {'step_number': 9, 'description': '얼큰함을 주기 위해서 고춧가루 투여!!', 'image_url': 'https://recipe1.ezmember.co.kr/cache/recipe/2017/10/14/112f8d5281b970229855788879dc83591.jpg'}, {'step_number': 10, 'description': '수제비가 다 익었다면 파, 마늘, 고추, 참기름 넣고 살짝만 더 끓여주세요.', 'image_url': 'https://recipe1.ezmember.co.kr/cache/recipe/2017/10/14/2c954d779faf3959915f1c0fe14350041.jpg'}, {'step_number': 11, 'description': '얼큰한 불고기 수제비 완성', 'image_url': 'https://recipe1.ezmember.co.kr/cache/recipe/2017/10/14/1e641925357a9f87ded9280e7ecf1a0d1.jpg'}]"
67024,면/만두,명절,소고기,끓이기,"든든하고 정갈한 한 끼, 유부 만둣국 레시피",유부만둣국,https://recipe1.ezmember.co.kr/cache/recipe/2024/01/03/2eb4dcada8ae9adadc3e1b15f79f9b0d1.png,111,20분 이내,초급,2인분,"[('유부 주머니', '7장'), ('부추', '7줄기'), ('다시마 멸치 육수', '800ml'), ('무', '1/8개'), ('표고버섯', '2개'), ('대파', '1개'), ('국간장', '0.5스푼'), ('식용유', '2스푼'), ('소고기 다짐육', '150g'), ('부추', '4줄기'), ('당면', '1/2줌'), ('두부', '1/3모'), ('대파', '1개'), ('참기름', '약간'), ('소금 후추', '약간'), ('청주', '약간'), ('소금 후추', '약간')]",부추로 만든 속을 채워 넣은 유부주머니를 맑은 육수에 끓여 내면 든든하게 한끼가 뚝딱! 영양 가득 부추와 간 소고기를 채워넣은 유부주머니로 영양과 복이 가득한 새해맞이 식사를 만들어보세요~,"[{'step_number': 1, 'description': '달군 팬에 카놀라유를 두르고 미리 10분간 밑간한 소고기 다짐육을 넣어 중불에서 5분간 볶아주세요', 'image_url': None}, {'step_number': 2, 'description': '볼에 볶은 소고기와 나머지 속재료를 잘게 다져 넣은 후 골고루 섞어주세요당면은 미리 물에 불린 뒤 살짝 데쳐 사용해주세요', 'image_url': None}, {'step_number': 3, 'description': '데친 유부주머니에 속재료를 넣고 데친 부추 줄기로 입구를 단단히 묶어주세요', 'image_url': None}, {'step_number': 4, 'description': '냄비에 멸치 다시마 육수와 먹기좋게 선 무를 넣고 강불에서 끓이다가 유부주머니를 넣어주세요', 'image_url': None}, {'step_number': 5, 'description': '주머니가 떠오르면 슬라이스 한 표고버섯과 대파를 넣고 국간장으로 간을 맞춰주세요', 'image_url': None}, {'step_number': 6, 'description': '뜨거운 유부주머니에 데이지 않도록 조심하며 맛있게 드세요', 'image_url': None}]"
