index,종류별,상황별,재료별,방법별,글 제목,레시피이름,레시피이미지,조회수,조리시간,난이도,인분,재료,소개글,조리순서
38358,메인반찬,술안주,닭고기,볶음,닭갈비 만들기 닭갈비 양념장 만드능 법 레시피,닭갈비,https://recipe1.ezmember.co.kr/cache/recipe/2024/08/01/7e7a4112549509ebd2064329c664662d1.jpg,225,90분 이내,중급,4인분,"[('닭다리살', '700g'), ('양배추                                                                                약 400~500g', '1/4개'), ('대파', '1/2대'), ('양파', '1/2개'), ('고구마', '1개'), ('감자', '1개'), ('청양고추', '2개'), ('깻잎', '10~15장'), ('조랭이 떡                                                                                또는 떡볶이 떡', '취향껏'), ('식용유', ''), ('다진 양파', '1/4개'), ('고추장', '2큰술'), ('설탕', '2큰술'), ('양조간장', '6큰술'), ('맛술                                                                                미림', '2큰술'), ('다진 마늘', '1큰술'), ('생강청', '1/3큰술'), ('참기름', '1큰술'), ('카레가루                                                                                중요', '1큰술')]","오늘은 추억의 음식을 준비해 봤습니다. 대학 시절 고기는 먹고 싶은데, 주머니 사정은 넉넉하지 못했죠.. ㅎㅎ 그래서 항상 비교적 저렴한 닭고기를 많이 먹었습니다. 그래서 오늘은 대학 시절 많이 먹었던 닭갈비를 만들어 봤습니다.","[{'step_number': 1, 'description': '잘게 썬 양파 1/4 개, 고추장 2 큰 술, 설탕 2 큰 술, 양조간장 6 큰 술, 맛술(미림) 2 큰 술, 다진 마늘 듬뿍 1 큰 술, 생강청 1/3 큰 술, 참기름 1 큰 술, 카레 가루 1 큰 술을 넣고 잘 섞어주세요.도마 , 조리용나이프 , 볼 , 수저집에서 닭갈비 전문점 맛을 내는 포인트는 양념장에 들어가는 카레 가루입니다. 시중에서 판매하는 카레 가루를 꼭 넣어주세요. 양념장은 냉장실에서 30분 이상 숙성 시키면 더욱 맛이 좋아집니다.', 'image_url': 'https://recipe1.ezmember.co.kr/cache/recipe/2024/08/03/bee4402aeac1ca384b299ffb11a297b21.jpg'}, {'step_number': 2, 'description': '요즘은 닭 다리 살을 잘게 잘라서 팔더라고요. 냉동 상태로 배송돼서 냉장실에서 해동 후, 700g만 사용했습니다.믹싱볼', 'image_url': 'https://recipe1.ezmember.co.kr/cache/recipe/2024/08/03/875eee8f0387677719bb0596dc94b3e61.jpg'}, {'step_number': 3, 'description': '닭 다리 살 700g에 만들어 놓은 양념장을 모두 넣고 잘 버무려 주세요. 비닐 랩을 씌우고 냉장실에서 10분~20분 정도 재워둡니다.위생장갑 , 랩', 'image_url': 'https://recipe1.ezmember.co.kr/cache/recipe/2024/08/03/e02f69f2fd11ea3b6044a6a8b453913a1.jpg'}, {'step_number': 4, 'description': '닭고기가 양념에 재워지는 동안 준비한 채소들을 큼직큼직하게 썰어줍니다.도마 , 조리용나이프 , 스텐트레이', 'image_url': 'https://recipe1.ezmember.co.kr/cache/recipe/2024/08/03/86743e5900cf39ac8c18762c2913a7a21.jpg'}, {'step_number': 5, 'description': '조랭이 떡도 물에 불려주세요.', 'image_url': 'https://recipe1.ezmember.co.kr/cache/recipe/2024/08/03/0eccfb3f246b62ca6dcade9fb123d1281.jpg'}, {'step_number': 6, 'description': '프라이팬에 식용유 2 큰 술을 두르고 양념된 닭고기를 먼저 볶아 주세요.프라이팬 , 요리집게', 'image_url': 'https://recipe1.ezmember.co.kr/cache/recipe/2024/08/03/137f203208eba033cc454371778f54c71.jpg'}, {'step_number': 7, 'description': '닭고기의 겉면이 살짝 익었다면 썰어 놓은 감자와 고구마를 넣어주세요.', 'image_url': 'https://recipe1.ezmember.co.kr/cache/recipe/2024/08/03/2b17eb21ff422ed30da4f119fa03c1471.jpg'}, {'step_number': 8, 'description': '불세기는 중불로 낮춰주고 뚜껑을 덮어 고구마와 감자를 익혀줍니다.수분이 너무 없어서 재료가 탈 거 같으면 물을 조금씩 넣어가면서 익혀주세요.', 'image_url': 'https://recipe1.ezmember.co.kr/cache/recipe/2024/08/03/ac987ba3a22e76793a1f6069c4c63eb01.jpg'}, {'step_number': 9, 'description': '젓가락으로 고구마와 감자를 찔러보고 어느 정도 익었다면 양파와 양배추를 넣고 뚜껑을 덮어 익혀줍니다.', 'image_url': 'https://recipe1.ezmember.co.kr/cache/recipe/2024/08/03/e444a023691aa4523448c2b2c339294a1.jpg'}, {'step_number': 10, 'description': '양배추 숨이 어느 정도 죽으면 고춧가루 1 큰 술을 넣고 볶아주다가, 조리주걱', 'image_url': 'https://recipe1.ezmember.co.kr/cache/recipe/2024/08/03/b609d1a5087788356a2e15d89721aa651.jpg'}, {'step_number': 11, 'description': '불려놓은 조랭이 떡도 같이 넣고 떡이 부드럽게 익을 때까지 볶아주세요.', 'image_url': 'https://recipe1.ezmember.co.kr/cache/recipe/2024/08/03/dd6c80f5a23cef616440a6d473ea5d501.jpg'}, {'step_number': 12, 'description': '이제 불을 끈 뒤, 대파와 청양고추, 깻잎을 넣고 프라이팬의 잔열로 익혀주면 닭갈비가 완성됩니다.', 'image_url': 'https://recipe1.ezmember.co.kr/cache/recipe/2024/08/03/276307341a790c570fef1b43adba8bc21.jpg'}]"
38359,메인반찬,술안주,닭고기,볶음,집에서 만드는 매운양념치킨,양념치킨,https://recipe1.ezmember.co.kr/cache/recipe/2015/05/18/ca57e24e614be081f26d865c5a116a801.jpg,"8,074",30분 이내,초급,2인분,"[('닭', '800g'), ('청양고추                                                                                다진 것', '2개'), ('고추가루', '6숟가락'), ('간장', '4숟가락'), ('설탕', '4숟가락'), ('물', '1컵'), ('후추가루', '조금'), ('다진마늘', '5숟가락')]",집에서 만들어먹는 초간단 양념치킨을 소개합니다~,"[{'step_number': 1, 'description': '닭에 칼집을 넣는다.', 'image_url': 'https://recipe1.ezmember.co.kr/cache/recipe/2015/05/19/217ca81aef413d6188f68b033a4313a41.jpg'}, {'step_number': 2, 'description': '끓는 물에 3분 30초 끓인다.', 'image_url': 'https://recipe1.ezmember.co.kr/cache/recipe/2015/05/19/91e528aa67c4df0f4fe155eee72cf9cd1.jpg'}, {'step_number': 3, 'description': '끓이는 동안 양념장을 준비한다. (청냥고추 2개 다진것, 고추가루 6숟가락, 간장 4숟가락, 설탕 4숟가락, 물 1컵, 후추가루, 조금다진마늘 5숟가락)', 'image_url': 'https://recipe1.ezmember.co.kr/cache/recipe/2015/05/19/cd9088638f01436e5171aa244c1aed031.jpg'}, {'step_number': 4, 'description': '양념장 위에 살짝 데친 닭을 올리고 양념이 고루 뭍게 비벼준다.\n강불에 끓을때까지 끓이고 중불로 바꿔 바짝 쫄여주면 완성!', 'image_url': 'https://recipe1.ezmember.co.kr/cache/recipe/2015/05/19/1c39ac890d5f71911e62492ac9b4ca381.jpg'}]"
38360,메인반찬,술안주,닭고기,볶음,시판 양념으로 초간단 치즈닭갈비,치즈닭갈비,https://recipe1.ezmember.co.kr/cache/recipe/2015/09/29/8778a9a82efb6dc6cc0ebfdf25c87f15.jpg,"6,895",30분 이내,초급,2인분,"[('닭가슴살', ''), ('쌀떡볶이', ''), ('대파', ''), ('양파', ''), ('청양고추', ''), ('마늘', ''), ('치즈', ''), ('떡볶이양념장', '')]",시판 양념으로 초간단 치즈닭갈비입니다.,"[{'step_number': 1, 'description': '애들이랑 마지막날 닭가슴살 샐러드 만들었거든요. 그래서 길쭉하게 썰어서 허브에 재워둔 건데 그거 활용했어요. 그리고 쌀떡볶이, 대파, 양파, 청양고추 좀 썰어서 준비하고 마늘도 두쪽 정도 다져졌어요. 그리고 떡볶이 양념장 준비했구요.', 'image_url': 'https://recipe1.ezmember.co.kr/cache/recipe/2015/09/30/cc8e9bafe8a5ab14ec9fa36dc98221d21.jpg'}, {'step_number': 2, 'description': '닭가슴살을 양념에 재웠다가 볶아도 되고 저는 시간도 없고해서 바로 볶았어요. 팬에 기름 약간만 두르고 닭가슴살과 떡볶이 양념장 넣고 달달 볶다가 닭가슴살이 익으면 양파, 대파, 고추, 다진마늘 넣고 조금 더 볶고 모짜렐라 치즈 넣어 주세요.', 'image_url': 'https://recipe1.ezmember.co.kr/cache/recipe/2015/09/30/8a46ca6c10405795ce916c7e4a9b769d1.jpg'}, {'step_number': 3, 'description': '치즈 넣고 두껑 덮어서 녹여도 되고 아님 같이 섞어도 상관 없구요.', 'image_url': 'https://recipe1.ezmember.co.kr/cache/recipe/2015/09/30/736e71da3d7c3a19b8aa36afd3031b811.jpg'}]"
38361,메인반찬,술안주,닭고기,볶음,한 입 크게 싸 먹는 닭가슴살 김치볶음,닭가슴살김치볶음,https://recipe1.ezmember.co.kr/cache/recipe/2016/10/30/0a4dccf9539445d34b3203c2aace46b11.jpg,"2,564",60분 이내,아무나,2인분,"[('닭가슴살', '100g'), ('양파', '1/2개'), ('대파', '1/2개'), ('묵은지', '50g'), ('청양초', '2개'), ('고춧가루', '1숟가락'), ('물', '2숟가락'), ('깨소금', '약간'), ('참기름', '약간')]","우리 집 식탁에 자주 오르는 게 있다면 쌈 종류입니다. 상추, 깻잎, 쌈 배추 양배추 등 쌈 싸 먹는 걸 좋아하기 때문입니다. 오늘은 닭 가슴살 김치볶음으로 한 입 크게 싸 먹어 보았습니다.","[{'step_number': 1, 'description': '[브로콜리 무침] \n브로콜리는 손질하여 끓는 물에 살짝데쳐낸다.브로콜리 손질법 레시피', 'image_url': 'https://recipe1.ezmember.co.kr/cache/recipe/2016/12/23/7aaf19b680930e2b32ce9cd2c47e7b991.jpg'}, {'step_number': 2, 'description': '먹기 좋은 크기로 썰어 양념을 넣고 조물조물 무쳐주면 완성된다.', 'image_url': 'https://recipe1.ezmember.co.kr/cache/recipe/2016/12/23/e513e3ee54f81da25d8c33be65e9b8221.jpg'}, {'step_number': 3, 'description': '[닭 가슴살 김치볶음] \n닭 가슴살, 양파, 대파, 청양초는 먹기 좋은 크기로 썰어준다.', 'image_url': 'https://recipe1.ezmember.co.kr/cache/recipe/2016/12/23/b90137de8e59f984561c0ae48d5e7e751.jpg'}, {'step_number': 4, 'description': '묵은지도 먹기 좋은 크기로 썰어 물을 약간 두르고 볶아준 후 닭 가슴살을 넣어준다.', 'image_url': 'https://recipe1.ezmember.co.kr/cache/recipe/2016/12/23/1b20a968e1adf7c0b4cd036c1010137f1.jpg'}, {'step_number': 5, 'description': '고춧가루를 넣고 완전히 익힌 후 양파와 청양초를 넣고 볶아준다.', 'image_url': 'https://recipe1.ezmember.co.kr/cache/recipe/2016/12/23/9ed232a92f59a389b35ac3f94b175f751.jpg'}, {'step_number': 6, 'description': '마지막에 깨소금, 참기름을 뿌려 완성한다.', 'image_url': 'https://recipe1.ezmember.co.kr/cache/recipe/2016/12/23/c74cd470d98e0cbd597cf73413c8209f1.jpg'}, {'step_number': 7, 'description': '완성된 모습', 'image_url': 'https://recipe1.ezmember.co.kr/cache/recipe/2016/12/23/3d2a092670ef00a7e35f1279b92f66b61.jpg'}, {'step_number': 8, 'description': '[뚝배기 된장국] \n멸치와 다시마를 넣고 육수를 내준 후 건더기는 건져낸다.', 'image_url': 'https://recipe1.ezmember.co.kr/cache/recipe/2016/12/23/e1c7805d3af610bb2b0dfdc4f76ab7391.jpg'}, {'step_number': 9, 'description': '감자, 양파, 된장, 청양초를 넣고 끓인 후 마지막에 대파를 넣고 마무리한다.', 'image_url': 'https://recipe1.ezmember.co.kr/cache/recipe/2016/12/23/99bafc18d7172cbe123b1ad6ea613ab11.jpg'}]"
38362,메인반찬,술안주,닭고기,볶음,순대볶음 황금 레시피. 다이어트에 좋은 닭가슴살 곤약 순대 볶음.,닭가슴살곤약순대볶음,https://recipe1.ezmember.co.kr/cache/recipe/2020/03/02/e1bcbe2a485eed4f25ded13da199131d1.jpg,"3,706",30분 이내,아무나,2인분,"[('닭가슴살 순대', '2팩'), ('양배추', '200g'), ('양파', '1/2개'), ('청고추', '1개'), ('홍고추', '1개'), ('대파', '1줄'), ('깻잎', '5장'), ('고추장', '2T'), ('고춧가루', '2T'), ('설탕', '1T'), ('간장', '3T'), ('간마늘', '1T'), ('생강술', '1T'), ('후추', ''), ('통깨', ''), ('들기름', '')]",다이어트에 좋은 닭가슴살 곤약 순대로 그냥 먹어도 맛있지만 순대 볶음으로도 매콤하게 만들었어요.,"[{'step_number': 1, 'description': '양배추,적양배추는 굵게 채 썹니다.\n*양배추는 오랫동안 달달 볶아야 하니\n조금 두툼하게 썰어야 좋아요.', 'image_url': 'https://recipe1.ezmember.co.kr/cache/recipe/2020/03/02/87fefdfdc56d683db0ca5c64f44e6e7f1.jpg'}, {'step_number': 2, 'description': '채썬 양배추는 아삭하게 찬물에 담궈\n물기 빼 주세요.\n*적 양배추는 없으면 양배추만 넉넉히 넣어도 달고 맛있더라구요.', 'image_url': 'https://recipe1.ezmember.co.kr/cache/recipe/2020/03/02/f546a7435b35cfb97610ea81aabf0c2b1.jpg'}, {'step_number': 3, 'description': '양파도 채 썰어 줍니다.\n*양파와 양배추를 숨이 죽도록\n볶아야 하니 큼직하게 잘라도 됩니다.', 'image_url': 'https://recipe1.ezmember.co.kr/cache/recipe/2020/03/02/2cae3888f6a74b663a19ddcfa8629dde1.jpg'}, {'step_number': 4, 'description': '청,홍고추는 어슷 썰어 줍니다.', 'image_url': 'https://recipe1.ezmember.co.kr/cache/recipe/2020/03/02/b2ee25021ebc1d44530af4b0a215f1e61.jpg'}, {'step_number': 5, 'description': '깻잎은 반갈라 굵게 잘라 주세요.', 'image_url': 'https://recipe1.ezmember.co.kr/cache/recipe/2020/03/02/6baeb9c1e8c796e7f0210e2d7b29c3e31.jpg'}, {'step_number': 6, 'description': '대파도 어슷 썰어 주세요.', 'image_url': 'https://recipe1.ezmember.co.kr/cache/recipe/2020/03/02/86d27de26f61f908f56937280fb213f31.jpg'}, {'step_number': 7, 'description': '간마늘,고추가루,고추장,간장,생강술,후추로 양념장 만듭니다.\n*양념이 약간 되직한데 양배추에서 물이 나와 괜찮더라구요.', 'image_url': 'https://recipe1.ezmember.co.kr/cache/recipe/2020/03/02/4d51235569517844f3c5990203b912ec1.jpg'}, {'step_number': 8, 'description': '순대 속이 꽉 찼죠? \n곤약 쌀과 닭가슴살로 속을 채웠어요.', 'image_url': 'https://recipe1.ezmember.co.kr/cache/recipe/2020/03/02/78b03509dd565f2a30016fd74dfa1a3c1.jpg'}, {'step_number': 9, 'description': '달궈진 팬에 양배추와 대파,들기름\n넣어 센불에서 양배추가 무르고 투명해\n질때 까지 볶아 주세요.\n들깨 가루를 넣으면 물기를 다 흡수해서\n퍽퍽할수 있으니 야채를 들기름으로 볶았어요.', 'image_url': 'https://recipe1.ezmember.co.kr/cache/recipe/2020/03/02/32deb1abf132e090b55572370c56f0971.jpg'}, {'step_number': 10, 'description': '달달 볶아지면 순대와 양념 넣어 볶아 줍니다.\n양념은 남길 필요없이 딱 맞더라구요.', 'image_url': 'https://recipe1.ezmember.co.kr/cache/recipe/2020/03/02/a38fbc4ec6458fef306688e563ee26c61.jpg'}, {'step_number': 11, 'description': '순대가 터질까 걱정했는데 속을 어찌나\n꽉 채웠는지 하나도 안터지더라구요.\n향긋한 깻잎과 통깨,참기름 넣어 완성합니다.', 'image_url': 'https://recipe1.ezmember.co.kr/cache/recipe/2020/03/02/9fcbcfe825e6d9de62ce2c62f4936bc11.jpg'}]"
38363,메인반찬,술안주,닭고기,볶음,#닭고기요리 #오돌뼈볶음만들기 #겁나게매운오돌뼈볶음 #오돌뼈주먹밥만들기 #매운닭발집의 오돌뼈볶음따라하기!!!,오돌뼈볶음,https://recipe1.ezmember.co.kr/cache/recipe/2020/04/06/4098da08f19d5daa8fb0a9ba6bc6562b1.jpg,"5,403",30분 이내,초급,6인분 이상,"[('닭오돌뼈', '1kg'), ('다짐 닭가슴살', '500g'), ('다진마늘', '3큰술'), ('썬파', '4큰술'), ('다진생강', '1작은술'), ('양파', '2개'), ('청양고추', '2개'), ('청주', '2큰술'), ('후추', '1큰술'), ('매실액', '2큰술'), ('캡사이신', '1큰술'), ('불향 고춧기름', '2큰술'), ('매운닭발양념', '1컵'), ('오돌뼈볶음', '2컵'), ('밥', '2공기'), ('자반김', '3큰술'), ('참기름', '1작은술'), ('통깨', '1작은술')]","논현동에 있는 매운닭발집...홍미닭발인가요.

원래 본점은 강서구청에 있지요. 강서구청 뒷골목에는 맛집들이 많이 있는데

그중 하나가 유명한 닭발집인 홍미닭발입니다.

​

그곳의 시그니처메뉴는 닭발이라고 생각하실지 모르겠지만

원래는 닭볶음탕입니다. 그 닭볶음탕의 매력에 빠지면 홍미닭발집에서

닭발보다는 닭볶음탕에 빠지게 되지요. 얼얼하게 매운데 자꾸만 먹게 되는 맛이요 ㅎㅎ

​

​

청양고추가 어마어마하게 위에 올려져서 나오는데

일단,,,빼서 먹어야 합니다. 안그럼...죽습니다. ㅋㅋㅋㅋ

​

매운닭발도 맛있지만 또한가지가 오돌뼈볶음이지요.

그 오돌뼈볶음이 생각나서 인터넷으로 주문한 오돌뼈와 닭가슬살다짐육을 넣고

오돌뼈볶음을 만들었습니다. 소스는 시판되는 소스를 사용했고

좀더 좀더 더 매운 맛을 내기 위해서 캡사이신도 넣어 주고 불향고춧기름도 넣어 주었지요.

뭐 밥이랑 같이 먹기에는 충분한 맛이였어요. 주먹밥으로요.

오돌뼈볶음은 주먹밥이지요 ㅋㅋㅋ","[{'step_number': 1, 'description': '매운닭발집에서 나오는 오돌뼈를 보면 양파도 들어가져 있더라구요. 다져서는 같이 볶아 준 것 같지요. 청양고추도 들어가져 있는 것 같기도 하고요. 그래서 일단, 양파부터 다져 줍니다.', 'image_url': 'https://recipe1.ezmember.co.kr/cache/recipe/2020/04/06/08ed88e34d7cbf0bfe507b1832c907171.jpg'}, {'step_number': 2, 'description': '다진 양파에 다진마늘, 다진생강, 썬파를 넣어 줍니다.', 'image_url': 'https://recipe1.ezmember.co.kr/cache/recipe/2020/04/06/87562c64df4577dc1e30c29fbc1a1e031.jpg'}, {'step_number': 3, 'description': '그리고 불향나는 고춧기름을 넣어 주고요. 후추도 넣어서 잡내를 없애 주는 역할을 담당합니다. 그리고 매실액으로 단맛을 추가해 주고요.', 'image_url': 'https://recipe1.ezmember.co.kr/cache/recipe/2020/04/06/810d245675f284c9654508b6e9dae6ec1.jpg'}, {'step_number': 4, 'description': '닭오돌뼈 1kg입니다. 닭오돌뼈는 1차적으로 잘게 잘게 썰어 주시는데 왠만해서는 잘게 다져지지 않더라구요. 그래서 1차로 다져 주고는 다음에 볶을때에 익히면서 가위를 이용해서 잘라 줄려고 합니다.', 'image_url': 'https://recipe1.ezmember.co.kr/cache/recipe/2020/04/06/20ba4b615534a913466d2bde074ba9311.jpg'}, {'step_number': 5, 'description': '오돌뼈에는 닭살이 그리 많지가 않아서 구입한 닭가슴살 다짐육입니다. 추가로 넣어 주려고 합니다.', 'image_url': 'https://recipe1.ezmember.co.kr/cache/recipe/2020/04/06/541a2a1647a31e560931c5a6122b14cf1.jpg'}, {'step_number': 6, 'description': '닭가슴살다짐육을 넣어 줍니다.', 'image_url': 'https://recipe1.ezmember.co.kr/cache/recipe/2020/04/06/aa680c5dacc33a80a2ff368947c0ef071.jpg'}, {'step_number': 7, 'description': '1차로 다져 준 닭오돌뼈도 넣어 줍니다. 그리고 잘 섞어 주세요.', 'image_url': 'https://recipe1.ezmember.co.kr/cache/recipe/2020/04/06/c433e60dc96ab448abe99b0650f83e0d1.jpg'}, {'step_number': 8, 'description': '이번에 사용한 양념은 매운닭발양념입니다. 이 양념으로 매운맛을 내어 줄려고 합니다.', 'image_url': 'https://recipe1.ezmember.co.kr/cache/recipe/2020/04/06/ac92d5bdf9e1f5426c1aa4c180fab9d61.jpg'}, {'step_number': 9, 'description': '매운닭발양념을 넣어 주고 더더더 맵게 하기 위해서 캡사이신을 넣어 주었습니다. 조물조물 무쳐 양념을 해 줍니다. 그러면 양념은 끝입니다.', 'image_url': 'https://recipe1.ezmember.co.kr/cache/recipe/2020/04/06/c6c1c07f1984597e801b3540768738f41.jpg'}, {'step_number': 10, 'description': '양념에 재워 놓고 반나절 정도 지난 후에 꺼내어서는 달궈진 팬에 고춧기름을 한바퀴 둘러 주고는 오돌뼈를 볶아 줍니다. 중간 중간에 오돌뼈가 익으면 가위를 이용해서 좀더 잘게 잘게 다져 줍니다.', 'image_url': 'https://recipe1.ezmember.co.kr/cache/recipe/2020/04/06/076ae4f251e115ef73bffda904b6dad51.jpg'}, {'step_number': 11, 'description': '오휴!!! 매운 향이 올라오면서 재채기를 몇번이나 했지 모르겠습니다. 다 볶아졌습니다. 이렇게 그냥 드셔도 맛있지만 가장 중요한 포인트는 주먹밥이지요.', 'image_url': 'https://recipe1.ezmember.co.kr/cache/recipe/2020/04/06/950fca891fd8400f53b19e62a85fa3fb1.jpg'}, {'step_number': 12, 'description': '완성접시에 오돌뼈볶음을 담아 내고는 통깨를 뿌려서 마무리!! 참기름은 넣지 않았습니다.', 'image_url': 'https://recipe1.ezmember.co.kr/cache/recipe/2020/04/06/554a53092c95a73e3fd42b9a4adbb7261.jpg'}, {'step_number': 13, 'description': '볶아낸 오돌뼈를 주먹밥으로 변신시켜야겠지요. 밥을 투하합니다.', 'image_url': 'https://recipe1.ezmember.co.kr/cache/recipe/2020/04/06/d902fc76cc1d0d67794c6aff9c0e05161.jpg'}, {'step_number': 14, 'description': '통깨와 참기름도 넣어 줍니다.', 'image_url': 'https://recipe1.ezmember.co.kr/cache/recipe/2020/04/06/25be79ecf989a413359c2056d1d1a8ab1.jpg'}, {'step_number': 15, 'description': '그리고 중요한 자반김이나 김가루를 넣어 주고는 잘 섞어 주세요. 그런 다음에 위생비닐장갑을 끼고는 주먹밥을 한입크기로 뭉쳐서 만들어 주시면 됩니다.', 'image_url': 'https://recipe1.ezmember.co.kr/cache/recipe/2020/04/06/9ffb3a22a67f6025264e8901fc6ffa001.jpg'}, {'step_number': 16, 'description': '매운 오돌뼈볶음과 오돌뼈주먹밥 완성입니다. 주먹밥은 밥이 들어가서 그런지 그닥 맵다고 생각이 안들더라구요. 참기름의 영향도 큰 것 같고요. 오드득 오드득 씹히는 식감이 넘넘 좋네요. 오히려 가서 먹는 것보다 훨씬더 오돌뼈의 식감을 많이 느끼게 되는 것 같아요.', 'image_url': 'https://recipe1.ezmember.co.kr/cache/recipe/2020/04/06/f2cb2ed3b371e4e2f1e04c2c1fc852471.jpg'}]"
38364,메인반찬,술안주,닭고기,볶음,무뼈닭발 황금레시피 알려드려요 :: 구름이 비추는 세상,무뼈닭발,https://recipe1.ezmember.co.kr/cache/recipe/2019/07/13/b85448198ddac6cdf44236ca1074ed0a1.jpg,"12,182",60분 이내,초급,2인분,"[('뼈없는 닭발', '200g'), ('양파', '1/2개'), ('대파', '조금'), ('고추장', '2큰술'), ('고추가루', '1큰술'), ('다진마늘', '2큰술'), ('설탕', '2큰술'), ('간장', '1큰술'), ('매실', '2큰술'), ('맛술', '2큰술')]",안녕하세요 구름달빛입니다 오늘의 요리는 뼈없는 닭발 맛있게 만드는법 알려드릴께요 닭발은 콜라겐이 풍부해 피부 노화를 예방한다고 하지요 20대에는 닭발 먹을줄도 몰랐던 시절이 있었네요 술안주로 추천할만큼 자주 해먹는 요리중에 하나이지요,"[{'step_number': 1, 'description': '뼈없는 닭발은 맛술 한컵 넣고 잡내 제거을 위해 30분간 담궈 뒀어요 우유에 재워 두셔도 좋아요 재워둔 닭발은 끓는물에 삶아 줄꺼예요 후추 약간 넣고 끓기 시작하면 5분정도 삶아주세요 삶아낸 닭발은 찬물에 깨끗하게 씻어주세요', 'image_url': 'https://recipe1.ezmember.co.kr/cache/recipe/2019/07/15/6d6fde9adb9bda30ca86b28a94cdc1731.jpg'}, {'step_number': 2, 'description': '양념장을 미리 만들어 주세요', 'image_url': 'https://recipe1.ezmember.co.kr/cache/recipe/2019/07/15/f0edf742baec82082d5b438a9f80d7471.jpg'}, {'step_number': 3, 'description': '깨끗하게 손질한 닭발은 만들어둔 양념장을 반만 넣어 닭발에 버무려 재워주세요 30분정도 재워놓고 팬에 볶아 줬어요', 'image_url': 'https://recipe1.ezmember.co.kr/cache/recipe/2019/07/15/cbad872538a539c140236c0435b1f8cb1.jpg'}, {'step_number': 4, 'description': '팬에 기름을 넣고 썰어둔 대파를 넣어 먼저 볶아주세요 재워둔 닭발을 넣고 볶아주시는데요 닭발에 수분제거를 해도 볶을때 조금 튀어요 저는 약불에서 볶아줬어요', 'image_url': 'https://recipe1.ezmember.co.kr/cache/recipe/2019/07/15/31f7c9ed0f3784a867f6fbb3cf16911c1.jpg'}, {'step_number': 5, 'description': '약불에서 볶아주시고 물 소주컵 한컵 넣어주시고 남은 양념 같이 넣어 약불에 조려 줬어요 양념이 닭발에 베일수 있게 해주니 양념이 겉돌지 않더라구요', 'image_url': 'https://recipe1.ezmember.co.kr/cache/recipe/2019/07/15/d69893c41ca605506f1932e228b9f6b31.jpg'}, {'step_number': 6, 'description': '양념이 졸아지면 양파를 기호에 맞게 썰어 넣어주세요. 만약 싱거우면 간장으로 간을 맞추시고 센불에서 볶아주세요 닭발은 약간 불맛이 나야 맛있더라구요 양념이 없어 질때까지 볶아주시면 닭발 완성입니다', 'image_url': 'https://recipe1.ezmember.co.kr/cache/recipe/2019/07/15/28390d3d9b3fd6539bc56bbf5da09d5c1.jpg'}]"
