index,종류별,상황별,재료별,방법별,글 제목,레시피이름,레시피이미지,조회수,조리시간,난이도,인분,재료,소개글,조리순서
166729,빵,간식,과일류,굽기,초코소보로 바나나파운드케이크,초코소보로바나나파운드케이크,https://recipe1.ezmember.co.kr/cache/recipe/2015/06/01/6b049fced23d575c3ba085f78db1f3d11.jpg,"7,370",60분 이내,중급,3인분,"[('바나나', '2개'), ('설탕', '30g'), ('버터', '30g'), ('럼주', '1큰술'), ('박력분', '125g'), ('버터', '100g'), ('설탕', '80g'), ('베이킹파우더', '1작은술'), ('달걀', '100g'), ('캐머멜리제바나나', '70g'), ('바나나', ''), ('초코소보로', '적당량')]",초코소보로가 듬뿍 달콤함이 가득한 초코소보로 바나나파운드케이크입니다.,"[{'step_number': 1, 'description': '설탕과 버터를 팬에 녹인 후에 바나나를 잘라주세요.', 'image_url': 'https://recipe1.ezmember.co.kr/cache/recipe/2015/06/01/5fc2e01c6c419401f581c4df015cc2b41.jpg'}, {'step_number': 2, 'description': '바나나를 잘라서 넣고 나무주걱으로 잘 저어 섞어주세요 어느정도 캐러멜 색이 나면 럼을 넣어주세요. 럼이 없으시면 청주를 넣어주셔도 좋아요.', 'image_url': 'https://recipe1.ezmember.co.kr/cache/recipe/2015/06/01/44dd88cddfb935eb87164a5a9c9f7a341.jpg'}, {'step_number': 3, 'description': '실온에 놓아둔 버터를 크림화 시킨 후에 설탕을 넣어 섞어주세요.', 'image_url': 'https://recipe1.ezmember.co.kr/cache/recipe/2015/06/01/9e22e63bf9ddf065813b5e09ccbd561c1.jpg'}, {'step_number': 4, 'description': '달걀을 4~5번 나누어 섞어 풍성하게 볼륨을 주세요.', 'image_url': 'https://recipe1.ezmember.co.kr/cache/recipe/2015/06/01/9c6ea4eb9ce8c9c5c7f161952d1e7bb71.jpg'}, {'step_number': 5, 'description': '가루류를 넣어 나누 섞어주세요.', 'image_url': 'https://recipe1.ezmember.co.kr/cache/recipe/2015/06/01/dc15dc188f8293359250a05d4024e5b21.jpg'}, {'step_number': 6, 'description': '나무주걱으로 칼로 자르듯이 섞어 반죽을 만들어 주세요. 미리 만들어 차게 식혀놓은 매러멜리제바나나를 넣고 부드럽게 섞어주세요.', 'image_url': 'https://recipe1.ezmember.co.kr/cache/recipe/2015/06/01/4f98bdc12c92430b1615351aa6caa8a71.jpg'}, {'step_number': 7, 'description': '파운드틀에 버터를 바른 후에 반죽을 담아주신 후에 위에 바나나를 잘라 올려주세요.', 'image_url': 'https://recipe1.ezmember.co.kr/cache/recipe/2015/06/01/5a7fe19015f6f4490a04407b76f7b8c11.jpg'}, {'step_number': 8, 'description': '초코소보로를 듬뿍 올려주세요.\n오븐 170도 20분 구워주 신후에 오븐에 꺼내 칼로 반 가르고 20~30분 더 구워주세요.오븐', 'image_url': 'https://recipe1.ezmember.co.kr/cache/recipe/2015/06/01/63f7305e6ea04ec623e711bc6a45653d1.jpg'}]"
166730,빵,간식,과일류,굽기,애플 소보로 케이크,애플소보로케이크,https://recipe1.ezmember.co.kr/cache/recipe/2015/06/03/5b3639ca52f823b60b6c85b4a84ec3ab1.jpg,"7,885",60분 이내,초급,4인분,"[('사과', '1개'), ('호두분태', '30g'), ('박력분', '100g'), ('베이킹파우더', '5g'), ('레몬즙', '2큰술'), ('달걀', '2개'), ('버터', '60g'), ('설탕                                                                                사과잴때', '30g'), ('설탕', '60g'), ('소보로                                                                                선택', '적당량'), ('슈가파우더', '약간'), ('시나몬파우더', '약간')]",제철과일로 소보로 케익 만들기,"[{'step_number': 1, 'description': '사과는 사방1cm크기로 썰어준비해주신후에 레몬즙과 설탕30g에 절여두었더가 체에 받쳐 물기를 빼주세요', 'image_url': 'https://recipe1.ezmember.co.kr/cache/recipe/2015/06/19/cc2096336db193a15cdfe88ed95e72971.jpg'}, {'step_number': 2, 'description': '볼에 달걀과 설탕을 넣고 뜨거운물을 받쳐 중탕에서 녹여주신후에 볼을 내리고 거품을 뽀얗고 곱게 충분히 내주세요 가루류를 나누어 넣으면서 주걱으로 섞어주세요 가루가 다 섞이면 녹인버터를 천천히 넣으면서 섞어주세요', 'image_url': 'https://recipe1.ezmember.co.kr/cache/recipe/2015/06/19/ee6e807cf66be9cb900ee0fd21a7435e1.jpg'}, {'step_number': 3, 'description': '호두와 사과를 반씩 넣어 섞어주세요', 'image_url': 'https://recipe1.ezmember.co.kr/cache/recipe/2015/06/19/b26e0ed1a18d68486272730e6fa0ecb61.jpg'}, {'step_number': 4, 'description': '타르트틀에 버터를 칠해주시고 반죽을 부어주신후에 반죽을 부어주세요 나머지 사과와 호두를 위에 올려주세요 슈거파우더와 시나몬파우더를 뿌려주신다음 오븐 180도 20~25분 구워주세요~ (오븐사양에따라 시간, 온도 조절해주세요)오븐', 'image_url': 'https://recipe1.ezmember.co.kr/cache/recipe/2015/06/19/93d2aa5e1f3ebfdacdcd03713f4c6ae01.jpg'}]"
166731,빵,간식,과일류,굽기,"바나나 롤 샌드위치만들어요""",바나나롤샌드위치,https://recipe1.ezmember.co.kr/cache/recipe/2016/07/16/480f69ad81d4fd57ed06070cb73afb1c1.jpg,"4,637",30분 이내,아무나,1인분,"[('식빵', '2장'), ('블루베리쨈', '약간'), ('바나나', '1개')]","달콤하고 부드러운샌드위치 디저트로 좋아요.


http://blog.naver.com/ajok10","[{'step_number': 1, 'description': '바나나1개,식빵2장,블루베리쨈약간 블루베리쨈을 넣었어요\n딸기쨈,땅콩버터 취향에 맞게 선택하여 만들면되요.', 'image_url': 'https://recipe1.ezmember.co.kr/cache/recipe/2016/07/16/85d170e14aa8675d268357c16adf6f621.jpg'}, {'step_number': 2, 'description': '식빵은 가장자리는 자르고 밀대로 얇게 밀어주세요.\n밀대가 없으면 병으로 문질러도 됩니다.', 'image_url': 'https://recipe1.ezmember.co.kr/cache/recipe/2016/07/16/b2336a012dfa1ff81bde357674a56dce1.jpg'}, {'step_number': 3, 'description': '바나나는 반으로 잘라주어요.', 'image_url': 'https://recipe1.ezmember.co.kr/cache/recipe/2016/07/16/f6bcbde0deb4803ee657deb31a64a7ee1.jpg'}, {'step_number': 4, 'description': '식빵위에 쨈을 발라주고\n너무 많이 바르면 삐져나오니 적당히 발라주세요.', 'image_url': 'https://recipe1.ezmember.co.kr/cache/recipe/2016/07/16/05d1fc10cd69820ad704d0dc2568b4441.jpg'}, {'step_number': 5, 'description': '쨈바른 식빵위에 바나나를 올려 돌돌 말아주면 됩니다.', 'image_url': 'https://recipe1.ezmember.co.kr/cache/recipe/2016/07/16/a6e8ef4dd5fb19085a580985a8e0d1711.jpg'}, {'step_number': 6, 'description': '요렇게 돌돌말아 랩으로 싼 다음 자르면 이쁘게 만들어지는데요', 'image_url': 'https://recipe1.ezmember.co.kr/cache/recipe/2016/07/16/ffeb55ab36c29efd716f9f2cec7ce17d1.jpg'}]"
166732,빵,간식,과일류,굽기,사과피자 만들기,사과피자,https://recipe1.ezmember.co.kr/cache/recipe/2015/06/21/f48767d040cff831cfaf0854b2df912c.jpg,"20,851",None,None,None,"[('사과', ''), ('또띠아', ''), ('피자치즈', ''), ('호두', ''), ('꿀', '')]","제철 과일 사과를 활용한 사과피자 만들기입니다. 만들기도 아주 간단하고 칼로리도 일반 피자에 비해 월등히 낮아 간식으로든, 야식으로든 모두 부담없이 드실수 있을거에요.","[{'step_number': 1, 'description': '사과는 껍질채 깨끗이 씻어 채썰어 준비합니다.', 'image_url': 'https://recipe1.ezmember.co.kr/cache/recipe/2015/06/22/49e26aac220437f775556ad7e120a5cc1.jpg'}, {'step_number': 2, 'description': '호두는 굵직하게 다져 준비해줍니다.', 'image_url': 'https://recipe1.ezmember.co.kr/cache/recipe/2015/06/22/ec7d465d04e2237b3b892c8e3f2144f11.jpg'}, {'step_number': 3, 'description': '또띠아 위에 피자치즈를 조금 올려준후 한장의 또띠아를 겹쳐주세요.', 'image_url': 'https://recipe1.ezmember.co.kr/cache/recipe/2015/06/22/c37624a5856fb443df595452589082491.jpg'}, {'step_number': 4, 'description': '윗면의 또띠아에 피자소스 대신 꿀을 발라줍니다.', 'image_url': 'https://recipe1.ezmember.co.kr/cache/recipe/2015/06/22/b21d41b3c3d839be8fb2485143f781261.jpg'}, {'step_number': 5, 'description': '그리고, 피자치즈를 조금 펼쳐 올린후 채썬 사과와 다진 호두를 듬뿍 올려주세요.', 'image_url': 'https://recipe1.ezmember.co.kr/cache/recipe/2015/06/22/9611d439a657d97dae88c52fa7a93e6c1.jpg'}, {'step_number': 6, 'description': '마지막으로 피자치즈를 듬뿍 올려줍니다.', 'image_url': 'https://recipe1.ezmember.co.kr/cache/recipe/2015/06/22/7db7358af2e0dabaad7d3361dea4404d1.jpg'}, {'step_number': 7, 'description': '위에 사과를 얇게 슬라이스해서 올려주었어요.', 'image_url': 'https://recipe1.ezmember.co.kr/cache/recipe/2015/06/22/81865592b8c13b11c677d8493a40db861.jpg'}, {'step_number': 8, 'description': '예열한 200도 오븐에서 15분정도 구워줍니다.오븐', 'image_url': 'https://recipe1.ezmember.co.kr/cache/recipe/2015/06/22/d5636b3d04143056c750761d409e60bf1.jpg'}, {'step_number': 9, 'description': '완성된 사과피자입니다.', 'image_url': 'https://recipe1.ezmember.co.kr/cache/recipe/2015/06/22/05800f26f1ac9abac9490d234a000bbb1.jpg'}]"
166733,빵,간식,과일류,굽기,디저트 레시피 #크랜베리파이,크랜베리파이,https://recipe1.ezmember.co.kr/cache/recipe/2016/11/22/f5bb5fe3e908f6373f9afbcfed3aac111.jpg,"1,312",15분 이내,초급,2인분,"[('파이반죽', ''), ('크랜베리', ''), ('체리', ''), ('크랜베리소스', ''), ('바닐라에센스', '')]","안녕하세요, 그노마미에요~
새콤한 게 땡긴다고 하니까 딸 생기는 거 아니냐고~
우스운 소리를 들었던!
크랜베리파이 레시피입니당~ㅎㅎ","[{'step_number': 1, 'description': '크랜베리파이 만들기 첫번째~\n오븐을 예열하고~\n큰 그릇에 크랜베리와 체리, 크랜베리 필링, \n바닐라에센스를 잘 섞어줍니다~', 'image_url': 'https://recipe1.ezmember.co.kr/cache/recipe/2016/11/22/051aa48fe9dcb0be9d7f05e2eb143ce81.jpg'}, {'step_number': 2, 'description': '크랜베리파이 만들기 두번째~\n미리 준비한 파이반죽에\n섞어놓은 크랜베리 소스를 채워줍니다~\n저는 반죽만들기 귀찮아서\n시중에 파는 타르트를 구입해서 사용했어요 ㅎㅎ', 'image_url': 'https://recipe1.ezmember.co.kr/cache/recipe/2016/11/22/f99f56649004768824a4297bb11c2ddb1.jpg'}, {'step_number': 3, 'description': '크랜베리파이 만들기 세번째~\n파이는 역시 격자로 해야죠 ㅎㅎ\n이제 오픈에 굽기만 하면 끝!오븐', 'image_url': 'https://recipe1.ezmember.co.kr/cache/recipe/2016/11/22/f1e0aa9bdb1e5b3d63fbe60a9c4f6f8b1.jpg'}, {'step_number': 4, 'description': '크랜베리파이 만들기 네번째~\n오븐에서 잘 익은 파이를\n조심스럽게 꺼냅니다 ㅎㅎ\n접시에 예쁘게 담아서 데코를 해주면 끝!', 'image_url': 'https://recipe1.ezmember.co.kr/cache/recipe/2016/11/22/1da63d07e7aac535181785f75d28ccdb1.jpg'}]"
166734,빵,간식,과일류,굽기,블루베리 피자,블루베리피자,https://recipe1.ezmember.co.kr/cache/recipe/2015/06/18/e718307c2373dec824ca6228d187d87e.jpg,"12,523",30분 이내,초급,2인분,"[('블루베리', '1C'), ('설탕', '1-2T'), ('또띠아', '2장'), ('피자치즈', '3줌')]",요즘 건강에 좋다는 음식 선호하고 특히 블루베리는 눈에 좋다고 해 눈의 피로가 심한 사람들은 블루베리 보조식품도 많이 드시더라구요 ..​ 블루베리피자에 모짜렐라 피자치즈를 올리지만 티라미슈 만들 때 사용하는 마스카포네 치즈나 크림치즈를 발라도 고소하게 맛있답니다,"[{'step_number': 1, 'description': '또띠아 한장에 피자치즈를 원하는만큼 솔솔~~~ 또띠아 한장으로만 만들면 너무 얇아 힘을 못받아요', 'image_url': 'https://recipe1.ezmember.co.kr/cache/recipe/2015/06/18/9394ba8052ccb2eea22cd17425a37dad1.jpg'}, {'step_number': 2, 'description': '다시 또띠아 한장을 올리고 크림치즈를 펴 바릅니다 .', 'image_url': 'https://recipe1.ezmember.co.kr/cache/recipe/2015/06/18/b225d979273458d372cea517099713e31.jpg'}, {'step_number': 3, 'description': '졸여둔 블루베리를 원하는만큼 펼칩니다. 하지만 너~~무 많이 펼치면 구워지면서 블루베리 즙이 흘러내려요', 'image_url': 'https://recipe1.ezmember.co.kr/cache/recipe/2015/06/18/41ca68e4ce407866a718f43955ea27621.jpg'}, {'step_number': 4, 'description': '또 다시 모자렐라 피자치즈 듬뿍~~~ 치즈가 녹을 수 있는 오븐 온도 전, 220도에서 17분 구웠습니다. 이렇게 기다리는 시간은 왜 그리 긴지...오븐', 'image_url': 'https://recipe1.ezmember.co.kr/cache/recipe/2015/06/18/062e5c4c35cf225569d7ee05c2b48b711.jpg'}, {'step_number': 5, 'description': '드디어 세상밖으로 블루베리 피자가 쓩~~~ 나왔습니당~~ 블루베리 향이 은은한게.... 블루베리를 구울 수도 있다는게....', 'image_url': 'https://recipe1.ezmember.co.kr/cache/recipe/2015/06/18/185ad2a326990a375914deb8a1d3bfd11.jpg'}]"
166735,빵,간식,과일류,굽기,[레시피/홈베이킹] 극강의 달콤함! 애플크럼블파이 만들기,애플크럼블파이,https://recipe1.ezmember.co.kr/cache/recipe/2022/06/21/ea66b4be61db301c494126f88ff161c81.jpg,441,60분 이내,초급,6인분 이상,"[('크로와상 생지', '4개'), ('사과', '3개'), ('황설탕', '165g'), ('밀가루중력분', '65g'), ('시나몬가루', '1.5t'), ('버터', '74g')]","사과의 달콤함을 극대화해서 느낄 수 있는
애플크럼블파이를 만들어봤어요^^
달콤하고 바삭한 애플크럼블파이, 스트레스 받는 날 달달함으로 다 잊을 수 있는 이 레시피! 공유드려요!","[{'step_number': 1, 'description': '재료 준비 먼저 볼게요!\n매우 간단하죠?\n냉동파이생지가 있다면 훨씬 쉽게 만들 수 있을텐데, 저희는 집에 있어 크로와상생지를 활용했어요!', 'image_url': 'https://recipe1.ezmember.co.kr/cache/recipe/2022/06/21/2ff3bca5bde700874bc93bc32d042c121.jpg'}, {'step_number': 2, 'description': '먼저 바삭, 달콤을 담당해줄 크럼블을 만들어볼게요!\n너무 간단해서 절차랄 것도 사실 없어요^^\n시나몬가루, 중력분, 황설탕, 버터를 모조리 넣고 믹서기에 갈아줍니다!', 'image_url': 'https://recipe1.ezmember.co.kr/cache/recipe/2022/06/21/085a0c4da01f9d4c968a358d3cbc39311.jpg'}, {'step_number': 3, 'description': '갈아주면 이런 비주얼이 됩니다^^\n달콤하고 바삭바삭하게 구워질 크럼블 만들기는 완성이예요!\n나중에 파이를 구우면서 파이 아래, 위 꼼꼼하게 채워줄거라 한켠에 잠시 두면 됩니다!', 'image_url': 'https://recipe1.ezmember.co.kr/cache/recipe/2022/06/21/7247601554e7f1dbf73955ed342112b91.jpg'}, {'step_number': 4, 'description': '이제 파이의 대부분을 차지할 사과를 손질해줄게요! 깨끗하게 세척한 사과는 껍질을 벗겨주고, 편썰기 좋은 크기로 1차 썰어둡니다!사과 손질법 레시피', 'image_url': 'https://recipe1.ezmember.co.kr/cache/recipe/2022/06/21/9b57a4a511b7ef55c5c27b2b8988865a1.jpg'}, {'step_number': 5, 'description': '파이 속이 될 예정이기 때문에 얇게 저미듯 썰어주는게 포인트예요!^^', 'image_url': 'https://recipe1.ezmember.co.kr/cache/recipe/2022/06/21/6061c5814de77857dfbf38c4afa0fa161.jpg'}, {'step_number': 6, 'description': '이렇게 가지런히 정리된 파이 재료들^^\n얇게 썬 사과, 크럼블, 그리고 적당히 해동한 크로와상생지!', 'image_url': 'https://recipe1.ezmember.co.kr/cache/recipe/2022/06/21/0648c600421f12be503abdbfae4b80da1.jpg'}, {'step_number': 7, 'description': '파이지로 변신시켜야 할 크로와상생지는 2개를 하나로 뭉쳐서 넓게 펴줍니다!', 'image_url': 'https://recipe1.ezmember.co.kr/cache/recipe/2022/06/21/679a72b0dad25299f1ee7b145dfc868d1.jpg'}, {'step_number': 8, 'description': '2개의 생지를 뭉쳐서 베이킹 도구로 밀어주면 대략 이런 너비로 펼쳐집니다!', 'image_url': 'https://recipe1.ezmember.co.kr/cache/recipe/2022/06/21/73d145cdb52d9c99708fd9971d2283481.jpg'}, {'step_number': 9, 'description': '집에 있던 파운드케이크틀을 활용했는데요~ 유산지를 깔아주고 먼저 크로와상생지를 아래, 옆면에 고루 밀착시켜줍니다. 파이의 틀을 만들어 주신다고 생각하면 됩니다^^', 'image_url': 'https://recipe1.ezmember.co.kr/cache/recipe/2022/06/21/02f4a85e18ceb1435ca01df61d1a01991.jpg'}, {'step_number': 10, 'description': '그 위에 적당히 크럼블을 깔아 올려줍니다^^', 'image_url': 'https://recipe1.ezmember.co.kr/cache/recipe/2022/06/21/6fbb7554693c2a01fccffd5f55c368ad1.jpg'}, {'step_number': 11, 'description': '얇게 저며두었던 사과를 아주 넉넉히!!! 가득 올려주고, 제일 위에도 크럼블로 덮어주세요!', 'image_url': 'https://recipe1.ezmember.co.kr/cache/recipe/2022/06/21/0e93c050274a7d5d7d7b63aea7316d031.jpg'}, {'step_number': 12, 'description': '이제 이 상태로 에어프라이어에 넣고 180도에 1시간 가량 구워주는데, 크럼블이랑 사과가 타버리는 걸 방지하기 위해서 30분 정도 쯤에 한번 꺼내어 호일로 덮어서 다시 30분을 마저 구워주면 타지 않고 바삭한 파이를 만들 수 있어요!에어프라이어', 'image_url': 'https://recipe1.ezmember.co.kr/cache/recipe/2022/06/21/10978b38d7c2c22ebf2f278a3248766d1.jpg'}, {'step_number': 13, 'description': '굽는 내내 집에 달콤한 사과와 시나몬 향이 가득 퍼지더라구요~^^\n다 구워져 꺼내 본 애플크럼블파이!', 'image_url': 'https://recipe1.ezmember.co.kr/cache/recipe/2022/06/21/70f02373e02fadfd22078437a345eca21.jpg'}, {'step_number': 14, 'description': '다행히 크로와상생지가 파이틀로서의 역할을 잘 해주고 있어서 무너지지 않았더라구요^^', 'image_url': 'https://recipe1.ezmember.co.kr/cache/recipe/2022/06/21/0c1a28d7aec654a53e0fb6db4525fb761.jpg'}, {'step_number': 15, 'description': '한 겹 썰어보면 이렇게 사과가 층층이 쌓여 단맛을 아주 강하게 내어주고, 크럼블은 달콤 바삭해서 정말 기분 좋은 달콤함이 가득했어요!', 'image_url': 'https://recipe1.ezmember.co.kr/cache/recipe/2022/06/21/828eb656d9c72ec587bb3bdad8aec6031.jpg'}, {'step_number': 16, 'description': '따뜻할 때 이렇게 애플크럼블파이만 먹어도 좋고, 아이스크림이나 커피를 곁들여먹어도 궁합이 너무 좋은 애플크럼블파이!\n다들 스트레스를 확! 날리고 싶을 정도로 달달한 음식이 당길 때 간단하게 애플크럼블파이 만들어보시면 좋을 것 같아요^^', 'image_url': 'https://recipe1.ezmember.co.kr/cache/recipe/2022/06/21/4c63676f4b5279572cadb7cbb561e9aa1.jpg'}]"
166736,빵,간식,과일류,굽기,알러지 걱정 No! 비건 글루텐프리 무설탕 바나나 찹쌀빵 만들기,찹쌀빵,https://recipe1.ezmember.co.kr/cache/recipe/2022/07/05/8542bd981c9e6fc8a74679f1e43034c71.jpg,"1,398",30분 이내,초급,1인분,"[('바나나', '75g'), ('쌀가루', '30g'), ('찹쌀가루', '10g'), ('코코넛오일', '5g'), ('무첨가 두유', '5g')]","계란, 글루텐 알러지가 있는 분들을 위해, 우리 아이를 위해 담백하게, 건강하게 만든 비건 글루텐프리 바나나 찹쌀빵입니다.","[{'step_number': 1, 'description': '바나나 껍질을 벗기고 코코넛 오일과 함께 한 볼에 담아주세요.잘 익지 않은 바나나는 당도도 낮고 아이들한테는 변비가 생길 수 있어서 숙성이 잘 돼서 바나나 껍질에 갈색 반점이 생긴 무른 바나나로 하면 달고 맛있어요.', 'image_url': 'https://recipe1.ezmember.co.kr/cache/recipe/2022/07/05/bce034988779b32b446fd8c7ca8ec4741.jpg'}, {'step_number': 2, 'description': '한 볼에는 쌀가루와 찹쌀가루를 담아 주시고, 한 볼에는 두유를 준비해주세요.', 'image_url': 'https://recipe1.ezmember.co.kr/cache/recipe/2022/07/05/928fcbc94157a08ff883e71d48adfbf21.jpg'}, {'step_number': 3, 'description': '바나나와 코코넛오일을 섞으면서 바나나를 포크를 이용해서 으깨주세요. 약간의 덩어리가 있어도 괜찮아요!', 'image_url': 'https://recipe1.ezmember.co.kr/cache/recipe/2022/07/05/4728299b74b2d2e9757bf28c54ad17651.jpg'}, {'step_number': 4, 'description': '잘 섞은 바나나와 코코넛오일에 가루류(찹쌀가루+쌀가루)를 골고루 섞어주세요.', 'image_url': 'https://recipe1.ezmember.co.kr/cache/recipe/2022/07/05/3489c8b795f6d0174c4d80f1c61870731.jpg'}, {'step_number': 5, 'description': '마지막으로 반죽 상태를 보시고 두유 5g을 추가해주시면 돼요.만약 먹다 남은 바나나를 냉동해 놓았거나 바나나가 너무 익어서 수분이 많이 함유하고 있는 바나나는 두유를 추가하기 전에 반죽상태를 보고 생략하셔도 되고요. 너무 수분이 없는 바나나는 두유를 좀 더 추가하셔도 돼요!', 'image_url': 'https://recipe1.ezmember.co.kr/cache/recipe/2022/07/05/2c07e7b77632bc565768a062d3ccfcdb1.jpg'}, {'step_number': 6, 'description': '마지막으로 오븐팬에 기름칠(코코넛오일 또는 포도씨유 등) 을 한 후에 잘 섞은 반죽을 넣어주세요.저는 아기가 먹기 편하게 바통팬을 이용했어요. 바통팬이 없다면 반죽이 많이 들어가지 않는 얇은 팬인 휘낭시에팬도 괜찮아요!', 'image_url': 'https://recipe1.ezmember.co.kr/cache/recipe/2022/07/05/dd2fae36326dd14f0e16800ffe4a236e1.jpg'}, {'step_number': 7, 'description': '180도에서 10분이상 예열한 오븐에 넣고170도에서 약 20분 구우면 돼요.오븐오븐마다 구워지는 온도는 달라요! 처음 구울 때는 중간중간 온도체크 해주세요!!', 'image_url': 'https://recipe1.ezmember.co.kr/cache/recipe/2022/07/05/8ed0dc317442e438c3e7acee32c91e811.jpg'}]"
