index,종류별,상황별,재료별,방법별,글 제목,레시피이름,레시피이미지,조회수,조리시간,난이도,인분,재료,소개글,조리순서
1636,밑반찬,일상,채소류,볶음,"브로콜리무침 제발 데치지 마세요 ❌ 혈당조절, 섬유질 풍부한 브로콜리 10배 더 효과적으로 드세요 ‼️",브로콜리무침,https://recipe1.ezmember.co.kr/cache/recipe/2023/07/05/87b0a685ee1f5297fbdbd88584c51f3c1.jpg,"1,539",15분 이내,아무나,2인분,"[('브로콜리', '1송이'), ('양파', '1/4개'), ('마늘', '1작은술'), ('참깨가루', '2큰술'), ('진간장', '1/2큰술'), ('올리고당', '1/2큰술'), ('매실액', '1큰술'), ('소금', '2~3꼬집'), ('마요네즈', '3큰술')]",혈당을 낮게 유지시켜주고 과식을 막아주는 섬유질이 풍부해 다이어트에도 도움을 주는 브로콜리랍니다,"[{'step_number': 1, 'description': '브로콜리는 물에 10분간 담가 주세요 세척 후 먹기 좋은 크기로 썰어요', 'image_url': 'https://recipe1.ezmember.co.kr/cache/recipe/2023/07/05/501b96b83d50b576b6f509c3b52e37fd1.jpg'}, {'step_number': 2, 'description': '양파 1/4개 잘게 다져 물에 담가주고', 'image_url': 'https://recipe1.ezmember.co.kr/cache/recipe/2023/07/05/4472980e8a12e2e6be1fce801f094eec1.jpg'}, {'step_number': 3, 'description': '참치는 기름을 빼주세요', 'image_url': 'https://recipe1.ezmember.co.kr/cache/recipe/2023/07/05/0f885b44b1008bad36cae2dc40ec91561.jpg'}, {'step_number': 4, 'description': '분량의 양념장을 잘 섞어요 참깨가루 2큰술, 진간장 1/2큰술 올리고당 1/2큰술, 매실액 1큰술 소금 2~3꼬집, 마요네즈 3큰술', 'image_url': 'https://recipe1.ezmember.co.kr/cache/recipe/2023/07/05/8d19ea50c502e010326b0b38cd4a7e441.jpg'}, {'step_number': 5, 'description': '팬에 올리브유를 두른 후 브로콜리를 볶아요 소금 2~3꼬집, 마늘 1작은술 넣어 볶아주세요', 'image_url': 'https://recipe1.ezmember.co.kr/cache/recipe/2023/07/05/cb3d8a8a3778739b9849ad9b717c99061.jpg'}, {'step_number': 6, 'description': '볶은 브로콜리 한김 식힌 후 참치, 양파, 마요참깨소스 넣어 잘 섞어주면 완성입니다', 'image_url': 'https://recipe1.ezmember.co.kr/cache/recipe/2023/07/05/6d79b05ce87b8f5afa5e967818e64f111.jpg'}]"
1637,밑반찬,일상,채소류,볶음,취향저격 야매중국요리♪ 지삼선 / 가지감자볶음,가지감자볶음,https://recipe1.ezmember.co.kr/cache/recipe/2018/01/05/6fbe2f9f4e28ce9195d912eb930bea021.jpg,"43,955",30분 이내,아무나,3인분,"[('가지', '1개'), ('감자', '1개'), ('피망', '1개'), ('기름', '적당량'), ('마늘', '2-3알'), ('소금', '약간'), ('물', '1/3컵'), ('간장', '1T'), ('굴소스', '1T'), ('설탕', '0.5t'), ('물', '5-6T'), ('전분가루', '4T')]",가지와 감자와 피망을 볶아 만든 지삼선 / 가지감자볶음입니다:),"[{'step_number': 1, 'description': '분량의 재료를 준비해주세요. 감자는 약 1cm 두께로 썰고 가지는 연필깍이 썰기 해주세요. 피망도 먹기 좋은 크기로 썰어주세요.가지, 감자, 피망저는 피망을 안 좋아해서 아삭이 고추로 대체했어요.', 'image_url': 'https://recipe1.ezmember.co.kr/cache/recipe/2018/01/05/e59b9db9729820bca175ec1a022050421.jpg'}, {'step_number': 2, 'description': '분량의 양념장 재료를 잘 섞어주세요.물 1/3컵, 간장 1T, 굴소스 1T, 설탕 0.5t', 'image_url': 'https://recipe1.ezmember.co.kr/cache/recipe/2018/01/05/6b88d129b122aeacd6692f6448ae52261.jpg'}, {'step_number': 3, 'description': '물과 전분가루를 전분물도 준비해 주세요.물 5-6T, 전분가루 4T', 'image_url': 'https://recipe1.ezmember.co.kr/cache/recipe/2018/01/05/fb5016fe419c72197670a12691386cdb1.jpg'}, {'step_number': 4, 'description': '원래 감자와 가지는 튀겨야 하지만 저는 감자는 오일을 조금 발라 에어 후라이기에 넣었어요. 대신 팬에 기름을 두르고 감자를 넣어 중불에서 감자를 익혀주셔도 좋아요.감자, 기름중불', 'image_url': 'https://recipe1.ezmember.co.kr/cache/recipe/2018/01/05/e79eb45a262e345cc0e06d44da69c77e1.jpg'}, {'step_number': 5, 'description': '감자는 이렇게 노릇하게 익혀주세요. \n가지는 마른 팬에 겉면이 노릇노릇하도록 구워주세요.전 가지도 에어후라이기를 사용했어요', 'image_url': 'https://recipe1.ezmember.co.kr/cache/recipe/2018/01/05/9859a04b961caed7132a9c3b7aaf478b1.jpg'}, {'step_number': 6, 'description': '팬에 기름 2-3T 두르고 편 썬 마늘을 넣어 약불에서 볶아주세요.기름 2-3T, 편 썬 마늘약불', 'image_url': 'https://recipe1.ezmember.co.kr/cache/recipe/2018/01/05/bffec8c9d09efd7465c14a962f6aa1001.jpg'}, {'step_number': 7, 'description': '마늘이 노릇해지면 피망(저는 아삭이 고추를 넣었어요)을 넣어 센불에서 약 30초간 볶아주세요.피망센불', 'image_url': 'https://recipe1.ezmember.co.kr/cache/recipe/2018/01/05/37b2b47a1af6ffcddd26e94ad0537d101.jpg'}, {'step_number': 8, 'description': '그리고 아까 만들어놓은 양념장을 넣어주세요.양념장센불', 'image_url': 'https://recipe1.ezmember.co.kr/cache/recipe/2018/01/05/9624ef7a7ad99ca83ebed252507fa26d1.jpg'}, {'step_number': 9, 'description': '양념장이 이렇게 끓어오르면센불', 'image_url': 'https://recipe1.ezmember.co.kr/cache/recipe/2018/01/05/b3fded0ec555dd6e2b1e43444e29928a1.jpg'}, {'step_number': 10, 'description': '구운 가지와 감자를 넣어 양념장이 반정도로 줄때까지 뒤적여가며 졸여주세요.가지, 감자센불', 'image_url': 'https://recipe1.ezmember.co.kr/cache/recipe/2018/01/05/b8017f92b2d6c673c49664df89b834611.jpg'}, {'step_number': 11, 'description': '마지막으로 전분물을 넣어 농도를 맞추고 부족한 간은 소금으로 맞춰주세요.전분물, 소금센불전분물은 조금씩 넣어 저어가며 농도를 맞춰주세요.', 'image_url': 'https://recipe1.ezmember.co.kr/cache/recipe/2018/01/05/171f1556849d606a8a3d4b442b1e0f4d1.jpg'}]"
1638,밑반찬,일상,채소류,볶음,꽈리고추 어묵볶음,꽈리고추어묵볶음,https://recipe1.ezmember.co.kr/cache/recipe/2018/09/20/ffb61aba713fb69dbe5c3101001f3a961.jpg,"24,603",30분 이내,아무나,2인분,"[('어묵', '2장'), ('꽈리고추', '2줌'), ('간장', '1스푼'), ('마늘', '5쪽'), ('올리고 당', '1스푼'), ('맛술', '1스푼'), ('참기름', '0.5스푼'), ('통깨', '0.5스푼'), ('후춧가루', '적당히')]",반찬,"[{'step_number': 1, 'description': '꽈리고추는 꼭지를 따주고', 'image_url': 'https://recipe1.ezmember.co.kr/cache/recipe/2018/09/20/bc1522216eb9b0f70e6b671aea36e8f91.jpg'}, {'step_number': 2, 'description': '물에 씻어 주세요.', 'image_url': 'https://recipe1.ezmember.co.kr/cache/recipe/2018/09/20/01864e5e420d41544edd41bdf4e635741.jpg'}, {'step_number': 3, 'description': '사각어묵은 꽈리고추와 볶았을 때 잘 어울리게 썰어주고\n씻어 놓은 꽈리고추는 반으로 잘라 사용하거나\n양념이 잘 배도록 포크로 콕콕 찍어 준비합니다.', 'image_url': 'https://recipe1.ezmember.co.kr/cache/recipe/2018/09/20/24e6161f5ef7fe2afd846b29e3092f421.jpg'}, {'step_number': 4, 'description': '마늘 5쪽을 썰어\n달군 팬에 기름을 두르고 달달 볶아 마늘향을 내주세요.', 'image_url': 'https://recipe1.ezmember.co.kr/cache/recipe/2018/09/20/a09e3e48f7d7f75c5efe309c5b0a00f71.jpg'}, {'step_number': 5, 'description': '마늘이 잘 볶아지면\n준비해 놓은 어묵, 꽈리고추를 넣고 같이 볶아 줍니다.', 'image_url': 'https://recipe1.ezmember.co.kr/cache/recipe/2018/09/20/e5e227905b6445a3d2bdb1974df85e401.jpg'}, {'step_number': 6, 'description': '이때 센 불에서 볶으면 탈수 있으니\n불을 줄이고 나서\n양념재료인 간장 1, 맛술 1, 올리고 당 1, 참기름 0.5,\n통깨 0.5, 후춧가루 적당량을 넣어 고루 볶아주세요.', 'image_url': 'https://recipe1.ezmember.co.kr/cache/recipe/2018/09/20/e3b05270607e7626324ab3d3d67163a71.jpg'}, {'step_number': 7, 'description': '꽈리고추 어묵볶음 완성 ^^', 'image_url': 'https://recipe1.ezmember.co.kr/cache/recipe/2018/09/20/7caddc80e93a389bf9876d44daeb3ce31.jpg'}]"
1639,밑반찬,일상,채소류,볶음,"깻잎 식용유로 튀기지 말고, 이것넣어 건강하게!! 매우 쉬운 깻잎 자반(깻잎 후레이크)",깻잎자반,https://recipe1.ezmember.co.kr/cache/recipe/2021/07/21/8c7474867155c68a493cec0c7ef88c881.jpg,"3,701",15분 이내,초급,2인분,"[('깻잎', '50장'), ('홍고추', '1개'), ('올리브유', '5T'), ('통깨', '2T'), ('소금', '1/2t')]","건강에도 아주 좋은 깻잎!! 깻잎 김치 식상하셨나요?!
기름에 튀기지 않고 올리브유를 넣어 볶아주면, 김자반과는 또 다른 향긋한 깻잎자반입니다, 밑반찬으로도 아주 좋고,입맛 없는 부모님 할머니 주먹밥처럼 간식으로 해드리면 맛있다고 칭찬해주는 레시피입니다^^","[{'step_number': 1, 'description': '깻잎 50장은 깨끗하게 씻어 물기를 닦아준 다음,\n채 썰어줍니다.', 'image_url': 'https://recipe1.ezmember.co.kr/cache/recipe/2021/07/21/21a6ef06a97136e8efbf8c545077bff31.jpg'}, {'step_number': 2, 'description': '홍고추 1개는 반으로 가른뒤 잘게 다져줍니다', 'image_url': 'https://recipe1.ezmember.co.kr/cache/recipe/2021/07/21/217036f12b329a4a87e7d0199caf089b1.jpg'}, {'step_number': 3, 'description': '넓은 볼에 채썬 깻잎,홍고추를 넣어준 다음,\n올리브유 5 T / 소금 1/2 t / 통깨 1 T 를 넣어 섞어줍니다', 'image_url': 'https://recipe1.ezmember.co.kr/cache/recipe/2021/07/21/4c0f42f1998c07e4d054114ae7895de31.jpg'}, {'step_number': 4, 'description': '잘 버무려준 깻잎은 후라이팬에 넣어줍니다', 'image_url': 'https://recipe1.ezmember.co.kr/cache/recipe/2021/07/21/eda9265bba7f23b82bac8a6f91d562e81.jpg'}, {'step_number': 5, 'description': '약불에서 숨이 죽을때까지 약 5분정도 볶아줍니다', 'image_url': 'https://recipe1.ezmember.co.kr/cache/recipe/2021/07/21/5b4fc99d1bc5ba8d96ca579b8c1fc7411.jpg'}, {'step_number': 6, 'description': '수분이 어느정도 빠져 나가면, 약불로 바삭해지도록 \n5분~7분정도 덖어줍니다', 'image_url': 'https://recipe1.ezmember.co.kr/cache/recipe/2021/07/21/1a0527c3e2daad191223decda41676b51.jpg'}, {'step_number': 7, 'description': '바삭해지면 불을 꺼주시면 김자반보다 맛있고 깻잎 향이\n가득한 깻잎자반 완성입니다', 'image_url': 'https://recipe1.ezmember.co.kr/cache/recipe/2021/07/21/dc9b2636c17ad3652801595d0d107cdf1.jpg'}, {'step_number': 8, 'description': '뜨거운 밥에 그냥 먹어도 맛있지만, 이렇게 주먹밥으로\n드셔도 간식으로 아주 맛있습니다!!', 'image_url': 'https://recipe1.ezmember.co.kr/cache/recipe/2021/07/21/9b853bceabab1e14594bb6024135f40b1.jpg'}]"
1640,밑반찬,일상,채소류,볶음,부서지지 않고 쉽게 감자채볶음 만드는 방법(김진옥요리가좋다),감자채볶음,https://recipe1.ezmember.co.kr/cache/recipe/2019/04/04/d222a221f288e6d4c4e3f020aa4765fb1.jpg,"38,896",20분 이내,아무나,4인분,"[('감자', '2개'), ('양파', '1/2개'), ('다진파', '1T'), ('식용유', '2T'), ('고운소금', '1/2T'), ('다진마늘', '1/3T'), ('후춧가루', '소량'), ('깨', '')]","안녕하세요. 김진옥입니다.
요즘 햇감자 많이 나왔죠??
햇감자로 맛있는 감자채볶음 만들어보세요~~
감자채볶음 만들때 부서지지 않게 만드는법~~
바로 소금에 감자를 20분정도 절인후 볶아줍니다.
재료: 감자2개(큰사이즈). 양파1/2개. 다진파1T. 식용유2T. 소금1/2T. 다진마늘1/3T. 깨.후춧가루소량
**저의 계량은 밥숟가락 한숟가락이 1T입니다~","[{'step_number': 1, 'description': '1. 감자는 큰사이즈로 2개 준비후...0.5cm두께로 채썰어줍니다.\n양파1/2개도 0.5cm두께로 채썰어줍니다.', 'image_url': 'https://recipe1.ezmember.co.kr/cache/recipe/2019/04/04/cd36f2bfe1eb4c2dec45ce15bc0d1f921.png'}, {'step_number': 2, 'description': '2. 채썬 감자채를 찬물에 담궈 녹말기를 제거후~\n소쿠리에 받쳐 물기를 제거합니다.', 'image_url': 'https://recipe1.ezmember.co.kr/cache/recipe/2019/04/04/903c5c2f7afac3587b16c64647d7b7d71.png'}, {'step_number': 3, 'description': '3. 감자채를 볶음팬에 넣고 고운소금1/2T를 골고루 뿌려준후...20분동안 절여줍니다.\n==> 이렇게 소금에 절인후...감자채볶음을 하면 부서지지 않습니다.', 'image_url': 'https://recipe1.ezmember.co.kr/cache/recipe/2019/04/04/55a008124204ec9663bb4f06332e65dc1.png'}, {'step_number': 4, 'description': '4. 20분절인 감자채에서 자연스럽게 물이 나올겁니다. 이물은 버리지 말고..그대로..감자채볶음을 만들어줍니다.\n(따로 물을 넣지 않아도 됩니다).\n절인 감자채에...다진마늘1/3T.식용유2T. 후춧가루소량을 넣고... 뚜껑을 덮고 중약불에서 6~7분정도 볶아줍니다.\n(중간중간 뒤적여줍니다)', 'image_url': 'https://recipe1.ezmember.co.kr/cache/recipe/2019/04/04/9bc3bdfb1fe24bbbcd04063110d6b5de1.png'}, {'step_number': 5, 'description': '5. 6~7분후 감자가 익으면 다진파1T를 넣고 한번만 뒤적인후..마지막으로 깨를 뿌려주면 완성입니다.', 'image_url': 'https://recipe1.ezmember.co.kr/cache/recipe/2019/04/04/4cc2aa73d39bc2f5d05f6bff55cd09481.png'}]"
1641,밑반찬,일상,채소류,볶음,무나물 부서지지 않게 만드는 세가지 팁~,무나물,https://recipe1.ezmember.co.kr/cache/recipe/2020/08/09/4ba43754770976175377a40ad093b2111.jpg,"6,588",30분 이내,아무나,4인분,"[('무                                                                                350g', '1/4개'), ('대파 흰대', '5cm'), ('소금', '0.5숟가락'), ('식용유', '1숟가락'), ('다진마늘', '0.5숟가락'), ('물 반컵', '100ml'), ('국간장', '0.5숟가락'), ('들깨가루', '2숟가락'), ('들기름', '1숟가락'), ('소금', '2꼬집'), ('후추', '약간')]",속 편한 반찬 중 하나인 무나물은 일년 내내 즐길 수 있죠~ 간단한 팁 세가지만 알면 무가 부서지지 않아 깔끔한 무나물을 만들 수 있답니다^^ 시작할게요~,"[{'step_number': 1, 'description': '무나물을 부서지지 않게 만들려면 써는 방법이 중요한대요~ 무를 세워서 즉, 자라는 방향으로 잘라주시면 됩니다.\n결이 눈에 보이기 때문에 어렵지 않으실 거예요~ 0.5cm 두께로 결대로 잘라주세요.', 'image_url': 'https://recipe1.ezmember.co.kr/cache/recipe/2020/08/09/a31bb7d1fa7bd4aa7312933e38f1e7651.jpg'}, {'step_number': 2, 'description': '허접한 그림이지만 이해를 도와봅니다 ^^', 'image_url': 'https://recipe1.ezmember.co.kr/cache/recipe/2020/08/09/54df3a8357822fb4a7f9cd8f413966681.jpg'}, {'step_number': 3, 'description': '웍에 채썬 무를 담고 소금 반스푼을 고루 섞어 20분간 절여주세요. 이렇게 절여주면 무가 쉽게 부서지지 않는답니다', 'image_url': 'https://recipe1.ezmember.co.kr/cache/recipe/2020/08/09/1df0bfaa72a58952ad119fe6ee3bc46b1.jpg'}, {'step_number': 4, 'description': '무를 절이는 동안 대파 흰부분을 길이로 네등분 해서 잘게 다지고', 'image_url': 'https://recipe1.ezmember.co.kr/cache/recipe/2020/08/09/f960d891281dcfcf29728a9b987f5c971.jpg'}, {'step_number': 5, 'description': '물 반컵(100ml)에 국간장 0.5, 들깨가루 2를 섞어 두세요~', 'image_url': 'https://recipe1.ezmember.co.kr/cache/recipe/2020/08/09/ab0282c920609af3d3bfef14354b60281.jpg'}, {'step_number': 6, 'description': '20분간 절인 무에서 생긴 물을 버리지 말고~ 그대로 식용유 1, 다진마늘 0.5를 섞어 중불을 켜주세요중불', 'image_url': 'https://recipe1.ezmember.co.kr/cache/recipe/2020/08/09/dad63bcf33f03c09a356bda5749f09911.jpg'}, {'step_number': 7, 'description': '물이 끓어오르면 뚜껑을 덮고 팬을 앞뒤로 흔들어 주며 2분간 끓여요.', 'image_url': 'https://recipe1.ezmember.co.kr/cache/recipe/2020/08/09/9e677819617edf085e93f082126a241c1.jpg'}, {'step_number': 8, 'description': '스텝 5에서 만들어 둔 양념물을 붓고 뚜껑을 덮어 팬을 흔들어 주며 3분간 볶습니다.젓가락으로 젓지 말고 팬 전체를 흔들며 볶아야 부서지지 않아요~ 젓가락질은 중간중간에 한두번씩만 해주세요', 'image_url': 'https://recipe1.ezmember.co.kr/cache/recipe/2020/08/09/7f9d703d0df78ce73cf67cc32d55668b1.jpg'}, {'step_number': 9, 'description': '마지막으로 간을 보고 소금 2꼬집을 넣고 다진파, 들기름 1, 후추 약간을 넣고 센불에 바르르 한번만 끓여주면 완성입니다 ♡마지막 간은 기호에 맞게 조절하세요', 'image_url': 'https://recipe1.ezmember.co.kr/cache/recipe/2020/08/09/cb365f909803e9de1aa583744a8b31941.jpg'}, {'step_number': 10, 'description': '들기름을 마지막에 넣어서 향이 살아있어요~ 뜨거워도 식어도 맛있는 무나물♡', 'image_url': 'https://recipe1.ezmember.co.kr/cache/recipe/2020/08/09/63348d30b9449d84b6bee4033bbed15a1.jpg'}, {'step_number': 11, 'description': '부서지지 않고 살캉하게 예쁘게도 볶였죠?\n결대로 무썰기! 절이기! 젓가락으로 계속 젓지않기! 기억하셔서 달큰하고 깔끔한 무나물 만들어 보세요:D', 'image_url': 'https://recipe1.ezmember.co.kr/cache/recipe/2020/08/09/4fb5981268269c0cc42d55adff3ebc481.jpg'}]"
1642,밑반찬,일상,채소류,볶음,콩나물 볶음,콩나물볶음,https://recipe1.ezmember.co.kr/cache/recipe/2018/09/10/d5eaad647c0c3e4438bbfedfb42c5c6a1.jpg,"31,422",15분 이내,아무나,3인분,"[('콩나물', '1봉지'), ('양파', '1/4개'), ('파', '약간'), ('매운고추', '1개'), ('홍고추', '약간'), ('깐 마늘', '3개'), ('식용유', '약간'), ('참기름', '약간'), ('깨소금', '1큰술'), ('참치 액젓', '1큰술'), ('국간장', '2큰술'), ('고춧가루', '1.5큰술')]",만만한 반찬 콩나물 무치지 말고 볶아 먹자~~ 간편하게 볶아 먹는 콩나물 볶음 더 맛있게 즐기세요~,"[{'step_number': 1, 'description': '콩나물을 세척해 물기 제거하고요', 'image_url': 'https://recipe1.ezmember.co.kr/cache/recipe/2018/09/10/6dd5453c4296c040cf7516bfe887d0521.jpg'}, {'step_number': 2, 'description': '양파는 채 썰고, 파 고추 송송 썰고요 깐 마늘을 다져줍니다', 'image_url': 'https://recipe1.ezmember.co.kr/cache/recipe/2018/09/10/c9dc343a6d614c7b252d27f0db6d31fc1.jpg'}, {'step_number': 3, 'description': '달군 팬에 식용유 약간 두르고 마늘 양파 넣고 볶아 향을 내고', 'image_url': 'https://recipe1.ezmember.co.kr/cache/recipe/2018/09/10/d5609333eb8917537300a938b138b67c1.jpg'}, {'step_number': 4, 'description': '물기 제거한 콩나물 넣고 잠시 두고요', 'image_url': 'https://recipe1.ezmember.co.kr/cache/recipe/2018/09/10/1d3e1826773375316b98f1df6f688ccc1.jpg'}, {'step_number': 5, 'description': '숨이 약간 죽은 콩나물은 뒤집게로 뒤집어 잠시 두고', 'image_url': 'https://recipe1.ezmember.co.kr/cache/recipe/2018/09/10/bf612446bcfcf632bec3961590c01bed1.jpg'}, {'step_number': 6, 'description': '바로 국간장 2,참치 액젓 1, 고춧가루 1.5 넣고 뒤적거려 주세요', 'image_url': 'https://recipe1.ezmember.co.kr/cache/recipe/2018/09/10/fdf602e479cf6756d69e81d7270316b31.jpg'}, {'step_number': 7, 'description': '바로 파 고추 넣고 한번 뒤적거린 후 불 끄고요', 'image_url': 'https://recipe1.ezmember.co.kr/cache/recipe/2018/09/10/601fc9e43165a4cac7d4376eeee493661.jpg'}, {'step_number': 8, 'description': '참기름 한두 방울과 깨소금 듬뿍 넣어 섞어 마무리합니다 무침보다 식감이 아삭아삭 더 맛있는 콩나물 볶음 만들어 보세요', 'image_url': 'https://recipe1.ezmember.co.kr/cache/recipe/2018/09/10/3241ec62419bf46f84bffeede43457d11.jpg'}]"
1643,밑반찬,일상,채소류,볶음,건강하게 맛있는 맛 '청경채 버섯볶음',청경채버섯볶음,https://recipe1.ezmember.co.kr/cache/recipe/2020/11/25/13d493700584ab3e122e6bd15731e4631.jpg,"8,950",20분 이내,아무나,2인분,"[('청경채', '3개'), ('느타리버섯', '1줌'), ('마늘', '6알'), ('굴소스', '1t'), ('통깨', '톡톡'), ('전분물', '3t')]","몸에 좋은 버섯과 청경채!
이 두 재료의 조합은 정말 건강하도고 너무나 맛있는 맛이지요^~^","[{'step_number': 1, 'description': '깨끗하게 씻은 청경채와 버섯을 준비하고 마늘을 편썰어 주세요.너무 큰 청경채들은 반으로 잘라주어 더 빠르게 익을 수 있도록 해줍니다.', 'image_url': 'https://recipe1.ezmember.co.kr/cache/recipe/2020/11/25/bd052007097bb5c710c9261927cd73321.jpg'}, {'step_number': 2, 'description': '기름을 두르고 마늘을 먼저 볶은 뒤 노릇해 질 쯤 버섯을 넣고 볶아줍니다.중불', 'image_url': 'https://recipe1.ezmember.co.kr/cache/recipe/2020/11/25/84628540cb69673ebfe79b316a9f77d21.jpg'}, {'step_number': 3, 'description': '버섯에 수분이 나오고 익어가는 것이 보일쯤 청경채를 넣고 볶아줍니다.', 'image_url': 'https://recipe1.ezmember.co.kr/cache/recipe/2020/11/25/ad5573e206de0d13c2460d1b697d81e81.jpg'}, {'step_number': 4, 'description': '청경채가 숨이 죽으면 굴소스를 넣고 빠르게 볶아줍니다.강불이때 전분물을 넣으면 양념이 쫀득?해지는 것을 느낄 수 있답니다.', 'image_url': 'https://recipe1.ezmember.co.kr/cache/recipe/2020/11/25/1c4f15e6208281fb2175e08813904f901.jpg'}, {'step_number': 5, 'description': '통깨를 톡톡 뿌리고 맛있게 먹어줍니다^~^', 'image_url': 'https://recipe1.ezmember.co.kr/cache/recipe/2020/11/25/f8b97f766495335a644b9ee41cabf2dc1.jpg'}]"
1644,밑반찬,일상,채소류,볶음,호박볶음 들깨가루 넣어서 더 맛있어요^^,호박볶음,https://recipe1.ezmember.co.kr/cache/recipe/2017/03/04/b99e3f4a3b8ea093dc9e0aacb184dc421.jpg,"77,793",30분 이내,아무나,2인분,"[('애호박', '1개'), ('양파채', '1줌'), ('다진마늘', '0.5스푼'), ('국간장', '1스푼'), ('들깨가루', '1스푼'), ('들기름', '1스푼')]",호박볶음은 제가 느무 좋아하는 반찬 중에 하나인데요. 요즘 애호박 가격이 만만치 않아서 자주 먹지는 못했거든요~ 그나마 조금 가격이 내려서~ 마트 갔다가 얼른 집어 들고 왔답니다.ㅎㅎ 애호박으로 만들고 싶은 요리가 많았는데 또 귀차니즘 발동으로 어려운 건 못하겠고~~ㅋ 쉽게 만들 수 있는 호박볶음으로~~ 요기에 스페셜하게 들깨가루도 넣어서 맛나게 먹었어요~ 들깨가루 넣은 애호박볶음 보여드릴게요^^,"[{'step_number': 1, 'description': '양파는 채 썰어 준비하고 애호박은 반달로 썰어서 준비했어요~', 'image_url': 'https://recipe1.ezmember.co.kr/cache/recipe/2017/03/07/8d526744e3170cd56561e10a76a7c5d11.jpg'}, {'step_number': 2, 'description': '달구어진 팬에 식용유 두르고 다진 마늘부터 볶아서 마늘향을 내고~ 양파를 넣어서 투명하게 익을때까지 볶아요~ 제가 생양파맛은 별로 좋아하지 않아서 양파부터 흐물흐물할때까지 익혔어요~ 그 다음 애호박을 넣어서 볶아요~ 저는 약간 단단하게 살짝만 익은 호박을 좋아하는데 이번엔 부드럽게 먹고 싶어서 평소보다 조금 더 많이 익혔구요~ 간은 국간장으로 했습니다. 국간장이 일반 양조간장보다는 짜기 때문에 1스푼으로도 충분하더라구요. 보통 호박볶음은 새우젓을 많이 사용하지만 저는 젓갈을 별로 좋아하지 않아서 국간장으로 간을 하는데 이렇게 만들어도 담백하고 맛있어요~', 'image_url': 'https://recipe1.ezmember.co.kr/cache/recipe/2017/03/07/1484052cd61273da62e45dd3f7e38c481.jpg'}, {'step_number': 3, 'description': '마무리 단계에서 들깨가루를 한스푼 둘러서 골고루 섞어주고~~ 마지막에 들기름도 넣어 줬어요~~', 'image_url': 'https://recipe1.ezmember.co.kr/cache/recipe/2017/03/07/c582d2b142a7bb8a5dbec2ab989016851.jpg'}, {'step_number': 4, 'description': '고소한 들깨향 가득한 호박볶음 완성 입니다.', 'image_url': 'https://recipe1.ezmember.co.kr/cache/recipe/2017/03/07/2eb2f1f27e81b32bf7da46aa701b4f981.jpg'}]"
