index,종류별,상황별,재료별,방법별,글 제목,레시피이름,레시피이미지,조회수,조리시간,난이도,인분,재료,소개글,조리순서
40665,메인반찬,술안주,곡류,부침,모짜렐라 치즈 감자채전 만들기 간단한 맥주 안주 감자전,치즈감자채전,https://recipe1.ezmember.co.kr/cache/recipe/2024/03/16/d356f6641f5bca9a190552e36645bce71.jpg,"2,675",30분 이내,아무나,3인분,"[('감자', '900g'), ('모짜렐라 치즈', '600g'), ('청양고추', '1-2개')]","평소에도 감자전을 참 좋아해요. 원조 감자전인 갈아서 만드는 게 제일 맛있지만 조금 색다르게 만든 감자전은 또 다른 맛을 느낄 수 있어 좋아요.

감자를 얇게 채 썰어 감자채전을 만들어 먹으면 감자 씹히는 맛을 느낄 수 있어 느낌이 다른 감자전이 되는데요.

여기에 모짜렐라 치즈를 섞어 만들면 치즈의 고소함과 짭조름함이 더해져 풍미가 깊은 감자전이 된답니다.

맥주 생각 절로 나죠~","[{'step_number': 1, 'description': '감자는 깨끗이 씻어 껍질을 벗겨 주세요.감자칼 , 믹싱볼', 'image_url': 'https://recipe1.ezmember.co.kr/cache/recipe/2024/03/16/de0e741d621c871ccf5fb57b76cd00991.jpg'}, {'step_number': 2, 'description': '껍질을 벗긴 감자는 얇게 채 썰어 줍니다. 칼질에 자신이 있다면 직접 썰어도 좋지만 같은 두께로 썰기 위해선 채칼을 활용하시는 게 좋아요. 두께가 다르면 익는 정도가 달라지기 때문에 식감이 좋지 않아요.도마 , 조리용나이프 , 채칼', 'image_url': 'https://recipe1.ezmember.co.kr/cache/recipe/2024/03/16/bab29eee498bbb8456f0ce635fb665141.jpg'}, {'step_number': 3, 'description': '채 썬 감자는 물에 잠시 5분 정도 담가 주었다가 헹궈 전분을 제거해 줍니다. 썰어서 바로 여러 번 헹궈 내주셔도 좋아요.', 'image_url': 'https://recipe1.ezmember.co.kr/cache/recipe/2024/03/16/fdc7b64c10e21d79a2448c48154d5d381.jpg'}, {'step_number': 4, 'description': '헹궈 낸 감자채는 체에 밭쳐 물기를 제거해 주세요.채반', 'image_url': 'https://recipe1.ezmember.co.kr/cache/recipe/2024/03/16/4931083a95f85737859f486be6a7c5881.jpg'}, {'step_number': 5, 'description': '물기를 제거한 감자채를 볼에 넣고', 'image_url': 'https://recipe1.ezmember.co.kr/cache/recipe/2024/03/16/30e255cf5139ec1f717e2009d24fdd431.jpg'}, {'step_number': 6, 'description': '모짜렐라 치즈를 넣어 골고루 섞어 줍니다. 피자 치즈가 짭조름함이 있어 간을 따로 하지 않아도 괜찮은데요. 짜게 드시는 분들이라면 소금을 살짝 넣으셔도 좋아요. 그리고 매콤함을 살짝 주기 위해 청양고추를 한두 개 다져 넣으시면 더 맛있을 거예요.요리스푼', 'image_url': 'https://recipe1.ezmember.co.kr/cache/recipe/2024/03/16/bcd36e7173220d8e8aa5f86140729cb61.jpg'}, {'step_number': 7, 'description': '식용유를 적당히 두른 팬을 중불로 달궈 준 후 감자채 반죽의 1/3을 올려 주세요.프라이팬', 'image_url': 'https://recipe1.ezmember.co.kr/cache/recipe/2024/03/16/82450225ea4e440a711e6ad408443d291.jpg'}, {'step_number': 8, 'description': '중불에서 5분 정도 익혀 줍니다. 이때 겉 부분에 흐트러져 있는 감자채들을 모아 모양을 잘 잡아 주시면 좋아요. 감자채가 흐트러지지 않을까 싶지만 모짜렐라 치즈가 녹으면서 감자들끼리 달라붙게 도와준답니다.뒤집개', 'image_url': 'https://recipe1.ezmember.co.kr/cache/recipe/2024/03/16/16fac7b3d9e1f018ccadee427536aa391.jpg'}, {'step_number': 9, 'description': '5분 후 뒤집어 보면 녹아내린 모짜렐라 치즈가 바닥 부분에 노릇하게 구워져 과자처럼 변한 걸 볼 수 있어요. 이 상태로 다시 5분 구워 줍니다.접시', 'image_url': 'https://recipe1.ezmember.co.kr/cache/recipe/2024/03/16/955b43b33e2ed1e6d8d93860073e44101.jpg'}, {'step_number': 10, 'description': '만들기도 쉽고 먹기는 더 쉬워요~ ㅎㅎ 감자 900g 이면 너무 많은 거 아니야?라고 처음엔 생각하시겠지만 먹어보면 절대 많지 않다는 점~ 혼자 두 장은 먹을 수 있으니 둘이 먹다 싸울 수도 있습니다.', 'image_url': 'https://recipe1.ezmember.co.kr/cache/recipe/2024/03/16/eba0bd166b8f332bbce9fc5bbeb3c9911.jpg'}]"
40666,메인반찬,술안주,곡류,부침,"녹두빈대떡(녹두부침개), 주당아빠를 위한 안주겸 반찬",녹두빈대떡,https://recipe1.ezmember.co.kr/cache/recipe/2017/04/18/acaa2e770baefb46210d27e4684c5cc61.jpg,"48,410",2시간 이상,신의경지,4인분,"[('깐녹두                                                                                불리기전', '2컵'), ('맵쌀(흰쌀)', '1/4컵'), ('고사리                                                                                삶은것', '2줌'), ('숙주                                                                                삶은것', '2줌'), ('김치', '1/2~3/4포기'), ('간돼지고기', '2줌'), ('참기름', '1T'), ('소금', '1t'), ('후추', '1/4t')]",아빠의 입맛을 가장 많이 닮은 큰 딸이 아빠와 집에서 빈대떡 부쳐서 막걸리 한 잔 하고 싶은 맘으로 레시피 올립니다. 결혼하고 명절에 빈대떡 부칠 때마다 아빠가 좋아하시는 거라 언제 한 번 해드리고 싶다는 생각을 늘 했었는데 아직 한 번도 못해드렸네요. 녹두와 숙주가 성질이 찬 음식이라 더운 여름에 잘 어울려요. 여름 장마철에 해 먹으면 딱일 것 같아요.,"[{'step_number': 1, 'description': '숙주는 끓는 물에 데치고 고사리는 삶아줍니다. 녹두+맵쌀은 밥할 때 쌀 씻듯이 씻은 후 차가운 생수를 넉넉히 부어 4시간 이상 불립니다. 녹두가 스테인레스 용기에 닿으면 더 잘 삭는다고해서 플라스틱 대야(?)에 불렸어요.', 'image_url': 'https://recipe1.ezmember.co.kr/cache/recipe/2017/04/18/ddce693f721d90b5b50c30b1e815c46b1.jpg'}, {'step_number': 2, 'description': '약 6시간 가량 불려진 녹두+맵쌀입니다. 잘 모르시는 분들이 녹두 불린 데에 찹쌀가루를 넣으시는데 원래는 쌀을 함께 넣고 불려 전분기를 더해주었다고 합니다.', 'image_url': 'https://recipe1.ezmember.co.kr/cache/recipe/2017/04/18/c150be8af97a7576f8b01b99387de5f51.jpg'}, {'step_number': 3, 'description': '불려진 녹두를 갈아야하는데요, 간녹두의 농도가 녹두빈대떡의 승패를 가르기 때문에 물의 양이 아주 중요합니다. 그래서 물의 양을 정확하게 계량하기 위해 소쿠리에 옮겨 물을 모조리 빼주었습니다.', 'image_url': 'https://recipe1.ezmember.co.kr/cache/recipe/2017/04/18/14105e7ba0382a079504287341c28c211.jpg'}, {'step_number': 4, 'description': '가는 과정도 중요해요. 블렌더에 물 1컵(240ml)만 먼저 부어주세요. 귀찮다고 물이랑 불린 녹두 한꺼번에 넣고 갈려고 하면 잘 갈아지지 않아서 물을 더 넣게되고, 그러면 결국 망합니다.', 'image_url': 'https://recipe1.ezmember.co.kr/cache/recipe/2017/04/18/5fe14cd7833761460d51b009cabf11021.jpg'}, {'step_number': 5, 'description': '국자로 불린 녹두+맵쌀을 두 국자정도 떠서 블렌더 속 물에 넣고 뚜껑닫고 갈아주세요.', 'image_url': 'https://recipe1.ezmember.co.kr/cache/recipe/2017/04/18/c87a22ee49b2aa84b3112605862271eb1.jpg'}, {'step_number': 6, 'description': '아직은 물이 많으니까 잘 갈아집니다. 한 두 국자 정도 더 넣고 또 뚜껑닫고 갈아줍니다.', 'image_url': 'https://recipe1.ezmember.co.kr/cache/recipe/2017/04/18/afe3ccb43a5d2c02eb158a5c6feeb3441.jpg'}, {'step_number': 7, 'description': '아직까지는 그럭저럭 갈아지죠? 한 두 국자 더 넣고 또 뚜껑닫고 갈아줄건데요 슬슬 뻑뻑해지면서 잘 안 갈아지려고 폼 잡을거에요. 그럴 땐 블렌더를 앞뒤로 흔들면서 갈아주세요.', 'image_url': 'https://recipe1.ezmember.co.kr/cache/recipe/2017/04/18/a63ce876c4240c2757194b19993a4c311.jpg'}, {'step_number': 8, 'description': '또 한 두 국자 더 넣고 갈아줘야 하는데요 점점 지 혼자 갈아지려고 하지는 않을겁니다. 이제 뻑뻑해져서 뚜껑없어도 위로 튀어나오는 거 없으니 플라스틱 숟가락으로 윗부분을 휘휘 저으면서 블렌더로 갈아주시면 잘 섞이면서 골고루 곱게 갈아진답니다.', 'image_url': 'https://recipe1.ezmember.co.kr/cache/recipe/2017/04/18/9c9b16672f523567acb1df17ade886631.jpg'}, {'step_number': 9, 'description': '다 갈아진 녹두입니다. 이제 소를 준비해야죠?', 'image_url': 'https://recipe1.ezmember.co.kr/cache/recipe/2017/04/18/5df2b442405112901707152b1074b54b1.jpg'}, {'step_number': 10, 'description': '삶은 고사리를 베보자기를 사용해서 최대한 물을 꽉 짜낸 뒤, 너무 길지 않도록 듬성듬성 잘라줍니다.', 'image_url': 'https://recipe1.ezmember.co.kr/cache/recipe/2017/04/18/14e4aec9cc2d3d01ef54df0c8a8422831.jpg'}, {'step_number': 11, 'description': '김치 1/2포기 두 개 최대한 큰 걸로.. 혹여 작으면 1/4포기 더 체에 걸러 국물 흐르지 않도록 하고', 'image_url': 'https://recipe1.ezmember.co.kr/cache/recipe/2017/04/18/35d3b6a1e9a4771ab7504e73476f64361.jpg'}, {'step_number': 12, 'description': '손으로 꽉 짠 다음 칼로 잘게 썰어주고 베보자기에 넣어 한번더 최대한 국물을 짜내주세요. 김치가 생각보다 국물이 많이 나와요. 손으로만 짜면 나중에 계속 물이 나오니 베보자기없으시면 페이퍼타올이라도 사용하셔서 꽉 짜주셔야합니다.', 'image_url': 'https://recipe1.ezmember.co.kr/cache/recipe/2017/04/18/af4d16bed0e3d285835b5b33b8a2c7801.jpg'}, {'step_number': 13, 'description': '데친 숙주도 마찬가지로 베보자기나 면보를 이용해서 최대한 물기를 제거합니다. 간 돼지고기까지 준비하면 모든 속재료가 준비끝. 모든 재료들이 부피가 비슷하죠? 두 손안에 간신히 잡히는 공 크기 정도라고 보시면 딱 맞습니다.', 'image_url': 'https://recipe1.ezmember.co.kr/cache/recipe/2017/04/18/65625ea2dce4ed83bb3799a8464f173d1.jpg'}, {'step_number': 14, 'description': '물기 짜내느라 뭉쳐있는 재료들에 소금, 후추, 참기름 넣고 살살 풀어주면서 같은 재료끼리 말고 서로 다른 재료들과 사이좋게 어우러지도록 잘 섞어주세요.', 'image_url': 'https://recipe1.ezmember.co.kr/cache/recipe/2017/04/18/372f6c50076a846a8be12cd57a1bf6561.jpg'}, {'step_number': 15, 'description': '빈대떡 속에 들어가는 소가 완성되었습니다.', 'image_url': 'https://recipe1.ezmember.co.kr/cache/recipe/2017/04/18/f9e403a532d8b0b254ab5c48139e07f21.jpg'}, {'step_number': 16, 'description': '간 녹두에 속재료를 넣고 속재료에 간녹두를 묻히는 느낌으로 잘 버무려주세요.', 'image_url': 'https://recipe1.ezmember.co.kr/cache/recipe/2017/04/18/4a27e475be34ddce6c64f132c57f570e1.jpg'}, {'step_number': 17, 'description': '혹시 속재료의 물기를 잘 제거하지 않아 반죽이 너무 묽다면 임시방편으로 쌀가루를 넣어 농도를 조절해주세요. 묽으면 부칠 때 모양을 잡을 수도 없고 뒤집다가 다 찢어져요.', 'image_url': 'https://recipe1.ezmember.co.kr/cache/recipe/2017/04/18/d7dcbca637e5060b75da85ad4c67d2de1.jpg'}, {'step_number': 18, 'description': '부칠 땐 후라이팬을 충분히 달궈주시고, 기름도 넉넉히 둘러주셔야 합니다. 녹두빈대떡은 너무 얇으면 맛이없죠. 적당히 두툼하게 부치시되 타지않고 속까지 잘 익도록 중강불에서 충분히 익혀주세요.', 'image_url': 'https://recipe1.ezmember.co.kr/cache/recipe/2017/04/18/c18e9f4a2210592e17fda05cd5ec8f831.jpg'}, {'step_number': 19, 'description': '완성입니다. 초간장에 찍어서 드시면 간이 딱 맞아요.', 'image_url': 'https://recipe1.ezmember.co.kr/cache/recipe/2017/04/18/1f658b97d3146312dfa16c2398fdd7ce1.jpg'}]"
40667,메인반찬,술안주,곡류,부침,"야식&술안주, 바삭하고 고소한 녹두전 만들기",녹두전,https://recipe1.ezmember.co.kr/cache/recipe/2018/05/08/df81cbd2a060ee79bc28959b7ab183871.jpg,"61,752",60분 이내,중급,4인분,"[('깐녹두', '1팩'), ('쌀                                                                                한줌 쌀가루', '1/2컵'), ('돼지고기 갈은것', '300~400g'), ('김치', '1/4포기'), ('숙주', '1봉지'), ('다진마늘', '1~2큰술'), ('생강가루나 생강즙', '약간'), ('후추', '약간'), ('미림                                                                                또는 소주', '1큰술'), ('참치액젓', '1~1.5큰술'), ('소금                                                                                입맛에 따라 또는 간장', '1작은술'), ('들기름', '약간')]","요즘같은 봄날씨, 환경호르몬에 쉽게 노출되는 우리몸엔 독소를 배출하고 해독하는 음식이 좋은것 같아요. 특히 녹두는 미네랄과 칼슘도 많아 영양도 만점이라고 하네요. 시중의 녹두전처럼 밀가루를 넣지않고 녹두와 멥쌀 약간만으로 정말 건강하고 맛있는 녹두전 만들어보았어요.","[{'step_number': 1, 'description': '깐녹두 한팩을 사서 하루정도 물에 불려두었어요. 녹두는 물에 불릴때 거품이 많이 나더라구요. 여러번 행군 후 물에 하루를 불리고, 양손바닥으로 살살 비비면 껍질이 많이 벗겨져나가요. 이렇게 어느정도 껍질을 벗겨낸후 건져서 물기를 빼주었어요. 저는 되직하고 진한 녹두전을 좋아하기 때문에 물기는 가능한 많이 뺐어요.껍질은 완벽히 벗길필요까지 없고 사진처럼 어느정도 벗겨내면 되요.', 'image_url': 'https://recipe1.ezmember.co.kr/cache/recipe/2018/05/08/3261315779fa52a8949808432e2e8c8b1.jpg'}, {'step_number': 2, 'description': '저는 고기의 고소함과 씹는맛을 위해 다짐육을 조금 많이 넣어요, 돼지고기 다짐육은 300g~400g 취향에 따라 양을 준비하세요.', 'image_url': 'https://recipe1.ezmember.co.kr/cache/recipe/2018/05/08/cd93694baf47de2c3adc0dcc910a4ac51.jpg'}, {'step_number': 3, 'description': '돼지고기는 키친타올로 눌러 핏물을 어느정도 뺀 후 맛술 1큰술, 간마늘 1-2큰술, 생강가루나 생강즙 1작은술, 후춧가루 약간, 참치액젓1큰술을 넣고, 들기름 살짝 뿌려서 잘 섞어준 후 잠시 재워두세요.참치액젓은 안 넣으셔도 되요. 있으시다면 한술정도 넣으면 감칠맛이 좀더 깊어져요.', 'image_url': 'https://recipe1.ezmember.co.kr/cache/recipe/2018/05/08/85b49a16cfa71534e060a65512cacfa91.jpg'}, {'step_number': 4, 'description': '녹두전에 들어갈 김치는 신김치로 해야 맛이 좋아요. 1/4포기를 준비해주세요.', 'image_url': 'https://recipe1.ezmember.co.kr/cache/recipe/2018/05/08/16f976c85cb67ebc7d62f654e9e2e4151.jpg'}, {'step_number': 5, 'description': '잘게 다져 썰어서 준비합니다. 다진김치는 국물을 짜서 고기와 합쳐주는데 김치가 전체적인 간을 하는 역할이라서 한번에 다 넣지 말고 준비량의 반정도 넣어 섞어서 만들어본 후 전을 하나 테스트로 부쳐보면서 김치를 더 넣던지 간을 맞추면 좋아요.김치는 국물을 너무 꽉짜기 마시고 국물이 흐르지 않는정도로만 적당히 짜 주세요.', 'image_url': 'https://recipe1.ezmember.co.kr/cache/recipe/2018/05/08/1e4701d6bad7bbb2b1ed6b62c3e0db331.jpg'}, {'step_number': 6, 'description': '숙주는 크게 손으로 2-3줌 분량을 끓는물에 넣어 데쳐주어요.\n고사리가 있으면 고사리도 데쳐 썰어서 넣어주시면 좋아요.', 'image_url': 'https://recipe1.ezmember.co.kr/cache/recipe/2018/05/08/9cc42a562593dd6944202af6f43855581.jpg'}, {'step_number': 7, 'description': '끓는물에 숙주의 흰 부분이 투명해질 정도로만, 너무 숨이 죽지않고 아삭함이 남아있게 데쳐주셔야 해요. 그래야 녹두전을 부쳤을때 식감이 더 좋아요.', 'image_url': 'https://recipe1.ezmember.co.kr/cache/recipe/2018/05/08/b8efcb02b37cfea40e27422667b18a4c1.jpg'}, {'step_number': 8, 'description': '데친 숙주는 체에 걸러 식을때까지 기다려주세요. 숙주가 식으면 꽉 손으로 짠다음 썰어주세요.', 'image_url': 'https://recipe1.ezmember.co.kr/cache/recipe/2018/05/08/15ec17a8ac11587ad18cbe324bbf38361.jpg'}, {'step_number': 9, 'description': '저는 처음에는 조금 잘게 썰어주었는데요, 이렇게까지 잘게 썰지 않고 칼로 수직으로 두번씩만 썰어줘도 충분한 것 같아요. 고사리가 있을 경우에는 조금 양을 줄이는게 좋구요. 이번엔 숙주와 김치만 야채를 넣기 때문에 숙주양도 많이 넣었는데 식감이 아삭하니 좋아요.', 'image_url': 'https://recipe1.ezmember.co.kr/cache/recipe/2018/05/08/1e3e5eed1dffab28a5ff547558c399931.jpg'}, {'step_number': 10, 'description': '김치 1/2분량을 고기와 함께 섞어서 조물조물 섞어주세요.', 'image_url': 'https://recipe1.ezmember.co.kr/cache/recipe/2018/05/08/575125d41efda811c0b9e8f904fbc6531.jpg'}, {'step_number': 11, 'description': '고기와 김치를 섞은 양 대비 물기를 뺀 숙주는 이 정도 분량을 넣었어요.', 'image_url': 'https://recipe1.ezmember.co.kr/cache/recipe/2018/05/08/7a7c984501ec68770db87b3268a8d0e81.jpg'}, {'step_number': 12, 'description': '돼지고기, 김치, 숙주를 양념과 한데 섞어 조물조물 뭉쳐준 후 잠시 놓아둡니다. 이제 주재료인 불린 녹두를 갈아줄거예요.녹두를 갈면 물이 나와 금방 삭을 수 있어서 재료준비가 다 된후 바로 가는것이 좋아요. 방금 갈아서 해먹는 녹두전은 향도 진하고 맛있는것 같아요.', 'image_url': 'https://recipe1.ezmember.co.kr/cache/recipe/2018/05/08/82124a7533d9ecb656839b0cce6b04821.jpg'}, {'step_number': 13, 'description': '멥쌀은 작게 한줌정도를 녹두와 따로 물에 불려놨어요. 멥쌀은 2시간 정도만 불려도 되요. 불린멥쌀은 건져내어 믹서기에 곱게 갈아주었어요. 손으로 비벼보았을때 까끌한 느낌이 많이 나지 않게 조금 많이 갈아주세요. 쌀가루가 있다면 물에 녹여 그대로 쓰시면 됩니다.멥쌀은 덜 갈게 되면 까끌한것이 전에서도 씹히게 되니 충분히 곱게 갈아주세요.멥쌀의 양은양은 아주 조금만 넣었는데 녹두양의 1/9정도만 넣었어요.', 'image_url': 'https://recipe1.ezmember.co.kr/cache/recipe/2018/05/08/6abaf6b1f1a79095341c319d75acbbee1.jpg'}, {'step_number': 14, 'description': '불린 녹두도 한국자, 물 약간만 넣어서 되직하게 갈아주세요. 이때 가장 중요한 첫번째 포인트! 물을 많이 넣으면 맛이 없다는 점입니다. 믹서기 돌아갈 정도만 약간씩 첨가하며 아주 되직하게 갈아낼수록 진한 녹두전의 맛을 즐길 수 있어요. 두번째 포인트! 녹두를 믹서로 너무 오래 갈지 마세요. 녹두알이 보이지않고 전체가 거칠게 다 갈아졌다면 믹서기를 멈춥니다.녹두는 너무 곱게 갈면, 너무 부드러워져서 맛이 없더라구요. 녹두는 조금 거칠게 갈아주고, 물도 최소한으로 적게~ 되직되직하게 해야해요. 거기에 각종 재료를 넣고 섞으면 어차피 또 물이 생기거든요 ^^', 'image_url': 'https://recipe1.ezmember.co.kr/cache/recipe/2018/05/08/206356bdd0b443e9c87dc02e1375736e1.jpg'}, {'step_number': 15, 'description': '이제 섞어놓았던 재료들을 넣어주세요. 역시 한번에 다 넣지 마시고, 간 녹두의 양을 봐가며 내용물재료를 넣고 섞어야합니다. 2/3을 넣고 잘 섞어서 하나 조그맣게 전을 부쳐보세요. 맛을 보고 재료를 더 가감하면 완벽한 녹두전이 됩니다.', 'image_url': 'https://recipe1.ezmember.co.kr/cache/recipe/2018/05/08/f6b835a2a847e01d973e3fa1839b4f881.jpg'}, {'step_number': 16, 'description': '이 정도 질감, 이정도 색상과 비율의 반죽으로 완성했어요. 내용물재료가 너무 많은가 싶을정도로 되직하게 하셔도 되요.\n시간이 지나면 물이 생기거든요. 녹두 본연의 맛을 좋아하시면 김치양은 제 레시피에서 줄이시고 소금간을 더 하시면 좋을듯합니다.섞어놓은 날 반죽재료는 김치냉장고에 넣어 보관하세요. 가능하면 3일안에 부쳐드셔야해요.', 'image_url': 'https://recipe1.ezmember.co.kr/cache/recipe/2018/05/08/2b0bc152efc49e52bb45b6f4ce22a53a1.jpg'}, {'step_number': 17, 'description': '후라이팬에 기름을 넉넉히 두르고 중불에서 지져줍니다. 이때 최대한 얇게 부치세요. 눌러가며 바삭바삭하게. 그게 맛있습니다. 양쪽면이 이정도 굽기가 나오면 되는데 여러번 뒤집지 마시고 한쪽이 충분히 색이 나오면 뒤집어주시면 됩니다.', 'image_url': 'https://recipe1.ezmember.co.kr/cache/recipe/2018/05/08/7e0e91a062275eaea99ffadcc8f941a01.jpg'}, {'step_number': 18, 'description': '앞에서도 말씀드렸다시피 한장 구워서 드셔보시고 재료나 간을 가감하면 실패도 적고 입맛에 더욱 맞아서 좋아요. 녹두전은 시간이 지나면 물도 나오지만 오히려 간도 쎄지니, 처음부터 간을 너무 쎄게 하지 마시고 간장을 곁들여 드시면 좋을것 같아요.', 'image_url': 'https://recipe1.ezmember.co.kr/cache/recipe/2018/05/08/f88e85bfc6975b1b7db1dc1426d2e1301.jpg'}, {'step_number': 19, 'description': '돼지고기는 많이 넣어도 맛있는것 같아요~~ 김치의 새콤함과 고기의 씹는 맛, 거기에 녹두의 고소함이 어우러져 몇장을 먹었는지 모르겠네요^^ 신랑이 무척 좋아했어요. 녹두전 장사를 해야한다나 ㅎㅎ녹두전 재료가 상할까봐 걱정이시면 오래보관하지 마시고 살짝 초벌로 부친후 보관했다가 데워드세요. 녹두전은 며칠이 지나도 맛있어요~', 'image_url': 'https://recipe1.ezmember.co.kr/cache/recipe/2018/05/08/e48c6d4f4cd4eed4ca08c1d8e3c0d66d1.jpg'}, {'step_number': 20, 'description': '온가족을 위한 건강영양간식, 남편의 술안주 녹두전. 정성과 손은 좀 가지만 시중에 파는 녹두전과는 비교가 안되는 맛이지요. 정말 맛있어요. 녹두전. 가족을 위해 함 만들어보세요.', 'image_url': 'https://recipe1.ezmember.co.kr/cache/recipe/2018/05/08/b402b0e687210ef152e5828b8a0012281.jpg'}]"
40668,메인반찬,술안주,곡류,부침,고소한 녹두빈대떡 만들기,녹두빈대떡,https://recipe1.ezmember.co.kr/cache/recipe/2015/12/11/b95c1165c89726295d397dc2e9ef9a371.jpg,"63,064",60분 이내,아무나,4인분,"[('녹두                                                                                껍질벗긴', '3컵'), ('찹쌀가루', '3큰술'), ('돼지고기 갈은것', '300g'), ('숙주', '300g'), ('김치', '200g'), ('식용유', '약간'), ('소금', '약간'), ('후추', '약간'), ('참기름', '약간')]","명절에나 주로 부쳤던 녹두빈대떡! 녹두전이 먹고싶다고 식구들의 주문이 들어와 간단하게 만들어 봤어요~ 명절때였으면 나물들도 많아서 재료를 넉넉히 넣었을 텐데 이번엔 약식으로 김치와 숙주, 돼지고기 정도만 넣고 노릇노릇하게 녹두전을 부쳐줬더니 어찌나 맛나게도 먹던지~ ​ 늘 잘 먹는 식구들을 바라보면 흐뭇하고 좋네요 ㅎㅎ","[{'step_number': 1, 'description': '녹두는 찬물에 4~5시간 정도 불린 후 손으로 비벼 남아있는 껍질을 벗겨 찬물에 몇 번 헹궈 껍질을 제거해 줍니다.', 'image_url': 'https://recipe1.ezmember.co.kr/cache/recipe/2015/12/29/b1836ff866b28047ef0d0adf7c720a8e1.jpg'}, {'step_number': 2, 'description': '숙주는 데쳐서 송송 썰어 물기를 꼭 짜고 배추김치는 물에 씻어 곱게 다져 물기를 꼭 짜냅니다.', 'image_url': 'https://recipe1.ezmember.co.kr/cache/recipe/2015/12/29/0ec2f4be2f4985785be2ceb38979396e1.jpg'}, {'step_number': 3, 'description': '믹서기에 녹두와 물을 조금 넣고 입자가 있게 갈아줍니다.', 'image_url': 'https://recipe1.ezmember.co.kr/cache/recipe/2015/12/29/f6b3ef7c100cc5000b618bb706562a961.jpg'}, {'step_number': 4, 'description': '갈아놓은 녹두에 돼지고기, 숙주, 김치, 찹쌀가루, 소금, 후추, 참기름을 넣고 고루 섞어줍니다.', 'image_url': 'https://recipe1.ezmember.co.kr/cache/recipe/2015/12/29/f21fbee84dfac304d9db24bddd3d8dd61.jpg'}, {'step_number': 5, 'description': '달군 팬에 기름을 넉넉히 두르고 적당량을 넣고 앞뒤로 노릇하게 지져냅니다 .', 'image_url': 'https://recipe1.ezmember.co.kr/cache/recipe/2015/12/29/42e4e95236963d4470c4a7e3c36b351f1.jpg'}, {'step_number': 6, 'description': '녹두전이 완성되어 4등분으로 썰어 접시에 담아주었어요~ 더 맛있게 먹으려면 고사리나 고추, 대파 등을 넣으면 속이 풍성하니 좋겠죠~ 순수한 녹두에 찹쌀가루는 조금만 넣어서 잘 부서지기 때문에 크기는 조금 작게 부치는게 찢어지지 않고 좋아요~ 나물을 많이 넣는 이유도 속 재료가 서로 엉겨있으면 맛도 좋지만 더 단단하기 때문이기도 하답니다.', 'image_url': 'https://recipe1.ezmember.co.kr/cache/recipe/2015/12/29/15b1c1cab1d6b21102ef0b9b11602c2b1.jpg'}]"
