index,종류별,상황별,재료별,방법별,글 제목,레시피이름,레시피이미지,조회수,조리시간,난이도,인분,재료,소개글,조리순서
48012,국/탕,일상,건어물류,끓이기,북어국 만들기 북어국 황금레시피,북어국,https://recipe1.ezmember.co.kr/cache/recipe/2017/12/12/35d25a0155dc70618fc7a0f5fcee56271.jpg,"22,540",30분 이내,아무나,4인분,"[('말린북어', '1마리'), ('참기름', '2T'), ('멸치', '24마리'), ('다시마                                                                                6x6', '2장'), ('무', '1/4개'), ('다진마늘', '1t'), ('간장', '2T'), ('소금', '적당량'), ('대파', '1/2대')]","막혔던 속도 뻥 뚫어줄것만 같은 시원한 국물때문에
술국으로도 인기가 그만인 북어국.
뽀얗게 우러난 시원한 국물맛이 좋아
해장할일 없는 우리집에도 아침상에 가끔 오르는 국이죠:)","[{'step_number': 1, 'description': '재료손질\n북어는 결대로 쪽쪽 찢어 찬물에 가볍게 씻어 물기를 꼭 짜고, 무는 납작하게 썰어주고 멸치는 머리와 내장을 발라주세요.', 'image_url': 'https://recipe1.ezmember.co.kr/cache/recipe/2017/12/12/3eebb1a4bb1de5c8223f290a43bc61371.jpg'}, {'step_number': 2, 'description': '냄비에 참기름을 두르고 북어와 멸치를 넣어 고루 저어가며 달달 볶아줍니다.', 'image_url': 'https://recipe1.ezmember.co.kr/cache/recipe/2017/12/12/533eb98d87694835c0b1792424794bce1.jpg'}, {'step_number': 3, 'description': '여기에 다시마와 무, 그리고 물을 넣고 뚜껑을 덮어 맛이 우러나도록 충분히 끓여주세요.', 'image_url': 'https://recipe1.ezmember.co.kr/cache/recipe/2017/12/12/d6d08cafaa198b7dc4a71822d4ef06211.jpg'}, {'step_number': 4, 'description': '다시마와 멸치를 건져내고 다진마늘을 넣어 끓입니다. 이때 건진 다시마는 반정도만 채 썰어 고명으로 사용해도 좋아요~:)', 'image_url': 'https://recipe1.ezmember.co.kr/cache/recipe/2017/12/12/e11cc0b32ad22a0603432a473c4652d81.jpg'}, {'step_number': 5, 'description': '물에 거품을 걷어내고 간장을 넣고,', 'image_url': 'https://recipe1.ezmember.co.kr/cache/recipe/2017/12/12/08f3e4313c7d49c31e3145cb4a6df3861.jpg'}, {'step_number': 6, 'description': '소금으로 간을 맞춘 뒤,', 'image_url': 'https://recipe1.ezmember.co.kr/cache/recipe/2017/12/12/3a385c37a544f698504187d79b4c69311.jpg'}, {'step_number': 7, 'description': '대파를 넣고 살짝 더 끓입니다.', 'image_url': 'https://recipe1.ezmember.co.kr/cache/recipe/2017/12/12/6890fd406490aa371beb2cf749eb01fe1.jpg'}, {'step_number': 8, 'description': '그릇에 담고 채썬 다시마를 얹어내 북어국 완성!\n간단하게 그냥 북어넣고 국물내면 된다니 세상 편한 요리예요. 하하하-\n간단히 시원한 국 해드시고 싶으실때 만들어보세요! 강추드려요!\n♡\n저는 다른 레시피로 다시 돌아올게요\n맛있고 행복한 하루 보내세요!\n:)\n씨유쑨♥', 'image_url': 'https://recipe1.ezmember.co.kr/cache/recipe/2017/12/12/f0344995a0a947210bca3a606e992b631.jpg'}]"
48013,국/탕,일상,건어물류,끓이기,"백종원 북어국, 숙취엔 북어국이지 ~",북어국,https://recipe1.ezmember.co.kr/cache/recipe/2017/08/14/cf77aefe3d2c5809159bf1ef64788cb21.jpg,"85,491",30분 이내,아무나,2인분,"[('북어채', '1줌'), ('대파', '약간'), ('계란', '1개'), ('국간장', '1큰술'), ('새우젓', '1/3큰술'), ('다진마늘', '1큰술'), ('참기름', '1큰술'), ('소금', '약간'), ('쌀뜨물 1+물', '1비율')]","숙취해소엔 이만한게 없쥬^^
http://blog.naver.com/qw3859","[{'step_number': 1, 'description': '북어채를 물에 담궜다가 물기를 바로 제거해주세요\n그리고 북어채 담궜던 물을 버리지 않고 국물낼때 이용할꺼예요', 'image_url': 'https://recipe1.ezmember.co.kr/cache/recipe/2017/08/14/8b0e0d72d8ee2065642b1c4dd209d7261.jpg'}, {'step_number': 2, 'description': '물에 담궜다가 건져낸 북어채는 물기를 살짝 \n짜주시고 냄비에 넣어주세요', 'image_url': 'https://recipe1.ezmember.co.kr/cache/recipe/2017/08/14/536a3c316ed710f7d4142c5e3467f4ef1.jpg'}, {'step_number': 3, 'description': '요건 북어를 담궜다가 건진 물인데요\n국물낼때 이용할꺼라 버리지 않고 한번 거름망 걸러서\n준비해 주었답니다', 'image_url': 'https://recipe1.ezmember.co.kr/cache/recipe/2017/08/14/4a1c3be07cc63379740bfc1975214f461.jpg'}, {'step_number': 4, 'description': '그리고 쌀뜨물도 준비해주시는데요\n쌀뜨물과 북어채물을 1:1 비율로 준비해주시면 되요', 'image_url': 'https://recipe1.ezmember.co.kr/cache/recipe/2017/08/14/bf5544ce4ae82b88bda47e8f315f2ef61.jpg'}, {'step_number': 5, 'description': '북어채를 넣어둔 냄비에 참기름을 1큰술 넣고\n달달 참기름 향이 살짝 퍼지도록 볶아주세요', 'image_url': 'https://recipe1.ezmember.co.kr/cache/recipe/2017/08/14/b72714bbab55fc9337cacba933617cd31.jpg'}, {'step_number': 6, 'description': '어느정도 볶아준뒤에 준비해둔 쌀뜨물과\n북어채 담궜던 물을 1:1 비율로 넣어주세요', 'image_url': 'https://recipe1.ezmember.co.kr/cache/recipe/2017/08/14/91ddb66023ba72c5a5f305fc0bcd71791.jpg'}, {'step_number': 7, 'description': '1:1 비율로 해야 가장 맛있다고 하더라구요\n그동안은 그냥 멸치육수를 사용하거나 생수로만\n끓여줬는데 쌀뜨물과 북어채물을 넣으니\n확실히 국물맛이 더 깊고 구수하더라구요', 'image_url': 'https://recipe1.ezmember.co.kr/cache/recipe/2017/08/14/47cab4da17447963634bef27cf64bd701.jpg'}, {'step_number': 8, 'description': '1:1 비율의 물을 넣고 나서 다진마늘과', 'image_url': 'https://recipe1.ezmember.co.kr/cache/recipe/2017/08/14/b494ebd579436953541aeb886f2c120b1.jpg'}, {'step_number': 9, 'description': '맛의 풍미를 높여줄 국간장을 1큰술 넣어줬어요', 'image_url': 'https://recipe1.ezmember.co.kr/cache/recipe/2017/08/14/ce6eb527fe49a7b076736b5afe21e2991.jpg'}, {'step_number': 10, 'description': '그리고 팔팔 끓여주세요\n국물이 팔팔 끓어오르는 동안 계란물도 만들어주시고요\n끓어오르면 계란물을 삥둘러서 넣어주세요', 'image_url': 'https://recipe1.ezmember.co.kr/cache/recipe/2017/08/14/ffecd3100c092b1147683107f6a0ae041.jpg'}, {'step_number': 11, 'description': '팔팔 끓어오르기 시작하면 새우젓으로 간을 맞춰주세요\n새우젓을 넣고 모자란 간은 소금을 좀더 넣어서 맞춰주시면 되요', 'image_url': 'https://recipe1.ezmember.co.kr/cache/recipe/2017/08/14/db7d414249cbda3298ccba3f2e88a9f61.jpg'}, {'step_number': 12, 'description': '국물이 뽀얗게 우러나오고 있죠 ~\n취향에따라 양파나 다른 야채를 조금더 추가하셔도 좋은데\n전 그냥 대파만 더 넣어서 끓이기로 했어요', 'image_url': 'https://recipe1.ezmember.co.kr/cache/recipe/2017/08/14/93a8c6f6eaa4fa09d1da8c93283459801.jpg'}, {'step_number': 13, 'description': '대파는 많이~ 넣는걸 좋아해서 한움큼 넘게 넣은거 같아요 ~\n좀 더 칼칼한맛을 원하시면 청양고추를 더 넣으셔도 좋아요\n전 아이들과 함께 먹을꺼라 고추는 넣지 않고 요리했어요', 'image_url': 'https://recipe1.ezmember.co.kr/cache/recipe/2017/08/14/d124cd844e2dda86b9fb298bf081a00f1.jpg'}]"
48014,국/탕,일상,건어물류,끓이기,김국 끓이는 법 간단해서 빨리먹기 좋아요,김국,https://recipe1.ezmember.co.kr/cache/recipe/2017/12/19/4e5a40588edd13c5c39f26eb25cd2ceb1.jpg,"56,712",30분 이내,아무나,5인분,"[('돌김(곱창김)', '4장'), ('계란', '2개'), ('다진마늘', '1큰술'), ('파', '1줌'), ('멸치액젓', '2큰술'), ('국간장', '1큰술'), ('소금', '1/2큰술')]","저는 밥먹을때 국이 없으면 밥먹은 기분이 안나서 국이 꼭 있어야하는데요, 국거리나 찌개거리가 없을때 자주 해먹는 국이 있죠 ㅎㅎ 이번엔 그 중 하나인 김국을 끓여봤어요.","[{'step_number': 1, 'description': '우선 시원한 국물맛을 위해서 물에 국물용 멸치와 다시마를 넣고 육수를 내어 주세요 .', 'image_url': 'https://recipe1.ezmember.co.kr/cache/recipe/2017/12/20/701d5b9d19268bc7f0dd2c4b3c1c26e31.jpg'}, {'step_number': 2, 'description': '육수가 우러나오는동안 김을 구울 건데요. 김은 김밥용 김 보다 이러 돌김으로 하는게 더 맛있답니다! 요즘에 또 김철이라 햇김도 많이 나오잖아요? 이럴때 많이 먹어두는게 좋죠♥', 'image_url': 'https://recipe1.ezmember.co.kr/cache/recipe/2017/12/20/15f8912d47a64e4a2f3632fbaf9569071.jpg'}, {'step_number': 3, 'description': '무튼! 김국에 들어갈 김4장은 달군팬에 앞뒤로 구워줘요. 이렇게 구우면 더 구수하고 맛도 좋아진답니다.', 'image_url': 'https://recipe1.ezmember.co.kr/cache/recipe/2017/12/20/f4493619a38dfdb8bc77b92e577abf381.jpg'}, {'step_number': 4, 'description': '왼쪽이 안구운김 오른쪽이 구운김이에요! 확실히 다르죠??', 'image_url': 'https://recipe1.ezmember.co.kr/cache/recipe/2017/12/20/98a30b0d60fe1ed2255fa0c92ab769291.jpg'}, {'step_number': 5, 'description': '이렇게 구운김은 위생봉투에 담아 잘게잘게 부숴 준비해 주세요.', 'image_url': 'https://recipe1.ezmember.co.kr/cache/recipe/2017/12/20/18621ad6a0a5bab4659fa24e7a139b9d1.jpg'}, {'step_number': 6, 'description': '계란도 미리 풀어서 준비해 준 후,', 'image_url': 'https://recipe1.ezmember.co.kr/cache/recipe/2017/12/20/e1e4325e19dfc9af1e07e85090364cdd1.jpg'}, {'step_number': 7, 'description': '아까 미리 만들어 놓은 육수에 다진마늘 1큰술', 'image_url': 'https://recipe1.ezmember.co.kr/cache/recipe/2017/12/20/01dd16007a73ac17a93904ec900d2a0e1.jpg'}, {'step_number': 8, 'description': '멸치액젓 2큰술, 국간장 1큰술넣고', 'image_url': 'https://recipe1.ezmember.co.kr/cache/recipe/2017/12/20/c1443762a4d91d6b262e4cce32b4daf71.jpg'}, {'step_number': 9, 'description': '부숴놨던 구운 돌김을 넣어 끓여주세요.', 'image_url': 'https://recipe1.ezmember.co.kr/cache/recipe/2017/12/20/23f45d7f4a6362fa348632d9e4cb347c1.jpg'}, {'step_number': 10, 'description': '미리풀은 계란도 넣어 끓여주세요. 부족한간은 소금을 이용해서 맞춰주면 돼요.^^', 'image_url': 'https://recipe1.ezmember.co.kr/cache/recipe/2017/12/20/a1c8bf298061763cecb4bd0b99be0bea1.jpg'}, {'step_number': 11, 'description': '마지막으로 썰은파 한줌 넣고 우르르 끓여주면 김국완성!!!', 'image_url': 'https://recipe1.ezmember.co.kr/cache/recipe/2017/12/20/a66af6f823a257855018e6014f56f34a1.jpg'}]"
48015,국/탕,일상,건어물류,끓이기,국물이 끝내줘요~ 초간단 시원한,미역국,https://recipe1.ezmember.co.kr/cache/recipe/2015/06/09/36229b79fe1cbac62805100d08f2f3bb.jpg,"32,809",60분 이내,초급,3인분,[],강원도 원주 5 일장이 설 때 마다 빠지지 않고 구입하는 통영 굴~ 언제나 먹어두 입맛 땡기는 굴... 초고추장에 맨 먼저 덥석 찍어 먹고 소주 한잔 기울이고.. 굴전으로 입맛 살려주고.. 굴국밥에 굴밥에... 굴을 무지 좋아하는 우리 식구들~ 요즘 굴을 많이 먹어서인가 얼굴이 포얗게 좋아진것두 같고 으흠..체력두 한결 좋아진거 같은 기분~ㅋㅌ한참 동안 미역국을 안 먹은것 같아..남은굴 어찌 먹을까 하다... 초간단하게 빠른 시간에 만들어 시원하게 먹을수 있는 굴 미역국.. 담백한 국물이 끝내줍니다.. 시원한 국 미역국 같이 끓여봐요~,"[{'step_number': 1, 'description': '1.미역을 찬물에 담궈 충분히 불린 후 큰것은 먹기 좋은 크기로 손으로 뜯어 주고 \n물기를 꼭 ~ 짜 준비 합니다. ㅡ>저는 짧게 자른 미역 사용했어요...\n그래두 큰것이 있드라구요..칼로 써는것보다 손으로 뜯어 주는게 왠지 더 맛난거 같아욤..^^ 10분정도만 담궈 두면 부드럽게 금방 불어나요. ..불린 미역양이 너무 많으시면 불린채로 냉동실에 팩에 넣어 보관해서 다음번에 쓰시거나\n무 생채나 북어채 ..미역이랑 같이 새콤달콤하게 무쳐 반찬으로 내셔두 돼욤~', 'image_url': 'https://recipe1.ezmember.co.kr/cache/recipe/2016/06/28/f23c943ba6c2fc69b7fd1ddba243e757.jpg'}, {'step_number': 2, 'description': '2. 옅은 소금물에 싱싱한 굴도 하나하나 굴껍질이 없는지 확인하며 살살 흔들어 씻어 건져 둡니다.', 'image_url': None}, {'step_number': 3, 'description': '3.깊고 넓은 냄비를 달군 후 들기름 1큰술을 넣어 주고\n물기 뺀 미역 과 국간장 1과 1/2큰술을 넣고 재빨리 달달 볶아줍니다.', 'image_url': None}, {'step_number': 4, 'description': '4.미역이 볶아지면 생수를 볶은 미역이 반정도 잠기게 부어 주고\n센불에서 자글자글 한소끔 끓여 미역이랑 국간장이랑 어울어져 간이 베여들게 끓여 준 다음\n미역국물을 잡아줍니다.. 미역이 잠겨 찰랑할 정도 잡아 주세요..저희집은 국물을 좋아해 밥공기로 3공기가 딱.. 맞네요~', 'image_url': None}, {'step_number': 5, 'description': '5.센불에서 뚜껑을 덮고 한소끔 끓여주세요.\n보글보글 한소끔 끓어 오르면 중불로 낮추어 5분정도 끓여주고 미역을 건져 먹었을때 미역이 좀 더 부드럽게 퍼지고 썰껑 거리는 느낌이 없어지면\n간을보고 싱거우면 볶은소금으로 간을 맞추어 줍니다..', 'image_url': None}, {'step_number': 6, 'description': '6.미역국에 간이 맞으면 준비한 굴을 넣어 한소끔 다시 한번 끓여 굴이 익으면 바로 불을 끕니다..\n굴 넣은 후 너무 오래 끓이면 굴 향과 맛이 떨어져요~ 들깨를 좋아하시면 여기에 들깨기피를 1큰술 넣어주심 국물이 한층 더 고소합니다..\n오늘 물향기는 맑은 미역국으로~ 굴 미역국이 해장으로두 좋구요~\n속이 쓰려 소화력이 약하신분..아가들..등등... 간단하게 만들수 있는 굴 미역국...시원한 국물로 오늘 한그릇씩 ~', 'image_url': 'https://recipe1.ezmember.co.kr/cache/recipe/2016/06/28/f093ea606431ca1b6a686f0387e5a54b.jpg'}]"
48016,국/탕,일상,건어물류,끓이기,황태국 만드는법,황태국,https://recipe1.ezmember.co.kr/cache/recipe/2016/02/15/4301072b61e299116cfb4fae6979d48d1.jpg,"60,068",30분 이내,초급,5인분,"[('황태', ''), ('무', ''), ('두부', ''), ('대파', ''), ('다진마늘', ''), ('계란', ''), ('새우젓', ''), ('간장', ''), ('디포리육수', '')]",국이 없으면 밥이 안 넘어간다는 아들녀석 때문에 거의 매일 국을 끓이게 되는데요. 오늘은 두부와 무 넣고 황태국 끓여봤어요. 백종원 레시피대로 북어를 물에 살짝 불려서 하니 훨씬 더 쉽게 되네요. 백종원 레시피 완전 좋아요. 디포리육수 넣어서 끓인 거라 국물이 진해서 더 맛있는 황태국이 되더라고요. 북어국도 이렇게 끓여내면 좋아요. 황태국 만드는법 알려드릴게요.,"[{'step_number': 1, 'description': '먼저 백종원 레시피의 팁대로 하자면 황태를 물에 살짝 불려주세요. 이렇게 하면 국물이 잘 우러나오겠죠. 황태 불렸던 물은 육수로 사용해도 좋아요.', 'image_url': 'https://recipe1.ezmember.co.kr/cache/recipe/2016/03/11/89dc77cbe2d476af5426067998e423421.jpg'}, {'step_number': 2, 'description': '불린 황태, 무, 두부, 대파 준비했고요. 무는 얇게 썰어주세요. 콩나물 넣어줘도 좋고 저처럼 무와 두부 넣어줘도 좋아요.', 'image_url': 'https://recipe1.ezmember.co.kr/cache/recipe/2016/03/11/38f1135c9a1e3f523dc1bbb7977f9eb41.jpg'}, {'step_number': 3, 'description': '냄비에 불린 황태, 무, 들기름 넣고 먼저 볶아줬어요.', 'image_url': 'https://recipe1.ezmember.co.kr/cache/recipe/2016/03/11/427039a4fef2f918e3c4c4d2fa7fb0721.jpg'}, {'step_number': 4, 'description': '참기름, 들기름 상관없고요. 무 얇게 썰어서 넣어주면 시원한 맛이 더해지겠죠.', 'image_url': 'https://recipe1.ezmember.co.kr/cache/recipe/2016/03/11/d41e54f361392b97fa2ad28a3293b4ae1.jpg'}, {'step_number': 5, 'description': '3분 이상 먼저 볶아주세요. 그런 다음 아까 황태 불려둔 물 육수로 넣어줘도 좋은데요. 저는 디포리 육수 사용했어요.', 'image_url': 'https://recipe1.ezmember.co.kr/cache/recipe/2016/03/11/89038f111985119b102fca754f7c3c9d1.jpg'}, {'step_number': 6, 'description': '평소에는 주로 멸치육수 사용하는데요. 디포리 한번 맛보고는 디포리로 갈아탔답니다. 천연조미료라서 디포리육수로 요리하면 진짜 맛있거든요. 5리터 육수 내놓으면 금새 없어져요.', 'image_url': 'https://recipe1.ezmember.co.kr/cache/recipe/2016/03/11/1c6f8b26466b1d6c575bd8bdfb666e0e1.jpg'}, {'step_number': 7, 'description': '디포리와 국물용 멸치, 다시마 넣고 푹 끓여주면 되네요.', 'image_url': 'https://recipe1.ezmember.co.kr/cache/recipe/2016/03/11/a39bd40a26a85556f961315b909d35ba1.jpg'}, {'step_number': 8, 'description': '디포리육수는 김치냉장고에 항상 준비해두고 있네요.', 'image_url': 'https://recipe1.ezmember.co.kr/cache/recipe/2016/03/11/59eb7fa4e7e040df36ca7076953698401.jpg'}, {'step_number': 9, 'description': '황태국에 육수로 디포리육수 넣어줬어요.', 'image_url': 'https://recipe1.ezmember.co.kr/cache/recipe/2016/03/11/0fb14d0fda794b3709e3e5f5fbefe7141.jpg'}, {'step_number': 10, 'description': '확실히 육수가 들어가니 국물 맛이 더 좋긴 하더라고요. 센 불에서 끓여주세요.', 'image_url': 'https://recipe1.ezmember.co.kr/cache/recipe/2016/03/11/297f3a166c582a568f870a5b586691ef1.jpg'}, {'step_number': 11, 'description': '황태국에 계란도 준비했고요.', 'image_url': 'https://recipe1.ezmember.co.kr/cache/recipe/2016/03/11/3eb847b2d44d7f0d5722c727e4580c751.jpg'}, {'step_number': 12, 'description': '황태국 어느 정도 끓여준 뒤 계란 넣어주면 된답니다.', 'image_url': 'https://recipe1.ezmember.co.kr/cache/recipe/2016/03/11/c2bb97fb16f493bf5edf67ffbb4ef96c1.jpg'}, {'step_number': 13, 'description': '계란 넣고는 젓지 마세요. 안 그럼 국물이 탁해지거든요.', 'image_url': 'https://recipe1.ezmember.co.kr/cache/recipe/2016/03/11/512a894590e54afc6e56f04ae3c2f1a21.jpg'}, {'step_number': 14, 'description': '국간장 넣으라는데 그냥 진간장 한수 저 넣어줬어요. 간장 많이 넣으면 국물이 탁해지니까 국 양에 따라서 한두 수저 넣어주면 될듯해요.', 'image_url': 'https://recipe1.ezmember.co.kr/cache/recipe/2016/03/11/7a59ebd242d3017e5d5ec7d5c9f98c6f1.jpg'}, {'step_number': 15, 'description': '집밥백선생의 북어국 팁은 바로 새우젓으로 간을 하는 거네요. 평소에 소금간 했었는데 새우젓 넣어보니 감칠맛이 나는 게 훨씬 더 맛있어요. 새우젓으로 부족한 간 맞춰줬답니다.', 'image_url': 'https://recipe1.ezmember.co.kr/cache/recipe/2016/03/11/48b14bb6695271b9be72e13f638319171.jpg'}, {'step_number': 16, 'description': '마지막에 대파 넣어주면 끝.', 'image_url': 'https://recipe1.ezmember.co.kr/cache/recipe/2016/03/11/d58e57f8c1118ca639658dd89c2691721.jpg'}, {'step_number': 17, 'description': '한 번만 끓여내면 황태국 완성이네요.', 'image_url': 'https://recipe1.ezmember.co.kr/cache/recipe/2016/03/11/2eeb8357b5e97d8ac21b6f3a2bb0a5501.jpg'}, {'step_number': 18, 'description': '국물 맛이 좋은 황태국 완성. 디포리육수로 끓여내서 훨씬 더 깊고 진한 맛이랍니다. 술 마신 다음날 마시면 속이 확 풀릴 것 같아요. 아침에 부담 없이 먹을 수 있는 맑은 국이라서 좋아요. 확실히 육수를 사용하니 맛이 틀려지네요.', 'image_url': 'https://recipe1.ezmember.co.kr/cache/recipe/2016/03/11/579aae3a9d712a9f37d02356c12316ba1.jpg'}]"
48017,국/탕,일상,건어물류,끓이기,"생미역으로 끓여 더 더욱 시원한~ 미역국 입니다. 들깨미역국, 황태 미역국",들깨미역국,https://recipe1.ezmember.co.kr/cache/recipe/2016/11/30/636866ca3b7bbef55bd9fbf7d699f0251.jpg,"53,966",30분 이내,아무나,4인분,"[('생미역', '3줌'), ('황태채', '1줌'), ('참기름', '1큰술'), ('멸치', '적당량'), ('다시마 끓인 물', '10컵'), ('국간장', '3큰술'), ('들깨가루', '6큰술')]",시장에 가니 생미역이 나오기 시작했네요. 아직은 가격이 좀 비싸긴 하지만 제일 적은 금액인 삼천원어치 사와서 미역국 한냄비 끓였더니 국물맛이 끝내주게 시원하더군요.​,"[{'step_number': 1, 'description': '생미역은 물을 충분히 붓고 20~30분간 담궈 둡니다. 그냥 물에 담궈 두기만 해도 미역에 붙은 이물질이 떨어져 나가고 미역이 보들보들해~진답니다.', 'image_url': 'https://recipe1.ezmember.co.kr/cache/recipe/2016/11/30/99d6a3ebce6f6bd8ae28d702f4c791021.jpg'}, {'step_number': 2, 'description': '그리고 물에 담궈 두었던 미역을 물을 3~4번씩 갈아 주면서 흔들어 씻어 건져 줍니다. 생미역의 두꺼운 줄기 부분은 따로 잘라내 버리지 마시고 데쳐 초장에 찍어 먹으면 맛나요~', 'image_url': 'https://recipe1.ezmember.co.kr/cache/recipe/2016/11/30/939209a271aa0f3da8aec565b98f2c591.jpg'}, {'step_number': 3, 'description': '그리고 물기뺀 미역을 손으로 한줌씩 잡아 3줌을 준비해 한잎크기로 잘라 주세요.', 'image_url': 'https://recipe1.ezmember.co.kr/cache/recipe/2016/11/30/6e37464634427fc2ef8ba674c91d42581.jpg'}, {'step_number': 4, 'description': '황태채는 물에 담궈 불리는 것이 아니라 물에 담궜다 바로 건져 물기를 꼭 짜 줍니다. 황태채 한줌.', 'image_url': 'https://recipe1.ezmember.co.kr/cache/recipe/2016/11/30/64b7151ea1e4843dcdaf2909b3e397091.jpg'}, {'step_number': 5, 'description': '그리고 달군 냄비에 참기름 1큰술을 두르고 황태채를 볶아 줍니다.', 'image_url': 'https://recipe1.ezmember.co.kr/cache/recipe/2016/11/30/1eef9bfa2aa314a9027a7f5b0d67df771.jpg'}, {'step_number': 6, 'description': '그리고 준비한 미역을 넣고 함께 달달 볶아 줍니다.', 'image_url': 'https://recipe1.ezmember.co.kr/cache/recipe/2016/11/30/7939dfda61291218df3f9261efecc9fe1.jpg'}, {'step_number': 7, 'description': '그리고 멸치, 다시마 끓인물 10컵을 붓고.....', 'image_url': 'https://recipe1.ezmember.co.kr/cache/recipe/2016/11/30/70de2d1bba4706e4293147939e3343c11.jpg'}, {'step_number': 8, 'description': '국간장 3큰술을 넣고 함께 끓여 줍니다.', 'image_url': 'https://recipe1.ezmember.co.kr/cache/recipe/2016/11/30/768daeb11673fba56a3b6a1759dd1b171.jpg'}, {'step_number': 9, 'description': '센불에서 팔팔 끓으면 불을 중~약불로 줄여 국물이 우러나도록 끓여 줍니다.', 'image_url': 'https://recipe1.ezmember.co.kr/cache/recipe/2016/11/30/33d1e66c4a2bf9b5bbb2084bea38ab161.jpg'}, {'step_number': 10, 'description': '그리고 들깨 가루 6큰술을 풀어 넣고 한번 더 끓여 주시면 되겠습니다.', 'image_url': 'https://recipe1.ezmember.co.kr/cache/recipe/2016/11/30/7ee897b784be14933746e045d42141bc1.jpg'}]"
