index,종류별,상황별,재료별,방법별,글 제목,레시피이름,레시피이미지,조회수,조리시간,난이도,인분,재료,소개글,조리순서
151561,양념/잼/소스,일상,돼지고기,볶음,딸아이가 잘먹는 카레 만드는법,카레,https://recipe1.ezmember.co.kr/cache/recipe/2018/07/04/9b1a767a9dcb652de1b501c54470c5241.jpg,"8,145",15분 이내,아무나,4인분,"[('카레                                                                                4인분', '100g'), ('양파', '2개'), ('감자 중', '1개'), ('당근', '1/2개'), ('돼지고기(등심)', '250g'), ('식용유', '적당량'), ('안데스마카분말', '1스푼')]",막내공주가 잘 먹는 카레에도 넣어 만드는 마카에요,"[{'step_number': 1, 'description': '야채는 껍질을 벗겨 줍니다', 'image_url': 'https://recipe1.ezmember.co.kr/cache/recipe/2018/07/04/3152bfe1d48fc233429d7dec6603a0ac1.jpg'}, {'step_number': 2, 'description': '당근과 감자는 깍둑썰기를 하고 양파만 채 썰어 준비했어요\n양파만 채를 썬 이유는 캐러멜라이징 할 때 편해서였고요', 'image_url': 'https://recipe1.ezmember.co.kr/cache/recipe/2018/07/04/117e572f07b604dce92d6a34531c7e191.jpg'}, {'step_number': 3, 'description': '팬에 식용유를 두르고 채 썰은 양파를 넣어 볶아 주었어요\n수분이 모두 날아가 투명한 갈색이 될때까지 볶아주었어요\n양파를 다 볶았으면 돼지고기를 넣고 볶아주었어요\n고기가 반정도 익을 때까지 볶다가 양파와 당근을 넣고 볶아주었어요', 'image_url': 'https://recipe1.ezmember.co.kr/cache/recipe/2018/07/04/a1fb46806266bdd82a874e6cd85c60ee1.jpg'}, {'step_number': 4, 'description': '물 700ml를 붓고 야채가 다 익을 때까지 끓여 준 다음 카레가루를 넣어주세요', 'image_url': 'https://recipe1.ezmember.co.kr/cache/recipe/2018/07/04/0a2540c8f658e431666534f5506c37571.jpg'}, {'step_number': 5, 'description': '마지막으로 마카 분말을 넣어서 끓여주었어요', 'image_url': 'https://recipe1.ezmember.co.kr/cache/recipe/2018/07/04/5f580f30809ccd833340a981538881d81.jpg'}, {'step_number': 6, 'description': '가루가 고운 편이라 녹지 않으면 어쩌나 하고 걱정했는데요\n요래 넣고 저어주니 잘 녹더라고요', 'image_url': 'https://recipe1.ezmember.co.kr/cache/recipe/2018/07/04/39f072c09f1f0492563075aff5d130f11.jpg'}]"
151562,양념/잼/소스,일상,돼지고기,볶음,카레만들기,카레,https://recipe1.ezmember.co.kr/cache/recipe/2020/05/30/efc843e26a27c6aa18b0c16f27cbb6491.jpg,499,30분 이내,초급,6인분 이상,"[('돼지고기 카레용', '600g'), ('감자 작은사이즈', '4개'), ('당근', '1개'), ('새송이버섯', '4개'), ('두부', '1모'), ('카레가루 카레', '2개'), ('양파', '1개')]",돼지고기와 야채를 듬뿍넣어서 그리고 두부까지 넣어서 영양만점 카레를 만들어봅니다,"[{'step_number': 1, 'description': '재료를 준비해요', 'image_url': 'https://recipe1.ezmember.co.kr/cache/recipe/2020/05/28/ae49cfef98809ddb1beea940f9a1a35e1.jpg'}, {'step_number': 2, 'description': '감자를 썰어요', 'image_url': 'https://recipe1.ezmember.co.kr/cache/recipe/2020/05/28/155b9e52bd8be1d3168e946223a46f701.jpg'}, {'step_number': 3, 'description': '양파를 썰어요', 'image_url': 'https://recipe1.ezmember.co.kr/cache/recipe/2020/05/28/069f5e2b76c9f79db64804392b6d6c091.jpg'}, {'step_number': 4, 'description': '당근을 썰어요', 'image_url': 'https://recipe1.ezmember.co.kr/cache/recipe/2020/05/28/95ad8ae10cdf860e13d66565118a449c1.jpg'}, {'step_number': 5, 'description': '새송이버섯을 썰어요', 'image_url': 'https://recipe1.ezmember.co.kr/cache/recipe/2020/05/28/086f12ff65522104ffbc63b6f60145ec1.jpg'}, {'step_number': 6, 'description': '두부를 썰어요', 'image_url': 'https://recipe1.ezmember.co.kr/cache/recipe/2020/05/28/7ec379ff04b5bbf589a44a675f7500e21.jpg'}, {'step_number': 7, 'description': '파기름에 돼지고기를 볶아요', 'image_url': 'https://recipe1.ezmember.co.kr/cache/recipe/2020/05/28/be88bb4430a65ba364b75121d4a0e5231.jpg'}, {'step_number': 8, 'description': '감자를 볶아요', 'image_url': 'https://recipe1.ezmember.co.kr/cache/recipe/2020/05/28/db81b131f83458d669bbea5aaa7270531.jpg'}, {'step_number': 9, 'description': '당근을 볶아요, 양파를 볶아요', 'image_url': 'https://recipe1.ezmember.co.kr/cache/recipe/2020/05/28/559a72441675ef0819dd5bbf984fa5cf1.jpg'}, {'step_number': 10, 'description': '재료를 볶고 있을 때,\n냄비에 물을 끓여요\n그리고 볶았던 재료를 해당 냄비에 넣어요', 'image_url': 'https://recipe1.ezmember.co.kr/cache/recipe/2020/05/28/bf8c653c616c1073127436850f61d10e1.jpg'}, {'step_number': 11, 'description': '감자와 당근이 익었다면\n카레가루를 넣고 저어요', 'image_url': 'https://recipe1.ezmember.co.kr/cache/recipe/2020/05/28/1cbbed917af7682a49e4797d287d7d171.jpg'}, {'step_number': 12, 'description': '마지막을 두부넣고 끝', 'image_url': 'https://recipe1.ezmember.co.kr/cache/recipe/2020/05/28/fbc4326cc22c096529c727ac2e99f8de1.jpg'}]"
151563,양념/잼/소스,일상,돼지고기,볶음,돼지고기 다짐육 볶음,돼지고기다짐육볶음,https://recipe1.ezmember.co.kr/cache/recipe/2020/09/03/7e17994c8198d12dc505b22200417a6c1.jpg,"3,852",5분 이내,초급,2인분,"[('돼지고기 다짐육', '100g'), ('양파', '1/4개'), ('고추', '1개'), ('미향', '1T'), ('간장', '1T'), ('매실청', '1T'), ('다진마늘', '1T')]",돼지고기 다짐육 볶았어요,"[{'step_number': 1, 'description': '다짐육 100g 에 미향 1T , 간장 1T, 매실청 1T, 다진마늘 1T 넣고 섞어주세요', 'image_url': 'https://recipe1.ezmember.co.kr/cache/recipe/2020/09/03/b31409eff6ff69aa15ce0a447dfca3aa1.jpg'}, {'step_number': 2, 'description': '중불에 다짐육을 볶아주세요', 'image_url': 'https://recipe1.ezmember.co.kr/cache/recipe/2020/09/03/d18f7cc9af4a29dcb6cbda363f40ba021.jpg'}, {'step_number': 3, 'description': '고기가 익으면 다진 양파와 잘게 썬 고추를 넣고 가볍게 볶아주세요', 'image_url': 'https://recipe1.ezmember.co.kr/cache/recipe/2020/09/03/82d736354ad59e3b38f33755a3f7707e1.jpg'}]"
151564,양념/잼/소스,일상,돼지고기,볶음,#맛남의광장 #라면스프만들기 #된장과 한돈햄을 넣어서 만드는 라면스프,라면스프,https://recipe1.ezmember.co.kr/cache/recipe/2021/02/25/dc8ecf8a9a1e3ee35e88ecd8920d38f01.jpg,"2,788",20분 이내,아무나,6인분 이상,"[('햄통조림 한돈 캔', '3개'), ('라면스프', '100g'), ('된장', '2큰술'), ('고춧가루', '1큰술'), ('다진마늘', '1큰술'), ('라면', '2봉지'), ('썬파', '2큰술'), ('천연조미료육수', '700ml')]","만남의광장에서 한돈편이 나왔는데, 한돈의 뒷다리살을 이용해서

스팸처럼 통조림햄을 만들었네요.

​

그 햄을 이용해서 라면스프를 만들었는데, 그 맛이 궁금하더라구요.

솔직히, 저건 어거지다....라고도 생각이 들었습니다.

그럼에도 맛이 궁금해서는 한번 해 보았습니다.

​

그런데 마치 부대찌개라면 같더라구요.

요즘에 그런 라면도 나오니까요. ^^

햄보다는 뒷다리살다짐육이 더욱 맛있을꺼 같다라는 생각도 들었습니다.

만들어서는 냉장고에 보관해서 그때그때 라면사리 넣고 만드셔도 좋습니다.","[{'step_number': 1, 'description': '한돈햄을 잘게 잘게 다져 줍니다.', 'image_url': 'https://recipe1.ezmember.co.kr/cache/recipe/2021/02/25/09d03f2e83980a1fa5e44df5578d6abf1.jpg'}, {'step_number': 2, 'description': '먼저 팬에 햄부터 볶아 줍니다. 기름은 자연스럽게 햄에서 나옵니다.', 'image_url': 'https://recipe1.ezmember.co.kr/cache/recipe/2021/02/25/e5d1dae930fd46d145f968f118ca21d71.jpg'}, {'step_number': 3, 'description': '여기에 라면스프, 된장을 넣어서 같이 볶아 줍니다. 그럼 라면스프 완성입니다.', 'image_url': 'https://recipe1.ezmember.co.kr/cache/recipe/2021/02/25/19b7b289396dd1784ec32b6cdea6c55c1.jpg'}, {'step_number': 4, 'description': '햄에서 나온 기름이랑 된장, 라면스프가 어우러지면서 매콤한 향이 나네요. 이건 그냥 밥에 볶아서 먹어도 맛있겠는데요. 단!!! 라면스프로 인해서 간이 쌔다라는 것이죠.', 'image_url': 'https://recipe1.ezmember.co.kr/cache/recipe/2021/02/25/d5e1c510a181a2c656322073e310cff71.jpg'}, {'step_number': 5, 'description': '냉장고에 담아서는 두고두고 활용해서 사용할 수 있습니다. 순두부찌개에 넣어도 맛있고요. 부대찌개 양념으로도 활용하셔도 좋습니다.', 'image_url': 'https://recipe1.ezmember.co.kr/cache/recipe/2021/02/25/0c3f732267a18f793ef7405dddac5d661.jpg'}, {'step_number': 6, 'description': '드디어 라면을 끓여 줍니다. 육수를 부어 주고는 만들어 놓았던 한돈햄 라면스프를 넣어서 끓여 줍니다.', 'image_url': 'https://recipe1.ezmember.co.kr/cache/recipe/2021/02/25/3514937f3d9c88e104b6c4d7cd7a02991.jpg'}, {'step_number': 7, 'description': '면을 넣어 줍니다. 저는 면사리를 넣어 주었습니다. 라면스프는 원래 가지고 있었던 것을 활용했기 때문입니다.', 'image_url': 'https://recipe1.ezmember.co.kr/cache/recipe/2021/02/25/1257bec29eb2b055e6a0bfa3640405041.jpg'}, {'step_number': 8, 'description': '마치 부대찌개라면 같은 느낌도 나고요. 만남의 광장 한돈햄을 이용한 라면 완성입니다.', 'image_url': 'https://recipe1.ezmember.co.kr/cache/recipe/2021/02/25/ecbd91f6f644bc1eb851117aa1f2f6d21.jpg'}]"
151565,양념/잼/소스,일상,돼지고기,볶음,"돼지고기볶음고추장, 이게 진짜 만능 양념장!/ 비빔밥 양념장으로 맛있게!",돼지고기볶음고추장,https://recipe1.ezmember.co.kr/cache/recipe/2021/06/23/dca25969ed370e03882502ddc13763a91.jpg,"2,689",60분 이내,초급,3인분,"[('돼지고기 다짐육', '300g'), ('사과', '1개'), ('파', '적당량'), ('다진마늘', '1.5T'), ('고추장', '3T'), ('된장', '1.5T'), ('고춧가루', '1T')]","저는 나물을 넣은 비빔밥을 정말 좋아해요.
비빔밥에 넣어 같이 비벼먹으면 정말 맛있는 돼지고기볶음고추장입니다.","[{'step_number': 1, 'description': '저는 사과즙이 없어서 사과한개를 갈아버렸습니다!\n강판에 사과를 신나게 밀어서 사과즙을 만들었어요.사과강판', 'image_url': 'https://recipe1.ezmember.co.kr/cache/recipe/2021/06/23/39b9a7e99fc5cbece29273e64d1bb4391.jpg'}, {'step_number': 2, 'description': '파도 송송 썰어주세요. 저는 파를 썰어서 냉동실에 넣어둔 것이 있었기에 이걸 사용했어요.\n이제 재료 준비는 끝입니다. 양파넣으시는 분들도 많던데 저는 귀찮아서 생략했어요. 넣으실분들은 잘게 다져서 넣으시면 됩니다.\n이제 팬에 기름을 두르고 파를 넣어서 파기름을 내주세요.파- 달궈진 팬이 아닌, 처음부터 파를 넣어서 파기름을 내주시면 됩니다.', 'image_url': 'https://recipe1.ezmember.co.kr/cache/recipe/2021/06/23/9b94c81b994b2e8ccf543f4e5eaf4ba91.jpg'}, {'step_number': 3, 'description': '파의 향이 솔솔 올라오면서 파기름이 좀 올라온다 싶으면 사과즙을 넣어줍니다.\n그리고 사과즙을 잘 볶아준 후 다진마늘 1.5스푼을 넣어주었구요. 살살 볶아주다가 다짐육을 넣어줍니다.\n다짐육은 덩어리로 되어있으니, 젓가락으로 잘 풀면서 익혀주시면 됩니다.\n(저는 해동이 완벽히 되지않아서 부분적으로 얼어있는 부분이 있어요.)사과즙, 다진마늘, 다짐육- 사과즙은 맨 마지막 단계에서 넣어주셔도 되요.', 'image_url': 'https://recipe1.ezmember.co.kr/cache/recipe/2021/06/23/c49787069d7ed0242b48022e2cbf347d1.jpg'}, {'step_number': 4, 'description': '이때부터 좀 정신이 없어서 사진을 못 찍었어요.\n다짐육 고기가 있었다 싶으시면 고추장 3스푼, 된장 1.5스푼을 넣어줍니다.고추장, 된장- 집집마다 고추장과 된장의 간이 다르므로 조금씩 넣으면서 간을 보시고 추가하시는것을 추천드려요.', 'image_url': 'https://recipe1.ezmember.co.kr/cache/recipe/2021/06/23/62bb0387074c9757f73243cf69662cb31.jpg'}, {'step_number': 5, 'description': '그렇게 잘 볶아주면 대충 이런 모습이 나옵니다.', 'image_url': 'https://recipe1.ezmember.co.kr/cache/recipe/2021/06/23/ca7e4ac68f603727c600c8c41417ff771.jpg'}, {'step_number': 6, 'description': '그러면 고춧가루 1스푼까지 넣고 잘 섞어주면 끝!고춧가루', 'image_url': 'https://recipe1.ezmember.co.kr/cache/recipe/2021/06/23/5c802ed058ad75f2508ceb27c1d4bb451.jpg'}, {'step_number': 7, 'description': '짠! 한김 식혀서 통에 담아주었어요.\n간 보려고 잠깐 찍어먹어봤는데 바로 맨 밥에 비벼먹고 싶은 충동이.....', 'image_url': 'https://recipe1.ezmember.co.kr/cache/recipe/2021/06/23/ae55055497ac60a2d2cffd9b7affecf61.jpg'}, {'step_number': 8, 'description': '갓 한 밥에 반숙 후라이 하나 올리구요.\n직접 만든 콩나물무침과 무생채, 시금치무침도 먹을만큼 올려줍니다. 그리고 방금 만든 돼지고기볶음고추장 한스푼 딱!\n노른자 터트리며 샥샥 비벼주면 정말 너무 맛있어요.\n많이 넣어도 하나도 안짜고 맛있더라구요.\n입맛을 더욱 살려주는 돼지고기볶음고추장 레시피였습니다.', 'image_url': 'https://recipe1.ezmember.co.kr/cache/recipe/2021/06/23/51b3fb1ed96f30d688711abe1d7375a31.jpg'}]"
151566,양념/잼/소스,일상,돼지고기,볶음,돼지 다짐육 양념장 / 다짐육 된장 양념장,돼지다짐육양념장,https://recipe1.ezmember.co.kr/cache/recipe/2021/07/06/5d279e6d35b9f481647531d1e4c6ce541.jpg,"2,785",20분 이내,아무나,4인분,"[('돼지고기다짐육', '150g'), ('다진 마늘', '1Ts'), ('설탕', '2Ts'), ('맛술', '1Ts'), ('된장', '4Ts'), ('후춧가루', '1꼬집')]","된장으로 만드는 돼지 다짐육 양념장 입니다.

01:58초 부터 보세요.","[{'step_number': 1, 'description': '돼지고기 다짐육을 준비한다.', 'image_url': 'https://recipe1.ezmember.co.kr/cache/recipe/2021/07/06/8a5aaf4b98df231d377f38191f5d43701.jpg'}, {'step_number': 2, 'description': '돼지 다짐육에 다진 마늘, 설탕, 맛술, 된장, 후춧가루를 넣고 섞는다.', 'image_url': 'https://recipe1.ezmember.co.kr/cache/recipe/2021/07/06/b3b035879966711b4de8af25a8389a5a1.jpg'}, {'step_number': 3, 'description': '팬에 기름 없이 고기를 센 불로 볶는다.', 'image_url': 'https://recipe1.ezmember.co.kr/cache/recipe/2021/07/06/7ad2ac81f7f84adbf93269067e84f6121.jpg'}]"
151567,양념/잼/소스,일상,돼지고기,볶음,#냉동해물요리 #해물짜장만들기 #해물짜장소스만들기 #짜장가루 #짜장소스 #검은콩장,해물짜장,https://recipe1.ezmember.co.kr/cache/recipe/2023/09/25/6c1e5fcb365fc741d2a38b4df6a053371.jpg,"2,059",60분 이내,아무나,6인분 이상,"[('양파', '2개'), ('돼지고기 다짐육', '600g'), ('냉동해물', '300g'), ('썬파', '2큰술'), ('파기름', '4큰술'), ('고량주', '1큰술'), ('검은 콩장', '1큰술'), ('치킨스톡', '2큰술'), ('카라멜소스', '3큰술'), ('레드페퍼홀', '1큰술'), ('짜장가루', '7큰술'), ('물', '1L')]","냉동해물과 양파 듬뿍 넣고 다짐육을 넣어서 만든 해물짜장입니다. 해물짜장으로 새우볶음밥 소스로 활용하고, 거기에 라면사리를 넣어서 볶음짜장으로 탄생시킬까 합니다. ​ 간단하게 만든 해물짜장에는 양파, 다짐육, 냉동해물이 기본재료로 들어가고, 거기에 검은콩장, 짜장가루, 카라멜소스, 치킨스톡이 들어가서는 진한 맛을 내어 주었습니다. ​ 느끼한 맛을 감싸주는 레드페퍼홀도 넣어서 칼칼한 해물짜장이 되었습니다.","[{'step_number': 1, 'description': '파기름을 넣고 썬파를 넣어서 볶아 줍니다. 그럼 파의 양이 적어도 됩니다.도마 , 조리용나이프 , 볶음팬.요리스푼', 'image_url': 'https://recipe1.ezmember.co.kr/cache/recipe/2023/09/25/f094dcc3170ad903ef7a783738e410761.jpg'}, {'step_number': 2, 'description': '돼지고기 다짐육을 넣어서 볶아 줍니다. 회색빛이 될때까지 볶는데 서로서로 뭉쳐지지 않도록 풀어가면서 볶아 줍니다.', 'image_url': 'https://recipe1.ezmember.co.kr/cache/recipe/2023/09/25/190736ff52929ad22250483b1f2a56d71.jpg'}, {'step_number': 3, 'description': '회색빛이 돈 돼지고기에 양파를 넣어 줍니다. 양파는 다지지 않고 조금은 잘게 썰어 주었습니다.', 'image_url': 'https://recipe1.ezmember.co.kr/cache/recipe/2023/09/25/b743263d841bb9610b9e839621bc45761.jpg'}, {'step_number': 4, 'description': '냉동해물을 넣어 주고는 매콤한 맛을 위해서 레드페퍼홀과 잡내를 잡기 위해서 고량주나 소주를 넣어 줍니다. 같이 잘 센불에서 볶아 줍니다.', 'image_url': 'https://recipe1.ezmember.co.kr/cache/recipe/2023/09/25/4d5b9e17d85e7302a8a308af95bce9ed1.jpg'}, {'step_number': 5, 'description': '골고루 잘 섞여서 볶아졌다면, 검은콩장과 치킨스톡을 넣어서 같이 볶아 줍니다. 검은콩장은 중국소스 중에 하나 입니다. 원래는 황두장을 넣는 것이 좋지만 없어서 검은콩장으로 대체했습니다. 이연복셰프의 레시피대로 ^^', 'image_url': 'https://recipe1.ezmember.co.kr/cache/recipe/2023/09/25/93239d4c4ea7eb303791ae916aa220f31.jpg'}, {'step_number': 6, 'description': '소스가 잘 골고루 섞어졌습니다. 중식은 무조건 센불입니다.', 'image_url': 'https://recipe1.ezmember.co.kr/cache/recipe/2023/09/25/694a38ee2a42787fb8977c5a12e4b69c1.jpg'}, {'step_number': 7, 'description': '이제 마지막으로 짜장가루를 넣어 줍니다. 그리고는 골고루 섞어가면서 볶아 줍니다. 너무 물기가 없어서 볶기가 힘들다고 생각이 드시면 기름을 조금더 추가로 넣어 주셔도 됩니다.', 'image_url': 'https://recipe1.ezmember.co.kr/cache/recipe/2023/09/25/6f9836b67be82abcf0ca20c9241048a71.jpg'}, {'step_number': 8, 'description': '물을 부어 주고는 센불에서 팔팔 잘 저어가면서 끓여 줍니다. 짜장가루에는 전분기가 있어서 따로 전분물을 넣지 않아도 걸쭉한 상태가 됩니다. 카레가루처럼요.', 'image_url': 'https://recipe1.ezmember.co.kr/cache/recipe/2023/09/25/e1c93b816f153b7c36b02e7f2e88f7281.jpg'}, {'step_number': 9, 'description': '걸쭉하고 진하면서도 단맛도 돌고 짠맛도 돌고 거기에 칼칼한 맛이 도는 짜장소스는 완성되었습니다. 이 해물짜장으로 맨밥 위에 올려서 먹으면 짜장밥이 되는 것이고 면을 넣어서 볶아내면 볶음짜장이 되는 것입니다. 또한 볶음밥 위에 소스로 올려서 먹으면 중식당에서 시켜서 먹는 볶음밥소스가 됩니다.', 'image_url': 'https://recipe1.ezmember.co.kr/cache/recipe/2023/09/25/a387d06a013f6ba3abdf4d3c427048281.jpg'}, {'step_number': 10, 'description': '일단, 짜장소스를 완성그릇에 담아 주었습니다. 해물짜장 완성입니다. 여기에 라면사리를 넣으면 후루룩 후루룩 짜파게티보다 몇배는 맛있는 볶음짜장이 되겠죠. ^^', 'image_url': 'https://recipe1.ezmember.co.kr/cache/recipe/2023/09/25/b8598ed48ca9206fa68588bcf38754181.jpg'}]"
151568,양념/잼/소스,일상,돼지고기,볶음,짜장 만들기 유니짜장만들기 짜장소스 짜장밥 레시피,짜장밥,https://recipe1.ezmember.co.kr/cache/recipe/2024/09/23/27d1c86bc2d700e8c0ba5f7043bb58461.jpg,134,60분 이내,초급,4인분,"[('다진 돼지고기', '300g'), ('양파', '1개'), ('감자', '1개'), ('양배추', '약간'), ('애호박', '1/4개'), ('당근', '약간'), ('식용유', '4스푼'), ('짜장분말', '80g'), ('진간장', '2'), ('다진 마늘', '0.5'), ('물', '1컵')]",유니짜장은 돼지고기와 채소 등의 재료를 잘게 썰어 짜장 가루와 함께 볶아 만든 부드러운 짜장 소스예요. ​일반 짜장과 달리 재료를 잘게 다져서 만들기 때문에 식감이 부드럽고 소화가 잘 되며 조리 과정도 간단한 건 물론이고 조리 시간도 단축되어 바쁜 일상 속에서 만들기 좋은레시피에요. 춘장 대신 시판용 짜장 가루를 이용해서 짜장 만들기 하면 쉬워요. ​직접 볶아야 하는 춘장에 비해 기름이 덜 들어가 칼로리 부담스럽지 않으면서 맛도 크게 차이가 나지 않아요.,"[{'step_number': 1, 'description': '유니짜장 만들기 할 때 고기와 야채를 잘게 다져 만들기 때문에 모든 재료를 다져줘야 해요. 저처럼 믹서기를 활용해 다져 주면 쉽게 다질 수 있어요.도마 , 조리용나이프 , 다지기', 'image_url': 'https://recipe1.ezmember.co.kr/cache/recipe/2024/09/23/4d4f84d3cbe5e2d9d459e0134283143e1.jpg'}, {'step_number': 2, 'description': '야채를 믹서기에 지나치게 오래 갈면 식감이 지나치게 묽어질 수 있으니 적당한 크기로 다져주는 것이 중요해요. 모든 야채를 잘게 다져 주세요.', 'image_url': 'https://recipe1.ezmember.co.kr/cache/recipe/2024/09/23/af4c840a82296d4bc9588306b34881211.jpg'}, {'step_number': 3, 'description': '팬에 식용유를 4스푼 정도 둘러주고 고기를 먼저 볶아주세요.볶음팬 , 조리주걱', 'image_url': 'https://recipe1.ezmember.co.kr/cache/recipe/2024/09/23/12658494a15ab3a73f128851fa9dc88c1.jpg'}, {'step_number': 4, 'description': '고기가 어느 정도 익으면 다진 야채들을 넣고 함께 볶아요. 양파가 투명해지면 고기와 야채를 한쪽으로 몰아 팬에 빈 공간을 만들어 주세요.', 'image_url': 'https://recipe1.ezmember.co.kr/cache/recipe/2024/09/23/018fc9ef2c664e07feb52eba2dae58a31.jpg'}, {'step_number': 5, 'description': '약불로 줄여주세요. 빈 공간에 다진 마늘 0.5스푼 진간장 2스푼 넣고 바글바글 끓여 준 후 모든 재료와 섞어요.숟가락', 'image_url': 'https://recipe1.ezmember.co.kr/cache/recipe/2024/09/23/31d6b28270e73b3ea2b7d2c86c9dc1291.jpg'}, {'step_number': 6, 'description': '약불에서 짜장 가루를 넣어 볶아 줄 거예요. ※ 짜장 가루는 한꺼번에 다 넣지 않고 조금씩 나누어 볶아줘요.', 'image_url': 'https://recipe1.ezmember.co.kr/cache/recipe/2024/09/23/13d3e721ed672d73882796edb7008be51.jpg'}, {'step_number': 7, 'description': '짜장 가루를 한 번에 넣으면 가루가 뭉쳐서 잘 풀어지지 않고 짜장 가루를 넣고 계속 저어주어야 타는 걸 방지할 수 있어요.', 'image_url': 'https://recipe1.ezmember.co.kr/cache/recipe/2024/09/23/bed12db0f4e1a33a7a827e2985b2f3011.jpg'}, {'step_number': 8, 'description': '짜장 가루를 다 넣어주었다면 물 한 컵을 부어주세요. 제품 뒷면에는 500ml 물을 부어주라고 되어 있지만 다진 재료이고 충분히 볶았기 때문에 물을 많이 넣을 필요는 없더라고요. 물 한 컵 부어주고 짜장 소스가 농도가 적당해질 때까지 끓여준 후 불을 꺼주세요.', 'image_url': 'https://recipe1.ezmember.co.kr/cache/recipe/2024/09/23/1bbaa1abbab692be41f0b9c75f707d951.jpg'}, {'step_number': 9, 'description': '그릇에 밥을 담고 그 위에 유니짜장 소스를 올려요. 매콤하게 먹으려고 짜장소스 위에 고춧가루 솔솔 뿌려주었어요. 너무 많이 넣으면 오히려 맛이 떨어질 수 있으니 적당히 넣는 것이 중요해요.국자 , 플레이팅접시', 'image_url': 'https://recipe1.ezmember.co.kr/cache/recipe/2024/09/23/1d6d63f0aa2436bc1206443d39e3c9af1.jpg'}]"
