index,종류별,상황별,재료별,방법별,글 제목,레시피이름,레시피이미지,조회수,조리시간,난이도,인분,재료,소개글,조리순서
76206,밥/죽/떡,초스피드,채소류,비빔,기름에 볶지않은 소세지김치밥 혼밥메뉴 스피드음식,소세지김치밥,https://recipe1.ezmember.co.kr/cache/recipe/2022/04/17/82f05d7eed719246d2258b753c69f1c01.jpg,413,10분 이내,초급,1인분,"[('비엔나소세지', '5개'), ('김치', '1/2컵'), ('참기름', '1T'), ('진간장', '1/2T'), ('통깨', '1T'), ('밥', '1공기')]",아이가 좋아하는 김치로 스피드한게 만든 소세지김치밥이에요..볶지않아 부담스럽지않답니다.,"[{'step_number': 1, 'description': '비엔나소세지는 얇게 썰어서 준비해주세요.', 'image_url': 'https://recipe1.ezmember.co.kr/cache/recipe/2022/04/17/f177048d291c94e62230493d23cc1c0e1.jpg'}, {'step_number': 2, 'description': '팬에 기름을 조금 두르고 바삭하게 구워주세요.', 'image_url': 'https://recipe1.ezmember.co.kr/cache/recipe/2022/04/17/fad5e75666c42c093a54e8a9b2c13a181.jpg'}, {'step_number': 3, 'description': '볼에 김치를 담고 가위로 잘게 잘라주세요.', 'image_url': 'https://recipe1.ezmember.co.kr/cache/recipe/2022/04/17/abf4aa8aed6223005b2dac613c768c3d1.jpg'}, {'step_number': 4, 'description': '자른 김치에 참기름 1T, 진간장 1/2T, 통깨1T넣고 잘 섞어주세요.', 'image_url': 'https://recipe1.ezmember.co.kr/cache/recipe/2022/04/17/79aa1e7a239224b64455c7c6a70ba5e51.jpg'}, {'step_number': 5, 'description': '전자렌지에 두껑을 덮고 1분간 조리해주세요.전자레인지', 'image_url': 'https://recipe1.ezmember.co.kr/cache/recipe/2022/04/17/ca6e3b193d3a2aeacf36f3d9f0c841141.jpg'}, {'step_number': 6, 'description': '조리한 김치양념에 밥한공기와 구운햄 반을 넣고 잘 비벼주세요.', 'image_url': 'https://recipe1.ezmember.co.kr/cache/recipe/2022/04/17/43ac685a4ff0f52203391e13fe88707c1.jpg'}, {'step_number': 7, 'description': '비빈밥은 접시에 이쁘고 옮겨담아주세요.', 'image_url': 'https://recipe1.ezmember.co.kr/cache/recipe/2022/04/17/b2e8b48280849697c2fa8c9a31bba7131.jpg'}, {'step_number': 8, 'description': '밥위에 남은 햄을 토핑해주면 소세지김치밥 완성입니다.\n맛있게드세요~', 'image_url': 'https://recipe1.ezmember.co.kr/cache/recipe/2022/04/17/e4b1d331f3b07c087133154af290f8b81.jpg'}]"
76207,밥/죽/떡,초스피드,채소류,비빔,밥하기귀찮을때 간편한 부추비빔밥레시피,부추비빔밥,https://recipe1.ezmember.co.kr/cache/recipe/2022/04/22/8e89c15608a536d13c56658f94276ff51.jpg,"1,258",5분 이내,아무나,1인분,"[('밥', '1공기'), ('부추', '50g'), ('고추장', '1스푼'), ('참기름', '1스푼'), ('계란', '1개'), ('포도씨유', '적당량')]","부추가 냉장고에 있어서 비벼 먹기 참 좋은 부추 비빔밥 
주말에 한번 만들어 드셔보세요","[{'step_number': 1, 'description': '부추를 준비해주세요\n부추 50g준비했습니다.', 'image_url': 'https://recipe1.ezmember.co.kr/cache/recipe/2022/04/22/b29c61c89a7367914692f76f9b5d0e141.jpg'}, {'step_number': 2, 'description': '부추를 보면 밑부분은 바로\n뿌리부분쪽이 흙이 많이\n뭍어있는것을 볼수있어요\n밑 부분 뿌리를 잘 세척해주시면 좋아요\n세척후 물에 3번 헹귀어서 물기를 털어주세요', 'image_url': 'https://recipe1.ezmember.co.kr/cache/recipe/2022/04/22/b1c3fa50649da9f3bb27d00fa0d1a7fd1.jpg'}, {'step_number': 3, 'description': '부추는 아래쪽을 살짝 잘라주세요\n그리고 먹기 좋은 크기로 1cm 정도로 썰어주세요\n부추만 들어가서 정말 쉽지요', 'image_url': 'https://recipe1.ezmember.co.kr/cache/recipe/2022/04/22/295e446c1cb64d6df53ddfc5429570261.jpg'}, {'step_number': 4, 'description': '후라이팬에 포도씨유를 두르고 중불로 시작해주세요\n후라이를 할때 1개면 부족하지요 3개정도 넣어서 후라이를 만들어주세요', 'image_url': 'https://recipe1.ezmember.co.kr/cache/recipe/2022/04/22/997bc61e0366aebc28cee300b588c45c1.jpg'}, {'step_number': 5, 'description': '그리고 뚜껑을 닫으면\n살짝 계란이 익어서 더 맛나는 계란후라이를 만들수있어요', 'image_url': 'https://recipe1.ezmember.co.kr/cache/recipe/2022/04/22/3819d3eac2a543f46c5463427fc4a7e11.jpg'}, {'step_number': 6, 'description': '밥1공기를 그릇에 담아주세요', 'image_url': 'https://recipe1.ezmember.co.kr/cache/recipe/2022/04/22/f13689c158f095c930fa6307bcb7aac21.jpg'}, {'step_number': 7, 'description': '그리고 부추를 주위로 하여서 예쁘게 담아주세요', 'image_url': 'https://recipe1.ezmember.co.kr/cache/recipe/2022/04/22/d661dd0a7bcc137ff6211f88d932654e1.jpg'}, {'step_number': 8, 'description': '고추장1스푼', 'image_url': 'https://recipe1.ezmember.co.kr/cache/recipe/2022/04/22/f8eed240283c3beeac6346a29c8ee2b51.jpg'}, {'step_number': 9, 'description': '참기름1스푼', 'image_url': 'https://recipe1.ezmember.co.kr/cache/recipe/2022/04/22/e62820279def24925b2b9dc3bd34fe9c1.jpg'}, {'step_number': 10, 'description': '마지막으로 계란을 올려주세요', 'image_url': 'https://recipe1.ezmember.co.kr/cache/recipe/2022/04/22/b27fae56579aa0ae7db2d0fb61f8c39d1.jpg'}, {'step_number': 11, 'description': '어쩌다 사장 보다가 저도 어쩌다 부추비빔밥 완성했습니다.', 'image_url': 'https://recipe1.ezmember.co.kr/cache/recipe/2022/04/22/0c5115fd9ca077b4e4f7dcbaa1d8fea61.jpg'}]"
76208,밥/죽/떡,초스피드,채소류,비빔,●김치볶음밥 환장하는데 살찔까바 걱정이라면? 저칼로리 건강식단 김치밥❤️●,김치밥,https://recipe1.ezmember.co.kr/cache/recipe/2023/03/12/900be7c1220fd02a88eab8a9d4656e891.jpg,"2,091",30분 이내,아무나,2인분,"[('김치', '200~300g'), ('고춧가루', '1.5큰술'), ('황설탕', '1작은술'), ('다진마늘', '1큰술'), ('표고버섯', '5개'), ('백미', ''), ('현미', '취향껏'), ('잡채용 고기', '200g'), ('소주', '1큰술'), ('천일염', '1/2큰술'), ('후춧가루', '1작은술'), ('생수', '적당히'), ('부추', '10줄'), ('다진마늘', '1큰술'), ('고춧가루', '1큰술'), ('간장', '3큰술'), ('매실청', '1큰술'), ('통깨', '1큰술'), ('황설탕', '1작은술'), ('참기름', '1큰술'), ('미지근한물', '조금')]",●김치볶음밥은 만인의 1등 음식! 근데 항상 먹고 나면 속이 편하지 않거나 식단 관리 하는 다이어터들에게 딱! 기름기 없이 매콤 아삭한 김치밥으로 드셔보세영!❤️●,"[{'step_number': 1, 'description': '●표고버섯은 눈썹 모양으로썰어서 준비해주세영!●\n●잡곡쌀은 3~4번 깨끗이 씻어서 잠시 불려주세요!●도마 , 요리용나이프', 'image_url': 'https://recipe1.ezmember.co.kr/cache/recipe/2023/03/12/c8590f69a3c185eb2f31dc33b2141cb71.jpg'}, {'step_number': 2, 'description': '김치는 색감&신맛을 잡기 위해 김치 양념에 들어가는 재료들을 다 넣고 잘 섞어준 뒤 10분간 재어둡니당!', 'image_url': 'https://recipe1.ezmember.co.kr/cache/recipe/2023/03/12/7ddcb4a01f8cc8a10aec20514d0279c81.jpg'}, {'step_number': 3, 'description': '돼지고기의 잡내를 잡기 위해 잡내용 재료들을 다 넣고 잘 섞어 준 뒤 10분간 숙성 시켜주세영!', 'image_url': 'https://recipe1.ezmember.co.kr/cache/recipe/2023/03/12/df065fa7af737762534f67e54f25fb1a1.jpg'}, {'step_number': 4, 'description': '미리 불려 놓은 잡곡쌀을 밥솥에 먼저 깔아 주고 생수를 손바닥 위 만큼 올라올 정도록 물양을 맞춰주세영!압력밥솥', 'image_url': 'https://recipe1.ezmember.co.kr/cache/recipe/2023/03/12/f9e3521d427bf1a7f63d18074eb6daf41.jpg'}, {'step_number': 5, 'description': '잠시 재어 둔 김치를 넣고 숟가락으로 펼쳐주세요!', 'image_url': 'https://recipe1.ezmember.co.kr/cache/recipe/2023/03/12/0220193d15fe4c71fa10266fa02436951.jpg'}, {'step_number': 6, 'description': '숙성 시킨 잡채용 고기를 넣어주세영!', 'image_url': 'https://recipe1.ezmember.co.kr/cache/recipe/2023/03/12/de4bc9c28fe7506db6f9b8356c26b5181.jpg'}, {'step_number': 7, 'description': '표고 버섯을 제일 위에 골고루 깔아주세영!', 'image_url': 'https://recipe1.ezmember.co.kr/cache/recipe/2023/03/12/38801dcbfaeed3fdd18c715cc65091f81.jpg'}, {'step_number': 8, 'description': '압력 밥솥에 넣고 취사 버튼을 눌려주세영!', 'image_url': 'https://recipe1.ezmember.co.kr/cache/recipe/2023/03/12/705e76ed130988244ee603b63af4787a1.jpg'}, {'step_number': 9, 'description': '밥을 짓는 사이 비빔밥 양념용 재료들을 준비해주세영!도마 , 요리용나이프', 'image_url': 'https://recipe1.ezmember.co.kr/cache/recipe/2023/03/12/921c09a417e3ba86fc8f973d18f0fd2e1.jpg'}, {'step_number': 10, 'description': '준비된 양념장 재료들을 다 넣고 마지막에 미지근한 물을 조금 넣고 잘 섞어주세영!볼,나무스푼', 'image_url': 'https://recipe1.ezmember.co.kr/cache/recipe/2023/03/12/05f7f695d6b7703ff524638465a114911.jpg'}, {'step_number': 11, 'description': '밥이 다 지어지면 잠시 뜸 들인 후 열어서 한번 깊이 잘 섞어 주세영!주걱', 'image_url': 'https://recipe1.ezmember.co.kr/cache/recipe/2023/03/12/3ea50076fb377253042d93942005e1c81.jpg'}, {'step_number': 12, 'description': '이쁜 그릇에 김치밥&비빔밥 양념장을 플레이팅 해서 준비해주세영!', 'image_url': 'https://recipe1.ezmember.co.kr/cache/recipe/2023/03/12/639bdd22c4bc8c29166cb8176cc1b4f11.jpg'}, {'step_number': 13, 'description': '취향대로 양념장을 넣고 슥슥 비벼서 맛있게 드세영!❤️', 'image_url': 'https://recipe1.ezmember.co.kr/cache/recipe/2023/03/12/3b5e8b15a4700f5ee0daffe48e7961ad1.jpg'}]"
76209,밥/죽/떡,초스피드,채소류,비빔,봄나물 한그릇 뚝딱 돌나물참치비빔밥 만들기,돌나물참치비빔밥,https://recipe1.ezmember.co.kr/cache/recipe/2023/03/01/2655c78e3f33a0bca035bce8ec934be01.jpg,513,10분 이내,아무나,1인분,"[('돌나물', '130g'), ('밥', '1공기'), ('달걀', '1개'), ('캔참치', '1/2캔'), ('김가루', '1젓가락'), ('고추장', '1숟갈'), ('식초', '2숟갈'), ('설탕', '1.3숟갈'), ('다진마늘', '1티스푼'), ('참기름', '1숟갈')]",봄하면 나물이 참 향긋하고 맛있는 시기죠. 그중에서도 저는 돌나물을 참 좋아해요. 아삭아삭하고 향긋한 맛이 참 좋죠. 오늘은 참치와 함께 비벼먹는 돌나물참치비빔밥 만들기입니다. 새콤한 맛에 입맛이 확 돌아옵니다.,"[{'step_number': 1, 'description': '양념장 재료는 모두 섞어서 준비합니다.\n간을 보시고 입맛에 따라서 조절하세요.사이다를 살짝 섞어줘도 맛있어요.', 'image_url': 'https://recipe1.ezmember.co.kr/cache/recipe/2023/03/01/bcf6180383955b3464f74d64868a92c51.jpg'}, {'step_number': 2, 'description': '돌나물에 만들어둔 양념장을 넣고 젓가락으로 살살 섞어주세요.\n돌나물은 약해서 절대 강하게 버무리면 안됩니다.', 'image_url': 'https://recipe1.ezmember.co.kr/cache/recipe/2023/03/01/dc15f2876f7f8f37cb7915ac71a8bc591.jpg'}, {'step_number': 3, 'description': '골고루 버무렸으면 참기름을 둘러서 무친후 잠시만 대기할게요.', 'image_url': 'https://recipe1.ezmember.co.kr/cache/recipe/2023/03/01/96e0043e45d215ae681e73140159e5611.jpg'}, {'step_number': 4, 'description': '참치 기름은 가볍게 짜서 준비합니다.', 'image_url': 'https://recipe1.ezmember.co.kr/cache/recipe/2023/03/01/d2e530e0e36f2e0637e43d6e710959ad1.jpg'}, {'step_number': 5, 'description': '달걀프라이도 하나 만들어주세요.중약불', 'image_url': 'https://recipe1.ezmember.co.kr/cache/recipe/2023/03/01/0626f88b601a1d212684cded3cca91d61.jpg'}, {'step_number': 6, 'description': '밥 위에 돌나물무침과 참치를 올려주세요.', 'image_url': 'https://recipe1.ezmember.co.kr/cache/recipe/2023/03/01/b08584f6e76e90a69b9f5d8c3a9a96d81.jpg'}, {'step_number': 7, 'description': '그리고 달걀프라이와 김가루를 뿌려서 완성!', 'image_url': 'https://recipe1.ezmember.co.kr/cache/recipe/2023/03/01/56dc01aa43dc64ea7154b8dbd4b8148d1.jpg'}]"
76210,밥/죽/떡,초스피드,채소류,비빔,부추비빔밥 조인성 레시피 노지부추 가성비 최고,부추비빔밥,https://recipe1.ezmember.co.kr/cache/recipe/2023/05/21/5e37b3bed9fced4727d6b48495a0f00f1.jpg,529,10분 이내,초급,1인분,"[('부추', '1/2줌'), ('밥', '1/2공기'), ('달걀', '1개'), ('고추장', '1/2스푼'), ('들기름', '1스푼'), ('깨소금', '')]","봄 부추는 약이라고 하지요. 올해 첨 올라오는 노지 부추는 인삼, 녹용과도 바꾸지 않으며 봄 부추 한단은 피 한 방울 보다 낫다고 합니다. 진시황도 영생을 꿈꾸며 몰래 먹었다는 불로초 부추. 간에도 좋고 남자들에게도 너무 좋아요. 고혈압예방, 세포노화방지에도 좋다고 하니 많이 먹어야겠지요.","[{'step_number': 1, 'description': '어머님이 올해 처음 올라온 부추라고 주셨어요. 미리 잘라두었다가 챙겨주신 봄에 올라온 노지부추입니다. 깨끗해서 특별히 손질할 필요는 없는듯합니다.부추 손질법 레시피', 'image_url': 'https://recipe1.ezmember.co.kr/cache/recipe/2023/05/21/1be1e2855814c916e97afc9ec1e2554d1.jpg'}, {'step_number': 2, 'description': '부추 반 줌은 깨끗이 씻어서 물기를 제거하고 0.5~1cm 정도로 썰어줍니다.', 'image_url': 'https://recipe1.ezmember.co.kr/cache/recipe/2023/05/21/85a7577f8cf811dcd04c63e719543b2a1.jpg'}, {'step_number': 3, 'description': '저는 스테인리스 제품을 많이 사용하는데 혹시 프라이팬 예열 때문에 사용하기 불편하세요. 예열 습관이 안되면 눌어붙어서 힘들 때가 있는데 이럴 때 간단하게 해결하는 방법이 있어요. 식용유와 함께 참기름을 넣어주면 바로 달걀을 풀어도 절대로 눌어붙지 않아요. 궁금하시면 일단 한번 해보세요.', 'image_url': 'https://recipe1.ezmember.co.kr/cache/recipe/2023/05/21/7f7c8772017d57600fbcb80b833d70c31.jpg'}, {'step_number': 4, 'description': '준비 완료 이제 그릇에 놓아볼까요? 찬밥이 있어서 레인지에 따뜻하게 돌려주었어요.', 'image_url': 'https://recipe1.ezmember.co.kr/cache/recipe/2023/05/21/3b09cc9007940c51b5354a92a7f186bb1.jpg'}, {'step_number': 5, 'description': '그릇에 밥을 넣어주세요.', 'image_url': 'https://recipe1.ezmember.co.kr/cache/recipe/2023/05/21/e62031ecad148efaa4065b0effd0d1221.jpg'}, {'step_number': 6, 'description': '가장자리로 썰어놓은 부추를 놓아주시고', 'image_url': 'https://recipe1.ezmember.co.kr/cache/recipe/2023/05/21/2e278ea51373e17a2a69780c583ab14d1.jpg'}, {'step_number': 7, 'description': '달걀 프라이도 올려주세요. 일단 색깔 비주얼은 너무 괜찮아 보여요.', 'image_url': 'https://recipe1.ezmember.co.kr/cache/recipe/2023/05/21/5b15ccf2f9cb5a1145fea91a4c5de9f01.jpg'}, {'step_number': 8, 'description': '그리고 고추장 반 스푼 올려주고 들기름 1스푼, 깨소금 올려주면 완성. 참기름 올려셔도 됩니다.', 'image_url': 'https://recipe1.ezmember.co.kr/cache/recipe/2023/05/21/561d7b2a46030eb286cbcdd9f2534ccd1.jpg'}, {'step_number': 9, 'description': '저는 방울토마토 장아찌가 있어서 두 개 정도 잘라서 올려주었어요.', 'image_url': 'https://recipe1.ezmember.co.kr/cache/recipe/2023/05/21/1ab5c0af2d2d7eff6157351e5d450aa81.jpg'}, {'step_number': 10, 'description': '이제 비벼서 맛있게 먹으면 끝~ 일단 색깔로 눈을 사로잡으니 비주얼은 합격입니다.', 'image_url': 'https://recipe1.ezmember.co.kr/cache/recipe/2023/05/21/7c661ff88db0ced6df939bea5fb210181.jpg'}, {'step_number': 11, 'description': '혹시나 하고 넣었는데 요 토마토 장아찌의 맛이 너무 좋아요.\n다음에는 더 많이 넣고 비벼 먹어야겠어요.', 'image_url': 'https://recipe1.ezmember.co.kr/cache/recipe/2023/05/21/1c9fe49b3e075f7f0492c8020838a5b51.jpg'}, {'step_number': 12, 'description': '은은함에 상큼함까지 들어있는 비빔밥 입니다. 톡쏘는 토마토의 새콤달콤이 싱그러움을 더합니다.', 'image_url': 'https://recipe1.ezmember.co.kr/cache/recipe/2023/05/21/3730f885397387b20a29c50b032d72b41.jpg'}, {'step_number': 13, 'description': '들어가는 재료는 별거 없는데 생각보다 너무 맛있어요. 부추가 아삭하니 씹는맛이 있어요. 부추가 많이 들어갔는데도 그렇게 향이 짙지 않아서 먹는데 부담스럽지 않고 고추장이랑 섞으니 너무 잘 어우러집니다. 비빔이지만 달걀노른자가 있어서 너무 촉촉하고 부드럽고 맛이 정말 과하지도 않고 그렇다고 밋밋하지도 않고 은은한 맛이 있네요. 향이 있는 부추와 고추장이 들어갔지만 맛은 엄청 순한 비빔밥입니다.', 'image_url': 'https://recipe1.ezmember.co.kr/cache/recipe/2023/05/21/180c2218fcc637af061a9071a7fab5e01.jpg'}, {'step_number': 14, 'description': '들기름을 넣어서 그런지 향이 너무 좋아요.\n여러 재료 넣고 고추장 듬뿍 넣고 비벼 먹는 비빔밥과는 많이 달라요.\n일단 은은하고 순해서 너무 좋아요.\n함께 먹어야 할 다른 밑반찬이 필요가 없네요.\n아무튼 가성비가 최고인 부추비빔밥입니다.', 'image_url': 'https://recipe1.ezmember.co.kr/cache/recipe/2023/05/21/9d49bd33a0048de120fe5eead0250c2e1.jpg'}, {'step_number': 15, 'description': '고추장도 집에서 만든 것을 넣어서 그런지 그리 맵지 않고 담백한 맛이 있어서 너무 맛있어요. 여러 가지 넣은 비빔밥도 좋지만 이렇게 한 가지만으로도 너무 괜찮은 한 그릇 요리가 됩니다. 가성비 짱인 부추비빔밥입니다.', 'image_url': 'https://recipe1.ezmember.co.kr/cache/recipe/2023/05/21/86aff62de4682022f57629118ca4f7ce1.jpg'}]"
76211,밥/죽/떡,초스피드,채소류,비빔,샐러드비빔밥! 간단하지만 완전 든든!,샐러드비빔밥,https://recipe1.ezmember.co.kr/cache/recipe/2017/02/22/c62b3f41397d8082a6fc995a99b6e51d1.jpg,"3,525",60분 이내,아무나,2인분,"[('밥', '1.5공기'), ('각종 샐러드 야채', '150g'), ('달걀', '2개'), ('비빔고추장                                                                                또는 초고추장', '')]","아침부터 비빔밥?
ㅎㅎ
별다른 반찬 없이 금방 차려낼 수 있는 샐러드 비빔밥으로 샐러드를 좋아하는 제가 아침에 저희 집 시커먼 두 녀석들을 위해 자주 식탁위에 올려줘요.","[{'step_number': 1, 'description': '샐러드용 야채들은 흐르는 물에 씻어 얼음이 담긴 찬물에 담가두었다가\n야채 탈수기에 넣고 돌려 물기를 빼주세요.', 'image_url': 'https://recipe1.ezmember.co.kr/cache/recipe/2017/04/10/7ff3ae99b483aa6705ed648962543c811.jpg'}, {'step_number': 2, 'description': '비빔 그릇에 밥과 샐러드 야채를 담고,', 'image_url': 'https://recipe1.ezmember.co.kr/cache/recipe/2017/04/10/d339423adc4e4be3c00bae7e89f1d3481.jpg'}, {'step_number': 3, 'description': '비빔밥에 빠지면 섭섭한 달걀 프라이를 올려주세요.', 'image_url': 'https://recipe1.ezmember.co.kr/cache/recipe/2017/04/10/6ab1dcbe60787effcb7df802dfd334a41.jpg'}, {'step_number': 4, 'description': '먹기직전 초고추장을 올려주세요.', 'image_url': 'https://recipe1.ezmember.co.kr/cache/recipe/2017/04/10/b28865966ea56444cd652e7bc7ea11061.jpg'}]"
76212,밥/죽/떡,초스피드,채소류,비빔,[비빔밥] 봄을 부르는 새콤한 맛 돌나물 봄 비빔밥,돌나물비빔밥,https://recipe1.ezmember.co.kr/cache/recipe/2017/05/10/631f7d708103a7f95b0a978623888ceb1.jpg,"3,264",10분 이내,아무나,1인분,"[('상추', '100g'), ('돌나물', '120g'), ('새싹채소', '50g'), ('파프리카', '50g'), ('양배추', '100g'), ('오이', '100g'), ('초고추장', '적당량'), ('잣', '5g'), ('들깨가루', '10t')]",입맛 없을 때 먹으면 새콤한 맛에 다시 입맛을 찾을 수 있는 비빔밥 요리에요.,"[{'step_number': 1, 'description': '모든 채소들은 깨끗이 씻어 물기를 제거해 준다.', 'image_url': 'https://recipe1.ezmember.co.kr/cache/recipe/2017/05/10/50f57e6d72fdc36d408308e0f485a0c01.jpg'}, {'step_number': 2, 'description': '씻은 채소들은 채를 썰어 준비한다.', 'image_url': 'https://recipe1.ezmember.co.kr/cache/recipe/2017/05/10/eaed8a5be92a4c142ba14e988b5be52b1.jpg'}, {'step_number': 3, 'description': '양배추는 채를 썰어 준비한다.', 'image_url': 'https://recipe1.ezmember.co.kr/cache/recipe/2017/05/10/49711fff8f2b30aa6260b1a2ca4f35df1.jpg'}, {'step_number': 4, 'description': '채썰은 양배추에 초고추장을 넣고 무쳐준다.', 'image_url': 'https://recipe1.ezmember.co.kr/cache/recipe/2017/05/10/2632705ad3b41386e385fc6284144c7d1.jpg'}, {'step_number': 5, 'description': '고슬고슬하게 지은 밥을 그릇에 담아준다.', 'image_url': 'https://recipe1.ezmember.co.kr/cache/recipe/2017/05/10/3c8ba5e16344c3e64e6a22d234fc1de51.jpg'}, {'step_number': 6, 'description': '가장자리에 상추, 오이, 파프리카, 돌나물을 올려준다.', 'image_url': 'https://recipe1.ezmember.co.kr/cache/recipe/2017/05/10/7d97c92b9433877a7fad4fbd7d3709c61.jpg'}, {'step_number': 7, 'description': '가운데에 초고추장에 무쳐낸 양배추를 얹고 잣과 들깨가루를 뿌려준다.', 'image_url': 'https://recipe1.ezmember.co.kr/cache/recipe/2017/05/10/85fed9f16175d50a4a8b2c5bb160f2881.jpg'}]"
76213,밥/죽/떡,초스피드,채소류,비빔,"명절나물활용 비빔밥, 약고추장 간단하게 만들기",비빔밥,https://recipe1.ezmember.co.kr/cache/recipe/2018/09/27/ad4626fa4718c14264d490f0e4f1fd231.jpg,"3,426",30분 이내,아무나,1인분,"[('명절나물', '1접시'), ('밥', '1공기'), ('계란', '1개'), ('양파                                                                                70g', '1/4개'), ('간마늘', '1큰술'), ('식용유', '1큰술'), ('맛술', '1큰술'), ('들기름', '1큰술')]",명절엔 몇가지 나물을 준비하잖아요. 그 나물들이 남아서요. 약고추장이 있어 더 맛있는 비빔밥,"[{'step_number': 1, 'description': '간단하게 약고추장을 만들어놓을꺼예요. 명절엔 고기를 많이 먹으니 고기없이 약고추장 만들어요. 다진양파와 간마늘을 볶아요양파1/4개, 간마늘1T, 포도씨오일1T약불', 'image_url': 'https://recipe1.ezmember.co.kr/cache/recipe/2018/09/27/ff6385a15c2d2016954a32f5af6adf381.jpg'}, {'step_number': 2, 'description': '양파향이 나면서 볶아졌으면 불을끄고 고추장, 맛술, 들기름을 섞어요맛술1T, 들기름1T, 고추장3T', 'image_url': 'https://recipe1.ezmember.co.kr/cache/recipe/2018/09/27/8b6f3ffba047f3e98e88748881e162fc1.jpg'}, {'step_number': 3, 'description': '불을켜고 볶아줍니다. 약 3분해찬들태양초고추장 사용약불', 'image_url': 'https://recipe1.ezmember.co.kr/cache/recipe/2018/09/27/9dd85ff417b242ad4a42c9beb9f54e911.jpg'}, {'step_number': 4, 'description': '비빕밥 양념장으로 사용할때 약 4인분.시판고추장은 설탕 안넣어도 달큼하게 맛있는 볶음고추장 만들어져요', 'image_url': 'https://recipe1.ezmember.co.kr/cache/recipe/2018/09/27/ce679b720930fcf67e4a3c9762c5aa851.jpg'}, {'step_number': 5, 'description': '명절에 남은음식 한접시 (고사리나물, 취나물, 미역줄기볶음, 열무김치, 더덕볶음) 버섯 식감이 좋아서 반만 데쳐서 꼭 짜서 넣었어요.', 'image_url': 'https://recipe1.ezmember.co.kr/cache/recipe/2018/09/27/1493b4344f5681eb5ce514b811664a751.jpg'}, {'step_number': 6, 'description': '밥을 펴서 담고', 'image_url': 'https://recipe1.ezmember.co.kr/cache/recipe/2018/09/27/5c8b4d2da8b41bd22a3ee2c1b990bca91.jpg'}, {'step_number': 7, 'description': '준비된 나물들 올리고요.', 'image_url': 'https://recipe1.ezmember.co.kr/cache/recipe/2018/09/27/b83fb5a3c2e196f7693c0356c9edaa9a1.jpg'}, {'step_number': 8, 'description': '고기없이 볶은 약고추장 2큰술 넣어요.약고추장2T', 'image_url': 'https://recipe1.ezmember.co.kr/cache/recipe/2018/09/27/cbbfbf0cb3b83f20f7af2d99d57b6a1b1.jpg'}, {'step_number': 9, 'description': '맛있게 비벼 먹습니다. 볶은고추장 덕분에 맛있게 맛있게~', 'image_url': 'https://recipe1.ezmember.co.kr/cache/recipe/2018/09/27/7a275b404f7b910628e8fd93940ffbc31.jpg'}, {'step_number': 10, 'description': '계란은 반숙을 하는것이 이쁜데.. 저는 반숙을 안먹어서 완숙 입니다', 'image_url': 'https://recipe1.ezmember.co.kr/cache/recipe/2018/09/27/8ac9da0cfb34373f04771865053074a71.jpg'}]"
