index,종류별,상황별,재료별,방법별,글 제목,레시피이름,레시피이미지,조회수,조리시간,난이도,인분,재료,소개글,조리순서
46733,국/탕,일상,해물류,끓이기,"동죽조개탕으로 동죽칼국수까지 먹는법, 동죽해감",동죽조개탕,https://recipe1.ezmember.co.kr/cache/recipe/2021/02/23/9ff27fdf2a39177ebf138c42e7ebde211.jpg,"18,704",30분 이내,초급,3인분,"[('동죽 조개', '1kg'), ('대파', '1/3개'), ('홍고추', '1개'), ('청양고추', '1개'), ('애호박', '1/4개'), ('당근', '약간'), ('다진마늘', '0.5큰술'), ('칼국수면', '2인분'), ('소주', '1큰술'), ('굵은소금', '2큰술'), ('식초', '1큰술')]","통통하고 쫄깃하면서 단맛이 나는 동죽조개로 시원한 동죽조개탕을 끓이고, 칼국수면을 넣어 동죽칼국수까지 
맛있게 먹는법 알려 드려요.","[{'step_number': 1, 'description': '동죽은 두세번 물로 헹군 후에 소금 2큰술과 식초 1큰술을 넣어 녹여 주어요', 'image_url': 'https://recipe1.ezmember.co.kr/cache/recipe/2021/02/23/7ede6051684c31c62ca4fdc36ba6a4ef1.jpg'}, {'step_number': 2, 'description': '스텐 수저나 포크를 한개 넣구요', 'image_url': 'https://recipe1.ezmember.co.kr/cache/recipe/2021/02/23/94b208cbe5b24964277e0bde5d5fe9b31.jpg'}, {'step_number': 3, 'description': '검은 비닐이나 호일등을 덮어서 시원한 곳에서 2시간 이상 두어 해감을 시켜 주세요', 'image_url': 'https://recipe1.ezmember.co.kr/cache/recipe/2021/02/23/7759e37af9e22d01c3156c7a415d50741.jpg'}, {'step_number': 4, 'description': '해감을 마친 동죽은 두 손으로 바락바락 문질러 씻어 여러번 헹구어 주세요', 'image_url': 'https://recipe1.ezmember.co.kr/cache/recipe/2021/02/23/af5cd24b12888f6ae2dff831de5bcd0e1.jpg'}, {'step_number': 5, 'description': '대파와 고추를 썰어 놓아요', 'image_url': 'https://recipe1.ezmember.co.kr/cache/recipe/2021/02/23/2d301d0a9824cc9c0cd80ab38761125b1.jpg'}, {'step_number': 6, 'description': '칼국수도 드실거면 당근과 호박도 썰어 주세요', 'image_url': 'https://recipe1.ezmember.co.kr/cache/recipe/2021/02/23/3e856885860eba5f8e9ba876fbd857c71.jpg'}, {'step_number': 7, 'description': '냄비에 동죽이 충분히 잠길만큼 물을 넣고 끓여주기 시작해요', 'image_url': 'https://recipe1.ezmember.co.kr/cache/recipe/2021/02/23/46ae091197683ff92d2529e7570b194c1.jpg'}, {'step_number': 8, 'description': '떠오르는 거품은 걷어 주세요', 'image_url': 'https://recipe1.ezmember.co.kr/cache/recipe/2021/02/23/e11edccf7288ff1352438945d1bfee551.jpg'}, {'step_number': 9, 'description': '다진마늘 반큰술을 넣어요\n깐마늘을 져며서 넣어 주시면 더 깔끔해요', 'image_url': 'https://recipe1.ezmember.co.kr/cache/recipe/2021/02/23/10d766a81675856bcf257f20f33a5c151.jpg'}, {'step_number': 10, 'description': '조개가 모두 입을 벌리면 소주 1큰술 넣고요. 대파와 홍고추를 넣고 한소끔 끓여서 마무리해요. \n오래 끓이면 질겨서 맛이 없어요\n모두 입을 벌리면 거의 완성 된 거에요.\n조개에서 짠맛이 우러나와 간을 따로 하지 않았어요', 'image_url': 'https://recipe1.ezmember.co.kr/cache/recipe/2021/02/23/c06850018de4370985e211b41eeb49151.jpg'}, {'step_number': 11, 'description': '시원한 국물맛이 끝내주는 , 쫄깃하고 달달한 맛이 최고인 동죽 조개탕 완성이에요. \n동죽 조개탕 드셔 보시면, 바지락은 정말 시시해져요^^', 'image_url': 'https://recipe1.ezmember.co.kr/cache/recipe/2021/02/23/2b7c2b58878daa3733c406c519a1d6771.jpg'}, {'step_number': 12, 'description': '동죽 조개탕 조개 건져 드시고요. 동죽칼국수까지 즐기실 거라면 , 조개탕 국물을 남겨 두고, 조개도 조금 따로 덜어 놓아요. \n여기에 면을 넣고 끓여주기 시작해요', 'image_url': 'https://recipe1.ezmember.co.kr/cache/recipe/2021/02/23/239e8252bc455ffab3fcddfdd47bf0071.jpg'}, {'step_number': 13, 'description': '면이 반정도 익으면 당근과 호박을 넣어요', 'image_url': 'https://recipe1.ezmember.co.kr/cache/recipe/2021/02/23/0bf71ae533fe0190f63b8a33c51e562a1.jpg'}, {'step_number': 14, 'description': '면과 채소가 거의 익으면 대파와, 고추, 남은 조개를 넣고 한 소끔 끓여서 마무리 해요. \n간이 부족하면 소금을 약간 추가하시면 되요', 'image_url': 'https://recipe1.ezmember.co.kr/cache/recipe/2021/02/23/02187d2310cae8d5319651787a12a2e51.jpg'}, {'step_number': 15, 'description': '시원한 동죽조개 칼국수까지 맛있게 드셔 보세요. \n동죽 넉넉히 준비하셔서 탕도 즐기시고, 칼국수도 즐기시면 1석 2조 랍니다 ^^ \n바지락 안 먹는 저희 아이도 동죽은 잘 먹어요 ^^\n달달하고 쫄깃한 동죽 꼭 드셔 보세요^^', 'image_url': 'https://recipe1.ezmember.co.kr/cache/recipe/2021/02/23/49bae4f7d63f4d2514f343b08f313e351.jpg'}]"
46734,국/탕,일상,해물류,끓이기,얼큰하고 시원한 오징어무국 간단하게 끓이는 법,오징어무국,https://recipe1.ezmember.co.kr/cache/recipe/2021/06/15/7e5e7072e93e698a12c7957ec338179b1.jpg,"4,730",30분 이내,아무나,4인분,"[('오징어 中', '2마리'), ('무 한토막', '250g'), ('물', '800~1000ml'), ('대파', '1대'), ('홍고추', '1개'), ('고춧가루', '2숟가락'), ('국간장', '1숟가락'), ('참치액', '1숟가락'), ('다진마늘', '1숟가락'), ('액젓', '1숟가락'), ('후추', ''), ('소금', '')]","들어가는 재료는 단출한데
시원한 감칠맛이 일품인 오징어국
다시백을 이용해서 따로 육수 내지 않고
간단하게 끓여봐요~","[{'step_number': 1, 'description': '오징어는 손질된 것으로 사서\n깨끗하게 씻은 후 숟가락 위에\n올라가기 좋게 격자 모양으로 썰어요\n영양이 풍부한 껍질은 제거하지 않았어요오징어 손질법 레시피', 'image_url': 'https://recipe1.ezmember.co.kr/cache/recipe/2021/06/15/b402f09457bf8193f55d9c7ad49ad7041.jpg'}, {'step_number': 2, 'description': '무는 도톰하게 나박 썰고\n대파와 홍고추는 어슷 썰어 줍니다.\n홍고추가 들어가면 국물이 더 개운해요', 'image_url': 'https://recipe1.ezmember.co.kr/cache/recipe/2021/06/15/ba3e5392072998669aa7017df04c1fea1.jpg'}, {'step_number': 3, 'description': '냄비에 물 800~1,000ml정도를 붓고\n썰어둔 무와 다시팩 하나\n고춧가루 1, 국간장 1, 참치액 1을 넣고\n중불로 5분간 끓여줍니다.\n다시팩이 없으면 다시마 4*4 2조각과 다시멸치 반줌 정도를 넣어주세요.', 'image_url': 'https://recipe1.ezmember.co.kr/cache/recipe/2021/06/15/13f0fe40d63b4f171a28e1279a6a21111.jpg'}, {'step_number': 4, 'description': '5분 후, 다시팩을 건져내고\n오징어와 액젓 1큰술\n다진마늘 1, 고춧가루 1을 추가해\n2분 정도 끓이다가', 'image_url': 'https://recipe1.ezmember.co.kr/cache/recipe/2021/06/15/a1685f5ebc2eb802031f9ffedf11e2bf1.jpg'}, {'step_number': 5, 'description': '대파와 고추를 넣고 1분 정도 더 끓이고\n모자라는 간은 소금으로 맞추기~\n후추 톡톡 뿌려주면 완성입니다 :)', 'image_url': 'https://recipe1.ezmember.co.kr/cache/recipe/2021/06/15/e037c44d2d0e50ab5e861b90d2e1a9b71.jpg'}, {'step_number': 6, 'description': '뜨는 거품은 중간중간 걷어내주시고\n비린내를 날리기 위해 전과정\n뚜껑은 열고 끓여주세요.', 'image_url': 'https://recipe1.ezmember.co.kr/cache/recipe/2021/06/15/db4f51c97404afe90f0851cce400ab461.jpg'}, {'step_number': 7, 'description': '간을 맞추는 양념은 한가지로만 쓰는 것보다\n국간장, 액젓, 참치액 등을 혼합해서\n사용하면 더 깊은 맛이 나요~', 'image_url': 'https://recipe1.ezmember.co.kr/cache/recipe/2021/06/15/db73ff475954cac176fdff61be026d321.jpg'}, {'step_number': 8, 'description': '전날 밤에 재료만 썰어두면\n끓이는 건 순식간이에요~\n10분 완성으로 간단한데\n영양까지 만점입니다♡', 'image_url': 'https://recipe1.ezmember.co.kr/cache/recipe/2021/06/15/6447f12c1e279533c1ba6c669a97562c1.jpg'}]"
46735,국/탕,일상,해물류,끓이기,백종원 꽃게탕 끓이는법 ~ 요대로만 하시면 맛보장,꽃게탕,https://recipe1.ezmember.co.kr/cache/recipe/2020/09/23/92e0c32efe6bd2ac024ddac75274c7571.jpg,"25,657",60분 이내,초급,3인분,"[('꽃게', '4마리'), ('자른 무', '1줌'), ('호박', '1/4개'), ('양파', '1/2개'), ('대파', '1/2개'), ('풋고추', '1개'), ('홍고추', '1개'), ('팽이버섯', '1/2개'), ('쑥갓', '약간'), ('해물육수', '1.2L'), ('된장', '1큰술'), ('고추가루', '2큰술'), ('고추장', '0.5큰술'), ('국간장', '1큰술'), ('다진마늘', '1큰술'), ('소주', '2큰술'), ('소금', '약간')]","백종원 꽃게탕 레시피로 진하고 시원한 국물맛의 
맛보장 꽃게탕 만들어 보세요 ~ 이대로만 하시면 맛보장 이에요^^","[{'step_number': 1, 'description': '꽃게는 손질 냉동해둔 것을 사용했어요 .꽃게 손질법 레시피', 'image_url': 'https://recipe1.ezmember.co.kr/cache/recipe/2020/09/23/c1cc77ad30c0aae5eae09e28790d023e1.jpg'}, {'step_number': 2, 'description': '채소는 손질 세척하여 준비해 주세요', 'image_url': 'https://recipe1.ezmember.co.kr/cache/recipe/2020/09/23/49d23320dfaf37e35a943c6dfc245d701.jpg'}, {'step_number': 3, 'description': '물 1.2리터에 다시마 2장, \n멸치와 보리새우를 넣고 15~20분 육수를 끓여 주었어요 . \n해물 육수는 집에 있는 재료를 아무거나 사용하시면 되어요.', 'image_url': 'https://recipe1.ezmember.co.kr/cache/recipe/2020/09/23/95efb3f2beb6c1c6825f8d7d01dd8ffd1.jpg'}, {'step_number': 4, 'description': '무를 납작하게 썰어 주세요', 'image_url': 'https://recipe1.ezmember.co.kr/cache/recipe/2020/09/23/1c8a78fb952740874cd91159d3f270711.jpg'}, {'step_number': 5, 'description': '호박은 반달 모양으로 납작하게 썰어 주세요', 'image_url': 'https://recipe1.ezmember.co.kr/cache/recipe/2020/09/23/e13ad3ca2609a8386876b8b3c92961df1.jpg'}, {'step_number': 6, 'description': '양파를 굵게 세로로 썰어 주세요', 'image_url': 'https://recipe1.ezmember.co.kr/cache/recipe/2020/09/23/297b4548dae75db9dbda02f17f0a48541.jpg'}, {'step_number': 7, 'description': '대파를 어슷 썰기 하세요', 'image_url': 'https://recipe1.ezmember.co.kr/cache/recipe/2020/09/23/79afef356c949b2014a31905b6bb9cab1.jpg'}, {'step_number': 8, 'description': '고추도 어슷 썰기 해주세요', 'image_url': 'https://recipe1.ezmember.co.kr/cache/recipe/2020/09/23/9c18bf802635fb3087379467ef6f164e1.jpg'}, {'step_number': 9, 'description': '양념장을 레시피 분량대로 만들어 \n주세요~ 소금은 마지막에 간을 맞출 때 추가하는 것이니, 양념장엔 넣지 않습니다 .', 'image_url': 'https://recipe1.ezmember.co.kr/cache/recipe/2020/09/23/43db397f79c97ae63996ce09adf5fec61.jpg'}, {'step_number': 10, 'description': '육수에 양념장을 풀어 무를 넣어 끓이기 시작하세요 ~', 'image_url': 'https://recipe1.ezmember.co.kr/cache/recipe/2020/09/23/245c7b9eefcb64e06cae2be89ac0ce391.jpg'}, {'step_number': 11, 'description': '국물이 끓기 시작하면 꽃게를 넣고 끓여 줍니다 ~', 'image_url': 'https://recipe1.ezmember.co.kr/cache/recipe/2020/09/23/9fed72540e1da0590e59bd97f3350c681.jpg'}, {'step_number': 12, 'description': '거품이 떠오르면 조금씩 걷어 주시거나, 다 끓고 나서 걷어 주셔도 됩니다', 'image_url': 'https://recipe1.ezmember.co.kr/cache/recipe/2020/09/23/2de2689151a40f0bd08dcadd6efb14a51.jpg'}, {'step_number': 13, 'description': '꽃게가 거의 익었으면 양파와 호박을 넣고 잠시만 더 끓여 주세요', 'image_url': 'https://recipe1.ezmember.co.kr/cache/recipe/2020/09/23/5300c29f5d9b3e78baddf2f8787fd28b1.jpg'}, {'step_number': 14, 'description': '간을 보시고, 부족한 것은 소금으로 맞추어 주세요. \n대파와 고추를 넣어 한소끔 끓이고, 팽이버섯과 쑥갓을 넣고 마무리 합니다', 'image_url': 'https://recipe1.ezmember.co.kr/cache/recipe/2020/09/23/5f84a254466385a27fc7cb9e8ee384d71.jpg'}, {'step_number': 15, 'description': '제철 싱싱한 꽃게탕은 얼큰하고 시원하며 진한 국물맛이 아주 일품이에요 ~\n살이 꽉 들어찬 꽃게살을 발라 먹으면서 맛에 또 한번 반하지요.', 'image_url': 'https://recipe1.ezmember.co.kr/cache/recipe/2020/09/23/940dd8742ce8698d339259990cdf60101.jpg'}, {'step_number': 16, 'description': '백종원 꽃게탕 레시피로 제철 꽃게탕을 만들어 보세요. \n가을맛을 느낄 수 있는 행복한 \n식탁을 만들 수 있답니다 ^^', 'image_url': 'https://recipe1.ezmember.co.kr/cache/recipe/2020/09/23/36e279e588c042e8ed39642591ce22d51.jpg'}]"
46736,국/탕,일상,해물류,끓이기,시원한 오징어 무우국,오징어무국,https://recipe1.ezmember.co.kr/cache/recipe/2018/10/08/c1893bd216b7ff11273409fe85b74b5e1.jpg,"27,569",30분 이내,초급,4인분,"[('오징어 큰거', '1마리'), ('땡초', '2개'), ('무우', '2토막'), ('대파', '1개'), ('다진마늘', '1숟가락'), ('액젓', '2숟가락'), ('소금', '약간'), ('참기름', '1숟가락')]","요즘 오징어가 오낙 비싸 오징어를 잘사지 않게 되더라고요 그런데 오늘 장에 가니 큰오징어가 3마리가 만원이라기예 얼른 사가지고 왔죠
한마리는 저녁에 국 끓이고 2마리는 냉동실로 직행","[{'step_number': 1, 'description': '오징어는 깨끗이 씻은후 먹기 좋은 크기로 썰어 주세요', 'image_url': 'https://recipe1.ezmember.co.kr/cache/recipe/2018/10/08/4eb20df3594d9a87ad32c44b497e16b31.jpg'}, {'step_number': 2, 'description': '살짝 달군 팬에 *참기름1숟가락이랑 오징어를 넣고 달달 볶아주세요', 'image_url': 'https://recipe1.ezmember.co.kr/cache/recipe/2018/10/08/1d71ec7e44a111aa237a14fb649307301.jpg'}, {'step_number': 3, 'description': '오징어가 익어면 무우를 넣고 약불에서 볶아 주다가 *무우가 익어 투명해지면 *물을 1대접넣고 *다진마늘1숟가락 *액젓2숟가락 넣고 한번 끓여주세요', 'image_url': 'https://recipe1.ezmember.co.kr/cache/recipe/2018/10/08/ab7f07e961886eab1cd6c246ed7431171.jpg'}, {'step_number': 4, 'description': '한번 끓이면 오징어와 무우에 양념이 잘베여 깊은 맛을 냅니다 충분히 양념이 잘베이면 *물2대접을 추가한후에 간을 맞추시면 됩니다 그리고 마지막에 파,땡초를 넣고 모자라는 간은 소금으로 맞추시면 됩니다', 'image_url': 'https://recipe1.ezmember.co.kr/cache/recipe/2018/10/08/f95a2db1a526ed2dcc3cd8a77f23c3891.jpg'}]"
46737,국/탕,일상,해물류,끓이기,조개배추된장국,조개배추된장국,https://recipe1.ezmember.co.kr/cache/recipe/2017/10/16/66c951cc76d27b10545e2eb82b7e9f121.jpg,"8,231",10분 이내,초급,2인분,"[('조개', '800g'), ('배추', '1/2통'), ('멸치육수', '1L'), ('된장', '2스푼'), ('마늘', '1스푼'), ('고추가루', '1스푼'), ('홍고추', '1/2스푼')]",가을배추가 많이 출하되어 제철음식 먹어보고자 합니다,"[{'step_number': 1, 'description': '멸치육수 일리터에 배추가 무르도록 중간불에 끓입니다', 'image_url': 'https://recipe1.ezmember.co.kr/cache/recipe/2017/10/16/5ec3b373212266b8989a940f851849fb1.jpg'}, {'step_number': 2, 'description': '1번에 된장 두스푼 , 마늘 한스푼, 고추가루 한스푼을 같이 넣어줍니다.싱겁다싶으면 된장 추가해주세요.', 'image_url': 'https://recipe1.ezmember.co.kr/cache/recipe/2017/10/16/3c321ffba022b40d5efa20381373da201.jpg'}, {'step_number': 3, 'description': '배추가 숨이 거의 죽었을때 조개를 넣고 입을 다 벌리면 불을 끕니다.전 조개를 좋아해서 많이 넣었어요. 200그램만 넣으셔도 됩니다', 'image_url': 'https://recipe1.ezmember.co.kr/cache/recipe/2017/10/16/786e9269d9665e65afba5653152f00691.jpg'}, {'step_number': 4, 'description': '색감을 내고자 홍고추 넣어봤어요.없으면 생략해주세요.', 'image_url': None}]"
46738,국/탕,일상,해물류,끓이기,"집밥 백선생 오징어무국 만드는 법, 칼칼하고 시원한 국물♥",오징어무국,https://recipe1.ezmember.co.kr/cache/recipe/2018/02/08/1655f228f0c881518ccdcbb876d632651.jpg,"57,527",30분 이내,초급,4인분,"[('오징어', '1마리'), ('무', '250g'), ('대파', '1/2대'), ('홍고추                                                                                선택', '1개'), ('물', '900ml'), ('다진 마늘', '1큰술'), ('들기름', '3큰술'), ('고춧가루', '1큰술'), ('후춧가루', '적당량'), ('액젓', '2큰술'), ('국간장', '1큰술'), ('소금', '약간')]","오늘은 추운 날씨에 딱 어울리는 칼칼하고 시원한 국물요리를 하나 준비해보았어요.

바로바로 집밥 백 선생 오징어 뭇국 레시피랍니다.","[{'step_number': 1, 'description': '먼저 재료를 준비해요.\n오징어는 껍질을 벗겨 깨끗이 씻어준 뒤 길쭉하게 잘라주었고요.\n무는 얇게 썰어줍니다. 대파와 홍고추는 어슷 썰어 준비해요.', 'image_url': 'https://recipe1.ezmember.co.kr/cache/recipe/2018/02/08/48c4eee28851af6d145ceded5b3325bd1.jpg'}, {'step_number': 2, 'description': '냄비에 들기름 3 큰 술을 두르고 얇게 썬 무를 먼저 볶아요.', 'image_url': 'https://recipe1.ezmember.co.kr/cache/recipe/2018/02/08/86449c7f7aaf39ddd0b53324af26612a1.jpg'}, {'step_number': 3, 'description': '손질한 오징어를 넣고 무가 어느 정도 익을 때까지 좀 더 볶아주다가 물 900ml를 넣고 바글바글 끓여주세요.\n끓을 때 나오는 거품은 걷어주시고요 ~~~', 'image_url': 'https://recipe1.ezmember.co.kr/cache/recipe/2018/02/08/e196d8e66eb43c854452c35fe7c44b261.jpg'}, {'step_number': 4, 'description': '다진 마늘과 국간장, 액젓을 분량대로 넣어주세요.', 'image_url': 'https://recipe1.ezmember.co.kr/cache/recipe/2018/02/08/3f7073e419acf39c24d9259117adef921.jpg'}, {'step_number': 5, 'description': '어슷 썰어둔 대파와 홍고추도 넣고요.', 'image_url': 'https://recipe1.ezmember.co.kr/cache/recipe/2018/02/08/333e47e2c109d807508bae1b3a3cbad81.jpg'}, {'step_number': 6, 'description': '마지막으로 고춧가루 1 큰 술과 후춧가루를 조금 넣고 한소끔 끓여내면 집밥 백선생 오징어무국 만드는 법은 이렇게 끝이 나요!\n좀 더 칼칼하게 즐기고 싶은 분들은 청양고추를 쫑쫑 썰어서 넣어도 굿굿 :)', 'image_url': 'https://recipe1.ezmember.co.kr/cache/recipe/2018/02/08/04460149d68c30ef5a9eb8d26755feae1.jpg'}, {'step_number': 7, 'description': '뼛속까지 스며드는 듯한 칼바람에 꽁꽁 언 몸과 마음을 따뜻하게 녹여줄 칼칼하고 시원한 오징어무국 한 그릇 대령이오 ♥', 'image_url': 'https://recipe1.ezmember.co.kr/cache/recipe/2018/02/08/ba0d20167a4a724988913eae14fe2e4f1.jpg'}, {'step_number': 8, 'description': '주말에는 청양고추까지 팍팍 썰어 넣어서 소주 한 잔 할까 봐요 ㅎㅎㅎㅎ', 'image_url': 'https://recipe1.ezmember.co.kr/cache/recipe/2018/02/08/d1cb91bbbc307f507ea6eebb67e0fa421.jpg'}]"
46739,국/탕,일상,해물류,끓이기,속이 개운해지는 국물요리~두부매생이북어국 *^^*,두부매생이북어국,https://recipe1.ezmember.co.kr/cache/recipe/2018/12/03/9064e9d5c765a734f9f202192e5499481.jpg,"10,133",30분 이내,아무나,4인분,"[('매생이', '120g'), ('북어', '50g'), ('두부', '1모'), ('멸치다시마육수', '4.5컵'), ('참기름', '2T'), ('국간장', '2T'), ('다진마늘', '1/2T'), ('후춧가루', '소량')]","2월까지가 제철인 매생이는 영양가가 풍부해서 제철에 꼭 섭쉬하시는것이 좋습니다.
매생이를 보통 굴을 넣고 많이 끓이시는데요..북어를 넣고 두부까지 넣어 만든 두부매생이북어국은 정말 속이 개운해지는 국물요리랍니다.","[{'step_number': 1, 'description': '1. 북어채는 흐르는 물에 씻어 준후...먹기 좋게 작게 썰어줍니다.\n2. 매생이는 한줌정도의 양입니다. 매생이는 흐르는 물에 살살 씻어 준비합니다.\n사진에는 없지만 멸치다시마육수를 미리 끓여 4컵반 준비합니다.\n***멸치다시마육수 끓이는법http://hls3790.tistory.com/8001.북어는 마른상태의 무게입니다.대충 한줌정도의 양입니다.\n2. 멸치다시마육수가 없을때는 감칠맛은 덜하지만 그냥 물을 사용하셔도 괜찮습니다.', 'image_url': 'https://recipe1.ezmember.co.kr/cache/recipe/2018/12/03/b0c65635725c1e9cfa91f73dc419dedc1.jpg'}, {'step_number': 2, 'description': '3. 두부는 먹기 좋게 썰어준후...그릇에 담아 씻은 매생이와 함께 담아준후...\n참기름1T.국간장2T. 다진마늘½T. 후춧가루 소량을 넣어 밑간을 합니다.\n=> 이렇게 두부를 미리 밑간하면 두부에 간이 베어 좋더라고요.\n=> 두부와 매생이는 마지막에 같이 넣고 살짝 끓일거라서요...같이 양념하는겁니다.', 'image_url': 'https://recipe1.ezmember.co.kr/cache/recipe/2018/12/03/96eaee08b48a6af367c61e2c1c2f54531.jpg'}, {'step_number': 3, 'description': '4. 냄비에 위1번에서 준비한 북어를 넣어준후 참기름1T를 넣어 살살 30초정도 볶다가\n멸치다시마육수 4컵반을 부어준후 센불로 켠후 뚜껑을 덮고 끓여줍니다.\n끓어오르면 중불로 줄여 5분정도 끓인후....(뚜껑은 계속 덮고 끓여줍니다)', 'image_url': 'https://recipe1.ezmember.co.kr/cache/recipe/2018/12/03/1e3f8aabfbff4be9497bb961f4ba5cee1.jpg'}, {'step_number': 4, 'description': '5. 위3번에서 준비한 두부.매생이를 넣고 한번만 끓여주면 완성입니다.\n=> 두부와 매생이에 밑간을 했기때문에 추가로 간을 하지 않아도 됩니다.\n=> 두부와 매생이 넣은후에는 센불로 켠후 살짝 한번만 끓이면 됩니다.', 'image_url': 'https://recipe1.ezmember.co.kr/cache/recipe/2018/12/03/f2ace5709eb4a55f482e6d71ee3ba4331.jpg'}]"
46740,국/탕,일상,해물류,끓이기,오징어무국 끓이는법,오징어무국,https://recipe1.ezmember.co.kr/cache/recipe/2015/06/07/1ab0dee111254fd109863edef69cb2781.JPG,"33,403",30분 이내,초급,4인분,"[('오징어', '3마리'), ('무', ''), ('홍고추', '1개'), ('청양고추', '2개'), ('호박', ''), ('양파', '조금'), ('대파', '1줄'), ('두부', '1/2모'), ('멸치다시마육수', '1L'), ('고추장', '2큰술'), ('고추가루', '2큰술'), ('국간장', '2큰술'), ('다진마늘', '1큰술'), ('맛술', '1큰술'), ('후추가루', '조금')]",오늘은 반건조 오징어로 오징어 무국을 끓여서 먹었어요. 아침마다 매일 국한가지씩 만드는데 오징어무국은 달큰하고 얼큰하게 좋을 듯해서 끓였는데 역시나 굿이였여요...,"[{'step_number': 1, 'description': '무, 호박은 반달모양이나 나박 썰고 오징어는 적당한 크기로 잘라주고 고추, 양파, 두부도 적당한 크기로 썰어주세요.', 'image_url': 'https://recipe1.ezmember.co.kr/cache/recipe/2015/06/08/2df1331a989d5256fdac8c260be6c44f1.JPG'}, {'step_number': 2, 'description': '고추장 2큰술, 고추가루 2큰술, 국간장2 큰술, 다진마늘 1큰술, 맛술 1큰술, 후추가루 조금을 섞어 양념을 미리 만들어 주세요.', 'image_url': 'https://recipe1.ezmember.co.kr/cache/recipe/2015/06/08/a8a61d19e727971cee34dc61fcdf995e1.JPG'}, {'step_number': 3, 'description': '냄비에 육수나 물을 붓고 양념을 푼뒤 무를 넣고 끓여줍니다.', 'image_url': 'https://recipe1.ezmember.co.kr/cache/recipe/2015/06/08/74306d6d4bf541171e791d1cdd08a85a1.JPG'}, {'step_number': 4, 'description': '무가 끓으면 호박, 양파, 오징어를 넣고 끓인뒤 고추, 대파를 넣어 한소큼 끓인 뒤 마무리하세요.', 'image_url': 'https://recipe1.ezmember.co.kr/cache/recipe/2015/06/08/905cb1d3d2786633c293d2c253a7242a1.JPG'}]"
