index,종류별,상황별,재료별,방법별,글 제목,레시피이름,레시피이미지,조회수,조리시간,난이도,인분,재료,소개글,조리순서
65477,면/만두,초스피드,곡류,비빔,쫄깃한 식감좋은 쌀면 비빔국수,쌀면비빔국수,https://recipe1.ezmember.co.kr/cache/recipe/2017/07/11/a8d84e26af4234445be1e5ffd452ca201.jpg,"13,131",10분 이내,아무나,4인분,"[('쌀면', '4인분'), ('쌈채소', '10장'), ('당근', '1/5개'), ('고추장', '3T'), ('매실액', '1.5T'), ('다진마늘', '1/2T'), ('깨소금', '1/2T'), ('꿀', '1/2T'), ('식초', '1/3T'), ('참기름', '1t')]","쌀면삶아 비빔국수 만들어 볼게요
쫄깃한 식감이 좋아서 비벼 먹어도 좋고 콩국수, 냉면도 굿이지요","[{'step_number': 1, 'description': '냉동상태로 사용해도 되는데 저는 냉장실에 두어 얼지않은 상태입니다\n끝부분 가닥을 풀어놓아요', 'image_url': 'https://recipe1.ezmember.co.kr/cache/recipe/2017/07/11/84017b9c60332628b2d30543d2319e241.jpg'}, {'step_number': 2, 'description': '끓는물에 넣고 20초만 끓여 줍니다\n휘저으며 끓여요', 'image_url': 'https://recipe1.ezmember.co.kr/cache/recipe/2017/07/11/623fc72646653fa5698bd691822033a61.jpg'}, {'step_number': 3, 'description': '흐르는 물에 씻어 건집니다', 'image_url': 'https://recipe1.ezmember.co.kr/cache/recipe/2017/07/11/80b0adad2056ba031125def9614735a11.jpg'}, {'step_number': 4, 'description': '쌈채소, 당근은 잘게 채썰었어요\n고추장, 매실액, 다진마늘, 깨소금, 꿀, 식초넣고 양념장 만들어 비벼 줍니다', 'image_url': 'https://recipe1.ezmember.co.kr/cache/recipe/2017/07/11/9dff690b235465333dbfd898c03011941.jpg'}, {'step_number': 5, 'description': '참기름 한 방울 둘러요\n쫄깃한 식감좋은 쌀면 비빔국수 완성입니다', 'image_url': 'https://recipe1.ezmember.co.kr/cache/recipe/2017/07/11/b82f8acb5221e1398288b66f36aced431.jpg'}]"
65478,면/만두,초스피드,곡류,비빔,들기름 막국수 만드는법 쯔유 간장비빔국수 양념장,들기름막국수,https://recipe1.ezmember.co.kr/cache/recipe/2023/09/03/9198103dec2f8eabc58eb6d7862bd3e11.jpg,"6,982",20분 이내,초급,1인분,"[('메밀면', '100g'), ('구운김', '2장'), ('대파', '1/2대'), ('통깨', ''), ('다진마늘', '1/2스푼'), ('간장', '1스푼'), ('쯔유', '1스푼'), ('설탕', '1/2스푼'), ('들기름', '3스푼')]",간장과 쯔유를 넣어 감칠맛 가득한 들기름 막국수입니다. 메밀국수로 만들어 더욱 맛있는 간장비빔국수~ 아이들도 정말 좋아해요 :),"[{'step_number': 1, 'description': '먼저 양념장을 만들어 볼게요. 다진마늘 1/2스푼,간장 1스푼,쯔유 1스푼,설탕 1/2스푼,들기름 3스푼을 넣어 잘 섞어 줍니다.', 'image_url': 'https://recipe1.ezmember.co.kr/cache/recipe/2023/09/03/721476e0084704df9a6e82ebf51f6a2b1.jpg'}, {'step_number': 2, 'description': '대파 반대는 쫑쫑 썰어 주세요. (쪽파나 대파 어떤 것이든 좋습니다.) 김은 위생비닐에 넣어 비벼 잘게 부셔 줍니다.도마 , 칼 , 위생비닐', 'image_url': 'https://recipe1.ezmember.co.kr/cache/recipe/2023/09/03/a5109db5f79eae6a3d3e4da196f910501.jpg'}, {'step_number': 3, 'description': '이제 면을 삶아주는데요. 냄비에 물 1L를 넣고 끓여 주다 물이 팔팔 끓으면 메밀면 1인분을 펼쳐 넣어 줍니다. 면이 서로 붙지 않게 잘 저어 주시고 끓으면서 거품이 올라오면 찬물 반컵 넣어 진정시기는 과정을 두번 해 주세요.', 'image_url': 'https://recipe1.ezmember.co.kr/cache/recipe/2023/09/03/df31b42abd8553d4dd2cf5dbbc72f1b21.jpg'}, {'step_number': 4, 'description': '이렇게 4분정도 삶은 뒤 찬물에 바로 헹구어 쫄깃한 면을 준비합니다.체반', 'image_url': 'https://recipe1.ezmember.co.kr/cache/recipe/2023/09/03/5fafb59af1ee5e2d6c4ce4c0983f83591.jpg'}, {'step_number': 5, 'description': '면은 물기를 살짝 뺀 뒤 미리 만들어 둔 양념에 비벼 그릇에 올려주세요.볼', 'image_url': 'https://recipe1.ezmember.co.kr/cache/recipe/2023/09/03/e9bed8d36ab10f263327cd5bca3b38b81.jpg'}, {'step_number': 6, 'description': '그 위에 준비한 구운김과 파,통깨를 올려 주시면 완성입니다.통깨는 빻아서 올려주면 더욱 고소합니다.', 'image_url': 'https://recipe1.ezmember.co.kr/cache/recipe/2023/09/03/52a9a1d5d8433b1c6a19f70587b009c31.jpg'}]"
65479,면/만두,초스피드,곡류,비빔,목이버섯 비빔국수 만들기,버섯비빔국수,https://recipe1.ezmember.co.kr/cache/recipe/2015/05/11/9aa2fb892495875e4b84d64531ffc86b1.jpg,"2,900",30분 이내,초급,1인분,"[('목이버섯', ''), ('국수소면', ''), ('야채                                                                                각종', ''), ('계란                                                                                삶은것', ''), ('고추장', '1.5스푼'), ('고추가루', '1/2스푼'), ('들기름                                                                                or 참기름', '1/2스푼'), ('깨', '약간'), ('후추', '약간'), ('마늘가루', '약간'), ('식초', '1스푼'), ('매실액', '2스푼'), ('꿀', '1스푼'), ('한식간장', '1스푼'), ('새우젓', '약간'), ('멸치액젓', '약간'), ('까나리액젓', '약간')]",목이버섯과 목이버섯국수를 이용한 목이버섯 비빔국수를 만들어보았습니다~,"[{'step_number': 1, 'description': '목이버섯 한줌 정도를 씻어서 물에 불려놓고 냉장고에 넣어놓고 잤어요! 다음날 일어났더니 목이버섯이 잘 불어있네요. 이제 본격적으로 목이버섯 비빔국수를 만들어 보아요~', 'image_url': 'https://recipe1.ezmember.co.kr/cache/recipe/2015/05/11/52591859b68cb17e03ef64e682d249281.jpg'}, {'step_number': 2, 'description': '분량대로 양념장을 만들어 주세요. 고추가루하고 고추장 양은 매운 정도에 따라 입맛에 맞게 가감할 수 있어요~', 'image_url': 'https://recipe1.ezmember.co.kr/cache/recipe/2015/05/11/f55f8e6ac2ebc8c488b1673030fd04e11.jpg'}, {'step_number': 3, 'description': '양념장을 만들어 둔 다음 물을 끓여서 목이버섯 국수를 삶아주세요~없으면 일반 소면으로 대체하면 됩니다.', 'image_url': 'https://recipe1.ezmember.co.kr/cache/recipe/2015/05/11/beffcd02c48c63a3b4ab262fc1f6a2b41.jpg'}, {'step_number': 4, 'description': '끓는물에 목이버섯국수 투하!', 'image_url': 'https://recipe1.ezmember.co.kr/cache/recipe/2015/05/11/c6a517dd8b43704101bb028cecb5872d1.jpg'}, {'step_number': 5, 'description': '불려둔 목이버섯도 국수가 반쯤 익었을 때 넣어서 같이 데쳐줘요.', 'image_url': 'https://recipe1.ezmember.co.kr/cache/recipe/2015/05/11/2545113d8aa2367c4748a0979e9c99b31.jpg'}, {'step_number': 6, 'description': '잘익었다면 채반에 받쳐서 찬물에 헹궈주고요. 물기를 빼두어요. 목이버섯도 채반에 받쳐서 찬물에 헹구고 목이버섯은 먹기좋게 밑둥을 잘라서 물기가 빠지게 살짝 둡니다. 물기가 빠지는 동안 목이버섯 비빔국수에 올릴 고명 손질을 해요.', 'image_url': 'https://recipe1.ezmember.co.kr/cache/recipe/2015/05/11/d19425974a18fc5546c43c2fdf4972e21.jpg'}, {'step_number': 7, 'description': '면에 물기가 빠졌으면 접시에 면 투척하고 그대로 양념장과 섞어주세요.', 'image_url': 'https://recipe1.ezmember.co.kr/cache/recipe/2015/05/11/6a41983e229ed80f55f57ca087df3e3c1.jpg'}, {'step_number': 8, 'description': '그리고 데쳐둔 목이버섯포함 원하는 고명 올리고 깨 뿌렸어요! 목이버섯이랑, 미나리랑, 캐슈넛 투하! 단백질이 부족해 보이므로 견과류를 넣어서 완성~', 'image_url': 'https://recipe1.ezmember.co.kr/cache/recipe/2015/05/11/3b8db1af72eed667a69eb54d035a06331.jpg'}]"
65480,면/만두,초스피드,곡류,비빔,들기름 막국수 만들기 들기름 간장국수 쯔유 들기름 메밀국수 레시피,들기름막국수,https://recipe1.ezmember.co.kr/cache/recipe/2024/06/12/2333bb7ec290f1ee260356eacf421c3e1.jpg,"1,733",10분 이내,아무나,1인분,"[('메밀면', '100g'), ('대파', '1/2대'), ('구운김', '1장'), ('다진마늘', '1/2스푼'), ('설탕', '1/2스푼'), ('간장', '1스푼'), ('쯔유', '1스푼'), ('들기름', '3스푼'), ('통깨', '1스푼')]",달콤 짭조롬한 간장소스에 비빈 고소한 들기름향이 가득한 들기름 막국수입니다. 입맛 없는 더운 날 간단히 만들어 먹는 들기름막국수 한그릇 어떠세요 ?,"[{'step_number': 1, 'description': '볼에 다진마늘 1/2스푼 , 설탕 1/2스푼 , 간장 1스푼 , 쯔유 1스푼 , 들기름 3스푼 , 통깨 1스푼을 넣어 잘 섞어 들기름 막국수 양념을 만들어 주세요.\n볼통깨를 갈아서 넣으면 더욱 고소합니다.', 'image_url': 'https://recipe1.ezmember.co.kr/cache/recipe/2024/06/12/db6504e76ee6a514e3ab93aa5dea74491.jpg'}, {'step_number': 2, 'description': '대파는 얇게 송송 썰어 주세요.도마 , 조리용나이프대파 손질법', 'image_url': 'https://recipe1.ezmember.co.kr/cache/recipe/2024/06/12/6ec95179049d17101b3dab75775a25331.jpg'}, {'step_number': 3, 'description': '김은 마른 팬에 가볍게 구운 뒤 위생 봉지에 넣어 잘게 부수어 줍니다.\n비닐봉지', 'image_url': 'https://recipe1.ezmember.co.kr/cache/recipe/2024/06/12/e273202af8f0bb0c19e1e1c38e45ab5e1.jpg'}, {'step_number': 4, 'description': '물 1L를 끓이다 물이 끓기 시작하면 면 100g을 펼쳐 넣어 4분가량 삶아 주세요.\n냄비 , 요리젓가락중불', 'image_url': 'https://recipe1.ezmember.co.kr/cache/recipe/2024/06/12/fdf42b5c48d0d6523e9c2609f51a9d941.jpg'}, {'step_number': 5, 'description': '냄비 옆에 찬물을 준비해두었다 물이 끓으며 거품이 올라오면 찬물을 조금 부어 거품을 가라앉히며 끓여줍니다. 이 과정을 2번 하여 면을 삶아 주세요.', 'image_url': 'https://recipe1.ezmember.co.kr/cache/recipe/2024/06/12/93907c775eb082d85b23d6f4f07a5bd11.jpg'}, {'step_number': 6, 'description': '삶은 면은 바로 체반에 받쳐 흐르는 물에 열기를 식히며 헹구어 준 뒤 물기를 털어 주세요.채반물기를 완전히 제거할 필요 없이 가볍게 털어 양념에 비벼주면 더 촉촉한 들기름 막국수를 드실 수 있어요.', 'image_url': 'https://recipe1.ezmember.co.kr/cache/recipe/2024/06/12/c8d527ca37a2ed2b22be93a25f3584151.jpg'}, {'step_number': 7, 'description': '물기를 가볍게 턴 메밀면을 미리 만들어 둔 양념장에 넣어 비벼 그릇에 담은 뒤 대파와 김가루 그리고 통깨를 부수어 올려주면 들기름 막국수 완성입니다.', 'image_url': 'https://recipe1.ezmember.co.kr/cache/recipe/2024/06/12/a60b3ca2f09ad757dbd3e2fb5ab187491.jpg'}]"
65481,면/만두,초스피드,곡류,비빔,곤약 비빔면(feat.팔도),곤약비빔면,https://recipe1.ezmember.co.kr/cache/recipe/2019/02/21/f808ca2a80c1fa3148ed20fbea72047d1.jpg,"5,471",10분 이내,아무나,1인분,"[('곤약면', '1주먹'), ('당근', '1/4'), ('샐러리', '1주먹'), ('파', '1/4'), ('팔도 비빔면 소스', '1.5t'), ('참기름', '0.5t')]",배는 고프고 살은 빼고싶어하는 여러 욕망이 담긴 요리입니다. 뭐 요리라할껀 없고 조리입니다.,"[{'step_number': 1, 'description': '들어가는 재료는 냉장고에 있는 것들로 준비했습니다. 샐러리, 파,당근 입니다 취향껏 준비하시면 됩니다', 'image_url': 'https://recipe1.ezmember.co.kr/cache/recipe/2019/02/21/f096a34791a9f808f746e175e3ee47311.jpg'}, {'step_number': 2, 'description': '곤약면을 식초 0.5T정도 넣고 팔팔 끌여주세요. 곤약면의 인공향을 날랴주기위해 뚜껑은 열어놓겠습니다', 'image_url': 'https://recipe1.ezmember.co.kr/cache/recipe/2019/02/21/3ef469b86a77eb980f367cea2b685d901.jpg'}, {'step_number': 3, 'description': '당근은 채칼로 면처럼 준비하고 그릇에 옮겨 담아주세요', 'image_url': 'https://recipe1.ezmember.co.kr/cache/recipe/2019/02/21/50016ce6e8e55c441558c07a10cd4d7a1.jpg'}, {'step_number': 4, 'description': '팔도 비빔장을 넣어 버무려 드시면 됩니다. 깨를 좀 넣고 참기름도 가미하면 훨씬 맛있습니다', 'image_url': 'https://recipe1.ezmember.co.kr/cache/recipe/2019/02/21/2ff21a99486e8e4f3a06c6888cd58c491.jpg'}]"
65482,면/만두,초스피드,곡류,비빔,씹히는 맛이 예술인 오이통깨 메밀국수 만들어보겠습니다!,오이메밀국수,https://recipe1.ezmember.co.kr/cache/recipe/2019/07/01/d48d02e5661d7ec528938be0dc06cc631.jpg,853,15분 이내,아무나,2인분,"[('칠갑농산 메밀국수', '400g'), ('칠갑농산 가쓰오부시 액상소스', '4큰술'), ('오이', '2개'), ('통깨', '3큰술'), ('다진 마늘', '1큰술'), ('쪽파', '2~3개'), ('고추냉이', '약간')]","초!!초!!초!!간단 메밀국수
간단한지만 특별하게 즐겨볼까요?!?!
고소함 가득한 날되세요~♥","[{'step_number': 1, 'description': '재료 (2인기준)입니다.칠갑농산 메밀국수 400g, 칠갑농산 가쓰오브시 액상소스 4큰술, 오이 2개, 통깨 3큰술, 다진 마늘 1큰술, 쪽파2~3개, 고추냉이 약간', 'image_url': 'https://recipe1.ezmember.co.kr/cache/recipe/2019/07/01/1139dfcbb28a981646de58ce843ada331.jpg'}, {'step_number': 2, 'description': '야채손질을 합니다. 통깨는 거칠게 갈아주세요.', 'image_url': 'https://recipe1.ezmember.co.kr/cache/recipe/2019/07/01/9899c4f28b89fadfd427d5ae66f336201.jpg'}, {'step_number': 3, 'description': '끓는 물에 메밀국수를 삷은 후, 찬물에 헹궈 건져둡니다.', 'image_url': 'https://recipe1.ezmember.co.kr/cache/recipe/2019/07/01/7be3a6d0e168ec5b5ed2669aff6c38a11.jpg'}, {'step_number': 4, 'description': '메밀국수, 오이, 쪽파, 가쓰오브시 액상소스, 다진마늘, 고추냉이, 통깨를 넣어 버무려 그릇에 담으면 완성!!', 'image_url': 'https://recipe1.ezmember.co.kr/cache/recipe/2019/07/01/96795aafb51ab0aa4b3189fd096c350d1.jpg'}]"
