index,종류별,상황별,재료별,방법별,글 제목,레시피이름,레시피이미지,조회수,조리시간,난이도,인분,재료,소개글,조리순서
156231,양식,손님접대,해물류,끓이기,새우요리 감바스 알 아히요.~ 고소고소~,감바스알아히요,https://recipe1.ezmember.co.kr/cache/recipe/2017/10/14/63a3367db2dae3010b5654821f73826e1.jpg,"30,445",30분 이내,초급,4인분,"[('새우', '25마리'), ('베트남고추', '5개'), ('레몬', '조금'), ('바게트빵', ''), ('소금', '2꼬집'), ('통후추', '2꼬집'), ('올리브유', '200ml'), ('파마산치즈', ''), ('청경채', '약간')]","감바스 알 아히요는 생각보다 만들기가 까다롭지 않았어요.
올리브유를 넣어서 너무 느끼하지나 않을까 
내심 걱정을 했는데요.
생각보다 느끼하거나 만들기 어렵지 않았어요.","[{'step_number': 1, 'description': '통통한 새우를 준비하고요.\n소금물에 담가서 해동했어요.\n대략 25마리더라고요.\n머리 떼고요.새우 머리와 껍질은 모아서 \n나중에 새우 죽을 끓이려고 해요.', 'image_url': 'https://recipe1.ezmember.co.kr/cache/recipe/2017/10/14/eda64ffc02b2f268ce97a65ada301b771.jpg'}, {'step_number': 2, 'description': '새우 껍질을 모두 벗기고요.', 'image_url': 'https://recipe1.ezmember.co.kr/cache/recipe/2017/10/14/56a101a3c3874a71f6d17b493988e1df1.jpg'}, {'step_number': 3, 'description': '새우 내장을 제거했어요.', 'image_url': 'https://recipe1.ezmember.co.kr/cache/recipe/2017/10/14/a3d71b5e1acedc787369a634a68ecd771.jpg'}, {'step_number': 4, 'description': '튀길 거라 얘는 꼭 제거해주어야 합니다.\n새우 물총인데요.\n새우 꼬리에 붙어 있어요.\n걍 과감하게 싹둑 잘랐어요.요거 제거해야 기름이 튀지않아요.', 'image_url': 'https://recipe1.ezmember.co.kr/cache/recipe/2017/10/14/b262bacfcd8201b15654feeb4d18f5731.jpg'}, {'step_number': 5, 'description': '살짝 씻어 키친타올에 올려 수분을 제거했어요.\n통후추는 다져서 준비했어요.\n확실히 통후추를 뿌리니 맛이 달라지더라고요.\n새우에 소금 2꼬집과 \n후추 2꼬집을 뿌렸어요.', 'image_url': 'https://recipe1.ezmember.co.kr/cache/recipe/2017/10/14/0e21806683e132f32949f038bcf670111.jpg'}, {'step_number': 6, 'description': '마늘은 편 썰고요.\n베트남 고추는 반 잘라 준비했어요.', 'image_url': 'https://recipe1.ezmember.co.kr/cache/recipe/2017/10/14/1be589a5a162bfd799e0cb7de74294cc1.jpg'}, {'step_number': 7, 'description': '팬에 올리브유 올리고 예열하고요.\n마늘 슬라이스친 것 올려서 \n구어 줬어요.\n마늘 향이 솔솔 나는 것이 \n아주 고소하답니다.', 'image_url': 'https://recipe1.ezmember.co.kr/cache/recipe/2017/10/14/b9d818119b51815a513f5d0049034c591.jpg'}, {'step_number': 8, 'description': '지글지글 마늘이 구워질수록 \n갈릭 향이 어마 무시하게 퍼집니다.', 'image_url': 'https://recipe1.ezmember.co.kr/cache/recipe/2017/10/14/a1eef2d9e5d5812bf7886f0b15363ab91.jpg'}, {'step_number': 9, 'description': '새우가 큰 사이즈라 팬이 마구 넘치려고 해요.\n젓가락으로 살살 뒤집어 주고요.\n마늘 구워지는 것이 느껴집니다.', 'image_url': 'https://recipe1.ezmember.co.kr/cache/recipe/2017/10/14/c7bcad543c35ef13cdf07ba0266ecce01.jpg'}, {'step_number': 10, 'description': '베트남 고추도 투하하고요.\n감바스 알 아히요.\n먹음직먹으직 하게 만들어지는데요.\n군침이 줄줄 흐르는 비주얼로 만들어지더라고요.', 'image_url': 'https://recipe1.ezmember.co.kr/cache/recipe/2017/10/14/4c12ec1d7f503aa6fb6dcab87614a49d1.jpg'}, {'step_number': 11, 'description': '불 끄고요.\n레몬즙을 짜서 감바스 알 아히요에 뿌려줍니다.', 'image_url': 'https://recipe1.ezmember.co.kr/cache/recipe/2017/10/14/4dad16035f88730a50e49f6f8a4937f11.jpg'}, {'step_number': 12, 'description': '다른 팬에 바게트 빵도 \n부드럽게 살짝 데워내고요.', 'image_url': 'https://recipe1.ezmember.co.kr/cache/recipe/2017/10/14/338284602a63b35d974f093e24f1d4d51.jpg'}, {'step_number': 13, 'description': '감바스 알 아히요는 스페인 전채 요리라는군요.\n감바스는 새우고\n아히요는 마늘소스를 말한데요.\n올리브유가 들어가서 \n식으면 느끼한 맛이 강해지기 때문에\n냄비용 그릇에 조리한 뒤 그대로 먹는 게 좋다고 하네요.(네이버지식백과)\n파마산 치즈가루도 솔솔 뿌려서 먹었어요.', 'image_url': 'https://recipe1.ezmember.co.kr/cache/recipe/2017/10/14/2650008dd105d9cced6f1ef26cd5e7831.jpg'}]"
156232,양식,손님접대,해물류,끓이기,감바스 알 아히오 초간단으로 만들기!,감바스알아히요,https://recipe1.ezmember.co.kr/cache/recipe/2017/11/20/8cd74da76f87d27ddabe540cee4a3c1b1.jpg,"30,468",15분 이내,초급,2인분,"[('새우', '10여마리'), ('마늘', '5쪽'), ('올리브유', '1/2컵'), ('페페론치니', '1티스푼'), ('버터', '1스푼'), ('소금', '약간'), ('후추', '약간'), ('파슬리가루', '약간')]","스페인 지중해식 새우요리 감바스 알 아히오는 짧게 감바스라고도 부르는데 손님 초대요리로도 좋답니다
감바스는 마늘을 의미하고 흔히 까수엘라라고도 부르는데 바게트 빵을 찍어 먹어도 맛있답니다
고소한 새우와 튀기듯이 구운 마늘의 조합이 환상이지요ㅋ
쉽게 만드는 초간단 감바스 알 아히오 레시피 소개시켜 드릴게요~","[{'step_number': 1, 'description': '재료를 준비해 주세요~', 'image_url': 'https://recipe1.ezmember.co.kr/cache/recipe/2017/11/20/3b29a14e3cee0e34c8d35ee04130d6491.jpg'}, {'step_number': 2, 'description': '새우는 껍질 벗겨 손질하고 마늘은 편으로 썰어 두면 재료 준비 끝~\n버터 넣어 마늘과 페페론치니 넣고 볶다가 소금, 후추 살짝 톡톡하고 \n올리브유 넉넉히 부어 준 다음 새우를 넣어 튀기듯이 볶아 주세요~페페론치니가 없으면 청양고추 넣어도 좋답니다새우 손질법 레시피', 'image_url': 'https://recipe1.ezmember.co.kr/cache/recipe/2017/11/20/01d37e7782d5c284a9f2ff5e02080c4d1.jpg'}, {'step_number': 3, 'description': '생선그릴에 넣어 낮은 온도로 5분 정도만 기다려 주면 완성되요~생선그릴로 만들었는데 오븐 활용해도 좋고 오븐이 없으면 그냥 낮은 불에서 살짝 끓여 주면 되요~', 'image_url': 'https://recipe1.ezmember.co.kr/cache/recipe/2017/11/20/eeb10e16b53a27f460ed8dc470142c811.jpg'}]"
156233,양식,손님접대,해물류,끓이기,감바스 알 아히요,감바스알아히요,https://recipe1.ezmember.co.kr/cache/recipe/2020/07/10/f47e9b29c9b767b5d0e89eec06ea35bc1.jpg,"8,702",15분 이내,아무나,2인분,"[('생새우', '20~30마리'), ('통마늘', '20~30알'), ('올리브오일', '1/2컵'), ('파슬리', '조금'), ('오레가노', '조금'), ('페페론치노', '5개'), ('소금', '4꼬집'), ('후추', '1꼬집')]","올리브오일과 마늘,새우만 있다면 근사한 스페인요리를 집에서도 만들수 있어요
정말 어렵지 않으니 한번 도전해보세요

조리용 참고영상 
☞ ☞ https://youtu.be/GhbR3gl6F9E ☜☜","[{'step_number': 1, 'description': '통마늘은 슬라이스 쳐주세여\n★많으면 많을수록 요리의 풍미가 좋아집니다. 아낌없이 준비해주세요★', 'image_url': 'https://recipe1.ezmember.co.kr/cache/recipe/2020/07/10/5cf243435a8fe5460a760b56902262a61.jpg'}, {'step_number': 2, 'description': '준비된 편 마늘과 페페론치노를 넣고 올리브오일을 잠길정도로 넉넉히 부어주세여\n★페페론치노가 없다면 베트남고추로도 대체 가능합니다.★', 'image_url': 'https://recipe1.ezmember.co.kr/cache/recipe/2020/07/10/6089ea90aea2b803a6a79a19b43a5c371.jpg'}, {'step_number': 3, 'description': '중약불로 놓고 천천히 마늘의 향을 뽑아주세여.\n★센불로 하시면 안되요.이거 중요합니다~~꼭 약한불로 마늘이 노릇해질때까지 천천히 조리해주세요★', 'image_url': 'https://recipe1.ezmember.co.kr/cache/recipe/2020/07/10/fad3067bb42787a254f9e9550458aa431.jpg'}, {'step_number': 4, 'description': '마늘이 노릇해지면 준비한새우를 넣고 익혀주세여', 'image_url': 'https://recipe1.ezmember.co.kr/cache/recipe/2020/07/10/74a480214229f16c36e3b224be502b5e1.jpg'}, {'step_number': 5, 'description': '소금 네 꼬집과 후추 한꼬집으로 간을 해주세요. \n★소금 간은 조금 쎄게 해주셔야 맛이 좋으니 간을 보시고 더 추가해주세요★', 'image_url': 'https://recipe1.ezmember.co.kr/cache/recipe/2020/07/10/40d47ea1198045b40babb23226e0b35d1.jpg'}, {'step_number': 6, 'description': '파슬리와 오레가노를 넣고 마무리 해주세요\n★없으면 안넣어도 상관 없습니다.★', 'image_url': 'https://recipe1.ezmember.co.kr/cache/recipe/2020/07/10/a07ae11e8a1cf61e08c1add1a29804891.jpg'}]"
156234,양식,손님접대,해물류,끓이기,초간단 홈이자카야 안주 추천! 10월 제철 새우요리 감바스 만드는 법_오일 파스타 만들기,감바스,https://recipe1.ezmember.co.kr/cache/recipe/2018/10/16/38e5158619a5b11336651a2c43e7d2e41.jpg,"12,705",10분 이내,아무나,2인분,"[('새우', ''), ('마늘', ''), ('올리브유', ''), ('페페론치노', ''), ('소금', ''), ('후추', ''), ('드라이허브', ''), ('파마산치즈', ''), ('파스타면', ''), ('몽꽁떼', ''), ('PN멀티팟', '')]","집 나간 며느리도 돌아온다는 가을은 전어의 계절!
하지만 전어 못지 않게 10월 하면 떠오르는 재료가 대하!
소금에 구워먹어도 맛있고 버터에 구워먹어도맛있는 대하이지만 비싸잖아요.. ㅠㅠ

오늘은 대하가 아닌 칵테일 새우로도 충분히 맛있고 누.구.나 만들 수 있는 초간단 혼술, 홈이자카야 술안주 요리

바로 새우 감바스 만드는 법과 감바스를 활용해 오일파스타 만드는 법을 준비해 봤어요.","[{'step_number': 1, 'description': '무쇠주물 베이비 웍 몽꽁떼에 올리브유를 반 정도 넣고, 편으로 썬 마늘과 페페론치노를 넣어주세요.중약불', 'image_url': 'https://recipe1.ezmember.co.kr/cache/recipe/2018/10/16/54e2694e99610fd8663ffa963884f0c11.jpg'}, {'step_number': 2, 'description': '마늘향이 솔솔~ 고소하게 나기 시작했다면 새우를 넣어주세요.해동 후 물에 한 번 씻은 새우는 키친타월로 톡톡 두드려 물기를 제거해서 넣어주세요.', 'image_url': 'https://recipe1.ezmember.co.kr/cache/recipe/2018/10/16/bf83c4fe8765baba8a13de23ea0c81121.jpg'}, {'step_number': 3, 'description': '취향과 재료 상황에 따라 소금, 후추, 허브, 파마산치즈 등을 넣고 새우가 빨갛게 익었다 싶으면 감바스 만들기 끝!중약불비싼 대하 대신 시판 자숙새우를 활용하시면 손질도 필요없고 한 번 익혀서나온 만큼 얼마나 익혀야 할지 걱정 고민 없이 요리 초보도 손쉽게 초간단 감바스 알 아히요 만들기 성공이랍니다.', 'image_url': 'https://recipe1.ezmember.co.kr/cache/recipe/2018/10/16/416d0fc3ddcf9b37adebfec9412bbeca1.jpg'}, {'step_number': 4, 'description': '+보너스)\n감바스만으로는 뭔가 배가 고프다 싶을 때, PN 멀티팟에 파스타면을 삶아 남은 감바스 오일에 섞어주면 맛있는 초간단 오일 파스타로 변신!오일소스를 적당히 머금도록 스파게티나 링귀니같은 너무 굵지 않은 롱파스타를 추천드려요!', 'image_url': 'https://recipe1.ezmember.co.kr/cache/recipe/2018/10/16/252b362eeab1b3bcca22f905c2ed05ea1.jpg'}, {'step_number': 5, 'description': '무쇠주물냄비 몽 꽁떼와 PN멀티팟의 만남으로 맛있는 오일 파스타 완성!파스타 면 대신 남은 식빵 자투리 등을 찍어먹어도 맛있어요!', 'image_url': 'https://recipe1.ezmember.co.kr/cache/recipe/2018/10/16/54918d5d608383ea1d88f55f0c345a6d1.JPG'}]"
156235,양식,손님접대,해물류,끓이기,지중해 요리 - 감바스 알 아히요,감바스알아히요,https://recipe1.ezmember.co.kr/cache/recipe/2016/05/16/4c881a6eb39117a350c84ad5d1fb42261.jpg,"28,103",30분 이내,초급,2인분,"[('새우', '200g'), ('바지락', '200g'), ('바게트 빵', '4-5개'), ('버터', '1조각'), ('붉은 고추', '1개'), ('이태리 파슬리', '1-2줄'), ('소금', '약간'), ('올리브오일                                                                                70ml', '1/3컵')]","지중해 식단은 그리스의 크레타섬 주민들의 시골식 식사법에서 유래된 건강 식단인데요. 예로부터 크레타 주민들은 채소와 과일, 요구르트와 생선, 그리고 올리브오일과 포도추를 항상 챙겨 먹었다고 합니다. 이 때문에 세계적인 건강, 장수 식단으로 꼽힌답니다. 
지중해 식단은 WHO 에서 발표한 건강한 식단으로 선정되었으며, 대장암과 심혈관 질환의 예방에도 효과가 있답니다.



특히 그리스. 스페인 등의 지중해 요리는 유네스크 지정 인류무형문화유산이기도 하고요. 



오늘은 그 중에서 까수엘라라고 불리는 감바스 알 아히요를 만들어 보겠습니다. 감바스 알 아히요는 칼슘, 비타민, 철분, 단백질 등이 



풍부한 해산물로 요리한 스페인 가정식 요리랍니다.","[{'step_number': 1, 'description': '재료도 생각보다 간단하답니다. 새우는 너무 작은 걸 사용하면 쪼그라들어서 볼품이 없어지니까 너무 작은 새우만 피하세요. 붉은 고추는 가위로 잘랐는데, 원래는 이태리 고추인 페퍼론치노를 사용하면 더욱 좋습니다.', 'image_url': 'https://recipe1.ezmember.co.kr/cache/recipe/2016/05/18/c28197d594c1db84443ccad52f0b10be1.jpg'}, {'step_number': 2, 'description': '올리브오일은 종이컵 3분의 1컵이 필요하구요.', 'image_url': 'https://recipe1.ezmember.co.kr/cache/recipe/2016/05/18/cb7dc969822f60e2ed0b5201e8d121681.jpg'}, {'step_number': 3, 'description': '바지락은 찬물에 식초 1-2큰술을 넣어 10분간 담궈놓으면 해감이 됩니다. 요거 소금보다 해감이 빨라서 좋답니다. 해감이 끝나면 헹궈서 물기를 제거하시구요.', 'image_url': 'https://recipe1.ezmember.co.kr/cache/recipe/2016/05/18/725fa0c9c256e59e75b40e09ad622b0b1.jpg'}, {'step_number': 4, 'description': '새우는 머리를 떼고 새우 꼬리쪽에 한 마디만 껍질을 남기고 모두 벗겨줍니다.', 'image_url': 'https://recipe1.ezmember.co.kr/cache/recipe/2016/05/18/3e760fa9b6928dfd253b9ac50a1301c61.jpg'}, {'step_number': 5, 'description': '꼬리 쪽에 뽀족한 삼각 모양의 물총이 있는데, 요것도 제거합니다. 기름에 들어 갔을 때 튈 수가 있기 때문이지요.', 'image_url': 'https://recipe1.ezmember.co.kr/cache/recipe/2016/05/18/cb03089abb9d0ccb2e070fab86b2919c1.jpg'}, {'step_number': 6, 'description': '새우 등쪽에 이쑤시개를 넣어 올리면 검은 내장이 제거됩니다. 요거 쓴 맛이 나니까 꼭 제거하세요.', 'image_url': 'https://recipe1.ezmember.co.kr/cache/recipe/2016/05/18/59fa629686b7bf424c9f840135606ed11.jpg'}, {'step_number': 7, 'description': '손질한 새우 몸통과 머리는 소금물에 헹궈서 물기를 제거해줍니다.', 'image_url': 'https://recipe1.ezmember.co.kr/cache/recipe/2016/05/18/8f29ad877dfa7600b69c7f79c78bf12d1.jpg'}, {'step_number': 8, 'description': '작은 냄비에 올리브유 종이컵 3분의 1컵을 넣고 저민 마늘과 자른 고추를 은근하게 약불에서 익혀줍니다. 원래 스페인에서는 작고 얕은 뚝배기를 사용하는 것이 정석이지요. 그러므로 원하는 뚝배기가 없으면 작은 냄비나 팬을 이용하세요. 마늘이 노릇해지면 바지락을 넣어줍니다.', 'image_url': 'https://recipe1.ezmember.co.kr/cache/recipe/2016/05/18/ee4f07d147818754be37f70e09a9aa431.jpg'}, {'step_number': 9, 'description': '새우를 넣고 뚜껑을 닫아서 바지락이 입이 벌려질 때까지 익혀줍니다. 너무 오래 익히면 새우나 바지락이 질겨지니 주의하시구요. 저는 새우 머리까지 넣어주었는데, 그래야만 맛이 훨씬 깊어진답니다. 몸통만 넣으셔도 되긴 하구요. 불을 끄고 소금 약간을 넣어주시구요. 소금이 해물의 감칠맛을 업시켜준답니다.', 'image_url': 'https://recipe1.ezmember.co.kr/cache/recipe/2016/05/18/0fbbd19c8fa88cef741ee15a6fe3a14d1.jpg'}, {'step_number': 10, 'description': '이태리 파슬리를 넣어 완성합니다.', 'image_url': 'https://recipe1.ezmember.co.kr/cache/recipe/2016/05/18/1417569a123c855658acdbf414844f441.jpg'}, {'step_number': 11, 'description': '바게트빵은 버터를 넣어 노릇하게 앞뒤로 구워줍니다.', 'image_url': 'https://recipe1.ezmember.co.kr/cache/recipe/2016/05/18/8b33a79dc92cd50cd467b7e7f033650a1.jpg'}, {'step_number': 12, 'description': '감바스 알 아히요가 완성되었습니다.', 'image_url': 'https://recipe1.ezmember.co.kr/cache/recipe/2016/05/18/1ddce5dcced3822c9b18ef011a0065111.jpg'}]"
156236,양식,손님접대,해물류,끓이기,No Gas stove 감바스,감바스,https://recipe1.ezmember.co.kr/cache/recipe/2018/06/11/825a42d305fa6f369e6e2f4960e9d1491.jpg,"11,598",15분 이내,아무나,1인분,"[('새우', '10마리'), ('마늘', '5알'), ('올리브유', '100ml'), ('느타리버섯', '50g'), ('청량초', '1개'), ('페퍼론치노', '5개'), ('양파', '1/8개'), ('소금', '2t'), ('후추', '1t'), ('간장', '1t')]","제가 평소에 감바스를 즐겨먹는데 생각보다 감바스란 요리를 아는사람이
많지않더라구요. 그래서 이 요리를 많은사람에게 알리고자 불을 쓰지않고 
전자레인지로 간편하게 만들어먹을 수 있는 레시피를 만들어왔습니다.","[{'step_number': 1, 'description': '준비한 재료를 깨끗히 씻어줍니다.(페퍼론치노 제외)페퍼론치노가 없다면 안넣으셔도 됩니다!', 'image_url': 'https://recipe1.ezmember.co.kr/cache/recipe/2018/06/11/dac4ba016ac65e93917465ca1f970da21.jpg'}, {'step_number': 2, 'description': '새우-껍질과 내장을 제거한다.간장과 후추로 간해줍니다.\n마늘-편 썰어줍니다.\n버섯-먹기좋은 크기로 찢어줍니다.\n양파-다져줍니다.\n청량초-어슷썰어줍니다.새우의 내장을 제거할땐 이쑤시개로 빼는게 편해요!', 'image_url': 'https://recipe1.ezmember.co.kr/cache/recipe/2018/06/11/ad4cd516fd061584440968f3e88a6b201.jpg'}, {'step_number': 3, 'description': '뚝배기나 전자레인지용기에 올리브유와 마늘을 넣고 \n4분간 돌려줍니다.전자레인지마늘을 먼저 조리해야 마늘의 향이 많이나요!', 'image_url': 'https://recipe1.ezmember.co.kr/cache/recipe/2018/06/11/b4dba7e913bdddefe15957c22bef882f1.jpg'}, {'step_number': 4, 'description': 'Step3가 끝나면 새우,양파,버섯,페퍼론치노,소금,후추를 넣고 3분간 돌려줍니다.새우가 밑에 깔려잇어야지 촉촉하게 익어요!', 'image_url': 'https://recipe1.ezmember.co.kr/cache/recipe/2018/06/11/dbbea6785675204c241244482da185971.jpg'}, {'step_number': 5, 'description': '다 익은 재료들을 잘 섞어준 뒤 원하는 접시에 옮겨담아\n예쁘게 플레이팅을 합니다.손님대접용이라면 깔끔한 흰접시가 좋아요!', 'image_url': 'https://recipe1.ezmember.co.kr/cache/recipe/2018/06/11/5ac2eb5b7dcf10c3f3d3b4f4f080889d1.jpg'}]"
156237,양식,손님접대,해물류,끓이기,감바스 알 아히요 레시피 감바스 만드는법,감바스알아히요,https://recipe1.ezmember.co.kr/cache/recipe/2023/07/03/6131022767c94475080fc0f702c21c281.jpg,"1,135",30분 이내,초급,2인분,"[('새우', '20마리'), ('소금', '약간'), ('후추', '2꼬집'), ('맛술', '1스푼'), ('통마늘', '10개'), ('아스파라거스', '2개'), ('토마토', '1/2개'), ('페페론치노', '2~3개'), ('올리브오일', '8스푼'), ('치킨스톡', '50g'), ('허브솔트', '')]",새우와 마늘을 듬뿍 넣은 스페인 요리입니다^^ 풍미 깊은 새우요리~ 맛있게 만들어 드세요 :),"[{'step_number': 1, 'description': '새우는 머리와 껍질을 제거해 깨끗이 씻은 뒤 소금,후추 두꼬집과 맛술 1스푼을 넣어 밑간을 해 주세요.손질 새우를 사용하시면 더욱 편리합니다.', 'image_url': 'https://recipe1.ezmember.co.kr/cache/recipe/2023/07/03/9d34e4e56afc0c4852a81e3ede0dd2e81.jpg'}, {'step_number': 2, 'description': '통마늘은 꼭지를 제거하고 4등분으로 편썰어 주세요.', 'image_url': 'https://recipe1.ezmember.co.kr/cache/recipe/2023/07/03/a633a14ddbc569b8b1fb7076e2e695111.jpg'}, {'step_number': 3, 'description': '아스파라거스와 토마토는 먹기 좋은 크기로 잘라줍니다. (베이컨이나 방울토마토,파프리카 등 원하는 재료를 넣어주시면 됩니다.)', 'image_url': 'https://recipe1.ezmember.co.kr/cache/recipe/2023/07/03/ec8a1145b229ac21a77bd1695c95200d1.jpg'}, {'step_number': 4, 'description': '올리브유 8스푼 넣은 팬에 마늘과 페페론치노 2~3개를 넣어 볶아주다가 새우를 넣어 볶아주세요. 새우가 붉게 익으면 아스파라거스와 토마토를 넣어 주세요.매운향이 좋으시면 페페론치노를 부셔서 넣어주세요.', 'image_url': 'https://recipe1.ezmember.co.kr/cache/recipe/2023/07/03/dc80bd1836b83f863ed179c622b0d96c1.jpg'}, {'step_number': 5, 'description': '치킨스톡 50g 을 넣어 풍미를 살려주시고 부족한 간은 허브솔트로 해 주시면 완성입니다.', 'image_url': 'https://recipe1.ezmember.co.kr/cache/recipe/2023/07/03/9d2fd529a7f5a991c7275e3419c805da1.jpg'}, {'step_number': 6, 'description': '여기에 파스타면 삶아 볶아드시면 오일파스타로도 즐기실 수 있어요 ^^', 'image_url': 'https://recipe1.ezmember.co.kr/cache/recipe/2023/07/03/f3ec6933a3e44d2f21d6192b3d1d9dbc1.jpg'}]"
156238,양식,손님접대,해물류,끓이기,"초간단 감바스 알 아히요, 폼나는 새우요리",감바스알아히요,https://recipe1.ezmember.co.kr/cache/recipe/2017/03/21/429b3de1443445602136fc812c894aed1.jpg,"9,585",15분 이내,아무나,3인분,"[('새우', '300g'), ('마늘', '7~8개'), ('홍고추', '1개'), ('올리브오일', '1.5~2컵'), ('바질가루', ''), ('빵', '')]","새우로 만드는 폼나는 요리!
감바스 알 아히요 
파티음식, 집들이음식, 손님접대음식으로 너무 좋아요
예쁘기도하고, 맛있기까지 하니깐 말이죠","[{'step_number': 1, 'description': '홍고추는 어슷썰기해주세요', 'image_url': 'https://recipe1.ezmember.co.kr/cache/recipe/2017/03/21/9e163e49c00d4ce4c8694111ddcde97f1.jpg'}, {'step_number': 2, 'description': '마늘은 모양대로 편을 썰어주세요', 'image_url': 'https://recipe1.ezmember.co.kr/cache/recipe/2017/03/21/35047363ac9497b0649c36e55446d3541.jpg'}, {'step_number': 3, 'description': '올리브오일을 1컵 반~ 2컵정도 부어주세요 \n그리고 홍고추와 편마늘을 넣어주세요 \n그리고 가스불을 켜서 끓여줍니다 \n* 새우의 양에 따라 올리브오일의 양을 조절하세요\n새우가 잠길정도의 양이면 됩니다', 'image_url': 'https://recipe1.ezmember.co.kr/cache/recipe/2017/03/21/dc6c902eb1b2ef1e31c803bf973a96061.jpg'}, {'step_number': 4, 'description': '저는 냉동 생새우살을 사용했어요\n새우껍질은 이미 벗겨져있었고, 깨끗하게 씻어 키친타월을 이용해서 물기를 다 닦아주세요', 'image_url': 'https://recipe1.ezmember.co.kr/cache/recipe/2017/03/21/697f888ae84d514598b54fd0c5b8201d1.jpg'}, {'step_number': 5, 'description': '올리브오일이 끓기 시작하면 새우를 모두 넣어주세요', 'image_url': 'https://recipe1.ezmember.co.kr/cache/recipe/2017/03/21/4a0f3ef870a70f01c6c9109a36ff24151.jpg'}, {'step_number': 6, 'description': '새우가 예쁜 주황색으로 다 익을때까지 끓여주세요', 'image_url': 'https://recipe1.ezmember.co.kr/cache/recipe/2017/03/21/bda0e3933bc2162b3c619f667a25f2b01.jpg'}, {'step_number': 7, 'description': '새우가 동동 뜬답니다', 'image_url': 'https://recipe1.ezmember.co.kr/cache/recipe/2017/03/21/11d85a7dc7ec53388cb1bd0d081add431.jpg'}]"
