index,종류별,상황별,재료별,방법별,글 제목,레시피이름,레시피이미지,조회수,조리시간,난이도,인분,재료,소개글,조리순서
55307,디저트,초스피드,해물류,부침,간단하고 맛있는 해산물 오코노미야끼 만들기,해산물오코노미야끼,https://recipe1.ezmember.co.kr/cache/recipe/2018/06/04/b9ae47ff74ebfb14cd048c5f847dc66c1.jpg,"99,919",10분 이내,초급,2인분,"[('양배추', '1/4통'), ('오징어                                                                                채썬것 한줌', '1/2마리'), ('새우', '10~15마리'), ('양파', '1/2개'), ('후추', '약간'), ('가츠오부시', '1줌'), ('달걀', '2개'), ('부침가루', '2~3큰술'), ('마요네즈', '2큰술'), ('야끼소바소스(돈까스소스)', '2.5큰술')]","일본에서 먹던 맛 그대로, 초스피드 오코노미야끼 아주 간단하게 만들 수 있어요. 식사대용으로나 간식으로도, 안주로도 훌륭한 한끼. 해산물 오코노미야끼 만들어보겠습니다.","[{'step_number': 1, 'description': '요즘 국산오징어도 꽤 나오더라구요. 저는 수산시장에서 2~3마리를 사서 물에 잘 씻어서 껍질을 벗기고 채썰어서 냉동실에 먹을만큼 냉동해두었다가 필요할때 꺼내쓴답니다. 오징어는 채썬후, 다시 토막토막 1~2센티 정도로 잘라주시고, 새우도 식감있는 정도로 3,4등분 해주세요.', 'image_url': 'https://recipe1.ezmember.co.kr/cache/recipe/2018/06/04/d0195255a5d50038562e054acf43616e1.jpg'}, {'step_number': 2, 'description': '양배추와 양파는 채썰어서 너무 야채 길이가 길거나 크지않을정도로만 잘라 준비해주세요.양배추는 채썰어서 찬물에 조금 담가두었다가 걸러서 쓰시면 좋아요.', 'image_url': 'https://recipe1.ezmember.co.kr/cache/recipe/2018/06/04/e426212ce82c9fda68d87b22289508c11.jpg'}, {'step_number': 3, 'description': '오코노미야끼에 뿌려줄 마요네즈와 야끼소바소스를 준비해주세요.만약 오코노미야끼용 소스가 없다면 돈까스 소스나 오므라이스 소스도 괜찮아요.', 'image_url': 'https://recipe1.ezmember.co.kr/cache/recipe/2018/06/04/363a5d3e09f782a6ab7549456f5e224c1.jpg'}, {'step_number': 4, 'description': '마트에 가면 파는 가츠오부시. 가츠오부시만 있다면 일본에서 먹던 맛 그대로 즐기실 수 있어요. 하지만 굳이 없고 귀찮으시면 안 뿌리고 먹어도 맛있답니다.', 'image_url': 'https://recipe1.ezmember.co.kr/cache/recipe/2018/06/04/f01d746e00cd550d1534466eeeb9968b1.jpg'}, {'step_number': 5, 'description': '큰 볼에 양배추, 양파, 해산물을 넣고, 계란두개와 부침가루 2~3큰술을 넣은 후 섞어주세요.\n저는 개인적으로 부침가루는 많이 넣으면 맛이 없더라구요. 재료가 달라붙는 점성을 위해 조금만 넣어주세요.', 'image_url': 'https://recipe1.ezmember.co.kr/cache/recipe/2018/06/04/a754930dd29ebf3661f540003cebccd61.jpg'}, {'step_number': 6, 'description': '이정도로 질어보여도 문제없어요^^, 집에 다진마늘 있으시면 1t정도 넣으시고, 후춧가루도 약간 뿌려주세요. 없으시면 패스~', 'image_url': 'https://recipe1.ezmember.co.kr/cache/recipe/2018/06/04/d7cc997e7bcecbf0d5554121f4a0c2391.jpg'}, {'step_number': 7, 'description': '반죽을 잘 섞은 다음 이제 부쳐줄건데요.', 'image_url': 'https://recipe1.ezmember.co.kr/cache/recipe/2018/06/04/3f5f6faaee4d1d7bc492cea823ec418d1.jpg'}, {'step_number': 8, 'description': '후라이팬을 중불로 달궈서 오일을 넉넉히 넣고, 불은 반드시 약불로 줄여주신후 반죽을 동그랗게 다듬으면서 두툼하게 올려주세요. 화면처럼. 너무 크게 부치면 뒤집기 어려우니 손바닥보다 약간 큰 사이즈 정도로 부쳐주시면 편해요.불이 너무 강하면 겉만 타고 안쪽은 안익을 수 있으니 약불로 뚜껑을 덮고 조리해주세요.', 'image_url': 'https://recipe1.ezmember.co.kr/cache/recipe/2018/06/04/709ea94e3711eb947db9f8af8b37df6c1.jpg'}, {'step_number': 9, 'description': '약불에 지지다가 뚜껑을 덮고 1분정도 뭉근히 구워주세요. 그리고 아래면이 익으면 상태를 봐서 한방에 뒤집어주세요. ㅋ\n기름의 양은 너무 적으면 타니 적당히 넣어주세요.', 'image_url': 'https://recipe1.ezmember.co.kr/cache/recipe/2018/06/04/68fb5492c7b4546ebe14927c2d54ee1d1.jpg'}, {'step_number': 10, 'description': '약불로 해야 겉만 타지 않고 안까지 익을 수 있습니다. 마무리할때는 뚜껑은 열고 양면이 바삭하게 익도록 구워주세요. 두꺼워서 많이 뒤집기 힘들기 때문에 한두번만에 잘 뒤집어서 끝내야해요.', 'image_url': 'https://recipe1.ezmember.co.kr/cache/recipe/2018/06/04/8e2fcbc000e56348d1c3961ace5ef60a1.jpg'}, {'step_number': 11, 'description': '이렇게 10분안에 완성된 해물오코노미야끼를 접시에 담아주시고', 'image_url': 'https://recipe1.ezmember.co.kr/cache/recipe/2018/06/04/58680b4f439f873851d7422b50d8ee611.jpg'}, {'step_number': 12, 'description': '야끼소바 소스를 지그재그로 뿌려주세요.', 'image_url': 'https://recipe1.ezmember.co.kr/cache/recipe/2018/06/04/1c76eb70bbf1d94a50e7afc54b4848fc1.jpg'}, {'step_number': 13, 'description': '저도 따로 짤주머니 등이 없어서 예쁘게 뿌려지지 않았어요. 여러분은 마요네즈를 먼저 면에 펴바른 후에 야끼소바 소스를 뿌리면 더 예쁠것 같네요.', 'image_url': 'https://recipe1.ezmember.co.kr/cache/recipe/2018/06/04/110c013e198808681d402298b5b2b30b1.jpg'}, {'step_number': 14, 'description': '마지막으로 가츠오부시를 위에 넉넉하게 뿌려 덮어주세요. 가츠오부시는 많이 뿌려도 맛있어요. 간과 감칠맛을 잡아주거든요.', 'image_url': 'https://recipe1.ezmember.co.kr/cache/recipe/2018/06/04/6730ea9dfb7133a7125519f971be383f1.jpg'}, {'step_number': 15, 'description': '간단하고 맛있는 해산물 오코노미야끼 완성~! 열로 인해 가츠오부시가 하늘하늘 춤을 추네요.', 'image_url': 'https://recipe1.ezmember.co.kr/cache/recipe/2018/06/04/7eff01f53b52852669e7fee9422e01621.jpg'}, {'step_number': 16, 'description': '언제 먹어도, 밥대용, 술안주로도 손색이 없는 해산물 오코노미야끼.\n야채에 파를 추가하거나, 해산물로 문어나 건새우를 사용해도 정말 좋아요. 다양하게 좋아하는 해물을 넣어 만들어보세요.', 'image_url': 'https://recipe1.ezmember.co.kr/cache/recipe/2018/06/04/c97b253384536b82a0a96a3dcf0602921.jpg'}, {'step_number': 17, 'description': '피자처럼 칼로 잘라먹거나 포크로 떠먹으면 되요. 손님접대나 특별한 음식이 먹고싶은 날. 10분이면 금방 만들수 있어요. 오늘 진하고 맛있는 오코노미야끼 만들어보세요~~', 'image_url': 'https://recipe1.ezmember.co.kr/cache/recipe/2018/06/04/69f0578db5b53aaa60ea3c7cf93a87381.jpg'}]"
55308,디저트,초스피드,해물류,부침,"일본식 부침개
오꼬노미야끼",오꼬노미야끼,https://recipe1.ezmember.co.kr/cache/recipe/2016/06/07/426e4d022e53a20cbf8faecc1c2376ab1.jpg,"5,706",30분 이내,중급,4인분,"[('밀가루', '2컵'), ('전분(감자나 옥수수)', '1컵'), ('물', '1.5컵'), ('계란', '2개'), ('적양배추', '200g'), ('냉동새우', '195g'), ('양파', '1/2개'), ('갑오징어', '145g'), ('베이컨', '165g'), ('파', ''), ('소금', '1t'), ('가쓰오육수', '1T'), ('데리야끼소스', '1T'), ('간장', '2T'), ('올리고당', '2T'), ('가쓰오부시', '')]","오꼬노미야끼에 들어가는 재료를 좀더
업그레이드 해서 만들었어요 
오징어대신 갑오징어 양배추대신 적양배추로 하니 
식감이 더 배가되 맛이 좋네요
우리네 부침개도 맛있지만 가끔은 이런 일본식 
부침개도 색다르게 해드시는것도 맛있겠죠
오늘 같은 날씨에 딱이네요^^","[{'step_number': 1, 'description': '밀가루 전분 계란 소금을 넣고 반죽을 합니다', 'image_url': 'https://recipe1.ezmember.co.kr/cache/recipe/2016/06/07/aeda7d44e9eb486a3b9abf98c3a62e771.jpg'}, {'step_number': 2, 'description': '적채는 채를 썰어 물에 담가놓습니다', 'image_url': 'https://recipe1.ezmember.co.kr/cache/recipe/2016/06/07/cc89f7eb8f578c9c4a2febed60b834a91.jpg'}, {'step_number': 3, 'description': '양파도 채를 썰어놓습니다', 'image_url': 'https://recipe1.ezmember.co.kr/cache/recipe/2016/06/07/846fe81d059bf503f206d24ebae5909e1.jpg'}, {'step_number': 4, 'description': '새우 갑오징어를 다집니다', 'image_url': 'https://recipe1.ezmember.co.kr/cache/recipe/2016/06/07/a6d1a9fd89a40ed051f83004098f2c611.jpg'}, {'step_number': 5, 'description': '베이컨도 썰어놓습니다', 'image_url': 'https://recipe1.ezmember.co.kr/cache/recipe/2016/06/07/e3661f44d1c76e5e87f1e2dcac2539ad1.jpg'}, {'step_number': 6, 'description': '반죽에 모든 재료를 넣습니다', 'image_url': 'https://recipe1.ezmember.co.kr/cache/recipe/2016/06/07/57e40f94fc82141a15ffe977ebdc9bf41.jpg'}, {'step_number': 7, 'description': '가쓰오육수를 만듭니다', 'image_url': 'https://recipe1.ezmember.co.kr/cache/recipe/2016/06/07/8450e76d2dfd13a8371f107fed4b46e31.jpg'}, {'step_number': 8, 'description': '소스를 만듭니다', 'image_url': 'https://recipe1.ezmember.co.kr/cache/recipe/2016/06/07/7246f558ba257c2dd883f5c3c72d76371.jpg'}, {'step_number': 9, 'description': '팬에 오일을 넣고 반죽을 도톰하게 올립니다', 'image_url': 'https://recipe1.ezmember.co.kr/cache/recipe/2016/06/07/2a1db98e1bad095053067fb0423d6f921.jpg'}, {'step_number': 10, 'description': '약불로 뚜껑을 덮고 은근히 익힙니다', 'image_url': 'https://recipe1.ezmember.co.kr/cache/recipe/2016/06/07/7c4c5741d3d2f75416546eaa0005e25f1.jpg'}, {'step_number': 11, 'description': '앞뒤로 노릇하게 부칩니다', 'image_url': 'https://recipe1.ezmember.co.kr/cache/recipe/2016/06/07/1df2ae9042492179680c62cff9a551cc1.jpg'}, {'step_number': 12, 'description': '접시에 올린후 가쓰오를 올립니다', 'image_url': 'https://recipe1.ezmember.co.kr/cache/recipe/2016/06/07/cdf68c83f6294330edde436cf9fb738c1.jpg'}, {'step_number': 13, 'description': '위에 오꼬노미소스를 뿌립니다', 'image_url': 'https://recipe1.ezmember.co.kr/cache/recipe/2016/06/07/45abd920bbef32eac994e72f9df32df61.jpg'}, {'step_number': 14, 'description': '그위에 마요네즈를 뿌립니다', 'image_url': 'https://recipe1.ezmember.co.kr/cache/recipe/2016/06/07/29e39aa8ead6c93132754f61b57ee5821.jpg'}]"
