index,종류별,상황별,재료별,방법별,글 제목,레시피이름,레시피이미지,조회수,조리시간,난이도,인분,재료,소개글,조리순서
35295,메인반찬,손님접대,닭고기,굽기,닭오븐구이 간편하게 만들기,닭오븐구이,https://recipe1.ezmember.co.kr/cache/recipe/2015/04/06/cb0d3c094a36ba96349467fa4610fc3f1.jpg,"36,271",None,None,None,"[('닭', '1마리'), ('우유', ''), ('소금', '1T'), ('설탕', '2T'), ('후추', '1t'), ('다진마늘', '1T'), ('식용유', '1T'), ('파슬리가루', '')]",저렴하고 간편하게 만들어먹는 닭오븐구이,"[{'step_number': 1, 'description': '닭껍질을 싫어하고 기름이 많아서 웬만한 닭요리(닭볶음탕, 삼계탕 등등)를 할 때 껍질은 벗겨내는 편이에요', 'image_url': 'https://recipe1.ezmember.co.kr/cache/recipe/2015/04/10/4d893172668823d17ec64c1ca63813e71.jpg'}, {'step_number': 2, 'description': '닭을 먹기좋게 잘라줍니다 양쪽다리, 양쪽날개를 자르고 가슴살 등은 살코기만 발라내었어요 두꺼운 살코기 부분은 칼집을 내주시는게 좋아요. 그래야 빨리 익고 양념도 잘 베고^^', 'image_url': 'https://recipe1.ezmember.co.kr/cache/recipe/2015/04/10/5b61d03d13fccab1354d5285b851171c1.jpg'}, {'step_number': 3, 'description': '손질된 닭은 우유에 20~30분 재워줍니다. 누린내를 잡기위해서지요', 'image_url': 'https://recipe1.ezmember.co.kr/cache/recipe/2015/04/10/568a873bbccb2aaf25f8446153b55d861.jpg'}, {'step_number': 4, 'description': '양념은 간단합니다. 간장소스로 만들어먹어도 좋지만 깔끔하게 소금양념으로 했어요 분량의 다진마늘, 소금, 설탕, 식용유, 후추, 파슬리가루를 넣어줍니다', 'image_url': 'https://recipe1.ezmember.co.kr/cache/recipe/2015/04/10/c519c77e7e92cecafc5bdd3c95c9e5dc1.jpg'}, {'step_number': 5, 'description': '우유에 재어져있던 닭을 건져내 양념과 비비적비비적 잘 버물린 후 시간이 된다면 냉장고에서 30분~1시간 숙성시켜주세요.', 'image_url': 'https://recipe1.ezmember.co.kr/cache/recipe/2015/04/10/46f80263666e51ff5ff7360848de31f31.jpg'}, {'step_number': 6, 'description': '220도 예열한 오븐에서 30~40분가량 구워주세요. 색이 노릇노릇해질 때까지 ^^오븐', 'image_url': 'https://recipe1.ezmember.co.kr/cache/recipe/2015/04/10/14c0925cfea03d7f69f59b69be700dda1.jpg'}, {'step_number': 7, 'description': '기름기가 쏙~ 빠진 홈메이드 치킨완성입니다~', 'image_url': 'https://recipe1.ezmember.co.kr/cache/recipe/2015/04/10/d2800b57f9e3522fc966c53f542969a01.jpg'}]"
35296,메인반찬,손님접대,닭고기,굽기,오렌지 쥬스로 만든 닭안심구이,닭안심구이,https://recipe1.ezmember.co.kr/cache/recipe/2015/09/11/f48b8aff005781bdffd95fe2ab702044.jpg,"9,903",2시간 이상,초급,4인분,"[('닭안심살                                                                                닭다리 또는 가슴살', '500g'), ('구이용 포도씨유', '3큰술'), ('샐러드야채', '적당량'), ('오렌지쥬스', '1컵'), ('오렌지 마말레이드', '1큰술'), ('꿀', '1큰술'), ('간장', '1큰술'), ('소금', '조금'), ('후추', '조금'), ('큐브형 치킨스톡', '1개'), ('포도씨유', '1큰술'), ('오렌지쥬스', '2~3큰술'), ('식초', '1큰술'), ('오일                                                                                올리브유혹은 포도씨유', '1큰술'), ('소금', '조금'), ('꿀                                                                                이나 올리고당', '1/2큰술')]",만들기 간단하고 맛있는 치킨요리입니다.,"[{'step_number': 1, 'description': '레시피 재료를 몽땅 오렌지쥬스에 넣어 녹여 줍니다. 오렌지쥬는 슈퍼에서 파는것으로 100%쥬스를 사용합니다. 다만 오렌지 스카시100~ 요건 안된다는것.', 'image_url': 'https://recipe1.ezmember.co.kr/cache/recipe/2015/09/11/4240dcb66894ebb2cbc6287bcebdf2e21.jpg'}, {'step_number': 2, 'description': '마말레이드입니다. 없다면 유자차용 유자청으로 하세요.', 'image_url': 'https://recipe1.ezmember.co.kr/cache/recipe/2015/09/11/e118c4c990ad43eddaeb8f10f604b3d41.jpg'}, {'step_number': 3, 'description': '닭고기국물 대신 요 스톡을 사용했어요. 요것도 없으시면 다시다를 1작은술 넣어 주세요.', 'image_url': 'https://recipe1.ezmember.co.kr/cache/recipe/2015/09/11/adbb3a058ce16057134aac21a60021b61.jpg'}, {'step_number': 4, 'description': '오렌지쥬스에 오렌지 마말레이드와 꿀 그리고 간장, 포도씨오일이나 올리브유를 한술 넣어 섞어주고 깨끗하게 씻어 손질해서 소금, 후추 뿌린 닭고기도 지퍼백에 몽땅 넣어 냉장고에서 한나절 혹은 하루이상 재워 둡니다.', 'image_url': 'https://recipe1.ezmember.co.kr/cache/recipe/2015/09/11/ea1f7dc656debc684d38dbc6b28f5a621.jpg'}, {'step_number': 5, 'description': '프라이팬에 기름을 두르고 가스불을 중불로 하여 닭고기를 노릇하게 구워 줍니다. 이때 기름이 튀니 주의 하시고 너무 튈때는 가스불을 끄고 다시 불을 켜고를 반복 하세요. 물론 뚜껑을 덮어 구워도 됩니다만 금방 타버리니까 조심하셔서 살펴 보셔야 한답니다.', 'image_url': 'https://recipe1.ezmember.co.kr/cache/recipe/2015/09/11/ff99598837544570a555421fbca279601.jpg'}, {'step_number': 6, 'description': '앞뒤로 노릇하게 구워지면 비닐팩에 있는 오렌지 쥬스소스를 1/4컵정도를 팬에 넣어주고 졸여 줍니다.', 'image_url': 'https://recipe1.ezmember.co.kr/cache/recipe/2015/09/11/c3dbd2f683b307b502f4fc9be01a07fc1.jpg'}, {'step_number': 7, 'description': '국물이 졸아들면서 닭고기가 윤기나게 졸여지면', 'image_url': 'https://recipe1.ezmember.co.kr/cache/recipe/2015/09/11/db71650edce6689bcff1ac127f083a951.jpg'}, {'step_number': 8, 'description': '접시에 담아 주시면 된답니다. 샐러드에 오렌지드레싱를 만들어 뿌려서 같이 드시면 더 맛있어요.', 'image_url': 'https://recipe1.ezmember.co.kr/cache/recipe/2015/09/11/1d33365e336379d1c9fc1e483d71a08f1.jpg'}]"
35297,메인반찬,손님접대,닭고기,굽기,#간장양념의 닭다리살구이만들기 #닭다리를 직접 발골해서 살만 양념해서 양파와 함께 먹는 간장닭다리살구이~~,닭다리살간장구이,https://recipe1.ezmember.co.kr/cache/recipe/2017/04/11/ce4f0dd39b90f0150452af16c0bb46081.jpg,"22,245",60분 이내,초급,2인분,"[('닭다리', '5개'), ('양파', '1개'), ('생강가루', '1작은술'), ('다진마늘', '1큰술'), ('청주', '2큰술'), ('다시마맛간장', '4큰술'), ('설탕', '1작은술'), ('후추', '조금'), ('훈제파프리카가루', '1작은술')]",닭다리살을 일본간장에 졸이듯이 구워낸 간장양념 닭다리살구이지요. 닭다리살만 마트에서 팔기도 하는데 의외로 가격이 그냥 닭다리만 파는 것보다는 비싸더라구요. 그래서 닭다리만 구입해서는 직접 발골해서 양념에 재워 놓은 다음에 굽고 양파도 함께 넣어서 양파의 달달한 맛과 간장의 짭쪼른한 맛이 어우러지는 닭다리살구이를 만들었어요.,"[{'step_number': 1, 'description': '닭다리살 5개를 준비했습니다. 깨끗이 한번 씻어 주시고요.', 'image_url': 'https://recipe1.ezmember.co.kr/cache/recipe/2017/04/11/29c19f2fe5cae99bb3fff4d185527e7d1.jpg'}, {'step_number': 2, 'description': '가위나 칼을 이용해서 다리 끝부분을 반으로 갈라서는 발골을 해 줍니다. 칼보다는 가위로 하시는 것이 훨씬더 편하고 안전할 것 같아요. 살만 고르게 잘 펴서는 접시에 올려 놓아 줍니다.', 'image_url': 'https://recipe1.ezmember.co.kr/cache/recipe/2017/04/11/0c73363518b0cf2fab916ea21dbcee861.jpg'}, {'step_number': 3, 'description': '요렇게 뼈만 남았어요.', 'image_url': 'https://recipe1.ezmember.co.kr/cache/recipe/2017/04/11/53a9d4e2504c469fb46e437dfd6074491.jpg'}, {'step_number': 4, 'description': '이제 밑간 및 양념을 해 줍니다. 잡내를 잡기 위해서 생강가루와 후추, 그리고 불맛이 나도록 훈제파프리카가루를 넣어 주시고요.', 'image_url': 'https://recipe1.ezmember.co.kr/cache/recipe/2017/04/11/93d0bd582d7c06f5698caa1b15265cac1.jpg'}, {'step_number': 5, 'description': '그리고 감칠맛과 잡내제거로 다진마늘과 청주, 다시마맛간장, 설탕을 넣어 줍니다. 청주가 없으시면 맛술로 대체하실 수 있고요. 다시마맛간장이 없으시면 데리야끼소스로 바꿔서 하셔도 또다른 매력의 닭다리살구이가 되지요.', 'image_url': 'https://recipe1.ezmember.co.kr/cache/recipe/2017/04/11/98dfa2d39530da8de8fc9dd8868114ad1.jpg'}, {'step_number': 6, 'description': '마지막으로 로즈마리를 넣어서는 잘 섞어 줍니다. 닭다리살이 양념에 잘 베이도록 조물조물 잘 입혀 주세요.', 'image_url': 'https://recipe1.ezmember.co.kr/cache/recipe/2017/04/11/4fd7e1acdb06312b8e71e94174607b571.jpg'}, {'step_number': 7, 'description': '냉장고에서 약 30분정도 숙성을 시켜 주세요. 숙성시키기 전에 월계수잎을 넣어서 완벽하게 잡내를 잡아 줍니다. 숙성되는 사이에 양파를 큼지막하게 채썰어서 준비를 해 놓습니다.', 'image_url': 'https://recipe1.ezmember.co.kr/cache/recipe/2017/04/11/ed5147155c48e7328121f99b716b9f551.jpg'}, {'step_number': 8, 'description': '확실히 처음보다 색이 달라졌네요. 숙성이 잘 되었습니다. 이제 구워주기만 하면 되지요. 체에 걸러서 구워주셔도 되고 그냥 고기만 건져서 구워주셔도 됩니다. 아니면 그냥 그대로 후라이팬에 부어서 졸이듯이 구워 주셔도 됩니다. 다시마맛간장은 그리 간이 쌔지 않기 때문에요.', 'image_url': 'https://recipe1.ezmember.co.kr/cache/recipe/2017/04/11/bfd8f498f61a1608dbe340822fa6da451.jpg'}, {'step_number': 9, 'description': '달궈진 팬에 기름 넉넉하게 두르시고요.', 'image_url': 'https://recipe1.ezmember.co.kr/cache/recipe/2017/04/11/2570f32fb9781e4f0069b09d56c55f6b1.jpg'}, {'step_number': 10, 'description': '닭다리살만 골라서는 구워 주기 시작합니다. 월계수잎은 빼지 않고 함께 구워 줍니다. 향이 남도록하기 위해서요.', 'image_url': 'https://recipe1.ezmember.co.kr/cache/recipe/2017/04/11/f4573ee39a37187d43aad26b18bedfb71.jpg'}, {'step_number': 11, 'description': '구워지면서 자연스럽게 물이 나오기 시작하죠. 이 물이 다 사라질때까지 구워 주시면 됩니다. 불은 중불에서 구워 주세요. 너무 쎈불에 구우면 겉면만 타고 속은 익지 않을 수 있기 때문에요. 양념이 되어진 닭다리살이라 쉽게 탈 수 있어요.', 'image_url': 'https://recipe1.ezmember.co.kr/cache/recipe/2017/04/11/4194298c873fbe6b7c10aebfec9888bb1.jpg'}, {'step_number': 12, 'description': '한쪽면이 노릇노릇하게 익어갈때쯤에 뒤집어서 구워 주시고 이때 큼지막하게 채썰어 놓았던 양파를 넣어 줍니다.', 'image_url': 'https://recipe1.ezmember.co.kr/cache/recipe/2017/04/11/f5b9e7a20cfdab8d94c6825b05d8efee1.jpg'}, {'step_number': 13, 'description': '닭다리가 완전하게 익어할때쯤에 양파도 투명해지면서 양념이 스며들고 익어가게 됩니다.', 'image_url': 'https://recipe1.ezmember.co.kr/cache/recipe/2017/04/11/2aa8f995198b482023f60c89c7ebac0a1.jpg'}, {'step_number': 14, 'description': '국물이 거의 사라졌지요. 닭도 완전하게 익었고 양파도 지나치게 많이 익지 않고 씹는 식감이 날 수 있도록 익었습니다. 이제 월계수잎은 빼주시고 마무리합니다.', 'image_url': 'https://recipe1.ezmember.co.kr/cache/recipe/2017/04/11/70d3f258c1953c718665c8c79296ccac1.jpg'}, {'step_number': 15, 'description': '간장양념이 잘 베어든 닭다리살구이를 완성접시에 올리고 함께 구운 양파도 듬뿍 가운데에 올려 줍니다. 그리고 푸른색이 없으시 약간의 쌉싸름한 맛을 주기 위해서 무순을 살짝 올려서 마무리합니다. 마치 닭다리살스테이크처럼 썰어서 드시면 짭쪼름하면서도 달달한 간장맛의 닭다리살구이를 드실 수 있지요~~', 'image_url': 'https://recipe1.ezmember.co.kr/cache/recipe/2017/04/11/46aac16aa838e1b22d814d53e31a3ca91.jpg'}]"
35298,메인반찬,손님접대,닭고기,굽기,● 주말요리- 바베큐양념구이 치킨 & 후라이팬에 구운 웨지감지,바베큐치킨,https://recipe1.ezmember.co.kr/cache/recipe/2015/06/09/096faee39f1d0e825d72edc76dac9c9b.jpg,"10,078",60분 이내,아무나,4인분,"[('중닭', '1마리'), ('우유', '300ml'), ('감자小', '4개'), ('베이컨', '5장'), ('쪽마늘', '7개'), ('바베큐소스', '5숟갈'), ('굴소스', '1숟갈'), ('칠리소스', '3숟갈'), ('다진마늘', '1숟갈'), ('생강가루', '1/3숟갈'), ('올리고당', '1숟갈'), ('후추', '약간'), ('파슬리', '1숟갈'), ('허브맛솔트', '약간'), ('올리브오일', '2숟갈')]",바베큐양념구이 치킨 ~ 전 갠적으로 닭요리 이요릴 가장 좋아해요~ 후라이드 치킨도 좋아하지만 후라이드는 기름에 한번 튀겨낸 요리인지라 먹어도 한두개 먹음 금방 질리고 또 양념치킨은 맛은 있는데 시판되는 양념치킨 소스가 너무 달아서 것도 한두개 먹음 쉽게 질리고요~ 그래서 집에서 제가 주말요리로 잘해주는 바베큐양념소스에 재워 구워낸 요 치킨 넘 좋아라 합니다. 만드는방법도 기름에 튀기고 튀김가루 안 뭍히고 하니 시간도 적게 들고 살도 덜찌고 담백하기도 하고요 만드는방법 소스만 잘 내면 되니~ 한번 만들어 보세요~,"[{'step_number': 1, 'description': '닭도리용 중닭한마리 팩에서 꺼내 우유300ml 정도 부어서 한 10여분 담가서비릿함을 없애주시고 흐르는물에 깨끗이 씻어 체에받쳐 물기를 쏙 빼주세요', 'image_url': 'https://recipe1.ezmember.co.kr/cache/recipe/2016/08/16/f04d1dc2ae6fd0858f41b67b96aba7d01.jpg'}, {'step_number': 2, 'description': '바베큐소스 5숟갈. 굴소스1숟갈. 칠리소스3숟갈1. 다진마늘1숟갈. 생강가루 0.3숟갈. 올리고당1숟갈. 후추약간 넣고 섞어주세요. 만들어둔 양념장에 씻어서 물기빼둔 닭을 넣고 주물럭주물럭 양념해 통에 담아 냉장고에 넣고 3시간이상 숙성시켜 주세요 ~전 토욜자정쯤에 넣어두고 그 담날 꺼내 조리해 먹었어요', 'image_url': None}, {'step_number': 3, 'description': '재워뒀던 닭 꺼내 오븐팬에 올리고 200도 예열된 오븐에서 20~25분간 돌려주심 됩니다.오븐은 출력사양에 따라 조절해서 구워주세요. 다 굽고 나서 접시에 담아 견과류등을 뿌려주심 끝~!오븐', 'image_url': None}, {'step_number': 4, 'description': '간도 딱베고 ~ 닭살도 기름에 튀긴거 보다 더 쫄깃하니 맛있어요~ 닭볶음탕 해먹으려고 사다뒀는데 콩나물국을 많이 끓여둔지라 ㅋㅋ 이리 만들었네요 샐러드나 무등 없음 깍두기라도 곁들여 드셔보세요 담백하니 양념도 하루 재워뒀던거라 안까지 쏙쏙 잘 베서~ 몇개 먹은거 같지도 않은데 다 먹었네 하실꺼에요~', 'image_url': None}, {'step_number': 5, 'description': '치킨하고 같이 먹으려고 후다닥 만들어본~ 트리플 웨지감자에요 ㅋㅋ 이요린 이웃블로거 빵꽃님 레시피를 참조했네요~ 오븐에 구우려고 했는데~ 닭구워질 동안 후라이팬에 후다닥 ~ 구워 만들어 봤네요 정말 빵꽃님 말처럼~ 이건 암나 다 하는 요리랍니다. 조리법도 간단하고 또 오븐에 구우나 팬에 구우나 맛은 똑같고요 오븐에 굽는거 보다 시간도 적게 걸리고요', 'image_url': 'https://recipe1.ezmember.co.kr/cache/recipe/2016/08/16/77702f545030f4b81dd8e7c4969d60341.jpg'}, {'step_number': 6, 'description': '감자3개 겉표면에 흙 떨어내고 흐르는물에 깨끗이 여러번 씻어 준비해 개당 6~8개 나오게 잘라서 준비해 주세요. 끓는물에 소금반티스푼 넣고 ~ 3분여 삶아서 건져주세요~ 이리 한번 삶아줘야 감자껍질에 혹시라도 뭍은 이물질도 없애주고 또 이리 살짝 삶아줘야~ 팬이나 오븐에 구우실때 안까지 쏙쏙 익혀주고 조리시간도 짧아집니다.', 'image_url': 'https://recipe1.ezmember.co.kr/cache/recipe/2016/08/16/ea8b4ec2b2d1eaf302ee7c37b46291e71.jpg'}, {'step_number': 7, 'description': '같이 구워줄 쪽마늘 7개 반으로 잘라 준비. 베이컨도 3등분으로 잘라서 준비. 파슬리도 잘게 다져 준비해 주세요. 삶아건진 감자에 마늘.파슬리 넣고 올리브오일2숟갈. 허브맛솔트 약간넣고 고루 버무려 주세요', 'image_url': None}, {'step_number': 8, 'description': '팬에 4의 재료넣고~ 베이컨도 넣고 노릿하게 구워주시면 됩니다. 구워서 취향껏~ 케찹이나 머스터드 소스 준비하셔서 찍어드셔도 되고 그냥 드셔도 간은 맞긴한데~ 걍 취향껏! 알아서!~', 'image_url': None}]"
35299,메인반찬,손님접대,닭고기,굽기,◈ 간장양념 닭다리구이,None,https://recipe1.ezmember.co.kr/cache/recipe/2015/06/09/b599882dee9c0b4ea598f8a4b8d5ac2e.jpg,"12,889",60분 이내,초급,2인분,[],오늘은 간장양념 닭다리 구이를 만들어봤답니다. 집안 행사나 연말에 홈파티 하게 되면 맛있게 먹을수 있는 메뉴일꺼같네요.,[]
35300,메인반찬,손님접대,닭고기,굽기,닭가슴살요리 포모도로 소스로 맛을 낸 치킨브레스트,치킨브레스트,https://recipe1.ezmember.co.kr/cache/recipe/2016/11/29/44c8728713b9399bf569559c61d7a2801.jpg,"2,261",30분 이내,아무나,2인분,"[('닭가슴살', '2개'), ('미니양배추', '4개'), ('아스파라거스', '2개'), ('방울토마토', '4개'), ('적양파', '1/2개'), ('올리브유', '2큰술'), ('천일염', '약간'), ('후추', '약간'), ('미작', '1큰술'), ('파스타소스', '1컵')]","닭가슴살을 맛있게 먹는 방법 하나쯤은 다들 알고 계시죠? 어떤분들은 부드럽게 삶아 샐러드로 먹는다 던지, 혹은 스테이크처럼 구워먹는다 던지요! ^^ 닭가슴살요리는 잘못하게 되면 퍽퍽해지기 때문에 부드럽게 요리하는 것이 아주 중요한데요. 오늘 정원이가 맛있고 부드러운 닭가슴살요리를 선보일 예정입니다. 요리의 이름은 포모도로 소스로 맛을 낸 치킨브레스트에요! *_* 맛있는 닭가슴살요리! 치킨브레스트 레시피가 궁금하시다면 어서 스크롤을 내려보세요~","[{'step_number': 1, 'description': '미작, 천일염, 올리브유, 후추를 닭가슴살에 발라 잠시 재워둔다.', 'image_url': 'https://recipe1.ezmember.co.kr/cache/recipe/2016/11/29/51b0b5fdc8882c1c5a299317905fc3fb1.jpg'}, {'step_number': 2, 'description': '적양파, 아스파라거스, 방울토마토, 미니양배추를 한입크기로 자른다.', 'image_url': 'https://recipe1.ezmember.co.kr/cache/recipe/2016/11/29/bea40ecf4525f2b1677ea8347e541a341.jpg'}, {'step_number': 3, 'description': '끓는 물에 천일염을 넣고 아스파라거스, 미니양배추를 살짝 데친 후 얼음물에 식힌다.', 'image_url': 'https://recipe1.ezmember.co.kr/cache/recipe/2016/11/29/6631596884d677f7e0e7a51ab14473291.jpg'}, {'step_number': 4, 'description': '그릴팬에 닭가슴살을 사선으로 구워 색을 낸 후 180℃ 예열된 오븐에 약 8분간 굽는다.오븐', 'image_url': 'https://recipe1.ezmember.co.kr/cache/recipe/2016/11/29/48777978ecee09c1a44e6f1ed91b39df1.jpg'}, {'step_number': 5, 'description': '그릴 팬에 적양파, 미니양배추, 방울토마토, 아스파라거스를 노릇하게 굽고 소금, 후추 밑간을 한다.', 'image_url': 'https://recipe1.ezmember.co.kr/cache/recipe/2016/11/29/95886dbdf0da60e37f7c7b65b2533e6a1.jpg'}, {'step_number': 6, 'description': '접시에 포모도로 소스를 뿌리고 닭가슴살, 그릴야채를 담아 완성한다.', 'image_url': 'https://recipe1.ezmember.co.kr/cache/recipe/2016/11/29/81dd66d869472d3b073d8b1f7cd6c1c61.jpg'}]"
35301,메인반찬,손님접대,닭고기,굽기,-,None,https://recipe1.ezmember.co.kr/cache/recipe/2018/03/13/7d741d5e276988d623122a079713f1101.jpg,"24,180",None,None,None,[],,[]
35302,메인반찬,손님접대,닭고기,굽기,닭봉구이 만들기,닭봉구이,https://recipe1.ezmember.co.kr/cache/recipe/2015/06/08/511ba4b18934dcc45447b0ed0650082c.jpg,"78,919",60분 이내,중급,2인분,"[('닭봉', '500g'), ('양송이버섯', '3개'), ('통마늘', '10알'), ('애호박', '30g'), ('우유', '200ml'), ('간장', '2TS'), ('설탕', '2TS'), ('핫소스', '1TS'), ('청주', '1TS'), ('맛술', '1TS'), ('레몬즙', '1TS'), ('다진마늘', '1/2TS'), ('참기름', '1/2TS')]",간장소스로 조린 맛있는 닭봉구이입니다.,"[{'step_number': 1, 'description': '분량의 재료 간장 2TS, 설탕 2TS, 핫소스 1TS, 청주 1TS, 맛술 1TS, 레몬즙 1TS 다진마늘 1/2TS, 참기름 1/2TS \ufeff를 넣어 섞어 주세요.', 'image_url': 'https://recipe1.ezmember.co.kr/cache/recipe/2015/06/18/71b793652637ad00b242e51c2b4d94991.jpg'}, {'step_number': 2, 'description': '깨끗하게 씻은 닭봉에 우유200ml를 넣어 30분간 재워주세요.', 'image_url': 'https://recipe1.ezmember.co.kr/cache/recipe/2015/06/18/235a44d029f5069f565b359f1b589e4b1.jpg'}, {'step_number': 3, 'description': '우유를 씻어낸 닭봉에 소금, 후추를 뿌려 30분간 2차 밑간을 해주세요 .', 'image_url': 'https://recipe1.ezmember.co.kr/cache/recipe/2015/06/18/d1aea33e26d7efcdbca61916483385271.jpg'}, {'step_number': 4, 'description': '달군 후라이팬에 식용유를 넉넉히 넣고 페페로치니를 넣어주세요.', 'image_url': 'https://recipe1.ezmember.co.kr/cache/recipe/2015/06/18/d0f4369f10af24847b6a1c909d6174d41.jpg'}, {'step_number': 5, 'description': '페페로치니향이 올라오면 통마늘을 넣어주세요.', 'image_url': 'https://recipe1.ezmember.co.kr/cache/recipe/2015/06/18/e7524cd629c766e6f9e7f3bc3a3ffb171.jpg'}, {'step_number': 6, 'description': '밑간 해 놓은 닭봉을 후라이팬에 올려 센불에서 겉면을 익힌 후 뚜껑을 덮어 약불에서 속까지 골고루 익혀주세요.', 'image_url': 'https://recipe1.ezmember.co.kr/cache/recipe/2015/06/18/e230c60da1d2c97ad568ce2e326635e01.jpg'}, {'step_number': 7, 'description': '닭봉의 속까지 익으면 닭봉에서 나온 기름과 물을 제거하시고 올리브유를 살짝 둘러 겉면을 한번더 살짝 익혀주세요.', 'image_url': 'https://recipe1.ezmember.co.kr/cache/recipe/2015/06/18/9d8b6e38527e17389ae01c6f97821cd71.jpg'}, {'step_number': 8, 'description': '준비 해 놓은 간장소스를 넣어 주세요.', 'image_url': 'https://recipe1.ezmember.co.kr/cache/recipe/2015/06/18/38625a840feca6bd1a366f934f27b6171.jpg'}, {'step_number': 9, 'description': '간장소스가 닭봉에 살짝 베어들면 애호박을 넣어주세요.', 'image_url': 'https://recipe1.ezmember.co.kr/cache/recipe/2015/06/18/21177de82f103c89da83dbf17d5d50de1.jpg'}, {'step_number': 10, 'description': '양송이버섯과 빼두었던 통마늘을 넣고 간장소스가 재료에 모두 스며들도록 조려주세요.', 'image_url': 'https://recipe1.ezmember.co.kr/cache/recipe/2015/06/18/687c6621a99617433f592e7713f4f12b1.jpg'}]"
35303,메인반찬,손님접대,닭고기,굽기,인도커리 탄두리 치킨 만들기,탄두리치킨,https://recipe1.ezmember.co.kr/cache/recipe/2015/07/27/d9c23a48100533863e9f2ec1b5c7fdd7.jpg,"14,112",60분 이내,초급,4인분,"[('닭', '900~950g'), ('탄두리치킨 소스', '50g'), ('플레인 요거트', '110ml')]",집에서 즐기는 간단한 탄두리 치킨입니다.,"[{'step_number': 1, 'description': '원래 탄두리는 숯불에 양념을 여러번 덧발라 가며 구워 먹어야 제맛이긴 하지만, 가정에서는 숯불에 굽는게 쉽지 않은 일이니, 그냥 오븐을 이용하기로 했답니다. 저는 닭볶음용 닭을 구입해서 먼저 오븐에 넣고 초벌 구이를 해주었어요. (온도 250도, 20~30분가량, 컨벡션기능)오븐', 'image_url': 'https://recipe1.ezmember.co.kr/cache/recipe/2015/07/29/3904e53c27835fdc0abc6170004ae3281.jpg'}, {'step_number': 2, 'description': '플레인 요거트 110ml와 탄두리소스를 함께 섞어 주세요. 초벌구이한 닭을 소스에 버무려서 1시간 가량 둡니다..', 'image_url': 'https://recipe1.ezmember.co.kr/cache/recipe/2015/07/29/22cc090746321f55c0e55d9818809f6b1.jpg'}, {'step_number': 3, 'description': '한시간 가량 소스에 재워둔 닭고기는 또 다시 오븐에 넣고 위의 온도와 동일하게 해서 구워주세요. 중간 중간 고기와 양념이 구워지는 정도를 보시면서 시간 조절 해주시고 또 중간중간에 남은 소스를 고기에 덧발라 주시면서 구워주세요.', 'image_url': 'https://recipe1.ezmember.co.kr/cache/recipe/2015/07/29/2e5f7618dfd0ac854bac6d43cb70f6961.jpg'}]"
