index,종류별,상황별,재료별,방법별,글 제목,레시피이름,레시피이미지,조회수,조리시간,난이도,인분,재료,소개글,조리순서
7420,밑반찬,일상,달걀/유제품,부침,머랭 계란말이,머랭계란말이,https://recipe1.ezmember.co.kr/cache/recipe/2015/05/11/5196532bcaa285b0e5d35350405b99c51.jpg,"7,764",30분 이내,초급,3인분,"[('계란', '3개'), ('소금', '3꼬집'), ('포도씨유', '1큰술')]",약간 빵을 먹는 듯한 느낌에 일반 계란말이하고 맛이 많이다른 머랭 계란말이입니다.,"[{'step_number': 1, 'description': '계란 3개를 준비하시고요. 계란은 먼저 흰자와 노른자를 분리합니다. \n노른자에 소금 3꼬집을 넣어줍니다. 젓가락으로 한번씩만 소금을 집으면 계란 1개에 대한 소금 양입니다. \n잘 섞은 후에 체에 걸러줍니다.', 'image_url': 'https://recipe1.ezmember.co.kr/cache/recipe/2015/05/11/7f3fd62b5041154ffc3d184cbb0bde9b1.jpg'}, {'step_number': 2, 'description': '머랭을 만들기 위해 거품기가 필요합니다. 흰자만 걸러서 거품기를 저어줍니다.', 'image_url': 'https://recipe1.ezmember.co.kr/cache/recipe/2015/05/11/88865ee8ed3dbb8e3f1744bd7b45cbbf1.jpg'}, {'step_number': 3, 'description': '뿔이 생길 정도로 단단한 머랭을 만들어 줍니다. 머랭을 살짝 들어 올리면 뿔처럼 모양이 생기는 것이고요.', 'image_url': 'https://recipe1.ezmember.co.kr/cache/recipe/2015/05/11/cee427680933d0615ce0c16b2d60d9e01.jpg'}, {'step_number': 4, 'description': '머랭에 계란 노른자를 3-4 회에 나눠서 섞어줍니다.', 'image_url': 'https://recipe1.ezmember.co.kr/cache/recipe/2015/05/11/4f9137dc9e386ce0881f4e95678828261.jpg'}, {'step_number': 5, 'description': '팬을 달군 후에 키친타올에 포도씨유를 묻혀서 (이 때 기름을 가능한 적게 넣어줍니다. 옆면에도 기름을 발라주는 것이 좋아요 ) 고루 발라줍니다. \n계란물을 넓게 펴준 다음 돌돌 말아줍니다. 다시 계란물을 넣어서 이어 붙여줍니다. 거품을 올린 것이기에 펴는 작업이 약간 어려워요. 스푼 바닥으로 넓게넓게 펴 줍니다.\n불을 약하게 하고, 계속 기름을 발라가며 계란물을 이어 붙어 줍니다.', 'image_url': 'https://recipe1.ezmember.co.kr/cache/recipe/2015/05/11/89c3c56765a23cb8194b691f4f6c5db51.jpg'}, {'step_number': 6, 'description': '김발에서 모양을 잡아줍니다.', 'image_url': 'https://recipe1.ezmember.co.kr/cache/recipe/2015/05/11/3b38b1e492dc79522c08cbd3859a91fe1.jpg'}, {'step_number': 7, 'description': '먼저 가운데로 2등분한 후에 다시 3등분하면 모양이 일정하게 나옵니다.', 'image_url': 'https://recipe1.ezmember.co.kr/cache/recipe/2015/05/11/1981d4ea721cf6dfe0a4fbb84674bfd91.jpg'}]"
7421,밑반찬,일상,달걀/유제품,부침,일본식 계란말이 (타마고마끼) & 일본식 계란찜 (차왕무시),일본식계란말이,https://recipe1.ezmember.co.kr/cache/recipe/2015/04/23/973a73c9dfcfab39c14302c471be1ac11.jpg,"85,683",None,None,None,"[('계란', '4알'), ('다시마 국물', '1/3Cup'), ('맛술', '1T'), ('소금', '1t'), ('', ''), ('청주', '1t'), ('맛술', '1t'), ('소금', '1t')]",폭신 폭신 부드럽고 달달해서 입에서 살살 녹는 일본식 계란말이 정말 너무 맛있죠~ 집에서 만든 차왕무시입니다.,"[{'step_number': 1, 'description': '계란 4알에 다시마 국물 1/3Cup이 필요해요. 다시마를 찬물에 넣고 끓기 시작하면 바로 불을 끄고 식혀 주세요.', 'image_url': 'https://recipe1.ezmember.co.kr/cache/recipe/2015/04/23/2ff2890a782cb53b9e94a7656acb65be1.jpg'}, {'step_number': 2, 'description': '계란 4알을 체에 걸러 줍니다.', 'image_url': 'https://recipe1.ezmember.co.kr/cache/recipe/2015/04/23/6bd61076c864344e7e264eaa67e7b9fb1.jpg'}, {'step_number': 3, 'description': '식힌 다시마 국물 1/3Cup + 맛술 1T + 소금 1t 넣어 주세요. 단 맛 좋아하시면 설탕 조금 넣으셔도 되는데 저는 생략했어요.', 'image_url': 'https://recipe1.ezmember.co.kr/cache/recipe/2015/04/23/fdf4413335d870edbb4f57372b3b34a91.jpg'}, {'step_number': 4, 'description': '사각팬이 있으면 확실히 모양 잡기가 좋기는 하지만 필수품은 아니에요. 팬을 충분히 달군 후 기름을 골고루 둘러 주세요.', 'image_url': 'https://recipe1.ezmember.co.kr/cache/recipe/2015/04/23/9c78b0f0642f7229cf174c3c367a3dbe1.jpg'}, {'step_number': 5, 'description': '계란물을 1/5 정도만 부은 후 팬에 고르게 펴 줍니다.', 'image_url': 'https://recipe1.ezmember.co.kr/cache/recipe/2015/04/23/38ff292c4888d6f763a546fcff1cb7251.jpg'}, {'step_number': 6, 'description': '돌돌 말기 시작~', 'image_url': 'https://recipe1.ezmember.co.kr/cache/recipe/2015/04/23/51c5d8ea22104ad0d09cb3076f4059e71.jpg'}, {'step_number': 7, 'description': '어느 정도 계란이 말아지면 앞으로 당겨 두고 남은 계란물을 조금씩 더 부어 주세요. 계란물을 전부 사용할 때까지 이 과정을 계속 반복해 줍니다.', 'image_url': 'https://recipe1.ezmember.co.kr/cache/recipe/2015/04/23/a7eb781fc04ceb43bad92dc423d289341.jpg'}, {'step_number': 8, 'description': '몽글 몽글 부드러우니까 살살 돌려서 모양을 잡아 주세요.', 'image_url': 'https://recipe1.ezmember.co.kr/cache/recipe/2015/04/23/eb08851de3b2e91356f0bd1853033fc91.jpg'}, {'step_number': 9, 'description': '한김 식힌 후', 'image_url': 'https://recipe1.ezmember.co.kr/cache/recipe/2015/04/23/494bb2f8210b5ff31094819911e7a4371.jpg'}, {'step_number': 10, 'description': '썰어 주면 완성~', 'image_url': 'https://recipe1.ezmember.co.kr/cache/recipe/2015/04/23/7c6ec010be94af61ccaaa91f96c264401.jpg'}, {'step_number': 11, 'description': '자~~ 이제는 푸딩처럼 부드러운 일본식 계란찜을 만들어 볼까요? \n계란과 다시물의 비율만 생각해 두시면 되는데요. 그냥 일반적으로 부드러운 계란찜을 좋아하시면 계란 : 다시물 = 1 : 2 마치 푸딩처럼 하늘 하늘 찰랑거리는 계란찜을 원하시면 계란 : 다시물 = 1 : 2.5 저는 완전 하늘거리는 푸딩 같은 계란찜을 만들어 보려구요~ 계란 2알 (2인분)을 대체로 80미리 정도의 양으로 잡으시면 되구요. 2.5 배의 다시물이 필요하니까 대략 1Cup (200미리) 가 되겠죠. 끓는거 생각해서 대략 210미리 정도 물을 냄비에 넣고 다시마 10 * 20 정도 넣고 끓여 주세요.', 'image_url': 'https://recipe1.ezmember.co.kr/cache/recipe/2015/04/23/1f66c9b35331880a7cdbf249fa6597e61.jpg'}, {'step_number': 12, 'description': '7~8분 후 다시마는 건져 내시고 가다랑어포 반줌을 넣고 불을 끄세요. 8분 정도 후에 거르시면 다시물 완성~ 여기에 청주 1t + 맛술 1t + 소금 1t 넣어 주시고요.', 'image_url': 'https://recipe1.ezmember.co.kr/cache/recipe/2015/04/23/76f6c18c1a905383e9f313229a9649da1.jpg'}, {'step_number': 13, 'description': '계란 두알을 잘 풀은 후 준비한 다시물 1Cup (200미리) 넣어 줍니다. 표고 버섯이나 새우 등 다른 부재료를 첨가하셔도 좋죠~ 그런데 저는 그냥 후루룩~~~~ 넘어가는 계란찜이 땡겨서 다른 부재료 생략 했어요. ^^', 'image_url': 'https://recipe1.ezmember.co.kr/cache/recipe/2015/04/23/a8c2717537879d112a04c9f5047d20011.jpg'}, {'step_number': 14, 'description': '고운 체에 한번 걸러 주세요. 가장자리로 올라온 기포는 수저로 떠서 제거해 주셔야 매끄러운 계란찜이 나온답니다.', 'image_url': 'https://recipe1.ezmember.co.kr/cache/recipe/2015/04/23/80e509eaac6d4f5b971642039b99e2701.jpg'}, {'step_number': 15, 'description': '김이 오르는 찜기에 올려 주세요.', 'image_url': 'https://recipe1.ezmember.co.kr/cache/recipe/2015/04/23/7de7a504f84236533787e1f1d5365e0f1.jpg'}, {'step_number': 16, 'description': '중불 이하로 대략 12분 정도 쪄주시면 됩니다.', 'image_url': 'https://recipe1.ezmember.co.kr/cache/recipe/2015/04/23/95bab70ed0347183f1ffd31aa98eb6091.jpg'}, {'step_number': 17, 'description': '흔들어 보았을 때 찰랑 찰랑 탄력있게 움직이면', 'image_url': 'https://recipe1.ezmember.co.kr/cache/recipe/2015/04/23/a9ded2475292886469d1242ac9c8da181.jpg'}, {'step_number': 18, 'description': '술술 넘어가는 부드러운 일본식 계란찜 (차왕무시) 완성입니다~ ^^', 'image_url': 'https://recipe1.ezmember.co.kr/cache/recipe/2015/04/23/58891ac0605794ba34ac087d2e045a001.jpg'}]"
7422,밑반찬,일상,달걀/유제품,부침,"동료와 함께 먹은 도시락. 도시락 반찬, 김 계란말이",김계란말이,https://recipe1.ezmember.co.kr/cache/recipe/2021/02/26/13fcba63a173c3fbc31ff1e7e921b29a1.jpg,"1,973",30분 이내,아무나,2인분,"[('계란', '4개'), ('소금', ''), ('식용유', '약간')]",신학기 준비로 바쁜 요즘 코로나 때문에 밖에서 외식을 못해 도시락을 싸가지고 갔습니다.,"[{'step_number': 1, 'description': '계란 4개, 소금을 넣고 풀어둔다.', 'image_url': 'https://recipe1.ezmember.co.kr/cache/recipe/2021/02/27/247a129a9f86d8778d2f0078eef7f16d1.jpg'}, {'step_number': 2, 'description': '계란 물 1/3을 뭇고 프라이팬에 펴준 후 김을 올려 돌돌 말아준다.', 'image_url': 'https://recipe1.ezmember.co.kr/cache/recipe/2021/02/27/e56f0407206b5564abf5b89bf868d0351.jpg'}, {'step_number': 3, 'description': '계란 물을 3차례 나눠 김과 함께 부쳐낸다.', 'image_url': 'https://recipe1.ezmember.co.kr/cache/recipe/2021/02/27/27b3efc98baab53db78a688b707e7a121.jpg'}, {'step_number': 4, 'description': '익으면 도마에 올려 식힌 후 먹기 좋은 크기로 잘라준다.', 'image_url': 'https://recipe1.ezmember.co.kr/cache/recipe/2021/02/27/2025b582a7d10f9ace7b1048b896f5fb1.jpg'}]"
7423,밑반찬,일상,달걀/유제품,부침,계란말이,계란말이,https://recipe1.ezmember.co.kr/cache/recipe/2015/05/13/38da0882ae8123c7bbb2ef94964661311.jpg,"5,597",30분 이내,초급,2인분,"[('계란', '5개'), ('대파', ''), ('통깨', ''), ('소금', ''), ('김', '1장')]",계란말이 만들기가 좀 어렵지만 몇 번 하다 보면 감이 온답니다. 요리도 연습이 나름 필요하지요~ 함께 맛있는 계란말이를 만들어 보아요~,"[{'step_number': 1, 'description': '계란을 우선은 잘 풀어주세요. 양이 넉넉하게 5개 넣고 풀었네요. 그리고 맛있으라고 파랑 통깨 넣고 했어요.', 'image_url': 'https://recipe1.ezmember.co.kr/cache/recipe/2015/05/14/247e33d3feea3f67ba0f3d253c5137d51.jpg'}, {'step_number': 2, 'description': '적당히 기름을 두른 다음에 뜨겁게 달궈주세요 안 그럼 눌어붙는답니다. 그러니 따끈따끈하게 달궈주세요. \n이제 부어 주세요.', 'image_url': 'https://recipe1.ezmember.co.kr/cache/recipe/2015/05/14/6f30f8a7e37140f92255a6e152c6f4fd1.jpg'}, {'step_number': 3, 'description': '김 한 장을 다 익기 전에 살포시 얹었어요. \n여기서 불 조절은 약한 불입니다. 강하게 하면 테두리가 너무 타서 굳기 때문에 접을 때 찢어진답니다.', 'image_url': 'https://recipe1.ezmember.co.kr/cache/recipe/2015/05/14/7b39531e950f25f5ab6e48d3a0f35dde1.jpg'}, {'step_number': 4, 'description': '테두리 부분이 이제 살포시 익은 느낌이 나면 한번 살포시 접었습니다. 그리고 한번 더 살짝 접어주세요.', 'image_url': 'https://recipe1.ezmember.co.kr/cache/recipe/2015/05/14/b724b2998ea87fea241a5b9d74071e4a1.jpg'}, {'step_number': 5, 'description': '접어진 부분은 프라이팬을 흔들어서 빈 공간으로 당겨주세요 어느 정도 익었다는 느낌이 들면 얼른얼른 접어야 해요. \n너무 노랗게 익어버리면 찢어진답니다. 이때도 불은 계속 약한 불 유지해주세요.', 'image_url': 'https://recipe1.ezmember.co.kr/cache/recipe/2015/05/14/567719f3d08d8f6d6382ad62c30c0de31.jpg'}, {'step_number': 6, 'description': '이제 마지막까지 다 빙글빙글 돌려주세요.', 'image_url': 'https://recipe1.ezmember.co.kr/cache/recipe/2015/05/14/3545f2bf50da0071336fb9f7806ef2061.jpg'}]"
7424,밑반찬,일상,달걀/유제품,부침,"[명란계란말이, 집밥백선생 레시피] 계란말이만 해도 맛있는데 명란까지 넣어 더 맛있는 백종원명란달걀말이.",명란달걀말이,https://recipe1.ezmember.co.kr/cache/recipe/2018/07/10/caab82042cfca0dfc90e4d6feb0dba9b1.jpg,"14,517",15분 이내,초급,2인분,"[('계란', '5개'), ('명란젓', '1개'), ('설탕', '1티스푼'), ('대파(쪽파)', '약간')]",약 한 달 전쯤 중부시장에서 명란젓과 조개젓을 구매해 왔지요. 1만 원어치 명란젓이 꽤 많아 아직도 먹고 있었는데 얼마 남지 않은 것을 보고 서둘러 명란계란말이 만들어 봤어요. 언제 먹어도 고소한 계란말이. 여기에 명란을 넣어 만드니 그 맛이 몇 배나 튑니다. 명란은 다양한 요리에서 맛을 업그레이드해주는 키포인트인 듯합니다.,"[{'step_number': 1, 'description': '계란 5개를 그릇에 담아 주세요.', 'image_url': 'https://recipe1.ezmember.co.kr/cache/recipe/2018/07/10/cbdfb88914d740d770dd86ed60ff107d1.jpg'}, {'step_number': 2, 'description': '덩어리 없게 잘 풀어 주세요.', 'image_url': 'https://recipe1.ezmember.co.kr/cache/recipe/2018/07/10/a12577fc8632f733ab0843503264df231.jpg'}, {'step_number': 3, 'description': '설탕 1티스푼 넣고 잘 풀어 주세요. 단맛 좋아하는 분들은 조금 더 넣으셔도 됩니다.', 'image_url': 'https://recipe1.ezmember.co.kr/cache/recipe/2018/07/10/87fb8ef55d286e86a36d5b22ab078fa51.jpg'}, {'step_number': 4, 'description': '대파도 조금 썰어 주세요. 원래 쪽파가 적당한데 대파만 있어 사용했어요.', 'image_url': 'https://recipe1.ezmember.co.kr/cache/recipe/2018/07/10/f49fdd417e543bb6dc0e64e08774bd721.jpg'}, {'step_number': 5, 'description': '명란젓입니다. 이런 빨갛게 매콤한 젓갈로 해도 되고 염장 안된 것으로 사용해도 좋습니다. 지난번 구매한 명란젓이 남아 있어 이것으로 사용합니다. 많이 넣으면 짤 것 같아 조금만 넣어 주었어요.', 'image_url': 'https://recipe1.ezmember.co.kr/cache/recipe/2018/07/10/b8d4ae7ea84a74ebed7e8e13e09e16631.jpg'}, {'step_number': 6, 'description': '계란말이를 길게 만드니 명란도 길게 잘라 주었어요. 2개로 작게 자르니 계란 팬에 들어갈 듯합니다.', 'image_url': 'https://recipe1.ezmember.co.kr/cache/recipe/2018/07/10/2d4f79fe046e395ff19b54d3aab90c8f1.jpg'}, {'step_number': 7, 'description': '계란말이 전용(?) 팬을 뜨겁게 달구어 주세요. 식용유 조금 둘러 주세요. 4각팬이 모양도 잘 잡히고 계란말이 만드는데 좋더군요.', 'image_url': 'https://recipe1.ezmember.co.kr/cache/recipe/2018/07/10/874a502673a12a37418807b625e75b7b1.jpg'}, {'step_number': 8, 'description': '키친타월로 식용유를 닦아줍니다. 팬에 얇게 기름막이 형성될 정도로만 해주어야 합니다.', 'image_url': 'https://recipe1.ezmember.co.kr/cache/recipe/2018/07/10/d2901f522af871abd72f3218659b8f1b1.jpg'}, {'step_number': 9, 'description': '약불로 한 후 계란물 1국자 팬에 넣어 주세요.', 'image_url': 'https://recipe1.ezmember.co.kr/cache/recipe/2018/07/10/dc6515838f3ac18868a5f9ac813076b41.jpg'}, {'step_number': 10, 'description': '계란이 빨리 익으니 조금 익은 듯하면 재료를 넣어줘야 합니다.', 'image_url': 'https://recipe1.ezmember.co.kr/cache/recipe/2018/07/10/21b6a3f075919ea3812499a888314e661.jpg'}, {'step_number': 11, 'description': '명란을 길게 놓아 주세요.', 'image_url': 'https://recipe1.ezmember.co.kr/cache/recipe/2018/07/10/ad7bf7d445957a167e51955ae0365b471.jpg'}, {'step_number': 12, 'description': '그 옆에 대파도 넣어 주세요.', 'image_url': 'https://recipe1.ezmember.co.kr/cache/recipe/2018/07/10/35c832b3bebfc43d4f175fbed3b13cc51.jpg'}, {'step_number': 13, 'description': '살살 말아 주세요. 중간중간 사진을 찍다 보니 계란이 조금 많이 익었네요 ㅠㅠ 계란이 덜 익은 상태로 말아 줘야 모양이 잘 나오고 공간도 적어져요.', 'image_url': 'https://recipe1.ezmember.co.kr/cache/recipe/2018/07/10/6731e31ec9ad4353c9e050fd7dc42b401.jpg'}, {'step_number': 14, 'description': '끝까지 말아 주세요.', 'image_url': 'https://recipe1.ezmember.co.kr/cache/recipe/2018/07/10/60b14a79505b43f136e66ac2b34d8ef01.jpg'}, {'step_number': 15, 'description': '다시 계란물 1국자 떠서 처음에 만든 것이랑 붙을 수 있게 넣어 주세요.', 'image_url': 'https://recipe1.ezmember.co.kr/cache/recipe/2018/07/10/bf46006deccbe1b00682cd3477f234f71.jpg'}, {'step_number': 16, 'description': '살살 말아 주세요. 이번에는 덜 익었을 때 말아주었기 때문에 모양이 잘 잡혔어요. 주걱으로 잘 안되면 계란을 손으로 잡고 하시면 잘 되실 거예요.', 'image_url': 'https://recipe1.ezmember.co.kr/cache/recipe/2018/07/10/dfac543a7293f445764ddcc70a0b22d21.jpg'}, {'step_number': 17, 'description': '다시 한번 반복해 줍니다. 계란 개수에 따라 몇 번 해야 하는지 달라질 겁니다. 보통 4-5회 정도 부어주면 될 거예요.', 'image_url': 'https://recipe1.ezmember.co.kr/cache/recipe/2018/07/10/7ea437d09fa1d44721d18cd5297be4261.jpg'}, {'step_number': 18, 'description': '마지막 계란 물까지 잘 익혀 말아졌어요.', 'image_url': 'https://recipe1.ezmember.co.kr/cache/recipe/2018/07/10/2f656ed0b3ac774c16efe509ab86eb101.jpg'}, {'step_number': 19, 'description': '팬의 한쪽 벽으로 뉘어 옆면도 익혀 줍니다.', 'image_url': 'https://recipe1.ezmember.co.kr/cache/recipe/2018/07/10/d73c7364402e132054bf90e24c2058fe1.jpg'}, {'step_number': 20, 'description': '계란말이가 적당한 크기로 노릇노릇하게 잘 되었습니다. 완성된 계란말이 덩어리예요. 조금 식혔다 잘라줍니다.', 'image_url': 'https://recipe1.ezmember.co.kr/cache/recipe/2018/07/10/1ae66eebfa4bd2b3c5b8d9cd962e12741.jpg'}, {'step_number': 21, 'description': '달걀말이 단면입니다. 안에 명란젓과 파가 잘 들어가 있어요.', 'image_url': 'https://recipe1.ezmember.co.kr/cache/recipe/2018/07/10/d3676e80376937f35127cf7017f538961.jpg'}, {'step_number': 22, 'description': '조금 더 확대해 보았어요. 더 먹음직스럽게 보입니다. 군침이 돌아요. 그냥 한 개 집어먹고 싶지만 밥반찬으로 나눠 먹어야 하는 관계로 참아 줍니다.', 'image_url': 'https://recipe1.ezmember.co.kr/cache/recipe/2018/07/10/8be30c9de69be22b647285994b2fa4861.jpg'}, {'step_number': 23, 'description': '예쁜 접시에 담아 반찬으로 상에 올려 줍니다. 명란젓으로 해서 간을 하나도 하지 않았어도 짭조름하니 맛이 좋아요. 폭신하고 약간 단맛이 돌고, 간혹 파향도 나서 꽤 맛있는 밥반찬이 되었어요. 토마토케첩하고 먹으면 궁합이 아주 좋습니다.', 'image_url': 'https://recipe1.ezmember.co.kr/cache/recipe/2018/07/10/559bd59bbdbd1d86e7029b0f14998c421.jpg'}]"
7425,밑반찬,일상,달걀/유제품,부침,치즈계란말이,치즈계란말이,https://recipe1.ezmember.co.kr/cache/recipe/2016/02/22/56b2daa27a9e6129b869bbcb93a04f0b1.jpg,"5,994",15분 이내,초급,2인분,"[('달걀', '5개'), ('맛살', '2개'), ('부추', ''), ('모짜렐라치즈', '')]",계란을 듬뿍넣어 두툼하고 정말 먹음직스러운 치즈계란말이입니다.,"[{'step_number': 1, 'description': '달걀 5개를 넣어 조금 두툼하게 계란말이 만들어보려고요. 계란을 그릇에 깨주세요. 그리고 거품기로 잘 풀어주세요. 풀어놓은 달걀은 체반에 한번 걸려주심 좋아요. 사진은 빼먹었네요.', 'image_url': 'https://recipe1.ezmember.co.kr/cache/recipe/2016/02/25/3a26c00d0eeadbbf35d65588f02d38e71.jpg'}, {'step_number': 2, 'description': '풀어놓은 계란물에 썰어 놓은 부추를 넣어주심 된답니다. 그리고 잘 섞어주세요. 간은 소금 간 아주 조금 해주었네요. 치즈를 넣을꺼라서요. 치즈 없으신분은 소금 간 적당히 해주세요. 그래야지 밥 반찬으로 먹을수 있잖아요. 너무 싱거우면~ 계란말이는 맛없는 것 같아요 이것도 개인취향 ㅋ 입맛에 맞게 간을 해주세요.', 'image_url': 'https://recipe1.ezmember.co.kr/cache/recipe/2016/02/25/3836d42402b0d55b79526fd16575152f1.jpg'}, {'step_number': 3, 'description': '잘 달궈팬에 기름을 두르고 계란물을 절반만 부어주세요. 계란물 다 부우면 안되고 남겨두셔야해요. 그래야지 두툼한 계란말이를 만들수 있거든요.', 'image_url': 'https://recipe1.ezmember.co.kr/cache/recipe/2016/02/25/757a3d888876c5ab6227a66dc81f20541.jpg'}, {'step_number': 4, 'description': '맛살 두줄 올려주고 모짜렐라치즈 뿌려주고 치즈를 냉동실에 보관해 두었다가 꺼냈더니 애들이 막 붙어있네요.', 'image_url': 'https://recipe1.ezmember.co.kr/cache/recipe/2016/02/25/a7084c1f6028bd126644ae9dc7288cbf1.jpg'}, {'step_number': 5, 'description': '끝에서 부터 돌돌 말아주다 남아있던 계란물을 다 부어주심 된답니다.', 'image_url': 'https://recipe1.ezmember.co.kr/cache/recipe/2016/02/25/124b2c299911fc95bcf0c72e7b8759f81.jpg'}, {'step_number': 6, 'description': '조심 조심 젓가락과 뒤집기를 이용해 돌돌 말아주세요. 계란말이 옆구리 터지지 않게~ 센불보단 약불에서 말아주는게 전 편하고 좋은것같아요. 그럼 계란이 타지않고 잘 말아지는것같다는요.', 'image_url': 'https://recipe1.ezmember.co.kr/cache/recipe/2016/02/25/09d0e1db0158c8e1ad7e45739db00fe91.jpg'}, {'step_number': 7, 'description': '돌돌 말아진 치즈계란말이 완성 먹기좋은 크기로 잘라 그릇에 담아주면 되지요.', 'image_url': 'https://recipe1.ezmember.co.kr/cache/recipe/2016/02/25/1f24f8c66d0bd2f1515b35389b37952e1.jpg'}]"
7426,밑반찬,일상,달걀/유제품,부침,#꼬막전 [꼬막계란전],꼬막계란전,https://recipe1.ezmember.co.kr/cache/recipe/2019/12/16/0f23ce8f7af36099cbd5f2ca8eba87391.jpg,"5,050",15분 이내,초급,2인분,"[('손질된 꼬막', '2줌'), ('계란', '4개'), ('쪽파', '1줌'), ('양파', '1/6개'), ('당근', '1/6개'), ('빨간파프리카', '1/6개'), ('풋고추', '1개'), ('소금', '3꼬집'), ('후추', '약간')]","꼬막으로 색다른 요리 만들기!
꼬막계란전 만들기 정말 쉬워요!!^^","[{'step_number': 1, 'description': '꼬막은 데쳐서 손질후 사용합니다.\n러빙밍꼬막손질법▶ @6923208 꼬막 손질법 레시피', 'image_url': 'https://recipe1.ezmember.co.kr/cache/recipe/2019/12/16/d24486fc3e154335a0fb1cb492c3a73f1.jpg'}, {'step_number': 2, 'description': '야채는 다져놓거나 채썰어 준비해주세요.', 'image_url': 'https://recipe1.ezmember.co.kr/cache/recipe/2019/12/16/8b1f8420ede5e4ff9a812e2c70bb7f441.jpg'}, {'step_number': 3, 'description': '볼에 계란,소금,후추를 넣어 먼저 풀어줍니다.', 'image_url': 'https://recipe1.ezmember.co.kr/cache/recipe/2019/12/16/66cc8bc04849d4234b3b25cfa82688cd1.jpg'}, {'step_number': 4, 'description': '풀은 계란에 준비된 재료를 다 넣어줍니다.', 'image_url': 'https://recipe1.ezmember.co.kr/cache/recipe/2019/12/16/68ff35369a4539780a43b478dc6addf01.jpg'}, {'step_number': 5, 'description': '섞어줍니다.', 'image_url': 'https://recipe1.ezmember.co.kr/cache/recipe/2019/12/16/2aaadda67e6d211197b5fdc2d898c3701.jpg'}, {'step_number': 6, 'description': '달군팬에 기름을 두르고 반죽을 올려줍니다.중불', 'image_url': 'https://recipe1.ezmember.co.kr/cache/recipe/2019/12/16/ae01463698503206dc6eedb005eec03b1.jpg'}, {'step_number': 7, 'description': '어느정도 익은거같을때 뒤집어줍니다.약불', 'image_url': 'https://recipe1.ezmember.co.kr/cache/recipe/2019/12/16/323057f73255c25b06b28ff2c1e9ad1e1.jpg'}]"
