index,종류별,상황별,재료별,방법별,글 제목,레시피이름,레시피이미지,조회수,조리시간,난이도,인분,재료,소개글,조리순서
168750,과자,간식,밀가루,굽기,노오븐 달콤 바삭바삭한 러스크,러스크,https://recipe1.ezmember.co.kr/cache/recipe/2015/08/17/d4518c84920ba30403587f66d509ccc21.jpg,"18,081",15분 이내,아무나,2인분,"[('식빵', '6장'), ('물', ''), ('설탕', '')]","자투리 식빵들을 활용하여 만드는 식빵활용요리예요.
통에 담아서 간식으로 먹기 딱 좋아요.","[{'step_number': 1, 'description': '식빵을 먹기 좋은 한 입크기로 잘라 주세요.', 'image_url': 'https://recipe1.ezmember.co.kr/cache/recipe/2015/08/17/e87b2620b5cb2305271ca5ce533de3d41.jpg'}, {'step_number': 2, 'description': '전자레인지에 30초씩 3번 나누어서 돌려주세요.\n전자레인지에 식빵을 돌리는 이유는 수분을 빼주기 위해서예요.전자레인지', 'image_url': 'https://recipe1.ezmember.co.kr/cache/recipe/2015/08/17/aee65e06fd5ab25dbbbdec61771defd01.jpg'}, {'step_number': 3, 'description': '식빵은 앞뒤를 뒤집어가며 전자레인지에 돌리신후, 식혀주세요.\n*전자레인지마다 사양이 틀리니 재료를 확인하시면서 시간조절을 해주세요*', 'image_url': 'https://recipe1.ezmember.co.kr/cache/recipe/2015/08/17/7dc89dd8133d8129a6691139d52dc8111.jpg'}, {'step_number': 4, 'description': '냄비에 설탕과 물을 1:1 비율로 넣고 설탕물을 만들어주세요.', 'image_url': 'https://recipe1.ezmember.co.kr/cache/recipe/2015/08/17/0bdeeecaaa77d29480fdecccfe32aaeb1.jpg'}, {'step_number': 5, 'description': '센불에서 주걱으로 저어주시면서 설탕물을 졸여 주세요.', 'image_url': 'https://recipe1.ezmember.co.kr/cache/recipe/2015/08/17/ad683caddba8d4e04b33a47e4eec29451.jpg'}, {'step_number': 6, 'description': '설탕물이 바글바글 끓기 시작하면 약불로 불 조절후 걸쭉해질때까지 졸여 주세요.', 'image_url': 'https://recipe1.ezmember.co.kr/cache/recipe/2015/08/17/ecdf3156702b87a36140ac5f498a15151.jpg'}, {'step_number': 7, 'description': '걸쭉하게 설탕옷이 만들어졌으면 불을 끄고 식빵을 넣고 주걱으로 섞어 주세요.', 'image_url': 'https://recipe1.ezmember.co.kr/cache/recipe/2015/08/17/b1626f3a4f379e14ff531d9fa9a292ad1.jpg'}, {'step_number': 8, 'description': '설탕옷을 입은 식빵들은 꺼내서 식혀 주세요.\n식힐때 취향에 따라서 파마산치즈가루, 시나몬가루를 뿌리시면 치즈러스크, 시나몬 러스크를 드실수 있어요.', 'image_url': 'https://recipe1.ezmember.co.kr/cache/recipe/2015/08/17/bd89c8b9d75666dd8aa5d2beb2295b951.jpg'}]"
168751,과자,간식,밀가루,굽기,찰치즈스틱 만들기 Sticky cheese stickㅣ오네디 Dessert at 4 p.m.,찰치즈스틱,https://recipe1.ezmember.co.kr/cache/recipe/2020/12/21/b861c4bae9e590ea28ff546993363efe1.jpg,"1,009",120분 이내,초급,4인분,"[('대두소프트 Daedoo soft', '400g'), ('중력분 Medium flour', '20g'), ('황치즈분말 Cheddar cheese powder', '18g'), ('다진 모짜렐라치즈 Chopped mozzarella c', '150g'), ('파마산치즈가루 Parmesan cheese powder', '18g'), ('버터 Butter', '100g'), ('계란 Egg', '2개'), ('식용유 Cooking oil', '20g'), ('설탕 Sugar', '20g'), ('우유 Milk', '130ml'), ('소금 Salt', '5g')]","안녕하세요. 오후 4시의 디저트 입니다.
오늘은 쫄깃쫄깃한 찰치즈스틱을 만들어보았어요.
모짜렐라와 파마산치즈를 추가해서 짭쪼름한맛을 더했답니다. 레시피 관련 문의사항이 있으시면 언제든 댓글 남겨주세요!","[{'step_number': 1, 'description': '대두소프트, 중력분, 황치즈가루를 볼에 담아줍니다.\n(대두소프트는 입자가 고와서 체를 치면 가루날림이 심합니다. 중력분과 황치즈가루만 체쳐주세요.)', 'image_url': 'https://recipe1.ezmember.co.kr/cache/recipe/2020/12/21/83cbc3dbbcddf25b853e22ba951da5e91.jpg'}, {'step_number': 2, 'description': '1에 설탕과 소금을 넣고 섞어줍니다.', 'image_url': 'https://recipe1.ezmember.co.kr/cache/recipe/2020/12/21/d3f5715e6e2db87b10aacada863ea0811.jpg'}, {'step_number': 3, 'description': '2에 버터를 넣고 스크래퍼로 콩알만하게 다져줍니다.', 'image_url': 'https://recipe1.ezmember.co.kr/cache/recipe/2020/12/21/2c82c653a986b5eb77968d03d8333e021.jpg'}, {'step_number': 4, 'description': '3에 계란과 식용유를 넣고 고슬고슬한 상태로 만들어줍니다.', 'image_url': 'https://recipe1.ezmember.co.kr/cache/recipe/2020/12/21/9b9cdab7aaa69e59327fbfbeec369f841.jpg'}, {'step_number': 5, 'description': '4에 우유를 넣고 한덩이로 뭉쳐질때까지 반죽합니다.', 'image_url': 'https://recipe1.ezmember.co.kr/cache/recipe/2020/12/21/a1ac3873ae4735ac96eb5257d005483d1.jpg'}, {'step_number': 6, 'description': '마지막으로 파마산, 모짜렐라치즈를 넣고 반죽을 마무리해줍니다.', 'image_url': 'https://recipe1.ezmember.co.kr/cache/recipe/2020/12/21/0c994f46ef11b03b128f0f081ff19f361.jpg'}, {'step_number': 7, 'description': '완성된 반죽은 40g씩 분할해주고 길다란 스틱모양으로 성형해줍니다.', 'image_url': 'https://recipe1.ezmember.co.kr/cache/recipe/2020/12/21/56bbb6d8b8bc629bef2eb712bf0bb1c41.jpg'}, {'step_number': 8, 'description': '적당한 간격으로 팬닝합니다.', 'image_url': 'https://recipe1.ezmember.co.kr/cache/recipe/2020/12/21/9fac95556c1a4fac5a988ce2718448c51.jpg'}, {'step_number': 9, 'description': '170도의 오븐에서 15분간 구워줍니다.\n(오븐마다 온도 차이가 있기 때문에 상태를 보고 시간과 온도를 조절해주세요.)오븐', 'image_url': 'https://recipe1.ezmember.co.kr/cache/recipe/2020/12/21/7ccee570027a6bcf7531c387f1842af81.jpg'}]"
168752,과자,간식,밀가루,굽기,초코 쿠키 만들기,초코쿠키,https://recipe1.ezmember.co.kr/cache/recipe/2018/06/26/96b159374feb5c3c4629679c9fac77dc1.jpg,"6,217",90분 이내,초급,3인분,"[('박력분', '3종이컵'), ('계란', '1개'), ('무염버터', '30'), ('설탕', '50'), ('소금', '3'), ('슈가파우더', ''), ('코코아 가루', '10')]",요리책에서 바닐라 쿠키를 초코 쿠키로 만들어 보았습니다^^,"[{'step_number': 1, 'description': '버터를 녹여,설탕과,소금과 같이 섞어줍니다.', 'image_url': 'https://recipe1.ezmember.co.kr/cache/recipe/2018/06/26/f5db34ddfb3ce58c1384a3a435e373bd1.jpg'}, {'step_number': 2, 'description': '박력분,코코아 가루를 넣어 반죽합니다.', 'image_url': 'https://recipe1.ezmember.co.kr/cache/recipe/2018/06/26/269b09f7af94ee34706f43d8f7550aa71.jpg'}, {'step_number': 3, 'description': '반죽은 냉장고에 1시간 발효 시켜줍니다.', 'image_url': 'https://recipe1.ezmember.co.kr/cache/recipe/2018/06/26/b1dd98e5c27753fd45495d6085e269451.jpg'}, {'step_number': 4, 'description': '모양틀을 이용하여 모양을 내줍니다.', 'image_url': 'https://recipe1.ezmember.co.kr/cache/recipe/2018/06/26/2749418553f9846babd5c0c14b4223f81.jpg'}, {'step_number': 5, 'description': '200도로 먼저 예열을 하고,195도로15분간 구워줍니다.', 'image_url': 'https://recipe1.ezmember.co.kr/cache/recipe/2018/06/26/49b013f020cd6e69c85862811c17e0f01.jpg'}]"
168753,과자,간식,밀가루,굽기,미니 딸기 타르트,미니딸기타르트,https://recipe1.ezmember.co.kr/cache/recipe/2015/07/22/bf8c14d1ec8a46890f0c9a5206f03e60.jpg,"19,705",120분 이내,고급,6인분 이상,"[('밀가루박력분', '145g'), ('버터', '70g'), ('슈거파우더', '70g'), ('소금', '1/3작은술'), ('우유                                                                                생략가능', '1/2큰술'), ('달걀 노른자', '1개'), ('설탕', '35g'), ('우유', '130g'), ('밀가루박력분', '10g'), ('바닐라빈', '1/2개'), ('달걀 노른자', '1개'), ('크림치즈', '100g'), ('생크림', '125g'), ('레몬즙', '1작은술'), ('설탕', '35g'), ('딸기', ''), ('피스타치오', '')]",제철 딸기를 듬뿍 올림 새콤달콤한 미니 딸기 타르트입니다~!,"[{'step_number': 1, 'description': '커터기에 박력분, 슈거파우더, 소금, 차가운 버터를 넣고 10~15초간 돌려주시고 달걀 노른자와 우유를 넣고 반죽을 뭉쳐주세요', 'image_url': 'https://recipe1.ezmember.co.kr/cache/recipe/2015/07/22/bb8a957e35793a543a39eddb20013ecf1.jpg'}, {'step_number': 2, 'description': '반죽을 비닐이나 랩으로 감싸 냉장고에서 1시간 동안 휴지시킨 후 반죽을 0.4cm 두께로 밀어주세요', 'image_url': 'https://recipe1.ezmember.co.kr/cache/recipe/2015/07/22/47bf32b8362fab3069b3fd05a91d1e291.jpg'}, {'step_number': 3, 'description': '반죽을 팬에 밀착시켜 붙이고 포크로 바닥을 찍은 뒤 180도로 예열한 오븐에서 15분간 구워주고 냄비에 우유와 바닐라빈을 넣고 끓여주세요오븐', 'image_url': 'https://recipe1.ezmember.co.kr/cache/recipe/2015/07/22/0ee96f226c1e99643eb9070476ab1a191.jpg'}, {'step_number': 4, 'description': '달걀 노른자와 설탕을 볼에 넣고 밝은 색을 띌 때까지 거품기로 저어준 뒤 우유를 붓고 잘 섞어주고 체에 내린 다음 냄비에 붓고 중불에서 거품기로 저어가며 끓여주세요', 'image_url': 'https://recipe1.ezmember.co.kr/cache/recipe/2015/07/22/b3daa853a7a57613593c8e7affb116b01.jpg'}, {'step_number': 5, 'description': '걸쭉해지면 불을 끄고 식혀냅두고 생크림에는 설탕을 넣고 휘핑해주세요', 'image_url': 'https://recipe1.ezmember.co.kr/cache/recipe/2015/07/22/0aae236210211e4f62b37934fdd7b65b1.jpg'}, {'step_number': 6, 'description': '부드럽게 풀어둔 크림치즈를 넣고 섞어주고 식힌 타르트 위에 커스터드 크림을 넣어주세요.', 'image_url': 'https://recipe1.ezmember.co.kr/cache/recipe/2015/07/22/aa57e403ec1f71d3395ebb9ce2e2e6c91.jpg'}, {'step_number': 7, 'description': '원형 깍지를 끼운 짤주머니에 크림치즈 크림을 채운 뒤 커스터드 크림 위에 알맞게 짜주고 원하는 모양으로 자른 딸기를 올려 장식해주세요.', 'image_url': 'https://recipe1.ezmember.co.kr/cache/recipe/2015/07/22/e7d9e57a7d696cf377a29b78e4e126fa1.jpg'}]"
168754,과자,간식,밀가루,굽기,"버터향 가득, 풍미가 좋은 모자이크 쿠키 / 체크쿠키 만들기",체크쿠키,https://recipe1.ezmember.co.kr/cache/recipe/2018/10/25/b61c4ba440d84c7bc8e4d100b5c3ff371.jpg,"6,735",60분 이내,아무나,4인분,"[('버터', '120g'), ('노른자', '1알'), ('박력분', '200g'), ('베이킹파우더', '1g'), ('소금', '1g'), ('슈가파우더', '90g'), ('버터', '120g'), ('노른자', '1알'), ('박력분', '185g'), ('베이킹파우더', '1g'), ('소금', '1g'), ('슈가파우더', '90g'), ('코코아파우더', '15g')]","고소하고 부드러운 버터쿠키와 달콤한 향이 있는 초코쿠키가 만나 체크쿠키가 나왔습니다!
반죽을 이용해 아이들과 얼굴만들기를 해도 좋고
실패하기가 어려운 레시피니 만들어보세요 :)","[{'step_number': 1, 'description': '실온에 둔 버터를 볼에 담아\n부드럽게 크림화해주세요.버터 120g볼', 'image_url': 'https://recipe1.ezmember.co.kr/cache/recipe/2018/10/25/910b53532cc10516b14c5f0896a0ee001.jpg'}, {'step_number': 2, 'description': '노른자를 1알 넣고 뭉침없이 잘 섞어주세요.노른자 1알버터와 달걀 모두 실온에 두어 냉기를 뺀 후에 사용해야 분리가 없답니다.', 'image_url': 'https://recipe1.ezmember.co.kr/cache/recipe/2018/10/25/678b5ce4e364bce38e1a56feaa741a0b1.jpg'}, {'step_number': 3, 'description': '노른자가 잘 섞인 후 슈가파우더를 넣고 섞어주세요.설탕을 사용해도 상관은 없지만 슈가파우더를 사용했을 때 버터크림이 매끄럽게 된답니다. 설탕을 넣을 경우에는 설탕이 어느정도 녹을 때까지 오래 휘핑해주세요.', 'image_url': 'https://recipe1.ezmember.co.kr/cache/recipe/2018/10/25/d88f2c96a3f83b3efee2fb2668dbb61f1.jpg'}, {'step_number': 4, 'description': '그 후 박력분, 베이킹파우더, 소금을 모두 체쳐서 넣어주세요.\n초코반죽에는 박력분, 베이킹파우더, 소금, 코코아파우더겠죠 :D\n#모양으로 날가루가 안 보일 정도로만 섞고 뭉쳐주세요.냉장고에 휴지를 시켜주면 더 바삭한 식감의 쿠키를 만들 수 있어요.', 'image_url': 'https://recipe1.ezmember.co.kr/cache/recipe/2018/10/25/ee54cfb8eff2da9a3f3b22308728bda51.jpg'}, {'step_number': 5, 'description': '휴지를 끝낸 반죽은 각각 2등분으로 나눠서 길죽하게 모양을 만든 뒤 모자이크 모양으로 성형해주세요.\n그 후 원하는 두께만큼 썰어주시면 됩니다.노른자를 사용하고 남은 흰자로 반죽사이에 발라주면 접착제역할을 해요!', 'image_url': 'https://recipe1.ezmember.co.kr/cache/recipe/2018/10/25/27f870d7508d674335bfeb25e68a65511.jpg'}, {'step_number': 6, 'description': '오븐 트레이에 간격을 두고 넓게 배치해주세요. 두께가 있는 만큼 넓게 퍼지기 때문에 12~15개정도만 두는게 좋습니다.(오븐크기에 따라 다름)\n예열한 오븐에 170도 10분정도 구워주면 완성!오븐', 'image_url': 'https://recipe1.ezmember.co.kr/cache/recipe/2018/10/25/c537f1a5935cbf75fde2d289a7be0f531.jpg'}]"
168755,과자,간식,밀가루,굽기,호두 월병,호두월병,https://recipe1.ezmember.co.kr/cache/recipe/2015/10/07/b84cc6fd58618ced1a236d8f5a666b8b1.jpg,"5,916",90분 이내,중급,6인분 이상,"[('달걀', '5개'), ('식물성오일                                                                                향이 강하지 않은 오일은 다 괜찮아요', '100g'), ('박력분', '750g'), ('아몬드가루', '100g'), ('다진호두', '400g'), ('덧가루용 밀가루', '약간'), ('달걀물', '약간'), ('설탕', '200g'), ('꿀', '75g'), ('소금', '1g'), ('흰앙금', '500g'), ('적앙금', '500g')]","월병은 중국에서 명절때 먹는 음식으로, 보기에도 좋고 맛도 주변 사람들에게 선물로 만들어 주기 좋은 간식입니다. 호두가 들어가 있어 고소하고 버터를 사용하지 않아 더욱 건강하답니다. 특히, 어르신들에게 인기만점인 월병이예요.","[{'step_number': 1, 'description': '먼저 오븐을 170도로 예열하면서 5분에서 10분 정도 호두를 구워주시면 더 고소하게 드실 수 있답니다.오븐', 'image_url': 'https://recipe1.ezmember.co.kr/cache/recipe/2015/10/08/2dbcb1e0286f3796361fe007271294171.jpg'}, {'step_number': 2, 'description': '볼에 달걀을 풀고 설탕, 소금을 넣고 잘 섞어주세요. 설탕을 충분히 녹여주셔야 하기 때문에 중탕으로 설탕을 녹인 후에 식혀주시는 것도 좋답니다.', 'image_url': 'https://recipe1.ezmember.co.kr/cache/recipe/2015/10/08/f6247f841c08462bf5172e1c04fd81211.jpg'}, {'step_number': 3, 'description': '분량의 꿀과 오일을 넣고 잘 섞은 후 미리 쳬 쳐 놓은 가루들을 넣어 잘 섞어줍니다. 반죽을 비닐에 싸서 냉장고에 30분 정도 휴지시켜주세요.', 'image_url': 'https://recipe1.ezmember.co.kr/cache/recipe/2015/10/08/9d62e994ceee0fe3aa58266ece2d2f6b1.jpg'}, {'step_number': 4, 'description': '흰앙금과 적앙금에 각각 전처리한 호두의 절반씩을 넣고 잘 섞어줍니다.', 'image_url': 'https://recipe1.ezmember.co.kr/cache/recipe/2015/10/08/35ba7e864354afc5d1d7670910d334911.jpg'}, {'step_number': 5, 'description': '잘 섞인 앙금은 각각 전체 나누기 40을 하여 둥글려주세요. 이렇게 하신 후 냉장실의 반죽을 꺼내시면 딱 맞을 것 같아요.', 'image_url': 'https://recipe1.ezmember.co.kr/cache/recipe/2015/10/08/8c0c99b73741430ac047406e615d741b1.jpg'}, {'step_number': 6, 'description': '냉장실에서 꺼낸 반죽도 전체 나누기 40을 하여 둥글려 주시면 된답니다.', 'image_url': 'https://recipe1.ezmember.co.kr/cache/recipe/2015/10/08/4933a0436b39d64af77a46e44a9feff81.jpg'}, {'step_number': 7, 'description': '이제 손에 덧가루를 바른 후 반죽을 둥글납작하게 만들고 그 위에 앙금을 올려서 살살살 오므려주세요. 이음매가 서로 겹치지 않게 잘 오므려만 주시면 된답니다.', 'image_url': 'https://recipe1.ezmember.co.kr/cache/recipe/2015/10/08/3984c952e4e4493f55f546b1a47cef941.jpg'}, {'step_number': 8, 'description': '이제 반죽에 덧가루를 살짝 묻힌 후에 이음매가 바닥으로 가게해서 월병프레스로 모양을 찍어주시면 된답니다. 사진에는 빠졌지만 여기에 게란물을 꼼꼼하게 발라주세요.', 'image_url': 'https://recipe1.ezmember.co.kr/cache/recipe/2015/10/08/b9563be7ffb8f87388e518429f888ec51.jpg'}, {'step_number': 9, 'description': '그런다음 예열된 오븐에서 구우시면 되는데요. 보통 170도에서 15분 정도 구우면 된다고 하는데 이번에 오븐을 바꾸었더니 온도를 좀 더 높여야 하더라구요. 전 180도에서 15~17분 가량 구웠답니다.', 'image_url': 'https://recipe1.ezmember.co.kr/cache/recipe/2015/10/08/d566b4082d08fb955009ebd7cebd99f11.jpg'}]"
168756,과자,간식,밀가루,굽기,[오븐]마늘러스크만들기 # 식빵 꼬다리 활용,마늘러스크,https://recipe1.ezmember.co.kr/cache/recipe/2016/02/18/a4d918b02157c3e594afd4023342c1f31.jpg,"26,947",15분 이내,아무나,2인분,"[('식빵꼬다리', '1접시'), ('다진마늘', '1t'), ('버터', '2T'), ('설탕', '1T'), ('파슬리가루                                                                                생략가능', '조금')]","가끔 처치 곤란한 식빵 꼬다리 냉동실에 있으신가요.
그 아이로 마늘향나는 간단한 간식 만들어 보아요.","[{'step_number': 1, 'description': '전자레인지에 30초-1분 돌려 액체 상태가 된 버터에 \n다진마늘,설탕,파슬리가루를 넣고 섞어주세요전자레인지', 'image_url': 'https://recipe1.ezmember.co.kr/cache/recipe/2016/02/18/c6b9948074d09e10fc5c345ba0c7ad5d1.jpg'}, {'step_number': 2, 'description': '버터소스에 식빵꼬다리를 넣어 살짝 적시거나 실리콘 붓을 이용해서 골고루 발라주세요', 'image_url': 'https://recipe1.ezmember.co.kr/cache/recipe/2016/02/18/6e6fa6852bec85bdfc9c64cbe1e200f41.jpg'}, {'step_number': 3, 'description': '종이호일을 깔고 소스바른 식빵을 오븐에 넣어주세요', 'image_url': 'https://recipe1.ezmember.co.kr/cache/recipe/2016/02/18/0a705ef7357958819a5a64719c2165061.jpg'}, {'step_number': 4, 'description': '오븐(에어프라이어) 180도6-7분 돌려주세요오븐 , 에어프라이어', 'image_url': 'https://recipe1.ezmember.co.kr/cache/recipe/2016/02/18/68431ddc02c2bac66e0fe80acd1d33d81.jpg'}]"
168757,과자,간식,밀가루,굽기,"[명절베이킹]땅콩쿠키,단호박쿠키,자색고구마쿠키,녹차쿠키 - 4가지 맛과 색이 있는 쿠키",쿠키,https://recipe1.ezmember.co.kr/cache/recipe/2017/09/14/cda4de034fff74472e23ced71ab1ab611.jpg,"12,426",60분 이내,중급,1인분,"[('박력분', '110g'), ('버터', '55g'), ('땅콩버터', '66g'), ('슈가파우더', '55g'), ('달걀', '22g'), ('박력분', '123g'), ('단호박가루', '11g'), ('버터', '53g'), ('슈가파우더', '53g'), ('달걀', '34g'), ('박력분', '110g'), ('아몬드가루', '30g'), ('녹차가루', '7g'), ('버터', '60g'), ('슈가파우더', '50g'), ('달걀흰자', '20g'), ('박력분', '120g'), ('자색고구마쿠키', '50g'), ('버터', '65g'), ('슈가파우더', '60g'), ('달걀', '40g')]","설,추석 명절때 주변분들에게 소소하게 선물하기 좋은
4색쿠키랍니다.
천연가루를 사용하여 은은색이 나며 
4가지 쿠키 모두 맛이 너무 좋아요.
쿠키커터대신 월병틀을 사용했더니 명절분위기 확실히 나네요.","[{'step_number': 1, 'description': '실온에둔 버터(땅콩버터)를 부드럽게 풀어준 뒤 슈가파우더를 넣고 섞어줍니다.', 'image_url': 'https://recipe1.ezmember.co.kr/cache/recipe/2017/09/14/6264846bf39ce1081bfa750db5dfb8ab1.jpg'}, {'step_number': 2, 'description': '달걀(달걀흰자)을 넣고 섞어줍니다.', 'image_url': 'https://recipe1.ezmember.co.kr/cache/recipe/2017/09/14/323a64a30a437060b668fcaf22634fb11.jpg'}, {'step_number': 3, 'description': '가루류(박력분및 천연가루)를 체 쳐 넣고 가볍게 섞어줍니다.', 'image_url': 'https://recipe1.ezmember.co.kr/cache/recipe/2017/09/14/36af9c6e457b977082fd9caf302196b21.jpg'}, {'step_number': 4, 'description': '완성된 반죽은 비닐에 넣어 두께 5mm정도로 밀어펴준 뒤 냉장고에서 한시간정도 휴지 시켜줍니다.', 'image_url': 'https://recipe1.ezmember.co.kr/cache/recipe/2017/09/14/8323aa16a79c6accb3225e8de93999141.jpg'}, {'step_number': 5, 'description': '월병틀이나 쿠키커터로 찍어줍니다.', 'image_url': 'https://recipe1.ezmember.co.kr/cache/recipe/2017/09/14/9dfe828a63e0ea906c35c8255e0082641.jpg'}, {'step_number': 6, 'description': '월병틀에 덧가루를 살짝 묻혀 찍어주셔야 선명한 문양이 찍혀요.\n쿠키에 묻은 덧가루는 털어주세요.', 'image_url': 'https://recipe1.ezmember.co.kr/cache/recipe/2017/09/14/63050f9826f3df089987006f26f1f84f1.jpg'}, {'step_number': 7, 'description': '퍼짐이 거의 없으니 적당간격을 두고 팬닝합니다.', 'image_url': 'https://recipe1.ezmember.co.kr/cache/recipe/2017/09/14/74492b023fd8fd792bdddf3bf838aba01.jpg'}, {'step_number': 8, 'description': '170도로 예열된 오븐에서 10~12분 구워줍니다.오븐', 'image_url': 'https://recipe1.ezmember.co.kr/cache/recipe/2017/09/14/75de0953943445ff5a5edd9f04e4c4c11.jpg'}]"
168758,과자,간식,밀가루,굽기,"커피향 솔솔! 가볍게 먹기 좋은 커피콩쿠키, 커피콩빵 만들기",커피콩쿠키,https://recipe1.ezmember.co.kr/cache/recipe/2018/10/23/06701bb8d32fcd13bc685135d65aa5401.jpg,"27,604",60분 이내,초급,2인분,"[('버터', '60g'), ('설탕                                                                                기호에 따라 가감', '50g'), ('커피가루', '3~5g'), ('우유', '10~20g'), ('코코아 파우더', '10g'), ('노른자', '1개'), ('박력분', '120g')]","예전에 카페에 가면 커피콩빵을 많이 사 먹었는데
요새는 있기는 하지만 잘 안보이더라고요.
그래서 집에서 만들어봤어요!","[{'step_number': 1, 'description': '실온에 둔 버터를 가볍게 풀어주고\n설탕을 2번에 나눠 넣어 잘 휘핑해주세요. 설탕을 넣어 휘핑하면 버터가 더 부드러워지고 부푸는 느낌이 드실거예요.\n설탕의 사각사각하는 소리가 줄어들어 완전히 녹을 때까지 저어주세요 :)버터 60g, 설탕 50g믹싱볼설탕이 모두 녹을때까지 휘핑해주세요.\n설탕대신 슈가파우더도 가능합니다.', 'image_url': 'https://recipe1.ezmember.co.kr/cache/recipe/2018/10/23/bf70384ab07050795ee6dad42fd65fc11.jpg'}, {'step_number': 2, 'description': '따뜻하게 데운 우유에 커피가루를 잘 녹여주세요.우유 20ml, 커피가루 5g냄비약불차가운 우유에 해도 커피가루가 어느정도 녹지만 제대로 녹이지 않으면 나중에 반죽성형을 할 때에 얼룩이 생겨요!', 'image_url': 'https://recipe1.ezmember.co.kr/cache/recipe/2018/10/23/632cc043c5b9dbebf3afb482bea858721.jpg'}, {'step_number': 3, 'description': '커피를 다 녹인 우유를 한김 식힌 후에 풀어둔 버터와 함께 섞어주세요.', 'image_url': 'https://recipe1.ezmember.co.kr/cache/recipe/2018/10/23/35d73d23607a5b08237056119cb7c1261.jpg'}, {'step_number': 4, 'description': '어느정도 섞은 후에 달걀노른자도 함께 넣어주세요.달걀노른자 1알', 'image_url': 'https://recipe1.ezmember.co.kr/cache/recipe/2018/10/23/6fb50c95181aa5799dcefc537de8c27f1.jpg'}, {'step_number': 5, 'description': '가루류를 모두 체쳐서 넣어주세요.\n쿠키류기 때문에 치대듯 많이 섞지 말고 #자로 날가루 없을 정도로만 한 덩어리로 모아주세요.밀가루 120g, 코코아파우더 10g체망30분~1시간정도 냉장고에 두면 더 바삭한 식감을 즐길 수 있습니다.', 'image_url': 'https://recipe1.ezmember.co.kr/cache/recipe/2018/10/23/18a4b3423b86c94ed0ee5f376724c9171.jpg'}, {'step_number': 6, 'description': '13~15g, 엄지손가락 한~두 마디정도\n크기의 다원형모양으로 둥글려 나눠주세요.', 'image_url': 'https://recipe1.ezmember.co.kr/cache/recipe/2018/10/23/2e68b9cc04a4c2f025e755bd137ca9761.jpg'}, {'step_number': 7, 'description': '커피콩모양을 내기 위해 젓가락, 이쑤시개, 칼등과 같은 도구를 이용해 가운데를 갈라주세요.젓가락 or 이쑤시개 or 칼등', 'image_url': 'https://recipe1.ezmember.co.kr/cache/recipe/2018/10/23/4b9dcfd92f0e51016b94a671ec011d341.jpg'}, {'step_number': 8, 'description': '예열된 오븐에 170도 15분정도 구워주세요.\n바삭한 식감이 좋다면 170도 13분 180도 2~3분정도로 구워도 좋아요.오븐', 'image_url': 'https://recipe1.ezmember.co.kr/cache/recipe/2018/10/23/737961ef8a117b0a0fc7d460375c4fee1.jpg'}]"
