index,종류별,상황별,재료별,방법별,글 제목,레시피이름,레시피이미지,조회수,조리시간,난이도,인분,재료,소개글,조리순서
150745,퓨전,술안주,소고기,부침,TV요리) 전참시요리대결 1등 먹은 이영자의 육전 ★,육전,https://recipe1.ezmember.co.kr/cache/recipe/2019/07/26/5ca20b6edd6731a15079643d9121288d1.jpg,"81,732",20분 이내,초급,1인분,"[('소불고기', '100g'), ('달걀', '2개'), ('표고버섯', '1개'), ('맛술', '1숟가락'), ('소금', '약간'), ('후추', '약간'), ('샐러드채소', '1줌'), ('간장', '2숟가락'), ('올리브유', '2숟가락'), ('식초', '1숟가락'), ('설탕', '1숟가락'), ('다진 마늘', '1/2숟가락'), ('통깨', '1/2숟가락'), ('후추', '약간')]","먹어본자가 요리도 역시 잘해 ~! 
이원일 쉐프의 육전을 복붙한 이영자의 육전 ★
세상의 모든 레시피 만개의레시피","[{'step_number': 1, 'description': '표고버섯은 채 썬다.', 'image_url': 'https://recipe1.ezmember.co.kr/cache/recipe/2019/07/26/914a91e8e887ba65b033e6bc14897c5e1.jpg'}, {'step_number': 2, 'description': '볼에 달걀을 풀고 소금 후추를 넣어 섞는다.볼', 'image_url': 'https://recipe1.ezmember.co.kr/cache/recipe/2019/07/26/35b3c8e8ca9ebc97d81335a5bec3252c1.jpg'}, {'step_number': 3, 'description': '달군 팬에 식용유를 두르고 소불고기를 넣어 50% 정도 익힌다.팬이때 소불고기는 미리 키친타월로 핏물을 빼주세요.', 'image_url': 'https://recipe1.ezmember.co.kr/cache/recipe/2019/07/26/5d7428fcbfa2878fea269f42fd4b91081.jpg'}, {'step_number': 4, 'description': '소금, 후추, 맛술을 넣는다.', 'image_url': 'https://recipe1.ezmember.co.kr/cache/recipe/2019/07/26/6f98376286a98b0fdaaba9252fb8e0d61.jpg'}, {'step_number': 5, 'description': '(2)에 풀어두었던 달걀을 붓고 표고버섯을 올려 약불로 부친다.', 'image_url': 'https://recipe1.ezmember.co.kr/cache/recipe/2019/07/26/16a2e940fb3d25b40424bc453c83c33d1.jpg'}, {'step_number': 6, 'description': '볼에 소스재료를 넣고 소스를 만든다.볼시판 오리엔탈드레싱이나 발사믹드레싱을 이용해도 괜찮아요.', 'image_url': 'https://recipe1.ezmember.co.kr/cache/recipe/2019/07/26/242f6d4564b1d1d9a05263165e1c286d1.jpg'}, {'step_number': 7, 'description': '그릇에 달걀전과 샐러드채소를 올린 후 소스를 뿌려 완성한다.그릇', 'image_url': 'https://recipe1.ezmember.co.kr/cache/recipe/2019/07/26/21fee52577a406d60a80009c3483d9e51.jpg'}]"
150746,퓨전,술안주,소고기,부침,"술 안주, 손님초대에 딱! 불고기 오코노미야끼 만들기 - 이 조합 아주 칭찬해!",오코노미야끼,https://recipe1.ezmember.co.kr/cache/recipe/2019/06/03/999b8694b4d9a9cc8d841658c8e4dd7b1.jpg,"2,939",30분 이내,초급,2인분,"[('소불고기', '300g'), ('양배추', ''), ('양파', '1/2개'), ('숙주', ''), ('부침가루', ''), ('달걀', '1개'), ('마요네즈', ''), ('가쓰오부시', '')]","오늘은 바로 오코노미야끼를 만들어봤는데요, 
여기에 토핑으로 불고기를 더해봤습니다.
달콤짭짤하면서 담백하기까지한 불고기 오코노미야끼!
그럼 바로 만들어보도록 하겠습니다.","[{'step_number': 1, 'description': '먼저 소불고기를 준비해줍니다.\n마트에서 양념육 구매하셔도 좋구요.\n저는 간단하게 시판용 소스만 사용했습니다.\n양념이 잘베이도록 15-20분간 재워줍니다.', 'image_url': 'https://recipe1.ezmember.co.kr/cache/recipe/2019/06/03/8381c0ba69dd306fbd0c829b7ccc8e081.png'}, {'step_number': 2, 'description': '그동안 야채를 손질해줍니다. 양파 1개 얇게 채썰어주세요.\n그리고 양배추도 마찬가지로 얇게 채썰어주세요.\n칼로 하셔도 되는데, 저는 채판이 더 편하더라구요.\n양배추의 식감을 더 원하신다면 칼로 써시는게 더 좋습니다.', 'image_url': 'https://recipe1.ezmember.co.kr/cache/recipe/2019/06/03/de5921c1c5fe5150807797e4b64a1e221.png'}, {'step_number': 3, 'description': '볼에 양파와 양배추를 넣어주시구요.\n저는 숙주가 남은게 있어서 추가했습니다. \n그 다음 부침가루를 부어주세요. \n야채 양의 1/3정도 분량이면 적당한거 같더라구요.\n그리고 달걀 1개 넣어주시구요.\n물은 한꺼번에 많이 넣지 마시고 조금씩 넣으면서 \n반죽을 만들어주세요.', 'image_url': 'https://recipe1.ezmember.co.kr/cache/recipe/2019/06/03/059c411f2a3e0a513ba37efbea3434f41.png'}, {'step_number': 4, 'description': '반죽은 야채들이 버무려졌다고 느껴질 만큼 \n이정도로만 만들어주시면 됩니다.', 'image_url': 'https://recipe1.ezmember.co.kr/cache/recipe/2019/06/03/34daba797ff90d94c0863293dc9602681.png'}, {'step_number': 5, 'description': '그 다음은 프라이팬에 식용유를 두르고 반죽을 올려주세요. \n오코노미야끼는 부침개와는 다르게 \n어느정도 두께감이 있게 만드는게 맛있습니다.', 'image_url': 'https://recipe1.ezmember.co.kr/cache/recipe/2019/06/03/1fae78ea33947b70834a006288af342a1.png'}, {'step_number': 6, 'description': '바로 그 위에 양념을 한 불고기를 올려 \n노릇노릇하게 익혀줍니다.', 'image_url': 'https://recipe1.ezmember.co.kr/cache/recipe/2019/06/03/d1fc91e7f6a064088dcdc125a25876ae1.png'}, {'step_number': 7, 'description': '고기가 탈 수 있으니 중약불에 놓고 \n뒤집을 때는 과감하게 한번에 뒤집으셔야 합니다!', 'image_url': 'https://recipe1.ezmember.co.kr/cache/recipe/2019/06/03/f2a7de9c45df545fd3a51bd31623fb7c1.png'}, {'step_number': 8, 'description': '마지막으로 접시에 옮겨 마요네즈와 가쓰오부시를 \n뿌려주시면 완성짤주머니가 없으시다면 비닐봉지에 마요네즈를 넣고\n구멍 작게 뚫어서 뿌려주시면 되요!', 'image_url': 'https://recipe1.ezmember.co.kr/cache/recipe/2019/06/03/771f9823fe1da615fab08bb41b1065bb1.png'}]"
