index,종류별,상황별,재료별,방법별,글 제목,레시피이름,레시피이미지,조회수,조리시간,난이도,인분,재료,소개글,조리순서
166913,빵,간식,곡류,찜,포슬포슬 크림치즈떡케이크,크림치즈떡케이크,https://recipe1.ezmember.co.kr/cache/recipe/2015/08/24/6d8cbc1bf3a5e9ced7a2001f8e5809af.jpg,"5,815",90분 이내,중급,6인분 이상,"[('쌀가루                                                                                시판용', '280g'), ('크림치즈', '50g'), ('물', '170ml'), ('자색고구마가루', '5g'), ('설탕', '40g')]",크림치즈가 익숙하지 않으신 분이나 어르신들께서도 부담없이 드실 수 있는 그런 맛이랍니다.,"[{'step_number': 1, 'description': '쌀가루에 실온의 크림치즈를 넣고 손으로 골고루 비벼 주세요. 쌀가루와 크림치즈가 골고루 섞이면 분량의 물을 넣고 섞어 주세요. (물의 양은 손으로 뭉쳐 위로 3~4번 정도 던져서 덩어리가 살짝 부서지는 정도가 적당해요.)', 'image_url': 'https://recipe1.ezmember.co.kr/cache/recipe/2015/08/24/1b9acbec9698f508a7794b78ee41150d1.jpg'}, {'step_number': 2, 'description': '쌀가루의 1/3 분량을 덜어 자색고구마가루를 섞은 후 각각 랩이나 비닐을 씌워 실온에 30분 정도 놓아 주세요. 수분을 흡수한 쌀가루는 두 번 정도 체에 내려주고 설탕을 골고루 섞어 주세요. (설탕의 2/3는 하얀 쌀가루에 설탕의 1/3은 자색고구마가루를 섞은 쌀가루에 섞어 주세요.)', 'image_url': 'https://recipe1.ezmember.co.kr/cache/recipe/2015/08/24/d910f421eedf025df44750ad61331a771.jpg'}, {'step_number': 3, 'description': '틀에 자색고구마가루를 섞은 쌀가루와 하얀 쌀가루를 순서대로 담고 스크래퍼로 윗면을 정리한 후 김 오른 찜통에서 20~25분 정도 찌고 5분간 뜸을 들여 주세요.', 'image_url': 'https://recipe1.ezmember.co.kr/cache/recipe/2015/08/24/bade3eef05b4acaa2dd425f29f0ebc421.jpg'}]"
166914,빵,간식,곡류,찜,♬ 건강만점! 웰빙 블루베리 떡케이크,블루베리떡케이크,https://recipe1.ezmember.co.kr/cache/recipe/2015/06/08/f92e88fa1cfe6764000b98ac4bfa138f.jpg,"7,155",90분 이내,고급,4인분,"[('쌀가루', '4.5컵'), ('블루베리', '1컵'), ('설탕', '1.5숟가락'), ('', ''), ('쌀가루', '5.5컵'), ('설탕', '2숟가락'), ('', ''), ('블루베리설기                                                                                2개분량', '5컵'), ('설탕', '2숟가락'), ('블루베리', '1/2컵'), ('', ''), ('쌀가루', '2.5컵'), ('블루베리시럽', '1.5숟가락'), ('물', '1.5숟가락'), ('', ''), ('쑥가루', '2숟가락'), ('물', '1숟가락')]","짱이 오늘은 떡을 만들었어요. 그렇다고 지가 떡을 자주 만든다거나~ 떡만드는 재주가 남다른것은 아니고~^^;; 냉장고에 있는 블루베리로 뭔가를 만들어 보고 싶은 욕구가 마구 생기길래 - 방앗간에 들려서 쌀가루 조금 구입해서 떡을 만들었답니다. 재주가 없다고 그냥 맹숭맹숭한 떡을 만들기보다는 조금 멋을 내어서 떡케이크를 만들었답니다. 떡 만들기 시작은 그냥으로 시작을 하였지만! 결과적으로 이야기를 하자면, 만들면서는 카페와 블로그를 맞이하여 기념하는 떡케이크를 만들었어요.^^;; 고거이 그냥 떡케이크가 아니고, 보라빛이 유혹적인 블루베리를 뜸뿍 넣어서 맛짱 나름대로 멋을 부린~ 어설픈 블루베리 떡 케이크랍니다. 걍~ 이쁘게 보시고, 블로그와 카페 생일을 함께 축하하여주세요~^^ 오늘은 세계10대 장수식품으로 선정된 블루베리로 만든 건강에 도움이 되는 떡케이크랍니다.","[{'step_number': 1, 'description': '먼저 장식으로 사용할 송편반죽: 쌀가루에 블루베리 시럼을 넣고 양손으로 비벼서 보라빛으로 물을 들이고, 물을 넣은뒤에 반죽을 한뒤에\n송편과 작은 볼을 만든다.송편속은 생블루베리와 블루베리쨈을 약간씩 넣었다.', 'image_url': None}, {'step_number': 2, 'description': '쑥색송편은\n블루베리 송편과 같은 방법으로 반죽을 하여 콩보다 조금 큰크기로 구슬모양을 만들어 찐다.', 'image_url': None}, {'step_number': 3, 'description': '찜통에 물이 끓으면 송편을 넣어 쪄 준다.', 'image_url': None}, {'step_number': 4, 'description': '송편으로는 장식을 할것이고요. 식는동안에 블루베리 설기와 백설기를 만들어 준다.', 'image_url': None}, {'step_number': 5, 'description': '쌀가루에 설탕을 넣어 잘 섞은뒤에 블루베리를 넣고 섞은뒤에 찜통에 젖은 보자기를 깔고,', 'image_url': None}, {'step_number': 6, 'description': '블루베리를 섞은 쌀가루를 넣고, 다른한쪽에는 백설기를 분량을 넣어 찜통에 올린다.', 'image_url': None}, {'step_number': 7, 'description': '지름 25센치가 조금 안되는 지름의 대나무 찜통이예요.\n찜통과 맞는 사이즈의 냄에위에 물을 넣어 끓이다가 물이 끓으면 \n쌀가루를 넣은 대나무 찜통을 올려서 설기를 쪄준다.\n대간 15분 두었는데... 설기의 두께가 얇아서 빨리 익네요.', 'image_url': None}, {'step_number': 8, 'description': '이렇게 백설기와 블루베리 설기가 다 만들어 졌네요.\n얇게 만든 두가지 설기를 합하여 떡케이크를 만들거랍니다.', 'image_url': None}, {'step_number': 9, 'description': '블루베리 윗면이 백설기 윗면과 맞닿게 엎어서 모양을 만들고,미리 만들어 놓은 블루베리 송편으로 장식을 하면 완성!', 'image_url': None}, {'step_number': 10, 'description': '블루베리 떡 케이크 중앙에는 송편을 올려 놓고, 윗쪽에는 반으로 자른 송편을 올렸답니다.\n그리고 허전하여 생블루베리를 몇개 올려 놓았어요.', 'image_url': None}, {'step_number': 11, 'description': '가장자리는 쑥가루를 넣어 만든 떡과 블루베리를 넣어 만든 떡 두가지를 대충 쌓아서\n그럴싸하게~ㅎㅎㅎ', 'image_url': None}]"
166915,빵,간식,곡류,찜,"몸에 좋은 막걸리로 발효해요, 막걸리 보리 술빵",None,https://recipe1.ezmember.co.kr/cache/recipe/2015/06/08/8b9770e91e8160f1e7df01df756cb46e.jpg,"30,179",None,None,None,[],,[]
166916,빵,간식,곡류,찜,막걸리로 찐빵/호떡만들기,호떡,https://recipe1.ezmember.co.kr/cache/recipe/2015/05/25/fe165e8e28fbb751685707fdc445144c1.jpg,"13,284",2시간 이상,초급,1인분,"[('밀가루', '3컵'), ('막걸리', '1컵'), ('냉동딸기', '1/2컵'), ('소금', ''), ('식용유', '1/2컵'), ('팥', '2컵'), ('설탕', '4T'), ('소금', '1t'), ('조청', '1컵'), ('물', '5컵')]",오늘은 진빵만들기 레시피로 여러분과 함께하려고해요!! 시판 막걸리를 이용해 반죽을 숙성시킬 효모를 대체해 볼거에요~ 팥앙금도 직접 만들고 또 찐빵반죽에는 냉동딸기를 갈아 상큼한 향을 더해볼거랍니다!,"[{'step_number': 1, 'description': '효모가 활동하기 좋은 온도로 맞춰주기 위해 딸기와 막걸리는 마이크로 웨이브에 각각 1분 & 40초 조리해서 준비해볼게요! 믹서에 곱게 갈아 딸기막걸리를 만들어주세요.', 'image_url': 'https://recipe1.ezmember.co.kr/cache/recipe/2015/05/26/e8c227662c734869107dd2c3fe380f401.jpg'}, {'step_number': 2, 'description': '색이 곱게 나온 딸기막걸리와 분량의 밀가루와 소금을 넣고 반죽을 만들어 주세요~ 반죽을 넣은 용기가 따뜻해 질 때까지 찜기 위에 3분정도 올려두셨다가 실온에서 2시간 동안 숙성을 시작해볼게요!', 'image_url': 'https://recipe1.ezmember.co.kr/cache/recipe/2015/05/26/8740400241714c1c9cc996de7c6e9efe1.jpg'}, {'step_number': 3, 'description': '숙성이 되는 동안 팥앙금을 만들어볼까요? 먼저 팥과 물을 압력솥에 넣고 30분간 중불에서 잘 삶아주세요. 손으로 쉽게 뭉게질 정도로 푹!! 참!! 팥은 끓는물에 한번 삶아 사용하셔야 합니다~ 그래야 팥 특유의 쓴맛이 제거된답니다!', 'image_url': 'https://recipe1.ezmember.co.kr/cache/recipe/2015/05/26/42c957ec5fba88e1fabd5697fffd3a3d1.jpg'}, {'step_number': 4, 'description': '이렇게 잘 익은 팥에 조청과 설탕 그리고 소금을 넣고 간을 맞춰 주시면 팥앙금 완성입니다! 그냥 떠먹어도 맛있어요! 시판 단팥에비해 덜 달아서 어른들 입맛에 딱 이에요.', 'image_url': 'https://recipe1.ezmember.co.kr/cache/recipe/2015/05/26/8f87be8c50d1013fc4ff62a484b896a81.jpg'}, {'step_number': 5, 'description': '2시간 경과!! 반죽이 거의 2배 이상 부풀었어요~~ 손에 기름을 살짝 발라 반죽이 붙는 것을 방지 해 주시고 팥앙금을 1t정도씩 떠서 가운데에 넣고 동그란 찐빵 모양으로 빚어주세요!', 'image_url': 'https://recipe1.ezmember.co.kr/cache/recipe/2015/05/26/24d1269a943eed9d9fc0db44b5f1320c1.jpg'}, {'step_number': 6, 'description': '찜기에 올려 10분간 쪄내면 찐빵! 기름에 지져내면 호떡 완성!', 'image_url': 'https://recipe1.ezmember.co.kr/cache/recipe/2015/05/26/2dde882ed5241f7b08b2c56072eda6ae1.jpg'}]"
166917,빵,간식,곡류,찜,따끈 따끈~ 찹쌀 찐빵,찹쌀찐빵,https://recipe1.ezmember.co.kr/cache/recipe/2015/09/20/fa9a4680781277500cff5b75184ee3b11.jpg,"9,195",90분 이내,초급,4인분,"[('강력분', '150g'), ('우리밀 통밀', '30g'), ('건식 쌀가루', '50g'), ('건식 찹쌀 가루', '20g'), ('인스턴트 드라이 이스트', '1+1/4ts'), ('베이킹 파우더', '1ts'), ('비정제 설탕', '45g'), ('소금', '2/3ts'), ('달걀 왕란', '1개'), ('물', '110±20g'), ('팥앙금', '350g'), ('호두', '70g')]","찹쌀가루와 쌀가루를 사용하려고 만들어본 찹쌀 찐빵이에요.
찌자마자 뜨거울때 호호 불어가며 먹는 맛이란~!
점점 쌀쌀해지는데 간식으로도 좋을 찹쌀 찐빵입니다~

12개 분량","[{'step_number': 1, 'description': '제빵기에 물과 달걀을 넣고 설탕과 소금을 넣은 뒤, 가루 종류를 넣고 인스턴트 이스트를 맨 위에 넣습니다. 반죽 코스를 돌리다가 반죽이 매끈해지고 윤기가 나면 반죽을 멈춰주세요. 쌀가루가 들어가기 때문에 70~80프로만 글루텐을 잡습니다~ 질기는 환경에 따라 달라질수 있으니 물을 가감해서 질기를 맞춰주세요~', 'image_url': 'https://recipe1.ezmember.co.kr/cache/recipe/2015/09/20/0c274775c36f388410eb58198a55a7231.jpg'}, {'step_number': 2, 'description': '그 상태로 15분 정도 실온상태에서 1차 발효를 합니다.', 'image_url': 'https://recipe1.ezmember.co.kr/cache/recipe/2015/09/20/564bb5f120dac795982cf578b5e5f8e01.jpg'}, {'step_number': 3, 'description': '발효가 되는 동안 팥앙금과 호두를 섞은뒤 35그램씩 분할하여 둥글리기 해둡니다.. 저는 호두를 넣었는데요 수분에 의해 찌는 찐빵이라 호두나 아몬드 같은 마른 견과류보다는 팥배기나 콩배기 같은 촉촉한 배기류가 더 잘어울릴것 같아요. 만드실때 참고하세요~^^', 'image_url': 'https://recipe1.ezmember.co.kr/cache/recipe/2015/09/20/3bec8f6463ba9aad37bb0aaafa0347b01.jpg'}, {'step_number': 4, 'description': '40그램씩 분할해서 둥글리기를 해주세요. 젖은 면보나 비닐을 덮어 반죽이 마르지 않도록 한뒤 실온에서 10~15분 정도 휴지 합니다.', 'image_url': 'https://recipe1.ezmember.co.kr/cache/recipe/2015/09/20/ba5e889aaff238214110c4cea29c75f51.jpg'}, {'step_number': 5, 'description': '휴지가 완료된 반죽을 넙적하게 펴서 팥앙금을 잘 싸주세요.', 'image_url': 'https://recipe1.ezmember.co.kr/cache/recipe/2015/09/20/bc0bb2d327995a89f496e41209b3f02d1.jpg'}, {'step_number': 6, 'description': '잘 꼬집은 후 머핀 유산지 위에 놓습니다.', 'image_url': 'https://recipe1.ezmember.co.kr/cache/recipe/2015/09/20/8db1a482f567f2c95ac97a95212c2e4b1.jpg'}, {'step_number': 7, 'description': '팬닝하고 그 상태로 젖은 면보를 덮어 실온에서 20분 정도 2차 발효를 해주세요.', 'image_url': 'https://recipe1.ezmember.co.kr/cache/recipe/2015/09/20/96024b31bd711db52dec3eb0806a3a691.jpg'}, {'step_number': 8, 'description': '2차 발효를 완료하기 전에 찜솥에 물을 올려 끓여주세요. 김오른 찜솥에서 15분 정도 쪄줍니다.', 'image_url': 'https://recipe1.ezmember.co.kr/cache/recipe/2015/09/20/b5c1a19d35bde547ad27378a4a41a2991.jpg'}]"
166918,빵,간식,곡류,찜,★살구설기미니케이크~★,None,https://recipe1.ezmember.co.kr/cache/recipe/2015/06/05/6703c191d12788f65a4bd7a2e0e7781d.jpg,"3,591",None,None,None,[],,[]
166919,빵,간식,곡류,찜,보리가루 보리술빵 만드는 법 보리빵 만들기,보리빵,https://recipe1.ezmember.co.kr/cache/recipe/2024/03/18/03af02d5456cdf2a1eaea20c7ca5cdd51.jpg,"1,652",60분 이내,아무나,6인분 이상,"[('보리가루', '350g'), ('막걸리', '350ml'), ('꿀', '5큰술'), ('삶은 팥', '5큰술')]",어렸을때의 옛 추억이 생각이나서 만들어 봤어요,"[{'step_number': 1, 'description': '재료를 준비해 주세요볼', 'image_url': 'https://recipe1.ezmember.co.kr/cache/recipe/2024/03/18/31203b5dae5c7608d806d8144ef116f41.jpg'}, {'step_number': 2, 'description': '막걸리 꿀을 넣어서 반죽을 해주세요믹싱볼 , 조리주걱', 'image_url': 'https://recipe1.ezmember.co.kr/cache/recipe/2024/03/18/e28d9a6c2ceb084c982094387a63da341.jpg'}, {'step_number': 3, 'description': '반죽을 해서 20분 정도 숙성을 해주세요', 'image_url': 'https://recipe1.ezmember.co.kr/cache/recipe/2024/03/18/d38999de382fe9a38264f8867c250f691.jpg'}, {'step_number': 4, 'description': '찜기에 쿠킹호일을 깔아 주세요냄비 , 찜기 , 쿠킹호일', 'image_url': 'https://recipe1.ezmember.co.kr/cache/recipe/2024/03/18/c404f1af2d8fcbbc734d692d0dad99b61.jpg'}, {'step_number': 5, 'description': '반죽을 올려서 골고루 펼쳐 주세요', 'image_url': 'https://recipe1.ezmember.co.kr/cache/recipe/2024/03/18/92beda170ad00cc5c36cc7bbb3abd6c11.jpg'}, {'step_number': 6, 'description': '위에 팥을 골고루 펼쳐 주셔도 되고요 반죽할때 같이 섞어서 반죽을 해주셔도 괜찮아요', 'image_url': 'https://recipe1.ezmember.co.kr/cache/recipe/2024/03/18/593dae5586625b9cc75cf64e7da8a4ea1.jpg'}, {'step_number': 7, 'description': '뚜껑을 닫고 센불에서 30분간 쪄 주세요', 'image_url': 'https://recipe1.ezmember.co.kr/cache/recipe/2024/03/18/56ffaa1944316e36fd371b41489518091.jpg'}, {'step_number': 8, 'description': '뚜깡을 열고 식혀 주세요', 'image_url': 'https://recipe1.ezmember.co.kr/cache/recipe/2024/03/18/bed620aa5949257a9dfd0606d2be454b1.jpg'}]"
166920,빵,간식,곡류,찜,마법꾸미의 성탄미니 떡케이크 데코~*,None,https://recipe1.ezmember.co.kr/cache/recipe/2015/06/05/a905461dc8591e44e565f308ee12dd8b.gif,"3,503",None,None,None,[],,[]
