index,종류별,상황별,재료별,방법별,글 제목,레시피이름,레시피이미지,조회수,조리시간,난이도,인분,재료,소개글,조리순서
63538,면/만두,일상,밀가루,끓이기,무더위 날려버릴 새콤달콤 김치말이국수,김치말이국수,https://recipe1.ezmember.co.kr/cache/recipe/2016/08/11/a9a98efab383c844721d2e261f43653c1.jpg,"10,137",15분 이내,아무나,2인분,"[('멸치육수', '2컵'), ('냉면육수', '2봉지'), ('신김치', ''), ('호박', '1/2개'), ('당근', '1/2개'), ('오이', '1개'), ('참기름', '1T'), ('설탕', '1T'), ('깨소금', '1꼬집')]",옆에 있기만 해도 불쾌지수가 올라가는 무더운 여름날 항상 고기집을 가서 시켜먹던 김치말이국수가 생각이 나서 집에서도 간편하게 해먹을 수 있게 만들어봤어요,"[{'step_number': 1, 'description': '먼저 물 두컵을 넣고 시중에 파는 멸치육수 티백을 이용해 멸치육수를 내줍니다. 5분정도면 충분히 우려나는데 기호에 따라 무를 같이 넣어주셔도 됩니다. 멸치육수를 조금 식힌 후 식초 1T, 김치국물 6T, 소금 1T를 넣어줍니다.', 'image_url': 'https://recipe1.ezmember.co.kr/cache/recipe/2016/08/11/6a8a0dd959d3a1c84da8996daef3b17d1.jpg'}, {'step_number': 2, 'description': '육수는 시원하게 먹기위해 냉동실에 잠깐 보관해두고 고명으로 쓸 오이, 당근, 애호박, 삶은 달걀을 준비합니다', 'image_url': 'https://recipe1.ezmember.co.kr/cache/recipe/2016/08/11/f6bc7c89e08f1451a226c1b697f17aaf1.jpg'}, {'step_number': 3, 'description': '호박과 당근은 채를 썰고', 'image_url': 'https://recipe1.ezmember.co.kr/cache/recipe/2016/08/11/2d28f10d8df5175d0a24b3439cbf2eee1.jpg'}, {'step_number': 4, 'description': '식용유를 살짝 둘러서 단단함이 없어질 정도로 볶아줍니다', 'image_url': 'https://recipe1.ezmember.co.kr/cache/recipe/2016/08/11/60aba1a6f9573082e0ca9a8b2973d4ae1.jpg'}, {'step_number': 5, 'description': '볶은 당근과 호박은 접시에 담아두고 오이도 채썰어줍니다', 'image_url': 'https://recipe1.ezmember.co.kr/cache/recipe/2016/08/11/b94a9f4e494321f558a93d49cd9043281.jpg'}, {'step_number': 6, 'description': '마지막으로 신김치도 채썰어서 참기름 1T, 설탕 1T, 깨소금 조금을 넣고 버무려서 같이 고명으로 사용합니다', 'image_url': 'https://recipe1.ezmember.co.kr/cache/recipe/2016/08/11/59dad33713286610482b3b0351b6b1a21.jpg'}, {'step_number': 7, 'description': '고명이 준비가 다 되면 국수를 삶아주는데 물이 끓으면 면을 넣고 끓어오르면 찬물 한컵, 다시 끓어오르면 찬물 한컵을 붓고 다음 끓어오를때 끄고 채반에 담아 찬물로 헹구며 빨래를 빨듯이 박박 빨아줍니다', 'image_url': 'https://recipe1.ezmember.co.kr/cache/recipe/2016/08/11/6d47fe74a0951e07718ef545cc72756b1.jpg'}, {'step_number': 8, 'description': '이제 육수를 준비하는데 냉동실에 두었던 멸치육수 2컵 분량과 시중에 파는 냉면육수 2봉지를 섞어줍니다', 'image_url': 'https://recipe1.ezmember.co.kr/cache/recipe/2016/08/11/64af0e76d7159b438df49ea861fddcd21.jpg'}, {'step_number': 9, 'description': '삶은 면을 그릇에 담아내고 고명을 먹을만큼 올립니다', 'image_url': 'https://recipe1.ezmember.co.kr/cache/recipe/2016/08/11/baf903340ac29a17d80e39612c3dadcc1.jpg'}, {'step_number': 10, 'description': '준비된 육수를 부어서 맛있게 먹으면 더위야 물러나라~!', 'image_url': 'https://recipe1.ezmember.co.kr/cache/recipe/2016/08/11/d79de323d4976a78275ef7cc3e1f824f1.jpg'}]"
63539,면/만두,일상,밀가루,끓이기,간단한 국수요리!! 따뜻한 김치국수,김치국수,https://recipe1.ezmember.co.kr/cache/recipe/2016/11/29/b16a30a2ec69c905309baf46f8cf30381.jpg,"13,561",30분 이내,아무나,2인분,"[('묵은지', '1/4포기'), ('소면', '200g'), ('청양고추', '2개'), ('멸치액젓', '2T'), ('후추', '약간'), ('대파', '1줌'), ('김치국물', '5T'), ('물', '800ml'), ('다시마                                                                                10*10', '2장'), ('멸치', '5마리')]",냉장고에 마땅한 재료가 없을 때 별다른 재료 없이 오로지 김치와 소면만 있어도 잔치국수 못지않은 훌륭한 국수 요리랍니다.,"[{'step_number': 1, 'description': '냄비에 물과 멸치, 다시마를 넣고 \n중불에서 10분 정도 끓여서 \n육수를 만들어 주세요.물, 멸치, 다시마냄비중불', 'image_url': 'https://recipe1.ezmember.co.kr/cache/recipe/2016/11/29/6cb034e7ceaf5a75ab160963ec094ca41.jpg'}, {'step_number': 2, 'description': '육수를 만드는 동안 묵은지는 먹기 좋은 크기로 잘라주세요.묵은지도마 ,  칼', 'image_url': 'https://recipe1.ezmember.co.kr/cache/recipe/2016/11/29/35fbdfa98a63a8a08bf49d65706ba30d1.jpg'}, {'step_number': 3, 'description': '청양고추와 대파도 송송 썰어주세요.청양고추, 대파도마 ,  칼', 'image_url': 'https://recipe1.ezmember.co.kr/cache/recipe/2016/11/29/c35f881e55fd827c2ae924da9bd729811.jpg'}, {'step_number': 4, 'description': '육수가 완성되면 \n다시마와 멸치는 건져내고국자', 'image_url': 'https://recipe1.ezmember.co.kr/cache/recipe/2016/11/29/a872e76a1e45d253a4af92388fefbe111.jpg'}, {'step_number': 5, 'description': '끓여놓은 육수에 \n송송 썬 묵은지를 넣은 뒤손질한 묵은지중불', 'image_url': 'https://recipe1.ezmember.co.kr/cache/recipe/2016/11/29/d8db61b2a101c5d95274c963b421c2601.jpg'}, {'step_number': 6, 'description': '김치 국물도 5T을 넣어주세요김치국물중불', 'image_url': 'https://recipe1.ezmember.co.kr/cache/recipe/2016/11/29/77a906e7b0e1f47d5c741362c7f96dfa1.jpg'}, {'step_number': 7, 'description': '그리고 얼큰한 맛을 담당하는 청양고추도 넣어주세요. 안 넣어도 무방해요.중불', 'image_url': 'https://recipe1.ezmember.co.kr/cache/recipe/2016/11/29/1b0631027ca52d26c258a4a45516d5101.jpg'}, {'step_number': 8, 'description': '김치 넣은 국물이 펄펄 끓으면\n소면을 넣고 바글바글 끓여주세요. 소면중불소면은 따로 삶지 않고 \u200b그냥 넣어주세요', 'image_url': 'https://recipe1.ezmember.co.kr/cache/recipe/2016/11/29/dcdc3c7827484b37e369aa3049263c751.jpg'}, {'step_number': 9, 'description': '멸치 액젓 2T과멸치액젓중불', 'image_url': 'https://recipe1.ezmember.co.kr/cache/recipe/2016/11/29/ecaafd2193fbe5c593be1d14013084291.jpg'}, {'step_number': 10, 'description': '후추를 조금 넣어서 간을 맞춰주세요. 후추중불', 'image_url': 'https://recipe1.ezmember.co.kr/cache/recipe/2016/11/29/8e9e9975a8a006ffe9c5b7ca7657c70b1.jpg'}, {'step_number': 11, 'description': '마지막으로 대파를 넣어 \n한번 휙 끓여주면 김치국수 완성이에요.대파중약불', 'image_url': 'https://recipe1.ezmember.co.kr/cache/recipe/2016/11/29/1039223134fe676a2431f05e3e36d24a1.jpg'}]"
63540,면/만두,일상,밀가루,끓이기,백종원레시피) 얼큰한 장칼국수 만들기,장칼국수,https://recipe1.ezmember.co.kr/cache/recipe/2016/04/21/01eeada4fa265631d8333a63d7e5f13d1.jpg,"13,112",30분 이내,초급,2인분,"[('칼국수면', ''), ('호박', ''), ('양파', ''), ('감자', ''), ('굴', ''), ('다시마                                                                                육수용', ''), ('건새우', ''), ('고추장', ''), ('된장', ''), ('고춧가루', ''), ('달걀', '')]","요즘같이 꿀꿀한 날씨에 딱 어울리는 얼큰한 장칼국수!
뜨끈하게 한그릇 하실래요? ㅎㅎ","[{'step_number': 1, 'description': '재료는 냉장고사정에 따라 조정가능한거 아시쥬? ㅎㅎ', 'image_url': 'https://recipe1.ezmember.co.kr/cache/recipe/2016/04/21/2abc3430e2ac177b3733b0ef613e8fd91.jpg'}, {'step_number': 2, 'description': '다시백에 건새우 + 다시마 + 디포리를 넣고 끓여서 육수를 내요', 'image_url': 'https://recipe1.ezmember.co.kr/cache/recipe/2016/04/21/95c4ef7c6b625b972208aadb5d11e9761.jpg'}, {'step_number': 3, 'description': '양념재료는 고추장, 된장, 고춧가루\n그리고 천연조미료', 'image_url': 'https://recipe1.ezmember.co.kr/cache/recipe/2016/04/21/93a84b674038c17201114bd25c6e57391.jpg'}, {'step_number': 4, 'description': '호박, 감자, 양파는 채썰어서 준비했어요', 'image_url': 'https://recipe1.ezmember.co.kr/cache/recipe/2016/04/21/42b29a257c2f7b6cab1b98409e188a7c1.jpg'}, {'step_number': 5, 'description': '굴은 한번 헹구어서 물기를 빼주었고요', 'image_url': 'https://recipe1.ezmember.co.kr/cache/recipe/2016/04/21/3bdd5232c118ab0352624f1168adf5461.jpg'}, {'step_number': 6, 'description': '육수에 된장을 한숟갈 풀어주었어요', 'image_url': 'https://recipe1.ezmember.co.kr/cache/recipe/2016/04/21/cf19bb5740cf6d125d27998bafa391c11.jpg'}, {'step_number': 7, 'description': '그리고 고추장 두숟갈', 'image_url': 'https://recipe1.ezmember.co.kr/cache/recipe/2016/04/21/48b315f64084bc7d5ef520238acb5b151.jpg'}, {'step_number': 8, 'description': '채썰어둔 야채 투하!', 'image_url': 'https://recipe1.ezmember.co.kr/cache/recipe/2016/04/21/5af91b902a0be10d353618419f9ac9b21.jpg'}, {'step_number': 9, 'description': '간마늘도 한숟갈 넣어주고요', 'image_url': 'https://recipe1.ezmember.co.kr/cache/recipe/2016/04/21/467010eecf950078cf4b69ffdec4cdee1.jpg'}, {'step_number': 10, 'description': '고춧가루 두숟갈 (취향껏 조절하세요)', 'image_url': 'https://recipe1.ezmember.co.kr/cache/recipe/2016/04/21/20026aa58cf18551fe9f91a3fd07fe2f1.jpg'}, {'step_number': 11, 'description': '천연조미료도 한숟갈 넣었어요\n(없음 생략해도 되겠쥬?)', 'image_url': 'https://recipe1.ezmember.co.kr/cache/recipe/2016/04/21/47bb857ab765e601458ecca427905ab81.jpg'}, {'step_number': 12, 'description': '굴을 넣어주고요', 'image_url': 'https://recipe1.ezmember.co.kr/cache/recipe/2016/04/21/2c495698b0bf378e262bd9d3d048296d1.jpg'}, {'step_number': 13, 'description': '칼국수면을 씻어서 준비하기\n겉에 묻은 밀가루를 잘 씻어내야\n덜 걸쭉해져요', 'image_url': 'https://recipe1.ezmember.co.kr/cache/recipe/2016/04/21/cbc56cc9058dd167a46421b3160f774d1.jpg'}, {'step_number': 14, 'description': '야채가 익을때까지 충분히 끓인다음\n면 넣기!\n칼국수면을 넣고 잘 저어줘야 뭉치지 않아요', 'image_url': 'https://recipe1.ezmember.co.kr/cache/recipe/2016/04/21/b2af70ed5e7aa16096ab3ea650124f7a1.jpg'}, {'step_number': 15, 'description': '풀어놓은 달걀넣고 휘이휘이 젓기', 'image_url': 'https://recipe1.ezmember.co.kr/cache/recipe/2016/04/21/37ba25412e1342df504761a66a42b7751.jpg'}, {'step_number': 16, 'description': '면이 불기전에 후다닥 담아서 \n김가루로 마무리!', 'image_url': 'https://recipe1.ezmember.co.kr/cache/recipe/2016/04/21/050cd7b3a633fcb1d77c93cda885a1001.jpg'}]"
63541,면/만두,일상,밀가루,끓이기,깔끔한 잔치국수 먹고싶은 날,잔치국수,https://recipe1.ezmember.co.kr/cache/recipe/2017/05/04/0d051c1dcfef8fc9cded0b386e2f30311.jpg,"9,184",30분 이내,아무나,3인분,"[('소면', '2인분'), ('멸치다시팩', '1개'), ('대파', ''), ('맛간장', '2큰술'), ('소금', '약간'), ('후추', ''), ('다진소고기', '1컵'), ('간장', '1큰술'), ('설탕', '약간'), ('후추', ''), ('맛술', ''), ('계란지단', ''), ('주키니호박 (애호박)', '1토막'), ('햇양파', '1개'), ('대파', ''), ('청양고추', '')]",​자극적이고 매콤한 음식을 좋아하는 울 식구들이지만 때로는 깔끔한 국물을 찾기도 한답니다 ​ 깔끔한 잔치국수가 먹고 싶은 날~ 맑은 국물에 고명 넣고 만들어주었더니 다들 시원하고 담백하니 맛있다며 잘 먹는 거 있죠 ​ 잔치국수 또는 장터국수! 오랜만에 한번 끓여봤네요~,"[{'step_number': 1, 'description': '호박과 양파는 채를 썰어 기름을 아주 약간 넣고 재빨리 볶고 다진 소고기에 간장, 설탕, 맛술, 후추를 넣고 보슬보슬하게 볶아줍니다 계란지단을 얇게 부쳐 가늘게 채 썰어줍니다', 'image_url': 'https://recipe1.ezmember.co.kr/cache/recipe/2017/05/12/e578a0768798ed305a761c9efdb1b4a81.jpg'}, {'step_number': 2, 'description': '냄비에 물을 붓고 다시 팩을 넣고 대파, 청양고추, 간장, 소금을 넣고 장국을 끓이고 다른 쪽에선 소면을 불지 않게 삶아줍니다', 'image_url': 'https://recipe1.ezmember.co.kr/cache/recipe/2017/05/12/5e717fbadde706c66c4ecf5c91a3321e1.jpg'}, {'step_number': 3, 'description': '면기에 소면을 담고 위에 보기 좋게 고명을 올리고 장국을 넣어주었어요~', 'image_url': 'https://recipe1.ezmember.co.kr/cache/recipe/2017/05/12/03ee990b134ce5bf32442aa0b7cd72651.jpg'}]"
63542,면/만두,일상,밀가루,끓이기,감자 수제비 만들기 황금레시피,감자수제비,https://recipe1.ezmember.co.kr/cache/recipe/2019/02/03/c1e8b21a82e2f0e4b6edef725b22f4541.jpg,"7,050",30분 이내,아무나,2인분,"[('감자', '1개'), ('소금', '1t'), ('느타리버섯', '1움큼'), ('밀가루', '200g'), ('부추', '1움큼'), ('계란', '1개'), ('양파', '1/4개'), ('간마늘', '1t'), ('당근', '1움큼')]","간단하게 감자를 넣어서 더욱 맛있는 
감자 수제비 만들어 볼께요.","[{'step_number': 1, 'description': '감자를 넣어서 더 맛있고\n구수한 맛이 일품인 감자 수제비예요..', 'image_url': 'https://recipe1.ezmember.co.kr/cache/recipe/2019/02/03/e2bf351121e68b5d60ceeda8d49683071.jpg'}, {'step_number': 2, 'description': '우선 준비한 재료는 감자는 큼직하게 썰어 준비해 주세요.\n당근은 채썰어서 준비해 주시구요\n양파도 채썰어 주세요.\n그리고 반죽에 넣을 부추는 얇게 썰어 주시구요.\n계란 하나 준비해 주세요..', 'image_url': 'https://recipe1.ezmember.co.kr/cache/recipe/2019/02/03/ebe6bd593bb6b4b912a4137a7f6abb8a1.jpg'}, {'step_number': 3, 'description': '멸치 육수에 소금과 후추로 간을 하구요\n물에 감자를 먼저 넣어 주세용.', 'image_url': 'https://recipe1.ezmember.co.kr/cache/recipe/2019/02/03/36a38a08ce0fdd0c9f9913b4ff6f88ef1.jpg'}, {'step_number': 4, 'description': '그리고 야채도 육수 몫을 톡톡히 하니 \n야채도 듬뿍 넣어 주세요..', 'image_url': 'https://recipe1.ezmember.co.kr/cache/recipe/2019/02/03/e415003e336df0a4bdba722a29350d831.jpg'}, {'step_number': 5, 'description': '육수가 끓어서 국물이 우러날때까지 \n반죽을 준비해 볼까요?\n우선 밀가루에 계란과 물 그리고 아까 썰어서 준비해 둔\n부추를 넣어 주세요.', 'image_url': 'https://recipe1.ezmember.co.kr/cache/recipe/2019/02/03/548abad56829493c033c5b4f77d78c071.jpg'}, {'step_number': 6, 'description': '밀가루 반죽속에 부추가 송송\n더 예뻐보이는 효과가 있지요..\n더 맛나보이기도 하구요..\n그리고는 끓는 육수에 얇게 떼어서 \n넣어 주세요..', 'image_url': 'https://recipe1.ezmember.co.kr/cache/recipe/2019/02/03/726a0fc8666234009cc6c3ce6101501e1.jpg'}, {'step_number': 7, 'description': '그리고 푹 반죽이 익을 정도로 끓여서\n그릇에 담아 내면 \n집에서도 간단하게 감자 수제비를 완성', 'image_url': 'https://recipe1.ezmember.co.kr/cache/recipe/2019/02/03/cad301132f67d74bcc5296835b677f6b1.jpg'}]"
63543,면/만두,일상,밀가루,끓이기,뜨끈하고 고소한 들깨칼국수 만드는법,들깨칼국수,https://recipe1.ezmember.co.kr/cache/recipe/2018/08/23/9814e14881a348039c80ac22cad5dec41.jpg,"6,563",30분 이내,초급,1인분,"[('칼국수 생면사리', '200g'), ('해물다시백', '1개'), ('바지락살', '100g'), ('부추', '100g'), ('홍고추', '1개'), ('느타리버섯', '1/3팩'), ('다진마늘', '1/2T'), ('물                                                                                육수용', '600ml'), ('면 삶기용 물', '1.5L'), ('국간장', '1/2T'), ('소금', '1t'), ('후추', '1/3t'), ('들깻가루', '2T')]","유난히 비오는 장마철 저희집은 들깨칼국수를 자주 먹으러 다녔던 것 같아요. 그 무더운 날씨에 시원한 냉면 한그릇이 더 낫지 않겠냐고 많이들 물으시겠지만, 글쎄요 무더워도, 날씨가 추워도 꼭 뜨끈한 국물요리의 매력은 거부할 수가 없더라구요. 오늘은 고소한맛이 특히 일품인 들깨 칼국수 만드는법 레시피로 여러분과 함께 해 볼까합니다.","[{'step_number': 1, 'description': '**만개의 레시피를 통해 제공되는 메이플대니얼의 컨텐츠는 사진형으로 보실 때 더욱 좋습니다**', 'image_url': 'https://recipe1.ezmember.co.kr/cache/recipe/2018/08/23/e8114e3ef246d9754ae2149f24197e1a1.png'}, {'step_number': 2, 'description': '국물맛을 내는데는 해물다시팩을 사용했어요. 일반 육수용 멸치와 다시마로 대체하셔도 좋습니다. 바지락 살도 넣고 개운한 맛을 더해볼게요. 저는 생바지락을 구하기 어려워서 냉동제품 사용했는데, 생물바지락 사용하시면 한결 국물 맛 내시기 좋을거에요.', 'image_url': 'https://recipe1.ezmember.co.kr/cache/recipe/2018/08/23/33c520fecd9457d1ab5ed5a46a76df451.jpg'}, {'step_number': 3, 'description': '향긋한 부추는 그 향도 매력적이지만 익혔을 때 식감이 아삭해서 더 좋더라구요. 깨끗히 세척 후 물기를 제거한 다음 3~4cm 간격으로 잘라주세요. 홍고추는 0.7cm 정도 두께로 어슷하게 편썰어주시고 느타리버섯은 먹기 좋게 찢어서 준비할게요.', 'image_url': 'https://recipe1.ezmember.co.kr/cache/recipe/2018/08/23/487107b5bd6c3423acfc79d65574cf1d1.jpg'}, {'step_number': 4, 'description': '먼저 냄비에 물600mL와 다시팩을 넣고 8분정도 중불에서 끓여주시고 건져 낸 다음 바지락살과 느타리버섯을 넣고 한소끔 더 끓여주세요.', 'image_url': 'https://recipe1.ezmember.co.kr/cache/recipe/2018/08/23/e651b25cbc24ac2747a73c743c6a41591.jpg'}, {'step_number': 5, 'description': '그리고 칼국수 생면사리는 넉넉한 물 1.5L정도에 한번 데쳐서 사용할게요. 그냥 바로 사용하면 국물이 너무 걸쭉해지고 깔끔하지 못하더라구요. 한소끔 끓여주시고 이 때 완전히 익히실 필요는 없습니다.', 'image_url': 'https://recipe1.ezmember.co.kr/cache/recipe/2018/08/23/10252fe53301708da8fbdb71da716f0c1.jpg'}, {'step_number': 6, 'description': '면을 익히는 사이, 국물에 국간장과 소금, 후추로 기호에 맞게 간을 해 주시고 다진마늘을 넣어주세요.', 'image_url': 'https://recipe1.ezmember.co.kr/cache/recipe/2018/08/23/6e74a7f55b876e29caae1f1bf75e5b5f1.jpg'}, {'step_number': 7, 'description': '이제 따로 데친 칼국수 면을 넣고 끓여주세요.', 'image_url': 'https://recipe1.ezmember.co.kr/cache/recipe/2018/08/23/9c62c26f4c89bf2b8d033307981ee0221.jpg'}, {'step_number': 8, 'description': '향긋함을 더해 줄 부추도 이제 넣어보겠습니다.', 'image_url': 'https://recipe1.ezmember.co.kr/cache/recipe/2018/08/23/8fc9832ade368c98c60f48848576b97b1.jpg'}, {'step_number': 9, 'description': '마지막으로 들깻가루 넣고 한소끔 더 끓여주신 다음, 홍고추를 넣어 개운한 향까지 더해 주시면 고소하게 즐기는 들깨 칼국수 만드는법 완성입니다!', 'image_url': 'https://recipe1.ezmember.co.kr/cache/recipe/2018/08/23/ece0f4f8fa357d8eaeaa13fed92b5e1f1.jpg'}, {'step_number': 10, 'description': '들깨가 들어가 그윽하면서 고소한 향과 함께 부추의 알싸한 향까지. 입맛없을 때 별미로 즐기기 참 좋은 메뉴에요. 비올때나 날씨 쌀쌀할 때 뜨끈하게 즐길 수 있는 국물요리로 추천 해 드리고 싶습니다. 김치하나만 있으면 더이상 꺼낼 반찬도 없겠더라구요.', 'image_url': 'https://recipe1.ezmember.co.kr/cache/recipe/2018/08/23/3d85e8ca9a6d25e520c816352f11b8f31.jpg'}, {'step_number': 11, 'description': '오늘은 시판되는 칼국수 생면사리로 집에서 맛있게 완성할 수 있는 고소한 들깨 칼국수 만드는법 레시피로 여러분과 함께했습니다. 부추까지 넣어 만들었더니 훨씬 푸짐하게 즐길 수 있어서 좋더라구요. 날이 더워도 꼭 가끔 국물요리가 생각날 때가 있더라구요. 입맛 돋우기 좋은 별미 요리로 만들어서 맛있게 즐겨보시길 바랄게요!', 'image_url': 'https://recipe1.ezmember.co.kr/cache/recipe/2018/08/23/6790e29d359ae6582fa0d97c97bf91481.jpg'}]"
63544,면/만두,일상,밀가루,끓이기,먹다 남은 된장찌개로 만든 된장 국수,된장국수,https://recipe1.ezmember.co.kr/cache/recipe/2017/09/16/b01f44275a2424554de19ac00c12592b1.jpg,"9,264",30분 이내,아무나,1인분,"[('국수', '2인분'), ('된장찌개', ''), ('김가루', ''), ('깨소금', ''), ('참기름', '약간')]","먹다 남은 된장찌개로 만든 된장 국수 며칠 전, 퇴근하면서 배고프다고 하는 남편, 저녁밥이 한 공기 밖에 되질 않아 ""국수 삶을까?"" ""언제 먹어! 라면 없어?"" 마침 라면이 똑떨어지고 없었던.. 된장찌개 끓여 놓은 게 있어 국수만 얼른 삶아 말아먹었습니다.","[{'step_number': 1, 'description': '[된장찌개]감자, 양파, 당근, 고추는 먹기 좋은 크기로 썰어준다. 멸치, 다시마, 붉은고추, 청양초를 넣고 육수를 내주고 건더기는 건져낸다. 육수가 끓으면 단단한 감자와 당근을 넣어준다.', 'image_url': 'https://recipe1.ezmember.co.kr/cache/recipe/2017/09/18/aa37537eba004aea533f2f5db40902501.jpg'}, {'step_number': 2, 'description': '된장을 풀어주고 나머지 채소도 넣어주고 마지막에 대파를 넣어 완성한다.', 'image_url': 'https://recipe1.ezmember.co.kr/cache/recipe/2017/09/18/bdb7c73a89b64d593a019a044e0580651.jpg'}, {'step_number': 3, 'description': '[된장국수]냄비에 물을 붓고 끓어오르면 국수를 넣어준다. 2~3번 깜짝 물을 넣어가며 삶아낸 후 찬물에 얼른 헹구어 준 뒤 그릇에 담는다.', 'image_url': 'https://recipe1.ezmember.co.kr/cache/recipe/2017/09/18/bf33f332e1aac03b5cff08cfd832e3f41.jpg'}, {'step_number': 4, 'description': '국수 위에 된장찌개, 김가루, 깨소금, 참기름을 넣고 마무리한다.', 'image_url': 'https://recipe1.ezmember.co.kr/cache/recipe/2017/09/18/4887f2e8e59a96dd2d585e1cbb8d8b4e1.jpg'}]"
63545,면/만두,일상,밀가루,끓이기,만두피 수제비 만들기,None,https://recipe1.ezmember.co.kr/cache/recipe/2015/06/05/de0e39d8635046ea970365fe8d59983b.jpg,"32,550",None,None,None,[],,[]
