index,종류별,상황별,재료별,방법별,글 제목,레시피이름,레시피이미지,조회수,조리시간,난이도,인분,재료,소개글,조리순서
168162,과자,간식,달걀/유제품,굽기,복분자 마카롱 만들기,복분자마카롱,https://recipe1.ezmember.co.kr/cache/recipe/2018/06/11/063e7fd15f620d0705f5b7a5166fe6541.jpg,"3,525",60분 이내,초급,4인분,"[('흰자', '64g'), ('슈가파우더', '85g'), ('아몬드 가루', '85g'), ('설탕', '55g'), ('분홍 색소', '약간'), ('무염버터', '60g'), ('슈가파우더', '20g'), ('복분자잼', '50g'), ('그외 가운데 들어갈 복분자 잼', '50g')]","실로 정말 오랜만에 마카롱을 만들어본 것 같아요~ 작년 겨울 초입에 만들어보곤 지금 만들어 본..ㅎ~ 그냥 불현듯 마카롱이 제대로 만들어질까 궁금해졌어요.
감은 아직 살아 있는건지, 잘 만들어는질지.. 그리고 작년 이맘때 만들어둔 복분자 잼 처리겸 겸사겸사. 암튼 오랜만에 구운 마카롱이라 감을 잃었을거라 생각하며 구웠는데 생각보다 괜찮게 나와준거 같아서 다행이라 생각했네요. 
오랜만에 구워본 복분자 마카롱~ 만들어봐요~","[{'step_number': 1, 'description': '흰자를 가볍게 거품을 올리고 설탕을 세번에 나누어 넣어가며, 끝이 구부러지지만 단단한 머랭을 만들어주세요.', 'image_url': 'https://recipe1.ezmember.co.kr/cache/recipe/2018/06/11/f9b817402fe92b0e0d79e72b591947ab1.jpg'}, {'step_number': 2, 'description': '완성된 머랭에 색소 약간을 넣고 핸드믹서 저속으로 거품을 정리하며 색을 내주세요. 슈가파우더와 아몬드 파우더를 체쳐 넣고 살살 섞어주세요.', 'image_url': 'https://recipe1.ezmember.co.kr/cache/recipe/2018/06/11/2352b7b562d03d6568bbcdbffd4405141.jpg'}, {'step_number': 3, 'description': '반죽을 볼벽에 세네번 문지르며 마카로나쥬를 해주세요. 반죽을 떨어뜨려봤을때 착착 접히면서 계단모양을 그리며 떨어지는 정도면 됩니다.', 'image_url': 'https://recipe1.ezmember.co.kr/cache/recipe/2018/06/11/2b1da788edb4eb2b0e2f739a1c2a7a221.jpg'}, {'step_number': 4, 'description': '원형깍지를 낀 짤주머니에 반죽을 넣어, 테프론 시트를 깐 팬에 원형으로 반죽을 짜준 후, 팬 바닥을 몇번 두드려 반죽을 정리해주세요.', 'image_url': 'https://recipe1.ezmember.co.kr/cache/recipe/2018/06/11/e96a0776f65be0a03997ea6856931dd71.jpg'}, {'step_number': 5, 'description': '그런 후 실온에서 30분~한시간 정도 말려주세요. 옆면을 만졌을때 단단하고 윗면을 만졌을때 탄탄하다고 느껴지면 다 마른겁니다. 150도로 예열된 오븐에서 12~15분 정도 구워주세요. 꼬끄 하나를 흔들어봤을때 움직이지 않으면 다 구워진거에요.오븐', 'image_url': 'https://recipe1.ezmember.co.kr/cache/recipe/2018/06/11/bd4a8871b33a768c9a8cc48bd55035651.jpg'}, {'step_number': 6, 'description': '복분자 버터크림을 만들어요. 실온에 두어 말랑한 버터를 부드럽게 풀고, 슈가파우더를 넣고 충분히 휩해주세요. 여기에 복분자 잼을 넣고 잘 섞어주세요.', 'image_url': 'https://recipe1.ezmember.co.kr/cache/recipe/2018/06/11/0f7d030ddf2cb6ab0e99031a1a0d26f01.jpg'}, {'step_number': 7, 'description': '짝을 맞춘 꼬끄 한쪽에 완성한 복분자 버터크림을 원형으로 짜 준뒤, 가운데에 복분자잼으로 채워주세요. 그런 후 다른 쪽의 꼬끄로 덮어 냉장실에서 하루나 이틀정도 숙성하면 완성.', 'image_url': 'https://recipe1.ezmember.co.kr/cache/recipe/2018/06/11/62edc58d338743840801c2b4433544ba1.jpg'}]"
168163,과자,간식,달걀/유제품,굽기,크리스마스에 아름답고 달달하게 시각과미각을 즐겁게 해주는 리스 머랭쿠키!!,리스머랭쿠키,https://recipe1.ezmember.co.kr/cache/recipe/2019/12/19/59904121a6b1cb291711c88b5f9690861.jpg,840,90분 이내,초급,3인분,"[('흰자', '70g'), ('설탕', '70g'), ('바닐라 익스트랙', '1t'), ('식용색소', '적당량')]","한번 먹으면 계속 먹게 되는 머랭쿠키, 그냥 먹어도 맛있지만 코코아 가루, 녹차가루 또는 오레오 분태,프레첼 등 올려서 구우면 더욱 더 2배로 맛있게 즐길수 있다. 재료도 간단하고, 누구나 쉽게 만들 수 있어서 Good!!","[{'step_number': 1, 'description': '재료 준비하기\n흰자 70g, 설탕(또는 슈가파우더)70g, 바닐라 익스트랙 1t, 식용색소(빨강,초록,갈색) \n도구\n휘핑기, 볼, 깍지(2번.68번 사용), 짤주머니, 주걱', 'image_url': 'https://recipe1.ezmember.co.kr/cache/recipe/2019/12/19/c92b41cda89a421109e2674be2f4e8701.jpg'}, {'step_number': 2, 'description': '볼에 흰자를 넣은뒤, 설탕을 3회정도 간격을 두고 머랭치기처음부터 많은 양의 설탕을 넣으면 입자가 굵어 머랭치기가 어려우니 3회정도 간격으로 설탕을 넣기\n슈가파우더를 사용하면 입자가 설탕보다 곱기 때문에 머랭치기 쉽다!!', 'image_url': 'https://recipe1.ezmember.co.kr/cache/recipe/2019/12/19/7bb8491ae85fe3169cf35053623e499b1.jpg'}, {'step_number': 3, 'description': '머랭이 어느정도 단단하게 휘핑이 되었으면 바닐라 익스택을 넣고 기포정리를 해준다. (바닐라 익스트랙 생략 가능.)', 'image_url': 'https://recipe1.ezmember.co.kr/cache/recipe/2019/12/19/86da27abd084eb643e83c7801c7b8b8e1.jpg'}, {'step_number': 4, 'description': '갈색(리스의 몸통 중심-원형)\n초록(잎사귀)\n빨강(리스의 꽃1.2)\n흰색(식용색소 사용No) (목화)\n머랭 비율은 갈색>초록>빨강=흰색', 'image_url': 'https://recipe1.ezmember.co.kr/cache/recipe/2019/12/19/6d6039cabdf890862ff27a9437284e811.jpg'}, {'step_number': 5, 'description': '머랭은 수분을 날리는 형식의 굽기로 부풀기가 없으므로 간격을 좁게 짜도 무관하다.\n다 짜면 예열된 오븐에 제일 낮은 온도 (90~100도)로 1시간정도 굽는다.오븐오랫동안 머랭을 만질경우 거품이 죽을 수 있다.', 'image_url': 'https://recipe1.ezmember.co.kr/cache/recipe/2019/12/19/696e18680f5632bedd7a0d95ec6539641.jpg'}]"
168164,과자,간식,달걀/유제품,굽기,고르곤졸라 치즈 스콘,고르곤졸라치즈스콘,https://recipe1.ezmember.co.kr/cache/recipe/2020/02/06/b91e8d3937023ac50d0f34d4d124b6431.jpg,"1,680",30분 이내,아무나,4인분,"[('박력분', '250g'), ('베이킹파우더', '7g'), ('고르곤졸라 치즈', '130g'), ('대파', '80g'), ('올리브오일', '50g'), ('트러플 소금', '2g'), ('비정제 설탕', '20g'), ('우유', '90g')]","고르곤졸라 치즈가 좀 남았고, 어떻게 사용해볼까 하다가 고르곤졸라 & 파 스콘 레시피를 발견~! 만들어 봤습니다. 레시피보다 고르곤졸라 치즈가 약간 덜 들어갔는데 고르곤졸라 치즈는 정말이지 티가 안날수가 없네요. 포장 열때부터 꼬릿한 향이 부엌 전체를 휘감더니 굽고나서는 오븐이며 오븐방에서 며칠동안 고르곤졸라 향을 느껴야 했답니다~ㅎㅎ 이렇게 질리게 꼬릿한 향을 맡고 난 후라 그 맛이 넘 궁금했는데 한입 물면 꼬릿한 고르곤졸라 향이 입안 가득~! 그리고 씹으면 알싸한 치즈향이 또 한번~! 저같은 치즈러버도 좀 호불호가 생길수 있겠구나 싶어요~ 고르곤졸라 치즈를 레시피보다 줄이거나 브리치즈나 다른 치즈와 함께 사용하는 것도 좋을듯 싶어요. 한꺼번에 다 먹을수는 없어서 냉동실에 얼려두었는데 전자레인지에 살짝 해동 후, 꿀을 뿌려 먹으니 또 신세계네요. 알싸한 고르곤졸라 치즈와 꿀과의 궁합은 정말이지 누가 발견했는지 참으로 엄지척입니다. 호불호가 갈릴수 있는 고르곤졸라 치즈 스콘~! 만들어 보아요~","[{'step_number': 1, 'description': '대파는 송송 썰어두고,', 'image_url': 'https://recipe1.ezmember.co.kr/cache/recipe/2020/02/06/b6ce226087b07ff0a98560dad60a1ee11.jpg'}, {'step_number': 2, 'description': '고르곤졸라 치즈는 손으로 적당한 크기로 잘라둡니다.', 'image_url': 'https://recipe1.ezmember.co.kr/cache/recipe/2020/02/06/2d30f70d836f3d8c393bb0f9bcc2f5f01.jpg'}, {'step_number': 3, 'description': '볼에 박력분, 베이킹파우더, 비정제 설탕은 체쳐 넣고, 소금도 넣어 거품기로 가볍게 섞어줍니다.', 'image_url': 'https://recipe1.ezmember.co.kr/cache/recipe/2020/02/06/1fb5c33d0a73e0e3d5f0b30e9531537d1.jpg'}, {'step_number': 4, 'description': '준비해둔 고르곤졸라 치즈를 넣고..', 'image_url': 'https://recipe1.ezmember.co.kr/cache/recipe/2020/02/06/e54dc30d5cab0590d65398cca57fa4411.jpg'}, {'step_number': 5, 'description': '고르곤졸라 치즈가 작은 크기가 되도록 스크래퍼로 잘라가며, 밀가루와 부슬하게 함께 섞어주세요.', 'image_url': 'https://recipe1.ezmember.co.kr/cache/recipe/2020/02/06/343e0834333cdbce3d97e0d96382faa71.jpg'}, {'step_number': 6, 'description': '여기에 대파를 넣고..', 'image_url': 'https://recipe1.ezmember.co.kr/cache/recipe/2020/02/06/53cd0eddc35a9276296c2475ca84b7e81.jpg'}, {'step_number': 7, 'description': '가볍게 섞어줍니다.', 'image_url': 'https://recipe1.ezmember.co.kr/cache/recipe/2020/02/06/7bc7d246832b9014a74a48fc191942b31.jpg'}, {'step_number': 8, 'description': '올리브오일과..', 'image_url': 'https://recipe1.ezmember.co.kr/cache/recipe/2020/02/06/93044a03050dc83fdd25167b8cba611e1.jpg'}, {'step_number': 9, 'description': '우유를 넣고..', 'image_url': 'https://recipe1.ezmember.co.kr/cache/recipe/2020/02/06/f8ad49c1123bcc091be2ec4974c93d081.jpg'}, {'step_number': 10, 'description': '가볍게 한덩어리로 만들어주세요.', 'image_url': 'https://recipe1.ezmember.co.kr/cache/recipe/2020/02/06/72a39f74e4e030b67a3c60a86a76edc51.jpg'}, {'step_number': 11, 'description': '한덩이로 만들어 반으로 잘라 살살 눌러가며 다시 한덩이로 만들고..', 'image_url': 'https://recipe1.ezmember.co.kr/cache/recipe/2020/02/06/be841adf8b1f5a971324e8ede115f71c1.jpg'}, {'step_number': 12, 'description': '다시한번 반으로 잘라 살짝 눌러 한덩어리로 만드는 과정을 두세번 해줍니다. 마지막으로 직사각형으로 모양을 잡은 후 8등분을 해주세요.', 'image_url': 'https://recipe1.ezmember.co.kr/cache/recipe/2020/02/06/2d2b8a01d414d91848acc247cf13b54d1.jpg'}, {'step_number': 13, 'description': '위에 우유을 살짝 바른 후,', 'image_url': 'https://recipe1.ezmember.co.kr/cache/recipe/2020/02/06/7ca7c55b1e72c4b76999003ec44830c51.jpg'}, {'step_number': 14, 'description': '180도로 예열된 오븐에서 25분 정도 구워주세요. 가운데를 만져봤을때 단단하면서도 탄력이 느껴지면 다 구워진거에요. 완성된 스콘은 식힘망에서 식히면 완성~! 오븐', 'image_url': 'https://recipe1.ezmember.co.kr/cache/recipe/2020/02/06/1b506f775c430a48a629a0ea7f939c7f1.jpg'}]"
168165,과자,간식,달걀/유제품,굽기,민초단 모여라! 민트크림샌드쿠키,샌드쿠키,https://recipe1.ezmember.co.kr/cache/recipe/2021/09/07/73ff51ff6ea7847784c0f86e851910711.jpg,"5,331",60분 이내,초급,6인분 이상,"[('무염버터', '100g'), ('슈가파우더', '55g'), ('소금', '1꼬집'), ('달걀', '25g'), ('박력분', '150g'), ('코코아파우더', '10g'), ('무염버터', '113g'), ('슈가파우더', '80g'), ('식용 민트 오일', '2~3방울'), ('민트 초콜릿', '7개'), ('식용색소', '약간')]","민초단 모여라!!
초코쿠키 사이에 민트버터크림을 듬뿍

버터크림에 민트초콜릿까지 넣어
민초단이라면 만족할만한 샌드쿠키 완성!

반민초단도 한번 드셔보시겠어요?","[{'step_number': 1, 'description': '볼에 버터를 넣고 고무주걱으로 부드럽게 푼다.볼 , 고무주걱', 'image_url': 'https://recipe1.ezmember.co.kr/cache/recipe/2021/09/03/8cb29866735d010a88bd7d4a35b783721.jpg'}, {'step_number': 2, 'description': '슈가파우더와 소금을 넣고 고무주걱으로 섞는다.고무주걱', 'image_url': 'https://recipe1.ezmember.co.kr/cache/recipe/2021/09/03/4f865cd5716177207459d1f7488ba68d1.jpg'}, {'step_number': 3, 'description': '달걀을 2~3회에 나누어 넣으면서 섞는다.', 'image_url': 'https://recipe1.ezmember.co.kr/cache/recipe/2021/09/03/ffbc80c308060b136bebd8031c5a7e921.jpg'}, {'step_number': 4, 'description': '체친 가루를 넣고 고무주걱으로 섞는다.고무주걱 \n\n                        \n                            휴바트 이지레스트 채반', 'image_url': 'https://recipe1.ezmember.co.kr/cache/recipe/2021/09/03/6df27034abe7e0e236274a95a6c81bda1.jpg'}, {'step_number': 5, 'description': '한덩어리가 된 반죽을 랩으로 싸 냉장고에 1시간 이상 휴지시킨다.랩', 'image_url': 'https://recipe1.ezmember.co.kr/cache/recipe/2021/09/03/b0abfdfdec53d69ff8765c4f0cd8a6d21.jpg'}, {'step_number': 6, 'description': '휴지시킨 반죽을 5mm 두께로 밀어편 후 원하는 모양으로 자른다.', 'image_url': 'https://recipe1.ezmember.co.kr/cache/recipe/2021/09/03/c0d7e7b3362fdb14c7b41ec09c374adf1.jpg'}, {'step_number': 7, 'description': '170도 오븐에 12~15분 구운 뒤 식힘망에 올려 식힌다.오븐', 'image_url': 'https://recipe1.ezmember.co.kr/cache/recipe/2021/09/03/95452083cbefb55a448f6d35fef563a41.jpg'}, {'step_number': 8, 'description': '[민트버터크림]\n민트초콜릿을 잘게 다진다.', 'image_url': 'https://recipe1.ezmember.co.kr/cache/recipe/2021/09/03/e24786a0972fa8b28533df634fdfce1e1.jpg'}, {'step_number': 9, 'description': '볼에 무염버터를 넣고 핸드믹서로 부드럽게 풀고 슈가파우더를 넣고 섞는다.핸드믹서 , 볼', 'image_url': 'https://recipe1.ezmember.co.kr/cache/recipe/2021/09/03/a2c9c662ce1db9e16d9313f45c1923ba1.jpg'}, {'step_number': 10, 'description': '식용색소와 식용 민트오일을 넣고 섞는다.', 'image_url': 'https://recipe1.ezmember.co.kr/cache/recipe/2021/09/03/bf0c1bde80472ee20b2eb342f22dda441.jpg'}, {'step_number': 11, 'description': '다진 민트초콜릿을 넣고 섞는다.', 'image_url': 'https://recipe1.ezmember.co.kr/cache/recipe/2021/09/03/155fe62864c2725bb080619beaa89dc31.jpg'}, {'step_number': 12, 'description': '식힌 쿠키에 민트크림을 짜서 샌드한다.', 'image_url': 'https://recipe1.ezmember.co.kr/cache/recipe/2021/09/03/f25b9ab811ee845cb51794b2ccd190ff1.jpg'}]"
168166,과자,간식,달걀/유제품,굽기,"밀가루 없는 흑임자 쿠키 만들기 :: 글루텐 프리, 노계란",흑임자쿠키,https://recipe1.ezmember.co.kr/cache/recipe/2021/06/02/27e60c39d95448625f634cc795b630591.jpg,"1,017",30분 이내,아무나,2인분,"[('실온 버터', '30g'), ('크림치즈', '25g'), ('비정제 설탕', '50g'), ('옥수수전분', '10g'), ('물', '15g'), ('바닐라 익스트랙', '1/2ts'), ('콩가루', '50g'), ('흑임자 가루', '50g'), ('베이킹 파우더', '2g'), ('베이킹 소다', '1g')]",흑임자 가루 소진하기에 힘쓰고 있는 요즘. 이번에는 밀가루를 넣지 않고 흑임자 가루와 콩가루만으로 만드는 흑임자 쿠키를 만들어 봤어요. 약간은 매트하지만 고소한 쿠키에요. 막 맛있는 맛은 아니지만 자꾸 끌리는 맛이랄까요. 적게 굽기도 했지만 금방 다 먹었던 쿠키에요. 고소한 맛의 좀 신박한 쿠키가 아닐까 싶어요. 고소한 흑임자 쿠키. 만들어 보아요~,"[{'step_number': 1, 'description': '먼저 옥수수 전분에 물을 넣어 잘 섞어줍니다. 바닐라 익스트랙도 넣어 잘 섞어주세요.', 'image_url': 'https://recipe1.ezmember.co.kr/cache/recipe/2021/06/02/3833d1f15654c8b5b181a49c53e5c5e61.jpg'}, {'step_number': 2, 'description': '실온의 버터와 실온의 크림치즈를 볼에 넣고 잘 푼 후, 비정제 설탕을 체쳐 넣고 거품기로 잘 섞어주세요.\n저는 굴러다니는 크림치즈가 있어서 넣어 주었는데요 없으시면 전량 버터를 사용하시면 됩니다.', 'image_url': 'https://recipe1.ezmember.co.kr/cache/recipe/2021/06/02/6ec5602b0b0792c73536cd5c26895a901.jpg'}, {'step_number': 3, 'description': '그런 후 만들어 두었던 옥수수 전분물을 조금씩 넣어 가며 잘 섞어줍니다. 옥수수 전분물 대신 계란 25 g 을 넣으셔도 됩니다.', 'image_url': 'https://recipe1.ezmember.co.kr/cache/recipe/2021/06/02/72c84ac2ca11d3f44ba90624273c8e241.jpg'}, {'step_number': 4, 'description': '완성된 버터 반죽에,', 'image_url': 'https://recipe1.ezmember.co.kr/cache/recipe/2021/06/02/ad3b52b98a7bf5a44f9a4d0e78742c571.jpg'}, {'step_number': 5, 'description': '흑임자 가루, 콩가루, 베이킹 파우더, 베이킹 소다를 체쳐 넣고, 주걱으로 가볍게 섞어줍니다. 콩가루는 설탕과 소금이 가미된 걸 사용했어요.', 'image_url': 'https://recipe1.ezmember.co.kr/cache/recipe/2021/06/02/bc566937e45f8a8822f90f38f0ca37841.jpg'}, {'step_number': 6, 'description': '완성된 반죽을..', 'image_url': 'https://recipe1.ezmember.co.kr/cache/recipe/2021/06/02/95757f640040517b7d79c3062ad0e3de1.jpg'}, {'step_number': 7, 'description': '스쿱으로 떠서 팬닝 한 후,', 'image_url': 'https://recipe1.ezmember.co.kr/cache/recipe/2021/06/02/9ab434f5699cfa2f1ef6493241758feb1.jpg'}, {'step_number': 8, 'description': '180도로 예열된 오븐에서 6분 정도 굽다가, 주걱으로 살짝 눌러 준 후, 6~8분 정도를 더 구워줍니다. 쿠키 주변이 노릇한 색이 들도록 구워주세요. 다 구워진 쿠키는, 팬채로 한김 식힌 후 식힘망으로 옮겨 완전히 식혀주세요. 오븐', 'image_url': 'https://recipe1.ezmember.co.kr/cache/recipe/2021/06/02/2ff7785eec2009bb28b9f3f79b8a69ad1.jpg'}]"
168167,과자,간식,달걀/유제품,굽기,홈베이킹 쿠키레시피! 뚱뚱한 초코칩쿠키 만드는 방법! 피넛초코칩쿠키 ♥,피넛초코칩쿠키,https://recipe1.ezmember.co.kr/cache/recipe/2021/06/04/09e3c7a7dbaa2ac826d32004ffaaad7f1.jpg,"5,664",90분 이내,초급,6인분 이상,"[('무염버터', '180g'), ('황설탕', '70g'), ('소금', '1꼬집'), ('달걀', '100g'), ('바닐라익스트랙', '1t'), ('땅콩버터', '170g'), ('박력분', '150g'), ('베이킹파우더', '1t'), ('베이킹소다', '1/2t'), ('다진 초콜릿', '150g')]","사 먹었던 비주얼의 뚱뚱이 초코칩쿠키! 
피넛버터를 넣어 촉촉한 듯 찐한 맛의 쿠키레시피! 
집에서도 만들 수 있는 레시피로 

뚱뚱이 초코칩 맛있게 베이킹하세요! 

세상의모든레시피 만개의레시피","[{'step_number': 1, 'description': '볼에 무염버터, 황설탕, 소금을 넣고 핸드믹서로 섞는다.핸드믹서 , 볼', 'image_url': 'https://recipe1.ezmember.co.kr/cache/recipe/2021/06/04/6dfc00d73fd47a722935cb28596f63b51.jpg'}, {'step_number': 2, 'description': '달걀과 바닐라익스트랙을 섞은 후 2~3회에 나누어 넣으면서 섞는다.', 'image_url': 'https://recipe1.ezmember.co.kr/cache/recipe/2021/06/04/d61eba64e3d52149b75ed9db6c7bf56f1.jpg'}, {'step_number': 3, 'description': '땅콩버터를 넣고 섞은 후 박력분, 베이킹파우더, 베이킹소다를 체쳐 넣고 실리콘주걱으로 섞는다.실리콘주걱', 'image_url': 'https://recipe1.ezmember.co.kr/cache/recipe/2021/06/04/18342be6a460646627e2e1fe029c0cfb1.jpg'}, {'step_number': 4, 'description': '다진 초콜릿을 넣고 섞은 후 아이스크림 스쿱이나 스푼으로 반죽을 적당한 크기로 나눈다.스쿱', 'image_url': 'https://recipe1.ezmember.co.kr/cache/recipe/2021/06/04/44ca3fe49f17e85895f7d25227aca75f1.jpg'}, {'step_number': 5, 'description': '랩을 덮어 냉장고에 30~1시간 정도 휴지시킨 후 175도로 예열한 오븐에 넣고 13~15분 정도 굽는다.오븐 , 랩', 'image_url': 'https://recipe1.ezmember.co.kr/cache/recipe/2021/06/04/dd86d6818d91934f4d7b8e98a578e2141.jpg'}, {'step_number': 6, 'description': '구워진 쿠키는 식힘망에서 식혀 완성한다.', 'image_url': 'https://recipe1.ezmember.co.kr/cache/recipe/2021/06/04/a0fcc1218687e0391ff7f41c066f29dd1.jpg'}]"
168168,과자,간식,달걀/유제품,굽기,레몬 사워크림 쿠키,레몬사워크림쿠키,https://recipe1.ezmember.co.kr/cache/recipe/2021/04/19/d52f9ff250175b35fb6d3b670ff0ec7b1.jpg,"1,269",30분 이내,아무나,3인분,"[('사워크림', '60g'), ('박력분', '70g'), ('베이킹 소다', '1/4ts'), ('소금', '1꼬집'), ('버터', '40g'), ('설탕', '45g'), ('레몬제스트 레몬', '1개분'), ('바닐라 익스트랙', '1/2ts'), ('레몬 익스트랙', '1/4ts'), ('레몬즙', '1ts')]","사워크림이 약간 남아서 만들어 본 쿠키에요. 레몬이 들어가 향긋하면서도 폭신한 쿠키입니다. 갓구워 먹으면 바삭하면서도 촉촉, 상큼해서 앉은 자리에서 몇개는 먹겠더라고요. 만들기도 많이 어렵지 않은 쿠키에요. 사워크림이 남았다면 레몬 더해서 만들어 보시길..사워크림이 들어가는 레몬 쿠키~! 만들어 보아요~","[{'step_number': 1, 'description': '실온에 두어 말랑 버터를 부드럽게 풀고, 설탕과 소금을 넣어 충분히 섞어줍니다.', 'image_url': 'https://recipe1.ezmember.co.kr/cache/recipe/2021/04/19/0f0971ffe2a22cae9d2610b9e481d8c41.jpg'}, {'step_number': 2, 'description': '여기에 레몬즙, 레몬 익스트랙, 바닐라 익스트랙을 넣어 잘 섞어주세요. 레몬즙, 레몬 익스트랙은 생략 가능해요.', 'image_url': 'https://recipe1.ezmember.co.kr/cache/recipe/2021/04/19/c77e92c6581fa0519b80ee0ce2a40cf71.jpg'}, {'step_number': 3, 'description': '레몬제스트와 사워크림을 넣고 잘 섞어주세요.', 'image_url': 'https://recipe1.ezmember.co.kr/cache/recipe/2021/04/19/a57ccb74c3c016c66850a550c3b6ee171.jpg'}, {'step_number': 4, 'description': '베이킹 소다와 박력분을 체쳐 넣고 주걱으로 섞어줍니다.', 'image_url': 'https://recipe1.ezmember.co.kr/cache/recipe/2021/04/19/c187f2cae0f964ec162db7775d3137ab1.jpg'}, {'step_number': 5, 'description': '완성된 반죽은..', 'image_url': 'https://recipe1.ezmember.co.kr/cache/recipe/2021/04/19/74f788a714e354c6608b50eb16dd9e6b1.jpg'}, {'step_number': 6, 'description': '스쿱으로 떠서 팬닝해주세요.175도로 예열된 오븐에서 12~14분 정도 가장자리가 노릇해지도록 구워줍니다. 완성된 쿠키는 팬채로 5분 정도 두었다가 식힘망으로 옮겨 완전히 식혀주세요.오븐', 'image_url': 'https://recipe1.ezmember.co.kr/cache/recipe/2021/04/19/526c855ee91b9a1a19551e8ed49226cd1.jpg'}]"
168169,과자,간식,달걀/유제품,굽기,슈반죽으로 만든 프랑스과자 슈게트 ♥,슈게트,https://recipe1.ezmember.co.kr/cache/recipe/2021/04/23/edc909ce9c3967a1cca00f8298a1cdf31.jpg,"3,372",60분 이내,초급,6인분 이상,"[('우유', '50g'), ('물', '50g'), ('버터', '50g'), ('소금', '1꼬집'), ('박력분', '80g'), ('달걀', '130g'), ('우박 설탕', '적당량'), ('치즈가루', '적당량')]","마담프루스트의 비밀정원에서 나온 
슈게트! 
우박설탕이 콕콕 박혀있고 
배어물면 안이 텅! 비어있어요! 
슈반죽으로 만든 슈게트로 
맛있는 베이킹하세요 ♥

세상의모든레시피 만개의레시피","[{'step_number': 1, 'description': '냄비에 우유, 물, 버터, 소금을 넣고 끓인다.냄비', 'image_url': 'https://recipe1.ezmember.co.kr/cache/recipe/2021/04/23/8c1fac73b7daefd2a4eda2be244867b51.jpg'}, {'step_number': 2, 'description': '액체가 끓어오르면 불을 끄고 체친 가루를 넣고 빠르게 섞는다.', 'image_url': 'https://recipe1.ezmember.co.kr/cache/recipe/2021/04/23/5c097bac1c8c6927b676e363c17b14121.jpg'}, {'step_number': 3, 'description': '가루가 완전히 섞이면 다시 중약불에서 주걱으로 반죽을 계속 저으면서 냄비 바닥에 얇은 막이 생길 때 까지 가열한다.주걱', 'image_url': 'https://recipe1.ezmember.co.kr/cache/recipe/2021/04/23/e7a64c2cb7f79b28491cd0d1e1fbbcf71.jpg'}, {'step_number': 4, 'description': '반죽을 볼에 옮기고 풀어둔 달걀을 조금씩 넣으면서 섞는다.앞서 넣은 달걀이 다 섞이면 다음 달걀을 넣고 섞는다.볼주걱으로 반죽을 들었을 때 매끄러운 삼각형을 만들며 떨어지면 완성이에요. 반죽의 되기를 보면서 달걀양을 조절해주세요.', 'image_url': 'https://recipe1.ezmember.co.kr/cache/recipe/2021/04/23/743f52e7b1522d2c23eb7dcab5c85b211.jpg'}, {'step_number': 5, 'description': '반죽을 짤주머니에 넣고 테프론시트를 깐 팬에 500원 동전크기 정도로 짠다.짤주머니 , 팬', 'image_url': 'https://recipe1.ezmember.co.kr/cache/recipe/2021/04/23/c74f729ec1da7d5d131e797f470ccd921.jpg'}, {'step_number': 6, 'description': '물스프레이로 물을 골고루 분무하고 우박 설탕 또는 치즈가루를 뿌린다.', 'image_url': 'https://recipe1.ezmember.co.kr/cache/recipe/2021/04/23/1c98807c1632e9d16474fe4c506b5ad71.jpg'}, {'step_number': 7, 'description': '190도 오븐에 넣고 10분 굽고 170도로 온도를 내려 20분 굽는다.오븐굽는 중간에 오븐 문을 열면 슈가 부풀지 않고 꺼지게 되니 주의하세요!', 'image_url': 'https://recipe1.ezmember.co.kr/cache/recipe/2021/04/23/f2522138e18cf3b55b390292cd834ba71.jpg'}]"
