index,종류별,상황별,재료별,방법별,글 제목,레시피이름,레시피이미지,조회수,조리시간,난이도,인분,재료,소개글,조리순서
50552,국/탕,영양식,닭고기,끓이기,닭곰탕,닭곰탕,https://recipe1.ezmember.co.kr/cache/recipe/2015/05/30/2d68ea9b6d5cb9411b02f8037c3185bf1.jpg,"24,606",2시간 이상,중급,2인분,"[('영계', '1마리'), ('생강', ''), ('마늘', ''), ('통후추', ''), ('월계수잎', ''), ('대파', ''), ('다진마늘', ''), ('후추', ''), ('소금', '')]",몸의 활기를 불어 넣어주는 뜨끈한 닭곰탕이에요.,"[{'step_number': 1, 'description': '크기가 작은 영계 두 마리....4인 가족이면 요 두마리 다 하시는게 국물도 진하고 더 맛나요. 목과 엉덩이 근처의 기름을 제거해 주고 날개 끝도 잘라서 다듬어줘요.', 'image_url': 'https://recipe1.ezmember.co.kr/cache/recipe/2015/06/03/ac0fc96e29976405f291db92e07056b51.JPG'}, {'step_number': 2, 'description': '말끔한 국물을 위해 여기저시 숨어있는 지방을 잘라내줬어요.', 'image_url': 'https://recipe1.ezmember.co.kr/cache/recipe/2015/06/03/47136ae1d0182ca09e639ece74347adf1.JPG'}, {'step_number': 3, 'description': '물을 닭이 잠길 만큼 잡아주고 닭 한 마리 입수~~~ 냄새 제거를 위해 통후와 생강, 월계수 잎을 몇 장 넣어줘요. 이러면 준빈 다 된거에요.', 'image_url': 'https://recipe1.ezmember.co.kr/cache/recipe/2015/06/03/c4ec05671e55f0e0d3c50a01724584cb1.JPG'}, {'step_number': 4, 'description': '그저 시간이 맛을 더해주길....닭살이 절로 다 떨어질만큼 푹 삶아주는게 닭곰탕의 묘미에요. 약불에서 2시간 정도 끓였어요.', 'image_url': 'https://recipe1.ezmember.co.kr/cache/recipe/2015/06/03/13a399e28dd2773c0d9fd57177fb93d21.JPG'}, {'step_number': 5, 'description': '닭은 건져서 살만 발라내요.', 'image_url': 'https://recipe1.ezmember.co.kr/cache/recipe/2015/06/03/6661b3d6057e2983e0ca50289c265c871.JPG'}, {'step_number': 6, 'description': '닭냄새를 잡아줄 대파를 듬뿍 넣어요. 다진 마늘도 넣구 후추도 넣구 소금으로 간하고. 한소큼 부르르 끓인 후 밥 말아 먹으면 좋아요.', 'image_url': 'https://recipe1.ezmember.co.kr/cache/recipe/2015/06/03/0ca66214b32e6ee7920baf43be24abf21.JPG'}]"
50553,국/탕,영양식,닭고기,끓이기,삼계탕 만들기,삼계탕,https://recipe1.ezmember.co.kr/cache/recipe/2015/05/01/34c99ae8c50e38caa7425542cd7e1b1a1.jpg,"192,448",120분 이내,초급,2인분,"[('닭                                                                                삼계탕용', '2마리'), ('찹쌀', '1~1.5컵'), ('황기', '40g'), ('당귀', '5g'), ('엄나무', '5g'), ('헛개나무', '10g'), ('오가피', '15g'), ('대추', '20g'), ('마늘', '10톨')]","요즘같은 컨디션에, 삼계탕을 먹었으면 좋았을텐데요. 봄의 시작 무렵에 먹었던 삼계탕이예요. 삼계탕은 끓이기만 하면 되니깐 ~ 의외로 간단하고 쉽죠? 대신 시간이 조금 오래 걸리는 게 단점이네요.","[{'step_number': 1, 'description': '깊은 냄비에 물 5리터와 위의 재료를 넣고 1시간 끓여 줍니다. 망을 활용 하셔도 좋아요.', 'image_url': 'https://recipe1.ezmember.co.kr/cache/recipe/2015/05/04/2c1b3fd3cdb66cae8cfe7c3924f1f92e1.jpg'}, {'step_number': 2, 'description': '찹쌀은 1시간 정도 불려 주었어요.', 'image_url': 'https://recipe1.ezmember.co.kr/cache/recipe/2015/05/04/569702258397dce757dc19a76e7f6a101.jpg'}, {'step_number': 3, 'description': '닭은 속을 깨끗히 씻어서 차가운 물에 30분 이상 담궈두어 준비 하세요. 닭은 꽁지를 잘라 내고 대추, 찹쌀, 마늘. 순서대로 속을 채워 넣으시고요~', 'image_url': 'https://recipe1.ezmember.co.kr/cache/recipe/2015/05/04/d7043da857d1296f6901163e2ce74afd1.jpg'}, {'step_number': 4, 'description': '다리에 칼집을 내어 꼬아 주세요.(뱃속을 너무 심하게 가득 채우실 필요는 없답니다!!)', 'image_url': 'https://recipe1.ezmember.co.kr/cache/recipe/2015/05/04/50966613d5d5311cd01bb27b870107e21.jpg'}, {'step_number': 5, 'description': '황기, 당귀등 미리 끓여 두었던 물에 손질한 닭, 양파1조각, 대추 서너개를 넣고 1시간 ~ 1시간 30분 정도 푹 삶아 주세요. 중간에 뜨는 거품은 제거 해주시면 됩니다.', 'image_url': 'https://recipe1.ezmember.co.kr/cache/recipe/2015/05/04/b796479cbf1de65b4e5b2b5dc4705ba41.jpg'}]"
50554,국/탕,영양식,닭고기,끓이기,더위를 이기는 보양식 닭백숙과 닭죽,닭백숙,https://recipe1.ezmember.co.kr/cache/recipe/2015/06/22/d8ad15ef18a7cd8bd1bb0835c516ed00.jpg,"96,427",120분 이내,고급,2인분,"[('중닭', '1마리'), ('마늘', '5톨'), ('시판한약재', '1봉지'), ('은행', '3~4알'), ('양파', '1개'), ('소금', ''), ('후춧가루', ''), ('검은깨', ''), ('통깨', ''), ('애호박', '1/2개'), ('당근', '1/3개')]",닭백숙 끓여 닭고기도 먹고 국물로 닭죽도 끓여 먹으니 속도 든든하니 아주 맛있더라구요 ~,"[{'step_number': 1, 'description': '팔팔끓는 물에 닭을 한번 살짝 삶아내고 한약재를 넣고 끓여주게 됩니다... 미리 끓여내면 닭기름기도 좀 제거가 되고요...', 'image_url': 'https://recipe1.ezmember.co.kr/cache/recipe/2015/06/22/80a09571d6b299551208a605be355f691.jpg'}, {'step_number': 2, 'description': '그리고 닭이잠길만큼의 물을 붓고 센불 - 중간불로 이어가며 푹...끓여 줍니다...', 'image_url': 'https://recipe1.ezmember.co.kr/cache/recipe/2015/06/22/eb3b945f46792b5e5f8b24390ae4aab01.jpg'}, {'step_number': 3, 'description': '육질은 부드럽게 푹...과졌고..국물도 구수하니 향긋한 한약재 냄새 폴폴 풍기며 제대로 과진것 같습니다...', 'image_url': 'https://recipe1.ezmember.co.kr/cache/recipe/2015/06/22/b0fa15726aa8484002de75428d18e1f31.jpg'}, {'step_number': 4, 'description': '닭육수를 팔팔 끓여 불린쌀을 넣고 고루 저어가면서 끓여 줍니다', 'image_url': 'https://recipe1.ezmember.co.kr/cache/recipe/2015/06/22/560a1692b02293aebd1d6f7498bb30991.jpg'}, {'step_number': 5, 'description': '보글보글 맛있게 끓고 있지요...?', 'image_url': 'https://recipe1.ezmember.co.kr/cache/recipe/2015/06/22/a1bdf654bc122eaff8ad95bf5d1805d21.jpg'}, {'step_number': 6, 'description': '야채도 커터기에 샤샥 ~ 갈아서 넣고요..', 'image_url': 'https://recipe1.ezmember.co.kr/cache/recipe/2015/06/22/b0004c79d477012cd8a7df9a7de024f61.jpg'}, {'step_number': 7, 'description': '당근부터 넣고 끓이다 당근이 어느정도 익으면 양파와 호박을 넣고 계속 저어가면서 약불에서 끓여 줍니다', 'image_url': 'https://recipe1.ezmember.co.kr/cache/recipe/2015/06/22/4e754854980b8758b1ff3c369f0ba4a91.jpg'}, {'step_number': 8, 'description': '그렇게 해서 완성된 맛있는 닭죽 이랍니다....', 'image_url': 'https://recipe1.ezmember.co.kr/cache/recipe/2015/06/22/797544001ef4c69f385006710d19334d1.jpg'}]"
50555,국/탕,영양식,닭고기,끓이기,매콤한 닭봉 볶음탕,None,https://recipe1.ezmember.co.kr/cache/recipe/2015/06/08/c10557dd2372e96bbda3db7c9edf30d7.jpg,"6,598",60분 이내,초급,4인분,"[('닭봉', '500g'), ('가래떡', '1개'), ('대파', '1대'), ('당근', '1토막'), ('감자', '1개'), ('새송이버섯', '1개'), ('청고추', '1개'), ('홍고추', '1개'), ('닭육수', '4컵'), ('양파간것', '1개'), ('고추가루', '5큰술'), ('매실청', '2큰술'), ('진간장', '3큰술'), ('닭육수', '1큰술'), ('물엿', '1큰술'), ('다진마늘', '1.5큰술'), ('다진생강', '3/4큰술'), ('소금', '0.5큰술')]",매콤한 닭봉 볶음탕 보양식으로 가족들 건강을 챙겨주렵니다. 매콤한걸 먹으면 정신건강에도 도움이 되는거 같더라구요.,"[{'step_number': 1, 'description': '닭봉은 끓는물에 살짝 데치세요.', 'image_url': 'https://recipe1.ezmember.co.kr/cache/recipe/2015/08/10/95bea6441fcb8cdc5de7e2cc625720cb1.jpg'}, {'step_number': 2, 'description': '준비한 재료들은 취향대로 잘라서 준비해 놓구요. 양파, 마늘, 생강을 갈아서 닭봉과 가래떡에 붓고 잠시 재워두세요.', 'image_url': 'https://recipe1.ezmember.co.kr/cache/recipe/2015/08/10/71265e05dc29e859275713261f9149b41.jpg'}, {'step_number': 3, 'description': '분량의 양념재료들을 골고루 잘 섞어서 양념장을 만들어 두세요.', 'image_url': 'https://recipe1.ezmember.co.kr/cache/recipe/2015/08/10/c0f7c324b0efc7f3bf781e5c0be1f4641.jpg'}, {'step_number': 4, 'description': '닭 육수에 닭과 함께 양념장을 넣고 끓이세요.', 'image_url': 'https://recipe1.ezmember.co.kr/cache/recipe/2015/08/10/896956d7fa59f43bddf135eac144698f1.jpg'}, {'step_number': 5, 'description': '감자, 고추, 새송이 버섯도 넣구 당근 꽃도 넣구요. 아.. 그리고 당근꽃 만들고 자투리들이 생기지요. 양파 갈때 같이 갈아주면 되요~', 'image_url': 'https://recipe1.ezmember.co.kr/cache/recipe/2015/08/10/e9a2e494c2b46cc12e03da3c1ce8d6d81.jpg'}]"
50556,국/탕,영양식,닭고기,끓이기,초보도 쉽게 만드는 보양식 부추삼계탕,부추삼계탕,https://recipe1.ezmember.co.kr/cache/recipe/2020/11/16/54a71431670266addce73256541301761.jpg,"6,956",60분 이내,아무나,1인분,"[('닭', '1마리'), ('백숙한방재료', '1봉지'), ('부추', ''), ('대추', '4알'), ('마늘', '7알')]",쌀쌀한 날씨에 보양식으로 끓여봤어요.,"[{'step_number': 1, 'description': '손질해준 닭을 물에 한번 씻어주세요.핏기가 남아있으면 끓였을때 냄새가 날 수 있으니 한번 씻어주는게 좋아요.', 'image_url': 'https://recipe1.ezmember.co.kr/cache/recipe/2020/11/16/71623e1698c4b1084dd0b096af1e582e1.jpg'}, {'step_number': 2, 'description': '잘 씻은 닭한마리,백숙한방재료,마늘,대추를 큰 냄비에 넣고 \n재료가 잠길정도의 물을 넣어주세요.', 'image_url': 'https://recipe1.ezmember.co.kr/cache/recipe/2020/11/16/98a799e1be3982abe40d89ed0a3884921.jpg'}, {'step_number': 3, 'description': '강불로 20~30분정도 푹 끓인 후 백숙한방재료는 빼주세요.', 'image_url': 'https://recipe1.ezmember.co.kr/cache/recipe/2020/11/16/d8e3aaea4df0e781b59739c41290b3fb1.jpg'}, {'step_number': 4, 'description': '잘씻은 부추를 국물에 잠깐 데친다는 생각으로 담궈주세요.', 'image_url': 'https://recipe1.ezmember.co.kr/cache/recipe/2020/11/16/9107172c0708a12a4e71867256515ffa1.jpg'}, {'step_number': 5, 'description': '그릇에 닭 먼저 꺼내고 국물도 넉넉히 담고 그 위에 부추를 올려주면 부추삼계탕 완성!!!', 'image_url': 'https://recipe1.ezmember.co.kr/cache/recipe/2020/11/16/6c240e7a2acc302aec3ce48d61afd5981.jpg'}]"
50557,국/탕,영양식,닭고기,끓이기,보양식 닭백숙 간단하게 끓이는법,닭백숙,https://recipe1.ezmember.co.kr/cache/recipe/2021/03/08/4b9f37dbe85fc54343b03389574d1fa81.jpg,"4,019",60분 이내,아무나,2인분,"[('중간닭', '2마리'), ('마늘', '10알'), ('대추', '8알'), ('대파', '1개'), ('양파', '1/2개'), ('월계수잎', '2장'), ('파뿌리', '')]",보양식 닭백숙 끓여 볼께요.,"[{'step_number': 1, 'description': '초초 간단한 닭백숙 만들기.삼계탕 끓이는법 소개 해 드릴께요.\n정말 들어가는 것 별로 없이 끓이기만 하면 된답니다.', 'image_url': 'https://recipe1.ezmember.co.kr/cache/recipe/2021/03/08/bed3e30b0c2fbc5d89b2f5f473a86b8b1.jpg'}, {'step_number': 2, 'description': '불필요한 부분을 잘라내고', 'image_url': 'https://recipe1.ezmember.co.kr/cache/recipe/2021/03/08/3a7a5a829af694461cd7c17d9d550f041.jpg'}, {'step_number': 3, 'description': '을 세척해 주세요.', 'image_url': 'https://recipe1.ezmember.co.kr/cache/recipe/2021/03/08/e1feebc77bc587d3994f2fb18927a4321.jpg'}, {'step_number': 4, 'description': '그리고 닭을 솥에 담고 푹 잠길 정도로 물을 넣어 주세요.', 'image_url': 'https://recipe1.ezmember.co.kr/cache/recipe/2021/03/08/4e82e77b8c3b3332f11bcae734cf8f021.jpg'}, {'step_number': 5, 'description': '그리고 마늘10알.대추8알.대파1개.양파 반개.월계수잎2장.파뿌리를\n다시팩에 넣어서 끓여 주시면 되세요.', 'image_url': 'https://recipe1.ezmember.co.kr/cache/recipe/2021/03/08/a5c53956c2ef33350b4f3c6fb78f119e1.jpg'}, {'step_number': 6, 'description': '우선 닭을 재료를 넣고 뚜껑을 닫고 강불로 끓이시다가\n푸르르 끓어 오르면 중불로 줄이시고 30-35분 가량 끓여 주시면 되세요.\n닭백숙 만드는법 시간은 요정도면 되더라구요.', 'image_url': 'https://recipe1.ezmember.co.kr/cache/recipe/2021/03/08/69768e5297cdd40a8da1e3a817e247641.jpg'}, {'step_number': 7, 'description': '막 끓어 오르기 시작하면 위에 떠오르는 거품들은 제거를 해 주세요.', 'image_url': 'https://recipe1.ezmember.co.kr/cache/recipe/2021/03/08/b583da011622f31c216993093079cc0b1.jpg'}, {'step_number': 8, 'description': '그럼 여름.겨울철 보양식 닭백숙 완성이네요\n국물이 개운하고 시원해용', 'image_url': 'https://recipe1.ezmember.co.kr/cache/recipe/2021/03/08/6749c66bec7fbe194e9513b7ed90b4bc1.jpg'}]"
50558,국/탕,영양식,닭고기,끓이기,삼계탕,삼계탕,https://recipe1.ezmember.co.kr/cache/recipe/2015/07/09/84810c1f55fbe883798b87f4822dbec7.jpg,"54,941",60분 이내,초급,3인분,"[('영계', '3마리'), ('생수', '3L'), ('황기', '4뿌리'), ('대추', '10개'), ('마늘', '10톨'), ('은행', '약간'), ('대파뿌리', '2개'), ('생강', '1톨'), ('건표고버섯', '2개')]",쉽게 만드는 영양 만점 삼계탕 레시피를 소개합니다!,"[{'step_number': 1, 'description': '닭은 기름기를 잘 씻어서 준비하고 같이 넣고 끓일 재료들을 준비해주세요.', 'image_url': 'https://recipe1.ezmember.co.kr/cache/recipe/2015/07/09/5f677b4469a876a330e63ed92f8342771.jpg'}, {'step_number': 2, 'description': '큰 냄비에 생수3L부어주고 모든 재료 넣고 팔팔 끓여줍니다.', 'image_url': 'https://recipe1.ezmember.co.kr/cache/recipe/2015/07/09/138962d3e9c7eafa3baaeb690af9e4471.jpg'}, {'step_number': 3, 'description': '닭이 2/3가량 익어갈때 굵은소금 넣어서 살짝 간을 미리 해줍니다. 둥둥뜨는 기름 살짝 제거해주면서 오래도록 뭉근히 끓여내주면 완성~', 'image_url': 'https://recipe1.ezmember.co.kr/cache/recipe/2015/07/09/6a650f464d4c55d7a74a1259111a14191.jpg'}]"
50559,국/탕,영양식,닭고기,끓이기,초계탕만들기 더위는 초계탕으로 날리세요.,초계탕,https://recipe1.ezmember.co.kr/cache/recipe/2017/07/28/3c4243882f7c9977e8ada7481401b50d1.jpg,"22,787",90분 이내,중급,4인분,"[('닭 9호', '1마리'), ('양파', '1개'), ('청오이', '1개'), ('파프리카', '1개'), ('양배추', '1줌'), ('적채', '1줌'), ('소금', '약간'), ('후추', '약간'), ('통마늘', '1/2줌'), ('대파', '1/2뿌리'), ('통후추', '약간'), ('소주', '약간'), ('냉면사리', '약간'), ('겨자분', '약간'), ('국간장', '1Ts'), ('소금', '약간'), ('설탕', '5Ts'), ('식초', '5Ts'), ('겨자', '약간')]","이제 더위도 막바지로 믿어야 할지 모르는 초복,중복을 지나 말복만 남았어요. 초복때 해먹었는데 가족들이 너무나 좋아했다는 그럼 만드는법 나가요.","[{'step_number': 1, 'description': '닭은 내장을 손질하고 꼬리부분살을 떼어내고 통마늘 통후추 소주 대파를 넣고 육수를 우리세요.', 'image_url': 'https://recipe1.ezmember.co.kr/cache/recipe/2017/07/28/aa527b996a895b2f7e2acdc6abbb0a231.jpg'}, {'step_number': 2, 'description': '끓기 시작하면 젓가락으로 푹푹 찍어서 기름을 빼주세요.', 'image_url': 'https://recipe1.ezmember.co.kr/cache/recipe/2017/07/28/804b2ed0a1eb1db9f47c2aabb3b72f811.jpg'}, {'step_number': 3, 'description': '중불로 줄여서 닭이 다 익고 뽀얗게 되면 닭을 건지세요.', 'image_url': 'https://recipe1.ezmember.co.kr/cache/recipe/2017/07/28/86640fa6efec76fc3c6b352d76d76e331.jpg'}, {'step_number': 4, 'description': '닭껍질은 벗겨주세요.\n육수는 걸러서 국간장으로 색을 내고 소금으로 간을 하고 설탕5:식초5을 넣고 간을 해주세요.\n육수는 냉동실이나 차가운곳에 넣고 보관해주세요', 'image_url': 'https://recipe1.ezmember.co.kr/cache/recipe/2017/07/28/fbc70e8a92672d246a1581925cb5a5171.jpg'}, {'step_number': 5, 'description': '닭은 껍질을 벗긴후 잘게 찢어주세요. 찢은 고기는 소금후추로 간을 해주세요.', 'image_url': 'https://recipe1.ezmember.co.kr/cache/recipe/2017/07/28/b61d20a1cbe38054a4908c6a51fc7ae31.jpg'}, {'step_number': 6, 'description': '청오이는 어슷썰기로 해서 소금약간과 설탕 식초를 동량으로 단촛물을 만들어(3:3) 절여주세요.', 'image_url': 'https://recipe1.ezmember.co.kr/cache/recipe/2017/07/28/bbe93a634b76076c2f4f0f1130729e2f1.jpg'}, {'step_number': 7, 'description': '절인 오이는 물기를 짜주세요.\n파프리카는 길게 썰어주세요.\n양패추와 적채는 가늘게 채썰고 양파도 가늘게 채썰어주세요.\n차가운 물에 담가 아삭하게 해주세요.\n이제 접시에 보기좋게 둘러담고 가운데 양념한 고기를 올리세요.', 'image_url': 'https://recipe1.ezmember.co.kr/cache/recipe/2017/07/28/33b8e461ad0830780b0d6a10460606461.jpg'}, {'step_number': 8, 'description': '차가 식혀둔 육수는 기름을 거르고 숙성시킨 겨자를 넣어 주세요.없으면 연겨자를 쓰셔도 무관\n이제 얼음동동 띄워서 드시면 완성이에요.', 'image_url': 'https://recipe1.ezmember.co.kr/cache/recipe/2017/07/28/408614a64be93a77083430b63f0308201.jpg'}, {'step_number': 9, 'description': '다 드시고 난다음 냉면사리를 삶아 드셔도 좋아요.', 'image_url': 'https://recipe1.ezmember.co.kr/cache/recipe/2017/07/28/7249f510b6fa10ca88dacee9f8ece1021.jpg'}]"
50560,국/탕,영양식,닭고기,끓이기,묵은지 닭볶음탕,None,https://recipe1.ezmember.co.kr/cache/recipe/2018/05/24/89f8e317754e4a2f1f6c7e97055fd2a01.jpg,"7,797",60분 이내,중급,3인분,"[('닭고기 닭볶음탕용', '1마리'), ('양파', '1/2개'), ('감자                                                                                핵주먹만한거', '1개'), ('고구마', '1개'), ('팽이버섯', '1줌'), ('묵은지', '1/4쪽'), ('다시마 등 육수용 재료                                                                                취향에 따라', '1팩'), ('생강가루', '1t'), ('쌀뜬 물', '1L'), ('대파', '2/3개'), ('간장', '1.5T'), ('설탕', '1T'), ('고추장', '2T'), ('고춧가루', '2t'), ('다진마늘', '1t'), ('물', '120ml')]","입맛없지만, 잘 챙겨먹어야하는 임신9개월 예비맘ㅋㅋ스스로 해먹었지만ㅋㅋ 밥 두공기 부르는 닭볶음탕 입니다ㅋㅋ자화자찬","[{'step_number': 1, 'description': '닭고기는 찬물로 한 번 씻어주세요.(지저분한 것, 기름 기 제거)', 'image_url': 'https://recipe1.ezmember.co.kr/cache/recipe/2018/05/24/0d85f2e7c7b9fcd7e8e76431392f16ab1.jpg'}, {'step_number': 2, 'description': '씻은 닭고기에 쌀뜬 물 가득 넣고,\n생강가루 1티스푼(1t) 넣고, 팔팔 끓으면 찬물로 행궈주세요', 'image_url': 'https://recipe1.ezmember.co.kr/cache/recipe/2018/05/24/c519c97ec6a768ab5a56fd714ba867831.jpg'}, {'step_number': 3, 'description': '그 사이 다시마 3장, 국물용 멸치 8마리, 대파(위쪽으로 1/3)등으로 육수를 1L 끓여주세요. (센불로 끓이다가 팔팔 끓으면 중약불로 10~15분)', 'image_url': 'https://recipe1.ezmember.co.kr/cache/recipe/2018/05/24/e7be37c4658f274a66690ff6ce1f33871.jpg'}, {'step_number': 4, 'description': '2번에서 끓이고(데치는 정도), 찬물로 씻은 닭에 양념장(양념재료 모두를 섞고, 정량의 물을 넣어 섞어주세요.)을 묻혀서 재어 주세요.', 'image_url': 'https://recipe1.ezmember.co.kr/cache/recipe/2018/05/24/94eef174b9e74fc1c1c6d8c747b675dc1.jpg'}, {'step_number': 5, 'description': '육수 내는 동안, 준비한 감자, 고구마를 납작하게!\n양파를 깍둑썰고!\n팽이버섯 한 줌을 송송! 썰어주세요.(팽이버섯이 익으면 단맛이 나서 좋아요. 그치만 없으면 생략 가능해요.)', 'image_url': 'https://recipe1.ezmember.co.kr/cache/recipe/2018/05/24/7b0c180d9479efb1615c4c795857b9411.jpg'}, {'step_number': 6, 'description': '재어 둔 닭고기와 한켠에는 묵은지를 자르지 않고 놓아주시고, 준비한 육수를 붓고, \n그 위에 감자, 고구마, 팽이버섯을 올려 팔팔 끓여 주시고, 끓는다 싶을 때 불을 약불로 줄여주세요.\n뚜껑 닫고, 그 상태로 10분정도 끓여주시면 감자가 반정도 익었을 때', 'image_url': 'https://recipe1.ezmember.co.kr/cache/recipe/2018/05/24/5496e1ff766d69cb08ea6b9394f3589f1.jpg'}, {'step_number': 7, 'description': '양파를 넣어 주세요.\n그렇게 5분 더 끓이시고,', 'image_url': 'https://recipe1.ezmember.co.kr/cache/recipe/2018/05/24/348e534eb288e7b1cdd0ab1ae6beeb3f1.jpg'}, {'step_number': 8, 'description': '마지막으로 어슷썬 대파 1/3(뿌리 쪽) 을 얹어서 5분 더 끓이시면 완성입니다.', 'image_url': 'https://recipe1.ezmember.co.kr/cache/recipe/2018/05/24/8731e9a0387d5860ad900ec370a2a84c1.jpg'}]"
50561,국/탕,영양식,닭고기,끓이기,닭도리탕 매운닭볶음탕 만드는법,닭도리탕,https://recipe1.ezmember.co.kr/cache/recipe/2016/11/23/a6446c45269c63b1c5a1e7d2e7ccd2cf1.jpg,"41,721",60분 이내,아무나,4인분,"[('닭', '1마리'), ('감자', '3개'), ('양파', '1개'), ('대파', '1개'), ('당근', '1토막'), ('청홍고추', '4개'), ('청양고춧가루', '4큰술'), ('간장', '3큰술'), ('맛술', '3큰술'), ('설탕', '2큰술'), ('소금', '1큰술'), ('매운굴소스', '1큰술'), ('마늘', '약간'), ('생강', '약간'), ('후추', '약간'), ('참기름', '약간'), ('물', '적당량')]",갑자기 영하로 기온이 뚝 떨어진 아침~ 옷을 껴입어도 으슬으슬 떨리는게 이제 본격적인 겨울인가 봐요 식구들이 요즘 입맛이 없다길래 고춧가루의 힘을 좀 빌려 봤는데요 ​ 매운 닭볶음탕에 청양 고춧가루 팍팍 넣어 칼칼하고 얼큰하게 만들었답니다 역시나 입맛 저격 제대로 ㅋㅋ 닭도리탕이라고 부르죠~ 그렇게 불러야 더 맛있다는 사람도 있더라고요~ 추운 날씨에 매운 음식 먹고 나면 기운도 나고 추위도 잊게 되니 오늘같은 날씨에 딱 좋은 것 같아요,"[{'step_number': 1, 'description': '닭은 깨끗이 손질하고', 'image_url': 'https://recipe1.ezmember.co.kr/cache/recipe/2016/11/23/d524d25e01786d8023edc4a8bdb97e881.jpg'}, {'step_number': 2, 'description': '채소들은 큼직하게 썰어줍니다', 'image_url': 'https://recipe1.ezmember.co.kr/cache/recipe/2016/11/23/21263022bcd1b5f18094e4f82b07f1941.jpg'}, {'step_number': 3, 'description': '끓는 물에 닭을 넣고 데친 후 찬물에 씻어 기름기와 불순물을 제거해준 뒤', 'image_url': 'https://recipe1.ezmember.co.kr/cache/recipe/2016/11/23/9c49a0f91a46fc5a4a678a9da093ea181.jpg'}, {'step_number': 4, 'description': '냄비에 닭이 잠길 정도로 물을 붓고 간장, 고춧가루, 소금, 설탕, 굴소스, 맛술을 넣고 끓으면 데쳐놓은 닭을 넣고 폭 끓여줍니다', 'image_url': 'https://recipe1.ezmember.co.kr/cache/recipe/2016/11/23/53e6389bbc17c7767bffef9e742bc5d01.jpg'}, {'step_number': 5, 'description': '닭이 거의 다 익었으면 썰어놓은 채소를 넣고 보글보글 끓여준 뒤 후추, 참기름으로 마무리합니다 +) 고명으로 뿌릴 고추와 파는 조금 남겨둡니다', 'image_url': 'https://recipe1.ezmember.co.kr/cache/recipe/2016/11/23/f0b8212dc3a22f57cdca2f172c4760e81.jpg'}, {'step_number': 6, 'description': '닭도리탕이 완성되어 접시에 담고 향이 좋으라고 생고추와 파를 조금 뿌려주었어요 국물이 아주 빨갛고 진한게 보기만 해도 맵게 느껴지네요~', 'image_url': 'https://recipe1.ezmember.co.kr/cache/recipe/2016/11/23/33e00684c5de70b3b6fc096be363fbd41.jpg'}]"
