index,종류별,상황별,재료별,방법별,글 제목,레시피이름,레시피이미지,조회수,조리시간,난이도,인분,재료,소개글,조리순서
19091,메인반찬,일상,소고기,굽기,푸짐하게 집에서 즐기는 스테이크~~,스테이크,https://recipe1.ezmember.co.kr/cache/recipe/2017/06/26/82603bf945fa571ff2a2b128be26355d1.jpg,"2,953",60분 이내,초급,2인분,"[('스테이크용 소고기', '500g'), ('방울토마토', '8개'), ('아스파라거스', '4개'), ('새송이버섯', '2개'), ('양파', '1개'), ('가지', '1/2개'), ('시판 스테이크소스', '1/2컵'), ('우유', '1/2종이컵'), ('올리브오일', '5-6스푼'), ('버터', '20g'), ('허브솔트', '적당량')]","스테이크는 단지 거들뿐~
텃밭이 선물한 야채를 구워 먹는맛이란...
늘 옳습니다!!!","[{'step_number': 1, 'description': '키친타올을 이용해 고기의 핏물을 제거해줍니다.속까지 잘익고 촉촉하고 맛있는 스테이크를 드시려면 고기를 냉장고에서 미리 꺼내 상온에 20분 정도 두신후 요리하심 좋아요.', 'image_url': 'https://recipe1.ezmember.co.kr/cache/recipe/2017/06/26/df56f4c550ba9ebda186fd74fac9aa591.jpg'}, {'step_number': 2, 'description': '허브솔트를 고기 앞뒤로 뿌려줍니다.(허브솔트가 없으시면 소금,후추 사용하세요)', 'image_url': 'https://recipe1.ezmember.co.kr/cache/recipe/2017/06/26/3f5d3ff8c4da83fe28c73c6c59186a701.jpg'}, {'step_number': 3, 'description': '그 사이 곁들일 야채를 준비합니다.', 'image_url': 'https://recipe1.ezmember.co.kr/cache/recipe/2017/06/26/37e8a0546b32f56029faee17d09ac64d1.jpg'}, {'step_number': 4, 'description': '새송이버섯,가지에 허브솔트를 적당히 뿌려줍니다', 'image_url': 'https://recipe1.ezmember.co.kr/cache/recipe/2017/06/26/113fee304cb425c6f27246e4752184231.jpg'}, {'step_number': 5, 'description': '팬에 올리브오일과 버터를 녹여줍니다', 'image_url': 'https://recipe1.ezmember.co.kr/cache/recipe/2017/06/26/78e44c72be2e45b5d4dbd43aa7960bd11.jpg'}, {'step_number': 6, 'description': '충분히 달궈진팬에 스테이크를 구워줍니다.한쪽면을 4분정도씩 구워준것 같아요. 윗면에 기름을 끼얹어주며 구우심 스테이크가 마르지않게 잘 구우실수 있어요.앞,뒤,옆면 골고루 익혀주세요', 'image_url': 'https://recipe1.ezmember.co.kr/cache/recipe/2017/06/26/71394413a804e743314e6d402f0bef681.jpg'}, {'step_number': 7, 'description': '스테이크가 거의 구워질무렵 남는 공간에 야채를 구워줬어요.편리한대로 하심 될것같아요.', 'image_url': 'https://recipe1.ezmember.co.kr/cache/recipe/2017/06/26/467e70f5029cef605e62580ba180b6c91.jpg'}, {'step_number': 8, 'description': '구운 고기를 접시에 담고 호일로 감싸 5분정도 레스팅을 해줍니다.이렇게하면 육즙이 고루퍼져 촉촉하고 맛있는 스테이크가 된다고하네요.', 'image_url': 'https://recipe1.ezmember.co.kr/cache/recipe/2017/06/26/42c416a367e47f96e81320f83a33cb4d1.jpg'}, {'step_number': 9, 'description': '새송이버섯두 구워주고', 'image_url': 'https://recipe1.ezmember.co.kr/cache/recipe/2017/06/26/4e398b21c1a6475f5fb5c6f059b691d41.jpg'}, {'step_number': 10, 'description': '아스파라거스,방울토마토도 구워줍니다', 'image_url': 'https://recipe1.ezmember.co.kr/cache/recipe/2017/06/26/58d0fceae11a3a342ddee9fdfe301d9e1.jpg'}, {'step_number': 11, 'description': '야채가 구워지는 동안 냄비에 스테이크소스 1/2컵,우유 1/2컵을 넣고 약불로 뭉근히 끓여주세요.생크림 넣어주심 좋은데 없어서 우유로 대체했어요.우유는 취향에 따라 생략하셔두 됩니다.우유나 생크림이 들어감 맛이 좀 더 부드러워지는것 같아요.', 'image_url': 'https://recipe1.ezmember.co.kr/cache/recipe/2017/06/26/d438da86d427d2ca22a751dae3b570671.jpg'}, {'step_number': 12, 'description': '접시에 취향껏 담아내심 됩니다.스테이크와 가니시의 환상궁합~^^', 'image_url': 'https://recipe1.ezmember.co.kr/cache/recipe/2017/06/26/4566e915c7cefb82e016712eb20a004c1.jpg'}]"
19092,메인반찬,일상,소고기,굽기,#오늘뭐먹지 최현석쉐프의 된장소스스테이크만들기 #된장소스로 구워낸 색다른 스테이크에 참나물연근샐러드를 올려서~~,스테이크,https://recipe1.ezmember.co.kr/cache/recipe/2017/10/01/298166885f5b4739019253b2a05704a81.jpg,"5,541",30분 이내,초급,1인분,"[('된장', '2큰술'), ('올리브오일', '2큰술'), ('채끝등심', '180g'), ('참나물연근샐러드', '1컵')]",독특한 된장소스를 만들어서 스테이크를 구울때에 발라가면서 구워 주는 독특한 된장소스스테이크 입니다.,"[{'step_number': 1, 'description': '된장소스부터 만들어 줍니다. 참나물연근샐러드는 이미 만들어져 있어서 스테이크를 구워 주려고 된장소스부터 만들어 줍니다. 믹서기에 된장을 넣어 주시고요.', 'image_url': 'https://recipe1.ezmember.co.kr/cache/recipe/2017/10/01/8e8ffff7f99f56bd68d40efac1f6bf541.jpg'}, {'step_number': 2, 'description': '된장과 동량으로 올리브오일을 넣어 주시고는 믹서기에 갈아 주시면 됩니다.', 'image_url': 'https://recipe1.ezmember.co.kr/cache/recipe/2017/10/01/6858a7e3a21cc92e95301929131d30071.jpg'}, {'step_number': 3, 'description': '요렇게 갈아서 간단하게 스테이크소스로 활용하는 된장소스가 완성되었습니다. 된장과 올리브오일 밖에는 넣지 않았지요.', 'image_url': 'https://recipe1.ezmember.co.kr/cache/recipe/2017/10/01/3c2dca39f2283e6ca5426e84e542c9971.jpg'}, {'step_number': 4, 'description': '채끝등신을 준비했어요. 여기에 먼저 만들어 놓은 된장소스를 발라 줍니다.', 'image_url': 'https://recipe1.ezmember.co.kr/cache/recipe/2017/10/01/3413e91089d488162a9b36cfb8e05da81.jpg'}, {'step_number': 5, 'description': '충분히 달궈진 팬에 올리브오일을 두르시고 된장소스가 발라진 부분부터 먼저 지글지글 구워 줍니다. 된장소스로 인해서 스테이크를 구우실때에 연기가 많이 나오기 때문에 후드를 틀어 놓고 조리하시는 것이 좋겠어요. 그리고 된장소스가 발라지지 않은 윗부분에도 역시나 소스를 발라 줍니다.', 'image_url': 'https://recipe1.ezmember.co.kr/cache/recipe/2017/10/01/61b238dcf6d058f21f0f00ec510e7a2e1.jpg'}, {'step_number': 6, 'description': '그리고 계속해서 뒤집어 가면서 소스를 발라줍니다. 3~4번에 걸쳐서 소스를 발라 가면서 구워 주세요.', 'image_url': 'https://recipe1.ezmember.co.kr/cache/recipe/2017/10/01/19eded53b9aa6e4c1fcbcebc28614dbf1.jpg'}, {'step_number': 7, 'description': '겉표면이 바삭바삭하게 구워지게 구워 주시면 미디움레어로 구우실 수 있고 젓가락을 고기 가운데에 찔렀다가 뺀 후에 입술에 데고 뜨거운 웰던, 미지근하면 미디움, 차가우면 레어입니다.', 'image_url': 'https://recipe1.ezmember.co.kr/cache/recipe/2017/10/01/ebffab52aea57d6a155902815ba87e411.jpg'}, {'step_number': 8, 'description': '노릇노릇하면서도 겉표면이 완전히 익은 된장소스스테이크가 다 구워졌어요. 잠시 레스팅을 시켜 줍니다.', 'image_url': 'https://recipe1.ezmember.co.kr/cache/recipe/2017/10/01/6f6a2c4ae17905430b1ef996003917221.jpg'}, {'step_number': 9, 'description': '비스듬하게 스테이크를 썰어 주세요.', 'image_url': 'https://recipe1.ezmember.co.kr/cache/recipe/2017/10/01/cd44ac9b3b6c924ff5152cb46d3c1a701.jpg'}, {'step_number': 10, 'description': '된장소스스테이크를 완성 접시에 담아 놓습니다.', 'image_url': 'https://recipe1.ezmember.co.kr/cache/recipe/2017/10/01/f70a2df199b514257ba99c38eb6e27991.jpg'}, {'step_number': 11, 'description': '그리고 그 위에 참나물연근샐러드를 올려 주시면 된장소스스테이크 완성입니다.', 'image_url': 'https://recipe1.ezmember.co.kr/cache/recipe/2017/10/01/beb106ceb6941ac8cedc6747d9d320471.jpg'}]"
19093,메인반찬,일상,소고기,굽기,LA갈비 만들기 갈아만든배로 이렇게 쉽게?,LA갈비,https://recipe1.ezmember.co.kr/cache/recipe/2017/10/18/c17d925d6290b8313b60788a8f5c12851.jpg,"18,070",2시간 이상,초급,6인분 이상,"[('호주산 LA갈비', '1.5kg'), ('간장', '120ml'), ('양파', '1개'), ('복숭아', '2개'), ('마늘', '3큰술'), ('대파', '2뿌리'), ('참기름', '약간'), ('후추', '약간'), ('꿀', '1큰술'), ('갈아만든배', '1캔')]","배도 갈고 과일도 갈고 그런 귀찮음은 이제 그만
갈아만든배 하나면 LA갈비 만들기 이제 걱정 없어요","[{'step_number': 1, 'description': '어젯밤 물에 담가 여러번 핏물 \n버리고 부어가며\n핏물 제거 작업을 하였답니다\n핏물 제거를 제대로 하지 않으면\nLA 갈비에서 잡 냄새가 나서 \n충분히 우려주었어요', 'image_url': 'https://recipe1.ezmember.co.kr/cache/recipe/2017/10/18/9de1cb8b0472cbc7262e330241813bb11.jpg'}, {'step_number': 2, 'description': '충분히 우려낸 후 소쿠리에서 \n물기 제거 작업에 들어갑니다\n기름도 별로 없어 LA갈비가 \n좋아 보이네요', 'image_url': 'https://recipe1.ezmember.co.kr/cache/recipe/2017/10/18/4bbf976bd9e436cf60f9471224c7752d1.jpg'}, {'step_number': 3, 'description': '양파와 요즘 너무 많아 모든 음식에 \n활용 중인 복숭아도\n갈아 사용하려고 준비해 두었어요', 'image_url': 'https://recipe1.ezmember.co.kr/cache/recipe/2017/10/18/6d503213d8b9cfb7d2bb72a00471ed0e1.jpg'}, {'step_number': 4, 'description': '간장도 준비', 'image_url': 'https://recipe1.ezmember.co.kr/cache/recipe/2017/10/18/e2f9cf46ac4055ca71a1d385a1aad0c21.jpg'}, {'step_number': 5, 'description': 'LA갈비 만들기 갈아만든배 \n요것만 있으면 \n맛있는 갈비를 만들 수가 있는데요\n몇 년 전 명절에 시어머니께서 \n갈비를 재어 오라고 \n하시기에 평소에 배를 갈아 \n사용하다가\n꾀를 피워 갈아만든배를 \n이용했었는데요\n온 식구들 맛있다고 난리가 났었어요 ㅎㅎ\n그다음부터는 만능 요리 재료로 애용', 'image_url': 'https://recipe1.ezmember.co.kr/cache/recipe/2017/10/18/eb5c096a210d93be3d20fa756f02f5731.jpg'}, {'step_number': 6, 'description': '위에 설명한 LA갈비 레시피에\n갈비만 넣고 버무려 주면 준비 끝~~', 'image_url': 'https://recipe1.ezmember.co.kr/cache/recipe/2017/10/18/2793837a8598e125c8897bd70e8ede031.jpg'}, {'step_number': 7, 'description': '갈아만든배를 이용하여 만든 \nLA 갈비 완성된 모습', 'image_url': 'https://recipe1.ezmember.co.kr/cache/recipe/2017/10/18/6de1cdc6cd27fe953640a14c309085bd1.jpg'}, {'step_number': 8, 'description': '통에 담아 냉장고에서 \n한두 시간 숙성 후 구워 먹으면\n누가 뺏어 먹을까 걱정되는\n맛있는 LA갈비구이가 탄생한답니다 ㅎㅎ', 'image_url': 'https://recipe1.ezmember.co.kr/cache/recipe/2017/10/18/428e8975672c955086c3f87ef8f6a22a1.jpg'}, {'step_number': 9, 'description': '광복절 아침 늦은 아침식사 메뉴\nLA 갈비구이\n프라이팬에 갈비를 올리고\n약한 불에서 은근히 익혀주면 되는데요', 'image_url': 'https://recipe1.ezmember.co.kr/cache/recipe/2017/10/18/6134691b5b9ac3a4b0754b745a02dc511.jpg'}, {'step_number': 10, 'description': '한쪽 면이 익으면 반대로 뒤집어 \n다시 익혀준답니다\n양념이 되어 있어 타지 않도록 \n약간 신경 써야 해요', 'image_url': 'https://recipe1.ezmember.co.kr/cache/recipe/2017/10/18/4a53660c70002b5f22d56544c0ed39c51.jpg'}, {'step_number': 11, 'description': 'LA갈비구이 다 익었으면 \n먹기 좋은 크기로 잘라 줍니다', 'image_url': 'https://recipe1.ezmember.co.kr/cache/recipe/2017/10/18/5c9464ae3b6e997b4b6193e612d915a11.jpg'}, {'step_number': 12, 'description': '여기서 Tip\nLA 갈비 뼈 있는 부위는 위 사진처럼\n가위로 중간을 살짝 잘라두면\n갈비살만 호로록 벗겨져서\n먹기 편하게 드실 수 있어요', 'image_url': 'https://recipe1.ezmember.co.kr/cache/recipe/2017/10/18/f49dcec5196c7d2e051591f717645acd1.jpg'}]"
19094,메인반찬,일상,소고기,굽기,직화로 구운 듯한 바싹불고기만들기,바싹불고기,https://recipe1.ezmember.co.kr/cache/recipe/2016/04/29/e48a0e050bf6888776aab6afbed9c9bf1.jpg,"4,460",30분 이내,초급,2인분,"[('불고기', ''), ('느타리버섯', ''), ('냉이', ''), ('소금', ''), ('참기름', '')]",방배동대가님의 바싹불고기를 냉이와 버섯과 함께 즐기는 냉이바싹불고기입니다.,"[{'step_number': 1, 'description': '먼저 냉이를 달궈진 팬에 참기름 넣고 살짝 볶아 줍니다.\n냉이는 나중에 바싹불고기와 함께 먹을 것이지요. \n데치지 않고 생으로 살짝만 볶아주시면 됩니다.', 'image_url': 'https://recipe1.ezmember.co.kr/cache/recipe/2016/04/29/0e6df11b3514c1c0078721b6af88cabb1.jpg'}, {'step_number': 2, 'description': '볶으실때 간으로 소금간 조금 넣어서 볶아주세요. \n다 볶아졌다면 일단 접시에 담아 놓습니다.', 'image_url': 'https://recipe1.ezmember.co.kr/cache/recipe/2016/04/29/a6f3db023feb6f91c29506063148269b1.jpg'}, {'step_number': 3, 'description': '바로 그 팬으로 느타리버섯을 볶아 줍니다.\n역시 소금간 해주시고요.', 'image_url': 'https://recipe1.ezmember.co.kr/cache/recipe/2016/04/29/886d65f7a7bfab3f9906dbd753b779301.jpg'}, {'step_number': 4, 'description': '살짝 볶아낸 냉이와 느타리버섯을 준비해 놓고요.', 'image_url': 'https://recipe1.ezmember.co.kr/cache/recipe/2016/04/29/ad242e4d5d1fd89bd278ddbd5be96ef81.jpg'}, {'step_number': 5, 'description': '이젠 그 팬으로 불고기를 구워 줍니다. \n불고기는 양념된 불고기감도 좋고요. 직접 불고기감을 사다가 시판용 불고기양념으로 재워 놓으셔도 좋습니다.\n일단 불고기 양념이 중요한 것이 아니라 바싹하게 구워내는 방법이 중요하죠!!!', 'image_url': 'https://recipe1.ezmember.co.kr/cache/recipe/2016/04/29/45cac128f024c2d439a7bd9e4280efad1.jpg'}, {'step_number': 6, 'description': '불고기를 구울때에 자연스럽게 물이 나오지요. \n그래서 아무리 구워도 고기는 질겨지지만 바싹하게 구울 수가 없습니다.\n숯불이나 직화로 굽지 않는 이상에는요. \n일단 고기가 익을때까지 구워 주세요. \n너무 익지 않게만 구워주시면 됩니다.', 'image_url': 'https://recipe1.ezmember.co.kr/cache/recipe/2016/04/29/318a70b6e4deacc89b57f7cfab5fe64c1.jpg'}, {'step_number': 7, 'description': '바로 방배동대가님의 바싹불고기를 굽는 방법이죠!!!\n일단 구워진 고기와 기름을 체에 걸러 고기만 건져 냅니다. \n그리고 남은 기름은 다시 팬에 붓고요.\n이것이 번거로우시면 저처럼 체에 고기만 건져내시면 됩니다.', 'image_url': 'https://recipe1.ezmember.co.kr/cache/recipe/2016/04/29/12d4fbfb1d74b5390c28b04f8c1c5de31.jpg'}, {'step_number': 8, 'description': '팬에 기름이 남아 있죠. 양념도 조금 남아 있고요.\n이것을 조려 줍니다. 수분이 날라가고 졸아 들 정도로 조여 줍니다.', 'image_url': 'https://recipe1.ezmember.co.kr/cache/recipe/2016/04/29/6bbec3a5155c9f4a82e76595485aee0f1.jpg'}, {'step_number': 9, 'description': '어느정도 졸아 들었지요. \n이렇게 진득진득하게 졸아 들때까지 졸여 주세요. \n약불로 조려 주시는 것이 좋겠죠.', 'image_url': 'https://recipe1.ezmember.co.kr/cache/recipe/2016/04/29/f3c0538338977c8b6417f282e16447a81.jpg'}, {'step_number': 10, 'description': '다 졸여 졌다면 바로 여기에서 아까 구워낸 \n불고기를 투하해 줍니다.', 'image_url': 'https://recipe1.ezmember.co.kr/cache/recipe/2016/04/29/1933e5d9e02e85b90ab51325003e81121.jpg'}, {'step_number': 11, 'description': '진하게 진득해진 양념도 더욱 잘 베이고\n바싹하게 마치 직화로 구운 듯한 느낌의 불고기를 만들 수 있는 방법이지요.\n잘 섞어가면서 다시한번 구워 주세요.', 'image_url': 'https://recipe1.ezmember.co.kr/cache/recipe/2016/04/29/e84301a9e6a6d8db37685c285d96f5f81.jpg'}, {'step_number': 12, 'description': '그리고 바로 지금 남은 느타리버섯도 함께 넣어서 \n졸아진 기름과 양념에 잘 섞어가면서 구워주시면 됩니다. \n이렇게 하면 버섯도 식감이 살아 있고 \n고기도 바싹하게 구워집니다. 물기도 전혀 없고요.', 'image_url': 'https://recipe1.ezmember.co.kr/cache/recipe/2016/04/29/f642d99040f47ff3294467178fba59c61.jpg'}, {'step_number': 13, 'description': '바싹하게 직화로 구워낸 것처럼 국물도 없고 \n물도 없는 바싹불고기가 모두 구워졌습니다. 그럼 이제부터 완성접시에 담아 볼까요.', 'image_url': 'https://recipe1.ezmember.co.kr/cache/recipe/2016/04/29/7c050bbc3f263a8fb778a996a2301d101.jpg'}, {'step_number': 14, 'description': '완성 접시에 담아낸 바싹불고기 입니다. \n전혀 국물이 없죠~~~ !!! 양념도 더욱 잘 베였습니다. \n마치 양념불고기를 직화로 구운 듯한 느낌이네요.', 'image_url': 'https://recipe1.ezmember.co.kr/cache/recipe/2016/04/29/5ac60a0c19b52bc1443bf1452f3a9d6a1.jpg'}, {'step_number': 15, 'description': '바싹불고기 위에 아까 만들어 놓았던 \n냉이와 느타리버섯을 올려 줍니다. 높이 높이 위로 솟아오르게요. \n그럼 먹음직스럽게 보이는 플레이팅이 되겠죠.', 'image_url': 'https://recipe1.ezmember.co.kr/cache/recipe/2016/04/29/5b41a4b3580b4e362a6af976595a78651.jpg'}, {'step_number': 16, 'description': '잣가루가 없는 대신에 \n통깨를 솔솔 뿌려서 마무리를 지어 주었습니다. 방배동대가님의 직화로 구운 것 같은 바싹불고기가 완성되었습니다.', 'image_url': 'https://recipe1.ezmember.co.kr/cache/recipe/2016/04/29/defc81f3a3dc5db31a80015b6155e1ea1.jpg'}]"
19095,메인반찬,일상,소고기,굽기,한우 치마살구이,None,https://recipe1.ezmember.co.kr/cache/recipe/2018/04/13/cc245905efe904e153a193d000ebcc441.jpg,"22,989",None,None,None,"[('한우 치마살 구이용', '300g'), ('스테이크소스', ''), ('허브솔트', ''), ('후추', '')]",,[]
19096,메인반찬,일상,소고기,굽기,사과 건포도 소스의 등심구이,등심구이,https://recipe1.ezmember.co.kr/cache/recipe/2018/08/06/19c17054c9408113fb610d276bb32ade.jpg,860,60분 이내,중급,2인분,"[('돼지고기(등심)', '400 g'), ('백설오천년의신비명품천일염', '약간'), ('후추', '약간'), ('백설밀가루', '1 큰술'), ('양파', '150 g'), ('사과', '80 g'), ('건포도', '20 g'), ('페페론치노', '2 개'), ('백설스위트리알룰로스(설탕)', '30 g'), ('치킨스톡', '200 g'), ('발사믹식초', '80 g'), ('백설스위트리알룰로스(설탕)', '20 g'), ('월계수잎', '1 장'), ('정향', '1 개'), ('백설안달루시아산올리브유', '약간'), ('이탈리안파슬리', '약간')]","더 이상 그냥 구워먹지 말자. 느끼함까지 잡아주는 상큼한 사과 건포도 소스를 얹어, 소고기 등심이 부럽지 않은 등심구이 레시피를 소개한다. 백설 스위트리 알룰로스로 단맛을 내 칼로리 걱정까지 잡은 더할나위 없는 메뉴다.","[{'step_number': 1, 'description': '각각의 재료를 준비한다.', 'image_url': 'https://recipe1.ezmember.co.kr/cache/recipe/2018/08/06/6a34ef59e49506bd054895c0c6d40ce2.jpg'}, {'step_number': 2, 'description': '돼지고기는 키친타올에 감싸 핏물을 제거하고 사방 2.5cm 크기로 자른 뒤 소금, 후추를 뿌려 버무려 밑간 한다.', 'image_url': 'https://recipe1.ezmember.co.kr/cache/recipe/2018/08/06/abd2d5ee887d36ee0b5ea4b0445c8d6a.jpg'}, {'step_number': 3, 'description': '양파는 얇게 채 썰고 사과는 흐르는 물에 씻어 물기, 씨 제거 후 굵게 다진다. 이탈리안 파슬리는 잎만 떼어 흐르는 물에 씻고 물기 제거 후 곱게 다진다. 냄비에 분량의[소스] 재료를 넣고 5분간 끓인 뒤 체에 거른다.', 'image_url': 'https://recipe1.ezmember.co.kr/cache/recipe/2018/08/06/351b0656d2b9c45167998a354db7f657.jpg'}, {'step_number': 4, 'description': '달군 팬에 올리브유를 두른 뒤 채 썬 양파를 넣어 갈색이 나도록 볶다가 백설 스위트리 알룰로스를 넣고 진한 갈색이 날 때 까지 볶는다. 팬에 [소스]와 건포도, 다진 사과, 페페론치노를 넣어 3분 끓인다.', 'image_url': 'https://recipe1.ezmember.co.kr/cache/recipe/2018/08/06/bd1fe5f1f6f58f43da0bac541b39169e.jpg'}, {'step_number': 5, 'description': '밑간한 돼지고기에 밀가루를 살짝 묻혀 덧가루를 털어낸다. 다른 달군 팬에 올리브유와 돼지고기를 넣어 노릇하게 굽는다.', 'image_url': 'https://recipe1.ezmember.co.kr/cache/recipe/2018/08/06/e9cf7d571e3de2ddb84b6a640c54467e.jpg'}, {'step_number': 6, 'description': '5의 팬에 구운 돼지고기를 넣어 자작하게 조린 뒤 접시에 담고 다진 이탈리안 파슬리를 넣어 완성한다.', 'image_url': 'https://recipe1.ezmember.co.kr/cache/recipe/2018/08/06/a441ebc2592396e99dd092a9a0ede1f8.jpg'}]"
19097,메인반찬,일상,소고기,굽기,너비아니구이 l 한식자격증실기ㅣ시험시간 25분,너비아니구이,https://recipe1.ezmember.co.kr/cache/recipe/2020/03/27/dc3e5f56cd870c5fdbd35e8d513a6b331.jpg,"12,628",30분 이내,초급,1인분,"[('소고기', '100g'), ('간장', '50ml'), ('대파', '1토막'), ('마늘', '2쪽'), ('후추', '2g'), ('설탕', '10g'), ('깨소금', '5g'), ('참기름', '10ml'), ('배', '1/8개'), ('식용유', '10ml'), ('잣', '5개'), ('A4용지', '1장')]","한식의 시험과제가 축소되었어도 
여러가지 구이메뉴 중 하나인 너비아니구이!
영상보고 꼭 시험에 합격하세요! 
세상의 모든 레시피 만개의레시피","[{'step_number': 1, 'description': '파, 마늘을 곱게 다진다.', 'image_url': 'https://recipe1.ezmember.co.kr/cache/recipe/2020/03/27/27ccb180bab4225e38e5cf79353348e11.jpg'}, {'step_number': 2, 'description': '배는 껍질, 씨를 제거 한 후 면보 위에서 강판으로 갈아 면보를 이용하여 배즙을 만든다.면보', 'image_url': 'https://recipe1.ezmember.co.kr/cache/recipe/2020/03/27/6f0f1b62f857537012419f25e45de7c11.jpg'}, {'step_number': 3, 'description': '소고기는 요구사항 보다 크고 얇게 6장 포를 떠 손질한다.소고기는 지급되면 키친타올로 감싸 핏물을 제거 및 교차오염을 방지하고, 조리 시 길이가 줄고 두꺼워 지므로 요구사항보다는 길게, 두께는 얇게 손질한다.', 'image_url': 'https://recipe1.ezmember.co.kr/cache/recipe/2020/03/27/27c5b6faacadb091c1a91a08b33c766f1.jpg'}, {'step_number': 4, 'description': '칼등으로 두드려 연육 작업을 한 후 가장자리를 잘라 깨끗하게 손질한다.', 'image_url': 'https://recipe1.ezmember.co.kr/cache/recipe/2020/03/27/3bcadfb8102b57844d379f223ae217801.jpg'}, {'step_number': 5, 'description': '간장 1T, 배즙 1T, 설탕 1/2T, 다진 파 1/2T, 다진 마늘 1t, 후추 약간, 깨소금 약간, 참기름 1/2t를 넣고 양념장을 만든다.', 'image_url': 'https://recipe1.ezmember.co.kr/cache/recipe/2020/03/27/80cf76fb3315453a1f5d00206d8dca071.jpg'}, {'step_number': 6, 'description': '손질 한 고기에 양념장을 넣고 고기를 재운다.', 'image_url': 'https://recipe1.ezmember.co.kr/cache/recipe/2020/03/27/4e4f98f8c444d6d5816f9407531036161.jpg'}, {'step_number': 7, 'description': '고기 재워질 동안 잣을 곱게 다진다.', 'image_url': 'https://recipe1.ezmember.co.kr/cache/recipe/2020/03/27/a6d0cd7a353b33b2c85a3e67dc1b41da1.jpg'}, {'step_number': 8, 'description': '석쇠를 달궈 식용유를 발라 코팅을 한 후 재워 둔 고기를 얹고 앞 뒤로 익힌다.석쇠시간의 여유가 있다면 양념을 한번 더 묻혀 구우면 좋아요', 'image_url': 'https://recipe1.ezmember.co.kr/cache/recipe/2020/03/27/66cfa976f188d95d063732d0b3e553291.jpg'}, {'step_number': 9, 'description': '완성접시에 담아 잣가루를 뿌려 완성한다.접시', 'image_url': 'https://recipe1.ezmember.co.kr/cache/recipe/2020/03/27/cf30effc4c962fb86e9c869955fd07301.jpg'}]"
