index,종류별,상황별,재료별,방법별,글 제목,레시피이름,레시피이미지,조회수,조리시간,난이도,인분,재료,소개글,조리순서
53997,찌개,손님접대,소고기,끓이기,와인향기에 취하는 소고기 스튜,소고기스튜,https://recipe1.ezmember.co.kr/cache/recipe/2015/06/09/25ea26d571996a79f036d481e363bd36.jpg,"18,871",60분 이내,초급,3인분,"[('소고기                                                                                안심장조림육등', '300g'), ('적포도주', '1컵'), ('소금', '1/2ts'), ('후추', '조금'), ('월계수잎', '1장'), ('감자', '2~3개'), ('양파', '2개'), ('당근', '1/2개'), ('새송이', '2개'), ('버터', '1큰술'), ('식용유', '1/2큰술'), ('밀가루', '2큰술'), ('데미글라스소스', '300g'), ('우스터소스', '1/2컵'), ('돈가스소스', '1/2컵'), ('꿀', '1/2큰술'), ('생크림', '적당량'), ('파슬리가루', '조금')]",크리스마스 요리로 와인향이가 나는 소고기 스튜를 올려 봅니다 크리스마스라고 해서 특별하고 어려운요리를 만들기 보다는 만들기 쉽고 간편한 요리를 만들어서 온가족이 함께 따듯하고 맛있는 한끼식사를 하는것도 좋을것 같아요 장조림을 만드는 사태살이나 질긴 고기를 와인에 재워서 육질을 부드럽게 만들어서 야채와 함께 냄비에 넣고 푸욱~한참을 끓여낸 간단한 서양요리 입니다 희미하게 와인향기도 나고 어른들은 물론 아이들도 잘먹어서 크리스마스 요리로 추천해 봅니다,"[{'step_number': 1, 'description': '소고기는 한입크기로 잘라서 비닐백에 넣고 ★의 재료(와인,소금후추등)를 모두 넣고 밀봉해서 2시간정도 냉장고에 보관해 두세요~월계수잎이 없다면 소금후추를 빼고 허브솔트로 만드세요 야채는 큼직하게 썰어주고(아스파라거스나 샐러리줄기도 있으면 넣어주세요^^) 두꺼운 냄비에 버터와 식용유를 넣고 양파를 볶다가 밀가루를 넣어 노릇하게 볶아주고 와인에 절여둔 고기를 넣어 고기색이 변하도록 볶아 줍니다', 'image_url': 'https://recipe1.ezmember.co.kr/cache/recipe/2016/08/12/5cd8011dc9505ea62baf18e17c2585451.jpg'}, {'step_number': 2, 'description': '저는 백화점 수입식품코너에서 구입한 데미그라소스를 넣고 만들어 봤는데 입이 촌스러워서 그런지 요걸 넣지않고 그냥 평소에 제가 만들어 먹던 스튜가 더 맛있더라구요~ 밀키표 짝퉁 데미그라소스가 시판소스의 맛을 뛰어 넘더군요~ㅎㅎ 우리 입맛엔 맛이강한 소스가 더맛있게 느껴지는듯 합니다!', 'image_url': 'https://recipe1.ezmember.co.kr/cache/recipe/2016/08/12/9223d6a23c5ecd2a2af69b9ea09994751.jpg'}, {'step_number': 3, 'description': '데미그라소스 대신에 케찹1컵,우스터소스1/2컵,돈가스소스1/2컵,꿀1/2큰술 등을 냄비에 넣고 물2컵을 넣고 섞어준후 중불에 올려놓고 뚜껑을 덮어 끓여주다가 가끔 눌러 붙지 않게 저어주세요 소스양이 1/3쯤 졸아 들었다면 맛을 보고 소금 후추로 간을 한후 불에서 내려 줍니다 서양사람들은 요걸 오븐에 2~3시간 넣어 익히기도 하지만 중불에서 약불로 불조절을 해서 한시간 정도 졸여주면 야채와 고기가 푸욱 무르게 된답니다 중간에 국물이 졸아들면 물을 더 넣어 주셔도 됩니다~편하게 만들어 보세요~^^*', 'image_url': None}, {'step_number': 4, 'description': '그릇에 담아 파슬리가루를 뿌리고 생크림을 조금 뿌려 먹으면 더 고소하고 맛있어요~^^* 빵과함께 드시거나 밥위에 스튜를 듬뿍 떠서 비벼 드시면 간단하게 한끼식사가 됩니다', 'image_url': 'https://recipe1.ezmember.co.kr/cache/recipe/2016/08/12/94dc69564f8aca998543dcb5fdba832d1.jpg'}]"
53998,찌개,손님접대,소고기,끓이기,초대음식 으로 최고 불고기 낙지 전골 끓이기,불고기낙지전골,https://recipe1.ezmember.co.kr/cache/recipe/2022/08/05/4b1d2b15d2ba8a4bc3fe91840e4cd7d01.jpg,719,60분 이내,아무나,3인분,"[('낙지', '3마리'), ('소고기 불고기용', '2~300g'), ('멸치육수', ''), ('청경채', '2포기'), ('표고버섯', '2개'), ('느타리버섯', '약간'), ('당근', '1/3개'), ('애호박', '1/3개'), ('두부', '1/2모'), ('당면', '1줌'), ('양파', '1/2개'), ('맛술', '2큰술'), ('설탕', '1큰술'), ('다진마늘', '2.5큰술'), ('참기름', '1큰술'), ('고추가루', '2큰술'), ('국간장', '2큰술'), ('진간장', '5큰술'), ('소금', '적당량')]","날이 추워지면서 전골류 음식을 많이 찾게 되더라구요. 보통 한겨울엔 카레나 샤브샤브를 자주 해먹는데, 이번에는 기력 보강 겸 해서 낙지와 한우를 넣어 불고기낙지전골! 불낙전골을 끓여봤어요.","[{'step_number': 1, 'description': '모든 조리를 하기 전 당면은 미리 물에 담가 불려주세요~', 'image_url': 'https://recipe1.ezmember.co.kr/cache/recipe/2022/08/08/44d102b550a9dce21a9c3bff5c2697e61.jpg'}, {'step_number': 2, 'description': '불고기용 소고기는 먹기 좋은 크기로 썰은 후 설탕 1큰술', 'image_url': 'https://recipe1.ezmember.co.kr/cache/recipe/2022/08/08/ea0ae57bbb470f54288604d30143e2d01.jpg'}, {'step_number': 3, 'description': '맛술 2큰술, 진간장 5큰술', 'image_url': 'https://recipe1.ezmember.co.kr/cache/recipe/2022/08/08/8eaf8f56c8ad296cb2fa8b353879bf221.jpg'}, {'step_number': 4, 'description': '참기름 1큰술, 다진마늘 1.5큰술 넣어 조물조물 섞어 미리 양념에 재워 놓아주세요', 'image_url': 'https://recipe1.ezmember.co.kr/cache/recipe/2022/08/08/391769937445aedfcf30532c7e211cd91.jpg'}, {'step_number': 5, 'description': '낙지는 내장을 제거한 후, 밀가루를 넣어 바락바락 깨끗이 씻어 주세요', 'image_url': 'https://recipe1.ezmember.co.kr/cache/recipe/2022/08/08/ad21cd3516aabd6a9d9d5bbdd0c76d321.jpg'}, {'step_number': 6, 'description': '깨끗이 씻은 낙지는 먹기좋은 크기로 썰어 다진마늘 1큰술', 'image_url': 'https://recipe1.ezmember.co.kr/cache/recipe/2022/08/08/eccc7f15e1fdf7f8dde298a2023442191.jpg'}, {'step_number': 7, 'description': '국간장 1큰술, 고추가루 2큰술 넣어 잘 섞어주세요~ 이렇게 미리 밑간해둔 소불고기와 낙지는 냉장고에 30분이상 넣어주세요', 'image_url': 'https://recipe1.ezmember.co.kr/cache/recipe/2022/08/08/49f81c42c154dc9f33fd07a43356a5f51.jpg'}, {'step_number': 8, 'description': '이제 미리 준비한 야채를 전골냄비에 빙 둘러가며 셋팅해줍니다. 야채는 집에 있는걸로 준비하면 되는데 기본적으로 버섯과 양파, 애호박, 청경채는 들어가는게 맛있더라구요 저는 전골요리에는 무조건 청경채를 넣자는 주의인지라;;ㅎㅎ', 'image_url': 'https://recipe1.ezmember.co.kr/cache/recipe/2022/08/08/d59e07652fbc4d438b3eb55227f485811.jpg'}, {'step_number': 9, 'description': '두부 1/2모도 먹기 좋은 크기로 썰어서 올려 놓아 주었어요~', 'image_url': 'https://recipe1.ezmember.co.kr/cache/recipe/2022/08/08/8c2dec2a316b8298ef19aeedd3b4afb51.jpg'}, {'step_number': 10, 'description': '미리 불려 놓았던 당면을 올려주고', 'image_url': 'https://recipe1.ezmember.co.kr/cache/recipe/2022/08/08/98ea3c722cd3846af06b6fcf8187cb061.jpg'}, {'step_number': 11, 'description': '양념해 두었던 소고기와 낙지를 넣어 끓이는데 멸치육수를 전골냄비에 1/3정도만 채워서 끓인 후, 추가하여 끓이도록 합니다~ 이때 추가로 국간장 1큰술 넣어주고~ (야채에서 수분이 나오면서 넘칠 수 있어요~)', 'image_url': 'https://recipe1.ezmember.co.kr/cache/recipe/2022/08/08/8158698d1d87456a90948e0499bc4b241.jpg'}, {'step_number': 12, 'description': '센불로 팔팔 끓여주세요~', 'image_url': 'https://recipe1.ezmember.co.kr/cache/recipe/2022/08/08/c0df8b7f968f0caaed1461bd093e0a841.jpg'}, {'step_number': 13, 'description': '센불로 팔팔 끓이다가 약불로 줄여서 끓여 먹으면 딱 좋아요~ 참! 부족한 간은 소금으로 맞춰주면 됩니다^^ 저도 1큰술 정도 첨가 했어요^^', 'image_url': 'https://recipe1.ezmember.co.kr/cache/recipe/2022/08/08/d2075f9d48db3dcd1cc88945681df0b81.jpg'}]"
53999,찌개,손님접대,소고기,끓이기,많이 먹어도 살 안찌는 소고기배추말이 전골 만드는 법,소고기배추말이전골,https://recipe1.ezmember.co.kr/cache/recipe/2023/12/08/5c33f05e18d81ad2cc368d9095c5a6ab1.jpg,"1,488",20분 이내,초급,2인분,"[('배춧잎', '8~10개'), ('팽이버섯', '1봉'), ('당근', '1/2개'), ('애호박', '1/2개'), ('숙주', '1봉지'), ('샤브샤브용 소고기', '100g'), ('코인 육수', '2개'), ('액젓', '2스푼'), ('물', '500ml'), ('간장', '2스푼'), ('식초', '1스푼'), ('설탕', '1스푼'), ('레몬', '약간')]",오늘도 뭔가 건강하게 먹을 수 있는 요리를 찾아보다가 인스타보고 만들게 된 소고기배추전골! 요즘 배추가 맛있을 시기라 만들어 봤답니다.,"[{'step_number': 1, 'description': '배춧잎은 찜기에 넣고 10분간 찝니다.찜기', 'image_url': 'https://recipe1.ezmember.co.kr/cache/recipe/2023/12/08/d80fdf6ec92284f63ac7ed0fe0c0dec01.jpg'}, {'step_number': 2, 'description': '애호박과 당근은 채 썰고, 팽이버섯은 밑동을 제거하고 씻어주고 숙주도 물에 헹궈 세척해 줍니다.도마 , 조리용나이프 , 믹싱볼', 'image_url': 'https://recipe1.ezmember.co.kr/cache/recipe/2023/12/08/c49731a26deab18d9a844a2471cf3b601.jpg'}, {'step_number': 3, 'description': '배추에 소고기를 올리고 팽이버섯, 당근, 애호박을 올리고 돌돌 말아 줍니다.', 'image_url': 'https://recipe1.ezmember.co.kr/cache/recipe/2023/12/08/1e27e21bb20af3167b6f98c48a8db5c21.jpg'}, {'step_number': 4, 'description': '칼로 반을 썰어 줍니다.', 'image_url': 'https://recipe1.ezmember.co.kr/cache/recipe/2023/12/08/2b262cf3e4b9aadb3311adcebdf922261.jpg'}, {'step_number': 5, 'description': '냄비에 숙주를 넣고 그 위에 소고기배추말이를 올려 줍니다.전골냄비', 'image_url': 'https://recipe1.ezmember.co.kr/cache/recipe/2023/12/08/6025d67159274e819a116e884c70a4891.jpg'}, {'step_number': 6, 'description': '물 500ml를 붓고 코인 육수 2개, 액젓 2T를 넣고 10분간 끓입니다.계량컵', 'image_url': 'https://recipe1.ezmember.co.kr/cache/recipe/2023/12/08/11232e4aff5ce38ad555aa59a8ea5dc31.jpg'}, {'step_number': 7, 'description': '간장 2T, 식초 1T, 설탕 1T, 레몬 조각 2개를 넣고 섞은 레몬 소스에 찍어 먹어요.소스볼', 'image_url': 'https://recipe1.ezmember.co.kr/cache/recipe/2023/12/08/4ecb72d6847bd70334b618d853cae1901.jpg'}]"
54000,찌개,손님접대,소고기,끓이기,타진으로 소고기스튜 만들기,소고기스튜,https://recipe1.ezmember.co.kr/cache/recipe/2016/10/20/ebb3d45832baf410026e3f62edbfbd161.jpg,"4,579",30분 이내,초급,2인분,"[('사태', '500g'), ('샐러리', '3개'), ('당근', '1개'), ('양파', '2개'), ('토마토케찹', '100g'), ('소금', '약간'), ('버터', '1T'), ('올리브유', '1T'), ('머스타드', '적당량'), ('후춧가루', '적당량')]","가족이 둘러 앉아 먹기 너무 좋은 메뉴

소고기로 스튜를 만드는 이색 레시피 소개해드릴께요~","[{'step_number': 1, 'description': '사태는 먹기 좋은 크기로 잘라서\n소금, 후추를 뿌려 밑간해 주시구요\n양파 등 다른 채료도 한잎 크기로 썰어서 준비해 주세요', 'image_url': 'https://recipe1.ezmember.co.kr/cache/recipe/2016/10/20/52adc913567884b5c4fbd6768b10906b1.jpg'}, {'step_number': 2, 'description': '타진 냄비에 버터 한스푼을 넣고\n양파를 넣어서 볶아주세요\n세라프레임 타진은 최고급 세라믹으로 만들었기 때문에\n스텐 식기를 사용해서 볶아도 긁힘 없이 요리하실 수 있으세요~', 'image_url': 'https://recipe1.ezmember.co.kr/cache/recipe/2016/10/20/3080f6bce727f6d25d794c2a550ec7cf1.jpg'}, {'step_number': 3, 'description': '양파가 갈색이 되면\n밑간한 쇠고기를 넣고\n노릇하게 잘 볶아주세요', 'image_url': 'https://recipe1.ezmember.co.kr/cache/recipe/2016/10/20/7d1c94bff191946efe63c00fd32e4c221.jpg'}, {'step_number': 4, 'description': '소고기 표면이 노릇하게 익을 정도가 되면\n소스를 넣고 볶아주세요', 'image_url': 'https://recipe1.ezmember.co.kr/cache/recipe/2016/10/20/23588e0b3aebc2bc6fa7e96853d9eac31.jpg'}, {'step_number': 5, 'description': '잘라 놓은 채소를 넣고 5분 정도 더 볶다가', 'image_url': 'https://recipe1.ezmember.co.kr/cache/recipe/2016/10/20/bc5f1a0b4e6838f0b0172b40de4787a01.jpg'}, {'step_number': 6, 'description': '타진 냄비 뚜껑을 닫고\n약불로 소스가 졸여질 정도로 푹 끓여주세요', 'image_url': 'https://recipe1.ezmember.co.kr/cache/recipe/2016/10/20/738b608deb97ed3489770215031383041.jpg'}, {'step_number': 7, 'description': '이렇게 맛난 소고기 스튜가 완성 되었습니다\n소고기가 한껏 들어 있는\n푹- 익혀서 너무 부드러운 소고기 맛이 일품인 스튜\n만들기도 너무 간편하고\n모임이나 파티에서 만들어서 다같이 먹이에도 좋은 소고기 스튜', 'image_url': 'https://recipe1.ezmember.co.kr/cache/recipe/2016/10/20/1127fe37b90345eaa9daf4ace17fc5571.jpg'}, {'step_number': 8, 'description': '워머에 올려 놓고 따뜻하게 먹으면 더욱 좋은 소고기 스튜', 'image_url': 'https://recipe1.ezmember.co.kr/cache/recipe/2016/10/20/88f488135cd263478bd34bf6535e9f331.jpg'}, {'step_number': 9, 'description': '간단하게 만들기 편한\n그렇지만 맛 만큼은 마체프로가 보장하는!\n소고기 스튜\n꼭 만들어 보세요~^^', 'image_url': 'https://recipe1.ezmember.co.kr/cache/recipe/2016/10/20/255bed08bf21708ec70e1d4c90d5327c1.jpg'}]"
54001,찌개,손님접대,소고기,끓이기,소고기주꾸미전골) 추석에 다같이 모여 먹기좋은 전골,소고기주꾸미전골,https://recipe1.ezmember.co.kr/cache/recipe/2023/09/12/0eb331333b4e2c703ec478652bb2141c1.jpg,366,30분 이내,초급,1인분,"[('소고기', '300g'), ('쭈꾸미', '5마리'), ('양파', '1/4개'), ('당근', '조금'), ('대파', '1/2개'), ('양배추', '조금'), ('버섯', '조금'), ('당면', '30g'), ('물', '500ml'), ('간장', '3큰술'), ('설탕', '1큰술'), ('후추', '조금'), ('마늘', '1/2큰술'), ('후추', '조금'), ('참치액', '1/2큰술')]",소불고기 해먹고 남은 양념소고기로 만들었는데 맛있어요~,"[{'step_number': 1, 'description': '당면을 물에 불려주세요.파스텔믹싱볼', 'image_url': 'https://recipe1.ezmember.co.kr/cache/recipe/2023/09/12/43743414b389184eca9752a42749ab4a1.jpg'}, {'step_number': 2, 'description': '불고기용 소고기에 간장3큰술, 설탕1큰술, 후추를 넣고 재워두세요.', 'image_url': 'https://recipe1.ezmember.co.kr/cache/recipe/2023/09/12/5a54a581887ea76ca437ecfb1be095641.jpg'}, {'step_number': 3, 'description': '물 500ml에 코인육수 1개 넣고 끓여주세요.멀티팬', 'image_url': 'https://recipe1.ezmember.co.kr/cache/recipe/2023/09/12/fa6b1cd43a5bd6b0cccd64328c7a13291.jpg'}, {'step_number': 4, 'description': '양파, 대파, 버섯, 당근을 적당한 크기로 썰어주세요.도마 , 조리용나이프', 'image_url': 'https://recipe1.ezmember.co.kr/cache/recipe/2023/09/12/527f5c14e284345d27cea0ae0294850a1.jpg'}, {'step_number': 5, 'description': '물이 끓으면 재워둔 고기를 넣어주세요.', 'image_url': 'https://recipe1.ezmember.co.kr/cache/recipe/2023/09/12/99b3fd27bc88536925138b1aa1a5a7421.jpg'}, {'step_number': 6, 'description': '위에 뜨는 불순물을 제거해주세요.요리스푼', 'image_url': 'https://recipe1.ezmember.co.kr/cache/recipe/2023/09/12/d1b0a667e71d56d5539d82506358a1391.jpg'}, {'step_number': 7, 'description': '썰어 놓은 야채를 넣고 끓여주세요.', 'image_url': 'https://recipe1.ezmember.co.kr/cache/recipe/2023/09/12/6a242cff933c89c155dfdedc172b23a51.jpg'}, {'step_number': 8, 'description': '야채가 어느정도 익으면 쭈꾸미와 당면을 넣어주세요.', 'image_url': 'https://recipe1.ezmember.co.kr/cache/recipe/2023/09/12/5ccbe529fe4e1b20c20eb35c5b6f22201.jpg'}, {'step_number': 9, 'description': '마지막으로 마늘, 후추, 참치액 넣고 간을 봐주세요. 기호에 따라 소금, 설탕을 더 넣어주세요.', 'image_url': 'https://recipe1.ezmember.co.kr/cache/recipe/2023/09/12/d41d1da539acd60b3594b38cc0c6fc831.jpg'}, {'step_number': 10, 'description': '맛있게드세요. (쭈꾸미가 없으면 낙지, 새우를 넣어주셔도 되고 없을시 안 넣으셔도 됩니다.)', 'image_url': 'https://recipe1.ezmember.co.kr/cache/recipe/2023/09/12/a05c8eabc1e75d27a475f904e5c4d1e41.jpg'}]"
