index,종류별,상황별,재료별,방법별,글 제목,레시피이름,레시피이미지,조회수,조리시간,난이도,인분,재료,소개글,조리순서
38351,메인반찬,술안주,닭고기,볶음,술안주로 어때?~닭볶음탕!,None,https://recipe1.ezmember.co.kr/cache/recipe/2023/05/30/25f0b91770983a1a565152709739f5191.jpg,766,60분 이내,아무나,4인분,"[('닭 볶음탕용', '700g'), ('감자', '3개'), ('양파', '1개'), ('당근', '조금'), ('대파', '2개'), ('깻잎', '6~7장'), ('월계수잎', '조금'), ('소주', '1/2컵'), ('고추장', '1큰술'), ('고추가루', '2~3큰술'), ('다진마늘', '1.5큰술'), ('진간장', '2~3큰술'), ('올리고당', '2~3큰술'), ('설탕', '조금'), ('후추가루', '조금'), ('들기름', '1큰술'), ('깨', '조금')]",포실한 감자를 넣어서 매콤한듯 달콤한듯 닭볶음탕을 만들어봤어요,"[{'step_number': 1, 'description': '닭볶음탕용 닭으로 잘라진것을 준비후에 냄비에 그대로 넣고 물이 살짝 잠기게 붓고 소주(생강술이나 맛술),월계수잎을 넣고 센불에서 10분간 펄펄 끓여주세요냄비 , 요리스푼', 'image_url': 'https://recipe1.ezmember.co.kr/cache/recipe/2023/09/18/c4195523aaa8dc7bc2155c58d45319dc1.jpg'}, {'step_number': 2, 'description': '1번에서 삶아진것을 모두 버리고 닭만 건져내주시고 다시 잠기도록 물을 붓고 고추장및 양념을 넣어 끓여주세요', 'image_url': 'https://recipe1.ezmember.co.kr/cache/recipe/2023/09/18/8040bd828ab197cca999e756b76ebe1a1.jpg'}, {'step_number': 3, 'description': '그사이에 양파,대파를 큼직큼직하게 썰어주시고도마 , 조리용나이프', 'image_url': 'https://recipe1.ezmember.co.kr/cache/recipe/2023/09/18/6873a278671f20c34cbb29897cc6ed4f1.jpg'}, {'step_number': 4, 'description': '감자도 껍질을 벗겨 큰것은 절반씩 잘라주시고 찬물에서 1번을 씻어주세요', 'image_url': 'https://recipe1.ezmember.co.kr/cache/recipe/2023/09/18/b8684d61199fbc336b4f16a1fec704931.jpg'}, {'step_number': 5, 'description': '당근,깻잎도 있으시면 썰어 준비해주세요', 'image_url': 'https://recipe1.ezmember.co.kr/cache/recipe/2023/09/18/2fb9c091fdd4e966850ad361699b59981.jpg'}, {'step_number': 6, 'description': '2번을 10~15분정도 펄펄 끓여주시고 썰어준 감자를 넣고', 'image_url': 'https://recipe1.ezmember.co.kr/cache/recipe/2023/09/18/37957ee5b85a7b9d028ebd2a2f7c31291.jpg'}, {'step_number': 7, 'description': '5분후에 양파,당근을 넣어주세요 중간중간에 한번씩 살살 섞어주면서 끓여주세요 여기서 국물의 밑간을 보시고 부족하신것은 채워주시고 짠경우 물을 추가하세요', 'image_url': 'https://recipe1.ezmember.co.kr/cache/recipe/2023/09/18/31e22034aec4a7d56a5ee546969929441.jpg'}, {'step_number': 8, 'description': '감자를 찔러봐서 다익었을때 자른깻잎과 대파를 넣어주신후\n3~4분을 더 끓여주시면 완성이네요', 'image_url': 'https://recipe1.ezmember.co.kr/cache/recipe/2023/09/18/1e4ee46f2e5650357b5a1e58b2de6fd01.jpg'}, {'step_number': 9, 'description': '저희집의 닭볶음탕은 국물이 있는거네요 남은 국물에 밥볶아 먹는게 맛있거든요ㅎㅎ', 'image_url': 'https://recipe1.ezmember.co.kr/cache/recipe/2023/09/18/59b2eb64f937383678abb900a8981fe61.jpg'}]"
38352,메인반찬,술안주,닭고기,볶음,"나래바 부럽지 않은 홈포차 안주, 갈릭버터닭똥집",갈릭버터닭똥집,https://recipe1.ezmember.co.kr/cache/recipe/2022/10/17/dd6fd1f8532122727230d760c11606111.jpg,"1,315",20분 이내,아무나,2인분,"[('닭근위', '400g'), ('소주', '1/2종이컵'), ('통마늘', '1줌'), ('양파', '1/4개'), ('청양고추', '2개'), ('홍고추', '1개'), ('식용유', '3숟가락'), ('다진마늘', '1숟가락'), ('버터', '1숟가락'), ('맛소금', '적당량'), ('후추', '톡톡')]","이거 하나면 술이 잘 넘어갑니다~
쫄깃한 닭똥집에 마늘, 고추까지 넣어
달달 볶아주고 버터로 풍미 추가하면 끝","[{'step_number': 1, 'description': '깨끗이 씻은 닭근위는 2~3등분으로 썰어요.                    \n\n                        \n                            헹켈 데피니션 칼', 'image_url': 'https://recipe1.ezmember.co.kr/cache/recipe/2022/10/17/cf395ca392e7b7e6593f8ef1e790bef71.jpg'}, {'step_number': 2, 'description': '양파는 먹기 좋은 크기로 썰어요.', 'image_url': 'https://recipe1.ezmember.co.kr/cache/recipe/2022/10/17/05747267cc40685cf8dcaed09f0bac8d1.jpg'}, {'step_number': 3, 'description': '청양고추, 홍고추는 0.5cm 간격으로 송송 썰어요.', 'image_url': 'https://recipe1.ezmember.co.kr/cache/recipe/2022/10/17/4ca248f88579fa350888da5cf543e3d01.jpg'}, {'step_number': 4, 'description': '끓는 물에 닭근위, 소주를 넣고 2분간 삶아요.                    \n\n                        \n                            드롭스 코팅 프라이팬', 'image_url': 'https://recipe1.ezmember.co.kr/cache/recipe/2022/10/17/f90a362a104df9937f46618425a2e1ef1.jpg'}, {'step_number': 5, 'description': '팬에 식용유를 두르고 마늘을 볶아요.팬', 'image_url': 'https://recipe1.ezmember.co.kr/cache/recipe/2022/10/17/2c24f24f7431b7f5ff2a2cdcb106db091.jpg'}, {'step_number': 6, 'description': '마늘이 익으면 닭근위를 넣고 노릇하게 볶아요.', 'image_url': 'https://recipe1.ezmember.co.kr/cache/recipe/2022/10/17/7a9433793973806a60410650aaf941231.jpg'}, {'step_number': 7, 'description': '양파, 고추를 넣고 1분간 볶아요.', 'image_url': 'https://recipe1.ezmember.co.kr/cache/recipe/2022/10/17/c3b0d17e908aba577bd7dc84a5d8b2e01.jpg'}, {'step_number': 8, 'description': '맛소금, 후추로 간해요.닭똥집은 속까지 간이 배지 않아서 짭짤해야 맛있어요.', 'image_url': 'https://recipe1.ezmember.co.kr/cache/recipe/2022/10/17/92339acbb318a34a91cec3cc935583291.jpg'}, {'step_number': 9, 'description': '다진마늘, 버터를 넣고 볶아요.', 'image_url': 'https://recipe1.ezmember.co.kr/cache/recipe/2022/10/17/43bf14b752f518e75cd5b40e87c92e491.jpg'}]"
38353,메인반찬,술안주,닭고기,볶음,닭날개 쯔란볶음 ! 바삭바삭 맛있게~,닭날개쯔란볶음,https://recipe1.ezmember.co.kr/cache/recipe/2022/10/20/384a034863bab157c7ce319ed896a2401.jpg,"1,997",20분 이내,초급,2인분,"[('닭날개', '400g'), ('하오츠양꼬치소스', '30g'), ('대파', '30g'), ('마늘', '20g'), ('감자전분가루', '100g'), ('우유', ''), ('기름', '')]","쯔란소스! 양꼬치에만 찍어드시나요?

전분가루에 묻혀 튀겨낸
닭날개에 쯔란으로 양념하면ㅠ최고의 술안주가 되요 !","[{'step_number': 1, 'description': '닭날개 잡내는 우유에 잠깐 담궈주세요\n살짝 칼집을 내주셔도 좋아요 :)', 'image_url': 'https://recipe1.ezmember.co.kr/cache/recipe/2022/10/20/0b1623b8a2bf2de8ccbffe91c0b7bff61.jpg'}, {'step_number': 2, 'description': '대파는 잘게, 마늘은 굵게 다져주세요', 'image_url': 'https://recipe1.ezmember.co.kr/cache/recipe/2022/10/20/9b578a0e457b087c58f849c1350aec1c1.jpg'}, {'step_number': 3, 'description': '우유에 재워둔 닭날개를 건져내\n감자전분가루를 골고루 묻혀주세요.봉지에 넣고 흔들어주면\n전체적으로 잘 묻어나요 :)', 'image_url': 'https://recipe1.ezmember.co.kr/cache/recipe/2022/10/20/7dff64a5d654106763c57320cfb957a21.jpg'}, {'step_number': 4, 'description': '160도에서 초벌로 튀긴 후,\n170도로 올려 2번 노릇하게 튀겨주세요', 'image_url': 'https://recipe1.ezmember.co.kr/cache/recipe/2022/10/20/a9df2bc2d8b680f9dc349d6ba37c8d721.jpg'}, {'step_number': 5, 'description': '팬에 오일을 두르고\n마늘을 먼저 볶아주세요', 'image_url': 'https://recipe1.ezmember.co.kr/cache/recipe/2022/10/20/b6fd1fa3b06de1f2712a42f727c573e11.jpg'}, {'step_number': 6, 'description': '마늘이 노릇노릇해지면 닭날개,\n쯔란가루를 뿌려 골고루 묻게 잘 볶아주세요', 'image_url': 'https://recipe1.ezmember.co.kr/cache/recipe/2022/10/20/2624a41d1088b2bb41c1dc19e251b7c71.jpg'}, {'step_number': 7, 'description': '마지막으로 대파를 넣고 불을 꺼주세요', 'image_url': 'https://recipe1.ezmember.co.kr/cache/recipe/2022/10/20/2156f8f0037839fe4e383ffcb692bdce1.jpg'}, {'step_number': 8, 'description': '바삭바삭 맛있는 닭날개 쯔란볶음 완성!', 'image_url': 'https://recipe1.ezmember.co.kr/cache/recipe/2022/10/20/95b9d7a9bc1acc93d0294d9d2ebf65fa1.jpg'}]"
38354,메인반찬,술안주,닭고기,볶음,집에서 만드는 지코바치킨 매콤한 닭다리살 요리 집코바 양념장 레시피,지코바치킨,https://recipe1.ezmember.co.kr/cache/recipe/2024/03/08/74133c32933f7b955e775996f64639411.jpg,668,30분 이내,아무나,2인분,"[('닭다리살', '600g'), ('청양고추', '2개'), ('대파', '1개'), ('떡국떡                                                                                1줌 정도', '10개'), ('간장', '3T'), ('설탕', '2T'), ('고춧가루', '2T'), ('굴 소스', '1T'), ('올리고 당', '5T'), ('케첩', '1T'), ('고추장', '1T'), ('다진 마늘', '1T'), ('후추', '0.3T')]","호둘아빠가 뜬금없이 집에서 만드는 지코바 치킨이 있다며 먹고 싶다고 하는 거예요. 닭 다리 살 노릇이 구워 매콤한 양념소스에 볶아내니 맥주 안주로 너무 좋더라고요. 호둘이네 지난 불금 메뉴, 맥주 안주로 너무 좋았던 집에서 만드는 지코바치킨 매콤한 닭다리살 요리 집코바 양념 레시피 소개해 볼게요","[{'step_number': 1, 'description': '닭다리살은 깨끗이 씻어 물기를 빼줬어요 호둘이네는 절단 정육을 이용했어요믹싱볼 , 채반', 'image_url': 'https://recipe1.ezmember.co.kr/cache/recipe/2024/03/08/e4554a6e6a526d488e3dfdfcaa70f8ca1.jpg'}, {'step_number': 2, 'description': '닭다리살의 물기가 빠지는 동안 집코바 양념장을 만들어줬어요\n집코바 양념장은 간장 3, 설탕 2, 고춧가루 2, 굴 소스 1, 올리고 당 5, 케첩 1, 고추장 1, 다진 마늘 1, 후추 0.3 을 잘 섞어서 준비해 주세요.면기 , 조리용스푼', 'image_url': 'https://recipe1.ezmember.co.kr/cache/recipe/2024/03/08/1916620d90aaaa701ff8d590a146c62a1.jpg'}, {'step_number': 3, 'description': '함께 구울 대파도 큼직하게 썰고도마 , 조리용나이프', 'image_url': 'https://recipe1.ezmember.co.kr/cache/recipe/2024/03/08/dcd8c32474363a17e4967250866f3e1b1.jpg'}, {'step_number': 4, 'description': '청양고추 2개도 썰어 준비했어요 호둘맘은 청양고추 썰어 얼려서 보관했던 것이 있어 꺼내서 준비했답니다접시', 'image_url': 'https://recipe1.ezmember.co.kr/cache/recipe/2024/03/08/afb1ebc46c2b224dd5118dfb0071d4ad1.jpg'}, {'step_number': 5, 'description': '떡국떡 혹은 떡볶이 떡은 찬물에 잠시 담가줬어요', 'image_url': 'https://recipe1.ezmember.co.kr/cache/recipe/2024/03/08/8c74c177d2f12cf45d7833cb1898308b1.jpg'}, {'step_number': 6, 'description': '팬에 닭다리살을 구워주세요 닭다리살을 구우며 대파도 함꺼 구워 향을 입혀줬어요프라이팬닭다리살을 통으로 사용할 경우 기름을 두르지 않고 껍질 쪽부터 구워주세요.\n\n호둘이네는 절단육이라 적당히 식용유를 두르고 구워줬어요\n\n\u200b', 'image_url': 'https://recipe1.ezmember.co.kr/cache/recipe/2024/03/08/50f88f95683259101ab88b693d4cf0261.jpg'}, {'step_number': 7, 'description': '닭다리살이 어느 정도 익었을 때 물에 담가뒀던 떡도 함께 넣어 구워주세요', 'image_url': 'https://recipe1.ezmember.co.kr/cache/recipe/2024/03/08/664f00d170daf7acac68bc19036047071.jpg'}, {'step_number': 8, 'description': '떡과 고기가 노릇하게 익을 때까지 구워주세요', 'image_url': 'https://recipe1.ezmember.co.kr/cache/recipe/2024/03/08/a57d417b6af77733e3cf1e99babd380e1.jpg'}, {'step_number': 9, 'description': '닭고기와 떡이 노릇하게 구워지면 만들어둔 집코바 양념장을 넣어 볶듯이 익혀줍니다', 'image_url': 'https://recipe1.ezmember.co.kr/cache/recipe/2024/03/08/af28ca844788023a58d2797ae0d4f9fc1.jpg'}, {'step_number': 10, 'description': '양념장의 수분이 날아갈 때까지 중약불에 구워줍니다', 'image_url': 'https://recipe1.ezmember.co.kr/cache/recipe/2024/03/08/cd48a6bae98a8ede89bc12114cec664c1.jpg'}, {'step_number': 11, 'description': '숯불양념치킨 집코바 양념장의 수분이 반 정도 날아갈 때쯤 썰어둔 청양고추도 넣어 볶아주세요', 'image_url': 'https://recipe1.ezmember.co.kr/cache/recipe/2024/03/08/c495cd8f16d88b6299cc762967f58a691.jpg'}, {'step_number': 12, 'description': '양념장의 수분이 다 날아가고 꾸덕꾸덕한 느낌이 나면 마무리로 통깨 넉넉히 뿌려 마무리해주세요', 'image_url': 'https://recipe1.ezmember.co.kr/cache/recipe/2024/03/08/a3d335ebc08757b0182d831ff326ca691.jpg'}, {'step_number': 13, 'description': '집에서도 뚝딱 완성되는 지코바치킨 집코바에요접시', 'image_url': 'https://recipe1.ezmember.co.kr/cache/recipe/2024/03/08/a9e5bc6fca598266ebf928b39129a8931.jpg'}, {'step_number': 14, 'description': '맥주가 생각날 수밖에 없는 맥주 안주로 딱 좋은 집에서 만드는 지코바치킨 매콤한 닭 다리 살 요리 집코바 양념장 레시피랍니다', 'image_url': 'https://recipe1.ezmember.co.kr/cache/recipe/2024/03/08/79a0636a808e691b9b60a97016c5ba0e1.jpg'}]"
38355,메인반찬,술안주,닭고기,볶음,편스토랑 류수영 만원 닭볶음탕 만들기 황금레시피 인정,None,https://recipe1.ezmember.co.kr/cache/recipe/2024/05/15/21a6991d20b16a57982f1dd5a30056831.jpg,"7,733",90분 이내,아무나,2인분,"[('닭                                                                                닭볶음탕용', '1마리'), ('감자', '2개'), ('대파', '1대'), ('양파', '1개'), ('청양고추', '4개'), ('물', '1L'), ('간장', '8T'), ('고춧가루', '4T'), ('설탕', '3T'), ('다진마늘', '1T'), ('쌈장', '1T'), ('소금', '3꼬집')]",도대체 얼마나 더 감동시킬 것인가 편스토랑 류수영 레시피는 언제나 황금레시피 인정 류수영 만원 닭볶음탕 꼭 만들어 드세요.,"[{'step_number': 1, 'description': '닭볶음탕용 닭은 흐르는 물에 헹구고 내장이 붙어 있다면 제거해 주세요. 내장이 남아 있으면 닭 누린내가 날 수 있어요. 닭 껍질은 떼지 말고 사용합니다.믹싱볼닭고기 손질법', 'image_url': 'https://recipe1.ezmember.co.kr/cache/recipe/2024/05/15/568ef8a1ff39a0c607e4ece31746ac4f1.jpg'}, {'step_number': 2, 'description': '감자 2개는 껍질을 깎은 후 1센티 정도 두께로 썰어 주세요. 도마 , 조리용나이프감자 손질법', 'image_url': 'https://recipe1.ezmember.co.kr/cache/recipe/2024/05/15/f666b42f18bd387a02404debf619dbc51.jpg'}, {'step_number': 3, 'description': '양파 1개는 굵게 채 썰어 주세요.양파 손질법', 'image_url': 'https://recipe1.ezmember.co.kr/cache/recipe/2024/05/15/45a9d75092c7444e1562e004c6e8b0e81.jpg'}, {'step_number': 4, 'description': '대파 1대는 굵게 송송 썰어 주세요.대파 손질법', 'image_url': 'https://recipe1.ezmember.co.kr/cache/recipe/2024/05/15/94f401416dfbd779ff716801782ad1d61.jpg'}, {'step_number': 5, 'description': '청양고추 4개는 송송 썰어 주세요. 청양고추 양은 기호에 따라 조절하세요. 매운 걸 좋아한다면 많이 넣으시면 되고 매운 걸 못 드신다면 줄여 주세요. 저는 처음에 3개 넣고 나중에 3개 더 넣었습니다.', 'image_url': 'https://recipe1.ezmember.co.kr/cache/recipe/2024/05/15/edab4a1d8401e88c0c9458e28f8acc0e1.jpg'}, {'step_number': 6, 'description': '웍은 예열한 후 닭을 껍질이 있는 쪽을 바닥으로 하나씩 올려 준 후 소금 3 꼬집을 뿌린 후 강불로 3분 정도 노릇하게 구워 줍니다.웍 , 요리집게', 'image_url': 'https://recipe1.ezmember.co.kr/cache/recipe/2024/05/15/f0ef70369c48d50703d8a675b2945c081.jpg'}, {'step_number': 7, 'description': '닭 껍질 쪽으로 올려 구워야 닭기름이 나오거든요. 뒤적이지 말고 노릇해질 때까지 구워주고 기름기가 없는 닭일 경우에는 식용유를 1T 둘러 주세요.', 'image_url': 'https://recipe1.ezmember.co.kr/cache/recipe/2024/05/15/c775fe547196c2e752e0cc56d34151a61.jpg'}, {'step_number': 8, 'description': '닭이 노릇하게 익고 기름이 나오면 다진 마늘 1T, 썰어둔 대파를 넣고 볶아 줍니다. 대파와 마늘 향이 너무 좋아요. 닭 냄새도 잡아 줄 수 있어요.', 'image_url': 'https://recipe1.ezmember.co.kr/cache/recipe/2024/05/15/55451738d452d1ae44589e20000ae4311.jpg'}, {'step_number': 9, 'description': '진간장 8T를 넣고 바르르 끓으면', 'image_url': 'https://recipe1.ezmember.co.kr/cache/recipe/2024/05/15/c804759bc2b2408f210944763486e8351.jpg'}, {'step_number': 10, 'description': '골고루 볶아 주세요. 간장이 끓으면 감칠맛이 올라가요.', 'image_url': 'https://recipe1.ezmember.co.kr/cache/recipe/2024/05/15/2804974fc1328231a66508e844fa20471.jpg'}, {'step_number': 11, 'description': '불을 중불로 낮춘 후 고춧가루 4T, 설탕 3T를 넣고요리스푼', 'image_url': 'https://recipe1.ezmember.co.kr/cache/recipe/2024/05/15/a2ba8c0bad2d3ddbe9d546be5b23ab3e1.jpg'}, {'step_number': 12, 'description': '골고루 볶아 줍니다. 이렇게만 먹어도 맛있을 것 같아요. 양념치킨 같달까요? 다음에는 이렇게도 한번 먹어봐야겠습니다.', 'image_url': 'https://recipe1.ezmember.co.kr/cache/recipe/2024/05/15/2a94daefa09a77f4774fe95413fb8a8f1.jpg'}, {'step_number': 13, 'description': '고추기름이 나오면 물 1L, 쌈장 듬뿍 1T를 넣고 강불로 끓여 줍니다. 쌈장이 류수영 만원 닭볶음탕 만들기의 치트키인 것 같아요. 감칠맛은 올려 주고 전혀 쌈장이 들어갔다는 건 알 수 없어요.', 'image_url': 'https://recipe1.ezmember.co.kr/cache/recipe/2024/05/15/44b38a693b8d0810815d984bdc16da741.jpg'}, {'step_number': 14, 'description': '물이 끓기 시작하면 뚜껑을 닫고 10분 끓여 주세요.', 'image_url': 'https://recipe1.ezmember.co.kr/cache/recipe/2024/05/15/3b07444314d54aea3d23aab41ac713551.jpg'}, {'step_number': 15, 'description': '10분 후 썰어 둔 감자, 양파, 청양고추를 넣고 뚜껑을 닫고 중불로 15분 더 끓여 줍니다. 감자를 바깥쪽에 넣으면 부서지지 않는다고 합니다.', 'image_url': 'https://recipe1.ezmember.co.kr/cache/recipe/2024/05/15/f79596e4c1e7c3fed6779c3aebe011d51.jpg'}, {'step_number': 16, 'description': '국물은 원하는 만큼 졸여 주시면 될 것 같고요. 마지막으로 청양고추, 홍고추 등 채소를 올려 조금 더 예쁘게 먹어요.', 'image_url': 'https://recipe1.ezmember.co.kr/cache/recipe/2024/05/15/199604acaedc5ac08c3cdcfa62a935601.jpg'}, {'step_number': 17, 'description': '특별할 것 없는 것 같은 레시피인데 한입 먹는 순간 깜짝 놀라게 됩니다. 닭볶음탕 황금레시피이니 믿고 만들어 드셔 보세요. 온 가족들 난리 납니다. 국물 한 방울 남길 수 없어요.국자 , 접시', 'image_url': 'https://recipe1.ezmember.co.kr/cache/recipe/2024/05/15/78efed1352b5c814f071163e26c5b68d1.jpg'}]"
38356,메인반찬,술안주,닭고기,볶음,#닭근위요리 #닭똥집요리 #후추통마늘닭똥집구이만들기 #통마늘닭똥집구이 #후추닭똥집구이,통마늘닭똥집구이,https://recipe1.ezmember.co.kr/cache/recipe/2024/06/21/35a2c71c834ee19d30b4192e414e00c31.jpg,490,60분 이내,아무나,6인분 이상,"[('닭근위', '500g'), ('소주', '3큰술'), ('통후추', '6바퀴'), ('깐마늘', '20개'), ('마늘허브소금', '1작은술'), ('레드페퍼홀', '1작은술')]","자주자주 하는 근위볶음이자 똥집구이. 닭똥집이죠. ​ 통마늘 넣고 만드는데, 이번에는 조금 매콤한 맛을 가미시켰습니다. 후추떡볶이를 하면서 떠오른 생각이였습니다. ​ 통후추를 갈아서 기본양념을 한 후에 통마늘 넣고, 통후추도 넣어서 만들어서 후추의 매콤한 향이 물씬 풍기는 후추통마늘똥집구이입니다.","[{'step_number': 1, 'description': '닭똥집이자 닭근위를 소주를 넣고 물 넣어서 한번 삶아냅니다. 이물질들이 다 빠져나오도록 삶아냅니다.냄비', 'image_url': 'https://recipe1.ezmember.co.kr/cache/recipe/2024/06/21/1e5b33e2b10e270b1d1e2672df04565b1.jpg'}, {'step_number': 2, 'description': '삶아낸 근위는 찬물에 씻어 준 후 물기를 빼 준 후 먹기 좋게 2등분을 해 줍니다.도마 , 조리용나이프 , 볼', 'image_url': 'https://recipe1.ezmember.co.kr/cache/recipe/2024/06/21/04776642637716850640bc0bdf42aa2c1.jpg'}, {'step_number': 3, 'description': '이번에 하는 닭근위볶음은 통마늘만 들어가는 것이 아닌, 후추통마늘근위볶음이니 통후추를 갈아서 듬뿍 넣어 줍니다. 그리고는 잘 섞어서 후추 밑간을 해 줍니다.', 'image_url': 'https://recipe1.ezmember.co.kr/cache/recipe/2024/06/21/a92315d6e0dc68d6e30f862dcd80f5031.jpg'}, {'step_number': 4, 'description': '달궈진 팬에 기름 두르고는 통마늘과 한번 삶아내서 후추로 밑간을 한 똥집을 넣어 줍니다. 그리고 마늘허브소금, 레드페퍼홀을 넣어 주고는 달달 볶아가면서 구워 줍니다.볶음팬 , 나무스푼', 'image_url': 'https://recipe1.ezmember.co.kr/cache/recipe/2024/06/21/358f50937eda1d7c26c5d0adae0072461.jpg'}, {'step_number': 5, 'description': '아주아주 잘 구워졌습니다. 마늘도 제대로 구워졌고 기름도 모두 없어질 정도로 잘 구워졌습니다.', 'image_url': 'https://recipe1.ezmember.co.kr/cache/recipe/2024/06/21/43740cba673141f198475c485a5e8ff51.jpg'}, {'step_number': 6, 'description': '완성접시에 담아서는 통깨 솔솔 뿌려 주고, 거기에 그냥 냉동실에 썰어 놓았던 쪽파썬 것도 뿌려서 마무리를 해 주었습니다. 후추를 넣고 매콤하게 만든 후추통마늘똥집구이 완성입니다. 완전 꼬득꼬득한 식감이 최고입니다.접시', 'image_url': 'https://recipe1.ezmember.co.kr/cache/recipe/2024/06/21/cecf6fd5dd9ef1556ca4c744359e23d31.jpg'}]"
38357,메인반찬,술안주,닭고기,볶음,뼈있는 닭발볶음 레시피,닭발볶음,https://recipe1.ezmember.co.kr/cache/recipe/2024/07/08/7040a125c8df7b378780b10023c993571.jpg,"1,237",30분 이내,초급,3인분,"[('뼈있는 닭발', '700g'), ('소주', ''), ('후추', ''), ('다진마늘', '2T'), ('매운 고추장', '1T'), ('액젓', '1T'), ('불닭소스', '1T'), ('올리고당', '1T'), ('설탕', '1T')]",오늘은 국물닭발에 이어 뼈 있는 닭발볶음 레시피를 소개해드릴게요 :) 이렇게 하면 매콤한 향과 불맛이 일품인 뼈있는 닭발 볶음을 만드실 수 있답니다 〰️,"[{'step_number': 1, 'description': '핏물을 빼기 위해 물에 15분 정도 담가놔주세요.볼', 'image_url': 'https://recipe1.ezmember.co.kr/cache/recipe/2024/07/08/a03c40fa7a9208fb66fb273a489ee2e11.jpg'}, {'step_number': 2, 'description': '소주 1/3병을 넣고, 후추 갈갈한 후에 20분정도 삶아주세요.웍저희는 2kg를 삶고 소분할거라 사진상에는 양이 많아요!', 'image_url': 'https://recipe1.ezmember.co.kr/cache/recipe/2024/07/08/d2418281dce9d7e287899c50553a2d971.jpg'}, {'step_number': 3, 'description': '중간중간 불순물이 거품처럼 생기는데 계속 걸러주세요.국자', 'image_url': 'https://recipe1.ezmember.co.kr/cache/recipe/2024/07/08/b74c1b96bc2bbdec7eebb6e843eeafb01.jpg'}, {'step_number': 4, 'description': '다진 마늘 2T, 매운 고추장 1T, 액젓 1T, 불닭소스 1T, 올리고당 1T, 설탕 1T를 넣고 양념장을 만들어주세요.소스볼', 'image_url': 'https://recipe1.ezmember.co.kr/cache/recipe/2024/07/08/9fd35f1e0dd01dc585d6453242ab057e1.jpg'}, {'step_number': 5, 'description': '준비된 양념장을 넣고 삶은 닭발과 함께 볶아주세요.', 'image_url': 'https://recipe1.ezmember.co.kr/cache/recipe/2024/07/08/485ca0236927d1e03a37dc49886b38a31.jpg'}]"
