index,종류별,상황별,재료별,방법별,글 제목,레시피이름,레시피이미지,조회수,조리시간,난이도,인분,재료,소개글,조리순서
162931,빵,손님접대,해물류,볶음,우리가족 집콕스낵! 자꾸만 손이 가는 크림새우 브루스케타,크림새우브루스케타,https://recipe1.ezmember.co.kr/cache/recipe/2020/09/09/d67bcde0954f055254814e4348cbcf881.jpg,"15,420",30분 이내,아무나,2인분,"[('바게트', '1/2개'), ('새우살', '1컵'), ('양송이버섯', '4개'), ('느타리버섯', '1/3팩'), ('버터', '1숟가락'), ('다진 마늘', '1큰술'), ('우유', '1종이컵'), ('생크림', '1/2종이컵'), ('파마산치즈가루', '1숟가락'), ('소금', '약간'), ('후추', '약간')]","걸쭉하고 부드러운 크림소스에
짭조롬한 새우, 그 아래엔 바삭한 바게트!

아는 맛이 더 무섭다더니, 벌써부터 침 고이는 분들 손~?
으른들은 안주, 아이들은 간식으로
우리가족 집콕스낵 하기 딱이에요.","[{'step_number': 1, 'description': '바게트는 1cm 두께로 어슷하게 썰어 살짝 구워 사용해요.', 'image_url': 'https://recipe1.ezmember.co.kr/cache/recipe/2020/09/09/85c5e13df76ba67747a353c6b806b0841.jpg'}, {'step_number': 2, 'description': '새우살은 엷은 소금물에 흔들어 씻어 물기를 빼요.', 'image_url': 'https://recipe1.ezmember.co.kr/cache/recipe/2020/09/09/760503560f884541f1cba3e46f7117c01.jpg'}, {'step_number': 3, 'description': '양송이 버섯은 4등분하고, 느타리 버섯은 잘게 찢어요.', 'image_url': 'https://recipe1.ezmember.co.kr/cache/recipe/2020/09/09/29b11b3006a4fcc9bfc1ebe117fbc7941.jpg'}, {'step_number': 4, 'description': '예열된 팬에 버터를 녹이고 새우살과 다진 마늘을 볶다(30초)가 버섯도 넣어 볶아요.', 'image_url': 'https://recipe1.ezmember.co.kr/cache/recipe/2020/09/09/1167377424dcda25fdd80fd1bd602a221.jpg'}, {'step_number': 5, 'description': '4에 우유1+1/2컵과 생크림을 넣어서 끓이고 걸쭉하게 농도를 맞추고 파마산 치즈가루, 소금, 후추를 약간 씩 넣어 간을 맞쳐요.', 'image_url': 'https://recipe1.ezmember.co.kr/cache/recipe/2020/09/09/a4349f21aaac75e6b2276a29687d3db51.jpg'}, {'step_number': 6, 'description': '구운 바게뜨 위에 볶은 재료를 올려 완성해요.', 'image_url': 'https://recipe1.ezmember.co.kr/cache/recipe/2020/09/09/98807c231e629020036f2c6d0cc759751.jpg'}]"
162932,빵,손님접대,해물류,볶음,[해양수산부 이달의 수산물 5월] 담백한맛의 일품 ★ 바지락바질카나페,바지락바질카나페,https://recipe1.ezmember.co.kr/cache/recipe/2019/04/30/fe4e2b00285000f41249ed6a0184c4bc1.jpg,936,20분 이내,초급,1인분,"[('바지락살', '30g'), ('버터', '20g'), ('모짜렐라치즈', '50g'), ('설탕', '1숟가락'), ('바질 페스토', '1/2숟가락'), ('다진마늘', '10g')]","성인병 예방의 탁월한 바지락 ★ 
카나페로 변신★ 손님초대에도 굳굳굳
세상의 모든 레시피 만개의레시피","[{'step_number': 1, 'description': '볼 위에 소금물과 바지락을 넣어 해감한다.볼 위에 소금물을 만들어 넣은 후 바지락을 넣어 해감 한다. 이때, 검은색 봉지 혹은 검은색 천을 덮어두면, 야간에 활동이 많은 바지락은 야간으로 착각하여 더욱 빨리 바지락 안의 모래(불순물)를 배출한다.', 'image_url': 'https://recipe1.ezmember.co.kr/cache/recipe/2019/04/30/9b07f60c23eb85131e71737b570479d51.jpg'}, {'step_number': 2, 'description': '냄비 안에 물과 바지락을 넣어 끓인 후 바지락을 흐르는 물에 씻어준다.', 'image_url': 'https://recipe1.ezmember.co.kr/cache/recipe/2019/04/30/f38c6d4d04892541ddf9809ecbc79b811.jpg'}, {'step_number': 3, 'description': '충분히 씻어 준 바지락의 껍질과 속살을 분리한 후, 속살은 한 번 짜내어 물기를 제거한다.', 'image_url': 'https://recipe1.ezmember.co.kr/cache/recipe/2019/04/30/e9476a5945e489ea57d4cc43eb7d43361.jpg'}, {'step_number': 4, 'description': '바게트빵을 3cm 두께로 어슷썰기를 하여 썰어 준비한다.', 'image_url': 'https://recipe1.ezmember.co.kr/cache/recipe/2019/04/30/f013be0b4887c175fe9d7e92c00ce26e1.jpg'}, {'step_number': 5, 'description': '예열된 팬에 버터를 녹인 후 바로 설탕, 바질페스토, 마늘, 바지락살을 넣어 중불에 볶는다.팬', 'image_url': 'https://recipe1.ezmember.co.kr/cache/recipe/2019/04/30/571df59bdaf907c35298dd8c98e5e0b91.jpg'}, {'step_number': 6, 'description': '바게트빵 위에 (바지락과 같이 볶아 놓은)바질 소스를 바른 후, 바지락을 올린다.', 'image_url': 'https://recipe1.ezmember.co.kr/cache/recipe/2019/04/30/a909af3fbdf04daddf807c37712293b31.jpg'}, {'step_number': 7, 'description': '바지락 바질을 올린 바게트빵 위에, 모짜렐라 치즈를 뿌린 뒤 전자레인지 또는 오븐에 약 2분간 가열한다.전자레인지 , 오븐전자레인지가 아닌, 오븐을 사용하면 더욱 바삭한 식감을 느낄 수 있다.', 'image_url': 'https://recipe1.ezmember.co.kr/cache/recipe/2019/04/30/08a85b3553030110199a48d6fc68471c1.jpg'}]"
