index,종류별,상황별,재료별,방법별,글 제목,레시피이름,레시피이미지,조회수,조리시간,난이도,인분,재료,소개글,조리순서
35651,메인반찬,손님접대,육류,굽기,훈제오리 구이와 오이고추막장무침,훈제오리구이,https://recipe1.ezmember.co.kr/cache/recipe/2018/05/18/eb4822085dd6a651441dd9abedc7b5091.jpg,"1,882",15분 이내,아무나,2인분,"[('훈제오리', '1/2마리'), ('오이고추', '3개'), ('홍고추', '1/2개'), ('쪽파', '1대'), ('참기름', '1작은술'), ('올리고당', '1작은술'), ('다진마늘', '1/2작은술'), ('막장', '2큰술')]","매일 식사를 준비하는 주부들에게 저녁메뉴를 고르는 것은 항상 고민인데요. 그래서 오늘은 간단하지만 푸짐하게 즐길 수 있는 저녁메뉴를 추천해드리려고 합니다~ 바로 훈제오리구이와 오이고추막장 무침인데요! 마트에서 쉽게 구할 수 있는 훈제오리와 오이고추, 막장만 있으면 푸짐한 저녁식사를 즐길 수 있답니다~ 그냥 먹어도 맛있는 훈제오리 구이에 오이고추막장무침을 곁들였으니 더욱 맛있겠죠? 그럼 지금부터 푸짐한 저녁메뉴 추천, 훈제오리 구이와 오이고추막장무침 만들기를 만나볼까요?","[{'step_number': 1, 'description': '오리를 한입 크기로 얇게 썰어 팬에 굽는다.', 'image_url': 'https://recipe1.ezmember.co.kr/cache/recipe/2018/05/18/9ea8d8e6bbb6380993c8331bc1a03c781.jpg'}, {'step_number': 2, 'description': '오이고추는 약 1.5cm 두께로 썰고 홍고추와 쪽파는 송송 썬다.', 'image_url': 'https://recipe1.ezmember.co.kr/cache/recipe/2018/05/18/cdf76d4212c63e8d06958bdab8c290a91.jpg'}, {'step_number': 3, 'description': '썰어둔 오이고추에 홍고추, 쪽파, 참기름, 올리고당, 다진마늘, 막장을 넣어 버무린다.', 'image_url': 'https://recipe1.ezmember.co.kr/cache/recipe/2018/05/18/7d12d713337a4d2dde1b3e4e14d02f3d1.jpg'}, {'step_number': 4, 'description': '접시에 구운 오리를 담고 오이고추막장무침을 곁들여 완성한다.', 'image_url': 'https://recipe1.ezmember.co.kr/cache/recipe/2018/05/18/e7bfdd81a100d01fd7a8b526ddaada161.jpg'}]"
35652,메인반찬,손님접대,육류,굽기,오리코스요리③ 메인요리 1 /생강레몬 오리오븐구이,오리오븐구이,https://recipe1.ezmember.co.kr/cache/recipe/2021/08/19/237be6d09ccf2aa677dc9bae9d11dd361.jpg,"1,096",60분 이내,고급,2인분,"[('오리 닭다리', '1개'), ('참나물', '1줌'), ('후추', '약간'), ('소금', '약간'), ('간장', '2T'), ('레몬즙', '1T'), ('생강', '1/2개'), ('마늘', '1/2t'), ('올리고당', '1T'), ('간장', '1t'), ('레몬즙', '1T'), ('벌꿀', '1t')]","오리의 여러부위로 오리코스요리를 만들어보았는데요~
세번째 코스로 메인요리입니다.
[오리코스요리③ 메인요리 1/생강레몬 오리오븐구이]
생강과 레몬을 베이스로 오리에 양념을 해서 오븐에 구웠어요
참나물을 레모즙양념에 새콤하게 무쳐 오리와 싸서 먹으면 참 맛있어요","[{'step_number': 1, 'description': '다양한 오리의 부위로 [오리 코스요리]를 만들었어요\n차례대로 게시물 공개하였습니다\n① 전채요리/ 오리찹쌀전병\n② 샐러드 요리/ 오리수삼 샐러드\n③ 메인요리 1/생강레몬 오리오븐구이 ◀◀◀◀◀\n④ 메인요리2/쌈장으로 맛을낸 오리주물럭 양배추쌈\n⑤ 후식요리/오리녹두죽', 'image_url': 'https://recipe1.ezmember.co.kr/cache/recipe/2021/08/19/7b8dfad3c8324d4714c33e64dfd991e41.jpg'}, {'step_number': 2, 'description': '♣생강레몬 오리오븐구이♣\n재료: 오리 닭다리1개, 참나물 한줌,후추,소금\n양념재료: 간장2T,레몬즙1T,생강1/2쪽,마늘1/2t,올리고당1T\n참나물소스: 간장1t , 레몬즙 1T,벌꿀 1t', 'image_url': 'https://recipe1.ezmember.co.kr/cache/recipe/2021/08/19/b97065cdc7394b13c8427ddeb83dab341.jpg'}, {'step_number': 3, 'description': '오리다리 껍질부위에는 긴 칼집을 넣어주시구요\n뒷쪽에는 짧은 칼집을 넣어주세요', 'image_url': 'https://recipe1.ezmember.co.kr/cache/recipe/2021/08/19/a01cd21a32869f14fa8a14ca792b079b1.jpg'}, {'step_number': 4, 'description': '생강 1/2쪽은 강판에 갈아 준비해주시구요', 'image_url': 'https://recipe1.ezmember.co.kr/cache/recipe/2021/08/19/818c76a6134e53cffda18bfb5aaaee2d1.jpg'}, {'step_number': 5, 'description': '레몬1T(레몬1/2개)과 생강갈은것을 섞어주세요', 'image_url': 'https://recipe1.ezmember.co.kr/cache/recipe/2021/08/19/f55f6b9aa4552af6d330fddb71804fbb1.jpg'}, {'step_number': 6, 'description': '생강레몬을 오리다리에 골고루 발라주세요,\n오리에 생강과 레몬향이 골고루 베어 잡내가 나지않고 향이 좋아져요', 'image_url': 'https://recipe1.ezmember.co.kr/cache/recipe/2021/08/19/4d02e467a9aba88effc6e75ff63825791.jpg'}, {'step_number': 7, 'description': '앞뒤로 소금 후추를 톡톡 뿌려서 20분동안 재워주세요~~', 'image_url': 'https://recipe1.ezmember.co.kr/cache/recipe/2021/08/19/4a6228f50ee71c2775a1428ba2c07d3f1.jpg'}, {'step_number': 8, 'description': '칼집 사이사이에 생강레몬즙이 골고루 들어가도록 \n잘 재워주시는것이 포인트예요', 'image_url': 'https://recipe1.ezmember.co.kr/cache/recipe/2021/08/19/7b63a5d1cb787738ebcd39420ae06dd41.jpg'}, {'step_number': 9, 'description': '예열된 오븐에서 180도에서 10분간 초벌구이를 해줍니다.\n(오븐사양은 집집마다 다르니 조절하세요.오리가 겉만 살짝 익었다 싶을정도면 됩니다)오븐', 'image_url': 'https://recipe1.ezmember.co.kr/cache/recipe/2021/08/19/57f18c798cfbbe0aa5763684e3fa99a71.jpg'}, {'step_number': 10, 'description': '본격적인 오븐구이의 소스를 만들어 볼께요~\n간장2T,레몬즙1T,생강1/2쪽,마늘1/2t,올리고당1T\n맛을보시고 기호에 맞게 단짠단짠을 조절해주세요~~', 'image_url': 'https://recipe1.ezmember.co.kr/cache/recipe/2021/08/19/eab0f1c3b6bc9fec6d60931e328e8ea11.jpg'}, {'step_number': 11, 'description': '초벌구이된 오리다리에 간장양념을 골고루 발라주세요', 'image_url': 'https://recipe1.ezmember.co.kr/cache/recipe/2021/08/19/86dc317c079bfc8bfd0cb2ad0dc1fb0d1.jpg'}, {'step_number': 12, 'description': '양념이 있어 높은온도에서는 탈수있으니\n160도에서 10분간 굽고 뒤집어서 10분간 구워주세요\n요새 나온 오븐은 뒤집지 않아도 된다니 ^^;;', 'image_url': 'https://recipe1.ezmember.co.kr/cache/recipe/2021/08/19/c75fb7879d705e36e8f07ba28c0afadf1.jpg'}, {'step_number': 13, 'description': '구워지면 한번더 양념을 발라주세요~~', 'image_url': 'https://recipe1.ezmember.co.kr/cache/recipe/2021/08/19/430d540b2700a300d34b3a0f3a72355a1.jpg'}, {'step_number': 14, 'description': '이때 레몬껍질을 슬라이스채에 썰어서 뿌려주시고 파슬리가루를 뿌려줍니다.\n그리고 다시한번 160도 온도에서 10분간 더 구워주시면 완성이요~~\n.', 'image_url': 'https://recipe1.ezmember.co.kr/cache/recipe/2021/08/19/272c765975bfb24a9edf1771827108a21.jpg'}, {'step_number': 15, 'description': '오리가 오븐속에서 마지막으로 구워지고 있을때 \n참나물을 무쳐주세요~~\n간장1t , 레몬즙 1T,벌꿀 1t 을 넣고 아주 새콤달콤하게 무쳐주세요~\n레몬의 새콤한맛이 포인트입니다.미리 무쳐놓으면 참나물이 숨이 죽어요', 'image_url': 'https://recipe1.ezmember.co.kr/cache/recipe/2021/08/19/b1e5b1fc3076ea3698f2679c394c3c081.jpg'}, {'step_number': 16, 'description': '두둥!!! 오븐속에서 꺼낸 오리오븐구이 예요~\n어때요?? 완젼 맛있게 구워졌죠?\n참나물무침과 함께 접시에 예쁘게 담아보았어요', 'image_url': 'https://recipe1.ezmember.co.kr/cache/recipe/2021/08/19/a563494c0abab421924467839c11a5731.jpg'}, {'step_number': 17, 'description': '슬라이스한 레몬껍질이 타면 안되니 주의하세요~', 'image_url': 'https://recipe1.ezmember.co.kr/cache/recipe/2021/08/19/418d65c6a4cc39169501c296fa2348001.jpg'}, {'step_number': 18, 'description': '잘라보았는데 완젼 속까지 폭~~익었어요~~\n레몬의 향이 겉과 속에 모두 베어서 어찌나 향긋하고 맛있던지요~새콤한맛은 사라지고 향긋함과 달콤함이 남아있네요', 'image_url': 'https://recipe1.ezmember.co.kr/cache/recipe/2021/08/19/d303c3d4c6f61d302090f2e6623ed5f61.jpg'}, {'step_number': 19, 'description': '새콤달콤한 참나물과 함께 같이 드시면 더욱더 풍미를 느끼실수가 있답니다.\n오리의 고소함! 쫄깃한 그맛! 잊을수가 없네요~\n주말저녁 가족들을 행복하게 해줄 요리임에는 틀림이 없습니다^^', 'image_url': 'https://recipe1.ezmember.co.kr/cache/recipe/2021/08/19/5b5f0970aa1021c3d67dfff3a9151f261.jpg'}]"
35653,메인반찬,손님접대,육류,굽기,단호박에 풍Duck~!,오리스테이크,https://recipe1.ezmember.co.kr/cache/recipe/2021/08/26/5fb66a6364d3e0a41faf622f065bf9771.jpg,697,60분 이내,초급,2인분,"[('미니단호박', '1통'), ('흰우유', '200ml'), ('슬라이스체다치즈', '2장'), ('다진마늘', '1ts'), ('다진양파', '2Ts'), ('소금', '소량'), ('후추', '소량'), ('올리브유', '1Ts'), ('오리고기 가슴살', '2덩어리'), ('소금', '약간'), ('후추', '약간'), ('타임', '소량'), ('통마늘', '2쪽'), ('무염버터', '2Ts')]","베타카로틴이 풍부한 단호박과 오리고기의 지방산은 몸속의 독소를 배출하는데에 도움을 주는 궁합이지요. 단호박 오리찜과 같은 대표음식이 있지만, 양식스타일로 재해석 해본 단호박퓨레를 곁들인 오리가슴살 스테이크 입니다!","[{'step_number': 1, 'description': '미니단호박을 반으로 가른 후, 씨를 제거하여 8등분 해줍니다.생 단호박은 단단해서 칼질 위험이 있으니 통으로 전자레인지에 1분 30초 돌린 후 자르시면 더 수월합니다!', 'image_url': 'https://recipe1.ezmember.co.kr/cache/recipe/2021/08/26/2b9bf48e7c9080bdf1750a167bffbc1c1.jpg'}, {'step_number': 2, 'description': '자른 단호박을 전자레인지에 7분간 돌려줍니다. 잘 익은 단호박은 한김 식힌 뒤 껍질과 분리하여 포크로 으깨줍니다.전자레인지', 'image_url': 'https://recipe1.ezmember.co.kr/cache/recipe/2021/08/26/5ba6d5a9d680287e73a6cb794496b2a61.jpg'}, {'step_number': 3, 'description': '잘게 으깬 단호박에 우유 200ml를 넣고 잘 섞어줍니다.', 'image_url': 'https://recipe1.ezmember.co.kr/cache/recipe/2021/08/26/9b274327791c52cac9f29a1c57152e1f1.jpg'}, {'step_number': 4, 'description': '다진마늘, 다진양파, 슬라이스 체다치즈까지 준비해줍니다.', 'image_url': 'https://recipe1.ezmember.co.kr/cache/recipe/2021/08/26/35276c55a97b653fcf81c5f3e260b9861.jpg'}, {'step_number': 5, 'description': '냄비에 올리브유를 넣고 다진 마늘과 다진 양파를 함께 볶아줍니다.우유가 들어가는 재료이니 두꺼운 코팅팬이나 냄비를 사용해주세요!', 'image_url': 'https://recipe1.ezmember.co.kr/cache/recipe/2021/08/26/ee301918d052afcbcdb60a861bc7fb2f1.jpg'}, {'step_number': 6, 'description': '양파와 마늘이 볶아지면 우유와 단호박 섞은것을 부어줍니다. 끓어오를때까지 약불에서 잘 저어가며 끓여줍니다.우유는 금방 눌러붙기 때문에 잘 저어가며 끓여주세요!', 'image_url': 'https://recipe1.ezmember.co.kr/cache/recipe/2021/08/26/a224c119537d21c9f6109f3fa47a9c481.jpg'}, {'step_number': 7, 'description': '끓어오른 퓨레에 슬라이스 치즈 2장을 잘 녹여주고 소금 후추로 간을 해줍니다.', 'image_url': 'https://recipe1.ezmember.co.kr/cache/recipe/2021/08/26/589e4d3b1d82183ea07396c4123738071.jpg'}, {'step_number': 8, 'description': '오리 가슴살은 껍질에 칼집을 내주고 소금후추를 앞뒤로 뿌려 준비합니다.', 'image_url': 'https://recipe1.ezmember.co.kr/cache/recipe/2021/08/26/618597d67dc74ea46700f18fcb52002d1.jpg'}, {'step_number': 9, 'description': '기름을 두르지 않은 팬에 껍질면을 아래로 향하게 고기를 올린 뒤, 약불로 켜줍니다.오리고기에서 기름이 나오기 때문에 기름을 사용할 필요가 없습니다!', 'image_url': 'https://recipe1.ezmember.co.kr/cache/recipe/2021/08/26/a7776c48e25ff62b27cc7bbfad1871491.jpg'}, {'step_number': 10, 'description': '처음 껍질면에서 5분, 뒤집어서 버터와 타임 통마늘을 넣고 3분, 옆면은 각각 1분씩 총 2분 구워줍니다.', 'image_url': 'https://recipe1.ezmember.co.kr/cache/recipe/2021/08/26/774d7629659a1306fc727bc0ff4c5c971.jpg'}, {'step_number': 11, 'description': '다 구워진 고기는 쿠킹호일에 감싸 7분간 레스팅 해줍니다.이렇게 하면 미디움 정도의 굽기입니다!', 'image_url': 'https://recipe1.ezmember.co.kr/cache/recipe/2021/08/26/2f05ae58e706ab2151094bdad0cf7ab81.jpg'}, {'step_number': 12, 'description': '넓은 접시에 단호박 퓨레를 펼쳐 담고 그 위에 레스팅이 끝난 오리가슴살을 얹어 마무리 합니다.', 'image_url': 'https://recipe1.ezmember.co.kr/cache/recipe/2021/08/26/372cf5c590bf257ea7046e36766219bd1.jpg'}]"
35654,메인반찬,손님접대,육류,굽기,떡갈비!!!,떡갈비,https://recipe1.ezmember.co.kr/cache/recipe/2021/11/16/395b8fe19e73e85603b2504eaad55d701.jpg,"2,882",20분 이내,초급,2인분,"[('소고기다짐육', '300g'), ('돼지고기다짐육', '140g'), ('양파', '1개'), ('쪽파', '5뿌리'), ('다진마늘', '1스푼'), ('진간장', '1스푼'), ('맛술', '1스푼'), ('참기름', '1/2스푼'), ('생강가루', '약간'), ('후춧가루', '약간'), ('통깨', '1스푼')]",돼지고기 다짐육하고 소고기다짐육을 환상적인 조합으로 만들어낸 떡갈비는 집에서 만들어서 달지않으면서 맛있는 떡갈비가 완성이 되었습니다.,"[{'step_number': 1, 'description': '떡갈비를 직접 만들었다는 생각에 마음이 뿌듯합니다. 직접 만들어서 더 건강한 떡갈비 지금부터 레시피를 공개합니다.', 'image_url': 'https://recipe1.ezmember.co.kr/cache/recipe/2021/11/16/043c96d98df57a6fca240a2166efe5251.jpg'}, {'step_number': 2, 'description': '소고기와 돼지고기를 적당량을 준비합니다.\n쪽파와 양파를 썰어서 넣어주세요.\n다진마늘을 넣어주세요.\n생강가루를 넣어주세요.\n양념이 모두 베이도록 조물조물 섞어주세요.', 'image_url': 'https://recipe1.ezmember.co.kr/cache/recipe/2021/11/16/f71d1c2d6ae009753e5cb6d23300d1af1.jpg'}, {'step_number': 3, 'description': '먹기좋은 크기로 동그랗게 만들어 주세요.\n너무 두꺼우면 속까지 익으려면 시간이 오래걸리고 탈수있으니 적당한 두께로 만들어 주세요.', 'image_url': 'https://recipe1.ezmember.co.kr/cache/recipe/2021/11/16/e3f5ea212b36cb9a0d58a755e135957d1.jpg'}, {'step_number': 4, 'description': '적당한 크기로 동그랗게 만들어 준비합니다.', 'image_url': 'https://recipe1.ezmember.co.kr/cache/recipe/2021/11/16/4519a81ce6f8f03c8c676fbce7e51ce61.jpg'}, {'step_number': 5, 'description': '후라이팬에 기름을 두른후 앞뒤로 노릇노릇하게 구워주세요.', 'image_url': 'https://recipe1.ezmember.co.kr/cache/recipe/2021/11/16/486c3e2a642d54627fa2aac8a70b733a1.jpg'}, {'step_number': 6, 'description': '두께가 있다보니 약한불을 이용해서 앞뒤로 구워주세요.', 'image_url': 'https://recipe1.ezmember.co.kr/cache/recipe/2021/11/16/833c0622fc4a8b35cf1021a092a532501.jpg'}, {'step_number': 7, 'description': '뚜껑을 닫아준후에 불을 약하게 해서 구워냅니다.', 'image_url': 'https://recipe1.ezmember.co.kr/cache/recipe/2021/11/16/59953ceebd3c80295d770dbf3211647b1.jpg'}, {'step_number': 8, 'description': '이정도면 떡갈비가 완성이 되었다는 생각이 들때쯤 꺼내면 됩니다.', 'image_url': 'https://recipe1.ezmember.co.kr/cache/recipe/2021/11/16/ed4e257af61aed084959eade0f0059331.jpg'}, {'step_number': 9, 'description': '사각접시위에 부추를 올려주세요.', 'image_url': 'https://recipe1.ezmember.co.kr/cache/recipe/2021/11/16/a09dc0f50c9d14ddec83f203238d88041.jpg'}, {'step_number': 10, 'description': '떡갈비 위에 잣가루를 뿌리고 대추꽃을 살짝 올려주세요.', 'image_url': 'https://recipe1.ezmember.co.kr/cache/recipe/2021/11/16/de59192e8aefc5001cc021996cf64e2a1.jpg'}, {'step_number': 11, 'description': '먹음직 스러운 떡갈비가 완성이 되었습니다.', 'image_url': 'https://recipe1.ezmember.co.kr/cache/recipe/2021/11/16/7e31ee2eb64d17efe334639d1d8443ff1.jpg'}, {'step_number': 12, 'description': '식탁위에 떡갈비 꽃이 피었습니다.', 'image_url': 'https://recipe1.ezmember.co.kr/cache/recipe/2021/11/16/360ca59ee95757839d014c2d84df91ef1.jpg'}, {'step_number': 13, 'description': '우리집 식탁위에 떡갈비 꽃이 피었습니다.', 'image_url': 'https://recipe1.ezmember.co.kr/cache/recipe/2021/11/16/b720cfd26d75927b56fc058b70a9f5361.jpg'}]"
35655,메인반찬,손님접대,육류,굽기,훈제오리 무쌈말이 (겨자소스),훈제오리무쌈말이,https://recipe1.ezmember.co.kr/cache/recipe/2022/04/05/defbc794e6dc73f29684104a91bbd2d11.jpg,"3,941",60분 이내,아무나,2인분,"[('훈제오리', '250g'), ('노랑 파프리카', '1/2개'), ('빨강 파프리카', '1/2개'), ('오이', '1개'), ('소금', '1/2수저'), ('무순', '적당량'), ('쌈무', '적당량'), ('후추', '약간'), ('허니머스터드', '1수저'), ('마요네즈', '1수저'), ('연겨자', '1/3수저'), ('레몬즙', '1수저'), ('올리고당', '1수저')]","훈제오리 무쌈은 만들기도 간편하고 비주얼이 예뻐서
손님초대요리로 추천드려요^^","[{'step_number': 1, 'description': '오이는 표면에 굵은소금 1/2수저를 뿌려서 박박 문질러 주세요.', 'image_url': 'https://recipe1.ezmember.co.kr/cache/recipe/2022/04/05/f5b2d8ab1921c477c9b349c92a59985d1.jpg'}, {'step_number': 2, 'description': '소금에 박박 문지른 오이는 흐르는 물에 깨끗이 헹궈줍니다.', 'image_url': 'https://recipe1.ezmember.co.kr/cache/recipe/2022/04/05/a378f5615cc321deef5cbe59948b687f1.jpg'}, {'step_number': 3, 'description': '무순도 흐르는 물에 헹궈주고 파프리카도 깨끗이 씻어주세요.', 'image_url': 'https://recipe1.ezmember.co.kr/cache/recipe/2022/04/05/c51ee497041d7cd7b8670850ed6a4ebd1.jpg'}, {'step_number': 4, 'description': '파프리카는 반으로 잘라서 씨를 제거하고 적당한 두께로 채 썰어 줍니다.', 'image_url': 'https://recipe1.ezmember.co.kr/cache/recipe/2022/04/05/e84a84863fc06d615c0418d90ae08e471.jpg'}, {'step_number': 5, 'description': '오이도 중간에 씨 부분은 제외하고 적당한 두께로 채 썰어 주세요. 길이는 파프리카 길이와 비슷하게 썰어주시면 돼요.야채의 길이와 두께를 비슷하게 맞춰서 썰어주어야 모양이 더 예쁘고 깔끔해요.', 'image_url': 'https://recipe1.ezmember.co.kr/cache/recipe/2022/04/05/9682f89d4bbbea1b7b278daece2146f81.jpg'}, {'step_number': 6, 'description': '쌈무는 물기를 짜서 준비합니다.', 'image_url': 'https://recipe1.ezmember.co.kr/cache/recipe/2022/04/05/834c9072d3f4ebb4df8b7fe41fea60a81.jpg'}, {'step_number': 7, 'description': '훈제오리는 끓는 물에 데쳐서 기름기를 제거해 주거나 저처럼 따뜻한 물을 끼얹어가며 헹궈주세요.슬라이스 된 훈제오리 사이사이 기름기가 꽤 많아서 따듯한 물에 헹궈준 뒤 물기를 빼서 구워주면 기름기도 적고 맛도 깔끔할 뿐 아니라 굽기도 편해요.', 'image_url': 'https://recipe1.ezmember.co.kr/cache/recipe/2022/04/05/1727958723a2ca27526626316d2128cb1.jpg'}, {'step_number': 8, 'description': '달군 프라이팬에 훈제오리를 올리고 후추를 전체적으로 뿌려주세요.', 'image_url': 'https://recipe1.ezmember.co.kr/cache/recipe/2022/04/05/9b13499fbff96aa569d98e2a17dd433c1.jpg'}, {'step_number': 9, 'description': '중불에 앞뒤로 노릇노릇하게 구워줍니다.훈제오리는 이미 훈연되어 나온 제품 이라서 오래 구울 필요는 없어요. 너무 오래 구우면 오히려 딱딱해져요.', 'image_url': 'https://recipe1.ezmember.co.kr/cache/recipe/2022/04/05/4822fa13d45135a8259699f4db4abf581.jpg'}, {'step_number': 10, 'description': '구워준 오리는 키친타월 위에 올려서 한 번 더 기름기를 제거해 주세요.', 'image_url': 'https://recipe1.ezmember.co.kr/cache/recipe/2022/04/05/1e35dbbe644750da43bce7c85ccd16421.jpg'}, {'step_number': 11, 'description': '썰어둔 야채와 재료들을 가지런히 담아주세요.', 'image_url': 'https://recipe1.ezmember.co.kr/cache/recipe/2022/04/05/1cc5cb8f7095de041cf8c0bfd2000f331.jpg'}, {'step_number': 12, 'description': '허니 머스터드 1수저, 마요네즈 1수저, 연겨자 1/3수저, 레몬즙 1수저, 올리고당 1수저를 넣고 잘 섞어서 소스를 만들어 주세요.', 'image_url': 'https://recipe1.ezmember.co.kr/cache/recipe/2022/04/05/2750a0236fac2c138cedf85edbac88c61.jpg'}, {'step_number': 13, 'description': '도마 위에 물기를 뺀 무쌈을 올리고 훈제오리를 가운데 올려줍니다.', 'image_url': 'https://recipe1.ezmember.co.kr/cache/recipe/2022/04/05/22877c7f34f092ff2b918daa86a14e771.jpg'}, {'step_number': 14, 'description': '훈제오리고기 위에 오이와 파프리카를 나란히 올려주세요.', 'image_url': 'https://recipe1.ezmember.co.kr/cache/recipe/2022/04/05/90371f6a5775a9cd578bf85dd15f81741.jpg'}, {'step_number': 15, 'description': '마지막으로 무순을 가운데 올려줍니다.', 'image_url': 'https://recipe1.ezmember.co.kr/cache/recipe/2022/04/05/00a14ace9a23406b770a941fb792d68a1.jpg'}, {'step_number': 16, 'description': '쌈무로 재료를 싸 줍니다.너무 헐렁하게 싸면 젓가락으로 집어먹을 때 풀릴 수 있으니 쌈무를 살짝 당겨서 포개듯이 잘 싸줍니다.약간 타이트하게 말아주면 먹을 때 젓가락으로 집어도 쌈이 안 풀리고 깔끔하게 유지돼요.', 'image_url': 'https://recipe1.ezmember.co.kr/cache/recipe/2022/04/05/0bdcdaa079810da4a29f1eba7c4e46531.jpg'}, {'step_number': 17, 'description': '접시에 빙둘러서 완성해 줍니다. 가운데 소스를 놓아주세요.', 'image_url': 'https://recipe1.ezmember.co.kr/cache/recipe/2022/04/05/b7915551b72ec2c1a8c8bceb2a4aa67f1.jpg'}]"
35656,메인반찬,손님접대,육류,굽기,단호박훈제오리구이 ) 치즈 넣고 구워 단짠단짠 고소한 단호박훈제오리치즈구이~,단호박훈제오리구이,https://recipe1.ezmember.co.kr/cache/recipe/2023/07/12/4de88a08ca198705374e099a4a1229671.jpg,"2,385",60분 이내,초급,2인분,"[('단호박', '2개'), ('훈제오리', '200g'), ('치즈', '50g'), ('머스타드', '')]",복날 삼계탕만 먹기 지겨워 오리요리를 한 번 해봤어요~^^ 치즈를 넣고 구워서 단짠단짠 고소한게 너무 맛있게 잘먹었어요. 아주아주 간단하니 한 번 만들어드세요.,"[{'step_number': 1, 'description': '- 미니 단호박 2개를 흐르는 물에 엄청 깨끗하게 씻어서 전자레인지에 3분 정도 돌려주세요. (단호박 1개는 2분 정도 돌려주세요.)', 'image_url': 'https://recipe1.ezmember.co.kr/cache/recipe/2023/07/12/30d5f7b660ca6fcc88feaac6adffcf311.jpg'}, {'step_number': 2, 'description': '- 살짝 익은 단호박은 꼭지 부분을 네모로 잘라 빼주세요.', 'image_url': 'https://recipe1.ezmember.co.kr/cache/recipe/2023/07/12/43cda5189e2b757acf3685a6107df3471.jpg'}, {'step_number': 3, 'description': '- 티스푼으로 속을 파주세요.', 'image_url': 'https://recipe1.ezmember.co.kr/cache/recipe/2023/07/12/4a262a7a7f50471130ff343b557f21c11.jpg'}, {'step_number': 4, 'description': '- 오리는 프라이팬에 앞뒤로 구워주세요.', 'image_url': 'https://recipe1.ezmember.co.kr/cache/recipe/2023/07/12/08bf7aa8570a2aaa038ad6e578f6a9aa1.jpg'}, {'step_number': 5, 'description': '- 구운 오리는 속을 파놓은 단호박 안에 넣어주세요.', 'image_url': 'https://recipe1.ezmember.co.kr/cache/recipe/2023/07/12/b8f9fb5fd15515b792fc33bf4ad58b111.jpg'}, {'step_number': 6, 'description': '- 에어프라이어나 오븐에 175 ° C에 15분간 구워주세요. 15분 뒤 혹시 익지 않으면 조금 더 구워주세요.', 'image_url': 'https://recipe1.ezmember.co.kr/cache/recipe/2023/07/12/a2c2dbf0482030fb39cb4c8c3611a66d1.jpg'}, {'step_number': 7, 'description': '- 다 익은 단호박은 칼로 잘라서 살짝 벌려주세요.', 'image_url': 'https://recipe1.ezmember.co.kr/cache/recipe/2023/07/12/7e00bccc3a1a13d6d8f16875b0d8009a1.jpg'}, {'step_number': 8, 'description': '- 훈제오리 위에 치즈를 얹어주시고, 에어프라이어나 오븐에 치즈가 녹을 때까지 돌려주세요(약 2~3분간 돌려주세요.)', 'image_url': 'https://recipe1.ezmember.co.kr/cache/recipe/2023/07/12/09fef7bc384599c7b907436cd24ebae21.jpg'}, {'step_number': 9, 'description': '- 조심히 꺼내서 맛있게 드세요. (단호박에 오리를 올려서 같이 드시면 맛있습니다.)', 'image_url': 'https://recipe1.ezmember.co.kr/cache/recipe/2023/07/12/8d1ad8ae327578ef47d8802a2453da6b1.jpg'}]"
