index,종류별,상황별,재료별,방법별,글 제목,레시피이름,레시피이미지,조회수,조리시간,난이도,인분,재료,소개글,조리순서
36584,메인반찬,손님접대,해물류,찜,제철새우 듬뿍 매콤한~새우찜 - 딸에게#/제철음식 [원산지표시제도],None,https://recipe1.ezmember.co.kr/cache/recipe/2015/07/28/79e9f01ea625fe59590f947f96e3d3c31.jpg,"13,280",None,None,None,[],,[]
36585,메인반찬,손님접대,해물류,찜,홍합 콩나물찜,홍합콩나물찜,https://recipe1.ezmember.co.kr/cache/recipe/2015/08/05/ba2e1199ec128b99427cf54840a7548a.jpg,"15,751",60분 이내,중급,2인분,"[('홍합', ''), ('콩나물', ''), ('맛술', ''), ('대파', ''), ('물녹말', '2큰술'), ('참기름', ''), ('깨', ''), ('물', '1.5큰술'), ('녹말', '1.5큰술'), ('고추가루', '2큰술'), ('다진마늘', '1큰술'), ('맛술', '1큰술'), ('양조간장', '1큰술'), ('올리고당', '1큰술'), ('소금', '1/3큰술'), ('후추가루', '약간'), ('멸치액젓', '1작은술')]",요즘 홍합이 제철이라고 하죠! 얼마전에 홍합 사다가 홍합탕을 끓여먹긴했는데 홍합알이 작아서 너무 아쉬웠어요~ 그래서 이번에는 얌코리아에서 구입한 홍합으로 맛있는 요리를 했답니다~,"[{'step_number': 1, 'description': '깨끗하게 씻은 홍합넣고 물 반컵넣고 맛술 넣고 센불에서 끓이다가 끓기시작하면 중약불로 줄여서 3분간 더 익혀주세요. 홍합은 건져내고 나온 육수는 그릇에 담아주세요.', 'image_url': 'https://recipe1.ezmember.co.kr/cache/recipe/2015/08/05/0f19eabad2561a66762d0da6405d17a71.jpg'}, {'step_number': 2, 'description': '냄비에 육수 2/3컵을 넣어주세요.', 'image_url': 'https://recipe1.ezmember.co.kr/cache/recipe/2015/08/05/2c3e00e088a2c1c85607b0e09dd7d9d51.jpg'}, {'step_number': 3, 'description': '분량의 재료로 양념장을 만들어주세요.', 'image_url': 'https://recipe1.ezmember.co.kr/cache/recipe/2015/08/05/b03f61ba1b193aa3f6571799784499521.jpg'}, {'step_number': 4, 'description': '육수넣고 양념장 잘 풀어넣고 홍합넣고 뚜껑을 연채 센 불에서 끓여주세요. 대하 등 다른 해산물을 넣으셔도 좋아요. 전 뽀나수로 대하 4마리도 넣었답니다.', 'image_url': 'https://recipe1.ezmember.co.kr/cache/recipe/2015/08/05/f0ecee6ac7c0ce91a740954de356ce381.jpg'}, {'step_number': 5, 'description': '콩나물 얹고 뚜껑덮어서 중간불에서 2분간 조리해 주세요~', 'image_url': 'https://recipe1.ezmember.co.kr/cache/recipe/2015/08/05/2cbafd9047e2702d5d1a747a6133dea91.jpg'}, {'step_number': 6, 'description': '대파넣고 30초간 버무려 주세요~ 밑에 깔린 양념장이랑 위에 콩나물이랑 잘 섞어주세요~', 'image_url': 'https://recipe1.ezmember.co.kr/cache/recipe/2015/08/05/fd17022aef4902289b0cedd6690101621.jpg'}, {'step_number': 7, 'description': '물녹말 2큰술을 골고루 잘 붓고 섞어주세요. 걸쭉해지면 참기름 두르고 불 꺼주세요~', 'image_url': 'https://recipe1.ezmember.co.kr/cache/recipe/2015/08/05/e7d106cd35b048fc1597c1b818d951461.jpg'}, {'step_number': 8, 'description': '접시에 담고 깨뿌려서 마무리~', 'image_url': 'https://recipe1.ezmember.co.kr/cache/recipe/2015/08/05/0dff47a0407e3098ed02cf640aa4e1e31.jpg'}]"
36586,메인반찬,손님접대,해물류,찜,꽃게찜,꽃게찜,https://recipe1.ezmember.co.kr/cache/recipe/2015/09/23/5a4dbb3c61e5ef48862b9e7b470cd7e1.jpg,"19,453",60분 이내,초급,2인분,"[('꽃게', '2마리'), ('콩나물 찜용', '466g'), ('양파', '80g'), ('미나리', '380g'), ('미더덕', '2주먹'), ('물', '2컵'), ('국멸치', '5~6마리'), ('다시마 작은거', '1개'), ('매콤한 고춧가루', '5큰술'), ('진간장', '2큰술'), ('설탕', '1큰술'), ('맛술', '2큰술'), ('다진마늘', '2큰술'), ('식용유', '1큰술'), ('후추', '조금'), ('녹말물', '4큰술'), ('참기름', ''), ('깨', '적당량')]",매콤하고 부드러운 꽃게찜입니다.,"[{'step_number': 1, 'description': '우선 양념장 만들어서 준비해주시구요. 미더덕도 잘 씻어서 준비해주세요. 미나리는 이파리는 떼어내시고 줄기부분만 준비 4~5센치정도 길이로 준비 양파도 채썰어준비 콩나물은 머리 꼬리 떼어내고 준비하세요.', 'image_url': 'https://recipe1.ezmember.co.kr/cache/recipe/2015/09/23/c8cc8f24d3e532bb3fd6c5a833d8cc4b1.jpg'}, {'step_number': 2, 'description': '파티웍에 물 2컵 부어주시고 멸치 머리랑 내장 빼고 넣고 다시마 넣고 중불에서 끓여주시다가 다시마는 끓기전에 건지고 나머지는 조금 더 끓여주다가 건져내기 꽃게딱지 꽃게, 미더덕 넣고 양념장을 넣어서 잘 섞어주고 2분정도 어우러지면서 끓게 하고 콩나물이랑 양파 넣어서 뚜껑 닫고 10분정도 끓입니다.', 'image_url': 'https://recipe1.ezmember.co.kr/cache/recipe/2015/09/23/2c55ff322aa74398cbabf923d17e2f1b1.jpg'}, {'step_number': 3, 'description': '10분 지나면 뚜껑 열어서 양념을 콩나물과 잘 어우러지게 버무린후 미나리 넣어서 버무리고 간을 보셔서 싱거우면 소금 약간 더하세요. 그리고 후추랑 참기름 깨 넣어주시고요. 마지막으로 녹말물을 농도봐가며 넣어주시면 됩니다.', 'image_url': 'https://recipe1.ezmember.co.kr/cache/recipe/2015/09/23/ae6f5f06cd65c97d12abf5838bda6d191.jpg'}]"
36587,메인반찬,손님접대,해물류,찜,롤치즈 해산물송편 단호박찜,단호박찜,https://recipe1.ezmember.co.kr/cache/recipe/2015/10/01/8efad6b09bb4f413a86cb80af5b2c63e.jpg,"5,813",30분 이내,초급,4인분,"[('해물모듬', ''), ('단호박', ''), ('송편', ''), ('롤치즈', ''), ('대파', ''), ('청양고추', ''), ('양파', ''), ('깻잎', ''), ('고추장', ''), ('고춧가루', ''), ('다진마늘', ''), ('다진생강', ''), ('간장', ''), ('후춧가루', ''), ('올리고당', ''), ('후춧가루', ''), ('참기름', '')]","각종 해산물을 넣고 여기에 송편을 넣어서 단호박찜을 만들어 보았어요. 일반적으로 그냥 가래떡이나 떡볶이떡을 많이 사용하시는데, 이렇게 송편을 사용하면 송편속에 달콤함이 있어서 같이 먹으면 더욱 맛있답니다.","[{'step_number': 1, 'description': '단호박은 꼭지 부분만 칼로 깊숙이 넣어서 잘라주고, 속의 씨를 깨끗이 파 냅니다. 접시에 단호박을 올리고 랩을 씌운후 전자렌지에 약 7~8분정도 돌려줍니다. 돌려준 단호박 속의 수분을 따라 버립니다.전자레인지', 'image_url': 'https://recipe1.ezmember.co.kr/cache/recipe/2015/10/05/93b16a881e41aa684e508ddc7c5008c41.jpg'}, {'step_number': 2, 'description': '볼에 양념재료를 모두 넣어 양념장을 만들어 줍니다.', 'image_url': 'https://recipe1.ezmember.co.kr/cache/recipe/2015/10/05/f2ba2ae304104695413131a77e543e421.jpg'}, {'step_number': 3, 'description': '각종 해산물은 끓는 물에 넣어서 살짝 데친후 채망에 담아 물을 빼줍니다.', 'image_url': 'https://recipe1.ezmember.co.kr/cache/recipe/2015/10/05/d7d67372c788801cd2ddb11e36eacb9d1.jpg'}, {'step_number': 4, 'description': '말랑말랑 송편을 준비합니다. 그냥 떡보다는 송편이 속에 달콤함이 있어서 더욱 맛있어요. 롤치즈는 후라이팬에 듬뿍 넣어서 녹여줍니다.', 'image_url': 'https://recipe1.ezmember.co.kr/cache/recipe/2015/10/05/fd67decf45fff783d2c783596ecdb61c1.jpg'}, {'step_number': 5, 'description': '각종 채소를 손질하여 깨끗이 씻은후 채썰어줍니다. 후라이팬에 해산물과 각종채소를 넣고 들기름을 부은후 볶아줍니다. 여기에 송편과 양념장을 넣어서 센불에 재빨리 볶아줍니다. 그래야 물이 생기지 않아요.', 'image_url': 'https://recipe1.ezmember.co.kr/cache/recipe/2015/10/05/234bcf25c4b0504482febd0de3614b611.jpg'}, {'step_number': 6, 'description': '단호박에 볶은 재료를 듬뿍 넣고 그 위에 녹인 롤치즈를 듬뿍 올려줍니다. 210도로 예열한 오븐에서 15~20분정도 구워줍니다.오븐', 'image_url': 'https://recipe1.ezmember.co.kr/cache/recipe/2015/10/05/12160232347cf878658490bf29073ead1.jpg'}]"
36588,메인반찬,손님접대,해물류,찜,그리 어렵지 않은 [오징어순대]만들기,오징어순대,https://recipe1.ezmember.co.kr/cache/recipe/2016/03/25/1e519539d4c9e4ca42db6d473926f1121.jpg,"6,162",60분 이내,아무나,3인분,"[('오징어 작은것', '3마리'), ('돼지고기 갈은것', '2큰술'), ('두부', '1/2모'), ('양파', '1/2개'), ('다진파', '4큰술'), ('당근                                                                                다진것', '4큰술'), ('다진마늘', '1큰술'), ('소금', '1/2작은술'), ('간장', '1작은술'), ('된장', '1작은술'), ('통깨', '1작은술'), ('참기름', '1큰술'), ('후추', '약간'), ('간장', '1큰술'), ('물', '1큰술'), ('물엿', '1큰술'), ('미림                                                                                또는 맛술', '1큰술'), ('설탕', '1큰술'), ('고추냉이', '1작은술'), ('녹말물', '1작은술')]","오징어볶음,오징어무침만 먹다가 별식으로 오징어순대를 만들었더니 가족모두 맛진 시간이었습니다.","[{'step_number': 1, 'description': '손질 되어 있지 않은 오징어는\n껍질과 귀?부분은 그대로 사용하고,\n내장만 제거해 줍니다.', 'image_url': 'https://recipe1.ezmember.co.kr/cache/recipe/2016/03/25/af7b9e02d44c0a0e27d2db81157fa6b31.jpg'}, {'step_number': 2, 'description': '손질 된 오징어를 재빨리 세척해 준 다음\n채에 받쳐 물기를 빼줍니다.', 'image_url': 'https://recipe1.ezmember.co.kr/cache/recipe/2016/03/25/4e3e0501f636c9eaef6273a19d42a4921.jpg'}, {'step_number': 3, 'description': '속은 좀 넉넉하게 만들어 \n남으면 동그랑땡을 만들어도 좋습니다.\n손바닥 만한 오징어 3마리에 들어가고도 충분히 남는 분량의 속재료\n돼지고기 갈은것 (또는 쇠고기) 2큰술\n두부 1/2모 물기 꽉 짠것\n양파1/2개 다진것\n다진파 4큰술\n다진당근 4큰술\n다진마늘 1큰술\n소금1/2 작은술\n간장 1작은술\n된장 1작은술\n통깨 1작은술\n참기름 1큰술\n후추약간', 'image_url': 'https://recipe1.ezmember.co.kr/cache/recipe/2016/03/25/aab0b658a114035800fa196ba01b39e61.jpg'}, {'step_number': 4, 'description': '반죽이 날리지 않고 끈기있게 하기위해\n계란1개를 넣습니다.', 'image_url': 'https://recipe1.ezmember.co.kr/cache/recipe/2016/03/25/6291d1b08f4bd9fe995eddf11673fe091.jpg'}, {'step_number': 5, 'description': '오징어 다리는 끓는 물에 살짝데쳐\n씹기좋은 크기로 잘게 썰어\n속재료에 함께 섞어줍니다.\n오징어 다리를 끓는물에 데쳐서 넣어야 \n찌는 과정에서 물이 생기지 않습니다.', 'image_url': 'https://recipe1.ezmember.co.kr/cache/recipe/2016/03/25/612ede5dc47594db3672311ed7b328011.jpg'}, {'step_number': 6, 'description': '오징어 몸통 속에 밀가루를 바룬다음\n속을 채워주어야 \n오징어를 찐후에도 속이 오징어에 잘 붙어있습니다.\n속 재료는 \n오징어 몸통속의 1/2정도만 \n엉성하게,헐겁게 채워주고\n입구를 이쑤시개 등으로 홈질해 줍니다.\n오징어는 익으면 아주 많이 수축하기 때문에\n반드시 속을 헐겁에 넣어주어야합니다.\n한김오른 찜기에 오징어를 넣고 \n뚜껑닫고 15분정도 익혀줍니다.\n반드시 충분히 김이 오른 상태에서 오징어를 넣어야\n시간도 절약되고\n수분도 덜 빠지게 됩니다.', 'image_url': 'https://recipe1.ezmember.co.kr/cache/recipe/2016/03/25/eceb5fc8a01bf4394b9d03af15368aac1.jpg'}, {'step_number': 7, 'description': '1시간정도 충분히 식힌 후에\n칼을 톱질하 듯 썰어주어야 속이 빠지지 않습니다.', 'image_url': 'https://recipe1.ezmember.co.kr/cache/recipe/2016/03/25/c7b98351b67d639f441949bf96a32f191.jpg'}, {'step_number': 8, 'description': '오징어순대에 곁들일 간장소스는\n간장 2큰술\n물 1큰술\n물엿 1큰술\n미림 (또는 맛술) 1큰술\n설탕 1큰술\n고추냉이 1작은술\n물녹말 1작은술 (물과 녹말가루를 1:1)\n위의 재료들을 잘 섞은 후\n바글바글 한번 끓여 준비합니다.', 'image_url': 'https://recipe1.ezmember.co.kr/cache/recipe/2016/03/25/c763286bee27bf7adb047bee20fbd64f1.jpg'}, {'step_number': 9, 'description': '먹기 좋게 썰은 오징어순대를 그릇에 담고\n간장겨자소스를 적당히 올려줍니다.', 'image_url': 'https://recipe1.ezmember.co.kr/cache/recipe/2016/03/25/83c156b345a79861e63d63cd9661915c1.jpg'}, {'step_number': 10, 'description': '청경채 겉절이를 오징어순대와 함께 곁들이면 \n깔끔한 맛의 어우러짐이 좋습니다.', 'image_url': 'https://recipe1.ezmember.co.kr/cache/recipe/2016/03/25/98b2530136b0a702f47aafb74f203e231.jpg'}]"
36589,메인반찬,손님접대,해물류,찜,가리비와인찜,가리비와인찜,https://recipe1.ezmember.co.kr/cache/recipe/2015/05/23/84ef12c44a65ef71d41780416981b8df1.jpg,"6,098",30분 이내,아무나,3인분,"[('가리비', '18개'), ('마늘', '5쪽'), ('생강', '1톨'), ('화이트 와인', '100ml'), ('포도시유', '1.5큰술')]",간단한 방법으로 향기롭고 맛있는 가리비 요리를 할 수 있는 가리비와인찜을 소개합니다.,"[{'step_number': 1, 'description': '조금 단단한 솔을 이용해 가리비 겉면에 붙어 있는 불순물을 제거해줍니다.', 'image_url': 'https://recipe1.ezmember.co.kr/cache/recipe/2015/05/26/c23955534ff9dc404f76edf8e278c0771.jpg'}, {'step_number': 2, 'description': '깨끗한 물로 서너번 헹구고', 'image_url': 'https://recipe1.ezmember.co.kr/cache/recipe/2015/05/26/71df24b0e8fc9d864cde26a00a9315b31.jpg'}, {'step_number': 3, 'description': '냄비에 포도씨유를 넣고 편썰기한 생강과 마늘을 볶아 향을 내준 뒤 (중약불) 가비리를 넣어 간단하게 볶듯 서너번 뒤적거리다 화이트 와인을 붓고 뚜껑 덮어 쪄줍니다.', 'image_url': 'https://recipe1.ezmember.co.kr/cache/recipe/2015/05/26/ef6d47c9157799d9a78a17f5cdf69c6b1.jpg'}, {'step_number': 4, 'description': '이렇게 입을 벌릴때까지만 쪄주세요. 너무 오래 찌면 해산물 종류가 대부분 그렇듯 질겨질 수 있거든요. 입을 벌린 가리비를 그릇에 담아내면 완성.', 'image_url': 'https://recipe1.ezmember.co.kr/cache/recipe/2015/05/26/38e3b6104e7991f10f753a5b77dd7d211.jpg'}]"
36590,메인반찬,손님접대,해물류,찜,"백종원 꽃게찜 , 해물찜 , 집밥백선생 레시피 , 꽃게탕",꽃게찜,https://recipe1.ezmember.co.kr/cache/recipe/2018/02/01/ff20a0fae972162b8b2eeb189b2f2d731.jpg,"37,815",60분 이내,중급,5인분,"[('꽃게', '4마리'), ('대하', '5마리'), ('미더덕', '1팩'), ('대파', '1/2주먹'), ('양파', '1/2개'), ('미나리', '마음대로'), ('마늘', '2스푼'), ('고춧가루', '2스푼'), ('된장', '2.5스푼'), ('청양고추', '3개'), ('콩나물', '1봉지')]",꽃게찜을 만들어보려고 찜으로시작해서 나중엔 물을 추가해서 해물탕으로 만들어봤어요,"[{'step_number': 1, 'description': '꽃게를 손질해줍니다.\n칫솔이나 솔을 이용해서 다리사이사이에 끼어있는 이끼까지 깨끗하게 제거해주면되요.칫솔 ,  솔꽃게 손질법 레시피', 'image_url': 'https://recipe1.ezmember.co.kr/cache/recipe/2018/02/01/93425a870404222ed32f7e38096872e01.jpg'}, {'step_number': 2, 'description': '대하는 차가운물에 넣도 잠시 해감해두고 깨끗하게 씻고 건져 물어 빼두어요.', 'image_url': 'https://recipe1.ezmember.co.kr/cache/recipe/2018/02/01/85d16cb32b9f5b18c02fe752fad50e191.jpg'}, {'step_number': 3, 'description': '오만디(미더덕) 차가운물과 솔로 문질러 깨끗하게 씻어 물에서 빼둡니다.칫솔 ,  솔', 'image_url': 'https://recipe1.ezmember.co.kr/cache/recipe/2018/02/01/e190df76ca17e19e730c01dc7787a60f1.jpg'}, {'step_number': 4, 'description': '이렇게 손질을 마친 해물들은 한군데 모아 두면되구요. 꽃게는 껍데기를 벗기고 가위로 반절씩 잘라주어요', 'image_url': 'https://recipe1.ezmember.co.kr/cache/recipe/2018/02/01/0e68483e1aa8d0f42e9022cae9740c4d1.jpg'}, {'step_number': 5, 'description': '우선 물에 된장 2.5스푼을 풀고 보글보글 끓여줍니다.', 'image_url': 'https://recipe1.ezmember.co.kr/cache/recipe/2018/02/01/f5f2bd9c062ba6431eca6ee4c942aa281.jpg'}, {'step_number': 6, 'description': '그다음 고추가루를 조금 썪어 붉은빛을 내주구요 거기에 손질된 콩나물을 넣어주어요콩나물을 다듬은후 찬물에 씻어 넣어주세요', 'image_url': 'https://recipe1.ezmember.co.kr/cache/recipe/2018/02/01/7ea6e06a3ba672f9fb26c940cbe2ee6e1.jpg'}, {'step_number': 7, 'description': '콩나물까지 넣은상태에서 보글보글 끓기시작하면 해물을 한번에 넣어줍니다.중불', 'image_url': 'https://recipe1.ezmember.co.kr/cache/recipe/2018/02/01/19bad303830552d1a507dc4da92b18d81.jpg'}, {'step_number': 8, 'description': '해물이 끓기시작하면 이때 미더덕(오만디)와 청양고추를 함께 넣어줍니다.', 'image_url': 'https://recipe1.ezmember.co.kr/cache/recipe/2018/02/01/9aa95acc88a3b790fbf37d23dd7df9471.jpg'}, {'step_number': 9, 'description': '이쯤에서 간을 보고 고추가루를 추가해주시면 좀더 칼칼한맛이 나서 좋아요.너무 매운맛을 싫어한다면 고추가루 생략', 'image_url': 'https://recipe1.ezmember.co.kr/cache/recipe/2018/02/01/ed219b75c6bbd7b89026ba21919be5621.jpg'}, {'step_number': 10, 'description': '저는 쑥갓대신 미나리를 넣어봤습니다.', 'image_url': 'https://recipe1.ezmember.co.kr/cache/recipe/2018/02/01/7be9ca6a7a3f93ea69017a7c4e087a6a1.jpg'}, {'step_number': 11, 'description': '미나리 숨이죽도록 뚜껑을 덮어주어요.\n미나리라 끓으면 간을보고. 저는 좀짠듯싶어 물을더 넣고 꽃게탕으로 변신을 해보았습니다.중불미나리를 한번 잘라서 넣어주셔도 좋아요', 'image_url': 'https://recipe1.ezmember.co.kr/cache/recipe/2018/02/01/4d0c8735077f8a4a2d53ab8d04791b7d1.jpg'}, {'step_number': 12, 'description': '이렇게 하면 꽃게탕이 완성이여요.\n처음에 간을 좀더 약하게했으면 찜으로 먹으려했으나 간이좀 강해서 꽃게탕으로 변신시킨 해물요리입니다 :)', 'image_url': 'https://recipe1.ezmember.co.kr/cache/recipe/2018/02/01/98e555adadc582f9be680c0751c2a51b1.jpg'}]"
