index,종류별,상황별,재료별,방법별,글 제목,레시피이름,레시피이미지,조회수,조리시간,난이도,인분,재료,소개글,조리순서
159634,샐러드,다이어트,해물류,무침,"다이어트에 딱! 태국식 새우 당면 샐러드, 얌운센 만들기",얌운센,https://recipe1.ezmember.co.kr/cache/recipe/2023/06/15/404f65502706661885c6094922bbc0631.jpg,"1,594",30분 이내,초급,2인분,"[('칵테일새우', '5마리'), ('녹두실 당면', '40g'), ('다진 돼지고기', '50g'), ('토마토', '1/2개'), ('샐러리', '1/2개'), ('쪽파', '2줄'), ('샬롯', '2개'), ('마늘', '1알'), ('쥐똥고추', '2개'), ('피시소스', '2T'), ('라임', '1개'), ('팜슈가', '1T')]","요즘 날씨가 따뜻하다 못해 더워지고 있지 않나요? 급! 다이어트의 필요성을 느끼게 되는데요. 오늘은 다이어트에 도움이 될만한 태국 요리를 소개해 드리려고요. 바로 얌운센이라는 음식인데요. ‘얌’은 샐러드이고, ‘운센’은 녹두 당면을 뜻해요. 말 그대로 녹두 당면 샐러드랍니다. 이 요리의 특이한 점이 있다면, 차가운 샐러드가 아니라 따뜻한 웜샐러드라는 점! 쫄깃한 녹두 당면에 통통한 새우와 다진 돼지고기, 새콤 매콤한 드레싱이 들어가 맛이 좋으면서도 부담 없는 한 끼 식사로 좋은 태국식 당면 샐러드예요. 그럼 다이어트 식단으로 딱 좋은 얌운센 레시피 알려드릴게요.","[{'step_number': 1, 'description': '재료들을 준비해 주세요.', 'image_url': 'https://recipe1.ezmember.co.kr/cache/recipe/2023/06/15/24e8402ad96dd50d6a77473e2601306d1.jpg'}, {'step_number': 2, 'description': '가장 먼저 할 일은 당면을 불리는 것이에요. 미지근한 물에 10분 이상 불려주세요.', 'image_url': 'https://recipe1.ezmember.co.kr/cache/recipe/2023/06/15/b9e60a2535dae6200667e741947368221.jpg'}, {'step_number': 3, 'description': '마늘은 다져 주세요.', 'image_url': 'https://recipe1.ezmember.co.kr/cache/recipe/2023/06/15/f7557686ed27dfdf11e90a43a338eb621.jpg'}, {'step_number': 4, 'description': '쥐똥고추도 다져 주세요. 없으시면 홍청양고추를, 그것도 없다면 청양고추를 사용해 주세요. 대신 빛깔은 좀 달라질 수 있겠죠?', 'image_url': 'https://recipe1.ezmember.co.kr/cache/recipe/2023/06/15/cfdb8e4e5a394ef7937ba8a2e2094c351.jpg'}, {'step_number': 5, 'description': '샬롯은 얇게 채 썰어 주세요. 없으시면 양파로 대체해 주시면 돼요.', 'image_url': 'https://recipe1.ezmember.co.kr/cache/recipe/2023/06/15/18ffcac15fd4c31cdb2a78c8ff074c461.jpg'}, {'step_number': 6, 'description': '라임은 짜기 좋게 썰어주시고요. 라임이 없다면 레몬을 사용하셔도 돼요. 주스형태의 것을 사용하셔도 됩니다.', 'image_url': 'https://recipe1.ezmember.co.kr/cache/recipe/2023/06/15/0f62330d2196c9824c522080df0096ac1.jpg'}, {'step_number': 7, 'description': '쪽파는 손가락 길이로 썰어주세요.', 'image_url': 'https://recipe1.ezmember.co.kr/cache/recipe/2023/06/15/84e1ec4c08e2d96b35f56d0d3172bd381.jpg'}, {'step_number': 8, 'description': '얌운센에서 샐러리는 원래 차이니즈샐러리가 사용이 되어요. 우리가 먹는 샐러리와 맛은 거의 같은데, 생긴 것은 약간 이탈리안 파슬리나 고수같이 생겼답니다. 조금 얇은 형태죠. 그래서 저는 최대한 비슷한 느낌을 내기 위해 얇게 썰어 주었어요.', 'image_url': 'https://recipe1.ezmember.co.kr/cache/recipe/2023/06/15/2cab828f8b09b6f9eb61f00496e1d3241.jpg'}, {'step_number': 9, 'description': '토마토는 웨지 모양으로 썰어 주시고요.', 'image_url': 'https://recipe1.ezmember.co.kr/cache/recipe/2023/06/15/3f51ebbd34bc0995120b2260dfcaab471.jpg'}, {'step_number': 10, 'description': '이제 소스를 만들어 볼까요? 우선 팜슈가 1T 넣어주세요. 설탕을 사용하신다면 1/2T 넣기!', 'image_url': 'https://recipe1.ezmember.co.kr/cache/recipe/2023/06/15/440540fc95aec95731c522ed61560cd41.jpg'}, {'step_number': 11, 'description': '피시소스 2T 넣어주시고요. 저는 스퀴즈 제품을 사용했는데, 액젓을 사용하셔도 돼요.', 'image_url': 'https://recipe1.ezmember.co.kr/cache/recipe/2023/06/15/be133b37e1475b0d8d3edf811c73420f1.jpg'}, {'step_number': 12, 'description': '라임은 꽉 짜주세요. 주스 형태의 것을 사용하시면 3-4T 넣어 주시면 됩니다.', 'image_url': 'https://recipe1.ezmember.co.kr/cache/recipe/2023/06/15/712f45fe3179e0a416de5a885723dd0a1.jpg'}, {'step_number': 13, 'description': '멍울이 없도록 잘 저어 주세요.', 'image_url': 'https://recipe1.ezmember.co.kr/cache/recipe/2023/06/15/ce47a6c31a085955b66cccfa8b302fd11.jpg'}, {'step_number': 14, 'description': '재료 손질하는 동안 녹두 당면은 잘 불어졌을 거예요. 끓는 물에 넣고 1-2분간 데쳐줍니다.중불', 'image_url': 'https://recipe1.ezmember.co.kr/cache/recipe/2023/06/15/5a315afa315bbd978301a73479de57891.jpg'}, {'step_number': 15, 'description': '금방 익으니 1-2분 가량 짧게 데쳐 주시면 됩니다.', 'image_url': 'https://recipe1.ezmember.co.kr/cache/recipe/2023/06/15/f2ef87b9c73d7d05fc8f47427c22d1eb1.jpg'}, {'step_number': 16, 'description': '1-2분 뒤 바로 건져 주세요. 따뜻하게 먹는 웜샐러드이니, 차가운 물샤워 같은 건 하지 않아요. 한쪽에다 둡니다. 태국 길거리에서 얌운센을 시키면 면, 새우, 고기, 채소 등을 마라탕처럼 한꺼번에 데쳐서 만드는 걸 볼 수 있어요. 집에서도 그렇게 해도 되지만, 각각 그 재료에 맞게 조리하는게 아무래도 더 맛있겠죠?', 'image_url': 'https://recipe1.ezmember.co.kr/cache/recipe/2023/06/15/e11e327eb3930df6e100cdadb92b49fd1.jpg'}, {'step_number': 17, 'description': '새우의 크기에 따라 데치는 시간이 달라지겠죠? 익을 정도로 데쳐 주세요. 저는 큰 새우라 5분 정도 익혀 주었어요.', 'image_url': 'https://recipe1.ezmember.co.kr/cache/recipe/2023/06/15/9505e1027f62e3ec7aa34641438dbef51.jpg'}, {'step_number': 18, 'description': '다진 돼지고기도 데쳐줍니다.', 'image_url': 'https://recipe1.ezmember.co.kr/cache/recipe/2023/06/15/1290c9011ce9cb7cd944e2815b0ad3a01.jpg'}, {'step_number': 19, 'description': '아까 만들어 둔 소스를 재료를 섞을 볼에 옮겨 주세요.', 'image_url': 'https://recipe1.ezmember.co.kr/cache/recipe/2023/06/15/48ae2dfbb3e33582a1fb27512684eeaa1.jpg'}, {'step_number': 20, 'description': '모든 재료를 볼에 다가 넣어주세요.', 'image_url': 'https://recipe1.ezmember.co.kr/cache/recipe/2023/06/15/495ae7d8c8e577a66b7405ed844da0d41.jpg'}, {'step_number': 21, 'description': '조물조물 버무려 주면 완성.', 'image_url': 'https://recipe1.ezmember.co.kr/cache/recipe/2023/06/15/e2bd2d5efcc3a560931abbf3c90c29331.jpg'}, {'step_number': 22, 'description': '간단하면서 맛도 좋은 얌운센입니다. 새콤매콤한 소스와 면, 각종 재료들의 합이 참 좋아요. 채소도 듬뿍 들어가고, 녹두 당면이라 칼로리도 낮고 소화효소가 많이 함유되어 소화도 잘 된다고 하니 다이어트에 그만인 음식 같네요. 색다른 음식으로 가볍게 한 끼 즐기며, 기분전환까지 덤으로 해보시는 것 어떠세요?', 'image_url': 'https://recipe1.ezmember.co.kr/cache/recipe/2023/06/15/f76074e1f1ebee5844780b23676e94df1.jpg'}]"
159635,샐러드,다이어트,해물류,무침,먹으면 건강해지는 치유음식 해초모둠 채소샐러드,해초모둠채소샐러드,https://recipe1.ezmember.co.kr/cache/recipe/2024/08/08/742b402ccd32c86e63c51a9fbba8c7e41.jpg,51,None,None,None,"[('해초                                                                                해초모둠', '1봉지'), ('홍 파프리카', '1/2개'), ('노랑 파프리카', '1/2개'), ('피망', '1/2개'), ('양파', '1/2개'), ('오이', '1개'), ('식초', '1수저'), ('설탕', '2수저'), ('다진마늘', '1/2수저'), ('들기름', '1/2수저'), ('깨소금', '1/2수저'), ('소금', '1스푼')]",덥다 더워~~!! 역시 중복 지나고 말복 사이가 제일 덥다더니 요 몇일이 제일 덥지않나 느낌이 들면서 요번주 지나면 더위는 한풀 꺽이지않을까 하는데 더 늦기전에 근처라도 나갔다와야 겠네요. ​ 어제가 입추다보니 그동안 준비했던 여름 요리를 방출해야 합니다.,"[{'step_number': 1, 'description': '해초모둠 채소샐러드 재료- 해초모둠 1봉지, 홍 파푸리카 반개, 노랑 파푸리카 반개, 피망 반개, 양파 반개, 오이 1개도마 , 조리용나이프', 'image_url': 'https://recipe1.ezmember.co.kr/cache/recipe/2024/08/08/44fcef7d559dac25c769cf30ac0c6b811.jpg'}, {'step_number': 2, 'description': '미역이나 해초 표면의 미끈미끈함이 격렬한 조수의 흐름으로부터 해조류를 보호해 주는데 이런성분을 ""후코이단(fucoidan)""이라는 이름으로 불렀습니다. 이 미끌거리는 성분이 사람 몸에 얼마나 좋은지 공부한적이 있는데요. 오늘은 조금만 기술 해 놓겠습니다.', 'image_url': 'https://recipe1.ezmember.co.kr/cache/recipe/2024/08/08/d2d864ae701c250528c4769ea9c1cc771.jpg'}, {'step_number': 3, 'description': '일반적으로 시중에 파는 해조류 모둠은 염장해서 봉지에 넣어둔거니 물에 담궈 짠기를 빼주고 염분을 최소화한 뒤볼', 'image_url': 'https://recipe1.ezmember.co.kr/cache/recipe/2024/08/08/ce962840fbca2a14e250d37252d7f7251.jpg'}, {'step_number': 4, 'description': '새콤 달콤하게 양념을 합니다.', 'image_url': 'https://recipe1.ezmember.co.kr/cache/recipe/2024/08/08/25f90899e8631ff67667acb1fe8087191.jpg'}, {'step_number': 5, 'description': '해초 채소샐러드 양념 -식초 1수저, 설탕 2수저, 다진마늘 반수저, 들기름 반수저, 깨소금 반수저, 소금 1스푼', 'image_url': 'https://recipe1.ezmember.co.kr/cache/recipe/2024/08/08/6a683cdec84e9c93c694c1568d2c4d471.jpg'}, {'step_number': 6, 'description': '커다란 뷔페접시에 얇게 썰어둔 채소들을 모양을 내 담아두고접시', 'image_url': 'https://recipe1.ezmember.co.kr/cache/recipe/2024/08/08/ea478a2e5bf53780f8f71df60d3b4b581.jpg'}, {'step_number': 7, 'description': '양념한 해조류 모둠을 올려줍니다. 이렇게 해서 해조류와 채소를 덜어와 그냥 드셔도 되지만.. 조물조물~~함께 무쳐주면 더 편하게 드실 수 있지요.', 'image_url': 'https://recipe1.ezmember.co.kr/cache/recipe/2024/08/08/3ff64d49c90483574e6f4ed235c4d1871.jpg'}, {'step_number': 8, 'description': '바다나 육지나 미끄덩한 느낌이 드는 재료들이 몸에 아주 좋은데요. 장어가 그렇고 낙지나 마 가 미끄덩의 대표식품 입니다. 미역이나 해조류에 들어있는 성분도 이에 못지 않지요. 아마도 더 좋으면 좋았지 덜하지는 않을겁니다. 특히나 지금처럼 푹푹~찌는 여름엔 두말할 필요가 없겠죠~ 맛나고 건강한 음식 많이 드십시요~^^', 'image_url': 'https://recipe1.ezmember.co.kr/cache/recipe/2024/08/08/ab06bda058c8dfe7ca6dac74e80c7ed91.jpg'}]"
159636,샐러드,다이어트,해물류,무침,차게 먹는 여름 냉채요리/버섯 오징어냉채,버섯오징어냉채,https://recipe1.ezmember.co.kr/cache/recipe/2017/06/02/293b77d6ccb48754eeeb460040ddd6ee1.jpg,"2,909",30분 이내,초급,4인분,"[('오징어(소)', '2마리'), ('백오이', '1개'), ('느타리버섯', '100g'), ('소금', '1티스푼'), ('식초', '2스푼'), ('황설탕', '1스푼'), ('간장', '3큰술'), ('다진마늘', '1스푼'), ('연겨자', '0.5스푼'), ('식초', '2큰술'), ('올리고당', '2스푼'), ('황설탕', '1스푼'), ('레몬즙', '0.5스푼'), ('맛술', '1스푼'), ('깨', '0.5스푼'), ('참기름', '1스푼'), ('후추', '약간'), ('소금', '약간')]","만만한 오징어와 가격도 저렴한 애느타리 버섯, 오이 넣고 만든 여름별미 요리 버섯 오징어 냉채랍니다
차게해 시원하게 먹는 입맛 살려주는 버섯 오지엉냉채 소개시켜 드릴게요~","[{'step_number': 1, 'description': '재료를 준비해 주세요~', 'image_url': 'https://recipe1.ezmember.co.kr/cache/recipe/2017/06/02/883405bd421de1c6271ef8c4b63911a11.jpg'}, {'step_number': 2, 'description': '오징어는 껍질째 껍질 없는 몸통 안쪽에\n사선으로 칼집을 내 주세요~껍질 벗겨도 상관은 없어요', 'image_url': 'https://recipe1.ezmember.co.kr/cache/recipe/2017/06/02/1c8da2b6030529c2184b6dd79dc92e711.jpg'}, {'step_number': 3, 'description': '끓는 물에 살짝 데쳐 내 주세요~', 'image_url': 'https://recipe1.ezmember.co.kr/cache/recipe/2017/06/02/62d1a304b0d38f875ccd0562fd4eab8b1.jpg'}, {'step_number': 4, 'description': '먹기 좋게 한입 크기로 썰어 차게 냉장고에 넣어 두세요~', 'image_url': 'https://recipe1.ezmember.co.kr/cache/recipe/2017/06/02/87ccabb1c116369d2840b0720b9a8b921.jpg'}, {'step_number': 5, 'description': '오이는 어슷 어슷하게 썰어 주세요~', 'image_url': 'https://recipe1.ezmember.co.kr/cache/recipe/2017/06/02/2f4e149aee461909b6f7cf661419d3a71.jpg'}, {'step_number': 6, 'description': '식초, 설탕, 소금을 넣고 10~15분 정도 절여 준 다음 \n체에 받쳐 물기를 빼 주세요~그냥 넣어도 좋지만 살짝 절이면 오이맛이 더 좋아요!', 'image_url': 'https://recipe1.ezmember.co.kr/cache/recipe/2017/06/02/8835355838fa034bbf54ab857ade29a11.jpg'}, {'step_number': 7, 'description': '느타리버섯은 끓는 물에 살짝 데쳐 \n물기를 꽉 짜 준비해 주세요~', 'image_url': 'https://recipe1.ezmember.co.kr/cache/recipe/2017/06/02/8b79a90f6bf53d5b605df42dcda0c9b91.jpg'}, {'step_number': 8, 'description': '적힌 분량의 양념을 넣고 잘 섞어 냉채소스를 만들어 주세요~기호에 따라 양념을 가감해 주세요~', 'image_url': 'https://recipe1.ezmember.co.kr/cache/recipe/2017/06/02/1bbbd281f2940603c89c8835a50257371.jpg'}, {'step_number': 9, 'description': '준비한 오징어, 오이, 버섯을 모두 그릇에 담아 주세요~', 'image_url': 'https://recipe1.ezmember.co.kr/cache/recipe/2017/06/02/92ddab5c580c8aea830faad6828877031.jpg'}, {'step_number': 10, 'description': '먹기 직전에 만든 냉채소스를 넣어 주세요~', 'image_url': 'https://recipe1.ezmember.co.kr/cache/recipe/2017/06/02/6385c3ad2af2223b2a68e8536730b60e1.jpg'}, {'step_number': 11, 'description': '소스가 검은게 싫으면 간장은 빼고 \n소금으로만 간을 해 소스를 만들면 되요~', 'image_url': 'https://recipe1.ezmember.co.kr/cache/recipe/2017/06/02/e10d508e353759e602c6dde0b7d4d9b31.jpg'}, {'step_number': 12, 'description': '살포시 골고루 버무려 주면 버섯 오징어냉채가 완성되요~', 'image_url': 'https://recipe1.ezmember.co.kr/cache/recipe/2017/06/02/cee52d48733b9e3c3912c6d300f70f571.jpg'}]"
159637,샐러드,다이어트,해물류,무침,여름별미 주꾸미 냉채. 혼밥도 알록달록 아름답게~ 다이어트에도 좋아~,주꾸미냉채,https://recipe1.ezmember.co.kr/cache/recipe/2018/06/01/6789a5054288490259cf1fcacbec85421.jpg,"1,714",30분 이내,초급,3인분,"[('주꾸미', '4마리'), ('빨간파프리카', '1/2개'), ('노랑파프리카', '1/2개'), ('오이', '1/3개'), ('당근', '1/3개'), ('미나리', '3줄기'), ('팽이버섯', '1/2개'), ('양파', '1/2개'), ('연겨자', '1T'), ('간장', '2T'), ('식초', '3T'), ('다진마늘', '1T'), ('올리고당', '4T'), ('물', '3T')]",알록달록 눈으로 먹고 쫄깃쫄깃 톡쏘는 맛에 입도 즐거운 주꾸미 냉채,"[{'step_number': 1, 'description': '일단 쭈꾸미 손질을 합니다. 주꾸미 머리에 손을 넣어 안쪽에 있는 끈을 제거 후 머리를 뒤집어 주고 안쪽에 있는 내장을 제거 해 주세요.쭈꾸미 손질법 레시피', 'image_url': 'https://recipe1.ezmember.co.kr/cache/recipe/2018/06/05/1866e4817f677508fb14d867168a14671.jpg'}, {'step_number': 2, 'description': '그리고 다리쪽에 있는 입을 제거해야죠. 저는 사진찍느라 한손만 나왔는데 양쪽 엄지손톱으로 꾹 눌러주면 입이 밖으로 나와줍니다.', 'image_url': 'https://recipe1.ezmember.co.kr/cache/recipe/2018/06/05/caf80d9228b1f711825184323a81916d1.jpg'}, {'step_number': 3, 'description': '이제 밀가루를 넣고 치대듯 문질러 불순물을 제거합니다. 지저분한 것을 밀가루가 흡착해서 깨끗해 질거에요. 문지르다 보면 밀가루색이 점점 지저분해 지는 걸 볼 수 있어요.', 'image_url': 'https://recipe1.ezmember.co.kr/cache/recipe/2018/06/05/0745d316192a8fd8216dd706b165dfc71.jpg'}, {'step_number': 4, 'description': '흐르는 물에 깨끗이 씻어 주지요. 그럼 쭈꾸미 손질 끝.', 'image_url': 'https://recipe1.ezmember.co.kr/cache/recipe/2018/06/05/6503d13dd2cd54076d7e69cba73e979d1.jpg'}, {'step_number': 5, 'description': '팔팔 끓는물에 넣고 1분정도만 데쳐 주었어요.', 'image_url': 'https://recipe1.ezmember.co.kr/cache/recipe/2018/06/05/0e3b03db68e11f3f3bcfdc2f3edc1e3f1.jpg'}, {'step_number': 6, 'description': '쭈꾸미를 데치기 전에 채소도 손질해 준비하지요. 저는 파프리카, 양파, 오이, 당근, 미나리, 팽이버섯을 준비 했어요. 전부 채 썰어 준비 해 주세요.', 'image_url': 'https://recipe1.ezmember.co.kr/cache/recipe/2018/06/05/65e9a2a251595dee2c741d8fd89571721.jpg'}, {'step_number': 7, 'description': '이제 양념을 준비합니다. 연겨자1T, 간장2T, 식초3T, 다진마늘1T, 올리고당4T, 물3T를 넣어주세요.', 'image_url': 'https://recipe1.ezmember.co.kr/cache/recipe/2018/06/05/a30f0c2610bcc650f565a3b73630f73d1.jpg'}, {'step_number': 8, 'description': '채 썰어 준비한채소를 예쁘게 올려주고, 쭈꾸미도 올려주고 겨자소스도 곁들여 준비합니다.', 'image_url': 'https://recipe1.ezmember.co.kr/cache/recipe/2018/06/05/8bf6604a2fbaf9d5c2e783848617e2c41.jpg'}]"
159638,샐러드,다이어트,해물류,무침,저칼로리 해물미역누들샐러드,해물미역누들샐러드,https://recipe1.ezmember.co.kr/cache/recipe/2018/06/10/534243558e4474329b8f7920c5276d351.jpg,"2,609",30분 이내,초급,2인분,"[('자숙문어다리', '2개'), ('새우', '200g'), ('관자', '2개'), ('미역누들', '1팩'), ('적양파', '1/2개'), ('선드라이드 토마토', '5개'), ('양상추', ''), ('베이비채소', ''), ('딜(허브)', '1조각'), ('물', '1L'), ('천일염', '1t'), ('레몬즙', '1T'), ('핑크페퍼', '1/2t'), ('월계수잎', '1개'), ('무', '2조각'), ('간장', '2T'), ('굴소스', '1T'), ('레몬즙', '2T'), ('화이트발사믹식초', '2T'), ('자일로즈 설탕', '2T'), ('다진마늘', '1T'), ('홀그레인머스타드', '1T'), ('매실청', '1T'), ('포도씨유', '4T'), ('핑크페퍼', '1/2t')]","거제에서 올라온 싱싱한 해물과 오로지 미역만을 가지고 만든 미역면으로 다이어트용 저칼로리 누들샐러드를 만들었어요. 뜨거운 보양식도 좋지만, 여름의 뜨거운 열기를 금새 가시게 해줄 사각사각하게 잔 얼음이 언 식감의 드레싱을 곁들여 먹는 면 샐러드도 드셔보세요. 다이어트 할 때 칼로리가 걱정될 때, 면이 미치도록 먹고 싶을 때 이 레시피를 사용해보세요.","[{'step_number': 1, 'description': '드레싱은 재료를 잘 섞어 1시간 정도 얼려둬요. 담을 접시는 냉장고에 넣어 차갑게 만들어줍니다.', 'image_url': 'https://recipe1.ezmember.co.kr/cache/recipe/2018/06/10/45f5ff7cc4302111c6ec86deb3e1f87d1.jpg'}, {'step_number': 2, 'description': '미역면은 체에 밭쳐 물기를 제거해 냉장 보관해요.', 'image_url': 'https://recipe1.ezmember.co.kr/cache/recipe/2018/06/10/6271087bafe470ce01aa75e2ad6efcee1.jpg'}, {'step_number': 3, 'description': '적양파는 채 썰어 찬물에서 매운기를 제거해요.', 'image_url': 'https://recipe1.ezmember.co.kr/cache/recipe/2018/06/10/9a608b689b6e8f4e9b62f3a8a58319151.jpg'}, {'step_number': 4, 'description': '양상추와 새싹채소는 먹기좋은 크기로 뜯어 찬 얼음물에 담가 채소의 세포가 살아나게 만들어줍니다.', 'image_url': 'https://recipe1.ezmember.co.kr/cache/recipe/2018/06/10/2a5211f7a5c97dccb293a43fccbff9361.jpg'}, {'step_number': 5, 'description': '해물 재료를 준비해요. 관자는 흐르는 물에 잘 씻어줍니다. 새우는 껍질을 제거해 마찬가지로 흐르는 물에 씻어줘요.', 'image_url': 'https://recipe1.ezmember.co.kr/cache/recipe/2018/06/10/a3644321fe6e4a86e56be93d1f5fa3d41.jpg'}, {'step_number': 6, 'description': '관자는 얇은 막을 제거하고 관자 사이의 하얀 살을 떼어낸 뒤 물에 씻어 체에 받쳐 준비합니다. 0.5mm 정도의 두께로 얇게 썰어줘요. 냄비에 물과 무, 천일염, 핑크페퍼, 월계수잎, 레몬즙을 넣고 끓인 뒤 30초 데쳐 얼음을 넣고 차게 보관해요.', 'image_url': 'https://recipe1.ezmember.co.kr/cache/recipe/2018/06/10/bd06244b5860d1a3136e5a2db9e54cb91.jpg'}, {'step_number': 7, 'description': '새우도 관자와 마찬가지로 30초 데쳐 얼음을 넣고 차게 보관해요.', 'image_url': 'https://recipe1.ezmember.co.kr/cache/recipe/2018/06/10/da06cf845f9acee26373226784bb2d3c1.jpg'}, {'step_number': 8, 'description': '간편하게 자숙문어를 준비할땐 10초간 살짝 데쳐요. 생 문어 일때는 내장제거 후 밀가루를 넣고 바락바락 씻어요.', 'image_url': 'https://recipe1.ezmember.co.kr/cache/recipe/2018/06/10/3b47f547b667c4ac9ae6802dd2b18fac1.jpg'}, {'step_number': 9, 'description': '냄비의 물이 끓으면 문어의 다리를 넣고 뺐다를 세번정도 반복 해줘요. 다리가 예쁘게 말리기위함이예요.', 'image_url': 'https://recipe1.ezmember.co.kr/cache/recipe/2018/06/10/706401024acffe6140c554778a8498651.jpg'}, {'step_number': 10, 'description': '다리가 말리면 머리부터 집어넣어 5분~9분 삶아요. 삶은 문어의 열이 가시면 편으로 썰어줘요.', 'image_url': 'https://recipe1.ezmember.co.kr/cache/recipe/2018/06/10/6be10e967c06565109c453c5ac0457dd1.jpg'}, {'step_number': 11, 'description': '양상추를 접시에 담고 미역면, 채소, 해물, 새싹채소, 선드라이토마토, 핑크페퍼를 담아요. 차게 식힌 해물을 올려요.', 'image_url': 'https://recipe1.ezmember.co.kr/cache/recipe/2018/06/10/296cc01dd434fb8a9d862d61b9e4bb6f1.jpg'}, {'step_number': 12, 'description': '드레싱을 담거나 뿌려 완성합니다.', 'image_url': 'https://recipe1.ezmember.co.kr/cache/recipe/2018/06/10/ef87eac24f6819691ee1b3a429d6b7531.jpg'}]"
