index,종류별,상황별,재료별,방법별,글 제목,레시피이름,레시피이미지,조회수,조리시간,난이도,인분,재료,소개글,조리순서
162899,빵,손님접대,돼지고기,볶음,반미 샌드위치 만들기 반미 샌드위치 레시피,반미샌드위치,https://recipe1.ezmember.co.kr/cache/recipe/2019/06/10/0a2681e1ba1e48c2b72755e05f0769c61.jpg,"61,119",60분 이내,중급,2인분,"[('양상추', ''), ('오이', ''), ('청양고추', ''), ('당근', ''), ('돼지고기', ''), ('바게트                                                                                반미용', ''), ('마늘', '1작은술'), ('피쉬소스', '2큰술'), ('설탕', '2큰술'), ('식초', '1큰술'), ('라임즙', '4큰술'), ('베트남고추', '2개'), ('물', '1컵'), ('피쉬소스', '1큰술'), ('간장', '1큰술'), ('다진마늘', '1작은술'), ('설탕', '2작은술'), ('마요네즈', '2큰술'), ('스리라차소스', '1큰술'), ('올리고당', '1작은술')]","저번에 올렸던 분짜 레시피를 생각보다 많이 좋아해주셔서

반미샌드위치 레시피를 빨리 들고왔어요

한동안 엄청 만들어먹어서 찍어놓은 사진이 많은데 과연...

언제 다올릴지 모르겠네요.ㅎ




반미는 베트남 음식으로 반미는 베트남식 바게트를 말한답니다.

우리나라 바게트처럼 딱딱하지 않고

부드러워서 샌드위치 만들어먹기 좋다고 하더라구요

요즘은 인터넷으로 구매도 가능하다고 하니

구매해서 만드셔도 좋을꺼 같아요




반미샌드위치는 그 반미를 반으로 가르고

야채와 고기를 넣어서 같이 먹는 샌드위치를 말한답니다.

고기가 들어있어서 샌드위치지만 푸짐하게 드실수있는 장점이 있어요~




인터넷에서 베트남전문 쉐프님이 올려주심 레시피와

좀더 쉬운레시피를 짬뽕해서 만들어봤어요","[{'step_number': 1, 'description': '양상추를 씻어서 물기를 뺀후 손으로 크지막하게 잘라주세요\n오이와 청양고추는 슬라이스해주시고', 'image_url': 'https://recipe1.ezmember.co.kr/cache/recipe/2019/06/10/a7de4be2bd2fde3f6c9e9e0682efe6611.jpg'}, {'step_number': 2, 'description': '당근과 무는 채썰어 주세요', 'image_url': 'https://recipe1.ezmember.co.kr/cache/recipe/2019/06/10/5f1378454a1d78153a4b0ec7d146d1211.jpg'}, {'step_number': 3, 'description': '마늘1작은술, 피쉬소스2큰술, 설탕2큰술, 식초1큰술, 라이즙4큰술, 베트남고추2개, 물1컵을\n볼에 넣어서 잘섞은후', 'image_url': 'https://recipe1.ezmember.co.kr/cache/recipe/2019/06/10/2bb17c74fec9cb1757abce46d8f4eb361.jpg'}, {'step_number': 4, 'description': '채썬 당근과 무를 넣어서 20여분 절여주세요', 'image_url': 'https://recipe1.ezmember.co.kr/cache/recipe/2019/06/10/a670bc7403d4c7e361da52e12df9ab1e1.jpg'}, {'step_number': 5, 'description': '피쉬소스1큰술, 간장1큰술, 다진마늘1작은술, 설탕2작은술을 볼에 넣고\n잘섞어준후 고기를 넣어서 10여분 이상 재어주세요', 'image_url': 'https://recipe1.ezmember.co.kr/cache/recipe/2019/06/10/fc3919653aa9c51bf240ab075b34c9fd1.jpg'}, {'step_number': 6, 'description': '마요네즈2큰술, 스리라차소스1큰술, 올리고당1작은술을 섞어\n빵에 바를 소스를 준비해주세요', 'image_url': 'https://recipe1.ezmember.co.kr/cache/recipe/2019/06/10/bd571a758658096b212a6b4e59f02fdf1.jpg'}, {'step_number': 7, 'description': '양념한 고기는 물기가 없게 바짝 볶아주세요', 'image_url': 'https://recipe1.ezmember.co.kr/cache/recipe/2019/06/10/87d45825a57cc5787b25c3c392d204a91.jpg'}, {'step_number': 8, 'description': '긴 바게트는 반으로 가르고\n또 길게 칼집을 넣은후', 'image_url': 'https://recipe1.ezmember.co.kr/cache/recipe/2019/06/10/597a8db719070016aecaeba0a68f88811.jpg'}, {'step_number': 9, 'description': '양면에 스프레드 소스를 발라주세요', 'image_url': 'https://recipe1.ezmember.co.kr/cache/recipe/2019/06/10/59c23ac7e73214bbd2471f0d932eefee1.jpg'}, {'step_number': 10, 'description': '바게트에 양상추 -> 오이 -> 고기 -> 당근과 무절임을 올리고\n마지막으로 취향에 맞게 청양고추와 고수를 올려서 먹으시면 된답니다.', 'image_url': 'https://recipe1.ezmember.co.kr/cache/recipe/2019/06/10/106a8a382adda83ae691df65336ac3e61.jpg'}]"
162900,빵,손님접대,돼지고기,볶음,돼지고기 멕시칸 브리또,돼지고기브리또,https://recipe1.ezmember.co.kr/cache/recipe/2017/09/08/3ee1310646db2df938c8d5fdb2cd256f1.jpg,"8,989",60분 이내,중급,4인분,"[('돼지고기', '400g'), ('양파', '1개'), ('마늘', '3개'), ('토마토                                                                                또는 토마토소스-100ml', '1개'), ('닭육수', '100ml'), ('피망', '1개'), ('양상추', '4~5장'), ('노랑 파프리카', '1개'), ('빨강 파프리카', '1개'), ('살사소스', ''), ('샤워크림', ''), ('할라피뇨', ''), ('올리브오일', ''), ('소금', ''), ('후추', ''), ('미림                                                                                or드라이화이트와인', '2T'), ('식초', '2t'), ('설탕', '2t'), ('타코시즈닝', '4T')]",시판 타코시즈닝을 구입하지는 않고~ 대신에 타코시즈닝에 들어가는 향신료들의 배합으로 양념가루를 만들어봤어요. 멕시칸 느낌 납니다.,"[{'step_number': 1, 'description': '파프리카,피망은 채썰고, 양파, 마늘은 다집니다.', 'image_url': 'https://recipe1.ezmember.co.kr/cache/recipe/2017/09/08/ad3c093ec7fcc580eb1054cd46a9457d1.jpg'}, {'step_number': 2, 'description': '타코시즈닝은 시판용으로 써도 되고, 칠리파우더 : 큐민파우더 : 코리엔더파우더 : 말린오레가노 : 케이안페퍼파우더 = 4:2:2:1:1의 비율로 섞어서 사용해도 됩니다. 저는 칠리파우더 4T를 기준으로 해서 만들어봤어요. (고기가 700g있었거든요~)\n지퍼팩에 4T와 미림2T넣고 양념이 잘 스미도록 조물조물~', 'image_url': 'https://recipe1.ezmember.co.kr/cache/recipe/2017/09/08/3f0f5d57fc37a8183b106291b422e3831.jpg'}, {'step_number': 3, 'description': '올리브오일 두르고 야채를 하나씩 볶아요. 소금,후추 약간씩 뿌려요.', 'image_url': 'https://recipe1.ezmember.co.kr/cache/recipe/2017/09/08/5c00ad796df54ef72f40d2356ab1dce11.jpg'}, {'step_number': 4, 'description': '다 볶아서, 양상추 채썬것과 같이 세팅했어요. \n전 라다치오가 마침 있어서 같이 채썰어서 놨어요.', 'image_url': 'https://recipe1.ezmember.co.kr/cache/recipe/2017/09/08/115738a045d9a2af9f9566960253e3561.jpg'}, {'step_number': 5, 'description': '올리브오일을 두르고, 마늘과 양파를 먼저 익히다가 향이 올라오면, 고기를 넣고 볶아줘요.', 'image_url': 'https://recipe1.ezmember.co.kr/cache/recipe/2017/09/08/02f4b859676b226226dc2e000b401c1d1.jpg'}, {'step_number': 6, 'description': '고기가 어느정도 볶아졌으면, 닭육수, 토마토소스를 넣고 은근히 졸여줍니다. 그리고 마지막에 식초와 설탕, 그리고 싱거우면 소금을 넣습니다. 후추도 약간.', 'image_url': 'https://recipe1.ezmember.co.kr/cache/recipe/2017/09/08/5339c553ee5060e9c2ee8f46da9c3f851.jpg'}, {'step_number': 7, 'description': '고수풀 있으면 뿌려줬어요. 살사소스는 지난번에 만드는 법 올려놨어요. 참고하시고, 할라피뇨와 샤워크림은 시판쓰면 됩니다.', 'image_url': 'https://recipe1.ezmember.co.kr/cache/recipe/2017/09/08/066450e9c7c0ebd3d803bbb03be8d8631.jpg'}, {'step_number': 8, 'description': '또띠아 시판용 빈후라이팬을 달궈서 살짝씩 앞뒤로 구웠어요.', 'image_url': 'https://recipe1.ezmember.co.kr/cache/recipe/2017/09/08/fee618524e41fdddb437b82e6f0196e11.jpg'}, {'step_number': 9, 'description': '밥도 넣고 싸면 브리또가 되고, 아니면 그냥 화이타처럼.. 아니면 타코처럼 먹을 수도 있어요.', 'image_url': 'https://recipe1.ezmember.co.kr/cache/recipe/2017/09/08/09d88fd9d84a795739069c6f25f605fb1.jpg'}]"
