index,종류별,상황별,재료별,방법별,글 제목,레시피이름,레시피이미지,조회수,조리시간,난이도,인분,재료,소개글,조리순서
167769,과자,간식,채소류,튀김,포테이토칩 간단하게 만들기,포테이토칩,https://recipe1.ezmember.co.kr/cache/recipe/2015/09/22/af8fa2e2f4f3d3a85dd5879d69116756.jpg,"9,667",30분 이내,아무나,4인분,"[('감자', '3개'), ('식용유', '적당량'), ('구운소금', '약간'), ('파슬리가루', '약간')]",갑자기 포테이토칩이 먹고싶은 거에요. 그래서 먹겠다는 일념으로 귀찮음을 무릅쓰고 후딱 만들어 먹었어요.,"[{'step_number': 1, 'description': '감자는 깨끗이 씻어서 최대한 얇게 썰어주세요. 종이장처럼은 아니라도 1밀리 정도로 썰어주세요. 전 채칼이 없어서 기냥 칼로 썰었어요. 감자 필러로도 가능한데 전 칼이 편하더라구요. 이게 그나마 젤 어려우면서도 중요한 작업이에요. 썬 감자는 물에 깨끗이 씻어서 전분기를 제거하고 체에 받쳐 물기를 뺀 후 통풍이 잘되는 곳에서 한 10분 정도 물기를 잠깐 말리세요. 바쁘면 패쓰~', 'image_url': 'https://recipe1.ezmember.co.kr/cache/recipe/2015/09/30/4a0d5cfe25aa3dd57e34fdc426edbc411.jpg'}, {'step_number': 2, 'description': '물기가 거의 없어졌으면 키친타월로 꾹꾹 눌러서 남은 물기를 마저 제거해요.', 'image_url': 'https://recipe1.ezmember.co.kr/cache/recipe/2015/09/30/ecc06240ada2530291c8213ce477a1061.jpg'}, {'step_number': 3, 'description': '웍같은 깊은 팬에 식용유 양을 감자가 튀겨질 정도로만 넣고 센불로 온도를 높여요.', 'image_url': 'https://recipe1.ezmember.co.kr/cache/recipe/2015/09/30/61e1160937bc0c6e360fdf42f236932d1.jpg'}, {'step_number': 4, 'description': '보통 튀김하는 정도인 180도 정도의 온도에 감자를 넣어주세요. 전 식용유를 적게 쓰려고 양을 감자양보다 적게하고 감자를 몇 번에 나눠서 넣었어요. 온도는 감자조각 등을 넣어보고 떠오르는 정도로 판별하시면 돼요.', 'image_url': 'https://recipe1.ezmember.co.kr/cache/recipe/2015/09/30/57ead0aaf675c1b555cc49d5282412f91.jpg'}, {'step_number': 5, 'description': '감자를 넣고 튀기다가 약간 투명해지면서 모양이 오그러들기 시작하면 불을 약간 낮춰주세요. 계속 온도가 높으면 완전히 바삭해지기 전에 감자가 타버려요. 적당한 색일 때 꺼내면 열이 남아있어 색이 진해지므로 원하는 색이 나오기 직전에 꺼내주세요. 사진 정도일 때 몇 초 후에 꺼내세요.', 'image_url': 'https://recipe1.ezmember.co.kr/cache/recipe/2015/09/30/461748b8cac0ee7ac9cc7128361e1fe91.jpg'}, {'step_number': 6, 'description': '식용유에서 튀김 젓가락이나 튀김채로 건져서 체에 받쳐 기름을 빼주세요.', 'image_url': 'https://recipe1.ezmember.co.kr/cache/recipe/2015/09/30/8b3e83adcf776c980fef98e638cc7e0c1.jpg'}, {'step_number': 7, 'description': '소금과 파슬리 가루를 취향대로 넣고 체를 흔들어서 잘 섞으세요. 그러면 완성.', 'image_url': 'https://recipe1.ezmember.co.kr/cache/recipe/2015/09/30/ee73df786d33d52baccb6b49b0555bc51.jpg'}]"
167770,과자,간식,채소류,튀김,♬추억속의 간식 고구마 튀긴스낵,None,https://recipe1.ezmember.co.kr/cache/recipe/2015/06/09/a832e2591cde1785d1a8e4a77a7535fb.jpg,"3,199",None,None,None,[],,[]
167771,과자,간식,채소류,튀김,고구마스틱튀김- 딸에게#~ 에어프라이어,None,https://recipe1.ezmember.co.kr/cache/recipe/2020/12/16/b881b352f3194f1da3e7cccdd3abd6d11.jpg,485,None,None,None,"[('고구마', '1개'), ('식용유', '1큰술')]",,[]
167772,과자,간식,채소류,튀김,포테이토 칩 만들기 감자요리 간식,포테이토칩,https://recipe1.ezmember.co.kr/cache/recipe/2018/10/04/f4ba0256652c94e47e2d905d23471d651.jpg,"9,494",30분 이내,아무나,4인분,"[('감자', ''), ('식용유', '')]",바삭바삭 손이가는 포테이토 칩 만들기,"[{'step_number': 1, 'description': '감자는 깨끗하게 세척해 얇게 슬라이스합니다감자는 얇을 수록 더 바삭하게 튀겨집니다', 'image_url': 'https://recipe1.ezmember.co.kr/cache/recipe/2018/10/04/596e0362f4384aea6b20632bf631b2d11.jpg'}, {'step_number': 2, 'description': '슬라이스한 감자는 물에 담궈 전분을 제거 해 깨끗한 면포나 키친타월위에 올려 물기 제거합니다', 'image_url': 'https://recipe1.ezmember.co.kr/cache/recipe/2018/10/04/5a44e0177229f44e60c13fda4936ff9c1.jpg'}, {'step_number': 3, 'description': '팬에 식용유 넉넉히 넣고 기름이 데워지면 물기 제거한 감자 넣고 구워주고', 'image_url': 'https://recipe1.ezmember.co.kr/cache/recipe/2018/10/04/14b7062b654c4a51aeab048447fc01391.jpg'}, {'step_number': 4, 'description': '튀기는 중간에 뒤집어 주면 더 빨이 튀겨져요 감자가 바삭하게 튀겨지면 거품이 잦아 들면서 소리가 거의 나지 않아요 이때 건져냅니다', 'image_url': 'https://recipe1.ezmember.co.kr/cache/recipe/2018/10/04/3315a77137627d4482add4e43cab8db21.jpg'}, {'step_number': 5, 'description': '튀긴 감자는 기름 제거하고요 바삭바삭 맛있는 간식 포테이토 칩 완성입니다', 'image_url': 'https://recipe1.ezmember.co.kr/cache/recipe/2018/10/04/d234ec2118d103d13609a774966035b61.jpg'}]"
167773,과자,간식,채소류,튀김,손이가도 손이 가는 고구마칩,고구마칩,https://recipe1.ezmember.co.kr/cache/recipe/2018/10/12/b5e7612848b2a487e459e3bad88479c91.jpg,"4,972",30분 이내,아무나,4인분,"[('고구마 큰 사이즈', '2개'), ('요리유', '적당량'), ('소금', '약간'), ('설탕                                                                                이나 꿀', '약간')]","지금 집에 넘쳐나는 고구마!
이럴떈 감자칩이 아니라 고구마칩이죠!
제가 전자렌지에도 해보고
오븐에도 구워봤지만 역시나 감자칩이나
고구마칩은 튀겨야 그 맛이 제일! 이더라구요.
그래서 다이어트는 잠시 안녕~","[{'step_number': 1, 'description': '집에 넘쳐나는 고구마들 중\n큰 고구마 두개를 건져내어\n껍질을 벗겨주세요.', 'image_url': 'https://recipe1.ezmember.co.kr/cache/recipe/2018/10/12/4769face54e69e9277043425181166c21.jpg'}, {'step_number': 2, 'description': '칩으로 만들어 먹기위해서 \n슬라이스로 썰어 물에 담궈서\n전분기를 제거해 주세요.(10분이상)', 'image_url': 'https://recipe1.ezmember.co.kr/cache/recipe/2018/10/12/b359842fa35bb6213078e166405d3e971.jpg'}, {'step_number': 3, 'description': '10분이 지나면 체어 건져 두었다가\n물기를 조금 빼고', 'image_url': 'https://recipe1.ezmember.co.kr/cache/recipe/2018/10/12/6e4856b2b84981a0e97e5096fb1324011.jpg'}, {'step_number': 4, 'description': '건져낸 고구마들을\n키친타올에 닦아 물기를 제거합니다.', 'image_url': 'https://recipe1.ezmember.co.kr/cache/recipe/2018/10/12/5d1d4ea9d6600cbc053421300d125a031.jpg'}, {'step_number': 5, 'description': '그런 다음엔 기름에 고구마칩들을 \n튀겨주세요.', 'image_url': 'https://recipe1.ezmember.co.kr/cache/recipe/2018/10/12/978283890e235238bdb1d72afd540ad31.jpg'}, {'step_number': 6, 'description': '튀긴 고구마들은 \n기름종이 위에 담아 두고', 'image_url': 'https://recipe1.ezmember.co.kr/cache/recipe/2018/10/12/f9ae609e7fb5a6a0f2989b1aef868b141.jpg'}, {'step_number': 7, 'description': '기호에 따라 꿀을 뿌리거나 설탕, 소금을 뿌려주세요.', 'image_url': 'https://recipe1.ezmember.co.kr/cache/recipe/2018/10/12/ada963173f74d7d2a6f5aea620afb39c1.jpg'}, {'step_number': 8, 'description': '정말 초간단! \n하지만 맛은 일품인 고구마칩!\n시장이나 마트에서 사먹던 그 맛\n정말 맛있어요^^', 'image_url': 'https://recipe1.ezmember.co.kr/cache/recipe/2018/10/12/deba8a2c578dbc26f326885a00e679971.jpg'}]"
