index,종류별,상황별,재료별,방법별,글 제목,레시피이름,레시피이미지,조회수,조리시간,난이도,인분,재료,소개글,조리순서
169594,차/음료/술,일상,과일류,절임,패션후르츠청 백향과 에이드 백향과청 패션후르츠에이드,백향과청에이드,https://recipe1.ezmember.co.kr/cache/recipe/2023/05/19/cb43562d128b54967301b669c63aecc51.jpg,985,10분 이내,초급,6인분 이상,"[('백향과', '6개'), ('과즙', '180g'), ('설탕', '180g')]",백가지 맛이 난다는 백향과로 백향과청을 만들어 백향과 에이드로 마십니다.,"[{'step_number': 1, 'description': '마트에서 산 백향과를 2 개는 그냥 먹고 6 개로 청을 만들었어요. 백향과는 그냥 먹기도 하지만 신맛이 강해서 청을 만들어 봅니다.', 'image_url': 'https://recipe1.ezmember.co.kr/cache/recipe/2023/05/19/10719d61be4299db4841ada5998806311.jpg'}, {'step_number': 2, 'description': '백향과는 깨끗이 씻어 반으로 잘라 줍니다. 톡톡 씹히는 씨가 노란 젤리 같은 과육에 싸여 빼곡하게 차 있네요.', 'image_url': 'https://recipe1.ezmember.co.kr/cache/recipe/2023/05/19/90f6f65a41e60c12cdf89abbf6ad82b01.jpg'}, {'step_number': 3, 'description': '숟가락을 이용해서 속에 있는 과육을 파냅니다.', 'image_url': 'https://recipe1.ezmember.co.kr/cache/recipe/2023/05/19/23463c933adaeee49806543fd2c164541.jpg'}, {'step_number': 4, 'description': '개구리알처럼 생겼네요.^^', 'image_url': 'https://recipe1.ezmember.co.kr/cache/recipe/2023/05/19/97ac9c601f85f656d06c475fb6f1cde71.jpg'}, {'step_number': 5, 'description': '과즙 무게를 재보니 180g이라 설탕도 똑같이 180g 넣어 줍니다.', 'image_url': 'https://recipe1.ezmember.co.kr/cache/recipe/2023/05/19/e6dee8080e6157a2b6449139baf618991.jpg'}, {'step_number': 6, 'description': '설탕이 녹게 잘 저어 줍니다.', 'image_url': 'https://recipe1.ezmember.co.kr/cache/recipe/2023/05/19/0ef9a628b1a5966d3c3fb5bac10236a01.jpg'}, {'step_number': 7, 'description': '설탕이 다 녹은 다음 요렇게 병에 담았답니다. 6개로 만들어 양이 얼마 되지 않네요.', 'image_url': 'https://recipe1.ezmember.co.kr/cache/recipe/2023/05/19/c6d4056171a8a6a8fff199b97d89862a1.jpg'}, {'step_number': 8, 'description': '컵에 백향과청을 3 큰 술 정도 넣어 줍니다.', 'image_url': 'https://recipe1.ezmember.co.kr/cache/recipe/2023/05/19/01b19c7a1bc377124e072dc2806211371.jpg'}, {'step_number': 9, 'description': '단맛이 없는 탄산수 250ml 부어 주었답니다.', 'image_url': 'https://recipe1.ezmember.co.kr/cache/recipe/2023/05/19/829c960d94983f812854d62aa81d65d51.jpg'}, {'step_number': 10, 'description': '백향과 에이드 완성입니다. 얼음을 넣어 먹어도 되지요.', 'image_url': 'https://recipe1.ezmember.co.kr/cache/recipe/2023/05/19/ac277bfb994eb7b4da92636e5c2be0671.jpg'}]"
169595,차/음료/술,일상,과일류,절임,매실청 담그기 보관 매실엑기스 매실청 담그는시기 매실엑기스보관,매실청,https://recipe1.ezmember.co.kr/cache/recipe/2023/05/30/5f2efd44533855a89aeb0db186947c971.jpg,"5,956",2시간 이상,초급,6인분 이상,"[('매실', '5kg'), ('설탕', '5kg'), ('올리고당', '1컵'), ('소주', '약간'), ('베이킹소다', ''), ('식초', '')]","이제 매실청 담는 계절이 돌아왔네요 #매실청 #매실엑기스 는 해마다 조금씩이라도 담그는 편이거든요 그래서 지금 먹고 있는 매실청은 거의 10년이 다 된 매실청이었는데 여기저기 나눔을 하다 보니 이제 얼마 안 남아서 올해도 담아야겠네요 이레 시피는 작년에 담았는데 게으름피우다 올리지 못했기에 올해 올려드립니다 #6월제철음식 #매실청담그는시기 #매실청담그는법 입니다 지금부터 매. 실 이 나오기 시작하는데 #매실엑기스담는법 #매실엑기스담그기 메실엑기스를 담으면 100일 만에 과육을 건져내지요 그런데 6월 망종 이후에 수확하는 매. 실은 씨가 여물기 때문에 건져내지 않고 그대로 두어도 된다고 합니다 매실청은 설탕 비율 매실거르기 매실청보관법 등 도 중요하지요 병에 소분해놓고 양념으로 사용하고 음료로도 마시고 있어요 ​레시피는 계량스푼 ,계량컵사용 1 큰 술=15ml1 작은 술=5ml 1컵=200ml ​","[{'step_number': 1, 'description': '저는 작년 6월 12일에 매실을 구매해서 담았어요 이 시기엔 청. 매. 실이 많이 나오지만 조금 지나면 황매실과 홈 매실이 나오는 시기이기도 하지요 청매실이 익으면 황매실이고 황매실은 품종이 다른 종류입니다 초록색 단단한 청매실이 익으면 노르스름한 황매실이 되는데 황매실은 조금 부드럽고 향은 진하고 매실청을 담으면 맛은 조금 더 있는 것 같기도 하더라고요 매실진액은 청매실이나 황매실 홍매실 모두 가능하지만 매실장아찌는 단단한 청매실로 담아야 무르지 않고 오래 두어도 괜찮아요 지금 저는 담은 지 3년 된 매실장아찌도 조금 남았고 작년에 담은 매실장아찌는 아직 열어도 안봤네요 조만간 매실장아찌 담는 법도 올려드릴게요', 'image_url': 'https://recipe1.ezmember.co.kr/cache/recipe/2023/05/30/d16c9411217b36bc16c80b9dcf32530e1.jpg'}, {'step_number': 2, 'description': '청매실로 장아찌나 엑기스를 담는 시기는 5월 말경부터 6월 중순 까지가 담는 시기라 하지요 좋은 매실 고르는법은 상처가 없고 크기가 균일하고 큰 것이 청이나 엑기스를 담았을 때 즙이 많이 나오겠지요 #매실세척 하는것도 중요하지요 베이킹소다를 넣고 10분간 담가 놓았어요', 'image_url': 'https://recipe1.ezmember.co.kr/cache/recipe/2023/05/30/9f05321cab376038d8acf2666f17f21f1.jpg'}, {'step_number': 3, 'description': '베이킹소다 입자가 남아있을 수 있기에 저는 흐르는 물에 다시 한번 깨끗하게 세척해 주었어요', 'image_url': 'https://recipe1.ezmember.co.kr/cache/recipe/2023/05/30/d03fe5ac8be9fba212ee5a630ae6ee501.jpg'}, {'step_number': 4, 'description': '그리고 마지막 헹굼에 물에 식초도 2 큰 술 희석한 다음 헹구어 건져주었어요 꼭 저처럼 식초를 넣거나 베이킹소다로 세척하는 과정을 거치지 않고 흐르는 물에 헹구어도 되겠지만 저는 찝찝해서 세척을 중요시한답니다', 'image_url': 'https://recipe1.ezmember.co.kr/cache/recipe/2023/05/30/51a7dfbe8c1149c080b72bd7f6a258881.jpg'}, {'step_number': 5, 'description': '물기 없이 건져준 다음 남은 물기는 키친타월로 닦아줍니다 물기가 남아있으면 매실청 담았을 때 곰팡이가 생길 수 있어요', 'image_url': 'https://recipe1.ezmember.co.kr/cache/recipe/2023/05/30/8fa9fec398d3ca0d2fcb012b279df7c51.jpg'}, {'step_number': 6, 'description': '#매실손질법 오목한 부분에 까만 꼭지가 있는데 꼭지를 이쑤시개로 제거해 줍니다 게 거하는 게 조금 시간은 걸리지만 어렵지 않아요 꼭지를 제거하지 않으면 쓴맛이 생길 수 있어요 매실 손질법 레시피', 'image_url': 'https://recipe1.ezmember.co.kr/cache/recipe/2023/05/30/cf0121fc53bc60d9c8def1cb7205e4651.jpg'}, {'step_number': 7, 'description': '매실 무게와 설탕 무게를 1:1비율로 준비해 줍니다 설탕량을 줄이게 되면 변질이 되거나 곰팡이가 생길 수 있어요 설탕량을 줄이고 올리고당으로 채워주어도 괜찮아요 담을 용기가 클 경우엔 열탕소독이 어렵기에 뜨거운 물을 부어서 헹구어낸 다음 소주를 조금 넣고 헹구어준 다음 물기를 바짝 말려서 사용하시면 됩니다 저는 작은 용기로 2개를 나누어 담았어요 열탕소독한 용기에 설탕을 깔아준 다음 매실과 설탕을 켜켜이 넣어줍니다', 'image_url': 'https://recipe1.ezmember.co.kr/cache/recipe/2023/05/30/cc626a02121247b2861488e5eee4f67f1.jpg'}, {'step_number': 8, 'description': '켜켜이 설탕과 매실을 넣은 후 마지막에 매실이 보이지 않도록 설탕을 덮어줍니다 저는 올리고당을 조금씩 부어주었어요 올리고당을 부으면 설탕이 빨리 녹아요', 'image_url': 'https://recipe1.ezmember.co.kr/cache/recipe/2023/05/30/40cef4663900933c6ca26151c5ad81b71.jpg'}, {'step_number': 9, 'description': '병여 담아놓고 설탕이 녹으면 매실은 위로 뜨고 설탕이 바닥에 가라앉아있기에 매일 뚜껑을 열어 가스도 빼주고 저어주어야 합니다 저는 그 과정을 찍지 못했네요 이때는 스텐보다는 나무주걱을 이용하는 게 좋아요', 'image_url': 'https://recipe1.ezmember.co.kr/cache/recipe/2023/05/30/58c9af068954935abe75f8e3721fda811.jpg'}, {'step_number': 10, 'description': '바로 담아놓은 매실청은 백일이 지난 다음 엑기스와 매실을 분리해 주기도 하지만 망종이 지난 후에 담은 매실엑기스는 일 년 뒤에 분리해 주어도 괜찮아요 일 년이 지나면 매실의 독은 없어진다고 합니다', 'image_url': 'https://recipe1.ezmember.co.kr/cache/recipe/2023/05/30/45989d08b24a3850ce93729f5d754afd1.jpg'}, {'step_number': 11, 'description': '더운 여름 매실엑기스에 물이나 탄산음료를 넣고 희석한 다음 얼음 동동 띄워 마시면 여름 음료로 더할 나위 없지요 그리고 요리할 때 많이 사용하는 매실청 직접 담아보시면 좋겠지요', 'image_url': 'https://recipe1.ezmember.co.kr/cache/recipe/2023/05/30/fcae5758feb1c7f1c73e506efe9872a91.jpg'}, {'step_number': 12, 'description': '이제 매실청 담는 계절이 돌아왔네요 좋은 매실 제철 요리로 매실청 매실엑기스 만들어 보세요', 'image_url': 'https://recipe1.ezmember.co.kr/cache/recipe/2023/05/30/64f04414c84212dd844250d934f4d1221.jpg'}, {'step_number': 13, 'description': '어떤 음료보다 건강한 맛 건강음료 시원하게 한잔 마셔보세요', 'image_url': 'https://recipe1.ezmember.co.kr/cache/recipe/2023/05/30/591b568fd4d5572b86aa25a92a10a4841.jpg'}]"
169596,차/음료/술,일상,과일류,절임,"상큼 달콤, 키위청",키위청,https://recipe1.ezmember.co.kr/cache/recipe/2017/01/03/db528e805391504561bff394d64769701.jpg,"4,651",15분 이내,아무나,2인분,"[('그린키위                                                                                또는 참다래', '7개'), ('설탕', '400g')]","집에선 별미로 즐기고, 정성이 가득한 선물로도 제격인 키위청을 만들어 볼까요?
키위는 비타민 C, 칼슘, 미네랄 등이 풍부해 누구에게나 좋은 건강 과일입니다.","[{'step_number': 1, 'description': '보관할 용기는 미리 세척한 뒤, 물과 함께 냄비에 넣고 끓여서 소독해 주세요. 습기가 마르는 동안의 시간이 있으니 꼭 미리 해주셔야 합니다.물이 끓을 때 유리용기를 넣게 되면 깨질 위험이 있어요!\n습기가 가득한 용기는 곰팡이가 생길 수 있어요!', 'image_url': 'https://recipe1.ezmember.co.kr/cache/recipe/2017/01/03/63f15fcef58ae8f66c13aa1c0624de5c1.jpg'}, {'step_number': 2, 'description': '키위는 껍질을 깎아 넣을 것이기 때문에 겉에 묻은 먼지 정도만 제거될 수 있도록 흐르는 물에 간단히 씻어주세요.', 'image_url': 'https://recipe1.ezmember.co.kr/cache/recipe/2017/01/03/60eea586251588442bd25a5272f37d081.jpg'}, {'step_number': 3, 'description': '씻은 키위는 모두 껍질을 벗겨 주세요.', 'image_url': 'https://recipe1.ezmember.co.kr/cache/recipe/2017/01/03/6393cf7500d7ae1270b4597d7e46cb431.jpg'}, {'step_number': 4, 'description': '조각이 적당히 작아야 용기에 담기 수월해요. 사진과 같이 약간 얇고 작게 썰어주세요.', 'image_url': 'https://recipe1.ezmember.co.kr/cache/recipe/2017/01/03/3da0d116d726f14ed160952ad277e9151.jpg'}, {'step_number': 5, 'description': '다 썰어냈다면 이제 90%는 완성!', 'image_url': 'https://recipe1.ezmember.co.kr/cache/recipe/2017/01/03/117c38f2f9fc10055d6afcb54ba789361.jpg'}, {'step_number': 6, 'description': '키위와 설탕의 비율이 1:1이 되거나, 아주 약간 설탕이 많도록 담아 주세요. 키위 1칸, 설탕 1칸 이렇게 번갈아 가며 넣어주면 좋아요. 모두 담아 내면 완성!설탕이 적으면 금방 상할 수 있어요!', 'image_url': 'https://recipe1.ezmember.co.kr/cache/recipe/2017/01/03/5aabe19e987e328c7960f66ef1d8032f1.jpg'}]"
169597,차/음료/술,일상,과일류,절임,레몬청 만들기,None,https://recipe1.ezmember.co.kr/cache/recipe/2016/02/05/b7e38f5e0cb7ee969b41646fe8bec45b1.jpg,"13,838",None,None,None,"[('레몬', ''), ('베이킹소다', ''), ('식초', ''), ('설탕', '')]",,[]
169598,차/음료/술,일상,과일류,절임,키위레몬청 키위효능과 감기예방 수제청 만들기,키위레몬청,https://recipe1.ezmember.co.kr/cache/recipe/2016/11/07/76a580a66156d5ac87e63dae5a1e3eb21.jpg,"10,317",30분 이내,아무나,6인분 이상,"[('딱딱한 그린키위 대과', '4개'), ('레몬', '4개'), ('설탕', '적당량'), ('꿀', '적당량')]",감기예방에 좋은 과일청 키위수제청 요즘 날씨가 제법 쌀쌀해졌어요 11월초부터 이런 추위는 처음 이네요 월요일 일이 있어서 밖에 활동을 많이 했더니 저도 감기가 와서 이틀은 집에서 푸욱 쉬면서 열심히 약도 먹고 비타민이 풍부한 과일 많이 먹고 있습니다. 지난주 집에 레몬이 있어서 키위와 레몬을 넣어서 수제청을 만들었어요 레몬과 키위과 비타민과 무기질이 풍부해서 감기예방에 참 좋거든요 탄산수에 타 먹어도 맛있고 따뜻하게 차로 즐겨도 참 좋더라구요 키위 제대로 알고 먹으면 참 좋은 과일 이에요,"[{'step_number': 1, 'description': '레몬은 굵은 소금으로 겉에 박박 문질러서 왁스를 제거하고 베이킹소다를 풀은 물에 5분 정도 침지 다시한번 베이킹소다로 팍팍 문질러서 깨끗이 씻어서 준비 했어요 레몬은 물기를 완전히 제거하고 얇게 썰어 주시구요 씨는 제거해 주세요 쓴맛이 나거든요 키위는 껍질을 제거하고 2-3mm 두께로 썰어 주세요', 'image_url': 'https://recipe1.ezmember.co.kr/cache/recipe/2016/11/07/0d0d521441dc9daa182690c8275b737e1.jpg'}, {'step_number': 2, 'description': '일단 절반 정도의 설탕을 넣고 꿀을 그대로 다 넣고 실리콘 주걱을 이용해서 고루 잘 섞어 주세요 한꺼번에 다 넣으면 덩어리 지고 잘 녹지 않아서 이렇게 하는 거에요', 'image_url': 'https://recipe1.ezmember.co.kr/cache/recipe/2016/11/07/12b279413c1c4c10486e27d5a7e8105a1.jpg'}, {'step_number': 3, 'description': '10분에서 15분 실온에 두면 슬슬 물이 생겨요..', 'image_url': 'https://recipe1.ezmember.co.kr/cache/recipe/2016/11/07/903198c06b761599ef8302140e408e331.jpg'}, {'step_number': 4, 'description': '보이시죠 ? 어느정도 설탕이 녹으면서 물이 생기면 남은 설탕을 넣고 고루 섞어서 실온에 잠시 방치...', 'image_url': 'https://recipe1.ezmember.co.kr/cache/recipe/2016/11/07/4c813cc2750de706dd9fa68c8b574ead1.jpg'}, {'step_number': 5, 'description': '설탕이 잘 녹을수 있게 중간 중간에 살살 뒤적여주시구요..', 'image_url': 'https://recipe1.ezmember.co.kr/cache/recipe/2016/11/07/704178406991421c3478706e1555020a1.jpg'}, {'step_number': 6, 'description': '설탕이 어느정도 녹고 물이 많이 생기면 병에 담아서 실온에서 일주일간 숙성하고 양이 많으면 걸러서 냉장보관하시고 드심 되요 물이나 요거나 우유에 희석해서 드심 좋아요 차로도 좋구요.. 저는 양이 적어서 금방 먹을꺼라 그대로 냉장 보관 했네요', 'image_url': 'https://recipe1.ezmember.co.kr/cache/recipe/2016/11/07/5d00d4699adedd9bfed48a71416d250f1.jpg'}, {'step_number': 7, 'description': '키위레몬청 완성... 뭔가 아쉽네요 양이 적어서 ㅎㅎ 다음주에 시장 가면 더 구매해서 좀 만들어 두어야 겠어요', 'image_url': 'https://recipe1.ezmember.co.kr/cache/recipe/2016/11/07/98821bc30e1bebf15ebbd6041c4b23d71.jpg'}]"
169599,차/음료/술,일상,과일류,절임,레몽청 ...기관지에 좋은 레몽청 만들어 선물하기~*,레몬청,https://recipe1.ezmember.co.kr/cache/recipe/2016/05/10/3d7cf22baabebbc09a65effc1f0db56b1.jpg,"3,097",60분 이내,초급,6인분 이상,"[('레몬', '1박스'), ('자몽', '1박스'), ('설탕', '1봉지'), ('베이킹소다', '3컵'), ('굵은 소금', '2컵')]","광명 코스트코에 갔다가 요즘 핫한 tea <오레몽>을 만들어 보려구 재료를 구입했는데....오렌지가 없어서 레몬,자몽만 구입하고 왔어요.
그래서 오레몽이 아닌 레몽청으로 만들어 볼게요.^^
5월은 감사의 달 
레몽청 만들어 지인,은사님,친지분들에게 한병씩 나누어 주면 정말 좋아 하시겠죠?
비타민C가 많이 함류되어 피로회복,피부미용,
감기예방,다이어트에 좋은 레몬 & 자몽.","[{'step_number': 1, 'description': '레몬은 베이킹소다,소금으로 박박\n문질러 깨끗이 씻어 주셔요.\n자몽은 껍질을 벗기고 사용해서\n그냥 평소처럼 씻어 주셔요.', 'image_url': 'https://recipe1.ezmember.co.kr/cache/recipe/2016/05/09/42a2d1027cbe7b020bfb1fedd97ccf631.jpg'}, {'step_number': 2, 'description': '물기를 닦고..\n레몬을 반을 갈라서 or 원형으로\n아주 얇게 썰어주셔요.\n(씨는 제거)\n자몽은 껍질을 까고 흰색부분도\n되도록 제거하고 알맹이만 3등분\n해서 잘라주셔요.\n(흰색부분이 써요)', 'image_url': 'https://recipe1.ezmember.co.kr/cache/recipe/2016/05/09/609ce93ffec3459487bf935e02e844af1.jpg'}, {'step_number': 3, 'description': '열소독 된 큰 유리밀페용기에\n레몬 한켠 설탕 동량\n자몽 한켠 설탕 동량\n레몬과 자몽이 번갈아가게\n켠켠이 쌓아 줍니다.', 'image_url': 'https://recipe1.ezmember.co.kr/cache/recipe/2016/05/09/d80a98078027907f860b4accbb4f64a01.jpg'}, {'step_number': 4, 'description': '마지막에는 설탕이 덮게역할을 해요.\n병 입구에 설탕을 닦아내고\n비닐을 한장 깔고 덮개를 꼭 \n닫아주셔요.\n설탕이 녹으라고 저을때는 물기가\n전혀 없는 긴주걱으로 저어 주셔요.\n설탕이 녹고 과즙이 발효되면\n작은밀폐유리병에 나눠서 넣고\n선물하셔요.', 'image_url': 'https://recipe1.ezmember.co.kr/cache/recipe/2016/05/09/55cc0fd0e81dbb647732d687fbe140351.jpg'}, {'step_number': 5, 'description': '어떤 맛인지 궁금해서...\n샘플로 먹어 봤어요.\n자몽 과육은 차랑 같이 먹구요.\n레몬은 데코레이션을 해요.', 'image_url': 'https://recipe1.ezmember.co.kr/cache/recipe/2016/05/09/998f478c69d50f31e17d8387cfdb82d01.jpg'}, {'step_number': 6, 'description': '한꺼번에 3개가 들어간 레몬이\n좀 아쉽지만...\n맛은 정말 좋네요.\n선물 받는 분도 좋아하시겠죠?', 'image_url': 'https://recipe1.ezmember.co.kr/cache/recipe/2016/05/09/64b1c9127c59ea33ce69f57dab24ef771.jpg'}]"
169600,차/음료/술,일상,과일류,절임,레몬청 만들기,레몬청,https://recipe1.ezmember.co.kr/cache/recipe/2015/05/18/dfd274edb2984179db12ce20b5771a361.jpg,"6,368",30분 이내,아무나,6인분 이상,"[('레몬', ''), ('설탕', '')]",매번 매실액기스에 물과 얼음을 섞어 음료를 만들었는데 것두 지겨울듯해서 레몬청을 만들었어요.,"[{'step_number': 1, 'description': '레몬에 굵은 소금을 뿌리고 고무장갑을 낀 손으로 봑봑 씻어줬어요.', 'image_url': 'https://recipe1.ezmember.co.kr/cache/recipe/2015/05/18/f521f330644bdaf816b0584a34a9513d1.jpg'}, {'step_number': 2, 'description': '소금세척을 끝내고 베이킹 소다를 넣고 물에 담궈뒀어요. 중간중간 한번씩 휘저어 섞어주구요.', 'image_url': 'https://recipe1.ezmember.co.kr/cache/recipe/2015/05/18/2ba12b55a9d9e2dae47056feea00b1931.jpg'}, {'step_number': 3, 'description': ""요렇게 레몬들을 절단낸 다음 꼭 해야될 일이 있는데요. 고것은 '씨 제거하기' 매실액기스 만들때 꼭지를 제거해야 쓴맛이 안나는 것과 마찬가지예요. 그리고 레몬 끝부분은 쓴맛이 나니까 끝은 사용하지 않았어요."", 'image_url': 'https://recipe1.ezmember.co.kr/cache/recipe/2015/05/18/d04183da2a1b5ddd3706133c4de9b9c41.jpg'}, {'step_number': 4, 'description': '유리병에 레몬과 설탕을 켜켜이 쌓았어요. 그리고 한가지 주의사항이 있어요. 레몬 넣을 저 유리병은 반드시 건조해서 물기를 없애줘야 한다는 것. 물기가 남아있으면 곰팡이가 생기기도 한답니다.', 'image_url': 'https://recipe1.ezmember.co.kr/cache/recipe/2015/05/18/0b14a1eb0961f2d05147dc0cff1496321.jpg'}, {'step_number': 5, 'description': '켜켜이 넣구 마지막엔 레몬이 안보이게 설탕으로 덮어줬어요.', 'image_url': 'https://recipe1.ezmember.co.kr/cache/recipe/2015/05/18/14cfc621cea6cf18a643a9cc3af931b21.jpg'}, {'step_number': 6, 'description': '레몬청 완성! 열흘만 지나면 먹을수 있어요.', 'image_url': 'https://recipe1.ezmember.co.kr/cache/recipe/2015/05/18/35d0dc30b83f8137299d67742c83c06e1.jpg'}]"
169601,차/음료/술,일상,과일류,절임,레몬청 만들기,레몬청,https://recipe1.ezmember.co.kr/cache/recipe/2015/06/08/c6da60ca10ddd874ce9bc039a1607ff4.jpg,"4,930",90분 이내,아무나,6인분 이상,"[('레몬', '2kg'), ('설탕', ''), ('굵은소금', ''), ('베이킹파우더', '')]",감기에도 좋고 비타민C가 풍부해서 피로회복에도 좋은 레몬으로 미세먼지 많은 봄철 건강하게 잘 보낼 수 있을 것 같습니다.,"[{'step_number': 1, 'description': '설탕, 레몬, 굵은소금이 필요해서 천일염소금, 레몬씻어줄 식소다 \ufeff 그리고 레몬청을 담을 병을 준비해주세요.', 'image_url': 'https://recipe1.ezmember.co.kr/cache/recipe/2015/06/19/327ba33177d0bdfb4015ebdd9ad30fde1.jpg'}, {'step_number': 2, 'description': '유리병은 재료를 준비하고 씻고 할 동안 물과함께 냄비안에서 약불로 끓여줍니다.', 'image_url': 'https://recipe1.ezmember.co.kr/cache/recipe/2015/06/19/02f3e42c270453eb372ac6e90062059a1.jpg'}, {'step_number': 3, 'description': '물과 함께 끓고 있는 유리병', 'image_url': 'https://recipe1.ezmember.co.kr/cache/recipe/2015/06/19/338e539bf6544150f76008e899d3fc441.jpg'}, {'step_number': 4, 'description': '레몬 준비', 'image_url': 'https://recipe1.ezmember.co.kr/cache/recipe/2015/06/19/12b0c7a568e590547ab0f9866b69959d1.jpg'}, {'step_number': 5, 'description': '레몬청에 레몬이 껍질째 들어가기 때문에 레몬을 잘 씻어줍니다. 먼저 굵은 소금을 준비해서 위에 듬뿍듬뿍 뿌린 후 장갑을 착용하고 아주 박박 씻어줍니다. 물없이 박박씻어줍니다.', 'image_url': 'https://recipe1.ezmember.co.kr/cache/recipe/2015/06/19/d901a9fd2aab20f748d6e9c69c8a49171.jpg'}, {'step_number': 6, 'description': '식소다를 이용해서 레몬씻기 - 베이킹소다 또는 식소다로 레몬을 2차 씻습니다.', 'image_url': 'https://recipe1.ezmember.co.kr/cache/recipe/2015/06/19/7f59d818a569360df49deddfb409a7441.jpg'}, {'step_number': 7, 'description': '레몬을 주방수건위에 올려놓고 깨끗하게 닦아주기.', 'image_url': 'https://recipe1.ezmember.co.kr/cache/recipe/2015/06/19/0ee3a663c6fdf20ca00c72f1f98be09d1.jpg'}, {'step_number': 8, 'description': '물기를 제거한 후 레몬청을 만들기 때문에 물기를 깨끗이 말립니다.', 'image_url': 'https://recipe1.ezmember.co.kr/cache/recipe/2015/06/19/ff1d123a4a3783a385fbc741ced5d7fc1.jpg'}, {'step_number': 9, 'description': '레몬씨 제거하여 레몬자르기', 'image_url': 'https://recipe1.ezmember.co.kr/cache/recipe/2015/06/19/a871c6ba0e2cc6add7b2ef718e6370511.jpg'}, {'step_number': 10, 'description': '일단 레몬의 양쪽을 잘라줍니다. 양끝부분은 쓰다고하여 먹지않을꺼니까 잘 제거합니다. 씨도 함께 제거해줍니다.', 'image_url': 'https://recipe1.ezmember.co.kr/cache/recipe/2015/06/19/0764c76d4d11ddff132c95d5745d88ab1.jpg'}, {'step_number': 11, 'description': '이제 젤 중요한 레몬과 설탕 1:1 로 담기', 'image_url': 'https://recipe1.ezmember.co.kr/cache/recipe/2015/06/19/52fb886e8c8d3035ad4afcaf530dd6731.jpg'}, {'step_number': 12, 'description': '너무 설탕을 적게 넣어서도 안되고 정말 1:1 에 맞춰야합니다. 주방저울도 맞출계량기도 없지만 \ufeff \ufeff 레몬 1층쌓고 설탕도 한움큼 쌓고 레몬->설탕-> 레몬-> 설탕-> 레몬-> 설탕-> 레몬-> 설탕 순으로 반복합니다.', 'image_url': 'https://recipe1.ezmember.co.kr/cache/recipe/2015/06/19/1883bc469af1873a334305b14eea205d1.jpg'}, {'step_number': 13, 'description': '유리병 맨위는 설탕으로 덮기 숙성될동안 공기가 들어가는 것을 막기위해 설탕으로 마무리하니다.', 'image_url': 'https://recipe1.ezmember.co.kr/cache/recipe/2015/06/19/a5a37c7d985433ff0d935cb52468ce981.jpg'}, {'step_number': 14, 'description': '이렇게 유리병에 담긴 레몬청은 하루이틀 바깥에 두고 다시 냉장고에서 3일 4일 숙성시킨 후 한 일주일있다가 먹으면 좋습니다.', 'image_url': 'https://recipe1.ezmember.co.kr/cache/recipe/2015/06/19/3a60a62c779ab88d7d910cc7435c41e61.jpg'}]"
