index,종류별,상황별,재료별,방법별,글 제목,레시피이름,레시피이미지,조회수,조리시간,난이도,인분,재료,소개글,조리순서
50570,국/탕,영양식,닭고기,끓이기,건강을 생각한 한방 닭미역국 만드는 법,닭미역국,https://recipe1.ezmember.co.kr/cache/recipe/2017/04/13/e17ad3441a7ebc36266bb17c512468441.jpg,"7,542",2시간 이상,초급,6인분 이상,"[('닭 12호', '1마리'), ('백숙용 한약재 티백', '1개'), ('미역', '1줌'), ('물                                                                                800ml', '4컵'), ('무', '310g'), ('대파', '1줌'), ('국간장', '2밥수저'), ('다진 마늘', '1/2밥수저'), ('소금', '1밥수저'), ('후춧가루', '약간'), ('쌀뜨물                                                                                닭이 잠길 정도', '')]",시어머님 댁이 가까운 관계로 남편은 가끔 저녁을 먹고 옵니다. 어머니의 닭미역국이 맛있었다며 저에게 해달라는 남편. 시어머님께 전화해서 레시피를 여쭈어 보았습니다. 남편이 맛있게 먹었다는 이야기에 기분 좋아하시는 시어머님께 전수 받은 닭미역국 레시피 입니다.,"[{'step_number': 1, 'description': '[한방 약재 우리기]\n큰 냄비에 물 4,800ml를 넣어주시고\n백숙용 티백 한약재를 한 봉지 넣어주세요.\n< 강불 >로 시작해서 물이 끓기 시작하면 < 중불 >로 줄여서 40분간 끓여주세요.물 4800ml, 백숙용 한약재 티백 1개 강불로 시작해서 물이 끓으면 중불끓일수록 한약재 맛이 강해지니 선호하지 않으시면 20분만 끓여주세요.', 'image_url': 'https://recipe1.ezmember.co.kr/cache/recipe/2017/04/13/ecc967a0fd7bb5ced0c66900fd8538041.jpg'}, {'step_number': 2, 'description': '[메인 재료 준비]\n미역 한 줌 분량을 찬물에 담가 20분 정도 불려주세요. 12호 닭은 흐르는 찬물에 1차 세척을 해주세요.미역 한 줌, 닭 12호토막낸 닭보다 통닭이 나중에 살 발라내기 좋아요. 닭 껍질 별로 안좋아하시면 정육점에서 구매하실 때 벗겨달라고 해주세요.', 'image_url': 'https://recipe1.ezmember.co.kr/cache/recipe/2017/04/13/c7ef541542b31d82ee30d766fd6d68d01.jpg'}, {'step_number': 3, 'description': '[닭 잡내 제거]\n닭이 잠길 정도의 쌀뜨물에 닭을 30분 정도 담가 주세요.쌀뜨물우유에 담가주셔도 좋지만 아까우니 쌀뜨물 추천 드려요.', 'image_url': 'https://recipe1.ezmember.co.kr/cache/recipe/2017/04/13/0d0e5ee0341e1db3df39ade9d8aa1f611.jpg'}, {'step_number': 4, 'description': '[닭 삶아주기]\n20분~40분 정도 우려낸 육수에 잡내 제거를 마친 닭을 넣어주세요.\n그리고 로 시작해서 끓기 시작하면 로 줄여서 20분 동안 끓여주세요.잡내 제거를 마친 12호 닭강불로 시작해서 육수가 끓으면 중불', 'image_url': 'https://recipe1.ezmember.co.kr/cache/recipe/2017/04/13/13b67a389da0e333174c22f9c9fe593d1.jpg'}, {'step_number': 5, 'description': '[잡내 제거 TIP]\n집에 인삼이 있으시다면 얇게 썰은것 2개를 같이 끓여주세요. 향도 느껴지지 않으면서 닭의 잡내를 효과적으로 잡아 줍니다.인삼 조각 2개 (생략 가능)', 'image_url': 'https://recipe1.ezmember.co.kr/cache/recipe/2017/04/13/4e3b5abacd1aa770478b6960397ce1c11.jpg'}, {'step_number': 6, 'description': '[육수 재료 모두 건져내기]\n닭과 티백 등 모든 재료를 건져내 주세요. 둥둥 떠다니는 불순물도 채반을 이용해서 말끔하게 모두 건져내 주세요.채반불순물을 건져내야 국물의 모습이 깔끔해지겠죠!', 'image_url': 'https://recipe1.ezmember.co.kr/cache/recipe/2017/04/13/edf80e2b058a0a45b13b82c82c9c13d51.jpg'}, {'step_number': 7, 'description': '[닭 발골하기]\n생닭 상태에서의 발골은 전문적인 기술이 필요하지만 삶은 상태라면 아주 간단하답니다.\n위생장갑 착용하시고 살만 발라내 주시고 먹기 좋은 크기로 찢어주세요.위생장갑뜨거우니 조금 식은 상태에서 해주시거나 위생장갑 안에 얇은 장갑을 착용하시고 해주세요.', 'image_url': 'https://recipe1.ezmember.co.kr/cache/recipe/2017/04/13/cff6b301fdb49a043c72d4a8258da5941.jpg'}, {'step_number': 8, 'description': '[닭 살코기에 밑간하기]\n뜯어놓은 닭 살코기에 후춧가루 톡톡 3번, 소금 3 꼬집을 넣고 버무려 주세요.후춧가루 톡톡 세번, 소금 3꼬집너무 주물럭 하시면 닭살이 으깨지니 살살해주세요', 'image_url': 'https://recipe1.ezmember.co.kr/cache/recipe/2017/04/13/72f2e810bd6cccaacd4492befbcb79d11.jpg'}, {'step_number': 9, 'description': '[야채 넣고 끓이기]\n최대한 얇게 썰은 무 310g과 송송 썰은 대파 두 줌을 육수에 넣어주세요.\n로 무가 투명해질때까지 10분 정도 끓여주세요.무 310g, 대파 두 줌강불무는 최대한 얇게 썰어주셔야 빨리 익고 국물에 잘 우러납니다.', 'image_url': 'https://recipe1.ezmember.co.kr/cache/recipe/2017/04/13/98468fd94a57a9efc9ab03b668cf73bf1.jpg'}, {'step_number': 10, 'description': '[메인 재료 넣고 끓이기]\n불린 미역 한 줌을 넣고 로 5분 정도 끓여주시면 미역이 흐물흐물해질거에요. 이때 닭고기를 육수에 넣어주세요.불려놓은 미역 한 줌, 살 발라놓은 닭고기강불', 'image_url': 'https://recipe1.ezmember.co.kr/cache/recipe/2017/04/13/b55f495ef3bbb650988c5cd86189cfec1.jpg'}, {'step_number': 11, 'description': '[취향에 따라 간 맞추기]\n국간장 2스푼, 다진 마늘 반 스푼을 넣고 휘휘 저어주시며 1분간 끓여주세요.\n마무리 간을 보시고 소금으로 취향에 맞춰 간을 맞춰주시면 되는데요. 제 기준으로는 천일염 1스푼 넣었습니다.국간장 2스푼, 다진 마늘 반 스푼, 소금(천일염) 1스푼실패할 포인트는 없지만 한약재 때문에 호불호가 갈릴 수 있으니, 좋아하지 않으시면 최초 육수 내실 때 20분 이하로만 우려주세요.', 'image_url': 'https://recipe1.ezmember.co.kr/cache/recipe/2017/04/13/de494f505d62aa7632cbdc722759587c1.jpg'}]"
50571,국/탕,영양식,닭고기,끓이기,"전복삼계탕 만드는법, 해신탕 레시피",전복삼계탕,https://recipe1.ezmember.co.kr/cache/recipe/2017/07/05/a5d3c4ac5cfe3de661e8345748e50e991.jpg,"173,754",60분 이내,초급,2인분,"[('토종닭                                                                                1kg', '1마리'), ('삼계탕 약재                                                                                마트용', '1팩'), ('인삼', '2뿌리'), ('전복', '3미'), ('낙지', '1마리'), ('마늘', '4쪽'), ('불린 찹쌀', '1/2컵'), ('물', '1.2L'), ('소금', '2/3큰술'), ('후춧가루', '약간')]","우리나라 대표 보양식 삼계탕 ♥
거기에 전복과 낙지를 넣어 좀 더 호화스러운(?) 삼계탕을 만들어봤어요.

미네랄, 칼슘이 풍부한 전복과 타우린, 무기질이 함유된 낙지가 어우러져
풍부한 영양과 국물 맛을 배로 갖춘 오늘의 메뉴^_^

전복해물삼계탕 만드는 법, 해신탕 레시피 소개해요.","[{'step_number': 1, 'description': '**토종닭 대신 영계 2마리로 대체 가능해요.\n**찹쌀은 깨끗이 씻어 1시간 가량 불려 사용하세요.', 'image_url': 'https://recipe1.ezmember.co.kr/cache/recipe/2017/07/05/04a765609c97b4d4a2cbe53e4838e8a21.jpg'}, {'step_number': 2, 'description': '닭을 먹기 좋게 손질한 뒤 찬물에 씻어 핏물과 불순물을 제거해주세요.\n(닭 손질법) 꽁지와 날개 끝부분은 가위를 이용해 잘라내고 껍질을 벗겨내주세요.', 'image_url': 'https://recipe1.ezmember.co.kr/cache/recipe/2017/07/05/8e5e9ff5dac769c2bc0cd3dbc1b63eb71.jpg'}, {'step_number': 3, 'description': '(닭 손질법) 꽁지와 날개 끝부분은 가위를 이용해 잘라내고 껍질을 벗겨내주세요.삼계탕용 닭 손질하는 방법\n특히나 닭의 꽁지는 기름기가 많아 잘라내고 조리해야 깔끔하고 담백한 국물을 낼 수 있어요.', 'image_url': 'https://recipe1.ezmember.co.kr/cache/recipe/2017/07/05/29f37d4891ed5f661efd04a1907199531.jpg'}, {'step_number': 4, 'description': '닭 한마리 껍질이 이렇게 많네요.\n영계로 삼계탕을 만들 땐 껍질 그대로 끓여내도 괜찮더만 토종닭은 국물이 텁텁해지더라고요.\n깔끔한 국물 맛을 위해 닭 껍질을 벗겨냈어요.', 'image_url': 'https://recipe1.ezmember.co.kr/cache/recipe/2017/07/05/17566cfbec0d9daa28b89c14994836c51.jpg'}, {'step_number': 5, 'description': '손질한 토종닭 배에 찹쌀, 인삼, 마늘을 넣어주세요.\n다리를 X자로 교차한 뒤 굵은 실로 단단히 고정시켜주세요.실이 없다면 닭다리 한쪽 가랑이에 세로로 칼집을 넣어주세요.\n칼집 사이로 반대편 다리를 엇갈리게 찔러넣어 X자로 교차시켜주는 방법도 있습니다.', 'image_url': 'https://recipe1.ezmember.co.kr/cache/recipe/2017/07/05/bcea60b272d6a5495538dea8081d2db31.jpg'}, {'step_number': 6, 'description': '밥솥에 물 1.2L, 닭 1마리, 전복 3미, 약재를 넣어주세요.\n압력밥솥 찜기능을 이용해 40분 이상 충분히 익혀주세요.베리츄는 전복을 미리 손질한 뒤 냉동시켰다가 하나씩 꺼내 요리를 하고 있어요.\n생 전복을 사용한다면 껍질을 솔로 깨끗이 닦아내며 씻어준 뒤 이빨을 제거하고 넣어주셔요.', 'image_url': 'https://recipe1.ezmember.co.kr/cache/recipe/2017/07/05/737dcabfa2cfcf9973b69df678542d061.jpg'}, {'step_number': 7, 'description': '베리츄는 밥솥에 스마트영양찜 기능이 탑재되어있어 간편하게 이용했는데요,\n없다면 일반 밥통에 있는 찜모드로 40분~1시간 가량 익혀주세요.', 'image_url': 'https://recipe1.ezmember.co.kr/cache/recipe/2017/07/05/5c115f63fb998c0da09623a732b5e6161.jpg'}, {'step_number': 8, 'description': '(전복삼계탕 만드는 동안) 낙지를 손질해주세요.<낙지 손질법>\n1. 낙지 머리에 칼집을 내어 뒤집은 뒤 내장을 뺀다.\n2. 머리와 다리를 연결하는 부분에 돌출되어있는 눈 2개를 제거한다.\n3. 다리를 뒤집어 안쪽에 있는 입을 제거한다.\n4. 밀가루 4큰술을 넣고 바락바락 주물러 씻어준다.낙지 손질법 레시피', 'image_url': 'https://recipe1.ezmember.co.kr/cache/recipe/2017/07/05/917a708ef18095a0265e1f2082dd1a831.jpg'}, {'step_number': 9, 'description': '전복삼계탕이 완성되면 냄비로 옮겨준 뒤, 약재를 건져내주세요.', 'image_url': 'https://recipe1.ezmember.co.kr/cache/recipe/2017/07/05/bf57aeb74f8745c7dd1b412a3bfac5461.jpg'}, {'step_number': 10, 'description': '중불로 끓여주면서 닭이 충분하게 익을 때까지 끓여주세요.삼계탕을 냄비에 끓일 때 중간중간 거품을 걷어내주면 육수의 맛이 깔끔해져요.\nQ. 닭이 익었는지 확인하는 방법?\nA. 젓가락을 이용해 살코기 부분을 찔러보세요. 막힘없이 푹 들어가면 다 익은 거예요.', 'image_url': 'https://recipe1.ezmember.co.kr/cache/recipe/2017/07/05/1a4f069961a137079c59b50448afba551.jpg'}, {'step_number': 11, 'description': '완성된 전복삼계탕에 낙지를 넣고 3분간 끓여주세요.낙지를 오래 익히면 질겨지니 마지막 단계에 넣고 3분 정도 익혀주는 것이 좋아요:)', 'image_url': 'https://recipe1.ezmember.co.kr/cache/recipe/2017/07/05/3f9db2fd17ecb6712111f4f6195052bb1.jpg'}, {'step_number': 12, 'description': '소금, 후춧가루로 간을 해주세요.', 'image_url': 'https://recipe1.ezmember.co.kr/cache/recipe/2017/07/05/cff38e874666dc93eb0aaa9eb76b326a1.jpg'}]"
50572,국/탕,영양식,닭고기,끓이기,":: 엄나무 백숙 :: 쌀쌀~한날이면 생각나는 뜨끈한 삼계탕, 백숙요리 !",None,https://recipe1.ezmember.co.kr/cache/recipe/2015/06/08/b6a1f516efebfeb28abbe612f64f4eb2.jpg,"54,886",None,None,None,[],,[]
50573,국/탕,영양식,닭고기,끓이기,"백숙, 간단한 재료-압력솥 활용, 초간단",백숙,https://recipe1.ezmember.co.kr/cache/recipe/2017/07/13/b89cd2a7b94050eda9ee9f38db4aac6b1.jpg,"20,424",60분 이내,초급,2인분,"[('영계500g', '2마리'), ('대파', '1뿌리'), ('마늘', '20알'), ('찹쌀', '6줌'), ('맛술', '6T'), ('쌀뜨물', '적당량'), ('꽃소금', '1.5티스푼'), ('맛소금', '약간'), ('후추', '약간')]",밥숟가락 계량 입니다.,"[{'step_number': 1, 'description': '찹쌀은 씻어서 불려둡니다.', 'image_url': 'https://recipe1.ezmember.co.kr/cache/recipe/2017/07/13/8170782a3057996513c6bc4ebad983481.jpg'}, {'step_number': 2, 'description': '닭은 안쪽까지 잘 씻어주고 기름기가 많은 꽁지부분은 가위로 잘라줍니다.', 'image_url': 'https://recipe1.ezmember.co.kr/cache/recipe/2017/07/13/12b0e28323e8a8a2a2bf184115155c941.jpg'}, {'step_number': 3, 'description': '닭 안에 찹쌀3줌,마늘10알을 넣어 채워 줍니다.', 'image_url': 'https://recipe1.ezmember.co.kr/cache/recipe/2017/07/13/33c3a6350340b4b151e76c260f5b80a71.jpg'}, {'step_number': 4, 'description': '닭 다리 한쪽에 칼집을 내고 다리를 교차하여 엮어줍니다.', 'image_url': 'https://recipe1.ezmember.co.kr/cache/recipe/2017/07/13/1653c4c20cef3cebc4ad5ae3c61bd7f91.jpg'}, {'step_number': 5, 'description': '압력솥에 닭을 넣고 쌀뜨물을 닭 반정도 차도록 부어준뒤, 대파,꽃소금,맛술을 넣어 줍니다.', 'image_url': 'https://recipe1.ezmember.co.kr/cache/recipe/2017/07/13/ed8782a446b8129a3377fd875b6d043d1.jpg'}, {'step_number': 6, 'description': '15분정도 강불에서 조리 해 압력추가 올라오면 중약불로 줄여 30분정도 더 조리 해 줍니다.', 'image_url': 'https://recipe1.ezmember.co.kr/cache/recipe/2017/07/13/6f4495029e8159cb0dbd57aa728caf001.jpg'}, {'step_number': 7, 'description': '불을끄고 압력추가 내려오면 압력솥 뚜껑을 열어주어 완성.', 'image_url': 'https://recipe1.ezmember.co.kr/cache/recipe/2017/07/13/1ccb4a10f8487b13f20f80bd60dd9c421.jpg'}, {'step_number': 8, 'description': '맛소금에 후추를 곁들여 드시면 됩니다.', 'image_url': 'https://recipe1.ezmember.co.kr/cache/recipe/2017/07/13/ad4488ee33fc2e4dc7bcb024bb65e6f91.jpg'}]"
50574,국/탕,영양식,닭고기,끓이기,여름철 보양식 닭백숙과 닭죽끓이기,닭백숙,https://recipe1.ezmember.co.kr/cache/recipe/2015/07/07/9572bdc6d74aca42dec7b3beb0d8e7601.jpg,"14,936",120분 이내,중급,3인분,"[('닭', '1마리'), ('전복', '2개'), ('낙지', '1마리'), ('녹두', ''), ('찹쌀', ''), ('맵쌀', ''), ('감자', ''), ('양파', ''), ('당근', ''), ('애호박', ''), ('인삼', ''), ('대추', ''), ('통마늘', ''), ('헛개나무', ''), ('오가피', ''), ('황기', ''), ('소금', ''), ('후추가루', '조금')]","다가오는 복날을 맞이해 미리 닭백숙을 끓여보았어요~
전복과 낙지가 들어가있어 해신탕과 감히 견주어볼수있는
남녀노소 모두 좋아할 닭백숙이랍니다^^","[{'step_number': 1, 'description': '녹두는 몸안의 독소를 배출해주어 미용팩으로도 많이 사용하시지요???\n녹두를 고르실때에는 표면이 거칠고 광택이 나지않는것이 좋답니다ㅎㅎ\n맵쌀, 찹쌀, 녹두를 깨끗이 씻어 물에 충분히 담가 불려주세요~', 'image_url': 'https://recipe1.ezmember.co.kr/cache/recipe/2015/07/14/af48af640455d15f25e3dd3d38a1ee541.jpg'}, {'step_number': 2, 'description': '남녀노소 누구나 부담없이 즐길수있는 닭은\n배를 가르고 껍질을 벗겨 깨끗이 씻은다음\n끓는물에 살짝 데쳐 닭의 불순물과 기름기를 제거해주세요ㅎㅎ', 'image_url': 'https://recipe1.ezmember.co.kr/cache/recipe/2015/07/14/b1406c1b448c21f79e32a10b63a1fe181.jpg'}, {'step_number': 3, 'description': '삼계탕이나 백숙에 빠지지않는 재료들이지요???ㅎ\n통마늘과 대추도 깨끗이 씻어 준비해주시고요~\n인삼은 인삼의 머리부분인 뇌두를 제거해주세요~\n인삼의 뇌두부분에는 독성을 포함하고있어 \n구토나 설사를 유발할수있다고해요ㅠㅠ', 'image_url': 'https://recipe1.ezmember.co.kr/cache/recipe/2015/07/14/7a87531e708b8aeefb650a614ce9b6ca1.jpg'}, {'step_number': 4, 'description': '땀이 많으신분들에게 정말 좋다는 황기는 닭백숙에 필수이고요~\n간 해독에 특효인 헛개나무와 \n뼈와 근육에 좋은 오가피도 한줌씩 준비해보았어요~', 'image_url': 'https://recipe1.ezmember.co.kr/cache/recipe/2015/07/14/30fa103c5b57277783b85c62bf7df0f91.jpg'}, {'step_number': 5, 'description': '웍이나 압력솥에 데쳐놓은 닭을 넣으시고\n준비해두신 인삼, 통마늘, 대추, 황기, 헛개나무, 오가피와\n양파, 대파를 넣어 찬물을 붓고 끓이기 시작합니다~\n국물이 지저분해지고 찌꺼기가 나올수있는 나무류와 통마늘은\n다시팩에 싸서 넣어주었어요^^;;', 'image_url': 'https://recipe1.ezmember.co.kr/cache/recipe/2015/07/14/bf73a1025a9ab18d8a8261806b8dcd3e1.jpg'}, {'step_number': 6, 'description': '전복은 솔을 이용해 깨끗이 씻어 주었고요~\n쓰러진 소도 일으켜세운다는 산낙지 역시 \n흐르는 물에 씻어준비했어요ㅎㅎ', 'image_url': 'https://recipe1.ezmember.co.kr/cache/recipe/2015/07/14/9332c5756199283db8b5e36e4a0c266e1.jpg'}, {'step_number': 7, 'description': '닭의 살이 푹 무르고 국물이 충분히 우러나오면\n닭을 제외한 나머지 재료들을 모두 건져내시고\n한김 식힌후에 국물에 떠있는 기름기를 걷어내주세요~\n삼계탕이나 백숙에 들어간 인삼을 드시는 분들도 계시지만\n불순물을 모두 흡수했다고하여 건져내시는분들도 많더라구요ㅎㅎㅎ', 'image_url': 'https://recipe1.ezmember.co.kr/cache/recipe/2015/07/14/a4eab526d0dd0466f1de4d492efaf6c21.jpg'}, {'step_number': 8, 'description': '전골팬에 닭을 담아주시고\n기름기를 제거한 육수를 부어 팔팔 끓을때\n전복과 낙지를 넣어 한소큼 끓여냅니다~\n낙지는 오래 익히면 질겨지고\n전복이나 낙지 모두 회로 드실수있는것이니 살짝만 익혀주시면 되어요~ㅎㅎㅎ', 'image_url': 'https://recipe1.ezmember.co.kr/cache/recipe/2015/07/14/32fc2019edd54bc6c7aa83cd03eab5ad1.jpg'}, {'step_number': 9, 'description': '닭, 낙지, 전복을 건져 \n소금, 후추에 살짝 찍어 맛있게 드시고요~~~', 'image_url': 'https://recipe1.ezmember.co.kr/cache/recipe/2015/07/14/ba418e15675ffee22a2bf8c8bdaeeadb1.jpg'}, {'step_number': 10, 'description': '나머지 육수를 이용해 죽을 끓여야 하겠지요???\n감자, 애호박, 당근, 양파를 잘게 다져준비했어요~', 'image_url': 'https://recipe1.ezmember.co.kr/cache/recipe/2015/07/14/260d8d0b03ae6703a02dd70a88e2d50b1.jpg'}, {'step_number': 11, 'description': '육수에 불려놓은 녹두와 맵쌀, 찹쌀을 넣고 끓이시다가\n준비한 채소를 모두 넣고 \n녹두가 툭툭 터질때까지 뭉근하게 죽을 끓여줍니다~', 'image_url': 'https://recipe1.ezmember.co.kr/cache/recipe/2015/07/14/15c28ca3654de84abf43d7f87e0b60791.jpg'}, {'step_number': 12, 'description': '소금, 후추로 간을 하시고\n실파를 쫑쫑 썰어 깨소금과함께 마무리해주었어요ㅎㅎㅎ', 'image_url': 'https://recipe1.ezmember.co.kr/cache/recipe/2015/07/14/7c603ed619fe505d786903cbc1a133cb1.jpg'}]"
50575,국/탕,영양식,닭고기,끓이기,녹두 닭백숙/ 닭님을 녹두물에 목욕시키기~,녹두닭백숙,https://recipe1.ezmember.co.kr/cache/recipe/2015/07/11/5e645f4c3e7da83f79ab0dae940f6ef51.jpg,"7,221",2시간 이상,중급,2인분,"[('닭', ''), ('녹두', ''), ('대추', ''), ('황기', ''), ('마늘', ''), ('낙지', '')]",복날도 얼마 남지 않았고.. 기력도 보충 할겸.. 녹두 닭백숙을 했답니다.. 저는 요게 그렇게도 맛나더라구요... 아직 드시지 못한 분이 있다면 꼭 한번 해 드셔보세요.. 복날이 얼마 남지 않았어요~~,"[{'step_number': 1, 'description': '녹두는 하루전날 12시간정도 불려줍니다.. 요즘은 날이 더우니 물을 한시간에 한번씩 갈아주거나.. 냉장고에서 불리시길 바래요~~~ 저는 녹두를 좋아해서 많이 넣었습니다.. 음.. 머그컵으로 세컵 정도?', 'image_url': 'https://recipe1.ezmember.co.kr/cache/recipe/2015/07/13/6b0c4a7f2a97b689c15246c1cf1234001.jpg'}, {'step_number': 2, 'description': '닭님을 깨끗이 씻어 월계수 잎을 몇개 띄우고 살짝 삶아내 줄거에요.. 저는 그냥 끓이는 것보다 한번 끓여내고 씻어주는게 좋더라구요.. 많이는 아니고.. 바글바글 끓으면 5분쯤 있다가 꺼내서 씻어 줍니다요..', 'image_url': 'https://recipe1.ezmember.co.kr/cache/recipe/2015/07/13/07415bed899453a044217679b7a8369f1.jpg'}, {'step_number': 3, 'description': '닭을 끓일때 큰냄비에 녹두를 넣고 물을 많이 넣고 같이 끓여주세요..', 'image_url': 'https://recipe1.ezmember.co.kr/cache/recipe/2015/07/13/2632a54c887b60a9f889fe8660bb96da1.jpg'}, {'step_number': 4, 'description': '닭이 끓고 오분쯤 후에 꺼내서 찬물에 한번 씻어 불순물을 제거하고 녹두가 들어있는 냄비에 닭을 넣고.. 황기, 대추, 마늘등을 넣고 푹~~ 세네시간을 끓입니다.. 오래 끓일것이기 때문에 물이 너무 적으면 안되요~ 중간에 보니 요래 뽀얗게 국물이 끓고 있더구만요...', 'image_url': 'https://recipe1.ezmember.co.kr/cache/recipe/2015/07/13/810ac7d4a727b004c553903d7148279c1.jpg'}, {'step_number': 5, 'description': '세시간쯤은 바글바글 끓이다가 한시간쯤 약불로 끓여 주어요.. 마지막에 저는 산낙지를 넣고.. 10여분쯤 더 끓였어요.. 머리가 없었다면 살짝만 끓였겠지만.. 머리가 있어서..', 'image_url': 'https://recipe1.ezmember.co.kr/cache/recipe/2015/07/13/d9008703cddce457471325286d3bb7321.jpg'}, {'step_number': 6, 'description': '구수하고 담백한 녹두 닭백숙이 완성! 다 먹고 보면 녹두죽이 가득~ 아~~ 맛나다.. 요게 별미거든요~~ 행복해요~~', 'image_url': 'https://recipe1.ezmember.co.kr/cache/recipe/2015/07/13/900cf9489919cee1d25dc9309c3d7d591.jpg'}]"
