index,종류별,상황별,재료별,방법별,글 제목,레시피이름,레시피이미지,조회수,조리시간,난이도,인분,재료,소개글,조리순서
71025,밥/죽/떡,일상,채소류,비빔,아삭아삭한 콩나물밥 만드는 법/콩나물밥/콩나물 야채밥/균형 잡힌 영양 콩나물밥 만드는 방법/콩나물밥,콩나물밥,https://recipe1.ezmember.co.kr/cache/recipe/2023/08/15/1f975080548a24a814f4b7d66f0141841.jpg,"5,881",60분 이내,초급,4인분,"[('콩나물', '200g'), ('둥근 호박', '1개'), ('노란 파프리카', '1/2개'), ('당근', '1/2개'), ('돼지고기 다짐육', '200g')]","점심 메뉴 고민하다가 오랜 만에 콩나물밥을 만들었습니다. 콩나물은 물론 호박, 당근 등 야채가 골고루 추가되고, 갈 은 고기 볶아 넣어서 다른 반찬이 없이 계란 국만 곁들여 먹어도 될 정도로 한 끼 균형 잡힌 콩나물밥이 되었습니다.

아삭아삭하게 먹기 위해 콩나물을 무치지 않고 그대로 그냥 넣고 고기에 간을 조금 세게 잡았더니 양념장 넣고 콩나물밥을 비벼 먹었을 때 간이 딱! 맞아 떨어졌답니다.","[{'step_number': 1, 'description': '콩나물을 세척해 줍니다.', 'image_url': 'https://recipe1.ezmember.co.kr/cache/recipe/2023/08/15/2cfcede5c7635da8cbf07329719347dc1.jpg'}, {'step_number': 2, 'description': '콩나물을 깨끗이 세척하여 냄비에 담고 10분간 삶아 줍니다.', 'image_url': 'https://recipe1.ezmember.co.kr/cache/recipe/2023/08/15/b68a076a9842d706aff11a9d5f8438e31.jpg'}, {'step_number': 3, 'description': '10분간 콩나물을 삶아 줍니다.', 'image_url': 'https://recipe1.ezmember.co.kr/cache/recipe/2023/08/15/e5b4540e1670dd0b7698b0cba478eeb21.jpg'}, {'step_number': 4, 'description': '콩나물이 익으면 찬물로 2번 헹구어 주어 열기를 식혀 주어야 식 감이 아삭아삭 합니다.', 'image_url': 'https://recipe1.ezmember.co.kr/cache/recipe/2023/08/15/86908202309cbea09740fcefa51b83841.jpg'}, {'step_number': 5, 'description': '삶은 콩나물을 헹구어 준 뒤 소쿠리에 건져서 물기를 뺍니다.', 'image_url': 'https://recipe1.ezmember.co.kr/cache/recipe/2023/08/15/ee9e0b46dd3862e410b2ec0769a5cc301.jpg'}, {'step_number': 6, 'description': '갈은 고기를 재우기 위해 양념장을 만들어 줍니다. 양념 볼에 마늘 1큰 술을 넣어 줍니다.', 'image_url': 'https://recipe1.ezmember.co.kr/cache/recipe/2023/08/15/26efe21623c9171fa4ce9187e58f752a1.jpg'}, {'step_number': 7, 'description': '진간장 2 큰 술을 넣어 줍니다.', 'image_url': 'https://recipe1.ezmember.co.kr/cache/recipe/2023/08/15/783fd12b1f81e027ab5ac5d0613627811.jpg'}, {'step_number': 8, 'description': '소주 1 큰 술을 넣어 줍니다.', 'image_url': 'https://recipe1.ezmember.co.kr/cache/recipe/2023/08/15/10f9490e90e9c92ac4be058daa4e377a1.jpg'}, {'step_number': 9, 'description': '스테비아 설탕 1/2 큰 술을 넣어 줍니다.', 'image_url': 'https://recipe1.ezmember.co.kr/cache/recipe/2023/08/15/e63bb8e3eed266ac9b73cba239e9ce931.jpg'}, {'step_number': 10, 'description': '후추도 약간을 넣어 줍니다.', 'image_url': 'https://recipe1.ezmember.co.kr/cache/recipe/2023/08/15/7d777e70599a83fd52100340d6bd2a331.jpg'}, {'step_number': 11, 'description': '참기름 1 큰 술을 넣어 줍니다.', 'image_url': 'https://recipe1.ezmember.co.kr/cache/recipe/2023/08/15/50d3c7db0b90d6fcd2a204bc8f6d466f1.jpg'}, {'step_number': 12, 'description': '말린 생강도 넣어 줍니다. 생강은 돼지고기의 누린내를 없애 줍니다.', 'image_url': 'https://recipe1.ezmember.co.kr/cache/recipe/2023/08/15/8b2178f3f8f36ce78c409af761b441691.jpg'}, {'step_number': 13, 'description': '갈아 놓은 고기에 양념을 넣고 골고루 주물러 줍니다.', 'image_url': 'https://recipe1.ezmember.co.kr/cache/recipe/2023/08/15/5bbf3a1b7bfe1c159d43f83a162548b41.jpg'}, {'step_number': 14, 'description': '절 여 둔 갈 은 고기를 물기 없게 바삭하게 볶아 줍니다.', 'image_url': 'https://recipe1.ezmember.co.kr/cache/recipe/2023/08/15/c53e6453f224764b654a47d3ecdb84a51.jpg'}, {'step_number': 15, 'description': '고기가 완전히 볶아지면 그릇에 옮겨 담아 줍니다.', 'image_url': 'https://recipe1.ezmember.co.kr/cache/recipe/2023/08/15/645067822cea2d6235dc82fded39b6501.jpg'}, {'step_number': 16, 'description': '둥근 호박 1개를 준비해서 깨끗이 손질해 줍니다.', 'image_url': 'https://recipe1.ezmember.co.kr/cache/recipe/2023/08/15/9960b99207e02f1ce25523cbad474c1e1.jpg'}, {'step_number': 17, 'description': '둥근 호박은 0.5cm 두께로 채 썰어 줍니다.', 'image_url': 'https://recipe1.ezmember.co.kr/cache/recipe/2023/08/15/15686280c50cbd004d0242eeda3ecf3a1.jpg'}, {'step_number': 18, 'description': '채 썰어 놓은 둥근 호박에 소금 1/3 작은 술을 넣어 절 여 줍니다.', 'image_url': 'https://recipe1.ezmember.co.kr/cache/recipe/2023/08/15/1b3c6a368b1d0b6424420ca006cd55f91.jpg'}, {'step_number': 19, 'description': '절 여 둔 둥근 호박은 물기 짜낸 후 센 불에서 재빨리 볶아 줍니다.', 'image_url': 'https://recipe1.ezmember.co.kr/cache/recipe/2023/08/15/c25ab258c2564fe5159cca7c0ba397641.jpg'}, {'step_number': 20, 'description': '둥근 호박이 약간 덜 익은 느낌에서 불을 끄고 남은 열기로 볶아 줍니다.', 'image_url': 'https://recipe1.ezmember.co.kr/cache/recipe/2023/08/15/874fad11d4400dcdedf646fe948fd6d11.jpg'}, {'step_number': 21, 'description': '둥근 호박이 볶아지면 참기름을 1 큰 술 넣어 줍니다.', 'image_url': 'https://recipe1.ezmember.co.kr/cache/recipe/2023/08/15/f973b2b8373c88d574caba2ed3a550ac1.jpg'}, {'step_number': 22, 'description': '볶은 둥근 호박에 깨소금을 넣어 줍니다.', 'image_url': 'https://recipe1.ezmember.co.kr/cache/recipe/2023/08/15/0b43b9ec022d5b8c3055bbef3c6bc5041.jpg'}, {'step_number': 23, 'description': '노란 파프리카 채 썰어 줍니다.', 'image_url': 'https://recipe1.ezmember.co.kr/cache/recipe/2023/08/15/85506ee6be77e2e08fff519bdf50140a1.jpg'}, {'step_number': 24, 'description': '식용유 두르고 소금 한 꼬 집 넣어 볶아 냅니다.', 'image_url': 'https://recipe1.ezmember.co.kr/cache/recipe/2023/08/15/11f29f3143e14ea2cb85d187f499ffc41.jpg'}, {'step_number': 25, 'description': '물이 끓으면 채 썰어 놓은 당근을 1분간 데칩니다.', 'image_url': 'https://recipe1.ezmember.co.kr/cache/recipe/2023/08/15/0990ba2ed14029dde0ac32c0aca703771.jpg'}, {'step_number': 26, 'description': '데쳐 낸 당근을 팬에서 재빨리 볶아 냅니다.', 'image_url': 'https://recipe1.ezmember.co.kr/cache/recipe/2023/08/15/b2a8e2db1213ddc76d17abe2d33f98301.jpg'}, {'step_number': 27, 'description': '볶은 당근을 그릇에 담고 열기를 식혀 줍니다.', 'image_url': 'https://recipe1.ezmember.co.kr/cache/recipe/2023/08/15/f22cf7fd14ed32e506d2c28bcae311ec1.jpg'}, {'step_number': 28, 'description': '콩나물밥을 세팅하기 위해 밥을 비빔 그릇에 담아 줍니다.', 'image_url': 'https://recipe1.ezmember.co.kr/cache/recipe/2023/08/15/d4ad2d6e52e5e2c90d649f631496a3eb1.jpg'}, {'step_number': 29, 'description': '익힌 콩나물, 볶은 노란 파프리카, 볶은 호박, 당근을 돌려 담고 볶은 고기를 가운데에 올려 줍니다.', 'image_url': 'https://recipe1.ezmember.co.kr/cache/recipe/2023/08/15/41fadfea983b94ffd05dc24bbe9adb091.jpg'}, {'step_number': 30, 'description': '아삭아삭한 식 감이 좋은 콩나물과 채소들, 그리고 볶은 고기와 비빔 양념장을 넣고 비벼 드시면 영양이 균형 잡힌 콩나물밥을 먹을 수 있습니다.', 'image_url': 'https://recipe1.ezmember.co.kr/cache/recipe/2023/08/15/094b0dc838c809927ff0a5d7a59fa3881.jpg'}]"
71026,밥/죽/떡,일상,채소류,비빔,"오이 요리, 오이김비빔밥 레시피",오이김비빔밥,https://recipe1.ezmember.co.kr/cache/recipe/2023/08/16/2812d787c3d79353320f3f6685d334df1.jpg,897,15분 이내,아무나,1인분,"[('공기밥', '200g'), ('오이', '1개'), ('김가루', '1컵'), ('진간장', '1.5T'), ('마요네즈', '1T'), ('연겨자', '0.5T'), ('식초', '1.5T'), ('참기름', '1T'), ('통깨', '0.5T')]","오이 요리, 오이김비빔밥 레시피 입니다.","[{'step_number': 1, 'description': '-오이는 한입 크기로 썰어 주세요.', 'image_url': 'https://recipe1.ezmember.co.kr/cache/recipe/2023/08/16/df4fcdc5f0439d6765e32f3523fced881.jpg'}, {'step_number': 2, 'description': '공기밥 200g 을 준비하고, 그 위에 오이를 올려주세요. 그리고나서 진간장 1.5T 넣어주세요.', 'image_url': 'https://recipe1.ezmember.co.kr/cache/recipe/2023/08/16/2439b60694931368e7bd6669a2369b491.jpg'}, {'step_number': 3, 'description': '식초도 1.5T 들어갑니다.', 'image_url': 'https://recipe1.ezmember.co.kr/cache/recipe/2023/08/16/46abba9668d946a3c28bc49aa80a67b41.jpg'}, {'step_number': 4, 'description': '참기름 1T 넣어주시구요.', 'image_url': 'https://recipe1.ezmember.co.kr/cache/recipe/2023/08/16/352e8443a696d36f7da0d636f88632ff1.jpg'}, {'step_number': 5, 'description': '연겨자 혹은 고추냉이 0.5T 넣어주세요.', 'image_url': 'https://recipe1.ezmember.co.kr/cache/recipe/2023/08/16/28d9501858cfdc3187b35af03a2439241.jpg'}, {'step_number': 6, 'description': '마요네즈 1T 들어가구요.', 'image_url': 'https://recipe1.ezmember.co.kr/cache/recipe/2023/08/16/3b27c276c3b0ef4d87339e8574d7ea021.jpg'}, {'step_number': 7, 'description': '김가루는 종이컵 기준으로 1컵 올려주세요.', 'image_url': 'https://recipe1.ezmember.co.kr/cache/recipe/2023/08/16/cce81c2168dfd19f7560f38d17ae7e5a1.jpg'}, {'step_number': 8, 'description': '마지막으로 통깨 0.5T 가량 뿌린 다음 비벼 드시면 됩니다.', 'image_url': 'https://recipe1.ezmember.co.kr/cache/recipe/2023/08/16/e3722abf17455dc69b6367261309bb341.jpg'}]"
71027,밥/죽/떡,일상,채소류,비빔,조인성 비빔밥 부추 활용요리- 5분컷 초초간단 레시피,부추비빔밥,https://recipe1.ezmember.co.kr/cache/recipe/2023/08/17/25458257141687071d4de128c1d69cb61.jpg,753,5분 이내,아무나,1인분,"[('밥', '1공기'), ('부추', '1줌'), ('참기름', '1~2T'), ('계란', '1개'), ('통깨', '약간'), ('고추장', '1T'), ('설탕', '1T'), ('참기름', '1/2T'), ('물', '1T')]","여름철 부추는 맛도 제일 좋고 건강에도 아주 좋다고 하니까요ㅎㅎ 여름에 특히 부추로 겉절이, 부추전, 무침 등으로 다양하게 드실 텐데요! ​부추 요리를 많이 만들어 먹는 요즘 부추가 애매하게 남았길래 저는 부추비빔밥을 만들어봤어요 :) ​일명 조인성비빔밥♡ 티비에서 조인성님이 만들었다길래 레시피를 보니.. 초초간단하면서 꿀맛보장 이겠더라구요ㅋㅋ 부추 잘게 썰고. 고추장 양념 만들고. 계란후라이 하나 부치면 땡이랍니다ㅎㅎㅎ 어른용 간장 계란비빔밥이라고 표현해볼까봐요ㅋㅋ 계속 땡기는 맛ㅋㅋ 저는 두 그릇도 먹을 것 같아요 :)​","[{'step_number': 1, 'description': '부추를 흐르는 물에 깨끗이 헹궈서 세척합니다 상한 부분은 정리해 주시구요 물기를 제거해서 준비합니다', 'image_url': 'https://recipe1.ezmember.co.kr/cache/recipe/2023/08/17/6f6ffda257d2a034fae9c665d651d5901.jpg'}, {'step_number': 2, 'description': '아이들도 같이 먹을 거라서 잘게 썰어서 준비했답니다 양이 꽤 많죠?ㅎㅎ 네 식구 비빔밥 해 먹고 남은 부추로는 부추 계란말이를 만들어 먹었어요 >', 'image_url': 'https://recipe1.ezmember.co.kr/cache/recipe/2023/08/17/b3b2bed0c5c468ad3b535b9393fe3a7c1.jpg'}, {'step_number': 3, 'description': '비빔밥 양념장을 만들어 봅니다 고추장 1T, 설탕 1T, 참기름 1/2T, 물 1T 를 넣고 잘 섞어 주세요', 'image_url': 'https://recipe1.ezmember.co.kr/cache/recipe/2023/08/17/6c48ec4eaf6112b5f00193f6287cfa831.jpg'}, {'step_number': 4, 'description': '계란후라이도 반숙으로 준비해 주세요', 'image_url': 'https://recipe1.ezmember.co.kr/cache/recipe/2023/08/17/5412fa6952359b61db14d11efa85110c1.jpg'}, {'step_number': 5, 'description': '접시를 준비! 따뜻한 밥 1공기 올리고 썰어 놓은 부추도 넉넉히 옮겨 담아 줍니다 :)', 'image_url': 'https://recipe1.ezmember.co.kr/cache/recipe/2023/08/17/21dfbeb8e7acd333d4e8796c09d4a43b1.jpg'}, {'step_number': 6, 'description': '그 위에 참기름 한바퀴 삥 (1~2T) 둘러주시구요', 'image_url': 'https://recipe1.ezmember.co.kr/cache/recipe/2023/08/17/e5839ed12d441399f555111d6883fae71.jpg'}, {'step_number': 7, 'description': '계란후라이도 예쁘게 살포시 담아 주세요 :)', 'image_url': 'https://recipe1.ezmember.co.kr/cache/recipe/2023/08/17/b3617fca5a78168cd03ee0d299b118ad1.jpg'}, {'step_number': 8, 'description': '이어서 고추장 양념장을 올려 주세요 양념장은 입맛에 맞게 넣어 드시면 된답니다 :) 통깨도 솔솔 뿌려주면 조인성 비빔밥 만들기 완성입니다♡', 'image_url': 'https://recipe1.ezmember.co.kr/cache/recipe/2023/08/17/e43be50d29c5c031391cd8d69d5cf5441.jpg'}]"
71028,밥/죽/떡,일상,채소류,비빔,전기밥솥 콩나물밥 만드는법 콩나물 간장비빔밥,콩나물비빔밥,https://recipe1.ezmember.co.kr/cache/recipe/2022/12/07/8de49f5e456e9d2e33cbd27403ef9f3a1.jpg,"2,491",20분 이내,아무나,4인분,"[('콩나물', '300g'), ('쌀', '3컵'), ('물', '3T'), ('달래', '1움큼'), ('물', '1/2컵'), ('간장', '1/2컵'), ('고춧가루', '1T'), ('설탕', '2t'), ('통깨', '약간'), ('참기름', '1T'), ('청양고추', '1/2개')]",슥슥 비벼서 먹음 그 맛이 최고인 콩나물비빔밥 만들어 볼께요.,"[{'step_number': 1, 'description': '반찬이 많이 필요없는 콩나물비빔밥 만들기 해 볼께요.', 'image_url': 'https://recipe1.ezmember.co.kr/cache/recipe/2022/12/07/752b19635af6bc4089dce38d31d410a81.jpg'}, {'step_number': 2, 'description': '저는 밥3컵을 기준으로 콩나물 300g을 넣었어여\n깨끗하게 세척한 콩나물을 쌀을 씻어서 물을 약간 덜 넣고\n그 위에 세척한 콩나물을 넣어 주세요.\n그리고 취사버튼 누르시면 되요', 'image_url': 'https://recipe1.ezmember.co.kr/cache/recipe/2022/12/07/fe27ed99ba16ef163007a092ce2f371e1.jpg'}, {'step_number': 3, 'description': '고춧가루1T.설탕2t.통깨약간.청양고추를 넣고\n잘 저어 주세요.\n매운 것을 싫어 하시는 분들은 청양고추를 빼시면 되시구요\n좋아하시는 분들은 더 넣으셔도 되세요.\n그리고 기호에 따라서 설탕 양도 조절하시면 되세요.', 'image_url': 'https://recipe1.ezmember.co.kr/cache/recipe/2022/12/07/b61b40ad95e8aefba3da2ce22e8139fe1.jpg'}, {'step_number': 4, 'description': '콩나물밥이 완성이 되었네요.', 'image_url': 'https://recipe1.ezmember.co.kr/cache/recipe/2022/12/07/82b3935db5dc96ea64d90a492dedc50d1.jpg'}, {'step_number': 5, 'description': '그럼 밥이랑 함께 콩나물을 뜨고 양념장과 함께 내서 슥슥 비벼서 먹음 된답니다.', 'image_url': 'https://recipe1.ezmember.co.kr/cache/recipe/2022/12/07/4e054d07cf5ca178b6051231516775511.jpg'}]"
71029,밥/죽/떡,일상,채소류,비빔,알토란 알배추비빔밥 이원일 레시피 알배추나물 대패삼겹살 한그릇요리 feat.만능된장양념,알배추비빔밥,https://recipe1.ezmember.co.kr/cache/recipe/2023/05/28/9aacaed1f228bc7a854d48151e34d0281.jpg,575,30분 이내,아무나,4인분,"[('밥', '1공기'), ('쪽파', '1T'), ('달걀', '1개'), ('대패삼겹살', '100g'), ('알배추', '600g'), ('청양고추', '3T'), ('홍고추', '약간'), ('참기름', '3T'), ('국간장', '1.5T'), ('다진 마늘', '1T'), ('다진 대파', '1T'), ('통깨', '2T'), ('후추', '약간'), ('된장', '5T'), ('국간장', '1/2T'), ('고춧가루', '2T'), ('꿀', '2T'), ('후추', '약간'), ('다진 마늘', '1T'), ('다진 대파', '1T'), ('맛술', '1T'), ('통깨', '2T'), ('단무지', '4T'), ('청양고추', '3개')]",알배추무침 밥 위에 올려 만능된장양념에 비벼 보세요!! 따로 반찬이 필요없는 한그릇요리입니다.,"[{'step_number': 1, 'description': '끓는 물 2L에 소금 1T를 넣고 알배추 600g을 잎 부분을 잡고 줄기 부분을 먼저 30초간 데친다. * 부위별로 식감과 익는 속도가 다르니 줄기부터 익혀야 물러지지 않고 식감을 제대로 살리 수 있다.', 'image_url': 'https://recipe1.ezmember.co.kr/cache/recipe/2023/05/29/796b6824992a3685d096153dd3c3ed8d1.jpg'}, {'step_number': 2, 'description': '줄기 부분을 30초 데친 후 이파리까지 모두 담가 넣고 배추가 부드러워질 때까지 3분간 데친 후 얼음 물에 식힌다.', 'image_url': 'https://recipe1.ezmember.co.kr/cache/recipe/2023/05/29/0c2310498fc5ab8fe83a04be4b14ca781.jpg'}, {'step_number': 3, 'description': '손으로 가볍게 물기를 제거한 후 손으로 먹기 좋게 찢는다.', 'image_url': 'https://recipe1.ezmember.co.kr/cache/recipe/2023/05/29/43321fd73a47829ddd20e619ced55bfb1.jpg'}, {'step_number': 4, 'description': '참기름 3T, 국간장 1.5T, 다진 마늘 1T, 다진 대파 1T, 통깨 2T, 후춧가루 약간 넣고 알배추 나물 양념장을 만든다.', 'image_url': 'https://recipe1.ezmember.co.kr/cache/recipe/2023/05/29/f91aa8f5677f8eb8fde13691d9e0768c1.jpg'}, {'step_number': 5, 'description': '먹기 좋게 찢어 놓은 알배추에 송송 썬 홍고추 2개, 청양고추 3개를 넣고 양념장을 모두 넣어 버무린다.', 'image_url': 'https://recipe1.ezmember.co.kr/cache/recipe/2023/05/29/44ee2911461ecb731f33ef96238548191.jpg'}, {'step_number': 6, 'description': '대패삼겹살이나 기타 자투리 고기를 구워 기름을 제거한다.', 'image_url': 'https://recipe1.ezmember.co.kr/cache/recipe/2023/05/29/4c27da46e48a31ed7f7612d33381fd121.jpg'}, {'step_number': 7, 'description': '만능 된장 양념 재료들 된장 5T, 국간장 1/2T, 고춧가루 2T, 꿀 2T, 후춧가루 1t, 다진 마늘 1T, 맛술 1T, 통깨 2T, 다진 꼭 들 단무지 4T, 다진 청양고추 3개를 넣고 섞는다. * 꿀은 된장의 짠맛을 잡아주는 역할', 'image_url': 'https://recipe1.ezmember.co.kr/cache/recipe/2023/05/29/3a96b75dbd651125d2c2cbc2d6992caf1.jpg'}, {'step_number': 8, 'description': '밥을 담고 구운 고기, 알배추 나물, 달걀 프라이 그리고 송송 썬 쪽파를 올린 후 만능 된장 양념과 함께 내면 완성된다.', 'image_url': 'https://recipe1.ezmember.co.kr/cache/recipe/2023/05/29/ae4b67b97dca304e83adb196da5977031.jpg'}]"
71030,밥/죽/떡,일상,채소류,비빔,제철 돌나물요리 돌나물 참치비빔밥 만드는 법,돌나물참치비빔밥,https://recipe1.ezmember.co.kr/cache/recipe/2023/04/01/6876b13debad0a051b727d12c976a6ec1.jpg,"1,158",10분 이내,아무나,2인분,"[('돌나물', '100g'), ('참치캔', '1개'), ('오이', '1/2개'), ('밥', '2공기'), ('후춧가루', '조금'), ('식초', '1큰술'), ('고추장', '2큰술'), ('매실액', '1큰술'), ('올리고당', '1큰술'), ('다진마늘', '1큰술'), ('식초', '1큰술'), ('참기름', '1큰술'), ('깨소금', '1큰술')]","봄철 나물 돌나물로 만드는 향긋한 비빔밥이에요. 10분도 안 걸리기 때문에 간단한 자취 요리로도 좋고, 간편한 한 그릇 음식으로도 너무 좋은 돌나물 참치 비빔밥입니다. 참치랑 양념장 듬뿍 넣어서 비벼 먹으니 고소하고 아삭하고 새콤해서 너무 맛있더라고요. 싱싱한 제철 돌나물로 비빔밥 맛있게 만들어 보세요. :)","[{'step_number': 1, 'description': '돌나물은 깨끗이 세척하고 식초 1큰술 탄 물에 5분 정도 담가주세요. 그리고 흐르는 물에 헹궈서 물기를 탈탈 털어줍니다.', 'image_url': 'https://recipe1.ezmember.co.kr/cache/recipe/2023/04/01/4449f60805c85bab2dd4e758e5f57bf91.jpg'}, {'step_number': 2, 'description': '오이는 1/2개 채 썰어서 준비해 주세요. 오이는 썰어 놓으면 물이 나오니 키친타월을 깔아 잠시 대기합니다.', 'image_url': 'https://recipe1.ezmember.co.kr/cache/recipe/2023/04/01/8d2b91a427b0089a89ac21faadfd785a1.jpg'}, {'step_number': 3, 'description': '참치캔은 조심히 따서 느끼하지 않게 체에 밭쳐서 기름을 쫙 빼주세요.', 'image_url': 'https://recipe1.ezmember.co.kr/cache/recipe/2023/04/01/c84e480d9aadb7aa3750b6b3bf92c0511.jpg'}, {'step_number': 4, 'description': '양념장은 새콤하게 만들겠습니다. 고추장 2큰술, 다진마늘 1큰술, 매실액 1큰술, 올리고당 1큰술, 식초 1큰술, 깨소금 1큰술, 참기름 1큰술 넣어서 잘 섞어주세요.', 'image_url': 'https://recipe1.ezmember.co.kr/cache/recipe/2023/04/01/56e6de0fd77664599d99dcc77be00b1f1.jpg'}, {'step_number': 5, 'description': '그릇에 밥을 먼저 깔고 돌나물과 오이를 올려주세요. 그리고 가운데에 기름 뺀 참치를 올리고 후추를 살짝 뿌려줍니다. 이제 새콤한 초고추장 양념장 입맛에 맞게 올려서 비벼 먹으면 돼요.', 'image_url': 'https://recipe1.ezmember.co.kr/cache/recipe/2023/04/01/1a96de313104353b42d277f84231a00e1.jpg'}]"
71031,밥/죽/떡,일상,채소류,비빔,미나리비빔밥 만드는법,미나리비빔밥,https://recipe1.ezmember.co.kr/cache/recipe/2023/04/09/c608a10d1d41bc86aea2a5a8641547201.jpg,"1,389",30분 이내,초급,2인분,"[('미나리', '50g'), ('참치', '90g'), ('계란', '2개'), ('밥', '2공기'), ('식초', '1T'), ('까나리액젓', '1T'), ('설탕', '1T'), ('고춧가루', '1T'), ('참기름', '1작은술'), ('깨', '1작은술'), ('초장', '3T'), ('식초', '1T')]",제철인 미나리와 참치넣어 비빔밥 만들었습니다.,"[{'step_number': 1, 'description': '재료준비했어요.', 'image_url': 'https://recipe1.ezmember.co.kr/cache/recipe/2023/04/09/11244a0182d80389ede44b25af014ad71.jpg'}, {'step_number': 2, 'description': '미나리는 줄기뿌리부분 약간 잘라내주세요. 물에 식초 1T를 넣고 미나리를 10분 담가놔요. 이렇게하면 세척이 잘되고 좋아요. 건져내서 여러번헹궈 잘 씻어줍니다.', 'image_url': 'https://recipe1.ezmember.co.kr/cache/recipe/2023/04/09/38857d3283844ca1b7a80b7e8bb924491.jpg'}, {'step_number': 3, 'description': '건져 물기뺀 미나리 2~3등분 해주세요. 참치는 기름을 빼주고 초장 3T를 넣고 버무려줘요.', 'image_url': 'https://recipe1.ezmember.co.kr/cache/recipe/2023/04/09/43d1869b49afdd26d85801a207b0e2301.jpg'}, {'step_number': 4, 'description': '식초1T, 까나리액젓 1T, 설탕 1T, 고춧가루 1T를 넣고 조물조물 무쳐줍니다. 마무리로 참기름 1작은술, 깨 1작은술을 넣고 섞어줍니다. 계란 반숙이나 완숙으로 부쳐 올려주시면되요.', 'image_url': 'https://recipe1.ezmember.co.kr/cache/recipe/2023/04/09/34855f00d58f3606e8fbeec9d6b72d151.jpg'}]"
71032,밥/죽/떡,일상,채소류,비빔,가지 덮밥 양념장 여름 제철 채소 한그릇 요리,가지덮밥,https://recipe1.ezmember.co.kr/cache/recipe/2023/08/05/1f5824c3bc80195185ae5549f5903ea81.jpg,471,60분 이내,아무나,1인분,"[('밥', '1공기'), ('가지', '1개'), ('부추', '조금'), ('간장', '3스푼'), ('고춧가루', '1ts'), ('매실액', '1스푼'), ('참기름', '조금'), ('다진마늘', '1ts'), ('깨소금', '조금')]",가지 덮밥 양념장 여름 제철 채소 한그릇 요리,"[{'step_number': 1, 'description': '가지는 반으로 잘라 너무 두껍지 않은 크기로 어슷하게 잘라 주었어요. 조금더 부드러운 맛을 좋아하시면 두껍게 준비하셔도 됩니다. 쫄깃한 구운 가지을 좋아해서 얇게 썰어 주었습니다.가지 손질법 레시피', 'image_url': 'https://recipe1.ezmember.co.kr/cache/recipe/2023/08/28/e1e325f86bcc6f97e96a52ef736e662d1.jpg'}, {'step_number': 2, 'description': '기름 두르지 않은 팬에 가지를 가지런하게 올리고 수분이 날아가게 앞뒤로 구워 줍니다. 옆에 있으면 수분이 증발하는 것을 보실 수 있어요. 원하시는 식감에 맞게 굽는 정도는 선택해 주세요.타지만 않게 신경써 주세요. 오래 익히지 않아도 되서 다른 나물 보다 만들기 쉽습니다.', 'image_url': 'https://recipe1.ezmember.co.kr/cache/recipe/2023/08/28/5d2479bc8eafaa16bbaecd24c7e245931.jpg'}, {'step_number': 3, 'description': '준비한 양념들을 차례대로 넣고 섞어 줍니다. 간장의 양보다는 부추를 많이 먹을 수 있게 간장의 양은 최소로 넣었습니다. 부추 송송 썰어 주고 냉장고에 방치 되어있던 김밥만들고 남았던 기름에 볶은 당근 채도 같이 넣어 주었습니다. 당근을 양념장에 넣으면 영양도 추가 할 수 있지만 색도 고와서 입맛을 살려 줍니다. 눈이 만족해요.', 'image_url': 'https://recipe1.ezmember.co.kr/cache/recipe/2023/08/28/c7263afc40c3665f8f1a39b641f9fffc1.jpg'}, {'step_number': 4, 'description': '사진처럼 밥 위에 구운 가지 올리고 양념장 올려 비벼 먹으면 완성입니다. 또 다른 방법으로 구운가지에 양념장을 무친후 나물 처럼 만든후 밥이랑 비벼 드셔도 됩니다.', 'image_url': 'https://recipe1.ezmember.co.kr/cache/recipe/2023/08/28/8ae78d6471f0623aa7490af188b5d8be1.jpg'}]"
