index,종류별,상황별,재료별,방법별,글 제목,레시피이름,레시피이미지,조회수,조리시간,난이도,인분,재료,소개글,조리순서
46719,국/탕,일상,해물류,끓이기,시원한 조개 국물을 넣어 만든 바지락 시금치국,바지락시금치국,https://recipe1.ezmember.co.kr/cache/recipe/2015/12/08/e48ad94a7aaa8a561503d903403a47971.jpg,"8,644",30분 이내,초급,2인분,"[('시금치', '1/2단'), ('바지락', '2봉지'), ('물', '1L'), ('고추장', '2큰술'), ('된장', '1큰술'), ('대파', '1/2대'), ('후추', '약간'), ('다진마늘', '1/2큰술'), ('소금', '1/2작은술')]",시금치와 바지락 육수로 달짝지근하고 시원한 국을 만들어 보려고 합니다.,"[{'step_number': 1, 'description': '먼저 시금치를 손질하는데, 찬물에 5분 정도 담가서 흙이나 이물질을 제거합니다. 세번 정도 찬물에 헹궈 물기를 제거하고 뿌리를 제거합니다. 전 칼 대신 가위를 사용했답니다. 그리고 국에 넣을 것이므로 가위로 시금치를 먹기 좋게 2등분 해주었습니다. 뭐 칼을 이용하셔도 되지만 반 단 밖에 안 되므로 가위를 이용했답니다.시금치 손질법 레시피', 'image_url': 'https://recipe1.ezmember.co.kr/cache/recipe/2015/12/09/eaf07e12ac17b41ed51207cf05497f961.jpg'}, {'step_number': 2, 'description': '바지락은 2봉지를 사용했답니다. 조개 크기가 작아서 2봉지를 사용했으며, 해감을 해야 하는데, 찬물에 천일염 을 1큰술 반 정도 넣고 물은 바지락이 잠길 정도로 넣습니다. 이 때 볼을 사용하고 그 위에 채반을 넣어 여기에 바지락을 넣어주면 한번 해감한 이물질들은 볼 바닥에 깔려 더욱 좋답니다. 검정 비닐을 씌워주면 조개가 있던 뻘 같은 어두운 환경을 만들어 주기 때문에 더 잘 해감이 된답니다. 한 두 시간 정도 해감해줍니다.', 'image_url': 'https://recipe1.ezmember.co.kr/cache/recipe/2015/12/09/f582e821a2c2a3cc27b031e09beb9cbf1.jpg'}, {'step_number': 3, 'description': '냄비에 물 1리터를 넣고 해감한 바지락을 넣고 끓여줍니다.', 'image_url': 'https://recipe1.ezmember.co.kr/cache/recipe/2015/12/09/21448a85f13f62fa17afedce810b199a1.jpg'}, {'step_number': 4, 'description': '찬물에서부터 넣고 끓여야 육수가 뽀얗게 잘 우러나온답니다. 조개 육수가 대신 멸치 육수를 사용하셔도 되구요.', 'image_url': 'https://recipe1.ezmember.co.kr/cache/recipe/2015/12/09/18ba3ad7ce911657c2d55a6d331e49c01.jpg'}, {'step_number': 5, 'description': '끓기 시작하면 거품들을 제거합니다.', 'image_url': 'https://recipe1.ezmember.co.kr/cache/recipe/2015/12/09/a17ea1529b38b86595de22928f5711621.jpg'}, {'step_number': 6, 'description': '거품망으로 제거하면 쉽게 제거할 수 있구요. 이 거품망은 찬물에 씻어서 다시 거품을 제거해야 원래의 거품 이 다시 냄비에 들어가지 않는답니다. 뽀얗게 국물이 우러나면 ~', 'image_url': 'https://recipe1.ezmember.co.kr/cache/recipe/2015/12/09/5dbcf13a5521d3d67549fe791e994dd91.jpg'}, {'step_number': 7, 'description': '거품망에 육수를 한번 걸러줍니다. 면보에 걸러주면 더욱 좋구요.', 'image_url': 'https://recipe1.ezmember.co.kr/cache/recipe/2015/12/09/b26c2fa8c3838dbfed45bdd20f4dacfc1.jpg'}, {'step_number': 8, 'description': '이물질이 하나도 없는 뽀얀 바지락 육수입니다.~', 'image_url': 'https://recipe1.ezmember.co.kr/cache/recipe/2015/12/09/2fd90d73027c5bb294e66ef2ea0c23911.jpg'}, {'step_number': 9, 'description': '데친 바지락은 일단 꺼내놓아야지, 계속 끓이면 바지락이 질겨진답니다.', 'image_url': 'https://recipe1.ezmember.co.kr/cache/recipe/2015/12/09/ad499357bcd07381c121720df3b1a8821.jpg'}, {'step_number': 10, 'description': '데쳐진 바지락은 조개껍질 한쪽을 제거하는 것이 좋습니다. 바지락살만 넣으면 너무 볼륨감이 없고, 조개 껍질을 다 넣으면 국에 온통 조개껍질만 돌아다니는 것 같아서... 요렇게 전처리를 하면 음식이 아주 깔끔해진답니다.', 'image_url': 'https://recipe1.ezmember.co.kr/cache/recipe/2015/12/09/8babb861a0b86633c17c2ef4924e105d1.jpg'}, {'step_number': 11, 'description': '고추장을 주 베이스로 해서 만들었기 때문에 고추장 2큰술을 넣어주고( 매운 것이 싫으시면 된장양을 많이 하고 고추장을 적게 넣어도 됩니다. 된장국엔 고추장을 약간 넣거나, 고추장국에 된장을 약간 넣어주는 것 이 훨씬 맛을 깊게 해준답니다. 하나의 장만 넣었을 때보다...) 여기에 고추가루를 1큰술 정도 넣어주어도 좋구요. 전 고추가루는 안 넣었답니다.', 'image_url': 'https://recipe1.ezmember.co.kr/cache/recipe/2015/12/09/63bc7aaffc305a44b37ff79517d94c691.jpg'}, {'step_number': 12, 'description': '된장은 1큰술을 넣어줍니다.', 'image_url': 'https://recipe1.ezmember.co.kr/cache/recipe/2015/12/09/19f08e888ed28ca75952ec4d3c0f27f61.jpg'}, {'step_number': 13, 'description': '된장의 콩 찌거기는 버리지 말고 영양가가 많으므로 그대로 풀어주기만 하고 국에 넣어줍니다.', 'image_url': 'https://recipe1.ezmember.co.kr/cache/recipe/2015/12/09/7d3f148e1b796c6aaef174c43a2b7dc51.jpg'}, {'step_number': 14, 'description': '요렇게 국물에 양념을 풀어주고 끓기 시작하면~', 'image_url': 'https://recipe1.ezmember.co.kr/cache/recipe/2015/12/09/5176cc938f85f3cb8f0a940e93f3e14e1.jpg'}, {'step_number': 15, 'description': '손질한 시금치를 넣어줍니다.', 'image_url': 'https://recipe1.ezmember.co.kr/cache/recipe/2015/12/09/83b246e856252ca1e7528255bd89aae81.jpg'}, {'step_number': 16, 'description': '다진마늘 반큰술을 넣어주고~', 'image_url': 'https://recipe1.ezmember.co.kr/cache/recipe/2015/12/09/8017582c5784068bb10623c070bd84701.jpg'}, {'step_number': 17, 'description': '후추도 약간 넣어주고~ ( 통후추를 넣어주면 향이 아주 진하답니다.)', 'image_url': 'https://recipe1.ezmember.co.kr/cache/recipe/2015/12/09/e0b857fd01daf66e75cc36d1ec73fcab1.jpg'}, {'step_number': 18, 'description': '껍질을 손질해두었던 바지락을 넣어줍니다.', 'image_url': 'https://recipe1.ezmember.co.kr/cache/recipe/2015/12/09/39ad513647708a940e7dd6aad06e5d2b1.jpg'}, {'step_number': 19, 'description': '바지락을 넣어 잠깐만 끓여주면 됩니다.', 'image_url': 'https://recipe1.ezmember.co.kr/cache/recipe/2015/12/09/4649ee88f281fa4a2495214bdcd48e9c1.jpg'}, {'step_number': 20, 'description': '대파는 어슷썰어줍니다.', 'image_url': 'https://recipe1.ezmember.co.kr/cache/recipe/2015/12/09/fdc992137135be83d03e847f28d536cd1.jpg'}, {'step_number': 21, 'description': '대파를 넣어 완성하면 됩니다. 좀더 매운 맛을 원하실 땐 고추를 어슷썰어 넣어주세요.', 'image_url': 'https://recipe1.ezmember.co.kr/cache/recipe/2015/12/09/96a1f6e2b6b4297e1a0104254754e8411.jpg'}, {'step_number': 22, 'description': '소금 반작은술을 넣어 주시면 됩니다. 스푼이 2.5ml 거든요.', 'image_url': 'https://recipe1.ezmember.co.kr/cache/recipe/2015/12/09/fc05d7aec28f5976e66f0b7734c6ea271.jpg'}]"
46720,국/탕,일상,해물류,끓이기,얼큰하고 시원한 오징어국,오징어국,https://recipe1.ezmember.co.kr/cache/recipe/2015/09/22/d2bf6b87a213fbc2655df0b14dc05d2e1.jpg,"23,506",30분 이내,초급,2인분,"[('오징어', '1마리'), ('무 작은 것', '1/3개'), ('양파', '1/2개'), ('고추', '1개'), ('고추가루', '1T'), ('다진마늘', '1/2T'), ('간장', '1T'), ('소금', '약간')]",얼큰하고 시원한 오징어국입니다.,"[{'step_number': 1, 'description': '오징어는 깨끗하게 손질한 후 먹기 좋은 크기로 썰어 줍니다.오징어 손질법 레시피', 'image_url': 'https://recipe1.ezmember.co.kr/cache/recipe/2015/09/22/c4fcc9a3a5cc0632d8fba8a6dda8efb11.jpg'}, {'step_number': 2, 'description': '양파는 채썰고 고추는 어슷썰어 줍니다. 무는 0.5cm 간격으로 썰어 줍니다.', 'image_url': 'https://recipe1.ezmember.co.kr/cache/recipe/2015/09/22/cc646034234fec851b1fe1ac8b90ea001.jpg'}, {'step_number': 3, 'description': '먼저 찬물을 넣어서 끓여 줍니다.', 'image_url': 'https://recipe1.ezmember.co.kr/cache/recipe/2015/09/22/e28154de39766e99e4c83b9b666854d91.jpg'}, {'step_number': 4, 'description': '끓기 시작하면 10분간 더 끓여 줍니다. 무를 이용해서 육수를 만들어 주는 것 입니다.', 'image_url': 'https://recipe1.ezmember.co.kr/cache/recipe/2015/09/22/64e67944d72bacedff56b7b163e7be471.jpg'}, {'step_number': 5, 'description': '오징어를 넣어서 끓여 줍니다.', 'image_url': 'https://recipe1.ezmember.co.kr/cache/recipe/2015/09/22/8b37e2ca37a8b74f9b3b141e48f6bbf61.jpg'}, {'step_number': 6, 'description': '징어를 넣고 끓기 시작하면 고추가루 1T, 다진마늘 1/2T, 간장 1T를 넣어 줍니다.', 'image_url': 'https://recipe1.ezmember.co.kr/cache/recipe/2015/09/22/804d8364178759944896ff07156df70a1.jpg'}, {'step_number': 7, 'description': '5분정도 더 끓여 줍니다. 양파와 고추를 넣어 줍니다.', 'image_url': 'https://recipe1.ezmember.co.kr/cache/recipe/2015/09/22/7b2813318bf3b4b2ee5640ecd8f09b931.jpg'}, {'step_number': 8, 'description': '부족한 간은 소금을 넣어 줍니다. 소금을 넣고 살짝만 더 끓여주면 오징어국 완성.', 'image_url': 'https://recipe1.ezmember.co.kr/cache/recipe/2015/09/22/d897e99fca44ffa8a0b692b9eb0949041.jpg'}]"
46721,국/탕,일상,해물류,끓이기,꿀처 해물누룽지탕,해물누룽지탕,https://recipe1.ezmember.co.kr/cache/recipe/2017/08/24/1d4c000a1d5372bf8965b7ef0505e8d71.jpg,"34,762",60분 이내,중급,2인분,"[('밥', '1공기'), ('오징어', '1/2마리'), ('칵테일새우', '10마리'), ('관자', '1개'), ('당근', '1/8개'), ('양파', '1/6개'), ('표고버섯', '1개'), ('양송이버섯', '1개'), ('청피망', '1/8개'), ('죽순', '7cm'), ('통마늘', '3개'), ('청경채', '2개'), ('대파 흰부분', '5cm'), ('대파 잎부분', '2줄기'), ('굴소스', '2'), ('치킨톡스', '0.5'), ('생강즙', '0.5'), ('전분', ''), ('물', ''), ('오일', '넉넉히')]","안녕하세요, 꿀처예요~♡ 
요 몇일 아주 비에 바람에..정말.. 요즘 날씨 맘에 안들어요..ㅠ 덕분에 따끈한 국물 생각이나서 오늘은,, 뜨근한 해물 누룽지탕을 해볼껀데요~ 
누룽지의 식감도 매력적이고, 이렇게 갑자기 추워지는 간절기에는 뜨끈한 국물까지도 기분좋고, 입안가득 해물의 향까지도 좋은 해물 누룽지탕,, 그럼 바로 요리 시작해볼께용~♡","[{'step_number': 1, 'description': '아무것도 두루지않은 마른팬에 밥을 얇게 펴서 최대한 약불로 20여분간 뒤집어가며 누룽지를 만들어주세요 > 중불에서 기름에 튀겨주세요(고온에선 시꺼멓게 바로 타요) > 튀긴 누룽지는 기름제거를 해주기위해 키친타올에 받쳐놔주세요~', 'image_url': 'https://recipe1.ezmember.co.kr/cache/recipe/2017/08/24/06954e81b8dc8c50be1f56914701679a1.jpg'}, {'step_number': 2, 'description': '이제 준비한 재료들을 깨끗이 세척해놔주세요~', 'image_url': 'https://recipe1.ezmember.co.kr/cache/recipe/2017/08/24/11eb62bb6925ebea1aac99d5f9c982701.jpg'}, {'step_number': 3, 'description': '오징어는 양념이 잘 베도록 안쪽에 칼집을 넣어 채썰어놔주시고, 나머지 재료들은 편썰거나 채썰어서 먹기좋게 준비해놔주세요~', 'image_url': 'https://recipe1.ezmember.co.kr/cache/recipe/2017/08/24/ef7a1a305e6cf22a176c399d8c50fdd21.jpg'}, {'step_number': 4, 'description': '준비해둔 해산물에 굴소스(1)을 넣어 밑간을 해놔주세요~', 'image_url': 'https://recipe1.ezmember.co.kr/cache/recipe/2017/08/24/7a9b8a2d5044ee32f613e335fad84b891.jpg'}, {'step_number': 5, 'description': '이제 팬작업을 할껀데요~\n1) 오일을 두르고 향을내기위해 마늘과 양파를 먼저 볶아주세요 > 2) 그다음 밑간을해둔 해물을 볶아줄껀데요, 이때 쎈불로 불맛을 입혀주면 더 맛있어요 > 3) 청경채를 뺀 나머지 야채들을 다 넣고 볶아주세요 > 4) 이제 물(1컵반)을 붓고 굴소스(1), 치킨톡스 (0.5), 생강즙(0.5)를 넣고 간을해준뒤 약 4~5분간 끓여주세요, 이때 청경채를 넣어주세요 > 마지막으로 전분:물을 1:2 비율로해서 바글바글 끓을때 달팽이 모양으로 큰원을 그리면서 전분물을 부어주신후 저어주세요~', 'image_url': 'https://recipe1.ezmember.co.kr/cache/recipe/2017/08/24/ed52b768478d5f5cfaffeee5726ee0e21.jpg'}, {'step_number': 6, 'description': '이제 먹기좋게 뚝배기나 그릇에 담아내면되요~\n먼저 그릇에 누룽지를 담아내고, 그위에 뜨거운 해물소스를 부어주면, 와~~ 정말 술안주로 최고인 해물 누룽지탕이 완성됐습니당~~\n그럼 오늘도 맛있는거 드시고 행복하세용~♡', 'image_url': 'https://recipe1.ezmember.co.kr/cache/recipe/2017/08/24/623fbac10280d0ca81500cd92c5e4e7c1.jpg'}]"
46722,국/탕,일상,해물류,끓이기,가을엔 국물이 달달한 꽃게탕이 제대로네요,꽃게탕,https://recipe1.ezmember.co.kr/cache/recipe/2016/11/15/ec5fe0c5becf4e5fe202d138ea0668551.jpg,"36,605",30분 이내,아무나,3인분,"[('꽃게', '5마리'), ('무', '적당량'), ('애호박', '적당량'), ('버섯', '적당량'), ('파', '적당량'), ('배추', '적당량'), ('된장', '2T'), ('고추장', '1T'), ('고춧가루', '2T'), ('마늘', '1T'), ('소금', '조금')]","요즘 게살이 꽉 찬 계절이라 한 번쯤은 먹고 싶죠~
끓여 놓으면 달달한 맛과 게살 빼어 먹는 재미가 쏠쏠하고 국물 맛이 끝내줍니다.
오늘은 무얼 해 먹지?하고 고민되신다면 꽃게탕 어때요?","[{'step_number': 1, 'description': '반으로 갈라서 꽃게를 손질해주세요꽃게 손질법 레시피', 'image_url': 'https://recipe1.ezmember.co.kr/cache/recipe/2016/11/15/55d75754a1e0c391de58afa8550bea4e1.jpg'}, {'step_number': 2, 'description': '먼저 무를 썰어 넣고', 'image_url': 'https://recipe1.ezmember.co.kr/cache/recipe/2016/11/15/fa228f96dc26bab0851486be7ca2b63c1.jpg'}, {'step_number': 3, 'description': '된장 2큰술을 떠 넣어 끓여줍니다.\n무가 반쯤 익기를 기다려야겠지요~', 'image_url': 'https://recipe1.ezmember.co.kr/cache/recipe/2016/11/15/176389f84055262fb9986b8ee77048641.jpg'}, {'step_number': 4, 'description': '그동안 야채 손질\n들어갈 야채는 내가 좋아하는 야채를 넣어주면 되겠지요~~', 'image_url': 'https://recipe1.ezmember.co.kr/cache/recipe/2016/11/15/177e10e0dbb9cf9f716c296e903688271.jpg'}, {'step_number': 5, 'description': '무가 어느 정도 익었을 때 꽃게를 넣어줍니다.', 'image_url': 'https://recipe1.ezmember.co.kr/cache/recipe/2016/11/15/acb8e7504c416e1a28b69affc88badb71.jpg'}, {'step_number': 6, 'description': '나머지 양념은 고추장,고춧가루,마늘 넣얼 끓여줍니다.', 'image_url': 'https://recipe1.ezmember.co.kr/cache/recipe/2016/11/15/328e7a498d23dac49225e6ba476365431.jpg'}, {'step_number': 7, 'description': '넣으면 금방 익는 야채를 넣어 한소끔 끓이면 됩니다.', 'image_url': 'https://recipe1.ezmember.co.kr/cache/recipe/2016/11/15/c43460e06bc9f5ba86903bb7c9475a791.jpg'}, {'step_number': 8, 'description': '부족한 간은 간장이나 소금으로 마무리~~', 'image_url': 'https://recipe1.ezmember.co.kr/cache/recipe/2016/11/15/bbb799b09581bed5fc6ca0eb042d6b5d1.jpg'}]"
46723,국/탕,일상,해물류,끓이기,알탕만들기 참 쉬워요^^,알탕,https://recipe1.ezmember.co.kr/cache/recipe/2016/08/12/1a7231b35a8ab921714ce61f5196e3361.jpg,"325,170",30분 이내,초급,4인분,"[('명란알', ''), ('육수다시팩', ''), ('무', ''), ('애호박', ''), ('콩나물', ''), ('대파', ''), ('쑥갓', ''), ('소금', ''), ('고추장', '1/2큰술'), ('고추가루', '2큰술'), ('국간장', '1큰술'), ('다진마늘', '1큰술'), ('후추가루', ''), ('생강가루                                                                                or생강즙', '')]",명태의 알을 이용해 칼칼한 알탕을 끓여보세요^^,"[{'step_number': 1, 'description': '명태의 알은 소금물에 깨끗이 씻어 준비합니다~', 'image_url': 'https://recipe1.ezmember.co.kr/cache/recipe/2016/08/12/db2be7062055e7c97aa8afd8cb7ca27c1.jpg'}, {'step_number': 2, 'description': '고추장 1/2큰술, 고추가루 2큰술, 국간장 1큰술, 다진마늘 1큰술에 후추가루와 생강가루 또는 생강즙을 살짝 넣고 잘 섞어 \n양념장을 만들어주세요~', 'image_url': 'https://recipe1.ezmember.co.kr/cache/recipe/2016/08/12/7c00c6b8ce34ef8bae5cd7958d5355ff1.jpg'}, {'step_number': 3, 'description': '다시멸치와 다시마를 넣은 다시팩을 찬물에 넣고 끓여 멸치육수를 만들어주세요~', 'image_url': 'https://recipe1.ezmember.co.kr/cache/recipe/2016/08/12/459cfbfdca5305b432a1e498efd5e9d21.jpg'}, {'step_number': 4, 'description': '멸치육수가 충분히 우러나면 다시팩을 건져내시고\n납작썰기 한 무를 넣어 끓여줍니다~', 'image_url': 'https://recipe1.ezmember.co.kr/cache/recipe/2016/08/12/e76c73c4c9e1b1de7e991dd1dda949501.jpg'}, {'step_number': 5, 'description': '무가 투명하게 반쯤 익었을때 \n한입 크기로 썬 애호박과 명태알을 넣어줍니다~', 'image_url': 'https://recipe1.ezmember.co.kr/cache/recipe/2016/08/12/28837e2c580cdbff3de379902af4761f1.jpg'}, {'step_number': 6, 'description': '미리 만들어놓은 양념장을 넣어 색을 내어주시고요~', 'image_url': 'https://recipe1.ezmember.co.kr/cache/recipe/2016/08/12/71311f48ae061eec0888ac941c86dca61.jpg'}, {'step_number': 7, 'description': '알이 모두 익었다면 \n콩나물과 대파를 넣어주시고 \n부족한 간은 소금으로 맞춰주세요~', 'image_url': 'https://recipe1.ezmember.co.kr/cache/recipe/2016/08/12/28f5351b0791a998d3978dfde9e9a9711.jpg'}, {'step_number': 8, 'description': '마지막으로 쑥갓을 올려 불을 꺼주시면\n정말 쉬운 알탕만들기 완성~~!!!', 'image_url': 'https://recipe1.ezmember.co.kr/cache/recipe/2016/08/12/609ba6d67f7659b2cefbe5072ed02c021.gif'}]"
46724,국/탕,일상,해물류,끓이기,얼큰 시원한 꽃게탕,꽃게탕,https://recipe1.ezmember.co.kr/cache/recipe/2015/04/02/e38b9edd4a526854842befb34dcb80981.jpg,"71,979",None,None,None,"[('꽃게', '3마리'), ('무', '150g'), ('호박', '1/2개'), ('대파', '1/2대'), ('홍고추', '1개'), ('청고추', '1개'), ('미나리', ''), ('쑥갓', ''), ('콩나물', ''), ('미더덕', ''), ('물', '7컵'), ('다시마', '2조각'), ('국물용멸치', '1줌'), ('고춧가루', '2큰술'), ('다진마늘', '1큰술'), ('소금', '약간'), ('된장', '1큰술')]","찬바람 솔솔 불어오니 얼큰한 탕이 먹고 싶어져서 꽃게탕 시원하게 끓여 봤어요. 꽃게탕 절대 어렵지 않아요~~멸치랑 다시마 넣고 국물 내고, 집에 있는 무와 호박 등을 넣어 주심 됩니다.","[{'step_number': 1, 'description': '냄비에 다시마와 멸치를 넣고 끓여 국물을 만드세요.', 'image_url': 'https://recipe1.ezmember.co.kr/cache/recipe/2015/04/02/982b501c35834e9b12a55e2871ce1d471.jpg'}, {'step_number': 2, 'description': '무 호박, 미나리, 대파, 청홍고추를 준비해 둡니다.', 'image_url': 'https://recipe1.ezmember.co.kr/cache/recipe/2015/04/02/9777dfb919dd19b939a5e0e84b7f2a9b1.jpg'}, {'step_number': 3, 'description': '솔을 이용하여 꽃게를 잘 씻어 주세요.', 'image_url': 'https://recipe1.ezmember.co.kr/cache/recipe/2015/04/02/a0e137420948ac2a0c85f9a349c026ba1.jpg'}, {'step_number': 4, 'description': '발끝을 가위로 잘라내고, 등껍질을 떼어 내고 아가미도 가위로 모두 잘라냅니다.', 'image_url': 'https://recipe1.ezmember.co.kr/cache/recipe/2015/04/02/3cc1256c2c0a937b978514c7310625591.jpg'}, {'step_number': 5, 'description': '냄비에 멸칫국물을 부어서 된장 1큰술 풀고, 납작 썬 무와 떨어진 꽃게발을 넣고 끓입니다.\n혹시 꽃게 사면서 떨어진 발 보이면 넣어달라고 하세요. 국물내기에 참 좋습니다', 'image_url': 'https://recipe1.ezmember.co.kr/cache/recipe/2015/04/02/93e22048399cfd59f8106e2cf44bf7e31.jpg'}, {'step_number': 6, 'description': '무가 익으면 이어서 손질해둔 꽃게를 넣고 끓이다가 위로 뜨는 거품을 걷어냅니다.', 'image_url': 'https://recipe1.ezmember.co.kr/cache/recipe/2015/04/02/6aba3f0a19d3c190cc9372c6d04c0bab1.jpg'}, {'step_number': 7, 'description': '꽃게가 익어 맛이 어우러지면 준비한 채소들과 고춧가루를 넣습니다. \n이때 마늘도 함께 넣어 줍니다.\n마늘은 다져도 되고 곱게 채썰어도 좋습니다.\n(호박,홍고추, 등)--양파,미더덕,콩나물, 등도 있으면 넣어주셔도 됩니다.\n소금으로 간을 하고,대파와 청고추, 미나리를 넣고 마무리 합니다.', 'image_url': 'https://recipe1.ezmember.co.kr/cache/recipe/2015/04/02/193a704fbe5e4668c30df1b29fb602821.jpg'}, {'step_number': 8, 'description': '(꽃게매운탕/꽃게탕) 식지 않게 탕기에 뜨고 쑥갓을 얹어냅니다.\n콩나물과 미더덕을 생략하였는데도 국물맛이 어찌나 시원하던지요.', 'image_url': 'https://recipe1.ezmember.co.kr/cache/recipe/2015/04/02/fec80c596d6c0a446fae06ef703c8a881.jpg'}]"
46725,국/탕,일상,해물류,끓이기,아침반찬으로 좋은 홍합미역국!,홍합미역국,https://recipe1.ezmember.co.kr/cache/recipe/2019/05/18/5a32a6209f48438517ccc7db347384511.jpg,"47,788",30분 이내,아무나,4인분,"[('건미역', '20g'), ('홍합살', '200g'), ('청양고추', '1개'), ('멸치액젓', '1큰술'), ('소금', '1/2큰술'), ('후추가루', '조금')]","신랑생일 이여서 아침부터 끓여본 홍합을 넣은
미역국이네요 개운하고 맛있다면서 한그릇
다먹고 출근했네요^^","[{'step_number': 1, 'description': '건미역을 10분간 불려주신다음 흐르는물에 살짝 흔들어씻어서 먹기좋은 크기로 잘라주세요', 'image_url': 'https://recipe1.ezmember.co.kr/cache/recipe/2019/05/18/eb2e1058b0a08f841ce5adde4527180a1.jpg'}, {'step_number': 2, 'description': '잘라놓은 미역을 냄비에 넣고 미역이 잠길정도로 부어주세요', 'image_url': 'https://recipe1.ezmember.co.kr/cache/recipe/2019/05/18/892b2d8afcc53354f42259ab84cead721.jpg'}, {'step_number': 3, 'description': '미역만 넣고 5분간 펄펄 끓여주세요\n그런다음 냉동홍합살을 물에 한번 살짝 씻어서 펄펄 끓는 미역국에 넣어서 끓여주세요', 'image_url': 'https://recipe1.ezmember.co.kr/cache/recipe/2019/05/18/14607e2ee5aaf3eba70a8ff146a677cc1.jpg'}, {'step_number': 4, 'description': '청양고추 한개만 준비하셔서 \n잘라주신후 넣어주세요\n*전 냉동시켜둔걸 넣었네요\n국이나 찌개에는 냉동시켜준걸 넣어주셔도 되세요', 'image_url': 'https://recipe1.ezmember.co.kr/cache/recipe/2019/05/18/100bafd075988ac6a89f17b6acb009361.jpg'}, {'step_number': 5, 'description': '멸치액젓 1큰술을 넣어주시고 소금으로 간을 마추어 주세요', 'image_url': 'https://recipe1.ezmember.co.kr/cache/recipe/2019/05/18/553faacd103028ce21483c7ebd0a92e41.jpg'}, {'step_number': 6, 'description': '후추가루는 1번만 톡쳐서 주시고요 청양고추넣어 주신걸 건져내주세요\n청양고추는 그냥 드셔도 되지만 전 매운맛만 살짝만 빼고 건져버리네요 참고들하세요\n15분간 중불에서 펄펄 끓여주세요', 'image_url': 'https://recipe1.ezmember.co.kr/cache/recipe/2019/05/18/2ead12fe3bee8d5f4ba9c3bed57cfbbd1.jpg'}, {'step_number': 7, 'description': '홍합살의 감칠맛이 뛰어나고 \n개운한맛의 미역국이 완성되었어요\n고기들어간 미역국을 싫어하시는분들은 홍합살을 이용해서 미역국을 끓여보세요', 'image_url': 'https://recipe1.ezmember.co.kr/cache/recipe/2019/05/18/7124c1530c6d8e40fb15eec8192f212a1.jpg'}]"
