index,종류별,상황별,재료별,방법별,글 제목,레시피이름,레시피이미지,조회수,조리시간,난이도,인분,재료,소개글,조리순서
79519,밥/죽/떡,영양식,채소류,볶음,"먹고 싶은데 너무 복잡해? NO ~ 이제는 밥짓기+10분!""표고버섯우엉밥""",표고버섯우엉밥,https://recipe1.ezmember.co.kr/cache/recipe/2022/01/26/543396eda936fe812968d53c39596d7b1.jpg,968,60분 이내,초급,5인분,"[('우엉', '적당량'), ('표고버섯', '적당량'), ('식초', '1수저'), ('들기름', '2수저'), ('식용유', '2수저'), ('간장', '3수저')]","다들 우엉밥 좋아하시나요?
전 작년에 선물받은 다이어트 도시락 속의 연근우엉밥이 너무 맛있더라고요!!
그래서 만들어 먹으려고 인터넷에 우엉밥을 찾아보니 이런저런 재료도 많이 들어가고
우엉밥이라기 보단 모둠야채 영양밥이라는 표현이 맞을거 같은 느낌이더라고요!
제가 원한건 이런게 아닌데 말이죠!!그래서 준비했습니다!!
""나는 복잡한건 싫다.""""재료가 별로 없는데 재료를 사기에 부담된다.""
""한 끼에 많은 돈을 쓰기에는 부담스럽다""""간단한 조리과정을 원한다.""
그렇다면 이 레시피를 해보세요!
밥솥으로 밥짓는 시간 +10분이면 됩니다.","[{'step_number': 1, 'description': '재료를 준비해주세요. \n조금 큰 그릇에 물 1~2컵+식초를 넣어주세요.', 'image_url': 'https://recipe1.ezmember.co.kr/cache/recipe/2022/01/19/aa9f64179cd9e15355af11863a1c33e51.jpg'}, {'step_number': 2, 'description': '버섯은 흐르는 물에 씻고 밑단을 제거한 다음 잘게 썰어주세요.\n우엉은 껍질을 깎아 5~6센치크기로 잘라서 식초물에 담궈주세요. 그러고나서 잘게 썰어주세요.우엉은 껍질을 깎기 시작하면 바로 갈변이 된답니다.\n식초물에 담그면 갈변방지도 되고 우엉의 쓴맛도 제거가 되요!', 'image_url': 'https://recipe1.ezmember.co.kr/cache/recipe/2022/01/19/84417a75bab279f48f9a4794e9b3e41b1.jpg'}, {'step_number': 3, 'description': '후라이팬에 식용유를 넣고, 채반으로 건진 우엉을 2분 볶아주세요.너무 오래 볶으면 밥 했을 때 아삭한 식감이 죽어요~', 'image_url': 'https://recipe1.ezmember.co.kr/cache/recipe/2022/01/19/c95423cd3469ee44e7ee13701896a0f71.jpg'}, {'step_number': 4, 'description': '볶던 우엉에 표고버섯과 참기름, 간장을 넣고 2분간 더 볶아줍니다.저는 간장이 똑 떨어져서 달래간장을 넣었습니다.\n그냥 진간장이 더 맛있어요~', 'image_url': 'https://recipe1.ezmember.co.kr/cache/recipe/2022/01/19/2a12283c8337b7e4ec0ccc90bda3d4ef1.jpg'}, {'step_number': 5, 'description': '원하는 만큼 쌀을 씻고 후라이팬에 있던 재료를 넣어주세요.\n저는 5인분이라 쌀을 3컵 넣었습니다.ㅎㅎ밥 안칠 때 물은 평소보다 덜 넣어주세요.\n우엉, 표고버섯에서 수분이 나와서 평소처럼 밥을하면 많이 질어서 죽+밥이 됩니다.\n저는 손을 넣었을때 손이 잠기지도 않을 정도였어요. \n손가락 반만 잠길정도!!', 'image_url': 'https://recipe1.ezmember.co.kr/cache/recipe/2022/01/19/6f64b7735a0314c2787b12020685807d1.jpg'}, {'step_number': 6, 'description': '취사버튼을 누르고 기다리시면 짜잔~ 완성되었습니다.', 'image_url': 'https://recipe1.ezmember.co.kr/cache/recipe/2022/01/19/b35b311e7c3a4d5ae210983de07ff4091.jpg'}]"
79520,밥/죽/떡,영양식,채소류,볶음,암예방 레시피 - 가지마늘 소보로 현미 덮밥 & 건강 과일 주스,현미덮밥,https://recipe1.ezmember.co.kr/cache/recipe/2019/08/06/8fa64a6adc34aebb02dec9c62f25a6b31.jpg,"1,226",30분 이내,아무나,1인분,"[('현미밥', '1인분'), ('가지', '1개'), ('마늘', '7개'), ('달걀', '1개'), ('대파', '적당히'), ('양파', '1/4개'), ('사과', '1개'), ('바나나', '1/2개'), ('방울토마토', '5~6개'), ('레몬즙', '20ml'), ('물', '1/2컵'), ('간장', '1~1.5T'), ('참기름', '소량'), ('깨', '소량'), ('고춧가루', '0.5T'), ('꿀', '2~3T'), ('올리브유                                                                                또는 식용유', '1.5T')]","가지와 마늘, 계란을 소보로처럼 볶아 간장 소량으로 세지않게 간을 해 현미밥 위에 올려 만든 '가지 마늘 소보로 현미 덮밥' 과 함께 어울려 마시거나 후식으로 마시기 좋도록 사과와 방울토마토,바나나,레몬즙을 갈아 만든 '건강 과일 주스' 입니다 !!","[{'step_number': 1, 'description': '위의 재료를 준비해줍니다.', 'image_url': 'https://recipe1.ezmember.co.kr/cache/recipe/2019/08/06/7822f2524eaba248fbe356f839d5a2831.jpg'}, {'step_number': 2, 'description': '가지는 반으로 길게 잘라 반달모양으로 썰어줍니다.', 'image_url': 'https://recipe1.ezmember.co.kr/cache/recipe/2019/08/06/791dd4a3b0dec537affed4063019b6a61.jpg'}, {'step_number': 3, 'description': '대파는 작게 썰어줍니다.', 'image_url': 'https://recipe1.ezmember.co.kr/cache/recipe/2019/08/06/f3011cc0a88a287312feda581f323b901.jpg'}, {'step_number': 4, 'description': '양파를 다져줍니다.', 'image_url': 'https://recipe1.ezmember.co.kr/cache/recipe/2019/08/06/5df5d9c59a69c221ec0b50bedaef38881.jpg'}, {'step_number': 5, 'description': '마늘은 꼭지를 썰어 정리해줍니다.', 'image_url': 'https://recipe1.ezmember.co.kr/cache/recipe/2019/08/06/0da1f04e034810f2fd1a6fcb4d1cadb01.jpg'}, {'step_number': 6, 'description': '정리한 마늘을 너무 두껍지않게 편썰어 줍니다.', 'image_url': 'https://recipe1.ezmember.co.kr/cache/recipe/2019/08/06/78314278585179897db78ea00aba57a61.jpg'}, {'step_number': 7, 'description': '올리브유 또는 식용유에 대파 마늘 양파를 볶아줍니다.', 'image_url': 'https://recipe1.ezmember.co.kr/cache/recipe/2019/08/06/742d1bd28423bf429847b6d539aa065b1.jpg'}, {'step_number': 8, 'description': '양파가 살짝 익을때까지 볶아줍니다.\n(타지않게 주의해주세용 !!)', 'image_url': 'https://recipe1.ezmember.co.kr/cache/recipe/2019/08/06/b7ecd4bc1c776a110538debddc56099e1.jpg'}, {'step_number': 9, 'description': '양파가 살짝 익으면 가지를 넣어 볶아줍니다.', 'image_url': 'https://recipe1.ezmember.co.kr/cache/recipe/2019/08/06/848d968a3546c71e13b69bc82ca5ca401.jpg'}, {'step_number': 10, 'description': '가지가 어느정도 익었을 때 쯤 간장을 넣어 볶아줍니다.', 'image_url': 'https://recipe1.ezmember.co.kr/cache/recipe/2019/08/06/38333d2f77c5384ca2cd52fe0b0fdbb11.jpg'}, {'step_number': 11, 'description': '가지가 80% 익으면 한편에 계란을 스크램블 하듯이 볶아줍니다.', 'image_url': 'https://recipe1.ezmember.co.kr/cache/recipe/2019/08/06/b1490049a3e8c8a7553254ce5cce3a811.jpg'}, {'step_number': 12, 'description': '계란과 가지를 섞어 볶아준 후 참기름을 둘러줍니다.\n(취향에 따라 고춧가루를 소량 넣어 줍니다.)', 'image_url': 'https://recipe1.ezmember.co.kr/cache/recipe/2019/08/06/27bd4ab0ce054d9d32bb6171fee465b01.jpg'}, {'step_number': 13, 'description': '참기름을 넣고나서 살짝 볶아줍니다.', 'image_url': 'https://recipe1.ezmember.co.kr/cache/recipe/2019/08/06/f9e59f492d71986246837548cffdfa471.jpg'}, {'step_number': 14, 'description': '그릇을 준비해 밥을 정리해서 놓아줍니다.', 'image_url': 'https://recipe1.ezmember.co.kr/cache/recipe/2019/08/06/921300245704a12a1bb0ad7ad3507e431.jpg'}, {'step_number': 15, 'description': '밥 위에 가지마늘 소보로를 올려준 후 깨를 뿌려 마무리해줍니다.', 'image_url': 'https://recipe1.ezmember.co.kr/cache/recipe/2019/08/06/f817a949eebbdf01472f67276f84ecf61.jpg'}, {'step_number': 16, 'description': '건강 과일 주스 재료를 준비해줍니다.', 'image_url': 'https://recipe1.ezmember.co.kr/cache/recipe/2019/08/06/d37eb528f63e5e6dfce41007edf88dfc1.jpg'}, {'step_number': 17, 'description': '토마토는 반으로 썰어주고 사과도 적당한 크기로 썰어줍니다.', 'image_url': 'https://recipe1.ezmember.co.kr/cache/recipe/2019/08/06/226a4e1e477e164888990c7a9c0d70e01.jpg'}, {'step_number': 18, 'description': '믹서기에 과일과 레몬즙, 물 반컵과 취향에 따라 꿀을 소량 넣어줍니다.', 'image_url': 'https://recipe1.ezmember.co.kr/cache/recipe/2019/08/06/9b5e8dddd3f5e8fb2b48cc60d780260c1.jpg'}, {'step_number': 19, 'description': '과일이 다 갈아질때까지 갈아줍니다.', 'image_url': 'https://recipe1.ezmember.co.kr/cache/recipe/2019/08/06/a5c218d1503a131702138f02f71377ab1.jpg'}, {'step_number': 20, 'description': '가지마늘 현미 덮밥과 건강 과일 주스 완성입니다 !!', 'image_url': 'https://recipe1.ezmember.co.kr/cache/recipe/2019/08/06/7cc4946816e592626f3de1e31d9686231.jpg'}]"
79521,밥/죽/떡,영양식,채소류,볶음,"백종원 김치볶음밥보다 건강한 비트볶음밥, 비트 요리법 공개합니다.",비트볶음,https://recipe1.ezmember.co.kr/cache/recipe/2020/11/22/e4d2b191b74dcf420f6f9c7cb51505e51.jpg,"10,784",20분 이내,초급,3인분,"[('찬 밥', '3인분'), ('비트', '조금'), ('양파', '1/4개'), ('표고버섯 불린 것', '1~2개'), ('베이컨', '원하는만큼'), ('맛간장', '2스푼'), ('소금', '1/4스푼')]","비트 몸에 좋은데
어떻게 요리해서 먹는지 모르시는 분들 많으시죠?

비트 볶음밥 정말 맛있고 색도 예뻐요~","[{'step_number': 1, 'description': '베이컨과 야채들을 썰어주세요. 볶음밥은 잔반 처리용으로 아주 좋죠~ 국수 먹고 남은 지단과 당근을 다져서 넣어줬어요.', 'image_url': 'https://recipe1.ezmember.co.kr/cache/recipe/2020/11/22/36ebacd0680d62719334c16656f671c31.jpg'}, {'step_number': 2, 'description': '베이컨과 야채는 먼저 볶아줍니다. 베이컨은 빠짝 볶으면 맛있어요. 이때 베이컨에서 기름이 나오기 때문에 기름은 많이 두르지 않아도 괜찮아요.', 'image_url': 'https://recipe1.ezmember.co.kr/cache/recipe/2020/11/22/2a516affb8ada5c86060b360d3441bbb1.jpg'}, {'step_number': 3, 'description': '표고버섯 불린 것도 다져서 넣었어요. 없다면 패스하셔도 됩니다.', 'image_url': 'https://recipe1.ezmember.co.kr/cache/recipe/2020/11/22/3d70c7a56e76f4526613e00cef07675e1.jpg'}, {'step_number': 4, 'description': '양파 1/4개를 썰어서 넣어줍니다.', 'image_url': 'https://recipe1.ezmember.co.kr/cache/recipe/2020/11/22/bec34d57733d27e07a49567f2410ff471.jpg'}, {'step_number': 5, 'description': '비트! 비트는 많이 안 넣어도 색이 빨갛게 변해요. 1/4개 정도 썰어서 넣어주세요.', 'image_url': 'https://recipe1.ezmember.co.kr/cache/recipe/2020/11/22/ce71744b306467d2939ba7c507125c821.jpg'}, {'step_number': 6, 'description': '볶음밥은 밥이 되야 맛있어요. 된밥을 넣고 볶아주세요.', 'image_url': 'https://recipe1.ezmember.co.kr/cache/recipe/2020/11/22/2faf99ff57fb369f9cbeb1f05925405f1.jpg'}, {'step_number': 7, 'description': '간은 맛간장과 소금으로 할거예요. 맛간장 2스푼 넣어주세요. 이때 간장을 바로 밥에 넣지 말고 간장을 후라이팬 한켠에 끓여주세요. 그리고 간장이 끓고나면 밥과 섞어주세요.', 'image_url': 'https://recipe1.ezmember.co.kr/cache/recipe/2020/11/22/34458a49097e8e5e7b4adda96d5478e51.jpg'}, {'step_number': 8, 'description': '천일염 1/4스푼 정도 넣어줍니다.', 'image_url': 'https://recipe1.ezmember.co.kr/cache/recipe/2020/11/22/2504171ba2fc0a8c91742a9f938411041.jpg'}, {'step_number': 9, 'description': '어느정도 볶아지면 불을 끄고 잔열에 마무리해주세요.', 'image_url': 'https://recipe1.ezmember.co.kr/cache/recipe/2020/11/22/315372e1921b6ebc6128d9b8286260c11.jpg'}, {'step_number': 10, 'description': '마무리로 통깨를 뿌리고 드시면 됩니다. 통깨는 통으로 보관하시고 드실때마다 부셔서 드시는게 고소하고 좋아요~^^', 'image_url': 'https://recipe1.ezmember.co.kr/cache/recipe/2020/11/22/34e2ba5d07d9e6bc43b25c11c499132c1.jpg'}]"
79522,밥/죽/떡,영양식,채소류,볶음,#[면역력도시락] 웰빙 고사리김밥,고사리김밥,https://recipe1.ezmember.co.kr/cache/recipe/2019/11/13/a10a7c7ad57d7a3a291d1c5ed48fe6c01.jpg,"1,756",20분 이내,초급,1인분,"[('쌀밥', '1공기'), ('김밥용 김', '2장'), ('삶은 고사리', '1줌'), ('대파', '10cm'), ('당근', '5cm'), ('달걀', '2개'), ('통깨', '1큰술'), ('굴소스', '1/2스푼'), ('간장', '1스푼'), ('다진마늘', '1/2스푼'), ('올리고당', '1큰술'), ('맛술', '1큰술'), ('참기름', '1스푼')]","면역력 높이는 나물!
고사리 고사리 고~사리
고사리에는 엽산이랑 단백질이 풍부해서 
해열, 가래, 두통, 불면증에 효과가 있다고 합니다.
고사리 김밥 드시고 면역력 증진↑","[{'step_number': 1, 'description': '굴소스 반스푼, 간장 1스푼, 올리고당 1큰술, 맛술1큰술, 참기름 1스푼, 다진마늘 반스푼을 넣고 양념장을 만들어 주세요.', 'image_url': 'https://recipe1.ezmember.co.kr/cache/recipe/2019/11/13/1eb775e220331e0dce839f60882b1f271.jpg'}, {'step_number': 2, 'description': '삶은 고사리는 먹기 좋은 크기로 잘라주고 대파 송송, 당근도 채썰어 기름만 살짝 넣고 볶아주세요.삶은고사리는 엄지랑 세번째 손가락 닿은 정도 분량', 'image_url': 'https://recipe1.ezmember.co.kr/cache/recipe/2019/11/13/c418b0b8a71b58cdaf9aa356fc6f4dc11.jpg'}, {'step_number': 3, 'description': '달걀2개를 깨서 달걀 지단을 만들어 주세요.', 'image_url': 'https://recipe1.ezmember.co.kr/cache/recipe/2019/11/13/51b628801312932b703509080b2dde7c1.jpg'}, {'step_number': 4, 'description': '달군팬에 기름을 넉넉히 둘러준 뒤 고사리, 대파를 넣고 볶아주세요. 그리고 양념장을 붓고 양념이 스며들 만큼 충분히 볶아주세요.', 'image_url': 'https://recipe1.ezmember.co.kr/cache/recipe/2019/11/13/6508e0d74aec3927bbbf7ca9c483197f1.jpg'}, {'step_number': 5, 'description': '밥 한공기 듬뿍 담아 통깨만 뿌려주세요.양념된 고사리로 간이 충분해요.', 'image_url': 'https://recipe1.ezmember.co.kr/cache/recipe/2019/11/13/534b753e298f426d7a02cb214818b2151.jpg'}, {'step_number': 6, 'description': '김 위에 밥 올리고 고사리 올리고 달걀지단 올리고 당근 올려 돌돌 말아주세요.', 'image_url': 'https://recipe1.ezmember.co.kr/cache/recipe/2019/11/13/2346105a99f58a53f24409a89dc4ec881.jpg'}, {'step_number': 7, 'description': '먹기 좋은 크기로 잘라주세요.', 'image_url': 'https://recipe1.ezmember.co.kr/cache/recipe/2019/11/13/30c3e225a440e0f2b72b8c836d732fe11.jpg'}, {'step_number': 8, 'description': ""너~무 맛있어서 당황~당황!\n'산속의 소고기' 한입 드시고 건강하세요~"", 'image_url': 'https://recipe1.ezmember.co.kr/cache/recipe/2019/11/13/e02748cf3474eba80506e5259c18780b1.jpg'}]"
79523,밥/죽/떡,영양식,채소류,볶음,밀전병 김밥,밀전병김밥,https://recipe1.ezmember.co.kr/cache/recipe/2024/05/22/2c55af383324728af2a6420df6ba3eef1.jpg,109,30분 이내,중급,2인분,"[('동치미 무', '1개'), ('계란', '2개'), ('당근', '1개'), ('부추', '1줌'), ('밥', '1공기'), ('김', '2장'), ('밀가루', '200g'), ('참기름', '1수저'), ('소금', '2t'), ('들기름', '2수저'), ('연겨자', '20g'), ('식초', '3수저'), ('간장', '2/3스푼'), ('참기름', '1/2스푼'), ('물', '2수저'), ('설탕', '2수저')]",아이들이 채소를 잘 안먹어 어떻게 하면 조금이라도 먹일까 하다가 밀전병김밥을 만들게 되었어요,"[{'step_number': 1, 'description': '직접 담근 동치미 무를 강판에 채썰어 들기름에 아삭하게 볶아낸다 계란지단도 부쳐 채썰어 준다 부추는 삶아서 소금,참기름, 깨 한꼬짐 넣고 무쳐 놓는다 밀전병은 밀가루200그램+물200그램으로 잘 부쳐 놓는다 김에 밥을 펼쳐서 뒤집고 밀전병 김밥을 뒤집어서 김이 위로 올라오게 해서 무, 계란, 부추, 당근을 소복하게 놓고 김발로 잘 말아준후 썰어서 연겨자 소스에 찍어 맛있게 먹는다 요즘은 봄이라 돈나물 물김치와 같이 먹으면 좋다', 'image_url': None}, {'step_number': 2, 'description': '전병은 질지않게 한다', 'image_url': None}, {'step_number': 3, 'description': '동치미를 맛있게 담가 준비한다', 'image_url': None}]"
79524,밥/죽/떡,영양식,채소류,볶음,#해물요리 #콩요리 #야채요리 #해물콩야채포케만들기 #밥과함께볶아낸해물야채포케 #건강한한끼,해물야채포케,https://recipe1.ezmember.co.kr/cache/recipe/2024/06/05/4d49a39eb7824f245eda661f07e427dc1.jpg,212,30분 이내,아무나,4인분,"[('모둠 야채', '300g'), ('죽순', '200g'), ('낙지', '200g'), ('냉동칵테일 새우', '20마리'), ('완두콩', '3큰술'), ('그린빈', '80g'), ('병아리콩', '4큰술'), ('곤드레 볶음밥', '120g'), ('그레인보우', '400g'), ('다진마늘', '2큰술'), ('마늘허브 솔트', '1작은술'), ('후추', '1작은술'), ('바질가루', '1작은술'), ('산초가루', '1작은술'), ('올리브오일', ''), ('대두', '3알'), ('블랙올리브', '3알'), ('양송이버섯', '')]","지난번에 포케를 하면서 남겨 놓았던 모둠야채를 냉동실에 넣어 두었는데, 그것을 사용할때가 된 듯 싶어요. ​ 낙지와 죽순도 남아 있고, 냉동새우도 있으니 지난번처럼 이거 볶아주고,,, 또 다른것 볶아주고...의 이중삼중으로 하는 제대로된 포케가 아닌... ​ 초지일관 오로지 한팬에 한방에 끝내는 해물야채포케를 만들었습니다. 모둠야채와 그린빈, 완두콩, 병아리콩을 넣어 주고 낙지, 새우, 죽순까지 넣어서 만드는 건강한 포케입니다. ​ ​ 탄수화물은 그레인보우소고기와 곤드레볶음밥으로 ^^","[{'step_number': 1, 'description': '달궈진 팬에 올리브오일 듬뿍 넣어 주고, 거기에 다진마늘 넣어서 한번 달달 볶아 줍니다.볶음팬', 'image_url': 'https://recipe1.ezmember.co.kr/cache/recipe/2024/06/05/1e1a144a7f79719fdf49a5193bc3ba011.jpg'}, {'step_number': 2, 'description': '그린빈, 병아리콩, 모둠냉동야채에 마늘허브소금, 후추, 바질가루를 넣어서 달달 볶아 줍니다. 모둠냉동야채는 제가 직접 썰어서 냉동실에 쟁여 놓았던 것입니다. 거기에는 오색파프리카와 양송이버섯을 네모지게 썰어서 냉동실에 넣어 둔 것이죠. 지난번 포케할때에도 사용했었죠. ^^요리스푼', 'image_url': 'https://recipe1.ezmember.co.kr/cache/recipe/2024/06/05/84b96e2dc54ee9941b81a2ed807b99931.jpg'}, {'step_number': 3, 'description': '달달 볶아졌다면 해동시킨 칵테일생새우, 절단낙지, 죽순을 넣어서 같이 볶아 줍니다. 해물이 들어가다보니 물기가 생기네요.도마 , 조리용나이프죽순 손질법', 'image_url': 'https://recipe1.ezmember.co.kr/cache/recipe/2024/06/05/f09c72902378c37cc290df719a2727a41.jpg'}, {'step_number': 4, 'description': '조금 매콤한 맛을 위해서 산초가루를 추가로 넣어 주었습니다. 새우와 낙지가 익을때까지 달달 볶아 줍니다. 이렇게 볶으면 해물야채볶음이 될 것이고, 볶음밥 위에 올려 주면 포케가 되겠죠. 하지만, 조금더 간단하게 따로따로 아닌 한꺼번에 볶음밥도 넣어서 포케를 만들려고 합니다.', 'image_url': 'https://recipe1.ezmember.co.kr/cache/recipe/2024/06/05/37fd529b25b6dbe5d6191eb19d7838981.jpg'}, {'step_number': 5, 'description': '그레인보우처럼요. 그레인보우소고기인데,, 거기에도 곡물과 콩,,,야채, 아주아주 작은 소고기다진것이 들어가져서 같이 볶아낸 것이거든요. 그래서 그냥 한꺼번에 할려고 그레인보우소고기와 곤드레볶음밥도 조금 넣어 주었습니다. 같이 달달 센불에서 볶아 줍니다.', 'image_url': 'https://recipe1.ezmember.co.kr/cache/recipe/2024/06/05/e07c5d4aae9a111145d3aab5f1817c121.jpg'}, {'step_number': 6, 'description': '기름과 물기로 인해서 밥이 고슬고슬해지지 않는데, 계속해서 수분을 날려 주려고 중불로 옮겨서는 볶아 줍니다.', 'image_url': 'https://recipe1.ezmember.co.kr/cache/recipe/2024/06/05/7b62f3dfb55e65fff35fab79765e4b7d1.jpg'}, {'step_number': 7, 'description': '새우와 낙지를 넣어 주고, 각종 야채와 콩류를 넣어서 만든 해물콩야채포케 완성입니다. 위에 대두를 올려 주고 블랙올리브도 올려 주었습니다. 그냥 딱 볶음밥이지요. 지난번처럼 밥 따로 볶아 주고, 야채볶음과 해물 따로 볶아 주고... 그런 후에 밥 위에 야채볶음과 해물을 올린 후에 콩도 올려 주어야 하는데 그건 어찌보면 한번일지도 모릅니다. 그걸 또 하나....... 싶어지기도 하죠. 그냥 이대로도 충분히 맛있는 볶음밥같은 포케입니다.접시', 'image_url': 'https://recipe1.ezmember.co.kr/cache/recipe/2024/06/05/e0997dbae444a735c6c41812c3febd7f1.jpg'}]"
