index,종류별,상황별,재료별,방법별,글 제목,레시피이름,레시피이미지,조회수,조리시간,난이도,인분,재료,소개글,조리순서
7427,밑반찬,일상,달걀/유제품,부침,백종원 계란말이 만드는 법 촉촉한 식감의 비결은?,계란말이,https://recipe1.ezmember.co.kr/cache/recipe/2021/01/04/fd3217e679bcbf48e8df801de96c44fd1.jpg,"9,212",15분 이내,초급,2인분,"[('달걀', '6개'), ('대파 썬것', '1/2컵'), ('소금', '1꼬집'), ('후춧가루', '1꼬집'), ('식용유', '약간')]",아이 키우는 집에서 자주 만드는 반찬 중 하나가 바로 계란요리가 아닐까 싶어요. 저도 계란말이랑 계란찜은 정말 자주 만드는 반찬 중 하나인데요. 이게 또 예쁘고 도톰하게 만드는것도 테크닉이 필요해요. 오늘은 제가 애정하는 백종원 계란말이 레시피인데요~ 뻣뻣하지 않고 에그스크램플처럼 촉촉한게 특징이예요.,"[{'step_number': 1, 'description': '대파는 송송 썰어주세요.', 'image_url': 'https://recipe1.ezmember.co.kr/cache/recipe/2021/01/05/afaa06d169df3442c00de929b4414f6d1.jpg'}, {'step_number': 2, 'description': '계란 6개 풀고 소금 한꼬집, 후춧가루 한꼬집 넣고 잘 풀어주세요.', 'image_url': 'https://recipe1.ezmember.co.kr/cache/recipe/2021/01/05/11878cd8143eae1f39764adf69051ea51.jpg'}, {'step_number': 3, 'description': '후라이팬을 예열하고 중불로 줄인 후 식용유 두르고 대파를 달달 볶아주세요. 이렇게 파기름을 먼져 내는게 요령입니다.', 'image_url': 'https://recipe1.ezmember.co.kr/cache/recipe/2021/01/05/be36b78c13bb7bb652052e7dedaaf14d1.jpg'}, {'step_number': 4, 'description': '계란물의 1/4정도만 넣고 젓가락으로 휘휘 저어서 스크램블 에그를 만들어요.', 'image_url': 'https://recipe1.ezmember.co.kr/cache/recipe/2021/01/05/778da846745a53dbb77e7211432e60231.jpg'}, {'step_number': 5, 'description': '스크램블에그는 후라이팬 한귀퉁이로 몰아놓아요.', 'image_url': 'https://recipe1.ezmember.co.kr/cache/recipe/2021/01/05/f2846717e88bf010547e2867f556ec611.jpg'}, {'step_number': 6, 'description': '약불로 줄이고 계란물 1/4 붓고 익힌 후 돌돌 말고, 남은 계란물 또 부어주고 익으면 돌돌 말아주고 반복해주세요.', 'image_url': 'https://recipe1.ezmember.co.kr/cache/recipe/2021/01/05/8d566f2d759e64e8a2378c681c7b728d1.jpg'}, {'step_number': 7, 'description': '앞뒷면 옆면 골고루 각을 잘 잡아주면서 노릇하게 달걀말이를 익혀줍니다.', 'image_url': 'https://recipe1.ezmember.co.kr/cache/recipe/2021/01/05/aaf8f4c0be75199f92497f921a5f45511.jpg'}, {'step_number': 8, 'description': '완성이 된 달걀말이는 먹기 좋게 썰어주세요. 저는 빵칼로 썰었어요. 빵칼이 톱처럼 생겨서 두툼한 달걀말이를 예쁘게 썰기 좋더라고요.', 'image_url': 'https://recipe1.ezmember.co.kr/cache/recipe/2021/01/05/9523c360b46f3ffb4684c77a9732ff0d1.jpg'}]"
7428,밑반찬,일상,달걀/유제품,부침,#명란젓요리 #어쩌다사장명란계란말이 #명란계란만들기 #톡톡 튀는 저염명란계란말이,명란계란말이,https://recipe1.ezmember.co.kr/cache/recipe/2021/04/04/ae8094d6d50d15e03a3980e764b0da611.jpg,"4,782",15분 이내,아무나,4인분,"[('계란', '5개'), ('저염파지 명란', '3개'), ('허브소금', '1작은술'), ('썬파', '1큰술'), ('식용유', '1큰술'), ('케찹', '취향껏')]","저렴하게 구입한 저염파지명란으로 명란두부찌개를 끓였는데,

아직도 많이 남아 있어서

어쩌다사장의 메뉴인 명란계란말이를 만들었습니다.

​

아주 간단하죠. 계란 풀어서 소금간하고

명란은 속알만 빼내고 껍질은 버리고요.

그냥 그렇게 돌돌 말아서 부쳐낸 담백하면서도 알이 톡톡 튀는

명란계란말이를 만들었습니다.

​

남은 명란으로는 크림파스타를 해 볼까요. ㅎㅎㅎ

아니면 그냥 명란찌개!!!","[{'step_number': 1, 'description': '계란 5개에 마늘허브소금을 넣어서 잘 풀어 줍니다.', 'image_url': 'https://recipe1.ezmember.co.kr/cache/recipe/2021/04/04/8dd4f271fb6042e86372369879df7c661.jpg'}, {'step_number': 2, 'description': '저염파지명란의 속알만 빼내어서는 풀어 준 계란에 넣어서 잘 풀어 줍니다. 골고루 풀어 줍니다. 만약 저염이라서 간이 안맞을 수 있으니 소스를 활용하시면 됩니다. 케찹이지요. ^^', 'image_url': 'https://recipe1.ezmember.co.kr/cache/recipe/2021/04/04/8af1580c30967691d2788dca75df854f1.jpg'}, {'step_number': 3, 'description': '초록색빛이 없어서 썬파를 넣어 주었습니다.', 'image_url': 'https://recipe1.ezmember.co.kr/cache/recipe/2021/04/04/bfe5ffa4682ae98ef56ee416332d4f361.jpg'}, {'step_number': 4, 'description': '반국자씩 퍼서는 달궈진 팬에 식용유 두르고 부쳐 주는데 한번 부치고 말아 주고 다시 반국자를 퍼서는 익으면 말아주고를 반복해서 말아 줍니다. 그럼 두툼한 계란말이를 만드실 수 있습니다.', 'image_url': 'https://recipe1.ezmember.co.kr/cache/recipe/2021/04/04/6fa927f989aeec13fb2fb459f1d91f251.jpg'}, {'step_number': 5, 'description': '다 말아졌다면 이제 옆과 앞도 익을 수 있도록 모양을 잡듯이 뒤집개로 왔다갔다면서 눌러 줍니다. 그럼 반듯한 모양의 두툼한 명란계란말이를 만드실 수 있습니다. 바로 썰면 너무 뜨거우니 잠시 식힌 후에 썰어 주시면 됩니다.\n이렇게 2개를 만들어 주었습니다.', 'image_url': 'https://recipe1.ezmember.co.kr/cache/recipe/2021/04/04/42867e4971be5a2c0a5ad9e0913be2e91.jpg'}, {'step_number': 6, 'description': '저렴한 저염파지명란을 이용해서 만든 명란계란말이 완성입니다. 취향에 따라서 케찹을 뿌려서 드시면 됩니다. 사실 케찹을 뿌릴려고 했는데, 이 포스팅을 쓸때에는 여유가 없어서 그냥 사진을 찍었습니다.', 'image_url': 'https://recipe1.ezmember.co.kr/cache/recipe/2021/04/04/922d32eb74473bb2562731710c0738561.jpg'}]"
7429,밑반찬,일상,달걀/유제품,부침,두부 계란말이,두부계란말이,https://recipe1.ezmember.co.kr/cache/recipe/2016/01/13/fe6b168ce755c29603af1385d3d573831.jpg,"10,777",30분 이내,초급,3인분,"[('계란', '5개'), ('두부', ''), ('양파', ''), ('브로콜리', ''), ('당근', ''), ('치즈', ''), ('소금', ''), ('식용유', '')]",영양가득~ 두부 계란말이,"[{'step_number': 1, 'description': '두부만 넣으면 섭섭하니깐~~~ 야채도 함께 넣어줘야겠죠! 당근,브로콜리,양파를 잘게 다져주세요. 브로콜리는 데친후 사용하심 된답니다. 야채는 냉장고에 있는걸로 사용하심되요~~~똑같이 준비할 필요 없어요 ^^', 'image_url': 'https://recipe1.ezmember.co.kr/cache/recipe/2016/08/11/82a6e232ed9e6a9e2386d081797fe0a51.jpg'}, {'step_number': 2, 'description': '두부는 물기를 제거한후 으깨주세요. 반모 사용했어요!', 'image_url': 'https://recipe1.ezmember.co.kr/cache/recipe/2016/08/11/777142f18bba6ac4b9aba28ca4b6099b1.jpg'}, {'step_number': 3, 'description': '으깬 두부에 야채를 넣고 소금간을 해주세요.', 'image_url': 'https://recipe1.ezmember.co.kr/cache/recipe/2016/08/11/f78fa7cb19042942f01c11e4e678c7d41.jpg'}, {'step_number': 4, 'description': '달걀 3개를 넣고 재료를 섞어주세요.', 'image_url': 'https://recipe1.ezmember.co.kr/cache/recipe/2016/08/11/c81e4a59b53aa917c8e4757f71e251d21.jpg'}, {'step_number': 5, 'description': '달걀 2개는 따로 풀어서 간을 해주세요.', 'image_url': 'https://recipe1.ezmember.co.kr/cache/recipe/2016/08/11/249f13b0b502f1d6a690960a791211c21.jpg'}, {'step_number': 6, 'description': '팬에 기름을 두르고 준비한 두부계란말이를 부어주세요. 그리고 치즈를 올려주세요. 치즈 없으면 생략가능!! 달걀 끝부분 부터 돌돌 말아주심 된답니다. 그리고 남아있던 계란물을 부어서 계란말이를 완성하면되요!', 'image_url': 'https://recipe1.ezmember.co.kr/cache/recipe/2016/08/11/22e6e14dcdc725a8b12a4db2c3b6b55c1.jpg'}, {'step_number': 7, 'description': '두툼하게 완성된 계란말이!! 계란말이 전용 팬을 하나 구입해야겠어요 ㅋㅋㅋ~', 'image_url': 'https://recipe1.ezmember.co.kr/cache/recipe/2016/08/11/c2c4e164415d0572ac113269c135ab641.jpg'}, {'step_number': 8, 'description': '먹기 좋은 크기로 잘라 맛나게 먹으면 되지요. 부드럽고 담백한 두부 달걀말이 중간에 치즈를 넣어서~~~ 더 맛난것 같아요.', 'image_url': 'https://recipe1.ezmember.co.kr/cache/recipe/2016/08/11/5a0ae203a11e01f53dd84b69511c23901.jpg'}]"
7430,밑반찬,일상,달걀/유제품,부침,명란 계란말이 만들기,명란계란말이,https://recipe1.ezmember.co.kr/cache/recipe/2015/10/09/18b9ab0f189124a686a3cca4c5b114551.jpg,"15,554",30분 이내,아무나,2인분,"[('계란', '10개'), ('깻잎', '5~6장'), ('명란', '2개'), ('소주', '1큰술'), ('식용유', '적당량')]",톡톡 터지는 재미진 맛을 지닌 명란 계란말이 만들기,"[{'step_number': 1, 'description': '깻잎과 명란은 잘게 썰어 줍니다.', 'image_url': 'https://recipe1.ezmember.co.kr/cache/recipe/2015/10/12/5e5ee3e9f9101413dd16e64180edf1a31.jpg'}, {'step_number': 2, 'description': '계란을 소주 1큰술을 넣고 잘 풀어줍니다. 저 하얀 기분나뿐 것은 왠만하면 제거해 주시고요... 잘게 썬 명란과 깻잎을 넣어 골고루 섞어주세요. 좀 덜짜게 드시고 싶으시면 명란젓을 흐르는 물에 살짝 씻어서 넣어주세요.', 'image_url': 'https://recipe1.ezmember.co.kr/cache/recipe/2015/10/12/0543c01664c60fd728f10b13a928b64a1.jpg'}, {'step_number': 3, 'description': '달군 팬에 식용유를 두르는데 기름이 너무 과하게 많이 들어가지 않도록 합니다. 기름이 많아도 잘 안말려요. 계란물을 넣어 돌돌 말아주고, 또 달걀물을 넣고 말아주고를 반복합니다.', 'image_url': 'https://recipe1.ezmember.co.kr/cache/recipe/2015/10/12/a20e247690ab7bcc7e011f5448a0915f1.jpg'}, {'step_number': 4, 'description': '말린 계란말이는 김발로 둘둘 말아서 고정을 잠시 시켜 주세요. 라인이 더 많이 새겨지길 원하시면 좀 무거운걸 위에 올려 두시면 되요.', 'image_url': 'https://recipe1.ezmember.co.kr/cache/recipe/2015/10/12/3a11da06caad0c32e942200515b67cae1.jpg'}, {'step_number': 5, 'description': '그리고 빵칼을 이용하여 썰어주시면 흐트러짐 없이 잘 썰린답니다.', 'image_url': 'https://recipe1.ezmember.co.kr/cache/recipe/2015/10/12/794d521e2f546493385a79a658f879c11.jpg'}]"
7431,밑반찬,일상,달걀/유제품,부침,일본식 계란말이,계란말이,https://recipe1.ezmember.co.kr/cache/recipe/2015/06/04/f6335690f1bcf30419c4b633efef7ec91.jpg,"60,286",15분 이내,초급,2인분,"[('달걀', '4개'), ('가쓰오육수', '3스푼'), ('간장', '1스푼'), ('설탕', '0.3스푼'), ('청주', '2스푼')]",부드럽고 촉촉한 일본식 계란말이입니다.,"[{'step_number': 1, 'description': '계란에 육수와 간장, 설탕, 청주를 넣어 풀어줍니다. 육수는 가쓰오 육수가 있음 좋고 없으면 멸치 다시마 육수도 가능합니다.', 'image_url': 'https://recipe1.ezmember.co.kr/cache/recipe/2015/06/04/8727a058d137a32237dec5522051c0841.jpg'}, {'step_number': 2, 'description': '달구어진 팬에 계란물을 얇게 둘러 계란을 말고 또 남은 계란물을 부어서 이어서 계란을 말아줍니다. 너무 많이 익으면 맛이 덜 하니까 약한불에서 계란을 익혀줍니다.', 'image_url': 'https://recipe1.ezmember.co.kr/cache/recipe/2015/06/04/313ed809929682dfcbc272e0b2770ff31.jpg'}, {'step_number': 3, 'description': '란말이가 완성된 후 모양을 잡아주기 위해 종이호일로 돌돌 말아 열이 남아 있는 팬 위에 올려 놓습니다. 이렇게 5분 정도 두었다가 계란이 식었을때 썰어줍니다.', 'image_url': 'https://recipe1.ezmember.co.kr/cache/recipe/2015/06/04/7b250e5cdf65b360f85bb941ec3d78a91.jpg'}]"
7432,밑반찬,일상,달걀/유제품,부침,탱글탱글 부드러운 일본식 계란말이,계란말이,https://recipe1.ezmember.co.kr/cache/recipe/2015/09/07/03f92849ea7b3579eac99a0e053cc06f.jpg,"62,136",15분 이내,초급,2인분,"[('계란', '3개'), ('다시물', '3T'), ('무', '약간'), ('', ''), ('물', '5C'), ('다시마                                                                                사방5cm', '6개'), ('가쓰오부시', '30g'), ('설탕', '1t'), ('간장', '1/2t'), ('소금', '1/4t')]",야채를 듬뿍넣고 청량고추도 송송 썰어놓은 한국식 계란말이와는 또다른 맛이 있는 일본식 계란말이 함께 만들어 보아요. 탱글탱글 맛있는 일본식 계란말이랍니다.,"[{'step_number': 1, 'description': '다시물 만들기. 다시마 겉에 묻은 흰가루를 행주로 닦아낸다. 냄비에 물5컵을 넣고 다시마를 넣고 끓여준다. 물이 끓기 직전에 다시마를 꺼낸다. 다시마 우린 물이 팔팔 끓으면 가쓰오부시를 넣고 불을 끈 후 3분정도 그대로 둔다. 체나 면보에 걸러 사용한다. 이렇게 다시물을 만드시면 되요. 넉넉하게 만드셔서 냉장고에 보관하시면서 다양한 요리에 활용해보세요.', 'image_url': 'https://recipe1.ezmember.co.kr/cache/recipe/2015/09/07/fe7ee3fcd32fc974d867fcc87a374e291.jpg'}, {'step_number': 2, 'description': '이제 본격적으로 일본식 계란말이를 만들어 보아요. 일단 싱싱한 계란3개를 준비해주세요.', 'image_url': 'https://recipe1.ezmember.co.kr/cache/recipe/2015/09/07/02817764bf78a061876e914a4be845661.jpg'}, {'step_number': 3, 'description': '그릇에 계란을 깬 다음 다시물 3T, 설탕 1t, 간장 1/2t, 소금 1/4를 넣어주세요. 계란말이에 간 맞추기가 은근히 어렵답니다. 특히 일본식계란말이는 더 그래요. 제가 넣은 분량만큼 넣으시면 간이 딱 맞을거예요.', 'image_url': 'https://recipe1.ezmember.co.kr/cache/recipe/2015/09/07/f7ceffbf9b0d84d3facad908398bf8bf1.jpg'}, {'step_number': 4, 'description': '젓가락을 이용해 거품이 많이 나지 않도록 잘 섞어주세요.', 'image_url': 'https://recipe1.ezmember.co.kr/cache/recipe/2015/09/07/91648cb587e19548b789f3250abaab6f1.jpg'}, {'step_number': 5, 'description': '잘 풀어줬으면 고운체에 한번 걸러주세요.', 'image_url': 'https://recipe1.ezmember.co.kr/cache/recipe/2015/09/07/d06b2b82c54074a7420585809e3475fd1.jpg'}, {'step_number': 6, 'description': '이제 후라이팬을 아주 약불에 올려 달군 후에 기름을 두른 후 키친타올을 이용해 후라이팬에 골고루 발라주세요.', 'image_url': 'https://recipe1.ezmember.co.kr/cache/recipe/2015/09/07/ba83e80a94f979350b759a223490cb601.jpg'}, {'step_number': 7, 'description': '그 다음 계란물을 한번 부어서 넓게 펴 주신 후에 젓가락과 뒤집개를 이용해서 돌돌 말아주세요. 처음에는 뒤집개만 이용하시기 보다는 젓가락을 함께 이용해서 잡아주시면서 돌돌 말아주시면 편하게 하실 수 있어요.', 'image_url': 'https://recipe1.ezmember.co.kr/cache/recipe/2015/09/07/e40b08ddaac408b5f506bafb8b8047a31.jpg'}, {'step_number': 8, 'description': '요런식으로 돌돌 말아주신 다음 다시 계란물을 붓고 돌돌 말고 계란물 붓고를 반복해주시면 되요. 무엇보다 계란물을 부은 후에 다 익을때까지 기다리지 말고 바닥이 하얗게 익기 시작할때 돌돌 말아주셔야지 계란끼리 서로 붙어서 잘 말아져요.', 'image_url': 'https://recipe1.ezmember.co.kr/cache/recipe/2015/09/07/8afd6e85da385af20503a0bba04b0dae1.jpg'}, {'step_number': 9, 'description': '그러면 이렇게 도톰한 계란말이가 완성된답니다. 다 말아져도 안에까지 골고루 익을 수 있도록 저 상태에서 조금 더 익혀주세요. 혹시 계란말이가 이쁘게 만들어지지 않으시면 따뜻한 상태에서 김밥말에 돌돌 말아서 모양을 잡아주시면 네모난게 모양을 잡을 수 있답니다.', 'image_url': 'https://recipe1.ezmember.co.kr/cache/recipe/2015/09/07/0df613415c5f1af8aa2a720a96a6e9871.jpg'}, {'step_number': 10, 'description': '무를 갈아서 곁들이면 더 맛있게 드실 수 있답니다. 아주 계란말이가 탱글탱글한게 부드러워요. 일식집에서 드시던 그 부드러운 계란말이랍니다. 특히 일본식 계란말이에 특징을 설탕을 약간 넣어서 달달한 맛이 느껴지는거죠. 혹 달달한 맛이 싫으시면 설탕을 빼셔도 상관없어요. 밥반찬으로는 물론, 사케드실때 술 안주로도 좋아요. 맛있게 만들어 드세요.', 'image_url': 'https://recipe1.ezmember.co.kr/cache/recipe/2015/09/07/472c845c271d4d36b1a33df985e26cb71.jpg'}]"
7433,밑반찬,일상,달걀/유제품,부침,치즈 스크램블 에그 초간단,치즈스크램블에그,https://recipe1.ezmember.co.kr/cache/recipe/2020/10/13/0f1e0d235205d0519edc85075c7a88ab1.jpg,"4,856",5분 이내,초급,1인분,"[('달걀', '3개'), ('슬라이스 치즈', '2개')]",초간단요리 치즈 스크램블 에그,"[{'step_number': 1, 'description': '팬에 식용유를 두르고 예열한 후 달걀을 풀어줍니다', 'image_url': 'https://recipe1.ezmember.co.kr/cache/recipe/2020/10/13/00d2954bc535529d9e2013b83b1a349e1.jpg'}, {'step_number': 2, 'description': '달걀을 익히다가 휘저어 주세요', 'image_url': 'https://recipe1.ezmember.co.kr/cache/recipe/2020/10/13/00acac1eb2799ba9da955b339d59e9f11.jpg'}, {'step_number': 3, 'description': '슬라이스 치즈를 두개 넣고', 'image_url': 'https://recipe1.ezmember.co.kr/cache/recipe/2020/10/13/b1001f48c3e12b463f4973d60d9da3281.jpg'}, {'step_number': 4, 'description': '뒤집개로 섞어줍니다', 'image_url': 'https://recipe1.ezmember.co.kr/cache/recipe/2020/10/13/4fa5de241b764d56ec653ed00048dbd11.jpg'}, {'step_number': 5, 'description': '치즈가 달걀 속으로 녹도록 뒤집개로 여러번 섞어서 팬이 눌러붙을때까지 익혀주세요', 'image_url': 'https://recipe1.ezmember.co.kr/cache/recipe/2020/10/13/153602a7b4ed9a8d0fb86cfc516620e11.jpg'}]"
7434,밑반찬,일상,달걀/유제품,부침,비쥬얼 요리가 나타났다! 스페셜 2색 달걀말이,달걀말이,https://recipe1.ezmember.co.kr/cache/recipe/2016/07/18/42ce8abe67d16c4f646e9e4b843130cf1.png,"54,548",30분 이내,아무나,4인분,"[('시금치                                                                                80g', '1줌'), ('채 썬 당근', '1/8개'), ('달걀', '5개'), ('소금', '약간'), ('참기름', '1/3큰술'), ('소금', '1/2큰술'), ('후추', '약간')]","달걀말이도 이제는 스타일리쉬하게!
2색으로 만들어서 이쁘게 먹어보자!

세상의 모든 레시피 만개의레시피","[{'step_number': 1, 'description': '끓는 물(4컵)에 소금(1/2큰술)과 시금치를 넣고 10초간 데친 뒤 찬물에 헹궈요.시금치 1줌(80g)', 'image_url': 'https://recipe1.ezmember.co.kr/cache/recipe/2016/07/18/15a2fd1ad8457afc3c3abc95c5e59a0e1.png'}, {'step_number': 2, 'description': '시금치 데친 물에 당근도 넣고 15초 정도 데친 뒤 건져요. 데친 시금치는 물기를 짜고 밑간에 버무리고, 데친 당근도 물기를 제거해 소금(약간)에 버무려요.채 썬 당근 1/8개 [밑간]: 소금 약간, 참기름 1/3큰술', 'image_url': 'https://recipe1.ezmember.co.kr/cache/recipe/2016/07/18/cb34d5034b7ffaec8ff95324e54993c71.png'}, {'step_number': 3, 'description': '달걀은 소금(약간), 후춧가루(약간)을 넣고 곱게 풀어요.달걀 5개', 'image_url': 'https://recipe1.ezmember.co.kr/cache/recipe/2016/07/18/e4a090dc7fa8e9a2943ba0bdb712caa21.png'}, {'step_number': 4, 'description': '중약 불로 달군 팬에 식용유(1큰술)를 두르고 달걀물(1/2분량)을 부어 익혀요.팬중약 불', 'image_url': 'https://recipe1.ezmember.co.kr/cache/recipe/2016/07/18/1c9f39c73019f9509b574f92ae8030ad1.png'}, {'step_number': 5, 'description': '반숙으로 익으면 당근을 얹어 달걀물로 감싼 뒤 시금치도 얹고 돌돌 말아요.', 'image_url': 'https://recipe1.ezmember.co.kr/cache/recipe/2016/07/18/37fdb0a49bef841f19f6e5ac5d7dca711.png'}, {'step_number': 6, 'description': '남은 달걀물(1/2분량)을 붓고 이어 붙여가며 익혀 한 번 더 돌돌 말아 속까지 익힌 뒤, 먹기 좋게 썰어 마무리.', 'image_url': 'https://recipe1.ezmember.co.kr/cache/recipe/2016/07/18/d7c88e262eb81517674029629a96fc011.png'}]"
7435,밑반찬,일상,달걀/유제품,부침,깻잎계란말이,깻잎계란말이,https://recipe1.ezmember.co.kr/cache/recipe/2015/06/08/fb5afe0310c450b01976c3aca5e53bc21.jpg,"19,585",15분 이내,초급,2인분,"[('계란', '2개'), ('깻잎', ''), ('식용유', '적당량'), ('우유', ''), ('소금', '약간')]",깻잎향이 나는 계란말이 만드는법 알려드립니다.,"[{'step_number': 1, 'description': '깻잎은 잘게 다집니다.', 'image_url': 'https://recipe1.ezmember.co.kr/cache/recipe/2015/06/08/1cdd77ea5ef754f906d47b83a217a1c61.jpg'}, {'step_number': 2, 'description': '계란은 볼에 깨서 둡니다.', 'image_url': 'https://recipe1.ezmember.co.kr/cache/recipe/2015/06/08/a02dde0f7a065be03624b5ee663aa1c21.jpg'}, {'step_number': 3, 'description': '계란에 우유를 조금 넣어주세요. \n계란 2개정도에 2스푼 정도 넣어주시면 됩니다.', 'image_url': 'https://recipe1.ezmember.co.kr/cache/recipe/2015/06/08/32a68294daafd60e83cbd111217732181.jpg'}, {'step_number': 4, 'description': '깻잎을 넣고 소금으로 간해줍니다.', 'image_url': 'https://recipe1.ezmember.co.kr/cache/recipe/2015/06/08/4c118112be40ff20c9a6578fe6df99a71.jpg'}, {'step_number': 5, 'description': '달구어진팬에 식용유 두르시구요. 약불로 낮춰 계란물을 부어줍니다.', 'image_url': 'https://recipe1.ezmember.co.kr/cache/recipe/2015/06/08/2ae66bb9a97b7cafb21f8db7def479a71.jpg'}, {'step_number': 6, 'description': '돌돌 말아주면 완성.', 'image_url': 'https://recipe1.ezmember.co.kr/cache/recipe/2015/06/08/0ba295ad0548199afc4d92fe86383ab21.jpg'}]"
7436,밑반찬,일상,달걀/유제품,부침,계란말이 야채 듬뿍 다지기로 쉽게 만드는 법,계란말이,https://recipe1.ezmember.co.kr/cache/recipe/2018/12/11/829f848348cefc75180c6bedd8e3b3a11.jpg,"5,780",15분 이내,초급,4인분,"[('계란', '6개'), ('소금', '1/2t'), ('빨간 파프리카', '1/4개'), ('노란 파프리카', '1/4개'), ('초록 파프리카', '1/4개')]","오랜만에 계란말이를 했어요ㅡ
냉장고에 있는 파프리카 다져 넣고 계란말이를 했답니다
계란말이도 오랜만에 먹으면 맛있네요","[{'step_number': 1, 'description': '포프리계란 6개와 파프리카를 준비했어요~!~~', 'image_url': 'https://recipe1.ezmember.co.kr/cache/recipe/2018/12/11/e860fcb66764cc8ceaff537bfd18ea7b1.jpg'}, {'step_number': 2, 'description': '다지기를 이용하여 파프리카도 쉽게 다졌어요\n요즘 어깨가 너무 아파서 칼질하는 것도 힘들어서 다지기를 사용했어요', 'image_url': 'https://recipe1.ezmember.co.kr/cache/recipe/2018/12/11/65200ae49f6efe2f43aae465f086d3f11.jpg'}, {'step_number': 3, 'description': '볶음밥 할 때도 다지기에 야채 다지면 쉽게 만들어 먹을 수 있을 것 같지요', 'image_url': 'https://recipe1.ezmember.co.kr/cache/recipe/2018/12/11/13e0d3ae0364560b3b1d14b72f28addb1.jpg'}, {'step_number': 4, 'description': '계란도 따로 풀 필요 없이 야채 다진 것에 계란을 넣고 다지기로 풀어주면 너무 곱게 잘 풀어지네요', 'image_url': 'https://recipe1.ezmember.co.kr/cache/recipe/2018/12/11/6f8887059b8c5929903f194db85e7fe31.jpg'}, {'step_number': 5, 'description': '설거지 많이 할 필요 없이 다지기만 설거지하니까 편하네요\n팬을 달군 다음 기름을 둘러준 다음 키친타월로 닦아준 다음 계란물을 부어줍니다', 'image_url': 'https://recipe1.ezmember.co.kr/cache/recipe/2018/12/11/a1c302ae6266a64722e5265d7ed89dc21.jpg'}, {'step_number': 6, 'description': '계란을 말아주면서 남은 계란물을 부어 주기를 반복합니다', 'image_url': 'https://recipe1.ezmember.co.kr/cache/recipe/2018/12/11/8aace7f8b9cceca7b439d45548ed73041.jpg'}, {'step_number': 7, 'description': '부친 계란을 식은 다음 썰어야 모양을 예쁘게 썰 수 있어요', 'image_url': 'https://recipe1.ezmember.co.kr/cache/recipe/2018/12/11/52b36e64efb745895888d8c24c777d5a1.jpg'}, {'step_number': 8, 'description': '접시에 돌려 담았어요', 'image_url': 'https://recipe1.ezmember.co.kr/cache/recipe/2018/12/11/5be4f5d6e06b4d3bf624759356d2f88e1.jpg'}, {'step_number': 9, 'description': '파프리카의 아삭함과 계란의 부드러움이 어우러진 맛있는 계란 말이입니다', 'image_url': 'https://recipe1.ezmember.co.kr/cache/recipe/2018/12/11/c0baee7883ae2d0fb4d395d5f4745e5f1.jpg'}]"
