index,종류별,상황별,재료별,방법별,글 제목,레시피이름,레시피이미지,조회수,조리시간,난이도,인분,재료,소개글,조리순서
78465,밥/죽/떡,도시락,닭고기,튀김,남은치킨으로 치킨마요덮밥만들기,치킨마요덮밥,https://recipe1.ezmember.co.kr/cache/recipe/2020/07/15/24a118ad0e5dda9c84fbc912478c24211.jpg,"3,224",20분 이내,아무나,2인분,"[('남은치킨', ''), ('양파', '1/2쪽'), ('계란', '2개'), ('마요네즈', ''), ('간장', '2T'), ('올리고당', '2T')]","어제 먹다 남은 치킨으로 뭘할까 하다가

집에서도 쉽게 만들수있는 치킨마요덮밥을 만들었어요! 집에서 만드는 치킨마요덮밥~

쉽고 참 간단한데 맛은 진짜 진짜 맛있어요

치킨 듬뿍 넣고 단짠단짠 고소한 치킨마요만들기

자! 누구나 쉽게 따라해봅니다, 고고싱","[{'step_number': 1, 'description': '당연히 치킨이쥬! BBQ치킨 한마리 시켰어요\n후라이드 한마리 시켰더니 반은 남은거 같아요\n남은 치킨 활용한 요리 치킨마요덮밥을 만들거예요', 'image_url': 'https://recipe1.ezmember.co.kr/cache/recipe/2020/07/15/9612f25013fb4d1f758f8b08dd3788441.jpg'}, {'step_number': 2, 'description': '남은 치킨 살을 잘 발라주세요!\n저는 가슴살 위주로 뼈를 발라주었어요', 'image_url': 'https://recipe1.ezmember.co.kr/cache/recipe/2020/07/15/d86ac5ada2b623a928210f97b8e84ba51.jpg'}, {'step_number': 3, 'description': '양파 반쪽은 얇게 썰어주고 계란 두개는 잘 풀어주세요\n양파 한개 다 쓰셔도 좋을것 같아요!\n저는 양파가 참 맛있더라구요ㅋㅋ양파 많이', 'image_url': 'https://recipe1.ezmember.co.kr/cache/recipe/2020/07/15/bd792e527074fb7844c1cfbf0f2ebe501.jpg'}, {'step_number': 4, 'description': '후라이팬에 기름 살짝 두르고 계란물을 넣어주세요\n젓가락으로 돌려주며 익히시면 되요\n계란 스크램블 하시는거 다들 아시지요?\n휙휙 저으며 몽글몽글 익혀주시면 됩니다 :^)', 'image_url': 'https://recipe1.ezmember.co.kr/cache/recipe/2020/07/15/58f1a00f0fc484778b72123aa852a3151.jpg'}, {'step_number': 5, 'description': '기름 살짝 두른 후라이팬에 양파를 넣고\n간장2T 와 올리고당2T를 넣고 잘 조려주심 되요\n국물이 자글자글 있게끔 조려주세요\n요 간장소스가 진짜 엄청 맛있어요', 'image_url': 'https://recipe1.ezmember.co.kr/cache/recipe/2020/07/15/056a06239a591b9ac92eecb13e7d57a91.jpg'}, {'step_number': 6, 'description': '예쁜 그릇에 밥을 넣고 조려둔 양파와 소스를 올려주세요! 그후에 테두리를 계란으로 둘러주세요\n찢어둔 치킨을 올리시면 90%완성!!', 'image_url': 'https://recipe1.ezmember.co.kr/cache/recipe/2020/07/15/065b8ff0bb043ef5f217aa5b254cd11f1.jpg'}, {'step_number': 7, 'description': '예쁜 그릇에 밥을 넣고 조려둔 양파와 소스를 올려주세요! 그후에 테두리를 계란으로 둘러주세요\n찢어둔 치킨을 올리시면 90%완성!!', 'image_url': 'https://recipe1.ezmember.co.kr/cache/recipe/2020/07/15/f9ece83d8a276442ee49b44fef1df98e1.jpg'}]"
