index,종류별,상황별,재료별,방법별,글 제목,레시피이름,레시피이미지,조회수,조리시간,난이도,인분,재료,소개글,조리순서
71441,밥/죽/떡,일상,해물류,볶음,굴소스 새우볶음밥,굴소스새우볶음밥,https://recipe1.ezmember.co.kr/cache/recipe/2015/06/08/b9c181efe7f8330aa15fc3ebbe0cf182.jpg,"18,015",30분 이내,초급,1인분,"[('새우', '5마리'), ('밥', '1공기'), ('계란', '1개'), ('당근', ''), ('양파', ''), ('버섯등 자투리야채', '적당히'), ('버터                                                                                또는 포도씨유', '1큰술'), ('굴소스', '0.5큰술'), ('소금', '약간'), ('후추', '약간')]",집에서 깨끗하고 맛있고 영양많은 새우볶음밥 만들어보아요. 야채가 골고루 새우가 듬뿍 계란까지 또 맛도 엄마표가 최고 아이들 한끼식사로도 늠흐 좋을꼬 같아요. 으나는 버터향을 느끼고 싶어서 버터로 볶았는데 기호에 따라 포도씨유나 식용유등으로 볶으시면 되겠지요.,"[{'step_number': 1, 'description': '먼저 새우는 껍질을 벗기고 등쪽내장을 빼낸뒤 씻어 썰어줍니다. 야채랑 버섯도 작게 다지듯 썰어줍니다. 볶음밥에 야채가 넘 크면 별루예요. 란은 잘풀어서 소금으로 살짝 간해주세요. 달군팬에 버터나 포도씨유 0.5큰술 넣고 풀어준 계란을 부어 젓가락으로 저어가며 스크램블로 익혀준뒤 따로 그릇에 담아둡니다. 팬에 나머지 버터 0.5큰술을 넣고 썰어둔 새우와, 야채를 볶다가 야채가 거의 익으면', 'image_url': 'https://recipe1.ezmember.co.kr/cache/recipe/2015/10/05/6815f5e79e35391fb26e9432ba3079241.jpg'}, {'step_number': 2, 'description': '밥을 넣어 골고루 볶아주다가 따로 놔둔 달걀 스크램블를 넣고 굴소스 0.5큰술을 넣어 잘볶아줍니다. 마지막에 소금, 후추살짝 넣어 간을 맞추면 끝.', 'image_url': 'https://recipe1.ezmember.co.kr/cache/recipe/2015/10/05/16db727a803bbe735370ac7e4b90a5751.jpg'}, {'step_number': 3, 'description': '밥을 넣어 골고루 볶아주다가 따로 놔둔 달걀 스크램블를 넣고 굴소스 0.5큰술을 넣어 잘볶아줍니다. 마지막에 소금, 후추살짝 넣어 간을 맞추면 끝.', 'image_url': 'https://recipe1.ezmember.co.kr/cache/recipe/2015/10/05/893c899aadea1114f7842a4530f0f3171.jpg'}, {'step_number': 4, 'description': '밥공기에 볶아놓은 새우볶음밥을 눌러넣고 접시에 거꾸로 뒤집으니 얌전하게 담아졌어요. 볶음밥 위에 통깨도 뿌려주고 볶은뒤 따로 골라둔 반가른 새우도 올려주고 칠리소스살짝 뿌려주니 더 먹음직스럽네요. 양배추 샐러드도 곁들여 주었답니다. 요런거 먹을때 양배추 샐러드 완전 잘어울리잖아요. 야채가 골고루 들어가고 계란도 넣었더니 색깔이 넘 이뽀요. 굴소스로 간을 맞췄더니 더 먹음직스러워 보이구요. 볶음밥할때 굴소스로 간맞추면 맛내기도 쉽고 색깔도 먹음직스러워 보이는거 같아요.', 'image_url': 'https://recipe1.ezmember.co.kr/cache/recipe/2015/10/05/6ee68f87e3485dda6efa8a3f4b189d7c1.jpg'}]"
71442,밥/죽/떡,일상,해물류,볶음,해물떡볶이 - 해물떡볶이 레시피,해물떡볶이,https://recipe1.ezmember.co.kr/cache/recipe/2017/08/25/aa7394ecd28ca2a2374539521086cb351.jpg,"15,546",30분 이내,아무나,3인분,"[('밀떡', '30~35개'), ('해물믹스', '원하는만큼'), ('어묵', '2장'), ('양파', '1/2개'), ('대파', '1대'), ('양배추', '1줌'), ('식용유', '1/5컵'), ('물', '1.5컵'), ('고추장', '2'), ('설탕', '3'), ('고춧가루', '2'), ('진간장', '1/5컵'), ('후춧가루', '')]",해물떡볶이,"[{'step_number': 1, 'description': '대파 1대를 조금 큼지막하게 썰어주고,양파 1/2, 어묵 2장, 양배추를 먹기 좋은 크기로 썰어주세요.\n떡볶이\xa0떡은\xa0밀떡으로\xa0준비했습니다.\n밀떡은 양념이 빠르게 잘 베이고 쌀떡은 양념이 잘 베이지 않아요.\n그래서 즉석 떡볶이는 밀떡으로 조리해서 먹음 좋고요.\n\xa0쌀떡은 조리면서 먹을 때 적합하다고 하니 참고하세요.\n하지만 내 취향은 밀떡이라는 거~\xa0평소\xa0좋아하는\xa0떡으로\xa0하세요.', 'image_url': 'https://recipe1.ezmember.co.kr/cache/recipe/2017/08/25/9dd4526907bd437427a8011f7b204c7b1.jpg'}, {'step_number': 2, 'description': '해물 믹스는 넉넉하게 원하는 만큼 준비해서\n찬물에\xa0헹궈\xa0준비해주세요.\n그래야지 잡내가 나지 않아요', 'image_url': 'https://recipe1.ezmember.co.kr/cache/recipe/2017/08/25/aaa37d4551090511ce8f74dfeaeea97c1.jpg'}, {'step_number': 3, 'description': '저는 생새우도 몇 마리 손질해서 넣었습니다.\n통오징어 있음 함께 넣어도 좋아요.\n집에\xa0있는\xa0재료\xa0응용하세요.새우 손질법 레시피', 'image_url': 'https://recipe1.ezmember.co.kr/cache/recipe/2017/08/25/cf5093537b7ff9d8bb0b7c7d9226ba711.jpg'}, {'step_number': 4, 'description': '재료가 준비되었다면 이젠 양념장을 만들어 볼까요\n그릇에 생수 1컵 하고 1/2컵을 부어주고\n고추장 2숟가락을 넣어주세요.', 'image_url': 'https://recipe1.ezmember.co.kr/cache/recipe/2017/08/25/0734a0070c3a3bbcb53c430557f4f8401.jpg'}, {'step_number': 5, 'description': '그리고 진간장 1/5컵을 부어주고', 'image_url': 'https://recipe1.ezmember.co.kr/cache/recipe/2017/08/25/b9f2ad057bf15be6aabdeb2e54f0a2131.jpg'}, {'step_number': 6, 'description': '설탕 3숟가락', 'image_url': 'https://recipe1.ezmember.co.kr/cache/recipe/2017/08/25/bb3bf608a44ed803bab740c863c984a81.jpg'}, {'step_number': 7, 'description': '고춧가루 2숟가락을 넣고 마지막에 후추를 넣어 잘 섞어주세요', 'image_url': 'https://recipe1.ezmember.co.kr/cache/recipe/2017/08/25/654e6b953c2edb05c9d0a173e60956b31.jpg'}, {'step_number': 8, 'description': '팬에 식용유 1/5컵을 부어주고 썰어 놓은 대파를 넣고\n파기름을 내줍니다.', 'image_url': 'https://recipe1.ezmember.co.kr/cache/recipe/2017/08/25/3928c9e446f18491b3a2ffb76aff007d1.jpg'}, {'step_number': 9, 'description': '대파가 노릇노릇해 질 때까지 볶아주다', 'image_url': 'https://recipe1.ezmember.co.kr/cache/recipe/2017/08/25/b39a6344574e9dff2527564ac0e209151.jpg'}, {'step_number': 10, 'description': '해물 믹스를\xa0넣고 볶아주세요.\n이때 물이 생기는데 상관없으니 걱정 마세요.', 'image_url': 'https://recipe1.ezmember.co.kr/cache/recipe/2017/08/25/c296da7dff9dd7af205fdbc4f73c03bf1.jpg'}, {'step_number': 11, 'description': '곧이어 양배추, 양파를 넣고 볶아주다\n(새송이버섯이 있음 함께 넣어도 좋아요. 고구마, 감자 등 추가하면 더욱 풍성하답니다', 'image_url': 'https://recipe1.ezmember.co.kr/cache/recipe/2017/08/25/482eda9e99c927867ee8c780faf657ce1.jpg'}, {'step_number': 12, 'description': '밀떡, 어묵을 넣고', 'image_url': 'https://recipe1.ezmember.co.kr/cache/recipe/2017/08/25/7a408b577feebf4b35c43982c7a4fe641.jpg'}, {'step_number': 13, 'description': '만들어 놓은 소스를 넣어주세요.', 'image_url': 'https://recipe1.ezmember.co.kr/cache/recipe/2017/08/25/7fed07a2234f89f3a0ab521eab440a1f1.jpg'}, {'step_number': 14, 'description': '양념장을\xa0부어주고\xa0더\xa0빨간\xa0떡볶이를\xa0원한다면\xa0고춧가루를\xa0추가해\xa0주심\xa0된답니다.\n처음에는 국물이 부족해 보이지만\xa0 끓이다 보면 채소에서 수분이 나와 부족하지 않아요.\n불 조절에 따라 채소에서\xa0나오는\xa0물의\xa0양이\xa0틀리니깐요.\n참고하시어 양념장을 조절해주세요.', 'image_url': 'https://recipe1.ezmember.co.kr/cache/recipe/2017/08/25/e481a32796d932e928c15b681af350161.jpg'}, {'step_number': 15, 'description': '저는 중약불에서\xa0보글보글\xa0끓여\xa0주었습니다.\n당면 좋아하심 미리 불려 끓일 때 함께 넣어 주세요.\n국물이 걸쭉해 지면 마무리해주세요.', 'image_url': 'https://recipe1.ezmember.co.kr/cache/recipe/2017/08/25/dcd6f7fe9a5744530ab0853a9f05d4201.jpg'}, {'step_number': 16, 'description': '완성된 떡볶이를 그릇에 담고 삶은 달걀 올려주면\n해물떡볶이 완성 ^^', 'image_url': 'https://recipe1.ezmember.co.kr/cache/recipe/2017/08/25/6df1a54b3c2a2495948039980454d5b11.jpg'}]"
71443,밥/죽/떡,일상,해물류,볶음,#매콤한 오징어덮밥 만들기 #오징어볶음을 이용한 덮밥 만들기,오징어덮밥,https://recipe1.ezmember.co.kr/cache/recipe/2016/07/27/8cf22d163f4d1888e37531d7463ee1691.jpg,"6,918",30분 이내,아무나,2인분,"[('오징어', ''), ('양파', ''), ('느타리버섯', ''), ('호박', ''), ('당근', ''), ('고춧가루', ''), ('고추장', ''), ('다진마늘', ''), ('파', ''), ('매실액', ''), ('삶은달걀/삶은메추리알', ''), ('참기름', ''), ('통깨', '')]",삶은 메추리알이 매콤한 맛도 잡아 주면서 든든하게 만들어 주는 화끈한 오징어덮밥입니다.,"[{'step_number': 1, 'description': '재료들을 준비해 놓습니다. 호박, 당근, 양파, 느타리버섯을 비슷비슷한 크기로 썰어서 준비합니다.', 'image_url': 'https://recipe1.ezmember.co.kr/cache/recipe/2016/07/27/45f63f686e963f9ae4fd3fe0f61cad631.jpg'}, {'step_number': 2, 'description': '오징어도 깨끗이 씻어서 칼집을 낸 후에 썰어서 준비하고요.', 'image_url': 'https://recipe1.ezmember.co.kr/cache/recipe/2016/07/27/7fd8c24bd157be73198c8e7b0c2e655c1.jpg'}, {'step_number': 3, 'description': '양념장을 준비합니다. 고춧가루1: 고추장1: 간장1 의 비율로 준비하고 여기에 다진파도 넣어 주세요.', 'image_url': 'https://recipe1.ezmember.co.kr/cache/recipe/2016/07/27/e7718384f7288caef50470cff8c5d7cc1.jpg'}, {'step_number': 4, 'description': '고춧가루와 간장이 들어갔으니 이제 고추장이 들어가야겠죠.', 'image_url': 'https://recipe1.ezmember.co.kr/cache/recipe/2016/07/27/feac061c0c6822080f067f89cbace4c51.jpg'}, {'step_number': 5, 'description': '잘 섞어 줍니다. 고추장과 고춧가루 그리고 간장만 들어가서 퍽퍽합니다. 하지만 걱정하지마세요~~~ 더 들어갈 것이 있으니까요.', 'image_url': 'https://recipe1.ezmember.co.kr/cache/recipe/2016/07/27/36b6957ff5360d872981e4004a19aeec1.jpg'}, {'step_number': 6, 'description': '후추도 조금 넣어 주시고요. 맛술이나 청주를 넣어 주면서 농도를 맞춰 줍니다.', 'image_url': 'https://recipe1.ezmember.co.kr/cache/recipe/2016/07/27/8653c6c2fe04132d557386e0650475811.jpg'}, {'step_number': 7, 'description': '단맛으로는 설탕이나 매실액을 넣어 주시면 되고요. 다진 마늘도 넣고는 잘 섞어줍니다. \n그럼 오징어덮밥의 기본 양념은 만들어 진 것이죠. 냉장고에 넣어 두고서 약간의 숙성시간을 두면 더욱 진한 맛의 양념이 될 수 있죠.', 'image_url': 'https://recipe1.ezmember.co.kr/cache/recipe/2016/07/27/3aec882be291b1fbb83362ac750240131.jpg'}, {'step_number': 8, 'description': '아니면 이렇게 아예 처음부터 오징어와 각종 재료들을 양념장에 버무려서는 냉장고에서 숙성을 시키는 방법도 있습니다. 저는 한꺼번에 양념해서 냉장고에서 숙성을 시켜 주었습니다.', 'image_url': 'https://recipe1.ezmember.co.kr/cache/recipe/2016/07/27/293432d6a744ad36393c06fa7b9da3f21.jpg'}, {'step_number': 9, 'description': '양념이 잘 베어 들어갔지요. 각각의 재료들에~~~한 3시간 정도 숙성을 시킨 것 같네요. 이제 바로 달궈진 팬에 굽고 볶아주기만 하면 끝이지요.', 'image_url': 'https://recipe1.ezmember.co.kr/cache/recipe/2016/07/27/0d439a4ec3ac9c92cd1753e8d2d8a16f1.jpg'}, {'step_number': 10, 'description': '팬에 기름 두르고 달군 후에 한꺼번에 양념에 재워둔 재료들을 투하시켜 줍니다. 그리고 여기에 삶은 달걀이나 삶은 메추리알도 함께 넣고는 볶아 줍니다. 메추리알이 매운 맛을 잡아 줄 수도 있다지요.', 'image_url': 'https://recipe1.ezmember.co.kr/cache/recipe/2016/07/27/fd4f874569b069edede7cf485fada6991.jpg'}, {'step_number': 11, 'description': '오징어가 익고 당근이 익었다면 완성입니다. 이제 마지막으로 참기름 한방울 떨어뜨려서 마무리합니다. \n참기름을 넣은 후에는 반드시 불을 꺼주셔야 산화되어서 향이 날라가지 않습니다.', 'image_url': 'https://recipe1.ezmember.co.kr/cache/recipe/2016/07/27/421f1c515dc31e7cfaa9fe5cf7158fed1.jpg'}, {'step_number': 12, 'description': '매콤하면서도 단맛이 도는 오징어볶음 완성이죠. 이제 밥에 올려서 덮밥으로 먹으면 되죠.', 'image_url': 'https://recipe1.ezmember.co.kr/cache/recipe/2016/07/27/1ef69b90ccf0c52f1f81f05f40b1457c1.jpg'}, {'step_number': 13, 'description': '완성접시에 밥 올리고는 오징어볶음 올려 놓고 통깨 솔솔 뿌려 놓으면 끝!!!', 'image_url': 'https://recipe1.ezmember.co.kr/cache/recipe/2016/07/27/374014d4aa9e2478374275961364e9ea1.jpg'}]"
71444,밥/죽/떡,일상,해물류,볶음,#해산물요리 #덮밥요리 #오징어덮밥만들기 #오징어볶음덮밥 매콤하게 볶아낸 오징어볶음에 밥을 비벼서 먹는 일품요리!!,오징어덮밥,https://recipe1.ezmember.co.kr/cache/recipe/2018/06/04/c8c83cde4061daeb74d9295eb53191561.jpg,"3,003",60분 이내,초급,2인분,"[('오징어', '1마리'), ('배추', '3장'), ('대파', '1/3대'), ('청양고추', '1개'), ('당근', '1/3개'), ('애호박', '1/3개'), ('양파', '1/2개'), ('고추장', '1큰술'), ('고춧가루', '1큰술'), ('베트남매운소스', '1작은술'), ('액젓', '1큰술'), ('꿀', '1큰술'), ('청주', '1큰술'), ('후추', '1t'), ('다진마늘', '1작은술'), ('다진생강', '1t'), ('참기름', '1t'), ('통깨', '1t')]","애호박과 당근, 양파 등의 채소를 넣고 양념해서 재워 놓은 뒤에 먹기 직전에 볶아서 내 놓은 매콤한 오징어볶음덮밥입니다.","[{'step_number': 1, 'description': '재료들을 준비합니다. 우선 오징어를 빼고 들어가는 재료들은 당근, 양파, 배추, 대파, 청양고추, 그리고 애호박이예요. 직사각형의 모양으로 서로사로 비슷한 크기로 큼지막하게 썰어서 준비합니다. 배추가 없으시면 패쑤~~', 'image_url': 'https://recipe1.ezmember.co.kr/cache/recipe/2018/06/04/ceb9908b69dfe51fa8231cdf9c355da11.jpg'}, {'step_number': 2, 'description': '이제 오징어도 비슷하게 직사각형으로 썰어서는 함께 투하합니다.', 'image_url': 'https://recipe1.ezmember.co.kr/cache/recipe/2018/06/04/3be84487ffd2eb0c9b939623ad0908211.jpg'}, {'step_number': 3, 'description': '먼저 미리 양념을 해서 냉장고 재워 놓으려고 합니다. 고추장, 다진마늘, 다진생강을 넣어 주고요.', 'image_url': 'https://recipe1.ezmember.co.kr/cache/recipe/2018/06/04/0a48a241691849438fc7fc03422e57d01.jpg'}, {'step_number': 4, 'description': '고춧가루와 액젓, 후추, 청주이나 맛술, 꿀, 여기에 매콤한 맛을 추가하기 위해서 베트남에서 사온 매운소스를 추가로 넣어 주었습니다.', 'image_url': 'https://recipe1.ezmember.co.kr/cache/recipe/2018/06/04/149d1a722307f17cf3e2606a37f81f781.jpg'}, {'step_number': 5, 'description': '조물조물 양념이 잘 섞이도록 무친 후에 용기에 담아서는 냉장고에 잠시 넣어 둡니다. 양념이 잘 스며들도록요.', 'image_url': 'https://recipe1.ezmember.co.kr/cache/recipe/2018/06/04/affb5c6cd3fffc39a7064f591216a5771.jpg'}, {'step_number': 6, 'description': '2시간 정도 재워 놓았던 오징어불고기이자 양념한 오징어볶음재료들을 달궈진 팬에 기름 두르고 볶아 줍니다.', 'image_url': 'https://recipe1.ezmember.co.kr/cache/recipe/2018/06/04/6e06fa54a7fbb60147dd42aa2a48141a1.jpg'}, {'step_number': 7, 'description': '오징어가 익고 딱딱한 재료들이 다 익었다면 끝이죠. 마지막으로 참기름을 둘러 주고는 불을 끄시면 됩니다.', 'image_url': 'https://recipe1.ezmember.co.kr/cache/recipe/2018/06/04/5d24c06bccf6160943ec27d9a1e824901.jpg'}, {'step_number': 8, 'description': '완성접시에 밥을 푸짐하게 담아 주고요.', 'image_url': 'https://recipe1.ezmember.co.kr/cache/recipe/2018/06/04/69db6044431445a8d7689631dcc160381.jpg'}, {'step_number': 9, 'description': '상추 위에 완성된 오징어볶음을 올려 줍니다.', 'image_url': 'https://recipe1.ezmember.co.kr/cache/recipe/2018/06/04/c9cbc55f372ca881743ec61a856a13a31.jpg'}, {'step_number': 10, 'description': '그리고 통깨를 솔솔 뿌려서 마무리를 해주면 매콤하면서도 자꾸만 자꾸만 손이 가는 오징어볶음덮밥이 완성되었습니다.', 'image_url': 'https://recipe1.ezmember.co.kr/cache/recipe/2018/06/04/a69cb9b62086e8ce4c6c856b4c89a4fe1.jpg'}]"
71445,밥/죽/떡,일상,해물류,볶음,새우볶음밥 냉동 칵테일 새우로 만들기,새우볶음밥,https://recipe1.ezmember.co.kr/cache/recipe/2019/04/01/321f375261842e6bd0ff16f3ac7884921.jpg,"5,047",15분 이내,초급,1인분,"[('냉동 칵테일 새우', '적당량'), ('밥', ''), ('양파', ''), ('호박', ''), ('당근', ''), ('대파', ''), ('솔트', ''), ('굴소스', ''), ('소금', ''), ('달걀', ''), ('기름', '')]",저에게도 월요병이 왔나 봅니다. 아침에 일어나는 것이 어찌나 힘들던지 어제 작품(?) 활동을 너무 열심히 한 탓인지.... 아니면 봄을 타는 것인지 컨디션이 별로네요. 낮에 안자던 쪽잠도 살짝 자야 하루를 견디니 슬쩍 나이 탓(?)을 해봅니다. 오늘의 메뉴는 새우볶음밥입니다. 주말에 한그릇요리로 볶아서 김치만 놓고 먹었지요. ​,"[{'step_number': 1, 'description': '냉동 칵테일 새우입니다. 미리 꺼내놓아서 해동 후에 솔트를 뿌려서 밑간을 해줍니다.', 'image_url': None}, {'step_number': 2, 'description': '채소는 자투리 채소입니다. 기본적인 냉장고에 있는 재료들이죠. 대파, 양파, 당근, 호박을 잘게 다져줍니다.', 'image_url': None}, {'step_number': 3, 'description': '파기름을 내주기 위해 기름과 파를 먼저 넣고 볶아줍니다.', 'image_url': None}, {'step_number': 4, 'description': '파기름에 채소와 새우를 넣고 볶아주다가 밥 한공기를 넣어줍니다.', 'image_url': None}, {'step_number': 5, 'description': '굴소스 반스푼과 소금 조금 넣어서 간을 맞췄습니다. 한그릇음식 새우볶음밥 완성~ 이라고 하기엔 뭔가 섭섭하죠?', 'image_url': None}]"
71446,밥/죽/떡,일상,해물류,볶음,새우볶음밥 만드는 법,새우볶음밥,https://recipe1.ezmember.co.kr/cache/recipe/2015/07/22/ef1e94de1b809f02cde2607fffc32e27.jpg,"17,700",15분 이내,초급,2인분,"[('밥', '2공기'), ('칵테일새우', '16마리'), ('다진양파', '1큰술'), ('다진 당근', '1큰술'), ('다진 피망', '1큰술'), ('가스오부시', '1큰술'), ('흑임자', '조금'), ('혼다시', '1.5작은술'), ('굴소스', '2/3큰술'), ('올리브유', '1큰술')]",새우볶음밥은 재료보다는 양념만 잘 선택하면 외식에서 즐기는 맛보다 더 멋진 맛을 즐길 수 있답니다. 간단하면서 맛깔나게 만들어볼까요.,"[{'step_number': 1, 'description': '양파, 당근, 피망은 곱게 칼질을 합니다.', 'image_url': 'https://recipe1.ezmember.co.kr/cache/recipe/2015/07/22/69a8542f60f1abd37ae04e7d9bbb65b31.jpg'}, {'step_number': 2, 'description': '칵테일 새우를 준비합니다.', 'image_url': 'https://recipe1.ezmember.co.kr/cache/recipe/2015/07/22/c441734511c8fca3e462524dee245beb1.jpg'}, {'step_number': 3, 'description': '살짝 달군 팬에 식용유를 두르고 채소와 칵테일새우를 넣고 볶습니다. 새우가 익을 무렵에 혼다시를 넣습니다.', 'image_url': 'https://recipe1.ezmember.co.kr/cache/recipe/2015/07/22/f4b2295365e3072effcb92d3654ab9251.jpg'}, {'step_number': 4, 'description': '혼다시를 넣고 살짝 볶은 다음 굴소스를 넣고 양념을 버무린 후 밥을 넣어서 재료들이 잘 섞이도록 약한 불에서 볶음을 합니다.', 'image_url': 'https://recipe1.ezmember.co.kr/cache/recipe/2015/07/22/8dc63a5de6bbbd1d99d6322b8afc604f1.jpg'}, {'step_number': 5, 'description': '재료들이 골고루 잘 섞이면서 볶음밥이 다 되면 불에서 내리고 그릇에 예쁘게 담아내면 새우볶음밥이 완성됩니다.', 'image_url': 'https://recipe1.ezmember.co.kr/cache/recipe/2015/07/22/7b80ce923eb955ae5450b5e65253c38f1.jpg'}]"
