index,종류별,상황별,재료별,방법별,글 제목,레시피이름,레시피이미지,조회수,조리시간,난이도,인분,재료,소개글,조리순서
162455,빵,초스피드,해물류,굽기,[2022 해양수산부 이달의 수산물 5월] 넙치버거,넙치버거,https://recipe1.ezmember.co.kr/cache/recipe/2022/09/30/00898958c7df4020793b561bcd13dd621.jpg,138,20분 이내,아무나,1인분,"[('넙치', '250g'), ('햄버거빵', '2개'), ('마요네즈', '3큰술'), ('스리라차', '1/2큰술'), ('오이', '1개'), ('적양파', '1/2개'), ('버터', '약간'), ('소금', '1/2작은술'), ('화이트식초', '3큰술'), ('밀가루', '1큰술'), ('후춧가루', '약간')]","해양수산부가 선정한 2022년 이달의 수산물 5월 레시피
집에서 간편하게 먹을 수 있는 첫번째 요리
""넙치버거"" 지금 만나러 가보겠습니다.","[{'step_number': 1, 'description': '넙치의 효능\n: 고단백, 저지방, 저칼로리 식품으로 콜라겐 함량이 많아 육질이 단단하고 씹는 맛이 좋다. 라이신이 많아 성장기 어린이에게 좋고, 소화가 쉬워 환자식으로도 도움이 된다.', 'image_url': 'https://recipe1.ezmember.co.kr/cache/recipe/2022/09/30/e12cf400b7a24c64298503a9f83494431.jpg'}, {'step_number': 2, 'description': '재료를 준비합니다. \n: 넙치 250g, 햄버거빵 2개, 마요네즈 3큰술, 스리라차 1/2큰술, 오이 1개, 적양파 1/2개, 버터 약간, 소금 1/2작은술, 화이트식초 3큰술, 밀가루 1큰술, 후춧가루 약간', 'image_url': 'https://recipe1.ezmember.co.kr/cache/recipe/2022/09/30/c6de2d95259ee63a5b2718abac5246a31.jpg'}, {'step_number': 3, 'description': '손질된 넙치에 소금, 후추로 밑간을 한다.', 'image_url': 'https://recipe1.ezmember.co.kr/cache/recipe/2022/09/30/f175a044073c476d1deea152b11097cc1.jpg'}, {'step_number': 4, 'description': '밑간한 넙치 앞,뒤로 밀가루를 골고루 묻힌다.', 'image_url': 'https://recipe1.ezmember.co.kr/cache/recipe/2022/09/30/7a3b1e39df3b888ef0e606c4fe9734151.jpg'}, {'step_number': 5, 'description': '팬에 식용유를 두르고 넙치를 앞,뒤로 노릇하게 굽는다.', 'image_url': 'https://recipe1.ezmember.co.kr/cache/recipe/2022/09/30/2a29d04b8febc437ef381b1ec066f7ec1.jpg'}, {'step_number': 6, 'description': '먼저 버터를 녹인 후, 빵을 노릇하게 앞,뒤로 굽는다.', 'image_url': 'https://recipe1.ezmember.co.kr/cache/recipe/2022/09/30/0c6edce8eb3aa4958adad8e7ea65f5371.jpg'}, {'step_number': 7, 'description': '적양파는 슬라이스한다.', 'image_url': 'https://recipe1.ezmember.co.kr/cache/recipe/2022/09/30/de87e042d61728b8a24bc7d5d3a14aed1.jpg'}, {'step_number': 8, 'description': '오이는 필러로 얇게 슬라이스한다.', 'image_url': 'https://recipe1.ezmember.co.kr/cache/recipe/2022/09/30/9e596b612e67233f5ccdb98fb90426a71.jpg'}, {'step_number': 9, 'description': '볼에 손질한 오이-적양파를 넣고,', 'image_url': 'https://recipe1.ezmember.co.kr/cache/recipe/2022/09/30/c5fc1e1bea56551b251d3ae3aff81c0a1.jpg'}, {'step_number': 10, 'description': '화이트 식초-소금-후추를 넣고 버무린다.', 'image_url': 'https://recipe1.ezmember.co.kr/cache/recipe/2022/09/30/271676cddce6ac6be72b76601aeb6c081.jpg'}, {'step_number': 11, 'description': '소스재료를 잘 섞어서 만든다.', 'image_url': 'https://recipe1.ezmember.co.kr/cache/recipe/2022/09/30/ecddcce21120491dd6aa8311c54ea9111.jpg'}, {'step_number': 12, 'description': '빵에 소스를 전체적으로 잘 바른 다음에', 'image_url': 'https://recipe1.ezmember.co.kr/cache/recipe/2022/09/30/3f7dcb72ef9e01f03ff823d8fc3f5f491.jpg'}, {'step_number': 13, 'description': '구운 넙치-오이-적양파 순으로 올리고 빵을 덮어 마무리한다.', 'image_url': 'https://recipe1.ezmember.co.kr/cache/recipe/2022/09/30/db85c5690f15f82735af385974b4f2eb1.jpg'}]"
162456,빵,초스피드,해물류,굽기,새우살 또띠아 피자~*,새우살또띠아피자,https://recipe1.ezmember.co.kr/cache/recipe/2020/02/01/861f8421a60c630693f616240ae5c9661.jpg,"1,294",15분 이내,아무나,1인분,"[('새우살', ''), ('또띠아', '1'), ('모짜렐라치즈', ''), ('로제스파게티소스', '')]",간식 새우 또띠아 피자,"[{'step_number': 1, 'description': '또띠아에 스파게티소스를\n펴 바른다', 'image_url': 'https://recipe1.ezmember.co.kr/cache/recipe/2020/02/01/f28116ffb94c02e5c714f58b141d015d1.jpg'}, {'step_number': 2, 'description': '모짜렐라치즈 취향껏\n올려 준다', 'image_url': 'https://recipe1.ezmember.co.kr/cache/recipe/2020/02/01/dc79dfb787370a9fc01c142a5ce20f751.jpg'}, {'step_number': 3, 'description': '새우살도 취향껏 올려 주고', 'image_url': 'https://recipe1.ezmember.co.kr/cache/recipe/2020/02/01/93856cfa01cfb21de612c026dea661531.jpg'}, {'step_number': 4, 'description': '180° 온도에서 노릇하게\n구워 주면 완성', 'image_url': 'https://recipe1.ezmember.co.kr/cache/recipe/2020/02/01/9b1a60ba810bd9574f6475a922b447d01.jpg'}]"
162457,빵,초스피드,해물류,굽기,영양만점 바지락 토스트,바지락토스트,https://recipe1.ezmember.co.kr/cache/recipe/2018/06/10/3a4812eccf1a5f6bd52370ee63a90dc11.jpg,540,15분 이내,초급,1인분,"[('바지락살', '60g'), ('양파', '1/4개'), ('당근', '40g'), ('식빵', '1장'), ('달걀', '1개'), ('케찹', '약간'), ('슬라이스치즈', '1장'), ('모짜렐라치즈', '50g'), ('다진마늘', '1t')]","우리수산물 바지락살을 가지고 쉽게 만들수 있는 영양만점 바지락토스트 입니다.
기존에 햄 이나 가공식품을 이용해 만드는 토스트와 달리 바지락을 넣어 몸에도 좋고 쫄깃한 식감이 일품인 세오표 한끼 식사 입니다.
조리법도 쉽고 재료도 간단해서 10-15분 안에 뚝딱 완성할 수 있는 레시피 입니다.
혼밥하거나 집에서 요리하기 힘들 때 후다닥 만들어 먹을 수 있는 영양 가득 요리 입니다.","[{'step_number': 1, 'description': '프라이팬에 양파와 당근을 넣고 볶습니다. \n(집에 있는 다른 채소 대체가능)', 'image_url': 'https://recipe1.ezmember.co.kr/cache/recipe/2018/06/10/47737be557bfc463c740608a491c84851.jpg'}, {'step_number': 2, 'description': '어느정도 채소가 익으면 바지락 살과 다진 마늘을 넣고 볶습니다.(집에 남은 소주가 있으면 1T-2T 넣어주세요, 바지락의 비린내를 날려 버릴 수 있습니다.)', 'image_url': 'https://recipe1.ezmember.co.kr/cache/recipe/2018/06/10/994e24b58d92d407119753b5c688b6211.jpg'}, {'step_number': 3, 'description': '바지락+채소가 볶아지는 동안 달걀+식빵을 묻혀 프라이팬에 구워줍니다.', 'image_url': 'https://recipe1.ezmember.co.kr/cache/recipe/2018/06/10/3828ac71c378dd81d088b2a61798bd871.jpg'}, {'step_number': 4, 'description': '노릇하게 구워진 식빵에 슬라이스 치즈를 올려줍니다.', 'image_url': 'https://recipe1.ezmember.co.kr/cache/recipe/2018/06/10/b756d94d9dd6d54004e582044d22dc1b1.jpg'}, {'step_number': 5, 'description': '그 사이 다 익은 바지락+채소 볶음을 올려 줍니다.', 'image_url': 'https://recipe1.ezmember.co.kr/cache/recipe/2018/06/10/e0256897d614d52919f00afbf0e666dc1.jpg'}, {'step_number': 6, 'description': '모짜렐라 치즈를 얹고,', 'image_url': 'https://recipe1.ezmember.co.kr/cache/recipe/2018/06/10/9105cc329727f11f0f86ac5820bb99fa1.jpg'}, {'step_number': 7, 'description': '프라이팬 또는 오븐에 치즈가 익을 때 까지 잠시만 넣어줍니다.', 'image_url': 'https://recipe1.ezmember.co.kr/cache/recipe/2018/06/10/80d6b395a0c6099c9309640647fc557f1.jpg'}, {'step_number': 8, 'description': '위에 케찹을 올리고 먹기 좋게 썰어주면 \n쫄깃한 식감이 일품인 영양만점 바지락 토스트 완성!', 'image_url': 'https://recipe1.ezmember.co.kr/cache/recipe/2018/06/10/a18ce34817d654625d9405ce29a87d371.jpg'}]"
162458,빵,초스피드,해물류,굽기,참치또띠아 대신 명태또띠아,명태또띠아,https://recipe1.ezmember.co.kr/cache/recipe/2015/05/15/ac35f0b770e79cb181f002f5367bf56c1.jpg,"2,396",30분 이내,초급,1인분,"[('또띠아', ''), ('명태살', ''), ('야채', ''), ('요플레', ''), ('케찹', ''), ('머스타드', ''), ('사워크림', ''), ('크림치즈', ''), ('돈가스소스', ''), ('발사믹소스', ''), ('토마토소스', ''), ('홀그레인머스타드', '')]","보통은 참치또띠아를 많이 만들어 드시는데, 명태도 손질이 되어 있어서 손쉽게 또띠아가 되겠더라고요~ 그래서 명태또띠아 도전!","[{'step_number': 1, 'description': '또띠아반죽은 옥수수가루나 밀가루로 반죽해서 만드시면 됩니다. 전 도토리가루 + 통밀가루 + 소금만 넣고 만들었어요. 만든 반죽 충분히 숙성시켜서 냉동실에 얼려두었던지라, 해동해서 덧밀가루 묻혀서 얇게 동글동글하게 밀어줬어요~', 'image_url': 'https://recipe1.ezmember.co.kr/cache/recipe/2015/05/26/59ab429ad8a7ceb2b5810a231efe5d381.jpg'}, {'step_number': 2, 'description': '달군 후라이팬에 완성된 또띠아반죽을 올리고 중약불 정도로 해서 구워 줍니다. 너무 약한불에 구우면 부풀어 오르지 않으니까 중약불정도로 해주세요.', 'image_url': 'https://recipe1.ezmember.co.kr/cache/recipe/2015/05/26/4a5a1a1a0069c7389a6b5b3c989a6e511.jpg'}, {'step_number': 3, 'description': '명태살은 살만 있기 때문에 바로 구워주면 됩니다~ 비정제 코코넛오일 두르고 소금간이 안 되어 있어서 깨소금 뿌려줬어요. 취향에 따라 돈가스소스나 굴소스에 버무리셔도 무방합니다. \n명태향에 민감하신 분들은 소주에 살짝 담가두었다 구우시면 좋을 것 같아요. \n명태는 모양이 있는 형태로 또띠아에 넣어도 되지만 그냥 으깨줬어요. 취향에 따라 해주세요.', 'image_url': 'https://recipe1.ezmember.co.kr/cache/recipe/2015/05/26/3d5d3708d3122b6e480e3f68c20ca7671.jpg'}, {'step_number': 4, 'description': '원하는 채소를 씻어서 물기 빼서 먹기좋게 잘라 준비해줍니다. 그 다음 마요네즈 준비해요.', 'image_url': 'https://recipe1.ezmember.co.kr/cache/recipe/2015/05/26/a47c9a360ee05bb643e9f3b7ab21541e1.jpg'}, {'step_number': 5, 'description': '마요네즈에 머스타드 맛을 내기 위해 냉면에 넣는 연겨자를 살짝 섞었어요~ .케찹, 머스타드, 사워크림, 크림치즈, 요플레, 돈가스소스, 발사믹소스, 토마토소스, 홀그레인 머스타드 등 좋아하는 소스류 준비합니다.', 'image_url': 'https://recipe1.ezmember.co.kr/cache/recipe/2015/05/26/9689db09f8d2789532ebe7a00ca5f06e1.jpg'}, {'step_number': 6, 'description': '이제 소스가 완성되었으면 또띠에 메인 소스를 발라주세요. 메인 소스는 유지류 + 간이 되어 있는 소스를 발라주는 것이 좋아요. 예를들면 마요네즈, 머스타드같은 거요. \n바로 드실꺼면 아무거나 발라주세요. 그 다음 아까 준비한 재료들을 올려주시고요. 저는 케일 -> 명태 -> 토마토 소스 -> 발사믹소스 순으로 올렸어요. 그리고 좋아하는 소스 마구 넣어주세요. 말아서 먹으면 끝!', 'image_url': 'https://recipe1.ezmember.co.kr/cache/recipe/2015/05/26/e7d0c10964f348dd73e9a664834bba4d1.jpg'}]"
