index,종류별,상황별,재료별,방법별,글 제목,레시피이름,레시피이미지,조회수,조리시간,난이도,인분,재료,소개글,조리순서
41533,메인반찬,영양식,돼지고기,조림,돼지고기안심무조림 콜라비요리 가을무활용요리,돼지고기안심무조림,https://recipe1.ezmember.co.kr/cache/recipe/2023/10/29/1a9f21ab02cb58850feb42b79f79bafa1.jpg,"1,024",60분 이내,아무나,3인분,"[('돼지고기', '300g'), ('콜라비                                                                                300g', '1/2쪽'), ('대파', '1대'), ('양파', '1/2쪽'), ('통마늘', '10개'), ('생강', '약간'), ('청양고추', '3개'), ('물', '700ml'), ('조림간장', '10수저'), ('매실청', '3수저'), ('설탕', '1수저'), ('맛술', '3수저'), ('참기름', '2수저'), ('후추', '약간')]",지금 한창 제철인 콜라비는 겉은 단단하고 무보다 달고 맛있어 조림이나 생채로 많이 해먹는데 오늘은 돼지고기와 콜라비를 넣고 단짠하게 조림을 만들었어요 콜라비는 칼로리도 낮고 식이섬유도 많아 고기와 같이 먹으면 소화도 잘 되고 비타민도 많이 섭취할수 있는 채소입니다,"[{'step_number': 1, 'description': '색도 너무 이쁜 보랏빛콜라비 무보다 달고 맛있어서 그냥 입 심심할때 깍아먹으니 개운하니 맛있더라구요', 'image_url': 'https://recipe1.ezmember.co.kr/cache/recipe/2023/10/29/6388a731857d8ea00499e325bb4ade531.jpg'}, {'step_number': 2, 'description': '재료준비 돼지고기안심300g, 콜라비반쪽 ,양파반쪽, 대파1대, 통마늘10개, 청양고추3개, 콜라비와 양파, 대파는 먹기좋게 썰어주세요 청양고추는 쫑쫑 설어주세요도마 , 조리용나이프', 'image_url': 'https://recipe1.ezmember.co.kr/cache/recipe/2023/10/29/1f8270810abe8b5c72c4fafe6459a1161.jpg'}, {'step_number': 3, 'description': '돼지고기를 냄비에 넣고 물을 잠길만큼 붓고 겉에만 익을정도로 살짝 데쳐주세요(식초1수저넣고) 데친물은 버리고 물700ml에 맛술3수저와 생강2~3쪽 넣고 뚜껑열고 10분정도 끓여주세요냄비', 'image_url': 'https://recipe1.ezmember.co.kr/cache/recipe/2023/10/29/9693e610c9e7de814716e0a8d5039b1f1.jpg'}, {'step_number': 4, 'description': '10분정도 끓인후 콜라비를 넣고 간장10수저 매실청3수저 설탕1수저 넣고 뚜껑덮어 약불로 15분정도 끓여주세요', 'image_url': 'https://recipe1.ezmember.co.kr/cache/recipe/2023/10/29/2d4d8ddc69976e1f56f287767f1275501.jpg'}, {'step_number': 5, 'description': '15분 끓인후 통마늘 대파 양파 넣고 뚜껑열어 쎈불로 10분 끓여주세요 이때 고기도 먹기좋게 가위로 잘라주세요요리집게 , 주방가위', 'image_url': 'https://recipe1.ezmember.co.kr/cache/recipe/2023/10/29/7d119ad15aa5708e4e63a335cec665741.jpg'}, {'step_number': 6, 'description': '다 조려지면 썰은 청양고추와 참기름 후추로 마무리해주세요요리스푼', 'image_url': 'https://recipe1.ezmember.co.kr/cache/recipe/2023/10/29/f91c4ff316ce5869db6bf7a335e709351.jpg'}, {'step_number': 7, 'description': '단짠단짠 잘 조려진 콜라비돼지고기조림 완성입니다 콜라비의 아삭함과 돼지고기의 부드럽고 담백함이 밥반찬으로 아주 그만입니다완성접시', 'image_url': 'https://recipe1.ezmember.co.kr/cache/recipe/2023/10/29/e5fe0c7c0867b508085062c78e935fb01.jpg'}]"
41534,메인반찬,영양식,돼지고기,조림,돼지고기시래기조림,돼지고기시래기조림,https://recipe1.ezmember.co.kr/cache/recipe/2017/01/12/8204e431ba01a2f77ca1036db77f16e81.jpg,"8,336",60분 이내,아무나,4인분,"[('돼지고기사태', ''), ('무청시래기', ''), ('청양고추', ''), ('대파', ''), ('된장', ''), ('고추장', ''), ('고춧가루', ''), ('다진마늘', ''), ('갈은생강', ''), ('청주', ''), ('후춧가루', ''), ('올리고당', ''), ('참기름', '')]",돼지고기와 시래기를 같이 넣어 만든 건강반찬요리!!,"[{'step_number': 1, 'description': '볼에 양념재료를 넣고 고루 섞어 줍니다', 'image_url': 'https://recipe1.ezmember.co.kr/cache/recipe/2017/01/12/020802cd9c42d0f01ee190919c65a0d31.jpg'}, {'step_number': 2, 'description': '무청시래기는 삶은후 충분히 물에 담구어둔후 건져서 줄기의 껍질을 벗겨 줍니다 \n(이렇게하면 좀 더 먹기에 부드러워요. 물론 그냥 다 드셔도 좋아요)\n적당한 길이로 썰고 양념장의 반을 넣은후 고루 버무려줍니다', 'image_url': 'https://recipe1.ezmember.co.kr/cache/recipe/2017/01/12/e0ccab4d36971b9e02cca976041b5de71.jpg'}, {'step_number': 3, 'description': '돼지고기 사태살은 먹기 좋은 두께로 썰어 줍니다\n볼에 담고 남은 양념장을 넣어서 고루 버무려 줍니다\n큰냄비에 무청시래기를 넣고 그 위에 양념한 돼지고기 올린후 물을 한컵정도 부은후 조려 줍니다', 'image_url': 'https://recipe1.ezmember.co.kr/cache/recipe/2017/01/12/774e9d47fabc1180edbd23a4573c51f91.jpg'}, {'step_number': 4, 'description': '끓기 시작하면 중불이하로 줄인후 졸이다가 거의다 국물이 조려들때쯤 준비한 대파와 청양고추도 넣어 줍니다\n한소끔 더 조린후 불을 끄고 참기름을 몇방울 떨어뜨린후 접시에 가지런히 담아냅니다', 'image_url': 'https://recipe1.ezmember.co.kr/cache/recipe/2017/01/12/7bfcf65ea8d5a43e93a3838efb9207a21.jpg'}, {'step_number': 5, 'description': '양념에 된장이 들어가니 그리 맵지 않으면서 구수하고 담백해요\n돼지고기 사태살이 부드러우면서도 씹는 맛이 아주 좋고, 무청시래기와 같이 먹으니 아주 맛있더군요\n밥에 얹어 먹어도 좋고, 밥에 넣어 비벼 드셔도 좋고, 아주 맛있어요^^\n시래기와 돼지고기는 아주 잘 어울리고, 이렇게 조림을 하여도 참 좋은것 같아요\n지방이 적은 돼지고기 사태살을 사셔서 조림요리 한번 만들어 보세요!!!', 'image_url': 'https://recipe1.ezmember.co.kr/cache/recipe/2017/01/12/67091e7567b6d2370ad50dfa0ac5695f1.jpg'}]"
41535,메인반찬,영양식,돼지고기,조림,돼지고기가 골뱅이를 만났어요.,돼지고기,https://recipe1.ezmember.co.kr/cache/recipe/2017/06/15/b3ba071260eac4d010a53ffac6be4deb1.jpg,"1,966",90분 이내,초급,4인분,"[('돼지고기 목살', '500g'), ('골뱅이통조림', '1통'), ('잣', '1큰술'), ('소금', '약간'), ('후추', '약간'), ('사과(소)', '1개'), ('전분', '1/2컵'), ('바베큐소스', '1컵'), ('매실청', '1/2컵'), ('진간장', '1작은술'), ('토마토케찹', '3큰술'), ('맛술', '1큰술'), ('다진마늘', '1큰술'), ('생강청', '1큰술'), ('양파즙', '3큰술'), ('후추', '약간')]","돼지고기와 골뱅이의 만남이 밤새 잠을 못 이루게했습니다.
레시피를 생각해 놓고 과연 어떤 맛일까 하는 생각에 결국 뜬 눈으로 아침을 맞았고
드디어 나만의 새로운 요리가...
사과즙을 사용 하여서 사과의 은은한 향과 달콤함, 골뱅이의 쫀득함이 입안을 즐겁게 해줍니다.","[{'step_number': 1, 'description': '돼지고기는 도마위에 가지런히 펴 놓고 키친타올로 핏기를 닦아 줍니다.', 'image_url': 'https://recipe1.ezmember.co.kr/cache/recipe/2017/06/15/7e071748ef2dfc63047a856588befa381.jpg'}, {'step_number': 2, 'description': '골뱅이 통조림은 체반에 받쳐 물기를 빼줍니다.', 'image_url': 'https://recipe1.ezmember.co.kr/cache/recipe/2017/06/15/d8488f8fbc0f0e7a51916a664712b7e81.jpg'}, {'step_number': 3, 'description': '고기위에 소금과 후추를 살짝 뿌려서 밑간을 해놓습니다.', 'image_url': 'https://recipe1.ezmember.co.kr/cache/recipe/2017/06/15/0b2b9646e060ed23df52d1b9fc51634d1.jpg'}, {'step_number': 4, 'description': '껍질을깐 사과는 강판에 갈아준후', 'image_url': 'https://recipe1.ezmember.co.kr/cache/recipe/2017/06/15/dcaa76d05bd22b9f70ff2e16a0c7d5c21.jpg'}, {'step_number': 5, 'description': '고기을 하나씩 넣고 사과즙을 고루 발라서 재워둡니다.\n(10~20분정도)', 'image_url': 'https://recipe1.ezmember.co.kr/cache/recipe/2017/06/15/9d86678d243699f41566e4f4ef57a1491.jpg'}, {'step_number': 6, 'description': '바베큐소스1컵,매실청1/2컵,토마토케첩3큰술,간장1작은술,생강청1큰술,맛술1큰술,양파즙3큰술,마늘1큰술,후추를 팬에 넣고 저어 줍니다.', 'image_url': 'https://recipe1.ezmember.co.kr/cache/recipe/2017/06/15/bfa322afc3b4f354ece1c084712be02c1.jpg'}, {'step_number': 7, 'description': '재운 고기는 도마에 반듯하게 펴 놓고 전분을 살짝 입혀 준후', 'image_url': 'https://recipe1.ezmember.co.kr/cache/recipe/2017/06/15/763a08553129264d009f10e94785e55f1.jpg'}, {'step_number': 8, 'description': '골뱅이 2~3개를 돼지고기 위에 놓고', 'image_url': 'https://recipe1.ezmember.co.kr/cache/recipe/2017/06/15/954cd1093686159d5ba2f53d2a53a9b81.jpg'}, {'step_number': 9, 'description': '끝부분 부터 돌돌 말아줍니다.', 'image_url': 'https://recipe1.ezmember.co.kr/cache/recipe/2017/06/15/40a0a6ef7ce35c1e4a54edd98f9df6191.jpg'}, {'step_number': 10, 'description': '양쪽 끝부분에 꼬지로 꿰메주고', 'image_url': 'https://recipe1.ezmember.co.kr/cache/recipe/2017/06/15/f884beeefed4f6aef607bf186ba459911.jpg'}, {'step_number': 11, 'description': '하나씩 돌돌 말아 놓습니다.', 'image_url': 'https://recipe1.ezmember.co.kr/cache/recipe/2017/06/15/467836dce3af00964488c31f81de10381.jpg'}, {'step_number': 12, 'description': '불을 켜고 소스가 끓기 시작하면', 'image_url': 'https://recipe1.ezmember.co.kr/cache/recipe/2017/06/15/930f98e94523f95feb1c8773e5f8967b1.jpg'}, {'step_number': 13, 'description': '말은 고기를 넣고\n끓여 주다가(강불) 고기가 익으면 두꼉을 닫고 조려줍니다.\n(중불 )', 'image_url': 'https://recipe1.ezmember.co.kr/cache/recipe/2017/06/15/7b2758182430c51a5111ed8babee8d7b1.jpg'}, {'step_number': 14, 'description': '수시로 소스를 고루 껴얹져 주면서 조려줍니다.(20~25분정도 불조절을 하면서 조려줍니다.)', 'image_url': 'https://recipe1.ezmember.co.kr/cache/recipe/2017/06/15/6c75e49d97fba7cde7d89c8caa42cf371.jpg'}, {'step_number': 15, 'description': '소스가 자작하게 졸여지면 (다시 강불에서 2분정도 조린후 )완성접시에 담고 한김 식은후 꼬지를 빼야 풀어지지 않습니다.', 'image_url': 'https://recipe1.ezmember.co.kr/cache/recipe/2017/06/15/138ccd2e43d4f070ce18b71429f6fc241.jpg'}, {'step_number': 16, 'description': '잣을 뿌려 줍니다.', 'image_url': 'https://recipe1.ezmember.co.kr/cache/recipe/2017/06/15/6d40b0d158b9efa09dd1bc8c11553d621.jpg'}, {'step_number': 17, 'description': '하나씩 개인 접시에서 잘라 먹습니다.', 'image_url': 'https://recipe1.ezmember.co.kr/cache/recipe/2017/06/15/428b74e0bae8f927f936c49d290c5d971.jpg'}]"
41536,메인반찬,영양식,돼지고기,조림,부추를 듬뿍 곁들인 통삼겹 조림,삼겹살조림,https://recipe1.ezmember.co.kr/cache/recipe/2015/08/05/1f33dfc73ba7d40a7a6680303ceb7b75.jpg,"12,322",90분 이내,중급,4인분,"[('통 삼겹살', '600g'), ('쌈야채', ''), ('생강', ''), ('계피', ''), ('통후추', ''), ('월계수잎', ''), ('양파', '1/2개'), ('통마늘', ''), ('청주', '약간'), ('맛술', '1컵'), ('레드 와인', '1Cup'), ('간장', '4T'), ('꿀', '2T'), ('발사믹식초                                                                                생략무방', '1T')]","동의보감에 ""돼지고기는 허약한 사람을 살찌게 하고 음기를 보한다"" 라고 했을 정도로 돼지고기는 보양식에 좋은 재료에요. 돼지고기와 궁합이 최고라는 부추를 듬뿍 곁들여 나른해 지기 쉬운 환절기 봄철 보양식으로 만들어 보세요.","[{'step_number': 1, 'description': '양파는 깨끗이 씻어 껍질채 준비해 주시고요. 돼지고기의 콜레스테롤을 다스리는 성분이 껍질에 많이 들어있거든요. 생강, 계피, 통후추, 월계수잎 준비했어요.', 'image_url': 'https://recipe1.ezmember.co.kr/cache/recipe/2015/08/05/99955a0ffe4c715b2ae4c07aae9c8a7b1.jpg'}, {'step_number': 2, 'description': '양파 반개는 얇게 슬라이스 해서 찬물에 담가 매운맛을 제거해 주세요.', 'image_url': 'https://recipe1.ezmember.co.kr/cache/recipe/2015/08/05/fbe24923264b5876690abd669300ba711.jpg'}, {'step_number': 3, 'description': '부추 반단 정도 먹기 좋게 썰어 찬물에 잠깐 담갔다가 바로 건지시고요. 돼지고기는 성질이 찬 식품이고 부추는 양성 식품이라 최고의 궁합을 자랑하잖아요.', 'image_url': 'https://recipe1.ezmember.co.kr/cache/recipe/2015/08/05/add817685c69fd34ba3963b6ddf25d071.jpg'}, {'step_number': 4, 'description': '물기 잘 제거해 주세요.', 'image_url': 'https://recipe1.ezmember.co.kr/cache/recipe/2015/08/05/ffc32960bb3c755d3dcb7f058da95a371.jpg'}, {'step_number': 5, 'description': '쌈야채도 준비하고요. 삼겹살과 함께 조릴 통마늘도 한줌 준비했어요.', 'image_url': 'https://recipe1.ezmember.co.kr/cache/recipe/2015/08/05/c58198c6dc37fa5775d35399955c88cc1.jpg'}, {'step_number': 6, 'description': '물을 넉넉하게 붓고 팔팔 끓기 시작하면 통삼겹을 넣어 주세요.', 'image_url': 'https://recipe1.ezmember.co.kr/cache/recipe/2015/08/05/f59413bf0d38388f28db275023d3e7011.jpg'}, {'step_number': 7, 'description': '준비한 향신채 모두 넣고 청주도 약간 넣습니다.', 'image_url': 'https://recipe1.ezmember.co.kr/cache/recipe/2015/08/05/6c56b5d21a705fbe053060731ac5936a1.jpg'}, {'step_number': 8, 'description': '통삼겹이 다 삶아졌으면 준비한 조림장에 넣고 끓입니다. 조림장에 후추 넉넉히 뿌려 주세요.', 'image_url': 'https://recipe1.ezmember.co.kr/cache/recipe/2015/08/05/05cfc8850efbef2797286605945e02ff1.jpg'}, {'step_number': 9, 'description': '처음에는 센불로 끓여 주시고요. 중불로 줄여 삶은 통삼겹을 앞뒤로 돌려 가면서 조립니다.', 'image_url': 'https://recipe1.ezmember.co.kr/cache/recipe/2015/08/05/d3e72c2a1bbe4352c4721052d8d8354f1.jpg'}, {'step_number': 10, 'description': '어느 정도 고기가 조려졌다 싶으면 통마늘 넣고요. 먹음직스러운 컬러가 전체적으로 돌면 완성. 남은 조림장은 약불로 뭉근하게 조려 소스로 만들어 뿌려 주시면 되요.', 'image_url': 'https://recipe1.ezmember.co.kr/cache/recipe/2015/08/05/a37d8a6d819ca9ac7fa3e7090b664c4f1.jpg'}]"
41537,메인반찬,영양식,돼지고기,조림,돼지갈비강정,돼지갈비강정,https://recipe1.ezmember.co.kr/cache/recipe/2015/06/08/6c55052a8d14bf35ed6940f901963f57.jpg,"11,208",2시간 이상,중급,4인분,"[('돼지갈비', '1kg'), ('유자청', '1큰술'), ('은행', '약간'), ('식용유', '적당량'), ('진간장', '3큰술'), ('양파', '1개'), ('마른고추', '1개'), ('파인애플주스', ''), ('생강', '1쪽'), ('소주', '3큰술'), ('핫소스', '2큰술'), ('후춧가루', '약간'), ('진간장', '2큰술'), ('야채육수', '1컵'), ('올리고당', '3큰술'), ('케찹', '5큰술'), ('생강', '1쪽')]",돼지고기 특히 돼지갈비 하면 찜요리 많이 생각하시죠? 전 찜요리 대신 돼지갈비를 가지고 강정을 만들어 봤어요. 달콤 짭조름한 맛이 한끼 식사로도 딱 좋네요.,"[{'step_number': 1, 'description': '돼지갈비는 1시간 정도 물에 담가 핏물을 빼주세요.(도중에 물을 2차례정도 바꿔주세요) 핏물이 빠진 돼지갈비는 갈비뼈 깊숙히 칼집을 넣고 기름을 제거해주세요. 그래야 담백한 강정이 만들어져요.', 'image_url': 'https://recipe1.ezmember.co.kr/cache/recipe/2015/08/27/3558de6e4fc885531c03974c8a0194471.jpg'}, {'step_number': 2, 'description': '밑양념 재료를 푸드프로세서에 넣고 갈아주세요.', 'image_url': 'https://recipe1.ezmember.co.kr/cache/recipe/2015/08/27/4faa4ae691a454f4ac843ebd8693494c1.jpg'}, {'step_number': 3, 'description': '돼지 갈비에 밑양념을 재워 1시간 이상 재워주세요. 파인애플 주스가 들어가서 고기가 연해져서 부드럽답니다.', 'image_url': 'https://recipe1.ezmember.co.kr/cache/recipe/2015/08/27/75ab7c0c509d16274ebbb6c98e32c2fe1.jpg'}, {'step_number': 4, 'description': '전골냄비를 이용해서 돼지갈비를 구울꺼랍니다. 앞뒤로 노릇노릇 구워주세요.', 'image_url': 'https://recipe1.ezmember.co.kr/cache/recipe/2015/08/27/d0ba240d34b33eb82f13d5e9f6c49ecd1.jpg'}, {'step_number': 5, 'description': '노릇노릇 잘 구워지면 (기름을 넉넉히 넣어 튀긴나는 느낌으로 구워주셔야 더 맛이 좋아요)', 'image_url': 'https://recipe1.ezmember.co.kr/cache/recipe/2015/08/27/2d66d86030572fd08a88185914b048a81.jpg'}, {'step_number': 6, 'description': '전골냄비에서 잘 익은 갈비를 체에 꺼낸 후 뜨거운물을 부어 기름기를 완전히 제거해주세요.', 'image_url': 'https://recipe1.ezmember.co.kr/cache/recipe/2015/08/27/c1b8fb3212d618682f9545522700e2131.jpg'}, {'step_number': 7, 'description': '강정소스를 만들어 주세요. 아. 맛있겠어요.', 'image_url': 'https://recipe1.ezmember.co.kr/cache/recipe/2015/08/27/a268061ca8183934494e7b53afb4c4ed1.jpg'}, {'step_number': 8, 'description': '전골팬에 슬라이스한 생강과 강정소스를 넣고 한소큼 끓어오르면', 'image_url': 'https://recipe1.ezmember.co.kr/cache/recipe/2015/08/27/bb2d63af2bb29285592e38155a22de7e1.jpg'}, {'step_number': 9, 'description': '돼지갈비강정을 넣어 20분정도 조려주세요.', 'image_url': 'https://recipe1.ezmember.co.kr/cache/recipe/2015/08/27/e70d7fea4213588a515b07ff7163c6411.jpg'}, {'step_number': 10, 'description': '10분정도 조려진 모습이랍니다. 보기만 해도 군침 되시지요?', 'image_url': 'https://recipe1.ezmember.co.kr/cache/recipe/2015/08/27/502c83bfe1f630ca9353d942c6f6f0931.jpg'}, {'step_number': 11, 'description': '국물이 거의 졸면 은행과 유자청을 넣어 주세요.', 'image_url': 'https://recipe1.ezmember.co.kr/cache/recipe/2015/08/27/1bc242a3608c2999ee3a0ba09c9a073a1.jpg'}, {'step_number': 12, 'description': '완전 맛이어보이네요. 배가 부른데도 침넘어가는 이유.', 'image_url': 'https://recipe1.ezmember.co.kr/cache/recipe/2015/08/27/51a2245c2a61444335a1d243cf77c4061.jpg'}, {'step_number': 13, 'description': '향긋한 유자향과 올리고당의 달콤함이 담백한 돼지갈비에 쏙. 둘이 먹다가 하나가 죽어도 모를 맛이네요.', 'image_url': 'https://recipe1.ezmember.co.kr/cache/recipe/2015/08/27/2dc0fdbcd332a9feca59cddd36162c4e1.jpg'}]"
41538,메인반찬,영양식,돼지고기,조림,#사과요리 #돼지고기요리 #돼지고기사과말이조림만들기 #돼지고기와 사과의 궁합 #간장돼지불고기양념만들기,간장돼지불고기,https://recipe1.ezmember.co.kr/cache/recipe/2019/12/14/b8aec6052ec27d87a7e655e3840473041.jpg,"5,044",30분 이내,초급,2인분,"[('돼지고기 불고기감', '300g'), ('소금', '조금'), ('후추', '조금'), ('사과', '1개'), ('양파', '1/2개'), ('양조간장', '4큰술'), ('매실액', '1큰술'), ('다진마늘', '1큰술'), ('후추', '1작은술'), ('청주', '1큰술'), ('생강즙', '1작은술'), ('돼지고기 불고기감', '300g'), ('양념', '4큰술'), ('사과', '1개'), ('전분가루', '1/2컵'), ('물', '1/2컵')]","돼지고기와 사과가 궁합이 잘 맞는다고 합니다.

그래서 예전에는 돈까스용 돼지고기 등심을 이용해서 사과를 돌돌 말아서

튀겨 주었거든요. 그럼 바삭바삭한 돈까스의 맛과 함께

속에서 사과즙이 툭하고 터지는 느낌이 정말 달콤하고 맛있었죠.

​

이번에는 좀더 다른 조리방법으로 돼지고기 불고기감으로 사과를 말아 주고는

사과와 양파 등등을 갈아서 만든 소스를 넣고

졸여 준 돼지고기사과말이 조림입니다.

​

처음에는 쌀을 믹서기에 갈아서 돼지고기사과말이를 입혀 준 후에

찜통에서 쪄낼까도 생각했었죠 ㅎㅎㅎ 그럼 정말 건강식이 되겠죠.

그건 다음으로 미루고 이번에는 살짝 구운 후에 푹 졸여 준 돼지고기사과말이조림입니다.

​","[{'step_number': 1, 'description': '먼저 양념부터 만들어 줍니다. 조림양념이지요. 사과와 양파를 갈아 줍니다.', 'image_url': 'https://recipe1.ezmember.co.kr/cache/recipe/2019/12/14/9a97cc66e25b674eac6311b1e8aebaf31.jpg'}, {'step_number': 2, 'description': '여기에 양조간장, 매실액, 청주, 후추, 다진마늘, 생강즙을 넣어서 잘 섞어 줍니다. 단맛은 사과과 양파가 담당하게 되지요. 살짝 간을 보시고 단맛을 추가하시고 싶으시다면 설탕을 넣어서 맞춰 주세요.', 'image_url': 'https://recipe1.ezmember.co.kr/cache/recipe/2019/12/14/cdc6b2dc7466f5a32d52bd0ab44fc8651.jpg'}, {'step_number': 3, 'description': '돼지 불고기감입니다. 소금 조금, 후추 조금 넣고 밑간을 미리 해 놓습니다.', 'image_url': 'https://recipe1.ezmember.co.kr/cache/recipe/2019/12/14/0c12c0d3ceb16027060fcfd3a698a3b41.jpg'}, {'step_number': 4, 'description': '사과는 조금 두껍게 썰어 준비합니다. 너무 얇게 썰면 돼지고기안에서 쉽게 물러 질 수 있기 때문입니다.', 'image_url': 'https://recipe1.ezmember.co.kr/cache/recipe/2019/12/14/815144d0df44a58daaa88a809496dbeb1.jpg'}, {'step_number': 5, 'description': '돼지고기에 사과를 올리고 돌돌 말아 줍니다.', 'image_url': 'https://recipe1.ezmember.co.kr/cache/recipe/2019/12/14/5dd2d00f8d18cad7c372998aa7b416921.jpg'}, {'step_number': 6, 'description': '그리고 풀리지 않도록 끝부분에 전분가루를 발라주고 마무리 합니다.', 'image_url': 'https://recipe1.ezmember.co.kr/cache/recipe/2019/12/14/4d7f48636b2299368eb8f76f54a516381.jpg'}, {'step_number': 7, 'description': '그리고는 전체적으로 전분가루를 입혀 줍니다. 살짝만 입혀 주세요. 구울때에 바삭바삭하고 쫀득한 식감을 위해서 입혀 주었습니다.', 'image_url': 'https://recipe1.ezmember.co.kr/cache/recipe/2019/12/14/9f7273261496f6f676730b26c920cd991.jpg'}, {'step_number': 8, 'description': '모두 다 말아 주었습니다. 이제 1차로 기름에 구워 줍니다.', 'image_url': 'https://recipe1.ezmember.co.kr/cache/recipe/2019/12/14/9d7b28b6cb37fd08b81d9f8754c777421.jpg'}, {'step_number': 9, 'description': '달궈진 팬에 기름 두르시고는 앞뒤로만 살짝 구워 주세요. 살짝 노릇노릇하게 구워주시면 됩니다.', 'image_url': 'https://recipe1.ezmember.co.kr/cache/recipe/2019/12/14/6f845ed50f44350374663f43f91d7d231.jpg'}, {'step_number': 10, 'description': '앞뒤로 살짝 노릇노릇해졌다면 이제 만들어 놓았던 양념을 넣어 줍니다. 그리고 물 반컵을 넣어서 뚜껑을 닫고는 중불에서 은근하게 졸여 줍니다.', 'image_url': 'https://recipe1.ezmember.co.kr/cache/recipe/2019/12/14/ad86bfc89057a9a988d9e0bef76b9c6c1.jpg'}, {'step_number': 11, 'description': '양념의 갈색빛이 돌면서 푹 졸여낸 돼지고기사과말이조림을 완성접시에 담아서는 쪽파 썬것을 살짝 위에 뿌려 줍니다. 단짠단짠한 돼지고기사과말이조림 완성입니다.', 'image_url': 'https://recipe1.ezmember.co.kr/cache/recipe/2019/12/14/421e0111325694988d97dc2dffbb02c91.jpg'}]"
