index,종류별,상황별,재료별,방법별,글 제목,레시피이름,레시피이미지,조회수,조리시간,난이도,인분,재료,소개글,조리순서
156819,양식,영양식,닭고기,끓이기,만레'요리교실) 이거 보면 누구나 가능해 (ง •̀_•́)ง 치킨크림스튜 ★,치킨크림스튜,https://recipe1.ezmember.co.kr/cache/recipe/2019/04/19/a17d113e0583903f1b224cec92e87ae71.jpg,"33,944",30분 이내,초급,2인분,"[('닭다리살', '250g'), ('감자', '1개'), ('당근', '1/2개'), ('양파', '1/2개'), ('양송이 버섯', '3개'), ('배춧잎', '1장'), ('시금치', '3줄'), ('식용유', '1숟가락'), ('소금', '약간'), ('후추', '약간'), ('닭육수', '2종이컵'), ('월계수잎', '1장'), ('버터', '2숟가락'), ('밀가루', '2숟가락'), ('우유', '1종이컵'), ('생크림', '1종이컵')]","스튜의 기본인 루까지 알려드리는 만요교 3탄 치킨 크림스튜 ★
어렵다고 시도조차 못하셨다면 만레's요리교실에서 알려드립니닷 'ㅅ'
세상의 모든 레시피 만개의레시피","[{'step_number': 1, 'description': '닭다리는 기름기를 제거하고 한입 크기로 잘라, 소금, 후추 밑간한다.', 'image_url': 'https://recipe1.ezmember.co.kr/cache/recipe/2019/04/19/5f53081f4b288458f5ae8a6ec342b82d1.jpg'}, {'step_number': 2, 'description': '양파,감자, 당근은 껍질을 벗겨 사방 3cm 크기 정도로 큼지막하게 자른다.\n양송이는 2등분하고, 배추는 2~3cm 크기로 자른다.', 'image_url': 'https://recipe1.ezmember.co.kr/cache/recipe/2019/04/19/32e2bd33ee1cb9992eda7f3500f431e41.jpg'}, {'step_number': 3, 'description': '시금치는 끓는 소금물에 데쳐서 찬물에 헹구고 물기를 짠다.', 'image_url': 'https://recipe1.ezmember.co.kr/cache/recipe/2019/04/19/57ede1bbde65f09ef22c5d34f2f03fd01.jpg'}, {'step_number': 4, 'description': '달군 팬에 기름을 두르고, 닭고기를 노릇하게 익혀서 꺼내 둔다.팬', 'image_url': 'https://recipe1.ezmember.co.kr/cache/recipe/2019/04/19/419d1d2e110675e9bbe5a54197aadb601.jpg'}, {'step_number': 5, 'description': '당근, 양파, 양송이를 넣고 센불에서 표면을 익혀 접시로 옮겨 둔다.', 'image_url': 'https://recipe1.ezmember.co.kr/cache/recipe/2019/04/19/08247294bf7a7feab8df32bdfdca1a121.jpg'}, {'step_number': 6, 'description': '크림 소스 만들기\n채소 볶았던 팬에 버터를 녹이고, 밀가루를 넣고 중약불로 타지 않도록 볶는다.\n데운 우유를 조금씩 넣고 잘 저으면서 끓여 농도가 생기도록 둔다.팬', 'image_url': 'https://recipe1.ezmember.co.kr/cache/recipe/2019/04/19/68057b37b7c2f7c7a29632f86a406f471.jpg'}, {'step_number': 7, 'description': '바닥이 두껍고 깊은 냄비에 당근, 감자, 양파, 양송이, 닭육수, 월계수잎을 넣고 중불에서 10분간 끓인다.냄비', 'image_url': 'https://recipe1.ezmember.co.kr/cache/recipe/2019/04/19/00be9b436288be82ff500833c6230c8d1.jpg'}, {'step_number': 8, 'description': '닭고기, 감자, 배추, 끓여 둔 크림 소스를 넣고 중불에서 뚜껑을 덮고, 5분 정도 끓인다.이때 농도가 너무 되직해 졌다면, 물을 조금 더 채워도 된다.', 'image_url': 'https://recipe1.ezmember.co.kr/cache/recipe/2019/04/19/6b7e92d05ca014317cdb0fd6f9fb26531.jpg'}, {'step_number': 9, 'description': '감자가 익었는지 확인하고, 생크림, 소금, 후추로 간하고 한소끔 끓인 뒤 불을 끄고 시금치를 넣는다.감자가 조금 덜 익었으면 2~3분 시간을 더 둔다.\n좋아하는 치즈를 조금 넣어도 좋다.', 'image_url': 'https://recipe1.ezmember.co.kr/cache/recipe/2019/04/19/b0bd5e2fc72769960ba1c979786b4c5b1.jpg'}]"
156820,양식,영양식,닭고기,끓이기,고정관념을 버리자! 화이트커리 white curry,화이트커리,https://recipe1.ezmember.co.kr/cache/recipe/2019/05/12/599ed37501ec78d59903aabe2161da101.png,"1,155",60분 이내,초급,3인분,"[('버터', '15g'), ('밀가루', '10g'), ('우유', '40ml'), ('감자', '2개'), ('당근', '1/3개'), ('브로콜리', '1/2송이'), ('닭가슴살', '2덩이'), ('우유', '300ml'), ('생크림                                                                                또는 휘핑크림', '200ml'), ('백후추                                                                                또는 흑후추', '8알'), ('월계수잎', '2장'), ('정향', '1개'), ('소금', '1큰술'), ('백미                                                                                200ml', '2계량컵'), ('물                                                                                200ml', '2계량컵'), ('큐민가루', '1작은술'), ('파프리카가루', '1작은술'), ('강황가루                                                                                또는 기성품카레가루', '2작은술')]","카레(커리)는 꼭 소스가 노란색이어야 할까? 라는 생각에서 시작된
레시피 였는데 여기저기 찾아보니 뭐 사람 생각이 똑같다고 이미 외국의
많은 분들이 만드셨더라구요
그래도 이왕 하는김에 내스타일데로 해보고 싶은 마음에 만들어 보았습니다
제 레시피에 유독 향신료가 많이 들어가서 곤란하실 분들이 많을것 같아요
없는건 과감하게 빼고 자신만의 스타일로 만드시면 더욱 좋을것 같습니다 :)","[{'step_number': 1, 'description': '화이트 루를 만들어 봅니다\n1. 약불에 냄비를 올린 뒤 버터를 녹여줍니다\n2. 버터가 다 녹으면 밀가루를 넣고 약 2분간 볶아줍니다\n3. 우유를 3번에 나눠서 넣고 섞어줍니다\n1번 넣고 30초 섞어주고 \n2번 넣고 30초 섞어주고 \n3번 넣고 30초 섞어주고\n4. 만들어진 루를 식혀줍니다냄비 ,  주걱약불계속 약불입니다\n루를 강한 불에 볶으면 색이 나버리니 주의하세요', 'image_url': None}, {'step_number': 2, 'description': '화이트 카레 재료를 준비합니다\n1. 감자는 껍질을 벗겨 큼직하게 잘라줍니다\n(약 20분 끓이니 커도 상관없습니다)\n2. 당근은 딱딱하니 감자보다 조금 더 작게 잘라도\n좋습니다\n3. 브로콜리는 줄기를 제거하고 봉오리 부분만\n한입크기로 잘라 준비합니다\n4. 닭가슴살은 약 8~10등분으로 잘라줍니다.\n5.칼 ,  도마', 'image_url': None}, {'step_number': 3, 'description': '화이트 카레를 끓입니다\n1. 냄비에 브로콜리를 뺀 나머지 감자, 당근, 닭가슴살\n후추를 넣고 우유를 부어 끓여줍니다\n2. 끓기 시작하면 월계수잎, 정향을 넣고 중불에서 15분\n끓여줍니다\n3. 크림을 넣고 끓기 시작하면 브로콜리를 넣습니다\n4. 소금 1큰술을 넣어 간을 해줍니다\n5. 다시 끓어오르면 만들어둔 화이트 루 10g (1/4을) \n넣고 잘 섞어줍니다\n6. 잘 풀어지면 또 10g (1/4을) 넣고 섞어주면 끝입니다냄비 ,  주걱화이트 루는 2번에 나눠 넣습니다 번거롭다 생각하시면 한방에 넣으셔도 괜찮습니다 만들어둔 루의 반을 넣으시면 됩니다', 'image_url': None}, {'step_number': 4, 'description': '밥짓기\n1. 불려둔 쌀을 솥에 넣고 물을 부어줍니다\n2. 카레가루, 큐민가루, 파프리카가루를 넣고 밥을 지어줍니다전기밥솥 또는 냄비 ,  냄비뚜껑냄비밥이 자신 없으면 전기밥솥이 좋습니다.', 'image_url': None}]"
