index,종류별,상황별,재료별,방법별,글 제목,레시피이름,레시피이미지,조회수,조리시간,난이도,인분,재료,소개글,조리순서
163504,빵,도시락,채소류,끓이기,도시락을 위한 감자 샐러드~감자 샌드위치 만들기★,감자샐러드샌드위치,https://recipe1.ezmember.co.kr/cache/recipe/2016/09/26/01dfba35944ef899f4ed5538a2ddd5c31.jpg,"6,803",60분 이내,초급,1인분,"[('흙애서 볶은아마란스', ''), ('흙애서 감자', '2개'), ('오이', ''), ('햄', ''), ('당근', ''), ('양파', '적당량'), ('소금', '약간'), ('후추가루', '약간'), ('마요네즈', '적당량'), ('우유', '조금')]","지금 추석 때 찐 2kg이 빠질 생각을 안하네요! 그래도 얼마 전에 
흙애서에서 구입 한 감자랑 아마란스 발견! 아마란스가 몸에 그렇게 좋잖아요? 
다이어트는 물론 건강 챙기기엔 굿! 상큼 새콤달콤하니 거기에 톡톡 식감까지 
더해진 아마란스와 포근 포근 햇감자로 아주 맛있는 샐러드를 완성해보았답니다. 
도시락을 위한 감자 샐러드~감자 샌드위치 만들기 시작~♪","[{'step_number': 1, 'description': '일단 아주 맛있고 다이어트에도 좋은 샐러드를 완성해보았답니다 :)', 'image_url': 'https://recipe1.ezmember.co.kr/cache/recipe/2016/09/26/8e3521b8419f73ece3bae372b25258bb1.jpg'}, {'step_number': 2, 'description': '그리고 요거트에 볶은 아마란스를 넣어 먹는 방법이에요. 요것도 톡톡 씹히는 식감이 너무나도 좋답니다ㅎㅎ', 'image_url': 'https://recipe1.ezmember.co.kr/cache/recipe/2016/09/26/0026daf1ebff777a67ecf011f99530171.jpg'}, {'step_number': 3, 'description': '그리고 감자샐러드드 만들기!\n1. 감자는 1cm 두께로 둥글게 잘라 전자레인지에 7분 정도 돌리고 익혀진 감자는 모두 으깨어 준비해 놓습니다! \n2. 그리고 오이와 양파, 햄, 당근은 모두 잘게 다져 준비해 놓으세요.\n3. 감자를 으깨놓은 볼에 오이와 양파, 햄, 당근을 넣고~\n4. 볶은 아마란스와 마요네즈, 소금, 후춧가루를 넣어 버무려줍니다. 이때 너무 팍팍하면 우유를 넣어가며 질기를 조절해요!전자레인지', 'image_url': 'https://recipe1.ezmember.co.kr/cache/recipe/2016/09/26/c9b3319c6a3789401fcbe9766bacfd0c1.jpg'}, {'step_number': 4, 'description': '이 감자샐러드를 식빵 한쪽에 충분히 올려주고 다시 식빵을 덮어주면 감자샐러드 샌드위치도 완성됩니다. 샌드위치는 먹기 좋은 크기로 썰어주면 끝!ㅎㅎ', 'image_url': 'https://recipe1.ezmember.co.kr/cache/recipe/2016/09/26/6a7b0bf14a8ccee795b70668938474e51.jpg'}, {'step_number': 5, 'description': '시금치 무침도 보너스로~', 'image_url': 'https://recipe1.ezmember.co.kr/cache/recipe/2016/09/26/7428eee5ef73847a4343279ddf69a2301.jpg'}]"
