index,종류별,상황별,재료별,방법별,글 제목,레시피이름,레시피이미지,조회수,조리시간,난이도,인분,재료,소개글,조리순서
151553,양념/잼/소스,일상,돼지고기,볶음,돼지고기소보로 만능소보로 만드는 법과 보관법,돼지고기소보로,https://recipe1.ezmember.co.kr/cache/recipe/2020/04/08/a9f9d9c25ef93510909f7ff5e04419cd1.jpg,"10,658",15분 이내,초급,6인분 이상,"[('돼지고기 다짐 육', '400g'), ('양념간장', '4큰술'), ('설탕', '1큰술'), ('청주', '2큰술'), ('다진 마늘', '1큰술'), ('다진 생강', '1/4작은술'), ('후추', '약간'), ('통깨', '1큰술')]","오늘은 며칠 전 이웃들과 점심으로 비빔밥 만들어 먹을 때

#돼지고기소보로를 만들었던 것을 올려봅니다
소보로를 만들어서 비빔밥에 올려주니 맛도 있고 조금은 고급스럽게 느껴지더라고요
비빔밥뿐 아니라 주먹밥이나 여러모로 잘 사용할 수 있는 소보로 만들었어요
​","[{'step_number': 1, 'description': '다짐육에 설탕 청주 다진 마늘을 넣어줍니다', 'image_url': 'https://recipe1.ezmember.co.kr/cache/recipe/2020/04/08/de9b2d20ce1d0139f0db11fb33e06d201.jpg'}, {'step_number': 2, 'description': '돼지고기의 잡내를 잡아줄 청주와 생강을 넣어주는데\n저는 다진 생강 대신 생강가루를 조금 넣고 설탕 후추도 넣어서 잘 섞어줍니다', 'image_url': 'https://recipe1.ezmember.co.kr/cache/recipe/2020/04/08/be10caf67832793afda92ac5117eeb1d1.jpg'}, {'step_number': 3, 'description': '팬에 기름 없이 양념한 다짐 육은 볶아줍니다\n센 불에서 뭉쳐있는 다짐육을 펼쳐주며 볶아줍니다\n처음 볶기 시작하면 돼지고기에서 수분이 많이 나오더라고요', 'image_url': 'https://recipe1.ezmember.co.kr/cache/recipe/2020/04/08/feede1ad3d1b5cffe284c512feb050731.jpg'}, {'step_number': 4, 'description': '센 불에서 볶다가 불을 중간 불로 줄이고 계속 볶다 보면 고기가 고슬고슬 해집니다\n잘 볶아지면 통깨를 조금 넣고 마무리해 줍니다', 'image_url': 'https://recipe1.ezmember.co.kr/cache/recipe/2020/04/08/40ab70a52f4e061f4cff943a1548f4f91.jpg'}, {'step_number': 5, 'description': '돼지고기소보로 볶아 놓고 나니 활용도도 많을 것 같아요\n소보로는 단짠단짠으로 만들어 놓으면 맛있어요\n저는 설탕을 조금 넣었지만 설탕과 간장을 조금 추가하셔도 괜찮을 것 같아요~!~~', 'image_url': 'https://recipe1.ezmember.co.kr/cache/recipe/2020/04/08/57d34276eef8d7b3f8885cc17c2fa1e01.jpg'}, {'step_number': 6, 'description': '우선 동생들 왔을 때 비빔밥에 넣어주니\n고기가 조금 들어갔다고 맛있는 것 같았어요', 'image_url': 'https://recipe1.ezmember.co.kr/cache/recipe/2020/04/08/9799b9196a847947126833d65a1e3b901.jpg'}, {'step_number': 7, 'description': '조금 넉넉히 만들어서 냉동실에 보관해두고 필요할 때 활용할 수 있는 #만능소보로입니다', 'image_url': 'https://recipe1.ezmember.co.kr/cache/recipe/2020/04/08/9d8bc51e21eb3a49a1133db11b16e6381.jpg'}, {'step_number': 8, 'description': '돼지고기 소보로 만능으로 활용할 수 있는 만능소보로 맛있게 만들 수 있는 법은\n돼지고기 잡내를 잡아주는 일 이지요\n청주와 생강으로 돼지고기 잡내 확실하게 잡아준 다음\n수분 없이 고슬고슬하게 볶아주는 것입니다', 'image_url': 'https://recipe1.ezmember.co.kr/cache/recipe/2020/04/08/bf457fa63e83a1e1133906315846f2d21.jpg'}, {'step_number': 9, 'description': '남은 소보로는 소분해서 냉동실에 보관하면 조금 더 오래 이용할 수 있겠지요~!~', 'image_url': 'https://recipe1.ezmember.co.kr/cache/recipe/2020/04/08/55a8617c3d1d5a85fed4b6fece56078f1.jpg'}, {'step_number': 10, 'description': '나물 돌려 담고 가운데에 소보로 올리면 맛있는 비빔밥도 완성됩니다', 'image_url': 'https://recipe1.ezmember.co.kr/cache/recipe/2020/04/08/9301a89c1cf40b4151507136a24dc31b1.jpg'}]"
151554,양념/잼/소스,일상,돼지고기,볶음,마파치에즈 (마파가지),마파가지,https://recipe1.ezmember.co.kr/cache/recipe/2017/04/19/03ec3f1b983763cc0193a9d23b9138721.jpg,"1,069",30분 이내,아무나,4인분,"[('가지                                                                                약 440g', '1.5~2개'), ('다진 돼지고기', '130g'), ('피망                                                                                약50g', '1/2개'), ('당근                                                                                약60g', '1/4개')]",칠리페이스트와 춘장을 넣은 마파가지용 소스,"[{'step_number': 1, 'description': '다진 돼지고기와 가지, 피망, 당근을 준비합니다.', 'image_url': 'https://recipe1.ezmember.co.kr/cache/recipe/2017/04/19/6a6e317c4d40916590edf8388f0dfa121.jpg'}, {'step_number': 2, 'description': '가지를 5~7cm 크기로 잘라 세로로 8~10등분 합니다.', 'image_url': 'https://recipe1.ezmember.co.kr/cache/recipe/2017/04/19/59370f1364ba5e99f51a8d9035f5306c1.jpg'}, {'step_number': 3, 'description': '피망은 반으로 가른 후, 세로로 6~8등분 합니다.', 'image_url': 'https://recipe1.ezmember.co.kr/cache/recipe/2017/04/19/7b8e7e79327401304a34f40909e044211.jpg'}, {'step_number': 4, 'description': '당근은 1mm 정도 두께로 가지와 비슷한 크기가 되도록 손질합니다.당근 손질법 레시피\u200b', 'image_url': 'https://recipe1.ezmember.co.kr/cache/recipe/2017/04/19/568f1e9d1519861b7e48f911e781f3b01.jpg'}, {'step_number': 5, 'description': '달군 프라이팬에 식용유 3큰술을 넣고 중불에서 가지를 볶습니다.중불', 'image_url': 'https://recipe1.ezmember.co.kr/cache/recipe/2017/04/19/dae82095e710e72ed7d6134eab9f534e1.jpg'}, {'step_number': 6, 'description': '가지가 노릇해지면 당근과 피망을 넣고 약불에서 익힌 후, 그릇에 덜어 놓습니다.약불', 'image_url': 'https://recipe1.ezmember.co.kr/cache/recipe/2017/04/19/b4a9eee789c51e566884966fe2da75871.jpg'}, {'step_number': 7, 'description': '중불에서 다진 돼지고기를 볶습니다.중불', 'image_url': 'https://recipe1.ezmember.co.kr/cache/recipe/2017/04/19/19edd0fcf0a6de28f0874cbc503e4f101.jpg'}, {'step_number': 8, 'description': '고기가 익으면 일단 불을 끄고 [CooK Do®] 마파가지용 소스를 넣어 중불에 섞이도록 볶습니다.중불', 'image_url': 'https://recipe1.ezmember.co.kr/cache/recipe/2017/04/19/af40d62762621c034ec417d27a7e4fc41.jpg'}, {'step_number': 9, 'description': '소스에 볶은 고기(Step8)와 볶아둔 채소(Step6)를 넣고 함께 볶으면 완성!중불', 'image_url': 'https://recipe1.ezmember.co.kr/cache/recipe/2017/04/19/89299fa813cd6d0d4c8ce26592f9e7f11.jpg'}]"
151555,양념/잼/소스,일상,돼지고기,볶음,"집밥 백선생2, '드라이카레' 카레베이스 레시피!",드라이카레,https://recipe1.ezmember.co.kr/cache/recipe/2016/05/18/0b09cf46434b27845ae2084e00cb2a5b1.jpg,"5,585",15분 이내,아무나,4인분,"[('다진돼지고기                                                                                약 400g', '2종이컵'), ('양파', '1개'), ('당근', '1/3개'), ('간마늘', '1T'), ('카레', '1봉지'), ('간마늘', '1T'), ('소금', '1/3T'), ('후추', '1/2t'), ('식용유', '1/4컵')]","지난 집밥 백선생 방송에서는, '카레'활용 레시피를 알려줬는데요~ 이번 레시피는 모든 카레요리의 베이스가 되는 '드라이카레' 요리 방법입니다. 활용도 높은 '드라이카레'로 여러가지 카레요리에 도전해보세요!","[{'step_number': 1, 'description': '재료를 준비해주세요. 고기는 다진돼지고기를 사용합니다.', 'image_url': 'https://recipe1.ezmember.co.kr/cache/recipe/2016/05/18/3c8126982aa53a8fca47a8709b53d7411.jpg'}, {'step_number': 2, 'description': '양파 2컵 / 당근 1컵 양으로, 작게 썰어 준비합니다.', 'image_url': 'https://recipe1.ezmember.co.kr/cache/recipe/2016/05/18/02db8e1d4a69f7d37a35f40b8434138b1.jpg'}, {'step_number': 3, 'description': '약중불에 올린 팬에 식용유 1/4컵을 두릅니다.', 'image_url': 'https://recipe1.ezmember.co.kr/cache/recipe/2016/05/18/6a6b1516fdd4662ff84e50b92efcd9ff1.jpg'}, {'step_number': 4, 'description': '뭉치치 않도록 끊어주며 볶아주세요. 후추 반 티스푼 함께 넣고 볶습니다.', 'image_url': 'https://recipe1.ezmember.co.kr/cache/recipe/2016/05/18/00efb78aede22d686ada6524701414d31.jpg'}, {'step_number': 5, 'description': '고기에서 물이 꽤 나옵니다. 나머지 재료들을 모두 다 넣고 소금 1/3스푼 더해주세요. 불을 키워 수분을 날리며 볶습니다.', 'image_url': 'https://recipe1.ezmember.co.kr/cache/recipe/2016/05/18/399f35c052b32852340bb5d1bd724c9e1.jpg'}, {'step_number': 6, 'description': '물기가 다 사라질 때까지 바짝 볶아다가 카레가루 1봉지를 넣습니다.', 'image_url': 'https://recipe1.ezmember.co.kr/cache/recipe/2016/05/18/69c5c73870f3dc1ebe8661938f74e0bd1.jpg'}, {'step_number': 7, 'description': '잘 섞어 마무리합니다.', 'image_url': 'https://recipe1.ezmember.co.kr/cache/recipe/2016/05/18/e5d73a0cab5102d532c4b357d35882391.jpg'}]"
151556,양념/잼/소스,일상,돼지고기,볶음,#수요미식회 #유니짜장만들기 #옛날짜장만들기 #볶음밥과_함께_먹는_유니짜장밥!!!,유니짜장,https://recipe1.ezmember.co.kr/cache/recipe/2019/03/22/7b56a45345f6d6eb84b933adf96c7bc71.jpg,"12,716",30분 이내,초급,4인분,"[('돼지고기 다짐육', '500g'), ('양파', '2개'), ('주키니', '1/3개'), ('양배추', '1/6개'), ('볶은 춘장', '1.5개'), ('다진마늘', '1큰술'), ('썬파', '2큰술'), ('고춧기름', '2큰술'), ('다진생강', '1작은술'), ('청주', '2큰술'), ('꿀', '2큰술'), ('굴소스', '4큰술'), ('오이', '1/2개')]","유니짜장.... 간짜장,,,그냥 옛날짜장!! 도대체 뭐가 뭔지.

거기에 더해서 볶음짜장 ㅋㅋㅋ

​

짜장의 종류도 다양하게 변화하고 있습니다. 하지만 왠지 옛날짜장이 그리워지기도 해요.

유니짜장은 모든 재료들을 다 잘게 잘게 썰어서 볶은 춘장을 넣고 달달하게 꿀이나 카라멜소스를 넣어서 만드는 것인데요.

거기에 양파도 듬뿍 넣어 주고 주키니이자 돼지호박도 넣어 주고는

​

고명으로 오이채를 올린 옛날짜장이자 유니짜장밥입니다.

단!!! 밥은 그냥 밥이 아닌 그린빈스를 넣고 달걀 넣고 볶아낸 중국식 볶음밥입니다.","[{'step_number': 1, 'description': '준비한 재료들입니다. 양배추, 양파, 돼지고기다짐육, 볶아낸 춘장, 그리고 돼지호박이자 주키니입니다. 갑자기 드는 생각이 주키니 농사를 지으신 분들이 주키니가 팔리지 않아서 다 사장시켜 버렸다고 하시더라구요. 정말 안타까웠습니다. 주키니는 짬뽕을 할때에도 잘 쓰이고요. 그리고 각종 볶음요리에 활용해서 사용하시면 좋은 재료인데요. 애호박은 볶음요리에는 잘 맞지 않거든요. 단단하면서도 물기가 적어서 볶음이나 구이용으로도 잘 쓰이는 식재료인데 말이죠. 가격도 애호박에 비해서 저렴한 편이지요.', 'image_url': 'https://recipe1.ezmember.co.kr/cache/recipe/2019/03/22/bbf88fc827348ae9bef065acfdd8d08c1.jpg'}, {'step_number': 2, 'description': '모든 재료들을 모두모두 잘게 잘게 다져서 준비해 놓습니다. 그것이 유니짜장의 기본맛이기도 하고요.', 'image_url': 'https://recipe1.ezmember.co.kr/cache/recipe/2019/03/22/045b6d16d766e0c66be0f14d154bc6211.jpg'}, {'step_number': 3, 'description': '고춧기름을 넣어 주고 썬파와 다진마늘, 다진생강을 넣어서 볶아 줍니다. 요즘에 꽂힌 고춧기름이 불맛 향미유라고 하는데 이때에 그것을 알았다면 그것을 넣었을텐데 아쉽게도 그냥 고춧기름을 넣어 주었습니다.', 'image_url': 'https://recipe1.ezmember.co.kr/cache/recipe/2019/03/22/c0c21f9db74713dd0f18efcdc39650b91.jpg'}, {'step_number': 4, 'description': '가장 먼저 돼지고기 다짐육부터 볶아 줍니다. 회색빛이 돌때까지 잘 볶아 주세요. 중간에 청주나 독주,,,아니면 소주를 넣어서 잡내를 제거해 주시고요.', 'image_url': 'https://recipe1.ezmember.co.kr/cache/recipe/2019/03/22/9f7a666305c8792a61f73363c5db51b31.jpg'}, {'step_number': 5, 'description': '돼지고기가 다 볶아졌다면 이젠 나머지 준비한 재료들을 모두 투하해서는 볶아 줍니다.', 'image_url': 'https://recipe1.ezmember.co.kr/cache/recipe/2019/03/22/edbb0b68510c499c6ac6f95ab44716211.jpg'}, {'step_number': 6, 'description': '그리고 간이자 짜장소스인 볶아낸 춘장을 넣어 줍니다. 기존에 마트에서 시판되는 춘장을 사가지고는 기름 한컵 정도를 부어 주고 볶아 잽니다. 센불이면 반드시 춘장이 탈 수 있으니 충분히 달궈진 팬에 기름 넣어 주시고 튀기듯이 춘장을 넣고 중불에서 볶아 주세요. 그리고 체에 걸러서 기름을 빼주고 보관하시면 두고두고 짜장소스로 활용해서 쓰실 수 있습니다.', 'image_url': 'https://recipe1.ezmember.co.kr/cache/recipe/2019/03/22/98ea5b09e874d5668aebe069a539bd881.jpg'}, {'step_number': 7, 'description': '각종 재료에서 나오는 기름과 수분이 있기는 하지만 그래소 좀더 밥과 함께 먹기 위해서는 물이 필요한데요. 그냥 생수를 넣으셔도 되고요. 저는 닭유수를 넣어 주었습니다.', 'image_url': 'https://recipe1.ezmember.co.kr/cache/recipe/2019/03/22/8afe40d05ce7283326a2f5d9ef3610481.jpg'}, {'step_number': 8, 'description': '이제 드디어 농도를 맞춰 줄때가 된 것 같습니다. 모든 재료들을 잘게 다졌기 때문에 금방 익게 되거든요. 지금까지 시간적으로 생각했을때에 한 10분이 안 되었을까요. 중간 중간 사진을 찍느라고 멈춰서 시간이 오바했을 뿐이죠. 전분물을 만들어서는 조금씩 원을 그리면서 외곽부터 쭈욱 뿌려 줍니다. 그리고 계속해서 저어가면서 농도를 맞춰 줍니다. 걸쭉한 상태가 되면 불을 끄시고는 참기름을 한바퀴 둘러 주시면 끝!!!', 'image_url': 'https://recipe1.ezmember.co.kr/cache/recipe/2019/03/22/d7af057e7b84bd5d9d2008a40052d5bd1.jpg'}, {'step_number': 9, 'description': '밥은 그린빈스를 잘게 썰어서 밥과 함께 달걀 넣고 섞어 준 다음에 달궈진 팬에 기름 두르고 볶아 준 것입니다. 볶음밥에는 당연히 딸려 오는 짜장소스처럼요!!! 볶음밥과 유니짜장, 그리고 오이채를 올려 줍니다. 그럼 유니짜장 완성입니다.', 'image_url': 'https://recipe1.ezmember.co.kr/cache/recipe/2019/03/22/38a7a752abe700d6d826627d5315d8481.jpg'}]"
151557,양념/잼/소스,일상,돼지고기,볶음,"볶은 된장 다짐육,양념 고기 된장 만들기 (쌈,된장찌개 굿!)",고기된장,https://recipe1.ezmember.co.kr/cache/recipe/2019/07/31/a4113e6ba3e677b9135d8e1c74162f991.jpg,"6,625",20분 이내,아무나,2인분,"[('돼지고기다짐육', '100ml'), ('다진 마늘', '1/2수저'), ('쌈장', '2수저'), ('청양고추', '1개'), ('미림', '1/2수저'), ('후추', '약간')]","다짐 육 고기를 이용한 양념 된장을 만들었어요
쌈에 항상 빠지면 안 되는 고기라 
고기도 구워야 하고 이만저만 손이 많이 가는 게 아니라
하나로 만들어진 양념 고기 된장! 간편하고 먹기 쉬워 좋아요","[{'step_number': 1, 'description': '다짐 육 100ml 즉 머그컵 반컵, 분량과 다진 마늘, 쌈장 미림, 준비해 주시고 다짐 육이 먼저 마른 팬에 익혀 주세요\n고 기색이 하얗게 변하면 다진 마늘도 함께 볶아 주세요\n그리고 미림을 넣어 주세요약불', 'image_url': 'https://recipe1.ezmember.co.kr/cache/recipe/2019/07/31/98665ce2598d22fb072f5fb52b3f28411.jpg'}, {'step_number': 2, 'description': '그리고 쌈장을 넣어 주세요 지글지글 볶듯이 볶아 주시고 청양고추 잘게 썰은걸 넣어서 마지막으로 볶아내 주세요약불양파 다진걸 넣어도 좋아요', 'image_url': 'https://recipe1.ezmember.co.kr/cache/recipe/2019/07/31/55eafea7705d708a8468b6cef9201c941.jpg'}, {'step_number': 3, 'description': '양념 고기 된장 완성입니다!\n이거 하나만 있으면 쌈에 고기 부럽지 않아요!\n먹다 남으시면 강된장 할 때나 된장찌개 할 때 넣으셔도 됩니다!', 'image_url': 'https://recipe1.ezmember.co.kr/cache/recipe/2019/07/31/f50cf5f46b71621015bb8cb4a041b64f1.jpg'}]"
151558,양념/잼/소스,일상,돼지고기,볶음,돼지고기다짐육으로 만드는 약고추장 레시피!,약고추장,https://recipe1.ezmember.co.kr/cache/recipe/2020/10/24/39b692b65f4db9fa906114f34bd9793f1.jpg,"1,492",60분 이내,아무나,6인분 이상,"[('돼지고기 다짐육', '300g'), ('양파', '1/2개'), ('파', '1대'), ('마늘', '10알'), ('올리브유', '3~4큰술'), ('다진생강', '1/2작은술'), ('청주', '2큰술'), ('후추', '1/2작은술'), ('허브마늘솔트', '1/2작은술'), ('고추장 듬뿍', '7큰술'), ('매실액기스', '2큰술'), ('올리고당', '1큰술')]","코로나 때문과 이런저런 사정으로 남표니가 회사서 햇반을 돌려 반찬 대충 누가싸온거로 한끼를 해결한다길래~ 비벼먹을 약고추장을 만들어주기로 했어요~ 그런데보통 소고기로 하시는데 남표니가 소고기를 안좋아해서 돼지고기로 만들어보았습니다.

밥맛없을때 만들어놓고 계란후라이 얹어 고추장한술떠 챔기름넣고 쓱쓱 비비묵으면 없던 입맛도 돌아옵니당^^","[{'step_number': 1, 'description': '냉장육으로 사용했구요~\n고기에 청주 2큰술과 후추반작은술과\n허브마늘솔트 반작은술(생략가능)넣고 조물조물 밑간 해둡니다!', 'image_url': 'https://recipe1.ezmember.co.kr/cache/recipe/2020/10/24/93448962f66ef78066e2f901651911b61.jpg'}, {'step_number': 2, 'description': '양파반개 마늘10알 대파1대를 준비해주고', 'image_url': 'https://recipe1.ezmember.co.kr/cache/recipe/2020/10/24/4ce9117e84c283a348cc57af258a91c61.jpg'}, {'step_number': 3, 'description': '양파반개와 대파1대는 잘게 다져줍니다! 적당히 다질수 있는만큼만 다져주세요!', 'image_url': 'https://recipe1.ezmember.co.kr/cache/recipe/2020/10/24/005622eba9f0082db32653d6a75554281.jpg'}, {'step_number': 4, 'description': '마늘10알은 다져줍니다.', 'image_url': 'https://recipe1.ezmember.co.kr/cache/recipe/2020/10/24/e48c60f60e1a686d58564cbf477f754d1.jpg'}, {'step_number': 5, 'description': '냄비에 다진파와 양파를 담고 올리브유3~4큰술 정도 휘리릭 넣어주세요! 볶아질정도만 넣어주세요 넘많지않게!', 'image_url': 'https://recipe1.ezmember.co.kr/cache/recipe/2020/10/24/408d3c91ca52021a9ad13c1615db614b1.jpg'}, {'step_number': 6, 'description': '2분정도 중약불로볶다가 다진마늘 넣고, 2분정도볶아주세요!', 'image_url': 'https://recipe1.ezmember.co.kr/cache/recipe/2020/10/24/ef7c961e6db4dc8e8983181e5034c4161.jpg'}, {'step_number': 7, 'description': '2분볶았으면 밑간해둔 다짐육을 고루 펴서 뭉치지 않게 넣고 중불로 야채와 잘 어우러지게 볶아줍니다.\n요때 다진생강이 있다면 반작은술 넣어주세요. 없다면 패쓰!', 'image_url': 'https://recipe1.ezmember.co.kr/cache/recipe/2020/10/24/0363083128eb1cca0c4ef873ae636bc41.jpg'}, {'step_number': 8, 'description': '고기가 고루 잘 익었다면 고추장7큰술 듬뿍 넣어줍니다.\n고추장 잘 섞어준후', 'image_url': 'https://recipe1.ezmember.co.kr/cache/recipe/2020/10/24/8c76493ff635f590779a3348ef1a8dfb1.jpg'}, {'step_number': 9, 'description': '매실액기스2큰술 넣고', 'image_url': 'https://recipe1.ezmember.co.kr/cache/recipe/2020/10/24/c82813fcbc4f5af694193cf10e81dc7e1.jpg'}, {'step_number': 10, 'description': '올리고당 1큰술 넣고', 'image_url': 'https://recipe1.ezmember.co.kr/cache/recipe/2020/10/24/54d63312c1b55e8df524dbf63a2a745d1.jpg'}, {'step_number': 11, 'description': '잘 볶아줍니다. 어느정도 3분정도 저어가며 볶아준후 살짝 떠서 간을 봐준후 단맛이 부족하시면 기호에따라 올리고당을 추가해주시고 타지않게 적당히 2~3분 더볶아주시면 완성! 식혀서 통에 담으시면됩니다.', 'image_url': 'https://recipe1.ezmember.co.kr/cache/recipe/2020/10/24/fdf58249ab2d9a96d0f3f57cf89b38cb1.jpg'}]"
151559,양념/잼/소스,일상,돼지고기,볶음,직접만든 토마토소스에 30kcal콩담백면을 곁들였어요~,토마토소스면,https://recipe1.ezmember.co.kr/cache/recipe/2023/12/14/4b70b2f4eb07e25226bacf4859370b711.jpg,315,15분 이내,초급,3인분,"[('토마토', '3개'), ('돼지고기', '198g'), ('양파', '1개'), ('청피망', '1개'), ('새송이버섯', '104g'), ('당근', '약간'), ('마늘', '50g'), ('토마토케첩', '54g'), ('알룰로스', '25g'), ('치킨파우더', '12g'), ('소금', '약간'), ('후추', '약간'), ('건바질', '약간')]",트리 요리 @7015634  눈사람요리 @7015578 를 함께 올려 크리스마스 분위기를 뿜뿜,"[{'step_number': 1, 'description': '채소와 고기를 자르고, 마늘은 다져 준비해요.도마 , 조리용나이프', 'image_url': 'https://recipe1.ezmember.co.kr/cache/recipe/2023/12/14/6d13a3eab1cc107f31539d7bb82660b41.jpg'}, {'step_number': 2, 'description': '냄비에 마늘절반, 고기, 후추를 넣고 볶아요.냄비 , 요리스푼', 'image_url': 'https://recipe1.ezmember.co.kr/cache/recipe/2023/12/14/20561c6bdf68394ab82d2ee38f74b3431.jpg'}, {'step_number': 3, 'description': '고기가 익으면 버섯, 양파절반, 당근, 마늘을 넣고 볶아요.', 'image_url': 'https://recipe1.ezmember.co.kr/cache/recipe/2023/12/14/7c023a6efd84fa6426cccd18d970fe5a1.jpg'}, {'step_number': 4, 'description': '버섯이 익으면 토마토를 넣어요.', 'image_url': 'https://recipe1.ezmember.co.kr/cache/recipe/2023/12/14/61398a48294dde5578293832ca49902c1.jpg'}, {'step_number': 5, 'description': '토마토가 익어 물이 생기면 소스와 남은 채소를 모두 넣고 볶아요.', 'image_url': 'https://recipe1.ezmember.co.kr/cache/recipe/2023/12/14/408e380732409d80c3ae659792a06fec1.jpg'}, {'step_number': 6, 'description': '보글보글 끓기 시작해 5분간 더 볶아주면 완성싱거우면 맛소금을 추가해주세요', 'image_url': 'https://recipe1.ezmember.co.kr/cache/recipe/2023/12/14/ac36df276d940512b524bd636c2cdd241.jpg'}]"
151560,양념/잼/소스,일상,돼지고기,볶음,돼지고기들깨가루고추장볶음!,돼지고기들깨고추장볶음,https://recipe1.ezmember.co.kr/cache/recipe/2024/01/26/4bc860c118b511d8f0c49b36df766c041.jpg,357,30분 이내,아무나,6인분 이상,"[('돼지고기 다짐육', '600g'), ('고추장', '500g'), ('매운 고추장', '300g'), ('들깨가루', '3~4큰술'), ('진간장', '4~5큰술'), ('다진마늘', '1~2큰술'), ('생강술', '2큰술'), ('설탕', '2큰술'), ('후추가루', '조금'), ('올리고당', '1~2큰술'), ('참기름', '1큰술'), ('통깨', '조금')]","명절이 다가오니 나물반찬이 많겠죠~한끼정도는 그냥먹어도 매끼 그냥먹을수도없고 그럴때 비빔밥으로 비벼먹으면 빨리먹을수가 있겠죠~ㅎ 그래서 미리 돼지고기를 듬뿍 넣어서 고추장을 볶아줬어요 비빔장~으로 다른조림(닭도리탕,두부조림(부침),남은전을넣고 짜글이)에 넣고 조리해보세요","[{'step_number': 1, 'description': '돼지고기다짐육을 준비해주시고 볶아주실 팬에 넣고 돼지고기양념을 넣어주세요볶음팬', 'image_url': 'https://recipe1.ezmember.co.kr/cache/recipe/2024/01/26/2aeac45d851a7c41cb439b513ae37b261.jpg'}, {'step_number': 2, 'description': '양념을 섞어서 20~30분 재워두세요', 'image_url': 'https://recipe1.ezmember.co.kr/cache/recipe/2024/01/26/abf90dc9e1f708ca12670bbc4a6461b81.jpg'}, {'step_number': 3, 'description': '저는 2가지 고추장을 섞어서 했어요 취향껏 하시면 되세요 단)시판용만 쓰실경우 단맛을 조절하세요', 'image_url': 'https://recipe1.ezmember.co.kr/cache/recipe/2024/01/26/417b44ad4986514207b8d96081a5327f1.jpg'}, {'step_number': 4, 'description': '재워두었던 돼지고기를 바싹 수 분이 없도록 볶아주세요조리주걱 , 요리스푼', 'image_url': 'https://recipe1.ezmember.co.kr/cache/recipe/2024/01/26/403299e38c57f7c18b5938f3689dd8341.jpg'}, {'step_number': 5, 'description': '고추장을 넣어주신후 가스불을 중약불로 낮추시고 잘섞어가면서 볶아주세요', 'image_url': 'https://recipe1.ezmember.co.kr/cache/recipe/2024/01/26/2294f244dc3165635ac0aa55cdda6b971.jpg'}, {'step_number': 6, 'description': '들깨가루를 넣어서 잘섞어주세요 저는 추가로 올리고당,참기름을 넣어주었어요 취향껏 조절하세요', 'image_url': 'https://recipe1.ezmember.co.kr/cache/recipe/2024/01/26/c4b47066c94164a3c7e2d402328d80be1.jpg'}, {'step_number': 7, 'description': '5분을 볶아주시다가 가스불을 꺼주시 통깨를 뿌려주시면 완성이네요', 'image_url': 'https://recipe1.ezmember.co.kr/cache/recipe/2024/01/26/8afdb4438a2f34aa990c3e2f1f673ad31.jpg'}]"
