index,종류별,상황별,재료별,방법별,글 제목,레시피이름,레시피이미지,조회수,조리시간,난이도,인분,재료,소개글,조리순서
42465,메인반찬,영양식,해물류,무침,#낙지요리 #여름낙지요리 #낙지무침만들기 #낙지볶음아니고 낙지무침!!! #낙지와 채소를 넣고 무친 건강한 한끼 밥상,낙지무침,https://recipe1.ezmember.co.kr/cache/recipe/2019/08/15/74cabdb50c09aae93bd6af17e910e9091.jpg,"29,231",20분 이내,아무나,4인분,"[('낙지', '6마리'), ('양파', '1개'), ('당근', '1/2개'), ('오이', '1/3개'), ('얼갈이배추', '2개'), ('적양배추', '1/4개'), ('참기름', '1작은술'), ('통깨', '1작은술'), ('고추장', '2큰술'), ('고춧가루', '2큰술'), ('양조간장', '2큰술'), ('다진마늘', '1작은술'), ('썬파', '1큰술'), ('맛술', '1큰술'), ('식초', '1작은술'), ('후추', '조금')]","보통 낙지는 무교동스타일이나 오징어볶음스타일로 볶음을 많이 하는데[

이번에는 기름이 아닌 그냥 무친 낙지무침을 만들어 보았어요.

여름이니 기름에 볶는 음식보다는

살짝 데쳐서 슥슥 무쳐낸 음식이 입맛을 더욱 자극할 듯 싶어서요.

​

낙지는 역시나 보양식 식재료이기도 하니까요.

각종 채소들과 함께 무쳐낸 건강한 낙지무침입니다.","[{'step_number': 1, 'description': '양념부터 만들어 줍니다. 고추장, 고춧가루, 다진마늘, 썬파를 넣어 주시고요.', 'image_url': 'https://recipe1.ezmember.co.kr/cache/recipe/2019/08/15/3f0ffa11826f21e61fe9d0b0d5ac19831.jpg'}, {'step_number': 2, 'description': '양조간장, 매실액, 식초를 넣어 줍니다.', 'image_url': 'https://recipe1.ezmember.co.kr/cache/recipe/2019/08/15/3c9f29a09746976f719e104de1b8759c1.jpg'}, {'step_number': 3, 'description': '그리고 후추와 맛술도 넣어 주시고요.', 'image_url': 'https://recipe1.ezmember.co.kr/cache/recipe/2019/08/15/426596eb2e663cfd599fa4c3d35619dd1.jpg'}, {'step_number': 4, 'description': '잘 섞어서 냉장고에 잠시 숙성을 시켜 줍니다. 양념장은 준비가 다 되었습니다. 이제 낙지만 데쳐내면 끝이지요. 참기름과 통깨는 가장 나중에 버무릴때에 넣으시면 됩니다.', 'image_url': 'https://recipe1.ezmember.co.kr/cache/recipe/2019/08/15/34c18a281ef8cdc383be43f2669b01791.jpg'}, {'step_number': 5, 'description': '낙지무침에 들어가는 채소들을 준비합니다. 전 상추가 아닌 얼갈이배추를 준비했어요. 물도 안 생기고 씹는 식감도 좋고 알싸한 맛도 좋아서요. 깨끗하게 씻어서 물기를 뺀 다음에 낙지 길이만큼 썰어서 준비합니다.', 'image_url': 'https://recipe1.ezmember.co.kr/cache/recipe/2019/08/15/782156fafd8ac9d6e1124ddc6c1ee3fd1.jpg'}, {'step_number': 6, 'description': '당근도 역시 낙지의 길이와 폭으로 썰어서 준비합니다.', 'image_url': 'https://recipe1.ezmember.co.kr/cache/recipe/2019/08/15/7ef534c104720905265d5fafe8b521681.jpg'}, {'step_number': 7, 'description': '양파도 썰어서 준비해 놓고요. 역시 낙지의 굵기와 길이에 맞춰서 썰어서 준비해 놓았고요.', 'image_url': 'https://recipe1.ezmember.co.kr/cache/recipe/2019/08/15/716cf8ac532598e8a1fe57ea302854091.jpg'}, {'step_number': 8, 'description': '색감을 위해서 적양배추를 준비했어요. 역시 굵직하게 썰어서 준비합니다.', 'image_url': 'https://recipe1.ezmember.co.kr/cache/recipe/2019/08/15/43e25051f34f534fefd6a3dd9a69b3741.jpg'}, {'step_number': 9, 'description': '오이는 어슷하게 썰어서는 반으로 썰어서 준비해 놓습니다.', 'image_url': 'https://recipe1.ezmember.co.kr/cache/recipe/2019/08/15/09e9b4b2a17a7f6623a17e6b41a6cdf21.jpg'}, {'step_number': 10, 'description': '낙지무침에 들어가는 채소들을 준비했습니다. 얼갈이배추, 양파, 당근, 적양배추, 오이 이렇게 준비 완료입니다.', 'image_url': 'https://recipe1.ezmember.co.kr/cache/recipe/2019/08/15/900cb7d1ad145809db3c49721b286c8e1.jpg'}, {'step_number': 11, 'description': '낙지무침의 주연인 낙지를 해동시킨 후에 찬물에 씻어서 준비합니다. 굵은소금을 넣고 씻지 않으셔도 될 듯 싶어요. 냉동제품이라서 다 손질이 되어진 낙지라서요. 만약 그냥 생낙지라면 굵은소금을 넣고 박박 씻어서 구석구석 이물질들을 빼 주고 깔끔하게 소금기를 없애면서 씻어 준 후에 절단해서 사용하시면 됩니다.낙지 손질법 레시피', 'image_url': 'https://recipe1.ezmember.co.kr/cache/recipe/2019/08/15/2cd87b50bba3768539cba80ee9c63e4a1.jpg'}, {'step_number': 12, 'description': '낙지는 끓은 물에 넣고는 4분 정도 끓여 줍니다. 중간에 소금 간을 조금 해 주었습니다. 데쳐낸 낙지는 찬물에 깨끗하게 씻어 준 후에 잠시 얼음물에 담궈서 냉장고에 보관해 놓습니다. 그럼 더욱 탱글탱글한 식감의 낙지를 드실 수 있어요.', 'image_url': 'https://recipe1.ezmember.co.kr/cache/recipe/2019/08/15/c6b598159992d41601acca10b6c785621.jpg'}, {'step_number': 13, 'description': '이젠 다 한꺼번에 무치기만 하면 끝입니다. 준비한 채소들을 볼에 넣어 주시고요.', 'image_url': 'https://recipe1.ezmember.co.kr/cache/recipe/2019/08/15/86ffde2532b6583a0b467af32f7fba401.jpg'}, {'step_number': 14, 'description': '데쳐낸 낙지도 넣어 줍니다. 낙지가 조금 부족한 듯 싶어서 냉동해물도 함께 데쳐 주었습니다.', 'image_url': 'https://recipe1.ezmember.co.kr/cache/recipe/2019/08/15/4b916d002c84da2915ded104c83a2c7d1.jpg'}, {'step_number': 15, 'description': '양념장을 넣어 줍니다. 조물조물 무쳐 주세요.', 'image_url': 'https://recipe1.ezmember.co.kr/cache/recipe/2019/08/15/ae61386d1152d910632a15243d7b5f541.jpg'}, {'step_number': 16, 'description': '마지막으로 통깨와 참기름을 넣고 다시한번 무쳐 줍니다.', 'image_url': 'https://recipe1.ezmember.co.kr/cache/recipe/2019/08/15/5ed85ef63257622cc19dbc42488718871.jpg'}, {'step_number': 17, 'description': '살짝 새콤하면서도 매콤한 낙지무침이 다 무쳐졌습니다. 좀더 새콤한 맛을 원하시면 식초를 더 첨가하시면 되고요. 식초를 첨가하게 되면 고추장의 텁텁함이 덜 하게 되기도 합니다. 식초를 많이 넣지 않은 이유는 초무침이 아니기도 하지만 국수가 양념이 되어 있기 때문에 식초를 소량만 넣어 주었습니다.', 'image_url': 'https://recipe1.ezmember.co.kr/cache/recipe/2019/08/15/605f35420a91d23deb03066a401b2c601.jpg'}, {'step_number': 18, 'description': '비빔국수와도 잘 어울리고 그냥 소면과도 잘 어울리는 여름보양식 낙지무침 완성입니다.', 'image_url': 'https://recipe1.ezmember.co.kr/cache/recipe/2019/08/15/dc3a0b5787db4a58dd02117bb10f865b1.jpg'}]"
42466,메인반찬,영양식,해물류,무침,손은 많이가지만 그만큼 맛있는 꼬막무침!,꼬막무침,https://recipe1.ezmember.co.kr/cache/recipe/2019/12/19/d04a4522a27e294646af60a294aeb3a31.jpg,"1,735",60분 이내,아무나,4인분,"[('꼬막', '500g'), ('꼬막해감용 소금', '4큰술'), ('생강술', '1큰술'), ('간장', '2큰술'), ('고추가루', '2큰술'), ('다진마늘', '1/2큰술'), ('올리고당', '2큰술'), ('다진파', '1큰술'), ('통깨', '조금'), ('참기름', '조금')]",제철요리 꼬막무침! 손이많이 가는 음식이지만 만들어놓으면 자꾸손이가는 반찬이기도 하지요,"[{'step_number': 1, 'description': '꼬막을 굵은소금을 넣고 박박 비벼가면서 문질러주세요\n흐르는물에 한번을 씻어서 주세요', 'image_url': 'https://recipe1.ezmember.co.kr/cache/recipe/2019/12/19/80237a9c72cb75bab8d50f8f8fef59e01.jpg'}, {'step_number': 2, 'description': '씻은 꼬막을 천일염 3~4큰술을 섞은 소금물에 담구어주세요', 'image_url': 'https://recipe1.ezmember.co.kr/cache/recipe/2019/12/19/8e5ccd0fb385458fbb17c1e82348de101.jpg'}, {'step_number': 3, 'description': '냄비뚜껑이나 천을 덮어서 1~2시간을 꼬막을 해감시켜주세요\n*해감을 시켜주셔야 지근거림이 없고 뻘(진흙)냄새가 없어요', 'image_url': 'https://recipe1.ezmember.co.kr/cache/recipe/2019/12/19/1add8170596b12d2a66a18eb876d068c1.jpg'}, {'step_number': 4, 'description': '펄펄 끓는물에 해감시킨 꼬막을 넣고 생강술1큰술을 넣고 삶아주세요\n*꼬막을 넣고는 가스불을 중약불로 낮추어서 5분을 잘섞어가면서 삶아주세요\n꼬막이 클수록 삶는 시간을 늘려주세요\n꼬막이 한두개가 벌어지기 시작하면 건져내시면 되세요', 'image_url': 'https://recipe1.ezmember.co.kr/cache/recipe/2019/12/19/56ef8751feb4b19e81bc3cb8bdc9ab141.jpg'}, {'step_number': 5, 'description': '찬물에 담구어서 주신채로 숫가락으로 꼬막의 뒤에 살짝들어간곳에 넣고 살짝 비틀어 주시면 꼬막을 쉽게 깔수가 있어요', 'image_url': 'https://recipe1.ezmember.co.kr/cache/recipe/2019/12/19/09367e3ab535e70162ff953a37bead221.jpg'}, {'step_number': 6, 'description': '꼬막의 속살만 빼내어 드셔도 좋지만 저는 한쪽은 붙어있는게 좋아서 이렇게 손질했네요\n그건 각자의 취향껏 해주시고 아이들용인경우 속살만 빼서해주세요꼬막 손질법 레시피', 'image_url': 'https://recipe1.ezmember.co.kr/cache/recipe/2019/12/19/d1afc7036184590b7284ce575662a2cd1.jpg'}, {'step_number': 7, 'description': '간장/고추가루/다진마늘/다진파/올리고당/통깨/참기름을 넣고 양념장을 만들어주세요\n단)양념이 너무 짜면 안되요', 'image_url': 'https://recipe1.ezmember.co.kr/cache/recipe/2019/12/19/4ffcc7421f1e687fb6be2819eb9b2cbe1.jpg'}, {'step_number': 8, 'description': '손질한 꼬막을 담을 용기에 넣고 그위에 양념장을 조금씩 뿌려주면 되세요\n*속살만 분리해서 무침을 할경우는 양념을 조금씩 넣어가면서 무침을 하셔야 되세요', 'image_url': 'https://recipe1.ezmember.co.kr/cache/recipe/2019/12/19/7ab1aa9866b83c0ffcc07d7db68cf6401.jpg'}, {'step_number': 9, 'description': '손이많이 가는 음식이지만 만들어놓으면 누구나 맛있게 먹는 꼬막무침이 완성이 되었어요', 'image_url': 'https://recipe1.ezmember.co.kr/cache/recipe/2019/12/22/afa0f5bec1f57d20bf69bb8d6b94dabd1.jpg'}]"
42467,메인반찬,영양식,해물류,무침,봄의 기운을 이렇게 가득 담았다고? 춘곤증도 날아가는 봄 기력 충전 레시피 새콤향긋 이렇게 쉬운 <주꾸미달래무침>,주꾸미달래무침,https://recipe1.ezmember.co.kr/cache/recipe/2020/06/12/f81f7bf9d3c78592a08825921e2beea91.jpg,418,20분 이내,초급,2인분,"[('주꾸미', '1공기'), ('적양파', '1/6개'), ('달래', '1/2줌'), ('부추', '10줄기'), ('홍고추', '1/10개'), ('요리에센스 연두 청양초', '1스푼'), ('설탕', '1스푼'), ('식초', '2스푼')]","쫄깃쫄깃 주꾸미에 한번 향긋한 달래 향에 두 번 취하는
주꾸미달래무침을 소개합니다.","[{'step_number': 1, 'description': '분량의 재료를 준비해주세요.', 'image_url': 'https://recipe1.ezmember.co.kr/cache/recipe/2020/06/12/8269ece4d7139bc30a56d9b4af2a49be1.jpg'}, {'step_number': 2, 'description': '주꾸미는 내장, 이빨, 눈을 제거하고 조물조물 씻어 헹궈주세요. 끓는 물에 1분 정도 데친 후 물기를 제거하고 3cm 길이로 썰어주세요.', 'image_url': 'https://recipe1.ezmember.co.kr/cache/recipe/2020/06/12/96405edc33b3b2ece7a577cec0f17ef91.jpg'}, {'step_number': 3, 'description': '달래, 부추는 깨끗이 씻은 후 3cm으로 썰고 적양파는 채로, 홍고추는 송송 썰어 준비해 주세요.', 'image_url': 'https://recipe1.ezmember.co.kr/cache/recipe/2020/06/12/facc9d03297b4394b52117a222cb882f1.jpg'}, {'step_number': 4, 'description': '볼에 손질한 주꾸미와 야채를 넣고 연두매콤새콤양념을 만들어 무쳐주면 완성!', 'image_url': 'https://recipe1.ezmember.co.kr/cache/recipe/2020/06/12/0099ab4ac6f6f892cf092924dbc892201.jpg'}]"
42468,메인반찬,영양식,해물류,무침,봄철 입맛을 사로잡는 영양만점 전복회무침,전복무침,https://recipe1.ezmember.co.kr/cache/recipe/2015/05/15/e6b95e4a5c5c27720c45893d1b9e6c1d1.jpg,"6,205",30분 이내,초급,2인분,"[('활전복', ''), ('쌈채류', ''), ('오이', ''), ('양파', ''), ('청양고추', ''), ('초고추장', ''), ('고춧가루', ''), ('마늘', ''), ('생강즙', ''), ('깨', '')]",오늘 소개해드릴 메뉴는 봄철 나른한 몸에 활기를 불어넣어줄 새콤달콤매콤~쫄깃한 전복회무침이에요~,"[{'step_number': 1, 'description': '저는 봄철을 맞아 미나리와 봄동, 쌈채 몇종류, 오이, 양파, 청양고추 준비했어요~', 'image_url': 'https://recipe1.ezmember.co.kr/cache/recipe/2015/05/15/b1c8c0a8218d17c074ae6909910a1ca61.jpg'}, {'step_number': 2, 'description': '솔을 이용해 전복의 구석구석을 깨끗이 씻어줘요~ 수저(계량스푼이 더 얄팍해 좋더라구요~)를 이용해 전복을 껍질로부터 분리하고 내장을 제거해요~', 'image_url': 'https://recipe1.ezmember.co.kr/cache/recipe/2015/05/15/b4a6055a16575ca43955f61b4bfec9961.jpg'}, {'step_number': 3, 'description': '마지막으로 전복의 이빨을 제거하면 전복의 손질이 끝이 나요~채소도 4~5cm길이로 썰고 전복은 저며썰어 준비했어요~전복 손질법 레시피\u200b', 'image_url': 'https://recipe1.ezmember.co.kr/cache/recipe/2015/05/15/76c59ab897501215a4027aeafe3e99631.jpg'}, {'step_number': 4, 'description': '양념장은 시판 초고추장에 고춧가루, 매실액, 마늘, 생강즙넣어 편하게 준비했네요~', 'image_url': 'https://recipe1.ezmember.co.kr/cache/recipe/2015/05/15/f9e2c410f709cbcdd86c2b696cabfbae1.jpg'}, {'step_number': 5, 'description': '이제 모든 재료를 버물버물한 후 이쁘게 세팅해요~', 'image_url': 'https://recipe1.ezmember.co.kr/cache/recipe/2015/05/15/8732624453837f2b13e806c05ceb7f761.jpg'}]"
42469,메인반찬,영양식,해물류,무침,꽃게양념무침 (양념꽃게장)- 딸에게#,None,https://recipe1.ezmember.co.kr/cache/recipe/2015/06/08/6543606ca2f8cfa4515803accdf46262.jpg,"15,988",None,None,None,[],,[]
42470,메인반찬,영양식,해물류,무침,암예방산사해파리냉채,해파리냉채,https://recipe1.ezmember.co.kr/cache/recipe/2019/09/15/3a268f07129f08dc14956f51ac52c6671.jpg,"7,692",30분 이내,중급,5인분,"[('해파리냉채', '200g'), ('중하새우', '5마리'), ('오이', '1/2개'), ('빨파프리카', '1/3'), ('당근', '1/2개'), ('맛살', '2줄'), ('배', '1/4배'), ('달걀', '2개'), ('산사', '7g'), ('마늘', '2큰술'), ('연겨자', '1/2큰술'), ('설탕', '2큰술'), ('식초', '2큰술'), ('마요네즈', '3큰술'), ('레몬', '1/2개'), ('올리브 엑스트라버진', '2큰술'), ('참기름', '약간'), ('산사물', '1컵'), ('설탕', '1큰술'), ('식초', '1큰술'), ('소금', '약간'), ('해파리양념물', '')]","해파리는 단백질, 지방, 탄수화물,수분이 주성분이며 젤라틴이 풍부해 포만감이 많으며 살이 찌지 않는 식품으로 알려져 있고, 고혈압치료제로써도 뛰어난 효과를 보여주며, 중추신경,진정효능과 말초혈관, 확장작용이 있고 신경안정이 있어 항암하는 환자들에게 좋다.산사는 성질이 따뜻하고 혈관속 콜레스테롤과 지방을 제거 해줘 혈액순환에 좋고 어혈 및 고혈압을 예방하며, 소화불량,비만과 위산과다에도 좋다, 산사의 새콤함과 향긋함이 살아있는 맛있는 냉채에 잘 어울리는 약재이며 환자의 식욕을 돋아준다.","[{'step_number': 1, 'description': '산사 7g 씻어 냄비에 물을 붓고 끓여 우려 망에 걸러준비한다.\n새우는 삶아서 껍질을 까고 반으로 자른다.\n오이는 곱게 채썰어 볶는다\n파프리카는 곱게 채썰어 볶는다.\n당근은 곱게 채썰어 볶는다. 맛살은 먹기좋게 채썰어 볶는다, 배는 껍질을 벗기고 채썬다, \n달걀 2개 흰자 노른자를 갈라 부쳐 채썬다, \n산사해파리냉채 재료로, 산사,해파리,당근,파프리카,오이,새우,달걀,배,맛살,등 준비한다', 'image_url': 'https://recipe1.ezmember.co.kr/cache/recipe/2019/08/25/ab3b84923042763b02028dcb34b461b01.jpg'}, {'step_number': 2, 'description': '깨끗이 씻어 놓은 해파리는 냄비에 물이 끓으면 불을 끄고 해파리를 넣고 한번 저어준 다음 바로 꺼내 씻어 건져 우려낸 산사물은 소스를 만들 양을 남기고 산사물에 설탕과 소금 및 식초를 넣어 잘 저은 후 해파리를 넣어 숙성시킨다,', 'image_url': 'https://recipe1.ezmember.co.kr/cache/recipe/2019/08/25/ff29f69ef2e43e3136f18648ab39fb121.jpg'}, {'step_number': 3, 'description': '달걀은 흰자,노른자를 나눠 흰자는 전분약간을 넣어 식용유를 넣어 부친다, 노른자는 물한방울을 넣어 식용유 한방울을 넣어 지져낸다', 'image_url': 'https://recipe1.ezmember.co.kr/cache/recipe/2019/08/25/4b6d07d7d923a02ae85dc994f1dd15c21.jpg'}, {'step_number': 4, 'description': '당근,오이,청,홍파프리카, 맛살,흰자등 알맞게 채썰고 새우는 삶아서 껍질을 벗기고 반으로 자른다', 'image_url': 'https://recipe1.ezmember.co.kr/cache/recipe/2019/08/25/2febe47d4b67b5596d896f5f00e7dd691.jpg'}, {'step_number': 5, 'description': '곱게간 마늘2큰술, 연겨자 1/2큰술, 설탕2큰술, 식초2큰술,마요네즈3큰술, 레몬1/2개. 올리브엑스트라버진2큰술, 참기름 약간', 'image_url': 'https://recipe1.ezmember.co.kr/cache/recipe/2019/08/25/5675e677a3fb5a39b4c05f8d7db395061.jpg'}, {'step_number': 6, 'description': '채썬 야채, 당근,파프리카, 오이,당근을 셋팅하고 흰자,노른자자도 셋팅, 새우,해파리도 모양을 내어 위에 얹는다.', 'image_url': 'https://recipe1.ezmember.co.kr/cache/recipe/2019/08/25/7aa016cdcffca296e75118f67b1a9d931.jpg'}, {'step_number': 7, 'description': '알맞게 썰어 놓아 셋팅한 재료위에 마늘소스를 얹어 놓는다', 'image_url': 'https://recipe1.ezmember.co.kr/cache/recipe/2019/08/25/d7e4d73e7a4d3ab723798ff5785898e51.jpg'}]"
42471,메인반찬,영양식,해물류,무침,문어 초무침 :: 칼칼하고 개운한 생문어 초무침 만들기,문어초무침,https://recipe1.ezmember.co.kr/cache/recipe/2015/09/24/761f309ee282c7ed7a308f3bc4c4a9e41.jpg,"14,641",90분 이내,중급,2인분,"[('문어', '600g'), ('대파', '1/2개'), ('양파', '1개'), ('다진 마늘', '1큰술'), ('오이', '1개'), ('통깨', '조금'), ('고추장', '3큰술'), ('식초', '1큰술'), ('설탕', '1큰술'), ('매실청', '조금'), ('꿀', '조금')]",문어 초무침은 명절 기름진 음식이 많아서 칼칼하고 개운한 음식이 그리워 질 때 상에 즐겨 올리는 음식입니다. 문어 초무침이 주된 요리일 때 소면까지 삶아 내면 거뜬한 한 끼 식사를 할 수 있어요. 문어 초무침 만들기 시작해 봐요,"[{'step_number': 1, 'description': '문어는 굵은 소금으로 주물러 빨판의 이물질을 깨끗히 씻어요.', 'image_url': 'https://recipe1.ezmember.co.kr/cache/recipe/2015/09/24/890b86be30ea2838fc5c1e88d4cd4a851.jpg'}, {'step_number': 2, 'description': '문어를 데칠 때는 80˚C의 뜨거운 물에서 문어를 살짝 담가 데치면 문어가 훨씬 부드러워져요. 문어가 오그라들면 건져내주세요.', 'image_url': 'https://recipe1.ezmember.co.kr/cache/recipe/2015/09/24/fcfdccf26efb4866a7cdc34618189fec1.jpg'}, {'step_number': 3, 'description': '찬물에 잠시 넣었다가 건져서 물기를 빼주세요.', 'image_url': 'https://recipe1.ezmember.co.kr/cache/recipe/2015/09/24/cbe7973a835d3d98a7510554f5523bc11.jpg'}, {'step_number': 4, 'description': '문어는 씹기 좋게 어슷하게 썰어둡니다.', 'image_url': 'https://recipe1.ezmember.co.kr/cache/recipe/2015/09/24/58670c1c6be38883614cd224487606f91.jpg'}, {'step_number': 5, 'description': '오이 1개는 반달썰기 해요.', 'image_url': 'https://recipe1.ezmember.co.kr/cache/recipe/2015/09/24/fadf5e1e31b1026d7d2f12bc88ed74461.jpg'}, {'step_number': 6, 'description': '양파 1개는 채 썰어요.', 'image_url': 'https://recipe1.ezmember.co.kr/cache/recipe/2015/09/24/5c9099fc676769c6faf8341bc56a01a11.jpg'}, {'step_number': 7, 'description': '대파는 어슷썰기 하고, 마늘은 다져요.', 'image_url': 'https://recipe1.ezmember.co.kr/cache/recipe/2015/09/24/3e8a1c6b5877132e1b22337894d7b8311.jpg'}, {'step_number': 8, 'description': '고추장, 식초, 설탕을 3:1:1 비율로 넣고 매실청과 꿀을 조금 넣어 초장을 준비합니다.', 'image_url': 'https://recipe1.ezmember.co.kr/cache/recipe/2015/09/24/fbc447ca09be28cec7683527354a60341.jpg'}, {'step_number': 9, 'description': '초무침 양념을 넣고 재료와 맛이 어우러지도록 골고루 버무려주세요.', 'image_url': 'https://recipe1.ezmember.co.kr/cache/recipe/2015/09/24/b849ede6b34ed1db09509de936a1a3201.jpg'}, {'step_number': 10, 'description': '통깨를 조금 뿌려 잘 섞어주세요.', 'image_url': 'https://recipe1.ezmember.co.kr/cache/recipe/2015/09/24/7994a28594bb69ffad8947ec234b121f1.jpg'}, {'step_number': 11, 'description': '삶은 소면은 똬리를 틀어 접시에 담아둬요.', 'image_url': 'https://recipe1.ezmember.co.kr/cache/recipe/2015/09/24/0bfe2734d19a820e693ecadb5bad38f51.jpg'}, {'step_number': 12, 'description': '완성한 문어 초무침을 그릇에 담아 냅니다.', 'image_url': 'https://recipe1.ezmember.co.kr/cache/recipe/2015/09/24/2db3fbb3ca79dc696b362a8acba1903d1.jpg'}]"
42472,메인반찬,영양식,해물류,무침,봄철 보양식 숭어 회무침,숭어회무침,https://recipe1.ezmember.co.kr/cache/recipe/2015/05/17/95da287f66125b21d67da2b659c72f7d1.jpg,"6,139",30분 이내,초급,2인분,"[('숭어회', '4줌'), ('배', '1/4개'), ('오이', '1/4개'), ('쪽파', '1줌'), ('아삭이 고추', '2개'), ('양배추                                                                                채썬것', '1줌'), ('다진마늘', '0.5큰술'), ('깻잎', '1줌'), ('고추장', '3큰술'), ('설탕', '1큰술'), ('다진마늘', '0.5큰술'), ('매실청', '2큰술'), ('식초', '1.5~2큰술'), ('참기름', '1.5큰술'), ('후추', '조금'), ('통깨', '조금')]",새콤달콤 입맛을 돋궈주는 숭어 회무침입니다. 숭어가 보양식이나 다름이 없으니 입맛이 없어질 이쯤에 먹어주면 원기회복에도 좋을꺼 같아요.,"[{'step_number': 1, 'description': '양념장을 먼저 만들어 줍니다.', 'image_url': 'https://recipe1.ezmember.co.kr/cache/recipe/2015/05/19/0e5b4ca772c794d2b4347902dc80a6091.jpg'}, {'step_number': 2, 'description': '숭어회는 얇게 썰어주세요.', 'image_url': 'https://recipe1.ezmember.co.kr/cache/recipe/2015/05/19/1ee4427988b76d3adda502d1b3992cc71.jpg'}, {'step_number': 3, 'description': '채소와 배도 먹기 좋은 크기로 썰어주세요.', 'image_url': 'https://recipe1.ezmember.co.kr/cache/recipe/2015/05/19/ab490b39a5b7f03cda25f34104e4b5a71.jpg'}, {'step_number': 4, 'description': '볼에 재료들을 넣고 다진마늘 0.5큰술정도 더 넣어주시고 회무침 양념장을 넣어줍니다.', 'image_url': 'https://recipe1.ezmember.co.kr/cache/recipe/2015/05/19/6c35c224333ce59e38efc97d576b2ada1.jpg'}, {'step_number': 5, 'description': '양념이 잘 베이게 살살 버무려주시면 입맛 돋구는 숭어 회무침 완성입니다.', 'image_url': 'https://recipe1.ezmember.co.kr/cache/recipe/2015/05/19/93a4a8eea01a84335a884cc89c9d4fa21.jpg'}]"
