index,종류별,상황별,재료별,방법별,글 제목,레시피이름,레시피이미지,조회수,조리시간,난이도,인분,재료,소개글,조리순서
40707,메인반찬,다이어트,돼지고기,볶음,(다이어트) 돼지고기가 들어간 특별한 오이볶음~,돼지고기오이볶음,https://recipe1.ezmember.co.kr/cache/recipe/2019/04/21/1509bd00547eb40f23cacc5294851dd71.jpg,"14,378",60분 이내,초급,4인분,"[('돼지고기', '250g'), ('백오이', '3개'), ('홍고추', '1개'), ('간장', '2큰술'), ('다진마늘', '1큰술'), ('후추가루', '조금'), ('설탕', '1큰술'), ('식용류', '1큰술'), ('참기름', '1/2큰술'), ('통깨', '1큰술')]","돼지고기에 오이를넣어서 볶음요리를
만들었어요~다이어트음식으로 또는 
아이들반찬으로 딱좋아요","[{'step_number': 1, 'description': '돼지고기(잡채용)을 200g을 준비해주시고 다진마늘/후추가루/간장/설탕을 넣어 밑간을 해주시고 30분간 숙성을 시켜주세요', 'image_url': 'https://recipe1.ezmember.co.kr/cache/recipe/2019/04/22/d08b2476fae09ad108b64d12f3379d461.jpg'}, {'step_number': 2, 'description': '백오이3개를 3등분해서 돌려깍기를 해서 가운데 씨앗부분에 심지를 제거하고 얇게 채를 썰어 주시고 소금을 넣어서 절여주세요', 'image_url': 'https://recipe1.ezmember.co.kr/cache/recipe/2019/04/22/71a0050b5b141f977685e1799b7d30cc1.jpg'}, {'step_number': 3, 'description': '10분간 절여주세요', 'image_url': 'https://recipe1.ezmember.co.kr/cache/recipe/2019/04/22/0f61bf412a0dd1a9b96278baaa0db8c81.jpg'}, {'step_number': 4, 'description': '찬물에 한번 씻어서 물기를 최대한 꼭 짜주세요', 'image_url': 'https://recipe1.ezmember.co.kr/cache/recipe/2019/04/22/fc098a29bcc0f0282eacdb7c175f682f1.jpg'}, {'step_number': 5, 'description': '홍고추 한개를 반으로 가르고 씻를 제거후 얇게 채를 썰어주세요', 'image_url': 'https://recipe1.ezmember.co.kr/cache/recipe/2019/04/22/5a88c841f9eaceb1162155eef01f04061.jpg'}, {'step_number': 6, 'description': '숙성시켜둔 돼지고기를 팬에 식용류를 넣고 젓가락으로 \n섞어가면서 볶아주세요', 'image_url': 'https://recipe1.ezmember.co.kr/cache/recipe/2019/04/22/1abfb7c05282ed2c906b0f5da2530ab81.jpg'}, {'step_number': 7, 'description': '돼지고기가 다익을정도로 볶아졌으면 오이절인것과 홍고추를 넣어주시고 \n1분간 후리릭 볶아주시고 불을 끄신다음 참기름과 통깨를 뿌리시어 완성하시고 큰그릇이나 쟁반에 담아내서 \n식혀주세요', 'image_url': 'https://recipe1.ezmember.co.kr/cache/recipe/2019/04/22/b59c6392576e422a43eef5ed2bd90f641.jpg'}, {'step_number': 8, 'description': '오이에 부족한 단백질과 좋은성분을 돼지고기가 채워주어서 다이어트에 도움이 많이 되고 아이들반찬으로도 좋아요', 'image_url': 'https://recipe1.ezmember.co.kr/cache/recipe/2019/04/22/905f8bccb4cf3532d85754411cfba5261.jpg'}]"
40708,메인반찬,다이어트,돼지고기,볶음,<다이어트식단> 돼지등심 느타리버섯 파프리카볶음!,돼지등심느타리버섯파프리카볶음,https://recipe1.ezmember.co.kr/cache/recipe/2019/12/22/4f84181c5c0a8cbafea65872e7c198ad1.jpg,"8,414",30분 이내,아무나,4인분,"[('돼지고기등심', '250g'), ('말린 느타리버섯', '200g'), ('삼색파프리카', '150g'), ('간장', '3큰술'), ('다진마늘', '1/2큰술'), ('후추가루', '조금'), ('설탕', '1큰술'), ('생강술', '1큰술'), ('올리브유', '1큰술'), ('참기름', '조금'), ('통깨', '조금')]","날씨가 추워지다보니 옆구리의살들이 더 찌는듯해
다이어트식단으로 포만감과 영양을 다 챙길수있는
레시피네요~ 아이들반찬/영양반찬으로도 좋아요","[{'step_number': 1, 'description': '돼지고기등심(잡채용)으로 준비후 간장2/다진마늘/후추가루/설탕/생강술을 넣고 잘 버무려주세요', 'image_url': 'https://recipe1.ezmember.co.kr/cache/recipe/2019/12/22/ddb0ed4ad3d54562a5d5a7cacdeba24c1.jpg'}, {'step_number': 2, 'description': '말린 느타리버섯을 미지근한물에 담구어 불려주세요', 'image_url': 'https://recipe1.ezmember.co.kr/cache/recipe/2019/12/22/19502b13c4de8167c31cbe4ded95b1da1.jpg'}, {'step_number': 3, 'description': '파프리카를 색상별로 50g씩 너무 얇지않게 썰어서 준비해주세요\n*양파/대파를 썰어서 추가하셔도 되세요', 'image_url': 'https://recipe1.ezmember.co.kr/cache/recipe/2019/12/22/852e3245a5c2437f70654efa8dc4dbc91.jpg'}, {'step_number': 4, 'description': '팬에 올리브유를 넣고 양념해놓은 돼지등심을 넣어 볶아주세요', 'image_url': 'https://recipe1.ezmember.co.kr/cache/recipe/2019/12/22/1658df9ad4bd7488b83a4dc8210289311.jpg'}, {'step_number': 5, 'description': '돼지고기가 반쯤 익으면 불리 느타리버섯을 물기를 꼭짠후 넣어주시고 잘섞어가면서 3분간 볶아주세요', 'image_url': 'https://recipe1.ezmember.co.kr/cache/recipe/2019/12/22/5d548ba91551c05daef8b2e2df18b8f11.jpg'}, {'step_number': 6, 'description': '잘라놓은 파프리카를 넣고 간장/소금으로 추가간을 해주시고 2분간 휘리릭 볶아주세요\n*저는 다이어트식단이라서 간장1큰술만 추가했네요\n참고만 하세요', 'image_url': 'https://recipe1.ezmember.co.kr/cache/recipe/2019/12/22/93868d560d7ecab5b35897837b53a5801.jpg'}, {'step_number': 7, 'description': '가스불을 꺼주시고 참기름/통깨를 넣고 잘섞어주시면 영양은 듬뿍이지만 칼로리는 적은 건강한 다이어트식단인 돼지등심 느타리버섯 파프리카볶음이 완성이 되었어요\n아이들반찬으로도 좋네요ㅎ', 'image_url': 'https://recipe1.ezmember.co.kr/cache/recipe/2019/12/22/ad8d5a20f5ee3ea9a5b2c52be3c4b2731.jpg'}]"
40709,메인반찬,다이어트,돼지고기,볶음,피부와 다이어트에 좋은 ; 돼지껍데기 양념볶음,돼지껍데기볶음,https://recipe1.ezmember.co.kr/cache/recipe/2017/11/15/2ee5af52907425af99dc339ea601a6a81.jpg,"24,034",60분 이내,아무나,6인분 이상,"[('돼지껍데기', '1kg'), ('양파', ''), ('부추', ''), ('마늘', ''), ('청량고추', ''), ('홍고추', ''), ('된장', '2큰술'), ('양파', '2개'), ('생강                                                                                마늘크기', '10알'), ('대파', '2대'), ('월계수잎', '3장'), ('통후추', '20알'), ('맛술                                                                                또는 소주', '1컵'), ('고추장', '6큰술'), ('고춧가루', '10큰술'), ('멸치액젓                                                                                게세마리표', '2큰술'), ('설탕', '2큰술'), ('올리고당', '2큰술'), ('맛술', '1/2컵'), ('다진마늘', '4큰술'), ('후춧가루', '약간'), ('참기름', '4큰술'), ('소금', '약간'), ('간장', '약간')]","1.피부에 좋은
돼지껍데기가 콜라겐 덩어리라고 하지만
콜라겐이 직접 몸으로 가는 건 아니고,
콜라겐을 먹으면 몸속에서 아미노산으로 분해가 되고 
그 아미노산이 다시 콜라겐 생성에 도움이 된다고 해요.

2.다이어트효과가 있는
돼지껍데기는 탄수화물이 없고 지방과 단백질로만 형성이 되어있고
열량은 100g 에 289kal !
연애인들 중에 허기진 배를 
돼지껍데기로 달랬다는 다이어트 이야기가 사실인가 봐요.

3.연골재생과 피부질환에 효과가 있다고 해요.

하지만,
과유불급 !!!
돼지껍데기만 주구장창 먹는다면
배 뽈록이 된다는 경고를 의사선생님들께서 하시네요^^","[{'step_number': 1, 'description': '아시안 마켓에서 깨끗하게 손질된 \n돼지껍데기 2.43파운드 (약 1kg)를 구입했습니다.', 'image_url': 'https://recipe1.ezmember.co.kr/cache/recipe/2017/11/15/20917a3dbcfe07c751fcbcdb007249c21.jpg'}, {'step_number': 2, 'description': '돼기껍데기를 물에 한번 헹군 후\n된장2큰술,양파2개,생강10알,대파2대,월계수잎3장,통후추20알,맛술 한컵을 넣고\n팔팔 끓인 물에 넣고\n다시 한번 팔팔 끓으면\n불을 중불로 줄이고돼지껍데기 요리에서 제일 중요한 냄새 제거 과정입니다.\n집에있는 향신재료들 최대한 활용해 주세요.', 'image_url': 'https://recipe1.ezmember.co.kr/cache/recipe/2017/11/15/207ac367260b904acd546e0a95fb6e781.jpg'}, {'step_number': 3, 'description': '20분 정도 삶아 줍니다.중불', 'image_url': 'https://recipe1.ezmember.co.kr/cache/recipe/2017/11/15/19b7696d8d6dd7560ccece95509e51361.jpg'}, {'step_number': 4, 'description': '삶아진 돼지껍데기를 건져', 'image_url': 'https://recipe1.ezmember.co.kr/cache/recipe/2017/11/15/99b6af1846a55fcb90b3bbe7ccf13d321.jpg'}, {'step_number': 5, 'description': '찬물에 깨끗하게 헹군 다음', 'image_url': 'https://recipe1.ezmember.co.kr/cache/recipe/2017/11/15/2c08d53a96a15d1517ecdedf407c25181.jpg'}, {'step_number': 6, 'description': '돼지껍데기 안쪽 기름기를 칼로 긁어냅니다.', 'image_url': 'https://recipe1.ezmember.co.kr/cache/recipe/2017/11/15/dd389d0cb15f02a0864cce442eaa57fc1.jpg'}, {'step_number': 7, 'description': '돼기껍데기를 먹기 좋게 썰어줍니다.', 'image_url': 'https://recipe1.ezmember.co.kr/cache/recipe/2017/11/15/8ead5bd4f1882c892b763740bb86417e1.jpg'}, {'step_number': 8, 'description': '미리 만들어 놓은 양념을 넣고 \n[돼지껍데기 (1kg) 양념 만들기]\n고추장 6큰술\n고춧가루 10큰술\n게세마리표 멸치액젓 2큰술\n설탕 2큰술\n올리고당 2큰술\n맛술 1/2컵\n다진마늘4큰술\n후춧가루 약간\n참기름 4큰술\n볶아진 후\n간이 약하다 싶으면 \n소금이나 간장으로 간해주세요.', 'image_url': 'https://recipe1.ezmember.co.kr/cache/recipe/2017/11/15/867598995bd65dedf91e1b6167d5a71e1.jpg'}, {'step_number': 9, 'description': '조물조물 양념이 잘 배도록 무쳐줍니다.양념에 버무린 후 \n바로 볶아먹어도 좋지만,\n\n반나절 이상 냉장고에 넣은 후\n볶아 먹으면 간이 잘 배어 더욱 맛있습니다.', 'image_url': 'https://recipe1.ezmember.co.kr/cache/recipe/2017/11/15/65eeb460cc75329250c0ee8521f3c1871.jpg'}, {'step_number': 10, 'description': '편썬 마늘과 양파를 넣고 함께 중약불에서 볶아줍니다.\n이때,\n식용유는 넣지 않습니다.중약불쎈불에서 볶으면 \n양념이 타기도 하고\n돼지껍데기가 튀어 오를 수 있으니 주의하세요!', 'image_url': 'https://recipe1.ezmember.co.kr/cache/recipe/2017/11/15/ca77b3504a1eceac871a1aeae14b222f1.jpg'}, {'step_number': 11, 'description': '돼지껍데기가 볶아지면\n부추를 양껏 넣고 휘리릭 볶아줍니다.', 'image_url': 'https://recipe1.ezmember.co.kr/cache/recipe/2017/11/15/a83d55ecc425721a887f8ce68f21cd451.jpg'}, {'step_number': 12, 'description': '부추의 숨이 죽으면 불을 끕니다.', 'image_url': 'https://recipe1.ezmember.co.kr/cache/recipe/2017/11/15/b525af8ac7c2f2ecc16813d07b4b6c111.jpg'}, {'step_number': 13, 'description': '볶아진 돼지껍데기를 접시에 담고 \n통깨 솔솔~ 뿌리고\n청,홍고추를 함께 곁들이면\n맛있는 \n돼지껍데기 양념볶음이 완성됩니다.', 'image_url': 'https://recipe1.ezmember.co.kr/cache/recipe/2017/11/15/bafeccfab56268c2028a06616275b51f1.jpg'}]"
40710,메인반찬,다이어트,돼지고기,볶음,삼겹살 꽈리고추 볶음,삼겹살꽈리고추볶음,https://recipe1.ezmember.co.kr/cache/recipe/2023/07/23/3b905aa8a51e568a9ead59addc2d2c051.jpg,385,15분 이내,초급,1인분,"[('삼겹살 \u200b', '200g'), ('꽈리고추', '200g'), ('적양파', '1/2개'), ('다진 마늘', '1T'), ('어간장', '1T'), ('굴소스', '1/2T'), ('통깨', '약간'), ('케일', '10장')]","밥 반찬으로 먹어도 맛있고 술안주로도 최고일듯해요. ​저는 '삼겹살 꽈리고추볶음'을 밥에 비벼서 케일쌈이랑 먹었는데 완전 꿀 조합이었답니다. 특별한 양념을 넣은 것도 아닌데 너무너무 맛있더라고요.! 특별한 양념이라는 뜻은 보통 두루치기나 주물럭을 만들 때 설탕을 많이 쓰게 되잖아요. 저는 알룰로스도 넣지 않고 마늘 한 스푼, 어간장 한 스푼, 저당 굴 소스 반 스푼으로 간을 맞췄는데 속세 맛 부럽지 않더라고요. 어간장이 없으면 진간장과 참치 액젓을 1:1 비율로 넣어보세요. ​저당 굴 소스는 100g, 30kcal인데 당류가 0%라서 이 정도면 성분이 착한 편이라 허용합니다. 오늘 요리에 반 스푼만 넣어도 맛있더라고요.","[{'step_number': 1, 'description': '삼겹살을 먹기 좋은 크기로 잘라주세요.', 'image_url': 'https://recipe1.ezmember.co.kr/cache/recipe/2023/07/23/898c0a68479d5c057f698f228e6b3e141.jpg'}, {'step_number': 2, 'description': '꽈리고추를 식초물에 담가 깨끗이 씻은 후 반으로 잘라주세요. Tip. 통으로 넣으면 간이 잘 베이지 않아요.', 'image_url': 'https://recipe1.ezmember.co.kr/cache/recipe/2023/07/23/333f61cda71361684b8f302f7df8a45f1.jpg'}, {'step_number': 3, 'description': '양파를 얇게 썰어주세요.', 'image_url': 'https://recipe1.ezmember.co.kr/cache/recipe/2023/07/23/6d384a4c93fc875aeae51261c617a1311.jpg'}, {'step_number': 4, 'description': '삼겹살을 취향껏 구워주세요. 저는 바싹하게 구웠지만 부드러운 식감을 좋아하면 80% 정도만 익혀주세요. 바싹하게 구우면 사실 고기가 질겨져서 맛이없쥬?. ㅎ 저는 고기를 먹을 줄 몰라서 바싹하게 구워서 고소한 맛에 먹거든요.(힛)', 'image_url': 'https://recipe1.ezmember.co.kr/cache/recipe/2023/07/23/2061bb76ac0c79809655e0ca6013ce041.jpg'}, {'step_number': 5, 'description': '꽈리고추를 넣어주세요.', 'image_url': 'https://recipe1.ezmember.co.kr/cache/recipe/2023/07/23/248d0907ef0d20acf840b9f760f9fe9b1.jpg'}, {'step_number': 6, 'description': '다진 마늘 한 큰 술을 넣어주세요.', 'image_url': 'https://recipe1.ezmember.co.kr/cache/recipe/2023/07/23/0199e01e522b2cdb698c0e56b54323591.jpg'}, {'step_number': 7, 'description': '어간장 한 큰 술을 넣어주세요. 어간장이 없으면 진간장과 참치 액젓을 1:1 비율로 넣어주시면 됩니다.', 'image_url': 'https://recipe1.ezmember.co.kr/cache/recipe/2023/07/23/fb0bb62a48dd6764fb32684c70b2c1651.jpg'}, {'step_number': 8, 'description': '고춧가루 한 큰 술을 넣어주세요. Tip. 고춧가루를 너무 많이 넣으면 텁텁해져요. 매운 걸 좋아하면 청양고추를 얇게 썰어 넣거나 청양고추가루를 추가해 보세요.', 'image_url': 'https://recipe1.ezmember.co.kr/cache/recipe/2023/07/23/dd5fc15a5a4f1681efeb85f680e979161.jpg'}, {'step_number': 9, 'description': '양파를 넣고 볶아주세요.', 'image_url': 'https://recipe1.ezmember.co.kr/cache/recipe/2023/07/23/febbfe1425c273e44489967353d952951.jpg'}, {'step_number': 10, 'description': '저당 굴 소스 반 스푼을 넣고 볶아주세요.', 'image_url': 'https://recipe1.ezmember.co.kr/cache/recipe/2023/07/23/7a97edbeeb77e8e9d3e03faca2dae2ee1.jpg'}, {'step_number': 11, 'description': '불을 끄고 후추를 넣고 휘리릭 섞어주면 완성입니다. 여기서 맛을 보고 참기름 한 바퀴 둘러 주셔도 되고요. 저는 참기름 넣지 않아도 충분히 맛있었습니다. 사실 돼지기름에 볶으면 뭐, 말해 모해요. 맛보장 맞쥬?.ㅎ', 'image_url': 'https://recipe1.ezmember.co.kr/cache/recipe/2023/07/23/053b391b24ff3ddcd6fe793ceb297e9c1.jpg'}, {'step_number': 12, 'description': '삼겹살 꽈리고추 볶음을 상추쌈이나 깻잎에 싸 먹어도 \n맛있겠쥬', 'image_url': 'https://recipe1.ezmember.co.kr/cache/recipe/2023/07/23/f477253b6a4a486a47a389df61598ade1.jpg'}]"
40711,메인반찬,다이어트,돼지고기,볶음,다이어트 목살 요리 통마늘볶음 목살볶음 레시피,목살볶음,https://recipe1.ezmember.co.kr/cache/recipe/2024/09/11/7c57e237056f6c37a90498f9f1f011601.jpg,50,30분 이내,초급,4인분,"[('목살', '600g'), ('대파', '2대'), ('통마늘', '13~15개'), ('굴 소스', '1'), ('통깨', '약간'), ('진간장', '2'), ('자일로스 설탕', '1'), ('다진 생강                                                                                or 생강가루', '약간'), ('후춧가루', '약간')]","목살에 대파와 통마늘만 넣어서 볶아요. 대파와 통마늘을 돼지고기와 함께 섭취하면 소화를 촉진할 수 있고 통마늘의 매운맛이 고기의 누린내를 제거해 주며 대파의 신선한 향이 더해져 향이 풍부해져요. 간단한 재료 준비 목살, 대파, 통마늘만 있으면 OK! 체중 관리를 위해서 지방 섭취를 무조건 피하는 것이 능사가 아니에요. 사실, 일부 지방은 건강과 체중 관리에 오히려 도움이 될 수 있어요. 이른바 좋은 지방으로 불리는 불포화 지방산이 그 주인공입니다. 단백질과 지방은 포만감을 높여 과식을 방지해 주고 근육 형성에도 중요한 역할을 해요.","[{'step_number': 1, 'description': '대파는 4~5cm 길이로 잘라주세요.\n도마 , 조리용나이프', 'image_url': 'https://recipe1.ezmember.co.kr/cache/recipe/2024/09/11/c1fa032b2c5c06c7e515f5d00ae1f8d91.jpg'}, {'step_number': 2, 'description': '목살에 설탕 1스푼을 넣어주시는데요. 이때 설탕은 체내 흡수를 억제해 주는 자일로스 설탕을 넣었어요. 진간장 2스푼, 다진 생강과 후춧가루 약간 넣어주세요.볼 , 숟가락', 'image_url': 'https://recipe1.ezmember.co.kr/cache/recipe/2024/09/11/bdc9b0f4506b6c734e785610947d03451.jpg'}, {'step_number': 3, 'description': '양념이 고기에 골고루 스며들도록 뒤적뒤적 해주세요. 10분 이상 재워 놓으세요.', 'image_url': 'https://recipe1.ezmember.co.kr/cache/recipe/2024/09/11/aa0f6b7c65d8349ef9609af695d796e91.jpg'}, {'step_number': 4, 'description': '팬에 밑간 한 목살을 넣고 중불에서 볶아주세요. 목살의 겉면이 익으면볶음팬 , 조리주걱', 'image_url': 'https://recipe1.ezmember.co.kr/cache/recipe/2024/09/11/27a7bba12bf88a69227bf174ce91c8501.jpg'}, {'step_number': 5, 'description': '통마늘을 넣어요. 통마늘이 노릇노릇해지면 대파 투하!', 'image_url': 'https://recipe1.ezmember.co.kr/cache/recipe/2024/09/11/10f106be5c4c9994832f5b1a74b8f5421.jpg'}, {'step_number': 6, 'description': '대파를 넣은후 굴소스 1스푼 넣고 센 불로 올린 후 약 2분 정도 가볍게 볶으면 끝! 접시에 담고 통깨를 솔솔 뿌린 후 드세요.', 'image_url': 'https://recipe1.ezmember.co.kr/cache/recipe/2024/09/11/0c35a97d5984bae9069be736dee058611.jpg'}]"
40712,메인반찬,다이어트,돼지고기,볶음,돼지고기 곤약잡채,돼지고기곤약잡채,https://recipe1.ezmember.co.kr/cache/recipe/2018/02/24/09ae7652c0ba0202c4571e1a3323943d1.jpg,"4,347",15분 이내,초급,2인분,"[('돼지고기 다짐육', '400g'), ('실곤약', '1팩'), ('청피망', '1개'), ('양파', '1/2개'), ('홍고추', '1개'), ('간장', '10T'), ('설탕', '5T'), ('참기름', '1t')]",소고기잡채 보다 더 알뜰하면서도 체질과 건강을 고려한 레시피입니다. 특히 차가운 성질의 돼지고기와 곤약을 활용한 레시피라서 당뇨와 소양인에게 좋아요.,"[{'step_number': 1, 'description': '청피망과 양파를 채썰어 준비해줍니다', 'image_url': 'https://recipe1.ezmember.co.kr/cache/recipe/2018/02/24/18ef47d8f248c2a218dd3384e6763c6b1.jpg'}, {'step_number': 2, 'description': '홍고추를 적당한 크기로 썰어준비합니다', 'image_url': 'https://recipe1.ezmember.co.kr/cache/recipe/2018/02/24/7d97b77d0e43849e1987759a9f8d9a541.jpg'}, {'step_number': 3, 'description': '돼지고기다짐육을 팬에 볶아줍니다다짐육의 경우 볶음주걱으로 볶아주면 큰 덩어리로 뭉치기 때문에 볶음용 젓가락을 이용해주세요', 'image_url': 'https://recipe1.ezmember.co.kr/cache/recipe/2018/02/24/baf1625670b6770577d96406f2391f181.jpg'}, {'step_number': 4, 'description': '돼지고기는 약불에 정성껏 탄 면이 없도록 볶다가 익으면 양파와 청피망을 넣고 함께 볶아줍니다', 'image_url': 'https://recipe1.ezmember.co.kr/cache/recipe/2018/02/24/943b3496f83c0a2cc31465fce20a78d31.jpg'}, {'step_number': 5, 'description': '돼지고기 냄새를 잡기 위해서 후추도 듬뿍 뿌려주면 좋습니다', 'image_url': 'https://recipe1.ezmember.co.kr/cache/recipe/2018/02/24/fe7e3e96f4e1a81eceb4a9b6add1e7f81.jpg'}, {'step_number': 6, 'description': '마지막 단계에 홍고추를 넣고 불을 꺼줍니다.', 'image_url': 'https://recipe1.ezmember.co.kr/cache/recipe/2018/02/24/0e950b59d8ccde5de7181001edb0a3271.jpg'}, {'step_number': 7, 'description': '실곤약은 곤약의 비린내를 없애주기 위해 끓는 물에 한번 데쳐줍니다곤약 특유의 비린내를 특히 싫어한다면 이때 식초 한방울을 넣어주세요', 'image_url': 'https://recipe1.ezmember.co.kr/cache/recipe/2018/02/24/c4e56ecfca6978029cc28abab14535791.jpg'}, {'step_number': 8, 'description': '실곤약을 끓는 물에 데친 후 채에 밭쳐 물기를 제거해줍니다', 'image_url': 'https://recipe1.ezmember.co.kr/cache/recipe/2018/02/24/0119d0054ed55f571343a67fcd631d641.jpg'}, {'step_number': 9, 'description': '잡채 양념을 준비합니다. 집집마다의 비법대로 해주시면 됩니다. 간장과 설탕의 비율이 저희집 2:1', 'image_url': 'https://recipe1.ezmember.co.kr/cache/recipe/2018/02/24/cec08d2635eb21b0e03a3beb71f06a961.jpg'}, {'step_number': 10, 'description': '돼지고기와 채소를 볶아둔 팬에 데친 곤약과 양념을 넣고 강불로 휘리릭 볶아줍니다.물이 많이 나오지 않도록 강불에 3초만.', 'image_url': 'https://recipe1.ezmember.co.kr/cache/recipe/2018/02/24/a6a7a4688591691da02b723c6120a5b21.jpg'}]"
