index,종류별,상황별,재료별,방법별,글 제목,레시피이름,레시피이미지,조회수,조리시간,난이도,인분,재료,소개글,조리순서
159639,샐러드,다이어트,해물류,무침,[살 빠지는 레시피] 봄철 별미 꼬막 샐러드로 즐기기,꼬막샐러드,https://recipe1.ezmember.co.kr/cache/recipe/2023/03/20/f328fdec0536e00c63f7f75e74aeb8ab1.jpg,83,30분 이내,초급,2인분,"[('깐 꼬막', '150g'), ('야채 샐러드', '1봉'), ('파프리카', '50g'), ('간장', '2숟갈'), ('꿀', '1숟갈'), ('레몬주스', '1숟갈'), ('깨소금', '1숟갈')]",11 ~ 3월 제철음식 꼬막 쫄깃해서 자주 먹게 되는 반찬메뉴 중 하나가 바로 꼬막요리 인데요. 그냥 꼬막 삶는 법 하고 난 뒤에 샐러드 소스 만들어서 슥슥 비벼서 먹으면 최고의 다이어트요리이기도 하지만 철 맛있는 건강식 완성이죠. ​ 다이어트 하시는 분들 샐러드 많이 챙겨 드시죠?!? 간장으로 베이스로 한 꼬막샐러드는 어떠세요?,"[{'step_number': 1, 'description': '#꼬막해감법~ 꼬막을 씻은 후 소금을 넣고 고루 섞어준 후 검은 비닐이나 천을 덮어 놓고 30 ~ 1시간 정도 지나면 해감이 됩니다. 해감된 꼬막을 깨끗이 씻어주세요.', 'image_url': 'https://recipe1.ezmember.co.kr/cache/recipe/2023/03/20/9d0127c72d2f0720f7b67e660ea1cf331.jpg'}, {'step_number': 2, 'description': '#꼬막삶기~ 조개가 잠길 정도의 넉넉한 물을 끊이고 물이 팔팔 끊으면 찬물 한 컵을 부어주세요.물의 온도가 핵심 포인트! 살이 쪼그라들지 않도록! 탱글 한 식감을 느낄 수 있도록 제대로 삶고 싶다면 물의 온도가 80~90도씨 정도가 가장 적정한 온도라고 하니 팔팔 끊어 오르기 시작하면 차가운 물 한 컵을 부어주고 세척한 꼬막을 휘리릭~~~ 넣어주고 소금 한 숟가락 넣고 한쪽 방향으로 빙빙빙 저어가면서 삶아주세요!', 'image_url': 'https://recipe1.ezmember.co.kr/cache/recipe/2023/03/20/63494521953970e4b1bc53b7cfeb926f1.gif'}, {'step_number': 3, 'description': '일찍 입을 벌린 꼬막은 그냥 살만 발라내면 되고 입을 벌리지 않은 꼬막은 숟가락을 이용해 뒷부분을 돌리면 벌어집니다. 저는 손톱이 길어서 손으로 쉽게 깔 수 있었어요.', 'image_url': 'https://recipe1.ezmember.co.kr/cache/recipe/2023/03/20/89b4ec8e51d47b6bcd0ff106aa75e7501.jpg'}, {'step_number': 4, 'description': '믹스된 샐러드 한 팩을 구입했어요! 물로 깨끗이 씻어주고 파프리카는 얇게 썰어주면 됩니다. 파프리카는 넣으셔도 되고 안 넣어도 상관없어요. 냉장고에 있는 야채를 활용하시면 됩니다.', 'image_url': 'https://recipe1.ezmember.co.kr/cache/recipe/2023/03/20/7adc2490f0368b1b7aeb332f751e3e781.jpg'}, {'step_number': 5, 'description': '간장, 꿀, 레몬즙(식초로 대체 가능), 깨소금을 넣고 쉐끼쉐끼!', 'image_url': 'https://recipe1.ezmember.co.kr/cache/recipe/2023/03/20/6a8b2ece778b1b99f358734dbd5eb24c1.gif'}, {'step_number': 6, 'description': '원하는 접시에 썰어놓은 야채랑 꼬막을 넣고 그 위로 간장 드레싱을 골고루 얹어 주면 끝! 전 전날 꼬막전을 하면서 삶아 놓은 꼬막을 활용하여 샐러드를 만들었는데요! 10분 만에 뚝딱! 꼬막샐러드가 완성되었어요. 삶은 꼬막만 있다면 요리 초보도 가능한 쉬운요리', 'image_url': 'https://recipe1.ezmember.co.kr/cache/recipe/2023/03/20/0a7379e529e5e3c00abdb5fb7314c7391.jpg'}]"
159640,샐러드,다이어트,해물류,무침,여름에 먹기 좋은 미역 오이 샐러드 -많이 먹어도 살안찜!,미역오이샐러드,https://recipe1.ezmember.co.kr/cache/recipe/2021/07/07/c014aa18c3e541edd5ec40485e412cf71.jpg,"1,844",60분 이내,아무나,1인분,"[('자른미역', '4스푼'), ('오이', '1/3개'), ('양파', '1/4개'), ('빨강 파프리카', '1/2개'), ('노랑 파프리카', '1/2개'), ('냉동 손질 오징어', '1마리'), ('냉동 새우살', '1/2컵'), ('레몬', '1개'), ('설탕', '1스푼'), ('간장', '1스푼'), ('식초', '3스푼'), ('레몬즙', '2스푼'), ('굵은 소금', '1티스푼'), ('레몬슬라이스', '1조각')]",오이의 계절 여름이 왔어요!! 여름하면 오이 요리 많이 먹게 되죠 간장과 식초를 베이스로한 상큼하면서도 가벼운 드레싱을 얹은 미역오이샐러드를 만들어봤어요 아삭한 야채들의 식감과 오독오독 씹히는 해물까지! 가벼운 한끼 식사 대용으로 추천하고 싶어요,"[{'step_number': 1, 'description': '먼저 미역을 물에 20분 정도 불려주세요자른미역을 사용하면 편해요', 'image_url': 'https://recipe1.ezmember.co.kr/cache/recipe/2021/07/07/7bdefb4a8050e7fe76ce7442f77fd3431.jpg'}, {'step_number': 2, 'description': '냉동새우 반 컵은 찬물 부어 해동해주고', 'image_url': 'https://recipe1.ezmember.co.kr/cache/recipe/2021/07/07/a43773c62995b7a44029b5c5c3bb19061.jpg'}, {'step_number': 3, 'description': '손질오징어도 찬물에 담가 천천히 해동해줍니다', 'image_url': 'https://recipe1.ezmember.co.kr/cache/recipe/2021/07/07/eaf46e697c813f44ab1343e2173d71311.jpg'}, {'step_number': 4, 'description': '그 사이 양파는 얇게 채썰어', 'image_url': 'https://recipe1.ezmember.co.kr/cache/recipe/2021/07/07/361c602ba132f39f47f2c01966cc39141.jpg'}, {'step_number': 5, 'description': '찬물에 15분 정도 담가 아린맛을 제거해주고샐러드에는 생 양파를 넣기 때문에 아린맛을 제거 후 넣어야 맵지 않아요 (매운맛이 덜한 자색양파도 좋습니다)', 'image_url': 'https://recipe1.ezmember.co.kr/cache/recipe/2021/07/07/2ae8070d206aae28c898a11149ce74cf1.jpg'}, {'step_number': 6, 'description': '오이는 어슷썰기한 후 반달모양으로 썰어주고', 'image_url': 'https://recipe1.ezmember.co.kr/cache/recipe/2021/07/07/275fde3099353fd7314b51811600e62a1.jpg'}, {'step_number': 7, 'description': '파프리카도 색깔별로(빨강, 노랑) 반 개씩 \n적당한 두께로 채썰어준비해요', 'image_url': 'https://recipe1.ezmember.co.kr/cache/recipe/2021/07/07/ce32b34a4af791096623c677f5a410b91.jpg'}, {'step_number': 8, 'description': '해동한 오징어는 껍질을 깨끗이 벗겨낸 후 \n큼지막하게 썰어주세요삶을 때 많이 쪼그라드니 큼지막하게 썰어주는게 좋아요', 'image_url': 'https://recipe1.ezmember.co.kr/cache/recipe/2021/07/07/1e6bf5a3aaee3e8844f482b502d74b461.jpg'}, {'step_number': 9, 'description': '끓는 물에 굵은 소금 1티스푼, 레몬슬라이스 한 조각을 띄우고 오징어를 1분미만으로 데쳐주고, 바로 건져내 찬물에 헹궈줍니다오래 삶으면 질겨져요 \n짧게 삶아야 하는 해물의 경우 작은 체를 이용하면 편해요', 'image_url': 'https://recipe1.ezmember.co.kr/cache/recipe/2021/07/07/d76f652a9f963b68db206fa9c33bfbb01.jpg'}, {'step_number': 10, 'description': '냉동새우살도 마찬가지로 1분이면 주황빛이 금세 돌아요 익으면 바로 건져내 찬물에 바로 헹궈줍니다', 'image_url': 'https://recipe1.ezmember.co.kr/cache/recipe/2021/07/07/55cdb3ce8f936ead3a8baccdc128036c1.jpg'}, {'step_number': 11, 'description': '설탕 1스푼, 간장 1스푼, 식초3스푼, 레몬즙 2스푼을 넣고 잘 섞어 간장드레싱을 만들어줍니다보다 상큼한 맛을 원한다면 식초를 더 추가해주세요', 'image_url': 'https://recipe1.ezmember.co.kr/cache/recipe/2021/07/07/0eba839934cf5cc2865c6b88a3781f051.jpg'}, {'step_number': 12, 'description': '볼에 불린미역과 야채, 해물 모든 재료를 한데 넣고 드레싱을 뿌려 가볍게 무쳐주면 완성!', 'image_url': 'https://recipe1.ezmember.co.kr/cache/recipe/2021/07/07/45584afff3f97033a67d7232e7f1c2171.jpg'}, {'step_number': 13, 'description': '레몬 몇조각과 고소한 깨를 올려 마무리해요야채에서 수분이 나오면서 시간이 지날 수록 맛이 배어들어 맛있어져요', 'image_url': 'https://recipe1.ezmember.co.kr/cache/recipe/2021/07/07/e8d0b3f87cff4bbacd3012c71b480ebf1.jpg'}]"
159641,샐러드,다이어트,해물류,무침,[살 빠지는 레시피] 402kcal / 연어샐러드 만들기 / 그릭요거트 타르타르 만들기,연어샐러드,https://recipe1.ezmember.co.kr/cache/recipe/2023/04/03/69837d44af0dfe08c006c71963232c291.jpg,"1,103",30분 이내,아무나,1인분,"[('연어', '100g'), ('어린잎채소', '15g'), ('그릭요거트', '90g'), ('마요네즈', '1숟가락'), ('피클', '20g'), ('머스터드', '1숟가락'), ('레몬주스', '2숟가락')]","살 빠지는 레시피로 다이어트에 성공해 유지어터가 되고 푼 루나에요. 
반가워요!​​
연어는 말이죠!
피부면 피부 모발이면 모발 오메가-3 지방산으로 혈관도 건강하게 붉은 살의 기름진 생선 연어는 심장, 뇌, 뼈, 피부, 모발 등 신체 다양한 조직을 건강하게 유지하게 해주는데요. 그 이유는 오메가-3 지방산을 함유하고 있기 때문이에요.
​그냥 먹어도 맛있는 연어지만 간편하게 샐러드로 더 프레시하고 건강하게 즐겨보아요!","[{'step_number': 1, 'description': '포장 진공 된 생연어라 선도 유지를 위해서 손질과 동시에 바로 먹기 좋게 썰어 준비해요. \n사 오자마자 바로 다 먹으면 좋겠지만 딸과 저만 연어를 먹어요! 이 맛있는 연어를 왜 안 먹는 고야? \n연어보관법 잠시 보관해야 한다면 냉장고 가장 깊은 곳이나 김치냉장고에 보관해 주세요. \n단 회로 먹을 때는 24시간 안에 먹는 걸 권장해요.', 'image_url': 'https://recipe1.ezmember.co.kr/cache/recipe/2023/04/03/394ea2b88e70833e70cdeca1d5eca4b21.jpg'}, {'step_number': 2, 'description': '오이피클을 잘게 다져 놓아요. \n그릭요거트, 마요네즈, 머스터드소스, 레몬즙을 넣고 섞어주면 연어 그릭요거트 타르타르 소스가 되는 거예요!', 'image_url': 'https://recipe1.ezmember.co.kr/cache/recipe/2023/04/03/38d00d730717bdff978cab507b5065631.jpg'}, {'step_number': 3, 'description': '어린잎 채소는 깨끗이 씻어서 물기를 빼주세요! \n맘에 드는 접시에 이쁘게~ 맛있게 보이게~ 양껏 푸짐하게 마구마구 올리기', 'image_url': 'https://recipe1.ezmember.co.kr/cache/recipe/2023/04/03/b2e21b3768d2ada471cf2bc52a31522e1.jpg'}, {'step_number': 4, 'description': '타르타르 소스를 연어에 올려주면 끝. \n초스피드로 후다닥! \n맛있는 다이어트 요리 완성!', 'image_url': 'https://recipe1.ezmember.co.kr/cache/recipe/2023/04/03/3186573de73e66927274cd33bfbcf6cd1.gif'}]"
159642,샐러드,다이어트,해물류,무침,새우샐러드 다이어트 샐러드 소스 야채샐러드 드레싱 만들기,새우샐러드,https://recipe1.ezmember.co.kr/cache/recipe/2023/06/18/2870ec97ce59d0bbefba82bd52bc34541.jpg,"3,876",30분 이내,초급,1인분,"[('샐러드 믹스', '80g'), ('새우', '10마리'), ('토마토', '1개'), ('깨소금', '2수저'), ('간장', '1수저'), ('올리고당', '1수저'), ('식초', '1수저'), ('들기름', '1수저')]","365일 다이어트 중인 저는 아침에는 인슐린 감수성이 좋아 적당량의 탄수화물을 섭취해요. 아침에 적당한 탄수화물은 충분한 에너지를 얻을 수 있고, 과식할 확률이 적어져요. 저녁은 탄수화물 섭취를 줄이고 포만감이 좋은 샐러드 위주로 챙겨 먹고 있어요. 그리고 단백질도 꼭 챙겨 먹고요. 저녁에 먹는 다이어트 샐러드 새우샐러드 레시피를 알려드릴게요. 샐러드에는 소스가 중요하죠. 샐러드 소스 중에 야채샐러드 드레싱으로 좋은 간장드레싱 만들기도 알려드릴게요. 저녁은 샐러드로 먹자고요!","[{'step_number': 1, 'description': '냉동새우 칵테일 새우는 차가운 물에 담가 해동해 주세요.                    \n\n                        \n                            청정한상 흰다리 새우살 300g', 'image_url': 'https://recipe1.ezmember.co.kr/cache/recipe/2023/06/18/ff6de13c40ffde2b304bfb205ff7a5011.jpg'}, {'step_number': 2, 'description': '끓는 물에 해동한 새우를 넣고 데쳐주세요. 새우 코리가 말리면서 동글동글 해지면 새우가 익은 거예요. 익은 새우는 꺼내서 식혀 주세요.', 'image_url': 'https://recipe1.ezmember.co.kr/cache/recipe/2023/06/18/96cb79bd4ce63ad8a07409d8c89a3df31.jpg'}, {'step_number': 3, 'description': '야채샐러드는 씻어서 채반에 받쳐 물기를 제거해 주세요.', 'image_url': 'https://recipe1.ezmember.co.kr/cache/recipe/2023/06/18/1e66bbceddf9c0f76b54f92f2cd877651.jpg'}, {'step_number': 4, 'description': '토마토는 먹기 좋은 크기로 잘라주고 토마토 씨는 제거해 주세요. 토마토 씨를 제거하면 샐러드에 물이 생기지 않아요.', 'image_url': 'https://recipe1.ezmember.co.kr/cache/recipe/2023/06/18/b96f06dd1daadee618cbc110cbe308ee1.jpg'}, {'step_number': 5, 'description': '간장드레싱 재료를 모두 넣고 섞어주세요. 이 간장드레싱은 좀 더 개운하고 깔끔한 맛이 특징이에요. 누구나 입맛에 맞는 깨 소스 레시피입니다. 요즘은 마트에서 참깨 드레싱을 많이 사용하지만 간장드레싱 만들기는 생각보다 훨씬 간단하니 한 번 도전해 보면 특유의 고소한 맛에 매료되어 계속 만들어 먹게 될 거예요.', 'image_url': 'https://recipe1.ezmember.co.kr/cache/recipe/2023/06/18/1793a80c4e98447b31b9b5dce43af58a1.jpg'}, {'step_number': 6, 'description': '오목한 접시에 야채샐러드 넣고 그 위에 자른 토마토 올린 다음 새우로 장식한 뒤 간장드레싱을 뿌려주세요.', 'image_url': 'https://recipe1.ezmember.co.kr/cache/recipe/2023/06/18/d3d5d2960987639d1753dc03ddba600d1.jpg'}]"
159643,샐러드,다이어트,해물류,무침,"#톳요리 #초간단샐러드 #건강한샐러드 #톳샐러드만들기 #오이, 톳, 무쌈만 있으면 초간단하게 만들 수 있는 톳샐러드",톳샐러드,https://recipe1.ezmember.co.kr/cache/recipe/2020/09/11/ee660864a2582022927fb5278ea497cc1.jpg,"2,083",10분 이내,아무나,6인분 이상,"[('톳', '120g'), ('오이', '1개'), ('쌈무', '1통'), ('설탕', '3큰술'), ('식초', '5큰술')]","톳요리 톳샐러드만들기 초간단톳샐러드

염장된 톳을 깔끔하게 씻어 준 후에 한번 살짝 데쳐 줍니다.

거기에 쉽게 구할 수 있는 무쌈과 오이를 넣고 간단하게 만드는 톳샐러드입니다.

​

새콤하면서도 달콤하고 바다의 향이 물씬 풍기면서

오돌오돌 씹히는 톳의 식감이 좋은 톳샐러드입니다.","[{'step_number': 1, 'description': '염장된 톳은 계속해서 염분기를 빼주면서 씻어 준비하고 팔팔 끓은 물에 톳을 넣고 한번 살짝 데쳐 줍니다. 그래야 위생에도 좋고 안전하기 때문이지요. 오이는 채썰어서 넣어 줍니다. 톳도 길이가 길면 잘라서 넣어 주시면 됩니다.', 'image_url': 'https://recipe1.ezmember.co.kr/cache/recipe/2020/09/11/c11ba4560ba440cd9f0884dba7e42ef91.jpg'}, {'step_number': 2, 'description': '쌈무입니다. 쌈무를 오이랑 비슷하게 채썰어 준비합니다.', 'image_url': 'https://recipe1.ezmember.co.kr/cache/recipe/2020/09/11/1655c3a4af90ecb890d3bff61d695e7c1.jpg'}, {'step_number': 3, 'description': '쌈무도 넣어 주고요. 그럼 양념만 해주면 끝!!!', 'image_url': 'https://recipe1.ezmember.co.kr/cache/recipe/2020/09/11/1c9a0d00b7be91fb5397d05f422c9e851.jpg'}, {'step_number': 4, 'description': '아주 간단한 양념!! 식초와 설탕만 들어가면 됩니다. 다른 재료 없이 쉽고 간단하게 만드실 수 있어요. 참기름..아니요 아닙니다. 그냥 식초와 설탕만 있으면 끝!!!', 'image_url': 'https://recipe1.ezmember.co.kr/cache/recipe/2020/09/11/bd9a0599a6571b495ef2d4006a5f64181.jpg'}, {'step_number': 5, 'description': '상큼하고 새콤하고 달콤한 톳샐러드 완성입니다. 톳의 식감도 좋고 쌈무와 오이의 아삭함도 좋고요. 새콤한 맛을 좋아하시는 분들한테는 강추인 톳샐러드입니다.', 'image_url': 'https://recipe1.ezmember.co.kr/cache/recipe/2020/09/11/ed639e609483014878a866d6a514956f1.jpg'}]"
159644,샐러드,다이어트,해물류,무침,「해산물요리」키조개 관자와 야채 샐러드(&플레인 드레싱),관자야채샐러드,https://recipe1.ezmember.co.kr/cache/recipe/2018/02/01/579dd334f373cc9f556100e0eb1e90471.jpg,"6,156",30분 이내,초급,2인분,"[('키조개 관자', '5개'), ('야채', '150g'), ('고추냉이                                                                                페이스트 or 생타입', '1t'), ('올리브유', '2T'), ('곡물(현미)식초', '2T'), ('소금', '1꼬집'), ('흑후추', '1꼬집')]","제가 해산물 요리 중 가장 좋아하는 식재료인 키조개 관자로, 맛있는 야채샐러드를 만들었어요 :)
비결은 플레인 드레싱과 고추냉이~!~
흐흐. 
지금부터 보여드릴께요! :-) 
고고씽!!!!!","[{'step_number': 1, 'description': '볼에 분량의 드레싱 재료를 넣고 분리 되지 않도록 섞어줍니다. 여기에 고추냉이 페이스트를 넣고 섞어주세요.', 'image_url': 'https://recipe1.ezmember.co.kr/cache/recipe/2018/02/01/8d9d2f5453d12c29a298d2707da721441.jpg'}, {'step_number': 2, 'description': '물을 자작하게 해서 반을 자른 가리비를 넣고 속이 익을때까지 삶아주세요.기름을 넣지않고 건강하게 물로 볶는 방법이랍니다! :)', 'image_url': 'https://recipe1.ezmember.co.kr/cache/recipe/2018/02/01/f9dce901b70d3a8e22c72f1f80de84101.jpg'}, {'step_number': 3, 'description': '다른 볼에 키조개와 야채, 만들어놓은 고추냉이 플레인 드레싱의 절반을 넣고 가볍게 무쳐주세요.', 'image_url': 'https://recipe1.ezmember.co.kr/cache/recipe/2018/02/01/6f63ae361c8c0fcd96f56423615a03d21.jpg'}, {'step_number': 4, 'description': '그릇에 담고 마무리로 남은 드레싱을 전체에 고루 뿌려주시면 완성이에요 :)', 'image_url': 'https://recipe1.ezmember.co.kr/cache/recipe/2018/02/01/941f3d3e8957b1ec57084515967d70771.jpg'}, {'step_number': 5, 'description': '채소 본연의 맛을 살려주는 플레인 드레싱에 고추냉이를 더한 알싸함이 일품인,\n키조개 관자 샐러드~!~\n:-)\n생야채의 신선함과 키조개가 어우러진 그맛이 너무 좋아서,\n오늘도 순식간에 한접시 뚝딱!\n^^;;\nㅎㅎ\n저는 다시 올께요\n맛있고 행복한 하루 보내세요!\n씨유쑨!\n♥', 'image_url': 'https://recipe1.ezmember.co.kr/cache/recipe/2018/02/01/a41f87dae5041a5f3a95df74a561f0cf1.jpg'}]"
