index,종류별,상황별,재료별,방법별,글 제목,레시피이름,레시피이미지,조회수,조리시간,난이도,인분,재료,소개글,조리순서
169590,차/음료/술,일상,과일류,절임,체리청으로 체리콕 만들기 말복에 새콤달콤 시원하게 마셔요 :),체리청,https://recipe1.ezmember.co.kr/cache/recipe/2020/08/13/3aa4a0048895427aeadc260026a733fa1.jpg,"5,005",10분 이내,중급,2인분,"[('체리', '390g'), ('설탕', '390g'), ('레몬', '1개'), ('식초', '약간'), ('체리청', ''), ('콜라', ''), ('얼음', '적당량'), ('레몬짜개', '')]","집에서 직접 만든 홈메이드 체리청 레시피와 
체리청과 콜라의 조합으로 만든 체리콕 레시피를 
함께 알려드리려고 해요! 
체리는 그냥 먹어도 좋지만 
체리청을 만들어서 체리콕으로 드시면 
새콤달콤 톡~쏘는 홈카페를 즐기실 수 있어요 *^^* 
체리청&체리콕 만들기 ♥ 
우리 함께 시원하게 즐겨보아요 :)","[{'step_number': 1, 'description': '홈메이드 체리청을 만들기 위해 \n필요한 재료들을 먼저 알려드릴게요!체리 390g, 설탕 390g, 레몬 1개, 식초 약간레몬 짜개 ,  500ml짜리 유리병', 'image_url': 'https://recipe1.ezmember.co.kr/cache/recipe/2020/08/13/011e21e62495a76471a6594f6ae56ee51.jpg'}, {'step_number': 2, 'description': '그럼 먼저 홈메이드 체리청 만들기를 시작할게요~ \n마트에서 산 체리 390g을 믹싱볼에 담아주세요.', 'image_url': 'https://recipe1.ezmember.co.kr/cache/recipe/2020/08/13/1c75f4e87c6a8b64e9f404d37c14e0471.jpg'}, {'step_number': 3, 'description': '그리고 체리의 꼭지를 모두 제거해 줍니다.', 'image_url': 'https://recipe1.ezmember.co.kr/cache/recipe/2020/08/13/f5f45ba788e6312b208b4a6cf990e9051.jpg'}, {'step_number': 4, 'description': '꼭지가 모두 제거된 체리들은 찬물에 담가주세요. \n찬물에 담가진 체리들에게 식초를 약간 넣고 \n30초 정도 골고루 잘 섞어주면서', 'image_url': 'https://recipe1.ezmember.co.kr/cache/recipe/2020/08/13/ceaad4dbb5e9bf092d8bdf889a8fa2131.jpg'}, {'step_number': 5, 'description': '체리들을 씻어줍니다.', 'image_url': 'https://recipe1.ezmember.co.kr/cache/recipe/2020/08/13/ae5a40ed135bba366fb833ce0a2c527a1.jpg'}, {'step_number': 6, 'description': '식초물에 깨끗하게 씻어준 체리들은 \n물기를 제거해 주어야 해요~ \n넓은 쟁반에 키친타월을 깔아주세요. \n그리고 그 위에 깨끗하게 씻어준 체리들을 모두 올려 \n물기를 제거해주세요.', 'image_url': 'https://recipe1.ezmember.co.kr/cache/recipe/2020/08/13/721ab6d34b55932cd7a0ed66b68130ea1.jpg'}, {'step_number': 7, 'description': '이제 체리의 씨를 제거해 줄게요~', 'image_url': 'https://recipe1.ezmember.co.kr/cache/recipe/2020/08/13/4ecc0d75df26c16ab0ad31a8ebe8f0741.jpg'}, {'step_number': 8, 'description': '칼을 이용해서 체리를 반으로 칼집을 내어 돌려주면 \n체리가 딱! 반쪽이 돼요ㅋ', 'image_url': 'https://recipe1.ezmember.co.kr/cache/recipe/2020/08/13/87e3d506115d47005cb2b2043ee2bd251.jpg'}, {'step_number': 9, 'description': '반쪽으로 잘라진 체리의 가운데에 있는 씨를 쏙~ 빼주세요. \n나머지 체리들도 같은 방법으로 씨를 제거해줍니다. \n체리의 씨를 쉽게 제거할 수 있는 기계를 사용하셔도 좋아요~', 'image_url': 'https://recipe1.ezmember.co.kr/cache/recipe/2020/08/13/55f8196d9518adf46fef6048e7f0ee591.jpg'}, {'step_number': 10, 'description': '요렇게 저는 하나하나 손수 체리들의 씨를 \n쏙쏙 제거해 주었어요 ^^', 'image_url': 'https://recipe1.ezmember.co.kr/cache/recipe/2020/08/13/bcc1dbd2320021e908581371ed0b441e1.jpg'}, {'step_number': 11, 'description': '체리청에 사용될 레몬즙도 직접 짜서 사용할게요. \n레몬 1개는 찬물에 깨끗하게 씻어서 준비해주세요.', 'image_url': 'https://recipe1.ezmember.co.kr/cache/recipe/2020/08/13/b6ecd07384dcf3821116fdea6866eab21.jpg'}, {'step_number': 12, 'description': '씻어준 레몬 1개는 반으로 잘라줍니다.', 'image_url': 'https://recipe1.ezmember.co.kr/cache/recipe/2020/08/13/b6053620fe0d23f5156748328f425c151.jpg'}, {'step_number': 13, 'description': '반으로 잘라준 레몬은 레몬 짜개를 이용해서 \n레몬즙을 쫘아악 짜주세요ㅋ', 'image_url': 'https://recipe1.ezmember.co.kr/cache/recipe/2020/08/13/75a00bfbb2a89ce1c2ae075e9739ebf11.jpg'}, {'step_number': 14, 'description': '시중에서 파는 레몬을 직접 레몬 짜개를 이용해서 짠 \n레몬즙을 사용하셔도 좋구요~ \n인터넷이나 마트에서 파는 레몬즙을 사용하셔도 좋아요 ^^', 'image_url': 'https://recipe1.ezmember.co.kr/cache/recipe/2020/08/13/42cf6b6a4edf8e6f35b2d7ec7007f0b91.jpg'}, {'step_number': 15, 'description': '500ml짜리 유리병에 체리청을 만들기 위해 \n필요한 재료들을 차곡차곡 담아주시면 되는데요!', 'image_url': 'https://recipe1.ezmember.co.kr/cache/recipe/2020/08/13/95dd5c345d7e845c42f8aff4fd42b8c11.jpg'}, {'step_number': 16, 'description': '먼저 씨를 제거해 준 체리 1/3 정도 양을 유리병에 담아주세요.', 'image_url': 'https://recipe1.ezmember.co.kr/cache/recipe/2020/08/13/06ad0dc9e1f80c008d47d0a6de686ade1.jpg'}, {'step_number': 17, 'description': '그다음 설탕도 1/3 정도 양을 담아줍니다.', 'image_url': 'https://recipe1.ezmember.co.kr/cache/recipe/2020/08/13/f34d8a87349c47e8fdaff808371169851.jpg'}, {'step_number': 18, 'description': '또 나머지 체리 1/3 정도의 양을 넣어주시구요~', 'image_url': 'https://recipe1.ezmember.co.kr/cache/recipe/2020/08/13/6b60b51bd79fff8d6da53e26c8aa01521.jpg'}, {'step_number': 19, 'description': '설탕도 나머지 1/3 정도 양을 담아주세요.', 'image_url': 'https://recipe1.ezmember.co.kr/cache/recipe/2020/08/13/dbb310fc1b5d50d3d316dd39acd1f85e1.jpg'}, {'step_number': 20, 'description': '그리고 레몬을 직접 짜서 만든 레몬즙을 1/2 정도 넣어줍니다.', 'image_url': 'https://recipe1.ezmember.co.kr/cache/recipe/2020/08/13/aba02207ea046df165831751fc3f7bcd1.jpg'}, {'step_number': 21, 'description': '마지막으로 남은 체리, 설탕, 그리고 \n레몬즙을 모두 넣어주세요.', 'image_url': 'https://recipe1.ezmember.co.kr/cache/recipe/2020/08/13/42aa2ab27dfe647e96618eab36a043fc1.jpg'}, {'step_number': 22, 'description': '500ml짜리 유리병에 체리청이 \n아주아주 꽉꽉 알차게 담겼어요 ^_^', 'image_url': 'https://recipe1.ezmember.co.kr/cache/recipe/2020/08/13/1fabcc90cc249da3832f53040d8838da1.jpg'}, {'step_number': 23, 'description': '보기만 해도 벌써부터 새콤달콤할 것만 같은 체리청이예요!', 'image_url': 'https://recipe1.ezmember.co.kr/cache/recipe/2020/08/13/e5dc54ee764c88af08808c1562d17d751.jpg'}, {'step_number': 24, 'description': '완성된 체리청은 뚜껑을 잘 닫아 냉장고에서 \n2~3일 정도 숙성시켜주면 \n진짜로! 홈메이드 체리청이 완성돼요!', 'image_url': 'https://recipe1.ezmember.co.kr/cache/recipe/2020/08/13/ef15c0610bf04c549ca77d81d1e576481.jpg'}, {'step_number': 25, 'description': '생각보다 체리청 만들기 어렵지 않죠?? ^^', 'image_url': 'https://recipe1.ezmember.co.kr/cache/recipe/2020/08/13/2273aaed1de4206680dcd1c44734d6c51.jpg'}, {'step_number': 26, 'description': '이제 냉장고에서 상큼하게 숙성된 체리청으로 \n홈메이드 체리콕을 만들 거예요 ^^ \n체리청을 냉장고에서 꺼내주세요.', 'image_url': 'https://recipe1.ezmember.co.kr/cache/recipe/2020/08/13/3ed8f59a0c2f7963d750324175f7b0a51.jpg'}, {'step_number': 27, 'description': '홈카페 분위기가 물씬 나는 체리콕을 만들기 위해 \n필요한 재료는요!냉장고에서 상큼하게 숙성된 체리청, 콜라, 얼음 적당량빨대', 'image_url': 'https://recipe1.ezmember.co.kr/cache/recipe/2020/08/13/a248f3034800f3eb4592cb93c950024c1.jpg'}, {'step_number': 28, 'description': '숙성된 체리청이 담긴 병뚜껑을 열어보았어요~ \n체리청 밑에 가라앉은 설탕은 \n길쭉한 숟가락을 이용해서 골고루 잘 섞어주세요.', 'image_url': 'https://recipe1.ezmember.co.kr/cache/recipe/2020/08/13/523914bd039a6a9acf8f7b4460f296611.jpg'}, {'step_number': 29, 'description': '체리가 아주 제대로 숙성된 것 같아요 *^^*', 'image_url': 'https://recipe1.ezmember.co.kr/cache/recipe/2020/08/13/2261c61bd75e2271b32f9965b5d22f541.jpg'}, {'step_number': 30, 'description': '잘 섞어준 체리청은 컵에 적당량 담아주세요.', 'image_url': 'https://recipe1.ezmember.co.kr/cache/recipe/2020/08/13/a1d50bdf1f05a94bf58f4ecf531ebb2e1.jpg'}, {'step_number': 31, 'description': '입맛에 따라 체리청을 담아주시면 돼요~ ^^', 'image_url': 'https://recipe1.ezmember.co.kr/cache/recipe/2020/08/13/4be3863d7b6cb11fa4941e58e9afc18e1.jpg'}, {'step_number': 32, 'description': '그다음, 시원한 얼음을 넣어줍니다. \n저는 컵 하나당 각각 행운의 7 ☆', 'image_url': 'https://recipe1.ezmember.co.kr/cache/recipe/2020/08/13/8fc899e5f56868d8ff59a1e9e316d6b01.jpg'}, {'step_number': 33, 'description': '얼음 7개씩을 넣어주었어용~~~~~~~ \n보기만 해도 시원해보여요ㅋㅋ', 'image_url': 'https://recipe1.ezmember.co.kr/cache/recipe/2020/08/13/90f58e8ea9782cb098faf7e9bdff381e1.jpg'}, {'step_number': 34, 'description': '마지막으로 콜라를 넣어주시면 \n홈메이드 체리콕이 완성된답니다~~', 'image_url': 'https://recipe1.ezmember.co.kr/cache/recipe/2020/08/13/49c759747caa0809ad6db86525ab4ef31.jpg'}, {'step_number': 35, 'description': '콜라를 천천히 담아주시면 사진처럼 체리청과 콜라가 \n완전히 섞이지 않아 \n색깔까지 예쁜 체리콕이 만들어져요!', 'image_url': 'https://recipe1.ezmember.co.kr/cache/recipe/2020/08/13/6e788deaceeb52707a48817645daa7181.jpg'}, {'step_number': 36, 'description': '색감이 고급져보이는 것 같아요~', 'image_url': 'https://recipe1.ezmember.co.kr/cache/recipe/2020/08/13/9d7fc8d405a53835f9618073d76934151.jpg'}, {'step_number': 37, 'description': '제대로 홈카페 분위기를 내보려고 \n체리를 떠먹을 스푼이랑 빨대도 꽂아주었어요 ^_^ \n체리청과 콜라를 골고루 잘 섞어서 \n달콤하고 상큼한 체리콕을 즐기시면 됩니당!', 'image_url': 'https://recipe1.ezmember.co.kr/cache/recipe/2020/08/13/5d3fa938d0d6aed20810fede9377a8f61.jpg'}, {'step_number': 38, 'description': '처음부터 직접 손질해서 만든 체리청으로 만든 \n체리콕이라 그런지 \n더더더 맛있고 상큼해요! \n체리콕을 마시면서 중간중간에 \n체리를 스푼으로 떠먹으면 \n더욱 맛있어요~ \n톡! 쏘는 맛도 매력적이랍니다 ^^', 'image_url': 'https://recipe1.ezmember.co.kr/cache/recipe/2020/08/13/ae376d281c0c70efeb1ab79a0616e6731.jpg'}]"
169591,차/음료/술,일상,과일류,절임,"홈메이드 수제청 자몽청·자몽에이드 레시피, 세척법부터 껍질 까는법",자몽청,https://recipe1.ezmember.co.kr/cache/recipe/2021/09/18/4dd12e26e8cd1cf4105a8c61c13f41231.jpg,"1,653",30분 이내,아무나,2인분,"[('자몽청 및 자몽에이드', ''), ('자몽', '3개'), ('냉수                                                                                또는 탄산수', '적당량'), ('마스코바도설탕                                                                                자몽과 일대일비율', ''), ('식초', '적당량'), ('베이킹소다', '적당량')]","안녕하세요 여사장입니다. 홈메이드 수제청 자몽청·자몽에이드 레시피, 자몽 세척법부터 껍질 까는법을 공유하려고 합니다. 즐겁게 보시고 많은 도움이 되셨으면 좋겠습니다. 오늘도 방문해 주셔서 감사합니다.^^","[{'step_number': 1, 'description': '자몽 3개를 준비합니다.', 'image_url': 'https://recipe1.ezmember.co.kr/cache/recipe/2021/09/20/ef9f6f24d23565c24bb9b8f415bfe0411.jpg'}, {'step_number': 2, 'description': '큰 볼에 물을 받아 자몽 3개를 넣은 다음 베이킹 소다와 식초를 뿌려서 10~20분정도 담가줍니다.', 'image_url': 'https://recipe1.ezmember.co.kr/cache/recipe/2021/09/20/0bae2b8399ab3008d11a079d83c451071.jpg'}, {'step_number': 3, 'description': '10~20분 정도 지난 후 고무장갑을 끼고 자몽을 팍팍 문질러서 깨끗한 물에 여러번 행궈줍니다.', 'image_url': 'https://recipe1.ezmember.co.kr/cache/recipe/2021/09/20/c6efec3dfb7d780bb93fd7cca699bf5d1.jpg'}, {'step_number': 4, 'description': '자몽껍질 벗기는 방법 :자몽 처음과 끝부분을 잘라줍니다.', 'image_url': 'https://recipe1.ezmember.co.kr/cache/recipe/2021/09/20/336671288c0255b7b85a11e2ac58d0a51.jpg'}, {'step_number': 5, 'description': '칼로 가로세로 흠집을 내준다음 손으로 겉껍질을 벗겨줍니다.', 'image_url': 'https://recipe1.ezmember.co.kr/cache/recipe/2021/09/20/37c3d26ee9896c633589788005725bc71.jpg'}, {'step_number': 6, 'description': '얕은 속껍질부분을 칼로 살짝 자른 후 손으로 껍질을 벗겨줍니다.', 'image_url': 'https://recipe1.ezmember.co.kr/cache/recipe/2021/09/20/c30ccc6da580be1fceff9bcf334055081.jpg'}, {'step_number': 7, 'description': '자몽 알갱이를 빼서 그릇에 담아줍니다.', 'image_url': 'https://recipe1.ezmember.co.kr/cache/recipe/2021/09/20/30e56d10b1544aef416930cc222d46631.jpg'}, {'step_number': 8, 'description': '비정제 사탕수수 마스코바도 설탕을 자몽과 같은 비율로 넣어 잘 섞어줍니다.', 'image_url': 'https://recipe1.ezmember.co.kr/cache/recipe/2021/09/20/e459833a1ccdd27aa139007937ee92181.jpg'}, {'step_number': 9, 'description': '빈병 열탕소독법 냄비에 빈병을 넣고 입구부분이 잠길정도로 물을 부은 다음 가스불을 켜서 기포가 생길때까지 끓어줍니다. (빈병을 가스불 켤때 동시에 끓어주셔야 병이 깨지지 않습니다.)', 'image_url': 'https://recipe1.ezmember.co.kr/cache/recipe/2021/09/20/dcb16b6d8d820cc9ef28db7fb91f8b2d1.jpg'}, {'step_number': 10, 'description': '소독한 병에 자몽청을 넣어 냉장보관해줍니다.', 'image_url': 'https://recipe1.ezmember.co.kr/cache/recipe/2021/09/20/3cdf03548d5a62eb14d3ffac124b9f1b1.jpg'}, {'step_number': 11, 'description': '자몽에이드 만들기 재료: 얼음, 자몽청, 냉수 (탄산수도 좋습니다.)', 'image_url': 'https://recipe1.ezmember.co.kr/cache/recipe/2021/09/20/72dd2cf41724c954abc4e72bc14d191a1.jpg'}, {'step_number': 12, 'description': '맛있는 자몽에이드가 완성되었습니다.', 'image_url': 'https://recipe1.ezmember.co.kr/cache/recipe/2021/09/20/876b2ec38d680f739c6844df3af268691.jpg'}]"
169592,차/음료/술,일상,과일류,절임,음료로 먹으면 위에 좋은 사과청과 다이어트에 좋은 사과 식초 그리고 청을 활용해 술로도 쉽게 담그는법,사과청,https://recipe1.ezmember.co.kr/cache/recipe/2021/11/03/08c36730ba6f86192535449f3ae0bd121.jpg,"2,848",2시간 이상,중급,6인분 이상,"[('사과', '5kg'), ('설탕', '5kg'), ('사과청 건더기', '5kg'), ('건강 발효 식초', '4.8L')]","10월이 제철이고 이제 한창인 
가을 사과로 청이나 식초를 만들어 
드시면 위산 역류와 소화불량에
좋고 또 설탕이 들어가지 않은 
식초로 희석해 담는 방법이라 
다이어트에도 좋습니다 그래서
가능한 사과청과 그리고 식초
그리고 사과주를 가능한 자세하게 
만들어봤습니다

그리고 저희도 위가 안 좋아서 
사과청은 음료로 사과 식초는 
희석해서 음료나 요리에
넣어 먹고있습니다 그리고 
위가 특히 안 좋은 분도 
아침 저녁 식 후에 소주 잔 
한잔을 생수 ⑨ 식초 ①로 
희석해서드시면 위가 안 좋아도 
오랫동안드실 수 있어서","[{'step_number': 1, 'description': '① 청을 담을 사과 손질 \n사과 5Kg \n설탕 5kg \n사과를 식초물에 세척한 후\n채칼에 썰어 얇게 준비해줍니다 \n자투리 사과는 칼로 썰어서\n넣어주세요사과 5Kg 설탕 5kg 얇게 잘라야 청이 술냄새가 나기 전에\n드실 수 있습니다 사과 손질법 레시피', 'image_url': 'https://recipe1.ezmember.co.kr/cache/recipe/2021/11/03/4a514b04cf21316543202b247567a57c1.jpg'}, {'step_number': 2, 'description': '②사과청 재워주기\n얇게 자른 사과에 설탕과 \n섞어 둔 다음 30시간 재워줍니다 \n그러면 설탕이 빨리 녹아서 맛도\n좋고 빨리 숙성됩니다 15간격으로\n사과와 설탕을 살살 섞어주면 \n물이 더 많이 나와 빨리 설탕이\n녹습니다 30분이 지난 다음 사과와 \n사과에서 나온 물을 담아 준 다음 \n실내에서 서늘한 곳이나 햇빛이 \n안드는 베란다에 놓고 일주일만 \n숙성해주세요삼투 현상으로 30분동안 과즙을 내서\n설탕을 다 녹인 다음 담아야 빨리 숙성이\n됩니다 안그러면 7일안에는 못 만듭니다', 'image_url': 'https://recipe1.ezmember.co.kr/cache/recipe/2021/11/03/7f0eea0f1fcd738467f0583e7de42be51.jpg'}, {'step_number': 3, 'description': '③ 사과청에서 건더기와 진액 건져내기\n사과청 건더기 5kg \n시중에 파는 건강 발효 식초 (4.8L)약5L \n건강발효식초는 종류별로 있습니다\n현미 레몬 파인애플 사과등등이\n있으니 식성에 맞게 골라주세요\n일주일이 지난 다음 사과청은\n이대로 진액만 따로 건져낸 다음\n사과 식초를 담아주시면 됩니다\n사과청 진액은 생수 ④~⑤ 진액①으로\n희석해서 얼음에 넣고 드시면 \n맛도 좋고 위 건강에도 좋습니다\n사과청 건더기를 오래 담아두면\n술냄새가 나니 건져주시면 되는데\n사과청 건더기가 아까우니 식초를\n넣고 희석해서 음료와 식초대용으로\n신맛을 조금이라도 적게 드실 수 있게\n담아줍니다 \n사과청 건더기 5kg에 시중에 파는 \n건강 발효 중에 하나를식초 사셔서 \n넣으시면 되는데 건강 발효 사과식초는 \n개 당 800ml라서 8개(4.8L) 정도 넣어서\n사과 5kg 건강발효식초 4.8L으로 약 1:1\n비율로 담으시면 됩니다 \n말씀 드렸지만 이미 발효가 끝난 \n사과 식초라 설탕을 넣지 않고도 \n숙성이 돼서 좋고 설탕이 들어가지\n않아 다이어트용에 더 좋을 것 같아\n만들어봤습니다\n사과 식초는 일주일 실내에서 \n서늘 한 곳이나 햇빛이 안 드는 \n베란다에 두시고 음료나 식초 \n대용으로 드시면 됩니다 \n완성된 식초는 \n그냥 먹으면 \n위에 부담이 가니 \n생수 ⑨ 식초 ①로 \n비율로 소주 잔 한 잔만 \n아침 저녁식후에 드시면 \n위가 안 좋은 분도 \n장복 가능합니다건강 발효 사과식초는 \n개 당 800ml라서 8개(4.8L) 정도 넣어서\n사과 5kg 건강발효식초 4.8L으로 약 1:1\n비율로 담으시면 됩니다 \n\n완성된 식초를 그냥 먹으면 \n위에 부담이 가니 \n생수 ⑨ 식초 ①로 \n희석해서 조석으로\n소주잔 한잔을 드시면\n위가 안 좋은 분도 \n오래드실 수 있습니다', 'image_url': 'https://recipe1.ezmember.co.kr/cache/recipe/2021/11/03/126de48c8843103fdf7523849b6c52fb1.jpg'}, {'step_number': 4, 'description': '④ 청 진액으로 사과주 먹는 비율\n그리고 \n청 진액 ① 소주 ① \n비율로 타서 드시면 맛도 좋고 \n청 진액에 타서드시는 \n술이라 순해서 여성분들도\n드시면 참 좋습니다 \n청과 식초는 햇빛이 안드는 곳에\n두시면 되며 식초가 워낙 살균력이\n뛰어나서 건더기가 있어도 다 드실 때\n까지 상하지 않으니 걱정말고 드시면\n됩니다 그리고 소주와 청으로 술을 \n만드시고 나면 술은 냉장 보관해주세요 \n그럼 사과청과 사과식초를 \n마치겠습니다청 진액 ① 소주 ① \n\n비율로 타서 드시면 맛도 좋고 \n청 진액에 타서드시는 \n술이라 순해서 여성분들도\n드시면 참 좋습니다', 'image_url': 'https://recipe1.ezmember.co.kr/cache/recipe/2021/11/03/c4c3d9a58ba443775415ed34dd421f171.jpg'}]"
169593,차/음료/술,일상,과일류,절임,[만개백과] EP. 15 때론 시원하고 때론 따뜻하게 레몬청,레몬청,https://recipe1.ezmember.co.kr/cache/recipe/2022/04/12/6544981fff32a6fad4e238d54e08b3931.jpg,434,30분 이내,아무나,6인분 이상,"[('레몬', '4개'), ('설탕', '150g'), ('꿀', '100g'), ('식초', '2숟가락'), ('소금', '적당량'), ('베이킹소다', '적당량')]","요리 초보도 따라할 수 있는 요리 바이블 ‘만개백과’

만개가 알려주는대로 따라하면
요리 초보도 쉽게 만들 수 있어요!

탄산수를 부워 에이드로 만들어도 좋고
목이 칼칼한 봄날 따뜻하게 목을 보호해줄 ‘레몬청’","[{'step_number': 1, 'description': '레몬청을 담을 유리병을 준비하고 냄비에 물을 부어 열탕 소독해 주세요.유리병 , 냄비보관기간이 늘어나요.', 'image_url': 'https://recipe1.ezmember.co.kr/cache/recipe/2022/04/01/64497696bd822add593624058d03db481.jpg'}, {'step_number': 2, 'description': '찬물에 식초를 섞어 레몬을 넣어 약 10분간 담가 놓아요.', 'image_url': 'https://recipe1.ezmember.co.kr/cache/recipe/2022/04/01/85d68ee364b6042e9e861443a137b3561.jpg'}, {'step_number': 3, 'description': '굵은 소금으로 레몬 표면을 닦아요.', 'image_url': 'https://recipe1.ezmember.co.kr/cache/recipe/2022/04/01/9d313bf5ad127e087eac3ec1d41cf9791.jpg'}, {'step_number': 4, 'description': '베이킹 소다로 한번 더 닦아요.', 'image_url': 'https://recipe1.ezmember.co.kr/cache/recipe/2022/04/01/94b0553b2e7a21e1c2eeb66b99f79bd31.jpg'}, {'step_number': 5, 'description': '끓는 물에 약 10초 정도 레몬을 데쳐내요.', 'image_url': 'https://recipe1.ezmember.co.kr/cache/recipe/2022/04/01/b979b3e5a88b7a70d55971db7b1f584c1.jpg'}, {'step_number': 6, 'description': '레몬에 남은 물기를 제거해요.', 'image_url': 'https://recipe1.ezmember.co.kr/cache/recipe/2022/04/01/b8d767c6dbeca30d4d05e8389b727ca61.jpg'}, {'step_number': 7, 'description': '레몬은 양쪽 1/3을 잘라내고 가운데 과육만 얇게 슬라이스해요.레몬의 씨는 쓴맛이 날 수 있으니 꼭 제거해 주세요.', 'image_url': 'https://recipe1.ezmember.co.kr/cache/recipe/2022/04/01/7a76d3c47fbfcb1e89de0448de49230c1.jpg'}, {'step_number': 8, 'description': '양쪽 잘라낸 레몬은 즙을 짜 내요.레몬의 양 끝도 쓴맛의 원인이 될수 있어요.', 'image_url': 'https://recipe1.ezmember.co.kr/cache/recipe/2022/04/01/e4234a5095b5daa5b7675e52c63ba5341.jpg'}, {'step_number': 9, 'description': '썰어놓은 레몬의 무게를 제고 설탕과 꿀을 기호에 맞게 레몬의 무게와 동일하게 준비해요.설탕과 꿀은 기호에 따라 설탕만 넣어도 좋아요.', 'image_url': 'https://recipe1.ezmember.co.kr/cache/recipe/2022/04/01/760896179c2b34e864b6ba8e33f339e91.jpg'}, {'step_number': 10, 'description': '레몬, 설탕, 꿀, 레몬즙을 함께 섞어 열탕 소독한 유리보관 용기에 담아요', 'image_url': 'https://recipe1.ezmember.co.kr/cache/recipe/2022/04/01/77b97d8ea76cfe926525922989ba84f71.jpg'}, {'step_number': 11, 'description': '설탕을 조금 올려 뚜껑을 닫아 완성해요.실온에서 하루 숙성 후 냉장 보관 해 주세요.', 'image_url': 'https://recipe1.ezmember.co.kr/cache/recipe/2022/04/01/7247e42c08f4ee92a608688123a54ceb1.jpg'}]"
