index,종류별,상황별,재료별,방법별,글 제목,레시피이름,레시피이미지,조회수,조리시간,난이도,인분,재료,소개글,조리순서
75112,밥/죽/떡,일상,과일류,볶음,파인애플볶음밥 만들기,파인애플볶음밥,https://recipe1.ezmember.co.kr/cache/recipe/2016/05/06/4180bb828913bc7196d951858c76a1541.jpg,"5,140",15분 이내,초급,2인분,"[('통조림 파인애플', '3개'), ('밥', '2공기'), ('쪽파', '3개'), ('양파', '1개'), ('당근', '1/8개'), ('닭가슴살', '1쪽'), ('굴소스', '1T'), ('후추', '약간'), ('소금', '약간')]","캄파나 웍으로 만드는 캠핑요리 레시피 
캠핑장에서 가볍게, 휘리릭~ 한끼로 먹기 좋은 메뉴로
파인애플볶음밥 소개해드릴께요","[{'step_number': 1, 'description': '볶음밥 만드는거 다들 잘 아실테지만 ^^\n재료를 먹기 좋은 크기로 잘라주시세요', 'image_url': 'https://recipe1.ezmember.co.kr/cache/recipe/2016/05/06/fb6aec278bf08ea7e5c0999ee8f0937f1.jpg'}, {'step_number': 2, 'description': '캄파나 웍을 마체프 전기렌지에 살짝 예열한 다음\n기름을 둘러주세요', 'image_url': 'https://recipe1.ezmember.co.kr/cache/recipe/2016/05/06/0f12082ab3fb3f6fe75f92181defa7bb1.jpg'}, {'step_number': 3, 'description': '밥과 양념, 파인애플을 제외한 재료를 모두 넣고 볶아주세요\n섞여있던 재료를 넣다보니 마체프로는 파인애플이 조금 들어갔는데요\n야채와 닭가슴살이 있는 동안 파인애플이 너무 무를 수 있으니\n파인애플은 나중에 넣어주세요~', 'image_url': 'https://recipe1.ezmember.co.kr/cache/recipe/2016/05/06/9cd9b2f33be4ee754a4877ad3d69900e1.jpg'}, {'step_number': 4, 'description': '볶음밥에 넣으면 감칠맛이 훨씬 살아나는 굴소스와\n소금, 후추 간을 살짝 해서 볶아주시다가', 'image_url': 'https://recipe1.ezmember.co.kr/cache/recipe/2016/05/06/09334dbf561ab8a0d4ddc81e38794e2d1.jpg'}, {'step_number': 5, 'description': '닭가슴살이 익었으면\n밥을 넣어서 잘 섞어주세요', 'image_url': 'https://recipe1.ezmember.co.kr/cache/recipe/2016/05/06/16a46a3acebeb5c8925271f1267a55241.jpg'}, {'step_number': 6, 'description': '잘라놓은 파인애플을 모두 넣고 마지막으로 다시 섞어주세요\n제가 만들어 보니, 파인애플은 많이 넣으수록\n상큼한 맛이 아주 일품이더라고요', 'image_url': 'https://recipe1.ezmember.co.kr/cache/recipe/2016/05/06/79f571bfcacd57f697f7ffbfdaf265e61.jpg'}, {'step_number': 7, 'description': '평범한 볶음밥에 파인애플 하나 더 넣었을 뿐인데\n태국 음식점에서 먹는 볶음밥처럼\n아주 맛나더라고요 ^^', 'image_url': 'https://recipe1.ezmember.co.kr/cache/recipe/2016/05/06/5efbcbd3955ac1ca5f608b4186e1c0171.jpg'}, {'step_number': 8, 'description': '캠핑장에서 남은 재료가지고 만들어 먹기 좋은 레시피인데\n파인애플 통조림 하나 챙겨가서\n파인애플만 넣어도 더욱 맛난 볶음밥이 된답니다~:D', 'image_url': 'https://recipe1.ezmember.co.kr/cache/recipe/2016/05/06/7c732a756eb5ed5adf9ac8f22c2cb8031.jpg'}]"
75113,밥/죽/떡,일상,과일류,볶음,사과 볶음밥,사과볶음밥,https://recipe1.ezmember.co.kr/cache/recipe/2015/08/31/5c15c717df66a03df86a40a1ce61eb66.jpg,"2,896",30분 이내,아무나,1인분,"[('사과', '1/2개'), ('파프리카', '1/2개'), ('양파', '1/2개'), ('밥', '1.5공기'), ('식물성버터', '1큰술'), ('소금', '1작은술'), ('칠리소스', '약간'), ('검은깨', '약간'), ('참깨', '약간')]",아침 사과가 좋다는 건 다 아시죠? 바쁜 아침에 일부러 밥먹고 후식까지 챙겨서 먹기는 힘든데요. 오늘은 잘익은 사과를 넣어서 볶음밥을 준비했습니다. 사과도 있고 야채도 준비되어 있으면 간편하고 싱싱한 아침식단이 되지요.,"[{'step_number': 1, 'description': '잘게 잘라놓은 양파를 팬에 기름을 살짝 두르고 센불에서 익혀줍니다.', 'image_url': 'https://recipe1.ezmember.co.kr/cache/recipe/2015/08/31/c80e5ef72c9fa2b3ef32770fdcc885ad1.jpg'}, {'step_number': 2, 'description': '적당히 잘게 잘라놓은 사과를 팬에 같이 넣어서 중불에서 달달 익혀줍니다.', 'image_url': 'https://recipe1.ezmember.co.kr/cache/recipe/2015/08/31/c46a13b4b2014747b9afdc17a648176b1.jpg'}, {'step_number': 3, 'description': '주황색 파프리카도 넣어서 익혀주고', 'image_url': 'https://recipe1.ezmember.co.kr/cache/recipe/2015/08/31/7dcca356062548248ea498a4ae0599f21.jpg'}, {'step_number': 4, 'description': '칠리소스를 약간 넣어주고 소금으로 살짝 간을 해주세요.', 'image_url': 'https://recipe1.ezmember.co.kr/cache/recipe/2015/08/31/0319f02065c193bf0c6dee6170be90781.jpg'}]"
75114,밥/죽/떡,일상,과일류,볶음,파인애플 볶음밥,파인애플볶음밥,https://recipe1.ezmember.co.kr/cache/recipe/2015/09/14/1162abbc6a9d489c52a6c048a846b4a5.jpg,"3,818",30분 이내,아무나,2인분,"[('밥', '2인분'), ('식용유', '2큰술'), ('칵테일새우', '12마리'), ('완두콩', '1/2컵'), ('삶은 계란', '1개'), ('피망', '약간'), ('건포도', '약간'), ('호두', '약간'), ('카오팟 수파롯 소스', '1.5큰술'), ('후춧가루', '약간')]",파인애플 볶음밥이에요. 파인애플을 반으로 갈라 그 안에 밥을 볶아 넣었더니 더 먹음직하고 보기도 좋네요. 손님이 오셨을 때 밥 대신 내어도 좋을 것 같아요. 파인애플볶음밥 소스인 카오팟 수파롯을 넣었더니 특유의 향이 솔솔 나는 게 이국적인 맛이 나더라구요.,"[{'step_number': 1, 'description': '완두콩은 전자렌지에서 살짝 익혀놓고(2~3분간), 새우는 가운데 내장을 제거하고 2~3등분으로 잘라놓고 파인애플과 피망도 작게 썰어놓아요.전자레인지', 'image_url': 'https://recipe1.ezmember.co.kr/cache/recipe/2015/09/14/b659442417917e0b73aef63cb663b8a91.jpg'}, {'step_number': 2, 'description': '팬에 식용유를 두르고 완두콩과 피망, 새우살을 넣어 달달 볶아 반쯤 익으면~', 'image_url': 'https://recipe1.ezmember.co.kr/cache/recipe/2015/09/14/c4981064409c96de3f5bb8a6effc19c31.jpg'}, {'step_number': 3, 'description': '밥을 넣고 카오팟 수파롯 소스와 함께 모든 재료가 잘 섞여지도록 주걱으로 잘 섞어줍니다. 이때는 잠시 불을 꺼놓고 섞어도 좋고, 아주 약한 불에서 하세요. 밥과 부재료가 다 섞이기도 전에 양념 때문에 아랫쪽이 탈 수 있거든요.', 'image_url': 'https://recipe1.ezmember.co.kr/cache/recipe/2015/09/14/c032137f510b0316b7380a33d3c8e5481.jpg'}, {'step_number': 4, 'description': '마지막으로 파인애플을 넣고 후춧가루로 마무리합니다.', 'image_url': 'https://recipe1.ezmember.co.kr/cache/recipe/2015/09/14/ffac5cdc50b9e60cdb3047b1361988d61.jpg'}, {'step_number': 5, 'description': '마지막에 볶을 때는 불의 세기를 올려서 센 불에서 달달 볶아 수분기를 확 날려주어야 고슬한 볶음밥이 됩니다. 카오팟 수파롯 소스의 독특한 향과 달콤한 파인애플이 맛이 잘 어울리네요. 이 소스가 없으신 분은 굴소스와 카레가루를 적당히 넣어 맛을 내주시면 됩니다.', 'image_url': 'https://recipe1.ezmember.co.kr/cache/recipe/2015/09/14/9aa3fce23efce14fe7b372fa3d6a29ee1.jpg'}, {'step_number': 6, 'description': '파인애플을 횡으로 반 갈라서 파인애플을 꺼내고, 안쪽에 물기를 닦아낸 후 볶음밥을 담아냅니다. 삶은 계란과 새우살 2개 남겼다가 구워서 올렸어요. 바질잎으로 장식했구요.', 'image_url': 'https://recipe1.ezmember.co.kr/cache/recipe/2015/09/14/a11e25c5a61d14aef34c9fbd2a20e6461.jpg'}]"
75115,밥/죽/떡,일상,과일류,볶음,외식이 필요없어요~ 파인애플 오므라이스,None,https://recipe1.ezmember.co.kr/cache/recipe/2015/06/05/1db8c4819f689f25a79174a66a87dc57.jpg,"5,209",None,None,None,[],,[]
75116,밥/죽/떡,일상,과일류,볶음,카레향 가득한 파인애플 볶음밥,파인애플볶음밥,https://recipe1.ezmember.co.kr/cache/recipe/2015/06/08/a1d839cba0a614e3beca48262d445f8b.jpg,"3,405",30분 이내,아무나,1인분,"[('슬라이스 파인애플', '2조각'), ('밥', '1공기'), ('양파', ''), ('당근', ''), ('브로콜리', ''), ('햄', ''), ('달걀', '1개'), ('식용유', '적당량'), ('카레가루', '1ts'), ('피쉬소스', '')]","갑자기 오늘은 카레향이 가득한 ""파인애플볶음밥""이 당기네요. 가끔 요런 달콤한 볶음밥이 먹고 싶더라구요.","[{'step_number': 1, 'description': '볶음밥에 넣을 야채과 파인애플은 먹기 좋은 크기로 썰어 준비해 놓으세요.', 'image_url': 'https://recipe1.ezmember.co.kr/cache/recipe/2015/08/25/7c3821de7f9d597900c658ce81bfbbb81.jpg'}, {'step_number': 2, 'description': '기름을 넣고 달군 팬위에 양파, 당근, 햄을 넣고 양파가 살짝 투명해 질때까지 볶아준뒤, 준비한 밥을 넣고 야채와 골고루 볶아주세요.', 'image_url': 'https://recipe1.ezmember.co.kr/cache/recipe/2015/08/25/b03eba6b536736434514abbaee0ff0d81.jpg'}, {'step_number': 3, 'description': '밥과 야채가 골고루 섞였으면 여기에 카레가루를 넣고 다시 볶아주세요. 카레가루는 원하시는 만큼 넣어주시고, 마지막으로 파인애플과 브로콜리를 넣고 살살 볶아주면 새콤달콤 카레향 볶음밥 완성~', 'image_url': 'https://recipe1.ezmember.co.kr/cache/recipe/2015/08/25/5e86f2bc652d703813629562f3e3bb4c1.jpg'}, {'step_number': 4, 'description': '볶음밥위에 살짝 올려줄 스크램블을 만들어주세요. 달군팬에 기름을 두른뒤 달걀을 넣고 살짝 익기 시작할때 젓가락으로 원을 그리면 익혀주세요.', 'image_url': 'https://recipe1.ezmember.co.kr/cache/recipe/2015/08/25/8fd648fbf49b06172b60e1d009e6dd441.jpg'}, {'step_number': 5, 'description': '요렇게 예쁘게 접시에 담아 내면 완성', 'image_url': 'https://recipe1.ezmember.co.kr/cache/recipe/2015/08/25/d069bbd5eb732b77852e014ad39be52c.jpg'}, {'step_number': 6, 'description': '요건 태국의 피쉬소스에여~ 우리나라 젓갈처럼 만들어낸 액젓같은거죠. 태국요리 전문점에 가면 테이블위에 놓여있는 매운고추를 넣어만든 피쉬소스~ 짭짤한 소스를 볶음밥에 살짝 넣고 비벼 먹으면 짭쪼름한게 다른 반찬은 필요 없어요. 하지만 약간 비리다는 점~', 'image_url': 'https://recipe1.ezmember.co.kr/cache/recipe/2015/08/25/1edfc551213557a070c0285b87cdb82a.jpg'}]"
75117,밥/죽/떡,일상,과일류,볶음,"레스토랑 분위기 물씬, 생토마토 리조또 만들기*.*",생토마토리조또,https://recipe1.ezmember.co.kr/cache/recipe/2020/03/22/b10e6c6eeef4991fa331658b024a0c251.jpg,"2,432",30분 이내,아무나,2인분,"[('토마토', '4개'), ('스팸', '1/2개'), ('김치', ''), ('밥', '1공기'), ('치즈', '2장')]","요즘 토마토에 빠져 살고있어서 집에 토마토가 많은거있죵
그래서 오늘은 생토마토 리조또를 만들어볼거에요!","[{'step_number': 1, 'description': '먼저\xa0토마토3개를 잘 씻어서 껍질이 약간 벗겨질정도만 데쳐주세요', 'image_url': 'https://recipe1.ezmember.co.kr/cache/recipe/2020/03/22/c9787d3095c1f2062e0510c68e63bcbe1.jpg'}, {'step_number': 2, 'description': '스팸1/2캔을 잘게 썰어 볶아주세요', 'image_url': 'https://recipe1.ezmember.co.kr/cache/recipe/2020/03/22/ae9d5cd474bedaf06012893fd5368a6c1.jpg'}, {'step_number': 3, 'description': '스팸이 노릇노릇해지면\xa0김치를 잘게 썰어 같이 볶아주세요', 'image_url': 'https://recipe1.ezmember.co.kr/cache/recipe/2020/03/22/fdcdfb3bc80a9bd1956885fdc90af1ca1.jpg'}, {'step_number': 4, 'description': '데친 토마토는 으깬 후 넣어주세요', 'image_url': 'https://recipe1.ezmember.co.kr/cache/recipe/2020/03/22/ed177694328e98340222cc5e709b99b51.jpg'}, {'step_number': 5, 'description': '토마토소스가 재료들과 잘 어우러지도록 볶은 후\xa0밥1공기를 넣어주세요', 'image_url': 'https://recipe1.ezmember.co.kr/cache/recipe/2020/03/22/3c0908c301b6d8384a6d0a90e8e030a81.jpg'}, {'step_number': 6, 'description': '밥을 섞을때는 불을 끈 후 섞어주세요\n생토마토1개를 잘게 썬 후 넣어주세요', 'image_url': 'https://recipe1.ezmember.co.kr/cache/recipe/2020/03/22/9ea00552e9544eb9f3711f8fe92436011.jpg'}, {'step_number': 7, 'description': '다시 불을 켠 후\xa0치즈2장을 올려주세요\n치즈가 어느정도 녹으면 밥을 잘 섞어주세요', 'image_url': 'https://recipe1.ezmember.co.kr/cache/recipe/2020/03/22/4cfd0d464b71a12e25d46efcc44c39a31.jpg'}]"
75118,밥/죽/떡,일상,과일류,볶음,햄김치볶음밥 아보카도요리 청담동 브런치 김치볶음밥 멋스럽고 우아하게 먹어요,햄김치볶음밥,https://recipe1.ezmember.co.kr/cache/recipe/2022/12/07/f66ce34fac853b24a08d3bd12c48349e1.jpg,"1,738",30분 이내,아무나,2인분,"[('신김치', '2컵'), ('다진대파', '1컵'), ('다진햄', '1컵'), ('캔옥수수', '1컵'), ('계란', '2개'), ('아보카도', '1개'), ('간장', '1큰술'), ('설탕', '1큰술'), ('굴소스', '약간'), ('식용유', '약간'), ('밥', '2공기')]","얼마 전 이웃님의 김치볶음밥 포스팅을 보고 비주얼에 뿅 반해서 당장 따라 만들어봤어요.

​

청담동 어느 카페의 브런치 메뉴로 김치볶음밥이 유명하다고 하더라고요.

​

개인적으로 김치볶음밥도 좋아하고, 아보카도까지 좋아하니 이건 무조건 저의 최애 음식이 될듯해요 ^^","[{'step_number': 1, 'description': '김치볶음밥 재료를 준비해요.\n잘 익은 김치는 가위로 작게 잘라주고요.\n대파, 햄도 모두 송송 썰어요.\n캔 옥수수는 콘치즈 해먹고 조금 남은 게 있어서 준비했어요.(없으면 생략)\n김치볶음밥의 맛은 잘 익은 김치 맛이 90% 차지하죠.김치볶음밥을 해 먹고 싶은데 안 익은 김치밖에 없을 땐 식초 1큰술 넣어서 볶으면 새콤함을 보완할 수 있어요.', 'image_url': 'https://recipe1.ezmember.co.kr/cache/recipe/2022/12/07/bf0ff2cbb123eefcda3fc1712e4469401.jpg'}, {'step_number': 2, 'description': '팬에 오일을 두르고 다진 파를 넣어 파가 나른해지도록 볶아요.', 'image_url': 'https://recipe1.ezmember.co.kr/cache/recipe/2022/12/07/510cb25ff582c7872646f95aafe4011c1.jpg'}, {'step_number': 3, 'description': '파가 투명하게 익으면 송송 썬 김치를 넣고 충분히 볶아 줍니다.', 'image_url': 'https://recipe1.ezmember.co.kr/cache/recipe/2022/12/07/402e30a65daca4f5cb71288710f6b78a1.jpg'}, {'step_number': 4, 'description': '김치도 충분히 볶아지면 햄, 캔 옥수수 넣고 볶아요.', 'image_url': 'https://recipe1.ezmember.co.kr/cache/recipe/2022/12/07/df862f27533f5d8cbf4f55cb0646408d1.jpg'}, {'step_number': 5, 'description': '조금 더 맛있는 김치볶음밥을 만들기 위해 간장으로 불맛을 입혀줘요.\n볶은 재료들을 한쪽으로 밀어놓고 간장 1큰술, 설탕 1큰술을 넣어서 약간 태우듯이 볶아 줍니다.', 'image_url': 'https://recipe1.ezmember.co.kr/cache/recipe/2022/12/07/aa73ac1165464f67853be3422f748f951.jpg'}, {'step_number': 6, 'description': '간장이 바그르르 끓으면 밥 2공기 넣어서 잘 볶아요.\n부족한 간은 굴소스를 약간 추가해 주면 감칠맛 업!', 'image_url': 'https://recipe1.ezmember.co.kr/cache/recipe/2022/12/07/e79ad0245384a958c91cc3817cb0f8a11.jpg'}, {'step_number': 7, 'description': '김치볶음밥 위에 얹을 아보카도 손질을 해요.\n잘 숙성된 아보카도는 칼로 반 자르고요.아보카도 손질법 레시피', 'image_url': 'https://recipe1.ezmember.co.kr/cache/recipe/2022/12/07/854ad329955248b1119ea51c48f41fbf1.jpg'}, {'step_number': 8, 'description': '껍질을 제거해 줍니다.\n손으로 껍질을 살살 벗겨도 되고요.\n수저를 이용해서 움푹 파내도 좋습니다.', 'image_url': 'https://recipe1.ezmember.co.kr/cache/recipe/2022/12/07/498232b4fdb661cbfc7a1c8543cd34181.jpg'}, {'step_number': 9, 'description': '씨가 있는 부분은 씨를 칼로 탁 쳐서 살짝 비틀면 씨가 쏙 분리되는데요.\n저는 숙성이 조금 덜 됐더라고요.\n아무리 씨를 돌려 빼려 해도 안 빠져서 그냥 적당히 잘라 분리했어요. ㅠ', 'image_url': 'https://recipe1.ezmember.co.kr/cache/recipe/2022/12/07/f2c429352228c478974f5699fae154701.jpg'}, {'step_number': 10, 'description': '김치볶음밥 위에 얹을 스크램블도 만든 후 예쁘게 플레이팅 하면 끝이에요.\n계란스크램블을 만들 때는 80% 정도만 익혀줘야 보들보들한 식감을 즐길 수 있어요.', 'image_url': 'https://recipe1.ezmember.co.kr/cache/recipe/2022/12/07/c4ca9f355dfd7664e136d48cde91e4c01.jpg'}, {'step_number': 11, 'description': '김치볶음밥 + 스크램블 + 아보카도 올리면 끝!', 'image_url': 'https://recipe1.ezmember.co.kr/cache/recipe/2022/12/07/2a115dd684fc1833351c5b20c0f3da971.jpg'}]"
75119,밥/죽/떡,일상,과일류,볶음,파인애플 볶음밥 카레볶음밥 새우 볶음밥 만들기 태국식 볶음밥,태국식볶음밥,https://recipe1.ezmember.co.kr/cache/recipe/2024/01/16/54adeb5c2cfaac2c26f3a2c24b563ef51.jpg,687,60분 이내,초급,3인분,"[('파인애플 통조림', '150g'), ('새우', '250g'), ('밥', '420g'), ('소세지', '100g'), ('대파', '60g'), ('양파', '100g'), ('당근', '50g'), ('계란', '2개'), ('편마늘', '3큰술'), ('버터', '2큰술'), ('카레가루', '0.5큰술'), ('굴소스', '1큰술'), ('까나리액젓', '1큰술'), ('진간장', '1큰술'), ('후추', '톡톡'), ('파슬리가루', '톡톡'), ('맛술', '2큰술'), ('후추', '톡톡')]",태국 볶음밥인 파인애플 볶음밥 레시피입니다. 새우 듬뿍 넣고 카레가루도 넣어서 풍미를 살렸어요. 아이들이 참 좋아해요.,"[{'step_number': 1, 'description': '재료 준비했어요.', 'image_url': 'https://recipe1.ezmember.co.kr/cache/recipe/2024/01/16/9ba18247e27766779d4b4f629d4fe4941.jpg'}, {'step_number': 2, 'description': '즉석밥은 데우지않고 그대로 사용해야 밥알이 더 고슬고슬한 볶음밥 만들 수 있어요.', 'image_url': 'https://recipe1.ezmember.co.kr/cache/recipe/2024/01/16/fe5b5ba57c76087e74fd178d19013f451.jpg'}, {'step_number': 3, 'description': '깨끗이 씻은 새우에 맛술 2큰술, 후추 톡톡 뿌린 후 10분간 재워놓아요.볼', 'image_url': 'https://recipe1.ezmember.co.kr/cache/recipe/2024/01/16/68482e01601eb44fc79af79c37da06231.jpg'}, {'step_number': 4, 'description': '파인애플과 새우는 1.5센치 크기로 썰고 마늘은 편썰고 소세지는 1센치 두께로, 대파는 송송, 당근은 0.5센치 크기로, 양파는 1센치 크기로 썰었습니다.도마 , 조리용나이프 , 밧드', 'image_url': 'https://recipe1.ezmember.co.kr/cache/recipe/2024/01/16/798b3afb4bf355ff02829525e3b022231.jpg'}, {'step_number': 5, 'description': '중불에서 후라이팬에 버터 0.5큰술 녹이고 새우, 파인애플 넣고 앞뒤로 노릇노릇하게 구워줍니다. 요건 토핑용으로 쓸거예요.후라이팬 , 요리젓가락중불', 'image_url': 'https://recipe1.ezmember.co.kr/cache/recipe/2024/01/16/65e36a2a5ef59690c8a306b0f3f5bc471.jpg'}, {'step_number': 6, 'description': '중불에서 후라이팬에 버터 1.5큰술 녹이고 당근, 양파, 마늘, 대파, 소세지 넣고 2분간 볶아주세요. 파인애플과 새우 넣고 1분 볶아주고 카레가루 0.5큰술 넣고 섞어줍니다.후라이팬 , 요리스푼중불', 'image_url': 'https://recipe1.ezmember.co.kr/cache/recipe/2024/01/16/05c98c3d5b3d446f6d79ddf50153291a1.jpg'}, {'step_number': 7, 'description': '약불로 줄인후 볶은 재료들은 한쪽으로 밀고 계란 2개 넣어서 스크램블에그 만들어주세요.약불', 'image_url': 'https://recipe1.ezmember.co.kr/cache/recipe/2024/01/16/fc0c909f72758123e0daa6912d2286231.jpg'}, {'step_number': 8, 'description': '스크램블에그와 볶은 재료 섞어준 후 다시 한쪽으로 밀고 진간장 1큰술, 굴소스 1큰술, 까나리액젓 1큰술 넣고 바글바글 끓으면 골고루 섞어줍니다.', 'image_url': 'https://recipe1.ezmember.co.kr/cache/recipe/2024/01/16/0d0df342bc2c945c189c1206a2b594ca1.jpg'}, {'step_number': 9, 'description': '밥 넣고 섞어준 후 중불에서 2분간 볶아주세요.중불', 'image_url': 'https://recipe1.ezmember.co.kr/cache/recipe/2024/01/16/d710065325df7ebeebda97082b6a30431.jpg'}, {'step_number': 10, 'description': '약불에서 6분간 눌려줍니다. 2분에 한번씩 뒤섞어주세요. 불 끄고 후추 톡톡 뿌린 후 섞어주면 완성입니다. 볶음밥을 눌려주면 밥알 하나하나가 노릇노릇해지면서 불맛을 낼수있어요.약불', 'image_url': 'https://recipe1.ezmember.co.kr/cache/recipe/2024/01/16/b6cf0a6747d45530c5a7b0d6ef2db66a1.jpg'}, {'step_number': 11, 'description': '그릇에 랩 씌우고 볶음밥을 담아서 꾹꾹 눌러준 후 오목한 접시에 뒤집어서 넣습니다.랩 , 접시', 'image_url': 'https://recipe1.ezmember.co.kr/cache/recipe/2024/01/16/3bf48963a1ebaff6d390bef831b3e5901.jpg'}, {'step_number': 12, 'description': '구운 파인애플과 새우로 토핑하고 파슬리가루 솔솔 뿌려줍니다.\n카레향 솔솔 나는 맛있는 파인애플 볶음밥 맛있게 만들어 드세요.', 'image_url': 'https://recipe1.ezmember.co.kr/cache/recipe/2024/01/16/f547d8a403427fea29abc05e5be588ba1.jpg'}]"
