index,종류별,상황별,재료별,방법별,글 제목,레시피이름,레시피이미지,조회수,조리시간,난이도,인분,재료,소개글,조리순서
42734,메인반찬,영양식,달걀/유제품,찜,"부드럽게 부풀어오른 ""뚝배기 계란찜""♪",뚝배기계란찜,https://recipe1.ezmember.co.kr/cache/recipe/2015/08/21/6cc7693b796534f2a48db15077a65e841.jpg,"159,075",30분 이내,아무나,4인분,"[('계란', '4개'), ('물                                                                                계란과같은양', ''), ('당근', ''), ('부추', ''), ('파프리카다진거', ''), ('소금', '')]","간단한듯 하면서도 쉽지 않은 계란찜 만들기~
화산이 폭발한 마냥, 가득 부풀어오른 계란찜을 만들려 몇번 도전하다보니 나름대로 황금레시피를 찾은듯해요~ 뚝배기에 넣고 제대로 부풀린 계란찜, 간단하답니다^^","[{'step_number': 1, 'description': '우선 계란4개를 잘 풀어서 소금간을 해주고요~ 계란물을 최대한 많이 저어줘서 부드럽게 만들어 줍니다.\n물도 계란물 양과 동일하게 준비하구요..', 'image_url': 'https://recipe1.ezmember.co.kr/cache/recipe/2015/08/21/6abfac34a58c20b23b2a4a91a3ff63fc1.jpg'}, {'step_number': 2, 'description': '뚝배기에 계란푼것과 물을 넣어서 잘 섞어줍니다.', 'image_url': 'https://recipe1.ezmember.co.kr/cache/recipe/2015/08/21/1db05a0eee5056fa3b0a4549b2c33f7c1.jpg'}, {'step_number': 3, 'description': '당근/부추/빨강 파프리카는 잘게 조금씩 다져주고요~\n야채는 집에 있는 재료 취향껏 하시면 됩니다.', 'image_url': 'https://recipe1.ezmember.co.kr/cache/recipe/2015/08/21/81c7dd3ddc1e900609379e98913a3ff71.jpg'}, {'step_number': 4, 'description': '계란물에 야채 다진걸 넣어서 잘 섞어줍니다.', 'image_url': 'https://recipe1.ezmember.co.kr/cache/recipe/2015/08/21/5b7a4a0f8337a8237b12155389fed2a51.jpg'}, {'step_number': 5, 'description': '뚝배기를 가스불에 올리고 끓여주기 시작하는데.. 처음에는 가장 센불로 해놓으면 됩니다.', 'image_url': 'https://recipe1.ezmember.co.kr/cache/recipe/2015/08/21/8b415450fd4ab3fc576c0185cd2c9f0c1.jpg'}, {'step_number': 6, 'description': '가장자리부터 익기 시작하는게 보이면 가스불을 중불로 낮춰주고요~', 'image_url': 'https://recipe1.ezmember.co.kr/cache/recipe/2015/08/21/1967609c834e4bdca1452ba4d33809b81.jpg'}, {'step_number': 7, 'description': '중불로 낮춘뒤 바로 숟가락을 이용해 한번 섞어줍니다. 그냥 뒤적거리듯이..^^\n그리고 나서 가스불을 약불로 낮춥니다.', 'image_url': 'https://recipe1.ezmember.co.kr/cache/recipe/2015/08/21/5bf66fe289ae4a7bbaea0f21b932e87b1.jpg'}, {'step_number': 8, 'description': '약불인 상태로 가만히 놔두면 계란찜이 점점 부풀어 오르기 시작하는걸 볼 수 있을거예요~ \n부풀어 오른다는건 속까지 잘 익어가고 있다는 증거랍니다.', 'image_url': 'https://recipe1.ezmember.co.kr/cache/recipe/2015/08/21/7b4aaa8607ed7f7fed6bf741930d3caa1.jpg'}, {'step_number': 9, 'description': '가스불을 보시면 알겠지만..아주 약한불입니다. 꺼질듯 말듯...\n뚝배기에 계란찜을 하다보니 뚝배기 자체의 열이 굉장히 많이 발생해서 열전도율이 상당한데요~ 화력조절 잘하시길..', 'image_url': 'https://recipe1.ezmember.co.kr/cache/recipe/2015/08/21/6af1735220ed066e3793568d6bd481971.jpg'}, {'step_number': 10, 'description': '계속 놔두면 이렇게 점점 부풀어 올라서 화산모양(?)이 되어간답니다.\n계란찜 가스불에 올리기 전의 사진과 비교해보시면 상당히 많이 부풀어올랐다는걸 알 수 있을겁니다..^^', 'image_url': 'https://recipe1.ezmember.co.kr/cache/recipe/2015/08/21/2b4600ebf21a711725d1d48156b582ff1.jpg'}]"
42735,메인반찬,영양식,달걀/유제품,찜,"카스테라야 푸딩이야 ""두부계란찜~^^""",두부계란찜,https://recipe1.ezmember.co.kr/cache/recipe/2016/05/12/a4c9c66ee3316e2cf40f696e63200c101.jpg,"19,533",30분 이내,아무나,4인분,"[('두부', '1/4모'), ('계란', '2알'), ('우유', '120ml'), ('애호박', '1/8개'), ('양파', '1/2개'), ('맛간장', '1/2T'), ('설탕', '1/2T')]","7살이된 울딸아이 편식 하는거 없이 뭐든 주는데로 잘먹던 아인데 요즘들어 야채나 두부를 안먹으려고 하네요^^...컸다는 증거겠지요^^
자꾸 고기만 계란만 찾는 아이에게 야채도 두부도 먹일겸 만들었어요^^","[{'step_number': 1, 'description': '재료는 간단해요^^\n아이들이 있는 집이면 어느 집에나 있는 우유 120ml 계란 2알 두부 1/4모 양파1/2개 애호박 1/8개인데요^^\nㅎㅎ 레시피 올리면서 완전 불량주부등극 하겠어요^^\n요즘 게속 게을게을 한다고 장도 안보고 띵굴띵굴 했던이 냉장고가 홀쪽 하다못해 완전 할램이네요^^;;\n당근도 있으시면 넣으셔요^^\n색감적으로나 맛적으로나 더 좋아졌어요^^\n전 없어서..히히히히히히^^', 'image_url': 'https://recipe1.ezmember.co.kr/cache/recipe/2016/05/12/db29ed2d19a6f8eaf058041fc1fe8ae21.jpg'}, {'step_number': 2, 'description': '호박이랑 양파 (그리고 당근도)는 체처서 팬에 한번 볶아 숨을 죽여주세요^^', 'image_url': 'https://recipe1.ezmember.co.kr/cache/recipe/2016/05/12/ca1a6be9ae5c32843f3ff0b3ef010c271.jpg'}, {'step_number': 3, 'description': '두부는 체반이 받쳐 으깨 내리셔두 되는데요^^\n전 약간에 두부식감을 살리려고 칼면으로 으깼어요^^\n칼면으로 서너번 으깼네요^^', 'image_url': 'https://recipe1.ezmember.co.kr/cache/recipe/2016/05/12/461ad921a9ad295addfc677fad71a54c1.jpg'}, {'step_number': 4, 'description': '적당한 그릇에 우유 계란 으깬두부 볶은 야채까지 한데 넣고요\n잘 골고루 석어주세요^^', 'image_url': 'https://recipe1.ezmember.co.kr/cache/recipe/2016/05/12/679770dc280d1a781b9674dd15ede2b61.jpg'}, {'step_number': 5, 'description': '맛간장 1/2T', 'image_url': 'https://recipe1.ezmember.co.kr/cache/recipe/2016/05/12/a5252a9061a2b19bfaba7c26f35dd7761.jpg'}, {'step_number': 6, 'description': '설탕 1/2T널고 잘 섞어주세요\n그런데요^^\n설탕이 제가 넣는 양만큼 넣으면 약간 단맛이 느껴져요^^\n단맛이 싫으시면 빼셔두되요^^', 'image_url': 'https://recipe1.ezmember.co.kr/cache/recipe/2016/05/12/ea6967ed7b65eb7978b0bf0d5a92b5fb1.jpg'}, {'step_number': 7, 'description': '전자렌지에 넣구요^^전자레인지', 'image_url': 'https://recipe1.ezmember.co.kr/cache/recipe/2016/05/12/fb958a108e57461432fa148f26398edd1.jpg'}, {'step_number': 8, 'description': '저희집 전자렌지에 계란찜은 4분 30초예 설정이되어있어요^^....그레서 저는 두번 돌렸어요^^\n총 9분을 돌린거지요^^', 'image_url': 'https://recipe1.ezmember.co.kr/cache/recipe/2016/05/12/3b7b7c3d4ffc2ce16022b4bbe6ce0a291.jpg'}, {'step_number': 9, 'description': '이렇게 완성이되었어요^^\n계란에는 지구상에 존제하는 뇌에 좋은 영양소가 90%이상 들어있데요^^\n성장하는 아이들이나 어르신들 그리고 출산후 깜박깜박하는 주부님들 저처럼 하루 계란 한알 습관들여봐요^^\nㅋㅋ 저도 잘 못해요^^ 마음만', 'image_url': 'https://recipe1.ezmember.co.kr/cache/recipe/2016/05/12/e9ac5ab72e6cb3fa84d2493c2c115bd91.jpg'}, {'step_number': 10, 'description': 'ㅎㅎ 모양은 술빵같은데.....풍딩보다 부드럽고 카스테라보다 촉촉한 영양만쩜 계란찜 완성이예요^^', 'image_url': 'https://recipe1.ezmember.co.kr/cache/recipe/2016/05/12/86c4481922feaffa6a82ac566d67cfaa1.jpg'}, {'step_number': 11, 'description': '통실통실 하지요^^', 'image_url': 'https://recipe1.ezmember.co.kr/cache/recipe/2016/05/12/956e1a827343ccde417c094dd4db05381.jpg'}, {'step_number': 12, 'description': '이건 백종원님께서 겨울에 집밥이었나 3대천왕이었나 \n하튼 방송에서 똥두부(동두부 또는 동파두부)를 이야기 한적있어요^^\n그때 두부를 얼려 끓여먹었는데 와우 감탄했어요\n어쩌다 두부를 잘못 보관해 두부가 얼면 다 버렸었는데\n지금은 마트가면 두부 두모 만한 큰두부있잔아요^^\n그거 사다 8등분해서 1/4씩 따로 포장해 얼려둬요^^\n그레서 찌게나 전골에 넣어먹지요^^\nㅎㅎ 글타고 계란찜에 똥두부 쓰심안되요^^', 'image_url': 'https://recipe1.ezmember.co.kr/cache/recipe/2016/05/12/ba98b223dad65da21590af21c2987a4b1.jpg'}]"
42736,메인반찬,영양식,달걀/유제품,찜,부드러운 새우 계란찜,새우계란찜,https://recipe1.ezmember.co.kr/cache/recipe/2018/01/01/d4657d03a58d28c7d33dae83a5bc36c71.jpg,"13,616",30분 이내,아무나,3인분,"[('계란', '5개'), ('생새우                                                                                냉동', '6마리'), ('대파', '1/3대'), ('당근', '약간'), ('꽃소금', '1티스푼'), ('맛술', '1/2큰술'), ('멸치 다시마 육수', '2/3컵'), ('식용유', '1큰술')]",촉촉하니 부드러운 새우 계란찜 생새우를 넣어 씹히는 식감이 좋은 새우 계란찜 만들기 쉬워요~,"[{'step_number': 1, 'description': '당근,대파는 다지고, 냉동 생새우는 해동 후 작게 썰어 준비합니다 진하게 끓인 멸치 다시마 육수 준비하고~계란을 풀어주세요', 'image_url': 'https://recipe1.ezmember.co.kr/cache/recipe/2018/01/01/e66a03260d4b87d1917872c39129f2371.jpg'}, {'step_number': 2, 'description': '달군 뚝배기 (약불)에 식용유 1 큰 술 두르고 대파를 넣고 볶아 파기름을 내주었어요약불', 'image_url': 'https://recipe1.ezmember.co.kr/cache/recipe/2018/01/01/6fe4b9d325d4d589ca85662b08f15deb1.jpg'}, {'step_number': 3, 'description': '당근 새우 다진것 넣고 살짝 볶아줍니다', 'image_url': 'https://recipe1.ezmember.co.kr/cache/recipe/2018/01/01/404973e0105c0bbfe74a0ef4897e6be11.jpg'}, {'step_number': 4, 'description': '재료가 볶아지면 멸치육수 2/3컵을 넣고 끓입니다중불', 'image_url': 'https://recipe1.ezmember.co.kr/cache/recipe/2018/01/01/511fad0711ebffe00be22106e2371c081.jpg'}, {'step_number': 5, 'description': '육수가 끓으면 풀어둔 계란물을 넣고 바로 저어줍니다', 'image_url': 'https://recipe1.ezmember.co.kr/cache/recipe/2018/01/01/315bd61c63aa0d9512d8be929462d1161.jpg'}, {'step_number': 6, 'description': '가장자리가 몽글몽글 할때 불은 약불로 줄이고 계속 저어 눋지 않도록 젖고 약 70~80% 익으면 깊은 뚜껑덮고 약 1분정도 약불에 두어 익힌 후 불을꺼줍니다', 'image_url': 'https://recipe1.ezmember.co.kr/cache/recipe/2018/01/01/5528bc39fdc9ddb37f711981a64e44721.jpg'}, {'step_number': 7, 'description': '불은 끈 다음 약 1~2분간 뜸 들여주었어요', 'image_url': 'https://recipe1.ezmember.co.kr/cache/recipe/2018/01/01/01495746b4d0ad45c536cdc91bf33fed1.jpg'}, {'step_number': 8, 'description': '부드러운 새우 계란찜이 완성입니다', 'image_url': 'https://recipe1.ezmember.co.kr/cache/recipe/2018/01/01/0093dcd832f511ad9ac304bf58e6ea8e1.jpg'}]"
42737,메인반찬,영양식,달걀/유제품,찜,폭탄계란찜 달걀찜 만들기,폭탄달걀찜,https://recipe1.ezmember.co.kr/cache/recipe/2016/10/05/f0a463505880e358de863c94a4e703141.jpg,"825,662",15분 이내,아무나,4인분,"[('계란', '4개'), ('소금', '약간'), ('맛술', '1큰술'), ('물', '1컵'), ('다진 파', '약간')]",폭탄계란찜~ 오늘은 폭탄 맞은 것처럼 부풀어 올랐다는 일명 폭탄 계란찜을 만들어봤어요 평소 자주 만들어 먹는 편인데 그때그때 모양은 천차만별인게 사진으로 담으려니 타이밍을 못 맞춰 폭탄이 그새 가라앉는 바람에 지난번 계란찜 이후로 오랜만에 올려봤어요 다음엔 중간과정 없이 정말 동그랗게 소복이 올라온 모습을 보여드릴게요^^ ​ 달걀찜이 소복하게 올라와 보기도 좋지만 부들부들 얼마나 맛있게요~ 않으니 걱정마시구요.,"[{'step_number': 1, 'description': '믹서기에 달걀, 소금, 맛술을 넣고 곱게 풀어주고 물과 다진파를 준비합니다', 'image_url': 'https://recipe1.ezmember.co.kr/cache/recipe/2016/10/06/877e7ca4da1efbdc3ee8a8cda5e05ea81.jpg'}, {'step_number': 2, 'description': '뚝배기에 물을 넣고 보글보글 끓으면 달걀물을 넣고 나무주걱으로 잘 저어주는데 이때 불은 강에서 중불로 맞추고 몽글몽글 해질때까지 저어줍니다', 'image_url': 'https://recipe1.ezmember.co.kr/cache/recipe/2016/10/06/4a831822fd52fda81a52f2206e0312af1.jpg'}, {'step_number': 3, 'description': '약불로 줄인 후 파를 조금 뿌리고 밥그릇을 덮은 후 김이 나고 뚜껑이 들썩거리면서 부풀어 오르면 불을 끄고 1분 정도 뜸을 들여줍니다', 'image_url': 'https://recipe1.ezmember.co.kr/cache/recipe/2016/10/06/7af72db829e4bdf558ed41eb1d37b7a91.jpg'}]"
42738,메인반찬,영양식,달걀/유제품,찜,"계란찜 만드는법, 폭탄 계란찜, 부드럽고 맛있어요♬",폭탄계란찜,https://recipe1.ezmember.co.kr/cache/recipe/2016/02/27/5bb0a6afce2b16dfb9f899f61c7ad1921.jpg,"31,979",15분 이내,고급,3인분,"[('계란', '5개'), ('소금', '1작은술'), ('물', '2/3컵'), ('백후추', '약간'), ('미림', '약간'), ('참기름', '약간')]",계란찜 하나만 맛있게 만들면 다른 반찬 필요치 않아요,"[{'step_number': 1, 'description': '폭탄 계란찜 부드럽고 맛있어요\n계란을 깨어서 알끈을 제거하기 위해 체에 걸러준다.\n알끈을 거른 계란 물에 후추, 참기름, 소금, 미림을 넣어 잘 저어 준다.', 'image_url': 'https://recipe1.ezmember.co.kr/cache/recipe/2016/02/27/bad68cd256fd6cc28e757ed4de59bef51.jpg'}, {'step_number': 2, 'description': '믹서기에 계란을 풀어서 냉장고에 하루를 둡니다.\n한꺼번에 해놓으면 편해요.\n단백질을 섭취해야 한다기에 계란찜 자주 해 먹기로 했어요.', 'image_url': 'https://recipe1.ezmember.co.kr/cache/recipe/2016/02/27/853d456f8dccb2df3dad581027dfeedf1.jpg'}, {'step_number': 3, 'description': '뚝배기에 기름을 발라 주세요.\n눌러 붙는것을 막아주고 씻기에도 잘 씻어진답니다.', 'image_url': 'https://recipe1.ezmember.co.kr/cache/recipe/2016/02/27/2403415622fc299811810b10dd5f37841.jpg'}, {'step_number': 4, 'description': '물 2/3컵을 준비해요.\n뚝배기에 기름을 바르면 눌러 붙어도 잘 벗겨져요.', 'image_url': 'https://recipe1.ezmember.co.kr/cache/recipe/2016/02/27/45722d460d9b37fad7697618a8d88a451.jpg'}, {'step_number': 5, 'description': '그리고 가스불에 뚝배기를 올린 뒤에 물을 넣어 끓입니다.', 'image_url': 'https://recipe1.ezmember.co.kr/cache/recipe/2016/02/27/59a926d59f27371c4285e0d5e44fbff31.jpg'}, {'step_number': 6, 'description': '물을 끓이다가 푼 계란 물은 넣어줘요. 참기름을 뚝배기에 발랐더니 끓는 물에 기름이 둥둥~~~', 'image_url': 'https://recipe1.ezmember.co.kr/cache/recipe/2016/02/27/f2e1c5e56c20d04a659085ba3cd87c4a1.jpg'}, {'step_number': 7, 'description': '물이 끓을 때 푼 계란 물은 넣어 줘요,', 'image_url': 'https://recipe1.ezmember.co.kr/cache/recipe/2016/02/27/9d1a0e3a793df9372ed18e63bd2a73531.jpg'}, {'step_number': 8, 'description': '불은 센 불로 하면서 타지 않게 긁어주어요.\n타지 않게 긁어주면서 80% 익었을 때 약불에 뚜껑을 덮어 줘요.', 'image_url': 'https://recipe1.ezmember.co.kr/cache/recipe/2016/02/27/84d205f1a0b52f300e27f63efbbe195a1.jpg'}, {'step_number': 9, 'description': '수저가 뻑뻑하게 될때에\n본 그릇 보다 더큰 위쪽이 높은 뚜껑을 덮어주세요.', 'image_url': 'https://recipe1.ezmember.co.kr/cache/recipe/2016/02/27/4ecb84accd83e0df38e30d98cd1b01841.jpg'}, {'step_number': 10, 'description': '폭탄 계란찜이 완성됐어요. 폭탄 맞은 것 같은 주방이네요.', 'image_url': 'https://recipe1.ezmember.co.kr/cache/recipe/2016/02/27/c402404683f1ecc8d8fbc37075f118bf1.jpg'}, {'step_number': 11, 'description': '폭탄 계란찜이 완성 됐어요', 'image_url': 'https://recipe1.ezmember.co.kr/cache/recipe/2016/02/27/470d2af8098752614dbd7989e6a53bd91.jpg'}]"
42739,메인반찬,영양식,달걀/유제품,찜,(대경명란 레시피공모) 명란 단호박 계란찜 한번 드셔보세요~!~,명란단호박계란찜,https://recipe1.ezmember.co.kr/cache/recipe/2015/10/13/9666c17029d31b394d27dbc812a1fcc31.jpg,"2,106",60분 이내,초급,4인분,"[('단호박', '1개'), ('명란젓', '150g'), ('건조 매생이', '1봉지'), ('깻잎', '10장'), ('계란', '2개'), ('피자치즈', '2큰술'), ('맛술', '3큰술')]","젓갈 중에 제일 좋아하는 젓갈은 명란젓갈이랍니다~~
명란젓 1줄만 있으면 따끈한 밥에 비벼서도 먹고 넘 좋아하지요~!~
명란젓갈 그냥 먹어도 너무 맛있지만 조금 색다르게 만들어 보았어요~!~
명란젓갈과 계란을 풀어서 단호박 속에 넣고 쪄주며 아주 맛있는 명란 단호박찜이 완성된답니다~!~

한 끼 식사로 명란 단호박찜 한 조각만 먹어도 속이 든든하지요~!~","[{'step_number': 1, 'description': '명란젓 갈이 양념이 되어 있어서 소금은 안 넣어도 싱겁지 않아요~!~', 'image_url': 'https://recipe1.ezmember.co.kr/cache/recipe/2015/10/13/66f79e1f21ab327afb268a4aff10a48f1.jpg'}, {'step_number': 2, 'description': '단호박은 윗부분을 자른 다음 속을 파내어 준비했어요~!~\n명란젓을 껍질을 벗겨 놓았지요~~~\n깻잎은 채 썰어 준비하고요~~\n건조 매생이는 물에 담가서 풀어 놓았어요~~~', 'image_url': 'https://recipe1.ezmember.co.kr/cache/recipe/2015/10/13/e9e5fac3fc04e56ae6d43ebc97e973db1.jpg'}, {'step_number': 3, 'description': '물에 풀어놓은 매생이는 물기를 꼬옥 짜줍니다~!~', 'image_url': 'https://recipe1.ezmember.co.kr/cache/recipe/2015/10/13/8bcd4b0c36e94a14e84737e9200f04231.jpg'}, {'step_number': 4, 'description': '계란은 풀어 주고 매생이는 먹기 좋게 잘라 놓았어요~!~', 'image_url': 'https://recipe1.ezmember.co.kr/cache/recipe/2015/10/13/8cd3a067d4a11bfc426ea15b477a763c1.jpg'}, {'step_number': 5, 'description': '풀어놓은 계란에 매생이와 명란젓을 넣고 잘 섞어주었어요~!~\n잘 섞어준 계란 물은 단호박에 부어주었지요~!~', 'image_url': 'https://recipe1.ezmember.co.kr/cache/recipe/2015/10/13/6747cb2142e6f32ff7ae10a097e2fdb71.jpg'}, {'step_number': 6, 'description': '위에 피자치즈를 조금 올려주었어요~~(생략 가능)\n잘라놓은 호박 윗부분을 덮어주고 은박지로 싸주었지요~!~', 'image_url': 'https://recipe1.ezmember.co.kr/cache/recipe/2015/10/13/a2b9b7cacf431968117746374f191b001.jpg'}, {'step_number': 7, 'description': '180도 예열한 오븐에 40분 구워 주었어요~!~\n중간에 한번 꺼내보니 단호박 뚜껑을 덮어주면 익는 시간이 더 걸려서 \n뚜껑을 열어놓고 구워주었어요~!~오븐', 'image_url': 'https://recipe1.ezmember.co.kr/cache/recipe/2015/10/13/aeb495f3f565ba2c4efa7b393981a1021.jpg'}, {'step_number': 8, 'description': '잘 익었기에 먹기 좋은 크기로 잘라준 다음 가운데 채 썰은 깻잎을 올려주었지요~!~\n단호박 한쪽에 깻잎도 같이 먹으면 향긋한 깻잎 향이 어우러져 아주 고소하고 상큼하답니다\n중간에 명란알이 톡톡 터져서 씹는 식감도 넘 괜찮아요~!~\n단호박의 달큼함과 명란젓갈의 맛과 잘 어우러진 계란찜이 \n밥반찬으로도 남편들 술안주로도 정말 괜찮을 것 같지 않나요\n명란젓갈의 짠맛도 계란과 단호박이 잡아 주어 저염식 완소 반찬도 된답니다~!!\n명란 단호박 계란찜~정말 맛있어요\n여러분들도 한번 만들어 보세요\n만들기도 쉽고 맛도 있답니다~!~', 'image_url': 'https://recipe1.ezmember.co.kr/cache/recipe/2015/10/13/773bd45f2fd56aea93c2b88abb4b81361.jpg'}]"
42740,메인반찬,영양식,달걀/유제품,찜,폭탄 계란찜 달걀찜 만드는 법 풍성하게 부풀어 오르게 하는 비법,폭탄계란찜,https://recipe1.ezmember.co.kr/cache/recipe/2024/06/06/9304c539e222ff857852490b0bcf19d41.jpg,"6,047",10분 이내,초급,2인분,"[('계란', '4개'), ('대파', '10cm'), ('베이킹파우더', '1/2T'), ('물', '150~200ml'), ('액젓', '1/2T'), ('참기름', '1T'), ('소금', '1t'), ('후추', '')]",아이들이 좋아하는 초간단 계란찜입니다. 풍성하게 부풀어 오르게 하는 비법 알려드려요.,"[{'step_number': 1, 'description': '계란 4개, 대파를 준비', 'image_url': 'https://recipe1.ezmember.co.kr/cache/recipe/2024/06/06/362f7cb1ffff9f91b5da578a0c1f97731.jpg'}, {'step_number': 2, 'description': '대파는 쫑쫑 썰어 준비하고도마 , 조리용나이프대파 손질법', 'image_url': 'https://recipe1.ezmember.co.kr/cache/recipe/2024/06/06/c8bde1c096145c9fda3f7131ad35dd3e1.jpg'}, {'step_number': 3, 'description': '베이킹파우더 1t, 소금을 계란에 넣고 풀어준다.볼 , 조리용스푼', 'image_url': 'https://recipe1.ezmember.co.kr/cache/recipe/2024/06/06/b5cb58192a983e8ff918ea471f5d86bb1.jpg'}, {'step_number': 4, 'description': '계란에 대파를 넣은 다음 잘 저어준다.', 'image_url': 'https://recipe1.ezmember.co.kr/cache/recipe/2024/06/06/72f7b3d6882ee0739e99f217ad48ef1c1.jpg'}, {'step_number': 5, 'description': '중 불에 달군 뚝배기를 식용유를 살짝 발라준다.뚝배기', 'image_url': 'https://recipe1.ezmember.co.kr/cache/recipe/2024/06/06/1807200c4508ce19ade08a02511185291.jpg'}, {'step_number': 6, 'description': '물은 계란 1:1 또는 살짝 부족하게 넣고 물에 액젓을 넣는다.', 'image_url': 'https://recipe1.ezmember.co.kr/cache/recipe/2024/06/06/097179e17bc4dbd9fd0bbb5ba2fafdcb1.jpg'}, {'step_number': 7, 'description': '물이 끓어 오르면 계란 물을 붙고 중 불로 줄인 다음 계란을 살살 저어준다.', 'image_url': 'https://recipe1.ezmember.co.kr/cache/recipe/2024/06/06/d6508766f729430e4682b92bfa206e8b1.jpg'}, {'step_number': 8, 'description': '불을 끄고 마무리로 참기름과 후추를 뿌린 다음 밥 그릇을 위에 덮어준다.', 'image_url': 'https://recipe1.ezmember.co.kr/cache/recipe/2024/06/06/15b781338561a6c2c528c2e5a2f132c11.jpg'}, {'step_number': 9, 'description': '계란이 부풀어 오르는 공간을 주기 위해 위 공간이 넉넉한 그릇을 덮어주면 된다.그릇', 'image_url': 'https://recipe1.ezmember.co.kr/cache/recipe/2024/06/06/c1b99ab3f1621ebd00a5a2078182085d1.jpg'}]"
42741,메인반찬,영양식,달걀/유제품,찜,계란찜레시피 폭탄계란찜 초간단,폭탄계란찜,https://recipe1.ezmember.co.kr/cache/recipe/2024/05/03/f5ed65c96cfa3d5070f862b7ccc6f87a1.jpg,212,20분 이내,초급,3인분,"[('계란', '5개'), ('참치액', '1T'), ('소금', '3꼬집'), ('물', '150ml'), ('참기름', '1스푼'), ('통깨', '약간')]",뚝배기에서 가열해 끓여 만든 폭탄계란찜입니다 약 15분만 가열하면 진짜 맛난 계란찜이 완성됩니다~,"[{'step_number': 1, 'description': '계란 5개를 담아준다볼', 'image_url': 'https://recipe1.ezmember.co.kr/cache/recipe/2024/05/03/4221ff72c4dbb6693fe825ce41c312cc1.jpg'}, {'step_number': 2, 'description': '참치액 1T, 소금 3꼬집을 넣어준다', 'image_url': 'https://recipe1.ezmember.co.kr/cache/recipe/2024/05/03/723d96d6a129be1ffcd273f278839fa11.jpg'}, {'step_number': 3, 'description': '물 150ml를 넣고 고루 섞어준다거품기', 'image_url': 'https://recipe1.ezmember.co.kr/cache/recipe/2024/05/03/5ca50f2faae5da14b59b5af752acb13b1.jpg'}, {'step_number': 4, 'description': '참기름 1스푼을 뚝배기에 고루 꼼꼼하게 발라준다뚝배기', 'image_url': 'https://recipe1.ezmember.co.kr/cache/recipe/2024/05/03/2db9ca11c6aa28d9e2578df008cf32031.jpg'}, {'step_number': 5, 'description': '계란을 체에 받쳐 알끈을 제거하면서 담아준다채망', 'image_url': 'https://recipe1.ezmember.co.kr/cache/recipe/2024/05/03/2d3e05d95faee188eaa0b11a80f8267e1.jpg'}, {'step_number': 6, 'description': '중약불에 올려 계란이 살짝 몽글몽글 해 질때까지 저어준다요리스푼중약불', 'image_url': 'https://recipe1.ezmember.co.kr/cache/recipe/2024/05/03/fa7c07dfa5d831ab9d481962e68c8dd91.jpg'}, {'step_number': 7, 'description': '뚜껑을 덮고 약불에서 약 15분 가량 가열한다약불', 'image_url': 'https://recipe1.ezmember.co.kr/cache/recipe/2024/05/03/1332e9cd2dc2507dbc4570af68ccdf671.jpg'}, {'step_number': 8, 'description': '보글보글 끓기 시작하면 약 2분 가량 더 가열한다약불', 'image_url': 'https://recipe1.ezmember.co.kr/cache/recipe/2024/05/03/629447baeacde3da3374649d03f6df621.jpg'}, {'step_number': 9, 'description': '봉긋하게 계란찜이 올라오면 불을 끈다', 'image_url': 'https://recipe1.ezmember.co.kr/cache/recipe/2024/05/03/688b04c5de65955057eacafb81ad6abb1.jpg'}, {'step_number': 10, 'description': '참기름 약간과 통깨 약간을 솔솔 뿌려준다', 'image_url': 'https://recipe1.ezmember.co.kr/cache/recipe/2024/05/03/af9b7140af01724aa9b3583dc4524f9e1.jpg'}]"
