index,종류별,상황별,재료별,방법별,글 제목,레시피이름,레시피이미지,조회수,조리시간,난이도,인분,재료,소개글,조리순서
50688,국/탕,영양식,닭고기,끓이기,보양식~ 닭도리탕만드는법,닭도리탕,https://recipe1.ezmember.co.kr/cache/recipe/2016/11/10/30d81da1a1981210ace8dd71619196ce1.jpg,"3,665",60분 이내,중급,4인분,"[('토종닭', '1마리'), ('미림', '2T'), ('감자', '5개'), ('양파', '1.5개'), ('당근', ''), ('다진마늘', ''), ('대파', '1대'), ('청양고추', '3개'), ('고추가루', '2'), ('고추장', '1'), ('집간장', '1'), ('간장', '1'), ('새우젓', '1'), ('생강술', '2'), ('설탕', '1'), ('대파', '1대'), ('청양고추', '3개'), ('고추가루', '2'), ('고추장', '1'), ('집간장', '1'), ('간장', '1'), ('새우젓', '1'), ('생강술', '2'), ('설탕', '1'), ('대파', '1대'), ('청양고추', '3개'), ('다진마늘', '')]","시어머님의 비법이 담긴 닭도리탕
이젠 부모님께 보양식으로 대접합니다.","[{'step_number': 1, 'description': '토종닭 1.5Kg 이상 되는 큰닭\n기름은 띠어내고\n물에 깨긋이 씻어요\n토종닭은 운동량이 많아서 기름기도 적답니다.', 'image_url': 'https://recipe1.ezmember.co.kr/cache/recipe/2017/04/12/4ed2b13d76b1875612b2fba5e6c4b31c1.jpg'}, {'step_number': 2, 'description': '감자는 통으로 껍질깍아 준비', 'image_url': 'https://recipe1.ezmember.co.kr/cache/recipe/2017/04/12/dfb35b705b810bc48c9a7085d04a52fb1.jpg'}, {'step_number': 3, 'description': '양파, 당근, 대파,마늘, 청양고추 썰어놓고~', 'image_url': 'https://recipe1.ezmember.co.kr/cache/recipe/2017/04/12/4f33b9289a1d31733adfa3851de14f4b1.jpg'}, {'step_number': 4, 'description': '끓는 물에 튀어내요!~\n물에 양파껍질파잎, 통후추 넣어도 좋아요~\n미림 한술 뿌려서 잡내도 없애구요~', 'image_url': 'https://recipe1.ezmember.co.kr/cache/recipe/2017/04/12/e3f74a4339514063e514e73cac0382671.jpg'}, {'step_number': 5, 'description': '끓는 물에 튀어내어 찬물에 하나하나 씻어서 기름기를 없애줘요~\n자를때 부스러진 뼈도 없애주는 거라지요~\n압력솥에 닭을 담고\n간장, 고추가루,고추장, 설탕, 통마늘,생강술,넣고\n양파도 1개 큼직하게 썰어넣고\n감자도 얹고 물도 2컵 정도 넣고\n압력솥으로 익혀요~빨리 쉽게 닭도리탕만드는방법은\n\n압력솥을 사용하는 거랍니다.', 'image_url': 'https://recipe1.ezmember.co.kr/cache/recipe/2017/04/12/74baa273824fa7b155e8416278d4472a1.jpg'}, {'step_number': 6, 'description': '밥하듯 추가 울리면 불줄여 3분정도 두었다가\n압을빼고 물을 더 붓고 끓여요!~\n국물 떠먹는 걸 좋아해서 넉넉히 물 붓고 졸였답니다.\n간은 새우젓으로~\n청양고추,대파,당근, 다진마늘,양파 더 넣고 팔팔 끓여요~\n이때는 그냥 뚜껑열고 끓입니다.\n뚜껑덮고 끓여도 압력으로 안하고 그냥 냄비로~\n처음넣은 양파는 모양도 없이 국물에 녹아나며 \n단맛도 주고 맛나진다죠~\n감자 통째로 넣어서 부스러지지도 않고 굿~', 'image_url': 'https://recipe1.ezmember.co.kr/cache/recipe/2017/04/12/9fe1a021c422e6cb15b49789029d41361.jpg'}]"
50689,국/탕,영양식,닭고기,끓이기,삼계탕 & 해신 탕 보양식 만드는방법,삼계탕,https://recipe1.ezmember.co.kr/cache/recipe/2017/07/23/94aa442cb0489182da74ab1be5958c341.jpg,"11,649",60분 이내,초급,3인분,"[('삼계탕용닭', '3마리'), ('전복', '5개'), ('낙지', '4마리'), ('인삼', '3뿌리'), ('한방재료 티백', '1개'), ('대추', '10개'), ('생강', '3쪽'), ('깐 마늘', '1/2줌'), ('찹쌀', '1컵'), ('밀가루', '1'), ('대파', '1대'), ('물', '3L'), ('볶은소금', '적당히'), ('후춧가루', '약간'), ('깨소금', '약간')]",보양식하면 삼계탕이 최고인듯하네요 전복 낙지 인삼등 몸에 좋은 재료 듬뿍넣고 만든 삼계탕 & 해신탕 최고의 보양식 만들기입니다,"[{'step_number': 1, 'description': '찹쌀은 미리 30분정도 불려주고, 깐 마늘, 생강 (슬라이스)3쪽,대추10개를 준비합니다', 'image_url': 'https://recipe1.ezmember.co.kr/cache/recipe/2017/07/23/31d578d1af79b182bbccaff0988216d11.jpg'}, {'step_number': 2, 'description': '인삼은 흐르는물에 부드러운 솔을 사용해 살살 문질러 씻어준 후 인삼의 머리 뇌 두를 잘라주어요인삼의 뇌 두는 독 성분이 있어 안드시는게 좋아요', 'image_url': 'https://recipe1.ezmember.co.kr/cache/recipe/2017/07/23/eeb6045b1ef57ef3975cfd3530e44edf1.jpg'}, {'step_number': 3, 'description': '전복 손질하기- 전복은 솔을 사용해 겉껍질을 깨끗이 씻어주고 살이 있는 부분도 씻어준비합니다전복 손질법 레시피\u200b', 'image_url': 'https://recipe1.ezmember.co.kr/cache/recipe/2017/07/23/5ac166e84509a7145dca9f94d679d0541.jpg'}, {'step_number': 4, 'description': '낙지손질- 볼에 낙지담고 밀가루 수북하게 1넣고 바락바락 문질러 깨끗하게 헹궈줍니다낙지 손질법 레시피', 'image_url': 'https://recipe1.ezmember.co.kr/cache/recipe/2017/07/23/f95c970dc4da593d5a5da963f2aa73cd1.jpg'}, {'step_number': 5, 'description': '닭은 기름 제거하고 몸통안에도 깨끗하게 씻어준비해 찹쌀을 반 정도씩만 넣어주어요찹쌀이 익으면 부피가 많아지게 되어 반정도만 넣어주는게 좋아요', 'image_url': 'https://recipe1.ezmember.co.kr/cache/recipe/2017/07/23/9bfe63ef5c853590d5da6c3b3349b4461.jpg'}, {'step_number': 6, 'description': '닭다리 꼬기- 한 쪽 다리 허벅지 살이 많은곳에 다리 한 쪽이 들어갈 수 있는 길이로 칼집은 넣어주세요', 'image_url': 'https://recipe1.ezmember.co.kr/cache/recipe/2017/07/23/92af8f78acfb6bc03a32cafc6db83a681.jpg'}, {'step_number': 7, 'description': '한 쪽 다리에 집어 넣어줍니다 요염하게 다리를 잘 꼬고있네요~이렇게 다리를 꼬아주면 속의 내용물이 나오질 않고 깔끔하게 된답니다', 'image_url': 'https://recipe1.ezmember.co.kr/cache/recipe/2017/07/23/43c535422e58b96504704f0cb8725de41.jpg'}, {'step_number': 8, 'description': '3인분량으로 찹쌀가루 1컵이면 충분한데요 찹쌀가루 반 컵을 더 불렸어요 나머지 불린 찹쌀은 삼베 주머니에 넣어 묶어 준비했어요찹쌀을 주머니에 넣고 익히게 되면 국물도 깔끔하고 먹기에도 좋아요', 'image_url': 'https://recipe1.ezmember.co.kr/cache/recipe/2017/07/23/44a7e8b1ac6260ffb4d72345f8b05ee41.jpg'}, {'step_number': 9, 'description': '닭,생강,물 3리터 넣고 센 불에서 끓여주세요 중간에 대추도 넣어주었어요 15분정도 팔팔 끓여주세요 끓이는 동안에 소금 양념을 만들어둡니다 대파는 송송 썰어준비해요대추는 미리넣고 끓여야 대추의 단맛이 나옵니다', 'image_url': 'https://recipe1.ezmember.co.kr/cache/recipe/2017/07/23/22249f74a78900926dbbbbbdcef51f681.jpg'}, {'step_number': 10, 'description': '15분 끓이고 중불로 줄이고 마늘 인삼 넣고 15분간 끓여주세요', 'image_url': 'https://recipe1.ezmember.co.kr/cache/recipe/2017/07/23/04bee1ee30a933fb22f763a70a61d39c1.jpg'}, {'step_number': 11, 'description': '15분 끓인 후 인삼은 건져주었어요인삼은 해신탕위에 올려줄 거예요', 'image_url': 'https://recipe1.ezmember.co.kr/cache/recipe/2017/07/23/2b7c51628c65920ce5d56a3dd0071cb31.jpg'}, {'step_number': 12, 'description': '해신탕- 냄비나 뚝배기에 닭 한마리 담고 위에 전복 낙지 새우 닭육수 적당히 붓고 한소끔 끓여주세요', 'image_url': 'https://recipe1.ezmember.co.kr/cache/recipe/2017/07/23/3adacdd68e7311ff6a497ee97250b68e1.jpg'}, {'step_number': 13, 'description': '마지막에 대파 올려 마무리합니다', 'image_url': 'https://recipe1.ezmember.co.kr/cache/recipe/2017/07/23/83d1cf1579f4f2308926d874b1476b041.jpg'}]"
50690,국/탕,영양식,닭고기,끓이기,홍삼백숙&홍삼녹두찹쌀누룽지,백숙,https://recipe1.ezmember.co.kr/cache/recipe/2017/11/09/34673cd2003d49d79c685b45f5a8cc041.jpg,"4,063",60분 이내,아무나,2인분,"[('불린찹쌀', '1컵'), ('녹두', '1줌'), ('소금', '약간'), ('국내산닭', '1마리'), ('홍삼즙', '1포'), ('건대추', '5~6개'), ('청주', '약간'), ('물', ''), ('대파', '1/2뿌리')]",홍삼즙을 넣어 만든 닭보야요리!!,"[{'step_number': 1, 'description': '닭은 미리 찬물에 담구어 핏물을 제거하고 배를 갈라서 깨끗이 씻어 줍니다\n여기에 뜨거운 물을 고루 부어서 닭의 기름기도 제거하고 누린내나 잡내도 없애 줍니다\n(뜨거운 물을 부으면 닭고기가 수축하면서 더욱 졸깃한 맛도 즐길수 있고, 특히 기름기가 녹아서 빠진답니다)\n큰 건대추도 몇개 준비하고, 압력솥에 닭을 담고 대추도 넣어 줍니다', 'image_url': 'https://recipe1.ezmember.co.kr/cache/recipe/2017/11/09/3ec206e24451ffa69294a5658295d2d21.jpg'}, {'step_number': 2, 'description': '여기에 홍삼즙 1포 다 부어주고, 청주도 살짝 뿌린후 물을 자작하게 부어줍니다\n뚜껑을 덮고 약 7~10분간 익혀 줍니다', 'image_url': 'https://recipe1.ezmember.co.kr/cache/recipe/2017/11/09/63fc3b48addef93a69e7b7a58fe494641.jpg'}, {'step_number': 3, 'description': '찹쌀과 녹두를 준비하여 깨끗이 씻어서 솥에 담아 줍니다\n여기에 홍삼즙 1/2정도 붓고 물을 부은후 밥을 지어 줍니다\n바닥에 누룽지가 생기도록 만들어주면 더욱 맛있는 백숙을 즐길수 있어요', 'image_url': 'https://recipe1.ezmember.co.kr/cache/recipe/2017/11/09/8641c942d6b67ce6550cb255310223171.jpg'}, {'step_number': 4, 'description': '잘 익은 닭고기는 뜯어서 대접에 담고 홍삼을 넣어 지은 녹두찹쌀누룽지밥도 넣어 줍니다\n대파를 송송 썰어서 올려주고, 닭국물을 넉넉히 부어 줍니다', 'image_url': 'https://recipe1.ezmember.co.kr/cache/recipe/2017/11/09/4917f339fdda54bffd4f7a2f3a5b80e71.jpg'}, {'step_number': 5, 'description': '일단 전혀 닭의 좋지 않은 냄새는 없고, 홍삼의 향이 물씬 느껴지면서~~~\n닭도 담백하면서 졸깃하고, 아주 맛있어요\n닭국물이 진하면서 아주 부드러워서 아이들이 먹기에도 아주 좋지요\n삼계탕이나 백숙을 만들때 달리 많느 약재를 넣지 않아도 홍삼만 있으면 아주 맛있는 닭요리를 할수 있답니다\n역시 홍삼이 모든 요리에도 잘 어울리고, 보양식으로도 그만인것 같아요\n국물까지 남김없이 아주 맛있게 잘 먹었답니다^^', 'image_url': 'https://recipe1.ezmember.co.kr/cache/recipe/2017/11/09/00e277f4007523ec53ea7a48086191e91.jpg'}]"
50691,국/탕,영양식,닭고기,끓이기,#닭고기요리 #닭볶음탕만들기 #최애반찬 #닭도리탕양념 #쉽고 빠르게 만드는 닭볶음탕만드는법!!,None,https://recipe1.ezmember.co.kr/cache/recipe/2020/05/22/98c761b820bffadcfd4d4e30b386c4391.jpg,"2,697",30분 이내,아무나,2인분,"[('닭볶음탕용 닭', '1마리'), ('소주', '1큰술'), ('통후추', '1작은술'), ('표고버섯', '3개'), ('감자', '7개'), ('당근', '1/2개'), ('양념장', '3국자'), ('천연조미료해물육수', '4컵'), ('썬쪽파', '1큰술'), ('통깨', '1큰술'), ('고추장', '3큰술'), ('고춧가루', '3큰술'), ('양조간장', '3큰술'), ('다진마늘', '2큰술'), ('썬파', '3큰술'), ('다진생강', '1작은술'), ('맛술', '1큰술'), ('매실액', '2큰술'), ('물엿', '1큰술'), ('후추', '1작은술'), ('천연조미료', '1큰술'), ('천연조미료해물 육수', '1컵')]","닭고기요리 닭볶음탕만들기 닭매운탕만들기 닭도리탕양념만들기

​

닭볶음탕을 무지무지하게 좋아해서 자주 만들어 주는데

이번에 산 하림닭이 거의 토종닭수준으로 어마무시하게 크더라구요.

그리고 역시나 살들이 포실포실하다기보다는 질긴 듯한 느낌도 들었습니다.

나름 이 맛이 질기다고 표현하기 보다는 쫄깃하다고도 할 수 있는데

역시나 입맛과 취향의 차이이겠지요.

​

닭볶음탕 양념은 아주아주 간단합니다. 집에 재료로 충분히 활용할 수 있고요.

거기에 초스피드로 재빠르게 닭볶음탕을 만들 수 있지요.

그리고 무엇보다 기름기가 없고 잡내도 없게 만들 수 있다라는 장점이 있습니다.","[{'step_number': 1, 'description': '양념장부터 만들어 줍니다. 만들어 냉장고에 넣고는 잠시 숙성을 시켜 주려고요. 고춧가루, 고추장, 양조간장, 다진마늘, 썬파, 다진생강, 매실액, 맛술, 물엿, 후추와 더불어서 천연조미료와 천연조미료해물육수를 넣어 줍니다. 잘 섞어 주세요. 잠시 냉장고행!!!', 'image_url': 'https://recipe1.ezmember.co.kr/cache/recipe/2020/05/22/c22e79ad05b43a7de4d63a37f5b6d8501.jpg'}, {'step_number': 2, 'description': '닭볶음탕용 한마리를 물에 넣고 소주를 부어 주고는 한번 살짝 삶아 줍니다. 팔팔 끓어오르면서 이물질들이 올라 오게 됩니다. 그럼 깔끔하고 기름기도 빠진 닭을 만날 수 있지요.', 'image_url': 'https://recipe1.ezmember.co.kr/cache/recipe/2020/05/22/a7b51fbc6a461c79ec84b4726c7c38db1.jpg'}, {'step_number': 3, 'description': '미리 닭볶음탕에 들어가는 재료들을 준비해 놓고 냄비에 넣어 둡니다. 큰냄비여야겠지요. 닭볶음탕이니까요. 냄비에 감자, 당근을 큼지막하게 썰어서 넣어 줍니다. 감자는 작은 감자여서 그냥 통째로 넣어 주었습니다. 표고버섯은 기둥을 제거하고는 역시 통째로 넣어 주었습니다. 오랫동안 푸욱 익힐 것이기 때문에요.', 'image_url': 'https://recipe1.ezmember.co.kr/cache/recipe/2020/05/22/44dc8916eac8bf96fee6a7f34da774251.jpg'}, {'step_number': 4, 'description': '조금더 시간을 단축하기 위해서 양쪽에서 준비를 해 줍니다. 한쪽에서는 닭을 살짝 삶고 있고 다른쪽에서는 다른 재료들이 대기중입니다. 팔팔 끓어오르고 이물질들이 빠져나오고 핏물이 제거되면 살살 건져서는 바로 옆 냄비로 투하합니다. 보통 씻어서 넣는 경우도 있는데 저는 그냥 바로 투하합니다. 팔팔 끓어오르면 이물질과 고기가 분리가 되거든요.', 'image_url': 'https://recipe1.ezmember.co.kr/cache/recipe/2020/05/22/71464710851c63ef30ec57d3c06a8a3c1.jpg'}, {'step_number': 5, 'description': '살짝 삶아낸 닭고기를 재료들 위에 올려 줍니다. 바로 건져서 옆으로 이동하시면 되겠지요.', 'image_url': 'https://recipe1.ezmember.co.kr/cache/recipe/2020/05/22/0f82841b31cf1308dd919eeaad1a16bb1.jpg'}, {'step_number': 6, 'description': '숙성해 놓았던 양념장을 넣어 주고는 천연조미료해물육수를 부어 줍니다. 자작자작하게요. 모든 재료들이 반쯤 잠길때가 좋은 듯 싶어요. 국물이 많은 스타일을 좋아하시면 더 추가로 넣으시면 됩니다. 이렇게 뚜껑을 닫고는 센불에서 팔팔 계속해서 끓여 주다가는 중불로 옮겨서 은근하게 진한 국물맛을 우러내어 줍니다. 중간 중간 뚜껑을 열고는 양념이 골고루 입혀지도록 국물을 끼얹어 주시면 좋습니다.', 'image_url': 'https://recipe1.ezmember.co.kr/cache/recipe/2020/05/22/4aff35c24a6fe46152b9fb88e7419b571.jpg'}, {'step_number': 7, 'description': '감자도 폭신폭신하게 다 익었고요. 당근도 다 익었습니다. 닭도 양념이 잘 스며들어서 잘 익었네요. 국물이 자작해지고 은근하게 계속해서 졸이듯이 끓여 주어서 제대로 잘 완성되었습니다. 마지막으로 통깨 솔솔 뿌려 주고 썬쪽파도 쭈욱 뿌려 주시면 닭고기요리 닭볶음탕 완성입니다.', 'image_url': 'https://recipe1.ezmember.co.kr/cache/recipe/2020/05/22/4505f42463afbf8c8aa57fb30dc65fc31.jpg'}]"
50692,국/탕,영양식,닭고기,끓이기,누구나 만들 수 있는 초스피드 초간단진하고 뽀얀국물에 닭한마리,닭한마리,https://recipe1.ezmember.co.kr/cache/recipe/2020/05/25/736ec9788bc015fb0a090b6eeb5447561.jpg,"2,976",30분 이내,초급,2인분,"[('하림 닭볶음탕용 닭', '1팩'), ('양파', '1/2개'), ('대파 흰부분', '1대'), ('월계수잎', '2~3개'), ('통마늘', '1줌'), ('한방약재', '1팩'), ('커피가루', '1t'), ('간장', '2T'), ('소금', '1T'), ('맛술', '1/2컵')]","영양식 또는 보양식으로 만점인 닭한마리
만들기 복잡하고 손도 많이가는 까다로운 삼계탕 레시피는 이제 그만!
초보자도 쉽게 딱 30분투자로 칭찬받을 수 있는 삼계탕
초스피드 레시피!
뽀얀국물이 진한 닭한마리 함께 만들어보아요♡^^*","[{'step_number': 1, 'description': '먼저 큰 전골냄비에 대파흰부분,양파반개,한방약재1팩과 통마늘 한줌,월계수잎을 냄비에 넣어주세요\n(잡내제거를 위해 저는 여기에 커피가루1t를 넣었어요)', 'image_url': 'https://recipe1.ezmember.co.kr/cache/recipe/2020/05/26/30a819f0a04fe9850edeb95c0d69ee2b1.jpg'}, {'step_number': 2, 'description': '준비된 닭을 흐르는 물에 깨끗히 한번만 씻어주세요\n저는 시중마트에서 흔히 볼 수있는 하림 닭볶음탕용 닭을 사용했어요\n(보통 삼계탕에는 백숙용 닭을 사용하지만, 닭한마리집을 가면 절단되어있는 닭볶음탕 닭으로 많이 조리되서 나오드라구요.손질도 다 되있는 상태라 초보자도 쉽게 누구나 삼계탕을 만들수 있어요^^)', 'image_url': 'https://recipe1.ezmember.co.kr/cache/recipe/2020/05/26/e62452119a4328b88f89059c17035b2d1.jpg'}, {'step_number': 3, 'description': '준비된 닭과 모든재료가 잠길만큼만 물을 붓고 잡내제거를 위해 맛술을 조금 넣어주세요\n그리고 센불에서 팔팔 끓여주세요\n(맛술이 없으면 소주사용 가능)', 'image_url': 'https://recipe1.ezmember.co.kr/cache/recipe/2020/05/26/0ad90b36a10581f2fc3a171d490879d71.jpg'}, {'step_number': 4, 'description': '물이 팔팔 끓기시작하면 불을 줄이고 중불과 약불 사이에서 뚜껑을 닫고 약30분간 끓여주세요\n(팔팔 끓기시작할 때 올라오는 거품을 중간중간 국자로 제거해주시면 훨씬 깔끔한 국물을 드실 수 있어요^^)', 'image_url': 'https://recipe1.ezmember.co.kr/cache/recipe/2020/05/26/c9c11583fd3157636de43491a5475ca71.jpg'}, {'step_number': 5, 'description': '30분후 불을 끄고,소금1T와 간장2T 넣어 간을 맞춰주세요\n진한국물이 일품인 닭한마리 완성입니다!^^*', 'image_url': 'https://recipe1.ezmember.co.kr/cache/recipe/2020/05/26/17a1d1990e7210dc83e28bd3c08bd0b51.jpg'}]"
50693,국/탕,영양식,닭고기,끓이기,낙지넣어 해신탕 못지않은 전복삼계탕 복날 몸보신 든든하게:),전복삼계탕,https://recipe1.ezmember.co.kr/cache/recipe/2020/07/15/5fda070347970235cca02c420d717e0b1.jpg,"6,012",120분 이내,초급,2인분,"[('닭고기', '2마리'), ('전복', '4개'), ('낙지', '2마리'), ('한방팩', '1개'), ('양파                                                                                생략가능', ''), ('대파', '적당량'), ('마늘', '10알'), ('밤', '4알')]","복날 맞이 든든하게 영양듬뿍♡
모두 건강하게 한끼 챙기세요~^^*","[{'step_number': 1, 'description': '한방약재를 물 3리터 정도 넣고 닭 입수 전 20분 끓여주세요. 저는 압력솥 대신 무쇠냄비사용해서 중불로요.', 'image_url': 'https://recipe1.ezmember.co.kr/cache/recipe/2020/07/15/f350de0e4bbf4dc85850c44c41eae8ad1.jpg'}, {'step_number': 2, 'description': '그사이 닭을 씻고 재료를 닭뱃속에 넣고 나무꼬치로 고정합니다.', 'image_url': 'https://recipe1.ezmember.co.kr/cache/recipe/2020/07/15/3a610ecffd6aa24f1947f99a1b51ffdb1.jpg'}, {'step_number': 3, 'description': '준비되면 미리 준비한 한방재가 들어간 육수에 닭과 양파 마늘 표고버섯넣어요. (양파랑 표고버섯은 생략가능)\n뚜껑닫고 1시간 푹 끓여줍니다.', 'image_url': 'https://recipe1.ezmember.co.kr/cache/recipe/2020/07/15/09e7674bf76cc2e1b10b80131cc145c91.jpg'}, {'step_number': 4, 'description': '한시간 뒤 진하고 부드럽게 잘끓여졌어요.', 'image_url': 'https://recipe1.ezmember.co.kr/cache/recipe/2020/07/15/d31cb79cb100f539697aa9954d17f2721.jpg'}, {'step_number': 5, 'description': '2인분이라 각각 냄비에 따로 담고,', 'image_url': 'https://recipe1.ezmember.co.kr/cache/recipe/2020/07/15/99dcc653d0a02afbae0ffa82895a46831.jpg'}, {'step_number': 6, 'description': '먹기 직전 전복과 낙지 넣고 5분정도 끓여주세요', 'image_url': 'https://recipe1.ezmember.co.kr/cache/recipe/2020/07/15/b93d80b7af6ee187d62bfb727a63b52b1.jpg'}, {'step_number': 7, 'description': '캬아ㅎㅎ', 'image_url': 'https://recipe1.ezmember.co.kr/cache/recipe/2020/07/15/bc3800412aa811387a5aa050fb7729ee1.jpg'}, {'step_number': 8, 'description': '몸보신 제대로...\n끓이고 소금, 후추 간만 하면 됩니다.', 'image_url': 'https://recipe1.ezmember.co.kr/cache/recipe/2020/07/15/4f03e377ef1a7e39441b394748eb16c21.jpg'}, {'step_number': 9, 'description': '든든하게 한끼 클리어♡\n모두 건강하세요.', 'image_url': 'https://recipe1.ezmember.co.kr/cache/recipe/2020/07/15/30a3f800cb845d58094e2392b2833b6b1.jpg'}]"
50694,국/탕,영양식,닭고기,끓이기,복날 삼계탕 만들기. 능이 버섯을 넣어 더운 여름 원기 회복에 아주 좋아요.,삼계탕,https://recipe1.ezmember.co.kr/cache/recipe/2020/07/15/3b441f9882470dc0422f4f61f66ebfe01.png,"3,461",60분 이내,아무나,4인분,"[('토종닭', '1마리'), ('꼬마 전복', '7~8마리'), ('인삼', '2뿌리'), ('냉동 능이버섯', '2개'), ('통마늘', '5~6알'), ('대추', '5개'), ('찹쌀', '1C'), ('당근', '100g'), ('쪽파', '3줄'), ('표고버섯', '1개'), ('소금', '')]","내일이 초복이라 능이버섯을 넣어 삼계탕을 만들었어요.
더위에 지친 기력을 회복 시켜 준답니다.","[{'step_number': 1, 'description': '토종닭은 엉덩이 안쪽과 목 부분의 껍질 벗겨 기름을 떼고 깨끗이 씻어 주세요.\n*몸에 덜 빠진 털이 있으면 손으로 잡아 떼거나 핀셋을 이용해 제거해 주세요.', 'image_url': 'https://recipe1.ezmember.co.kr/cache/recipe/2020/07/15/94d99ec52fc0a884851896830234c05e1.jpg'}, {'step_number': 2, 'description': '냉동 능이 버섯은 해동한 후 깨끗이 씻고\n인삼도 겉면을 살살 긁어 씻어 주세요.\n*능이 버섯은 9월이 제철로 냉동\n능이를 사용 했고 조금만 넣어도 향이 강하답니다.', 'image_url': 'https://recipe1.ezmember.co.kr/cache/recipe/2020/07/15/0b6ec152f36585b930717a7b90f9b3cd1.jpg'}, {'step_number': 3, 'description': '삼계탕에 넣을 한약 재료와 통마늘은\n베보자기에 넣어 내용물이 빠져 나오지 못하도록 잘 여며 주세요.\n*베주머니에 넣지 않고 그냥 넣으면 한약재가 뒤섞여 지저분해 지므로 베주머니가 없으면 육수팩에라도 넣어서 끓여 주세요.', 'image_url': 'https://recipe1.ezmember.co.kr/cache/recipe/2020/07/15/04fa0b802df875bf04559cde4b351f071.jpg'}, {'step_number': 4, 'description': '냄비에 한약재와 토종닭,능이버섯,인삼을 넣고 푹 끓여 주세요.\n(냄비는 50분 압력솥은 20분)\n*나중에 월계수 잎 2장도 넣었어요.', 'image_url': 'https://recipe1.ezmember.co.kr/cache/recipe/2020/07/15/88f8d50eb0570ab631f324c22795865f1.jpg'}, {'step_number': 5, 'description': '닭이 익는 동안 전복은 칫솔로 깨끗이 닦고이빨을 잘라 준비합니다.\n(잘라내지 않으면 모래 씹는것 처럼 써그럭 거려요)', 'image_url': 'https://recipe1.ezmember.co.kr/cache/recipe/2020/07/15/1e64a911e695c1c20ab221389062b19f1.jpg'}, {'step_number': 6, 'description': '40분이 지나고 토종닭이 거의 익을 때쯤\n전복을 넣고 10분 더 끓입니다.\n*원래 토종닭이 좀 질긴데 총 50분 끓이니까 살이 부드럽게 잘 익더라구요.', 'image_url': 'https://recipe1.ezmember.co.kr/cache/recipe/2020/07/15/bc17c41130e0b85c17d3c2db7f936b361.jpg'}, {'step_number': 7, 'description': '닭죽에 넣을 당근과 쪽파는 송송 썰어 주세요.\n*야채는 냉장고에 있는 자투리 야채를 쓰시면 됩니다.', 'image_url': 'https://recipe1.ezmember.co.kr/cache/recipe/2020/07/15/565ad02b1ac23a39533a550988a350431.jpg'}, {'step_number': 8, 'description': '표고버섯도 송송 썰어 주세요.', 'image_url': 'https://recipe1.ezmember.co.kr/cache/recipe/2020/07/15/fc8548767683976e2bd5a8224210c4f61.jpg'}, {'step_number': 9, 'description': '닭 삶은 물은 기름을 걷어내고 찹쌀 1C을\n넣어 끓이다가 과 야채 넣어 죽을 눌지 않게 저어가며 끓입니다.', 'image_url': 'https://recipe1.ezmember.co.kr/cache/recipe/2020/07/15/25422076520d966aa8c04e8098110b1e1.jpg'}, {'step_number': 10, 'description': '닭죽이 많이 끓었으면 식성에 맞게 소금으로 간해 완성합니다.', 'image_url': 'https://recipe1.ezmember.co.kr/cache/recipe/2020/07/15/4774e1ae71e3f1aa37fe080f1a8236cf1.jpg'}]"
