index,종류별,상황별,재료별,방법별,글 제목,레시피이름,레시피이미지,조회수,조리시간,난이도,인분,재료,소개글,조리순서
40669,메인반찬,술안주,곡류,부침,#녹두가루 #녹두가루를이용한 #녹두빈대떡만들기 #각종나물과 다짐육이 들어간 고소하고 담백한 녹두빈대떡!!! 요맛이야,녹두빈대떡,https://recipe1.ezmember.co.kr/cache/recipe/2018/10/18/9f7882d51b037a3d9ac9b83482c75c361.jpg,"10,492",60분 이내,아무나,6인분 이상,"[('녹두가루', '400g'), ('돼지고기다짐육', '300g'), ('다진마늘', '1큰술'), ('다진생강', '1작은술'), ('후추', '1작은술'), ('양조간장', '1큰술'), ('참기름', '1작은술'), ('고사리나물', '1/2컵'), ('시금치나물', '1/2컵'), ('도라지나물', '1/2컵'), ('숙주나물', '1/2컵'), ('홍고추', '1/2개'), ('청양고추', '1/2개'), ('양파', '1/2개'), ('양조간장', '1/2컵'), ('식초', '3큰술'), ('홍고추', '1개'), ('청양고추', '1개'), ('꿀', '1큰술'), ('생수', '1컵')]","수미네반찬에서 녹두전이라고 했는데
전 방송되기전에 언니가 먹고 싶다고 해서 만들었지요. 
그냥 녹두가 없어서 녹두가루를 이용해서 간편하게 만들었지요. 

김치 생략이요!!! 고사리나물, 도라지나물, 숙주나물, 시금치나물을 넣고
양념한 돼지고기다짐육을 넣어서 만드는 녹두빈대떡입니다.","[{'step_number': 1, 'description': '녹두빈대떡과 너무 잘 어울리고 어떤 전이나 부침개랑 잘 어울리는 양파양념간장을 만들어 주려고요. 배추전을 할때에도 소개해 드렸어요. 양조간장과 생수를 넣어 주고 홍고추, 청양고추는 다져서 넣어 주시고 식초, 설탕이나 꿀을 넣어서 주세요.', 'image_url': 'https://recipe1.ezmember.co.kr/cache/recipe/2018/10/18/349f94e61ec0f7fe06f10bfb688f6ee51.jpg'}, {'step_number': 2, 'description': '그리고 양파는 큼지막하게 6등분을 해서 넣어 줍니다. 이렇게 넣어 주시고는 냉장고에 보관하시면 잘 절여진 양파양념간장이 되니까요~~', 'image_url': 'https://recipe1.ezmember.co.kr/cache/recipe/2018/10/18/f8d6365212d365d92368687cdcf0c11b1.jpg'}, {'step_number': 3, 'description': '본격적으로 녹두빈대떡에 들어가는 재료들을 준비합니다. 가장 먼저 돼지고기다짐육입니다.', 'image_url': 'https://recipe1.ezmember.co.kr/cache/recipe/2018/10/18/d9fd7d42ebba9f326bf7d25e36f6ae671.jpg'}, {'step_number': 4, 'description': '돼지고기다짐육에 밑간을 해 주세요. 다진마늘, 다진생강이나 생강즙, 후추, 양조간장, 참기름을 넣어 줍니다. 그런 다음에 조물조물 무쳐 주세요. 뭉쳐지지 않도록 그리고 양념이 베이도록 무쳐 주세요.', 'image_url': 'https://recipe1.ezmember.co.kr/cache/recipe/2018/10/18/79a0e776326ef11e1cf65ceb3091d7701.jpg'}, {'step_number': 5, 'description': '그리고 꼬옥 들어가는 재료가 바로 나물인데요. 도라지나물, 고사리나물, 숙주나물은 필수이고요. 거기에 시금치나물도 넣어 주었습니다. 수미네반찬에서 녹두전을 하는 모습을 보니 김치와 고기만 들어가더라구요. 개성출신이신 울오마니는 반드시 이 나물들을 넣어 주셔서 같이 녹두부침개를 해주셨거든요.', 'image_url': 'https://recipe1.ezmember.co.kr/cache/recipe/2018/10/18/c24c55e90f53b76d21350b572d72a32d1.jpg'}, {'step_number': 6, 'description': '고기양념에 마늘은 충분히 들어가 있고요. 각종 나물무침에도 다진마늘이 충분히 들어가 있고 다진파도 들어가져 있어서 굳이 파나 마늘을 따로 넣지 않았습니다. 양념된 고기를 넣어 주시고요.', 'image_url': 'https://recipe1.ezmember.co.kr/cache/recipe/2018/10/18/f3f4575918cb8fd443eba79fd53157b01.jpg'}, {'step_number': 7, 'description': '녹두가루를 넣어 줍니다.', 'image_url': 'https://recipe1.ezmember.co.kr/cache/recipe/2018/10/18/f444e627199095c87b7033f63a0cf8dd1.jpg'}, {'step_number': 8, 'description': '물을 조금씩 넣어가면서 농도를 맞춰 주세요. 반죽이 질퍽질퍽하면서도 끈기가 있는 상태가 되도록 하시면 됩니다. 취향에 따라 참기름 한두방울을 넣으셔도 괜찮고요.', 'image_url': 'https://recipe1.ezmember.co.kr/cache/recipe/2018/10/18/86129278962f049f2951b68aa0ca44ff1.jpg'}, {'step_number': 9, 'description': '달궈진 팬에 기름 충분히 두르시고요. 기름 많이 먹거든요. 그래서 충분히 둘러 주시고 중간 중간에 기름을 추가해서 부쳐 주세요. 불은 달군후에는 중약불로 옮겨서는 서서히 익도록 해 주시면 됩니다. 양념이 된 나물과 고기라서 센불에서 하시면 설익고 겉표면이 타기만 하거든요.', 'image_url': 'https://recipe1.ezmember.co.kr/cache/recipe/2018/10/18/79c8caecb2ce9baf9ea44b1474581de11.jpg'}, {'step_number': 10, 'description': '바로바로 드실려면 노릇노릇하게 앞뒤로 제대로 부쳐 주시고 아니면 두고두고 드실려면 설익혀서는 식혀서 한장한장 위생비닐에 넣어서 냉동실에 넣어 두었다가 그때그때 꺼내서 약불에서 서서히 익혀서 드시면 오랫동안 드실 수 있어요.', 'image_url': 'https://recipe1.ezmember.co.kr/cache/recipe/2018/10/18/709f99690b2a426bea6f31ecfce90afe1.jpg'}, {'step_number': 11, 'description': '녹두가루를 이용해서 간편하게 만든 녹두빈대떡 완성입니다.', 'image_url': 'https://recipe1.ezmember.co.kr/cache/recipe/2018/10/18/14653b86bf5bd5ca1c9e95a9112ec9151.jpg'}]"
40670,메인반찬,술안주,곡류,부침,메밀전 김치메밀전 만드는법,김치메밀전,https://recipe1.ezmember.co.kr/cache/recipe/2017/08/23/c4ac389e07ef31e5f3df20778eea34b91.jpg,"41,564",30분 이내,초급,3인분,"[('메밀가루', '2컵'), ('밀가루', '1큰술'), ('소금', '약간'), ('물', '2컵'), ('김치', ''), ('쪽파', ''), ('부침기름', ''), ('김치                                                                                잘게 썬', ''), ('설탕', '1작은술'), ('참기름', ''), ('통깨', '')]","구수하고 담백한 메밀전에 김치와 파를 넣고 부치기도 하고 김치 무침을 얹어 싸 먹기도 하는 간단하고 쉬운 메밀전, 메밀부침개랍니다.","[{'step_number': 1, 'description': '메밀가루에 소금, 밀가루를 섞어놓고 김치는 물기를 꼭 짜서 길게 썰고 쪽파도 준비합니다.', 'image_url': 'https://recipe1.ezmember.co.kr/cache/recipe/2017/08/23/52750557443fba03d2f34ad74a886cb01.jpg'}, {'step_number': 2, 'description': '메밀가루에 물을 넣고 고루 섞은 뒤 10분정도 숙성시켜줍니다. 메밀가루에 밀가루를 찢어지지 말라고 조금 넣었는데 기호에 따라 전분이나 부침가루를 넣어도 좋아요.', 'image_url': 'https://recipe1.ezmember.co.kr/cache/recipe/2017/08/23/3a926bb4ac9dcdaafecd0be19bb96f641.jpg'}, {'step_number': 3, 'description': '달군 팬에 기름을 두르고 반죽을 두국자 정도 넣고 얇게 편 뒤', 'image_url': 'https://recipe1.ezmember.co.kr/cache/recipe/2017/08/23/348fc0579b811724b930bc098c23d4691.jpg'}, {'step_number': 4, 'description': '위에 김치와 파를 얹고 반죽을 조금 뿌리고 뒤집어서 부쳐줍니다.', 'image_url': 'https://recipe1.ezmember.co.kr/cache/recipe/2017/08/23/003c2527f465e22b7904f1de24941c3c1.jpg'}, {'step_number': 5, 'description': '부치는 방법은 프라이팬에 김치와 파를 먼저 깔고 반죽을 덮어 부쳐도 좋아요.', 'image_url': None}]"
40671,메인반찬,술안주,곡류,부침,녹두 빈대떡 만들기 고소한 녹두전 레시피,녹두빈대떡,https://recipe1.ezmember.co.kr/cache/recipe/2024/01/02/f4f109db336291d35d104b7160d6f7d11.jpg,"18,262",2시간 이상,초급,2인분,"[('녹두', '200g'), ('물', '200g'), ('돼지고기 다짐육', '160g'), ('배추김치', '1컵'), ('숙주', '2줌'), ('고사리 데친거', '1줌'), ('대파', '1/2대'), ('찹쌀가루', '40ml'), ('소금', ''), ('식용유', ''), ('들기름', '약간'), ('소금', '2꼬집'), ('다진 마늘', '1t'), ('생강가루', '1/3t'), ('후추', '약간')]","집안 가득 기름냄새 풍기는 날 소분해두었던 녹두를 꺼내어 갖은 속재료를 다져 넣고 바삭바삭 전을 구웠어요. 간 돼지고기, 김치, 숙주나물, 고사리 등 여러 가지 재료를 넣고 구워내면 맛도 좋고 식감도 좋아요~","[{'step_number': 1, 'description': '깐녹두는 3~5시간 불려주어요.믹싱볼', 'image_url': 'https://recipe1.ezmember.co.kr/cache/recipe/2024/01/02/90e31c51f9eaea154eec4b256aee46101.jpg'}, {'step_number': 2, 'description': '돼지고기는 소금 두 꼬집, 다진 마늘 1 작은 술 생강가루 1/3 작은 술, 후추 약간 넣고 조물조물 밑간해줍니다.', 'image_url': 'https://recipe1.ezmember.co.kr/cache/recipe/2024/01/02/4581c5d5859c40e4fadf8dfafa6445371.jpg'}, {'step_number': 3, 'description': '숙주는 끓는 물에 30~40초 데쳐 물기를 털어줘요.냄비 , 요리스푼 , 채반', 'image_url': 'https://recipe1.ezmember.co.kr/cache/recipe/2024/01/02/8e2e36259d2384f811b4cbfa382a1f6e1.jpg'}, {'step_number': 4, 'description': '데친 숙주와 고사리, 대파 흰 부분을 잘게 썰어줘요.도마 , 조리용나이프', 'image_url': 'https://recipe1.ezmember.co.kr/cache/recipe/2024/01/02/10b8cf55e5fa63f8698104837f1f5f581.jpg'}, {'step_number': 5, 'description': '잘 익은 김치는 씻어 잘게 다져요.', 'image_url': 'https://recipe1.ezmember.co.kr/cache/recipe/2024/01/02/6b8ed3f62e01b50e0d4847b517edf6231.jpg'}, {'step_number': 6, 'description': '불린 녹두는 물 200ml 정도와 블렌더에 넣고 갈아줘요.블랜더', 'image_url': 'https://recipe1.ezmember.co.kr/cache/recipe/2024/01/02/d93148b5b402321f81c4cbd72cedd1b21.jpg'}, {'step_number': 7, 'description': '돼지고기와 함께 잘게 썬 고사리, 숙주, 대파 김치를 같이 넣고 찹쌀가루로 농도를 맞추며 섞어요.', 'image_url': 'https://recipe1.ezmember.co.kr/cache/recipe/2024/01/02/2f268f8f04f9deb40e5984915066d3fa1.jpg'}, {'step_number': 8, 'description': '달군 팬에 식용유를 두르고 동그랗게 모양을 잡아 구워요.프라이팬맛있는 색감을 위해 청홍고추를 얇게 썰어 고명으로 올려 구워주었답니다.', 'image_url': 'https://recipe1.ezmember.co.kr/cache/recipe/2024/01/02/28287e5fb090e4d628e4c1c44418ddc31.jpg'}, {'step_number': 9, 'description': '한쪽 면을 먼저 중간 센 불로 노릇노릇하게 구운 뒤 뒤집어 중불로 낮추어 속까지 익혀줘요.뒤집개', 'image_url': 'https://recipe1.ezmember.co.kr/cache/recipe/2024/01/02/2b5ab982e192f8e494370337926aac0b1.jpg'}, {'step_number': 10, 'description': '막걸리 한잔이 생각나는 녹두 빈대떡 완성이에요 :)완성접시', 'image_url': 'https://recipe1.ezmember.co.kr/cache/recipe/2024/01/02/fea2b1c5d79f2ca18ff9531dc90315cb1.jpg'}]"
40672,메인반찬,술안주,곡류,부침,메밀 전병 만들기,메밀전병,https://recipe1.ezmember.co.kr/cache/recipe/2022/09/15/436042cab3aaab1ed2f21f67f6cf22d31.jpg,"1,966",60분 이내,중급,4인분,"[('메밀', '2컵'), ('물', '400ml'), ('김치', '250g'), ('다진 양파', '3스푼'), ('썬 대파', '3스푼'), ('표고버섯', '1개'), ('두부', '1/4모'), ('당면', '25g'), ('고은 고춧가루', '1/2스푼'), ('간장', '1스푼'), ('설탕', '1스푼'), ('다진 마늘', '1스푼'), ('들기름', '1스푼'), ('들깨가루', '2스푼'), ('소금', '약간')]","얼마 전 춘천여행 가서 먹게 된 메밀 전병이 계속 생각이 나더라구요 메밀가루도 사놓아서 오늘은 만들어 보았어요
찬 성질의 메밀은 체내의 열을 내려 준다고 하죠 메밀은 비장 위장의 습기와 열기를 없애주며 소화가 잘 되게 하는 효능이 있다고 합니다

​","[{'step_number': 1, 'description': '김치는 소를 털고 잘게 다져주세요\n다진 김치는 물기만 살짝 짜주세요', 'image_url': 'https://recipe1.ezmember.co.kr/cache/recipe/2022/09/15/563c58052660a50ea4f40b8660c31cc41.jpg'}, {'step_number': 2, 'description': '김치 자른 것과 양파와 대파 다진 것 넣고 두부도 물기를 짜서 넣어요 그리고 당면은 꼭 삶아서 자른 후 넣어주세요 고기 대신 표고 넣었어요 표고는 생략해도 됩니다 표고와 당면에 소금과 후춧가루와 참기름 넣고 밑간을 했어요표고버섯과 당면에 소금과 후춧가루그리고 참기름으로 밑간을 해주세요', 'image_url': 'https://recipe1.ezmember.co.kr/cache/recipe/2022/09/15/b4088b753c152f27ed781e7b7d5301f31.jpg'}, {'step_number': 3, 'description': '간장 1스푼 설탕 1스푼 다진 마늘 1스푼 후춧가루 톡톡톡 넣고 섞어놓은 후 들깨가루 2스푼 들기름 1스푼 고은 고춧가루 반 스푼을 넣고 소를 완성시켜 줍니다', 'image_url': 'https://recipe1.ezmember.co.kr/cache/recipe/2022/09/15/787f2590d27aef0e22a75820098b128a1.jpg'}, {'step_number': 4, 'description': '메밀부침가루를 2컵과 물 2컵으로 1:1로 넣어요 반죽물이 똑똑 떨어질 정도로 반죽을 해주세요', 'image_url': 'https://recipe1.ezmember.co.kr/cache/recipe/2022/09/15/354a7bc8868d5333f03513b112340bd71.jpg'}, {'step_number': 5, 'description': '팬에 기름을 넣고 달군 후 팬케이크 만드는 것처럼 기름을 키친타월로 닦아서 기름기를 없게 합니다 그리고 약불로 줄인 후 2국자 정도를 넣고 최대한 얇게 폅니다', 'image_url': 'https://recipe1.ezmember.co.kr/cache/recipe/2022/09/15/6ce14be1eb795189a1699c5de4bc5f221.jpg'}, {'step_number': 6, 'description': '메밀을 얇게 펴고 30초 정도 지나면 김치 소를 얹고 돌돌 말아주세요 불조절은 약불로 줄이고 앞뒤로 익혀주세요팬을 달군 후 약불로 줄여서30초정도지나메일전이 조금익었을때 김치소를 넣어주세요', 'image_url': 'https://recipe1.ezmember.co.kr/cache/recipe/2022/09/15/e1d7d3e825d2b6b9c4cc6c2d7299674b1.jpg'}, {'step_number': 7, 'description': '메밀전병이 얇게 말렸어요 식힌 후 2.5cm 정도의 간격으로 자릅니다 너무 간격이 좁으면 소가 터져 나오고 넓게 하면 먹기가 나쁩니다', 'image_url': 'https://recipe1.ezmember.co.kr/cache/recipe/2022/09/15/92990c70a3dc46f88aff450f76348e331.jpg'}, {'step_number': 8, 'description': '메밀전병의 하이라이트가 들깻가루 와 들기름입니다 김칫소가 간이 적당해서 맛 간장이 없어도 간이 맞고 메밀도 얇아서 김치소와 조화가 머리에서 CG 터지는 맛이예요', 'image_url': 'https://recipe1.ezmember.co.kr/cache/recipe/2022/09/15/0896d7cb859da28c3c6cc22373fe60541.jpg'}]"
40673,메인반찬,술안주,곡류,부침,김치 메밀전 만드는 법,김치메밀전,https://recipe1.ezmember.co.kr/cache/recipe/2024/09/26/941c9d155e28cdb0ac10dfd793de0c4a1.jpg,30,60분 이내,초급,4인분,"[('메밀가루                                                                                250ml', '1컵'), ('배추김치', '1/4포기'), ('물                                                                                250ml', '1컵'), ('소금                                                                                테이블스픈', '0.25T'), ('올리브오일                                                                                배합용', '1T'), ('들기름                                                                                부침용', '60ml')]",기름에 부친 전은 너무너무 맛있죠~ 하지만 [ 건강에는 이롭지 않다 ] 모두가 알고있어요 건강을 생각한 메일가루를 이용하여 김치전을 만들어 맛과 건강 모두 챙겨보도록 해요,"[{'step_number': 1, 'description': '배추김치 1/4포기를 믹싱볼에 담아 물을 채우고 30분 동안 소금기를 빼줍니다믹싱볼너무 오랜시간 1시간 이상 담가두면 넘 싱거워져서 부침했을때 간이 안 맞을 수 있어요', 'image_url': 'https://recipe1.ezmember.co.kr/cache/recipe/2024/09/26/70f729c3fc403a313d9eec5906e329011.jpg'}, {'step_number': 2, 'description': '깨끗히 씻은 포기 김치를 긴 방향으로 칼로 썰어줍니다도마 , 조리용나이프', 'image_url': 'https://recipe1.ezmember.co.kr/cache/recipe/2024/09/26/2b2457b55e2bbdb8898eb70e1e24a7a91.jpg'}, {'step_number': 3, 'description': '메밀가루 및 양념을 배합하여 섞어줍니다. 메밀가루 1컵, 물1컵, 소금 1/4T계량컵 , 계량스푼가루와 물의 비율은 동률입니다 집에 있는 머그컵 등 사용해서 맞추기', 'image_url': 'https://recipe1.ezmember.co.kr/cache/recipe/2024/09/26/6032cccdeddc9b630b4b2940a601e6321.jpg'}, {'step_number': 4, 'description': '메밀 반죽에 올리브오일 1T 넣어 섞어 줍니다. 반죽을 부드럽게 그리고 풍미를 높여주죠', 'image_url': 'https://recipe1.ezmember.co.kr/cache/recipe/2024/09/26/e4a47f7debe5109fb45a959b569b467b1.jpg'}, {'step_number': 5, 'description': '김치를 길게 여러 쪽을 잡아 메밀 반죽에 충분히 적셔서 달군 팬에 부침을 합니다', 'image_url': 'https://recipe1.ezmember.co.kr/cache/recipe/2024/09/26/608b8f0771f62b90dbef37dc82f21ef01.png'}, {'step_number': 6, 'description': '달군 팬에 들기름 2T(20ml) 넣고 김치를 부침합니다. 이때, 잘 안 묻는 반죽 부분을 국자나 숟가락으로 조금씩 반죽물을 채워주시면 됩니다프라이팬 , 뒤집개', 'image_url': 'https://recipe1.ezmember.co.kr/cache/recipe/2024/09/26/e6570e68255dccb538a2625b8918c08c1.png'}, {'step_number': 7, 'description': '전 앞뒤로 노릿 하게 익혀주면 메밀전 완성입니다. 간단한 안주거리 삼아 막걸리 한 잔 하시면 좋습니다 들기름 향이 구수한게 제법 맛이 있네요접시', 'image_url': 'https://recipe1.ezmember.co.kr/cache/recipe/2024/09/26/1498515777814a4797c9128dc295de7f1.png'}]"
40674,메인반찬,술안주,곡류,부침,녹두 빈대떡 - 딸에게# / 장에서 사온 녹두반죽 활용,None,https://recipe1.ezmember.co.kr/cache/recipe/2018/05/10/3eba2a3a7a9152813e65ebf19e52b5551.jpg,"1,703",None,None,None,[],,[]
40675,메인반찬,술안주,곡류,부침,녹두빈대떡...비 오는날 전이 땡기는 이유?,녹두빈대떡,https://recipe1.ezmember.co.kr/cache/recipe/2016/05/24/079dffb7370befba38a3425b5f4d08da1.jpg,"6,126",15분 이내,아무나,3인분,"[('녹두간것', '1팩'), ('돼지고기', '100g'), ('숙주', '조금'), ('부추', '조금'), ('양파', '조금'), ('당근', '조금'), ('후추', '1t'), ('참기름', '1t'), ('맛간장', '1t'), ('달걀노른자', '1개'), ('찹쌀가루', '1/2컵'), ('오일', '약간')]","밤새 비가 많이 내렸네요...비 오는 날 전이 땡기는 이유 아시나 모르겠어요. 방송에서
어떤 게스트가 이렇게 말하더군요. 비가 내리는 소리 <추적추적>이랑 전 부치는 소리 <지글지글>이 비슷해서...시각의 연상이 아닌 청각의 연상을 일으켜서 전이 더 땡긴다구요. 의학적으로는 해의 일조량과 상관 관계가 있어서 신체리듬이 깨어지고 말초신경이 자극을 받아 식욕이 더 땡겨서 기름진 음식 OR 국물요리가 더 땡긴다고 하구요.
어쨌거나...이유가 그 무엇이든...간녹두를 사다가 간편하게 녹두빈대떡을 만들 수 있는 레시피를 올려봅니다.^^","[{'step_number': 1, 'description': '마트,백화점에 가면 간 녹두를 1팩씩 팔아요. 당근,부추,양파가 이미 들어가 있고 후추도 많이 들어가 있네요. 후추는 추가로 넣지 마셔요. 간 돼지고기는 미리 밑간을 해요. 맛간장 1t,참기름1t,(후추)를 넣고 잘 섞어 줍니다. 숙주는 살짝 데쳐서 물기를 꽉 짜 주고 쏭쏭 썰어줍니다.', 'image_url': 'https://recipe1.ezmember.co.kr/cache/recipe/2016/05/24/107defad98852f188e4c565d3e6e39dd1.jpg'}, {'step_number': 2, 'description': '혼합녹두에 돼지고기,숙주,달걀노른자1개를 섞어서 풀어 주어요. 아마도 묽을 꺼에요. 찹쌀가루(바삭한 식감)를 넣어서\n반죽농도를 맞추셔요.', 'image_url': 'https://recipe1.ezmember.co.kr/cache/recipe/2016/05/24/0550767f931116fdd78c9d93e8f167b61.jpg'}, {'step_number': 3, 'description': '달궈진 후라이팬에 오일을 두르고 약불에서 한국자씩 반죽을 올려요.\n빈대떡은 살짝 도톰하니 올라와야 더 맛나게 보입니다. 울집아들이 바싹한 걸 좋아해서 저는 무조건 납작하게 구웠어요.\n앞,뒤로 잘 구워 주셔요.', 'image_url': 'https://recipe1.ezmember.co.kr/cache/recipe/2016/05/24/519b63cead7e45f6ae474d3196ea9edc1.jpg'}, {'step_number': 4, 'description': '접시에 종이호일(한지) 한장을 깔고 위에 녹두빈대떡을 올렸어요.(간장소스) 맛간장1T,생수 1T, 식초 0.5T', 'image_url': 'https://recipe1.ezmember.co.kr/cache/recipe/2016/05/24/c1267b4774fb5c4fe92d8087c33313d21.jpg'}]"
40676,메인반찬,술안주,곡류,부침,밀가루 없는 고단백 다이어트 김치부침개 만들기,김치부침개,https://recipe1.ezmember.co.kr/cache/recipe/2023/05/18/b643a674a273e0cb61525c049fc2c3d31.jpg,"1,401",15분 이내,초급,2인분,"[('물', '500ml'), ('오트밀', '150g'), ('피자치즈', '100g'), ('김치', '200g'), ('대파', '1/2대')]",밀가루 대신에 오트밀을 이용해 김치부침개를 만들었어요.,"[{'step_number': 1, 'description': '믹서기에 오트밀, 물을 함께 넣고 갈아주세요.', 'image_url': 'https://recipe1.ezmember.co.kr/cache/recipe/2023/05/18/b42a7c6e1b0656d1967d83129d40b71b1.jpg'}, {'step_number': 2, 'description': '프라이팬에 현미유를 붓고서 손질한 김치와 대파를 함께 볶아주세요.중간불에 2분', 'image_url': 'https://recipe1.ezmember.co.kr/cache/recipe/2023/05/18/4b9dbc3434664407c2a3582ae084bb521.jpg'}, {'step_number': 3, 'description': '준비한 오트밀에 볶은 김치, 대파 넣고서 섞어주세요.', 'image_url': 'https://recipe1.ezmember.co.kr/cache/recipe/2023/05/18/4e78aa90d9ad95ccdb1810ec055a1b131.jpg'}, {'step_number': 4, 'description': '팬에 기름을 뿌리고 국자로 반죽을 올려서 넓게 펴주세요. *2분간 한쪽 면을 구워주세요. 2분간 약간 약한 불', 'image_url': 'https://recipe1.ezmember.co.kr/cache/recipe/2023/05/18/78528f3c08aaa2b559df68707bffabd01.jpg'}, {'step_number': 5, 'description': '익지않은 반죽 위에 치즈를 올린 뒤 뒤집어서 반대쪽도 약간 약한 불에 2분간 구워주세요.약불', 'image_url': 'https://recipe1.ezmember.co.kr/cache/recipe/2023/05/18/6c539a00d6ab03a6cd704f6d34f305131.jpg'}]"
40677,메인반찬,술안주,곡류,부침,이북식 녹두전 만들기,이북식녹두전,https://recipe1.ezmember.co.kr/cache/recipe/2023/08/20/1e3ba68e32c6a982b77c267747659e391.jpg,920,30분 이내,아무나,3인분,"[('깐녹두', '2컵'), ('부침가루', '1큰술'), ('후추', '1티스푼'), ('양파', '1/2개'), ('냉동삼겹살', '400g'), ('소금', '1티스푼')]",초등학생 시절 북한 요리에 대해 보았던 방송의 기억을 더듬어 만들어 보았습네다. 집에서 느끼는 이북땅의 맛 이북식 녹두전 레시피 시작합네다!!,"[{'step_number': 1, 'description': '깐녹두는 물에 불려서 갈아서 준비합니다. 깐 녹두가 없다면 물에 불려서 녹두를 까서 갈아 준비합니다.', 'image_url': 'https://recipe1.ezmember.co.kr/cache/recipe/2023/08/20/2669df06895eddd0b66cc7eb6e03838a1.jpg'}, {'step_number': 2, 'description': '양파를 채썰거나 다져서 넣고 부침가루를 1티스푼 넣어줍니다.', 'image_url': 'https://recipe1.ezmember.co.kr/cache/recipe/2023/08/20/13ca46d6501aec8cd40a5065614f2ab41.jpg'}, {'step_number': 3, 'description': '후추와 소금으로 간을 잡고 녹두 특유의 풀비린내를 잡아줍니다.', 'image_url': 'https://recipe1.ezmember.co.kr/cache/recipe/2023/08/20/3a46bfd2ddaf173575c60e5974c439b61.jpg'}, {'step_number': 4, 'description': '팬을 예열합니다.', 'image_url': 'https://recipe1.ezmember.co.kr/cache/recipe/2023/08/20/54b66f31f5ba3913887fae346129bfae1.jpg'}, {'step_number': 5, 'description': '삼겹살을 구워서 삼겹살 기름을 내 줍니다.', 'image_url': 'https://recipe1.ezmember.co.kr/cache/recipe/2023/08/20/c0447e891725aec9521e4153b14153791.jpg'}, {'step_number': 6, 'description': '삼겹살은 반 정도 익혀서 적절한 크기로 잘라서 준비합니다.', 'image_url': 'https://recipe1.ezmember.co.kr/cache/recipe/2023/08/20/bb007e80e9c9a4f90293cdc9f32960011.jpg'}, {'step_number': 7, 'description': '삼겹살 기름이 준비된 팬에 삼겹살을 깔아줍니다.', 'image_url': 'https://recipe1.ezmember.co.kr/cache/recipe/2023/08/20/f3f17eddf704fb7cb62c38fe414be2d01.jpg'}, {'step_number': 8, 'description': '준비된 녹두반죽을 부어 부쳐주면 완성입니다.', 'image_url': 'https://recipe1.ezmember.co.kr/cache/recipe/2023/08/20/736cda33108831e11e35854e0817bbdb1.jpg'}]"
