index,종류별,상황별,재료별,방법별,글 제목,레시피이름,레시피이미지,조회수,조리시간,난이도,인분,재료,소개글,조리순서
42365,메인반찬,영양식,해물류,끓이기,#쭈꾸미요리 #쭈꾸미샤브샤브만들기 #된장육수#남은 국물에 죽만들기,주꾸미샤브샤브,https://recipe1.ezmember.co.kr/cache/recipe/2021/02/02/11c12857fd0cc831384f52f2951630721.jpg,"8,674",15분 이내,아무나,2인분,"[('생물국산 쭈꾸미', '10마리'), ('시금치', '1단'), ('배추', '4장'), ('팽이버섯', '1봉지'), ('천연조미료 황태육수', '700ml'), ('된장', '1.5큰술'), ('다진마늘', '1작은술'), ('밥', '1공기'), ('계란', '1개'), ('모둠채소', '3큰술'), ('참기름', '1작은술')]","쭈꾸미는 봄이 되면 산란기라서 암컷이 알이 단단히 들어갑니다.

그래서 봄에는 쭈꾸미라고 하는 이유가 그 알!! 흔히 밥알이라고 말하는

쭈꾸미이지요. 그때 먹는 것이 제일 맛있기는 하지만

크기는 그리 크지 않습니다.

​

가을과 초겨울에 먹는 쑤꾸미는 수컷입니다.

수컷이 아주 튼실해질때이지요. 아마도 봄에 산란기가 있어서 몸을 키우는 것이 아닌가 싶기도 합니다.

튼실하고 큼지막한 수컷의 쭈꾸미를 이용해서

쫄깃쫄깃하고 담백한 쭈꾸미샤브샤브를 만들었습니다.

​

육수는 된장을 풀어 넣은 된장육수이고요. 그럼 구수한 맛을 주거든요.

거기에 꼭 들어가는 것이 바로 시금치입니다.

아니면 냉이도 좋습니다. 3-4월에 먹는 새조개샤브샤브에도 바로 시금치와 냉이가 들어갑니다.

아마도 서로 제철의 재료들이기 때문이 아닌가 싶어요.

​

쭈꾸미샤브샤브를 만들어 볼까요.","[{'step_number': 1, 'description': '쭈꾸미샤브샤브에 들어가는 재료들입니다. 시원한 국물맛을 윈해서 배추, 팽이버섯, 시금치를 준비했습니다. 배추 말고 무를 넣어 주셔도 됩니다.', 'image_url': 'https://recipe1.ezmember.co.kr/cache/recipe/2021/02/02/ac3114a4b0cf852bada3aef37ed078091.jpg'}, {'step_number': 2, 'description': '생물쭈꾸미는 굵은소금이나 밀가루를 이용해서 박박 씻어 줍니다. 빨판에 붙어 있는 이물질들을 다 제거해 주셔야 합니다. 그리고 쭈꾸미대가리에 들어가져 있는 먹물도 제거해 주세요. 내장이 싫으시면 내장도 제거해 줍니다. 그래도 대가리는 보존해 주십시오. 난 내장도 좋고 먹물이 퍼지는 국물맛도 좋다라고 하신다면 반드시 생물인 경우에만 통째로 넣어서 드셔야 합니다. 손질한 쭈꾸미입니다.쭈꾸미 손질법 레시피', 'image_url': 'https://recipe1.ezmember.co.kr/cache/recipe/2021/02/02/bb3332d79661fe5950527bbafd4fdec41.jpg'}, {'step_number': 3, 'description': '천연조미료해물육수에 배추부터 넣어 줍니다.', 'image_url': 'https://recipe1.ezmember.co.kr/cache/recipe/2021/02/02/ace303c62f98479b22888ab03898b7f21.jpg'}, {'step_number': 4, 'description': '쭈꾸미를 다 먹은 후에 먹을 죽을 준비해 놓습니다. 냉동볶음밥야채를 꺼내 놓았습니다.', 'image_url': 'https://recipe1.ezmember.co.kr/cache/recipe/2021/02/02/69debcdcc9384da0fc1defd3d1d5131c1.jpg'}, {'step_number': 5, 'description': '밥을 넣어 주고 계란도 한개 넣어 줍니다. 참기름과 통깨를 뿌려 줍니다.', 'image_url': 'https://recipe1.ezmember.co.kr/cache/recipe/2021/02/02/62423f4c7695537327ff94564c915f941.jpg'}, {'step_number': 6, 'description': '샤브샤브를 다 먹은 후에 다음 코스로 먹을 우동사리와 죽을 준비해 놓았습니다. 그런데 이걸 다 먹을 수 있을지는 모르겠습니다.', 'image_url': 'https://recipe1.ezmember.co.kr/cache/recipe/2021/02/02/07d01d836c62f44f50d24f7dd97576051.jpg'}, {'step_number': 7, 'description': '육수에 배추를 넣어 주고 된장을 풀어서는 먼저 끓여 줍니다.', 'image_url': 'https://recipe1.ezmember.co.kr/cache/recipe/2021/02/02/cd638de9b98557f07d2d59459d72ba221.jpg'}, {'step_number': 8, 'description': '부글부글 끓어오르면 시금치와 팽이버섯을 넣어 줍니다.', 'image_url': 'https://recipe1.ezmember.co.kr/cache/recipe/2021/02/02/3e9d61c72089135843958381c9dd3e391.jpg'}, {'step_number': 9, 'description': '그런 다음에 손질한 쭈꾸미를 통째로 넣어 줍니다. 쭈꾸미는 10초 정도만 익혀서 드시는 것이 가장 부드럽고 쫄깃하게 드실 수 있는 시각입니다.', 'image_url': 'https://recipe1.ezmember.co.kr/cache/recipe/2021/02/02/30cc9ea84cc098c7400dd91622c831ed1.jpg'}, {'step_number': 10, 'description': '탱탱하게 익은 쭈꾸미입니다. 건져내어서 소스에 찍어 드시면 진정 끝내주는 맛이나는 쭈꾸미샤브샤브입니다. 시금치와 팽이버섯, 배추도 함께 드세요. 소스는 간장에 육수 조금 넣어 주고 와사비를 풀어서 만드는 소스입니다. 아니면 초고추장을 이용하셔도 됩니다. 취향에 따라서 드시면 되겠지요.', 'image_url': 'https://recipe1.ezmember.co.kr/cache/recipe/2021/02/02/eb2ab19b8658c9e78f39c14c28f4e1df1.jpg'}, {'step_number': 11, 'description': '면을 준비하기는 했는데 면까지는 먹지 못하고 죽은 만들어 놓았으니까 죽으로 마무리를 해 줍니다. 육수를 조금 덜어내고는 준비한 죽재료들을 투하합니다. 밥알이 잘 풀어질때까지 끓여 주세요. 중불정도면 되겠네요. 계란도 잘 풀어 줍니다. 그럼 든든한 한끼로 드실 수 있는 쭈꾸미샤브샤브와 죽코스가 완성됩니다.', 'image_url': 'https://recipe1.ezmember.co.kr/cache/recipe/2021/02/02/56a5ff56841a9365a1ec39cace14ea531.jpg'}]"
42366,메인반찬,영양식,해물류,끓이기,#제철해산물 #새조개요리 #알쭈꾸미요리 #새조개알쭈꾸미샤브샤브만들기 #백탕홍탕샤브,새조개알주꾸미샤브샤브,https://recipe1.ezmember.co.kr/cache/recipe/2023/03/11/903473f3d722387eb8f153601eea8b131.jpg,"2,304",30분 이내,아무나,2인분,"[('새조개', '500g'), ('알쭈꾸미', '1.2kg'), ('훠궈소스', '110g'), ('멸치칼국수분말스프', '1개'), ('육수', '1L'), ('회초장', ''), ('땅콩소스', ''), ('땅콩버터', '3큰술'), ('양조간장', '1큰술'), ('꿀', '1작은술'), ('레몬즙', '1작은술')]","#제철요리 #제철해산물 #새조개요리 #알쭈꾸미요리 #새조개알쭈꾸미샤브샤브만들기 #백탕과홍탕으로만드는샤브샤브 #마라소스 #멸치칼국수라면스프 #새조개샤브샤브 #알쭈꾸미샤브샤브 #봄제철해산물 #알쭈꾸미 #새조개 #영양식 ​ ​ 드디어 새조개철이 왔습니다. 거기에 알이 가득찬 알쭈꾸미의 계절도 함께 찾아 왔습니다. ​ 일명 밥알이라고 하지요. 마치 밥알같이 알이 들어가져 있어서 나온 말이기도 하죠. 그런 알쭈꾸미와 새조개는 무조건 샤브샤브로 살짝 데쳐서 먹어 주는 것이 최고입니다. ​ 함께 샤브샤브할 야채는 시금치와 냉이입니다. 새조개는 여수가 유명한데, 여수에서 먹어 본 것으로 직접 채취한 냉이와 시금치로 시원하게 끓여서 만들더라구요. ​ 그래서 꼬옥 새조개샤브샤브나 알쭈꾸미샤브에는 시금치와 냉이를 넣어 줍니다. 이번에는 특이하게 훠궈처럼 홍탕과 백탕으로 나눠서 샤브샤브를 만들어 주었습니다. ​ 홍탕에는 마라소스를, 백탕에는 사리를 넣어서 잔치국수스프를 넣을까,,,,, 액젓을 넣을까 고민하다가 칼국수라면사리를 넣어서 먹을려고 멸치칼국수라면 분말스프를 넣어 주었습니다. 그것은 간이고 육수는 따로 만들어 준 새조개와 알쭈꾸미샤브샤브 입니다.","[{'step_number': 1, 'description': '새조개와 알쭈꾸미에 들어가는 샤브샤브 재료를 준비합니다. 시금치, 냉이, 그리고 느타리버섯입니다.', 'image_url': 'https://recipe1.ezmember.co.kr/cache/recipe/2023/03/11/0bcb3a47ed5094a7fd8e19b8c1cbd1071.jpg'}, {'step_number': 2, 'description': '손질되어져 온 알쭈꾸미와 새조개입니다. 그래도 한번 찬물에 씻어 줍니다. 씻어 낸 후에는 물기를 빼 줍니다.믹싱볼 , 채반', 'image_url': 'https://recipe1.ezmember.co.kr/cache/recipe/2023/03/11/23521f0c8a1ba94f0f9cceb157c0e7101.jpg'}, {'step_number': 3, 'description': '두가지의 샤브샤브육수를 만들텐데, 하나는 깔끔한 백탕입니다. 백탕의 간은 멸치칼국수라면 분말스프입니다. 칼국수라면을 사리로 사용하려고 하기 때문에, 그 분말스프로 간을 해 주었습니다. 그리고 홍탕은 마라소스를 넣어 줍니다. 그 마라홍탕에 잘 어울리는 땅콩소스를 만들어 줍니다. 간단하게 땅콩버터에 꿀, 레몬즙, 간장만 넣어서 잘 풀어 주었습니다.소스볼 , 조리용스푼', 'image_url': 'https://recipe1.ezmember.co.kr/cache/recipe/2023/03/11/0ddfb39ad950e96efc487af59badc1911.jpg'}, {'step_number': 4, 'description': '대파를 어슷하게 썰어 넣어 주고, 홍탕에는 마라소스를, 백탕에는 멸치칼국수분말스프를 넣어 주었습니다. 후레이크스프도 넣어 주었습니다. 딱히 쓸일이 없을 듯 싶어서 ㅋㅋㅋ도마 , 요리용나이프 , 반반냄비', 'image_url': 'https://recipe1.ezmember.co.kr/cache/recipe/2023/03/11/661cba04ac449e4db6d11dd47619da311.jpg'}, {'step_number': 5, 'description': '육수를 부어 줍니다. 원래는 닭육수로 해야하는 것이 맞지만, 그냥 육수명장 2알을 넣어서 만든 육수입니다.', 'image_url': 'https://recipe1.ezmember.co.kr/cache/recipe/2023/03/11/77e69adc7b18cf4d729b1dee80f9b36c1.jpg'}, {'step_number': 6, 'description': '샤브샤브 준비가 다 완료가 되었습니다. 이제 즉석에서 만들어야겠지요.', 'image_url': 'https://recipe1.ezmember.co.kr/cache/recipe/2023/03/11/b8303035df9a422f66b492348bb452881.jpg'}, {'step_number': 7, 'description': '육수가 팔팔 끓어 오르면 버섯과 야채부터 먼저 넣어 줍니다. 그래야 시원한 국물맛을 낼 수 있습니다.', 'image_url': 'https://recipe1.ezmember.co.kr/cache/recipe/2023/03/11/2fe933d925a4f700e15e1d736b026ab01.jpg'}, {'step_number': 8, 'description': '그리고 알쭈꾸미와 새조개를 넣어 줍니다. 새조개는 딱 1분이면 익기 때문에 바로 드시면 되고요. 알쭈꾸미는 3-4분 정도 걸립니다. 그리고 머리를 분리한 후 다리만 드시고, 머리는 조금더 익혀 드셔야 합니다.', 'image_url': 'https://recipe1.ezmember.co.kr/cache/recipe/2023/03/11/42d83f07330d4aa00a51d9bc9cdd7b091.jpg'}, {'step_number': 9, 'description': '알쭈꾸미의 다리가 잘 익혀졌습니다. 저 쭈꾸미의 머리가 보이시나요? 점박이이지요. 그것이 바로 알을 품고 있다라는 점이지요. 마치 밥알같기도 합니다. 회초장에 찍어 먹고 홍탕에 들어가져 있는 것은 땅콩소스에 찍어서 드시면 됩니다.', 'image_url': 'https://recipe1.ezmember.co.kr/cache/recipe/2023/03/11/b44307ce8e68db6e804c9a1ef0a1eec71.jpg'}, {'step_number': 10, 'description': '정말 귀하고 귀한 새조개입니다. 딱 이때밖에는 먹을 수 없는 귀한 존재이기도 합니다. 쫄깃쫄깃하면서도 달디단 맛을 주는 것이........', 'image_url': 'https://recipe1.ezmember.co.kr/cache/recipe/2023/03/11/3b9491c3c59bd3200fcc7404925f58bf1.jpg'}, {'step_number': 11, 'description': '쭈꾸미다리부터 먼저 먹어 주고, 머리는 좀더 익힌 후에 먹어 줍니다. 알이 그득하게 차있는 쭈꾸미입니다. 그래서 알쭈꾸미이겠죠.', 'image_url': 'https://recipe1.ezmember.co.kr/cache/recipe/2023/03/11/c7b7dd0fb9c4e9c6bd3635042f7769641.jpg'}]"
42367,메인반찬,영양식,해물류,끓이기,전복초 만들기...제철 밑반찬이랑 한상 (한식 푸드스타일링),전복초,https://recipe1.ezmember.co.kr/cache/recipe/2016/05/21/0117379c1c26e142ce822791fc78cee51.jpg,"3,412",30분 이내,초급,3인분,"[('전복', '6마리'), ('맛간장', '1/2컵'), ('생수', '4컵'), ('마른고추(베트남)', '3개'), ('생강즙', '1t'), ('설탕', '1T'), ('물엿', '1T'), ('후추', '1T'), ('다시마', '1장')]","전복초를 만들고... 이번 주에 만들었던 제철 밑반찬 (마늘쫑고추장무침,깨잎순무침,오이소박이)이랑 함께 한식 밥상을 거하게? 차려 보았어요. 폭신한 감자밥에 고추장찌개를 곁들인 맛있는 밥상입니다. 집에 있는 밑반찬 몇개에 전복초를 만들어 이렇게 한 번 식탁을 푸짐하게 꾸며 보셔요.~~~*","[{'step_number': 1, 'description': '물4컵,맛간장반컵,다시마,마른고추,생강즙,설탕,물엿을 넣고 끓여 줍니다. (중불로 시작 한소뜸하면 약불로 교체) 설탕이 잘 녹게 저어 주어요.\n맛간장만들기 @6847410', 'image_url': 'https://recipe1.ezmember.co.kr/cache/recipe/2016/05/21/537a3fe2e1d20bcb248fb60f9f0e43ab1.jpg'}, {'step_number': 2, 'description': '전복손질법은 다음 레시피에 상세하게 올릴게요.\n손질된 전복은 다이아몬드 칼집을 내 주어요.전복 손질법 레시피\u200b', 'image_url': 'https://recipe1.ezmember.co.kr/cache/recipe/2016/05/21/c1ffe9f5b5b88285de36dc9a7aed959c1.jpg'}, {'step_number': 3, 'description': '내장은 버리지 말고 따로 놓아 두셔요.(내장소스 전복장)', 'image_url': 'https://recipe1.ezmember.co.kr/cache/recipe/2016/05/21/eb0a51d3b197a88ce62462cfdef4b8ba1.jpg'}, {'step_number': 4, 'description': '한소뜸한 전복장에 전복을 넣고 약불에서 끓여요.', 'image_url': 'https://recipe1.ezmember.co.kr/cache/recipe/2016/05/21/210e8208153cd54bbf5fcafec821c60c1.jpg'}, {'step_number': 5, 'description': '약불>한소뜸하면 다시마는 건져 내고...청주 1T를 넣어요. (잡냄새를 잡아줌)수시로 거품을 제거 하셔요. 소스가 줄어들면 아래 소스를 숟가락으로 전복 위로 끼얹어 주셔요. (반복)', 'image_url': 'https://recipe1.ezmember.co.kr/cache/recipe/2016/05/21/b79e33e8381809902c441eac182cbc071.jpg'}, {'step_number': 6, 'description': '끓는 물에 식초(휘발성)1T를 넣고 전복 껍데기를 삶아주어요. 살균 & 소독작업 (3분)', 'image_url': 'https://recipe1.ezmember.co.kr/cache/recipe/2016/05/21/b4ef25fc1d7689df04b085639bf2bba41.jpg'}, {'step_number': 7, 'description': '담을 접시 위에 껍데기를 올려서 식혀 둡니다.', 'image_url': 'https://recipe1.ezmember.co.kr/cache/recipe/2016/05/21/5b418ee6ba5b5b85b26a5eaf5e42d7411.jpg'}, {'step_number': 8, 'description': '껍데기 위에 전복 주인을 찾아 올려 주셔요.ㅋㅋㅋ 누구의 집인지 모르면 ?크기에 맞는 껍데기에 올려 놓으셔요. 통깨를 조금씩 올려요.', 'image_url': 'https://recipe1.ezmember.co.kr/cache/recipe/2016/05/21/6cfb7120321f858e74aa0040eb890ae01.jpg'}, {'step_number': 9, 'description': '전복초가 완성 되었어요.', 'image_url': 'https://recipe1.ezmember.co.kr/cache/recipe/2016/05/21/ebe4c850f7dc527dd11e7f39fddf6f251.jpg'}, {'step_number': 10, 'description': '집에 있는 밑반찬을 올려 놓았어요. 마늘쫑고추장무침,깻잎순무침,콩자반,오이소박이...밥은 감자밥에 국은 굴라쉬 먹고 남은 건더기에 물을 2컵 더 부어 만능매운장,맛간장,토마토페이스트를 추가로 넣어서 울나라 식 고추장찌개를 만들었어요. 재탕으로 탄생했네요.', 'image_url': 'https://recipe1.ezmember.co.kr/cache/recipe/2016/05/21/26e113f88da9e043782ad381dec081b11.jpg'}]"
42368,메인반찬,영양식,해물류,끓이기,[2021 해양수산부 이달의 수산물 4월] 멸치 강된장,멸치강된장,https://recipe1.ezmember.co.kr/cache/recipe/2021/06/09/214b06adb98bdbbc8cb99b4c619358721.jpg,865,20분 이내,아무나,1인분,"[('생 멸치', '250g'), ('양파', '1/2개'), ('대파', '1단'), ('청고추', '1개'), ('홍고추', '1개'), ('다진 마늘', '1큰술'), ('고춧가루', '1큰술'), ('고추장', '1/2큰술'), ('된장', '2큰술'), ('맛술', '1큰술')]","해양수산부가 선정한 이달의 수산물 4월 레시피
집에서 간편하게 먹을 수 있는 두번째 요리
""멸치 강된장"" 지금 만나러 가보겠습니다.","[{'step_number': 1, 'description': '멸치의 효능\n: 뼈 성장, 골다공증, 허리디스크 예방에 탁월하다. 포화지방산을 체외로 배출하여 콜레스테롤 수치를 낮춰주고 DHA 성분 함유로 태아 두뇌 발달에 도움을 준다.', 'image_url': 'https://recipe1.ezmember.co.kr/cache/recipe/2021/06/09/5c1e56580e15bb14d0c025c272c38e061.jpg'}, {'step_number': 2, 'description': '재료를 준비 합니다.\n: 생멸치 250g, 양파 1/2개, 대파 1단, 청/홍고추 각 1개, 다진 마늘 1큰술, 고춧가루 1큰술, 고추장 1/2큰술, 된장 2큰술, 맛술 1큰술', 'image_url': 'https://recipe1.ezmember.co.kr/cache/recipe/2021/06/09/db37246bf3cdff6137eef9e0be785d421.jpg'}, {'step_number': 3, 'description': '생멸치는 깨끗하게 씻어서 준비한다.', 'image_url': 'https://recipe1.ezmember.co.kr/cache/recipe/2021/06/09/416e49cb5a978468820b5546d91591e41.jpg'}, {'step_number': 4, 'description': '양파는 크게 다져준다.', 'image_url': 'https://recipe1.ezmember.co.kr/cache/recipe/2021/06/09/cb3be1995a4d979acd9d9777dbdedd691.jpg'}, {'step_number': 5, 'description': '대파, 청/홍고추는 송송 썰어준다.', 'image_url': 'https://recipe1.ezmember.co.kr/cache/recipe/2021/06/09/2716a502add869f71f3766074c770e931.jpg'}, {'step_number': 6, 'description': '냄비에 물을 붓고, 된장, 고추장, 다진 마늘을 넣는다.', 'image_url': 'https://recipe1.ezmember.co.kr/cache/recipe/2021/06/09/1b816ce0062f9a530fa35176e7d23a4a1.jpg'}, {'step_number': 7, 'description': '끓으면, 생멸치, 맛술, 고춧가루, 다진 양파. 대파&고추를 넣는다.', 'image_url': 'https://recipe1.ezmember.co.kr/cache/recipe/2021/06/09/f4ef81f91310f2d003fb69de2125c6bc1.jpg'}, {'step_number': 8, 'description': '팔팔 끓는 국물을 졸여가며 완성한다.', 'image_url': 'https://recipe1.ezmember.co.kr/cache/recipe/2021/06/09/81956d9fcedec2f74ccf601dec840d211.jpg'}, {'step_number': 9, 'description': '두 번째 요리 멸치 강된장 완성', 'image_url': 'https://recipe1.ezmember.co.kr/cache/recipe/2021/06/09/a3ed5d0ce91ebc1fd88557024ae87e5e1.jpg'}]"
42369,메인반찬,영양식,해물류,끓이기,김수미 전복장과 백종원 만능간장 전복장 만들기 비교,전복장,https://recipe1.ezmember.co.kr/cache/recipe/2023/04/17/702a26f8f375beb6831be8d57f86da211.jpg,"7,539",30분 이내,중급,4인분,"[('전복 각 레시피당', '10-15개'), ('참기름', '1스푼'), ('참깨', '약간'), ('물', '500ml'), ('소주', '3-4스푼'), ('양조간장', '4-5큰술'), ('매실청', '1스푼'), ('건표고버섯', '4-5개'), ('청양고추', '2개'), ('붉은고추', '1개'), ('마늘', '10톨'), ('생강', '1톨'), ('참기름', '1스푼'), ('참깨', '약간'), ('다진 돼지고기', '200g'), ('간장', '300ml'), ('설탕', '100g'), ('물', '100ml'), ('마늘', '10톨'), ('생강', '2톨'), ('만능간장', '5스푼'), ('저염 맛간장', '2스푼'), ('물', '7스푼'), ('소주', '1스푼')]",오늘 롯데슈퍼에 갔는데 살아 있는 전복 10마리 9900원이더라구요. 너무 싱싱하고 가격이 착해서 충동 구매 하고 말았어요. 물론 크기는 그렇게 크지 않았지만 그래도 중간 사이즈 정도는 되는 듯 해요. 전복으로 김수미 전복장도 만들어 보고 백종원 만능양념장으로도 전복장을 만들어 봤어요. 맛은 전복이 맛있으니 둘 다 맛있는데 굳이 고르라고 하면 수고 대비 맛이 좋았던 백종원 만능간장에 한표 던지고 싶네요. 가족들이 전복장을 좋아해서 하나씩 먹기 좋게 가위로 잘라 밥위에 얹어주면 엄청 귀한대접 받는 듯이 좋아라 하더라구요. ​,"[{'step_number': 1, 'description': '공통과정 - 전복 칫솔로 이끼를 싹싹 씻어 주세요', 'image_url': 'https://recipe1.ezmember.co.kr/cache/recipe/2023/04/17/755a6d3d4e5e9b5041a388a391151cc71.jpg'}, {'step_number': 2, 'description': '공통과정 -찜기에 물이 끓으면 소주와 전복을 넣고 5분간 삶아 주세요.', 'image_url': 'https://recipe1.ezmember.co.kr/cache/recipe/2023/04/17/654a9f2ba85a0161edf81c4c8b18f7fb1.jpg'}, {'step_number': 3, 'description': '공통과정 - 삶은 전복을 식혀 숟가락으로 살을 분리해 주세요. 익은 전복은 아주 쉬게 떨어져요. 내장은 영양이 많아 먹을 수 있으면 같이 넣고 내장의 비린맛에 민감하면 따로 떼어 놓았다가 전복죽이나 전복밥 할 때 갈아 넣어요.', 'image_url': 'https://recipe1.ezmember.co.kr/cache/recipe/2023/04/17/7f416ec14778c86c29cbe970e730d5db1.jpg'}, {'step_number': 4, 'description': '김수미레시피 1 \n건 표고 버섯을 한번 씻어 불려 주세요. 불린 물은 그대로 육수로 사용해요.', 'image_url': 'https://recipe1.ezmember.co.kr/cache/recipe/2023/04/17/a39d1ab3ed8fed32a219e3340ea4b2e91.jpg'}, {'step_number': 5, 'description': '김수미레시피2 \n표고 버섯 불린 물 250ml에 전복장 소스 재료를 다 넣고 중강불에서 10분 정도 뚜껑덮고 끓여 주세요. 마늘은 썰지 말고 통으로 넣어 주세요. 간장은 싱거워서 2스푼 더 넣게 되더라구요. 감안해서 레시피 적었어요.', 'image_url': 'https://recipe1.ezmember.co.kr/cache/recipe/2023/04/17/8662e42a8894f87b25d54a05c4ff2be81.jpg'}, {'step_number': 6, 'description': '김수미레시피3 \n전복을 넣고 한소끔 끓여 주세요. 전복은 삶은 거라 오래 끓이지 않아도 돼요.', 'image_url': 'https://recipe1.ezmember.co.kr/cache/recipe/2023/04/17/ca8d97bab16fb7ea60d82abcb840acf31.jpg'}, {'step_number': 7, 'description': '김수미레시피\n전복을 넣고 한소끔 끓여 주세요.', 'image_url': 'https://recipe1.ezmember.co.kr/cache/recipe/2023/04/17/3ec37630a144981ddd0316cece44c8811.jpg'}, {'step_number': 8, 'description': '백종원 간장 활용 레시피 1 \n냄비에 만능간장 재료를 다 넣어 끓여 주세요. 옆에서 지켜서 있다가 한번 부르르 끓어 오르면 넘치기 전에 불을 꺼주세요. 뚜껑을 덮고 식을 때까지 잔열에 놔두면 마늘 생강 맛이 다 우러나요.', 'image_url': 'https://recipe1.ezmember.co.kr/cache/recipe/2023/04/17/4419c136b871fba604fe46fde765fe771.jpg'}, {'step_number': 9, 'description': '백종원 간장 활용 레시피 2 \n냄비에 전복장 양념 재료와 (만능간장5 ,홍게간장2 ,물 7 ,설탕1/2, 소주 1스푼) 전복을 넣고 5분 정도 끓여주세요.', 'image_url': 'https://recipe1.ezmember.co.kr/cache/recipe/2023/04/17/7a861899aa26b7523fe367d22128c2681.jpg'}, {'step_number': 10, 'description': '참기름 참깨 뿌리고 완성이예요.', 'image_url': 'https://recipe1.ezmember.co.kr/cache/recipe/2023/04/17/82b0f6998d26ad8913cdc79c8a7dff471.jpg'}]"
