index,종류별,상황별,재료별,방법별,글 제목,레시피이름,레시피이미지,조회수,조리시간,난이도,인분,재료,소개글,조리순서
17291,밑반찬,명절,채소류,볶음,도라지나물볶음 만드는법 제사 도라지나물 레시피 추석 삼색나물 종류 깐도라지 쓴맛 제거,도라지나물볶음,https://recipe1.ezmember.co.kr/cache/recipe/2024/09/16/73fefdf74400d61e12f0793a048a65df1.jpg,526,60분 이내,초급,3인분,"[('깐도라지', '150g'), ('설탕                                                                                쓴맛 제거할 때', '1T'), ('식용유', '2T'), ('다진마늘', '1/2T'), ('다진대파', '2T'), ('참치액', '1/2T'), ('국간장', '2/3T'), ('물', '3T'), ('참기름', '1T'), ('깨소금', '1T'), ('통깨', '약간')]","오늘은 도라지나물 볶음 만드는법 보여드릴게요 :) 제사나물 삼색나물 중 하얀색나물로 도라지나물, 콩나물, 무나물 등을 사용해요 (검은색, 초록색의 삼색나물 레시피는 예꿈이댁 또 다른 포스팅에서 확인하실 수 있어요 :)) 그중 도라지나물은 껍질을 까는 과정이 있어서 손이 더 가는 뿌리채소이기도 한데요. 요즘엔 워낙 깨끗하게 손질이 잘 되어 나와서 국내산 깐도라지 사용해서 만들면 더 간단하게 도라지나물볶음 만들기 할 수 있기 때문에​ 국산 깐도라지도 추천해요 :) 삼색나물에서 흰색을 담당하는 나물 중. 씹는식감과 맛도 단연 좋아서 예꿈이댁은 도라지나물을 제일 한다지유!ㅎㅎㅎ 추석이면 제철을 맞아서 더욱 달달하고 맛있는 도라지나물을 드실 수 있는 점도 매력포인트예요 :) 예꿈이댁 역시 국산 깐도라지를 사용하여 간단하게 만들어봤어요 도라지는 특유의 알싸한 쓴맛이 있어서 도라지요리 하기 전에는 쓴맛제거를 해 주셔야 해요 설탕 1T를 넣고 바락바락 씻고, 30분간 물에 담가두는 과정을 거치면 쓴맛 없이 맛있는 도라지나물볶음을 만드실 수 있어요 :) 여기에 소금 넣고 끓인물에 1분간 데쳐내면 쓴맛이 더 확실하게 제거되는 팁도 알려드려요","[{'step_number': 1, 'description': '국내산 깐도라지 150g을 준비했어요 별도의 손질이 필요없을 정도로 이미 손질이 잘 되어 나온 상태였는데요. 줄기가 너무 두꺼운 것은 먹기좋게 칼로 갈라서 준비해 주면 되세요 :) 물에 담가서 손으로 살살 흔들어가며 2~3차례 세척해주고 물기를 빼 주었어요볼 , 조리용나이프맛있는 도라지 고르는법은 잔뿌리가 많으면서 흠이 없고 표면이 단단한 것이 좋은 도라지예요 손질 도라지의 경우. 국내산 도라지가 변질이 없고 신선한데요. 길이가 짧고 흰색을 띠며 둥글게 말리는 게 특징이에요', 'image_url': 'https://recipe1.ezmember.co.kr/cache/recipe/2024/09/16/c052ff226fc5aaf92a951e738c481da91.jpg'}, {'step_number': 2, 'description': '볼에 도라지, 설탕 1T를 넣고', 'image_url': 'https://recipe1.ezmember.co.kr/cache/recipe/2024/09/16/895fe4950bdf7ccf97f17ea2d90b6d4d1.jpg'}, {'step_number': 3, 'description': '바락바락 주물러주세요 힘을 주어서 박박 주물러주면 쓴맛제거도 되고 도라지를 부드럽게 드실 수 있어요 :)위생장갑', 'image_url': 'https://recipe1.ezmember.co.kr/cache/recipe/2024/09/16/e3a0325854d0bd5fa3b243157c7c6f8b1.jpg'}, {'step_number': 4, 'description': '숨이 살짝 죽어서 부드러워진 모습이에요 :)', 'image_url': 'https://recipe1.ezmember.co.kr/cache/recipe/2024/09/16/d510ef543a622f0a1146e8da87b16c5a1.jpg'}, {'step_number': 5, 'description': '그런 다음 설탕에 바락바락 버무린 상태에서 물을 잠기도록 붓고 30분간 그대로 둡니다\n마트에서 구입한 거라면 어느정도 손질이 되어 있어서 담가두는 시간을 30분 정도만 잡아도 충분했는데요.\n\u200b시장에서 할머님들이 파시는 생도라지는 담가두는 시간을 더 길게 잡아주면 되세요 30분~1시간 정도 담가두어야 도라지의 쓴맛제거에 도움이 된답니다 :)', 'image_url': 'https://recipe1.ezmember.co.kr/cache/recipe/2024/09/16/1c00aefce1c99824fda2d2a1caf071d81.jpg'}, {'step_number': 6, 'description': '30분이 경과한 후에 손으로 바락바락 주물러가며 한번더 쓴맛 제거를 해주었어요 찬물을 갈아가면서 3~4차례 헹궈주고 채반에 밭쳐서 물기를 가볍게 짜서 준비합니다볼 , 채반', 'image_url': 'https://recipe1.ezmember.co.kr/cache/recipe/2024/09/16/13d2a57f08fdcf7fe36edccdaca511821.jpg'}, {'step_number': 7, 'description': '대파는 송송썰어 주고 도라지나물볶음을 해 볼 텐데요. 쓴맛이 강할 때는 끓는물에 소금넣고 1분간 데쳐서 헹군 후에 조리해 주셔도 좋아요 :) 저는 데치는 과정은 생략했답니다도마 , 조리용나이프', 'image_url': 'https://recipe1.ezmember.co.kr/cache/recipe/2024/09/16/db5710484233b0ed73fab2578dcd9b571.jpg'}, {'step_number': 8, 'description': '팬에 식용유 2T, 다진마늘 1/2T, 다진대파 2T를 넣고 중불로 불을 켜 주세요 가볍게 볶아서 파기름을 내고볶음팬 , 요리스푼', 'image_url': 'https://recipe1.ezmember.co.kr/cache/recipe/2024/09/16/686aa4b94d7273ee937a58d2ec80d2f91.jpg'}, {'step_number': 9, 'description': '고소한 향이 올라오면 준비한 도라지를 넣어줍니다', 'image_url': 'https://recipe1.ezmember.co.kr/cache/recipe/2024/09/16/65a447b3907be937bee99b7d84fd0e5a1.jpg'}, {'step_number': 10, 'description': '가볍게 볶아주시면 되는데요. 파기름에 코팅이 되도록 볶아내면 쓴맛도 어느정도 제거되는 효과가 있어요', 'image_url': 'https://recipe1.ezmember.co.kr/cache/recipe/2024/09/16/ae5764e6b4c868b95912fc41f7cac1a61.jpg'}, {'step_number': 11, 'description': '대파기름에 골고루 코팅이 되었으면 참치액 1/2T, 국간장 2/3T, 물 3T, 참기름 1T, 깨소금 1T을 넣고 중불에 볶아주세요물을 살짝 넣어주어야 수분감이 생기고 나물볶음이 뻣뻣하지 않고 촉촉해져요\u200b', 'image_url': 'https://recipe1.ezmember.co.kr/cache/recipe/2024/09/16/926f827de27026f5fb6fa568805c31c21.jpg'}, {'step_number': 12, 'description': '도라지나물의 양과 상태에 따라 볶는시간과 물의 양을 가감해서 조리해 주면 되고, 양념이 골고루 스며들도록 촉촉하게 볶아주세요 :) 타지 않게 유의하며 도라지가 익을 때까지 볶아준 후에는', 'image_url': 'https://recipe1.ezmember.co.kr/cache/recipe/2024/09/16/c88f7733bcf5a07117df1f1cf98994231.jpg'}, {'step_number': 13, 'description': '불을 끄고 통깨 솔솔 뿌려서 마무리해 줍니다 간을 보고 부족한 간은 소금이나 국간장을 뿌려서 맞춰주면 되세요 :)제사 도라지나물이라면 다진마늘, 대파는 생략하고, 색이 탁해지지 않도록 국간장보다는 소금을 사용해 주면 흰색나물의 깔끔한 빛깔을 살릴 수 있어요\n물론 일반 명절나물로 드시는 용도라면 예꿈이댁 레시피처럼 다진마늘과 대파, 참치액, 국간장 넣고 더 맛있게 도라지볶음 만드는 법 해 주시면 된답니다', 'image_url': 'https://recipe1.ezmember.co.kr/cache/recipe/2024/09/16/d9cf56ea565631a7484c915f3238fcee1.jpg'}, {'step_number': 14, 'description': '맛있게 볶아진 도라지나물을 접시에 담고 통깨 솔솔 뿌려내면 삼색나물 종류 명절 나물요리 도리지나물볶음 완성이에요 :)\n접시', 'image_url': 'https://recipe1.ezmember.co.kr/cache/recipe/2024/09/16/096dffca1b9fbdf83f20198647e165401.jpg'}]"
17292,밑반찬,명절,채소류,볶음,제사 무나물볶음 만드는법 차례상 무나물 레시피,무나물볶음,https://recipe1.ezmember.co.kr/cache/recipe/2024/09/19/5b904bca611d5e46e7df0ce684f2dcd91.jpg,93,20분 이내,초급,2인분,"[('무', '250g'), ('참기름                                                                                또는 들기름', '1.5숟가락'), ('물', '100ml'), ('참치액', '1/2숟가락'), ('소금', '약간'), ('설탕                                                                                또는 올리고당', '약간'), ('통깨', '1/2숟가락')]","삼색나물 중 하나로 준비하기 좋은 무나물볶음 만들었어요 ​ 보통은 도라지나물, 고사리나물, 시금치나물 이렇게 세가지를 많이들 준비하시는데 도라지나물 대신 무나물을 올리셔도 괜찮아요 ​ 제사 차례상 무나물볶음은 향신채인 파와 마늘을 생략하고 모양도 정갈하고 예뻐야 하기에 무는 두께감 있게 썰어주는 것이 좋아요 제사 무나물볶음 맛있게 만드는 꿀팁은 멸치육수를 조금 넣어 부드럽게 익혀주는 거예요. 간을 하실 때에도 참치액 살짝 넣어주면 맛있어요 ​ ​ 부드럽게 잘 익은 무를 한 젓가락 듬뿍 집어먹었을 때 입안 가득 감도는 깊은 감칠맛~ 제사 무나물볶음 맛있게 만드는 법 지금 바로 알려드릴게요^^ ​","[{'step_number': 1, 'description': '제사 나물은 향신채를 쓰지 않아서 대파나 마늘은 생략합니다 무만 한 덩어리 준비해요. 저울에 재보니 약 250g 정도입니다 아직 날이 많이 무더워 무가 맛있는 때는 아니에요 이럴 때는 올리고당이나 설탕을 조금 넣어 단맛을 더해줘도 좋아요도마 , 조리용나이프', 'image_url': 'https://recipe1.ezmember.co.kr/cache/recipe/2024/09/24/3f214e3c9218821351c6a9adf07ba64c1.jpg'}, {'step_number': 2, 'description': '적당한 두께로 채 썰어줍니다', 'image_url': 'https://recipe1.ezmember.co.kr/cache/recipe/2024/09/24/c5dc81b3e40d0b0be54175676e6f23371.jpg'}, {'step_number': 3, 'description': '사진과 같이 적당한 두께로 채를 썰어주세요', 'image_url': 'https://recipe1.ezmember.co.kr/cache/recipe/2024/09/24/21cfac34431bac6ab687fd1b12f70d4a1.jpg'}, {'step_number': 4, 'description': '참기름 또는 들기름을 1.5스푼 넣고 무와 함께 볶아주세요 불은 중불로 2분가량 볶아줬어요 냄비 , 조리주걱', 'image_url': 'https://recipe1.ezmember.co.kr/cache/recipe/2024/09/24/2ea92abb0b21a52fc95f07fa0cb744651.jpg'}, {'step_number': 5, 'description': '간은 소금으로만 깔끔하게 맞춰주셔도 좋지만 참치액이 살짝 들어가면 감칠맛이 더해져서 맛있더라고요. 국간장으로 대체하셔도 되지만 많이 넣으면 색이 진해져요 입맛에 맞게 선택하셔서 간을 적당히 맞춰주세요숟가락', 'image_url': 'https://recipe1.ezmember.co.kr/cache/recipe/2024/09/24/539ba5e8453e40caf0a78ff2477ac3701.jpg'}, {'step_number': 6, 'description': '나머지 간은 소금으로 맞춰주시면 되는데요 밥숟가락 1/3 살짝 안되게 넣었어요', 'image_url': 'https://recipe1.ezmember.co.kr/cache/recipe/2024/09/24/2c4b616b699078fb9665e00a31f707e41.jpg'}, {'step_number': 7, 'description': '여름 무라 단맛이 없어서 올리고당이나 설탕도 약간 넣어주면 좋아요 이건 생략하셔도 됩니다', 'image_url': 'https://recipe1.ezmember.co.kr/cache/recipe/2024/09/24/7dea44b1043096aa917c8af0cf40184e1.jpg'}, {'step_number': 8, 'description': '미리 준비한 멸치육수 100ml를 무에 부어주세요. 간단하게 쌀뜨물을 활용하셔도 좋아요 이제 뚜껑을 덮고 중약불로 줄인 후 8~10분간 졸여줬어요', 'image_url': 'https://recipe1.ezmember.co.kr/cache/recipe/2024/09/24/695e6cd853028744a233bd45803d639f1.jpg'}, {'step_number': 9, 'description': '국물이 촉촉하게 남았을 때 마무리해 주세요 무나물은 촉촉하고 부드러워야 맛있어요 통깨 뿌려 마무리합니다', 'image_url': 'https://recipe1.ezmember.co.kr/cache/recipe/2024/09/24/75518888defca3242d88d9d8d2d867791.jpg'}]"
17293,밑반찬,명절,채소류,볶음,"고구마순요리,고구마줄기 볶음.",고구마줄기볶음,https://recipe1.ezmember.co.kr/cache/recipe/2017/02/09/bfb4817cfc3df3b097cf268f30e3ebfa1.jpg,"13,939",30분 이내,아무나,4인분,"[('불린 고구마줄기', '500g'), ('국간장', '2수저'), ('쪽파', '5뿌리'), ('마늘', '3쪽'), ('들기름', '2수저'), ('표고버섯 가루', '1수저'), ('매실액', '1수저')]","농장에 심어 두었던 고구마는...
고구마줄기가 워낙 무성하여 고구마나 들었을라나...
 고구마줄기 요리를 워낙 좋아하다보니...여름부터 고구마줄기따다 묵나물로 말려두었지요.
정월 대보름이 다가오니...
고구마줄기볶음을 만들어 볼까해요.","[{'step_number': 1, 'description': '고구마줄기는 껍질을 벗겨 푹 삶아서 볕에 잘 말려 지퍼팩에 보관을 했어요.', 'image_url': 'https://recipe1.ezmember.co.kr/cache/recipe/2017/02/09/1b7e4efcbd4925b0bbc0b8299cc77b5e1.jpg'}, {'step_number': 2, 'description': '묵나물중에 고구마줄기가 가장 질긴거 같아요.\n묵나물 삶을 때는 서너시간 물에 불려 두었다가 삶으면 부드럽게 잘 삶아져요.', 'image_url': 'https://recipe1.ezmember.co.kr/cache/recipe/2017/02/09/813146efa58b0b85cd4d7389cd6b4bf31.jpg'}, {'step_number': 3, 'description': '서너시간 불려 두었던 말린고구마줄기는 중불로 30분정도 푹 삶아줍니다.', 'image_url': 'https://recipe1.ezmember.co.kr/cache/recipe/2017/02/09/e055e98da797ad88bcf903600f0779b21.jpg'}, {'step_number': 4, 'description': '푹 삶아진 고구마줄기는 삶은 물에 한두시간 담가두면 아무리 질긴 고구마줄기라 하더라도 아주 부드럽지요.', 'image_url': 'https://recipe1.ezmember.co.kr/cache/recipe/2017/02/09/10111454711583e85ea5c8f41d4356d61.jpg'}, {'step_number': 5, 'description': '보드러운 고구마줄기는 적당한 크기로 썰어서 준비합니다.', 'image_url': 'https://recipe1.ezmember.co.kr/cache/recipe/2017/02/09/26fa67951079c70674349a1b5a9472c81.jpg'}, {'step_number': 6, 'description': '쪽파는 적당한 크기로 썰어 주고, \n마늘은 다져 줍니다.', 'image_url': 'https://recipe1.ezmember.co.kr/cache/recipe/2017/02/09/63142d37fddacb995569f89e29c4e1891.jpg'}, {'step_number': 7, 'description': '쪽파, 다진마늘, 표고버섯가루, 들기름, 국간장, 매실액을 넣고 조물조물 무쳐줍니다.\n간이 베이도록 30분 정도 둡니다.', 'image_url': 'https://recipe1.ezmember.co.kr/cache/recipe/2017/02/09/0c53d29d6a1e8459f5a3d4aba70e88bf1.jpg'}, {'step_number': 8, 'description': '그리고 휘리릭 볶아줍니다.\n부족한 간은 국간장이나 소금으로 해주시면 됩니다.\n고구마순 볶음에 들깨 가루를 넣으면 고소함이 두배가 되요.', 'image_url': 'https://recipe1.ezmember.co.kr/cache/recipe/2017/02/09/56414433f0b7b1b5999fb2736ab1fd041.jpg'}]"
17294,밑반찬,명절,채소류,볶음,고사리나물,고사리나물,https://recipe1.ezmember.co.kr/cache/recipe/2019/01/27/46315f661b257a6b5415585a8475e1491.jpg,"4,075",15분 이내,초급,2인분,"[('삶은 고사리', '400g'), ('다진마늘', '1T'), ('파', '50g'), ('후추', '1t'), ('간장', '2T'), ('식용유', '2T'), ('참기름', '1T'), ('깨', '1t'), ('다시물', '1컵')]",곧 명절에 꼭 올라가는 나물입니다,"[{'step_number': 1, 'description': '삶은고사리를 깨끗이 씻어 물기를 뺀다음 적당한 크기로 자른다', 'image_url': 'https://recipe1.ezmember.co.kr/cache/recipe/2019/02/02/b4005fc211c49e9ca07736e715281bba1.jpg'}, {'step_number': 2, 'description': '팬에 썬고사리를 넣고 다진마늘,파,깨,간장,후추를 넣는다', 'image_url': 'https://recipe1.ezmember.co.kr/cache/recipe/2019/02/02/7ebaf94bd331f964cff3ec19fea094c71.jpg'}, {'step_number': 3, 'description': '팬에 고사리와 모든양념을 넣고 버무려준다', 'image_url': 'https://recipe1.ezmember.co.kr/cache/recipe/2019/02/02/4b5c7c0c54bec62f69d6eade24ee33911.jpg'}, {'step_number': 4, 'description': '모든양념을 넣고 버무린 고사리에 식용유와 물을 넣고 조리듯이 볶는다', 'image_url': 'https://recipe1.ezmember.co.kr/cache/recipe/2019/02/02/e647ce7e65668757b6c805072d6e62bd1.jpg'}, {'step_number': 5, 'description': '물이 어느정도 자작해질정도로 볶아주면 끝\n고사리나물 완성', 'image_url': 'https://recipe1.ezmember.co.kr/cache/recipe/2019/02/02/81f1849101036dd5012d7930eba2385f1.jpg'}]"
17295,밑반찬,명절,채소류,볶음,산나물중 제일 맛있는 대보름나물 곤드레나물볶음,곤드레나물볶음,https://recipe1.ezmember.co.kr/cache/recipe/2019/02/15/60a4f009929d58589b139b3a530ff7611.jpg,"3,442",60분 이내,초급,5인분,"[('곤드레', '1줌'), ('들기름', '2T'), ('치킨파우더                                                                                취향껏', '1t'), ('국간장', '1T'), ('간장                                                                                기호에 맞게 가감', '1T'), ('마늘', '1/2t'), ('파', '적당량'), ('통깨', '약간')]","정월대보름 나물요리
두번째로 곤드레나물볶음을 만들었어요

저는 산나물중 곤드레를 젤 좋아해요
처음으로 곤드레나물을 먹게 된건 
13년전쯤 이였던거 같아요

정선에 놀러가서 첨으로 
곤드레밥을 먹어보고 그맛에 반했죠
나물밥이라 하면 콩나물밥만 하는줄 
알았던 때라 산나물로 밥을 짓는다는건
무지 신선하고 새로운 맛을 
경험한듯 했어요

그도 그럴것이 설에선 곤드레나물을
구경한적도 없었거든요ㅋ
곤드레를 맛본후 곤드레땜에 
정선을 두번정도 더 갔을만큼
생각나게 했던 맛이였죠ㅋㅋ

근데 이제는 시장이나 마트에서도
흔하게 구입할수 있어서 넘 좋은듯 해요
그러니 보름날이면 곤드레나물 
빠지면 안되는 저희집에
필수나물이 되었어요ㅋㅋ

곤드레밥으로 해도 맛있고 나물로 해서
안비벼먹어도 맛있는 곤드레나물
정월보름나물로 맛있게 해드세요^^

오늘도 신나는 불금 맞으세요~♡","[{'step_number': 1, 'description': '곤드레를 끓는물에 삶습니다', 'image_url': None}, {'step_number': 2, 'description': '삶은 곤드레를 손질합니다', 'image_url': None}, {'step_number': 3, 'description': '여러번 씻은후 꼭 짭니다', 'image_url': None}, {'step_number': 4, 'description': '웍에 곤드레를 넣고 순서대로 양념을 하며 볶습니다', 'image_url': None}, {'step_number': 5, 'description': '그릇에 담아냅니다', 'image_url': None}]"
17296,밑반찬,명절,채소류,볶음,#수미네반찬 #정월대보름나물 #무나물만들기 #저염식무나물 #초간단무나물,무나물,https://recipe1.ezmember.co.kr/cache/recipe/2019/02/22/e45008a995085e74de396dfe23f538bf1.jpg,"28,922",15분 이내,아무나,6인분 이상,"[('무', '1개'), ('대파', '1/3대'), ('들기름', '2큰술'), ('다진마늘', '1작은술'), ('참기름', '1큰술'), ('소금', '1큰술')]","수미네반찬에서 명절나물로 만든 무나물!!

아주아주 간단하지요. 정월대보름에 이 나물을 만들어서 비빔밥해서 먹었지요.

그리고 남은 나물을 이용해서 나물김밥도 해 먹었고요.

​

무, 대파, 들기름, 참기름, 소금, 다진마늘만 있다면

아삭아삭하게 만드는 무나물을 초스피드로 만드실 수 있습니다.","[{'step_number': 1, 'description': '무는 너무 굵지 않게 채썰어서 준비합니다.', 'image_url': 'https://recipe1.ezmember.co.kr/cache/recipe/2019/02/22/80d6617d7e00ce6264bb32b279aeaebb1.jpg'}, {'step_number': 2, 'description': '그리고 대파도 무와 비슷한 길이로 채썰어서 준비합니다.', 'image_url': 'https://recipe1.ezmember.co.kr/cache/recipe/2019/02/22/18db8f7181815ae2e3385bf1acdff28a1.jpg'}, {'step_number': 3, 'description': '달궈진 팬에 기름없이!! 기름없이 무를 넣고는 볶아 줍니다. 중불에서 볶아 주세요.', 'image_url': 'https://recipe1.ezmember.co.kr/cache/recipe/2019/02/22/495338c18a11ef25ecd4f100fde255c61.jpg'}, {'step_number': 4, 'description': '그리고는 여기에 들기름을 넣어 줍니다. 들기름이 골고루 입혀지도록 볶아 주세요. 젓가락을 사용해서 볶아주시는 것이 훨씬더 잘 볶아지실꺼예요.', 'image_url': 'https://recipe1.ezmember.co.kr/cache/recipe/2019/02/22/229078817f6fb4ebaf8d90df08b3d1df1.jpg'}, {'step_number': 5, 'description': '그렇게 볶다가는 대파, 다진마늘, 참기름, 소금을 넣어 줍니다. 여기의 간은 소금간만 해 줍니다.', 'image_url': 'https://recipe1.ezmember.co.kr/cache/recipe/2019/02/22/e9075a71a9c1ed2e5d9f27972c28cb3b1.jpg'}, {'step_number': 6, 'description': '무가 날무가 아닌 익은 무가 될때까지 중불에서 볶아 주세요. 무의 아삭한 식감은 살아있으면서 날무가 아니면 됩니다. 간을 보시고는 부족하다고 생각이 드시면 소금 추가하시면 됩니다. 마무리로 통깨를 뿌려 줍니다. 그럼 끝이지요. 너무나 간단하지요.', 'image_url': 'https://recipe1.ezmember.co.kr/cache/recipe/2019/02/22/f73a1c8616c7099ad8f3da03e20834f51.jpg'}, {'step_number': 7, 'description': '물이 거의 생기지 않았어요. 이래야 제대로된 무나물이라고 합니다. 무의 아삭함은 살아 있으면서도 담백하고 무에서 나오는 단맛이 너무 좋은 무나물입니다.', 'image_url': 'https://recipe1.ezmember.co.kr/cache/recipe/2019/02/22/52f4f989c85aebec65d6532bc7d17ad71.jpg'}, {'step_number': 8, 'description': '수미네반찬 무나물을 완성접시에 담아 줍니다. 아삭아삭한 식감이 살아 있는 무나물 완성입니다.', 'image_url': 'https://recipe1.ezmember.co.kr/cache/recipe/2019/02/22/5a3664442163de4f4a848eed0c683cd11.jpg'}]"
17297,밑반찬,명절,채소류,볶음,"번거로워서 고민되는 정월대보름 나물, 쉽게 따라하기",나물,https://recipe1.ezmember.co.kr/cache/recipe/2018/02/27/ab27544b563e61b98373282f7f2439c21.jpg,"5,490",30분 이내,초급,1인분,"[('들기름', '1.5숟가락'), ('연두순', '1.5숟가락'), ('들깨가루', '2숟가락'), ('물', '2/3컵'), ('들기름', '1스푼'), ('연두순', '1.5숟가락'), ('깨소금', '1숟가락'), ('물', '1/4컵'), ('들기름', '1.5숟가락'), ('연두순', '1.5숟가락'), ('깨소금', '1숟가락')]","대표적인 3가지 건나물(토란대, 취나물, 표고버섯)로 쉽게 만드는 정월대보름 나물","[{'step_number': 1, 'description': '건나물을 서늘한 곳에서 반나절 불려주세요.반나절을 맞추기 어렵다면 전날 밤부터 불려주세요.', 'image_url': 'https://recipe1.ezmember.co.kr/cache/recipe/2018/02/27/2ed6099272c8374cf1b67d9ee5f50f891.jpg'}, {'step_number': 2, 'description': '불린 나물을 먹기 좋게 잘라 연두를 넣어 버무려주세요.', 'image_url': 'https://recipe1.ezmember.co.kr/cache/recipe/2018/02/27/275c5c7a8472544abbac2a20135954951.jpg'}, {'step_number': 3, 'description': '각 나물에 맞는 방법으로 조리해주세요.\n1) 토란대\n① 팬에 들기름을 두르고 삶은 토란대를 볶아주세요.\n② 물+들깨가루를 섞어 ①에 넣어주신 후, 5-7분정도 수분이 살짝 있을 때까지 부드럽게 볶아주세요.\n③ 토란줄기가 다 볶아지면 접시 담아 완성하세요.\n2) 취나물(곤드레나물, 고사리나물 등) \n① 팬에 들기름을 두르고 고사리를 볶아주세요.\n② 분량의 물을 넣고 약 3-5분간 촉촉한 느낌이 나도록 볶아주세요.\n③ 충분히 볶아지면 접시에 담아 깨소금을 뿌려 완성하세요.\n3) 표고버섯(말린가지나물, 호박고지나물 등)\n① 팬에 들기름을 두르고 표고버섯을 볶아주세요.\n② 약 3-5분간 너무 마르지 않게 볶아주세요.\n③ 충분히 볶아지면 접시에 담아 깨소금을 뿌려 완성하세요.', 'image_url': 'https://recipe1.ezmember.co.kr/cache/recipe/2018/02/27/55cb66c55cc9e259dcf3e33689404d451.jpg'}]"
17298,밑반찬,명절,채소류,볶음,쌉싸름한 도라지볶음,도라지볶음,https://recipe1.ezmember.co.kr/cache/recipe/2017/05/16/3b6fe8279216cfa0e79e877be0d6c0031.jpg,"7,791",15분 이내,초급,4인분,"[('도라지채', '200g'), ('포도씨유', '약간'), ('소금', '약간'), ('통깨', '약간'), ('참기름', '약간')]",명절이나 제사음식으로 올라오는 도라지 볶음은 쳐다보지도 않는 음식이었는데요... 언제부터인가 요 쌉싸름한 맛이 좋더라구요.,"[{'step_number': 1, 'description': '채 썬도라지를 찬물에 충분히 담궈서 쓴 맛을 빼놓습니다.', 'image_url': 'https://recipe1.ezmember.co.kr/cache/recipe/2017/05/16/61905327a4b9cc1c69025fa519f25c4c1.jpg'}, {'step_number': 2, 'description': '포도씨유를 두른 후라이팬에 도라지를 넣어 잘 볶습니다.', 'image_url': 'https://recipe1.ezmember.co.kr/cache/recipe/2017/05/16/f5f2b314de6f0f1394e23533e279f5b91.jpg'}, {'step_number': 3, 'description': '소금을 넣어 간을 합니다.(소금양은 조절하세요)', 'image_url': 'https://recipe1.ezmember.co.kr/cache/recipe/2017/05/16/9aae80ce494a68d7e70b35cf86e237491.jpg'}, {'step_number': 4, 'description': '가스불을 끈후에 참기름을 조금 넣어 향을 냅니다.', 'image_url': 'https://recipe1.ezmember.co.kr/cache/recipe/2017/05/16/dcc541225b18f8e3b585eac95c7056ea1.jpg'}, {'step_number': 5, 'description': '도라지볶음에 깨를 솔솔 뿌리고 맛나게 담습니다.', 'image_url': 'https://recipe1.ezmember.co.kr/cache/recipe/2017/05/16/a802eef23b5828a3bff253a30191e19a1.jpg'}]"
