index,종류별,상황별,재료별,방법별,글 제목,레시피이름,레시피이미지,조회수,조리시간,난이도,인분,재료,소개글,조리순서
36591,메인반찬,손님접대,해물류,찜,#수미네반찬 #랍스터해물찜만들기 #여름보양식 #수미네반찬 아구찜양념을 응용한 해물찜!!,랍스터해물찜,https://recipe1.ezmember.co.kr/cache/recipe/2018/07/24/004f18e86b6d4bc6a9999642a12de7071.jpg,"9,223",30분 이내,아무나,4인분,"[('냉동랍스터다리', '10개'), ('해물믹스', '2컵'), ('냉동새우', '8개'), ('콩나물', '2봉지'), ('쑥갓', '2봉지'), ('대파', '1대'), ('통깨', '2큰술'), ('고운고춧가루', '2컵'), ('굵은고춧가루', '2컵'), ('다진마늘', '1/2컵'), ('다진생강', '1큰술'), ('후추', '1큰술'), ('썬파', '3큰술'), ('풋고추', '2개'), ('홍고추', '1개'), ('양파', '1.5개'), ('양조간장', '1컵'), ('고추장', '3큰술'), ('물', '300ml'), ('청주', '3큰술'), ('전분가루', '3큰술'), ('물', '1컵'), ('꿀', '3큰술'), ('편마늘', '2큰술')]","랍스터다리를 이용해서 냉동새우, 냉동해물을 첨가해 준 후에 만든
랍스터해물찜이지요. 

그런데 양념장은 바로 수미네반찬에서 만들었던 아구찜 양념장을 만들어서 넣어 주었습니다. 
그리고 아구찜만드는 과정과 똑같이 랍스터해물찜을 만들어 주었지요. 
물론 랍스터다리와 냉동해물은 데칠 필요는 없었기 때문에 해동만 해주었고요.

지금까지 여러 방법으로 만들어 보았던 해물찜 중에 갑이였습니다.
이런 맛이라면 굳이 비싼 돈을 주고 해물찜 먹으러 가지 않아도 될 것 같아요~~","[{'step_number': 1, 'description': '굵은고춧가루와 고운고춧가루를 섞어서 넣어 주시고 썬파, 다진마늘, 다진생강도 넣어 줍니다.', 'image_url': 'https://recipe1.ezmember.co.kr/cache/recipe/2018/07/24/4679fe075fa097947a2d61f1856fa7bb1.jpg'}, {'step_number': 2, 'description': '풋고추와 홍고추는 어슷어슷하게 큼지막하게 썰어서 넣어 주시고 액젓이나 양조간장을 넣어서 간을 맞춰 주시고는 청주, 후추를 넣어서 잘 섞어 줍니다.', 'image_url': 'https://recipe1.ezmember.co.kr/cache/recipe/2018/07/24/387a48c1244e36f2a3d59f4a3887b4e41.jpg'}, {'step_number': 3, 'description': '일단 양파를 넣지 않은 상태의 양념장입니다. 이때에는 걸쭉하다기보다는 퍽퍽한 느낌의 농도이지요. 간장과 청주밖에는 수분이 공급되지 않았기 때문에요.', 'image_url': 'https://recipe1.ezmember.co.kr/cache/recipe/2018/07/24/0af9b79241a4c6ce404514a0b62d1d6b1.jpg'}, {'step_number': 4, 'description': '두껍게 채썬 양파에 섞어 놓은 3번의 양념을 넣어 줍니다. 그리고 고추장도 넣어 주세요.', 'image_url': 'https://recipe1.ezmember.co.kr/cache/recipe/2018/07/24/17b2e4fe377cbccd9bca1509d96cac941.jpg'}, {'step_number': 5, 'description': '그리고 물을 넣어 줍니다. 그럼 걸쭉한 상태의 수미네반찬 아구찜의 양념장이 완성되는 것이죠. 저는 이 양념으로 랍스터해물찜을 하려고요.', 'image_url': 'https://recipe1.ezmember.co.kr/cache/recipe/2018/07/24/87a5dac2118842d0d9bf973f07dc46a51.jpg'}, {'step_number': 6, 'description': '약간은 묽으면서도 걸쭉한 상태가 됩니다. 냉동랍스터와 냉동해물, 냉동새우가 녹는 시간이 필요해서 냉장고에 넣고 잠시 숙성을 시켜 주었어요.', 'image_url': 'https://recipe1.ezmember.co.kr/cache/recipe/2018/07/24/783310fadb6142fe096e050bfb5932e11.jpg'}, {'step_number': 7, 'description': '랍스터다리도 해동이 완료 되었고요. 냉동새우, 냉동해물도 해동완료입니다. 냉동해물에는 오징어, 바지락살, 홍합이 들어가져 있고요. 냉동새우는 좀더 큰 냉동새우를 사용하였습니다. 랍스터다리는 냉동의 제품으로 찬물에 살짝만 담궈 놓아 주시면 금방 해동 시키실 수 있어요.', 'image_url': 'https://recipe1.ezmember.co.kr/cache/recipe/2018/07/24/8c2576515d5ea6fd29c621a00f19c1ae1.jpg'}, {'step_number': 8, 'description': '랍스터해물찜을 하기 전에 먼저 또 준비해야할 것이 전분물입니다. 전분가루를 준비합니다.', 'image_url': 'https://recipe1.ezmember.co.kr/cache/recipe/2018/07/24/973be47e6ed27593907c34ac2b0075a41.jpg'}, {'step_number': 9, 'description': '콩나물은 해물찜용으로 나온 길고 굵은 것을 사용하시는 것이 좋은데 쉽게 구하기가 어려워서 그냥 일반적으로 약간은 굵은 콩나물을 두봉지를 구입해서 찜용 냄비에 가장 먼저 깔아 줍니다.', 'image_url': 'https://recipe1.ezmember.co.kr/cache/recipe/2018/07/24/b0e32c4075c1cde9908734bb006987981.jpg'}, {'step_number': 10, 'description': '그리고 해동시킨 냉동랍스터다리를 콩나물위에 깔아 줍니다.', 'image_url': 'https://recipe1.ezmember.co.kr/cache/recipe/2018/07/24/e794a5eb538042be79129483f9fc00fb1.jpg'}, {'step_number': 11, 'description': '랍스터다리 위에 냉동새우와 냉동해물을 올려 줍니다.', 'image_url': 'https://recipe1.ezmember.co.kr/cache/recipe/2018/07/24/c0f8ed4ef84acad47b952f5785dd4ed61.jpg'}, {'step_number': 12, 'description': '만들어 놓았던 해물찜양념을 위에 골고루 깔아 주세요. 섞으실 필요없이 그대로 그냥 위에 해물이나 랍스터가 보이지 않도록 빼곡히 깔아 주시면 됩니다. 그리고는 뚜껑을 반드시 닾아 주고는 15~20분정도 쪄 줍니다. 물을 넣지 않았습니다. 오로지 양념장에만 물이 들어갔지요. 자연스럽게 콩나물에서 많은 수분이 나오게 되지요.', 'image_url': 'https://recipe1.ezmember.co.kr/cache/recipe/2018/07/24/499dfefa32afaa0c2b4fd57c0e7072531.jpg'}, {'step_number': 13, 'description': '전분물을 마무리 해 줍니다. 전분가루에 물을 넣어서 잘 풀어 줍니다.', 'image_url': 'https://recipe1.ezmember.co.kr/cache/recipe/2018/07/24/fd46cb7a99f0245b38a1fd6203e3d2bb1.jpg'}, {'step_number': 14, 'description': '그리고 편마늘을 넣어 줍니다. 이점이 특이한 점이예요. 수미네반찬의 수미쌤의 방식이지요. 그리고 꿀을 넣어 줍니다. 요점도 특이하지요. 아마도 양념장에는 단맛이 전혀 들어가져 있지 않기 때문에 여기에 바로 단맛을 추가해주는 것 같아요.', 'image_url': 'https://recipe1.ezmember.co.kr/cache/recipe/2018/07/24/0e6bf23e42d47f0df5336276cfa019431.jpg'}, {'step_number': 15, 'description': '17분이 지난 후에 뚜껑을 열어 주었습니다. 우와 없던 수분이 엄청 많이 생겼네요. 이제부터는 스피드입니다.', 'image_url': 'https://recipe1.ezmember.co.kr/cache/recipe/2018/07/24/45593bb2c0f28054da6d468a8847a96e1.jpg'}, {'step_number': 16, 'description': '만들어 놓았던 전분물을 골고루 부어 줍니다. 휘휘 저으실 필요 없습니다. 나중에 완성 후에 한꺼번에 저으면 되니까요.', 'image_url': 'https://recipe1.ezmember.co.kr/cache/recipe/2018/07/24/74d27ca013e25ed9e8e65b9088579e1d1.jpg'}, {'step_number': 17, 'description': '그리고 큼지막하게 어슷하게 썬 대파를 위에 올려 줍니다.', 'image_url': 'https://recipe1.ezmember.co.kr/cache/recipe/2018/07/24/1cb0e8e5f73d444cb72634fc6b20ac4f1.jpg'}, {'step_number': 18, 'description': '그리고 5cm정도로 썬 쑥갓을 위에 덮어 줍니다. 미나리가 있으시면 미나리도 똑같은 길이로 썰어서 위에 같이 덮어 주시면 됩니다.', 'image_url': 'https://recipe1.ezmember.co.kr/cache/recipe/2018/07/24/9255ab0d3ad20bd7d7d2f32b95ee74c81.jpg'}, {'step_number': 19, 'description': '그리고 재빠르게 통깨와 참기름을 둘러 주시고는 불을 끄시고 뚜껑을 닫아 줍니다. 닫은 후에 5분정도 후에 뚜껑을 열으시면 수미네반찬 아구찜을 응용한 랍스터해물찜이 완성되는 것이죠.', 'image_url': 'https://recipe1.ezmember.co.kr/cache/recipe/2018/07/24/67bdf24adb981c0af3eedc2ca69724a41.jpg'}, {'step_number': 20, 'description': '불을 끄고 뚜껑을 닫았는데 잔열로 쑥갓이 충분히 익었습니다. 하지만 시들시들하게 너무 익은 상태가 아닌 푸릇푸릇한 상태로 익혀졌네요. 이제 드디어 밑에 깔린 콩나물부터 나무주걱을 이용해서 잘 섞어가면서 저어 줍니다. 전분물을 부어 주었기 때문에 농도도 걸쭉한 상태가 되고 양념이 콩나물과 쑥갓, 해물, 랍스터에 충분히 스며들어가져 있네요.', 'image_url': 'https://recipe1.ezmember.co.kr/cache/recipe/2018/07/24/7fe492e9639617049b85635a2e7e025c1.jpg'}, {'step_number': 21, 'description': '수미네반찬 아구찜을 응용한 랍스터해물찜 완성입니다. 그런데 역시나 굵은 콩나물이 아니어서 그런지 콩나물이 많이 익은 상태이네요. 아니면 17분을 해서 그렇게 되었을까요. 랍스터가 익지 않을까봐서는 2분을 추가해주었는데 말이죠.', 'image_url': 'https://recipe1.ezmember.co.kr/cache/recipe/2018/07/24/3f994e875bded68254e0a2c1c452584e1.jpg'}]"
36592,메인반찬,손님접대,해물류,찜,"제철 토마토로 맛을 낸, 토마토 해물찜 만들기",토마토해물찜,https://recipe1.ezmember.co.kr/cache/recipe/2018/06/15/6d67524f0366d1b370700c35f94dac671.jpg,"1,749",30분 이내,아무나,4인분,"[('오징어', '2마리'), ('홍합', '2컵'), ('미더덕', ''), ('정수물', '1컵'), ('완숙토마토 大', '2개'), ('양파', '1개'), ('콩나물', '500g'), ('미나리', '2줌'), ('대파', '1대'), ('청양고추', ''), ('홍고추', '1개'), ('전분가루', '3큰술'), ('참기름', '1큰술'), ('고춧가루', '4큰술'), ('마늘', '5쪽'), ('생강', '1/2톨'), ('간장', ''), ('매실청', '2큰술'), ('굴소스', ''), ('까나리액젓', '1큰술'), ('소금', '약간'), ('후추', '약간'), ('물', '1컵')]","토마토를 함께 넣고 조리하면 토마토 자체의 간으로 양념을 적게 사용할 수 있으며, 상큼한 맛이 맴돌아 개운하고 깔끔한 해물찜을 만들 수 있습니다.","[{'step_number': 1, 'description': '스무디 차퍼에 분량의 양념장을 만들어 약 10분가량 숙성시켜 주세요.타파웨어 스무디 차퍼', 'image_url': 'https://recipe1.ezmember.co.kr/cache/recipe/2018/06/15/af8d4de0ff6aa277835d66a9479f5d041.jpg'}, {'step_number': 2, 'description': '오징어는 내장만 제거하여 통으로 준비하고, 나머지 해물과 야채는 먹기 좋게 손질해 주세요.오징어 손질법 레시피', 'image_url': 'https://recipe1.ezmember.co.kr/cache/recipe/2018/06/15/707d6af81cb96f7cb212dc78ba131c701.jpg'}, {'step_number': 3, 'description': '넉넉한 크기의 냄비에 양파와 토마토를 깔고 해물-양념장 절반-야채-물 순으로 넣고 강불에서 12분간 익힌 후 콩나물과 미나리, 나머지 양념장을 넣고 다시 강불에서 5분간 조리해 주세요.레인보우 프리미엄 브레이져 38cm 8.5L', 'image_url': 'https://recipe1.ezmember.co.kr/cache/recipe/2018/06/15/7b666cdd5c250b3a2e86609b9397a9461.jpg'}, {'step_number': 4, 'description': '전분물을 풀어 농도를 맞추고 참기름을 두르면 완성!', 'image_url': 'https://recipe1.ezmember.co.kr/cache/recipe/2018/06/15/63a9e64002cdef89af3c1f1eb0290aff1.jpg'}]"
36593,메인반찬,손님접대,해물류,찜,가리비찜,가리비찜,https://recipe1.ezmember.co.kr/cache/recipe/2017/01/15/e565bf0370a1c0a9cd1f5dce7641bc401.jpg,"19,105",30분 이내,아무나,2인분,"[('가리비', '2kg'), ('소금', '4스푼')]","겨울이 제철음식인 가리비 
찜으로 먹어요","[{'step_number': 1, 'description': '싱싱한 가리비는 껍질에서 광택이 나고 푸른빛을 띠는 가리비를 구입합니다', 'image_url': 'https://recipe1.ezmember.co.kr/cache/recipe/2017/01/15/51b57a465cc6439b13612f30069df29d1.jpg'}, {'step_number': 2, 'description': '칫솔로 조개 겉면을 문질러 사이사이 붙어있는 뻘 모래등을 제거하고 흐르는 물에 여러번 행궈 줍니다', 'image_url': 'https://recipe1.ezmember.co.kr/cache/recipe/2017/01/15/590c5b7451562c77c3d92b1924295a211.jpg'}, {'step_number': 3, 'description': '볼에 소금을 풀어 가리비를 담궈 1시간정도 해감을 시킵니다', 'image_url': 'https://recipe1.ezmember.co.kr/cache/recipe/2017/01/15/6e7c6247a350ed425fc8e1a14064ee251.jpg'}, {'step_number': 4, 'description': '찜통에 채반을 넣고 채반이 잠길 만큼의 물과 정종3스픈 넣고 가리비를 차곡차곡 쌓아 10분정도 쪄줍니다', 'image_url': 'https://recipe1.ezmember.co.kr/cache/recipe/2017/01/15/b183f159d70f6d468f32d7171ce1bb301.jpg'}, {'step_number': 5, 'description': '육즙이 빠져 나오면 질겨지고 식감이 덜해 조개의 입이 벌어지면 바로 불을 끄고 접시에 담아 냅니다', 'image_url': 'https://recipe1.ezmember.co.kr/cache/recipe/2017/01/15/d25cc5b7e6ff1301c94ebbd028732cc31.jpg'}]"
36594,메인반찬,손님접대,해물류,찜,문어손질2탄 문어요리 문어숙회 모양내기 방송에 나온 전문식당 방법,문어숙회,https://recipe1.ezmember.co.kr/cache/recipe/2020/06/16/c3ca6c343f649f1de531c6dfd874da791.jpg,"3,235",10분 이내,초급,2인분,"[('문어', ''), ('맥주', '1캔')]","오늘도 해산물 덕후 우리부부는 하귀하나로마트에서 문어를 한마리 사왔어요. 오늘 구입한 문어는 붉은 색을 띄어서 직원분께 물어봤더니 싱싱할 수록 붉은 색을 띄구요 시간이 지날수록 점점 하얘진대요. ​ 지난 번 문어손질, 문어 예쁘게 삶기 포스팅에 이어 오늘은 2탄 방송에 나온 전문맛집 방법으로 문어숙회를 만들어 볼게요.","[{'step_number': 1, 'description': '문어 머리를 뒤집어서 내장을 제거하구요. 눈과 입을 제거해 줍니다.', 'image_url': 'https://recipe1.ezmember.co.kr/cache/recipe/2020/06/16/c53eb182e82c3d6f362166e91f8ed2b11.jpg'}, {'step_number': 2, 'description': '굵은 소금에 빨래하듯 1차 세척 그 다음 밀가루로 빨래하듯 2차 세척', 'image_url': 'https://recipe1.ezmember.co.kr/cache/recipe/2020/06/16/4195372e099404f05751a207848f4aa01.jpg'}, {'step_number': 3, 'description': '찜솥에 맥주를 넣어 문어를 찌면 비린내도 제거되고 야들야들한 문어를 맛볼 수 있어요.\n맥주가 끓어 찜기에 김이 오르면 문어를 뒤집어서 다리가 예뻐지도록 고루 자리잡아 줍니다.', 'image_url': 'https://recipe1.ezmember.co.kr/cache/recipe/2020/06/16/2b7bb5af8ffeb8f22efd10e70d6c6dd91.jpg'}, {'step_number': 4, 'description': '큰 문어는 10분 작은 문어는 7분 간 쪄 줍니다.', 'image_url': 'https://recipe1.ezmember.co.kr/cache/recipe/2020/06/16/2b4d8f0ff4e8860fe90efb50ed1d73321.jpg'}, {'step_number': 5, 'description': '쪄낸 문어는 뜨거울 때 다리부분에 살살살 칼집을 내 주면 이렇게 예쁘게 벌어진답니다.', 'image_url': 'https://recipe1.ezmember.co.kr/cache/recipe/2020/06/16/f1f0f784a8b9624a863b4781a95251731.jpg'}]"
36595,메인반찬,손님접대,해물류,찜,바지락술찜 바지락 해감과 바지락술찜,바지락술찜,https://recipe1.ezmember.co.kr/cache/recipe/2020/05/25/9b8532bbfe62b43d4978293b8e660fde1.jpg,"67,066",10분 이내,초급,2인분,"[('바지락', '500g'), ('통마늘', '5개'), ('페페론치노', ''), ('버터', '2조각'), ('소주', '2/3컵'), ('물', '1컵'), ('파슬리가루', '조금'), ('후추', '조금'), ('청양고추', '1개'), ('홍고추', '1개'), ('대파', '15cm')]","며칠 전 바지락 해감을 깨끗하게 해놓았기에 오랜만에 바지락술찜 끓여보았어요~!~

바다에서 나는 해물이나 생선을 너무 좋아하는 저는

해물이나 생선이 냉장고에 있음 빨리 꺼내서 식탁에 올리고 싶어진답니다~~!~

만들기는 쉽지만 만들어 놓으면 눈감빡할사이에 껍질만 남더라고요~!~
홈파티요리로 손님초대요리로도 손색이 없는 간단하지만 맛있는 요리네요

바지락이 싱싱하고 통통하게 살이 붙어서 더욱 맛있게 먹었는데

재료도 간단하고 만들기도 쉬워서 홈 파티에서도 인기 만점 이지요~!~
바지락 해감하는법은 동영상을 참고하세요

​

​
​","[{'step_number': 1, 'description': '화이트 와인이 있으면 좋은데 없어서 소주를 사용했어요~!~~\n재료의 양과 식성에 따라 양념은 가감하세요', 'image_url': 'https://recipe1.ezmember.co.kr/cache/recipe/2020/05/25/bfa7b78cfe7fcc0325663eea31e968ce1.jpg'}, {'step_number': 2, 'description': '바지락은 해감해서 준비합니다\n바지락 해감 법은 동영상을 보시면 됩니다\nhttps://tv.naver.com/v/13859968', 'image_url': 'https://recipe1.ezmember.co.kr/cache/recipe/2020/05/25/de1c3c102bd7bc3bc56748c58ee8482a1.jpg'}, {'step_number': 3, 'description': '팬에 버터 1조각을 넣어줍니다\n대파와 청양고추 마늘을 넣어서 파향과 마늘향을 냅니다\n이때 페페론치노도 넣어야 하는데 깜빡해서 나중에 넣었어요', 'image_url': 'https://recipe1.ezmember.co.kr/cache/recipe/2020/05/25/05367c162f58562bf21ed7bd438fd2e71.jpg'}, {'step_number': 4, 'description': '버터가 다 녹으면 바지락을 넣어주고 센 불에서 2~3분 볶아줍니다', 'image_url': 'https://recipe1.ezmember.co.kr/cache/recipe/2020/05/25/bae0c5bce15103716d5d7ec21bd480501.jpg'}, {'step_number': 5, 'description': '페페론치노와 소주(화이트 와인)를 넣어준 다음 바글바글 끓여줍니다', 'image_url': 'https://recipe1.ezmember.co.kr/cache/recipe/2020/05/25/e14419c3a8cee852807827f07ff356921.jpg'}, {'step_number': 6, 'description': '물은 안 넣어도 되는데 전 국물이 먹고 싶어서 물을 조금 넣었어요\n물을 조금 넣고 후추를 넣어줍니다', 'image_url': 'https://recipe1.ezmember.co.kr/cache/recipe/2020/05/25/be888f99c965f9790268c95a4c51067b1.jpg'}, {'step_number': 7, 'description': '바글바글 끓기 시작하면서 바지락이 벌어지지 시작하면 파슬리를 뿌려주고 완성입니다', 'image_url': 'https://recipe1.ezmember.co.kr/cache/recipe/2020/05/25/ac37b1d950a02d4d991ce7a116a81a201.jpg'}, {'step_number': 8, 'description': '국물이 칼칼하고 시원해서 바지락 건져먹고 난 다음 칼국수 면이 있음\n칼국수를 넣고 끓이고 싶은 마음이 간절했어요~!~~', 'image_url': 'https://recipe1.ezmember.co.kr/cache/recipe/2020/05/25/02c02ef5acb5fd8b7992748bfd91a39c1.jpg'}, {'step_number': 9, 'description': '간단하면서 맛있어서 언제나 좋아하는 메뉴지요~!~\n다음엔 넉넉하게 구매해서 해감한 뒤에 넣어놓고 먹어야겠어요~~~\n손잡이를 떼었을 때는 일반 그릇 같아요', 'image_url': 'https://recipe1.ezmember.co.kr/cache/recipe/2020/05/25/bf876c4b0f3d44386e694196861f51641.jpg'}]"
36596,메인반찬,손님접대,해물류,찜,크리스마스요리/애호박 전복찜,애호박전복찜,https://recipe1.ezmember.co.kr/cache/recipe/2019/12/17/9c78303d2649fae10ef153a91fed2af61.jpg,"1,208",30분 이내,초급,2인분,"[('전복', '2개'), ('애호박', '1개'), ('간장', '1스푼'), ('맛술', '2스푼'), ('매실청', '1스푼'), ('후추', '약간'), ('물', '1/2컵'), ('굴소스', '1스푼'), ('고추장', '0.5스푼'), ('올리고당', '1스푼')]","눈과 입이 즐거운 영양가득 품은 애호박 전복찜 만들어 봤어요~
제가 만든 애호박 전복찜은 전복 통째로 쪄 만드는 전복찜과는 비주얼과 맛이 완전 달라요~
쫄깃한 전복과 달큰한 애호박이 만나 식감과 맛 모두 굿입니다
자극적이지 않아 누구나 거부감 없이 맛있게 먹을 수 있어 크리스마스 홈파티요리로 손색없답니다","[{'step_number': 1, 'description': '재료 준비해 주세요~', 'image_url': 'https://recipe1.ezmember.co.kr/cache/recipe/2019/12/17/c509e27f5d4fcb3e92907c62e21d9e5c1.jpg'}, {'step_number': 2, 'description': '애호박은 3Cm 정도 되는 길이로 썰어 준 다음 \n가장자리 0.5Cm정도 남기고 가운데 씨 부분은 파내 주세요~', 'image_url': 'https://recipe1.ezmember.co.kr/cache/recipe/2019/12/17/fb117824628750c54b22c842ab3706f01.jpg'}, {'step_number': 3, 'description': '전복을 흐르는 물에 씻은 후 부드러운 솔을 이용해\n전복의 살과 족부 사이의 이물질을 닦아 주세요~\n껍질이 얇은 쪽으로 숟가락을 집어 넣고\n숟가락을 움직여 패각과 살을 분리해 주세요~\n살과 내장을 분리한 전복 이빨과 내장을\n가위나 칼을 이용해 떼어내 주면 전복손질 끝!전복 손질법 레시피', 'image_url': 'https://recipe1.ezmember.co.kr/cache/recipe/2019/12/17/c078372c147d5f28145e42ab4853b3411.jpg'}, {'step_number': 4, 'description': '파낸 애호박은 잘게 다져 주고 손질한 전복은 \n굵직하게 다져 준 다음 모두 그릇에 담고\n적힌 분량의 간장, 맛술, 매실청, 후추를 넣어 주세요~애호박 손질법 레시피', 'image_url': 'https://recipe1.ezmember.co.kr/cache/recipe/2019/12/17/81651a0b2a177029e07608c26a12472a1.jpg'}, {'step_number': 5, 'description': '전복과 애호박에 간이 배일 수 있도록 \n골고루 저어 밑간해 주세요~', 'image_url': 'https://recipe1.ezmember.co.kr/cache/recipe/2019/12/17/04cf4e1164f2eced4ad97a8a0bf1e91a1.jpg'}, {'step_number': 6, 'description': '파낸 애호박 가운데 부분에 \n밑간한 전복과 애호박 가득 채워 주세요~', 'image_url': 'https://recipe1.ezmember.co.kr/cache/recipe/2019/12/17/dd83d3fcf71281b9c525cb1acda28cfa1.jpg'}, {'step_number': 7, 'description': '팬에 적힌 분량의 조림 양념을 모두 넣고 \n만든 애호박 모두 올린 후 바글바글 끓이면서 조려 주면 완성!', 'image_url': 'https://recipe1.ezmember.co.kr/cache/recipe/2019/12/17/e5141f2c884fd36bd6e6a686d38ba15a1.jpg'}, {'step_number': 8, 'description': '접시에 완성된 애호박 전복찜 올리고 \n남은 소스 뿌려 주고 예쁜 당근꽃 올려 데코했어요~\n비주얼도 예뻐 크리스마스나 연말 홈파티요리로 굿입니다', 'image_url': 'https://recipe1.ezmember.co.kr/cache/recipe/2019/12/17/7c086ed3289fbfad669d2b4b1310fe141.jpg'}]"
