index,종류별,상황별,재료별,방법별,글 제목,레시피이름,레시피이미지,조회수,조리시간,난이도,인분,재료,소개글,조리순서
40925,메인반찬,다이어트,채소류,볶음,고기 없이 어묵으로 일품요리 완성~ 마라어묵쌈,마라어묵쌈,https://recipe1.ezmember.co.kr/cache/recipe/2024/08/23/5b000d61f457c21ff9b97198fe9f80d61.jpg,154,15분 이내,아무나,2인분,"[('사각어묵', '3장'), ('대파', '1/4대'), ('오이', '1/2개'), ('양파', '1/2개'), ('당근', '1/2개'), ('대파                                                                                흰부분', '1/2대'), ('포두부', '1팩'), ('마라소스', '1T'), ('알룰로스', '1/2T'), ('다진마늘', '1/2t'), ('굴소스', '1/2T'), ('다진대파', '1t'), ('식용유', '약간')]",어묵국수 해먹고 남은 사각어묵에 마라소스 약간 넣어서 마라어묵쌈 만들어 먹었어요. 편스토랑 진서연님 레시피를 따라서 만들었는데 매콤하고 포만감 있어서 다이어트 중에 먹기 좋을 것 같아요ㅎㅎ 매콤한거 좋아하시면 만들어보세요.,"[{'step_number': 1, 'description': '어묵는 길고 얇게 썰어요.도마 , 조리용나이프', 'image_url': 'https://recipe1.ezmember.co.kr/cache/recipe/2024/08/23/8c2fd0bb383171abd3a6cf698dc3249e1.jpg'}, {'step_number': 2, 'description': '오이는 엄지손가락 길이로 잘라서 4등분으로 자르고 씨부분은 잘라줬어요.', 'image_url': 'https://recipe1.ezmember.co.kr/cache/recipe/2024/08/23/eb6650858ea910b1f0ac479354c1d20c1.jpg'}, {'step_number': 3, 'description': '얇게 채 썰어요.오이 씨부분은 물기 생길까봐 잘라서 채 썰어줬는데 바로 드실거면 그냥 채 썰어도 괜찮아요. 오이 손질법', 'image_url': 'https://recipe1.ezmember.co.kr/cache/recipe/2024/08/23/2c92429393856657b75453d7badffb801.jpg'}, {'step_number': 4, 'description': '당근도 비슷한 길이도 얇게 채 썰어요.당근 손질법', 'image_url': 'https://recipe1.ezmember.co.kr/cache/recipe/2024/08/23/a2df15c9592bf0b63fd6fc0341a5ec561.jpg'}, {'step_number': 5, 'description': '대파는 반으로 갈라서 얇게 썰어요.어묵만 넣어도 충분히 매워서 매운거 못드시면 대파는 물에 잠시 담가서 사용하시거나, 생략하셔도 될 것 같아요. 대파 손질법', 'image_url': 'https://recipe1.ezmember.co.kr/cache/recipe/2024/08/23/5f22d0bee267711ba1bcf117a453921b1.jpg'}, {'step_number': 6, 'description': '양파도 얇게 썰어서 물에 10분정도 담가서 아린맛을 빼요.', 'image_url': 'https://recipe1.ezmember.co.kr/cache/recipe/2024/08/23/5d75809c18ead68a901e288ec8499a961.jpg'}, {'step_number': 7, 'description': '썰어둔 재료 각각 마주보게 접시에 담아요.플레이팅접시', 'image_url': 'https://recipe1.ezmember.co.kr/cache/recipe/2024/08/23/e0e933ecd426da917483f599852fe3d81.jpg'}, {'step_number': 8, 'description': '썰어둔 어묵에 마라소스 1T, 설탕 1/2T, 다진마늘 1/2t, 굴소스 1/2T 대파 약간 넣어서 볶아요. (굴소스는 기호에 따라 생략 가능한데 넣으면 감칠맛이 더해져서 더 맛있어요. )볶음팬 , 조리주걱진세연님 레시피에는 마라소스 3T 넣으셨는데 1T만 넣어도 충분히 매콤해서 처음에 조금 넣으시고 기호에 맞게 추가해주세요.', 'image_url': 'https://recipe1.ezmember.co.kr/cache/recipe/2024/08/23/eda3b5ece8e3c37efa45b85411f522ec1.jpg'}, {'step_number': 9, 'description': '볶아주다가 살짝 퍽퍽해서 식용유 약간 추가해서 볶아줬어요.', 'image_url': 'https://recipe1.ezmember.co.kr/cache/recipe/2024/08/23/732aea2b8afe046fe714e5b8393d56871.jpg'}, {'step_number': 10, 'description': '접시에 담아서 완성!', 'image_url': 'https://recipe1.ezmember.co.kr/cache/recipe/2024/08/23/434bb4afe838e10e06cb8220035e39c21.jpg'}, {'step_number': 11, 'description': '포두부 위에 재료들 올려서 돌돌 말아 먹었는데 매콤하고 상큼해서 다이어트 하는데 자극적인 거 땡기는 날 드셔 보세요.^^', 'image_url': 'https://recipe1.ezmember.co.kr/cache/recipe/2024/08/23/b0d12470a4bb5d82cbab88b07ecd3f451.jpg'}]"
40926,메인반찬,다이어트,채소류,볶음,가지 새송이 덮밥 만들기,가지새송이덮밥,https://recipe1.ezmember.co.kr/cache/recipe/2024/09/13/d6d6f0092fcae2209f80324642870b731.jpg,32,10분 이내,초급,2인분,"[('가지', '1개'), ('계란', '2개'), ('새송이', '1개'), ('물', '1T'), ('진간장', '1T'), ('미소된장', '1t'), ('고춧가루', '1t'), ('다진 마늘', '1t'), ('다진 대파', '2T'), ('들기름', '조금'), ('청양고추', '조금'), ('후춧가루', '조금')]",가지와 새송이를 작게 썰어 볶아 매콤한 양념을 더한 다이어트 덮밥 입니다.,"[{'step_number': 1, 'description': '가지와 새송이는 작게 썰어주세요.도마 , 조리용나이프가지 손질법', 'image_url': 'https://recipe1.ezmember.co.kr/cache/recipe/2024/09/13/163aa9e07525c1bbb68b949581170ae91.jpg'}, {'step_number': 2, 'description': '프라이팬 올리브유 다진 마늘과 대파 넣고서 향이 올라올 때까지 잘 볶다가프라이팬 , 조리주걱 \n\n                        \n                            알텐바흐 큐라이네 디펜더스 후라이팬', 'image_url': 'https://recipe1.ezmember.co.kr/cache/recipe/2024/09/13/ac9913c21d53aff2eac0f06d5c7d04a01.jpg'}, {'step_number': 3, 'description': '손질한 1의 재료 넣고 볶아주세요.중불2분 \n\n                        \n                            그로브 아보카도오일 엑스트라버진 250ml', 'image_url': 'https://recipe1.ezmember.co.kr/cache/recipe/2024/09/13/ac7e7a18e35f5c4f133bbcc804a452471.jpg'}, {'step_number': 4, 'description': '계란2개분량 잘 풀어서 부어주세요. 계란을 부드럽게 익혀주세요.', 'image_url': 'https://recipe1.ezmember.co.kr/cache/recipe/2024/09/13/fcadcd97163c243c4d40cbb271d187d71.jpg'}, {'step_number': 5, 'description': '작은 그릇에 양념재료 전부 넣고 섞어서 뿌려 살짝 볶으면 완성!', 'image_url': 'https://recipe1.ezmember.co.kr/cache/recipe/2024/09/13/9bcfc249eeb75d5fdcc8d1e22ec574ad1.jpg'}, {'step_number': 6, 'description': '잡곡밥, 야채, 가지새송이 덮밥소스 올려서 먹으면 영양만점 맛보장 한 끼 완성 입니다.접시', 'image_url': 'https://recipe1.ezmember.co.kr/cache/recipe/2024/09/13/acab5eaaeb5feb060fb7b364326a23d91.jpg'}]"
40927,메인반찬,다이어트,채소류,볶음,야채 유산슬 만들기,야채유산슬,https://recipe1.ezmember.co.kr/cache/recipe/2015/07/06/90f6585c46638da41668c02f0ba023f41.jpg,"24,665",15분 이내,초급,2인분,"[('냉장고속야채', ''), ('다진마늘', '1TS'), ('식용유', '약간'), ('두반장', '2TS'), ('굴소스', '1TS'), ('전분가루', '2TS'), ('물', '1/2컵'), ('후추', '약간'), ('참기름', '1TS')]",칼로리 걱정없는 야채넣어 만든 야채유산슬,"[{'step_number': 1, 'description': '모든 야채는 납작하고 얇은모양으로 채썰어주세요.', 'image_url': 'https://recipe1.ezmember.co.kr/cache/recipe/2015/07/10/3bfdc54aa70084cad29611c13cbfe4261.jpg'}, {'step_number': 2, 'description': '오이는 반달모양으로 어슷하게 썰어서 소금 1ts를 뿌려 5~10분정도 절여줍니다. 절여진 오이를 키친타올로 물기를 제거해서 준비해주세요.', 'image_url': 'https://recipe1.ezmember.co.kr/cache/recipe/2015/07/10/927c094ff180590edf3093340e6728471.jpg'}, {'step_number': 3, 'description': '프라이팬에 식용유를 두르고 양파와 다진마늘을 넣어 향을 내어준 다음 팽이버섯,대파,오이를 제외한 모든 야채들을 전부 넣어주고 이때 소금을 한꼬집 넣어서 볶아줍니다. 야채가 반정도 볶아지면 두반장 2TS, 굴소스 1TS를 넣고 볶아줍니다', 'image_url': 'https://recipe1.ezmember.co.kr/cache/recipe/2015/07/10/ca0f82697544e390d71f93bc12973afe1.jpg'}, {'step_number': 4, 'description': '양념이 야채들과 잘 어우러지면, 절여진 오이와 대파, 팽이버섯을 넣어 버무려 볶아줍니다. 마지막으로 전분가루 2TS, 물 반컵을 섞어 녹말물을 만들어주어 야채볶음에 풀어주세요. 가스불은 꺼주시구요! 이때, 한꺼번에 넣지말고.. 한숟갈씩 농도를 보면서 넣어주셔야 해요! 취향것 농도를 맞춰주세요.', 'image_url': 'https://recipe1.ezmember.co.kr/cache/recipe/2015/07/10/f20233b86dd76428681a16259a1a5f9e1.jpg'}, {'step_number': 5, 'description': '마무리로 후추 약간, 참기름 1TS을 넣어주시면 밑반찬으로 너무 좋은 야채 유산슬이 완성되었습니다', 'image_url': 'https://recipe1.ezmember.co.kr/cache/recipe/2015/07/10/34dd4184d42429bb3c2499e716ee1ef01.jpg'}]"
40928,메인반찬,다이어트,채소류,볶음,<비건음식> 으깬두부 채소 볶은밥 밥없는 볶은밥,두부볶음밥,https://recipe1.ezmember.co.kr/cache/recipe/2021/08/27/15673bef4cf2181c551f7362d3a06afc1.jpg,"1,730",10분 이내,아무나,1인분,"[('두부', '1/2모'), ('표고버섯', '1개'), ('감자', '1/2개'), ('토마토', '1개'), ('양파', '1/6개'), ('애호박', '1/5개'), ('파프리카', '1/2개'), ('올리브유', '1Ts'), ('간마늘', '1ts'), ('소금', '1/2ts'), ('진간장', '1Ts'), ('참기름', '1/2Ts'), ('깨소금', '약간'), ('후추', '약간')]","병원다녀와서 기운없는 나를 위해,밥없이…집에 있는
채소와 두부로 건강식, 밥없는 으깬두부 볶음밥을
만들어 봅니다.","[{'step_number': 1, 'description': '채소를 씻은후에 먹기좋게 다져 주세요.\n두부 반모는 손으로 꼭 짜서 물기를 제거해\n주세요.\n(먹다남은 찐 옥수수가있어서 함께 사용함)두부1/2.감자1/2,토마토1,버섯1,파프리카호박,양파도마 , 칼 , 접시두부는 꼭 짜주고,채소는 작게 다져주세요', 'image_url': 'https://recipe1.ezmember.co.kr/cache/recipe/2021/08/27/7615e74824b2b2c22be5a2d8c5ad07d01.jpg'}, {'step_number': 2, 'description': '준비 완료!\n프라이팬에 올리브유 1Ts을 두르고,먼저\n마늘을 넣어 10초 볶다가,감자,양파를\n넣어서 1분간 볶아 주세요..올리브유1Ts,간마늘1/2ts,감자1/2,양파프라이팬 , 나무숟가락중불마늘향을 낸 후에,감자를 익혀주세요', 'image_url': 'https://recipe1.ezmember.co.kr/cache/recipe/2021/08/27/f8f560e9dd9a4723d3425f3206adafd21.jpg'}, {'step_number': 3, 'description': '버섯,파프리카,애호박,토마토를 넣어서 \n볶다가 으깬 두부와 소금1/2ts을 넣어 주세요.버섯1,토마토1,애호박,파프리카,으깬두부1/2,소금1/2ts', 'image_url': 'https://recipe1.ezmember.co.kr/cache/recipe/2021/08/27/75c45d323d5defd64b3819b83658e7431.jpg'}, {'step_number': 4, 'description': '토마토가 거의 익었을 때에 진간장1Ts,\n후추를 톡톡 뿌리고 ,불을 끈 후에 참기름1/2 Ts을 둘러 주세요.으깬두부,채소,진간장1Ts,참기름1/2Ts,후추프라이팬 , 나무숟가락중불불을 끈 후에 참기름을 두른다.', 'image_url': 'https://recipe1.ezmember.co.kr/cache/recipe/2021/08/27/357a34991c5ab99c27dfd1bbc406af611.jpg'}, {'step_number': 5, 'description': '접시에 담고, 깨소금으로 마무리 하면\n근사한 으깬두부 채소밥이 완성이네요.\n밥이 없어도 든든하고,영양가도 있는,\n반찬도 필요없는 나를 위한 음식이\n완성 되었네요.으깬두부채소볶은밥,깨소금접시 , 스푼예쁘게 담아 주세요', 'image_url': 'https://recipe1.ezmember.co.kr/cache/recipe/2021/08/27/58803e9783a044f8247ae8a6689a3b031.jpg'}]"
40929,메인반찬,다이어트,채소류,볶음,규현 양배추 참치덮밥 다이어트 요리,참치덮밥,https://recipe1.ezmember.co.kr/cache/recipe/2024/09/02/6a7e5e85edb5ab4264090a39d42c2e041.jpg,107,15분 이내,아무나,1인분,"[('양배추', '200g'), ('식초', '1큰술'), ('캔참치', '100g'), ('계란', '1개'), ('대파', '1/2대'), ('식용유', '넉넉히'), ('참치액', '1큰술'), ('굴소스', '0.5큰술'), ('참기름', '1큰술'), ('통깨', '0.5큰술')]","다이어트 식단으로 먹기 좋은 양배추 참치덮밥, 아삭하게 씹히는 양배추에 고소한 참치가 잘 어우러져 자주 먹어도 물리지 않아 다이어트식으로 정말 좋아요! 양배추 참치덮밥 손쉽게 휘리릭 만들어 보세요 :)","[{'step_number': 1, 'description': '양배추 200g을 적당한 넓이로 채썰어 주세요도마 , 조리용나이프', 'image_url': 'https://recipe1.ezmember.co.kr/cache/recipe/2024/09/02/5ea561bd13882c65ad7931a15b5f61741.jpg'}, {'step_number': 2, 'description': '잘게 자른 양배추는 식초 1큰술 푼 물에 넣고 10분 담가준 후 흐르는 물에 세척해 물기를 충분히 털어내 주세요볼 , 채반', 'image_url': 'https://recipe1.ezmember.co.kr/cache/recipe/2024/09/02/a7b3997943d54d6e62ff780404de7d6d1.jpg'}, {'step_number': 3, 'description': '캔참치는 기름을 빼 준비하고 대파 1/2대는 잘게 송송 썰어주세요', 'image_url': 'https://recipe1.ezmember.co.kr/cache/recipe/2024/09/02/b7377feea10a89df698318e3dc7ddaeb1.jpg'}, {'step_number': 4, 'description': '팬에 식용유를 넉넉히 두르고 대파부터 넣어 볶아주세요프라이팬 , 요리스푼', 'image_url': 'https://recipe1.ezmember.co.kr/cache/recipe/2024/09/02/5cdb0f171230d654751a1a4fdde501661.jpg'}, {'step_number': 5, 'description': '대파의 향이 은근하게 올라오기 시작하면 세척해둔 양배추를 넣고 중강불로 볶아주세요', 'image_url': 'https://recipe1.ezmember.co.kr/cache/recipe/2024/09/02/d7c29eb519a903d542e6f601a070103a1.jpg'}, {'step_number': 6, 'description': '양배추의 숨이 살짝 죽으면 참치액 1큰술을 넣어주세요', 'image_url': 'https://recipe1.ezmember.co.kr/cache/recipe/2024/09/02/bcb375bdf8146c15d103dbab68952bb21.jpg'}, {'step_number': 7, 'description': '굴소스 0.5큰술을 함께 넣고 볶아주세요', 'image_url': 'https://recipe1.ezmember.co.kr/cache/recipe/2024/09/02/d796893a227d406a8acb27b33009db671.jpg'}, {'step_number': 8, 'description': '양배추에 간이 골고루 배면 참치를 넣고 휘리릭 섞 듯 볶아주세요', 'image_url': 'https://recipe1.ezmember.co.kr/cache/recipe/2024/09/02/f27fdf644903069fa3abab8cf3bed2741.jpg'}, {'step_number': 9, 'description': '양배추가 부드럽게 볶아지면 가운데 홈을 파 주세요', 'image_url': 'https://recipe1.ezmember.co.kr/cache/recipe/2024/09/02/404d45af649bd008a100d4c322528b961.jpg'}, {'step_number': 10, 'description': '계란 한알을 톡 깨뜨려 뚜껑을 덮고 익혀주세요. 그리고 참기름 1큰술, 통깨 솔솔 뿌려주시면 완성입니다 :)', 'image_url': 'https://recipe1.ezmember.co.kr/cache/recipe/2024/09/02/d0e085332468ae3d5184afc29b28e8171.jpg'}]"
40930,메인반찬,다이어트,채소류,볶음,방울토마토 꽈리고추 볶음 만드는법,방울토마토꽈리고추볶음,https://recipe1.ezmember.co.kr/cache/recipe/2024/09/12/b7e25afd717e69e8527c57c6a69db0421.jpg,28,10분 이내,초급,2인분,"[('방울토마토', '16개'), ('꽈리고추', '15개'), ('올리브오일', '1스푼'), ('들기름', '1스푼'), ('소금', '3꼬집'), ('통후추', '약간'), ('물', '500ml'), ('소금', '1/2스푼'), ('물', '500ml'), ('식초', '1스푼')]","알토란에서 본 신기한 요리였는데 재료도 간단하고 요리법도 간단한데 한번도 안해 본 조합이라 맛이 궁금해서 만들어 봤어요. 방울 토마토와 꽈리고추를 들기름에 볶아서 반찬처럼 먹는 요리예요. 신기하게도 소스에 들기름과 꽈리고추를 넣으니 이태리 샐러드 같은 요리가 갑자기 한식 요리가 되더라구요. 색감도 토마토와 꽈리고추의 빨강과 초록이 산뜻하게 대비를 이루어서 보기에도 좋아요. 간단하게 만들어서 건강한 요리로 먹을 수 있어 좋더라구요. 대신 많이 만들어 냉장고에 넣어 놓지 말고 한끼 정도 먹을 만큼만 만들어서 바로 먹어야 맛있게 즐길 수 있을 거 같아요. 꽈리고추와 토마토가 건강한 채소라서 건강한 채식 반찬이 되서 다이어트 요리나 건강요리로 좋은 거 같아요. 들기름의 맛이 고소하면서도 올리브 오일과 묘한 조화를 이루면서 동서양을 넘나드는 듯한 요리가 되더라구요. 밥반찬으로 먹어도 좋고 고기 요리에 같이 곁들여 줘도 좋을 거 같아요. 별거 아닌 작은 오일의 변화 만으로도 요리의 느낌이 많이 달라지는 신기한 요리, 색다른 맛으로 해볼 만 해요.","[{'step_number': 1, 'description': '방울 토마토는 씻어서 윗부분에 열십자로 칼집을 살짝 넣어 주세요.도마 , 조리용나이프', 'image_url': 'https://recipe1.ezmember.co.kr/cache/recipe/2024/09/12/5a515b99edbea30cd5d088a017c9f0771.jpg'}, {'step_number': 2, 'description': '끓는 물에 소금 1/2스푼 넣고 방울 토마토를 1분 정도 데쳐 주세요.냄비', 'image_url': 'https://recipe1.ezmember.co.kr/cache/recipe/2024/09/12/5927862e847947ccb03920a5c09e056a1.jpg'}, {'step_number': 3, 'description': '방울 토마토를 찬물에 헹궈 식혀 주세요.', 'image_url': 'https://recipe1.ezmember.co.kr/cache/recipe/2024/09/12/5170321b7085f164947a351982b289e21.jpg'}, {'step_number': 4, 'description': '체에 건져 물기를 빼주세요.채반', 'image_url': 'https://recipe1.ezmember.co.kr/cache/recipe/2024/09/12/2835c9b90177ce8bdafddc212eae064f1.jpg'}, {'step_number': 5, 'description': '방울 토마토는 껍질을 벗기고, 꽈리 고추는 꼭지를 떼고 길게 어슷하게 반을 썰어 주세요.', 'image_url': 'https://recipe1.ezmember.co.kr/cache/recipe/2024/09/12/ffd94373d000040bbd94294c30491e511.jpg'}, {'step_number': 6, 'description': '프라이팬에 올리브오일과 들기름을 섞어 넣어요.프라이팬 , 조리주걱', 'image_url': 'https://recipe1.ezmember.co.kr/cache/recipe/2024/09/12/979102d0e8b571d271fccf9eabde34541.jpg'}, {'step_number': 7, 'description': '꽈리고추와 토마토를 넣고 소금 3꼬집 넣고 볶아 주세요.\n중약불에서 5분 정도 볶아 주세요.', 'image_url': 'https://recipe1.ezmember.co.kr/cache/recipe/2024/09/12/4a642fba8a9bb5dbe5ef0ad4391ea49b1.jpg'}, {'step_number': 8, 'description': '불을 끄고 후추 뿌려 주고 마무리해요.', 'image_url': 'https://recipe1.ezmember.co.kr/cache/recipe/2024/09/12/fab91cd228de374b15eceb0b22ab8b971.jpg'}]"
