index,종류별,상황별,재료별,방법별,글 제목,레시피이름,레시피이미지,조회수,조리시간,난이도,인분,재료,소개글,조리순서
55923,디저트,다이어트,채소류,볶음,닭가슴살 고구마볶음 만들기,고구마볶음,https://recipe1.ezmember.co.kr/cache/recipe/2020/12/11/14ae0a311008a7bb7e6237011b48a4931.jpg,"3,668",30분 이내,아무나,3인분,"[('고구마 큰거', '1개'), ('닭가슴살', '300g'), ('양파', '1/2개'), ('대파', '1/2뿌리'), ('홍고추', '1개'), ('간장', '1T'), ('굴소스', '1T'), ('다진마늘', '1T'), ('검정깨', ''), ('참기름', '1T')]","작심삼일로 항상 끝나는 다이어트!!
 자꾸만 춥다고 움추리면서 옷으로 가리고다니는 요즘,식탁에서부터 방법을 찾아보아요~~^^","[{'step_number': 1, 'description': '*고구마는 껍질을 벗기고 깍뚝썰기해주세요\n웍에 기름조금 두르고 고구마를 먼저 볶아줍니다 .\n*고구마가 익어야되니 너무 두껍게 썰지 마시고 잠시 뚜껑을 덮어 익혀주세요', 'image_url': 'https://recipe1.ezmember.co.kr/cache/recipe/2020/12/11/173f536c709949c6f33129bc1bac0a061.jpg'}, {'step_number': 2, 'description': '저는 카레맛이 첨가된 닭가슴살준비했는데,순살도 좋아요', 'image_url': 'https://recipe1.ezmember.co.kr/cache/recipe/2020/12/11/14a0d830df27411240f155884280e8f21.jpg'}, {'step_number': 3, 'description': '대파도 듬뿍듬뿍 썰어서 준비해주세요', 'image_url': 'https://recipe1.ezmember.co.kr/cache/recipe/2020/12/11/a315de80e53a5623a190eed746760c2f1.jpg'}, {'step_number': 4, 'description': '살짝 볶아진 고구마에 닭가슴살을 넣어주세요', 'image_url': 'https://recipe1.ezmember.co.kr/cache/recipe/2020/12/11/567c22874af501b8211765d0a7337b711.jpg'}, {'step_number': 5, 'description': '잘게 썰어놓은 자색양파도 함께 넣고 뚜껑닫고 익혀줍니다', 'image_url': 'https://recipe1.ezmember.co.kr/cache/recipe/2020/12/11/af350d3670bf20e29fc2c6f20db3bd141.jpg'}, {'step_number': 6, 'description': '어느정도 끓어오르면 굴소스를 비롯 양념을 넣고 수분을 날려주면서 볶아주세요\n대파도 듬뿍듬뿍 올려주시구요', 'image_url': 'https://recipe1.ezmember.co.kr/cache/recipe/2020/12/11/2e571a0ca38cca1d5216cd2928a017e91.jpg'}, {'step_number': 7, 'description': '홍고추 가늘게 채썰어 올려주면 칼칼한맛도 있고 색감도 좋아요 \n건강한 다이어트식단 완성입니다 \n건강한 다이어트에 도전해 보세요~^^', 'image_url': 'https://recipe1.ezmember.co.kr/cache/recipe/2020/12/11/b300d97300623f6349fd4246d02ee72a1.jpg'}]"
55924,디저트,다이어트,채소류,볶음,저칼로리 요리 : 영양가득 다이어트 또띠아롤 만들기,또띠아롤,https://recipe1.ezmember.co.kr/cache/recipe/2017/08/04/3a157435714371d36f9205dff903a8371.jpg,"35,800",15분 이내,초급,1인분,"[('또띠아', ''), ('파프리카', ''), ('적양파', ''), ('계란', '3개'), ('베이컨', ''), ('후추', ''), ('저지방체다치즈', '')]","베이컨과 체다치즈를 넣어서 적당히 짭조름 고소한 맛이예요. 이 다이어트 또띠아롤에 단점은 아이 손, 어른 손 자꾸만 손이 가는 새우과자처럼 저칼로리 다이어트 또띠아롤도 한 번 손이 가기 시작하면 멈추지 않고 끝까지 먹고 싶단 점일 것 같아요 ㅋㅋㅋㅋㅋ","[{'step_number': 1, 'description': '먼저 또띠아 만들 재료들을 깨끗히 씻어주는게 제일 중요하다는 사실 알고 계시죠?\n과일 채소 전용 세척제인 퓨리어 에코파우더로 깨끗히 세척해주었답니다.', 'image_url': 'https://recipe1.ezmember.co.kr/cache/recipe/2017/08/16/bb13437139bae6da226fe147a7434f431.jpg'}, {'step_number': 2, 'description': '프라이팬에 올리브유를 두른 후 파프리카와 양파를 넣고 약간 센 불에 후추를 톡톡 뿌린 후 볶아 주세요.', 'image_url': 'https://recipe1.ezmember.co.kr/cache/recipe/2017/08/16/ca8547ed6ba36adc24dc910fe92fbb501.jpg'}, {'step_number': 3, 'description': '어느정도 채소들이 익었다 싶으면 준비해뒀던 계란 3개를 깨뜨려주세요.\n그리고 스크램블 하듯이 휙휙 저어 주세용~~', 'image_url': 'https://recipe1.ezmember.co.kr/cache/recipe/2017/08/16/6e5c98f77c6a5b4f348e6bbf1a9c89c91.jpg'}, {'step_number': 4, 'description': '기름을 두르지 않은 프라이팬에 또띠아를 살짝만 구워 주세요.\n구운 또띠아 위에 계란을 입힌 야채들을 올려주고 \n저지방 체다치즈와 잘게 자른 베이컨 한 조각을 같이 넣어줍니다.', 'image_url': 'https://recipe1.ezmember.co.kr/cache/recipe/2017/08/16/d007b0cdaa14efdbdbff9d315c4392691.jpg'}, {'step_number': 5, 'description': '이제 또띠아를 돌돌 말아주시면 준비 끝!', 'image_url': 'https://recipe1.ezmember.co.kr/cache/recipe/2017/08/16/d0db2f5a34bea619d3cace6e82e49a201.jpg'}]"
55925,디저트,다이어트,채소류,볶음,계란과 토마토가 만났다! 다이어트에 좋은 맛좋은 토달볶 레시피,토달볶,https://recipe1.ezmember.co.kr/cache/recipe/2015/04/01/ffe7acf1e288cf352d39feee17138aad1.jpg,"75,858",None,None,None,"[('토마토', ''), ('계란', ''), ('식용유', ''), ('소금', '')]","다이어트할때 먹으면 정말 좋을법한 음식, 칼로리 부담이 적은 요리 토달볶","[{'step_number': 1, 'description': '후라이팬을 약한 불로 가열해줄 동안 계란을 그릇에 톡 까서 노른자와 흰자가 잘 섞이도록 마구 휘저어줍니다. 이때 소금도 조금 뿌려 넣어주세요~ 계란은 먹을만큼만 넣으시면 되는데 저는 2~3개를 사용해 만들었으므로 참고해주세요~', 'image_url': 'https://recipe1.ezmember.co.kr/cache/recipe/2015/04/01/b064e900f725f2010a54a49017991cae1.jpg'}, {'step_number': 2, 'description': '후라이팬이 약간 뜨거워졌다 싶을 때 잘 풀어둔 계란을 부어 살살 휘저어주며 익혀주세요. 잘 저으며 익혀주다보면 사진처럼 되는데 여기에 잘라놓은 토마토를 후라이팬에 투척!! 후라이팬에 투척한 토마토를 계란과 골고루 섞이게 볶아주시면 끝!', 'image_url': 'https://recipe1.ezmember.co.kr/cache/recipe/2015/04/01/8559b83cbdcb13d12367817b7beeba341.jpg'}, {'step_number': 3, 'description': '위에 파슬리나 깨를 뿌려주어 포크로 맛있게 찍어먹으면 된답니다.', 'image_url': 'https://recipe1.ezmember.co.kr/cache/recipe/2015/04/01/623a9b6a0497cafe3c864e70df2c791f1.jpg'}]"
55926,디저트,다이어트,채소류,볶음,중국인들의 인기메뉴 토달볶,토달볶,https://recipe1.ezmember.co.kr/cache/recipe/2015/08/28/e8cdb68ff7e19c3023f7808c2543881f1.jpg,"10,944",15분 이내,아무나,1인분,"[('토마토', ''), ('달걀', ''), ('식용유', ''), ('소금', ''), ('후추', '')]",엄청 간단하지만 영양소가 풍부한 토마토 달걀 볶음이다.,"[{'step_number': 1, 'description': '생토마토를 8등분으로 썬다.', 'image_url': 'https://recipe1.ezmember.co.kr/cache/recipe/2015/08/31/edf0ccd4a3b413116f99afb57aca9ff21.jpg'}, {'step_number': 2, 'description': '계란 2개를 풀고 소금, 후추로 간을 한다.', 'image_url': 'https://recipe1.ezmember.co.kr/cache/recipe/2015/08/31/a5bd51faae9f58b80d6c7eef14535d421.jpg'}, {'step_number': 3, 'description': '팬에 기름을 두르고 계란을 부서 뒤적거리면서 스크램블을 만들다가 계란이 반쯤 익었을 때 토마토 투하하고 계란이 익을 때까지 함께 볶아 접시에 담으면 완성. 먹을땐 토마토와 계란을 뒤적거려서 함께 먹으면 부드럽고 새콤하니 맛있다.', 'image_url': 'https://recipe1.ezmember.co.kr/cache/recipe/2015/08/31/ce68a43e1ef7e68593e6e0aadb728ba31.jpg'}]"
55927,디저트,다이어트,채소류,볶음,저칼로리 야식! 달걀 채소볶음과 오미자 아이스티~,None,https://recipe1.ezmember.co.kr/cache/recipe/2015/08/28/86bb363fa47f29c7f80333d63bc0cba61.jpg,"4,160",30분 이내,아무나,1인분,"[('양파', ''), ('고추', ''), ('감자', ''), ('식용유', ''), ('다진마늘', ''), ('후추', ''), ('소금', ''), ('꿀오미자차', '')]",저칼로리 야식. 채소들이라 칼로리가 그다지 높지 않다. 아쉬운 단백질을 계란으로 더해 영양도 보충 하였습니다.,[]
