index,종류별,상황별,재료별,방법별,글 제목,레시피이름,레시피이미지,조회수,조리시간,난이도,인분,재료,소개글,조리순서
33971,메인반찬,손님접대,돼지고기,찜,[크리스마스에는~] 대패삼겹살찜&대패삼겹살말이구이,대패삼겹살찜,https://recipe1.ezmember.co.kr/cache/recipe/2018/12/26/964a6b7f5c88e0473703931738b4ffad1.jpg,"14,027",60분 이내,아무나,4인분,"[('대패삼겹살', '600g'), ('숙주나물', '1봉지'), ('생표고버섯', '2개'), ('대파', '약간'), ('통마늘', ''), ('각종야채', ''), ('식용유', ''), ('사과즙(배즙)', '1봉'), ('간장', '적당량'), ('식초', '2~3큰술'), ('고춧가루', '약간'), ('다진대파', '')]",대패삼겹살로 푸짐하고 일품요리를 다양하게~~,"[{'step_number': 1, 'description': '생표고버섯은 얇게 썰어주고, 마늘도 슬라이스해주고, 대파는 아주 가늘에 채를 썰어 줍니다', 'image_url': 'https://recipe1.ezmember.co.kr/cache/recipe/2018/12/26/d8f42791eca185b2bfab39da9a3b7fde1.jpg'}, {'step_number': 2, 'description': '찜기에 물을 붓고 청주나 소주를 좀 부어 줍니다', 'image_url': 'https://recipe1.ezmember.co.kr/cache/recipe/2018/12/26/43589b2a30b451be879f2773bf919dab1.jpg'}, {'step_number': 3, 'description': '채반을 올리고 손질하여 씻어둔 숙주나물을 넉넉히 올려 줍니다', 'image_url': 'https://recipe1.ezmember.co.kr/cache/recipe/2018/12/26/eb31c9899840c80954f0db4f5ba542b31.jpg'}, {'step_number': 4, 'description': '대패삼겹살을 해동하여 가지런히 반으로 접어서 둘러 담아 줍니다', 'image_url': 'https://recipe1.ezmember.co.kr/cache/recipe/2018/12/26/6715aae833046d7cf8672ea361876e751.jpg'}, {'step_number': 5, 'description': '대패삼겹살 위에 슬라이스마늘과 대파를 올리고 뚜껑을 덮어 약 15분간 익혀 줍니다', 'image_url': 'https://recipe1.ezmember.co.kr/cache/recipe/2018/12/26/7e98b70fd2b7ff177e65d2867ec8367d1.jpg'}, {'step_number': 6, 'description': '대패삼겹살에 숙주나물, 볶은당근, 볶은호박, 버섯을 찢어서 올리고 돌돌 말아 줍니다', 'image_url': 'https://recipe1.ezmember.co.kr/cache/recipe/2018/12/26/993293c36d3917bcda40565c2f6f8ac31.jpg'}, {'step_number': 7, 'description': '(야채는 원하는 것으로 어떤 야채든 다 좋답니다)', 'image_url': 'https://recipe1.ezmember.co.kr/cache/recipe/2018/12/26/d7425519ff6e5c7d03aa7d05a94ff5381.jpg'}, {'step_number': 8, 'description': '후라이팬에 가지런히 올리고 노릇하게 자주자주 뒤집어가며 구워줍니다', 'image_url': 'https://recipe1.ezmember.co.kr/cache/recipe/2018/12/26/6b871ec8264e161b66e957aa15fd9cc11.jpg'}, {'step_number': 9, 'description': '대패삼겹살말이구이가 다 되었어요~', 'image_url': 'https://recipe1.ezmember.co.kr/cache/recipe/2018/12/26/ea8621f408dbb1d51929979ffa2076341.jpg'}, {'step_number': 10, 'description': '잘 쩌진 대패삼겹살찜 위에 생버섯을 올리고 불을 뜨고 뚜껑을 덮어 잠시 둡니다', 'image_url': 'https://recipe1.ezmember.co.kr/cache/recipe/2018/12/26/149a6f9183798c502d4dbda96725ae4c1.jpg'}, {'step_number': 11, 'description': '어떤 버섯이든 다 좋고 버섯을 안 올려도 좋아요', 'image_url': 'https://recipe1.ezmember.co.kr/cache/recipe/2018/12/26/39802b5208f09e1016c0ebfdf68e9bae1.jpg'}, {'step_number': 12, 'description': '대패삼겹살로 만든 대패삼겹살찜과 대패삼겹살말이구이가 완성입니다!\n소스는 배즙이나 사과즙(1봉), 간장 적당량, 식초 2~3큰술, 고춧가루 약간, 다진대파를 넣어서 만들어 줍니다', 'image_url': 'https://recipe1.ezmember.co.kr/cache/recipe/2018/12/26/b1d2d18fc6220e02e7fc9c2e324758901.jpg'}, {'step_number': 13, 'description': '잘 쪄진 대패삼겹살찜을 보세요~~', 'image_url': 'https://recipe1.ezmember.co.kr/cache/recipe/2018/12/26/b43ff5c024e34f43a25cc76169c1bad51.jpg'}, {'step_number': 14, 'description': '대패삼겹살말이구이 입니다!', 'image_url': 'https://recipe1.ezmember.co.kr/cache/recipe/2018/12/26/efa63b93f4631b772a5e979840fe61fb1.jpg'}, {'step_number': 15, 'description': '대패삼겹살이여서 부드럽고 연하고\n삼겹살 특유의 고소함이 제대로 느껴져요!!\n여기에 각종 야채와 같이 먹으니 소고기로 만든 찜보다 훨씬 맛있더라구요^^\n대패삼겹살찜은 폭 쪄진 맛이라 상당히 부드럽고 연하고\n대패삼겹살말이구이는 안에 숙주가 아삭하고 고기가 구워져서 좀 더 단단하여서 식감이 참 좋더라구요!', 'image_url': 'https://recipe1.ezmember.co.kr/cache/recipe/2018/12/26/6a7b374367c15be6b81c2daef6937fa71.jpg'}]"
33972,메인반찬,손님접대,돼지고기,찜,돼지갈비찜 만드는법,돼지갈비찜,https://recipe1.ezmember.co.kr/cache/recipe/2015/06/17/347fe045d4d2cbd8136ce38e6113a71f.jpg,"26,694",2시간 이상,중급,2인분,"[('돼지갈비', '500g'), ('감자', '1개'), ('고구마', ''), ('당근', ''), ('떡', ''), ('밤', ''), ('은행', ''), ('양파', ''), ('간장', '5큰술'), ('통후추', ''), ('월계수잎', ''), ('대파나양파', ''), ('간장', '6큰술'), ('맛술', '2큰술'), ('매실', '2큰술'), ('설탕', '1큰술'), ('다진마늘', '2큰술'), ('다진파', '2큰술'), ('다진양파', '2큰술'), ('물', '약간')]","채소와 갈비가 듬뿍 들어간 돼지갈비찜

달콤하면서 짭쪼름한 맛~~^^ 이였답니다.","[{'step_number': 1, 'description': '돼지갈비는 기름을 제거한 후 찬물에 30분정도 담궈서 핏물을 제거해 주었답니다. 찬물에 너무 오래 담그면 육즙이 빠져서 맛이 없어요. 30분 담근 후에 끓는물에 간장 5큰술 , 통후추, 월계수입, 대파나 양파 있으면 넣고 한소끔 끓여주면 기름도 한번 제거가 되고 냄새도 잡을수 있답니다.', 'image_url': 'https://recipe1.ezmember.co.kr/cache/recipe/2015/06/18/2cc687ff6333727205e6b4579a5698861.jpg'}, {'step_number': 2, 'description': '채소는 깨끗하게 손질한 후에 먹기좋은 크기로 썰어 전분도 제거할겸 물에 잠깐 담궈주었어요.', 'image_url': 'https://recipe1.ezmember.co.kr/cache/recipe/2015/06/18/fa438459075fba8c076ad2846bd893d21.jpg'}, {'step_number': 3, 'description': '넓은 볼에 간장 6큰술, 맛술 2큰술, 매실 2큰술, 설탕 1큰술, 다진마늘 2큰술, 다진파 2큰술,다진양파 2큰술, 물약간을 넣고 데쳐놓은 고기와 채소를 넣고 잘 섞어주었답니다. 양념을 한후 6시간 이상 냉장고에 넣어 숙성을 해주시는데, 중간중간에 위 아래를 한번씩 뒤집어 주세요.', 'image_url': 'https://recipe1.ezmember.co.kr/cache/recipe/2015/06/18/ec950fd8affd3250cf3c4fd5b628b0ec1.jpg'}, {'step_number': 4, 'description': '냄비에 고기와 물 조금, 채 썬 양파를 넣고 중불에서 은은하게 끓여주었답니다. 처음부터 채소를 함께 넣으면 채소가 으스려 져서 맛이 없어요.', 'image_url': 'https://recipe1.ezmember.co.kr/cache/recipe/2015/06/18/1ab76cc519bf80103501a0ce30a130571.jpg'}, {'step_number': 5, 'description': '고기가 어느정도 야들야들 해졌을때 채소와 떡을 넣고 푹 끓여주시면 된답니다. 채소가 다 익을때까지만 끓여주시면 완성된답니다. (바닥이 탈수 있으니 중간 섞어주세요)', 'image_url': 'https://recipe1.ezmember.co.kr/cache/recipe/2015/06/18/64db686d25f5002c90ce4512614f42541.jpg'}]"
33973,메인반찬,손님접대,돼지고기,찜,돼지갈비찜 양념 황금레시피 갈비는 손으로 뜯어 먹어야 제맛!,돼지갈비찜,https://recipe1.ezmember.co.kr/cache/recipe/2018/02/10/a9e93c1f2dc682239fc7e156c121fb6a1.jpg,"397,868",2시간 이상,초급,5인분,"[('돼지갈비', '2kg'), ('감자', '2개'), ('당근', '2개'), ('대파', '약간'), ('양조간장', '1.5컵'), ('설탕                                                                                이나 올리고당', '1컵'), ('맛술', '1/2컵'), ('다진 마늘', '1/2컵'), ('후추', '약간'), ('참기름', '약간'), ('대파                                                                                잘게 다진', '1개')]","소갈비 보다 돼지갈비찜을 더 좋아하는
아이들과 남편은
시아버님을 닮았나 보다

아버님도 소고기보다는 돼지고기를 훨씬 좋아하셔서
시댁 내려갈 때는 돼지갈비를 만들어 가곤 하는데

얼마 전 어머님 생신이 있어서
돼지갈비를 만들었다","[{'step_number': 1, 'description': '레시피의 재료 양은 고기 2kg을 기준으로 작성되었고\n나는 가족들이 많아서 5근 이상을 만들었다\n핏물은 찬물에 담가서 빼주는데\n3시간 이상 핏물을 빼주어야 한다\n물은 30분에서 1시간에 한 번씩 갈아준다', 'image_url': 'https://recipe1.ezmember.co.kr/cache/recipe/2018/02/10/ea12cd80450bcd07831f8694d184abf01.jpg'}, {'step_number': 2, 'description': '끓는 물에 갈비를 한번 끓여서\n버려준 뒤 찬물로 깨끗하게 헹구어서 준비\n이때 된장을 살짝 넣어 같이 끓여주어도 좋다', 'image_url': 'https://recipe1.ezmember.co.kr/cache/recipe/2018/02/10/14134374ccafef921bc573bba1d7866f1.jpg'}, {'step_number': 3, 'description': '양념장 만들기\n배나 사과 같은 과일이 있으면\n갈아서 넣어 주면 좋지만\n간장과 설탕이나 올리고당을 비율에 잘 맞춰서 넣어 주기만 해도 아주 맛이 좋다', 'image_url': 'https://recipe1.ezmember.co.kr/cache/recipe/2018/02/10/2285e892a52a0a59e3e93d0fdd258a521.jpg'}, {'step_number': 4, 'description': '양념을 고기에 섞어 바로 끓이기 보다는 양념이 갈비에 잘 베이도록\n충분히 시간을 두는 게 좋다\n고기도 훨씬 연해지고 맛도 있다', 'image_url': 'https://recipe1.ezmember.co.kr/cache/recipe/2018/02/10/7c02fb5bab36f25557b1846d26a4dc6c1.jpg'}, {'step_number': 5, 'description': '전 날 밤에 고기를 재워두고\n다음날 끓여주었다', 'image_url': 'https://recipe1.ezmember.co.kr/cache/recipe/2018/02/10/5aed11a02e169d8a763207894e6234f91.jpg'}, {'step_number': 6, 'description': '당근과 감자의 가장자리\n모서리 부분을 살짝 깎아내면\n모양이 훨씬 좋다', 'image_url': 'https://recipe1.ezmember.co.kr/cache/recipe/2018/02/10/62f8301179872ee6923d0f9b6d6354901.jpg'}, {'step_number': 7, 'description': '조금 번거로워도 어른들 드실 음식엔\n늘 이렇게 정성을 들여본다', 'image_url': 'https://recipe1.ezmember.co.kr/cache/recipe/2018/02/10/a5c48fa3301c69c9f3c365b7764199a81.jpg'}, {'step_number': 8, 'description': '양념된 고기와 야채를 넣고 끓여주기', 'image_url': 'https://recipe1.ezmember.co.kr/cache/recipe/2018/02/10/23bf9f687337f9b9ec4572c0023c3a3e1.jpg'}, {'step_number': 9, 'description': '잘 익을 때까지 푹 끓여주는데\n가끔 감자가 빨리 익어서\n부서질 때가 있는데 \n이럴 때는\n감자를 먼저 꺼내 놓고 고기를 푹 익혀 준 뒤\n마지막에 같이 넣어 섞어 주면 된다', 'image_url': 'https://recipe1.ezmember.co.kr/cache/recipe/2018/02/10/aeee8ad49ee7a530923c34d8e91c029e1.jpg'}, {'step_number': 10, 'description': '중간에 간을 보고 입맛에 맞게\n간장이나 설탕을 추가해 주기~\n입맛이 각기 다르기 때문에\n본인의 입에 맞는 간을 했을 때가\n가장 맛있는 음식이 된다\n하지만 황금 레시피 비율은 대부분\n좋아하는 갈비찜 양념 맛이다~', 'image_url': 'https://recipe1.ezmember.co.kr/cache/recipe/2018/02/10/7d80354446be09a31f1d4d4c2f6680b01.jpg'}, {'step_number': 11, 'description': '마지막에 대파와 청양고추도 송송 썰어서 올려주면 조금 더 개운한 맛이 난다', 'image_url': 'https://recipe1.ezmember.co.kr/cache/recipe/2018/02/10/d30c26f689c9e9a273ca2bdcb0ce58951.jpg'}]"
33974,메인반찬,손님접대,돼지고기,찜,밥도둑! 등갈비김치말이찜!,등갈비김치말이찜,https://recipe1.ezmember.co.kr/cache/recipe/2020/03/16/30efd67d80837f9c3acc9cf8d7007bc01.jpg,"5,641",60분 이내,아무나,5인분,"[('돼지등갈비', '2근'), ('김치', '1/2등분'), ('간장', '4~5큰술'), ('올리고당', '4큰술'), ('다진마늘', '2큰술'), ('생강가루', '1작은술'), ('생강술', '3큰술'), ('후추가루', '조금'), ('물', '500ml')]",김장김치와 등갈비와의 만남은 밥도둑이네요!,"[{'step_number': 1, 'description': '돼지등갈비는 찬물에서 3시간 이상을 담구어서 핏물을 빼주세요', 'image_url': 'https://recipe1.ezmember.co.kr/cache/recipe/2020/03/16/587762fdae142d7bf92e440990628e311.jpg'}, {'step_number': 2, 'description': '배추김치는 위에 머리부분만 제거후 자르지말고 길게 한가닥씩에 돼지등갈비 1~2개씩을 말아주세요', 'image_url': 'https://recipe1.ezmember.co.kr/cache/recipe/2020/03/16/3e500f4925e2db96b8fe33ebfb7aeaa21.jpg'}, {'step_number': 3, 'description': '김치대에서 올려놓고 말아주시면 잎분으로 마지막을 감싸주면은 풀리지않아요', 'image_url': 'https://recipe1.ezmember.co.kr/cache/recipe/2020/03/16/3da2f276607486a1c3e0ac00aef974201.jpg'}, {'step_number': 4, 'description': '배추김치로 싼 등갈비는 냄비에 차곡히 넣어주시고 작은크기의 짜투리김치와 남은김치소를 위에 올려주세요', 'image_url': 'https://recipe1.ezmember.co.kr/cache/recipe/2020/03/16/e34efb1bef8e4bcc21a016524cc476a01.jpg'}, {'step_number': 5, 'description': '간장/올리고당/다진마늘/생강가루/생강술/후추가루를 넣어서 양념장을 만들어 주세요\n*저는 단짠의 맛으로 양념을 했어요 단맛은 개인의 취향껏 넣어주시면 되세요', 'image_url': 'https://recipe1.ezmember.co.kr/cache/recipe/2020/03/16/82260a6eb33b139746985fd22419cc7c1.jpg'}, {'step_number': 6, 'description': '4번에 만들양념장을 고루 뿌려준후 물을 냄비 가장자리로 돌려서 넣어주세요\n김치의 짠맛에 따라서 양념장을 넣어주시고요\n양념장을 절반만 넣고 물을 넣어서 조려주시다가 점점 더해주시면서 해주시면 실패가 없이 간을 할수가있어요\n집집마다 김치의 간의세기가 틀려서 말씀드립니다~', 'image_url': 'https://recipe1.ezmember.co.kr/cache/recipe/2020/03/16/a328b673c405570f4873ed3ed0c632cf1.jpg'}, {'step_number': 7, 'description': '처음10분은 센불에서 20분은 중약불에서 조려주시면 되세요', 'image_url': 'https://recipe1.ezmember.co.kr/cache/recipe/2020/03/16/dd46bd97d79b956fdb8c64f7c343b5c11.jpg'}, {'step_number': 8, 'description': '등갈비김치말이찜이 완성이 되었고요~등갈비를 빼주시고 배추김치는 쭉쭉 찢어서 드시면 밥두공기는 순삭이네요~~ㅎ', 'image_url': 'https://recipe1.ezmember.co.kr/cache/recipe/2020/03/16/2cfb27af3ed0715991125033fce3cd4a1.jpg'}]"
33975,메인반찬,손님접대,돼지고기,찜,통돼지김치찜,통돼지김치찜,https://recipe1.ezmember.co.kr/cache/recipe/2021/07/09/f823393e6b3f8eaa420caa9ddcde2b571.jpg,"3,467",60분 이내,중급,3인분,"[('통삼겹살', '1kg'), ('양파', '1개'), ('김치', '1/2포기'), ('된장', '1스푼'), ('생강청', '3스푼'), ('미림', '3스푼'), ('사이다', '4스푼'), ('후추', ''), ('물', '2컵'), ('다진마늘', '2스푼'), ('들기름', '2스푼'), ('물엿', '1스푼')]",묵은지와 통돼지고기로 김치찜을 해보아요,"[{'step_number': 1, 'description': '고기를 물로 깨끗히 씻어주세요', 'image_url': 'https://recipe1.ezmember.co.kr/cache/recipe/2021/07/09/a1a8fbf91651b146d5bbc2adc1b1db291.jpg'}, {'step_number': 2, 'description': '고기를 냄비에 넣고 된장1스푼, 생각청3스푼, 미림3스푼, 사이다4스푼, 후추조금, 물2컵을 넣고 15분간 끓여줍니다(고기를 젓가락으로 찔렀을때 잘들어가면 익은거에요)', 'image_url': 'https://recipe1.ezmember.co.kr/cache/recipe/2021/07/09/3504a36fc79d44852efe654b8ccc46d51.jpg'}, {'step_number': 3, 'description': '들기름2스푼, 물엿 1스푼을 넣고 15분간 끓여줍니다.', 'image_url': 'https://recipe1.ezmember.co.kr/cache/recipe/2021/07/09/af8740de3ed4b49d8b76e82405fa76911.jpg'}, {'step_number': 4, 'description': '고기가 익으면 양파를 고기위에넣고 그위에 김치를 물기를 짜서 냄비에 넣어주세요', 'image_url': 'https://recipe1.ezmember.co.kr/cache/recipe/2021/07/09/63c030c5bcf18cf443a3ed475572f14b1.jpg'}, {'step_number': 5, 'description': '김치가 어느정도 익으면 완성! 고기를 적당한 크기로 썰어서 맛있게 드시면 됩니다!', 'image_url': 'https://recipe1.ezmember.co.kr/cache/recipe/2021/07/09/258ca2a4a853b457401d6c362fb658621.jpg'}]"
33976,메인반찬,손님접대,돼지고기,찜,돼지고기 배추찜,돼지고기배추찜,https://recipe1.ezmember.co.kr/cache/recipe/2015/06/08/d3999004e2234ef34bb29b502fdb2848.jpg,"34,744",2시간 이상,중급,2인분,"[('배추(소)', '1/2'), ('돼지고기', '300'), ('말린표고버섯', '20'), ('새우젓', '1'), ('국간장', '1'), ('마늘', '1'), ('맛술', '1'), ('찹쌀가루', '1'), ('후추', '약간')]",돼지고기 배추찜 쉽고 간편하게 그리고 담백하게 만들어 볼까요.,"[{'step_number': 1, 'description': '속이 찬 미니배추에요. 김장용배추는 아니구요. 쌈배추에 가까운 미니배추랍니다. 요거 반으로 자른다음 굵은소금 반줌이랑 물 한컵이랑 해서 절여주었어요 . 한 3시간 절여준거 같아요.', 'image_url': 'https://recipe1.ezmember.co.kr/cache/recipe/2015/06/08/d17debe24162cfaf593765310d15b24c1.JPG'}, {'step_number': 2, 'description': '고기 버섯 마늘 찹쌀가루 후추 맛술 소금 약간을 넣고 밑간을 해주었답니다. 양념을 한후 1시간 정도 재워두었답니다.', 'image_url': 'https://recipe1.ezmember.co.kr/cache/recipe/2015/06/08/a6c7986d556029ec7cc1340674e5cae51.JPG'}, {'step_number': 3, 'description': '절여놓은 배추는 헹궈준후 마지막에 소금물에 헹궈 물기를 제거해준후에 양념해 놓은 고기를 켠켠히 넣어주었어요. 처음엔 두개를 만들려고 했었는데 생각보다 고기가 많이 들어가더라구요. 그래서 배추 반쪽에 양념된 고기를 다 넣어주었답니다.', 'image_url': 'https://recipe1.ezmember.co.kr/cache/recipe/2015/06/08/421c827acccef4cc93252c4254e0f9bb1.JPG'}, {'step_number': 4, 'description': '냄비에 속을 채운배추를 넣고 멸치육수 1.5리터를 넣고 중불에서 보글보글 끓여주었어요. 잠기지 않아도 배추가 익으면서 숨이 죽기 때문에 배추가 다 안잠겨도 된답니다.', 'image_url': 'https://recipe1.ezmember.co.kr/cache/recipe/2015/06/08/3a585e9aa4cacbd1d2e4a1467d5c36431.JPG'}, {'step_number': 5, 'description': '고기가 어느정도 익었을때쯤 새우젓과 국간장으로 간을 해주시면 된답니다. 새우젓이 싫으시다면 국간장으로만 간을 해주시면되요~', 'image_url': 'https://recipe1.ezmember.co.kr/cache/recipe/2015/06/08/874ef1cf13b407fc9f2773f15d8e5b0c1.JPG'}, {'step_number': 6, 'description': '버섯향이 솔솔 나는 돼지고기배추찜 완성.', 'image_url': 'https://recipe1.ezmember.co.kr/cache/recipe/2015/06/08/df099c8cfd01f008aa02b63d65aec67a1.JPG'}]"
33977,메인반찬,손님접대,돼지고기,찜,백종원 돼지갈비찜,돼지갈비찜,https://recipe1.ezmember.co.kr/cache/recipe/2016/05/04/a8e64c2ff2cebe1ea2c0e91e6b29db9b1.jpg,"211,297",2시간 이상,중급,6인분 이상,"[('\u200b돼지갈비 찜용', '4근'), ('무', ''), ('당근', ''), ('대파', ''), ('양파', ''), ('진간장', '2컵'), ('설탕', '1컵'), ('맛술', '1컵'), ('물', '2컵'), ('다진마늘', '1/2컵'), ('참기름', '1/4컵'), ('송송썰은 대파', '1컵'), ('다진생강', '1/2스푼')]",백종원 돼지갈비찜 만능소스 레시피 짱맛이에요.,"[{'step_number': 1, 'description': '고기는 핏물을 빼기위해 전날 저녁에 물에 담궜다가 다음날 오전까지. 반나절에서 하루정도 담궈주었어요. (중간중간 물을 갈아주심 더 좋아요)', 'image_url': 'https://recipe1.ezmember.co.kr/cache/recipe/2016/05/09/ac4f50afbfc30bf84fa7815a928ea31c1.jpg'}, {'step_number': 2, 'description': '양념소스는 레시피대로 만들어주었어요. 대파가 듬뿍듬뿍 들어가니 더 맛있어 보이네요.', 'image_url': 'https://recipe1.ezmember.co.kr/cache/recipe/2016/05/09/f8633a9ada1c152338695fec13e5784c1.jpg'}, {'step_number': 3, 'description': '그리고 야채들도 준비. 무, 당근, 양파 준비했어요. 부서지지않게 모서리부분 둥글둥글하게 다듬어주었네요.', 'image_url': 'https://recipe1.ezmember.co.kr/cache/recipe/2016/05/09/a5ff5ea9afb6aa8193557dacb9e393171.jpg'}, {'step_number': 4, 'description': '핏물빠진 고기는 냄비에 담아 양념장을 부어주었는데요. 고기가 살짝 덜잠길정도만 부어주면 되요. 고기가 잠길듯 말듯', 'image_url': 'https://recipe1.ezmember.co.kr/cache/recipe/2016/05/09/e334bcab3cd95c20c8369676784db3f31.jpg'}, {'step_number': 5, 'description': '그리고 물은 고기가 잠길정도로 부어주세. 레시피대로 2컵정도 부어주면 될듯. 그리고 끓이다가 간보고 짜면 더 넣어주면 되요.', 'image_url': 'https://recipe1.ezmember.co.kr/cache/recipe/2016/05/09/b0c3a21d006ced20cbddeb36127358121.jpg'}, {'step_number': 6, 'description': '총 1시간정도 끓여주심 되는데요. 야채는 백종원레시피 순서대로 넣으면 되요. 1군 - 무 / 2군 = 당근, 버섯 / 3군 - 양파, 대파, 고추 갈비찜이 30~4-분정도 끓으면 무를 먼저 넣어주세요.', 'image_url': 'https://recipe1.ezmember.co.kr/cache/recipe/2016/05/09/2476d80721f38cf68dbfb33f58fad6b01.jpg'}, {'step_number': 7, 'description': '무가 익었을때 2군채소 당근을 넣어주고', 'image_url': 'https://recipe1.ezmember.co.kr/cache/recipe/2016/05/09/34800533b6922b149632b74cbf8678391.jpg'}, {'step_number': 8, 'description': '당근이 익었을때쯤 마지막 양파와 고추를 넣어주면 되요. 그리고 마지막 채소들을 넣고 10~15분정도 더 끓여주면 완성.', 'image_url': 'https://recipe1.ezmember.co.kr/cache/recipe/2016/05/09/abe28582b4fe41ebf53534c584a28d481.jpg'}, {'step_number': 9, 'description': '넘나 맛있는 돼지갈비찜 순식간에 완성.', 'image_url': 'https://recipe1.ezmember.co.kr/cache/recipe/2016/05/09/13de1e49c0e1b4cefb121d827b845ef41.jpg'}, {'step_number': 10, 'description': '접시에 담아주면 너무 맛있어 보이죠. 양이 꽤많아 놔뒀다가 몇일동안 먹었는데요. 다시 데워도 맛있구 식어도 맛있구 계속먹어도 질리지 않는 갈비찜이네요. 백종원레시피라 방법도 간단하고 재료도 간단한 집들이나 생일이나 특별한날에 꼭 한번쯤 해보면 괜찮을것 같아요.', 'image_url': 'https://recipe1.ezmember.co.kr/cache/recipe/2016/05/09/07076d9763fa6654b246224e06c94e9c1.jpg'}]"
33978,메인반찬,손님접대,돼지고기,찜,김치등갈비찜 만들기,김치등갈비찜,https://recipe1.ezmember.co.kr/cache/recipe/2015/05/18/11e4285a28637872ab4d9a1f36ecc4221.jpg,"33,000",120분 이내,중급,2인분,"[('배추김치', ''), ('양념장', ''), ('월계수잎', ''), ('등갈비', ''), ('간장', '1T'), ('굴소스', '1T'), ('고추가루', '3T'), ('다진마늘', '1T'), ('올리고당', '2T'), ('매실액', '2T'), ('후추', '2꼬집')]",김치도 고기육수도 빼놓고 먹을 수 없는 맛있는 김치등갈비찜,"[{'step_number': 1, 'description': '등갈비는 결별로 잘라달라고 받아와서 찬물에 1~2시간 핏기를 빼준다.', 'image_url': 'https://recipe1.ezmember.co.kr/cache/recipe/2015/05/18/7b6d6a7389a81adf807b665a1711b7731.jpg'}, {'step_number': 2, 'description': '핏물을 뺀 등갈비 삶을 땐, 월계수 잎 3~4장 넣어주고 생각가루 두꼬집. 생각 저민것도 좋다. 통후추도 쫌 넣어주고 집에 통마늘도 있음 넣어주면 더 좋다.', 'image_url': 'https://recipe1.ezmember.co.kr/cache/recipe/2015/05/18/9fd7985fa1c811dab3fe0dc4ed1a853c1.jpg'}, {'step_number': 3, 'description': '간장 1스푼 굴소스 1스푼 고춧가루 3스푼 다진마늘 3스푼 올리고당 2스푼 매실액 2스푼 후추 2꼬집 을 넣고 섞어준후 냉장고에 넣어 숙성시킨다.', 'image_url': 'https://recipe1.ezmember.co.kr/cache/recipe/2015/05/18/2f25d3a34d9cbb33e6608767b44ead681.jpg'}, {'step_number': 4, 'description': '끓이던 등갈비는 뼈 속의 응고된 피를 빼주고 고기의 불순물을 제거해주기 위함이니 적당히 삶고 흐르는 찬물에 살짝 헹궈준다.', 'image_url': 'https://recipe1.ezmember.co.kr/cache/recipe/2015/05/18/6447dbe9acab691553aa2fa2762bc60b1.jpg'}, {'step_number': 5, 'description': '준비 해둔 양념장을 고기에 발라주고 배추김치를 턱 하니 올려주고 나머지 양념장을 올려준다. 그후 물 한두컵을 넣고 끓여준다.', 'image_url': 'https://recipe1.ezmember.co.kr/cache/recipe/2015/05/18/3c605093c496a4be06efe749ee54f1721.jpg'}, {'step_number': 6, 'description': '막 끓기 시작하면 양파랑 파 넗어서 불은 제일 약하게 줄이고 뭉근히 졸여준다.', 'image_url': 'https://recipe1.ezmember.co.kr/cache/recipe/2015/05/18/fe7430baece14c1cea724853ccb5367a1.jpg'}]"
