index,종류별,상황별,재료별,방법별,글 제목,레시피이름,레시피이미지,조회수,조리시간,난이도,인분,재료,소개글,조리순서
36191,메인반찬,손님접대,해물류,볶음,[2019 수산물 간편 레시피 전국민 공모전] 최우수상 매콤꼬막당면볶음 ★,꼬막당면볶음,https://recipe1.ezmember.co.kr/cache/recipe/2019/07/09/672e88c557a8442a5fb2354e512175531.jpg,"18,241",20분 이내,아무나,2인분,"[('삶은꼬막', '170g'), ('당면', '70g'), ('피망', '1/2개'), ('빨간 파프리카', '1/2개'), ('주황 파프리카', '1/2개'), ('양파', '1/2개'), ('당근', '약간'), ('굴소스', '2숟가락'), ('고추기름', '2큰술'), ('후추', '약간'), ('다진 마늘', '1숟가락'), ('올리고당', '1숟가락'), ('올리브유', '2숟가락')]","매콤한 양념에 탱글탱글한 당면까지 볶아
비린내가 전혀 느껴지지 않아!!!!
세상의 모든 레시피 만개의레시피","[{'step_number': 1, 'description': '해감하여 깨끗하게 씻은 꼬막은 삶아서 껍질을 벗겨 준비해요.', 'image_url': 'https://recipe1.ezmember.co.kr/cache/recipe/2019/07/09/7e7754e9c530748c5f64edc7c4353fa21.jpg'}, {'step_number': 2, 'description': '채소는 먹기 좋게 채 썰어 준비해요.', 'image_url': 'https://recipe1.ezmember.co.kr/cache/recipe/2019/07/09/29eb10431c53ab39c8a86191d152f2ba1.jpg'}, {'step_number': 3, 'description': '당면은 삶아서 찬물에 헹궈 물기를 제거해요.', 'image_url': 'https://recipe1.ezmember.co.kr/cache/recipe/2019/07/09/7b87da6f37ff7c0bc3ea3c67b7eaeb4a1.jpg'}, {'step_number': 4, 'description': '예열된 팬에 고추기름 2숟가락, 굴소스 1숟가락, 후추를 약간 넣고 채소를 넣어 숨이 죽을 때 까지 볶아요.팬', 'image_url': 'https://recipe1.ezmember.co.kr/cache/recipe/2019/07/09/091572f25644211d55d7db70f2e2ff4f1.jpg'}, {'step_number': 5, 'description': '볶아놓은 채소에 준비한 꼬막살, 당면, 다진마늘 1숟가락, 올리고당, 굴소스, 올리브유를 두른 후 볶아 완성해요.', 'image_url': 'https://recipe1.ezmember.co.kr/cache/recipe/2019/07/09/5f2ac0066ea478cb59782141a44210821.jpg'}]"
36192,메인반찬,손님접대,해물류,볶음,#두반장요리 #두반장해물볶음만들기 #두반장해물볶음덮밥만들기 #두반장으로 만든 매콤한 해물볶음!! 채소도 듬뿍!!,두반장해물볶음,https://recipe1.ezmember.co.kr/cache/recipe/2019/08/28/0399dc6ddd5d586d266bc4cc673c3f881.jpg,"4,330",30분 이내,아무나,4인분,"[('냉동모둠해물', '500g'), ('냉동모둠 채소', '400g'), ('샐러리 줄기', '2줄기'), ('표고버섯', '3개'), ('죽순', '200g'), ('파 기름', '2큰술'), ('썬파', '1큰술'), ('청양고추', '1개'), ('다진마늘', '1작은술'), ('두반장', '4큰술'), ('굴소스', '1큰술'), ('후추', '1작은술'), ('치킨스톡', '1작은술'), ('통깨', ''), ('참기름', ''), ('전분물                                                                                농도에맞춰서', '')]","매번 해물볶음을 굴소스로만 만들었는데요.

이번에는 두반장과 굴소스를 섞어서 만들어 보았습니다.

각종 채소들과 함께 죽순도 넣어 주고요!!

​

두반장이 2라면 굴소스는 1로 넣어서 만든 매콤하지만 절대로 맵지 않은

두반장의 특유의 향과 고소함을 느낄 수 있는

두반장해물볶음입니다. 면을 삶아서 비벼서 드셔도 좋고요.

덮밥으로 즐기셔도 좋습니다.","[{'step_number': 1, 'description': '냉동모둠채소에 죽순을 넣어 주었습니다. 모두 냉동제품입니다. 요즘 냉동채소에 빠져 있습니다.', 'image_url': 'https://recipe1.ezmember.co.kr/cache/recipe/2019/08/28/db44b31706b95483416d9c223cdf39441.jpg'}, {'step_number': 2, 'description': '샐러리가 좋다고 해서 구입했는데 막상 잘 먹지 않게 되더라구요. 아니 왠지 혼자 먹기엔 조금은 값비싼 채소여서 아까워서 결국엔 가족들을 위한 식재료로 사용합니다. 샐러리가 들어가면 더욱더 중식의 향과 느낌이 살아 납니다.', 'image_url': 'https://recipe1.ezmember.co.kr/cache/recipe/2019/08/28/8e9ba63196d5e2cb418079161484a6831.jpg'}, {'step_number': 3, 'description': '표고버섯도 썰어서 넣어 주고요. 남은 파프리카도 넣어 줍니다. 표고버섯 기둥도 썰어서 넣어 줍니다. 기둥 버리지 마시고 다 넣어 주세요.', 'image_url': 'https://recipe1.ezmember.co.kr/cache/recipe/2019/08/28/bac257f51f9f58a5a8c53cdc1231c46a1.jpg'}, {'step_number': 4, 'description': '이번에 새로 구입해 본 파기름입니다. 협찬 절대 아니구요. 한번 사보고 싶어서 구입했어요 ㅎㅎㅎ', 'image_url': 'https://recipe1.ezmember.co.kr/cache/recipe/2019/08/28/3ea59cb1b5d4d672a9232a2f074db3c11.jpg'}, {'step_number': 5, 'description': '해물빼고 모든 재료들은 다 준비가 되었습니다. 해물은 냉동모듬해물입니다.', 'image_url': 'https://recipe1.ezmember.co.kr/cache/recipe/2019/08/28/d95413cae2ba8299ae4bae7f83e1bc181.jpg'}, {'step_number': 6, 'description': '달궈진 팬에 파기름을 넣어 주고요. 그래도 믿음이 못 가서 썬파도 넣어 주었고요. 다진마늘, 청양고추도 썰어서 넣어서 같이 볶아 주었습니다.', 'image_url': 'https://recipe1.ezmember.co.kr/cache/recipe/2019/08/28/4d0ca92860d2d65ca2ca58ee12d8fb841.jpg'}, {'step_number': 7, 'description': '모둠채소와 버섯들을 모두 투하하고는 볶아 줍니다. 그냥 한꺼번에 볶아 주세요.', 'image_url': 'https://recipe1.ezmember.co.kr/cache/recipe/2019/08/28/997134467c118030d535fff92b3010f91.jpg'}, {'step_number': 8, 'description': '여기에 냉동해물도 넣어 줍니다. 그리고 간은 두반장과 굴소스로 해 줍니다.', 'image_url': 'https://recipe1.ezmember.co.kr/cache/recipe/2019/08/28/d03a5975cda78fc32532b8b51cf432e11.jpg'}, {'step_number': 9, 'description': '육수가 있으시면 육수를 넣어 주시는데 육수가 없어서 그냥 물을 넣어 주고는 치킨스톡을 넣어 주어서 팔팔 끓여 주었습니다.', 'image_url': 'https://recipe1.ezmember.co.kr/cache/recipe/2019/08/28/f4d0c3adec73a665d8e94a3650bb4d4c1.jpg'}, {'step_number': 10, 'description': '재료들이 다 익고 팔팔 끓었다면 이제 전분물을 조금씩 넣어가면서 농도를 맞춰 줍니다. 걸쭉한 상태가 되도록요. 전분물은 물과 전분가루를 1대1의 비율로 섞어서 만드시면 됩니다. 농도를 맞출때에는 조금씩 조금씩 넣어서 잘 섞으면서 걸쭉한 상태를 맞추시면 됩니다.', 'image_url': 'https://recipe1.ezmember.co.kr/cache/recipe/2019/08/28/a920a0a5601328d6c009fb6f78c32f351.jpg'}, {'step_number': 11, 'description': '걸쭉한 상태의 두반장해물볶음이 되었는데 마지막으로 후추와 통깨, 그리고 참기름을 한바퀴 돌려 주시고 마무리하시면 됩니다.', 'image_url': 'https://recipe1.ezmember.co.kr/cache/recipe/2019/08/28/a0f905c92b3b9831ecfb4731cd1909b61.jpg'}, {'step_number': 12, 'description': '매콤한 향이 풍겨나지만 지나치게 고춧가루의 매운맛이 아닌 두반장만의 특유의 중국향이 나는 걸쭉한 두반장해물볶음이 다 되었습니다.', 'image_url': 'https://recipe1.ezmember.co.kr/cache/recipe/2019/08/28/4a937254a875dca2748f8d91b18392681.jpg'}, {'step_number': 13, 'description': '완성접시에 푸짐하게 담아 놓으면 두반장해물볶음 완성입니다. 밥에 퍼서 올려서 덮밥으로 즐기셔도 좋고요. 중화면이 있다면 볶음짬뽕처럼 드셔도 좋습니다.', 'image_url': 'https://recipe1.ezmember.co.kr/cache/recipe/2019/08/28/6b4c6488a6b1263ab6cc6c9afe4743931.jpg'}]"
36193,메인반찬,손님접대,해물류,볶음,활쭈꾸미 제철음식 쭈꾸미볶음 만드는법 대박!,주꾸미볶음,https://recipe1.ezmember.co.kr/cache/recipe/2020/03/24/9810071b7aab719ca7812c6aa748b7771.jpg,"9,432",30분 이내,초급,5인분,"[('쭈꾸미', '750g'), ('콩나물', '220g'), ('청양고추', '6개'), ('대파', '2대'), ('양파', '1개'), ('당근', '50g'), ('데치는 소금', '1큰술'), ('전분', '1큰술'), ('물', '1큰술'), ('전분                                                                                미리 풀어둠', '1큰술'), ('고춧가루', '4큰술'), ('고추장', '1큰술'), ('진간장', '1큰술'), ('맛술', '2큰술'), ('고추청', '2큰술'), ('요리당', '2큰술'), ('마늘', '3큰술'), ('생강', '1쪽'), ('참기름', '1큰술'), ('통깨', '넉넉하게')]","헉! 살아있네~
제철음식 쭈꾸미볶음 만드는법
어라 ~ 팔딱팔딱 숨 쉬는 활쭈꾸미로 만든 아주아주 건강한 음식입니다.
요걸 안주 삼아 술 한 잔 기울이면 참 좋겠단 생각이 드실 거예요.
야들야들 식감이 쫀득거리는 쭈구미볶음은
매워서 입을 실룩거릴 정도로
매운 청양고추를 무려 6개를 넣고
시원한 콩나물도 삶아 건져서 쭈꾸미볶음 바닥에 갈았는데

쭈꾸미복음 양념이랑 들들 버무리면

그게 또 그렇게 맛있을 수가 없더라고요.","[{'step_number': 1, 'description': '쭈꾸미 손질법\n쭈꾸미는 머리를 뒤집어서 냉장을 제거하고요.\n먹물도 들어있으니 가만가만 힘주어 내장을 제거해야 하고\n입도 제거해야 해요.\n눈도 제거했어요.여기서 잠깐!\n쭈꾸미 암컷 머리에는 알이 들어있어요.\n상당히 조심해야 하고요.쭈꾸미 손질법 레시피', 'image_url': 'https://recipe1.ezmember.co.kr/cache/recipe/2020/03/24/665bd4b2debf7252be82b40b6f252f371.jpg'}, {'step_number': 2, 'description': '쭈구미는 밀가루 넉넉하게 넣고\n굵은소금도 한줌 넣어 바락바락 문질러 씻어줍니다.\n요런 정도는 딸램도 할 수 있다며 바락바락 문질러줍니다.', 'image_url': 'https://recipe1.ezmember.co.kr/cache/recipe/2020/03/24/768cb581172c488ebd525396ddd5f7501.jpg'}, {'step_number': 3, 'description': '쭈꾸미 발판에 낀 뻘을 모두 제거하고요.\n요런 정도면 아주 알뜰하게 손질 잘 한 것 같아요.', 'image_url': 'https://recipe1.ezmember.co.kr/cache/recipe/2020/03/24/f6d5ed1ebb7a87bba7061dcd307129a21.jpg'}, {'step_number': 4, 'description': '야채손질\n당근 나박 썰고\n대파 어슷 썰고\n청양고추도 어슷 썰고\n양파는 굵게 채 썰고요\n생강도 다져두고요.\n콩나물 씻어 건져두고요.', 'image_url': 'https://recipe1.ezmember.co.kr/cache/recipe/2020/03/24/e108f55a1ceef798a98d771880eda6701.jpg'}, {'step_number': 5, 'description': '콩나물 살기 쭈꾸미 데치기\n끓는 물에 소금 1큰술 넣고\n콩나물 데친 후 건져서 찬물에 헹궈 두고요.', 'image_url': 'https://recipe1.ezmember.co.kr/cache/recipe/2020/03/24/19b2e285a6b9cc9277a9ae89178194691.jpg'}, {'step_number': 6, 'description': '콩나물 삶은 물에 쭈꾸미를 넣고 데칩니다.\n쭈꾸미는 머리부터 집어넣어 모양을 잡아주고\n다 익히는 것이 아니라\n\n모양만 만들어지는 정도로 하고 바로 건집니다.\n참참! 쭈꾸미 알은\n다시 쭈꾸미 머릿속으로 넣어 데칩니다.\n그냥 쭈꾸미알만 덩그러니 넣으면\n\n국물에 쭈꾸미알이 터져서 아주 지저분해져요.\n\n\u200b', 'image_url': 'https://recipe1.ezmember.co.kr/cache/recipe/2020/03/24/25a6ca656111c5bd0792a330f13644e41.jpg'}, {'step_number': 7, 'description': '콩나물은 헹궜고\n쭈꾸미는 뜨끈한 상태입니다.\n그리고 쭈꾸미 삶은 물은 버리지 않아요.\n쭈꾸미 볶음 만들 때 넣을 거예요.', 'image_url': 'https://recipe1.ezmember.co.kr/cache/recipe/2020/03/24/a5cef4f20ca507f9d977c657122faca41.jpg'}, {'step_number': 8, 'description': '팬에 식용유 3큰술 정도 두르고\n마늘? no no!\n고춧가루부터 넣어 고추기름을 만듭니다.\n젤 약한 불에서요.\n그런 후 마늘 3큰술 넣어 볶다가', 'image_url': 'https://recipe1.ezmember.co.kr/cache/recipe/2020/03/24/29b5912fa7a40cfb3c7f6fadd8e2c39d1.jpg'}, {'step_number': 9, 'description': '그런 후 마늘 3큰술 넣어 볶다가\n남겨둔 쭈구미 데친 육수를 1컵 정도 붓고\n거기에 고추장 1큰술, 진간장 1큰술, 맛술 2큰술을 넣고 양념을 풀어주고\n살짝 되직해지도록 양념을 졸입니다.', 'image_url': 'https://recipe1.ezmember.co.kr/cache/recipe/2020/03/24/839a5724153d14b5442eee3a4163f3f31.jpg'}, {'step_number': 10, 'description': '양념에 양파 대파 준비한 분량의 1/2을 넣고\n당근도 넣고요.\n사륵 버무린 후\n바로 쭈꾸미 넣고\n중간불 이상에서 볶아줍니다.', 'image_url': 'https://recipe1.ezmember.co.kr/cache/recipe/2020/03/24/3572b6af2952b92de6333c23e73c4ce51.jpg'}, {'step_number': 11, 'description': '쭈꾸미에 양념이 고루 들면\n청양고추 썬 것을 넣고 들들~\n이때 양념이 탈 것 같으면\n남아있는 쭈구미 육수 100ml 정도 붓고 볶아줍니다.', 'image_url': 'https://recipe1.ezmember.co.kr/cache/recipe/2020/03/24/81a8e8c1954017adfd1ca3860bed89fd1.jpg'}, {'step_number': 12, 'description': '쭈꾸미볶음에 국물이 좀 남아있다 싶으면\n준비한 전분물을 넣고 윤기나게 섞어줍니다.', 'image_url': 'https://recipe1.ezmember.co.kr/cache/recipe/2020/03/24/7b192c58a1d17efc15dd9711fde591b31.jpg'}, {'step_number': 13, 'description': '마무리 단계입니다.\n남은 대파 올리고\n요리당 넣고 참기름 두르고 휘릭 섞어줍니다.', 'image_url': 'https://recipe1.ezmember.co.kr/cache/recipe/2020/03/24/c55b342f51b62b12fab694a3c8a15bea1.jpg'}, {'step_number': 14, 'description': '콩나물 삶은 것 접시에 깔고요.', 'image_url': 'https://recipe1.ezmember.co.kr/cache/recipe/2020/03/24/dd0e12928aa831da4c9a0033199f85671.jpg'}, {'step_number': 15, 'description': '쭈꾸미볶음 올리고요.\n통깨 솔솔 뿌려서 ~~', 'image_url': 'https://recipe1.ezmember.co.kr/cache/recipe/2020/03/24/e8b2420ac75fe73c676e3a545635933b1.jpg'}]"
36194,메인반찬,손님접대,해물류,볶음,떡국떡을 이용한 오삼떡볶음,오삼떡볶음,https://recipe1.ezmember.co.kr/cache/recipe/2020/12/21/45db44eb492a5e782d1e692ab22b74671.jpg,"1,107",20분 이내,초급,3인분,"[('떡국떡', '300g'), ('오징어', '300g'), ('삼겹살', '500g'), ('양파', '1/2개'), ('청양고추', '2개'), ('청경채', '1주먹'), ('굴소스', '1스푼'), ('미림', '2스푼'), ('간장', '2스푼'), ('설탕', '2스푼'), ('마늘', '1스푼'), ('고추장', '2스푼'), ('고추가루', '2스푼')]",오징어와 삼겹살 그리고 떡국떡을 이용한 매콤한 볶음요리 입니다^^ 간단한 소스를 이용하여 한그릇요리를 완성합니다!!,"[{'step_number': 1, 'description': '재료를 적당히 잘 썰어 준비합니다.오징어는 손질되어있는 냉동재료를 사용하면 간편합니다.', 'image_url': 'https://recipe1.ezmember.co.kr/cache/recipe/2020/12/21/9656f363e25d1421b7bdd5be7d5a83e91.jpg'}, {'step_number': 2, 'description': '삼겹살을 먼저 밑간을 위한 소금과 후추를 약간만 넣고 볶아줍니다.(기름진 삼겹살이 싫으시면 목살을 얇게 썰어 사용하셔도 좋아요)이때 나오는 삼겹살 기름을 키친타올로 제거해주면 볶음이 깔끔합니다.', 'image_url': 'https://recipe1.ezmember.co.kr/cache/recipe/2020/12/21/fb6fa42c25f120f6cbd15a6c1eb7fdba1.jpg'}, {'step_number': 3, 'description': '삼겹살을 먼저 볶아 충분히 익혀준후 오징어와 떡을 넣고 오징어가 익을때까지 볶아줍니다.', 'image_url': 'https://recipe1.ezmember.co.kr/cache/recipe/2020/12/21/4ee81df9b0df0535149262641c9917a71.jpg'}, {'step_number': 4, 'description': '어느정도 볶아지면 야채와 만들어둔 소스를 넣고 잘 볶아줍니다. 색을 보아 고춧가루가 더 필요하면 더 첨가해도 좋습니다.청경채는 맨 마지막에 거의 양념이 스며들면 넣어주세요', 'image_url': 'https://recipe1.ezmember.co.kr/cache/recipe/2020/12/21/de4c602e9a7a3cd01e0038904eaf2ab11.jpg'}, {'step_number': 5, 'description': '이 요리는 너무 많이 볶지 않습니다. 소스가 잘 섞이면 불을 끄고 살짝 참기름을 둘러줍니다.(참기름은 선택사항입니다)', 'image_url': 'https://recipe1.ezmember.co.kr/cache/recipe/2020/12/21/6a3d649149361a06884263e0c9b237d41.jpg'}]"
36195,메인반찬,손님접대,해물류,볶음,새우감바스 간단하게 만들어 폼나게 먹기~,새우감바스,https://recipe1.ezmember.co.kr/cache/recipe/2020/10/25/f85e0c1e0b825f190a2091914fd46b591.jpg,"2,989",15분 이내,아무나,2인분,"[('새우', '20~25개'), ('올리브유', '200ml'), ('마늘', '15개'), ('페페론치노', '5개'), ('파슬리가루', '약간'), ('소금', '2꼬집'), ('후추', '약간'), ('바질잎', '2장')]","냉동실에 칵테일새우 남은거 있어서 새우감바스 만들기 해보려는데 페페론치노가 딱 떨어지고 없어서 바로 주문해서 만들었는데요, 누구나 손쉽게 만드는 셰프요리로 브런치나 집콕하면서 레스토랑필 충만하게 즐겨보기 좋아요.","[{'step_number': 1, 'description': '통마늘은 편으로 썰어줍니다.', 'image_url': 'https://recipe1.ezmember.co.kr/cache/recipe/2020/10/26/58742d11053cd1fe035170a6623d80b91.jpg'}, {'step_number': 2, 'description': '냉동새우는 해동후 물기를 제거해서 준비합니다.', 'image_url': 'https://recipe1.ezmember.co.kr/cache/recipe/2020/10/26/a2efb2c5b1c990492f5fed98eb6ff8e01.jpg'}, {'step_number': 3, 'description': '팬에 올리브유 50ml 정도 넣고 편으로 썬 마늘과 페페론치노를 부슬러 넣어 조리합니다.', 'image_url': 'https://recipe1.ezmember.co.kr/cache/recipe/2020/10/26/9b1286f4e40547b38f582491c271766c1.jpg'}, {'step_number': 4, 'description': '새우를 넣어 주고, 남은 올리브유를 넣어 조리합니다.', 'image_url': 'https://recipe1.ezmember.co.kr/cache/recipe/2020/10/26/54ae2fec225970949abb0d39fb16bdea1.jpg'}, {'step_number': 5, 'description': '소금 두꼬집을 넣어 저어가면서 조리하고 후추 톡톡 하고, 파슬리가루 뿌려주면 되어요.', 'image_url': 'https://recipe1.ezmember.co.kr/cache/recipe/2020/10/26/0b065deb05a527591db3050c869072ef1.jpg'}, {'step_number': 6, 'description': '바게트빵은 에어프라이어에 넣어 먹기좋게 구워줍니다. 에어프라이어', 'image_url': 'https://recipe1.ezmember.co.kr/cache/recipe/2020/10/26/f4b96a227ac19900302ce715e19a0ed41.jpg'}]"
36196,메인반찬,손님접대,해물류,볶음,힘이 불끈 보양식 간장쭈꾸미볶음:D,간장주꾸미볶음,https://recipe1.ezmember.co.kr/cache/recipe/2020/04/20/f7fd57a784d2e1c7c35d7e7feb73e9971.jpg,"1,517",60분 이내,초급,4인분,"[('쭈꾸미', '7마리'), ('어묵', '6장'), ('부추', '1줌'), ('간장', '5숟가락'), ('올리고당', '5숟가락'), ('소주', '2숟가락'), ('다진마늘', '2숟가락'), ('후추', '적당량')]",시어머니께서 쭈꾸미를 사다주셔서 맛있게 볶아먹었어요:D,"[{'step_number': 1, 'description': '분량의 양념재료를 먼저 섞어두기.', 'image_url': 'https://recipe1.ezmember.co.kr/cache/recipe/2020/04/20/f1c519316d76f971144daacfe535dd201.jpg'}, {'step_number': 2, 'description': '쭈꾸미 손질하기.쭈꾸미 손질법 레시피', 'image_url': 'https://recipe1.ezmember.co.kr/cache/recipe/2020/04/20/21b9c7c27559f272004c07dd81411a241.jpg'}, {'step_number': 3, 'description': '손질한 쭈꾸미 양념에 재워두기.', 'image_url': 'https://recipe1.ezmember.co.kr/cache/recipe/2020/04/20/33f1d7aa55b686bb0a97b87bbe0c96691.jpg'}, {'step_number': 4, 'description': '어묵 먹기좋은 크기로 채썰기.', 'image_url': 'https://recipe1.ezmember.co.kr/cache/recipe/2020/04/20/54dd182d8518c30db3e3d3c5218897ce1.jpg'}, {'step_number': 5, 'description': '달궈진 냄비에 재워둔 쭈꾸미 넣고 볶기.', 'image_url': 'https://recipe1.ezmember.co.kr/cache/recipe/2020/04/20/18412a34359f1b59669bc913fc1524f11.jpg'}, {'step_number': 6, 'description': '쭈꾸미가 살짝 익으면 썰어둔 어묵넣기.', 'image_url': 'https://recipe1.ezmember.co.kr/cache/recipe/2020/04/20/c6959d7495d5a0aa5dcf37db8930c65c1.jpg'}, {'step_number': 7, 'description': '골고루 섞어주기.', 'image_url': 'https://recipe1.ezmember.co.kr/cache/recipe/2020/04/20/dfb9dac415568e33592ee31936586ce21.jpg'}, {'step_number': 8, 'description': '불끄고 부추를 어묵길이로 썰어 넣기.', 'image_url': 'https://recipe1.ezmember.co.kr/cache/recipe/2020/04/20/20acb520940cbd45d42c7ae40d1ceb731.jpg'}, {'step_number': 9, 'description': '접시에 담아 내기.', 'image_url': 'https://recipe1.ezmember.co.kr/cache/recipe/2020/04/20/381d2f6ae4aeaa541ba9d0aceadb04f61.jpg'}]"
36197,메인반찬,손님접대,해물류,볶음,쿡킹 윤은혜 두부타르트 & 새우감바스 도전♡ good,None,https://recipe1.ezmember.co.kr/cache/recipe/2021/10/14/26fac49f1f1e1eaa7f3c9c77bf0dad261.jpg,358,None,None,None,"[('두부', '5T'), ('마스카포네치즈', '3T'), ('천일염', '1꼬집'), ('만두피', '8개'), ('그라나파다노치즈', '약간'), ('새우', '5~6개'), ('미니파프리카', '3개'), ('가지', '4cm'), ('양파', '1/3조각'), ('올리브유', '3T'), ('페페론치노', '1T'), ('통마늘', '2개'), ('썬드라이토마토', '10g'), ('모듬허브믹스', '0.5t'), ('후추', '약간')]",,[]
36198,메인반찬,손님접대,해물류,볶음,떡을 품은 매운낙지볶음,낙지볶음,https://recipe1.ezmember.co.kr/cache/recipe/2017/10/18/00426c2a30f05ca24a5454df2a565d8d1.jpg,"2,113",30분 이내,아무나,4인분,"[('낙지', '3~4마리'), ('떡', '1줌'), ('대파', '적당량'), ('고추', '적당량'), ('멸치액젓', '2큰술'), ('다진마늘', '1큰술'), ('다진생강', '1작은술'), ('고추장', '2큰술'), ('고춧가루', '1큰술'), ('간장', '4~5큰술'), ('청주', '약간'), ('설탕', '1~2큰술'), ('꿀', '약간'), ('후춧가루', ''), ('소금', ''), ('참기름', ''), ('검은깨', '')]",야들한 낙지와 쫀득한 떡이 만나서 극강의 식감을 주는 떡 넣은 매운낙지볶음!!,"[{'step_number': 1, 'description': '낙지를 내장과 눈을 제거하고 굵은 소금을 넣어 박박 문질러 불순물을 제거후 깨끗이 씻은 후, 끓는 물에 살짝 데쳐서 한입 크기로 썰어준다.\n파와 풋고추는 어슷썰어 준비한다.\n떡은 뜨거운 물에 담구어 둔다.', 'image_url': 'https://recipe1.ezmember.co.kr/cache/recipe/2017/10/18/b487db8a380e9f428ce38c4d62ff3fe01.jpg'}, {'step_number': 2, 'description': '후라이팬에 낙지 넣고 야채 넣은 후 양념재료를 넣어 고루 잘 버무린다.\n센불에서 재빨이 볶다가 떡을 넣어 잘 섞어준 후 불을 끄고 참기름과 검은깨를 넣어준다.\n접시에 담아낸다.', 'image_url': 'https://recipe1.ezmember.co.kr/cache/recipe/2017/10/18/16ec7ffda0f6361a156c7abdb759b07c1.jpg'}, {'step_number': 3, 'description': '센불에 빨리 볶아야지 양념도 배이고 물이 생기지 않아서 맛있어요. 그리고 낙지가 질겨지지 않고, 떡에도 양념이 잘 베어서 좋아요.\n가을 낙지가 몸에 참 좋은데 맛있게 만들어 드시면 된답니다.\n오늘따라 더욱 맛있는 낙지볶음을 먹었답니다^^일단 해물을 볶을때에 멸치액젓을 넣으니 해물의 맛이 풍부해지고, 잡냄새를 싹없애주고, 그래서 해물이나 육류 요리시에 특별히 청주를 넣지 않아도 될 것 같아요.', 'image_url': 'https://recipe1.ezmember.co.kr/cache/recipe/2017/10/18/9f31b01585f4559b5e11198fbc76800e1.jpg'}]"
