index,종류별,상황별,재료별,방법별,글 제목,레시피이름,레시피이미지,조회수,조리시간,난이도,인분,재료,소개글,조리순서
41539,메인반찬,영양식,돼지고기,조림,#갈치속젓요리 #이베리코돼지갈비젓갈조림만들기 #갈치속젓으로 맛을 낸 감칠맛 폭발하는 갈비젓갈조림만들기,갈비젓갈조림,https://recipe1.ezmember.co.kr/cache/recipe/2020/12/17/6a622b5c4ca9f86697eddbea23e06f881.jpg,"1,340",90분 이내,초급,6인분 이상,"[('이베리코 돼지갈비', '1.2kg'), ('소주', '2큰술'), ('감자', '4개'), ('양파', '1개'), ('애호박', '1/2개'), ('무', '1/4개'), ('삶은시래기', '150g'), ('썬파', '1큰술'), ('천여조미료해물 육수', '3컵'), ('갈치속젓', '3큰술'), ('고춧가루', '2큰술'), ('고추장', '1큰술'), ('다진마늘', '1큰술'), ('다진생강', '1작은술'), ('썬파', '2큰술'), ('매실액', '1큰술'), ('맛술', '1큰술')]","지난 여름에 찾았던 정읍!! 그곳에서 유명하다고 하는

놀토에서도 나왔고요. 갈비박사의 갈비젓갈조림!!

물론 포장을 해서 펜션에서 먹었지만 그 맛이 너무 맛있어서

집에서 똑같이 따라해서 만들어 보았는데

​

이젠 제 스타일로 진정한 조림처럼 만들기 위해서

청경채나 버섯은 빼고 시래기를 넣어서 제대로된 갈비젓갈조림을 만들어 보았습니다.

조림에는 시래기나 우거지,, 아니면 고사리? 고구마순!!

이런 류가 들어가야 조림이겠죠. ㅎㅎㅎ

​

시래기와 남은 우거지사골된장국도 활용해주고요.

이베리코돼지갈비를 통째로 넣어서 푹 졸여낸 갈비젓갈조림입니다.

물론!! 가장 중요한 갈치속젓은 필수입니다.","[{'step_number': 1, 'description': '삶은시래기를 구입해서 씻어 준 후에 물기를 짜 주고 2등분으로 썰어서 준비해 놓습니다. 무도 너무 굵지 않게 썬 후에 반으로 다시 썰어서 준비해 놓습니다.', 'image_url': 'https://recipe1.ezmember.co.kr/cache/recipe/2020/12/17/d558cd2a7a53ed79f26f1e65e2231aa41.jpg'}, {'step_number': 2, 'description': '냉동실에 넣어 두었다가 한번 끓여서 먹고 남은 우거지사골된장국입니다. 이것을 사용하려고요. 없으시면 그냥 육수를 사용하시면 됩니다. 육수는 멸치다시마육수도 되고 사골육수도 됩니다.', 'image_url': 'https://recipe1.ezmember.co.kr/cache/recipe/2020/12/17/fe76396ac14e374de482f9297597e7891.jpg'}, {'step_number': 3, 'description': '우거지사골된장국에 무를 넣어 줍니다.', 'image_url': 'https://recipe1.ezmember.co.kr/cache/recipe/2020/12/17/70484e77d8e76c019da3e5fdf54f968d1.jpg'}, {'step_number': 4, 'description': '그리고 그 위에 시래기를 올려 줍니다. 골고루 잘 깔아 주세요.', 'image_url': 'https://recipe1.ezmember.co.kr/cache/recipe/2020/12/17/3627de4eeee03d26d5d08a2cbe0b41541.jpg'}, {'step_number': 5, 'description': '애호박은 조금은 두껍게 썰어서 역시나 반으로 반달모양으로 썰어서 줍니다.', 'image_url': 'https://recipe1.ezmember.co.kr/cache/recipe/2020/12/17/e9a630e992eea2134fea11df7a19d8aa1.jpg'}, {'step_number': 6, 'description': '감자도 준비해 놓습니다. 껍질을 까 주시고요.', 'image_url': 'https://recipe1.ezmember.co.kr/cache/recipe/2020/12/17/31a9efc11fc83f6f74ca0b2c8536e4cf1.jpg'}, {'step_number': 7, 'description': '두툼하게 연필깍기로 돌려가면서 썰어 준비해 놓습니다.', 'image_url': 'https://recipe1.ezmember.co.kr/cache/recipe/2020/12/17/6974cc0abf0dffa14aafb18f6ae7f5661.jpg'}, {'step_number': 8, 'description': '시래기 위에 감자와 애호박을 올려 줍니다. 기본적으로 들어가는 야채재료들은 다 넣어 준 것입니다.', 'image_url': 'https://recipe1.ezmember.co.kr/cache/recipe/2020/12/17/3ea9f80e34bd3379e046fa927eb5b5681.jpg'}, {'step_number': 9, 'description': '이제 양념을 만들어 줄 차례입니다. 고추장, 고춧가루를 넣어 주고 가장 중요한 갈치속젓도 넣어 줍니다.', 'image_url': 'https://recipe1.ezmember.co.kr/cache/recipe/2020/12/17/36b8b772b1c6e63aa52b0f458f2ecfbb1.jpg'}, {'step_number': 10, 'description': '다진마늘, 다진생강, 썬파, 소주, 매실액을 넣어 잘 섞어 줍니다. 그리고 랩을 씌운 후에 잠시 냉장고에 넣어 숙성을 시켜 줍니다.', 'image_url': 'https://recipe1.ezmember.co.kr/cache/recipe/2020/12/17/a24e6af7cd2a5ce888e1889f35c0f6b31.jpg'}, {'step_number': 11, 'description': '본격적으로 고기를 준비해 줍니다. 이베리코돼지고기 갈비입니다. 모두 뼈가 붙어 있는 갈비부위입니다. 스테이크를 해서 드셔도 좋고요. 아니면 구이로 즐기셔도 맛있습니다.', 'image_url': 'https://recipe1.ezmember.co.kr/cache/recipe/2020/12/17/ab0a06c3b6deec55ff01a4d62fc413871.jpg'}, {'step_number': 12, 'description': '먼저 삶기 전에 칼집부터 내어 줍니다. 앞뒤로 칼집을 내어 줍니다.', 'image_url': 'https://recipe1.ezmember.co.kr/cache/recipe/2020/12/17/91a8f69f02df63060c1eaf8bb96e7ce31.jpg'}, {'step_number': 13, 'description': '들통에 소주를 부어 주고 그 위에 칼집을 내어 준 이베리코돼지갈비를 올려 줍니다.', 'image_url': 'https://recipe1.ezmember.co.kr/cache/recipe/2020/12/17/b35ff597cc48d67b99973ac45b25bbda1.jpg'}, {'step_number': 14, 'description': '냉동상태의 고기를 해동시켜 준 것이라서 반드시 한번 삶아내어야지 핏물과 이물질들을 빼 낼 수 있습니다. 만약 냉동이 아닌 냉장제품이라면 이 단계를 빼주셔도 됩니다.', 'image_url': 'https://recipe1.ezmember.co.kr/cache/recipe/2020/12/17/346772dcc3fabd51b7ccac55f5887aff1.jpg'}, {'step_number': 15, 'description': '이물질과 핏물을 빼 준 삶아낸 돼지갈비를 준비해 놓았던 재료 위에 올려 줍니다. 그리고 육수를 부어 줍니다. 육수는 기존에 우거지사골된장국에 천연조미료황태육수를 추가로 넣어 주었습니다. 재료들이 다 잠기지 않고 2/3만 잠길 수 있도록 넣어 주세요.', 'image_url': 'https://recipe1.ezmember.co.kr/cache/recipe/2020/12/17/d69761203b754e573a8af307b0bbf06b1.jpg'}, {'step_number': 16, 'description': '냉장고에서 숙성시켜 놓았던 양념을 위에 골고루 발라 줍니다. 나중에 푹 익은 후에 간을 보시고 조금 약하다고 생각이 드시면 갈치속젓을 추가로 넣어 주시면 됩니다.', 'image_url': 'https://recipe1.ezmember.co.kr/cache/recipe/2020/12/17/1eb03217fd30dc5949909f04bec19f581.jpg'}, {'step_number': 17, 'description': '뚜껑을 닫고 푹 센불에서 끓여내어 주다가는 팔팔 끓어 오르고 20분이 지나면 중불로 옮겨서 계속해서 진득하게 끓여 줍니다. 중간 중간 골고루 국물을 위쪽으로 뿌려가면서 끓여 줍니다. 그리고 고기가 완전하게 다 익고 진한 국물이 나왔다면 마지막으로 썬파를 위에 올려 주고는 약 10분 더 끓여 줍니다.', 'image_url': 'https://recipe1.ezmember.co.kr/cache/recipe/2020/12/17/bd6e2852567e5673d806a43096c6cb381.jpg'}, {'step_number': 18, 'description': '뼈가 쉽게 쉽게 푹 빠져나올 정도로 푹 끓여내면 갈치속젓의 매콤하고 얼큰하면서도 감칠맛이 폭발하는 거기에 제일 맛있는 시래기까지 충분히 졸여진 갈비젓갈조림 완성입니다. 이것이 진정 갈비조림인 듯 싶습니다.', 'image_url': 'https://recipe1.ezmember.co.kr/cache/recipe/2020/12/17/063dbd34d6913e8c4ffa8796eb92acc61.jpg'}]"
41540,메인반찬,영양식,돼지고기,조림,쫄깃~ 돼지사태장조림 - 딸에게# / 돼지사태장조림 만드는법,None,https://recipe1.ezmember.co.kr/cache/recipe/2015/06/08/66236b2e3605675b6ed5802def86f41c.jpg,"6,409",None,None,None,[],,[]
41541,메인반찬,영양식,돼지고기,조림,간단별미 동파육,동파육,https://recipe1.ezmember.co.kr/cache/recipe/2015/06/08/b8bc6a174c9763372bbdefc225e26a46.jpg,"10,637",30분 이내,중급,1인분,"[('돼지고기', ''), ('청주', ''), ('통마늘', ''), ('대파', ''), ('생강', ''), ('후추', ''), ('흑마늘진액', ''), ('굴소스', '2큰술'), ('꿀', '1큰술'), ('마늘', ''), ('후추', '약간'), ('깨소금', ''), ('참기름', '')]",간단별미 동파육을 소개합니다.,"[{'step_number': 1, 'description': '고기는 우선 찬물에 넣고 피를 빼주고요. 청주와 통마늘, 대파, 생강, 후추를 넣고 고기를 삶아줘요.', 'image_url': 'https://recipe1.ezmember.co.kr/cache/recipe/2015/08/27/cb6b383b8626a165c7303747eb2cb5361.jpg'}, {'step_number': 2, 'description': '다 삶아진것은 젓가락으로 찔렀을때 피가 나지 않으면 다 익어진것이예요~ 전 비계를 좋아해서 삼겹수육을 준비했지만 비계 안좋아하시는분들은 살코기 많은걸로 준비하세요.', 'image_url': 'https://recipe1.ezmember.co.kr/cache/recipe/2015/08/27/7e898ff9dc791e0fe0cb6ec9417407da1.jpg'}, {'step_number': 3, 'description': '살짝 식혀주고요.', 'image_url': 'https://recipe1.ezmember.co.kr/cache/recipe/2015/08/27/1a81ca7b68eaae17054dfab382571b011.jpg'}, {'step_number': 4, 'description': '먹기좋을 크기로 잘라주세요.', 'image_url': 'https://recipe1.ezmember.co.kr/cache/recipe/2015/08/27/9cd85901555047489024a604a33aaa361.jpg'}, {'step_number': 5, 'description': '그리고 오늘의 핵심 양념중 하나인 풀마루 흑마늘진액입니다.', 'image_url': 'https://recipe1.ezmember.co.kr/cache/recipe/2015/08/27/1b4758aec6cfca12f3f49ce82f47f8781.jpg'}, {'step_number': 6, 'description': '한통 듬뿍듬뿍 넣어줬어요. 흑마늘진액을 넣고 다시한번 삶아주고요. 그런다음 굴소스 2 : 꿀 1 : 마늘, 후추, 깨소금, 참기름을 넣어주면 되요. 흑마늘 자제에 단맛이 있어 좀 달콤한 맛이 나기 때문에 단거 좋아하지 않는 분은 꿀 양을 조금 줄여주세요.', 'image_url': 'https://recipe1.ezmember.co.kr/cache/recipe/2015/08/27/07a89ccc0437344b85725b4d7877794d1.jpg'}, {'step_number': 7, 'description': '양념을 한다음 양념이 잘 배이도록 충분히 익혀줘요. 확실히 흑마늘 진액을 넣었더니 돼지고기 냄새가 안나요.', 'image_url': 'https://recipe1.ezmember.co.kr/cache/recipe/2015/08/27/d855c1761872bc35eaf49fec7bfc17101.jpg'}, {'step_number': 8, 'description': '완성입니다.', 'image_url': 'https://recipe1.ezmember.co.kr/cache/recipe/2015/08/27/468e8801c383a8f2ce2b0de2e086a1511.jpg'}]"
41542,메인반찬,영양식,돼지고기,조림,매콤 돼지등갈비찜 양념소스 생일생신상메뉴,매콤돼지등갈비찜,https://recipe1.ezmember.co.kr/cache/recipe/2024/01/08/36df75f5c68aa3e1d039a2e21f8e68de1.jpg,935,30분 이내,아무나,4인분,"[('돼지등갈비', '1팩'), ('고추장', '1T'), ('간장', '2T'), ('고춧가루', '1t'), ('간마늘', '1t'), ('후춧가루', '약간'), ('육수', '1컵'), ('설탕', '1T')]",매콤하고 맛있는 돼지등갈비 만들기 해 볼께요.,"[{'step_number': 1, 'description': '매콤하고 맛있는 돼지등갈비찜 만들기 해 볼께요.', 'image_url': 'https://recipe1.ezmember.co.kr/cache/recipe/2024/01/08/47da446f7e17033278e51049d0a37da21.jpg'}, {'step_number': 2, 'description': '고기를 설탕을 넣고 물에 담가서 물기를 빼고 살짝 데쳐서 깨끗하게 세척해 물기를 빼서 준비 해 주세요.냄비 , 접시', 'image_url': 'https://recipe1.ezmember.co.kr/cache/recipe/2024/01/08/413dd6e00805a46b859705e10a545bb11.jpg'}, {'step_number': 3, 'description': '고추장1T.간장2T.고춧가루1t.간마늘1t.후춧가루 약간. 육수 한컵.설탕1을 넣고 양념장을 만들어 주세요.조리용스푼 , 계량컵', 'image_url': 'https://recipe1.ezmember.co.kr/cache/recipe/2024/01/08/67f76749f81c84bff200bd6a0bba4cc61.jpg'}, {'step_number': 4, 'description': '그럼 양념장을 끓이시면서 손질 해 둔 돼지등갈비를 넣고 뚜껑을 닿고 5분 정도 끓여 주세요. 한번 삶아서 그리 오래 삶지 않아도 살이 잘 발라진답니다.조리용집게', 'image_url': 'https://recipe1.ezmember.co.kr/cache/recipe/2024/01/08/7ba9a44982f0a1aea5be4ccd5db41ad11.jpg'}, {'step_number': 5, 'description': '국물이 자작하게 잘 배도록 졸여 주세요.', 'image_url': 'https://recipe1.ezmember.co.kr/cache/recipe/2024/01/08/a3f14c9d533ee2f61b57decaacda8a111.jpg'}, {'step_number': 6, 'description': '그럼 맛있고 매콤한 돼지등갈비가 완성이랍니다.프라이팬', 'image_url': 'https://recipe1.ezmember.co.kr/cache/recipe/2024/01/08/5db3dc93ca250d6dc57b32ca9a3ceb051.jpg'}]"
