index,종류별,상황별,재료별,방법별,글 제목,레시피이름,레시피이미지,조회수,조리시간,난이도,인분,재료,소개글,조리순서
41526,메인반찬,영양식,돼지고기,조림,아이반찬 메추리알 돼지안심장조림~,돼지안심장조림,https://recipe1.ezmember.co.kr/cache/recipe/2019/05/03/674219a54ea6041a9680eaa4640d75d71.jpg,"14,590",60분 이내,아무나,4인분,"[('메추리알', '220g'), ('돼지고기안심 500g', '2개'), ('월계수잎', '4장'), ('간장', '10큰술'), ('요리당', '4큰술'), ('설탕', '2큰술'), ('맛술', '2큰술'), ('들기름/참기름', '1큰술'), ('통깨', '조금')]","메추리알과 돼지고기 안심으로 장조림을
만들어보세요~아이들반찬으로 좋아요","[{'step_number': 1, 'description': '메추리알을 8분간 삶아 찬물에 담구어서 껍질을 제거해주세요', 'image_url': 'https://recipe1.ezmember.co.kr/cache/recipe/2019/05/03/4615f7047518e9773c8cbf6da798b0231.jpg'}, {'step_number': 2, 'description': '돼지안심을 5센티 길이로 썰어주세요', 'image_url': 'https://recipe1.ezmember.co.kr/cache/recipe/2019/05/03/871c19c5263217af623b9dd7ab1717be1.jpg'}, {'step_number': 3, 'description': '간장10/요리당4/설탕2큰술/맛술2큰술씩을 넣고 물1컵반만 넣고 잘섞어주세요 간장양념을 돼지안심에 부어주세요', 'image_url': 'https://recipe1.ezmember.co.kr/cache/recipe/2019/05/03/f446166d4e19a6421a30cde609320b161.jpg'}, {'step_number': 4, 'description': '돼지안심에 간장양념을 부은곳에 월계수잎 4장만 넣어주세요\n펄펄 15분간 끓여주세요', 'image_url': 'https://recipe1.ezmember.co.kr/cache/recipe/2019/05/03/345a3799351cab369a515e25f0f794341.jpg'}, {'step_number': 5, 'description': '15분간 간장양념에 졸여준 돼지안심이 간장색이 잘들여졌으면 냄비에 한쪽으로 \n밀고 깐메추리알을 넣어주세요\n10분을 더조려주세요', 'image_url': 'https://recipe1.ezmember.co.kr/cache/recipe/2019/05/03/d98fa5146deb05053ea90812a673d67c1.jpg'}, {'step_number': 6, 'description': '10분후에 메추리알도 간장색이 잘들여졌으면 불을 꺼주세요', 'image_url': 'https://recipe1.ezmember.co.kr/cache/recipe/2019/05/03/02bd9226ef39940138ec6ce9580490441.jpg'}, {'step_number': 7, 'description': '돼지안심만 따로 건져내서 식혀주세요 젓가락으로 월계수잎을 건져내주세요', 'image_url': 'https://recipe1.ezmember.co.kr/cache/recipe/2019/05/03/699ffbbd13698679521c00e686ae27b01.jpg'}, {'step_number': 8, 'description': '그릇에 돼지안심을 먹기좋은 크기로 찢어주시고 그위에 간장양념 남은것이랑 메추리알을 부어주세요', 'image_url': 'https://recipe1.ezmember.co.kr/cache/recipe/2019/05/03/a28bb42f9eaf82ce4919c5359ab05b7c1.jpg'}, {'step_number': 9, 'description': '들기름/참기름을 1큰술을 넣고 통깨도 조금 뿌려주세요', 'image_url': 'https://recipe1.ezmember.co.kr/cache/recipe/2019/05/03/d8217a4f26908b7fcecc8822881d779b1.jpg'}, {'step_number': 10, 'description': '살살 버무려서 완성시켜주세요', 'image_url': 'https://recipe1.ezmember.co.kr/cache/recipe/2019/05/03/93a3cb44039aedf8beb0d6c5363f109b1.jpg'}]"
41527,메인반찬,영양식,돼지고기,조림,동파육 만들기,동파육,https://recipe1.ezmember.co.kr/cache/recipe/2015/07/03/9abdf253d469783e2443a042b78e467e1.jpg,"21,892",90분 이내,초급,1인분,"[('돼지고기', ''), ('로즈마리', ''), ('청경채', ''), ('마늘', ''), ('통후추', ''), ('간장', '6T'), ('굴소스', '4T'), ('올리고당', '4T'), ('소금', '')]","오늘 여러분과 함께 할 요리는, 풍미 좋은 고급 중국요리 동파육 만들기 레시피로 함께 해 보려고 합니다. 제가 전문가는 아니라 야매스럽지만 그래도 완성한 요리의 맛은 생각보다 괜찮더라구요~ 고급스러운 중식이라 가격대가 높은데 비교적 저렴한 예산으로 풍성하게 집에서 즐길 수 있었습니다. 중국의 향을 더하고 싶으시면 더욱 다양한 중국 향신료를 사용해서 그 풍미를 남달리 하셔도 좋을 것 같아요! 저는 캐나다에서 외국인들도 거부감 없는 친숙한 향으로 완성 해 볼까합니다.","[{'step_number': 1, 'description': '먼저 손을 깨끗하게 씻어주시고 필요한 재료를 준비 해 보겠습니다.\n저는 오늘 향을 더할 식재료로 로즈마리, 통마늘, 통후추\n이렇게 사용 해 볼 예정입니다.\n세 가지의 재료로도 충분히 잡내를 잡을 수 있는 것은 물론 은은한 향이 고기 안쪽까지 배이게 만들어 더욱 풍성한 맛을 즐기실 수 있습니다.', 'image_url': 'https://recipe1.ezmember.co.kr/cache/recipe/2015/07/13/01c7ce5714f0d382693908730f8196d81.jpg'}, {'step_number': 2, 'description': '오늘은 조리시간이 긴 편입니다.\n물의 양을 충분히 넉넉히 잡아주셔야 해요! 1L 이상의 물을 넣어주세요.', 'image_url': 'https://recipe1.ezmember.co.kr/cache/recipe/2015/07/13/87174836860560a113297d3cf73a38e71.jpg'}, {'step_number': 3, 'description': '그리고 마늘과 통후추를 넣고 껍데기가 붙어 있는\n삼겹살을 준비 해 넣어주세요.', 'image_url': 'https://recipe1.ezmember.co.kr/cache/recipe/2015/07/13/29c349c14b2420ef50c4b9f6399dd9cb1.jpg'}, {'step_number': 4, 'description': '향긋한 로즈마리도 넣어주시고 불에 올려 조리를 시작 해 주세요.\n한번 끓어오를 때 까지는 강불로 가열 해 주세요', 'image_url': 'https://recipe1.ezmember.co.kr/cache/recipe/2015/07/13/e468f4287cde14a3ea3fa5ff5c34af961.jpg'}, {'step_number': 5, 'description': '간장 6T, 굴소스 4T, 올리고당 4T을 넣어 간장소스를 만들어주세요', 'image_url': 'https://recipe1.ezmember.co.kr/cache/recipe/2015/07/13/b88b989f9ae64a496a64005eb1b5fd261.jpg'}, {'step_number': 6, 'description': '그 사이, 고기를 삶는 물이 팔팔 한 번 끓고 있을거에요.\n여기에 준비한 양념장을 넣어주세요.', 'image_url': 'https://recipe1.ezmember.co.kr/cache/recipe/2015/07/13/03f97fcba124dd5d6ee30df07127bb661.jpg'}, {'step_number': 7, 'description': '다시 한번, 우르르 끓어 오를 때 까지 강불에서 조리 해 주세요.', 'image_url': 'https://recipe1.ezmember.co.kr/cache/recipe/2015/07/13/687e986bbf0665c1e3dfe93a874eb7b01.jpg'}, {'step_number': 8, 'description': '아삭한 청경채는 동파육과 곁들여 먹게 되면\n개운함이 더해져 그 맛이 더욱 좋은데요.\n깨끗하게 씻은 청경채는 2등분 해서 먹기 좋게 준비 해 주세요.', 'image_url': 'https://recipe1.ezmember.co.kr/cache/recipe/2015/07/13/754dc17c7965296b2bc4ac084a1f03e31.jpg'}, {'step_number': 9, 'description': '우르르 끓어 오른 후 부터는 불을 중불로 줄여주세요.\n지금부터 1시간 동안 삶아보겠습니다.\n화력에 따라 중불 ~ 중약불 사이로 맞추어 주시면 좋습니다.\n펄펄 끓는 정도가 아닌, 잔잔하게 끓는 정도로 맞춰주세요.', 'image_url': 'https://recipe1.ezmember.co.kr/cache/recipe/2015/07/13/32a117a72e4bf5d62dae6256afaeb4441.jpg'}, {'step_number': 10, 'description': '청경채 데칠 물 700ML 에소금 1t를 넣고 끓여주세요.\n소금을 넣고 데치게 되면 푸릇푸릇 색감이 살아나요!', 'image_url': 'https://recipe1.ezmember.co.kr/cache/recipe/2015/07/13/10fc8325d03c85f098faf3894ec388af1.jpg'}, {'step_number': 11, 'description': '저는 아삭하게 즐기기 위해 물에 넣고 딱 1분 데쳤습니다.', 'image_url': 'https://recipe1.ezmember.co.kr/cache/recipe/2015/07/13/9fb09a61a5bda1e507761a36ec7360321.jpg'}, {'step_number': 12, 'description': '데친 청경채는 차디 찬 얼음물에 담가\n더운 기운을 빼 주시고 더욱 아삭하게 준비 해 주세요.', 'image_url': 'https://recipe1.ezmember.co.kr/cache/recipe/2015/07/13/2d6be1e29075aa119b8167fa0abc95c01.jpg'}, {'step_number': 13, 'description': '중불에서 끓인지 1시간 경과 후, 육수의 양이 꽤 많이 줄었죠?\n떠오른 기름과 불순물을 두어번 깔끔하게 걷어 내 주세요.', 'image_url': 'https://recipe1.ezmember.co.kr/cache/recipe/2015/07/13/894e7affabb51350d9d3ae71ea838af01.jpg'}, {'step_number': 14, 'description': '지금부터 중약불 ~ 약불 사이에서\n(가열도구 화력에 따라 조절) 15분간 더 삶아보도록 하겠습니다.', 'image_url': 'https://recipe1.ezmember.co.kr/cache/recipe/2015/07/13/e703d3c2c89a719396b90753465c64d01.jpg'}, {'step_number': 15, 'description': '육수의 양이 가장 처음보다\n2/3가량 줄어들었습니다.\n색이 짙어지고 윤기가 나며\n살짝 점도도 느껴집니다.', 'image_url': 'https://recipe1.ezmember.co.kr/cache/recipe/2015/07/13/7b721cebc5a184718b960ab006b19bc91.jpg'}, {'step_number': 16, 'description': '자, 이제 고기를 건져 실온에서 살짝 식혀주세요.', 'image_url': 'https://recipe1.ezmember.co.kr/cache/recipe/2015/07/13/268a7c370e60d44aa6dd601f79feae4f1.jpg'}, {'step_number': 17, 'description': '들어간 모든 향신 재료는 고운 체로 걸러 준비 해 주세요.\n마늘은 같이 곁들이셔도 훌륭해요! 건더기는 말끔히 건져 내시고 양념만 냄비에 남게 해 주세요.', 'image_url': 'https://recipe1.ezmember.co.kr/cache/recipe/2015/07/13/06b02e98948501322a8138748c6d96eb1.jpg'}, {'step_number': 18, 'description': '식혀진 고기는 두툼하게 1.5CM간격으로 슬라이스 해 보겠습니다.', 'image_url': 'https://recipe1.ezmember.co.kr/cache/recipe/2015/07/13/e8ebba2452036010c5dba020444f59a01.jpg'}, {'step_number': 19, 'description': '깔끔하게 준비 된 소스에 넣고 앞으로 15분간 약불에서 조려주세요.', 'image_url': 'https://recipe1.ezmember.co.kr/cache/recipe/2015/07/13/67c8bcd4ad71c1367a5e680b7c6289771.jpg'}, {'step_number': 20, 'description': '깔끔하게 준비 된 소스에 넣고 앞으로 15분간 약불에서 조려주세요.', 'image_url': 'https://recipe1.ezmember.co.kr/cache/recipe/2015/07/13/2013b1d13f7320e27f09da0ac50d86ef1.jpg'}]"
41528,메인반찬,영양식,돼지고기,조림,말복 보양식/마늘 돼지고기완자조림,마늘돼지고기완자조림,https://recipe1.ezmember.co.kr/cache/recipe/2020/08/12/d7cb2be6bfb502a50ea4d547fd9443b21.jpg,"2,771",30분 이내,초급,4인분,"[('다진 돼지고기', '200g'), ('마늘', '10여개'), ('계란', '1개'), ('두부', '1/3모'), ('애호박', '1/4개'), ('당근', '50g'), ('양파', '1/2개'), ('밀가루', '약간'), ('식용유', '약간'), ('검정깨', '약간'), ('굴소스', '1스푼'), ('다진생강', '2티스푼'), ('다진마늘', '1스푼'), ('맛술', '1스푼'), ('후추', '약간'), ('전분', '3스푼'), ('소금', '2티스푼'), ('참기름', '1스푼'), ('물', '1/2컵'), ('간장', '2스푼'), ('굴소스', '0.5스푼'), ('올리고당', '2스푼'), ('맛술', '2스푼')]","마늘과 돼지고기가 면역력 높이는데 좋다고 합니다
보양식으로 드시면 좋은 마늘 품은 돼지고기완자조림 소개해 드릴게요^^*","[{'step_number': 1, 'description': '재료를 준비해 주세요~', 'image_url': 'https://recipe1.ezmember.co.kr/cache/recipe/2020/08/12/fefc95ae1941ed07edf54149966e28171.jpg'}]"
41529,메인반찬,영양식,돼지고기,조림,삼겹살 간장조림(파채삼겹살),삼겹살간장조림,https://recipe1.ezmember.co.kr/cache/recipe/2018/10/05/f82f17e96f0ac8f997700436ba71e93e1.jpg,"15,534",60분 이내,중급,4인분,"[('돼지삼겹살', '600g'), ('파채', '200g'), ('조림간장', '3스푼'), ('굴소스', '2스푼'), ('생수', '2스푼'), ('맛술', '1스푼'), ('물엿', '1스푼'), ('설탕', '1스푼'), ('다진마늘', '1스푼'), ('참기름', '1스푼'), ('커피', '1/2스푼'), ('전분가루', '1스푼')]","삼겹살은 구워먹기만 했는데 어느날 TV를 보다가
 삼겹살조림을 보게 되었어요 요리를 좋아하다보닌까
바로 실천을 하게 되었답니다
삼겹살에 윤기가 자르르 흐르는게 구워먹는 삼겹살도
맛있는데 또 다른 느낌의 맛이 나네요
기름진 느낌도 덜 하고 더 담백하게 먹을수 있네요 ㅋㅋ","[{'step_number': 1, 'description': '정육점에서 신선한 삼겹살 600g구입\n맛있는 비결은 역시 신선한 재료!!', 'image_url': 'https://recipe1.ezmember.co.kr/cache/recipe/2018/10/05/1f8f28990d7f59b65d6ed65d5d1552d01.jpg'}, {'step_number': 2, 'description': '달구어진 팬에 삼겹살 나란히\n얹어 놓습니다', 'image_url': 'https://recipe1.ezmember.co.kr/cache/recipe/2018/10/05/d39b7d02167336c3c8a1b7b932de0a051.jpg'}, {'step_number': 3, 'description': '앞뒤로 노릇노릇 하게 구워 주시고', 'image_url': 'https://recipe1.ezmember.co.kr/cache/recipe/2018/10/05/cf3b2a809c8a41c63e34f6e9007468d51.jpg'}, {'step_number': 4, 'description': '삼겹살 구워지는 시간에\n양념장을 만들어 놓으세요\n*전분가루는 마지막에 넣을거니\n이 양념에 넣지 마세요', 'image_url': 'https://recipe1.ezmember.co.kr/cache/recipe/2018/10/05/13b0b592cb0b20db4e2c4eba9be52ca81.jpg'}, {'step_number': 5, 'description': '팬에 양념장을 끓여 줍니다', 'image_url': 'https://recipe1.ezmember.co.kr/cache/recipe/2018/10/05/594e66ea53703a87a674b1c724e55aeb1.jpg'}, {'step_number': 6, 'description': '양념장이 끓으면 노릇노릇 구운 삼겹살을 먹기좋은 크기로 잘라서\n넣어주세요\n중불에서 5분정도 조려주면 고기에 양념이 잘 베여 집니다', 'image_url': 'https://recipe1.ezmember.co.kr/cache/recipe/2018/10/05/393048347f3717793f046ae000b1fbe31.jpg'}, {'step_number': 7, 'description': '달콤 짭조름한 맛에 물전분\n(전분가루)을 살살 뿌려주며 \n농도 조절을 해 주세요. \n양념이 착 붙어 맛이 아주 좋아집니다', 'image_url': 'https://recipe1.ezmember.co.kr/cache/recipe/2018/10/05/0f9acd14506ec559118527cd73baec5d1.jpg'}, {'step_number': 8, 'description': '*파채양념*\n진간장,고추가루,식초,설탕,통깨\n참기름을 적당히 골고루 섞어\n주세요\n*파채양념 간단하죠', 'image_url': 'https://recipe1.ezmember.co.kr/cache/recipe/2018/10/05/9e1d21e81e76a63d2be6c53fcb19d7361.jpg'}, {'step_number': 9, 'description': '파채에 양념을 넣어 조물조물\n무쳐 주세요', 'image_url': 'https://recipe1.ezmember.co.kr/cache/recipe/2018/10/05/70f331d6aa998663e0dc8ccda17731551.jpg'}, {'step_number': 10, 'description': '예쁜접시에 삼겹살조림과 파채를\n얹어주면 삼겹살조림 완성!!', 'image_url': 'https://recipe1.ezmember.co.kr/cache/recipe/2018/10/05/94153197b2a6841171bf40d18049f2f71.jpg'}]"
41530,메인반찬,영양식,돼지고기,조림,돼지고기 안심 장조림 밑반찬만들기,돼지고기안심장조림,https://recipe1.ezmember.co.kr/cache/recipe/2016/10/11/86889ba248bfc2efdcb16f6dde54734e1.jpg,"17,146",30분 이내,아무나,4인분,"[('안심', '1kg'), ('달걀', '16개'), ('양파', '1/2개'), ('마늘', '1줌'), ('생강', '약간'), ('다시마', '약간'), ('월계수잎', '2장'), ('꽈리고추 간장', '1.5컵'), ('설탕', '3큰술'), ('소금', '2큰술'), ('맛술', '5큰술'), ('후추', '약간'), ('물', '적당량')]",​밥 반찬으로 좋은 돼지고기 안심 장조림을 만들어봤어요 갑자기 추워진 날씨에 감기가 폭 들어 목소리도 안 나오고 미리 밑반찬 몇가지를 만들어 놔서 어찌나 안심이 되던지~ 당분간은 걱정 없겠어요 ㅎㅎ 오랜만에 장조림을 만들었더니 그렇게 좋아할 수가~ 달걀도 넉넉히 삶아 넣고 꽈리고추도 넣어 부드러운 안심이라 돼지고기의 누린내도 없어 장조림 맛이 참 좋았답니다,"[{'step_number': 1, 'description': '돼지고기는 물에 담가 핏물을 빼고', 'image_url': 'https://recipe1.ezmember.co.kr/cache/recipe/2016/10/11/7f1517a3e3080e635ee7f4fb37069cda1.jpg'}, {'step_number': 2, 'description': '달걀을 넉넉히 삶아 껍질을 벗겨줍니다', 'image_url': 'https://recipe1.ezmember.co.kr/cache/recipe/2016/10/11/a026b09488b13096b82d06487c36b9011.jpg'}, {'step_number': 3, 'description': '냄비에 재료들이 잠길 정도로 물을 넣고 양파, 다시마, 월계수잎, 간장, 설탕, 소금을 넣고 끓여줍니다', 'image_url': 'https://recipe1.ezmember.co.kr/cache/recipe/2016/10/11/3f51c5ae30a82fe288b9dc91c593b4331.jpg'}, {'step_number': 4, 'description': '다시마를 건져내고 돼지고기를 넣고 속이 익을때까지 끓여줍니다', 'image_url': 'https://recipe1.ezmember.co.kr/cache/recipe/2016/10/11/d602f756bd3d5bce93f37569963c41111.jpg'}, {'step_number': 5, 'description': '고기가 잘 익었으면 달걀과 꽈리고추, 마늘을 넣고 색이 날때까지 끓여줍니다', 'image_url': 'https://recipe1.ezmember.co.kr/cache/recipe/2016/10/11/1ac2ce299f74f7e3338dbcf0dde4235e1.jpg'}, {'step_number': 6, 'description': '고기는 건져서 한 김 식으면 쪽쪽 찢어 통에 담고 달걀과 꽈리고추도 골라서 통에 넣은 뒤 채에 받혀 건더기를 뺀 국물을 부어주면 장조림 완성이에요', 'image_url': 'https://recipe1.ezmember.co.kr/cache/recipe/2016/10/11/b073925091f937d9fc67f7b5c9389a861.jpg'}]"
41531,메인반찬,영양식,돼지고기,조림,"돼지꼬리요리 드셔 보셨나요~???
쫀득함이 살아있는 돼지꼬리요리",돼지꼬리,https://recipe1.ezmember.co.kr/cache/recipe/2019/07/05/f2a472d3d6f62e13bfd55366b1a6d33d1.jpg,"48,022",60분 이내,아무나,3인분,"[('돼지고기 꼬리', '1kg'), ('된장', '1스푼'), ('소주', '1/2컵'), ('월계수잎', '3개'), ('간장', '2스푼'), ('다진마늘', '2스푼'), ('설탕', '1스푼'), ('후추가루', '약간'), ('올리고당', '1스푼'), ('생강가루', '약간'), ('참기름', '1스푼')]","돼지꼬리요리는 쫀득하면서도 꼬들꼬들한 식감이 
살아나는 요리 입니다
콜라겐 성분이 막 씹히는 느낌이 듭니다
콜라겐이 풍부해서 다이어트에 최고!!
피부탄력에도 일등공신을 하지만 다만 주의해야할것이
고칼로리 요리이기 때문에 너무 많이 먹기보다 주기적으로
꾸준히 먹으면 도움이 된다고 합니다","[{'step_number': 1, 'description': '돼지꼬리 1kg 준비 했어요(4천원)\n정육점에서 잘라오면 요리하기\n편합니다\n찬물에 1시간정도 담궈 놓았다가\n깨끗이 씻어 주시고', 'image_url': 'https://recipe1.ezmember.co.kr/cache/recipe/2019/07/05/78aabfefce5ed56c67a2f303382e4bc41.jpg'}, {'step_number': 2, 'description': '된장과 월계수잎,소주 넣고\n초벌로 한번 삶아 줍니다\n*돼지갈비,등뼈 요리 할때도\n이런 방법으로 초벌로 삶아주면\n돼지냄새 안 나고 맛 있어요', 'image_url': 'https://recipe1.ezmember.co.kr/cache/recipe/2019/07/05/963e2192f1e6edb5f6a65f52f61b4b471.jpg'}, {'step_number': 3, 'description': '불순물들이 많이 나오네요\n이런걸 그냥 요리했으면 \n어쩔뻔 했겠어요ㅠㅠ', 'image_url': 'https://recipe1.ezmember.co.kr/cache/recipe/2019/07/05/87916117f6c13bb2fb75974d30be0ae81.jpg'}, {'step_number': 4, 'description': '찬물로 깨끗이 씻어 주시고\n물기를 빼 주시고요', 'image_url': 'https://recipe1.ezmember.co.kr/cache/recipe/2019/07/05/3bfb5099bb4d201a8b62e287a20d11a41.jpg'}, {'step_number': 5, 'description': '그동안 양념을 만들면 됩니다\n간장,다진마늘,설탕,올리고당\n생강가루,후추가루를 섞어 \n주시면 됩니다', 'image_url': 'https://recipe1.ezmember.co.kr/cache/recipe/2019/07/05/a68f956c754f46574438f3b5faac4ca11.jpg'}, {'step_number': 6, 'description': '만든 양념장을 넣고 중불에서\n볶아 주면 됩니다\n바닥에 눌지 않도록 잘 볶아 주시고요', 'image_url': 'https://recipe1.ezmember.co.kr/cache/recipe/2019/07/05/21361a44dc9fc86b8e4358fdf5797a211.jpg'}, {'step_number': 7, 'description': '마지막에 참기름 한바퀴 돌려 주세요\n쫀득거리는 식감과 가운데 뼈가 있어\n발라내기가 쉽고 살고기도 있는데\n족발과 유사한 맛~\n엄청 쫄깃하고!!\n돼지껍질 좋아 하시는분들은 무조건\n좋아 하실겁니다', 'image_url': 'https://recipe1.ezmember.co.kr/cache/recipe/2019/07/05/87226bf160af22163cebe1826d6f33801.jpg'}, {'step_number': 8, 'description': '콜라겐 성분이 막 씹히는 느낌이\n듭니다\n씹을수록 고소하고 감칠맛 나는\n돼지꼬리 이 맛~!!', 'image_url': 'https://recipe1.ezmember.co.kr/cache/recipe/2019/07/05/a298c4354ad395273906f20c972e79681.jpg'}]"
41532,메인반찬,영양식,돼지고기,조림,봄 냄새 가득한 봄동 삼겹살 간장조림,봄동삼겹살간장조림,https://recipe1.ezmember.co.kr/cache/recipe/2018/04/20/e7292536b4ea6cd707a53ad47f10ff591.jpg,"2,093",30분 이내,초급,2인분,"[('삼겹살', '450g'), ('봄동', '1포기'), ('달래', '1/3줌'), ('청양고추', '2개')]","날씨가 어느덧 봄이 되어 가고 있습니다 ^(00)^~ 요즘 시장에 나가면 달래나 냉이 봄동 같은 봄나물들을 볼 수 있어 더욱더 봄이 된 걸 느끼고 있습니다. 이번에는 우리 땅에서 정성껏 키운 우리 돼지 한돈과 함께 봄동을 넣어 삼겹살 간장조림을 만들어보았는데요, 쫄깃한 식감과 간장의 짭조름한 감칠맛에 향긋한 봄나물까지! 이제 차례대로 레시피를 배워볼까요?","[{'step_number': 1, 'description': '삼겹살은 한입 크기로 썰어 놓고, 볼에 고기를 담고 미리 만들어 놓은 양념을 넣어 간이 고루 섞여질 수 있도록 잘 버무린 후 약 20분 정도 재워 줍니다. 봄동은 깨끗이 씻어서 큰 것은 반을 가르고 작은 것은 그대로 사용합니다. 청양고추는 어슷하게~ 달래는 송송~ 썰어서 준비합니다.', 'image_url': 'https://recipe1.ezmember.co.kr/cache/recipe/2018/04/20/94e57bee5055e0e4f842326aa909c6081.jpg'}, {'step_number': 2, 'description': '달군 팬에 재워 둔 고기를 올려서 구워주다가 고기가 거의 다 익어간다면! 이제 봄동을 넣어 함께 볶아 줍니다. 다 익으면 불을 끄고 청양고추와 달래를 넣어 섞어 줍니다. 이제 예쁜 접시에 옮기면 완성! 참 간단하죠? 이제 맛있게 먹어주기만 하면 끝이랍니다!', 'image_url': 'https://recipe1.ezmember.co.kr/cache/recipe/2018/04/20/35cf122054a780b8416f04976db79d131.jpg'}, {'step_number': 3, 'description': '봄 냄새 가득 한 접시 담아 본 봄동 삼겹살 간장조림이에요. 신선한 우리 돼지 한돈으로 만들면 더욱 쫄깃하고 담백하고 맛있답니다. 오늘 저녁은 한돈닷컴이 소개해드린 봄동 삼겹살 간장조림, 어떠신가요?', 'image_url': 'https://recipe1.ezmember.co.kr/cache/recipe/2018/04/20/20e640ed452de9b56b6bcf0cd1c0beee1.jpg'}]"
