index,종류별,상황별,재료별,방법별,글 제목,레시피이름,레시피이미지,조회수,조리시간,난이도,인분,재료,소개글,조리순서
76239,밥/죽/떡,초스피드,채소류,삶기,콩나물영양밥과 칼칼한 콩나물국: 콩나물 한봉으로 밥과 국 해결,콩나물국,https://recipe1.ezmember.co.kr/cache/recipe/2023/03/05/e85ea6a0fd17f6da93977d1586ea429e1.jpg,359,30분 이내,초급,3인분,"[('현미', '2비율'), ('현미찹쌀', '1비율'), ('당근', ''), ('무', ''), ('표고버섯', ''), ('다시마', ''), ('죽염', ''), ('콩나물', ''), ('양념장', ''), ('콩나물', ''), ('다시육수', ''), ('양파', ''), ('대파', ''), ('청양고추', ''), ('마늘', ''), ('국간장', ''), ('소금', ''), ('양조간장', ''), ('매실액', ''), ('배즙', ''), ('올리고당', ''), ('파', ''), ('마늘', ''), ('참기름', ''), ('통깨', '')]","콩나물국 끓일 때 콩나물을 넘치게 넣고 그 넘치는 만큼의
삶은콩나물은 콩나물밥을 만드는 일타이피 플러스요리에요.","[{'step_number': 1, 'description': '현미와 현미찹쌀을 2:1로 씻은 후 다시마와 당근,무,표고버섯을 잘게 썰어 넣고 \n죽염을 넣어 밥을 짓는다.', 'image_url': 'https://recipe1.ezmember.co.kr/cache/recipe/2023/03/05/7846b2e3fa366dbd0af58148f7206e001.jpg'}, {'step_number': 2, 'description': '다시마와 북어를 넣은 물이 끓을 때 손질한 콩나물을 넣어 삶는다', 'image_url': 'https://recipe1.ezmember.co.kr/cache/recipe/2023/03/05/25b70458889fb287783754b677369e721.jpg'}, {'step_number': 3, 'description': '콩나물이 아삭하게 삶아지면 2/3정도의 콩나물을 건져낸다.', 'image_url': 'https://recipe1.ezmember.co.kr/cache/recipe/2023/03/05/dc1d754a8f5fac138fc83d39c1fa242d1.jpg'}, {'step_number': 4, 'description': '콩나물을 일부 건져낸 냄비에 양파 썬 것을 넣고 한번 더 끓인다.', 'image_url': 'https://recipe1.ezmember.co.kr/cache/recipe/2023/03/05/0e2b850ef91a8e4608df624f5c15fd181.jpg'}, {'step_number': 5, 'description': '양파가 익으면 다진마늘,대파,청홍고추를 넣고 국간장과 소금으로 간을 맞춘다.\n콩나물국 완성!', 'image_url': 'https://recipe1.ezmember.co.kr/cache/recipe/2023/03/05/4ebaa4a4b07617b2a858873dde3d1f371.jpg'}, {'step_number': 6, 'description': '분량의 재료를 넣고 양념장을 만든다.', 'image_url': 'https://recipe1.ezmember.co.kr/cache/recipe/2023/03/05/bceaa08012c0ad10a4fa291831b615951.jpg'}, {'step_number': 7, 'description': '채소가 듬뿍 들어간 영양현미밥을 \n그릇에 담는다.', 'image_url': 'https://recipe1.ezmember.co.kr/cache/recipe/2023/03/05/5ae5bdc45b95add9124185ca8b979bcf1.jpg'}, {'step_number': 8, 'description': '따로 덜어놓은 콩나물을 얹고 양념장에 비비면 영양콩나물밥도 완성!', 'image_url': 'https://recipe1.ezmember.co.kr/cache/recipe/2023/03/05/b9b3480a9128478dfa73a06d0811da471.jpg'}]"
76240,밥/죽/떡,초스피드,채소류,삶기,초 간편 배추 쌈밥 만들기. 찬밥 활용하기 좋아요~,배추쌈밥,https://recipe1.ezmember.co.kr/cache/recipe/2023/08/14/466556358d838f698a6fab88a32586fb1.jpg,784,20분 이내,아무나,4인분,"[('알배추', '1통'), ('밥', '300g'), ('참기름', '1큰술'), ('소금', '1작은술'), ('쌈장', '3큰술')]",주말이면 주부들은 가족들 뭘 먹일까 고민 많으시죠? 음식 하기 번거롭고 힘드시죠?? 주말마다 배달 음식이 질리셨다면 오늘은 찬 밥을 이용해서 배추 쌈밥을 만들어 가족들과 맛있게 드셔 보세요..,"[{'step_number': 1, 'description': '배추는 뿌리 부분을 잘라 한 장씩 떼어내 주시고 두번 헹궈주세요.', 'image_url': 'https://recipe1.ezmember.co.kr/cache/recipe/2023/08/16/49f59085916eeaa0f0ba6eb410560a1b1.jpg'}, {'step_number': 2, 'description': '냄비에 물 400cc 부어주세요. 씻어둔 배추잎을 넣고 삶아주세요. 센불뚜껑을 닫고 줄기 부분까지 잘 익혀두세요\u200b', 'image_url': 'https://recipe1.ezmember.co.kr/cache/recipe/2023/08/16/68dd2287577f3a7b87546a1a5f0846321.jpg'}, {'step_number': 3, 'description': '배추가 다 익었으면 찬물에 담가 식혀주세요. 물기가 잘 빠지도록 채에 밭혀 주세요. 배추대신 양배추나 케일을 이용하셔도 좋아요.', 'image_url': 'https://recipe1.ezmember.co.kr/cache/recipe/2023/08/16/1b9570a0ec718b98a69407a00aa523401.jpg'}, {'step_number': 4, 'description': '밥을 준비해 주세요. 전자레인지에 2분간 데워서 준비해 주세요. 전날 남은 곤드레 밥을 사용했어요.', 'image_url': 'https://recipe1.ezmember.co.kr/cache/recipe/2023/08/16/d7e2a61725bf67d59bca0318975b87de1.jpg'}, {'step_number': 5, 'description': '준비된 밥에 참기름 1T와 소금1t를 넣고 밑간을 해주세요.', 'image_url': 'https://recipe1.ezmember.co.kr/cache/recipe/2023/08/16/b5e95ea5535cf85bf31cc6c38712e8dd1.jpg'}, {'step_number': 6, 'description': '밥을 한 입 크기로 말아주세요.\n배춧잎이 크다면 밥 양을 늘려서 싸주시고 반 잘라 드시면 좋아요.\u200b\u200b', 'image_url': 'https://recipe1.ezmember.co.kr/cache/recipe/2023/08/16/8a048ffbc0b437d29a7a93d9e0f6f1141.jpg'}, {'step_number': 7, 'description': '배춧잎은 물기를 잘 제거해 주시고 한 장 넓게 펴주세요.\n물기를 최대한 제거해 주셔야 해요.', 'image_url': 'https://recipe1.ezmember.co.kr/cache/recipe/2023/08/16/721022ae6c5a5d62ea046499b6d1c4971.jpg'}, {'step_number': 8, 'description': '줄기 부분에 밥을 얹어 주세요 쌈장을 배춧잎에 발라주세요.', 'image_url': 'https://recipe1.ezmember.co.kr/cache/recipe/2023/08/16/541115789d2e1680261deb6e32c3fcba1.jpg'}, {'step_number': 9, 'description': '줄기 부분부터 말아 주세요.', 'image_url': 'https://recipe1.ezmember.co.kr/cache/recipe/2023/08/16/ccf2eafb6a918e7d714434229e4373df1.jpg'}, {'step_number': 10, 'description': '돌돌돌 잎을 펴가며 말아주세요.', 'image_url': 'https://recipe1.ezmember.co.kr/cache/recipe/2023/08/16/77faf00d751d836135b4d752a0a1b1f31.jpg'}, {'step_number': 11, 'description': '속 재료가 삐져나오지 않게 돌돌 말아서 마무리해 주세요. 윗면에 쌈장이 보이면 더 맛깔 스럽습니다. 밥속에 쌈장을 넣기도 해요. 편한 방법을 선택해 보세요.', 'image_url': 'https://recipe1.ezmember.co.kr/cache/recipe/2023/08/16/d4f66536b41d3f091264a8d6e469b6561.jpg'}, {'step_number': 12, 'description': '물방울 모양 쌈밥도 만들어 봤어요 배추 줄기 부분을 짧게 잘라주세요.', 'image_url': 'https://recipe1.ezmember.co.kr/cache/recipe/2023/08/16/3c72260dbe92eb63b49e5b5fb2d802171.jpg'}, {'step_number': 13, 'description': '사진과 같이 배추 줄기 부분의 모양이 만들어 주세요.가위를 이용하시면 편해요.', 'image_url': 'https://recipe1.ezmember.co.kr/cache/recipe/2023/08/16/493d9a35a75575d1e28ef887d420c09f1.jpg'}, {'step_number': 14, 'description': '배추잎 부분에 한입크기의 밥을 올려주세요.', 'image_url': 'https://recipe1.ezmember.co.kr/cache/recipe/2023/08/16/63517ffe2979461a82718f9dc89a56dd1.jpg'}, {'step_number': 15, 'description': '배추잎을 넓게 펴서 속안의 밥이 안보이게 감싸주세요.', 'image_url': 'https://recipe1.ezmember.co.kr/cache/recipe/2023/08/16/7dd4769352e9cbc991d602c2f9be6bdc1.jpg'}, {'step_number': 16, 'description': '줄기 부분을 깔끔하게 잘라주세요. 데친 깻잎도 같은 방법으로 말아주시면 포인트도 되고 맛도 좋고 예뻐요.', 'image_url': 'https://recipe1.ezmember.co.kr/cache/recipe/2023/08/16/0b539e4b3129357599b964066f4a1fb21.jpg'}, {'step_number': 17, 'description': '접시에 예쁘게 담아주시면 근사한 배추, 깻잎 쌈밥이 됩니다.', 'image_url': 'https://recipe1.ezmember.co.kr/cache/recipe/2023/08/16/6f49408df25d9287d5b4dba2410c821e1.jpg'}]"
76241,밥/죽/떡,초스피드,채소류,삶기,실패 없는 콩나물밥 만들기 : 일반 마트용 콩나물 사용,콩나물밥,https://recipe1.ezmember.co.kr/cache/recipe/2017/09/24/ab50510a8ca22b3091876ca1e77289a21.jpg,"4,665",30분 이내,아무나,4인분,"[('콩나물', '1봉지'), ('계란후라이', '인원수대로'), ('밥                                                                                인원별', ''), ('간장', '1.5스푼'), ('맛술', '2스푼'), ('다진마늘', '1스푼'), ('고춧가루', '1/2스푼'), ('참기름', '1스푼'), ('통깨', '1/2스푼'), ('다진파', '1스푼')]","콩나물밥은 비교적 간단해 보이죠? 밥 지을 때 씻은 콩나물을 위에 올려서 취사 버튼을 누르면 될 것이라고 생각했어요. 이렇게 하면 밥솥을 열었는데 까무러친다고 하네요.
콩나물이 실처럼 얇게 쪼그라져 있고, 아삭아삭한 맛이 하나도 없다고 해요. 밥솥에 같이 찌려면 해물찜에 넣는 두꺼운 콩나물을 사용해야 한다네요. 그래서 마트용 콩나물로 만드는 레시피를 알려드리도록 하겠습니다.","[{'step_number': 1, 'description': '먼저 상한 콩나물 머리나 꼬리를 다듬어서 물에 깨끗이 씻어요.', 'image_url': 'https://recipe1.ezmember.co.kr/cache/recipe/2017/09/24/e357154a56cdebcb839da69aa93bae791.jpg'}, {'step_number': 2, 'description': '소금 1스푼을 넣고 끓는 물에 콩나물을 넣고 데쳐줍니다.끓인 콩나물물은 버리지 말아요!!', 'image_url': 'https://recipe1.ezmember.co.kr/cache/recipe/2017/09/24/eff0a1f9bf03e446405d28fea620e5e41.jpg'}, {'step_number': 3, 'description': '밥 할 때 콩나물 데친물을 넣어주면 콩나물의 깊은 맛을 느낄 수 있답니다.\n저는 생각도 못하고 검은 콩을 넣었어요 ㅠㅠ 콩콩나물밥이 되었답니다..', 'image_url': 'https://recipe1.ezmember.co.kr/cache/recipe/2017/09/24/f1a6d9c95fbf1f8c5c2f0258ee59469d1.jpg'}, {'step_number': 4, 'description': '콩나물 물로 지은 밥 완성! 굳이 밥을 새로 짓지 않아도 상관없어요.', 'image_url': 'https://recipe1.ezmember.co.kr/cache/recipe/2017/09/24/c9607261611aeb3890456ebadafecd311.jpg'}, {'step_number': 5, 'description': '데친 콩나물은 체에 받쳐 물기를 제거하구요.', 'image_url': 'https://recipe1.ezmember.co.kr/cache/recipe/2017/09/24/0c1157ffe227bd173f162d21a17c8fa71.jpg'}, {'step_number': 6, 'description': '밥을 그릇에 담아냅니다.\n밤을 넣어서 더욱 건간해 보이는..', 'image_url': 'https://recipe1.ezmember.co.kr/cache/recipe/2017/09/24/3721dccf2f70693ac2caea4ddaae16fa1.jpg'}, {'step_number': 7, 'description': '밥 위에 데쳐서 물기를 제거한 콩나물을 올려주어요.\n이렇게 마트용 콩나물은 얇기 때문에 밥 따로 콩나물 따로 조리를 해야한답니다.', 'image_url': 'https://recipe1.ezmember.co.kr/cache/recipe/2017/09/24/1478648853992224a5adc32e4c9725301.jpg'}, {'step_number': 8, 'description': '양념장 레시피대로 양념장을 만듭니다.\n(간장 1.5스푼, 맛술 2스푼, 다진마늘 1스푼, 고춧가루 반스푼, 참기름 1스푼, 통깨 반스푼, 다진파 1스푼)', 'image_url': 'https://recipe1.ezmember.co.kr/cache/recipe/2017/09/24/748090f2ed64c4f7174414477cf9b8351.jpg'}, {'step_number': 9, 'description': '계란 후라이로 단백질을 보충하면 더욱 좋지요. 양념장을 위에 솔솔 뿌리고 비벼서 맛있게 먹으면 돼요.', 'image_url': 'https://recipe1.ezmember.co.kr/cache/recipe/2017/09/24/edfc87d3a401bd1a412d291dfe74181f1.jpg'}, {'step_number': 10, 'description': '오늘의 건강식 \n콩나물밥과 그냥 집반찬들 입니다.', 'image_url': 'https://recipe1.ezmember.co.kr/cache/recipe/2017/09/24/7f734a00dacb07ed09d3d3d24734d04b1.jpg'}]"
