index,종류별,상황별,재료별,방법별,글 제목,레시피이름,레시피이미지,조회수,조리시간,난이도,인분,재료,소개글,조리순서
151569,양념/잼/소스,일상,돼지고기,볶음,약고추장 볶음고추장 만들기 /소고기 약고추장 황금레시피/ 돼지고기 약고추장 만드는법,약고추장,https://recipe1.ezmember.co.kr/cache/recipe/2024/09/28/3358451f713b64e3d1144aa02d54159d1.jpg,133,None,None,None,"[('간돼지고기                                                                                또는 구이용 돼지고기 아무거나', '150g'), ('대파', '50g'), ('양파                                                                                중간거 120g', '1/2개'), ('청양고추', '2개'), ('식용유                                                                                10g 삼겹살 사용시 1스푼만', '2스푼'), ('고추가루                                                                                입자가 최대한 고운걸로 7g', '1스푼'), ('설탕                                                                                20g', '2스푼'), ('간마늘                                                                                10g', '1/2스푼'), ('진간장                                                                                8g', '1스푼'), ('미림                                                                                 24g', '3스푼'), ('물엿                                                                                20g', '2스푼'), ('고추장                                                                                 90g', '3스푼'), ('시판 재래된장                                                                                 10g', '1/3스푼'), ('굴소스                                                                                12g', '1스푼'), ('참기름                                                                                 5g', '1스푼')]","고추장으로 밥도둑을 만든다면 볶음고추장을 빼먹을수 없요. 작은거 한통 만들어도 쌈장 대용, 밥비비기, 김밥 속재료 등등 무한 활용 가능합니다. ​ 오늘은 비싼 소고기말고 저렴한 돼지고기로 만들지만 소고기만큼 맛있고 입맛 살려주는 돼지고기 약고추장 만들어 봤습니다!","[{'step_number': 1, 'description': '대파큰거 굵은 몸통 위주로 반대 대략 50g을 준비하세요. 100원짜리 동전 굵기로 한뼌 정도면 대략 50g이 나옵니다.대파는 어슷어슷 대충 대충 썰어준 다음에 너무 잘게 다질 필요 없이 3~4번만 다져주세요.대파 손질법', 'image_url': 'https://recipe1.ezmember.co.kr/cache/recipe/2024/09/30/fa4bac7e76e65fd65edf5faacae547a31.jpg'}, {'step_number': 2, 'description': '양파중간거 반개를 볶음밥에 들어가는 양파처럼 잘게잘게 다져주세요.도마 , 조리용나이프', 'image_url': 'https://recipe1.ezmember.co.kr/cache/recipe/2024/09/30/e7e5f5ad4fb6c8273091c7a6aa7ee3931.jpg'}, {'step_number': 3, 'description': '땡초가 들어가면 볶음고추장에 알싸한 매운맛이 확 올라갑니다. 2개 정도 다져주시고 매운 식감 좋아하시면 3~4개를 다져주시고 고추씨는 기호에 따라 제거하세요.', 'image_url': 'https://recipe1.ezmember.co.kr/cache/recipe/2024/09/30/00b210c17d485152174d634d4581d4811.jpg'}, {'step_number': 4, 'description': '양념장을 만들때 고추가루는 입자가 너무 굵은거 말고 중간입자 정도 되는거 쓰시고 매운거 좋아하시면 땡초가루와 일반 고추가루를 반반 섞어보세요.볼 , 스푼', 'image_url': 'https://recipe1.ezmember.co.kr/cache/recipe/2024/09/30/b201a13114953b8e994cb20e1814230a1.jpg'}, {'step_number': 5, 'description': '설탕은 살짝 깍아서 넣어주세요. 황설탕을 사용하셔도 괜찮아요.간마늘 반스푼 10g', 'image_url': 'https://recipe1.ezmember.co.kr/cache/recipe/2024/09/30/916333d888affaeb2ed6463af4d4e4501.jpg'}, {'step_number': 6, 'description': '볶을때는 양조간장보다 진간장을 사용해야 풍미가 훨씬 좋습니다.미림이 없으시면 물 3스푼과 설탕 1/3스푼으로 대체를 하거나 정종 또는 소주를 넣어보세요.', 'image_url': 'https://recipe1.ezmember.co.kr/cache/recipe/2024/09/30/3d72d0de301c1b04e8db627ab7ce70311.jpg'}, {'step_number': 7, 'description': '고추장은 어떻게 퍼냐에 따라 무게 편차가 심하니 너무 고봉으로 푹! 퍼지 말고 적당히 퍼주세요. 그래야 1숟갈에 30g 정도가 나옵니다.', 'image_url': 'https://recipe1.ezmember.co.kr/cache/recipe/2024/09/30/c31f3c6e0541bc26bf02291054f603501.jpg'}, {'step_number': 8, 'description': '된장을 넣으면 구수함과 진한맛이 살아나니 빼먹지 말고 넣어주세요.', 'image_url': 'https://recipe1.ezmember.co.kr/cache/recipe/2024/09/30/48ff5644044e16e663d5410d6dddd3761.jpg'}, {'step_number': 9, 'description': '굴소스가 없으시면 소고기 다시다 1/3스푼 대략 3g 으로 대체를 해주세요. 참기름은 지금 넣으셔도 되지만 고소한 향을 확! 살리고 싶으시면 다 만든 다음에 마지막에 넣고 비벼주세요.', 'image_url': 'https://recipe1.ezmember.co.kr/cache/recipe/2024/09/30/ce75a8c72d4c89c7221f53663df5f8f21.jpg'}, {'step_number': 10, 'description': '참기름은 지금 넣으셔도 되지만 고소한 향을 확! 살리고 싶으시면 다 만든 다음에 마지막에 넣고 비벼주세요.설탕이 완전히 녹게 섞어주세요.', 'image_url': 'https://recipe1.ezmember.co.kr/cache/recipe/2024/09/30/dde4ae05ff0025716fbc5a0fdfd2292f1.jpg'}, {'step_number': 11, 'description': '팬이나 웍에 식용유 2스푼 부어서 중불로 달궈주세요.돼지고기는 간걸 사용하시면 편하지만 없으시면 앞다리살이나 삼겹살 등 기름이 적당히 있는 구이용 고기를 구워서 잘게잘게 잘라주시면 됩니다..프라이팬 , 조리용집게', 'image_url': 'https://recipe1.ezmember.co.kr/cache/recipe/2024/09/30/dc1ba15ab8c5ac0c98e60558ea5a35c41.jpg'}, {'step_number': 12, 'description': '고기 핏기가 거의 사라질때까지 볶아주세요.간고기 말고 구이용 쓰셨으면 숟가락으로 가위 끝을 막아가면서 팬을 긁지 않게 잘라주세요. 가열된 상태에서 쇠가 긁히면 팬 코팅수명이 빨리 떨어 진답니다.조리용스푼 , 조리용가위', 'image_url': 'https://recipe1.ezmember.co.kr/cache/recipe/2024/09/30/2d9d55eee428e58bf78907b8bc8506111.jpg'}, {'step_number': 13, 'description': '양파 대파를 넣고 불을 강불로 바꾸고 2분 정도를 볶아주세요.', 'image_url': 'https://recipe1.ezmember.co.kr/cache/recipe/2024/09/30/1158d4ce18b88938c5ec89bd34d4c73b1.jpg'}, {'step_number': 14, 'description': '양파가 살짝 투명해 진걸 확인 한 다음에 양념장을 전부 부어주세요.', 'image_url': 'https://recipe1.ezmember.co.kr/cache/recipe/2024/09/30/ee8e9e0c48e8e1a2725a99b9a7227d611.jpg'}, {'step_number': 15, 'description': '양념이 빨리 탈수도 있으니 불을 중불로 바꾸고 2분 정도를 볶아주세요.청양고추를 넣고 30초 정도만 볶아주세요. 고추는 오래 볶으면 알싸한 매운맛이 반감 될수있으니 짧게 볶아주세요.', 'image_url': 'https://recipe1.ezmember.co.kr/cache/recipe/2024/09/30/bc6b10505b2abe3b0bdd0f315e6060191.jpg'}, {'step_number': 16, 'description': '통깨는 기호에 따라 뿌려주세요.밥에 볶음고추장을 비벼서 그냥 드셔도 맛있습니다.', 'image_url': 'https://recipe1.ezmember.co.kr/cache/recipe/2024/09/30/edd412e816dc4231f2638c71b6b073971.jpg'}, {'step_number': 17, 'description': '별미로 드시려면 김위에 계란구워 올리고 양념에 비빈밥을 펴올리고 먹다남은 단무지 적당히 올려주고 돌돌돌 말아 먹으면', 'image_url': 'https://recipe1.ezmember.co.kr/cache/recipe/2024/09/30/1a7f28765d6ef45177e9f8888e4f9e131.jpg'}, {'step_number': 18, 'description': '매콤한 땡초김밥이 됩니다!도마 , 조리용나이프', 'image_url': 'https://recipe1.ezmember.co.kr/cache/recipe/2024/09/30/c7d319a81cff204994f65ad651b157681.jpg'}, {'step_number': 19, 'description': '여러가지로 유용하게 이것저것 해먹을수 있는 볶음고추장! 한통씩 만들어 놓고 즐겨보세요!', 'image_url': 'https://recipe1.ezmember.co.kr/cache/recipe/2024/09/30/b23b4ddfde4173e837b5997e99af76301.jpg'}]"
151570,양념/잼/소스,일상,돼지고기,볶음,돼지고기 약고추장 만드는법,돼지고기약고추장,https://recipe1.ezmember.co.kr/cache/recipe/2023/04/11/d4bb817d3dd44cdae9e160f04fc76a1a1.jpg,689,15분 이내,아무나,2인분,"[('돼지고기다짐육', '150g'), ('청양고추', '2개'), ('파', '10cm'), ('다진마늘', '1스푼'), ('식용유', '3스푼'), ('고추장', '3스푼'), ('미림', '1스푼'), ('설탕', '1.5스푼'), ('올리고당', '1/2스푼'), ('참기름', '1/2스푼'), ('깨', '1스푼'), ('후추', '1티스푼')]","명절지나고 나면 항상 남는 나물들.. 그냥 먹기 질릴때쯤 약고추장 만들어서 나물과 함게 비벼먹으면 정말 꿀맛이죠!! 나물이 없더라도 그냥 밥에 비벼먹어도 너무 맛있는 오늘의 요리 "" 돼지고기 약고추장"" 만들어보아요.","[{'step_number': 1, 'description': '청양고추와 파는 송송 썰어 준비해요.청양고추, 파', 'image_url': 'https://recipe1.ezmember.co.kr/cache/recipe/2023/04/11/7ab1678dbe82fba65ceeee1b239b37bb1.jpg'}, {'step_number': 2, 'description': '달군 웍에 식용유 2스푼과 다진마늘 1스푼을 넣고 볶아요.식용유 2스푼, 다진마늘 1스푼중불', 'image_url': 'https://recipe1.ezmember.co.kr/cache/recipe/2023/04/11/be200c8b479ace117f94613b9366cc411.jpg'}, {'step_number': 3, 'description': '마늘향이 올라오면 청양고추와 파를 넣고 볶아요.청양고추, 파중불', 'image_url': 'https://recipe1.ezmember.co.kr/cache/recipe/2023/04/11/583be97b9349bdf6e1ad1fdd6dd534301.jpg'}, {'step_number': 4, 'description': '어느정도 볶아지면 다진 돼지고기 150g을 넣고 잘 볶아요.다진 돼지고기150g중불', 'image_url': 'https://recipe1.ezmember.co.kr/cache/recipe/2023/04/11/ce4ede925190bd8cd2942e466cf839a61.jpg'}, {'step_number': 5, 'description': '뭉치지 않도록 잘 펼치면서 볶다가 미림1스푼을 넣고 볶아요.미림 1스푼약불', 'image_url': 'https://recipe1.ezmember.co.kr/cache/recipe/2023/04/11/d3e083664efc2355c6bc0263ec874c3f1.jpg'}, {'step_number': 6, 'description': '돼지고기가 다 익으면 고추장3스푼을 넣고 타지 않게 잘 볶아요.고추장 3스푼약불', 'image_url': 'https://recipe1.ezmember.co.kr/cache/recipe/2023/04/11/8bc573383f3b1f4d79054054343637e61.jpg'}, {'step_number': 7, 'description': '물이 들어가지 않아 타지 않게 약불로 자작하게 볶아요.약불', 'image_url': 'https://recipe1.ezmember.co.kr/cache/recipe/2023/04/11/8ad75fb21609efe8cc8fd69fa69d8cfa1.jpg'}, {'step_number': 8, 'description': '고추장이 잘 펼쳐지고 볶아지면 설탕1스푼반을 넣어요.설탕 1스푼반약불', 'image_url': 'https://recipe1.ezmember.co.kr/cache/recipe/2023/04/11/578641f3af917710c7d7b2dae0a226731.jpg'}, {'step_number': 9, 'description': '깨1스푼, 후추 약간을 넣고 타지 않게 5분정도 볶아요. 깨 1스푼, 후추 약간약불', 'image_url': 'https://recipe1.ezmember.co.kr/cache/recipe/2023/04/11/16604ba51c4c61bc378eb26d886001601.jpg'}, {'step_number': 10, 'description': '다볶아진 돼지고기 고추장에 올리고당 반스푼, 참기름 반스푼을 넣고 볶아요.올리고당 반스푼, 참기름 반스푼약불', 'image_url': 'https://recipe1.ezmember.co.kr/cache/recipe/2023/04/11/47cb37b565a8be7dec90ff293cdba4061.jpg'}, {'step_number': 11, 'description': '윤기가 자르륵 다진돼지고기를 넣은 약고추장 완성됐어요. 청양고추가 들어가서 매콤함과 달달함이 너무 맛있어요.', 'image_url': 'https://recipe1.ezmember.co.kr/cache/recipe/2023/04/11/25626ea731f6e6af583c0459a668e19a1.jpg'}]"
151571,양념/잼/소스,일상,돼지고기,볶음,돼지고기볶음양념장 (찌개용 양념장),돼지고기볶음양념장,https://recipe1.ezmember.co.kr/cache/recipe/2022/09/07/32ca5a32df9277f3524b1ce77ee09f621.jpg,630,20분 이내,초급,6인분 이상,"[('돼지고기 다짐육', '200g'), ('대파', '1대'), ('양파', '1개'), ('다진 마늘', '3T'), ('참기름', '4T'), ('식용유', '4T'), ('고춧가루', '200ml'), ('진간장', '4T'), ('국간장', '4T'), ('소금', '2T')]","돼지고기 다짐육을 이용한 찌개용 양념장입니다
순두부찌개 끓일때 가장 잘 어울리는 데 호박이나 버섯넣고 끓이는 찌개에도 사용해도 좋습니다","[{'step_number': 1, 'description': '양파 1개는 잘게 다지고 대파 1대는 송송 썰어준다', 'image_url': 'https://recipe1.ezmember.co.kr/cache/recipe/2022/09/07/c894e023c7026473694c15cbe8b7ca571.jpg'}, {'step_number': 2, 'description': '팬에 참기름 4T, 식용유 4T, 대파를 넣고 볶아준다센불', 'image_url': 'https://recipe1.ezmember.co.kr/cache/recipe/2022/09/07/de2be995ce39260cb6f3b138a495ba351.jpg'}, {'step_number': 3, 'description': '대파가 기름에 끓듯이 볶아준다센불', 'image_url': 'https://recipe1.ezmember.co.kr/cache/recipe/2022/09/07/aeeb52a0bc0ef274c430af73a7087b461.jpg'}, {'step_number': 4, 'description': '돼지고기 다짐육을 넣고 볶아준다센불', 'image_url': 'https://recipe1.ezmember.co.kr/cache/recipe/2022/09/07/764d7b2ec073636b47eaa548050375eb1.jpg'}, {'step_number': 5, 'description': '돼지고기가 익으면 잘게 다진 양파를 넣어준다중불', 'image_url': 'https://recipe1.ezmember.co.kr/cache/recipe/2022/09/07/202ea30ad964b98b1dbf2e20b685d00a1.jpg'}, {'step_number': 6, 'description': '다진 마늘 3T, 소금 2T를 넣고 볶아준다중불', 'image_url': 'https://recipe1.ezmember.co.kr/cache/recipe/2022/09/07/8a4497c50c347234be67986fec46c8131.jpg'}, {'step_number': 7, 'description': '고춧가루 200ml를 넣고 볶아준다중불', 'image_url': 'https://recipe1.ezmember.co.kr/cache/recipe/2022/09/07/ce99bc009ff35d202160f01c3985a6651.jpg'}, {'step_number': 8, 'description': '진간장 4T, 국간장 4T를 넣고 볶아준다중불', 'image_url': 'https://recipe1.ezmember.co.kr/cache/recipe/2022/09/07/1e0823fb6851a8c1512ca9e4d483165e1.jpg'}, {'step_number': 9, 'description': '재료가 타지않게 저어주면서 볶아준다중불', 'image_url': 'https://recipe1.ezmember.co.kr/cache/recipe/2022/09/07/3663c1b7d3a2a6a6608556e11cd214111.jpg'}]"
151572,양념/잼/소스,일상,돼지고기,볶음,"밥도둑 ""볶음 고추장/만능 볶음 고추장/만능 비빔장/약고추장"" 만들기(feat.다진 돼지고기)",볶음고추장,https://recipe1.ezmember.co.kr/cache/recipe/2020/06/17/3e30e5c28095f34be1159ead77b90dc71.jpg,"10,922",30분 이내,아무나,4인분,"[('다진 돼지고기', '300g'), ('양파', '1개'), ('청양고추', '3개'), ('다진마늘', ''), ('고추장', ''), ('설탕', ''), ('간장', ''), ('올리고당', ''), ('후추', ''), ('맛술', ''), ('통깨', '')]","오늘은 뭐 먹지 하다가 매콤한 게 땡겨서 볶음 고추장을 만들어 먹었어요.
흔히들 알고 있는 약고추장이라고 하죠~
맨밥에, 쌈에, 김에, 달걀 프라이에 어디에든 잘 어울리는 만능 고추장!
오랜만에 만들어 먹는데 너무 맛있더라구요.","[{'step_number': 1, 'description': '돼지고기 다짐육은 해동해주세요.', 'image_url': 'https://recipe1.ezmember.co.kr/cache/recipe/2020/06/17/5e50daf2f041887b3f7336bd3c2c9fe31.jpg'}, {'step_number': 2, 'description': '양파 1개와 청양고추(생략가능) 3개는 다져서 준비해 줍니다.청양고추를 반갈라 씨를 털어줬어요.고추는 씨를 빼주면 덜 맵답니다.\n(매운거 못드시는 분들은 청양고추는 생략해주세요.)', 'image_url': 'https://recipe1.ezmember.co.kr/cache/recipe/2020/06/17/212474bf0a05453a50ac5e3068d4e5d71.jpg'}, {'step_number': 3, 'description': '기름 넉넉히 충분히 두르시고 가열한 팬에 다진 양파랑 다진 마늘(3 큰 술)을 넣고 양파가 노릇노릇해질 때까지 볶아주세요.', 'image_url': 'https://recipe1.ezmember.co.kr/cache/recipe/2020/06/17/7223e6c4b63f3c64d6b74904f20e8ed31.jpg'}, {'step_number': 4, 'description': '양파가 노릇노릇해졌으면 고기를 투척해주고, 고기에 혹시 모를 잡내 제거를 위해 후추를 톡톡 미림이나 맛술도 한 숟갈 넣어서 볶아줍니다.', 'image_url': 'https://recipe1.ezmember.co.kr/cache/recipe/2020/06/17/9321694decd18e45c23fdde94fe90d391.jpg'}, {'step_number': 5, 'description': '돼지고기가 뭉치지 않게 주걱 날 끝을 세워서 다지듯이 볶아주세요.', 'image_url': 'https://recipe1.ezmember.co.kr/cache/recipe/2020/06/17/215eeabbeb31bfd913cf2861024b27d41.gif'}, {'step_number': 6, 'description': '고기가 적당히 익었으면 고추장을 이렇게 듬~뿍 숟가락에 넘칠 정도로 5 큰 술 넣어주세요.', 'image_url': 'https://recipe1.ezmember.co.kr/cache/recipe/2020/06/17/3d10ec732f2a4d85d0d10e4f26444a6c1.jpg'}, {'step_number': 7, 'description': '간장 2 큰 술과 설탕 1 큰 술도 넣어주고\n썰어놓은 청양고추도 지금 넣어 골고루 잘 섞이도록 볶아주세요.', 'image_url': 'https://recipe1.ezmember.co.kr/cache/recipe/2020/06/17/ab151ca22ea63f29805acc99586541931.jpg'}, {'step_number': 8, 'description': '요렇게 양념도 골고루 잘 볶아졌으면 마지막으로 불을끄고 통깨솔솔 올리고당 한바퀴 휙 둘러서 한번 더 섞어주면 완성입니다.올리고당은 센불에 가열하면 단맛이 사라진답니다.', 'image_url': 'https://recipe1.ezmember.co.kr/cache/recipe/2020/06/17/a0537b10a66e7daf6865714d283070741.jpg'}]"
151573,양념/잼/소스,일상,돼지고기,볶음,밥이랑만 먹어도 맛있는 [비빔밥 비빔양념],비빔밥,https://recipe1.ezmember.co.kr/cache/recipe/2023/10/10/cd8053915daeeaa192f32cd637c212191.jpg,444,30분 이내,아무나,6인분 이상,"[('돼지고기 다짐육', '1kg'), ('양파', '2개'), ('고추장', '600g'), ('소금', '100g'), ('설탕', '100g'), ('후추', '100g'), ('미림', '100ml'), ('식용유', '100ml'), ('다시다', '100g'), ('참기름', '200ml'), ('참깨', '100g')]",안녕하세요! 이급식입니다. 오늘은 고추장에 고기를 넣어 비빔밥에 넣어 먹는 비빔 소스를 만들겠습니다. ​ 그럼 밥하러 가! 보시죠!,"[{'step_number': 1, 'description': '팬에 기름을 넣고 다짐육과 후추, 소금을 넣고 볶아 줍니다.', 'image_url': 'https://recipe1.ezmember.co.kr/cache/recipe/2023/10/10/093f87ba4e0c76f9c50b7c6d719690b81.jpg'}, {'step_number': 2, 'description': '고기가 익으면 준비한 고추장과 설탕, 미림, 다시다를 넣고 더 볶아 줍니다.', 'image_url': 'https://recipe1.ezmember.co.kr/cache/recipe/2023/10/10/324b93ae4e7295a4ea04cb490617d6b21.jpg'}, {'step_number': 3, 'description': '양파는 다져서 넣어 주고 참기름, 깨를 넣고 마무리합니다', 'image_url': 'https://recipe1.ezmember.co.kr/cache/recipe/2023/10/10/2d83721340777c395c5dabd27ed1d6cc1.jpg'}]"
