index,종류별,상황별,재료별,방법별,글 제목,레시피이름,레시피이미지,조회수,조리시간,난이도,인분,재료,소개글,조리순서
56189,디저트,간식,닭고기,볶음,고구마무스 닭가슴살볶음,None,https://recipe1.ezmember.co.kr/cache/recipe/2015/06/05/3dd58f7ac08725e39b4245987cbac275.jpg,"29,053",None,None,None,[],,[]
56190,디저트,간식,닭고기,볶음,인삼닭말이 더운 여름을 위한 인삼요리,인삼닭말이,https://recipe1.ezmember.co.kr/cache/recipe/2019/06/18/429eacd57963699869d30b1871cef74e1.jpg,634,30분 이내,초급,2인분,"[('인삼', '1뿌리'), ('닭안심살', '4개'), ('우유                                                                                닭잠길 정도', ''), ('소금', '1꼬집'), ('후추', '톡톡'), ('파프리카', '조금'), ('양파', '1/2개'), ('스테이크소스', '3T'), ('굴소스', '1T'), ('케첩', '2T'), ('간 마늘', '0.5T'), ('올리고당', '2T'), ('버터', '0.5T'), ('기름', '조금')]","제가 삼계탕이나 백숙을 할 때마다 양쪽 집안에서 주신 삼이 많다고 했었죠.
맨날 삼계탕만 할 순 없으니 좀 다르게 해서 먹을 수 있는 인삼요리를 생각하다가 인삼닭말이를 만들어 봤어요.
찹스테이크 응용 버전이라고 할까요. ^^","[{'step_number': 1, 'description': '집에 닭가슴살이 없고 닭안심살만 있어서 있는 걸로 만들었어요.\n일단은 우유에 담가두고 다른 재료들 준비를 합니다.', 'image_url': 'https://recipe1.ezmember.co.kr/cache/recipe/2019/06/18/8a0db15376ba984e035c59b96dca9f231.jpg'}, {'step_number': 2, 'description': '인삼도 냉동실에 있는 거라서 미리 꺼내놓고 자연해동 시켰어요.', 'image_url': 'https://recipe1.ezmember.co.kr/cache/recipe/2019/06/18/eb6a1e32b77e9b74c6e653544185b3681.jpg'}, {'step_number': 3, 'description': '닭으로 말아줄 거라서 비슷한 크기로 인삼을 잘라두었어요.', 'image_url': 'https://recipe1.ezmember.co.kr/cache/recipe/2019/06/18/39ead081ae0724006229a6cf9cbd6b791.jpg'}, {'step_number': 4, 'description': '닭안심살은 가운데 칼집을 넣어서 얇게 펴줍니다.', 'image_url': 'https://recipe1.ezmember.co.kr/cache/recipe/2019/06/18/865e58921a54f41a0adbaa8e20229b701.jpg'}, {'step_number': 5, 'description': '소금과 후추로 밑간을 해준 후 썰어 놓은 인삼을 말아줄거랍니다.', 'image_url': 'https://recipe1.ezmember.co.kr/cache/recipe/2019/06/18/b1c300e61d77bb5d0320396c0fdbdde61.jpg'}, {'step_number': 6, 'description': '인삼을 품은 닭안심살이네요.\n4개밖에 안되지만 먹을땐 반으로 잘라줄거랍니다.', 'image_url': 'https://recipe1.ezmember.co.kr/cache/recipe/2019/06/18/cc615d9f436e4245144dd367ab2cc6091.jpg'}, {'step_number': 7, 'description': '이쑤시개를 꽂아서 풀리지 않게 고정 시켜준 후 찜통에 넣고 쪄줍니다.', 'image_url': 'https://recipe1.ezmember.co.kr/cache/recipe/2019/06/18/f0998a54352d805a054f0dc89b85fc531.jpg'}, {'step_number': 8, 'description': '파프리카와 양파를 적당한 크기로 잘라줍니다.\n알록달록 예쁜 인삼닭말이가 되겠죠?', 'image_url': 'https://recipe1.ezmember.co.kr/cache/recipe/2019/06/18/2b6749b37a1fcedd0adde4f3794968b31.jpg'}, {'step_number': 9, 'description': '스테이크소스 3T, 굴소스 1T, 케첩 2T, 간 마늘 0.5T, 올리고당 2T, 후추 톡톡 넣고 소스를 새콤달콤하게 만들었어요.', 'image_url': 'https://recipe1.ezmember.co.kr/cache/recipe/2019/06/18/639562184ea8eaa2d403990ccb19c71c1.jpg'}, {'step_number': 10, 'description': '버터를 넣고 인삼닭말이를 굴러가며 구워줍니다. \n버터향이 스르르~', 'image_url': 'https://recipe1.ezmember.co.kr/cache/recipe/2019/06/18/171d2f895882ff43a9fae33b50642cc21.jpg'}, {'step_number': 11, 'description': '야채들 넣고 만든 소스도 넣어주세요.', 'image_url': 'https://recipe1.ezmember.co.kr/cache/recipe/2019/06/18/0503c38fc07705110a198ce593e469b21.jpg'}, {'step_number': 12, 'description': '인삼닭말이를 이렇게 만들어봤어요. ^^', 'image_url': 'https://recipe1.ezmember.co.kr/cache/recipe/2019/06/18/bb04a8829a77aa5844d1ede2441c28dd1.jpg'}, {'step_number': 13, 'description': '썰어놓은 인삼이 남아서 기름을 넣고 바삭하게 튀겼어요.\n접시에 담을때 옆에 같이 놓아주려고요.', 'image_url': 'https://recipe1.ezmember.co.kr/cache/recipe/2019/06/18/134960ce4b6c14e3bdda715638948b201.jpg'}, {'step_number': 14, 'description': '찹스테이크 소스를 응용해서 만들긴 했는데 맛이 이상하면 어떨까 했지만 괜찮더라고요. \n인삼을 별미음식으로 만들어봤습니다.', 'image_url': 'https://recipe1.ezmember.co.kr/cache/recipe/2019/06/18/45a7f7f18dff50b66ce9229fddd79f1f1.jpg'}]"
56191,디저트,간식,닭고기,볶음,허니 치킨 아몬드,허니치킨아몬드,https://recipe1.ezmember.co.kr/cache/recipe/2015/08/23/6471f8cbae578b5500a81e575e8ab1f6.jpg,"3,031",60분 이내,초급,2인분,"[('닭다리살', '6개'), ('양파', '1/2개'), ('대파', '1/2개'), ('고추', '1개'), ('꿀', '1TS'), ('아몬드', '적당량'), ('케첩', '2Ts'), ('소주', '조금'), ('굴소스', '적당량'), ('참기름', '약간'), ('간장', '1Ts')]",치킨과 꿀이 만나 달콤하고 맛있는 허니 치킨 아몬드입니다.,"[{'step_number': 1, 'description': '케첩 2Ts, 소주 적당량, 굴소스 조금, 참기름 약간, 간장 1Ts씩을 넣고 잘 섞어주세요.', 'image_url': 'https://recipe1.ezmember.co.kr/cache/recipe/2015/08/27/d7f0ea39853689af31912e56d5af35e51.jpg'}, {'step_number': 2, 'description': '야채는 모두 다져주세요.', 'image_url': 'https://recipe1.ezmember.co.kr/cache/recipe/2015/08/27/852aa77098bb01134156f077055d2bb01.jpg'}, {'step_number': 3, 'description': '닭다릿살은 한입크기로 썰어 주세요. 전 닭다릿살을 직접 발라서 사용했어요. 마트에 닭코너에 가면 넓적다리살을 팔아요. 그거 사용하셔도 되요.', 'image_url': 'https://recipe1.ezmember.co.kr/cache/recipe/2015/08/27/cd7c2bc3c6e9e960c539bc37d7685d761.jpg'}, {'step_number': 4, 'description': '식용유를 넉넉히 두른뒤 다진 파를 넣고 볶다가 나머지 야채를 모두 넣고 볶아주세요.', 'image_url': 'https://recipe1.ezmember.co.kr/cache/recipe/2015/08/27/178b9f79b797d44ee14007b4085578061.jpg'}, {'step_number': 5, 'description': '닭다리살을 넣고 볶아주세요.', 'image_url': 'https://recipe1.ezmember.co.kr/cache/recipe/2015/08/27/8e8f4a4792935c16e7acfed3890726ec1.jpg'}, {'step_number': 6, 'description': '닭고기가 반 정도 익으면 물 4큰술을 넣고 뚜껑을 덮어 고기가 완전히 익을때 까지 익혀주세요.', 'image_url': 'https://recipe1.ezmember.co.kr/cache/recipe/2015/08/27/c81063211de73bb28166a90f1987bc3f1.jpg'}, {'step_number': 7, 'description': '고기가 완전히 익으면 소스재료를 넣고 소스가 자작하게 끓여질때까지 끓여주세요.', 'image_url': 'https://recipe1.ezmember.co.kr/cache/recipe/2015/08/27/31ac41ce897f10205f2f343e9717ef441.jpg'}, {'step_number': 8, 'description': '꿀과 아몬드를 넣고 섞어준후 불에서 내려주세요.', 'image_url': 'https://recipe1.ezmember.co.kr/cache/recipe/2015/08/27/6dc5a0f7944a73a0f85e7e6298e3a8ab1.jpg'}]"
56192,디저트,간식,닭고기,볶음,홍삼 치킨 강정,홍삼치킨강정,https://recipe1.ezmember.co.kr/cache/recipe/2015/06/30/3757923d10543e36ad4327ddc3338b29.jpg,"2,745",60분 이내,초급,2인분,"[('닭가슴살', '200g'), ('전분', '2큰술'), ('허브솔트                                                                                소금+후추', '1작은술'), ('홍삼분', '1g'), ('토마토케첩', '2큰술'), ('홍삼밀원', '1큰술'), ('포도씨유', '1큰술'), ('맛술', '1큰술'), ('다진마늘', '1큰술'), ('간장', '1큰술'), ('', ''), ('물엿', '1큰술'), ('홍삼슬라이스 다진것', '1큰술')]",오늘은 어린이날 아이들에게 해주면 좋을 영양듬뿍 홍삼치킨강정을 소개합니다~ 닭가슴살을 아이들이 먹기좋게 잘라 홍삼을 넣어 달콤새콤하게 한개씩 콕콕 찍어 먹기 좋답니다~ 어린이날 아이들 간식으로도 좋은 홍삼치킨강정 만나보세요~,"[{'step_number': 1, 'description': '닭가슴살,홍삼분,홍삼밀원을 준비해주시고 닭가슴살을 한입크기로 썰어 볼에 넣고 허브솔트,포도씨유를 넣어주세요.', 'image_url': 'https://recipe1.ezmember.co.kr/cache/recipe/2015/06/30/2b602e62fe032767fa906042a7c7930c1.jpg'}, {'step_number': 2, 'description': '홍삼가루를 넣어 30분정도 재워주신후에 전분가루를 넣어 섞어주세요.', 'image_url': 'https://recipe1.ezmember.co.kr/cache/recipe/2015/06/30/42dd354cb6b3fd3985856bc771a7947c1.jpg'}, {'step_number': 3, 'description': '오븐팬에 전분가루 묻힌 닭가슴살을 놓고 예열오븐 180도 20~25분 구워주세요.오븐', 'image_url': 'https://recipe1.ezmember.co.kr/cache/recipe/2015/06/30/0d3e767f1c2937fb06220cbb55ef6a941.jpg'}, {'step_number': 4, 'description': '홍삼슬라이스는 잘게 잘라주세요. 홍삼슬라이스는 생략하실수 있어요~', 'image_url': 'https://recipe1.ezmember.co.kr/cache/recipe/2015/06/30/82ff23a98ae7b00e911c609581d59fbb1.jpg'}, {'step_number': 5, 'description': '노릇노릇하게 구워지면 오븐에서 꺼내주시구요 팬에 기름을 두르고 다진마늘을 넣어 마늘향이 날때까지 볶아주세요 .', 'image_url': 'https://recipe1.ezmember.co.kr/cache/recipe/2015/06/30/44fe7bee3859c6c669adfec33fc503681.jpg'}, {'step_number': 6, 'description': '물엿을 제외한 소스재료를 모두넣어 섞어 보글보글 끓여주세요.', 'image_url': 'https://recipe1.ezmember.co.kr/cache/recipe/2015/06/30/1f970994fb56f1e70b66fc533ea5b03c1.jpg'}, {'step_number': 7, 'description': '구워놓은 닭가슴살을 넣고 마지막에 물엿을 넣어 재빨리 섞어주시면 완성입니다~', 'image_url': 'https://recipe1.ezmember.co.kr/cache/recipe/2015/06/30/b58b5340f0bc19d1ef7742f9a189eb911.jpg'}]"
56193,디저트,간식,닭고기,볶음,치팅데이 하는 날 닭가슴살 넣은 콘치즈 만들어 먹었어요.,닭가슴살콘치즈,https://recipe1.ezmember.co.kr/cache/recipe/2023/05/03/a72c9be24f2d86eeae6669b98a71a8241.jpg,540,30분 이내,초급,4인분,"[('옥수수캔', '1개'), ('모짜렐라치즈', '200g'), ('닭가슴살', '200g'), ('양파', '1/2개'), ('당근', '1/2개'), ('피망', '1/2쪽'), ('가염버터', '1조각'), ('마요네즈', '2수저'), ('스테비아', '1수저'), ('소금', '약간'), ('파슬리가루', '약간')]",살 빠지는 레시피로 다이어트 중인 루나에요. 치팅데이(Cheating Day)는'(몸을) 속인다'라는 뜻의 'Cheating'과 '날(日)'이라는 뜻의 'Day'가 합성되어 만들어진 용어입니다. 식단 조절 중 부족했던 탄수화물을 보충하기 위해 1~2주에 한 번 정도 먹고 싶었던 음식을 먹는 날을 뜻하는 말이에요. 평소에 먹고 싶은 게 많지만 참아야 하고 배고픔이 있지만 견뎌야 하기 때문에 스트레스가 쌓여 화도 나고 짜증까지 날 수밖에 없는데요 다이어트 때문에 지친 마음을 달래줄 치팅데이! 먹고 싶은 음식이 계속 생각나면 저는 치팅데이날 꼭 먹어요. 쭈~~~욱 늘어나는 콘치즈가 그렇게 먹고 싶었다는... 근데 또 양심은 있어서 콘치즈에 닭가슴살을 넣어 보았어요. 치즈 쭉~쭉! 늘어나게 만들러 가볼까요?,"[{'step_number': 1, 'description': '캔 옥수수는 안에 물기를 빼주기 위해 체반에 밭쳐 놓으세요.', 'image_url': 'https://recipe1.ezmember.co.kr/cache/recipe/2023/05/03/9606bd7e1198be213698d6c480442f181.jpg'}, {'step_number': 2, 'description': '양파, 피망, 당근은 옥수수 크기로 다져서 준비해 주세요. 파프리카가 있다면 파프리카 빨간색 넣으면 더 영양가도 좋고 이쁠듯해요. 파프리카가 없으면 저처럼 집에 있는 채소로 활용하시면 됩니다.', 'image_url': 'https://recipe1.ezmember.co.kr/cache/recipe/2023/05/03/5884c8ef1c9c4c4b6061d61986f16dcf1.jpg'}, {'step_number': 3, 'description': '닭가슴살은 가위로 싹둑싹둑 잘라주었어요. 닭가슴살은 가위로 잘라야 좋더라고요.', 'image_url': 'https://recipe1.ezmember.co.kr/cache/recipe/2023/05/03/b43c751258b9fb3af827eacfa93b9f461.jpg'}, {'step_number': 4, 'description': '예열된 팬에 버터를 녹여주고 오랜만에 집안에 버터 향이 가득하니 행복해지면서 기분이 좋아지는 거 있죠. 잘라놓은 채소 넣고', 'image_url': 'https://recipe1.ezmember.co.kr/cache/recipe/2023/05/03/ab28f834a7281e1af2981721e05ef6d61.jpg'}, {'step_number': 5, 'description': '닭가슴살, 옥수수 콘을 넣어서 볶아주세요. 단맛을 위해 스테비아 넣었어요. 소금도 넣어주고 마요네즈 듬뿍 넣고 싶었지만 2숟갈 넣어 주었어요.', 'image_url': 'https://recipe1.ezmember.co.kr/cache/recipe/2023/05/03/ee0c8b397b24ec8fb705a2006980c18b1.jpg'}, {'step_number': 6, 'description': '채소들이 볶아지면 오븐 용기에 담아주세요. 저는 두 번 나누어서 오븐에 구워 줄 거라 반만 그릇에 담았어요. 모차렐라 치즈 골고루 올려줍니다.', 'image_url': 'https://recipe1.ezmember.co.kr/cache/recipe/2023/05/03/b6fa70af74f8ffc71ee9770a6d8117f01.jpg'}, {'step_number': 7, 'description': '오븐 온도는 180도 5분 정도 돌려줬어요. 모두가 볶아서 만드는 거라서 치즈가 잘 녹을 정도만 돌리면 됩니다. 오븐에 꺼내면 고소한 닭가슴살콘치즈 완성!', 'image_url': 'https://recipe1.ezmember.co.kr/cache/recipe/2023/05/03/94a3ea40cb38ce60ecf9b0fac5f158431.jpg'}]"
