index,종류별,상황별,재료별,방법별,글 제목,레시피이름,레시피이미지,조회수,조리시간,난이도,인분,재료,소개글,조리순서
44473,메인반찬,명절,해물류,무침,명절음식 문어요리 문어사과초무침/문어손질법,문어사과초무침,https://recipe1.ezmember.co.kr/cache/recipe/2022/09/02/79349d5bb90fcde8720de78e61cac1f01.jpg,977,20분 이내,초급,3인분,"[('돌문어', '1/2마리'), ('사과', '1/2개'), ('깻잎', '10장'), ('상추', '5장'), ('양파', '1/3개'), ('홍고추', '1개'), ('청양고추', '2개'), ('당근', '30g'), ('간장', '1스푼'), ('고추장', '2스푼'), ('고춧가루', '3스푼'), ('식초', '3스푼'), ('올리고당', '1스푼'), ('황설탕', '1스푼'), ('매실청', '1스푼'), ('다진마늘', '1스푼'), ('생강즙', '2티스푼'), ('깨소금', '1스푼'), ('후추', '1꼬집'), ('무', '1/5개'), ('황설탕', '2스푼'), ('밀가루', '1/2컵')]","사과 넣고 무친 새콤 달콤 매콤한 문어초무침입니다^^*
느끼한 음식이 많은 명절에 입맛 돋우어 주는 명절반찬으로 만들어 보시면 좋을거 같아요~","[{'step_number': 1, 'description': '재료 준비해 주세요~', 'image_url': 'https://recipe1.ezmember.co.kr/cache/recipe/2022/09/02/b1ef7bce99c8dafceae1542bb917b3781.jpg'}, {'step_number': 2, 'description': '문어는 머리부분을 뒤집어\n내장, 눈, 입은 가위로 잘라 제거하고\n밀가루와 설탕을 넣고 박 박 주물러 \n빨판에 붙은 이물질을 제거해 준 후\n거품이 나오지 않을때까지 충분히 헹궈 주면 손질 끝!문어 입도 제거해 주시구요!', 'image_url': 'https://recipe1.ezmember.co.kr/cache/recipe/2022/09/02/526e849264ea6d7c7d2b0bf76a14702a1.jpg'}, {'step_number': 3, 'description': '냄비에 큼직하게 썰은 무와 설탕 1스푼 넣고 \n물이 끓으면 문어 넣고 5~8분 정도 삶아 준 후 \n불을 끄고 5분 정도 뜸을 들여 준 후 문어를 건져 주세요~문어 크기에 따라 삶는 시간을 가감해 주시고 \n무 대신 레몬이나 양파도 좋고 뜸을 들여 주면 \n문어 육질이 연해지고 녹차 넣어 삶아 주면 \n색이 예쁘게 나오고 비린맛도 잡아 준다고 해요~', 'image_url': 'https://recipe1.ezmember.co.kr/cache/recipe/2022/09/02/0a020deb90c14e0e9115b925259cf97e1.jpg'}, {'step_number': 4, 'description': '삶은 문어는 먹기 좋은 사이즈로 썰어 주세요~', 'image_url': 'https://recipe1.ezmember.co.kr/cache/recipe/2022/09/02/528861fc681b0fe4a72230a9dafe5cac1.jpg'}, {'step_number': 5, 'description': '적힌 분량의 간장, 고추장, 고춧가루, 다진마늘, \n식초, 황설탕, 올리고당, 생강즙, 매실청, 후추, \n깨소금을 넣고 설탕이 녹도록 저어 주면 무침 양념장 완성!양념장은 미리 만들어 냉장고에 넣어 \n숙성시켜 사용하면 깊은 맛을 낼 수 있어요!', 'image_url': 'https://recipe1.ezmember.co.kr/cache/recipe/2022/09/02/21caa1dc4dd68aa58969644b22ceebdf1.jpg'}, {'step_number': 6, 'description': '사과, 양파, 깻잎, 상추, 당근, 고추는 \n먹기 좋은 적당한 크기로 썰어 주세요~사과는 껍질 안 벗기고 사용해도 좋고\n미리 썰어 두면 갈변현상이 일어나니\n설탕물에 잠시 담가 두면 좋답니다', 'image_url': 'https://recipe1.ezmember.co.kr/cache/recipe/2022/09/02/8ca2210c569eb41332b10d3044cd06ee1.jpg'}, {'step_number': 7, 'description': '볼에 썰은 사과, 당근, 고추, 상추, \n깻잎, 양파와 문어를 담아 주세요~', 'image_url': 'https://recipe1.ezmember.co.kr/cache/recipe/2022/09/02/35b08ad0a27e5b9ca9010e4514c6ff481.jpg'}, {'step_number': 8, 'description': '만든 양념장을 넣어 주세요~', 'image_url': 'https://recipe1.ezmember.co.kr/cache/recipe/2022/09/02/6f2e50ccd4ac038045ac3edb11333e6f1.jpg'}, {'step_number': 9, 'description': '서로 잘 어우러지도록 살살\n버무려 주면 문어사과초무침 완성!부족한 간은 소금으로 맞춰 주고\n기호에 따라 참기름 추가해도 좋아요!', 'image_url': 'https://recipe1.ezmember.co.kr/cache/recipe/2022/09/02/e780e0e1b40178ec7fe9a2667f1e84f71.jpg'}]"
44474,메인반찬,명절,해물류,무침,"명절 음식 활용, 상큼한 문어 초무침",None,https://recipe1.ezmember.co.kr/cache/recipe/2018/02/19/199d2090323bb6859949067deb3e27351.jpg,"1,946",None,None,None,"[('상추/치커리', '50g'), ('문어', '100g'), ('오이', '1/2개'), ('고추장', '2숟가락'), ('고춧가루', '2숟가락'), ('매실진액', '2숟가락'), ('감식초', '2숟가락'), ('깨소금', '약간'), ('참기름', '약간'), ('마늘', '약간')]",,[]
44475,메인반찬,명절,해물류,무침,부추 한가득 “홍어무침”도 맛있어요.,홍어무침,https://recipe1.ezmember.co.kr/cache/recipe/2022/09/29/3aa74a008a8c5aa5e36b9b96345f1e721.jpg,638,2시간 이상,아무나,4인분,"[('냉동 홍어', '1마리'), ('오이', '1개'), ('부추', '1줌'), ('사이다', ''), ('3배 식초', '1/2컵'), ('소금', '1/2큰술'), ('고추장', '4큰술'), ('설탕', '3큰술'), ('다진마늘', '2큰술'), ('식초', '4큰술'), ('고춧가루', '3큰술'), ('참기름', '2큰술'), ('통깨', '2큰술')]","미국에 살다 보니 추석이 큰 의미가 없지만 그래도 그냥 지나치기엔 그래서 남편과 제가 좋아하는 “홍어무침” 간단히 만들어 즐겼습니다.집밥의 장점은 내 입맛에 맞게,양도 맘껏 먹을 수 있다는거죠!
주인공인 홍어 많이 넣고 오이와 부추만 넣어 만든 초간단
홍어무침
깻잎에 쌈 싸서 먹으니 맛 궁합이 찰떡쿵!

​","[{'step_number': 1, 'description': '냉동 홍어라도 한국 마켓에서 구입 할 수 있음에 늘 감사하는 맘으로 들고 왔습니다.', 'image_url': 'https://recipe1.ezmember.co.kr/cache/recipe/2022/09/29/fee718e18a7716cbdc693a0b8fd8df3a1.jpg'}, {'step_number': 2, 'description': '냉동 홍어를 냉장고에서 서서히 해동하고 소금물에 한번 헹군 후 먹기 좋게 썰어줍니다.', 'image_url': 'https://recipe1.ezmember.co.kr/cache/recipe/2022/09/29/e1249324c198ff1aaf82b4df6372818a1.jpg'}, {'step_number': 3, 'description': '결 반대 방향으로 잘라주면 먹을 때 식감이 덜 질겨 씹기 좋습니다.', 'image_url': 'https://recipe1.ezmember.co.kr/cache/recipe/2022/09/29/8e8886f3080b9324deca54ebbd9f3b031.jpg'}, {'step_number': 4, 'description': '사이다에 홍어가 푹 잠기게 재운 후 냉장고에서 최소 3시간 이상 재웁니다.\n3배 식초 1/2컵\n소금1/2큰술도 함께 넣어줍니다.\n(살균,뼈를 부드럽게 만들고 밑간이 맛있게 들어요)', 'image_url': 'https://recipe1.ezmember.co.kr/cache/recipe/2022/09/29/c6ce7a84cbb054ac82e27efc26f717c11.jpg'}, {'step_number': 5, 'description': '냉장고에서 4시간 재운 홍어를', 'image_url': 'https://recipe1.ezmember.co.kr/cache/recipe/2022/09/29/a39afc5b48c0bfe85d0585330426dbf81.jpg'}, {'step_number': 6, 'description': '채에 받쳐 물기를 뺀 다음', 'image_url': 'https://recipe1.ezmember.co.kr/cache/recipe/2022/09/29/61dbeed5e4d8cbda37d7405473fb75aa1.jpg'}, {'step_number': 7, 'description': '면보에 올려 최대한 물기를 짜줍니다.', 'image_url': 'https://recipe1.ezmember.co.kr/cache/recipe/2022/09/29/1db88e7199780cb8d6d54799932b1abd1.jpg'}, {'step_number': 8, 'description': '큰 그릇에 담고', 'image_url': 'https://recipe1.ezmember.co.kr/cache/recipe/2022/09/29/b3a15325fa839679fc9d86f6e4d2e0ef1.jpg'}, {'step_number': 9, 'description': '고추장 4큰술\n설탕 3큰술\n다진마늘 2큰술\n식초 4큰술\n고춧가루 3큰술', 'image_url': 'https://recipe1.ezmember.co.kr/cache/recipe/2022/09/29/5f23247e81da9cb5ca01eff75d342e8b1.jpg'}, {'step_number': 10, 'description': '양념에 홍어를 조물조물 무칩니다.', 'image_url': 'https://recipe1.ezmember.co.kr/cache/recipe/2022/09/29/6e95a3afa33f0c1c76d2972705d1f2f41.jpg'}, {'step_number': 11, 'description': '오이 1개를 어슷 썰어 소금 세꼬집에 20분 절군 후 면보에 넣고 물기를 꼭 짜줍니다.', 'image_url': 'https://recipe1.ezmember.co.kr/cache/recipe/2022/09/29/0b1e4b1e12dfa1da796d606d31565ddd1.jpg'}, {'step_number': 12, 'description': '부추 한줌을 먹기 좋게 썰고 오이와 함께 홍어무침에 넣은 후', 'image_url': 'https://recipe1.ezmember.co.kr/cache/recipe/2022/09/29/95a59d604d2ca51ec54980424b7c69601.jpg'}, {'step_number': 13, 'description': '참기름 2큰술', 'image_url': 'https://recipe1.ezmember.co.kr/cache/recipe/2022/09/29/6a675db878be163324f6eff44ffba7bc1.jpg'}, {'step_number': 14, 'description': '통깨 2큰술을 넣고 잘 버무립니다.', 'image_url': 'https://recipe1.ezmember.co.kr/cache/recipe/2022/09/29/5f02b072fba76a3a08615134e8950c4e1.jpg'}, {'step_number': 15, 'description': '깻잎을 접시에 깔고 홍어무침을 올려주면\n담음새가 이쁨 이쁨 합니다.', 'image_url': 'https://recipe1.ezmember.co.kr/cache/recipe/2022/09/29/7664e33e06aa916630046124217113581.jpg'}, {'step_number': 16, 'description': '주인공 홍어가 한가득~ 오도독 식감이 맛진 오이와 부추향이 양념과 참 잘 어우러지는\n홍어무침', 'image_url': 'https://recipe1.ezmember.co.kr/cache/recipe/2022/09/29/a62d16b4f8d610b23663450993d7bd511.jpg'}, {'step_number': 17, 'description': '홍어만 먹어도 맛나고\n깻잎위에 홍어,오이,부추를 올려 쌈 싸먹어도 입안에서 축제가 벌어지는 맛진 맛!', 'image_url': 'https://recipe1.ezmember.co.kr/cache/recipe/2022/09/29/0fbd87036d74e836ac040601fe8874501.jpg'}, {'step_number': 18, 'description': '추석 상차림에 홍어무침 요렇게 올려 놓으면 한 이쁨 하겠지요?\n즐거운 추석 명절,온 가족이 함께 모여 맛지고 즐거운 시간 보내시길 바랍니다.', 'image_url': 'https://recipe1.ezmember.co.kr/cache/recipe/2022/09/29/99d13b73f33afbd7ea6753129355604f1.jpg'}]"
44476,메인반찬,명절,해물류,무침,추석음식 맛있는 해물잡채 만들기. 이번 추석엔 해물잡채 어때요?,해물잡채,https://recipe1.ezmember.co.kr/cache/recipe/2018/09/13/2eb168b0ac319fedc3904868f78eaf571.jpg,"4,773",30분 이내,초급,4인분,"[('당면', '150g'), ('오징어', '2마리'), ('칵테일새우', '25마리'), ('빨간 파프리카', '1/2개'), ('노란 파프리카', '1/2개'), ('피망', '1/2개'), ('당근', '1/2개'), ('양파', '1개'), ('느타리버섯', '70g'), ('간장', '8T'), ('설탕', '1T'), ('다진마늘', '1T'), ('참기름', '3T'), ('후춧가루', '살짝'), ('깨', '살짝')]","명절이 다가오면 생각나는 음식들이 있어요. 평소에는 잘 해 먹지 않는 음식들이 있죠. 잡채나, 갈비, 전 등등 이런 음식들을 먹어야 왠지 명절같잖아요..^^ 이번 추석엔 어떤 음식을 해 먹을까 미리부터 고민을 했답니다. 매번 해 먹는 잡채 말고 다른게 없을까 생각하다가 그냥 잡채말고 해물잡채를 해 먹기로 했어요. 추석에 만들기 전 미리 한번 만들어 봅니다.^^","[{'step_number': 1, 'description': '끓는물에 먼저 칵테일 새우를 넣고 2분정도 익혀주고 꼬리쪽 껍질도 제거해 주세요.', 'image_url': 'https://recipe1.ezmember.co.kr/cache/recipe/2018/09/14/b1bdb68eb3f59e3c34338eec9decd5a51.jpg'}, {'step_number': 2, 'description': '칵테일 새우를 건져낸 후 오징어도 데쳐내 주세요. 끓는물에 3분정도 익혀 주었어요. 그리고 채 썰어주세요.', 'image_url': 'https://recipe1.ezmember.co.kr/cache/recipe/2018/09/14/faf024da06641164653f2df748219fc41.jpg'}, {'step_number': 3, 'description': '당근, 파프리카, 피망은 채 썰어주고, 느타리 버섯은 먹기좋게 손으로 찢어주세요.', 'image_url': 'https://recipe1.ezmember.co.kr/cache/recipe/2018/09/14/766b1dc8f57ea7bb25287468041545c31.jpg'}, {'step_number': 4, 'description': '그럼 재료준비 끝.', 'image_url': 'https://recipe1.ezmember.co.kr/cache/recipe/2018/09/14/f30c159848034f885690fd67e177a1d01.jpg'}, {'step_number': 5, 'description': '일단 당면을 익힐 물을 올려 끓여주고 채소들을 볶아 줄거에요. 채소는 색이 연한것부터 진한것까지 순서대로 볶아주세요. 프라이팬에 기름을 살짝 두르고 양파-느타리버섯-노랑파프리카-빨간파프리카-피망-당근 순으로 볶아주세요.', 'image_url': 'https://recipe1.ezmember.co.kr/cache/recipe/2018/09/14/969fde2c8905857cdb79b991e78a49481.jpg'}, {'step_number': 6, 'description': '볶아진 채소와 새우, 오징어를 큰 볼에 준비 해 둡니다.', 'image_url': 'https://recipe1.ezmember.co.kr/cache/recipe/2018/09/14/fa9499487dcc9aaaa91a0e51d2c7b1361.jpg'}, {'step_number': 7, 'description': '물이 끓고있는 냄비에 당면을 넣고 15분 정도 삶아줍니다. 저는 불려서 삶지 않아요. 그리고 체에 받쳐 물기를 제거해 주세요. 찬물에 헹구는거 아니에요.. 당면이 식은 후 무치실거라면 미리 참기름을 넣어 당면만 먼저 무쳐주시구요. 저는 다 식기전에 채소와 무쳐줄거에요.', 'image_url': 'https://recipe1.ezmember.co.kr/cache/recipe/2018/09/14/16b15d5faa425cf82b9af2d262ede6561.jpg'}, {'step_number': 8, 'description': '살짝 식은 당면을 준비해 둔 채소볼에 넣어주세요. 당면은 한두번 정도 가위로 잘라주는게 먹기 편하답니다.', 'image_url': 'https://recipe1.ezmember.co.kr/cache/recipe/2018/09/14/865de5bb9cbf3f71313d69117fd69d4e1.jpg'}, {'step_number': 9, 'description': '양념을 해 줄거에요. 저는 소금을 사용하지 않고 간장으로만 간을 합니다. 간장 8T를 넣어주세요. 설탕1T, 다진마늘1T, 깨, 후춧가루를 살짝 넣어주고', 'image_url': 'https://recipe1.ezmember.co.kr/cache/recipe/2018/09/14/10ecd7d85fee107748c2f05350a32d1e1.jpg'}, {'step_number': 10, 'description': '참기름 3T를 넣어주세요. 이제 조물조물 무쳐주면 완성이에요..', 'image_url': 'https://recipe1.ezmember.co.kr/cache/recipe/2018/09/14/01060dfd4eee2b8ecd994c9d45dee6991.jpg'}]"
44477,메인반찬,명절,해물류,무침,"""골뱅이무침"" ☆ 완전 맛았어요 ☆",골뱅이무침,https://recipe1.ezmember.co.kr/cache/recipe/2019/08/28/98c2078ff57ba92ea60f4f3f5a6adf341.jpg,"2,804",30분 이내,초급,5인분,"[('골뱅이캔', '300g'), ('오이', '1개'), ('적양파', '1/4개'), ('빨강 피망', '1/3개'), ('당근', '5조각'), ('고추', '2개'), ('냉면국수', '1인분'), ('고추장', '3T'), ('식초', '2T'), ('올리고당', '1T'), ('사양꿀', '1T'), ('간장', '1T'), ('마늘', '2개'), ('참기름', '1T'), ('고추가루', '2T')]","매콤한 양념에 고소한 골뱅이와 야채를 냉면국수로 감싸서 한입에 쏘옥 입맛이 확 돌아요 ~#
알록달록 야체를 골고루 담고 한상에 둘러앉아 도란도란 이야기꽃 피우며 맛있게 먹어요 ~#","[{'step_number': 1, 'description': '다진마늘 1T 고추장 3T 올리고당 1T 식초 2T 꿀 1T 간장 1T 고추가루 2T 참기름 1T를 양념 그릇에 넣고 골고루 잘 섞어요', 'image_url': 'https://recipe1.ezmember.co.kr/cache/recipe/2019/08/28/acdf35da7ade19a3d9d459e0fae7c2d01.jpg'}, {'step_number': 2, 'description': '캔에서 꺼낸 골뱅이는 거름망으로 물을 빼주고 세로로 반을 잘라요', 'image_url': 'https://recipe1.ezmember.co.kr/cache/recipe/2019/08/28/5967f4dd846d6bf7f9ecb4beb6dcae861.jpg'}, {'step_number': 3, 'description': '골뱅이는 가운데 담고 야채들은 모두 채썰어서 색깔을 교차해서 빙둘러 담아요', 'image_url': 'https://recipe1.ezmember.co.kr/cache/recipe/2019/08/28/aa1cb864c95c9ba618d1e463b2d074bd1.jpg'}, {'step_number': 4, 'description': '냉명 국수는 찬물에 담가 손으로 붙어있는 면을 떼어줍니다 끓는 물에 냉면 국수를 넣고 면이 붙지 않도록 요리 젓가락으로 저어가다가 면이 부드럽게 삶아지면 바로 찬물로 씻어서 물기를 뺀 후 접시에 세 덩어리로 나누어 담아요', 'image_url': 'https://recipe1.ezmember.co.kr/cache/recipe/2019/08/28/1360fd9a39fd589c96cb6553c11173af1.jpg'}, {'step_number': 5, 'description': '야채, 골뱅이와 면을 접시에 담고 테이블에 놓은 후 먹기 직전에 양념을 넣어 버무리면 골뱅이무침 완성입니다', 'image_url': 'https://recipe1.ezmember.co.kr/cache/recipe/2019/08/28/0e3ea11522068951db2965c0df683a9b1.jpg'}]"
44478,메인반찬,명절,해물류,무침,"새콤달콤 쫄깃한 맛이 일품, 전복초무침",전복초무침,https://recipe1.ezmember.co.kr/cache/recipe/2016/08/15/3f86cafbff6483740b5de8e94bf5caee1.jpg,"2,709",15분 이내,아무나,2인분,"[('전복', '10마리'), ('오이', '1/3개'), ('당근', '1/5개'), ('부추', '1/2줌'), ('양파', '1/3개'), ('고추장', '2T'), ('매실액', '2T'), ('식초', '1T'), ('꿀', '1T'), ('다진마늘', '1/2T'), ('간장', '1/3T')]","내일이 말복이네요
미리 복달임 음식으로 만들어 본 전복 초무침입니다

쫄깃쫄깃 전복으로 초무침 만들어 봅니다","[{'step_number': 1, 'description': '전복 손질법은 여러번 올려 드렸으니 오늘은 패스~~ㅎ\n전복 손질해 놓아요전복 손질법 레시피\u200b', 'image_url': 'https://recipe1.ezmember.co.kr/cache/recipe/2016/08/15/2920ad0dd923d5b83152f2e613a8e7cb1.jpg'}, {'step_number': 2, 'description': '오이, 당근, 양파, 부추 준비해요\n오이는 반달썰기하고 당근은 채썰어요\n부추도 비슷한 길이로 썰고 양파도 가늘게 슬라이스 합니다', 'image_url': 'https://recipe1.ezmember.co.kr/cache/recipe/2016/08/15/2794b0326afdbd920fb17ab9977be1c61.jpg'}, {'step_number': 3, 'description': '전복은 끓는물에 넣고 살짝만 데쳐 냅니다\n아주 잠깐만 데쳐요, 넣었다 바로 건지는 정도로..', 'image_url': 'https://recipe1.ezmember.co.kr/cache/recipe/2016/08/15/e393bd0bc981b54deb555fd2484d721f1.jpg'}, {'step_number': 4, 'description': '전복껍질도 삶아 건집니다', 'image_url': 'https://recipe1.ezmember.co.kr/cache/recipe/2016/08/15/6f30f42fc6b22fff13024e4dbf2556561.jpg'}, {'step_number': 5, 'description': '먹기좋게 전복은 썰어 준비 합니다', 'image_url': 'https://recipe1.ezmember.co.kr/cache/recipe/2016/08/15/6f1c0d737902d344f43ce8d9853d2f131.jpg'}, {'step_number': 6, 'description': '준비된 채소는 모두 볼에 담고..', 'image_url': 'https://recipe1.ezmember.co.kr/cache/recipe/2016/08/15/a4e1742ea57993c1fe14adb2ccce9c0b1.jpg'}, {'step_number': 7, 'description': '전복도 담아요', 'image_url': 'https://recipe1.ezmember.co.kr/cache/recipe/2016/08/15/93cf3d0933e86bee31008ec81e0843171.jpg'}, {'step_number': 8, 'description': '고추장, 매실액, 식초, 꿀, 다진마늘, 간장넣고 소스 만들어요', 'image_url': 'https://recipe1.ezmember.co.kr/cache/recipe/2016/08/15/255c4968ecae69cf2f8c5b65729efeb11.jpg'}, {'step_number': 9, 'description': '소스넣고 깨넣고 살살 버무려 줍니다\n전복 껍데기에 전복초무침 담아 냅니다', 'image_url': 'https://recipe1.ezmember.co.kr/cache/recipe/2016/08/15/6e7950451500c8c9b0b584f1bd55e4651.jpg'}]"
