index,종류별,상황별,재료별,방법별,글 제목,레시피이름,레시피이미지,조회수,조리시간,난이도,인분,재료,소개글,조리순서
151147,퓨전,간식,채소류,끓이기,단호박크림떡볶이 l 맵찔이들을 위한 달달+고고 떡볶이!,단호박크림떡볶이,https://recipe1.ezmember.co.kr/cache/recipe/2020/01/22/cda0f3506dc0d19272c0195d6b70c4361.jpg,"5,132",30분 이내,아무나,2인분,"[('떡볶이떡', '250g'), ('단호박', '200g'), ('양파', '1/4개'), ('베이컨', '3줄'), ('편마늘', '1숟가락'), ('브로콜리', '50g'), ('우유', '1종이컵'), ('생크림', '1종이컵'), ('소금', '약간'), ('후추', '약간'), ('파마산치즈가루', '1숟가락'), ('파슬리가루', '약간')]","쫀득한 떡복이를 색다르게 먹고싶은날엔???
달달한 단호박과 크림은 넘나 맛있는 간식! 
아이들 방학 간식으로 딱인걸????
세상의 모든 레시피 만개의레시피","[{'step_number': 1, 'description': '양파는 채 썰고 베이컨은 2cm 길이로 썬다.', 'image_url': 'https://recipe1.ezmember.co.kr/cache/recipe/2020/01/22/4b34caed829dfda0a5b9015972f7cc3d1.jpg'}, {'step_number': 2, 'description': '찐 단호박을 으깬다.단호박은 랩을 씌워 구멍을 낸 후 5분간 전자레인지에 돌려요.', 'image_url': 'https://recipe1.ezmember.co.kr/cache/recipe/2020/01/22/703c87373f692fa77826efc2e21541af1.jpg'}, {'step_number': 3, 'description': '끓는 물에 소금을 약간 넣고 브로콜리를 데친다.', 'image_url': 'https://recipe1.ezmember.co.kr/cache/recipe/2020/01/22/400ed904db60d8f90b3089794b2959981.jpg'}, {'step_number': 4, 'description': '달군 팬에 식용유를 두르고 편마늘, 채 썬 양파, 베이컨을 볶는다.팬', 'image_url': 'https://recipe1.ezmember.co.kr/cache/recipe/2020/01/22/5d59c8437506d1be7fcd425669ad3c521.jpg'}, {'step_number': 5, 'description': '양파가 투명해지면 우유와 생크림, 으깬 단호박을 넣고 끓인다.', 'image_url': 'https://recipe1.ezmember.co.kr/cache/recipe/2020/01/22/8db56e4fe30eea91d1c65ac1e0f34ea71.jpg'}, {'step_number': 6, 'description': '끓어오르면 떡볶이떡, 브로콜리를 넣고 소금, 후추를 뿌린 뒤 파마산치즈가루, 파슬리가루를 뿌려 완성한다.', 'image_url': 'https://recipe1.ezmember.co.kr/cache/recipe/2020/01/22/8af1fdbc9de78f357adfa0b2e040005c1.jpg'}]"
151148,퓨전,간식,채소류,끓이기,고구마 크림 스튜 떡볶이,고구마크림스튜떡볶이,https://recipe1.ezmember.co.kr/cache/recipe/2019/10/20/87bc282247f7a34dcea96f57f0654af11.jpg,"1,859",20분 이내,아무나,2인분,"[('고구마 중', '1개'), ('닭다리                                                                                또는 안심 정육', '300g'), ('떡볶이 떡', '200g'), ('적황 파프리카', '1/4개'), ('브로콜리', '조금'), ('당근', '조금'), ('생크림', '500g'), ('물', '100g'), ('소금', ''), ('편마늘                                                                                토핑', '4개'), ('어린잎                                                                                토핑', '조금'), ('닭고기 밑간용 청주', '3T'), ('소금', ''), ('통후추', '')]",매운 것을 전혀 못먹는 4살 딸아이를 위해 크림으로 소스를 만들어 제철식품인 고구마를 넣어봤습니다.,"[{'step_number': 1, 'description': '닭고기는 먹기좋은 크기로 썰어 밑간해 두고 나머지 채소도 썰어둔다.', 'image_url': 'https://recipe1.ezmember.co.kr/cache/recipe/2019/10/20/d9c82d76d386faeea0d00e61d65f5d981.jpg'}, {'step_number': 2, 'description': '달군 프라이팬에 기름을 두르고 마늘을 노릇하게 구워낸다.', 'image_url': 'https://recipe1.ezmember.co.kr/cache/recipe/2019/10/20/fa4f7b10d9d635a469fef21f3326c4801.jpg'}, {'step_number': 3, 'description': '마늘을 구워낸 프라이팬에 밑간한 고기를 1분정도 익히다, 고구마 양파를 넣고 2분 더 익힌다.', 'image_url': 'https://recipe1.ezmember.co.kr/cache/recipe/2019/10/20/17115df787250dfd8a83f6b709cdc08a1.jpg'}, {'step_number': 4, 'description': '생크림과 물을 넣고 끓으면 떡볶이 떡을 넣고 반쯤 익으면 파프리카, 당근, 브로콜리를 넣어 1분정도 끓인다.', 'image_url': 'https://recipe1.ezmember.co.kr/cache/recipe/2019/10/20/201147720f6b66dc6ce6c6226e285b9c1.jpg'}, {'step_number': 5, 'description': '그릇에 담는아 구운 마늘편을 올리고 파슬리를 뿌인다.', 'image_url': 'https://recipe1.ezmember.co.kr/cache/recipe/2019/10/20/3e8553c13e8729cf983504ad08bfae141.jpg'}]"
151149,퓨전,간식,채소류,끓이기,빵에는 잼이라는 생각은 놉! 브로콜리치즈딥 ★,브로콜리치즈딥,https://recipe1.ezmember.co.kr/cache/recipe/2019/07/19/73f001b5c1e94c723a2257807ccef8901.jpg,"16,259",30분 이내,아무나,4인분,"[('브로콜리', '1개'), ('베이컨', '2장'), ('다진 마늘', '1숟가락'), ('크림치즈', '100g'), ('생크림', '1컵'), ('피자치즈', '1/2컵'), ('후추', '약간'), ('크래커                                                                                또는 구운 식빵', '적당량')]","브로콜리가 들어가 채소싫어하는 아이 먹이기 굳굳굳
간식도 이젠 딥핑소스로 고급지게 즐겨봐 ★ 
세상의 모든 레시피 만개의레시피","[{'step_number': 1, 'description': '브로콜리는 밑동을 잘라낸 뒤 한 입 크기로 썰고 뜨거운 물을 부어 겉을 살짝 데친다.데친 브로콜리는 찬물에 헹구고 물기를 제거해요.', 'image_url': 'https://recipe1.ezmember.co.kr/cache/recipe/2019/07/19/06c47371529275e5a32b4360bddfef871.jpg'}, {'step_number': 2, 'description': '중불로 달군 팬에 베이컨을 바삭하게 구워 건진다.팬한 김 식힌 뒤 굵게 다져 준비해요.', 'image_url': 'https://recipe1.ezmember.co.kr/cache/recipe/2019/07/19/75110ffae5e1ff8fc7f8cfd9a8746b981.jpg'}, {'step_number': 3, 'description': '베이컨을 구운 팬에 다진 마늘과 데친 브로콜리를 볶아 한 김 식힌다.팬', 'image_url': 'https://recipe1.ezmember.co.kr/cache/recipe/2019/07/19/7ecd2f8fc217b7810d3257f0175e2abd1.jpg'}, {'step_number': 4, 'description': '믹서에 볶은 브로콜리, 크림치즈, 생크림, 파마산치즈가루를 넣어 곱게 간다.믹서기', 'image_url': 'https://recipe1.ezmember.co.kr/cache/recipe/2019/07/19/2ec2880710258d4dbe963f42994353c91.jpg'}, {'step_number': 5, 'description': '다시 팬에 붓고 피자치즈, 후추를 넣어 걸쭉하게 끓인다.팬맛을 보고 취향에 따라 소금으로 간을해요.', 'image_url': 'https://recipe1.ezmember.co.kr/cache/recipe/2019/07/19/a5f8bbc7c5f111839a7a2c7dcf9699181.jpg'}, {'step_number': 6, 'description': '그릇에 담은 뒤 베이컨을 뿌리고 크래커나 구운 식빵을 곁들인다.그릇치즈를 뿌린 뒤 토치로 살짝 그을리면 더 맛있어보여요.', 'image_url': 'https://recipe1.ezmember.co.kr/cache/recipe/2019/07/19/f5c65cc87f96d86c7f35ee67232491151.jpg'}]"
151150,퓨전,간식,채소류,끓이기,누룽지 요리 : 새콤달콤한 누룽지탕수육 만들기,누룽지탕수육,https://recipe1.ezmember.co.kr/cache/recipe/2022/02/09/718fb70962742b7af50102a4a4abe8ea1.jpg,"3,779",30분 이내,초급,2인분,"[('누룽지', '1공기'), ('사과', '1/3개'), ('양파', '1/3개'), ('당근', '1/3개'), ('식용유', '넉넉히'), ('설탕', '4T'), ('식초', '3T'), ('진간장', '4T'), ('물', '200ml'), ('전분가루', '2T'), ('물', '100ml')]",중국집에서 주문한 탕수육에 들어있던 누룽지가 너무 맛있어서 만들어본 요리예요. 바삭한 누룽지와 새콤달콤한 탕수육 소스의 조합이 좋은 메뉴였어요.,"[{'step_number': 1, 'description': '당근 1/3개, 사과 1/3개를 얇게 썰어주세요. 양파 1/3개는 깍둑썰기한 후 하나씩 분리시켜줍니다.', 'image_url': 'https://recipe1.ezmember.co.kr/cache/recipe/2022/02/09/5b32c4604be4c10adf74b87ef11548021.jpg'}, {'step_number': 2, 'description': '전분가루 2T, 물 100ml를 섞어서 전분물을 만들어주세요.', 'image_url': 'https://recipe1.ezmember.co.kr/cache/recipe/2022/02/09/6977aeafc00b7eed1730e0f4b8b084f01.jpg'}, {'step_number': 3, 'description': '냄비에 물 200ml와 설탕 4T, 식초 3T, 진간장 4T를 넣고 보글보글 끓여주세요.', 'image_url': 'https://recipe1.ezmember.co.kr/cache/recipe/2022/02/09/14296d98239a9d5e47e2372808af3bd11.jpg'}, {'step_number': 4, 'description': '물이 끓으면 썰어 놓은 당근, 사과, 양파를 넣고 끓여주세요.', 'image_url': 'https://recipe1.ezmember.co.kr/cache/recipe/2022/02/09/194583360d1efa19056d7734b21a4ffb1.jpg'}, {'step_number': 5, 'description': '양파가 어느 정도 익으면 전분물을 부어 주세요. 소스에 점성이 생기면 불을 꺼주세요.', 'image_url': 'https://recipe1.ezmember.co.kr/cache/recipe/2022/02/09/9e0adc2ad72e5ab669c9ff6d74445d811.jpg'}, {'step_number': 6, 'description': '누룽지를 튀기기 위해 후라이팬에 기름을 넉넉히 둘러주세요.', 'image_url': 'https://recipe1.ezmember.co.kr/cache/recipe/2022/02/09/8921e4086a1f61c3626287e77a2a2d0a1.jpg'}, {'step_number': 7, 'description': '누룽지를 후라이팬에 넣고 볶듯이 저어주세요. 누룽지 쌀알이 하얗게 변하면 튀겨진거예요.', 'image_url': 'https://recipe1.ezmember.co.kr/cache/recipe/2022/02/09/aa53691087afb6f7acf0b422b77e936b1.jpg'}, {'step_number': 8, 'description': '잘 튀겨진 누룽지를 그릇에 담고 위에 탕수육 소스를 뿌려주면 누룽지탕수육 완성이에요!', 'image_url': 'https://recipe1.ezmember.co.kr/cache/recipe/2022/02/09/eadd900b8499e54a67c0d231510443801.jpg'}]"
