index,종류별,상황별,재료별,방법별,글 제목,레시피이름,레시피이미지,조회수,조리시간,난이도,인분,재료,소개글,조리순서
36205,메인반찬,손님접대,해물류,볶음,순살 고등어 강정 비린맛 없게 만드는 법 에어프라이어 자반 고등어 강정 조림 레시피,고등어강정,https://recipe1.ezmember.co.kr/cache/recipe/2024/02/23/ee324bad3d0e7df249e1fefd8059bc171.jpg,179,60분 이내,초급,4인분,"[('순살 자반고등어', '150g'), ('전분가루', '3큰술'), ('카레가루', '1작은술'), ('땅콩', '30알'), ('케첩', '2큰술'), ('마요네즈', '1큰술'), ('진간장', '1큰술'), ('요리당', '2큰술'), ('참기름', '1큰술'), ('생수', '4큰술'), ('마늘', '1작은술'), ('맛술', '1큰술'), ('생강즙', '1/2작은술'), ('후추', '톡톡')]",저희 가족은 생선 요리를 좋아 한답니다 다양한 방법으로 해서 먹지요 생선 요리는 비린맛이 있으면 또 멀리 하게 되지요 한번씩 색다르게 해먹고 싶을때 비린맛 전혀 없는 순살 고등어 강정을 해서 먹는답니다 아이들도 좋아하고 어른들도 좋아 한답니다 방법 또한 간단해서 더 추천 드려요,"[{'step_number': 1, 'description': '순살 자반 고등어는 비린맛을 제거하기 위해서 쌀뜨물에 20분간 재워 두세요 그리고 자반 고등어 짠맛도 빠진답니다', 'image_url': 'https://recipe1.ezmember.co.kr/cache/recipe/2024/02/23/168eec3a992c5429a794d683180030e51.jpg'}, {'step_number': 2, 'description': '1센티 정도의 두께로 썰어 주세요', 'image_url': 'https://recipe1.ezmember.co.kr/cache/recipe/2024/02/23/c9921f21dcff17e4b11c90ced66f20301.jpg'}, {'step_number': 3, 'description': '맛술 1큰술을 넣어 주세요', 'image_url': 'https://recipe1.ezmember.co.kr/cache/recipe/2024/02/23/7488f79427329eb2485994ca0a3471bb1.jpg'}, {'step_number': 4, 'description': '후추 톡톡톡해 주세요', 'image_url': 'https://recipe1.ezmember.co.kr/cache/recipe/2024/02/23/c515c0982d7ce91d01d74065440bb8761.jpg'}, {'step_number': 5, 'description': '버무려서 20분간 재워 두세요(비린맛을 제거하기 위해서 밑간을 해두세요)', 'image_url': 'https://recipe1.ezmember.co.kr/cache/recipe/2024/02/23/74d0b51e4e889020f773a207e9942a201.jpg'}, {'step_number': 6, 'description': '밑간을 해둔 고등어에 전분가루 3큰술 카레가루 1작은술을 넣어 주세요', 'image_url': 'https://recipe1.ezmember.co.kr/cache/recipe/2024/02/23/eff4c0c8c9d52f323e7e0b4fa908c1761.jpg'}, {'step_number': 7, 'description': '조물조물 버무려 주세요 카레가루는 색감도 에쁘지만 비린맛을 제거할수 있어요 10분정도 재워 두세요', 'image_url': 'https://recipe1.ezmember.co.kr/cache/recipe/2024/02/23/d623718548d389670c8e56337c51a77f1.jpg'}, {'step_number': 8, 'description': '에어프라이어 용기예 종이호일을 깔고 고등어를 넣어 주세요', 'image_url': 'https://recipe1.ezmember.co.kr/cache/recipe/2024/02/23/2d89cdf6665578552de1c093d34c58e51.jpg'}, {'step_number': 9, 'description': '온도 200도에서 13분 돌려 주세요 바삭하게 구워젔답니다', 'image_url': 'https://recipe1.ezmember.co.kr/cache/recipe/2024/02/23/cd3a83fad5ccea98848cb6475b9891291.jpg'}, {'step_number': 10, 'description': '에어프라이어에 고등어 강정이 익는 동안에 소스를 만들어 주세요 케첩 2큰술 마요네즈 1큰술 진간장 1큰술 요리당 2큰술 참기름 1큰술 생수 4큰술 마늘 1작은술 맛술 1큰술 생강즙 1/2작은술 후추 톡톡톡 해서 넣어 주세요', 'image_url': 'https://recipe1.ezmember.co.kr/cache/recipe/2024/02/23/f8698165804a721f3349138da6e322cd1.jpg'}, {'step_number': 11, 'description': '골고루 섞이게끔 잘 저어 주세요', 'image_url': 'https://recipe1.ezmember.co.kr/cache/recipe/2024/02/23/b6dd7b42ad3cc035f61042abbc901a531.jpg'}, {'step_number': 12, 'description': '볶은 땅콩 30알정도 부셔 주세요', 'image_url': 'https://recipe1.ezmember.co.kr/cache/recipe/2024/02/23/29e30e58b42df210194144ae0644a7771.jpg'}, {'step_number': 13, 'description': '팬에 식용유 두르지 않고 소스를 넣어 주세요', 'image_url': 'https://recipe1.ezmember.co.kr/cache/recipe/2024/02/23/31377154d06d70c19358da7b7bfdb8cd1.jpg'}, {'step_number': 14, 'description': '소스가 보글보글 끓으면 고등어 강정을 넣어 주세요', 'image_url': 'https://recipe1.ezmember.co.kr/cache/recipe/2024/02/23/97d0c847f2ce4541699d05fc47c9649d1.jpg'}, {'step_number': 15, 'description': '부셔 놓은 땅콩을 넣어 주세요', 'image_url': 'https://recipe1.ezmember.co.kr/cache/recipe/2024/02/23/083647338aa972262c737a4a8ed50af31.jpg'}, {'step_number': 16, 'description': '중불에서 고등어의 전분피가 벗겨지지 않게끔 조심스럽게 뒤적여서 조려 주세요', 'image_url': 'https://recipe1.ezmember.co.kr/cache/recipe/2024/02/23/e8325830b80b8b06b6a3a34e9a40b65b1.jpg'}, {'step_number': 17, 'description': '고등어 강정이 다 조려 졌으면 통깨를 넣어 주세요', 'image_url': 'https://recipe1.ezmember.co.kr/cache/recipe/2024/02/23/2d198d290080cbf45ec42f284c0101481.jpg'}, {'step_number': 18, 'description': '불을 끄고 마무리해 주세요 접시에 담으시고 땅콩가루를 뿌려 주세요', 'image_url': 'https://recipe1.ezmember.co.kr/cache/recipe/2024/02/23/2a9e18885676a3b7c0155a065d03f6301.jpg'}]"
36206,메인반찬,손님접대,해물류,볶음,쭈삼불고기 쭈꾸미볶음 불맛 레시피 손질법 쭈꾸미양념,쭈삼불고기,https://recipe1.ezmember.co.kr/cache/recipe/2023/08/05/4f9bb57c0704973e5282f9e2606795121.jpg,866,90분 이내,아무나,2인분,"[('쭈꾸미', '10마리'), ('손질용 밀가루', '2스푼'), ('떡볶이떡', '10개'), ('쌈 야채', '적당히'), ('파', '1대'), ('양파', '1/2개'), ('청양고추', '2개'), ('마늘', '2스푼'), ('고추가루', '2스푼'), ('고추장', '1스푼'), ('간장', '1스푼'), ('미림', '2스푼'), ('후추가루', '조금'), ('참기름', ''), ('깨소금', '')]",쭈삼불고기 쭈꾸미볶음 불맛레시피 주꾸미 손질법 쭈꾸미양념 4월 제철음식,"[{'step_number': 1, 'description': '주꾸미는 물에 씻어 몸통을 뒤집어 내장과 눈 입 등을 가위로 손질해 줍니다.밀가루를 이용해 조물조물 해주어 빨판에 붙어 있는 이물질을 제거 합니다. 위에서 아래로 당겨 가면서 깨끗하게 세척 합니다. 흐르는 물에 탁한 물이 없어 질때 까지 여러번 헹구어 줍니다.주꾸미 손질법 레시피\u200b', 'image_url': 'https://recipe1.ezmember.co.kr/cache/recipe/2023/08/08/9c0af50b173b6d9a3561f01182f7600e1.jpg'}, {'step_number': 2, 'description': '고기도 좋아하지만 야채도 좋아하는 신랑은 상추와 깻잎을 푸짐하게 준비해 두었어요. 고기 먹을 때 생마늘, 청양고추,양파가 없으면 못먹는 습관이 있어요.', 'image_url': 'https://recipe1.ezmember.co.kr/cache/recipe/2023/08/08/10c7dfd04ffe6c51dadd84fb21515bb11.jpg'}, {'step_number': 3, 'description': '냉동실에 있던 떡볶이도 미리 해동해 놓아 말랑말랑 합니다.', 'image_url': 'https://recipe1.ezmember.co.kr/cache/recipe/2023/08/08/0370e94502cdd0ecf7ad5df0213318961.jpg'}, {'step_number': 4, 'description': '달궈진 팬에 어슷하게 썰은 대파를 먼저 볶아줍니다. 그리고 대패 삼겹살에 미림 2스푼 넣어 더 볶아요. 고기가 익을 때쯤 센불에 양파도 넣어 섞어줍니다. ※삼겹살 기름이 많아서 덜어내고 조리해 주었습니다.', 'image_url': 'https://recipe1.ezmember.co.kr/cache/recipe/2023/08/08/4e565ef298a98496a65c15f3bde1e4591.jpg'}, {'step_number': 5, 'description': '고추가루 2:고추장 1:간장1:설탕 1+1/2 후추 톡톡 넣어 골고루 섞어 줍니다. 양념은 한 번에 다 넣지말고 섞어 가면서 추가해 주시면 입맛에 맞게 조절하실 수 있어요. 싱거운건 괜찮지만 짜면 안되니까요. 짜다면 양파 정도를 추가해 주셔도 됩니다. 볶고 있던 고기에 양념과 떡을 넣어 섞고 센불에 주꾸미,청양고추,마늘을 넣어 볶아 줍니다.', 'image_url': 'https://recipe1.ezmember.co.kr/cache/recipe/2023/08/08/3a032e3978b42104fb7492980bf4479b1.jpg'}, {'step_number': 6, 'description': '미리 데쳐 놓아서 물이 많이 나오지 않습니다. 양념이 뭉치지 않게 골고루 섞어 줍니다.', 'image_url': 'https://recipe1.ezmember.co.kr/cache/recipe/2023/08/08/1b6c509f67cf3585a097b5fb284caa471.jpg'}, {'step_number': 7, 'description': '어느 정도 익은 후 가위를 이용해 먹기 좋은 사이즈로 크게 잘라 주었어요. 작게 자르면 씹는 맛이 덜할수 있어요. 화유와 참기름 넣고 깨소금으로 마무리해 줍니다.', 'image_url': 'https://recipe1.ezmember.co.kr/cache/recipe/2023/08/08/225b40c86ae5fb043db2f2cc86128e6f1.jpg'}, {'step_number': 8, 'description': '쫄깃하고 오동통 쭈꾸미 따로 먹어도 상추&깻잎에 싸서 먹어도 향긋 하고 맛있어요.', 'image_url': 'https://recipe1.ezmember.co.kr/cache/recipe/2023/08/08/6a8c57ab948ff9829bd31aa01129ac941.jpg'}, {'step_number': 9, 'description': '충분히 먹었지만 습관적으로 허전한 2%는 볶음밥으로 마무리 해주었습니다. 양념 2스푼,김치 송송작게 잘라 조금 준비하고 깻잎 여유있게,김가루 넣어 골고루 섞어주고 참기름과 깨소금 뿌려 완성해 줍니다. 다시 먹기 시작인 느낌이네요. 오늘도 푸짐하게 먹고 뒷길 산책 2시간 하러 나갔습니다. 먹기 위해 운동한다고 하는데 저희 부부도 그런거 같아요. 이웃님들~맛있는거 드시고 운동도 하시고 하루 하루 즐겁게 보내시길 바랍니다.', 'image_url': 'https://recipe1.ezmember.co.kr/cache/recipe/2023/08/08/60f29eee394138f10ef04d667b5158ca1.jpg'}]"
36207,메인반찬,손님접대,해물류,볶음,오징어볶음 쉬운레시피 실패없는 레시피 !,오징어볶음,https://recipe1.ezmember.co.kr/cache/recipe/2024/02/26/19a677920edc008a75197439d50bdfc71.jpg,502,60분 이내,아무나,3인분,"[('오징어', '2마리'), ('애호박', '1개'), ('양파', '1/2개'), ('대파', '1/2쪽'), ('마늘', '6개')]",오징어는 셀레늄 성분을 함유하고 있습니다. 세포가 대사하는데 필수 성분으로 면역력 향상과 여러 질병을 예방하는데 도움을 줍니다. 오징어 먹물에는 뮤코다당류 일렉 신예라는 종양을 억제하는 효능이 있으며 세균 용해성 효소인 리도팀이 방부 효과가 있어 세균과 박테리아를 제거하는 향균능력을 가지고 있습니다.,"[{'step_number': 1, 'description': '오징어를 깨끗이 씻어서 잘라서 준비합니다.도맞 , 조리용나이프 , 접시', 'image_url': 'https://recipe1.ezmember.co.kr/cache/recipe/2024/02/26/4e5ef0e2ac81e512704a92eb5a0079941.jpg'}, {'step_number': 2, 'description': '야채를 준비합니다.', 'image_url': 'https://recipe1.ezmember.co.kr/cache/recipe/2024/02/26/30dfab847ee085e27271a3cc4d714ede1.jpg'}, {'step_number': 3, 'description': '팬에 기름을 두르고 대파를 살짝 볶아요.볶음팬 , 요리스푼', 'image_url': 'https://recipe1.ezmember.co.kr/cache/recipe/2024/02/26/967c7fcb79b90a791d987b3a3abaf37e1.jpg'}, {'step_number': 4, 'description': '대파를 볶다가 오징어를 넣어주세요.', 'image_url': 'https://recipe1.ezmember.co.kr/cache/recipe/2024/02/26/4a0c298ad12c8a7501a7dc52457124331.jpg'}, {'step_number': 5, 'description': '스테비아 설탕 1스푼을 넣고 볶아요. 오징어가 익어질때까지 볶아요.', 'image_url': 'https://recipe1.ezmember.co.kr/cache/recipe/2024/02/26/9567a54495b06ec047cb69a8446494031.jpg'}, {'step_number': 6, 'description': '오징어가 사진처럼 익었을때 간장 5스푼 넣어요.', 'image_url': 'https://recipe1.ezmember.co.kr/cache/recipe/2024/02/26/98122cc52effd8df650c06ee3b0b8eb91.jpg'}, {'step_number': 7, 'description': '고추가루 2스푼 넣어요.', 'image_url': 'https://recipe1.ezmember.co.kr/cache/recipe/2024/02/26/f1b687d791c0214953111e77ff14c2881.jpg'}, {'step_number': 8, 'description': '마늘을 넣어주세요.', 'image_url': 'https://recipe1.ezmember.co.kr/cache/recipe/2024/02/26/f15a432fc1eff1776965a35127df29591.jpg'}, {'step_number': 9, 'description': '오징어가 잘 익었을때 야채를 넣어요. 야채는 2분정도만 볶아주세요 물러지지 않게 짧은시간 볶아주세요.', 'image_url': 'https://recipe1.ezmember.co.kr/cache/recipe/2024/02/26/bd00c3b07d98c36f1dfe341c553ba0001.jpg'}, {'step_number': 10, 'description': '불끄고 참기름이랑 깨를 넣어주세요.', 'image_url': 'https://recipe1.ezmember.co.kr/cache/recipe/2024/02/26/9f10da2729f715ea6d05a0e7dcf1bac01.jpg'}, {'step_number': 11, 'description': '완성입니다. 단짠단짠 밥이랑 최고입니다.완성접시', 'image_url': 'https://recipe1.ezmember.co.kr/cache/recipe/2024/02/26/221149a85d0c26456cd50f69bd4a39bf1.jpg'}]"
36208,메인반찬,손님접대,해물류,볶음,표고버섯 전복볶음 만드는법 굴소스 전복요리 전복볶음레시피 버섯요리 밑반찬레시피,표고버섯전복볶음,https://recipe1.ezmember.co.kr/cache/recipe/2024/03/02/4e1b00520af9b2d715cf3220c8e5c5351.jpg,"5,303",30분 이내,중급,3인분,"[('전복', '3마리'), ('표고버섯', '3-4개'), ('양파', '1개'), ('마늘', '1알'), ('청양고추', '1개'), ('식용유', '적당량'), ('미림                                                                                또는 소주-맛술', '2T'), ('후추', '적당량'), ('소금', '적당량'), ('굴소스', '1T'), ('참기름', '2T'), ('전분물', '0.5T'), ('통깨', '적당량'), ('물', '2T')]","안녕하세요 슈퍼파워입니다. 오늘은 표고버섯 전복 볶음을 만들어봤어요. 얼마 전에 전복을 선물받았는데, 어떻게 요리해먹으면 좋을까 고민하다 표고버섯 전복 볶음을 만들게 되었습니다. 쫄깃하고 향긋한 버섯과 전복. 다양한 소스, 채소를 넣어 볶은 요리로 짭짤하고 맛있습니다. 그럼 표고버섯 전복볶음 만드는 법 시작하겠습니다!","[{'step_number': 1, 'description': '껍질을 깐 양파 1개, 청양고추 1개, 마늘 1알을 준비해 주세요.\n양파 1개, 청양고추 1개, 마늘 1알도마 ,  칼', 'image_url': 'https://recipe1.ezmember.co.kr/cache/recipe/2024/03/02/2a608f11d6e7cdbf72aab9dee465cad91.jpg'}, {'step_number': 2, 'description': '양파는 먹기 좋은 크기로 잘라주고, 청양고추는 어슷 썰어줍니다. 마늘은 얇게 편으로 썰어주세요.도마 ,  칼', 'image_url': 'https://recipe1.ezmember.co.kr/cache/recipe/2024/03/02/182afda167ac31d5c16f7497bf17cd641.jpg'}, {'step_number': 3, 'description': '표고버섯 3-4개 준비해 착착 썰어주세요.저는 말린 표고버섯을 사용해서 물에 불려 줬습니다.\n표고버섯 3-4개 도마 ,  칼', 'image_url': 'https://recipe1.ezmember.co.kr/cache/recipe/2024/03/02/02ae4171335cb82af153c6103ecd6de31.jpg'}, {'step_number': 4, 'description': '깨끗하게 닦은 전복 3마리를 준비해, 숟가락으로 전복 살을 분리시켜줍니다.\n세척한 전복 3마리숟가락', 'image_url': 'https://recipe1.ezmember.co.kr/cache/recipe/2024/03/02/610c78adfe2e752de715f045727523711.jpg'}, {'step_number': 5, 'description': '전복 눈과 입을 제거시켜주세요. 전복살과 내장도 분리시켜줍니다. 전복 살을 슬라이스해 주시고, 내장은 적당히 다져주세요.도마 ,  칼', 'image_url': 'https://recipe1.ezmember.co.kr/cache/recipe/2024/03/02/cc5bce791afb57924cf09c3077deb84b1.jpg'}, {'step_number': 6, 'description': '팬에 식용유 적당량 두르고 내장을 넣어줍니다. 미림(맛술) 또는 소주 1T도 넣고 달달 볶아주세요. 식용유 적당량, 미림(맛술) 또는 소주 1T볶음팬 , 요리스푼', 'image_url': 'https://recipe1.ezmember.co.kr/cache/recipe/2024/03/02/795f98e932fa5500b378f5e873426f5d1.jpg'}, {'step_number': 7, 'description': '어느 정도 볶다가 전복 살도 넣어줍니다. 소금과 후추 적당량, 미림(맛술) 또는 소주 1T 넣고 1분간 볶아주세요.소금 적당량, 후추 적당량, 미림(맛술) 또는 소주 1T', 'image_url': 'https://recipe1.ezmember.co.kr/cache/recipe/2024/03/02/f16abff19540944af0abd2cd8a1d5d2f1.jpg'}, {'step_number': 8, 'description': '볶은 전복은 그릇에 옮겨줍니다.그릇', 'image_url': 'https://recipe1.ezmember.co.kr/cache/recipe/2024/03/02/c36cb0c94b527ad991d700429c9d5c261.jpg'}, {'step_number': 9, 'description': '전분 0.5T, 물 1T 넣고 전분물을 만들어주세요. 저는 고구마 전분을 사용했습니다.전분 0.5T, 물 1T', 'image_url': 'https://recipe1.ezmember.co.kr/cache/recipe/2024/03/02/0bce7562670bfcba2e091fb3fc67fdfc1.jpg'}, {'step_number': 10, 'description': '전복을 볶았던 팬에 참기름 1T, 표고버섯, 청양고추, 마늘을 넣고 볶다가 마늘 향이 올라오면 양파 넣고 15초간 볶아줍니다.참기름 1T, 표고버섯, 청양고추, 마늘, 양파팬', 'image_url': 'https://recipe1.ezmember.co.kr/cache/recipe/2024/03/02/99fb84688f5f18686165621ac5a71f151.jpg'}, {'step_number': 11, 'description': '물 2T, 소금 적당량, 후추 적당량 넣고 채소가 어느 정도 익을 때까지 볶아줍니다.물 2T, 소금 적당량, 후추 적당량', 'image_url': 'https://recipe1.ezmember.co.kr/cache/recipe/2024/03/02/bbd66175f136ba7929c45490476b8c081.jpg'}, {'step_number': 12, 'description': '볶아둔 전복, 굴 소스 1T, 전분물 0.5-1T,참기름 1T 넣고 섞듯이 볶아줍니다.\n볶아둔 전복, 굴 소스 1T, 전분물 0.5-1T,참기름 1T', 'image_url': 'https://recipe1.ezmember.co.kr/cache/recipe/2024/03/02/77733f623063b6d4af2bb642ff4b87131.jpg'}, {'step_number': 13, 'description': '마지막으로 통깨를 솔솔 뿌려주면!?', 'image_url': 'https://recipe1.ezmember.co.kr/cache/recipe/2024/03/02/871352a5d7516cba1c47f7a9c9207f5f1.jpg'}, {'step_number': 14, 'description': '표고버섯 전복 볶음 완성!!\n플레이팅접시', 'image_url': 'https://recipe1.ezmember.co.kr/cache/recipe/2024/03/02/1fbd86e5a29999e018b4644aa130308b1.jpg'}]"
36209,메인반찬,손님접대,해물류,볶음,매콤한 오징어볶음(김대석 세프),오징어볶음,https://recipe1.ezmember.co.kr/cache/recipe/2024/03/30/1212256bbd124f800d34fb2e4ef50fbe1.png,344,20분 이내,아무나,3인분,"[('오징어', '2마리'), ('대파', '1/2대'), ('깻잎', '10장'), ('양파', '1/2개'), ('당근', '50g'), ('청양고추', '3개'), ('소금', '1큰술'), ('밀가루', '1큰술'), ('식용유', '3큰술'), ('고춧가루', '5큰술'), ('마늘', '2큰술'), ('생강', '1/3큰술'), ('진간장', '4큰술'), ('굴 소스', '1큰술'), ('고추장', '2큰술'), ('설탕', '1큰술'), ('물엿', '2큰술'), ('감자전분', '1큰술'), ('통깨', '1큰술'), ('참기름', '1큰술')]",큰 시누이가 냉동 오징어를 맛있게 요리해 보라고 보내주시면서 김대석 세프 레시피도 같이 주시네요. 따스한 봄날 매콤한 오징어볶음으로 입맛을 돋우는 것도 좋을 것같아 따라해봤는데 국물이 생기지 않아 맛있게 먹어서 레시피 공유합니다.,"[{'step_number': 1, 'description': '볼에 오징어 2마리를 담고 소금 1 큰 술, 밀가루 1 큰 술을 넣고 손으로 바락바락 문지르고 빨판도 잡아당기면서 이물질을 제거해 준다.믹싱볼 , 조리용스푼', 'image_url': 'https://recipe1.ezmember.co.kr/cache/recipe/2024/03/30/cc4729cc9eeb0c2d01e2bfdd94cb9f5d1.jpg'}, {'step_number': 2, 'description': '바락바락 주물러 이물질이 제거된 오징어에 물을 조금 붓고 한 번 더 주물러준 다음 깨끗이 세척한다.', 'image_url': 'https://recipe1.ezmember.co.kr/cache/recipe/2024/03/30/86d4c21347a5de51ff7b7709f6d3e5591.jpg'}, {'step_number': 3, 'description': '오징어 몸통 부분을 2등분하고 1.5cm 정도로 썰어 줍니다.도마 , 조리용나이프', 'image_url': 'https://recipe1.ezmember.co.kr/cache/recipe/2024/03/30/7240af1ef95ac12a7e0804f1c7f193cd1.jpg'}, {'step_number': 4, 'description': '오징어 다리 끝부분은 잘라 버리고 먹기 좋은 크기로 썰어 줍니다.다리 부분은 칼집을 살짝 내면 양념이 잘 벱니다.', 'image_url': None}, {'step_number': 5, 'description': '준비한 야채들은 큼직하게 어슷 썰어줍니다. 청양 고추는 송송 썰어주고, 당근은 약간 넓적하게 썰고, 깻잎은 반으로 썰어 준비해 둡니다.접시', 'image_url': 'https://recipe1.ezmember.co.kr/cache/recipe/2024/03/30/724be7d7f9dca5d38fe1fb43756e08701.jpg'}, {'step_number': 6, 'description': '팬에 식용유를 넣고 가열시켜 고춧가루를 넣고 꾸덕해지도록 볶아줍니다.프라이팬가스불을 끈 상태로 진행합니다.', 'image_url': 'https://recipe1.ezmember.co.kr/cache/recipe/2024/03/30/1dc61a820cc5d7603e2b9be16261bc461.jpg'}, {'step_number': 7, 'description': '다진 마늘, 다진 생강, 진간장, 굴소스, 고추장, 설탕, 물엿을 넣고 가스불을 켜고 양념이 섞이도록 살짝 끓여 줍니다.약불', 'image_url': 'https://recipe1.ezmember.co.kr/cache/recipe/2024/03/30/0d4387692ef9f26e23cc8bae00d85b3c1.jpg'}, {'step_number': 8, 'description': '끓여진 양념에 양파, 당근, 청양고추를 넣고 2분간 볶아 줍니다.', 'image_url': 'https://recipe1.ezmember.co.kr/cache/recipe/2024/03/30/a3030500df95ad55747307ad86e2260b1.jpg'}, {'step_number': 9, 'description': '야채를 넣고 볶아진 양념에 손질해 둔 오징어를 넣고 살짝 볶아 줍니다.', 'image_url': 'https://recipe1.ezmember.co.kr/cache/recipe/2024/03/30/7f5aae87ba5c87703efe05f6a1646fa51.jpg'}, {'step_number': 10, 'description': '오징어가 살짝 설익은 상태에서 가스불을 올리고 대파, 고춧가루를 넣고 볶습니다.', 'image_url': 'https://recipe1.ezmember.co.kr/cache/recipe/2024/03/30/5cf698822908274a3bffcafcb95f69091.jpg'}, {'step_number': 11, 'description': '감자전분을 넣어 볶아 줍니다.감자전분을 넣어주면 오징어볶음을 했을때 물이 안생깁니다.', 'image_url': 'https://recipe1.ezmember.co.kr/cache/recipe/2024/03/30/8df0a29995f149fa8800de83bd6005851.jpg'}, {'step_number': 12, 'description': '마지막으로 참기름, 통깨, 깻잎을 넣고 살짝 볶아 매콤한 오징어볶음을 완성합니다.', 'image_url': 'https://recipe1.ezmember.co.kr/cache/recipe/2024/03/30/f9931615bfec350b202c7bcebe3f1ba21.jpg'}, {'step_number': 13, 'description': '완성한 매콤한 오징어볶음을 그릇에 담고 통깨를 솔솔 뿌려줍니다. 캭~ 소주를 부르는 비주얼 ㅎㅎ완성접시', 'image_url': 'https://recipe1.ezmember.co.kr/cache/recipe/2024/03/30/4b43762988a667624f163db9c10d090a1.jpg'}]"
36210,메인반찬,손님접대,해물류,볶음,해물제육볶음 ) 내맘대로 여수 삼합!!! 해물 듬뿍 넣은 제육볶음,해물제육볶음,https://recipe1.ezmember.co.kr/cache/recipe/2024/04/18/7cfaa53a20088dec15cc8c333faa49251.jpg,252,30분 이내,아무나,3인분,"[('돼지고기                                                                                대패', '500g'), ('가리비관자', '300g'), ('새우', '7마리'), ('오징어', '2마리'), ('팽이버섯', '1~2개'), ('부추', '적당히'), ('파김치', '적당히'), ('버터', '3큰술'), ('고추장', '2큰술'), ('고춧가루', '2큰술'), ('간장', '3큰술'), ('맛술', '2큰술'), ('설탕', '1큰술'), ('다진마늘', '1큰술'), ('참치액', '0.5큰술'), ('후추', '조금'), ('소금', '기호에따라')]","맛있는게 먹고싶을때!!! 손님초대, 술안주~ 불긍 저녁메뉴로 딱인!!! 해물삼합?? 제육볶음!!!! 내맘대로 볶아주세요","[{'step_number': 1, 'description': '관자는 살짝 녹았을때 적당한 두께로 썰어주세요. (2~3등분 해주세요.)도마 , 조리용나이프', 'image_url': 'https://recipe1.ezmember.co.kr/cache/recipe/2024/04/18/d2d074f1f373453a350cf769356e26e61.jpg'}, {'step_number': 2, 'description': '고추장 2큰술, 고춧가루 2큰술, 간장 3큰술, 맛술 2큰술, 설탕 1큰술, 다진마늘 1큰술, 참치액 0.5 큰술, 후추를 넣어 잘 섞어주세요.소스볼', 'image_url': 'https://recipe1.ezmember.co.kr/cache/recipe/2024/04/18/9dbcbe4181ffa005fff0415cac2e052b1.jpg'}, {'step_number': 3, 'description': '넓은 볶음팬에 버터 3큰술을 듬성듬성 밑에 깔고 그위에 대패, 오징어, 관자, 새우, 부추, 파김치, 팽이를 이쁘게 올려주세요.볶음팬 , 조리주걱오징어 손질법', 'image_url': 'https://recipe1.ezmember.co.kr/cache/recipe/2024/04/18/1b68268b8e5ec0494d12c480ae2f29701.jpg'}, {'step_number': 4, 'description': '재료를익혀주세요. (팁!! 고기를 제외한 다른 재료 한쪽으로 밀고 고기 먼저 익혀주시고 익으면 다른 재료와 섞어서 볶아주세요.', 'image_url': 'https://recipe1.ezmember.co.kr/cache/recipe/2024/04/18/01c96991490d479ca671f8b834d398691.jpg'}, {'step_number': 5, 'description': '어느 정도 익으면 양념장을 2/3를 먼저 넣고 볶아주시고 간을 보신후 싱거우연 나머지 양념을 넣어 주세요.', 'image_url': 'https://recipe1.ezmember.co.kr/cache/recipe/2024/04/18/bfaeb9474a82b1c38412d6e8ce2ad7b21.jpg'}, {'step_number': 6, 'description': '마지막으로 간보시고 소금으로 간 맞춰주세요.', 'image_url': 'https://recipe1.ezmember.co.kr/cache/recipe/2024/04/18/69fed80c4d5069ebce5e099f0e6fc6131.jpg'}, {'step_number': 7, 'description': '건더기 맛있게 드신후 마지막에 꼭!!! 볶음밥 해드세요.', 'image_url': 'https://recipe1.ezmember.co.kr/cache/recipe/2024/04/18/2ffaa1f2b246338fb8dd4acbfc3c636a1.jpg'}]"
