index,종류별,상황별,재료별,방법별,글 제목,레시피이름,레시피이미지,조회수,조리시간,난이도,인분,재료,소개글,조리순서
151546,양념/잼/소스,일상,돼지고기,볶음,돼지고기볶음고추장 : 만능양념장으로 밑반찬 걱정 뚝!,돼지고기볶음고추장,https://recipe1.ezmember.co.kr/cache/recipe/2019/10/05/204d6a88095981b1212683b7819aee841.jpg,"43,288",10분 이내,아무나,4인분,"[('돼지고기다짐육', '300g'), ('양파', '1.5개'), ('대파', '1/4뿌리'), ('식용유', '2숟갈'), ('다진마늘', '1숟갈'), ('양조간장', '4숟갈'), ('고추장', '4숟갈'), ('올리고당', '1숟갈'), ('고춧가루', '1숟갈')]","밑반찬 걱정도 덜고 맛있는 볶음밥이 생각날 때 한번씩 만들어두는 음식입니다. 
돼지고기 다짐육을 활용한 맛깔난 양념장 하나면 볶음밥, 순두부찌개를 척척 만들 수 있답니다:)","[{'step_number': 1, 'description': '양파 1.5개, 대파 1/4뿌리를 잘게 썰어주세요.', 'image_url': 'https://recipe1.ezmember.co.kr/cache/recipe/2019/10/05/5ec6505a054e33b7f88cc750a17654841.jpg'}, {'step_number': 2, 'description': '넒은 팬을 달구고 식용유 2숟갈 두른 후 \n썰어놓은 양파와 파를 넣고 1분 30초간 볶아주세요.중~약불', 'image_url': 'https://recipe1.ezmember.co.kr/cache/recipe/2019/10/05/35b1a288f64481a1b6ad7b2425fb97051.jpg'}, {'step_number': 3, 'description': '돼지고기 다짐육 300g, 다진 마늘 1숟갈을 넣고 잘 섞어가며 1분간 볶아주세요.', 'image_url': 'https://recipe1.ezmember.co.kr/cache/recipe/2019/10/05/78b7e35e32e0c5aaa2ae6bf413e5fed01.jpg'}, {'step_number': 4, 'description': '양조간장 4숟갈로 먼저 간을 해주면서 재료가 타지 않게 1분간 계속 볶아주세요.진간장은 2~2.5숟갈 넣어주세요.', 'image_url': 'https://recipe1.ezmember.co.kr/cache/recipe/2019/10/05/71e2812332adaf977950f88e3d727f9d1.jpg'}, {'step_number': 5, 'description': '곧바로 고춧가루 1숟갈, 고추장 4숟갈, 올리고당 1숟갈을 넣고 3분간 더 볶아주세요.', 'image_url': 'https://recipe1.ezmember.co.kr/cache/recipe/2019/10/05/faf3dfa38ab19012484c89cffcd9712f1.jpg'}, {'step_number': 6, 'description': '완성!\n밀폐 용기에 담아 냉장 보관하세요.\n2~3큰술씩 떠서 볶음밥, 순두부찌개,김밥, 쌈밥 양념 등으로 활용하시면 좋습니다.', 'image_url': 'https://recipe1.ezmember.co.kr/cache/recipe/2019/10/05/61bc6b109e1024a03513d5862120411f1.jpg'}]"
151547,양념/잼/소스,일상,돼지고기,볶음,고기를 먹기 위해 만드는 국물없는 드라이커리 ★,드라이커리,https://recipe1.ezmember.co.kr/cache/recipe/2020/02/12/7061043d215fb1d7f0e9b2de5de8d1311.jpg,"20,354",20분 이내,아무나,2인분,"[('양파', '1/2개'), ('생강', '1/4쪽'), ('마늘', '3개'), ('돼지고기 다짐육', '200g'), ('맛술', '1숟가락'), ('물', '1종이컵'), ('고형카레', '2개'), ('소금', '약간'), ('후추', '약간'), ('달걀', '1개'), ('쪽파', '1줄기')]","항상 먹었던 카레라이스를 다르게 만들기! 
국물 없이 간단하게 만드는 카레덮밥 레시피! 
세상의 모든 레시피 만개의레시피","[{'step_number': 1, 'description': '쪽파는 송송 썰고 양파, 마늘, 생강은 다져서 준비한다.', 'image_url': 'https://recipe1.ezmember.co.kr/cache/recipe/2020/02/12/817ea8bf05bf7d8b221e59be67a188d71.png'}, {'step_number': 2, 'description': '돼지고기 다짐육은 키친타월에 핏물을 제거한다.키친타월', 'image_url': 'https://recipe1.ezmember.co.kr/cache/recipe/2020/02/12/eddaddb3f8d262f69dc376c7ca8d58d01.png'}, {'step_number': 3, 'description': '팬에 기름을 두르고 다진 생강, 다진 마늘, 다진 양파를 넣고 양파가 투명해질 때까지 볶는다.팬', 'image_url': 'https://recipe1.ezmember.co.kr/cache/recipe/2020/02/12/5ff647c7cf140133d6eae9b5f4b69a721.png'}, {'step_number': 4, 'description': '3에 다진 돼지고기를 넣고 볶다가 맛술, 소금, 후추를 넣고 고기가 익을 때까지 볶는다.', 'image_url': 'https://recipe1.ezmember.co.kr/cache/recipe/2020/02/12/e9b47ecb5fe9030011919866e2866cce1.png'}, {'step_number': 5, 'description': '물과 고형 카레를 넣고 볶는다.', 'image_url': 'https://recipe1.ezmember.co.kr/cache/recipe/2020/02/12/3714f3694cd456908037b3e38af95ec91.png'}, {'step_number': 6, 'description': '밥위에 커리를 올리고 달걀 노른자와 쪽파를 곁들여 완성한다.', 'image_url': 'https://recipe1.ezmember.co.kr/cache/recipe/2020/02/12/401b21c62f666401ba25956de278ba4a1.png'}]"
151548,양념/잼/소스,일상,돼지고기,볶음,"백종원 만능 순두부 양념장 요거 만들어두면 마파두부, 찌개 끓일 때 요긴하게 써먹어요",순두부양념장,https://recipe1.ezmember.co.kr/cache/recipe/2022/06/21/2ae04466d4d7e55af94d9cb90debc75f1.jpg,"2,901",30분 이내,초급,6인분 이상,"[('돼지고기 다짐육', '1컵'), ('대파', '1컵'), ('양파', '2컵'), ('참기름', '1/4컵'), ('식용유', '1/4컵'), ('다진마늘', '1/2컵'), ('꽃소금', '1/4컵'), ('고추가루', '1.5컵'), ('설탕', '1.5T'), ('진간장', '1/4컵'), ('국간장', '1/4컵')]","저는 순두부는 그다지 좋아하지 않는데 백선생에 나온 순두부 양념장은 만들어놓으면 요긴해서 만들어 쓰고 있어요
만들어두면 찌개는 물론 마파두부 등 다양하게 먹을 수 있어 좋더라구요^^

1컵 = 종이컵, 1T = 밥숟가락","[{'step_number': 1, 'description': '대파, 양파는 잘게 썰어 준비해주세요\n돼지고기 다짐육은 1컵보다 더 넣어셔도 좋아요\n간도 덜 짜져서 고기 듬뿍 들어간 소스가 완성된답니다', 'image_url': 'https://recipe1.ezmember.co.kr/cache/recipe/2022/06/21/f101c04d5ad1e362e849901c3cf75af61.jpg'}, {'step_number': 2, 'description': '팬에 참기름과 식용유를 반씩 섞어 1/2컵을 붓고 대파를 볶아주세요\n파가 숨이 죽을 때까지 볶아주세요중약불로 볶아야 파향이 우러나 좋아요', 'image_url': 'https://recipe1.ezmember.co.kr/cache/recipe/2022/06/21/23a1a847c55c353898f3f26ba31e38451.jpg'}, {'step_number': 3, 'description': '다진 돼지고기를 넣고 볶아주세요\n이 때 돼지고기를 넣고 바로바로 볶아주셔야 뭉치는 곳 없이 골고루 볶아진답니다\n고기의 표면이 하얗게 변할 때까지 볶아주세요다짐육을 냉동해 두었다가 해동해서 쓰는 경우 해동 후 표면의 수분은 키친타올로 닦아주시면 냄새제거에 도움이 됩니다', 'image_url': 'https://recipe1.ezmember.co.kr/cache/recipe/2022/06/21/8dd769dd974373ed0754757af703f4a81.jpg'}, {'step_number': 4, 'description': '양파를 넣고 볶아줍니다\n양파의 수분이 날아가 기름만 남을 때까지 볶아주세요\n이 단계가 가장 시간이 걸리는 단계에요\n양념장이 양이 많기 때문에 오래 보관하시려면 수분을 제대로 날려주셔야 해요', 'image_url': 'https://recipe1.ezmember.co.kr/cache/recipe/2022/06/21/4132bbc487ed836c7c842c7b66d4574a1.jpg'}, {'step_number': 5, 'description': '4에 다진마늘과 꽃소금, 고춧가루와 진간장+국간장을 섞어 1/2컵을 넣고 골고루 섞어 잠깐동안만 볶아주시면 다양한 요리에 쓸 수 있는 고추기름 좔좔 백종원 만능순두부양념장 완성이에요^^\n양념장이라 간이 쎈편이나 물넣고 끓여먹는 찌개용이라 짠 건 당연해요간이 쎈 편이라 저는 양념을 많이 넣어 먹고 싶어서 간장과 소금양을 조금 줄여서 넣었더니 더 좋더라구요\n간은 취향에 따라^^', 'image_url': 'https://recipe1.ezmember.co.kr/cache/recipe/2022/06/21/a1f67d0cf60f7cf381198db540beb3a51.jpg'}, {'step_number': 6, 'description': '꽤 여러 번 해 먹을 수 있는 양이라 지퍼백에 소분해 통에 담아 냉동해두고 드시면 오래 드실 수 있답니다^^', 'image_url': 'https://recipe1.ezmember.co.kr/cache/recipe/2022/06/21/cc8e037501dce5c6dc805b817b39d2eb1.jpg'}]"
151549,양념/잼/소스,일상,돼지고기,볶음,백종원 약고추장 돼지고기 볶음고추장,돼지고기볶음고추장,https://recipe1.ezmember.co.kr/cache/recipe/2021/04/10/9e080a79857052c77906fe9606c0b8121.jpg,"31,078",30분 이내,초급,6인분 이상,"[('고추장', '2컵'), ('다진양파', '3컵'), ('다진대파', '1컵'), ('다진돼지고기', '1컵'), ('다진마늘', '1/3컵'), ('설탕', '1/2컵'), ('식용유', '1컵'), ('진간장', '2T')]","열반찬 안부러운 볶음고추장~ 비빔밥소스로는 말할것도 없고, 삼각김밥 만들기도 최고에요","[{'step_number': 1, 'description': '양파는 다져서 3컵 분량을 준비해주세요', 'image_url': 'https://recipe1.ezmember.co.kr/cache/recipe/2021/04/10/3474aedb7bfe8bbe7421afc4ef1929251.jpg'}, {'step_number': 2, 'description': '대파도 반으로 갈라 잘게 다져서 1컵분량을 준비합니다.', 'image_url': 'https://recipe1.ezmember.co.kr/cache/recipe/2021/04/10/250d0c07881d31f27559622f9e9761ce1.jpg'}, {'step_number': 3, 'description': '다진 마늘은 1/3컵을 준비하는데 저는 양을 잘못보고 1/2컵을 준비했어요 ㅎㅎ(그래도 맛은 최고최고)', 'image_url': 'https://recipe1.ezmember.co.kr/cache/recipe/2021/04/10/c479fffee88d6d52e73f9f60af3720781.jpg'}, {'step_number': 4, 'description': '다진돼지고기는 1종이컵 분량인데요 사진처럼 그냥 한컵이 아니고 한컵 듬뿍 넣어야 됩니다. 저는 사진만 찍고 다진돼지고기를 조금더 추가해주었어요.', 'image_url': 'https://recipe1.ezmember.co.kr/cache/recipe/2021/04/10/3022e946835bb780edf64683fc9e0bbc1.jpg'}, {'step_number': 5, 'description': '백종원씨가 시작할때 주의사항을 하나 알려주었는데요. 바로 볶음고추장을 만들때는 코팅된 팬을 사용하라는거~♡', 'image_url': 'https://recipe1.ezmember.co.kr/cache/recipe/2021/04/10/0a3807dafc06e48f0409c03ef92a6d081.jpg'}, {'step_number': 6, 'description': '코팅팬에 불을 올리고 식용유를 한컵 부어주세요.', 'image_url': 'https://recipe1.ezmember.co.kr/cache/recipe/2021/04/10/323cf0ad25fd854246399f656b5283c21.jpg'}, {'step_number': 7, 'description': '그리고 곧바로 준비한 대파,다진마늘, 양파, 다진돼지고기를 모두 넣어주세요.', 'image_url': 'https://recipe1.ezmember.co.kr/cache/recipe/2021/04/10/19ff3d4982dae3d79efe45ff1c1852591.jpg'}, {'step_number': 8, 'description': '재료가 모두 잘 섞일수 있게 볶아주다보면 기름기는 보이지 않고 수분이 많아질거에요.', 'image_url': 'https://recipe1.ezmember.co.kr/cache/recipe/2021/04/10/aa72418dc42661b50c9c3607e105286f1.jpg'}, {'step_number': 9, 'description': '그 수분이 사라지면서 다진돼지고기에서 기름이 조금씩 나오기 시작해요. \n어? 기름을 너무 많이 넣었나? 라는 생각이 들 정도로 기름이 충분히 나올때까지 볶아주세요', 'image_url': 'https://recipe1.ezmember.co.kr/cache/recipe/2021/04/10/c9ad7cd0ab7ebba3c87a25573ad541141.jpg'}, {'step_number': 10, 'description': '기름이 충분히 나왔다면 설탕을 부어서 기름에 튀겨지듯 볶아주세요.', 'image_url': 'https://recipe1.ezmember.co.kr/cache/recipe/2021/04/10/f083004b751ae4bc002d53197fea80581.jpg'}, {'step_number': 11, 'description': '설탕이 눌면서 뽑기냄새 같은 달짝한 향이 올라오면', 'image_url': 'https://recipe1.ezmember.co.kr/cache/recipe/2021/04/10/fcd16b89c58d7247f39b52f2217d76f31.jpg'}, {'step_number': 12, 'description': '재료와 팬이 맞닿는 사이드에 간장을 둘러서 간장향을 내주세요.', 'image_url': 'https://recipe1.ezmember.co.kr/cache/recipe/2021/04/10/0ced20cd531f79ba6f07cb7da0eb4b2b1.jpg'}, {'step_number': 13, 'description': '주변에 둘러넣었던 간장이 어느정도 눌면 재료와 섞어준 후에 고추장을 넣어줍니다.', 'image_url': 'https://recipe1.ezmember.co.kr/cache/recipe/2021/04/10/446753857c578c5f565984c124196d1d1.jpg'}, {'step_number': 14, 'description': '그리고는 고추장을 풀어주면서 볶아주세요.', 'image_url': 'https://recipe1.ezmember.co.kr/cache/recipe/2021/04/10/72682ce6f0c6a70d55d680f9bae43e9f1.jpg'}, {'step_number': 15, 'description': '잘 섞였으면 불을 약불로 줄여서 충분히 오랫동안 볶아줄거에요.\n백종원씨는 이과정이 가장 중요하다고 설명하더라고요. 여기서 약고추장 의 완성도가 갈린다고 합니다.', 'image_url': 'https://recipe1.ezmember.co.kr/cache/recipe/2021/04/10/f0e7633306a06c66447d2b61a5ce74361.jpg'}, {'step_number': 16, 'description': '볶음고추장을 10분 이상 충분히 볶아주어야 깊은맛의 백종원 볶음고추장이 만들어진다고 해요.', 'image_url': 'https://recipe1.ezmember.co.kr/cache/recipe/2021/04/10/48a029359de5b08e4ab7a31039070ec31.jpg'}, {'step_number': 17, 'description': '그렇게 10분이상 볶아내면 백종원 볶음고추장 완성입니다.', 'image_url': 'https://recipe1.ezmember.co.kr/cache/recipe/2021/04/10/51c86236587540d6a2659ebe16fb333a1.jpg'}, {'step_number': 18, 'description': '볶음고추장 은 식힌 후에 용기에 담아 냉장고에 보관해주세요.', 'image_url': 'https://recipe1.ezmember.co.kr/cache/recipe/2021/04/10/37d0532a9555f661b6f5a5b60c2ad1af1.jpg'}, {'step_number': 19, 'description': '볶음고추장 하나면 열반찬 안부러워요. 비빔밥도 먹고, 쌈도 싸먹고 말이쥬~ 그리고 저는 밥에 쓱쓱 비빈다음에 김에 싸먹는걸 좋아하는데 그렇게 먹으면 넘 맛있어요♡', 'image_url': 'https://recipe1.ezmember.co.kr/cache/recipe/2021/04/10/45ae065c91d165f62cb10e89170b19b41.jpg'}, {'step_number': 20, 'description': '맛있게 만들어드시길 바래요 ^^', 'image_url': 'https://recipe1.ezmember.co.kr/cache/recipe/2021/04/10/182ed915bb5e8582dec8b0df0b1486f21.jpg'}]"
151550,양념/잼/소스,일상,돼지고기,볶음,냉장고 털기! 일본 골든커리로 든든한 한끼 카레만들기,카레,https://recipe1.ezmember.co.kr/cache/recipe/2019/01/13/d0294ebca2b09465a1bc034ca70c28a41.jpg,"17,328",30분 이내,아무나,4인분,"[('카레용 돼지고기', '150g'), ('감자', '1개'), ('양파', '1/2개'), ('애호박', '1/2개'), ('당근', '1/2개'), ('소금', '1꼬집'), ('식용류', '적당량')]","일본 골든커리로 냉장고 털기 성공!! 쉬우면서 든든한 식사에요^^
한번 만들면 두끼는 해결되는 효자~","[{'step_number': 1, 'description': '재료를 준비해주세요. 야채는 깨끗하게 씻어주세요.돼지고기 대신 닭가슴살을 넣으면 칼로리도 낮아지고 의외로 맛있어요^^', 'image_url': 'https://recipe1.ezmember.co.kr/cache/recipe/2019/01/13/d141a0a85c48bbbb6a3d1e2dbdb3a08c1.jpg'}, {'step_number': 2, 'description': '감자, 양파, 당근, 애호박은 깍뚝설기로 먹기 좋게 잘라주세요. 저는 조금 작게 자르는 편이에요~가급적이면 야채들 크기를 비슷하게 맞춰주는게 좋겠죠?', 'image_url': 'https://recipe1.ezmember.co.kr/cache/recipe/2019/01/13/c8db208ddca13ce4800a2f5a9d43d46d1.jpg'}, {'step_number': 3, 'description': '기름을 두른 냄비에 돼지고기를 볶다가 당근을 넣고 30초 정도 같이 볶아주세요.쎈불', 'image_url': 'https://recipe1.ezmember.co.kr/cache/recipe/2019/01/13/c670b37e3b08d8206766168558f82cbb1.jpg'}, {'step_number': 4, 'description': '그 다음으로는 감자를 넣고 또 30초 동안 잘 볶아주세요.쎈불', 'image_url': 'https://recipe1.ezmember.co.kr/cache/recipe/2019/01/13/0456fd4bc11817070f7c2053933275941.jpg'}, {'step_number': 5, 'description': '애호박과 양파를 넣고 소금을 한꼬집 넣어주시고 30초 정도 잘 볶아주세요.쎈불', 'image_url': 'https://recipe1.ezmember.co.kr/cache/recipe/2019/01/13/2ad1de452806ce8b2b1cb5fd96062bea1.jpg'}, {'step_number': 6, 'description': '물 750ml를 넣고 10분 정도 끓여주세요.중불', 'image_url': 'https://recipe1.ezmember.co.kr/cache/recipe/2019/01/13/7b5e85d65e12a802d2289f144224c84f1.jpg'}, {'step_number': 7, 'description': '저는 일본의 골든커리(고체)를 절반 넣었어요.골든커리 1상자는 12인분이에요. 절반만 사용했어요^^', 'image_url': 'https://recipe1.ezmember.co.kr/cache/recipe/2019/01/13/baeedcd8d1ef41cf1938fe0a550d81431.jpg'}, {'step_number': 8, 'description': '불을 끄고 고체카레를 4등분 또는 6등분 해서 넣고 잘 풀어주세요.중불고체카레를 섞을때는 꼭 불을 꺼주시고 덩어리가 남지 않도록 잘 풀어주세요.', 'image_url': 'https://recipe1.ezmember.co.kr/cache/recipe/2019/01/13/fe564492e369eb3745c99194ff498d041.jpg'}, {'step_number': 9, 'description': '고체 커리가 잘 녹았으면 다시 불을 키고 5분 정도 끓여주세요. 이때는 약불로 커리를 살짝만 데운다는 느낌으로 끓여주면 완성!약불카레가 눌러붙지 않도록 계속 저어주세요.', 'image_url': 'https://recipe1.ezmember.co.kr/cache/recipe/2019/01/13/5c8b6ede93f630d2a343300dfcb2a1cc1.jpg'}]"
151551,양념/잼/소스,일상,돼지고기,볶음,백종원 오므라이스 소스 레시피 : 스파게티까지!!,오므라이스소스,https://recipe1.ezmember.co.kr/cache/recipe/2016/06/22/4fb672cfe5a785683f5c341800f1756d1.jpg,"25,050",30분 이내,초급,3인분,"[('식용유', '1/2컵'), ('버터', '1/2개'), ('후추', '조금'), ('간장                                                                                또는 우스타소스 우스타가 없으실때는 식초2수저', '1/2컵'), ('케첩', '2컵'), ('설탕', '2수저'), ('마늘', '2수저'), ('양파', '3컵'), ('파', '1컵'), ('당근', '1컵'), ('버섯                                                                                이나 피망', '1컵'), ('다진고기', '1컵')]","백종원 오므라이스 소스 레시피 : 스파게티까지!! 집밥백선생에서 오므라이스 편이 나왔는데, 제가 오므라이스를 즐겨 먹는 편은 아닌데도 따라해보고 싶다는 생각이 마구마구 ㅋㅋㅋㅋㅋㅋㅋㅋ그래서 다진고기만 사와서 준비해봐찌요 재료계량은 소주잔으로 했어요","[{'step_number': 1, 'description': '두둥 ㅋㅋㅋㅋㅋㅋㅋㅋ 엄청 귀엽지염', 'image_url': 'https://recipe1.ezmember.co.kr/cache/recipe/2016/06/30/8941fd577d47a86213166deb880c57131.jpg'}, {'step_number': 2, 'description': '다 준비되면 팬을 약불로 달군후 식용유를 넣어주세요', 'image_url': 'https://recipe1.ezmember.co.kr/cache/recipe/2016/06/30/72f7282e5b27a724ad3be01b190f97da1.jpg'}, {'step_number': 3, 'description': '그후 간고기를 넣어주시구용', 'image_url': 'https://recipe1.ezmember.co.kr/cache/recipe/2016/06/30/1f48fb6913ab4e98f081900b832320951.jpg'}, {'step_number': 4, 'description': '그후 모든 야채를 다 넣어주세요', 'image_url': 'https://recipe1.ezmember.co.kr/cache/recipe/2016/06/30/1e95b653261a3a7c311c0a81c55bbd851.jpg'}, {'step_number': 5, 'description': '당근넣구 양파넣구 파넣구 파프리카 버섯 다 넣어주세요.', 'image_url': 'https://recipe1.ezmember.co.kr/cache/recipe/2016/06/30/dc1220c603df85c8db91189e6e2b8c411.jpg'}, {'step_number': 6, 'description': '그후 볶아주세용 볶다가 마늘 2수저를 넣구~ 설탕도 2수저~ 간장반컵!!저는 우스타 1/3도 넣어줬어요 맛이 더 고급질거라구 해서 훗.... 그리고 케첩 두컵', 'image_url': 'https://recipe1.ezmember.co.kr/cache/recipe/2016/06/30/09b50aa16ea3e3867add7ae71b2f85371.jpg'}, {'step_number': 7, 'description': '그 리고 잘 저어준후 버터를 넣어주세요 버터는 안넣어두 되는데 넣으면 더욱 풍미가 깊어진다고 해요 요렇게 백종원 오므라이스소스 완성 !!!', 'image_url': 'https://recipe1.ezmember.co.kr/cache/recipe/2016/06/30/cdbf4f5b9304baddf58da3405e5b70911.jpg'}, {'step_number': 8, 'description': '이걸 밥에 비벼주면 되는데 저는 갑자기 그냥 파스타가 먹고싶은거예요. 그래서 결국 두둥 파스타면을 삶게 되어쪄요 그후에 그냥 먹어도 되지만 ? 치즈를 올리면 더욱 맛있다고 하셔서 치즈를 솔솔솔 그위에 체다치즈도 넣규 전자렌지에 돌려주세요전자레인지', 'image_url': 'https://recipe1.ezmember.co.kr/cache/recipe/2016/06/30/3c2f22ae8486e14ae8d0a6673f9866651.jpg'}, {'step_number': 9, 'description': '짜짠 오븐치즈파스타같지용? 파스타가 완성되떠요', 'image_url': 'https://recipe1.ezmember.co.kr/cache/recipe/2016/06/30/3ed1adec8b2484a67a8024a0130b23cd1.jpg'}]"
151552,양념/잼/소스,일상,돼지고기,볶음,쌈장 만드는 법 봄나물 우엉잎쌈 돼지고기 견과류 쌈장,쌈장,https://recipe1.ezmember.co.kr/cache/recipe/2022/03/28/96adc6f2a88c1fbcd5191c801e4eb5ae1.jpg,"1,840",30분 이내,초급,6인분 이상,"[('된장', '1컵'), ('고추장', '2/3컵'), ('돼지고기 다짐육', '300g'), ('견과류', '2/3컵'), ('양파', '1/3개'), ('통마늘', '10개'), ('식용유', '1큰술'), ('올리고당', '2큰술'), ('다시마육수', '1.5컵'), ('진간장', '1큰술'), ('다진마늘', '1큰술'), ('설탕', '1큰술'), ('후추', '톡톡')]","봄이 되면 봄나물로 쌈을 많이 먹게 되기에

쌈장을 넉넉하게 만들어 놓곤 하지요

돼지고기 다짐육을 넣고 견과류 넣어 만든 #쌈장 #쌈장만드는법

#돼지고기쌈장 #견과류쌈장 #돼지고기쌈장만드는법 #견과류쌈장만드는법 입니다
우엉 잎을 찜 솥에 쪄서 쌈장 올려 한입에 쏘옥 너무 맛있게 먹은

#봄나물 #봄나물쌈 #우엉잎쌈 과 쌈장입니다

​

아마도 우엉 잎은 생소하신 분들이 많으실 것 같아요

우리가 주로 먹는 뿌리채소 우엉과 잎을 쌈으로 먹는 우엉 종류가 있더라고요

​
​
​","[{'step_number': 1, 'description': '돼지고기 다짐육은 진간장 설탕 다진 마늘 후추를 넣고 밑간을 해줍니다\n된장과 고추장에 견과류와 돼지고기 다짐육을 넣고 볶아 놓으면\n조금 오랜 시간 냉장고에 넣어두고 먹을 수 있어요', 'image_url': 'https://recipe1.ezmember.co.kr/cache/recipe/2022/03/28/77b1a885b88db8b9d5f6b42eaf0d4c7d1.jpg'}, {'step_number': 2, 'description': '견과류는 다져주면 되는데 커터기로 갈아놓았어요\n몸을 아끼지 않고 미련하게 일을 했는데 이젠 조금씩 제 몸은\n제가 아껴야 한다는 생각에\n될 수 있으면 조금 편하게 요리도 하려고요 ㅎㅎ', 'image_url': 'https://recipe1.ezmember.co.kr/cache/recipe/2022/03/28/88640a01c723e422c2aad78855575c751.jpg'}, {'step_number': 3, 'description': '양파와 통마늘도 커터기로 갈아주었어요', 'image_url': 'https://recipe1.ezmember.co.kr/cache/recipe/2022/03/28/b8370942676082ca0d52b36573e7f3631.jpg'}, {'step_number': 4, 'description': '팬에 식용유를 둘러준 다음 양파와 다진 마늘을 넣고 볶다가\n밑간 한 돼지고기다짐육을 넣고 볶아줍니다', 'image_url': 'https://recipe1.ezmember.co.kr/cache/recipe/2022/03/28/6cb49c68a95bea70889f44ec3aa121491.jpg'}, {'step_number': 5, 'description': '고기가 80% 이상 익었을 때 육수를 붓고 된장과 고추장을 넣어 끓여줍니다', 'image_url': 'https://recipe1.ezmember.co.kr/cache/recipe/2022/03/28/b41f0ce7438054fd4ba65e82247073801.jpg'}, {'step_number': 6, 'description': '끓일 때 보글보글 기포가 생기면서 튀기 때문에 화상을 입을 수 있어요\n불을 약불로 줄이고 뚜껑을 닫고 졸여주었어요\n한소끔 끓고 나면 견과류를 넣고 볶으면서 수분을 날려줍니다', 'image_url': 'https://recipe1.ezmember.co.kr/cache/recipe/2022/03/28/d1f1c56af7a8dc8011c22b69c54114111.jpg'}, {'step_number': 7, 'description': '마지막에 올리고당을 넣고 휘리릭 볶은 다음 마무리해 줍니다\n시간을 두고 먹을 쌈장에는 참기름을 넣지 않고\n먹을 때 그릇에 덜어서 참기름을 조금 넣어주는 게 좋아요', 'image_url': 'https://recipe1.ezmember.co.kr/cache/recipe/2022/03/28/e4857e1138ef6f68b92390407faace5e1.jpg'}, {'step_number': 8, 'description': '견과류와 돼지고기가 씹히는 식감에\n고소하고 짜지 않은 돼지고기 쌈장 견과류 쌈장 완성입니다', 'image_url': 'https://recipe1.ezmember.co.kr/cache/recipe/2022/03/28/8da16c2bacae4824a8fac2cc7db531c91.jpg'}, {'step_number': 9, 'description': '봄이 되면 텃밭 채소들을 무쳐 먹을 때도 쌈을 먹을 때도\n든든한 쌈장 만들었어요\n지금 미니 비닐하우스에서 상추와 루콜라 쑥갓들이 자라고 있거든요\n곰취도 새순이 나왔기에 앞으로는 쌈장 먹을 일이 많겠지요', 'image_url': 'https://recipe1.ezmember.co.kr/cache/recipe/2022/03/28/601ac590cb8f0cb8ef22ad821b8c32361.jpg'}]"
