index,종류별,상황별,재료별,방법별,글 제목,레시피이름,레시피이미지,조회수,조리시간,난이도,인분,재료,소개글,조리순서
53991,찌개,손님접대,소고기,끓이기,우삼겹된장찌개 레시피,우삼겹된장찌개,https://recipe1.ezmember.co.kr/cache/recipe/2023/03/27/48b5b2598f9aafc55c917f5874e4e9c11.jpg,"5,428",30분 이내,초급,2인분,"[('우삼겹', '160g'), ('양파', '1/4개'), ('감자', '1/2개'), ('애호박', '1/3개'), ('표고버섯', '1줌'), ('두부', '1/2개'), ('청양고추', '1개'), ('대파', '1/2개'), ('후춧가루', '2꼬집'), ('된장', '2큰술'), ('고추장', '0.5큰술'), ('고춧가루', '1큰술'), ('다진마늘', '1큰술'), ('맛소금', '약간')]",홈쇼핑에서 구매한 알렉스 우삼겹으로 된장찌개를 끓였는데 정말 맛있었어요!,"[{'step_number': 1, 'description': '소포장이라 냉동실 공간차지를 별로 안해서 너무 좋았어요 1팩을 준비했습니다우삼겹 160g', 'image_url': 'https://recipe1.ezmember.co.kr/cache/recipe/2023/03/27/710ddb4c40295a1f4a66f97dc984cf7a1.jpg'}, {'step_number': 2, 'description': '애호박, 양파, 감자를 먹기 좋게 썰었어요감자 1/2개, 애호박 1/3개, 양파 1/4개', 'image_url': 'https://recipe1.ezmember.co.kr/cache/recipe/2023/03/27/3bd529f142672c2ef446539368ca1a531.jpg'}, {'step_number': 3, 'description': '청양고추, 홍고추, 대파도 썰어서 미리 준비했습니다청양고추 1개, 홍고추 1개, 대파 1/2개홍고추는 생략 가능합니다', 'image_url': 'https://recipe1.ezmember.co.kr/cache/recipe/2023/03/27/55a3142032f18efb22a7c5582e7110331.jpg'}, {'step_number': 4, 'description': '두부도 미리 썰어놓으면 나중에 편해요두부 1/2모', 'image_url': 'https://recipe1.ezmember.co.kr/cache/recipe/2023/03/27/6a8b7856cd87d0f529871425ed6d39231.jpg'}, {'step_number': 5, 'description': '우삼겹을 우선 팬에 볶아주세요 볶을 때 후추 2꼬집정도 넣었습니다우삼겹 160g, 후추 2꼬집프라이팬중약불', 'image_url': 'https://recipe1.ezmember.co.kr/cache/recipe/2023/03/27/6addbda9b5737206d639b44037b4f43a1.jpg'}, {'step_number': 6, 'description': '키친타올에 구운 우삼겹을 놓고 기름을 가볍게 한 번 빼줬어요키친타올기름기를 한번 제거해주면 더욱 담백한 된장찌개를 만들 수 있어요', 'image_url': 'https://recipe1.ezmember.co.kr/cache/recipe/2023/03/27/49f6823d65d68a7e3fd7377dc4726b051.jpg'}, {'step_number': 7, 'description': '냄비에 기름 뺀 우삼겹을 넣고 물을 부어주세요우삼겹 160g, 물 7~800ml냄비강불', 'image_url': 'https://recipe1.ezmember.co.kr/cache/recipe/2023/03/27/2188b8fecf609e2c9251af8cfe3bb4791.jpg'}, {'step_number': 8, 'description': '된장 2큰술을 넣어주세요강불', 'image_url': 'https://recipe1.ezmember.co.kr/cache/recipe/2023/03/27/c6825c45922da16798dd56af7537f0a31.jpg'}, {'step_number': 9, 'description': '고추장은 0.5큰술 넣었습니다', 'image_url': 'https://recipe1.ezmember.co.kr/cache/recipe/2023/03/27/eefe4dc30d052398b82ab6942b9f0fab1.jpg'}, {'step_number': 10, 'description': '다진마늘 1큰술, 감자 넣어주세요중불', 'image_url': 'https://recipe1.ezmember.co.kr/cache/recipe/2023/03/27/ed965117211e4a00b51fab0e28762b0d1.jpg'}, {'step_number': 11, 'description': '감자를 넣은 후 끓으면 양파와 애호박 넣어주세요중불', 'image_url': 'https://recipe1.ezmember.co.kr/cache/recipe/2023/03/27/aab0256f1c4386d2b4f47f378c8c597f1.jpg'}, {'step_number': 12, 'description': '바글바글 끓으면 고춧가루 1큰술 넣어주세요중불', 'image_url': 'https://recipe1.ezmember.co.kr/cache/recipe/2023/03/27/b5bbe9dace9002c3cdc4026356d163711.jpg'}, {'step_number': 13, 'description': '두부와 표고버섯도 넣었어요', 'image_url': 'https://recipe1.ezmember.co.kr/cache/recipe/2023/03/27/5cdf03390e1412ad7e0e3767323be6341.jpg'}, {'step_number': 14, 'description': '마지막에 청양고추와 대파도 넣어주세요중약불', 'image_url': 'https://recipe1.ezmember.co.kr/cache/recipe/2023/03/27/d1e2c9a0b737aa06a25b2be3ef33ff921.jpg'}, {'step_number': 15, 'description': '너무 맛있게 만들어져서 깜짝 놀랐어요 양념도 많이 안들어갔는데 남편도 잘 먹었어요', 'image_url': 'https://recipe1.ezmember.co.kr/cache/recipe/2023/03/27/30a5e1ae1b3c75818ed605c91dd4d9cf1.jpg'}]"
53992,찌개,손님접대,소고기,끓이기,암예방레시피 소고기 스튜 헝가리 굴라쉬 건강한 음식!,소고기스튜,https://recipe1.ezmember.co.kr/cache/recipe/2019/08/26/042acc0d9756005afc49ea5cc0abd4081.jpg,"16,740",30분 이내,아무나,6인분 이상,"[('소고기', '400g'), ('양파', '1개'), ('파프리카', '1개'), ('마늘', '6톨'), ('새송이버섯', '180g'), ('감자', '360g'), ('당근', '130g'), ('아스파라거스', '2개'), ('버터', '43g'), ('밀가루', '2큰술'), ('\u200b토마토페이스트', '250g'), ('케첩', '5큰술'), ('파프리카가루', '3큰술'), ('소금', '0.8큰술'), ('설탕', '1큰술'), ('레드와인', '120ml'), ('물', '600ml')]","집에 기르던 바질도 따서 올려 놓고
은근하게 우려진 소고기 양지 국물 맛에
포근하게 뭉그러진 감자가 국물을 부드럽고 고소하게 풀어주고
토마토페이스트의 새콤함이 혀끝에 맵 도는데요.
비타민C 풍부한 파프리카를 넣어 맵지 않고
영양 음식 건강음식으로 즐길만한 아주 고급스러운 스튜가 만들어졌어요.
소고기 스튜 헝가리 굴라쉬 ~
말이 필요 없는 맛이더라고요.
건강에 좋은 야채 마구 넣어
채수 맛과 고기 육수 맛이 골고루 배서
먹을수록 감칠맛이 느껴지더라고요.
한식과도 잘 어울리는 건강 음식입니다.
​","[{'step_number': 1, 'description': '야채와 고기 양념 모두 준비하고요.\n고기는 핏물 제거하고요.', 'image_url': 'https://recipe1.ezmember.co.kr/cache/recipe/2019/08/26/f2736e5ba63f8feb9954ad30d8a0be861.jpg'}, {'step_number': 2, 'description': '양파는 잘게 다지고 마늘 다지고\n아스파라거스는 1/2로 자르고\n파프리카는 사각으로 먹기 좋은 사이즈로 자르고', 'image_url': 'https://recipe1.ezmember.co.kr/cache/recipe/2019/08/26/3aadaeaf038063bd2d93bee396e288961.jpg'}, {'step_number': 3, 'description': '당근, 새송이버섯, 감자는 굵직하게 잘라줬어요.', 'image_url': 'https://recipe1.ezmember.co.kr/cache/recipe/2019/08/26/18ca4bfa5d3d29ff4999033c567c239a1.jpg'}, {'step_number': 4, 'description': '고기는 두툼하고 굵게 잘랐어요.\n사방 2cm 정도', 'image_url': 'https://recipe1.ezmember.co.kr/cache/recipe/2019/08/26/eab44e7db1dfc26a5b0dfa1e4998d81f1.jpg'}, {'step_number': 5, 'description': '고기에 밀가루를 넣고 묻힙니다.\n소고기 스튜 농도 조절에 필요해요.', 'image_url': 'https://recipe1.ezmember.co.kr/cache/recipe/2019/08/26/69568fa80fecbedbbe408d4082fb45931.jpg'}, {'step_number': 6, 'description': '압력솥에 버터 넣고 양파와 마늘 넣고 볶아주고요.\n올리브유 대체하면 더 건강한 요리가 되겠지요.', 'image_url': 'https://recipe1.ezmember.co.kr/cache/recipe/2019/08/26/7d71fc22a97677765c54498d8ba3b6091.jpg'}, {'step_number': 7, 'description': '양파 색이 변하고 갈색으로 볶으면 좋겠어요.\n저는 급해서 투명한 정도에서 멈췄어요.', 'image_url': 'https://recipe1.ezmember.co.kr/cache/recipe/2019/08/26/061d760013785b06149706c0802386c71.jpg'}, {'step_number': 8, 'description': '고기를 넣고 볶고요.', 'image_url': 'https://recipe1.ezmember.co.kr/cache/recipe/2019/08/26/a28d10fc2428effd11592028a2c48ed61.jpg'}, {'step_number': 9, 'description': '레드와인도 둘러서 풍미를 더했어요.', 'image_url': 'https://recipe1.ezmember.co.kr/cache/recipe/2019/08/26/0a8abff43d6626c9a37d07ac647444de1.jpg'}, {'step_number': 10, 'description': '야채 모두 넣고 물 600ml 붓고', 'image_url': 'https://recipe1.ezmember.co.kr/cache/recipe/2019/08/26/d2f2a4360c1eb71173d2dbdd07b311ec1.jpg'}, {'step_number': 11, 'description': '토마토페이스트 만든 것 넣고', 'image_url': 'https://recipe1.ezmember.co.kr/cache/recipe/2019/08/26/9d0c2e6c0e96d35d57181829ed80379a1.jpg'}, {'step_number': 12, 'description': '파프리카 가루도 준비한 분량을 넣었어요.', 'image_url': 'https://recipe1.ezmember.co.kr/cache/recipe/2019/08/26/3d392105f4e71ea3e7b5193dd6cb62a51.jpg'}, {'step_number': 13, 'description': '토마토 3큰술 넣고 2큰술 추가해서 넣고요.', 'image_url': 'https://recipe1.ezmember.co.kr/cache/recipe/2019/08/26/55daa2076d456876f02930fdfb1ecc851.jpg'}, {'step_number': 14, 'description': '잘 풀어준 후 뚜껑 덮고\n첨엔 센 불 끓으면 불을\n중간불 이하로 20분 끓인 후', 'image_url': 'https://recipe1.ezmember.co.kr/cache/recipe/2019/08/26/ade0c07bb56961ba8f836803110a984d1.jpg'}, {'step_number': 15, 'description': '자연 김빠지게 두고\n뚜껑 열면 요런 비주얼이 나오더라고요.\n마지막에 싱거워서 소금 0.8큰술 풀어서 간을 맞췄어요.', 'image_url': 'https://recipe1.ezmember.co.kr/cache/recipe/2019/08/26/b012f749b39abf621a529f9ba9bdac1d1.jpg'}, {'step_number': 16, 'description': '헝가리 굴라쉬 생각보다 소금 양도 적게 들어가고\n토마토페이스트에도 소금양은 많이 들어가지 않았는데\n간도 좋으면서 저염식 식단으로 참 괜찮겠다 싶더라고요.', 'image_url': 'https://recipe1.ezmember.co.kr/cache/recipe/2019/08/26/b49507506a51408ef50edc5a4e6dee471.jpg'}]"
53993,찌개,손님접대,소고기,끓이기,무수분 소고기 스튜(우리 육우와 토마토의 만남!!),소고기스튜,https://recipe1.ezmember.co.kr/cache/recipe/2018/12/03/91504bb2daff850b4a913191c505a57f1.jpg,"6,244",30분 이내,아무나,2인분,"[('육우(등심)', '160g'), ('토마토', '2개'), ('감자', '1개'), ('양파', '1/4개'), ('당근', '1/8개'), ('빨간 파프리카', '1/2개'), ('통마늘', '5알'), ('케찹', '2큰술'), ('월계수잎', '2장')]",토마토의 수분만으로 만드는 우리 육우를 넣은 무수분 소고기 스튜에요. 입에서 살살 녹는 육우와 새콤 달콤한 토마토의 조화가 좋고 빵까지 곁들이면 브런치로 더욱 좋아요.,"[{'step_number': 1, 'description': '재료준비\n- 육우는 키친타올에 올려 핏물 제거하기', 'image_url': 'https://recipe1.ezmember.co.kr/cache/recipe/2018/12/03/c9e9e0bd092fb0703285bbc560f9e7901.jpg'}, {'step_number': 2, 'description': '- 육우 한입 크기로 깍둑썰기한 후 허브소금 2꼬집 넣어 밑간하기', 'image_url': 'https://recipe1.ezmember.co.kr/cache/recipe/2018/12/03/4c04dc193c9d50bd68e7d56f27ec2ac01.jpg'}, {'step_number': 3, 'description': '- 토마토는 열십자 칼집 낸 후 뜨거운 물에 담가 놓기\n- 껍질이 들뜨면 꺼내 껍질 벗기기\nTip. 끓는 물에 넣어도 돼요. 뜨거우니 손 조심하세요!!', 'image_url': 'https://recipe1.ezmember.co.kr/cache/recipe/2018/12/03/2e679edc989b7d1439110f93139d6a9d1.jpg'}, {'step_number': 4, 'description': '- 껍질 벗긴 토마토 깍둑썰기(크기는 상관 없어요)\n- 감자는 육우보다 조금 작게 깍둑썰기\n- 빨간 파프리카, 양파, 당근은 조금 작게 깍둑썰기\n- 마늘 도톰하게 편썰기', 'image_url': 'https://recipe1.ezmember.co.kr/cache/recipe/2018/12/03/9bbf3399201efca18cc4ebaa5ad7dce61.jpg'}, {'step_number': 5, 'description': '- 팬에 기름 조금 두른 후 육우 넣어 센불에서 볶기', 'image_url': 'https://recipe1.ezmember.co.kr/cache/recipe/2018/12/03/6155b611f2ec1c207be2e58fcc1366291.jpg'}, {'step_number': 6, 'description': '- 육우 겉면 색이 변하면 마늘, 양파, 당근 넣어 중불에서 볶기', 'image_url': 'https://recipe1.ezmember.co.kr/cache/recipe/2018/12/03/26fdfc4439c139924b43b2948af4d0ac1.jpg'}, {'step_number': 7, 'description': '- 양파가 투명해지면 토마토 넣어 볶기', 'image_url': 'https://recipe1.ezmember.co.kr/cache/recipe/2018/12/03/feba9ee6891caf619bdd7e47855e78c91.jpg'}, {'step_number': 8, 'description': '- 토마토가 뭉개지면 나머지 재료 모두 넣어 끓이기', 'image_url': 'https://recipe1.ezmember.co.kr/cache/recipe/2018/12/03/680b5cff523e38ba5748d74f15616e901.jpg'}, {'step_number': 9, 'description': '-저는 치킨스톡 한꼬집과 파프리카가루도 조금 넣었는데 생략가능해서 레시피 분량에서 제외 했어요.', 'image_url': 'https://recipe1.ezmember.co.kr/cache/recipe/2018/12/03/846f5cc51f51eea300ed41d0f14555511.jpg'}, {'step_number': 10, 'description': '- 감자가 익으면 소금으로 간하기\nTip. 신맛이 강하면 설탕을 넣어가면서 신맛을 잡아주세요.', 'image_url': 'https://recipe1.ezmember.co.kr/cache/recipe/2018/12/03/efd4e02762b439d985996bbc1becbc251.jpg'}, {'step_number': 11, 'description': '우리 육우를 넣은 무수분 소고기스튜 완성~!', 'image_url': 'https://recipe1.ezmember.co.kr/cache/recipe/2018/12/03/53b66640329c951967840f71ebb7c3c01.jpg'}]"
53994,찌개,손님접대,소고기,끓이기,비프스튜(소고기스튜),소고기스튜,https://recipe1.ezmember.co.kr/cache/recipe/2016/03/08/706aab8d354e776ac522aa8431ce7b161.jpg,"57,812",120분 이내,초급,6인분 이상,"[('소고기(채끝)', '600g'), ('베이컨', '150g'), ('당근', '200g'), ('양파', '1개'), ('샐러리', '1대'), ('양송이', '150g'), ('치킨스톡', '1개'), ('레드와인', '360cc'), ('버터', '1T'), ('다진마늘', '1t'), ('다진양파', '1t'), ('설탕', '2T'), ('홀토마토', '1캔'), ('토마토소스', '1캔'), ('월계수잎', '2장')]","소고기 부채살스테이크 부위를 이용한 숙성부채살 스튜를 만들어 보려구요.
특수부위 부채살 자체로도 풍미가 좋은데 더욱 부드럽고 깊은맛을 느낄 수 있더라구요..
물론 몸에 좋은 야채도 잔뜩 넣어서 드시면 남녀노소 모두 느낄 수 있는 영양식이구요.
호텔에서 먹는 쉐프의 요리같은 느낌도 느껴 보실 수 있답니다.
단언컨대 만들어 드셔보시면 후회 안하실 거에요.","[{'step_number': 1, 'description': '소고기를 2센티로 깍뚝썰기하고 소금, 후추 간을한 후 10분간 재운뒤', 'image_url': 'https://recipe1.ezmember.co.kr/cache/recipe/2016/03/08/16d84f283807490cc792aa89683001ef1.jpg'}, {'step_number': 2, 'description': '팬에 오일을 1T두르고 모든면을 노릇하게 지져낸다.', 'image_url': 'https://recipe1.ezmember.co.kr/cache/recipe/2016/03/08/73947c03959387a9dd81e25013baf9e71.jpg'}, {'step_number': 3, 'description': '베이컨은 1센티정도 잘라 끓는 물에 데친다.', 'image_url': 'https://recipe1.ezmember.co.kr/cache/recipe/2016/03/08/eb0c3cf009d3037dd839712bb63a2fa21.jpg'}, {'step_number': 4, 'description': '당근, 양파,샐러리는 깍뚝썰기 한다. 양송이는 반으로 자른다.', 'image_url': 'https://recipe1.ezmember.co.kr/cache/recipe/2016/03/08/5a9282a56f98f6f1b8d84a05839cc9951.jpg'}, {'step_number': 5, 'description': '팬에 버터1T 넣고 양파,마늘 다진것1t 넣고 갈색이 나도록 볶는다.', 'image_url': 'https://recipe1.ezmember.co.kr/cache/recipe/2016/03/08/98931b1bfcc2bf28bd0e2711c554b59e1.jpg'}, {'step_number': 6, 'description': '5번에 지진고기, 레드와인,치킨스톡을 넣고 2/3를 졸인다.', 'image_url': 'https://recipe1.ezmember.co.kr/cache/recipe/2016/03/08/81133cf19c707bfc52cf65bce63cfc321.jpg'}, {'step_number': 7, 'description': '6에 홀토마토, 토마토소스 를 넣고 준비한 2,3번을 넣고', 'image_url': 'https://recipe1.ezmember.co.kr/cache/recipe/2016/03/08/f3fcc7bf0d19393ac9e3577dcef6bb281.jpg'}, {'step_number': 8, 'description': '월계수잎2장, 물3컵을 넣고 약불에서 뚜껑을 열고 1시간 이상 끓인다.', 'image_url': 'https://recipe1.ezmember.co.kr/cache/recipe/2016/03/08/05ea786e786dac2935c30d1e15c830c71.jpg'}, {'step_number': 9, 'description': '설탕2T를 넣고 간을한후 싱거우면 소금으로 간한다.(뚜껑은 팬에 걸쳐 놓듯이 얹어 놓는다.)', 'image_url': 'https://recipe1.ezmember.co.kr/cache/recipe/2016/03/08/6c01f29f3f7e821995f91f6be49a419d1.jpg'}]"
53995,찌개,손님접대,소고기,끓이기,우리 소고기로 만든 따끈한 비프스튜,소고기스튜,https://recipe1.ezmember.co.kr/cache/recipe/2015/07/28/d11ca8bc2867485ca7fd581bfa1a5960.jpg,"27,185",60분 이내,중급,5인분,"[('국내산 육우 안심', '500g'), ('당근', '1.5개'), ('감자 큰것', '2개'), ('양파', '1개'), ('샐러리 큰것 줄기', '2대'), ('월계수잎', '5장'), ('포도씨유', '3큰술'), ('올리고당', '2큰술'), ('토마토 페이스트', '100g'), ('다진마늘', '1/2큰술'), ('후추가루', '1작은술'), ('소금', '1/2큰술'), ('찬물', '3컵'), ('A1소스', '1/3컵'), ('우스터 소스', '3큰술'), ('밀가루', '5큰술'), ('버터', '5큰술')]",야들야들 부드러운 소고기 안심이 가득 따끈한 비프스튜입니다.,"[{'step_number': 1, 'description': '양파와 샐러리는 잘게 썰어 준비 합니다. 감자와 당근은 한입 크기로 썰어 모서리를 둥글게 깎아 줍니다. 소고기 안심은 한입 크기로 큼직하게 썰어 줍니다. 팬에 포도씨유 2큰술을 두르고 준비한 다진마늘과 채소를 볶아 줍니다. 감자의 표면이 살짝 투명해 지면 불에서 내려 줍니다. 팬에 포도씨유 1큰술을 두르고 후추를 뿌려가며 안심을 구워 줍니다.', 'image_url': 'https://recipe1.ezmember.co.kr/cache/recipe/2015/07/28/cae70ace8bc68c50b95d422d04d647df1.jpg'}, {'step_number': 2, 'description': '채소와 고기가 볶아지면 팬에 버터와 밀가루를 동량으로 넣어 줍니다. 중약불에서 계속 저어가며 진한 갈색빛이 돌도록 브라운 루를 만들어 줍니다. 냄비에 토마토 페이스트와 브라운루, 소금을 넣고 찬물을 부어 줍니다. 월계수잎과 A1소스, 우스터 소스를 넣고 중불로 가열해 줍니다.', 'image_url': 'https://recipe1.ezmember.co.kr/cache/recipe/2015/07/28/617fea8de42ebd77b3c658fa8189c9d61.jpg'}, {'step_number': 3, 'description': '소스가 끓기 시작하면 볶아둔 채소와 안심을 넣어 줍니다. 약불로 줄인후 밑이 눌지 않도록 저어가며 뭉근히 끓여 줍니다. 소스가 걸쭉해 지고 모든 재료가 뭉근하게 익으면 마지막에 올리고당을 넣어 줍니다.', 'image_url': 'https://recipe1.ezmember.co.kr/cache/recipe/2015/07/28/405d60702296c612391681461ffcf01a1.jpg'}]"
53996,찌개,손님접대,소고기,끓이기,불고기전골 양념 레시피 불고기버섯전골 만드는법,불고기버섯전골,https://recipe1.ezmember.co.kr/cache/recipe/2023/04/17/3d4b5c92b6dd4a4673f5e718389533d51.jpg,"10,007",30분 이내,초급,2인분,"[('불고기용 소고기', '300g'), ('표고버섯', '2개'), ('새송이버섯', '1개'), ('만송이 버섯', '1줌'), ('배춧잎', '4장'), ('양파 작은거', '1/2개'), ('대파', '1/2대'), ('청경채', '1개'), ('청양고추', '1개'), ('홍고추', '1개'), ('당근', '25g'), ('진간장', '2.5T'), ('황설탕', '2T'), ('맛술', '2T'), ('다진파', '1T'), ('다진마늘', '0.5T'), ('배즙', '2T'), ('참기름', '1T'), ('후추', '약간'), ('멸치다시마육수', '500ml'), ('국간장', '0.5T'), ('참치액', '1T'), ('다진마늘', '1t'), ('소금', '약간')]","보글보글 자작하게 끓는 국물과 달짝한 불고기 양념에 재운 고기, 쫄깃한 버섯과 채소를 듬뿍 넣은 한 냄비 푸짐한 불고기전골 준비했어요. 식탁 위에 올려 바로 끓여먹음 갖은 재료와 육수가 어우러져 담백하면서도 깊은 맛이 느껴져요.","[{'step_number': 1, 'description': '소고기는 얇게 썬 불고깃감을 준비하여 키친타월로 핏물을 제거해 줍니다.', 'image_url': 'https://recipe1.ezmember.co.kr/cache/recipe/2023/04/17/6ef2ed3a1f43e63306d1c227911ae9541.jpg'}, {'step_number': 2, 'description': '소불고기 양념 먼저 준비해요.진간장 2½ 큰 술, 황설탕 2 큰 술 맛술 2 큰 술, 다진 마늘 1/2 큰 술 배간 즙 2 큰 술, 참기름 1 큰 술 다진 파 1 큰 술, 후추 약간', 'image_url': 'https://recipe1.ezmember.co.kr/cache/recipe/2023/04/17/ccc858cf5dd165ce4e9645c38b7cb0d71.jpg'}, {'step_number': 3, 'description': '고기를 넣고 재워줍니다.고기는 덩어리지지 않게 하나씩 분리하여\n간이 잘 스며들도록 해줍니다.', 'image_url': 'https://recipe1.ezmember.co.kr/cache/recipe/2023/04/17/e5161349429bdb7acffe849d1dd1163a1.jpg'}, {'step_number': 4, 'description': '버섯은 모두먹기 좋은 크기로 손질해 주고, 표고버섯은 모양을 내어 주었습니다.버섯 손질법 레시피', 'image_url': 'https://recipe1.ezmember.co.kr/cache/recipe/2023/04/17/ca13c0ec3158792ad16371b83bca869a1.jpg'}, {'step_number': 5, 'description': '배춧잎은 크기에 따라 2~3등분 하여 세로로 썰어주고, 청경채는 밑동을 잘라주고, 대파는 길고 큼직하게 잘라줍니다. 양파는 채 썰어주었어요.', 'image_url': 'https://recipe1.ezmember.co.kr/cache/recipe/2023/04/17/8072f5708fc6675dd2405bf66d816fee1.jpg'}, {'step_number': 6, 'description': '당근과 고추도 썰어줍니다.', 'image_url': 'https://recipe1.ezmember.co.kr/cache/recipe/2023/04/17/b1a11c2be54b8827b39b1b64a1bcd7bc1.jpg'}, {'step_number': 7, 'description': '멸치 다시마 육수에 국간장 1/2 큰 술, 참치액 1 큰 술 ,다진 마늘 1 작은 술, 소금 약간 넣어 간을 해요.', 'image_url': 'https://recipe1.ezmember.co.kr/cache/recipe/2023/04/17/f8820e74452b754f60a82cecec92c4501.jpg'}, {'step_number': 8, 'description': '냄비에 손질하여둔 재료를 가장자리로 둘러 담고 가운데로 고기를 올려주어요.', 'image_url': 'https://recipe1.ezmember.co.kr/cache/recipe/2023/04/17/bc132ad6785e807c2b8cc5b7d7a8d1161.jpg'}, {'step_number': 9, 'description': '육수를 자작하게 부어 끓여줍니다.', 'image_url': 'https://recipe1.ezmember.co.kr/cache/recipe/2023/04/17/b832ec10ebfda3df6aeb0bcd4f983fe01.jpg'}, {'step_number': 10, 'description': '고기가 덩어리지지 않게 살살 풀어가며 간을 맞추어 줍니다.', 'image_url': 'https://recipe1.ezmember.co.kr/cache/recipe/2023/04/17/2744199b3963732b93d6d1cd21ea14281.jpg'}, {'step_number': 11, 'description': '버섯의 쫄깃하고 향긋한 맛과 달달한 소불고기, 어우러지는 채소까지 맛과 영양 가득 맛깔나요.', 'image_url': 'https://recipe1.ezmember.co.kr/cache/recipe/2023/04/17/87e2f0de2cdd80b38ca9ac96f6b8f8b21.jpg'}]"
