index,종류별,상황별,재료별,방법별,글 제목,레시피이름,레시피이미지,조회수,조리시간,난이도,인분,재료,소개글,조리순서
59897,면/만두,일상,소고기,무침,참간초 파스타 [참간초소스로 만드는 초간단 파스타! 편스토랑 류수영 레시피!],참간초파스타,https://recipe1.ezmember.co.kr/cache/recipe/2022/03/13/7a170250dde7330fe8b3ea3bd653eb251.jpg,"1,424",30분 이내,아무나,1인분,"[('스파게티면', '1인분'), ('양파', '1/4개'), ('고추', '1개'), ('방울토마토', '1/2개'), ('소고기 불고기용', '1컵'), ('참기름', '3스푼'), ('진간장', '3.5스푼'), ('식초', '1.5스푼'), ('설탕', '2스푼'), ('고춧가루', '1/2스푼'), ('깨', '1/2스푼')]","오늘은 참간초 파스타를 만들었어요.

​

'참간초? 이게 뭐지?' 이런 생각이 드실텐데요. 편스토랑을 보셨으면 아시는 분도 있으실 거예요. 참간초는 참기름, 간장, 식초를 기본으로 만든 양념장으로 버무린 냉파스타가 바로 참간초파스타예요. 

​

우리나라로 치면 간장냉비빔국수? 정도로 생각하면 되지 않을까요? 만드는 법도 간단하고 맛도 있는 이런 레시피! 전 정말 좋아요.","[{'step_number': 1, 'description': '우선 파스타면을 삶아야겠죠? \n냉파스타를 만들 거기 때문에 부드럽게 익히는 게 좋아요. 끓는 물에 9분정도 삶으면 부드럽게 익어요.', 'image_url': 'https://recipe1.ezmember.co.kr/cache/recipe/2022/03/13/b50804b07a74e416e5c3ab4ab9e83e251.jpg'}, {'step_number': 2, 'description': '양파와 모닝고추를 채썰어 준비해 두시고요. 방울토마토는 반으로 썰어 주세요.', 'image_url': 'https://recipe1.ezmember.co.kr/cache/recipe/2022/03/13/f9b0fcbf987761c5019a80e2c7a7f47e1.jpg'}, {'step_number': 3, 'description': '양념장을 만들게요.\n간장 3.5스푼, 참기름 3스푼, 식초 1.5스푼, 설탕 2스푼, 고추가루 1/2스푼, 깨 1/2스푼\n을 섞어서 간장양념을 만들어 주세요.\n만든 양념은 냉장고에 넣어 두고 차게 식혀 사용할 거예요. 냉파스타를 만들 거니까요.', 'image_url': 'https://recipe1.ezmember.co.kr/cache/recipe/2022/03/13/7be1f1c7ca4af08fbeaf34a7ebd5f5b71.jpg'}, {'step_number': 4, 'description': '소고기를 볶아 줄 차례예요. \n사실 편스토랑에서 류수영 배우는 분쇄돼지고기를 사용했는데요. 전 냉장고에 있던 불고기용 소고기를 활용했어요. 음식을 만들 때 재료는 항상 집에 있는 것을 최대한 활용하는 게 좋잖아요? \n소고기 볶을 때 양념은 소고기가 1컵일 경우,\n진간장 2스푼, 굴소스 1스푼, 참기름 1스푼 넣으시면 돼요.', 'image_url': 'https://recipe1.ezmember.co.kr/cache/recipe/2022/03/13/d1593b47e4e1ce73966684053f9ff0031.jpg'}, {'step_number': 5, 'description': '이제 삶아 둔 파스타면을 볼에 담고, 만들어서 냉장고에 넣어 뒀던 양념장을 섞어 주세요.', 'image_url': 'https://recipe1.ezmember.co.kr/cache/recipe/2022/03/13/1cfc8df64ecf791eb088dc7c539db5261.jpg'}, {'step_number': 6, 'description': '양념에 버무린 파스타면-> 양파채-> 고추채-> 볶은 소고기-> 반으로 자른 방울토마토-> 양파채+고추채\n차례로 올려 먹음직스럽게 담았어요.', 'image_url': 'https://recipe1.ezmember.co.kr/cache/recipe/2022/03/13/44a3f5201c54275be241901971e32c111.jpg'}, {'step_number': 7, 'description': '먹음직스럽지 않나요? 소고기볶음이 올라간 간장양념 냉파스타! 맛과 영양을 모두 갖춘 전천후 요리라는 생각이 드네요.', 'image_url': 'https://recipe1.ezmember.co.kr/cache/recipe/2022/03/13/36706df3a213716afe160514c93cdf661.jpg'}]"
