index,종류별,상황별,재료별,방법별,글 제목,레시피이름,레시피이미지,조회수,조리시간,난이도,인분,재료,소개글,조리순서
19073,메인반찬,일상,소고기,굽기,[스테이크굽는법] 미디엄레어로 스테이크 맛있게 굽는 팁을 모두 모았습니다~,스테이크,https://recipe1.ezmember.co.kr/cache/recipe/2020/08/11/d97fef41ec45df1c18fffa50556d6f411.jpg,"2,272",30분 이내,아무나,1인분,"[('살치살', '200g'), ('스테이크시즈닝                                                                                표면에촘촘히묻을만큼', ''), ('식용유', '듬뿍'), ('컬리플라워', '원하는만큼'), ('그린빈스', '원하는만큼'), ('소금', '톡톡'), ('올리브유', '1큰술'), ('후추', '톡톡')]","스테이크가 너무 먹고 싶어서, 살치살을 샀어요. 힘줄 센 것도 없고, 앗싸리 하면서 구웠답니다. 오늘은 야채에 더욱 신경을 써서 완벽한 스테이크 한 그릇을 완성했어요.","[{'step_number': 1, 'description': '야채가 냉동이어서, 굽는데에 시간이 오래 걸리므로 먼저 시작합니다. 오븐 용기에 넣고 소금후추와 올리브유를 뿌려서', 'image_url': 'https://recipe1.ezmember.co.kr/cache/recipe/2020/08/11/7cd973cac694c90ce62e9908677775291.jpg'}, {'step_number': 2, 'description': '오븐에 넣고 250도로 맞춘 후 20분 정도 구워주세요. 노릿해졌으면 완성이에요.오븐', 'image_url': 'https://recipe1.ezmember.co.kr/cache/recipe/2020/08/11/c92066c3b048ca83276d9a316bdf89a71.jpg'}, {'step_number': 3, 'description': '고기는 반드시 키친타올로 물기를 닦아낸 뒤 (안 그러면 구울 때 기름이 엄청 튀어요!) 시즈닝을 꼼꼼히 발라줍니다. 만약 스테이크시즈닝을 갖고 계시지 않다면 소금, 후추, 빵가루(옵션이에요), 큐민가루 조금, 파슬리가루를 혼합해서 발라주시면 됩니다.', 'image_url': 'https://recipe1.ezmember.co.kr/cache/recipe/2020/08/11/562fc2c2d696b5f969d4520c3d62910b1.jpg'}, {'step_number': 4, 'description': '기름을 듬뿍 팬에 넣고,', 'image_url': 'https://recipe1.ezmember.co.kr/cache/recipe/2020/08/11/ca1f8ac702d65e51182cb638a3cd9b3f1.jpg'}, {'step_number': 5, 'description': '고기를 넣어 각 면 약 1분씩 뒤집어 가며 굽습니다.', 'image_url': 'https://recipe1.ezmember.co.kr/cache/recipe/2020/08/11/87bb7e7e6e6031b776e363634c1ce1841.jpg'}, {'step_number': 6, 'description': '한 면 당 총 2분 30초 정도 구울 건데, 이렇게 미리 뒤집는 이유는 그래야지 고기가 휘지 않기 때문이에요.', 'image_url': 'https://recipe1.ezmember.co.kr/cache/recipe/2020/08/11/7a138024c33761ffb23c4f7d2d1c00991.jpg'}, {'step_number': 7, 'description': '제 고기처럼 통통한 경우에는 사이드도 구워줍니다.', 'image_url': 'https://recipe1.ezmember.co.kr/cache/recipe/2020/08/11/4984e8503addb16bb87bddc098b693bf1.jpg'}, {'step_number': 8, 'description': '굽는다라기보다 겉을 태운다는 느낌으로 접근하시면 좋아요.', 'image_url': 'https://recipe1.ezmember.co.kr/cache/recipe/2020/08/11/5413416284f0c98b96d6c579521441ba1.jpg'}, {'step_number': 9, 'description': '그리고 반드시 팬에서 꺼내 10분 정도 방치합니다. 이거 안 하고 썰어보면 고기가 좀 더 거칠더라고요.', 'image_url': 'https://recipe1.ezmember.co.kr/cache/recipe/2020/08/11/6b15f386bcc9339174cab6683a595c081.jpg'}, {'step_number': 10, 'description': '예쁘게 썰어서.', 'image_url': 'https://recipe1.ezmember.co.kr/cache/recipe/2020/08/11/83595156f70c8a589bb8335333dc98111.jpg'}, {'step_number': 11, 'description': '완성된 야채와 함꼐 그릇에 담으면', 'image_url': 'https://recipe1.ezmember.co.kr/cache/recipe/2020/08/11/31b4a97f543a5723b908736a3196c0c71.jpg'}, {'step_number': 12, 'description': '완성입니다.', 'image_url': 'https://recipe1.ezmember.co.kr/cache/recipe/2020/08/11/17a0be01d35efb46eb965ce58c14d4801.jpg'}]"
19074,메인반찬,일상,소고기,굽기,소고기 야채 볶음과 감자 튀김,소고기구이,https://recipe1.ezmember.co.kr/cache/recipe/2020/08/22/c8cfc3d5af595ec7d6a3c21e35ab27a21.jpg,867,15분 이내,초급,2인분,"[('소고기', '150g'), ('감자 소', '4개'), ('당근', '1조각'), ('양파', '1/5개'), ('사과', '1조각'), ('토마토', '1/2개'), ('풋고추', '1개'), ('밀가루', '1T'), ('스테이크 소스', '1T'), ('케첩', '1T'), ('미향', '2T'), ('소금', '2/3T'), ('설탕', '2T'), ('후추', ''), ('올리브유', '')]",소고기 야채 볶음과 감자 튀김 입니다,"[{'step_number': 1, 'description': '감자 당근 양파 풋고추 사과를 준비합니다', 'image_url': 'https://recipe1.ezmember.co.kr/cache/recipe/2020/08/22/7595268d0fa1f2774c04ff1a0f6ab5a01.jpg'}, {'step_number': 2, 'description': '감자는 납작하게 썰어 주세요 구이용 소고기에 미향 2T 소금 1/2T 설탕 1T 넣고 조물조물 섞어주세요', 'image_url': 'https://recipe1.ezmember.co.kr/cache/recipe/2020/08/22/fdcf209fd03267f2f8179e71cf6f1d401.jpg'}, {'step_number': 3, 'description': '감자와 당근에 밀가루를 골고루 뿌려줍니다', 'image_url': 'https://recipe1.ezmember.co.kr/cache/recipe/2020/08/22/c0608988be18a1c05f1623fd222df8261.jpg'}, {'step_number': 4, 'description': '식용유를 넉넉히 두르고 예열한 후 센불에 감자를 튀겨 주세요', 'image_url': 'https://recipe1.ezmember.co.kr/cache/recipe/2020/08/22/f0a410a8d7d652deff46cb2a444ece891.jpg'}, {'step_number': 5, 'description': '노릇하게 익은것부터 건져내고 나머지 감자를 공간이 생길때마다 넣고 튀겨주세요', 'image_url': 'https://recipe1.ezmember.co.kr/cache/recipe/2020/08/22/ec98dd795baa212ae2f4ec70a00c6e061.jpg'}, {'step_number': 6, 'description': '당근도 튀겨 주세요 불을 중불로 조절하면서 튀겨주세요', 'image_url': 'https://recipe1.ezmember.co.kr/cache/recipe/2020/08/22/e7afc6c6639ffe1629014044479b4f301.jpg'}, {'step_number': 7, 'description': '토마토를 썰고 고기도 좀더 추가했어요', 'image_url': 'https://recipe1.ezmember.co.kr/cache/recipe/2020/08/22/3e2090c6e2d714cf93c72b4c4c99d5881.jpg'}, {'step_number': 8, 'description': '팬을 예열한 후 고기를 넣고 구워주세요', 'image_url': 'https://recipe1.ezmember.co.kr/cache/recipe/2020/08/22/cc85e047328f3ef90b0f186075c0ef771.jpg'}, {'step_number': 9, 'description': '고기가 익으면 양파 사과 풋고추 토마토를 넣고 설탕과 소금을 추가해 넣어주세요', 'image_url': 'https://recipe1.ezmember.co.kr/cache/recipe/2020/08/22/2273bec106b9583711a1b6fac1239fe21.jpg'}, {'step_number': 10, 'description': '불을 끄고 갈아놓은 후추와 올리브유를 두르고 먹어요', 'image_url': 'https://recipe1.ezmember.co.kr/cache/recipe/2020/08/22/16abb38673e4bc8b33e8be2734de5f431.jpg'}]"
19075,메인반찬,일상,소고기,굽기,#심미장으로 양념한 소갈비구이 만들기,소갈비구이,https://recipe1.ezmember.co.kr/cache/recipe/2016/07/08/4e13c513761adf779192c77866be37471.jpg,"14,141",30분 이내,초급,2인분,"[('소갈비', ''), ('심미장', ''), ('심미즙', ''), ('맛술', ''), ('편마늘', ''), ('파', ''), ('양파', ''), ('버섯', ''), ('매실액', '')]",찜용갈비를 이용한 소 양념갈비구이. 비교적 저렴한 찜용 갈비를 이용해서 양념장에 재워서 구워 먹는 소갈비구이입니다.,"[{'step_number': 1, 'description': '소갈비를 양념에 재워 놓기 전에 함께 재울 채소들을 준비합니다. 양파는 채썰어 준비하고요. 마늘은 편으로 썰어서 준비하고 대파는 뿌리의 흰부분만 썰어서 준비해 놓았습니다.', 'image_url': 'https://recipe1.ezmember.co.kr/cache/recipe/2016/07/08/bf9eb487bb2da0a2637546aec1b26caf1.jpg'}, {'step_number': 2, 'description': '소갈비구이의 양념장은 아주 간단합니다. 심미장 한컵에 심미즙 두큰술, 맛술 1/3컵, 매실액 두큰술 넣어 주었습니다. 그리고 준비한 마늘과 대파 넣어 주시고요.', 'image_url': 'https://recipe1.ezmember.co.kr/cache/recipe/2016/07/08/e0363fe574a9ff553f776af3d4df9e4d1.jpg'}, {'step_number': 3, 'description': '여기에 양파도 넣어 주세요.', 'image_url': 'https://recipe1.ezmember.co.kr/cache/recipe/2016/07/08/773da10212dd3888468a58f818396fec1.jpg'}, {'step_number': 4, 'description': '소갈비는 이 상태로 된 것을 구입하시면 편리하게 바로 재워 놓을 수 있는데\n저는 찜용 갈비를 구입해서 갈비모양이 나도록 저며서 준비해 주었습니다. 그리고 양념이 잘 스며들고 부드러운 육질을 느끼게 칼집을 내어 주었습니다.', 'image_url': 'https://recipe1.ezmember.co.kr/cache/recipe/2016/07/08/0a537cab0f4747a8986244ccd5d98e861.jpg'}, {'step_number': 5, 'description': '반은 소갈비구이로 저며 놓았고 반은 그냥 갈비찜으로 해서 함께 만들어 놓은 양념장에 투하해 줍니다. \n이렇게 양념장에 재워 놓고는 냉장고에 보관해서 반나절 정도 두면 살도 연해지고 양념도 속속 잘 스며들어가서 구우실때 바로 꺼내어서 구워드시면 끝내주는 소갈비구이가 되지요.', 'image_url': 'https://recipe1.ezmember.co.kr/cache/recipe/2016/07/08/ef463658cff0ee4e98cc8d792de4a0631.jpg'}, {'step_number': 6, 'description': '직화그릴을 달궈준 다음에 양념에 재워 놓았던 소갈비구이를 구워 줍니다.\n같이 재워 놓았던 양파며 파며 마늘도 같이 구워 주세요~~~ 구울때에 향이 스며들어서 더욱 맛있어지거든요.', 'image_url': 'https://recipe1.ezmember.co.kr/cache/recipe/2016/07/08/c99c42065668542d1fa1330d4a89803f1.jpg'}, {'step_number': 7, 'description': '앞뒤로 잘 구워지면 일단 갈비대부분의 살을 잘라서 갈비대부분은 더 한참은 구워주셔야 붙어 있는 살이 익을 수 있고요. 나머지 살부분은 금방 익으니 바로바로 썰어서 접시에 담아서 드시면 됩니다.', 'image_url': 'https://recipe1.ezmember.co.kr/cache/recipe/2016/07/08/30499b2468a894f59e5bb5bbb56dbd231.jpg'}]"
19076,메인반찬,일상,소고기,굽기,홈파티에 빠지면 섭섭한 새콤달콤 귤소스 스테이크,스테이크,https://recipe1.ezmember.co.kr/cache/recipe/2018/12/14/7b8a86e272adf9b2d3a9d399a553c6f21.jpg,"2,805",60분 이내,초급,4인분,"[('소고기 등심', '400g'), ('새송이 버섯', '2개'), ('귤', '3개'), ('설탕', '취향껏'), ('올리브오일', '적당량'), ('소금', '적당량'), ('후추가루', '취향껏'), ('양파', '1개'), ('빨간 파프리카', '1개'), ('노란 파프리카', '1개')]","파티하면 스테이크죠!ㅎㅎㅎ 근데 흔한 소스가 아닌 제철 과일을 이용해 만든
귤소스 스테이크예요 만들기도 어렵지않고 귤소스에 찍어 먹는고기는 진짜 맛있어요","[{'step_number': 1, 'description': '파프리카,새송이버섯,양파는 썰어 올리브오일과 파슬리가루,소금조금 후추가루를 넣고 버무준다', 'image_url': 'https://recipe1.ezmember.co.kr/cache/recipe/2018/12/14/88432e3a0cc03d010094d2c27ed6be501.jpg'}, {'step_number': 2, 'description': '오븐에 넣고 야채가 노릇해 질때까지 구워준다\n자칫하면 탈수있으니 잘 지켜봐 주세요오븐', 'image_url': 'https://recipe1.ezmember.co.kr/cache/recipe/2018/12/14/2d55534fc7489d10d415da60d2790d711.jpg'}, {'step_number': 3, 'description': '야채가 오븐에서 익는동안 귤소스를 만들어요\n귤3개를 까서 납작하게 썰어 믹서기에 갈아줍니다\n그다음 냄비에 귤과즙을 담고 설탕을 넣은다음\n골고루 저어주기', 'image_url': 'https://recipe1.ezmember.co.kr/cache/recipe/2018/12/14/08c30c50a820b395ec39b9086425a5791.jpg'}, {'step_number': 4, 'description': '이렇게 걸죽해지면 다 된거예요\n굴소스 새콤달콤 아주 맛있어요', 'image_url': 'https://recipe1.ezmember.co.kr/cache/recipe/2018/12/14/cbd2ffcf7444ed7fd6d5ef5ef4f602601.jpg'}, {'step_number': 5, 'description': '귤소스 만드는 중간에 고기는 허브와 소금,후추가루를 뿌려 1시간 정도 마리네이드해 둔다', 'image_url': 'https://recipe1.ezmember.co.kr/cache/recipe/2018/12/14/6566e1e93e646018b0ed1257aaf7c7141.jpg'}, {'step_number': 6, 'description': '스테이크는 달군 후라이팬에 앞뒤가 골고루 익을수있게 구어주세요', 'image_url': 'https://recipe1.ezmember.co.kr/cache/recipe/2018/12/14/a7ad98a457662cd199095b1663f9b2c71.jpg'}, {'step_number': 7, 'description': '고기가 다 구워지면 고기는 먹기 좋은 크기로 썰어 접시에 올리고 만들어둔 감귤 소스를 살짝 뿌려준다', 'image_url': 'https://recipe1.ezmember.co.kr/cache/recipe/2018/12/14/1d58a3d8c379b564b3cc0724d280c5911.jpg'}, {'step_number': 8, 'description': '파티에 고기 빠지면 섭섭하죠?야채와 함께 썰어 나가기 때문에 먹기도 편하고 따로 어떤 소스도 필요가 없어요\n흔한 스테이크 소스 찍지말고 집에서 직접 만든 귤소스 새콤달콤 너무 맛있어요', 'image_url': 'https://recipe1.ezmember.co.kr/cache/recipe/2018/12/14/390fa3039ca587f0b9afda0b1cfabb481.jpg'}]"
19077,메인반찬,일상,소고기,굽기,고소한 육우 찹쌀 스테이크,찹쌀스테이크,https://recipe1.ezmember.co.kr/cache/recipe/2018/12/16/2ea3cbceda06d287a0946118536ff3131.jpg,742,15분 이내,초급,1인분,"[('소고기 부채살', '150g'), ('찹쌀가루', '30g'), ('세발나물                                                                                부추나샐러드로대체가능', '30g'), ('파프리카 빨간색', '1/4개'), ('파프리카 노란색', '1/4개'), ('소금', '1꼬집'), ('후추', '1꼬집'), ('생강', '1t'), ('꿀', '1T'), ('간장', '1T'), ('레몬즙', '2t'), ('양파', '30g'), ('잣', '10g'), ('배즙', '70ml'), ('전분물', '2t')]","우리 육우 부챗살에 찹쌀가루를 입혀 고소함을 더하고, 생강&꿀 소스를 얹어 향긋한 맛이 일품인 '고소한 육우 찹쌀 스테이크' 입니다.
세발나물을 크리스마스 리스 처럼 접시에 깔아 크리스마스 분위기를 내고, 육우와 곁들여 아삭한 식감을 더했습니다.
연말 파티 음식으로도 손색이 없고 한끼 든든하게 즐길 수 있는 고소한 육우 찹쌀 스테이크 레시피를 소개 합니다.","[{'step_number': 1, 'description': '우리 육우 부챗살 150g을 소금, 후추를 뿌려 밑간을 해 둡니다. (부챗살 대신 채끝이나 안심 등 다른 구이용 고기를 이용해도 좋습니다)', 'image_url': 'https://recipe1.ezmember.co.kr/cache/recipe/2018/12/16/223de2dbc4a56da0c0ec0f2e7ca2a22a1.jpg'}, {'step_number': 2, 'description': '스테이크와 같이 곁들일 세발나물, 파프리카는 깨끗이 씻어 준비해 줍니다. \n(저는 제철 세발나물을 이용했는데, 부추나 샐러드를 준비해도 좋습니다.)', 'image_url': 'https://recipe1.ezmember.co.kr/cache/recipe/2018/12/16/929f25c04b3582ea9a666eab5a6e503e1.jpg'}, {'step_number': 3, 'description': '그 사이 스테이크 위에 올라갈 생강&꿀 소스 재료를 준비해 줍니다.', 'image_url': 'https://recipe1.ezmember.co.kr/cache/recipe/2018/12/16/35d04271fc4b74176c0f9069a42f8d861.jpg'}, {'step_number': 4, 'description': '생강& 꿀소스를 만들 순서 입니다.\n준비 한 소스 재료 중 양파와 잣은 곱게 다져 주세요.\n(식감을 위해 너무 많이 다지지 않습니다.)', 'image_url': 'https://recipe1.ezmember.co.kr/cache/recipe/2018/12/16/fdf55b63453371e6fe6e1c1d593db3431.jpg'}, {'step_number': 5, 'description': '냄비에 배즙을 넣고 끓으면 양파, 생강, 잣, 간장, 꿀,레몬즙 순서로 넣어 주세요.\n전분물 2t를 준비 한 후 농도를 맞추고 불을 끕니다.', 'image_url': 'https://recipe1.ezmember.co.kr/cache/recipe/2018/12/16/3f8330d12d3178e4f4a25441456958ff1.jpg'}, {'step_number': 6, 'description': '밑간을 해 둔 부챗살에 찹쌀 가루를 가볍게 묻혀 줍니다.', 'image_url': 'https://recipe1.ezmember.co.kr/cache/recipe/2018/12/16/528b96af6573519e29d0bab998925cb61.jpg'}, {'step_number': 7, 'description': '약-중불에 찹쌀가루를 묻힌 육우를 익혀 줍니다.', 'image_url': 'https://recipe1.ezmember.co.kr/cache/recipe/2018/12/16/19f7593a044189a5486bd155bf5d15dd1.jpg'}, {'step_number': 8, 'description': '접시에 씻어 준비해둔 세발나물을 크리스마스 리스처럼 풍성하고 동그랗게 담아 줍니다.', 'image_url': 'https://recipe1.ezmember.co.kr/cache/recipe/2018/12/16/5001d416a25ddef0dd0705334040f0171.jpg'}, {'step_number': 9, 'description': '위에 잘 구운 육우 찹쌀 스테이크를 먹기 좋게 올린 후 생강&꿀 소스를 올려주고 가운데는 썰어놓은 파프리카를 보기 좋게 담아냅니다.', 'image_url': 'https://recipe1.ezmember.co.kr/cache/recipe/2018/12/16/0eef95a49501a100e70dc3a5c6c672741.jpg'}, {'step_number': 10, 'description': '육즙이 가득한 부챗살에 고소한 찹쌀가루가 더해져 부드럽고 고소한 맛이 일품 입니다. \n은은한 생강향이 도는 생강&꿀 소스와 아삭한 세발나물과 같이 먹으니 한 그릇을 금세 비웠습니다. \n연말 파티 음식으로도 좋고, 우리 육우를 이용해 한끼 든든한 식사로도 즐길 수 있는 육우 찹쌀 스테이크 입니다.', 'image_url': 'https://recipe1.ezmember.co.kr/cache/recipe/2018/12/16/43459bbfb5e24f95ce3324b474e1da5a1.jpg'}]"
19078,메인반찬,일상,소고기,굽기,"★갈비큐브스테이크, 집에서 해먹는 큐브스테이크 레시피",갈비큐브스테이크,https://recipe1.ezmember.co.kr/cache/recipe/2018/12/18/6360bcefdf79a524da5802879aed33df1.png,"3,141",15분 이내,아무나,2인분,"[('미국산 소고기 부채살', '200g'), ('파프리카', '1개'), ('양파', '1/2개'), ('줄기 콩', '1줌'), ('방울토마토', '4개'), ('올리브유', '적당량'), ('소금', '약간'), ('후추', '약간'), ('간장', '2큰술'), ('설탕', '1.5큰술'), ('미림', '1큰술'), ('사과즙', '1큰술'), ('간양파', '3큰술'), ('다진마늘', '1큰술')]","취향저격! 입맛저격! 갈비맛 큐브 스테이크!

두툼하고 고소한 미국산 부채살에 새콤달콤 최고의 단짠! 갈비맛 소스를 부으면?
집에서 손쉽게 만들 수 있는데, 맛과 냄새는 물론 눈까지 즐거운 갈비맛 큐브스테이크 만들기!","[{'step_number': 1, 'description': '미국산 부채살을 먹기 좋은 크기의 큐브모양으로 썰어주세요.', 'image_url': 'https://recipe1.ezmember.co.kr/cache/recipe/2018/12/18/79a03b6a0891adea58e48c044634a9b01.png'}, {'step_number': 2, 'description': '썰어놓은 부채살에 올리브유를 붓고, 소금, 후추를 뿌린 뒤 약 1시간 정도 재워주세요.', 'image_url': 'https://recipe1.ezmember.co.kr/cache/recipe/2018/12/18/e11875247920f6214d3bd4308359f6e21.png'}, {'step_number': 3, 'description': '간장(2큰술), 설탕(1과 1/2큰술), 미림(1큰술), 사과즙(1큰술), 간양파(3큰술), 다진마늘(1큰술), 후추(약간)을 넣고 잘 섞이도록 저어 양념장을 만들어주세요.', 'image_url': 'https://recipe1.ezmember.co.kr/cache/recipe/2018/12/18/31833c92227be39a479d964661c6d60f1.png'}, {'step_number': 4, 'description': '팬에 재워둔 미국산 부채살 굽고, 고기의 선분홍빛이 약간 남아있을 때, 양념장을 부어주세요.', 'image_url': 'https://recipe1.ezmember.co.kr/cache/recipe/2018/12/18/1419c2620238c63e6efd3601ed9f0d7e1.png'}, {'step_number': 5, 'description': '양념이 지글지글 끓을 때 파프리카(1개), 양파 1/2개, 줄기콩 1줌, 방울토마토 4개를 넣어 양념장이 다 스며들 때까지 볶아주세요.', 'image_url': 'https://recipe1.ezmember.co.kr/cache/recipe/2018/12/18/93de7a15dce3354c7ecaf2648cc1ac4c1.png'}, {'step_number': 6, 'description': '완성된 큐브스테이크를 접시에 담으면 완성!', 'image_url': 'https://recipe1.ezmember.co.kr/cache/recipe/2018/12/18/73e7aabd9306c800036650dbd5d0bea31.png'}]"
19079,메인반찬,일상,소고기,굽기,채끝구이 입에서 살살녹네,채끝구이,https://recipe1.ezmember.co.kr/cache/recipe/2021/04/19/c2ba0040140c4e46f41c1e8a03a1ae2c1.jpg,"1,934",5분 이내,아무나,2인분,"[('한우 채끝', '300g'), ('애호박', '1/3개')]","한우는 언제나 굿이지요
채끝구이 입니다","[{'step_number': 1, 'description': '키친타올로 핏물 닦아 줍니다', 'image_url': 'https://recipe1.ezmember.co.kr/cache/recipe/2021/04/19/5948395aff2916545f3da36d687d44c91.jpg'}, {'step_number': 2, 'description': '소금, 후추 뿌리고\n올리브오일로 코팅해서\n냉장고에 30분 둡니다', 'image_url': 'https://recipe1.ezmember.co.kr/cache/recipe/2021/04/19/eb623c9b25a8be4084597047c30c4f901.jpg'}, {'step_number': 3, 'description': '팬에 호박, 대파부터 구울게요\n가니쉬로 사용 할 것이 없어서 호박과 대파로..\n그래도 요즘은 대파가 아니라\n금파라며 혼자 위한하며.. ㅎㅎ\n버터 한 조각 넣고\n구워요\n약하게 소금간 하고..', 'image_url': 'https://recipe1.ezmember.co.kr/cache/recipe/2021/04/19/3aa908dcfb0d20fbf742a8c9e1288b1b1.jpg'}, {'step_number': 4, 'description': '채소 한 쪽으로 밀어두고\n채끝도 구워 줍니다', 'image_url': 'https://recipe1.ezmember.co.kr/cache/recipe/2021/04/19/323292e1b6de2d895af23efddfe028881.jpg'}, {'step_number': 5, 'description': '흐미~\n그릴선도 어찌나 예쁘게 나왔는지.. ㅎ\n더 먹음직 스러워요', 'image_url': 'https://recipe1.ezmember.co.kr/cache/recipe/2021/04/19/1a2a7063b2bfcde5e3a9894a9c092bce1.jpg'}]"
19080,메인반찬,일상,소고기,굽기,LA갈비 구이 양념 레시피,LA갈비,https://recipe1.ezmember.co.kr/cache/recipe/2020/12/07/6b4a0e8ea2cd2e426672a3c4d89e7b451.jpg,"3,729",90분 이내,초급,4인분,"[('la갈비', '1kg'), ('브로콜리', '적당량'), ('설탕', '4T'), ('미향', '4T'), ('간장', '8T'), ('물', '8T'), ('다진마늘', '2T'), ('다진생강', '1T'), ('후추', '톡톡'), ('올리브유', '2T')]",la갈비 이렇게만 만들면 완전 맛있어요,"[{'step_number': 1, 'description': 'la갈비 오랫만에 만들었어요 \n양파, 파가 없어서 젤 간단한 양념으로 만들었는데 완전 맛나네요', 'image_url': 'https://recipe1.ezmember.co.kr/cache/recipe/2020/12/07/5d686a29ebcc128d9bd01ee1222c65851.jpg'}, {'step_number': 2, 'description': '양념재료 모두 넣고 설탕을 수저로 저어서 녹이면서 섞어주세요', 'image_url': 'https://recipe1.ezmember.co.kr/cache/recipe/2020/12/07/56b8b375ed3d207e5eb309874ff8c5931.jpg'}, {'step_number': 3, 'description': '흐르는 물에 씻어서 뼈가루나 이물질을 제거합니다', 'image_url': 'https://recipe1.ezmember.co.kr/cache/recipe/2020/12/07/cbdf3d8b2912fc5467f8a31a69c8c4111.jpg'}, {'step_number': 4, 'description': '갈비를 한켜씩 깔고 양념을 수저로 윗면에 뿌려줍니다', 'image_url': 'https://recipe1.ezmember.co.kr/cache/recipe/2020/12/07/5479c88cda15e9c682aaa3db8b39197a1.jpg'}, {'step_number': 5, 'description': '양념을 모두 넣고 냉장고에 넣어 주세요 저녁에 만들어서 다음날 오전에 꺼냈어요', 'image_url': 'https://recipe1.ezmember.co.kr/cache/recipe/2020/12/07/a99e44ad774a6a218c773e292f407c7b1.jpg'}, {'step_number': 6, 'description': '다음날 아침 꺼내서 뚜껑은 덮은 상태로 1시간 동안 상온에 숙성시켜 줍니다', 'image_url': 'https://recipe1.ezmember.co.kr/cache/recipe/2020/12/07/4550c87cbde8bf141e75fffde8cee4cc1.jpg'}, {'step_number': 7, 'description': '팬을 예열한 후 중불에 갈비를 넣고', 'image_url': 'https://recipe1.ezmember.co.kr/cache/recipe/2020/12/07/ee77b8429bc7e3bf7071baaa867c564b1.jpg'}, {'step_number': 8, 'description': '앞뒤로 익혀주세요', 'image_url': 'https://recipe1.ezmember.co.kr/cache/recipe/2020/12/07/d534b68299cc5c10edeb68f5164005771.jpg'}, {'step_number': 9, 'description': '양념을 수저로 고기 위에 골고루 뿌려줍니다 냉동 브로콜리를 곁들여서 익혔어요 브로콜리 위에도 양념을 뿌려서 익혀주세요', 'image_url': 'https://recipe1.ezmember.co.kr/cache/recipe/2020/12/07/ca530dfa274da9cfef4d480cb2ae22741.jpg'}, {'step_number': 10, 'description': '고기 위로 핏물이 나오는데 키친타올로 닦아주고', 'image_url': 'https://recipe1.ezmember.co.kr/cache/recipe/2020/12/07/622bcde433d895a302063718c45587ca1.jpg'}, {'step_number': 11, 'description': '양념을 졸여서 구워주세요', 'image_url': 'https://recipe1.ezmember.co.kr/cache/recipe/2020/12/07/ea1215059eb80503ea62bebb77f56c061.jpg'}, {'step_number': 12, 'description': '고기 식감이 딱 적당해요\n뼈쪽이 적당한 질감이 있고 살은 적당한 부드러움에 씹는 맛이 너무 좋아요', 'image_url': 'https://recipe1.ezmember.co.kr/cache/recipe/2020/12/07/139c3f367d08b32dbe17b14981f7b7821.jpg'}]"
