index,종류별,상황별,재료별,방법별,글 제목,레시피이름,레시피이미지,조회수,조리시간,난이도,인분,재료,소개글,조리순서
42473,메인반찬,영양식,해물류,무침,"굴무침, 제철굴로 만든 영양 가득 레시피",굴무침,https://recipe1.ezmember.co.kr/cache/recipe/2019/12/20/62937d533fcb0b14d2df8affbfb22dfb1.jpg,"6,894",30분 이내,초급,4인분,"[('\u200b 굴', '500g'), ('무', '200g'), ('소금', '1큰술'), ('고춧가루', '5큰술'), ('새우젓', '1큰술'), ('액젓', '1.5큰술'), ('사이다', '1컵'), ('설탕', '3큰술'), ('다진 마늘', '2큰술'), ('쪽파', '1줌')]",제철굴 듬뿍 넣고 만든 맛있는 굴무침! ​ 밥도둑 제대로예요. ​,"[{'step_number': 1, 'description': '양념은 미리 그 전날 만들어두세요. 굴(oyster)500g에 해당하는 양이어요. 1kg 정도 되면 두 배로 가감하시면 되고요. 양념장은 만든 후 넣으실 때 한꺼번에 넣지 마시고 채소의 양, 개인 취향이 있으니 조금씩 양념하면서 넣으시길 권해드립니다.', 'image_url': 'https://recipe1.ezmember.co.kr/cache/recipe/2019/12/20/e57a96ce33b2cdd32c1d0c5faa3ecead1.jpg'}, {'step_number': 2, 'description': '굴김치처럼 먹기 위해 액젓도 넣어주었어요. 멸치 액젓, 까나리액젓 어떤 것도 좋아요. 한데 양념한 후 맛을 보면 설탕이 아직 덜 녹아서 맛이 겉돌아요. 그래서 저는 미리 그 전날 만들어 두었는데요. 양념장은 그 전날 만들어두시면 숙성이 되어서 훨씬 맛나답니다.', 'image_url': 'https://recipe1.ezmember.co.kr/cache/recipe/2019/12/20/e638cf4b51d79f7daf0e075f603639341.jpg'}, {'step_number': 3, 'description': '세척 방법은 흐르는 물에 씻기도 하지만 최대한 상처 없이 세척하려면 손대신 젓가락을 사용하는것이 좋아요. 간 무, 소금물에 5분 간 담근 후 살짝 씻어 물기 제거가 팁! 손으로 할 땐 상처가 나면서 따스한 손의 온기로 oyster의 신선도가 떨어진다고 합니다. 굵은 소금 1큰술 넣은 물에 잠깐 담궈두면 불순물이 빠져서 간편하고요. 무를 쓸때는 강판에 갈아서 그대로 넣어주심되어요. 저는 무생채도 할 예정이라 소금대신 써볼께요. 대신 무를갈아서 세척시 성분으로 인해 좀더 탱글탱글함과 비린맛도 제거가 된다고해요.', 'image_url': 'https://recipe1.ezmember.co.kr/cache/recipe/2019/12/20/f926db93af9edee8cf14b45286ca1f331.jpg'}, {'step_number': 4, 'description': '간 무 넣고 5분 지나니 이물질이 올라오니 보이는 거 있죠. 봉지에 담긴건 이미 한번은 세척된굴 이라서 조금만 유통기한 임박해도 신선도가 떨어지고 시간이 될수록 oyster속에 글리코겐성분이 빠져나와 물이 뿌옇게 변하는데요. (그래서 봉지에 담긴걸 살때는 최대한 물이 맑은걸 사세요.)', 'image_url': 'https://recipe1.ezmember.co.kr/cache/recipe/2019/12/20/ebb1285d82730b7fd218314a8639629e1.jpg'}, {'step_number': 5, 'description': '요렇게 거뭇거뭇 무 즙이 검게 변하면 물 받아서 2번 정도 헹군 후 채반에 받혀 물기 쏙 빼주세요.', 'image_url': 'https://recipe1.ezmember.co.kr/cache/recipe/2019/12/20/eb91853bffe7b09237837fc0b15dbfd21.jpg'}, {'step_number': 6, 'description': '무는 절이고 채소는 한 입 크기로 썰어요 채소는 미나리나 쪽파도 향긋하니 굴의 바다향을 상승시켜준답니다. 배, 사과 등을 곱게 채 썰어도 좋아요. 냉장고에 사과 넘쳐나는데 깜빡하고 못 넣고 나중에 무친 후 다시 넣었는데 맛나더라고요.', 'image_url': 'https://recipe1.ezmember.co.kr/cache/recipe/2019/12/20/9498f17bd47cbc5938fb157bdcbf91511.jpg'}, {'step_number': 7, 'description': '우선 도톰한 듯 썰어준 무는 소금에 절여줄 거예요. 소금에 절이면 보드라워져 잘 휘기에 두께 0.5cm보다 좀 더 크게 썰어주었어요.', 'image_url': 'https://recipe1.ezmember.co.kr/cache/recipe/2019/12/20/5835ede3d808d4c30c47cfc033330dd81.jpg'}, {'step_number': 8, 'description': '혹시 알맹이가 작은 소굴을 쓰시면 좀 더 곱게 채 썰어주셔요. 퐈이야~탄산 올라오는 사이다에 소금 넣어 무를 10분만 절여주세요', 'image_url': 'https://recipe1.ezmember.co.kr/cache/recipe/2019/12/20/23adc5f58474b8600634d06cb56c3dbc1.jpg'}, {'step_number': 9, 'description': '10분 절인 후 씻을 필요 없이 물기는 꼭~~짜주면 된답니다. 절대 씻지 마셔요~~', 'image_url': 'https://recipe1.ezmember.co.kr/cache/recipe/2019/12/20/b07152b1101600e4a54831ec01310c3a1.jpg'}, {'step_number': 10, 'description': '양념을 굴과 채소, 함께 넣고 버무리면 지금까지 아기 다루듯 했던 굴이 어스러질 수 있고요. 그래서 무 부터 먼저 양념 후 넣어주심 되어요. 알맹이가 터지면 물이 많이 생겨요. 무, 채소 또한 양념 옷 입으면 물이 생길 수 있으니 먹기 전 버무리시는 걸 권해드려요. 무가 빨갛게 옷을 입으면 이제 넣어 가볍게 버무려주세요.', 'image_url': 'https://recipe1.ezmember.co.kr/cache/recipe/2019/12/20/b8f020bd5af290c5a7e3d3546a8313c31.jpg'}, {'step_number': 11, 'description': '이렇게 양념이 적게 묻어도 채소 넣어서 한번 더 무치심 빨갛게 된답니다. 저는 쪽파 넣었는데요. 아삭한 배추(알배기배추도 좋아요)를 쭉쭉 찢어서 함께 양념하셔도 아삭함 더해져서 너무너무 맛나답니다.', 'image_url': 'https://recipe1.ezmember.co.kr/cache/recipe/2019/12/20/8ee504ecb4a007c3739b5aa86cf58a0d1.jpg'}]"
42474,메인반찬,영양식,해물류,무침,독소배출및 중금속배출에 좋은 미역무침!,미역무침,https://recipe1.ezmember.co.kr/cache/recipe/2019/06/05/e39b5d5c8a05d6047d0c8cdc7f0473b21.jpg,"2,572",15분 이내,아무나,4인분,"[('생미역', '400g'), ('다진파', '1큰술'), ('다진마늘', '1/2큰술'), ('멸치액젓', '1.5큰술'), ('설탕', '1/2큰술'), ('참기름', '1큰술'), ('통깨', '1큰술')]","시장에서 생미역 한다발을 사왔네요
건강한밥상을 위한 자극적이지 않은 
미역무침입니다~","[{'step_number': 1, 'description': '펄펄 끓는물에 생미역을 넣고 초록색으로 변하면 건져서 찬물에서 2번을 씻어주세요', 'image_url': 'https://recipe1.ezmember.co.kr/cache/recipe/2019/06/05/4cb11a8b83cf198e832c10cc14092d901.jpg'}, {'step_number': 2, 'description': '물기를 뺀 데쳐낸미역을 먹기좋은 크기로 잘르고 다진파 1큰술과 다진마늘 1/2큰술을 넣고 멸치액젓 1큰술과1/2를 넣어주세요\n*멸치액젓이 싫으신분들은\n소금으로 간을 해주시면 되세요', 'image_url': 'https://recipe1.ezmember.co.kr/cache/recipe/2019/06/05/ed700bae627059fd65b8647103eb0f671.jpg'}, {'step_number': 3, 'description': '설탕을1/2큰술을 넣고 참기름1큰술과 통깨 1큰술을 넣어주세요', 'image_url': 'https://recipe1.ezmember.co.kr/cache/recipe/2019/06/05/abb517517c30085c6c963fc2080865e61.jpg'}, {'step_number': 4, 'description': '모든재료가 들어갔으면 손으로 \n팍팍 힘을주어 무쳐주세요\n부족하신간은 멸치액젓추가나 소금추가하세요\n*전 약간은 심심한듯 무쳐내서 \n맨입으로도 많이 먹네요', 'image_url': 'https://recipe1.ezmember.co.kr/cache/recipe/2019/06/05/dc942d0f0c298daedb8ab9fe5235900a1.jpg'}, {'step_number': 5, 'description': '미역 본연의 맛이 제대로 느켜지는 자극적이지 않은 \n건강한식단 미역무침이 완성이 되었어요', 'image_url': 'https://recipe1.ezmember.co.kr/cache/recipe/2019/06/05/451c3d860cb537017497a1248438b0411.jpg'}]"
42475,메인반찬,영양식,해물류,무침,낙지탕탕이 만드는 법. 봄 보양식 산낙지 탕탕이.,낙지탕탕이,https://recipe1.ezmember.co.kr/cache/recipe/2020/05/20/b273f64b50bd9179a05d36b83a8fbd481.jpg,"24,139",20분 이내,중급,4인분,"[('산낙지', '5~6마리'), ('소고기 우둔살', '500g'), ('쪽파', '3~5줄'), ('청양고추', '4~5개'), ('통마늘', '5알'), ('청주', ''), ('소금', ''), ('후추', ''), ('참기름', ''), ('통깨', '')]",동생이 목포에서 낙지를 많이 사와 탕탕이를 만들었어요.,"[{'step_number': 1, 'description': '소고기는 기름이 붙어 있지 않는 우둔살로 준비 하시고 청주,후추,소금,참기름으로 양념해 둡니다.', 'image_url': 'https://recipe1.ezmember.co.kr/cache/recipe/2020/05/20/56a53e8069494224c002878587260abd1.jpg'}, {'step_number': 2, 'description': '가위로 낙지 머리를 잘라 내장을 손질하고 깨끗이 3~4번 씻어 주세요.\n원래는 점액질 때문에 밀가루로 씻어야\n하지만 낙지가 워낙 싱싱해서 다리만 훑어 물로만 깨끗이 씻어 줬어요.\n(빨판에 뻘이 남아있지 않도록 깨끗이..)낙지 손질법 레시피', 'image_url': 'https://recipe1.ezmember.co.kr/cache/recipe/2020/05/20/95ec1831f511573a0d2307a80f95201a1.jpg'}, {'step_number': 3, 'description': '손질한 낙지는 채반에 받쳐 물기 뺍니다.\n원래 탕탕이는 세발 낙지로 만들어야 하나 동생이 양이 없다며 큰 낙지로 사왔더라구요.\n*내장을 꺼냈는 데도 아직 죽지 않네요~', 'image_url': 'https://recipe1.ezmember.co.kr/cache/recipe/2020/05/20/ad22d98c033de95c53ca205725e91ed21.jpg'}, {'step_number': 4, 'description': '낙지는 먹기 좋게 잘라 육질이 부드럽게 탕탕 두드려 주세요.\n*낙지 머리는 따로 모아서 탕에 넣고 다리만 잘라 부드러워 지도록 탕탕 두드려 줬어요.\n(큼직하게 드시고 싶으면 그냥 크게 잘라 주세요.)', 'image_url': 'https://recipe1.ezmember.co.kr/cache/recipe/2020/05/20/d7d6e4d0689ac6d0e042379b0aadf1061.jpg'}, {'step_number': 5, 'description': '통마늘은 채 썰고 쪽파는 송송 썰어 주세요.', 'image_url': 'https://recipe1.ezmember.co.kr/cache/recipe/2020/05/20/ab50f7df7affa00894629ce536528dbf1.jpg'}, {'step_number': 6, 'description': '청양고추는 어슷 썹니다.', 'image_url': 'https://recipe1.ezmember.co.kr/cache/recipe/2020/05/20/eb06abb5a210fcff17f6dc28541ab6271.jpg'}, {'step_number': 7, 'description': '손질한 낙지에 양념한 소고기,마늘,쪽파,참기름,소금,통깨로 양념합니다.\n(싱거우면 와사비 소스나 기름장에 찍어 드시면 됩니다.)\n*통깨와 참기름이 많이 들어가면 훨씬 풍미가 있으니 아끼지 말고 많이 넣으헤요.', 'image_url': 'https://recipe1.ezmember.co.kr/cache/recipe/2020/05/20/b77298dba82f979d76da00f4faf1a6a91.jpg'}, {'step_number': 8, 'description': '무칠때 최소한의 양념만 하시고 대신 참기름과 통깨를 많이 넣어야 본연의 맛도 살리면서 더 맛있어요.', 'image_url': 'https://recipe1.ezmember.co.kr/cache/recipe/2020/05/20/b25af05e74db91ff1edbdcc09284f7671.jpg'}]"
42476,메인반찬,영양식,해물류,무침,꼬막무침 꼬막 비빔밥 만드는법 꼬막 해감 및 양념장 레시피,꼬막무침,https://recipe1.ezmember.co.kr/cache/recipe/2024/03/19/ca04db852fc1f57dc968679c490b83a01.jpg,"1,680",2시간 이상,중급,3인분,"[('꼬막', '1300g'), ('양파', '1/2개'), ('아삭이고추', '2개'), ('청양고추', '2개'), ('대파', '2T'), ('간장', '5T'), ('고춧가루', '2T'), ('맛술', '1T'), ('매실액', '1T'), ('설탕', '0.5T'), ('다진마늘', '1T'), ('물', '2T'), ('통깨', '1T'), ('참기름', '2T')]","오늘은 맛있는 꼬막무침&꼬막비빔밥 레시피를 가지고 왔어요~ 마트에 갔더니 꼬막 1300g에 4,000원에 팔고 있어서 바로 데리고 왔어요","[{'step_number': 1, 'description': '꼬막해감. 1) 꼬막은 맑은 물이 나올 때까지 물에 흔들어 씻어주세요 믹싱볼', 'image_url': 'https://recipe1.ezmember.co.kr/cache/recipe/2024/03/19/826956b85be8b00c12968acd0f124c6a1.jpg'}, {'step_number': 2, 'description': '꼬막해감. 2) 씻은 꼬막은 다시 물을 받아 소금 2스푼을 넣고 소금물을 만들어 중간에 쇠숟가락 하나를 넣어주세요믹싱볼 , 숟가락바닷물과 비슷한 염도가 되면 꼬막이 머금고 있는 이물질과 흙을 뱉어내고, 쇠숟가락의 스테인리스 성분이 산화 반응으로 이물질을 더 잘 뱉어낸다고 해요', 'image_url': 'https://recipe1.ezmember.co.kr/cache/recipe/2024/03/19/d53bc26fd5914bf11552ea9028fd70ce1.jpg'}, {'step_number': 3, 'description': '꼬막해감. 3) 어두운 환경을 만들어 주기 위해 위에 검은 봉지를 덮고 움직임이 적은 곳에 2시간 동안 해감을 해주세요', 'image_url': 'https://recipe1.ezmember.co.kr/cache/recipe/2024/03/19/381464fb404a39a306da6744eacc4af11.jpg'}, {'step_number': 4, 'description': '꼬막무침 레시피) 꼬막 해감하는 동안 야채를 손질해 주세요 양파 1/2개 채 썰어 주세요도마 , 조리용나이프꼬막 손질법 레시피', 'image_url': 'https://recipe1.ezmember.co.kr/cache/recipe/2024/03/19/a8b83682ff8dce04fc2b66115674121d1.jpg'}, {'step_number': 5, 'description': '아삭이고추 2개와 청양고추 2~3개 준비해 주세요', 'image_url': 'https://recipe1.ezmember.co.kr/cache/recipe/2024/03/19/78b9e6a0747e56223f082babe85099e01.jpg'}, {'step_number': 6, 'description': '꼬막 양념장 만들기) 간장 5스푼, 고춧가루 2스푼, 맛술 1스푼, 매실액 1스푼, 설탕 0.5스푼, 다진마늘 1스푼, 물 또는 꼬막삶은물 2스푼, 통깨 1스푼, 참기름 2스푼 그릇에 따로 만들어주세요 볼 , 조리용스푼', 'image_url': 'https://recipe1.ezmember.co.kr/cache/recipe/2024/03/19/abc47fb061c857d997b04ce07b4506311.jpg'}, {'step_number': 7, 'description': '2시간 뒤 해감이 끝난 꼬막은 깨끗한 물에 여러 번 헹궈주세요', 'image_url': 'https://recipe1.ezmember.co.kr/cache/recipe/2024/03/19/beeaa9b2ea616b06859873f0d6a461911.jpg'}, {'step_number': 8, 'description': '냄비에 물을 받아 끓여주고 잡내를 없애기 위해 소주나 맛술을 넣어 주세요 이때 소금 1스푼도 함께 넣어주세요냄비', 'image_url': 'https://recipe1.ezmember.co.kr/cache/recipe/2024/03/19/844c2aa2f13c14f57357d5fbabb452cd1.jpg'}, {'step_number': 9, 'description': '물이 끓어오르면 헹궈뒀던 꼬막을 넣어주고 한쪽 방향으로 저어가며 데치면 꼬막살이 한쪽으로 잘 달라붙게 되어 손질할 때 편하답니다', 'image_url': 'https://recipe1.ezmember.co.kr/cache/recipe/2024/03/19/ed300439329508575e495ef0f807f6161.jpg'}, {'step_number': 10, 'description': '꼬막이 5개 정도 입을 열면 불을 꺼주세요', 'image_url': 'https://recipe1.ezmember.co.kr/cache/recipe/2024/03/19/d454dd3e400f049524326f289160c0811.jpg'}, {'step_number': 11, 'description': '이물질이나 흙을 한 번 더 제거하기 위해 데친 꼬막은 찬물에 한번 헹궈줬어요채반', 'image_url': 'https://recipe1.ezmember.co.kr/cache/recipe/2024/03/19/85c2ae8335d7db72acf30602e7868dbb1.jpg'}, {'step_number': 12, 'description': '꼬막 뒤쪽에 있는 홈 사이에 숟가락을 끼워 넣은 후 약간 비틀면 손쉽게 껍질을 제거할 수 있어요', 'image_url': 'https://recipe1.ezmember.co.kr/cache/recipe/2024/03/19/955e02eb49399f15da903dbf630b369b1.jpg'}, {'step_number': 13, 'description': '꼬막 살을 다 분리했다면 꼬막과 손질했던 채소와 대파 2스푼 그리고 만들어놨던 양념장을 한곳에 모두 부어주세요', 'image_url': 'https://recipe1.ezmember.co.kr/cache/recipe/2024/03/19/8c92a17ca21e7bf921409dce86293ec21.jpg'}, {'step_number': 14, 'description': '꼬막살이 부서지지 않도록 조물조물 잘 무쳐주면 완성이에요위생장갑', 'image_url': 'https://recipe1.ezmember.co.kr/cache/recipe/2024/03/19/f54dfda8cdb8f0b42a19a7a4fb4501501.jpg'}, {'step_number': 15, 'description': '준비한 채소 외에 깻잎, 상추, 당근 등 집에 있는 채소를 활용해도 좋아요 그럼 맛있게 드세요접시', 'image_url': 'https://recipe1.ezmember.co.kr/cache/recipe/2024/03/19/955ec4f830a7e9a79f80f4de21d32b741.jpg'}]"
42477,메인반찬,영양식,해물류,무침,매콤달콤 전복무침에다 소면은 써비스 ㅎㅎ,None,https://recipe1.ezmember.co.kr/cache/recipe/2015/06/08/65ead62a883b413f362c852d2884614b.jpg,"3,988",None,None,None,[],,[]
42478,메인반찬,영양식,해물류,무침,여름 보양식 주꾸미 초무침으로~,주꾸미초무침,https://recipe1.ezmember.co.kr/cache/recipe/2019/07/30/3356b9639556a74c7ceb34d569cacc9e1.jpg,"3,084",20분 이내,아무나,4인분,"[('주꾸미', '2컵'), ('오이', '1/3개'), ('치커리', '1줌'), ('적양파', '1/3개'), ('양파', '1/3개'), ('고추', '1개'), ('고추장', '1큰술'), ('고춧가루', '2작은술'), ('매실액', '1큰술'), ('깨소금', '약간'), ('다진마늘', '1작은술'), ('참기름', '약간'), ('피클 주스', '2/3컵')]","동생이 낚시로 직접 잡아다준 주꾸미를
냉동 보관 후 초무침 만들어 먹었어요.
피클 만들어 먹고 남은 피클 주스로 양념장
만들어 휘리릭~~
맛있더라구요.
더운 여름 간 해독에도 좋다는 주꾸미~
여름 보양식으로 최고랍니다.","[{'step_number': 1, 'description': '피클 주스 2/3컵에 고춧가루\n고추장,매실액, 깨소금, 다진마늘\n참기름 넣어 잘 섞어줍니다.피클 주스 대신 사이다와 식초 넣어 만들어도 됩니다.', 'image_url': 'https://recipe1.ezmember.co.kr/cache/recipe/2019/07/30/b5e30409efaea2283bcb2a79b60ffd741.jpg'}, {'step_number': 2, 'description': '주꾸미는 냉동 보관이라\n소금 넣어 문지른 다음 살짝\n데쳤어요.', 'image_url': 'https://recipe1.ezmember.co.kr/cache/recipe/2019/07/30/de2ce41e83bb135597d92e9b19502e571.jpg'}, {'step_number': 3, 'description': '데친 주꾸미와 손질한 치커리\n양파,적양파,오이, 고추 \n그릇에 넣어줍니다.주꾸미 손질법 레시피\u200b', 'image_url': 'https://recipe1.ezmember.co.kr/cache/recipe/2019/07/30/e2b718527f8ae061bb2e0b1153997ee71.jpg'}, {'step_number': 4, 'description': '양념장 부어 살살 버무려 줍니다.', 'image_url': 'https://recipe1.ezmember.co.kr/cache/recipe/2019/07/30/8a70ca8959726078375b7fdd248063e21.jpg'}, {'step_number': 5, 'description': '버무린 주꾸미 초무침~~\n피클 주스맛도 나면서\n새콤 달콤 맛있답니다.', 'image_url': 'https://recipe1.ezmember.co.kr/cache/recipe/2019/07/30/7ba32642b324d051066ca2688766a7d61.jpg'}]"
42479,메인반찬,영양식,해물류,무침,당뇨에 좋은 건강한 단맛 코코넛 설탕/새우 브로콜리 마요무침,새우브로콜리마요무침,https://recipe1.ezmember.co.kr/cache/recipe/2018/03/15/cce720cfa9fd4bf3156064b9a438e7d41.jpg,"2,920",15분 이내,초급,3인분,"[('새우', '8마리'), ('데친 브로콜리', '1/2컵'), ('마요네즈', '1/3컵'), ('코코넛 설탕', '1/4컵'), ('레몬즙', '1스푼'), ('식초', '1스푼'), ('참깨', '2스푼'), ('검정깨', '0.5스푼'), ('소금', '1티스푼')]",당뇨가 있는 분들이 섭취해도 혈당이 거의 오르지 않아 서구에서는 당뇨환자를 위한 설탕 대체재로 떠오른 코코넛 설탕으로 만든 간단한 새우 브로콜리 마요무침이랍니다,"[{'step_number': 1, 'description': '재료를 준비해 주세요~', 'image_url': 'https://recipe1.ezmember.co.kr/cache/recipe/2018/03/15/717101fcf9418325e7d50999fe6279971.jpg'}, {'step_number': 2, 'description': '새우는 끓는 물에 데쳐 낸 다음 껍질을 벗겨 손질해 주세요~새우 손질법 레시피', 'image_url': 'https://recipe1.ezmember.co.kr/cache/recipe/2018/03/15/52c9d6f87d72dc593062cec1813fc9171.jpg'}, {'step_number': 3, 'description': '코코넛 설턍과 적힌 분량을 \n모두 넣고 잘 섞어 참깨 마요소스를 만들어 주세요~참깨 넣을때는 손바닥에 올려 뿌셔 넣어 주고 코코넛 설탕은 많이 달지 않아 넉넉히 넣어도 되요~', 'image_url': 'https://recipe1.ezmember.co.kr/cache/recipe/2018/03/15/2bc9b03c7de4f59dece12a7e18b8818c1.jpg'}, {'step_number': 4, 'description': '삶은 브로콜리와 손질한 새우를 그릇에 담아 주세요~브로콜리 손질법 레시피', 'image_url': 'https://recipe1.ezmember.co.kr/cache/recipe/2018/03/15/a40f967226823b7a574126bc1f9efc881.jpg'}, {'step_number': 5, 'description': '참깨 마요소스를 넣어 주세요~', 'image_url': 'https://recipe1.ezmember.co.kr/cache/recipe/2018/03/15/c85d81e0702033ab9c2800642b9ef63f1.jpg'}, {'step_number': 6, 'description': '살살 버무려 주기만 하면 새우 브로콜리 참깨 마요무침이 완성되요~', 'image_url': 'https://recipe1.ezmember.co.kr/cache/recipe/2018/03/15/c12d2de18ab4079cf3e7ac4771daa9331.jpg'}]"
42480,메인반찬,영양식,해물류,무침,전복무침 만능 초장으로 만드는 전복초무침! 전복 손질법,전복무침,https://recipe1.ezmember.co.kr/cache/recipe/2024/09/30/5b96f937cbea59dbfe0ff4a67803414f1.jpg,13,20분 이내,초급,2인분,"[('전복', '4마리'), ('미나리', '2줌'), ('오이', '1/2개'), ('양파', '1/2개'), ('청주', '1/3컵'), ('소금', '0.3큰술'), ('곰표부산 회초장', '3큰술'), ('참기름', '1큰술'), ('통깨', '약간')]",맛과 영양이 뛰어나 바다의 명품이라 불리는 전복은 여름에서 가을 사이 지금이 딱 제철인데요 제철을 맞아 살이 통통하게 오른 싱싱한 전복에 감칠맛 나는 양념을 더해 입맛과 기력을 동시에 북돋아 주는 전복무침 준비해 봤어요,"[{'step_number': 1, 'description': '전복은 솔로 씻어낸 후 이빨을 제거해주세요 끓는 물에 청주 넣고 10초간 짧게 데쳐내고 먹기 좋게 잘라 준비해주세요.주방솔 , 도마 , 조리용나이프', 'image_url': 'https://recipe1.ezmember.co.kr/cache/recipe/2024/09/30/b404282dade32eaccb2dc74c4499444b1.jpg'}, {'step_number': 2, 'description': '양파, 미나리 등 채소는 먹기 좋게 썰고 오이는 소금에 절여 물기를 제거해주세요.볼', 'image_url': 'https://recipe1.ezmember.co.kr/cache/recipe/2024/09/30/3dc4464753316e9186070a4b6b9b243a1.jpg'}, {'step_number': 3, 'description': '준비한 재료를 볼에 담고 곰표 부산회초장, 참기름, 통깨 넣어 무쳐주세요.스푼 , 접시', 'image_url': 'https://recipe1.ezmember.co.kr/cache/recipe/2024/09/30/c85b6648b9162af333f10a25122f6aea1.jpg'}]"
42481,메인반찬,영양식,해물류,무침,꼬막무침 꼬막비빔밥 꼬막무침양념장 (제철 건강음식),꼬막무침,https://recipe1.ezmember.co.kr/cache/recipe/2024/04/02/06f1bc20cb8649cbcf6e649e13085a401.jpg,207,20분 이내,초급,4인분,"[('꼬막', '800g'), ('청양고추', '1개'), ('부추', '1줌'), ('소금', '1스푼'), ('맛술', '3스푼'), ('식초', '1스푼'), ('통깨', '1스푼'), ('밥', '1공기'), ('조미김', '적당량'), ('진간장', '4스푼'), ('국간장', '1스푼'), ('참기름', '1스푼'), ('설탕', '0.5스푼'), ('고춧가루', '1스푼')]",11월~ 3월이 제철인 꼬막요리 입니다 뭐니뭐니해도 건강하게 음식을 섭취하는 기본적인 방법은 제철음식을 먹는 것입니다 막바지 꼬막 맛나게 양념해서 반찬으로 술안주로 맛나게 즐겨보세요,"[{'step_number': 1, 'description': '꼬막은 먼저 물에 4~5번 헹구어가면서 바락바락 씻어주고 소금 1스푼을 넣은 물에 약 30분 가량 담구어 해감을 해 준 후 물에 깨끗하게 씻어준다믹싱볼꼬막 손질법 레시피', 'image_url': 'https://recipe1.ezmember.co.kr/cache/recipe/2024/04/02/7525d9e7adb7737aae129f87bdf19dad1.jpg'}, {'step_number': 2, 'description': '소금 1스푼을 넣은 끓는 물에 넣고 삶아준다냄비 , 조리주걱센불꼬막의 껍질이 벌어지면 1분 정도 더 삶아준다\n꼬막은 너무 오래 삶으면 질겨진다', 'image_url': 'https://recipe1.ezmember.co.kr/cache/recipe/2024/04/02/f56b4acd42130e789be98367025ad90c1.jpg'}, {'step_number': 3, 'description': '삶은 꼬막은 껍질을 제거해 준다채반', 'image_url': 'https://recipe1.ezmember.co.kr/cache/recipe/2024/04/02/0a2eb42709c8f868c20e888453efe86c1.jpg'}, {'step_number': 4, 'description': '청양고추와 부추는 잘게 송송 썰어준다도마 , 조리용나이프', 'image_url': 'https://recipe1.ezmember.co.kr/cache/recipe/2024/04/02/90a1010c0f751cbab8e2e36cc01cc4c21.jpg'}, {'step_number': 5, 'description': '간장양념장을 모두 고루 섞어준다소스볼 , 숟가락', 'image_url': 'https://recipe1.ezmember.co.kr/cache/recipe/2024/04/02/15c2e772c89ab4f4f677926eb89b9b321.jpg'}, {'step_number': 6, 'description': '볼에 꼬막, 청양고추, 부추를 모두 담아준다', 'image_url': 'https://recipe1.ezmember.co.kr/cache/recipe/2024/04/02/82996dac3030f3645c6a4b4cc978137c1.jpg'}, {'step_number': 7, 'description': '양념장을 모두 넣어준다', 'image_url': 'https://recipe1.ezmember.co.kr/cache/recipe/2024/04/02/ec3b5d8df6a462fe9262a036fb8002341.jpg'}, {'step_number': 8, 'description': '양념장에 재료를 모두 고루 무쳐준다', 'image_url': 'https://recipe1.ezmember.co.kr/cache/recipe/2024/04/02/37f667efd6ec5f0bce1235ea683b5e5d1.jpg'}, {'step_number': 9, 'description': '3/4정도의 꼬막을 접시에 담은 후 밥 1공기를 넣고 고루 비벼준다', 'image_url': 'https://recipe1.ezmember.co.kr/cache/recipe/2024/04/02/7a3b1f6ca61fac342201da20651440ec1.jpg'}, {'step_number': 10, 'description': '접시에 무침 꼬막과 비빔밥을 같이 곁들인다접시', 'image_url': 'https://recipe1.ezmember.co.kr/cache/recipe/2024/04/02/fb06cc3b90cb7ae6e9e87914968838521.jpg'}, {'step_number': 11, 'description': '통깨를 고루 솔솔 뿌려주고 조미김을 곁들여 준다', 'image_url': 'https://recipe1.ezmember.co.kr/cache/recipe/2024/04/02/b3d1f4a54670c097e9bb17beac19b61f1.jpg'}]"
