index,종류별,상황별,재료별,방법별,글 제목,레시피이름,레시피이미지,조회수,조리시간,난이도,인분,재료,소개글,조리순서
36199,메인반찬,손님접대,해물류,볶음,"새우요리, 버터갈릭쉬림프",버터갈릭쉬림프,https://recipe1.ezmember.co.kr/cache/recipe/2018/05/18/4ddcf21a34282d6124845b9f8e40fe641.jpg,"7,840",15분 이내,아무나,2인분,"[('깐 새우', '30여마리'), ('다진마늘', '2숟갈'), ('버터', '1T')]",냉동실에 꽁꽁 냉동되어서 방치되어있던 새우가 불쌍해서 초간단 음식을 만들어보았습니당!,"[{'step_number': 1, 'description': '재료준비합니다.\n깐새우는 해동해서 두주먹정도.\n다진마늘과 버터도 준비합니다.\n완전 초간단이죠?깐새우 두주먹, 다진마늘2숟갈, 버터 1숟갈', 'image_url': 'https://recipe1.ezmember.co.kr/cache/recipe/2018/05/18/d753a505feef04b1b1bb3d89fd6e1d641.jpg'}, {'step_number': 2, 'description': '깐새우로 냉동된 새우라면 해동시켜서 흐르는 물에 씻어준 뒤, 물기를 쫘악 빼줍니다.', 'image_url': 'https://recipe1.ezmember.co.kr/cache/recipe/2018/05/18/7c34d00583a5a2b7b71e72db1815b4281.jpg'}, {'step_number': 3, 'description': '후라이팬에 기름을 두르고, 다진마늘을 2스푼 넣어주세요. 계량따위 힘들어요ㅠ. 집에있는 밥숟갈 기준하세요중불 추천 강불은 다진마늘이 너무 튀어올라요', 'image_url': 'https://recipe1.ezmember.co.kr/cache/recipe/2018/05/18/6bd932269313fff157178dedd540d7371.jpg'}, {'step_number': 4, 'description': '포인트는 여기! 다진마늘이 노르스름하게 익으면!\n노르스름이 중요합니다. 다진마늘의 컬러가중요해요다진마늘을 볶을땐 후라이팬 뚜껑으로 잠시 덮어두셔도 좋아요(튀어오름 방지)', 'image_url': 'https://recipe1.ezmember.co.kr/cache/recipe/2018/05/18/cf47d8bb3a88c743dd214b586a4995ca1.jpg'}, {'step_number': 5, 'description': '새우 투하!!!!', 'image_url': 'https://recipe1.ezmember.co.kr/cache/recipe/2018/05/18/2cdf951c24f318b0cb1536a1714c7b941.jpg'}, {'step_number': 6, 'description': '버터 한스푼 넣어주세요! 계량따위 힘들어요. 집에있는 베스키ㄴRㅏ빈스 스푼으로 1스푼 넣어주세요. 저는 버터 향 좋아해서 2스푼 정도 넣습니다.순서가 중요합니다. 버터를 꼭 마지막에 넣어주셔야해요!!', 'image_url': 'https://recipe1.ezmember.co.kr/cache/recipe/2018/05/18/a38a30042d0f4aa9d80fdd1f5995da471.jpg'}, {'step_number': 7, 'description': '버터도 넣고 다진마늘과 새우를 함께 볶아줍니다! \n이때는 강불로 하셔도 좋아요~강불', 'image_url': 'https://recipe1.ezmember.co.kr/cache/recipe/2018/05/18/6106d5c9d0bb63ff224240f155d6ca761.jpg'}, {'step_number': 8, 'description': '새우가 붉으스름하게 익어가는 색깔과 다진마늘이 좀 더 노르스름해지면 완성입니다.', 'image_url': 'https://recipe1.ezmember.co.kr/cache/recipe/2018/05/18/c071784e787a4e4b0621fee5331c75931.jpg'}, {'step_number': 9, 'description': '예쁜 그릇에 담아주세용!!!', 'image_url': 'https://recipe1.ezmember.co.kr/cache/recipe/2018/05/18/6664c10ea486def8cdad33d87365661b1.jpg'}]"
36200,메인반찬,손님접대,해물류,볶음,낙지볶음 황금레시피 오늘은 뭐먹지 무교동식,무교동낙지볶음,https://recipe1.ezmember.co.kr/cache/recipe/2016/07/21/e045d6080e2c5d190666d9d3fe83ad4a1.jpg,"25,412",120분 이내,중급,6인분 이상,"[('낙지', '4마리'), ('대파', '2대'), ('고추가루', '1국자'), ('다진마늘', '1국자')]",무교동식 낙지볶음을 좋아해서 가족들과 먹으려고 만들었어요,"[{'step_number': 1, 'description': '낙지는 굵은소금을 넣고 바락바락 150회 주물러주세요', 'image_url': 'https://recipe1.ezmember.co.kr/cache/recipe/2016/07/21/3f70a7f9a28f44c35d2878366c03f8671.jpg'}, {'step_number': 2, 'description': '끓는물에 낙지를 살짝 데쳐주세요', 'image_url': 'https://recipe1.ezmember.co.kr/cache/recipe/2016/07/21/7171500239f072c145516a8152c793721.jpg'}, {'step_number': 3, 'description': '마늘 대파 넣고 고추가루 넣어주세요', 'image_url': 'https://recipe1.ezmember.co.kr/cache/recipe/2016/07/21/bc31dab833d0b1553d7b72336f01eb7b1.jpg'}]"
36201,메인반찬,손님접대,해물류,볶음,소스가 참 맛있는 대게볶음 레시피 - 크리스마스 홈파티 음식,대게볶음,https://recipe1.ezmember.co.kr/cache/recipe/2021/12/23/d73e2717c02e0d0ac3d14e89868099531.jpg,846,60분 이내,초급,4인분,"[('찐 대게', '3마리'), ('코코넛밀크', '200ml'), ('양파', '1개'), ('청양고추', '2개'), ('버터', '1큰술'), ('다진마늘', '4큰술'), ('맛술', '2큰술'), ('소금', '1/2큰술'), ('후추', '톡톡')]","우리 아이들 어렸을때 자주 해주던 대게볶음 오랫만에 만들어봤어요.
딸아이가 소스 퍼묵퍼묵 하고싶은데 게가 걸리적거린다고 할 정도로 맛있답니다.","[{'step_number': 1, 'description': '대게는 쪄서 판매하는거 인터넷으로 주문해서 받았답니다.\n중간 크기 3개입니다.', 'image_url': 'https://recipe1.ezmember.co.kr/cache/recipe/2021/12/23/e6f260bd3c09bd046d462ebf1d95ab791.jpg'}, {'step_number': 2, 'description': '대게는 손질해서 내장도 같이 준비해주세요.\n대게 손질법은 아래의 링크를 참고해주세요.\n@6971338', 'image_url': 'https://recipe1.ezmember.co.kr/cache/recipe/2021/12/23/8f1b89114f4988c48dd294fac14201cb1.jpg'}, {'step_number': 3, 'description': '양파와 마늘은 굵게 다지고 청양고추는 송송 썰어주세요', 'image_url': 'https://recipe1.ezmember.co.kr/cache/recipe/2021/12/23/5ac95397bbab931a16c867880de852861.jpg'}, {'step_number': 4, 'description': '중불에서 냄비에 버터 1큰술 녹여주세요냄비중불', 'image_url': 'https://recipe1.ezmember.co.kr/cache/recipe/2021/12/23/7e64d92066fe87bc3bf811ce968c60861.jpg'}, {'step_number': 5, 'description': '마늘과 양파 넣고 양파가 투명해지도록 볶아주세요', 'image_url': 'https://recipe1.ezmember.co.kr/cache/recipe/2021/12/23/4a1919ecf363b323305f1ba3022c5edf1.jpg'}, {'step_number': 6, 'description': '대게와 내장 넣어주세요', 'image_url': 'https://recipe1.ezmember.co.kr/cache/recipe/2021/12/23/4177554f82990ca6e4d2d63a97c2d4ed1.jpg'}, {'step_number': 7, 'description': '코코넛밀크 통조림을 열어주세요. \n크림과 물이 층으로 분리되어 있으니 잘 저어주세요.', 'image_url': 'https://recipe1.ezmember.co.kr/cache/recipe/2021/12/23/127c0b9ebfe69f7a3c29cec6340f55d41.jpg'}, {'step_number': 8, 'description': '코코넛밀크 1/2캔(200ml) 넣어줍니다.\n살살 뒤적거리며 1분간 끓여주세요', 'image_url': 'https://recipe1.ezmember.co.kr/cache/recipe/2021/12/23/bd7f9d318c142177d97ebd12af4e086e1.jpg'}, {'step_number': 9, 'description': '분량의 양념과 청양고추 넣어주세요맛술 2큰술, 소금 1/2큰술, 후추 톡톡', 'image_url': 'https://recipe1.ezmember.co.kr/cache/recipe/2021/12/23/4f3f29199cd9c0b6fe9d722abe1be2001.jpg'}, {'step_number': 10, 'description': '휘리릭 저어주고 불을 끄면 완성입니다', 'image_url': 'https://recipe1.ezmember.co.kr/cache/recipe/2021/12/23/5330217167909e9ffb0af31284e7672d1.jpg'}, {'step_number': 11, 'description': '소스가 참 맛있어서 밥에 비벼먹으면 꿀맛입니다.\n같은 레시피로 꽃게나 새우로 만들어드셔도 참 좋아요.\n(소금간은 맛을 보면서 조절해주세요)', 'image_url': 'https://recipe1.ezmember.co.kr/cache/recipe/2021/12/23/64b24037ae804bf783b2ad2c78f370f21.jpg'}]"
36202,메인반찬,손님접대,해물류,볶음,#마라요리 #마라잡탕만들기 #라조깐마 #라조장마라잡탕 #마라잡탕밥 #마라잡탕볶음면,마라탕,https://recipe1.ezmember.co.kr/cache/recipe/2022/01/24/025943003e6098671d6c13e52c49dce81.jpg,"1,196",30분 이내,아무나,4인분,"[('참소라살', '10개'), ('위소라', '150g'), ('문어다리', '2개'), ('냉동새우', '7개'), ('바지락', '6개'), ('목이버섯', '5개'), ('당근', '1/4개'), ('양파', '1/2개'), ('배춧잎', '3장'), ('청겨자', '4장'), ('물미역', '10g'), ('레드페퍼', '1큰술'), ('라조깐마', '4큰술'), ('썬파', '3큰술'), ('편마늘', '2큰술'), ('굴소스', '2큰술'), ('설탕', '1작은술'), ('치킨파우더', '1작은술'), ('해물육수', '1L'), ('전분물                                                                                농도에맞게', ''), ('참기름', '1작은술')]","중국집에 있는 잡탕!! 각종 해물과 여러 야채들을

볶아내고 전분물을 넣어서 걸쭉하게 만드는 것이죠.

​

그걸 밥위에 올리면 잡탕밥이 되는 것이고요.

보통은 간장과 설탕, 굴소스를 이용해서 만드는데,

이번에는 라조깐마를 이용해서 마라잡탕을 만들었습니다.

​

너무 지나치게 간이 쌔지는 않고요.

마라탕처럼 마라향이 강렬하지만은 않습니다.

하지만 마라향이라는 것이 산초가 들어가는 것이죠. 그걸 화자오라고 하는데

추어탕에 들어가는 제피나 초피와는 조금 다르지만,

비슷한 톡쏘는 맛을 주기도 합니다.

​

그래서 그냥 해물찜이나 해물탕에 제피나 산초를 넣게 되면 희안하게

동남아나 중국음식처럼 느껴지게 되는 것이기도 하죠.

​

​

집에 라조깐마가 있어서 그걸 넣고 만든 매콤하고 톡쏘는

마라잡탕입니다. 마라잡탕을 밥에 얹으면 덛밥이 되고

중화면에 올리면 비빔면이 되겠지요. ㅎㅎㅎ

​

​

라조장, 라조깐마, 라조간마...이렇게 이름이 불리우는데,

모두 화자오를 기본으로 하는 소스들이죠.","[{'step_number': 1, 'description': '참소라살 - 2등분으로 썰어 줍니다.\n위소라 - 2등분으로 썰어 줍니다.\n물미역 - 3cm 잘라 줍니다.\n목이버섯 - 크기에 따라서 등분해 주세요. 재료들의 크기가 비슷하도록\n양파 - 반개를 4등분해 줍니다.\n청겨자 - 없으면 패스. 3-4등분해줍니다.\n바지락 - 해감시킨 것을 준비합니다.\n문어다리 - 편으로 썰어서 준비해 놓습니다.\n냉동새우 - 자숙되지 않은 냉동새우를 준비합니다. 자연해동\n참고로 재료는 충분히 변경이 가능합니다.', 'image_url': 'https://recipe1.ezmember.co.kr/cache/recipe/2022/01/24/2d580ad944e544387d58022e458577341.jpg'}, {'step_number': 2, 'description': '당근은 직사각형모양으로 썰어 줍니다.\n알배기배추 - 크기에 따라 세로로 한번, 가로로 5번정도 썰어 줍니다.', 'image_url': 'https://recipe1.ezmember.co.kr/cache/recipe/2022/01/24/e6a43e1b882b8b3f30c7ff4742e6998c1.jpg'}, {'step_number': 3, 'description': '썬파, 편마늘, 레드페퍼홀, 그리고 라조깐마나 라조장, 아니면 라조유를 넣어서 같이 볶아 줍니다.', 'image_url': 'https://recipe1.ezmember.co.kr/cache/recipe/2022/01/24/d228e665b7e6f3c64b405c255a01efa11.jpg'}, {'step_number': 4, 'description': '파와 고춧기름이 올라왔다면, 이제 재료들을 넣어서 같이 볶아 줍니다. 볶을때에 굴소스를 첨가해서 같이 볶아 줍니다.', 'image_url': 'https://recipe1.ezmember.co.kr/cache/recipe/2022/01/24/ec2c28b17fb4aa697cd43783dd32ba4b1.jpg'}, {'step_number': 5, 'description': '어느 정도 볶아지면서 조개가 입을 벌리고, 해물들이 반쯤 익었을때에 토치를 이용해서 섞어가면서 불향을 입혀 줍니다.', 'image_url': 'https://recipe1.ezmember.co.kr/cache/recipe/2022/01/24/3071dd58203ee3656ddc4de5d2ed53e21.jpg'}, {'step_number': 6, 'description': '육수를 부어 주고 센불에서 팔팔 끓여 줍니다. 볶을때에도 센불입니다.', 'image_url': 'https://recipe1.ezmember.co.kr/cache/recipe/2022/01/24/9e2882e2596e41e8293623c4bf5ec0781.jpg'}, {'step_number': 7, 'description': '모든 재료들이 국물맛이 진하게 우러나왔다면 마지막 간을 보고 간이 싱거우면 굴소스를 넣어서 간을 맞춰 줍니다. 그리고 전분물을 조금씩 넣어가면서 센불에서 잘 저어가면서 끓여서 농도를 맞춰 줍니다. 걸쭉한 농도가 되었다면 불을 끄고 참기름을 한바퀴 둘러 주세요. 그러면 마라잡탕은 완성입니다.', 'image_url': 'https://recipe1.ezmember.co.kr/cache/recipe/2022/01/24/fd5b7f4b9fc130904462c3838eb41c5c1.jpg'}, {'step_number': 8, 'description': '하나는 면으로 준비하고 다른 하나는 덮밥으로 준비합니다. 중화면을 삶아낸 후에 찬물에 씻어서 주고 물기를 빼 주고 완성대접에 담아 줍니다.', 'image_url': 'https://recipe1.ezmember.co.kr/cache/recipe/2022/01/24/59111f0eca2c9867af6a32b22baf362c1.jpg'}, {'step_number': 9, 'description': '거기에 마라잡탕을 위에 올려 줍니다. 그런 다음에 비벼서 드시면 마라잡탕면 볶음면이 되겠지요. 마라잡탕면은 완성입니다.', 'image_url': 'https://recipe1.ezmember.co.kr/cache/recipe/2022/01/24/b5065114e35123f4070727b7d9837af91.jpg'}, {'step_number': 10, 'description': '이번엔 밥입니다. 접시에 밥을 담아 주고는 그 위에 마라잡탕을 얹어 줍니다. 그럼 마라잡탕덮밥이 완성입니다.', 'image_url': 'https://recipe1.ezmember.co.kr/cache/recipe/2022/01/24/aeec1ee8617f0dbf9d284b26838c82de1.jpg'}]"
36203,메인반찬,손님접대,해물류,볶음,간단한 대하요리 (손님초대 요리),대하볶음,https://recipe1.ezmember.co.kr/cache/recipe/2021/11/29/37b9ee109dd69ac9480eabd7d644b7c91.jpg,"2,027",60분 이내,초급,3인분,"[('대하', '12마리'), ('스테이크 소스', '4T'), ('케첩', '2T'), ('굴 소스', '1T'), ('매실 진액', '1T'), ('적포도주', '4T'), ('올리고당', '1T'), ('식용유                                                                                혹은 버터', '약간'), ('표고버섯', '1개'), ('양파', '1/6개'), ('청양고추', '2개'), ('대파', '1/2줄기')]","소금구이 해 먹고 남은 대하가 약간 남아서 찹스테이크
소스를 만들어 후다닥 볶아 만들어 냈는데 식구들 손이
멈추지를 않는다. 무화과가 제 철이 지나서, 귤을 이용하여
그릇에 담아 내면 손님상으로 아주 좋을 것 같다.","[{'step_number': 1, 'description': '소금구이 해먹고 남은 대하를 가지고 \n간단하게 볶음 요리할 소스를 만든다.\n스테이크 소스 4T, 케첩 2T, 굴 소스 1T, \n매실 진액 1T, 적포도주 4T, 올리고당 1T를\n넣어 재료가 골고루 섞이도록 만든다.', 'image_url': 'https://recipe1.ezmember.co.kr/cache/recipe/2021/11/29/90bbb9e9aebc6a8bdc710bff9a286ebc1.jpg'}, {'step_number': 2, 'description': '남은 대하는 먹기좋은 크기로 썰었는데, \n만약 생새우라면 껍질을 제거하고 \n내장 손질을 하여 먹당한 크기로 잘라\n준비하면 된다.새우 손질법 레시피', 'image_url': 'https://recipe1.ezmember.co.kr/cache/recipe/2021/11/29/63efe72e37fe2d678dd7a32452f5a3521.jpg'}, {'step_number': 3, 'description': '간단한 대하요리이지만 맛은 정말 맛있다.\n새우만 볶는 것 보다는 채소를 친구하여 볶으면 \n수분도 어느정도 나와서 맛이 훨씬 부드럽다.\n양파, 대파, 청양고추를 준비 하였다.', 'image_url': 'https://recipe1.ezmember.co.kr/cache/recipe/2021/11/29/5d0f1b5ceca26b2c1155e02ac4626b4b1.jpg'}, {'step_number': 4, 'description': '팬에 버터나 식물성 오일을 1T정도 넣는다.\n버터를 넣으면 풍미가 더 좋을것 같다.\n손질한 새우를 볶아준다.\n다 익은 새우를 준비하여 약한 불을 이용 하였지만\n생새우를 준비하였다면 강한불로 빨리 \n볶는것이 좋겠다. 새우의 겉면이 붉게 변하면...', 'image_url': 'https://recipe1.ezmember.co.kr/cache/recipe/2021/11/29/98f99a142145a6564dc5c3a6e2bd4f011.gif'}, {'step_number': 5, 'description': '채소를 넣어 강한불로 빨리 볶는다.', 'image_url': 'https://recipe1.ezmember.co.kr/cache/recipe/2021/11/29/286c06224078937b4d624338fa1b1cc41.jpg'}, {'step_number': 6, 'description': '미리 만들어 놓은 소스를 부어 \n휘리릭 섞어 준뒤, 그릇에 담아 내면 된다.', 'image_url': 'https://recipe1.ezmember.co.kr/cache/recipe/2021/11/29/38a2b1780acc39ab4e106322944e74f21.jpg'}, {'step_number': 7, 'description': '약간 시들기는 했지만 무화과가 있어 \n얇게 썰어 장식을 하였는데, 요즘 맛있는\n귤을 썰어서 장식을 해도 좋을 것 같다.', 'image_url': 'https://recipe1.ezmember.co.kr/cache/recipe/2021/11/29/7df613efb621df73d2343866aaa3b3a51.jpg'}]"
36204,메인반찬,손님접대,해물류,볶음,#마라요리 #마라룽샤밀키트 #마라룽샤만들기 #냉동민물가재요리 #술안주 #밥도둑,마라룽샤,https://recipe1.ezmember.co.kr/cache/recipe/2022/08/12/554ddc2f8d42640d49fca6eee79a7c351.jpg,"1,525",30분 이내,아무나,4인분,"[('민물냉동마라룽샤', '580g'), ('자숙가재꼬리마라롱샤', '680g'), ('냉동모둠해물', '200g'), ('썬파', '3큰술'), ('다진마늘', '1큰술'), ('샐러리', '100g')]","#마라요리 #마라룽샤밀키트 #마라룽샤만들기

#냉동민물가재요리 #민물가재꼬리

#술안주 #밥도둑

​

​

​

보통 우리가 접하는 마라요리에는 마라상궈, 마라탕, 마라룽사가 있는데

​

마라륭사는 민물가재를 마라소스에 넣고는 볶아낸 것으로

각종 해물과 야채를 넣은 것은 마라상궈.

탕으로 끓여낸 것은 마라탕이지요.

​

마라상궈와 마라탕은 밀키트로 나와 있죠. 아니면 소스만 파는 경우가 있고요.

전에 우연하게 발견한 것이 마라룽샤 밀키트가 있었는데,

그것은 중국식재료 전문으로 하는 몰에서 발견한 것이였죠.

​

그런데 우리나라 쇼핑몰에서도 마라룽샤 밀키트를 팔더라구요.

전에 구입했던 민물가재보다 훨씬 크고 튼실한 가재를 넣어서요.

​

그래서 고거 밀키트랑 중국식재료를 구입하면서 발견한

가재꼬리만 들어가져 있는 마라룽샤도 구입해서 푸짐하게 만든 마라룽샤입니다.

역시 마라는 맛있습니다. 끌리는 맛입니다. ^^","[{'step_number': 1, 'description': '달궈진 팬에 썬파, 다진마늘을 넣고 볶아 줍니다.', 'image_url': 'https://recipe1.ezmember.co.kr/cache/recipe/2022/08/12/b413c0cd155edaeddef944ad9fb5ed611.jpg'}, {'step_number': 2, 'description': '마라룽샤 2가지를 섞어서 만드는 마라룽샤인데, 한가지는 냉동민물가재가 들어가져 있는 마라룽샤입니다. 그 민물가재는 익지 않은 것이라서 먼저 찬물에 씻어 주면서 해동시켜 주고 물기를 빼서 팬에 넣어 줍니다. \n그것이 정석인데 저는 그냥 넣어 주었습니다. 해동시키고 그러면 물기가 많이 생기고 그 물기를 완전하게 제거하기엔 시간이 부족해서요.', 'image_url': 'https://recipe1.ezmember.co.kr/cache/recipe/2022/08/12/0041b24e2f1a93ef07daa838b12b76f91.jpg'}, {'step_number': 3, 'description': '두번째 마라룽샤는 민물가재의 꼬리만 자숙되어져서 나온 것입니다. 그래서 반쯤 민물가재가 익었을때에 넣어 주고는 같이 볶아 줍니다.', 'image_url': 'https://recipe1.ezmember.co.kr/cache/recipe/2022/08/12/54e3d7bff74028784da2d33bc2b3aec51.jpg'}, {'step_number': 4, 'description': '어느 정도 볶았다면 색감과 향을 위해서 샐러리를 넣어서 섞어가면서 같이 볶아 줍니다.', 'image_url': 'https://recipe1.ezmember.co.kr/cache/recipe/2022/08/12/ae43753c082cbcb89eabb6f5827c73381.jpg'}, {'step_number': 5, 'description': '그리고 냉동모둠해물을 조금 넣어 줍니다. 시원한 맛과 씹는 식감을 위해서요.', 'image_url': 'https://recipe1.ezmember.co.kr/cache/recipe/2022/08/12/500a04695ba6699ed495c1a3b7abc71e1.jpg'}, {'step_number': 6, 'description': '그리고 두가지의 마라룽샤소스를 투하합니다. 냉동민물가재가 들어가져 있었던 마라룽샤 소스와 자숙된 민물가재꼬리로 구성된 마라룽샤소스를 투하합니다. 소스의 양은 둘다 180g입니다. \n같이 잘 섞어가면서 볶아 줍니다. 민물가재가 붉은색이 돌때까지 볶아 주시면 다 완성입니다.', 'image_url': 'https://recipe1.ezmember.co.kr/cache/recipe/2022/08/12/366ea22841f50c8ebd37ccf4b9243c211.jpg'}, {'step_number': 7, 'description': '완전히 가재들이 선홍색을 띠면서 잘 익었습니다. 색감도 잘 나오고 향도 마라향이 물씬납니다. 이 상태 그대로 완성접시에 담아 주시면 그것이 마라룽샤입니다.', 'image_url': 'https://recipe1.ezmember.co.kr/cache/recipe/2022/08/12/aa43b1528902b82af2c26046f43e34191.jpg'}, {'step_number': 8, 'description': '완성접시에 마라룽샤를 푸짐하게 담아 줍니다. 하나하나씩 위생장갑을 끼고 까서 먹는 재미가 있는 입술을 얼얼하게 만들지만 중독성이 있는 마라룽샤 완성입니다.', 'image_url': 'https://recipe1.ezmember.co.kr/cache/recipe/2022/08/12/0c0bde4d0d9da870220249f845645bed1.jpg'}]"
