index,종류별,상황별,재료별,방법별,글 제목,레시피이름,레시피이미지,조회수,조리시간,난이도,인분,재료,소개글,조리순서
48447,국/탕,초스피드,돼지고기,끓이기,순대내장국 20분완성 순대국 레시피,순대내장국,https://recipe1.ezmember.co.kr/cache/recipe/2020/10/10/1f9bfcc00a605a7a8bfaf5dae84e48521.jpg,"7,973",20분 이내,아무나,4인분,"[('사골육수', '1L'), ('순대', '400g'), ('내장', '300g'), ('고춧가루', '3스푼'), ('새우젓', '1스푼'), ('마늘', '1스푼'), ('국간장', '1스푼'), ('물', '2스푼'), ('청양고추', '4개')]","따끈한 국물이 생각날때 순대 내장탕 간단하게 집에서
순대내장국 끓여먹기","[{'step_number': 1, 'description': '사골육수 1.5리터를 끓여줍니다\n끓으면 새우젓1스푼을 넣고 내장을 먼저 넣어줍니다', 'image_url': 'https://recipe1.ezmember.co.kr/cache/recipe/2020/10/10/4417637bab34c124c0fce67ef56d9be71.jpg'}, {'step_number': 2, 'description': '끓는동안 다대기 만들어줘요고춧가루3스푼.새우젓1스푼.마늘1스푼.국간장1스푼.물2스푼.청양고추4개(잘게썰어서)중불', 'image_url': 'https://recipe1.ezmember.co.kr/cache/recipe/2020/10/10/85d772544e5c77eb83065d5885e7f0cd1.jpg'}, {'step_number': 3, 'description': '내장을 넣고 한소큼 끓으면 청양고추 대파 넣고 1분정도 지나 순대넣어줍니다', 'image_url': 'https://recipe1.ezmember.co.kr/cache/recipe/2020/10/10/c2f0bcaf2d8ca968e9e70bdb6acb8fd81.jpg'}, {'step_number': 4, 'description': '순대 넣고 3분후에 불 끄면 완성입니다\n집에 들깨가루 있으시면 넣어드시면 더 \n고소해요', 'image_url': 'https://recipe1.ezmember.co.kr/cache/recipe/2020/10/10/aeb7b87123decf2d4075e25d5407e1991.jpg'}]"
48448,국/탕,초스피드,돼지고기,끓이기,드디어 찾은 어릴때 먹었던 그맛 토종순대국&다대기,토종순대국,https://recipe1.ezmember.co.kr/cache/recipe/2020/10/20/15aafed676e61c59fa245014ccbf17411.jpg,"2,615",10분 이내,아무나,1인분,"[('돼지고기내장수육', ''), ('순대', ''), ('돼지사골육수', ''), ('파', ''), ('새우젓', ''), ('참치액', ''), ('고추가루', '')]","돼지고기내장수육을 만들고 제일 먼저
생각나는게 순대국이였어요

어릴때부터 엄마가 순대국 맛집을
데리고 다녀 먹던 버릇이 있어
커서도 맛있다는 집을 찾아다녔지만
어릴때 먹었던 그맛을 찾을수 없었어요

그래서 삶아 파는 내장으로 직접 해먹었죠
그렇게 만들면 파는곳 보단 맛있었지만 
그래도 뭔가 2%로 부족한 맛이였어요
아마도 내장이 아니였던 거죠ㅠ

그러니 처음으로 직접 삶은 내장이 있으니 
순대국 생각이 바로 나더라고요
해서 순대국을 끓이는데 저도 모르게 웃음이
나오네요ㅋ

드뎌 순대국다운 순대국을 먹나하는 기대감이
밀려 왔어요
끓여서 한수저 뜨는데 벌써 느낌이 
팍 오더라고요ㅋ

한말을 잊게 만들고 여태 찾아 헤매던
그맛이였어요
어릴때 먹었던 그맛을 내가 만들었다니~
정말 숨도 안쉬고 한뚝배기 뚝딱! 해치웠죠

다른것 보다도 국물이나 고기에 잡내가 전혀 
없어 감동적인 맛이였어요
고기도 먹고 싶은 양만큼 맘껏 넣을수 
있다는게 좋았고요

고소한 돼지사골육수에 내장도 양껏 
듬뿍 넣고 끓여 먹는 순대국 어려울것 없이
맛있게 해드세요^^

오늘도 건강 유의하세요~♡","[{'step_number': 1, 'description': '다대기를 만듭니다', 'image_url': 'https://recipe1.ezmember.co.kr/cache/recipe/2020/10/20/76dc48aeb36659901619f125c36ee8ec1.jpg'}, {'step_number': 2, 'description': '돼지사골육수를 끓입니다', 'image_url': 'https://recipe1.ezmember.co.kr/cache/recipe/2020/10/20/ab3dd5cd7dffe7e452547423deeeb7e41.jpg'}, {'step_number': 3, 'description': '돼지내장과 순대를 넣습니다', 'image_url': 'https://recipe1.ezmember.co.kr/cache/recipe/2020/10/20/e31c8b46e91b5cd1cfd7aae3e79fa04b1.jpg'}, {'step_number': 4, 'description': '파를 넣습니다', 'image_url': 'https://recipe1.ezmember.co.kr/cache/recipe/2020/10/20/470f92d7cf4e32ac812f742cfff862581.jpg'}, {'step_number': 5, 'description': '다대기와 식탁에 냅니다', 'image_url': 'https://recipe1.ezmember.co.kr/cache/recipe/2020/10/20/bcc02e0a7bd06111eb4a088cf41c38c31.jpg'}]"
48449,국/탕,초스피드,돼지고기,끓이기,돈까스김치나베로 간단한 크리스마스파티!,돈까스김치나베,https://recipe1.ezmember.co.kr/cache/recipe/2018/12/21/d74452557b658dcfab99786b7935551c1.png,"6,857",10분 이내,초급,1인분,"[('편의점돈까스도시락', '1개'), ('편의점김치찌개', '1개'), ('달걀', '1개'), ('양파', '1/6개'), ('송송썬대파', '1/6대')]","편의점에서 쉽게 구할 수 있는 재료들로 
..... 즐거운 크리스마스 파티♥ 나 .. 혼자여도 괜찮아! ^^ ! 

세상의 모든 레시피 만개의레시피","[{'step_number': 1, 'description': '양파는 채썬다.', 'image_url': 'https://recipe1.ezmember.co.kr/cache/recipe/2018/12/21/bca9bb3e2843eca714e576c9ac5824b71.png'}, {'step_number': 2, 'description': '냄비에 물을 붓고 김치찌개 소스를 넣어 끓인다.냄비', 'image_url': 'https://recipe1.ezmember.co.kr/cache/recipe/2018/12/21/3134e45c753506ece675362c340671371.png'}, {'step_number': 3, 'description': '채 썬 양파를 넣고 돈까스를 올린다.', 'image_url': 'https://recipe1.ezmember.co.kr/cache/recipe/2018/12/21/26067e73fc9c286155d03982e58f3f661.png'}, {'step_number': 4, 'description': '달걀, 파를 올려 살짝 끓여 완성한다.', 'image_url': 'https://recipe1.ezmember.co.kr/cache/recipe/2018/12/21/010798ac15bdc16c3587982100aadaa91.png'}]"
48450,국/탕,초스피드,돼지고기,끓이기,#레토르트 우거지뼈해장국을 이용해서 감자탕만들기 #삶은 감자를 넣고 들깨가루 넣어서 끓이는 집에서 먹는 감자탕!!,감자탕,https://recipe1.ezmember.co.kr/cache/recipe/2017/05/02/84b8a1d8cca4508be5d33342d07564541.jpg,"6,715",30분 이내,아무나,2인분,"[('배추우거지', '1팩'), ('삶은감자', '3개'), ('들깨가루', '3큰술'), ('대파', '1/2뿌리'), ('묵은지', '1/3포기')]","오늘의 간편하게 레토르트식품을 이용해서 조금 변형시킨 감자탕을 만들어 볼려고요. 우거지뼈해장국인데 뼈와 우거지가 들어가져 있죠. 여기에 그냥 감자를 넣으면 익지를 않기 때문에 감자는 삶아서 넣어 주었고요. 그리고 들깨가루 듬뿍 넣어 주었죠. 

그리고 간이 쌜것 같아서 물을 추가해서 넣어 주었는데
추가간은 묵은지로 해주었습니다.","[{'step_number': 1, 'description': '우거지 뼈해장국 1팩이면 충분히 2인이 드실 수 있어요. 뼈는 2개가 들어가져 있고 우거지도 꽤 많이 들어가져 있죠. 여기에 삶은 감자까지 넣어서 만드는 감자탕입니다.', 'image_url': 'https://recipe1.ezmember.co.kr/cache/recipe/2017/05/02/fc4bc06f4ba13e4b57f93d827915f6c61.jpg'}, {'step_number': 2, 'description': '우거지뼈해장국 1팩을 모두 넣고 물 1컵을 추가로 넣어 주고는 삶은 감자를 넣어 주었습니다. 그리고 묵은지는 밑에 깔아 주었고요. 그리고 팔팔 끓여 주시면 됩니다.', 'image_url': 'https://recipe1.ezmember.co.kr/cache/recipe/2017/05/02/5ea88506bb3bc39e64476ea6377f64881.jpg'}, {'step_number': 3, 'description': '어느 정도 끓어 오르면 들깨가루를 넣어 주세요. 깻잎이 있으시면 위에 살짝 올려주셔도 좋지요. 그럼 사먹는 감자탕과 더욱 비슷해지지요.', 'image_url': 'https://recipe1.ezmember.co.kr/cache/recipe/2017/05/02/8824b50535fd8d63f9bcbbd6e923e73c1.jpg'}, {'step_number': 4, 'description': '대파도 위에 듬뿍 올려 주시면 완성이지요. 쉽고 간단하면서 금방 만들어지지요. 그냥 뼈해장국으로도 좋지만 요렇게 추가해서 넣어 주면 또다른 맛의 감자탕이 되겠죠~~~', 'image_url': 'https://recipe1.ezmember.co.kr/cache/recipe/2017/05/02/5b5b026248aac6f286dd38991f1631d81.jpg'}, {'step_number': 5, 'description': '감자만 먼저 삶아 주시고는 같이 넣고 끓이시면 묵은지의 시원하고 개운맛과 함께 들깨가루의 고소한 맛까지 추가된 감자탕이 완성되는 것이죠. 소요시간은 감자삶은 시간을 포함해서 30분이면 충분하지 않을까요!!', 'image_url': 'https://recipe1.ezmember.co.kr/cache/recipe/2017/05/02/1bcbf7dcf08f834534a7a0df6d8349101.jpg'}]"
48451,국/탕,초스피드,돼지고기,끓이기,맛있어용^^ 돈까스 김치찌게나베~~~,김치돈까스나베,https://recipe1.ezmember.co.kr/cache/recipe/2015/08/09/0686350302cb04e62a6f175b6a82cc8b1.jpg,"3,605",10분 이내,아무나,2인분,"[('돈까스', '1개'), ('김치', '250g'), ('마늘', '1스푼'), ('양파', '1/2개'), ('파', '조금'), ('설탕', '1스푼'), ('다시다', '약간')]","김치찌게에 돈까스를 넣는 거에요..
보통 돼지고기를 넣잖아요?
허지만 돈까스도 먹고 김치찌게도 먹고..
맛있는 돈까스 김치찌게 나베 맛 좀 보실래요?","[{'step_number': 1, 'description': '전골 냄비에 기름을 두르고요', 'image_url': 'https://recipe1.ezmember.co.kr/cache/recipe/2015/08/09/a9066eca969b19d4371e03334d2ef3fc1.jpg'}, {'step_number': 2, 'description': '그리고 김치를 넣어 볶아준답니다', 'image_url': 'https://recipe1.ezmember.co.kr/cache/recipe/2015/08/09/fe1e6db2dd2685486711c28062bb7f701.jpg'}, {'step_number': 3, 'description': '양파를 같이 넣어서 볶아주는데요..약간 오래 볶아주면\n양파와 김치가 어우러져 풍미가 느껴 지실거에요^^', 'image_url': 'https://recipe1.ezmember.co.kr/cache/recipe/2015/08/09/af34a7694b490e53dda6f2f87ee719131.jpg'}, {'step_number': 4, 'description': '그리고 마늘 준비해두셨죠?', 'image_url': 'https://recipe1.ezmember.co.kr/cache/recipe/2015/08/09/0e65ad7889ad48622d63b35e5a6235e51.jpg'}, {'step_number': 5, 'description': '전 양파 갈아 놓은게 있어서 그걸 넣고 볶아 주었답니다.', 'image_url': 'https://recipe1.ezmember.co.kr/cache/recipe/2015/08/09/048461bdbe57d085a89d6be9dec16e231.jpg'}, {'step_number': 6, 'description': '그리고 마늘을 넣어서 조금 더 볶아 준답니다.\n쓰윽쓱...', 'image_url': 'https://recipe1.ezmember.co.kr/cache/recipe/2015/08/09/ba02a220e94b0f13137670f6c70b19821.jpg'}, {'step_number': 7, 'description': '설탕 1스푼을 넣어 주세요^^', 'image_url': 'https://recipe1.ezmember.co.kr/cache/recipe/2015/08/09/91b423331668d51dd3385876185ffafd1.jpg'}, {'step_number': 8, 'description': '그리고 이제는 물을 부어주어서 끓여 주어야겠지요?', 'image_url': 'https://recipe1.ezmember.co.kr/cache/recipe/2015/08/09/6f91c916e4a4ab8810df9721332247901.jpg'}, {'step_number': 9, 'description': '이때 전 돈까스를 어제 구입했는데요..\n나베를 만들 때에는 한 번 돈까스를 튀겨주어야 되잖아요?\n아니면 에어프라이어로 튀겨 주든지요?\n전 이번 구입한 돈까스는 마침 튀겨진 걸 구입했답니다.\n그래서인지 수월하더라구요..ㅎ에어프라이어', 'image_url': 'https://recipe1.ezmember.co.kr/cache/recipe/2015/08/09/b73419d1c5d69ef1009118fc76710edb1.jpg'}, {'step_number': 10, 'description': '그대로 끓고 있는 김치찌게에 돈까스를 넣었답니다.\n그러면 돈까스도 익혀질 때까지 김치찌게도 푹 같이 끓여주세요..\n김치찌게는 오래 끓일 수록 맛이 난다는 사실..\n더우신데..고생 많으세요..', 'image_url': 'https://recipe1.ezmember.co.kr/cache/recipe/2015/08/09/0f08c978212e288e179710587eb56ff41.jpg'}, {'step_number': 11, 'description': '그리고 돈까스를 국물이 배이게 하기 위해 \n계속 스푼으로 국믈을 얹어줘서 끓여야 되시겠지요?', 'image_url': 'https://recipe1.ezmember.co.kr/cache/recipe/2015/08/09/be6c77e3c5aabad65cd281bbf85fcd3b1.jpg'}, {'step_number': 12, 'description': '준비해둔 파를 썰어서 올려주시면 되시는것이랍니다.', 'image_url': 'https://recipe1.ezmember.co.kr/cache/recipe/2015/08/09/d1f87fa7c754fbbdc7e05c227ff31d1c1.jpg'}, {'step_number': 13, 'description': '이렇게 해서 그릇에 담았는데요..\n아마 맛이 많이 틀릴거에요..\n돈까스도 먹고 김치찌게도 먹고~~~\n특미로 해보세요^^', 'image_url': 'https://recipe1.ezmember.co.kr/cache/recipe/2015/08/09/a7754632c5a7618ba4050a122b24b54c1.jpg'}]"
48452,국/탕,초스피드,돼지고기,끓이기,밥에 쓱싹쓱싹 비벼 먹는 맛있는 돼지고기버섯탕,돼지고기버섯탕,https://recipe1.ezmember.co.kr/cache/recipe/2022/06/23/a2cd145b0a4ef6a2db97b204adc534db1.jpg,805,15분 이내,아무나,4인분,"[('물', '800g'), ('삽겹살', '1컵'), ('호박', '조금'), ('표고버섯', '3개'), ('연두부', '1팩'), ('고추씨기름', '1t'), ('참치액', '2T'), ('소금', ''), ('마늘', '1t'), ('고추가루', '2T'), ('파', '')]","표고버섯을 산지직송으로 1Kg를
구입했는데 싱싱하고 향이 좋은게
너무 맛있더라고요

볶아놓고 볶음밥도시락 싸줄것도 미리 볶아
소분해서 냉동 보관 했어도 넉넉히
남았어요

그래서 돼지고기넣고 탕으로 끓였죠
두부대신 연두부 넣고 끓였더니
이건 또 새롭게 만든 탕요리로
진짜 맛있네요

밥에 쓱쓱 비벼 먹었는데 모든 재료에
조합이 끝내주고 술안주로도 
좋을꺼 같아요

국물맛은 개운하고 든든하게
먹는 돼지고기버섯탕 맛있게
끓여드세요^^","[{'step_number': 1, 'description': '호박 버섯을 썰어 놓습니다', 'image_url': 'https://recipe1.ezmember.co.kr/cache/recipe/2022/06/22/214dcd1f0e5d9da66c1d4011304745ae1.jpg'}, {'step_number': 2, 'description': '연두부를 크게 썰어 놓습니다', 'image_url': 'https://recipe1.ezmember.co.kr/cache/recipe/2022/06/22/c04dae29cec190e699f52eee26575f311.jpg'}, {'step_number': 3, 'description': '삼겹살을 썰어 놓습니다', 'image_url': 'https://recipe1.ezmember.co.kr/cache/recipe/2022/06/22/216282834dc43ed7991d015f176dc3b11.jpg'}, {'step_number': 4, 'description': '고기에 양념을 하고 볶습니다', 'image_url': 'https://recipe1.ezmember.co.kr/cache/recipe/2022/06/22/d703772692a5a5e438d87b74bc109a851.jpg'}, {'step_number': 5, 'description': '물을 붓고 끓입니다', 'image_url': 'https://recipe1.ezmember.co.kr/cache/recipe/2022/06/22/977694b1a4ad1fcf0a64d68e32a16e871.jpg'}, {'step_number': 6, 'description': '순서대로 나머지 재료와 양념을 넣습니다', 'image_url': 'https://recipe1.ezmember.co.kr/cache/recipe/2022/06/22/cc8d00b4877742e22ee7cfa627b3a76a1.jpg'}, {'step_number': 7, 'description': '식탁에 냅니다', 'image_url': 'https://recipe1.ezmember.co.kr/cache/recipe/2022/06/22/a02da063d1864d6c3e31cc6d534a8fe31.jpg'}]"
48453,국/탕,초스피드,돼지고기,끓이기,이상엽 5분 순대국 만들기 편스토랑 레시피 빨간버터장,순대국,https://recipe1.ezmember.co.kr/cache/recipe/2023/12/21/7d8523e05e6118a628f605ac9856805f1.jpg,"2,672",10분 이내,아무나,2인분,"[('순대', '300g'), ('편육', '100g'), ('사골육수', '2봉지'), ('대파', '1대'), ('다진 마늘', '1/2스푼'), ('들깨가루', ''), ('후춧가루', ''), ('부추', '')]",겨울에는 국물요리가 최고입니다. 찬바람 불때 뜨끈한 국물요리 한 사발 하고 나면 온몸에 따뜻한 온기가 흐르면서 마음까지도 진정되지요. 순대국은 4계절 다 맛있고 즐겨먹지만 특히 이 겨울에 먹는 순대국은 허기를 달래주는 동시에 몸과 마음을 따시게 데워주는 엄마의 정이 그득한 음식이지요.,"[{'step_number': 1, 'description': '편육은 통으로 되어있는데 얇게 썰어주고,도마 , 조리용나이프', 'image_url': 'https://recipe1.ezmember.co.kr/cache/recipe/2023/12/21/af3fee511e73af00d11368d79a8857091.jpg'}, {'step_number': 2, 'description': '순대는 손가락 한마디 정도로 굵게 썰어줍니다. 순대가 너무 얇으면 끓이다 보면 터지는 수가 있어서 국물도 지저분해집니다.', 'image_url': 'https://recipe1.ezmember.co.kr/cache/recipe/2023/12/21/9611cbe9556180ae1b193c95fc9871ac1.jpg'}, {'step_number': 3, 'description': '저는 얼마 전에 사골을 우린 국물이 있어서 냉동된 것을 조금 녹혀서 사용했어요. 냄비에 사골육수 2팩을 부어줍니다. 1리터 정도 됩니다. 이렇게 끓이면 2~3인분의 양이 됩니다.냄비', 'image_url': 'https://recipe1.ezmember.co.kr/cache/recipe/2023/12/21/b900fdb53d0f958ff235cf7908ad6c911.jpg'}, {'step_number': 4, 'description': '다진 마늘 반 스푼, 대파, 순대, 편육을 한꺼번에 다 넣고 뚜껑을 닫고 5분 정도 끓여줍니다. 너무 쉽지요. 라면보다 더 쉽네요. 맛은 어떨지 궁금하지만요.', 'image_url': 'https://recipe1.ezmember.co.kr/cache/recipe/2023/12/21/ad7e49b26f75a6ef990b6a458703cde01.jpg'}, {'step_number': 5, 'description': '이렇게 끓이다 보면 편육이 스르르 녹아요. 그러면서 국물도 색깔도 엄청 진해집니다.', 'image_url': 'https://recipe1.ezmember.co.kr/cache/recipe/2023/12/21/0b28e8024fcfd5d5f8d83a86343f50131.jpg'}, {'step_number': 6, 'description': '들깨가루는 취향껏 넣어줍니다. 저는 좋아해서 듬뿍 넣어주었어요. 들깨가루가 들어가야 또 남아있을지도 모를 잡내를 확 다 잡아줍니다. 들깨가루는 꼭 들어가야 합니다. 간을 보시고 소금이나 새우젓으로 간을 합니다. 보통 시판용 사골육수에는 간이 되어있는 경우가 많으니 꼭 간을 보시고 넣어주세요. 저는 새우젓으로 간을 했어요.국자', 'image_url': 'https://recipe1.ezmember.co.kr/cache/recipe/2023/12/21/fd2e94356e6056a816eaa5ad8f1818b51.jpg'}, {'step_number': 7, 'description': '초간단 5분 만에 끓여 내는 진하고 맛있는 순대국 완성 전문점에서 보던 그런 비주얼 들깨 향이 너무 좋아요. 뚝배기', 'image_url': 'https://recipe1.ezmember.co.kr/cache/recipe/2023/12/21/20f2c07304a09a8c8235c069b643fb8b1.jpg'}, {'step_number': 8, 'description': '그리고 마지막으로 먹기 전에 후춧가루는 꼭 뿌리세요. 취향껏 많이 뿌려도 상관없어요. 요 후추가 또 맛을 업그레이드해줍니다. 평범한 순댓국에서 세련되고 고급진 순대국으로 만들어줍니다.', 'image_url': 'https://recipe1.ezmember.co.kr/cache/recipe/2023/12/21/1a684f3453825193dcc68d11ae4f33001.jpg'}, {'step_number': 9, 'description': '순대 풀어지지 않고 탱글탱글하니 잘 익었고 편육도 처음 상태는 아니지만 그래도 조금은 형태가 남아있네요. 맛있어요. 엄청 찐하고 맛이 조금 고급 지다고 할까요? 아무튼 식당에서 먹는 순댓국보다 더 맛있네요.', 'image_url': 'https://recipe1.ezmember.co.kr/cache/recipe/2023/12/21/04a7bf52751e9e3e30c37aea26f60e401.jpg'}, {'step_number': 10, 'description': '요 편육이 한수인 것 같아요. 편육이 녹아들면서 국물에다 묘기를 부렸네요. 찐하고 깊고 그리고 고소합니다. 방송에서는 버터가 들어간 고추가루 양념장도 만들었는데 제가 해보니 영 아니여서 넣지않았어요.', 'image_url': 'https://recipe1.ezmember.co.kr/cache/recipe/2023/12/21/8f32d9c48e81accfec38fb16fc3ce08c1.jpg'}]"
48454,국/탕,초스피드,돼지고기,끓이기,시판소스를 이용한 짬뽕,짬뽕,https://recipe1.ezmember.co.kr/cache/recipe/2020/02/14/e72d04b807e4d9e30a0b0dcba4071ba21.jpg,"1,720",60분 이내,아무나,3인분,"[('돼지고기', '200~300g'), ('양파', '1/2'), ('표고버섯', '2~3개'), ('숙주', '150g'), ('청경채', '1개'), ('냉동해물', '약간'), ('배추잎', '2장'), ('대파', '1/2대'), ('시판되는 짬뽕 소스 1봉×', '3'), ('멸치다시 육수 400미리×', '3')]",저는 시판소스를 이용한 간편요릴 좋아해요. 요즘 외식도 걱정스럽고해서 집에서 짬뽕을 만들어 보았습니다.,"[{'step_number': 1, 'description': '모든 재료를 손질해둡니다.', 'image_url': 'https://recipe1.ezmember.co.kr/cache/recipe/2020/02/14/9dccc5347be7a9a7c2338d5d2585ace61.jpg'}, {'step_number': 2, 'description': '예열된 팬에 기름을 두른 후 다진마늘, 다진파를 볶아 향을 냅니다.', 'image_url': 'https://recipe1.ezmember.co.kr/cache/recipe/2020/02/14/8654b591002c323311949f172b41c7541.jpg'}, {'step_number': 3, 'description': '마늘, 파 향이 나면 고기와 해물을 순차적으로 넣고 볶습니다.', 'image_url': 'https://recipe1.ezmember.co.kr/cache/recipe/2020/02/14/d7cd0381ea19c6d01b9e285154dc236b1.jpg'}, {'step_number': 4, 'description': '고기가 반쯤 익어갈때 야채(청경채잎과 숙주는 남기고)를 넣고 볶습니다.', 'image_url': 'https://recipe1.ezmember.co.kr/cache/recipe/2020/02/14/796b72776438271559055ba49b73f3521.jpg'}, {'step_number': 5, 'description': '마지막으로 파잎을 넣고 볶습니다.', 'image_url': 'https://recipe1.ezmember.co.kr/cache/recipe/2020/02/14/0cbc281d77bb44e315576aac557969961.jpg'}, {'step_number': 6, 'description': '소스(3봉)와 멸치다시물(1.2리터)을 넣고 끓입니다.', 'image_url': 'https://recipe1.ezmember.co.kr/cache/recipe/2020/02/14/7964e92289bde74b318c4428f6193d0a1.jpg'}, {'step_number': 7, 'description': '팔팔 끓어오르면 청경채잎과 숙주를 넣고 끓어오르면 거품을 살짝 걷어내고 불을 끕니다.', 'image_url': 'https://recipe1.ezmember.co.kr/cache/recipe/2020/02/14/40cc8db8ca3f494656e672f0de3d3d571.jpg'}, {'step_number': 8, 'description': '완성된 짬뽕을 먹습니다.', 'image_url': 'https://recipe1.ezmember.co.kr/cache/recipe/2020/02/14/9b1805ea89af813b756371c4655b5bac1.jpg'}]"
48455,국/탕,초스피드,돼지고기,끓이기,시판사골곰탕 남은수육 활용요리 초간단 돼지국밥 만들기,돼지국밥,https://recipe1.ezmember.co.kr/cache/recipe/2022/10/11/7a7f099ef9315de324cb5b16445992661.jpg,"3,274",5분 이내,아무나,1인분,"[('돼지고기 수육', '1줌'), ('순대', '4-5개'), ('사골곰탕', '1개'), ('액젓', '1T'), ('대파 흰부분', '1/2대'), ('땡초', '1개'), ('부추', '1줌'), ('새우젓', '적당량')]","갑자기 쌀쌀해진 날씨!
이럴때 뜨끈뜨끈한 국물 생각나지요.
그럴 때 딱 좋은 메뉴 들고왔어요.
제사지내고 남은 수육과 시판 사골곰탕 활용요리를 소개해드립니다.
바로 한그릇 뚝딱하기 좋은 집에서 돼지국밥만들기 완전 초간단레시피 에요!","[{'step_number': 1, 'description': '국물요리라 아무래도 쫄깃한 식감의 앞다리살이 맛있어요.\n요리의 시작은 수육과 남은 순대 몇점을 준비해주시구요.\n대파와 땡초1개는 쫑쫑다져주세요.', 'image_url': 'https://recipe1.ezmember.co.kr/cache/recipe/2022/10/11/4d6990e59759ce7f3e48be0c8d589c741.jpg'}, {'step_number': 2, 'description': '이번 요리의 핵심 부분이라고 할 수 있겠죠!\n팁이라고 한다면.. 시판 사골육수가 담백해질 수 있도록 물과 섞어주는 거에요.\n육수와 물의 비율은 2 : 1로 맞춰주시고 액젓 1T를 넣습니다.\n맛이 훨씬 자연스러워질거에요.레토르트는 100%로 쓰면 감칠맛만 진할 수 있으니 물을 꼭 섞어주세요!', 'image_url': 'https://recipe1.ezmember.co.kr/cache/recipe/2022/10/11/602e5d364fb7aec44b5b99e1180b5bef1.jpg'}, {'step_number': 3, 'description': '팔팔 끓을 때 고기와 순대, 대파를 넣고 끓입니다.\n마무리에서 땡초를 넣고 1분정도 끓여준 뒤 완성합니다.', 'image_url': 'https://recipe1.ezmember.co.kr/cache/recipe/2022/10/11/3aa7192f1fba5547e7448bb9502387a81.jpg'}, {'step_number': 4, 'description': '어울리는 찬들을 함께 내어줍니다.\n잘 익은 아삭한 깍두기와 부추 겉절이를 내었어요.\n부추는 국밥안에 넣을 것은 소금, 고추가루 등으로 물기없게 무친 것이 좋습니다.', 'image_url': 'https://recipe1.ezmember.co.kr/cache/recipe/2022/10/11/4eaf2bf08bbde0766b66e2a836e558291.jpg'}, {'step_number': 5, 'description': '통통한 식감의 순대와 쫄깃한 살코기가 허기를 달래고 따뜻한 육수가 속을 데워주네요.\n돼지의 뼈와 살코기를 푹 삶아 낸 전통 돼지국밥도 맛있지만 한번씩 간편식으로 후딱 만들 수 있다는 장점의 이 간단국밥!\n초스피드로 오 제법인 맛인데?! 할 수 있어 추천드립니다.', 'image_url': 'https://recipe1.ezmember.co.kr/cache/recipe/2022/10/11/77f3da437f72786bb632d26bafcba16d1.jpg'}]"
