index,종류별,상황별,재료별,방법별,글 제목,레시피이름,레시피이미지,조회수,조리시간,난이도,인분,재료,소개글,조리순서
159620,샐러드,다이어트,해물류,무침,여름에 잘 어울리는 미역초샐러드! 와사비 넣어 더 상큼하게,미역초샐러드,https://recipe1.ezmember.co.kr/cache/recipe/2018/07/02/c266461ad4b7032df19bd38c25b9cd441.jpg,"68,628",30분 이내,아무나,1인분,"[('미역                                                                                1인분', '5g'), ('오이', '1/2개'), ('양파                                                                                작은것', '1/2개'), ('통깨', '조금'), ('간장', '5스푼'), ('물', '5스푼'), ('식초', '3스푼'), ('설탕', '1스푼'), ('연와사비', '취향껏'), ('냉동새우', '4-5마리'), ('미림', '1스푼'), ('해물믹스', '적당량')]","여름이라 옷은 얇아지고 맛있는 건 먹고 싶고! 
다이어트가 고민될 때 있으시죠? 
이럴때 한끼 든든하게 먹을 수 있는 간단한 미역초샐러드 소개해요 간장드레싱에 와사비를 풀어 상큼하게 즐길 수 있는 샐러드랍니다","[{'step_number': 1, 'description': '오이는 굵은 소금을 발라 깨끗이 씻어주고 냉동새우살은 물에 담가 해동해주세요 미역은 자른 미역으로 준비해요', 'image_url': 'https://recipe1.ezmember.co.kr/cache/recipe/2018/07/02/653444b6ecc9cdfc9be32ec9d373d4db1.jpg'}, {'step_number': 2, 'description': '양파는 최대한 얇게 썰어주시고\n오이는 반달모양으로 썰어주세요양파는 찬물+식초 두2~3방울에 담가 아린맛을 제거해주는게 좋습니다', 'image_url': 'https://recipe1.ezmember.co.kr/cache/recipe/2018/07/02/0a8a8022e80889f793326aa02e6929121.jpg'}, {'step_number': 3, 'description': '미역을 물에 불려줍니다', 'image_url': 'https://recipe1.ezmember.co.kr/cache/recipe/2018/07/02/f58eab877695456108cdde32f00070641.jpg'}, {'step_number': 4, 'description': '해동한 냉동새우살은 맛술(미림)을 살짝 둘러주어 비린맛을 없애주세요', 'image_url': 'https://recipe1.ezmember.co.kr/cache/recipe/2018/07/02/509ce52a55ffbb100f525ed8529d9e901.jpg'}, {'step_number': 5, 'description': '새우살을 2~3분간 데쳐주고', 'image_url': 'https://recipe1.ezmember.co.kr/cache/recipe/2018/07/02/885f750de4ab297f76e9e2b262b476c91.jpg'}, {'step_number': 6, 'description': '불린 미역도 2분 정도 데쳐 \n찬물에 헹구워줍니다', 'image_url': 'https://recipe1.ezmember.co.kr/cache/recipe/2018/07/02/a13fdaecf6366828d1b06ddaf501abea1.jpg'}, {'step_number': 7, 'description': '간장5스푼, 물 5스푼, 식초 3스푼, 설탕1스푼에 와사비를 취향껏 넣어 드레싱을 만들어 줍니다', 'image_url': 'https://recipe1.ezmember.co.kr/cache/recipe/2018/07/02/01c926121ff68a7a491cae25761995401.jpg'}, {'step_number': 8, 'description': '준비된 재료들을 한데 넣고 \n드레싱을 부어가며 버무려주면 완성! \n접시에 낼땐 통깨를 뿌려주세요', 'image_url': 'https://recipe1.ezmember.co.kr/cache/recipe/2018/07/02/f150a9c1db616d2ce2e47c9d284789dc1.jpg'}]"
159621,샐러드,다이어트,해물류,무침,채소를 많이 먹을 수 있는 [해파리 냉채],해파리냉채,https://recipe1.ezmember.co.kr/cache/recipe/2017/01/20/d04825a5214718d47b7318856e9335a71.jpg,"167,394",60분 이내,아무나,6인분 이상,"[('해파리', '800g'), ('식초', '4큰술'), ('설탕', '4큰술'), ('빨간 파프리카', '1개'), ('노랑 파프리카', '1개'), ('오이', '1개'), ('맛살', '6개'), ('다진마늘', '4큰술'), ('식초', '2큰술'), ('설탕', '2큰술'), ('소금', '1~2작은술'), ('참기름', '2큰술'), ('연겨자', '약간')]","채소를 맛나게 많이 먹을 수 있는 요리가 뭐가 있을까?

아하!!!!
[해파리 냉채]","[{'step_number': 1, 'description': '염장 해파리는 미지근한 물에 담궈 짠맛을 빼줍니다.\n시간은 최소 1시간 부터 ~ 하룻밤 까지\n원하는 짠맛 정도에 맞춰 담궈 주세요.', 'image_url': 'https://recipe1.ezmember.co.kr/cache/recipe/2017/01/20/ebea790c5965322188271499c0fae4481.jpg'}, {'step_number': 2, 'description': '해파리 냉채의 핵심!!!\n해파리 데치기.\n70도의 물에 10초간 재빨리 데치기.\n70도 물 맞추는 방법은?\n물이 팔팔 끓으면 찬물 한컵을 붓고\n불을 끕니다.', 'image_url': 'https://recipe1.ezmember.co.kr/cache/recipe/2017/01/20/236904369b5db260eec3224bffebab791.jpg'}, {'step_number': 3, 'description': '해파리를 넣고 \n10초간 재빨리 데쳐줍니다.', 'image_url': 'https://recipe1.ezmember.co.kr/cache/recipe/2017/01/20/4925e2bdd304508fa24c9c51717435491.jpg'}, {'step_number': 4, 'description': '10초간 데친 해파리를', 'image_url': 'https://recipe1.ezmember.co.kr/cache/recipe/2017/01/20/b8bfea45c3a8cdc0987607be1ddeafb71.jpg'}, {'step_number': 5, 'description': '찬물에 헹궈 뜨거운기를 식힙니다.', 'image_url': 'https://recipe1.ezmember.co.kr/cache/recipe/2017/01/20/67cdcbff277a925432b2e000bf0e340b1.jpg'}, {'step_number': 6, 'description': '식초와 설탕에 해파리를 재웁니다.\n식초1:설탕1비율로\n식초4큰술,설탕4큰술을 넣습니다.', 'image_url': 'https://recipe1.ezmember.co.kr/cache/recipe/2017/01/20/4ff399722932bd760ab518288e6712ec1.jpg'}, {'step_number': 7, 'description': '식초와 설탕에 재운 해파리는 \n냉장고에서 1~2시간 재웁니다.', 'image_url': 'https://recipe1.ezmember.co.kr/cache/recipe/2017/01/20/2970f9c4b0e25fbbca500349d8e5c48e1.jpg'}, {'step_number': 8, 'description': '식초와 설탕에 재운 해파리는 냉장고에서 한달~두달까지 보관이 가능합니다.\n많이 만들어 조금씩 꺼내 먹으면 좋은것 같아요.', 'image_url': 'https://recipe1.ezmember.co.kr/cache/recipe/2017/01/20/a62f5c25b76c2eaebf6030f7dc72d52b1.jpg'}, {'step_number': 9, 'description': '소스에 들어가는 마늘은 진액이 나오지 않게\n칼로 다져서 사용합니다.', 'image_url': 'https://recipe1.ezmember.co.kr/cache/recipe/2017/01/20/a9f95ab8157df7ae5a5cad22e3c68bef1.jpg'}, {'step_number': 10, 'description': '마늘이 씹을 때 식감이 좋게 잘게 다져줍니다.', 'image_url': 'https://recipe1.ezmember.co.kr/cache/recipe/2017/01/20/b6f08a39493d29de7c094fd1ba2f55611.jpg'}, {'step_number': 11, 'description': '[소스 비율]\n다진마늘 2: 식초1:설탕1:물1:참기름1:소금1/5\n연겨자는 선택사항\n재료양에 맞게 비율에 맞춰 소스를 만들어 줍니다.', 'image_url': 'https://recipe1.ezmember.co.kr/cache/recipe/2017/01/20/e13da8367ab68ee1a5902561618a463e1.jpg'}, {'step_number': 12, 'description': '파프리카,오이,맛살을 잘게 채썰어\n색깔을 맞춰 접시에 가지런히 놓습니다.\n채식 식단이 아니라면\n쇠고기,계란지단,칵테일새우를 함께 놓으면\n맛 어우러짐이 더 좋은데 \n아쉽~~', 'image_url': 'https://recipe1.ezmember.co.kr/cache/recipe/2017/01/20/8374e9d89995cb3694d7362028390ce81.jpg'}, {'step_number': 13, 'description': '가지런히 놓은 채소들 위에\n식초와 설탕에 재워 투명해진 해파리를 올립니다.', 'image_url': 'https://recipe1.ezmember.co.kr/cache/recipe/2017/01/20/9a761b1915629b016c12c3f2853d62161.jpg'}, {'step_number': 14, 'description': '해파리위에 소스를 얹고\n채소위에도 소스를 얹습니다.', 'image_url': 'https://recipe1.ezmember.co.kr/cache/recipe/2017/01/20/903b2200f2c328d0517f6835c6b5edd71.jpg'}, {'step_number': 15, 'description': '상에 올린 후', 'image_url': 'https://recipe1.ezmember.co.kr/cache/recipe/2017/01/20/fa5a3ba2e864134b80c675b0fc92a4431.jpg'}, {'step_number': 16, 'description': '식사가 시작되면 재료들과 소스가 잘 섞이도록 버무립니다.', 'image_url': 'https://recipe1.ezmember.co.kr/cache/recipe/2017/01/20/580aa0b26bb6ed8036c895a467673e0e1.jpg'}, {'step_number': 17, 'description': '오도독~ 해파리의 매력적인 식감에\n채소들의 아삭~ 싱그러운 맛이 \n새콤 달콤 마늘과 겨자의 톡! 쏘는 소스와 어우러지는\n맛진 [해파리 냉채] 입니다.', 'image_url': 'https://recipe1.ezmember.co.kr/cache/recipe/2017/01/20/99ea66a4621c23a8f6cfe48ca0fb19181.jpg'}]"
159622,샐러드,다이어트,해물류,무침,남미풍 퀴노아 연어 샐러드,퀴노아연어샐러드,https://recipe1.ezmember.co.kr/cache/recipe/2017/09/16/0630eab902b8c7953397dd284bb65cde1.jpg,"16,104",15분 이내,초급,3인분,"[('훈제연어', '150~180g'), ('오이', '1/2개'), ('아보카도', '1/2개'), ('파슬리', '4~5줄기'), ('적양파', '1/3개'), ('퀴노아', '120ml'), ('방울토마토', '6개'), ('올리브유', '4T'), ('레몬즙', '2T'), ('소금 간봐가며', '약간'), ('후추', '약간')]",세계요리관련 책자를 보고~~ 너무 색감도 이쁘고 맛있을것 같아서...만들었는데... ^^ 맛은 참.. 건강한 맛이었어요ㅎㅎㅎ,"[{'step_number': 1, 'description': '오이는 8ml정도 사이즈로 깍뚝썰고, 파슬리는 다시고, 적양파는 채썰고, 토마토도 깍뚝썰어 준비', 'image_url': 'https://recipe1.ezmember.co.kr/cache/recipe/2017/09/16/7167e55d4a0e5d5c1855c1e3d396c60a1.jpg'}, {'step_number': 2, 'description': '소스 준비하고, 퀴노아는 체에 받쳐 흐르는 물에 조물조물 닦아서 정량', 'image_url': 'https://recipe1.ezmember.co.kr/cache/recipe/2017/09/16/e4f9759081c8bf60172e8a95c333b9491.jpg'}, {'step_number': 3, 'description': '끓는물에 퀴노아 넣고 중간불로 15분~20분정도 삶는다.', 'image_url': 'https://recipe1.ezmember.co.kr/cache/recipe/2017/09/16/b533959c02526575fb2753f25b1d1d871.jpg'}, {'step_number': 4, 'description': '체반에 받쳐 물기를 빼고,', 'image_url': 'https://recipe1.ezmember.co.kr/cache/recipe/2017/09/16/53d126d08d725aa2133b478acacdeaac1.jpg'}, {'step_number': 5, 'description': '준비해놓은 재료와 소스를 섞는다.', 'image_url': 'https://recipe1.ezmember.co.kr/cache/recipe/2017/09/16/3717559ecd9dca73f6be73d0256dcc161.jpg'}]"
159623,샐러드,다이어트,해물류,무침,#태국요리 #태국해산물샐러드 #얌운센만들기 #태국식해물샐러드!!!,얌운센,https://recipe1.ezmember.co.kr/cache/recipe/2018/07/03/a5507231b49120e61a07763f9433a9141.jpg,"10,393",30분 이내,아무나,4인분,"[('얌운센소스', '3큰술'), ('냉동해산물', '2컵'), ('방울토마토', '10개'), ('양파', '1/2개'), ('치커리', '1뭉치'), ('홍고추', '2개'), ('녹두실당면', '40g'), ('피쉬소스(멸치액젓)', '3큰술'), ('설탕', '2큰술'), ('칠리소스', '2큰술'), ('레몬즙', '3큰술')]","여름에 딱 맞는 시원한 해산물샐러드를 먹을 수 있게 되었지요. 
얌운센소스가 없으시면 피쉬소스, 설탕, 레몬즙, 칠리소스를 넣어서 섞어주셔도 
충분히 맛있는 얌운센소스를 만드실 수 있지요. 

얌운센소스가 있으니 냉동해산물을 살짝 데쳐서 준비하고
방울토마토, 양파, 그리고 녹두실당면을 준비해서 소스에 잘 머무려서 차갑게 해서 드시면
시원한 해산물샐러드를 이 여름에 딱 맞춰서 먹을 수 있겠죠.","[{'step_number': 1, 'description': '정말 간단하죠. 재료도 뭐 집에서 흔히 있는 재료들이고요. 해물은 냉동해물을 사용했고요. 뜨거운물에 한번 데쳐 주었습니다. 그리고 물기를 빼 준 후에 차갑게 식혀서는 먹기 좋게 썰어 주었습니다.', 'image_url': 'https://recipe1.ezmember.co.kr/cache/recipe/2018/07/03/ae0a658cbe8692fcdcbe010244c184921.jpg'}, {'step_number': 2, 'description': '양파는 채썰어서 차가운 물에 담궈 놓습니다. 그래야 양파의 알싸한 맛이 중화되거든요. 원래는 적양파를 사용하는 것이 더 좋은데 적양파가 없으니 그냥 양파를 사용하셔도 무관하지요.', 'image_url': 'https://recipe1.ezmember.co.kr/cache/recipe/2018/07/03/878b03fcf9fd1f67b03cf703f92f36b31.jpg'}, {'step_number': 3, 'description': '그냥 토마토를 썰어서 주셔도 좋고요. 방울토마토는 딱 반으로 썰어서 준비하시면 됩니다.', 'image_url': 'https://recipe1.ezmember.co.kr/cache/recipe/2018/07/03/d70a0c753d5659735f86b23965eac22a1.jpg'}, {'step_number': 4, 'description': '원래 들어가는 것은 고수이지만 고수를 못 먹는 관계로다가 비슷한 모양의 치커리를 준비했어요. 치커리도 토마토와 비슷한 크기로 썰어서 준비합니다. 모든 재료를 냉장고에 잠시 두어서 차갑게 해 둡니다.', 'image_url': 'https://recipe1.ezmember.co.kr/cache/recipe/2018/07/03/e4fac9997f661dcdbd12e870475164b21.jpg'}, {'step_number': 5, 'description': '원래는 소스안에 들어가져야 하는 것이 바로 붉은 홍고추 다짐이지요. 이것을 태국에서는 절구에 으깨어서 사용하는데 절구도 없으니 칼로 잘 다져 준비합니다.', 'image_url': 'https://recipe1.ezmember.co.kr/cache/recipe/2018/07/03/09e5d1f8548d3acbce56d110f0aec3c31.jpg'}, {'step_number': 6, 'description': '녹두실당면이지요. 이것을 미즈근한 물에 담궈 놓으셔도 되지만 빠른 시간내에 하시고자 하시면 끓은 물에 살짝 넣고는 살살 흔들어서 1~2분내에 건져내어 주시면 됩니다. 녹두당면이 없으시면 실곤약으로 대체하셔도 비슷한 식감을 느끼실 수 있고요. 사실 실곤약을 사용하게 되면 시간이 지나도 불지 않는다는 장점도 있지요.', 'image_url': 'https://recipe1.ezmember.co.kr/cache/recipe/2018/07/03/dfb55031a1196fefaf79aa627bfa2a851.jpg'}, {'step_number': 7, 'description': '차갑게 냉장고에 잠시 놓아둔 재료들을 모두 한데 모아모아 넣어 줍니다. 다진 홍고추도 넣어 주시고요. 양파는 찬물에서 건져서 물기를 빼 준 후에 넣어 줍니다.', 'image_url': 'https://recipe1.ezmember.co.kr/cache/recipe/2018/07/03/f92fbdc8a7cccde80e31eef1dc5757961.jpg'}, {'step_number': 8, 'description': '이제 얌운센소스를 넣어 주시면 끝이 됩니다. 소스를 넣고는 잘 조물조물 무쳐 주세요. 그러면 얌운센 완성이지요. 완성도를 위해서는 견과류를 위에 뿌려 주시면 더욱 좋겠죠. 달콤한 맛을 위해서 건과일도 함께 뿌려 주어도 되겠네요. 모든 집에 있는 재료들을 활용하시면 되지요.', 'image_url': 'https://recipe1.ezmember.co.kr/cache/recipe/2018/07/03/188bc27e90fdd1efef426d3ea80b8b911.jpg'}, {'step_number': 9, 'description': '얌운센 소스가 따로 없으시면 피쉬소스(이것도 없으시면 멸치액젓), 레몬즙, 칠리소스, 설탕을 잘 섞어서 만드시면 됩니다. 좀더 연한 얌운센소스를 만드시고 싶으시다면 물을 약간 첨가해서 묽게 만드실 수도 있어요.', 'image_url': 'https://recipe1.ezmember.co.kr/cache/recipe/2018/07/03/e1f803a93a458e95acd78d61ebbd91141.jpg'}, {'step_number': 10, 'description': '채소와 토마토가 주는 상큼함과 호로록 넘어가는 녹두당면의 맛!! 새콤하면서도 먹을수록 감칠맛이 나는 맛!!! 얌운센 완성입니다.', 'image_url': 'https://recipe1.ezmember.co.kr/cache/recipe/2018/07/03/e3528a0b37f27e4c5ce8674f5cb7fbed1.jpg'}]"
159624,샐러드,다이어트,해물류,무침,[연어 샐러드] 연어만 있으면 ok!! 다이어트로도 굿! 술안주로도 굿! 간단하게 만들어요 -양싸,연어샐러드,https://recipe1.ezmember.co.kr/cache/recipe/2015/09/11/57b16bb3000e9eb0a9de461f3200dd4e1.jpg,"94,293",10분 이내,아무나,1인분,"[('훈제연어', '적당량'), ('양파', '1/2개'), ('양상추', '1줌'), ('케이퍼', ''), ('홀스래디쉬소스                                                                                시판용', '')]","연어는 사랑이죠~
마트가서 훈제연어 한팩 사왔어요
초밥을 만들어도 되고
샐러드로도 좋고~!
집에 마요네즈나 꿀 있으시죠?
그럼 연어만 있음 되겠넹~ ^^
연어만 있음 만드는 간단한 연어샐러드!!!
만들어볼까요?","[{'step_number': 1, 'description': '양상추를 씻어서 체에받쳐 물기를 빼주세요\n*취향껏 드시고싶은만큼!! \n야채는 바질도 루꼴라도 새싹채소도 무순도 좋아하는 야채로 ~ 개인취향입니다^^*', 'image_url': 'https://recipe1.ezmember.co.kr/cache/recipe/2015/09/11/29488ae78cdeed526c3502f6aad32c091.jpg'}, {'step_number': 2, 'description': '양파는 얇게 썰어 물에 5분정도 담궜다가 체에받쳐 물기를 빼주세요\n*양파를 물에 담그면 매운기가 빠지거든요^^*', 'image_url': 'https://recipe1.ezmember.co.kr/cache/recipe/2015/09/11/2b0ebb84fd27a67c5a01c651f382035f1.jpg'}, {'step_number': 3, 'description': '케이퍼 준비!! \n*연어의 비린맛도 잡아주고 요게 콩같이 생겼는데 꽃봉오리래요~ 톡! 쏘는 매운맛이 있어요 (개인적으로 케이퍼 참 좋아해요^^)*', 'image_url': 'https://recipe1.ezmember.co.kr/cache/recipe/2015/09/11/1ec629900ce5c37627a5984c9bd199841.jpg'}, {'step_number': 4, 'description': '홀스래디쉬소스 (시판용)\n저는 파슬리가루도 넣어봤어요\n*홀스래디쉬소스만들기\n-마요네즈, 꿀 (생략 가능), 소금, 후추가루, 레몬즙(생략 가능), 겨자나 와사비, 다진양파, 다진마늘, 파슬리, 다진오이피클(생략가능)\n*오리엔탈 \n-간장, 꿀(생략 가능), 식초, 다진마늘, 올리브유, 바질또는 깨 \n그리고 또 다르게는\n소금, 후추, 레몬즙, 올리브유, 바질', 'image_url': 'https://recipe1.ezmember.co.kr/cache/recipe/2015/09/11/e69cbdf373bc81e080d2139ec3dff5a21.jpg'}, {'step_number': 5, 'description': '그릇에', 'image_url': 'https://recipe1.ezmember.co.kr/cache/recipe/2015/09/11/420a8c2dc1e789bc71329817027b597a1.jpg'}, {'step_number': 6, 'description': '양상추를 넣고', 'image_url': 'https://recipe1.ezmember.co.kr/cache/recipe/2015/09/11/8fb9c15b888af5f2babd9b0bad2a24ca1.jpg'}, {'step_number': 7, 'description': '양파도 올리고', 'image_url': 'https://recipe1.ezmember.co.kr/cache/recipe/2015/09/11/057225d25746d59207bfb81428fdecb41.jpg'}, {'step_number': 8, 'description': '연어도 올리고 소스와 케이퍼도 올려주시면 끝!!! \n완성입니다! \n사실 연어랑 양파 케이퍼만 있어도 전 굉장히 좋아합니다^^\n개인적으로 홀스래디쉬소스 좋아해용~!!', 'image_url': 'https://recipe1.ezmember.co.kr/cache/recipe/2015/09/11/c00908b8043f31b73ca81506f3b234271.jpg'}]"
159625,샐러드,다이어트,해물류,무침,태국식 샐러드 얌운센,얌운센,https://recipe1.ezmember.co.kr/cache/recipe/2017/07/12/4968e62294ea984aa0f22ed62501f3ae1.jpg,"20,293",30분 이내,초급,1인분,"[('다진 돼지고기', '50g'), ('새우', '7마리'), ('양파', '1/4개'), ('토마토', '1개'), ('샐러리', '1줄기'), ('쪽파', '3뿌리'), ('사이푼국수', '1/3'), ('피쉬소스', '2Tb'), ('라임주스', '2.5Tb'), ('다진마늘                                                                                1ts', '2알'), ('다진 타이고추                                                                                or 청양고추 2개.', '1개'), ('코코넛슈거', '1ts')]",제가 태국음식을 좋아해서 가끔 해 먹는 샐러드예요..제가 지금 미국에 살고 있어서 요즘 한국에 마트가 얼마나 외국 식재료가 구비되어 있는지는 모르겠지만 당근 거의 다 있을더라 믿고 레시피 올려볼게요..ㅋㅋ,"[{'step_number': 1, 'description': '우선 재료 준비 전에 국수부터 불려줄게요..국수는 당면의 식감과 비슷하고 굵기는 더 얇습니다..불고 있을 때 재료 준비 하러 가볼까요?ㅋㅋ', 'image_url': 'https://recipe1.ezmember.co.kr/cache/recipe/2017/07/12/655f78535562c5d3135c83d0ad20c77a1.jpg'}, {'step_number': 2, 'description': '셀러리는 0.5cm로 어슷썰어 주세요..사진에 셀러리는 중국 셀러리라 굵기가 일반 셀러리에 절반 정도고 맛은 좀 쎄네요..아마 고수가 안 맞는 분들에겐 비추예요..', 'image_url': 'https://recipe1.ezmember.co.kr/cache/recipe/2017/07/12/607f154d058f9bb9bc6362e2968c5fa41.jpg'}, {'step_number': 3, 'description': '쪽파 3뿔리는 양파 길이 약 3cm? 검지손가락 2마디 정도 길이로 썰어주세요..', 'image_url': 'https://recipe1.ezmember.co.kr/cache/recipe/2017/07/12/f4467ea366e602e6d26a5e553a12f34a1.jpg'}, {'step_number': 4, 'description': '양파도 채 썰어 주시구요..', 'image_url': 'https://recipe1.ezmember.co.kr/cache/recipe/2017/07/12/a2cc57aff95b01f83bbfe51a0955084e1.jpg'}, {'step_number': 5, 'description': '토마토는 10등분 했어요..제가 토마토를 좋아해서리..ㅋㅋ', 'image_url': 'https://recipe1.ezmember.co.kr/cache/recipe/2017/07/12/bef7f16ed01c37402bb86c5a897a45b21.jpg'}, {'step_number': 6, 'description': '야채 손질이 다끝났으면 고기를 볶아야해요..기름이 아님 물을 이용해서 작은 팬에 볶아요..사진에서 보듯이 정말 팬에 겨우 체울 만큼요..물론 물이 끓을 때 고기를 넣어야겠죠..', 'image_url': 'https://recipe1.ezmember.co.kr/cache/recipe/2017/07/12/d55c62a731ffe96a116ec89bc4606cc11.jpg'}, {'step_number': 7, 'description': '이 사진이 장 안나왔어요..국수를 익힐 때 체에 손질한 새우를 넣고 45초만 익힐께요..국수는 2분을 넘지 않는게 좋아요..1분 45초 정도?왜냐묜 이 국수가 퍼지면 금방 훅 퍼지거든요', 'image_url': 'https://recipe1.ezmember.co.kr/cache/recipe/2017/07/12/8702977fc37c41236c34092480d8d7931.jpg'}, {'step_number': 8, 'description': '준비 된 재료들과 양념들을 넣고 무쳐주세요..제가 코코넛설탕를 첨 써 보는데 일단 설탕이 잘 녹아야 하니 골고루 잘 버무려 주세요..제가 일반 설탕을 써 보긴 했는데 맛이 약간 모자란 느낌?일반 설탕을 사용 하실 경우 흑 > 갈 > 백 추천 합니다..', 'image_url': 'https://recipe1.ezmember.co.kr/cache/recipe/2017/07/12/381775b792d2a1ddf617ba96709b38681.jpg'}, {'step_number': 9, 'description': '완성 되었네요..', 'image_url': 'https://recipe1.ezmember.co.kr/cache/recipe/2017/07/12/66a3fcf5f81a395dad1766f4b57817e81.jpg'}, {'step_number': 10, 'description': '참고 사진이예요..코코넛 설탕인데 일단 굳어 있고 숟가락으로 긁어 써야하네요..혹시 쉽게 쓰는 방법을 아신다면 알려 주세요..', 'image_url': 'https://recipe1.ezmember.co.kr/cache/recipe/2017/07/12/b201d8016243a91054a5ae957c294df41.jpg'}]"
159626,샐러드,다이어트,해물류,무침,"하와이 로컬 음식, 아보카도 연어 포케",아보카도연어포케,https://recipe1.ezmember.co.kr/cache/recipe/2018/03/06/133c66702220a100ba172e8fa734899f1.png,"41,216",30분 이내,초급,2인분,"[('연어', '200g'), ('아보카도', '1개'), ('양파', '1/2개'), ('라임', '1/2개'), ('고수', '1줌'), ('어린 시금치 잎', '1줌'), ('와사비', '약간'), ('맛술 미림', '1큰술'), ('참기름', '2큰술'), ('간장', '1큰술'), ('맛술 미림', '1큰술'), ('천일염', '1/2큰술'), ('깨소금', '1큰술'), ('통후추', '약간')]",국내 유일의 요리 전용 맛술 미림을 활용하여 건강에도 좋고 맛도 좋은 아보카도 연어 포케를 만들어보자!,"[{'step_number': 1, 'description': '아보카도 연어 포케를 위한 기본 재료를 준비해주세요.', 'image_url': 'https://recipe1.ezmember.co.kr/cache/recipe/2018/03/06/17c955f7b3bd938db04627a477bce9e01.png'}, {'step_number': 2, 'description': '양념 재료를 준비해주세요.', 'image_url': 'https://recipe1.ezmember.co.kr/cache/recipe/2018/03/06/bf7118c9fa377cd6ea580bb1aa314f4c1.png'}, {'step_number': 3, 'description': '아보카도와 연어를 먹기 좋은 크기로 썬 후, 연어에 후추와 맛술 미림을 뿌려주세요.\nTIP. 이때 맛술 미림은 연어의 비린내를 제거해준답니다!', 'image_url': 'https://recipe1.ezmember.co.kr/cache/recipe/2018/03/06/b453c1ace4d98503fc932173d6e0e4a31.png'}, {'step_number': 4, 'description': '맛술 미림을 포함한 양념 재료를 모두 넣고 섞어주세요.\nTIP. 이때 맛술 미림은 양념에 감칠맛을 더해준답니다!', 'image_url': 'https://recipe1.ezmember.co.kr/cache/recipe/2018/03/06/e4a0170fbcb0fb445fafb1d5330f0d1f1.png'}, {'step_number': 5, 'description': '고수는 손으로 잘라주고 시금치는 잎을 손질해주세요. 양파는 슬라이스 한 후, 찬물에 담가 매운맛을 제거해주세요.시금치 손질법 레시피', 'image_url': 'https://recipe1.ezmember.co.kr/cache/recipe/2018/03/06/c09031f2a571b77265682720f82ba8e51.png'}, {'step_number': 6, 'description': '그릇에 연어와 양파, 고수를 넣고 양념에 골고루 무쳐주세요.', 'image_url': 'https://recipe1.ezmember.co.kr/cache/recipe/2018/03/06/4d444890b40e39cc9d1b2c671e58f34a1.png'}, {'step_number': 7, 'description': '밥을 담은 그릇에 양념된 연어와 손질해놓은 아보카도, 시금치 잎을 넣어주세요. 남은 양념을 뿌린 후, 라임으로 장식하면 아보카도 연어 포케 완성!', 'image_url': 'https://recipe1.ezmember.co.kr/cache/recipe/2018/03/06/9b1b96df27cf497185e779f6746580fe1.png'}]"
