index,종류별,상황별,재료별,방법별,글 제목,레시피이름,레시피이미지,조회수,조리시간,난이도,인분,재료,소개글,조리순서
12111,밑반찬,초스피드,채소류,볶음,식감 좋고 맛좋은 무나물볶음 만들기,무나물볶음,https://recipe1.ezmember.co.kr/cache/recipe/2024/09/26/766b284b53cfbe4e688f4a77ce2127681.jpg,32,10분 이내,아무나,4인분,"[('무', '1/2개'), ('파', '1움큼'), ('당근', '1움큼'), ('소금', '1/2t'), ('간장', '1t'), ('통깨', '1t'), ('간마늘', '1t'), ('들기름', '1T')]",아이들 반찬으로도 좋고 소화에도 좋은 무나물볶음 만들기 해 볼께요.,"[{'step_number': 1, 'description': '식감 좋고 아이들 반찬으로도 좋은 무나물볶음 만들기 해 볼께요.', 'image_url': 'https://recipe1.ezmember.co.kr/cache/recipe/2024/09/26/cf7f46193021723fba6c2520a9afc7371.jpg'}, {'step_number': 2, 'description': '우선 무를 적당한 두께로 채를 썰어 들기름을 두르고 반쯤 익도록 볶아 주세요.도마 , 조리용나이프 , 프라이팬 , 조리용스푼무 손질법', 'image_url': 'https://recipe1.ezmember.co.kr/cache/recipe/2024/09/26/23416a560893df50bc024c63ee7317cd1.png'}, {'step_number': 3, 'description': '소금1/2t.간장1t.통깨1t.간마늘1t을 넣고 간을 맞추어 주세요.', 'image_url': 'https://recipe1.ezmember.co.kr/cache/recipe/2024/09/26/de035bc28d387bd3593a9dccc708635c1.png'}, {'step_number': 4, 'description': '그리고 마지막으로 파를 넣고 살짝만 더 볶아 주세요.\n생으로도 먹는 무라서 너무 많이 볶으실 필요가 없으세요.대파 손질법', 'image_url': 'https://recipe1.ezmember.co.kr/cache/recipe/2024/09/26/eb9e3b0542de79774dd35870420b79ca1.png'}, {'step_number': 5, 'description': '그럼 너무 맛있는 무나물볶음 완성이랍니다.접시', 'image_url': 'https://recipe1.ezmember.co.kr/cache/recipe/2024/09/26/9d82348e380d52412af9631f223d3d891.jpg'}]"
12112,밑반찬,초스피드,채소류,볶음,None,None,None,None,None,None,None,[],,[]
12113,밑반찬,초스피드,채소류,볶음,[해외자취Cook.feel通]91. 굴소스채소볶음(굴소스야채볶음) 레시피,야채굴소스볶음,https://recipe1.ezmember.co.kr/cache/recipe/2015/12/14/9c31429b2303f33150fda718e2ce327e1.jpg,"2,481",30분 이내,아무나,3인분,"[('양배추', '1/2개'), ('브로콜리', '1주먹'), ('당근채', '약간'), ('굴소스', '2숟가락'), ('참기름', '1숟가락'), ('소금', '약간'), ('후추', '약간')]",집에 굴소스가 있어서 있는 채소들을 모아모아 볶아보게 되었습니다.,"[{'step_number': 1, 'description': '브로콜리나 당근을 바로 손질해서 하시는 경우 양배추만 다듬어서 바로 볶으심 됩니다.브로콜리 손질법 레시피', 'image_url': 'https://recipe1.ezmember.co.kr/cache/recipe/2015/12/14/22c81adc19a01f29de6db9e4099d57221.jpg'}, {'step_number': 2, 'description': '- 냉동시켜진 브로콜리1주먹과 채썬 당근을 후라이팬에 넣고 약불에서 서서히 해동시켜 준다.', 'image_url': 'https://recipe1.ezmember.co.kr/cache/recipe/2015/12/14/9a0125e6139bd98e3b28760ab9fa087d1.jpg'}, {'step_number': 3, 'description': '- 양배추는 깨꼿히 씻은 후에 소금약간으로 10분 정도 절여주곰', 'image_url': 'https://recipe1.ezmember.co.kr/cache/recipe/2015/12/14/c3d28f8ecd37c17bafb71014ce14a6d51.jpg'}, {'step_number': 4, 'description': '- 먹기좋은 사이즈로 북북 찢던지해서 브로콜리와 당근이 있던 후라이팬에 고이고이 올려준다.', 'image_url': 'https://recipe1.ezmember.co.kr/cache/recipe/2015/12/14/6f60db9da911f9a30b1c5d83f95532c51.jpg'}, {'step_number': 5, 'description': '- 후추약간을 넣고 양배추 숨이 죽을때까지 서서히 볶아주다가', 'image_url': 'https://recipe1.ezmember.co.kr/cache/recipe/2015/12/14/7f9bf3ea4e937afabb98169a353df4851.jpg'}, {'step_number': 6, 'description': '- 숨이 어느정도 죽었으면 굴소스 2숟가락 투하', 'image_url': 'https://recipe1.ezmember.co.kr/cache/recipe/2015/12/14/953a199e2e38f750455512e425c5f92d1.jpg'}, {'step_number': 7, 'description': '- 참기름 1숟가락도 마저 투하해서 물기 없어질 때까지 볶아주면', 'image_url': 'https://recipe1.ezmember.co.kr/cache/recipe/2015/12/14/3ab2509aa4ffe6dc4568b18ac739c7421.jpg'}, {'step_number': 8, 'description': '밥도둑이 따로없는 굴소스채소볶음 완성!!!', 'image_url': 'https://recipe1.ezmember.co.kr/cache/recipe/2015/12/14/5febf29b7e2c6b7474c9fe71089cdaec1.jpg'}]"
12114,밑반찬,초스피드,채소류,볶음,묵은지김치볶음,묵은지김치볶음,https://recipe1.ezmember.co.kr/cache/recipe/2015/06/03/4d52c596b3dd50f580cd35d869df74e01.jpg,"36,183",15분 이내,아무나,2인분,"[('묵은지김치', ''), ('들깨기름', ''), ('참기름', '약간'), ('깨소금', '약간')]",간단하게 만들 수 있는 가을 밑반찬종류인 묵은지 김치볶음입니다.,"[{'step_number': 1, 'description': '묵은지를 한번 물에 씻어주세요.아이들과 함께 먹으려면 많이 씻어주셔도 된답니다. 묵은지를 씻어서 먹기좋은 크기로 잘라주시면 됩니다.', 'image_url': 'https://recipe1.ezmember.co.kr/cache/recipe/2015/06/03/4eb4c6429b64489bb0cbc94002c4aae71.jpg'}, {'step_number': 2, 'description': '묵은지김치를 들깨기름과 참기름을 조물조물 무쳐주세요.', 'image_url': 'https://recipe1.ezmember.co.kr/cache/recipe/2015/06/03/d3eddcec131bb074d8d72af43efae6fd1.jpg'}, {'step_number': 3, 'description': '들기름과 참기름을 함께 넣어서 볶아주세요.', 'image_url': 'https://recipe1.ezmember.co.kr/cache/recipe/2015/06/03/9cddb41f388dea93820de421e572461c1.jpg'}]"
12115,밑반찬,초스피드,채소류,볶음,감자볶음 황금레시피,감자볶음,https://recipe1.ezmember.co.kr/cache/recipe/2015/05/11/a98439090f24fb5bb1003f7ebcd58f261.jpg,"62,454",30분 이내,초급,2인분,"[('감자', '2개'), ('천일염', ''), ('통깨', ''), ('후추', ''), ('오일', '조금')]","간단하지만 잘 안하게 되는, 가끔 하면 정말 맛있는 감자채볶음입니다.","[{'step_number': 1, 'description': '감자는 채썰어 줍니다.', 'image_url': 'https://recipe1.ezmember.co.kr/cache/recipe/2015/05/11/5ef102300114fa1e02c3b83a144f10f51.jpg'}, {'step_number': 2, 'description': '끓는 물에 감자채를 넣고 포도씨유 등의 오일 1큰술 정도 넣고 끓여주는데요. 감자가 끓기 시작하면 딱 2분을 끓여줍니다. 체에 받쳐서 물기를 빼주시구요.', 'image_url': 'https://recipe1.ezmember.co.kr/cache/recipe/2015/05/11/3e5d0927d140c1e330a4b89785b4c30f1.jpg'}, {'step_number': 3, 'description': '달군팬에 오일을 두르고 데쳐낸 감자채를 달달 볶다가 감자가 익으면 천일염, 후추로 간을 해주시고 통깨를 솔솔 뿌려주시면 됩니다.', 'image_url': 'https://recipe1.ezmember.co.kr/cache/recipe/2015/05/11/75c82b5d0d5b0170576d1b5365010b711.jpg'}]"
12116,밑반찬,초스피드,채소류,볶음,표고버섯 채소볶음,표고버섯채소볶음,https://recipe1.ezmember.co.kr/cache/recipe/2015/07/14/09b2ab6c4e22a7a7ed58693d469b931d1.jpg,"5,382",10분 이내,아무나,2인분,"[('표고버섯', '3개'), ('파프리카', '1/2개'), ('양파', '1/4개'), ('오이맛고추', '1개'), ('통마늘', '2알'), ('식용유', '약간'), ('소금', '약간'), ('후추', '약간'), ('통깨', '2숟갈')]",냉장고속 자투리 채소들로 만든 맛있는 반찬입니다.,"[{'step_number': 1, 'description': '표고버섯은 깨끗하게 씻어서 꼭지를 따고 얇게 썰어 준비해 주세요~', 'image_url': 'https://recipe1.ezmember.co.kr/cache/recipe/2015/07/14/1dc4bf834d910ed4f6c842e42f527c101.jpg'}, {'step_number': 2, 'description': '통마늘은 편으로, 오이맛고추는 반으로 갈라 씨를 빼주고 채썰어주시구요. 파프리카는 전날 짜투리 남아 있던게 있어서 모양 상관없이 그냥 툭툭 잘라주었고, 양파도 남아있던거 썰어서 준비합니다,', 'image_url': 'https://recipe1.ezmember.co.kr/cache/recipe/2015/07/14/b3ebe5966e5c24ee97ea92b1adff56331.jpg'}, {'step_number': 3, 'description': '기름을 약간 두른 팬에 편마늘을 볶아 향을 내주시고 양파를 넣어 볶아주세요.', 'image_url': 'https://recipe1.ezmember.co.kr/cache/recipe/2015/07/14/a5349f2d2895f4a9cf084949311bd7751.jpg'}, {'step_number': 4, 'description': '표고버섯을 넣고 소금을 넣어 볶아주세요.', 'image_url': 'https://recipe1.ezmember.co.kr/cache/recipe/2015/07/14/29bf7a060f93fd4926e507529c48aaf81.jpg'}, {'step_number': 5, 'description': '오이맛고추와 파프리카를 넣고 채소들이 숨이 죽을때까지 볶아주세요.', 'image_url': 'https://recipe1.ezmember.co.kr/cache/recipe/2015/07/14/31dafa70e7195c5e837304bf60bccd9f1.jpg'}, {'step_number': 6, 'description': '깔끔한 표고버섯 채소볶음을 먹고 싶어 참기름은 넣지 않았구요. 통깨를 비벼서 듬뿍 넣어줬어요~후추도 살짝 뿌려주시면 완성입니다.', 'image_url': 'https://recipe1.ezmember.co.kr/cache/recipe/2015/07/14/2a4ac0f6e17345d648da18afbb02564b1.jpg'}]"
12117,밑반찬,초스피드,채소류,볶음,슈퍼푸드 브로콜리 볶음,브로콜리볶음,https://recipe1.ezmember.co.kr/cache/recipe/2016/06/30/0b62f4dd0032bf056295dbcc0c483768.jpg,"23,625",15분 이내,아무나,3인분,"[('브로콜리', '1송이'), ('양파', ''), ('당근', '약간'), ('참기름', '1큰술'), ('굴소스', '1큰술'), ('간장', '1작은술'), ('허브맛솔트', '1/2작은술')]",브로콜리는 슈퍼푸드로 잘 알려져있죠~ 특히 여성에게 참 좋은 식품이에요~~대부분 스파게티에 넣어먹거나 데쳐서 초장을 찍어먹잖아요~ 이렇게 볶아서 먹어도 참 맛있답니다~,"[{'step_number': 1, 'description': '브로콜리는 적당한 크기로 썰고, 당근,양파도 가늘게 채썬다.', 'image_url': 'https://recipe1.ezmember.co.kr/cache/recipe/2016/06/30/74bbb73a862fe8c6e98c37fead5fa8c5.jpg'}, {'step_number': 2, 'description': '브로콜리는 뜨거운 물에 살짝 데쳐내서 체반에 받쳐서 물기를 빼낸다.', 'image_url': None}, {'step_number': 3, 'description': '달궈진 팬에 참기름 1큰술을 두르고 브로콜리와 양파, 당근을 넣고 볶아준다.', 'image_url': None}, {'step_number': 4, 'description': '굴소스 1큰술, 간장1작은술, 허브맛솔트 1/2작은술을 넣어서 간을 맞춰준다.', 'image_url': None}, {'step_number': 5, 'description': '양파가 아삭거릴정도로 볶아주세요.\n브로콜리는 살짝 데쳐내서 볶아내기 때문에 단시간내에 조리가 가능한 밑반찬이에요~영양가 많은 브로콜리에 굴소스로 양념을 해서 맛을 내는 스피드하게 만들수 있는 요리랍니다~', 'image_url': None}]"
12118,밑반찬,초스피드,채소류,볶음,아삭한 맛까지 더해진 초간단 감자볶음,감자볶음,https://recipe1.ezmember.co.kr/cache/recipe/2016/08/11/31febb842934b9adc3a9b10d2ea4fec51.jpg,"5,932",15분 이내,아무나,2인분,"[('감자', '2개'), ('당근', '1/6개'), ('올리브유', '1스푼'), ('소금', '1TS'), ('후추', '조금')]","감자가 아주 맛있는 계절이예요
소금간만 살짝해도 실패할 확율이 없어요
취향에 따라 부재료만 추가하면 가능합니다","[{'step_number': 1, 'description': '감자와 당근은 껍질을 벗겨 주세요', 'image_url': 'https://recipe1.ezmember.co.kr/cache/recipe/2016/08/11/a2e4ecdfe1622a0c8ac4b58ecb6bae121.jpg'}, {'step_number': 2, 'description': '감자는 편썰어 곱게 채썰어주고 당근도 같은 크기로 썰고 채썬 감자는 물에 한두번 행궈가면서 담궈 전분을 충분히 빼줍니다(전분기를 제거해야 볶을때 들러 붙지 않아요)', 'image_url': 'https://recipe1.ezmember.co.kr/cache/recipe/2016/08/11/a34a8bfb46a869b30a08781c81d726941.jpg'}, {'step_number': 3, 'description': '전분이 빠진 감자는 채반에 밭쳐 물기를 빼고', 'image_url': 'https://recipe1.ezmember.co.kr/cache/recipe/2016/08/11/9def6262d4955094e232bb171ba8b8aa1.jpg'}, {'step_number': 4, 'description': '내프킨을 이용해 감자에 남아 있는 물기를 완전히 제거하고', 'image_url': 'https://recipe1.ezmember.co.kr/cache/recipe/2016/08/11/331033cf2e331aa2f127926c2ce9a1511.jpg'}, {'step_number': 5, 'description': '달군 팬에 오일 두르고 채썬 감자를 넣어 재빨리 볶다 감자색이 투명해지면', 'image_url': 'https://recipe1.ezmember.co.kr/cache/recipe/2016/08/11/c2a8dae5249ff207fab80858b7404be51.jpg'}, {'step_number': 6, 'description': '당근넣어 소금 후추로 간을해 한번 더 볶아줍니다', 'image_url': 'https://recipe1.ezmember.co.kr/cache/recipe/2016/08/11/49ee96dc349eb053cd4f960e548c49631.jpg'}, {'step_number': 7, 'description': '맛있는 감자뽂음 어렵지 않죠 전분 제거한 감자로 만들어 아삭한 식감이 좋아요', 'image_url': 'https://recipe1.ezmember.co.kr/cache/recipe/2016/08/11/3e45ef9a1a61a857b65c45b7cf84c65f1.jpg'}]"
12119,밑반찬,초스피드,채소류,볶음,들기름에 볶아 구수한 고구마순볶음,고구마순볶음,https://recipe1.ezmember.co.kr/cache/recipe/2016/08/25/34c0be6fcedaedf39525152e29ce2efd1.jpg,"8,116",10분 이내,아무나,4인분,"[('삶은 고구마순', '2줌'), ('홍고추', '1개'), ('들기름', '1-2T'), ('다진마늘', '0.5T'), ('다진 파', '1T'), ('간장', '1T')]",여름에 딱 제철인 고구마순! 들기름에 후다닥 볶아서 준비한 간단한 고구마순볶음입니다:),"[{'step_number': 1, 'description': '삶은 고구마순을 준비해주세요.', 'image_url': 'https://recipe1.ezmember.co.kr/cache/recipe/2016/08/25/e923b7f1e15d326281653baa98211f301.jpg'}, {'step_number': 2, 'description': '팬에 들기름 1-2T 두르고', 'image_url': 'https://recipe1.ezmember.co.kr/cache/recipe/2016/08/25/5bf6b62972c1217c6d7facf2c5b423d81.jpg'}, {'step_number': 3, 'description': '고구마순을 넣어 중불에서 약 1-2분간 볶아주세요', 'image_url': 'https://recipe1.ezmember.co.kr/cache/recipe/2016/08/25/2effca261552eaf813df3c26892244201.jpg'}, {'step_number': 4, 'description': '그 다음 다진마늘 0.5T, 다진 파 1T 넣고', 'image_url': 'https://recipe1.ezmember.co.kr/cache/recipe/2016/08/25/39b755f3eb71b423b1e07a64df36f8e71.jpg'}, {'step_number': 5, 'description': '간장 1T를 넣어 잘 섞어주세요.', 'image_url': 'https://recipe1.ezmember.co.kr/cache/recipe/2016/08/25/519b54144453077eb177224788e283161.jpg'}, {'step_number': 6, 'description': '마무리로 홍고추 넣어 한번 더 볶아주시면 완성입니다.\n부족한 간은 소금으로 해주세요.', 'image_url': 'https://recipe1.ezmember.co.kr/cache/recipe/2016/08/25/a5021c6c7bf0c07d23be6b8fd96d88891.jpg'}]"
12120,밑반찬,초스피드,채소류,볶음,비프스톡으로 풍미가 깊어진 감자채볶음 - 맥주 안주로도 좋아요 :),감자채볶음,https://recipe1.ezmember.co.kr/cache/recipe/2016/06/01/2cacb2cf3c4ed414a0657b1104acc0f61.jpg,"3,529",15분 이내,아무나,2인분,"[('감자', '1개'), ('양파', '1/4개'), ('당근', '20g'), ('파프리카', '40g'), ('비프스톡', '1T'), ('후춧가루', '약간'), ('깨소금', '약간')]","반찬 뭐 해먹을까 오늘도 고민되시죠? 감자 한알과 냉장고속 자투리 채소들, 그리고 비프스톡 하나만 있으면 고민 해결! 자주 해먹는 감자채볶음이 비프스톡을 만나면 풍미가 달라져요.","[{'step_number': 1, 'description': '먼저 재료를 준비해주세요.', 'image_url': 'https://recipe1.ezmember.co.kr/cache/recipe/2016/06/01/787858566134ef388d101109e98317741.jpg'}, {'step_number': 2, 'description': '감자는 깨끗하게 씻어 필러로 껍질을 벗겨낸 뒤 예쁘게 채 썰어주세요.', 'image_url': 'https://recipe1.ezmember.co.kr/cache/recipe/2016/06/01/dbf68cfda05ac868d7b49557f5c3a8531.jpg'}, {'step_number': 3, 'description': '알록달록 파프리카도 적당한 크기로 채 썰고,', 'image_url': 'https://recipe1.ezmember.co.kr/cache/recipe/2016/06/01/eb089a25048712962d3a5e725023d7a51.jpg'}, {'step_number': 4, 'description': '껍질 벗긴 양파도 채 썰어주세요.', 'image_url': 'https://recipe1.ezmember.co.kr/cache/recipe/2016/06/01/8024393c71db1dfd1fe8522a719dcdea1.jpg'}, {'step_number': 5, 'description': '기름에 볶으면 베타카로틴 흡수율이 높아지는 당근! 마찬가지로 깨끗하게 씻어 채 썰어줍니다.', 'image_url': 'https://recipe1.ezmember.co.kr/cache/recipe/2016/06/01/e0ab0f1b690da021e8965cf0bd64af521.jpg'}, {'step_number': 6, 'description': '이제 손질을 마친 재료들을 본격적으로 볶아볼까요?\n달군 팬에 기름을 1T 두르고', 'image_url': 'https://recipe1.ezmember.co.kr/cache/recipe/2016/06/01/ac0103fc72469902d52e444eff47e59d1.jpg'}, {'step_number': 7, 'description': '제일 나중에 익는 감자를 먼저 볶아줍니다. 감자가 타지 않게 처음에 센 불에서 살짝 볶다가 중불로 줄여주세요.', 'image_url': 'https://recipe1.ezmember.co.kr/cache/recipe/2016/06/01/a74727d4192fbfd95ca8a4bf44b03a8c1.jpg'}, {'step_number': 8, 'description': '그 다음, 채 썬 양파를 넣고 살짝 투명해질 때까지 볶아주세요.', 'image_url': 'https://recipe1.ezmember.co.kr/cache/recipe/2016/06/01/9096722d02b4df128e2e4beb2dbb74c31.jpg'}, {'step_number': 9, 'description': '양파가 살짝 투명해지면 채 썬 당근을 넣고 기름이 골고루 묻도록 볶아주시다가', 'image_url': 'https://recipe1.ezmember.co.kr/cache/recipe/2016/06/01/6f6d9bfa3bf93784b1d4dded09a09ef61.jpg'}, {'step_number': 10, 'description': '파프리카를 넣어 사각사각 식감이 살아있게 살짝만 볶아주세요.', 'image_url': 'https://recipe1.ezmember.co.kr/cache/recipe/2016/06/01/d9804ca6350b4ae1d1c843d7ad49ef711.jpg'}, {'step_number': 11, 'description': '자! 이제 비프스톡 1T와 후춧가루 약간을 넣어주시고', 'image_url': 'https://recipe1.ezmember.co.kr/cache/recipe/2016/06/01/5580a450a21182c6e7b0cf33f0c567f81.jpg'}, {'step_number': 12, 'description': '다시금 센불에 휘리릭 볶아 골고루 양념이 묻도록 볶아주시면 끝!', 'image_url': 'https://recipe1.ezmember.co.kr/cache/recipe/2016/06/01/8c98f8f9bbf8b5dc8644dae3051306401.jpg'}, {'step_number': 13, 'description': '예쁜 그릇에 담아 손으로 깨소금을 부셔서 뿌려주시면~ 뻔한 감자채볶음은 가라! 초간단!! 비프스톡을 만나 더욱 맛이 깊어진 감자채볶음, 완성입니다! :)', 'image_url': 'https://recipe1.ezmember.co.kr/cache/recipe/2016/06/01/c6f4868816bcaf2470a0c919aeedefd61.jpg'}]"
12121,밑반찬,초스피드,채소류,볶음,아스파라거스 볶음,아스파라거스볶음,https://recipe1.ezmember.co.kr/cache/recipe/2016/05/29/af87afe412a8a72ca2b1472fba699ea31.jpg,"11,929",10분 이내,아무나,2인분,"[('아스파라거스', '3대'), ('양파', '1/3개'), ('비엔나소시지                                                                                큰사이즈', '6개'), ('허브솔트', ''), ('후추', ''), ('올리브유', '1큰술')]",콩나물의 10배인 아스파라긴산을 가진 아스파라거스는 2-3년 재배 이후 수확이 가능해 보통 수입에 의존해왔지만 요새 건강식 재료로 각광을 받고 나선 국산이 많이 생산돼 희소식이에요. 마트에 가도 쉽게 구할 수 있어 좋더라고요. 5-6월이 제철이라 요리하면 맛과 건강을 다 챙길 수 있어 좋아요. 저는 오늘 볶음을 해보려고 해요.,"[{'step_number': 1, 'description': '아스파라거스 손질방법 간단해요. 줄기 쪽을 감아 칼로 살짝 벗겨내고아스파라거스 손질법 레시피', 'image_url': 'https://recipe1.ezmember.co.kr/cache/recipe/2016/06/01/fb1eb63f1630ab8b315f004740b8c0c51.jpg'}, {'step_number': 2, 'description': '아래쪽 밑동을 잘라주면 끝 데칠 때는 끓는 물에 1분 만에 건져서 찬물에 식히면 되지만 오늘은 볶음이라 그냥 잘라서 사용해요.', 'image_url': 'https://recipe1.ezmember.co.kr/cache/recipe/2016/06/01/9ce3d3bc38a56d026bb387766a5eb0c41.jpg'}, {'step_number': 3, 'description': '같이 넣으면 궁합이 좋은 재료는 단백질 고기나 햄 전 둘째가 좋아하는 비엔나소시지를 잘라서 준비 양파도 조금 넣어줘요.', 'image_url': 'https://recipe1.ezmember.co.kr/cache/recipe/2016/06/01/2a634a7a989ff2e384098e07bd254bad1.jpg'}, {'step_number': 4, 'description': '이렇게 재료를 준비한 후', 'image_url': 'https://recipe1.ezmember.co.kr/cache/recipe/2016/06/01/3ad935a16b68d9c3bd862db55e4dfee21.jpg'}, {'step_number': 5, 'description': '올리브기름을 1ts 넣고', 'image_url': 'https://recipe1.ezmember.co.kr/cache/recipe/2016/06/01/fb0c0606a6b432020391acf8bf66d5271.jpg'}, {'step_number': 6, 'description': '아스파라거스 볶음을 달달 볶아줍니다.', 'image_url': 'https://recipe1.ezmember.co.kr/cache/recipe/2016/06/01/c952f2dc11534466c84dbef611d25f1c1.jpg'}, {'step_number': 7, 'description': '나머지 소시지와 양파를 넣은 후 요렇게 해서 꺼내서 먹음 저염식인데.', 'image_url': 'https://recipe1.ezmember.co.kr/cache/recipe/2016/06/01/965e3ac579fed82f75c2871c4ee4d68e1.jpg'}, {'step_number': 8, 'description': '전 허브솔트를 약간', 'image_url': 'https://recipe1.ezmember.co.kr/cache/recipe/2016/06/01/3fb4f311f7d8debcc54c00ec64ff2ca71.jpg'}, {'step_number': 9, 'description': '후추도 솔솔 뿌려줬어요.', 'image_url': 'https://recipe1.ezmember.co.kr/cache/recipe/2016/06/01/2915cb6de649c9fa23a0e70294366aca1.jpg'}, {'step_number': 10, 'description': '비주얼 정말 입맛 당기지 않나요? 스테이크에 가니시로 먹을 땐 몰랐는데아주 신선하면서 달달한 게 둘째도 폭풍 흡입할 정도로 아이들의 입맛도 취향 저격이었어요. 그냥 요대로 고기 한 점 구워서 같이 내면 제철 일품요리가 따로 없는 아스파라거스 볶음. 아삭한 식감이 빠져나올 수 없는 매력이에요.', 'image_url': 'https://recipe1.ezmember.co.kr/cache/recipe/2016/06/01/e47cde867e4bcd49a4f632399356a78b1.jpg'}]"
12122,밑반찬,초스피드,채소류,볶음,"백종원 무나물 만들기 ,, 초스피드 반찬~!",무나물,https://recipe1.ezmember.co.kr/cache/recipe/2017/03/30/184cf80e16d0362b82721732dc1bcfaf1.jpg,"7,853",15분 이내,아무나,2인분,"[('무', '1/4토막'), ('소금', '1작은술'), ('들기름', '1큰술'), ('진간장', '1큰술'), ('통깨', '약간')]","사실 무로 나물은 친정엄마가 너무 맛있게
해주셔서 명절이나 생일 때 정말 맛있게 먹곤 해요
멸치 육수로 정말 감칠맛 나게 해주시거든요
차갑게 먹음 얼마나 맛있는지....
비결을 물어보긴 했지만 집에서는 도전해보진
않았는데요
백종원 무나물 쉬운 레시피라서 도전해보았네요
친정 엄마표와는 다른 맛이지만 맛있게 먹은
간단 반찬 만들기 시작해요","[{'step_number': 1, 'description': '냉장고에 남은 무는 채 썰어 주세요\n많은 양 아님 ....\n채칼보다는 이렇게 손으로 썰면 더 먹음직스러운거\n같아요', 'image_url': 'https://recipe1.ezmember.co.kr/cache/recipe/2017/03/30/6ad159a8f5319d6d360979e43bac2ddd1.jpg'}, {'step_number': 2, 'description': '소금에 간을 해주세요\n무에 간이 배어서 맛있다고 하더라고요\n요 방법은 채김치 할 때 자주 하는 방법이기도 해요\n골고루 간이 잘 베어서\n맛있거든요', 'image_url': 'https://recipe1.ezmember.co.kr/cache/recipe/2017/03/30/c043bc396de54d662ac7f90e63265f991.jpg'}, {'step_number': 3, 'description': '백주부님이 자주 쓰는 들기름에 파기름을 내어주고\n절여놓은 무와 마늘을 넣고 \n볶아주기 시작해요\n중불에서 무가 숨이 죽을 때까지 볶아주세요', 'image_url': 'https://recipe1.ezmember.co.kr/cache/recipe/2017/03/30/191fc5f6123152628c213655275778b81.jpg'}, {'step_number': 4, 'description': '숨이 죽어가면 간장으로 간을 해주는데\n소금으로 절여 주었으니 입맛에 맞게\n조금만 해주면 되세요\n수분이 나올만큼 먹음직스럽게 볶아주세요', 'image_url': 'https://recipe1.ezmember.co.kr/cache/recipe/2017/03/30/c601dee18d45f2697e9dcbee69b2d9fd1.jpg'}, {'step_number': 5, 'description': '정말 초간단 무나물\n완성~\n들기름 맛이 부드럽고 깊은 맛이 나는 듯해요\n쌀뜨물을 중간에 넣어주어야 하는걸\n깜박....\n없는 관계로 물을 조금 넣어주었어요\n어쩐지 뻑뻑하더라구요...ㅠ\n담엔 쌀뜨물을 넣고 만들어봐야겠어요\n고소한맛이 배가 될듯하네요', 'image_url': 'https://recipe1.ezmember.co.kr/cache/recipe/2017/03/30/4a0c9349bb9519d97ee16cdda2f7c2031.jpg'}]"
