index,종류별,상황별,재료별,방법별,글 제목,레시피이름,레시피이미지,조회수,조리시간,난이도,인분,재료,소개글,조리순서
160082,스프,일상,닭고기,끓이기,"우리집 소울푸드 치킨누들스프 치킨누들수프 - 아이식단, 아침식사대용",치킨누들스프,https://recipe1.ezmember.co.kr/cache/recipe/2022/08/16/5980eb63fb4984e3134fe519dc65926a1.jpg,"6,285",90분 이내,초급,4인분,"[('닭', '1kg'), ('당면', '100g'), ('캔옥수수', '200g'), ('당근', '60g'), ('양파', '150g'), ('감자', '180g'), ('대파', '2뿌리'), ('마늘', '5개'), ('녹말가루', '2큰술'), ('물', '2L'), ('굴소스', '1큰술'), ('맛술', '2큰술'), ('소금', '1큰술'), ('후추', '톡톡')]","우리집 아이들 어렸을 적에 자주 만들어주었던 치킨누들스프 레시피 보여드릴께요.
아침식사대용으로도 아주 좋은 한그릇메뉴입니다.","[{'step_number': 1, 'description': '닭볶음탕 용으로 절단된 닭 1kg 준비했어요.\n닭고기는 뼈와 살코기를 분리해주세요.\n닭뼈에 살코기가 조금 붙도록 해줍니다.\n오늘은 닭뼈를 사용할거고 살코기는 양념에 재어두었다가 데리야끼치킨 만드시면 아주 좋아요.\n데리야끼치킨 레시피 링크 첨부해 드릴께요:\n@6977534', 'image_url': 'https://recipe1.ezmember.co.kr/cache/recipe/2022/08/16/0d572a080ffb344752a15c76b25e837c1.jpg'}, {'step_number': 2, 'description': '당면은 찬물에 1시간 정도 담구어 불려주세요.\n급할때엔 뜨거운 물에 담구면 더 빨리 불더라구요.\n불린 당면은 5센치 길이로 잘라주세요.', 'image_url': 'https://recipe1.ezmember.co.kr/cache/recipe/2022/08/16/a2c754b7b48b671a987929e3afb98d9f1.jpg'}, {'step_number': 3, 'description': '마늘은 편으로 썰고 당근, 감자, 양파는 1센치 크기로 깍둑썰기 해주세요.', 'image_url': 'https://recipe1.ezmember.co.kr/cache/recipe/2022/08/16/ea03de262a93f1baae967574023decce1.jpg'}, {'step_number': 4, 'description': '냄비에 닭뼈가 잠기도록 물 붓고 센불에서 끓으면 불을 끕니다.\n닭뼈를 건져내어 흐르는 물에 한 번 씻어주세요.냄비센불에서 끓으면 불 끄기', 'image_url': 'https://recipe1.ezmember.co.kr/cache/recipe/2022/08/16/9f31f91429148ec63faf0cb5ecefb26a1.jpg'}, {'step_number': 5, 'description': '씻은 닭뼈는 물 2L 붓고 센불에서 끓으면 중불로 줄여서 1시간동안 익혀줍니다.\n닭뼈는 건져내어 실코기를 발라냅니다.\n살코기는 쓸거고 닭뼈는 버리면 된답니다.냄비센불에서 끓으면 중불', 'image_url': 'https://recipe1.ezmember.co.kr/cache/recipe/2022/08/16/9fddfe64a582d4251602374d6210f7431.jpg'}, {'step_number': 6, 'description': '캔옥수수는 채에 받쳐서 흐르는 물에 한 번 헹구어주세요.', 'image_url': 'https://recipe1.ezmember.co.kr/cache/recipe/2022/08/16/b15860e326af5837ea6f95691e0182751.jpg'}, {'step_number': 7, 'description': '녹말가루 2큰술에 물 2큰술 넣어 잘 저어서 준비해주세요.', 'image_url': 'https://recipe1.ezmember.co.kr/cache/recipe/2022/08/16/8f83896c69e1832220fefb50125ddcae1.jpg'}, {'step_number': 8, 'description': '닭뼈 삶았던 육수에 맛술 2큰술, 굴소스 1큰술 넣고 소금으로 간을 맞추어주세요.\n저는 소금 1큰술 넣었더니 간이 맞았어요.\n육수의 양은 1.3L입니다.냄비', 'image_url': 'https://recipe1.ezmember.co.kr/cache/recipe/2022/08/16/e0f6c5d2a496a875164722b05b1e7b331.jpg'}, {'step_number': 9, 'description': '센불에서 닭육수에 닭고기와 당근, 감자 넣어주세요.센불', 'image_url': 'https://recipe1.ezmember.co.kr/cache/recipe/2022/08/16/2b5fb013c569c7fbe910139ff79f92fa1.jpg'}, {'step_number': 10, 'description': '당근, 감자가 거의 익었으면 양파와 어슷 썬 대파, 편마늘, 옥수수, 불린 당면 넣어주세요.', 'image_url': 'https://recipe1.ezmember.co.kr/cache/recipe/2022/08/16/13df3b7753e318364f68fe1c48c6773f1.jpg'}, {'step_number': 11, 'description': '당면이 익도록 3분 정도 끓여주세요. 약불로 줄이고 잘 섞은 녹말물을 넣어주세요.\n수저로 저으면서 조금씩 넣어줍니다.약불', 'image_url': 'https://recipe1.ezmember.co.kr/cache/recipe/2022/08/16/34016bfb042dead657d34682b817a8cd1.jpg'}, {'step_number': 12, 'description': '1분간만 저으면서 끓여줍니다.', 'image_url': 'https://recipe1.ezmember.co.kr/cache/recipe/2022/08/16/fecfa06dedb34c5b12e5d15f6e34d3161.jpg'}, {'step_number': 13, 'description': '끝으로 후추 톡톡 넣고 휘리릭 저은 후 불을 끕니다.', 'image_url': 'https://recipe1.ezmember.co.kr/cache/recipe/2022/08/16/734f44ce09e09c82470d5efd264e7a871.jpg'}, {'step_number': 14, 'description': '완성되었어요.\n옥수수와 당면이 들어가서 아이들이 참 좋아해요.\n남은 치킨스프는 당면이 불어서 국물이 줄어드니까 데우실때 물이나 닭육수 좀 더 추가하셔서 데우시면 좋아요.', 'image_url': 'https://recipe1.ezmember.co.kr/cache/recipe/2022/08/16/e217cff31cb48d4677028bc309ee95261.jpg'}]"
160083,스프,일상,닭고기,끓이기,따끈하고 고소한 닭고기 카레 수프,닭고기카레스프,https://recipe1.ezmember.co.kr/cache/recipe/2018/01/04/47c5e40957fb697df46bc3ddd54a7bb01.jpg,"3,905",90분 이내,중급,6인분 이상,"[('닭고기', '300g'), ('양파', '2.5개'), ('당근', '1.5개'), ('카레 가루', '200g'), ('감자', '3개'), ('우유', '500ml'), ('버터', '1T'), ('간장', '2T'), ('맛술', '7T'), ('다진마늘', '1T'), ('소금', '적당히'), ('후추', '적당히'), ('아보카도 오일                                                                                식용유', '적당히')]","어떤 야채나 어떤 고기를 넣어도 강황이 부리는 마법의 아름다움에 중독된 카레 러버입니다. 이 레시피는 다른 가족 구성원들이 텁텁하다고 생각하던 카레를 보다 담백하면서도 부드러운 풍미가 더해진, 농도가 묽은 수프로 탄생시키면 어떨까 하는 생각 끝에 만든 레시피입니다. 빵을 좋아하시는 아빠도, 밥을 안 먹으면 속이 허하다는 언니에게도, 다이어트를 하는 제게도 속이 편하면서 어떤 주재료와도 어울리는 입이 즐거운 음식이 탄생하였습니다. 한번 시도해 보세요. 후회하지 않으실 거예요^^","[{'step_number': 1, 'description': '닭고기는 지방을 잘 발라내고 한입 크기로 손질해 맛술, 다진마늘, 후추, 소금에 재워 주세요. 수프를 끓이기 3시간 전부터 재워두는 게 좋아요.', 'image_url': 'https://recipe1.ezmember.co.kr/cache/recipe/2018/01/04/0f558328f90be3e60cdfae8fbd17041a1.jpg'}, {'step_number': 2, 'description': '당근, 감자를 깨끗이 씻어 먹기 좋은 한입 크기로 잘라 주세요.', 'image_url': None}, {'step_number': 3, 'description': '양파는 길쭉하게 썰어 주세요.', 'image_url': None}, {'step_number': 4, 'description': '적당히 달궈진 냄비나 팬에 아보카도 오일이나 식용유를 두르고 양파를 볶아주세요.', 'image_url': None}, {'step_number': 5, 'description': '이때 양파를 볶으면서 버터와 소금을 추가하세요.', 'image_url': None}, {'step_number': 6, 'description': '볶은 양파에서 단 냄새가 나고 갈색으로 변하면 나머지 야채들을 넣고 함께 볶아주세요.', 'image_url': None}, {'step_number': 7, 'description': '야채들을 다 같이 볶다가 우유를 추가해 주세요.', 'image_url': None}, {'step_number': 8, 'description': '우유가 뭉근히 끓으면 불을 낮추시고 소금, 후추 간을 해주신 뒤 야채들을 70%정도 익히세요.', 'image_url': None}, {'step_number': 9, 'description': '이제 닭고기를 구울 차례인데요. 잘 달궈진 팬에 기름을 살짝 두르고 재워두었던 닭고기를 올려 주세요. 다진마늘을 덜어내고 사용하셔도 좋아요.', 'image_url': None}, {'step_number': 10, 'description': '닭고기를 완전히 바싹 익히지 마시고 어느 정도 익었을 때 카레가 끓고 있는 냄비에 넣어서 같이 끓여 주세요.', 'image_url': None}, {'step_number': 11, 'description': '닭고기는 껍질 쪽 뿐만아니라 속까지 잘 익었는지 확인해 주세요. 이미 안에 육즙이 가둬진 상태기 때문에 구워도 육즙이 날아가지 않습니다.', 'image_url': None}, {'step_number': 12, 'description': '야채들이 끓고 있는 냄비에 카레가루를 갠 물을 잘 저어서 넣어줍니다. 물을 많이 넣어 맛이 희석될까 걱정되시면 우유를 추가하세요.', 'image_url': None}, {'step_number': 13, 'description': '야채가 눌어붙지 않도록 냄비 바닥을 잘 저어 주시다가 카레가 재료들에 잘 배어들고 농도가 진해졌다면 불을 끄세요. 완성입니다.', 'image_url': None}]"
160084,스프,일상,닭고기,끓이기,"*닭 야채 스프*
깔끔하고 시원한 스프",닭야채스프,https://recipe1.ezmember.co.kr/cache/recipe/2016/09/28/bf859550d4c191fb7f42f4745b998b1e1.jpg,"21,910",60분 이내,초급,6인분 이상,"[('닭가슴살', ''), ('당근', ''), ('양배추', ''), ('샐러리', ''), ('양파', ''), ('감자', ''), ('마늘', ''), ('소금', ''), ('후추', '')]","닭가슴살과야채를 넣어 만든스프입니다 
미국에서는 감기걸리면 먹는 스프 입니다","[{'step_number': 1, 'description': '닭가슴살을 쌂아서 찢어 마늘을넣습니다', 'image_url': 'https://recipe1.ezmember.co.kr/cache/recipe/2016/09/28/dc1dd504da368cb4681a000145ff04801.jpg'}, {'step_number': 2, 'description': '1을 푹 끓입니다\n월개수잎을 넣고 끓이면좋습니다', 'image_url': 'https://recipe1.ezmember.co.kr/cache/recipe/2016/09/28/873c1d1b7c152038b9b88f97f30158ff1.jpg'}, {'step_number': 3, 'description': '감자 셀러리 양파 양배추 당근을 준비합니다', 'image_url': 'https://recipe1.ezmember.co.kr/cache/recipe/2016/09/28/c79b574a14c9221676657b93192888631.jpg'}, {'step_number': 4, 'description': '3의야채를 썰어서\n2에 넣고 끓입니다', 'image_url': 'https://recipe1.ezmember.co.kr/cache/recipe/2016/09/28/47d1a92ff66486f9e20eaf855155ec821.jpg'}, {'step_number': 5, 'description': '4를 소금과 후추로 간을 합니다', 'image_url': 'https://recipe1.ezmember.co.kr/cache/recipe/2016/09/28/d045d85d675e941e2fad8873038a49421.jpg'}, {'step_number': 6, 'description': '시원한스프가 완성 됐습니다', 'image_url': 'https://recipe1.ezmember.co.kr/cache/recipe/2016/09/28/91e8436530790e7c9b621c94215c37321.jpg'}]"
160085,스프,일상,닭고기,끓이기,치킨수프 (치킨누들수프),치킨스프,https://recipe1.ezmember.co.kr/cache/recipe/2018/05/26/0b304771a702f5b4e1aa7b04fba1dc761.jpg,"65,450",30분 이내,초급,2인분,"[('닭가슴살                                                                                약 260g', '2덩이'), ('샐러리', '3줄기'), ('당근', '1줌'), ('표고버섯 큰 것', '2개'), ('양파', '1개'), ('마늘', '6~7알'), ('소금', '약간'), ('후추', '약간'), ('치킨스톡', '2~3T'), ('월계수잎', '4장'), ('레몬', '1/2개'), ('펜네                                                                                100g', '1인분'), ('화이트와인', '약간')]","몸살기 있는 남편을 위해 고심끝 고른 메뉴는 (영혼을 치유한다는) 닭고기 수프 ! 여러번 들은 얘기지만, 우리나라에서도 보양식으로 통하는 삼계탕이 있고 바다건너에서도 아플 때 치킨수프를 먹는 문화가 있다는 게 신기하다. 그냥 수프만 끓여 먹어도 되지만 뭔가 그럼 허전할 것 같아 펜네파스타도 같이 넣어 한그릇 요리로 해 먹은 주말 아침 한상~","[{'step_number': 1, 'description': '닭가슴살은 한입크기로 썰어 와인약간, 소금, 허브, 후추 해서 잠시 둔다 샐러리, 당근, 버섯, 양파, 마늘은 다 먹기 좋은 크기로 잘게 썰어두기', 'image_url': 'https://recipe1.ezmember.co.kr/cache/recipe/2018/05/30/227758748d28e4d6af32c3818ed114fa1.jpg'}, {'step_number': 2, 'description': '펜네면 삶아두기 (정해진 시간보다 약간 덜 익히면 됨) 다른 큰 냄비에 올리브유 넉넉히 두르고 잠시 당근, 마늘 볶다가 닭고기 살짝 볶기', 'image_url': 'https://recipe1.ezmember.co.kr/cache/recipe/2018/05/30/bfcd31f703505c5ab59ff980790ab1711.jpg'}, {'step_number': 3, 'description': '겉면만 하얗게 익으면 마저 샐러리, 버섯, 양파 넣고 조금만 더 볶아주고 타지 않게 주의하다가 바로 물 약 1L붓기 치킨스톡 넣고, 월계수잎, 화이트와인 약 1~2t정도 넣어 강한불에 끓이기 (끓이다가 간 보면서 치킨스톡은 필요시 더 넣기, 부족한 간은 소금, 후추로) 치킨 수프 냄비가 바글바글 끓으면 불 약간 줄여 마저 더 익히는데 당근 익은 정도와 간을 봐 가면서 시간 조절하기, 위에 둥둥 뜨는 거품과 불순물 등은 건져주기 중간에 펜네 면 넣기', 'image_url': 'https://recipe1.ezmember.co.kr/cache/recipe/2018/05/30/0ee77b7556e8223628d84092349c78b31.jpg'}, {'step_number': 4, 'description': '바르르 끓으면 마지막 간 보고, 레몬 반개 짜서 접시에 담고 후추나 파슬리 톡톡 해서 내기', 'image_url': 'https://recipe1.ezmember.co.kr/cache/recipe/2018/05/30/ce0a9d9c3e02d15bd299aff3ebe7c99f1.jpg'}]"
160086,스프,일상,닭고기,끓이기,"*토마토 치킨스프*
진한맛의스프",토마토치킨스프,https://recipe1.ezmember.co.kr/cache/recipe/2016/09/29/667dafae08eb93298b05cf3c4fed90b51.jpg,"29,432",30분 이내,초급,5인분,"[('치킨스프', ''), ('토마토페이스트', ''), ('마카로니', ''), ('소금', ''), ('후추', '')]",어제 만든 치킨스프로 토마토 페스트와 마카로니 를 넣어 만든스프 입니다,"[{'step_number': 1, 'description': '치킨스프.토마토페스드 마카로니', 'image_url': 'https://recipe1.ezmember.co.kr/cache/recipe/2016/09/29/f481f1cf59bb8126652a0df11a70d6631.jpg'}, {'step_number': 2, 'description': '마키로니는 살짝 삻아줍니다', 'image_url': 'https://recipe1.ezmember.co.kr/cache/recipe/2016/09/29/a4e9108fc18dd0140d7b3ec90cc5e2b71.jpg'}, {'step_number': 3, 'description': '치킨스프르 ㄹ 끓입니다', 'image_url': 'https://recipe1.ezmember.co.kr/cache/recipe/2016/09/29/55bfa40a7453634d26ebdbef3a04fb751.jpg'}, {'step_number': 4, 'description': '3에 2를 넣습니다', 'image_url': 'https://recipe1.ezmember.co.kr/cache/recipe/2016/09/29/9e0a3ff45e91419a5163b75567b337141.jpg'}, {'step_number': 5, 'description': '4에 토마토 페스트르넣습니다', 'image_url': 'https://recipe1.ezmember.co.kr/cache/recipe/2016/09/29/a87e7c3fb0aa4df2b21723140ae1157c1.jpg'}, {'step_number': 6, 'description': '5를 끓여줍니다', 'image_url': 'https://recipe1.ezmember.co.kr/cache/recipe/2016/09/29/f41633bd004e172066a0d1a06be5003d1.jpg'}, {'step_number': 7, 'description': '6에소금 후추로 간을 합니다', 'image_url': 'https://recipe1.ezmember.co.kr/cache/recipe/2016/09/29/959ceb07fb751eefc0773b4d15dfd2b71.jpg'}, {'step_number': 8, 'description': '완성됐습니다', 'image_url': 'https://recipe1.ezmember.co.kr/cache/recipe/2016/09/29/fbbe18f6074b8b2dd2a146cb52a31ffe1.jpg'}, {'step_number': 9, 'description': '그릇에 스프를 담고 크레카를 부셔서카니쉬합니다', 'image_url': 'https://recipe1.ezmember.co.kr/cache/recipe/2016/09/29/7ec20a26905ac460ce23ab8c65eb9fa31.jpg'}]"
160087,스프,일상,닭고기,끓이기,우유넣고 끓여 칼로리 부담을 줄인 치킨 스프,치킨스프,https://recipe1.ezmember.co.kr/cache/recipe/2015/09/18/ea23432068890329ac244cddb9c4aa4f.jpg,"11,297",30분 이내,아무나,2인분,"[('닭안심살', '60g'), ('빨강 파프리카', '1/4개'), ('주황 파프리카', '1/4개'), ('양파', '1/4개'), ('우유', '200ml'), ('소금', '적당량'), ('밀가루', '1Ts'), ('후추', '약간')]",밥먹기는 귀찮고 배는 고프고 요럴때 너무 좋을꺼 같아요 ~ 그리고 아이들도 진짜 좋아라 할듯하고 그런 치킨스프~,"[{'step_number': 1, 'description': '닭안심살을 준비해주세요 ~ 안심이 없으시면 가슴살로 대체해주세요. 닭안심을 잘 삶아주신후에 손으로 부셔서 준비해주세요.', 'image_url': 'https://recipe1.ezmember.co.kr/cache/recipe/2015/09/18/6dd5a4f71c30f91d1f569d9507cfb94c1.jpg'}, {'step_number': 2, 'description': '야채들은 잘 다져서 준비해주세요.', 'image_url': 'https://recipe1.ezmember.co.kr/cache/recipe/2015/09/18/ab3dcb0238c137eb360c7b989c36c3191.jpg'}, {'step_number': 3, 'description': '냄비에 버터와 올리브유를 넣으신후에 닭안심살 으깬거와 양파를 넣고 살짝 볶아주세요. 요때 양파를 푸욱~ 무르게 안볶으셔도 되요.', 'image_url': 'https://recipe1.ezmember.co.kr/cache/recipe/2015/09/18/0736d950460062f7c0a2cb9cd939c8321.jpg'}, {'step_number': 4, 'description': '대충 양파색이 살짝 투명해질라고 한다 싶으시면 파프리카를 넣고 잘 볶아주세요.', 'image_url': 'https://recipe1.ezmember.co.kr/cache/recipe/2015/09/18/95c98579c2ed8657e98d43caddd5f6541.jpg'}, {'step_number': 5, 'description': '어느정도 볶아주시다가 준비해둔 우유를 넣고 보글보글 끓여주세요. 요때 칼로리좀 줄여보겠다고 저는 생크림을 안넣고 우유를 넣고 끓여줬어요.', 'image_url': 'https://recipe1.ezmember.co.kr/cache/recipe/2015/09/18/0fe558fc7dc4d8f74d53992771e4bd9b1.jpg'}, {'step_number': 6, 'description': '끓여주시다가 밀가루 1Ts 을 넣고 밀가루가 뭉치가 아니하도록 재빠르게 저어주세요. 밀가루를 넣어주신 후에 소금을 넣어서 간을 살짝 맞춰주세요. 그리고 후추도 살짝 넣어주세요.', 'image_url': 'https://recipe1.ezmember.co.kr/cache/recipe/2015/09/18/1b60616d0cfd0aec08328e9af9c42b8c1.jpg'}]"
160088,스프,일상,닭고기,끓이기,치킨누들수프 진한 국물로 마음까지 따뜻해져요,치킨누들수프,https://recipe1.ezmember.co.kr/cache/recipe/2022/03/02/d920e9beb3721092ba9c4a6be772146b1.jpg,835,60분 이내,아무나,2인분,"[('닭', '300g'), ('무', '100g'), ('당근', '70g'), ('양배추', '50g'), ('마늘', '20g'), ('허브솔트', '3g')]","따뜻하게 먹을만한 메뉴를 고민해보다가, 집에있는 야채들과 닭으로 치킨누들수프를 만들어보기로 했어요.
닭곰탕은 종종 해먹는 메뉴인데요, 거기에 야채들을 넣어서 좀 더 국물을 진하게 해서 먹는 느낌으로 생각하심 될 것 같아요.
​","[{'step_number': 1, 'description': '집에 있는 야채를 소환하시면 됩니다.\n양파, 감자, 샐러리, 토마토 등등 각종 재료 다 가능해요.\n저는 집에 있는 무와 양배추, 그리고 당근을 준비해봤습니다.', 'image_url': 'https://recipe1.ezmember.co.kr/cache/recipe/2022/03/02/6eff41f2dd8b0706637e1aa8d8d73c6d1.jpg'}, {'step_number': 2, 'description': '닭 정육은 살짝 애벌삶기를 할 예정이에요.\n딸이 껍질을 좋아해서 제거하지 않고 다 사용할 예정인데요, 깔끔한 맛을 좋아하신다면 껍질 제거하셔도 좋을 것 같습니다.살이 많은 부위를 선택하시면 좋아요. 가슴살도 좋고, 허벅지살도 좋아요', 'image_url': 'https://recipe1.ezmember.co.kr/cache/recipe/2022/03/02/5e1fbd4f3b8e1da582b0dff5133712f51.jpg'}, {'step_number': 3, 'description': '금방 끓을만큼 물을 넣고요~~ 닭이 잠기도록 해주면 됩니다.', 'image_url': 'https://recipe1.ezmember.co.kr/cache/recipe/2022/03/02/e8c119395a400a967fc36d12fb06705b1.jpg'}, {'step_number': 4, 'description': '한번 호로록~ 끓여주면 이렇게 불순물이 한번 나와서 거품이 만들어져요.\n요렇게 호로록 한번만 끓이고 닭을 물로 헹궈줍니다.', 'image_url': 'https://recipe1.ezmember.co.kr/cache/recipe/2022/03/02/099fd8217aee979139fd0bf857f14dbc1.jpg'}, {'step_number': 5, 'description': '불순물이 제거되었습니다.\n깔끔하죠~', 'image_url': 'https://recipe1.ezmember.co.kr/cache/recipe/2022/03/02/cbff7fd6eafe21d14eabd19d7daf94c71.jpg'}, {'step_number': 6, 'description': '들어가는 재료들은 먹기좋은 크기로 잘라줍니다', 'image_url': 'https://recipe1.ezmember.co.kr/cache/recipe/2022/03/02/810b762792fed64fc2e0077bce95f1c41.jpg'}, {'step_number': 7, 'description': '마늘도 다져줬어요.', 'image_url': 'https://recipe1.ezmember.co.kr/cache/recipe/2022/03/02/47753f5a306a646d3094c7544016df101.jpg'}, {'step_number': 8, 'description': '물을 2리터 정도 넣고 야채를 한번에 다 넣어줍니다.', 'image_url': 'https://recipe1.ezmember.co.kr/cache/recipe/2022/03/02/d728dcb178516915f20298676a14d7211.jpg'}, {'step_number': 9, 'description': '집에 있는 각종 허브를 넣어주면 좋은데요, 요렇게 고기 살 때 챙겨주신 허브솔트를 사용해도 좋습니다.', 'image_url': 'https://recipe1.ezmember.co.kr/cache/recipe/2022/03/02/5e85922c27d7db1e087360248983aafe1.jpg'}, {'step_number': 10, 'description': '허브솔트 3그람 한봉지 그대로 사용했고요, 다진 마늘을 넣었습니다.\n이제 푹~~ 끓여주세요', 'image_url': 'https://recipe1.ezmember.co.kr/cache/recipe/2022/03/02/887a575e4fa7096a00f32b930f12cbf11.jpg'}, {'step_number': 11, 'description': '끓이다가 치킨스톡이 있으면 1개 넣어주면 좋고요,\n저는 치킨스톡이 없어서 연두 한큰술을 넣었습니다.\n잘 익은 치킨은 중간에 건져서 가위로 쓱쓱 잘라줬어요.', 'image_url': 'https://recipe1.ezmember.co.kr/cache/recipe/2022/03/02/65f8d44387cc858ba05060cb37f7a2e71.jpg'}, {'step_number': 12, 'description': '닭과 야채에서 육수가 우러나오려면 시간이 걸려요.\n적어도 30분정도는 끓여야한답니다.\n30분이상 끓여낸 이후에~ 면을 넣어보겠습니다.', 'image_url': 'https://recipe1.ezmember.co.kr/cache/recipe/2022/03/02/eeeadb5180e413f41bf52c2f38ac61141.jpg'}, {'step_number': 13, 'description': '1.5인분 넣어서 아이와 둘이 먹을꺼에요.\n파스타면은 취향대로 넣어주심 되는데요, 늘 생각보다 양이 많아지니 제품 뒷면에 나온 적정 1인분 표시를 보시고 가늠하시길 추천드려요.\n파스타면을 넣을까 당면을 넣을까 고민하다가 이번엔 파스타면으로 해봤습니다.', 'image_url': 'https://recipe1.ezmember.co.kr/cache/recipe/2022/03/02/c52c01ef6d1d9292e0d0d1fe51ef8a8c1.jpg'}, {'step_number': 14, 'description': '면을 따로 삶아내지 않고 그대로 넣어서 끓일꺼에요.\n면수도 우러나와서 국물이 더 진해지겠죠.\n맑은 국을 좋아하신다면 따로 삶아서 해도 되는데요, 이번엔 한번 바로 넣어보세요^^', 'image_url': 'https://recipe1.ezmember.co.kr/cache/recipe/2022/03/02/0a0cc093b731aa9cc50e1446fef75c481.jpg'}, {'step_number': 15, 'description': '파스타면 제품에 표기된 조리시간에 맞춰서 삶아주심 됩니다.\n만약에 10분~12분으로 쓰여있으면 12분에 맞추시는 것이 좋아요.\n맹물이 아니고 육수라서 조금 늦게 익거든요.\n마지막으로 간을 보고 더해주시면 끝.\n저는 볶음김치와 먹을 예정이라 추가로 간 하지 않았어요.', 'image_url': 'https://recipe1.ezmember.co.kr/cache/recipe/2022/03/02/358d52784fece64dca0f65d9839a947a1.jpg'}]"
