index,종류별,상황별,재료별,방법별,글 제목,레시피이름,레시피이미지,조회수,조리시간,난이도,인분,재료,소개글,조리순서
14801,밑반찬,손님접대,과일류,굽기,상큼한 파인애플과 베이컨 환상의 조합! 파인애플베이컨말이,파인애플베이컨말이,https://recipe1.ezmember.co.kr/cache/recipe/2017/05/12/83ff357aa3b03a1c9674d168a56b79df1.jpg,"16,292",30분 이내,아무나,4인분,"[('통조림 파인애플', '4개'), ('베이컨', '8장'), ('머스터드소스', '약간')]","이렇게 간단하게 만드는데
맛은 진짜.. 캐 고급집니다♥

세상의 모든 레시피 만개의레시피","[{'step_number': 1, 'description': '파인애플은 2등분 해준다.통조림 파인애플 4개', 'image_url': 'https://recipe1.ezmember.co.kr/cache/recipe/2017/05/12/be9f95c369b7476c7b526f98804f53121.jpg'}, {'step_number': 2, 'description': '자른 파인애플을 베이컨으로 만다.베이컨 8장', 'image_url': 'https://recipe1.ezmember.co.kr/cache/recipe/2017/05/12/c289bdae708bc647531f7cca7cbca7ed1.jpg'}, {'step_number': 3, 'description': '예열된 팬에 노릇하게 구워 완성한다.[선택재료] 머스터드소스 약간팬', 'image_url': 'https://recipe1.ezmember.co.kr/cache/recipe/2017/05/12/22cdec3c7afb0d1b91cf61c8bb262a0b1.jpg'}]"
14802,밑반찬,손님접대,과일류,굽기,아보카도베이컨말이! 간단하지만 근사한 과일요리!,아보카도베이컨말이,https://recipe1.ezmember.co.kr/cache/recipe/2017/06/02/b249c7cc994b0053b9beed887f51fa911.jpg,"6,441",60분 이내,아무나,3인분,"[('아보카도', '1개'), ('베이컨', ''), ('오일', '약간'), ('허니머스타드소스', ''), ('레몬즙', '')]","요즈음 다시 ""냉장고 파먹기""를 하고 있는 가시장미네는 냉동실에 소분해 자리하고 있던 베이컨을 
아보카도에 돌돌 말아 아보카도 베이컨말이를 만들어 맛있게 먹었어요.
저희 대빵이 사다 준 큰 아보카도가 딸랑 1개 남았을 때 
저희 집으로 배송된 선물, 아보카도 덕에 또 열심히 맛있게 먹고 있어요.","[{'step_number': 1, 'description': '숙성이 잘 된 아보카도에 칼을 과육 중앙에 자리한 씨까지 찔러 씨를 중심으로 \n360도로 회전하듯 반으로 갈라준 뒤,\n씨를 제거해주세요.아보카도 손질하는 방법 : http://blog.naver.com/hwa202/221012889612', 'image_url': 'https://recipe1.ezmember.co.kr/cache/recipe/2017/06/20/92b7c11590dd484e9842506205b830661.jpg'}, {'step_number': 2, 'description': '씨와 껍질을 제거한 아보카도는 기호에 맞게 세로 & 가로로 슬라이스해주세요.\n전, 아보카도 베이컨말이를 완성했을 때 한 입에 쏘~옥 들어가도록\n가로로 슬라이스해준 뒤, 알맞게 자른 베이컨 위에 올리고 돌돌 말아줬어요.', 'image_url': 'https://recipe1.ezmember.co.kr/cache/recipe/2017/06/20/2c82282948c1cfe702cd607de06ad03f1.jpg'}, {'step_number': 3, 'description': '한 입에 쏙! 쏙!\n들어가게끔 베이컨으로 돌돌 말아준 아보카도는', 'image_url': 'https://recipe1.ezmember.co.kr/cache/recipe/2017/06/20/eb9069f0523dd3e13100c6c0ffd54a241.jpg'}, {'step_number': 4, 'description': '달구어진 팬에 오일을 둘러 키친타월로 닦아준 뒤, 팬에 올리고 앞뒤로 노릇하게 구워주세요.팬에 올려 구울 땐 돌돌 말린 베이컨의 마지막 부분이 아래쪽으로 가게끔\n해야 베이컨이 풀리지 않아요.', 'image_url': 'https://recipe1.ezmember.co.kr/cache/recipe/2017/06/20/83077c413a6abae31840f672817bceb21.jpg'}]"
