index,종류별,상황별,재료별,방법별,글 제목,레시피이름,레시피이미지,조회수,조리시간,난이도,인분,재료,소개글,조리순서
59173,디저트,간식,과일류,조림,살구가 제철!! 시원하게 먹는 살구병조림,살구병조림,https://recipe1.ezmember.co.kr/cache/recipe/2019/06/28/f9523d5b0e13cf2e4a8f4d3d4a2bf11e1.jpg,"2,364",30분 이내,아무나,6인분 이상,"[('살구', '1kg'), ('설탕', '2컵'), ('물', '4컵')]",살구가 제철인데..오래두고 먹을 순 없고..병조림으로 만들어 시원한 여름간식 하세요.,"[{'step_number': 1, 'description': '물4컵,설탕2컵을 냄비에 넣고 끓여요.', 'image_url': 'https://recipe1.ezmember.co.kr/cache/recipe/2019/06/28/e9c38481179dfa2039c66afe535de5fb1.jpg'}, {'step_number': 2, 'description': '살구는 반갈라 씨를 빼고 껍질을 벗겨서 병에 차곡차곡 담아요', 'image_url': 'https://recipe1.ezmember.co.kr/cache/recipe/2019/06/28/29c3b259c1d876950c18adeac9dbe79c1.jpg'}, {'step_number': 3, 'description': '끓인 설탕물을 병에 담아요', 'image_url': 'https://recipe1.ezmember.co.kr/cache/recipe/2019/06/28/c77a745cd62ada6e4942992522edb30e1.jpg'}, {'step_number': 4, 'description': '냉장고에 넣었다 시원하게 드세요', 'image_url': 'https://recipe1.ezmember.co.kr/cache/recipe/2019/06/28/0569c13f07404bcf60f8343eaa9da82a1.jpg'}]"
59174,디저트,간식,과일류,조림,사과 디저트요리,사과,https://recipe1.ezmember.co.kr/cache/recipe/2017/07/03/92f882382e14e475c9fdc629d75c3b781.jpg,"6,274",30분 이내,초급,2인분,"[('사과', ''), ('만두피', ''), ('설탕', ''), ('계피', ''), ('물', '')]","알카리성 식품으로 칼로리는 적고 

비타민과 식이섬유,기능성물질이 풍부해서

오죽하면 하루에 사과 한알이면 의사가 필요 없다는 말도 있는데요

사과를 이용해서 맛있는 간식을 만들어 봤답니다","[{'step_number': 1, 'description': '달콤한 꿀사과로 오랜만에 아이가 좋아하는 \n달콤한 디저트를 만들었는데요', 'image_url': 'https://recipe1.ezmember.co.kr/cache/recipe/2017/07/03/066548c8a550cc6c8e0934863f3f221a1.jpg'}, {'step_number': 2, 'description': '사과와 만두피만 준비하면 아주 간단하게 만들 수 있는 요리에요\n기름에 튀기거나 부치는 요리가 아니라\n다이어트에도 조금은 도움이 될거에요', 'image_url': 'https://recipe1.ezmember.co.kr/cache/recipe/2017/07/03/78a52c132275672d5e84f285226c36b01.jpg'}, {'step_number': 3, 'description': '우선 사과는 얇팍하게 썰어주시구요\n약간의 설탕과 계피,물을 넣고 졸여주세요', 'image_url': 'https://recipe1.ezmember.co.kr/cache/recipe/2017/07/03/9f795b8d3392a6903be0537e76aad8f91.jpg'}, {'step_number': 4, 'description': '만두피에 기름을 앞뒤로 발라주고\n은박지에 넣어 틀을 만들어주세요', 'image_url': 'https://recipe1.ezmember.co.kr/cache/recipe/2017/07/03/c5b690a9aa82d5bf856dcdadf452576b1.jpg'}, {'step_number': 5, 'description': '그리고 만들어 놓은 사과조림을 이쁘게 넣어주고\n오븐에서 구워주시면 된답니다', 'image_url': 'https://recipe1.ezmember.co.kr/cache/recipe/2017/07/03/43e2fa848e7bc2485ec4ec9134d5699d1.jpg'}, {'step_number': 6, 'description': '요건 달콤함이 생각날때 간단하게 만들 수 있는 간식인데요\n식사 후 디저트로도 달달하니 정말 좋아요\n요렇게 만들어 210 오븐에서 15분정도 구워주시면\n바삭하고 달콤한 사과디저트가 만들어져요오븐', 'image_url': 'https://recipe1.ezmember.co.kr/cache/recipe/2017/07/03/8cc90b9483697251e0e9da82e97d88181.jpg'}, {'step_number': 7, 'description': '오븐에서 잠깐이면 요렇게 바삭하니 먹음직스런 달달한 간식이..\n울딸아이가 과자을 좋아하다 보니 요런 간식을 자주 만들어 주는데요\n바삭한 과자안에 달콤한 사과조림이 하나가득~~\n먹어보면 입안에서 살살 녹는답니다', 'image_url': 'https://recipe1.ezmember.co.kr/cache/recipe/2017/07/03/4535d0158df8364223376b140b735a021.jpg'}, {'step_number': 8, 'description': '모양도 이쁘고..\n하나씩 들고 먹기에도 좋구요', 'image_url': 'https://recipe1.ezmember.co.kr/cache/recipe/2017/07/03/d5c3cafa3749a6ed835d47aa126ce2b21.jpg'}, {'step_number': 9, 'description': '설탕이 많이 들어가지 않아\n단거 별로 안좋아하는 저도 요건 은근히 맛나드라구요', 'image_url': 'https://recipe1.ezmember.co.kr/cache/recipe/2017/07/03/52a94a582f18d49acca97378eccf27941.jpg'}, {'step_number': 10, 'description': '사과와 만두피만 있으면 간단히 만들어 먹을 수 있고\n다이어트 하시는 분들은 설탕양을 줄여 주시면 \n살찔걱정도 줄일 수 있어요\n무엇보다.. 겉은 바삭 속은 향긋한 사과조림이라\n어른 아이 모두가 좋아하는 맛있는 간식이랍니다', 'image_url': 'https://recipe1.ezmember.co.kr/cache/recipe/2017/07/03/4af33927df299668e54cc39a6a079f5a1.jpg'}]"
59175,디저트,간식,과일류,조림,만능 복숭아 통조림,복숭아통조림,https://recipe1.ezmember.co.kr/cache/recipe/2020/09/08/24a6317cbe28d1e5c2749bc4e319d48f1.jpg,"1,961",60분 이내,아무나,4인분,"[('복숭아', '5~10개'), ('설탕', '원하는만큼'), ('물', '')]",혹시~ 복숭아 샀는데 망했다~하시는 분들 계실까요? 흐잉 ㅠㅠ 제 경우가 딱 그래요ㅠㅠㅠㅠ(다행히{?}선물받은거라?!??!!?!!???!!?!?) 그래서 오늘 수제 복숭아 통조림이랑 복숭아 얼음 만들어 보려구 해요. 맛있게 드세요!!!!!!,"[{'step_number': 1, 'description': '복숭아는 껍질을 벗기고 먹기 좋게 잘라주세요.', 'image_url': 'https://recipe1.ezmember.co.kr/cache/recipe/2020/09/08/1edeadc92842e1f5250448c9824b06b91.jpg'}, {'step_number': 2, 'description': '커다란 냄비에 설탕, 물, 복숭아를 넣고 끓여주세요.', 'image_url': 'https://recipe1.ezmember.co.kr/cache/recipe/2020/09/08/d9516debcfc0e747e12447f7c79adc291.jpg'}, {'step_number': 3, 'description': '끝!!! 물이나 탄산수에 타먹으면 맛있고 푸딩을 해 먹어도 좋아요.', 'image_url': 'https://recipe1.ezmember.co.kr/cache/recipe/2020/09/08/7bd2492fe3b1b620cf4e91c97ea884fe1.jpg'}]"
59176,디저트,간식,과일류,조림,맛없는 복숭아로 백도 통조림 만들기,복숭아통조림,https://recipe1.ezmember.co.kr/cache/recipe/2017/08/20/3bd3bb67159ea97a3762847d3c9a572e1.jpg,"31,177",30분 이내,아무나,2인분,"[('복숭아', '적당히'), ('설탕', '적당히')]","요즘 복숭아가 제철인데 
큰맘먹고 샀던 복숭아가 너무 맛이 없어서 
시중에 파는 백도통조림을 만들었어요
설탕양을 조절할수 있으니깐 아이들주기에도 안심이예요
만드는 방법이 너무 간단해서 
아이와 함께 만들어보는것도 
좋아요 
(아이들이 너무 좋아한답니다)","[{'step_number': 1, 'description': '시장에서 큰맘먹고 샀던 복숭아가 \n너무 맛이없어 속상해서 만들어본 \n백도만들기입니다\n너무 간단하지만 아이들과 함께 하기 좋아요\n복숭아를 깨끗이 씻어 줍니다', 'image_url': 'https://recipe1.ezmember.co.kr/cache/recipe/2017/08/20/01dd1a4422f549da1f617818f7fcc8981.jpg'}, {'step_number': 2, 'description': '껍질을 벗기고', 'image_url': 'https://recipe1.ezmember.co.kr/cache/recipe/2017/08/20/9274fd69eeb4dcef22cb9c2254c84e1b1.jpg'}, {'step_number': 3, 'description': '먹기좋은크기로 썰어줍니다 \n(동영상참고해주세요 7살짜리 딸아이와\n같이 했는데 너무 좋아했어요 )\n냄비에 복숭아가 잠길정도로 물을 담아서 \n끓여줍니다 설탕을 이때 넣는데 이건 취향껏 넣으세요 \n아이들 주는거면 너무 많이 넣지 않는게 좋겠죠 \n맛봐가면서 넣어주세요 \n보통 한컵에서 두컵들어갑니다', 'image_url': 'https://recipe1.ezmember.co.kr/cache/recipe/2017/08/20/c56af13551ce6f0d7707cb287d2163fd1.jpg'}, {'step_number': 4, 'description': '너무 오래익히면 물렁해지니깐 끓어오르면 불을 끄세요', 'image_url': 'https://recipe1.ezmember.co.kr/cache/recipe/2017/08/20/8d20eca7ece5380dab3b72cfb8c3afde1.jpg'}, {'step_number': 5, 'description': '그리고 유리그릇에 옮겨담고 냉장고에 넣어서 식혀 줍니다', 'image_url': 'https://recipe1.ezmember.co.kr/cache/recipe/2017/08/20/d994f494f636cddb9a05f5e16760fa551.jpg'}, {'step_number': 6, 'description': '차갑게 식은 복숭아를 그릇에 덜어 먹으면\n아주 맛있는 백도복숭아가 완성됩니다', 'image_url': 'https://recipe1.ezmember.co.kr/cache/recipe/2017/08/20/caa1217a59904f3f70e958500d2e4bd31.jpg'}]"
59177,디저트,간식,과일류,조림,복숭아 병조림,복숭아병조림,https://recipe1.ezmember.co.kr/cache/recipe/2015/06/08/b1bb7ed7864e26f234538be05b6cef70.jpg,"31,790",90분 이내,초급,1인분,"[('백도복숭아', '5개'), ('물', '2컵'), ('설탕', '180ml')]",환경호르몬 걱정없는 유리병에 만든 복숭아병조림,"[{'step_number': 1, 'description': '복숭아는 깨끗이 씻어 준비하세요', 'image_url': 'https://recipe1.ezmember.co.kr/cache/recipe/2015/06/19/b000f3597026b607a55cc0ab1748f53a1.jpg'}, {'step_number': 2, 'description': '복숭아 한개를 8등분으로 조각내어 껍질을 벗겨줍니다.', 'image_url': 'https://recipe1.ezmember.co.kr/cache/recipe/2015/06/19/28434b0add197a9237e5e7321636ba221.jpg'}, {'step_number': 3, 'description': '열탕소독한 유리병에 복숭아를 차곡차곡 담아주세요', 'image_url': 'https://recipe1.ezmember.co.kr/cache/recipe/2015/06/19/a911b30babd3bc94755f673bb606bfd91.jpg'}, {'step_number': 4, 'description': '이제 설탕절임물을 만들건데요.분량의 물에 설탕을 넣어주세요.', 'image_url': 'https://recipe1.ezmember.co.kr/cache/recipe/2015/06/19/6285b93c85ec9be4c4ecfad80e34288a1.jpg'}, {'step_number': 5, 'description': '팔팔 끓기 시작하면 중약불로 줄인후 3분정도 끓여주세요', 'image_url': 'https://recipe1.ezmember.co.kr/cache/recipe/2015/06/19/0eaa429c59c9d460962a96ae26d7b3021.jpg'}, {'step_number': 6, 'description': '복숭아가 든 유리병에 뜨거운 설탕물을 냅다 들이부어주세요', 'image_url': 'https://recipe1.ezmember.co.kr/cache/recipe/2015/06/19/7c56714e67f762a6e4d3f481a076d1921.jpg'}, {'step_number': 7, 'description': '냄비에 물을 담은후 복숭아가 든 병을 넣고.. 병 입구에는 냄비뚜껑을 살짝 덮어준후.. 끓기 시작하면 약불로 줄여 50분정도 끓여줍니다', 'image_url': 'https://recipe1.ezmember.co.kr/cache/recipe/2015/06/19/8c31fcef0a08c7966df36caa3cf6ec051.jpg'}, {'step_number': 8, 'description': '물이 줄어들면 수시로 뜨거운 물을 부어 보충해 주면서 끓여주셔야해요', 'image_url': 'https://recipe1.ezmember.co.kr/cache/recipe/2015/06/19/a687e2a7a94061cdf5087ab6ec7b014d1.jpg'}, {'step_number': 9, 'description': '병입구에 냄비뚜껑을 살짝 걸쳐 그대로 식혀준후.. 완전히 식으면 병뚜껑을 닫아 냉장고에 보관하시면 되어요', 'image_url': 'https://recipe1.ezmember.co.kr/cache/recipe/2015/06/19/ff93517170f1720715f60c2b49db918b1.jpg'}]"
59178,디저트,간식,과일류,조림,말복에는 시원과일이죠.복숭아병조림 만들기,복숭아병조림,https://recipe1.ezmember.co.kr/cache/recipe/2020/08/07/bcf1cdae8289ee52cac4b86932c490381.jpg,"1,240",30분 이내,초급,6인분 이상,"[('복숭아', '10개'), ('설탕', '1컵'), ('화이트와인', '1/2컵'), ('레몬즙                                                                                or 식초', '50ml')]","오랜 장마는 요즘 한창 제철인 복숭아 맛도 떨어지게 하는거 같아요.
복숭아 먹고 싶었서 사왔는데...도저히 맹탕이여서 먹을수 없을때 이럴때는
와인과 설탕을 넣어 병조림으로 만들어 시원하게 먹으면 별미중에 별비지요.","[{'step_number': 1, 'description': '요즘 황도가 많이 나오던데...\n저는 백도를 준비 했어요.\n천도복숭아를 사용하셔도 좋아요.', 'image_url': 'https://recipe1.ezmember.co.kr/cache/recipe/2020/08/07/c452a01a415e055629de1535b46edd0e1.jpg'}, {'step_number': 2, 'description': '껍질을 벗기고, 한입 크기로 썰어 준비 합니다.\n저는 시각장애인이신 엄마가 드실거라서 조금 작은듯하게 준비 했어요.', 'image_url': 'https://recipe1.ezmember.co.kr/cache/recipe/2020/08/07/e3f05c469ea9ceeb468d56093b0cb8b81.jpg'}, {'step_number': 3, 'description': '설탕은 복숭아 당도에 따라 조졸하시면 되는데\n저는 넉넉하게 한컵 준비 했어요.', 'image_url': 'https://recipe1.ezmember.co.kr/cache/recipe/2020/08/07/2d68bc21f58fe4ee692e696701a069901.jpg'}, {'step_number': 4, 'description': '레몬즙을 넣으면 좋은데 없어서\n현미식토 50ml 준비 했어요.\n식초를 넣으면 복숭아 갈변도 막아주고\n새콤해서 더 맛있더라구요.', 'image_url': 'https://recipe1.ezmember.co.kr/cache/recipe/2020/08/07/e564a0b7607bfc1b071490103e5e66341.jpg'}, {'step_number': 5, 'description': '화이트와인 반컵 준비 합니다.\n화이트와인을 오래 숙성 시켰더니 색이 변했어요 ㅎㅎ\n와인을 넣으면 복숭아병조림 보간기간이 더 길어 집니다.', 'image_url': 'https://recipe1.ezmember.co.kr/cache/recipe/2020/08/07/9997ece244e916209866c2c37943b4901.jpg'}, {'step_number': 6, 'description': '모든 재료를 넣고 센불에서 끓여 줍니다.', 'image_url': 'https://recipe1.ezmember.co.kr/cache/recipe/2020/08/07/c767bd6a32a5790fe736e0184c30bec81.jpg'}, {'step_number': 7, 'description': '복숭아에서 수분이 생각보다 많이 나와서 바닥에 눌지는 않아요.', 'image_url': 'https://recipe1.ezmember.co.kr/cache/recipe/2020/08/07/0e456af1d2c296d66de9509f2754a3ed1.jpg'}, {'step_number': 8, 'description': '끓기 시작하면 \n약불로 10~15분정도 더 조려 주시면 됩니다.', 'image_url': 'https://recipe1.ezmember.co.kr/cache/recipe/2020/08/07/da5c10451a74ebba355ad3dc4e8be35b1.jpg'}, {'step_number': 9, 'description': '냄비 바닥에 행주를 깔아주고\n물을 붓고, 유리병을 거꾸로 뒤집어 놓고 끓여 줍니다.\n팔팔 끓기 시작하면서 10분정도 더 끓여 주면 되요.\n냄비바닥에 행주를 깔지 않으면 유리병이 깨질수 있어요.\n복숭아조림은 뜨거울때 유리병에 담고, 뚜껑을 닫고,병을 뒤집어서 식혀 줍니다.', 'image_url': 'https://recipe1.ezmember.co.kr/cache/recipe/2020/08/07/cb533821d6e6d710100ff8101682d60f1.jpg'}]"
59179,디저트,간식,과일류,조림,[복숭아 병조림] 여름 과일 복숭아를 가을까지 먹는 방법,복숭아병조림,https://recipe1.ezmember.co.kr/cache/recipe/2020/08/14/7d8e573fa964dd03bd3424b1036606b81.jpg,534,120분 이내,초급,6인분 이상,"[('복숭아', '4개'), ('비정제 설탕', '0.5컵'), ('라임쥬스', '2큰술'), ('물', '1컵')]","근처 농산물 마트에서 복숭아를 샀어요. 때깔이 좋아 보이길래 덜컥 구입했는데, 이런.. 때깔만 좋고 복숭아의 향만 날뿐.. 달고 쥬이시한 맛은 온데간데없는.. 그런 복숭아더라고요. 무려 한 박스나 구입해서 2개 정도는 그냥 깎아먹고.. 나머지는 어떻게 처리해야 할까 싶어서 병조림을 만들기로 했답니다!","[{'step_number': 1, 'description': '발그스레한 핑크빛 복숭아에 홀려 구입했는데, 껍질을 까보니 복숭아 향만 머금고 있던 그 복숭아입니다 ㅠ_ㅠ\n너무 저렴하게 파는 복숭아는 의심을 해보아야 해요!', 'image_url': 'https://recipe1.ezmember.co.kr/cache/recipe/2020/08/14/f0bf2e27a5ef53ce6eb354d95e52fadb1.jpg'}, {'step_number': 2, 'description': '세척용 베이킹소다를 푼 물에 복숭아를 세척해 주세요. 껍질까지 모두 사용할 예정이므로 표면에 묻은 이물질까지 씻는 게 중요하답니다 ~', 'image_url': 'https://recipe1.ezmember.co.kr/cache/recipe/2020/08/14/e5a1ea21994bde8883a7525012d1e3c11.jpg'}, {'step_number': 3, 'description': '껍질과 과육을 따로 분리해 주세요.\n껍질은 먼저 넣고 끓여 향을 낼 거예요.\n과육은 잘 발라낸 후 라임쥬스를 넣어 갈변되는 걸 방지해 주세요', 'image_url': 'https://recipe1.ezmember.co.kr/cache/recipe/2020/08/14/1753f0b688d9f11405cedef297df898e1.jpg'}, {'step_number': 4, 'description': '복숭아 껍질과 물을 넣고 보글보글 끓여주세요. 약 5분 정도 끓은 후에 껍질은 건져내고, 바로 복숭아 과육과 설탕을 넣어주세요. \n그리고 중약불에서 10분간 끓여준 후 불을 끄고 식혀주세요.\n복숭아가 많이 무르면 5분으로 줄이고 단단하면 시간을 조금 늘려주세요', 'image_url': 'https://recipe1.ezmember.co.kr/cache/recipe/2020/08/14/380ebb7c6c31fb23d06e443db9b8fe711.jpg'}, {'step_number': 5, 'description': '끓는 물에 병을 뒤집어서 소독해 주세요.\n5분간 소독한 후, 그대로 식혀주세요.\n빨리 식힌다고 병안에 찬물 넣으면 깨진답니다.. 조심해야 해요 ㅠ_ㅠ', 'image_url': 'https://recipe1.ezmember.co.kr/cache/recipe/2020/08/14/38e7f4f7497f711454366d87b756c8d11.jpg'}, {'step_number': 6, 'description': '병에 차곡차곡 복숭아를 병입한 후 마지막에 담고 남은 쥬스를 채워줬어요.\n쥬스가 많이 남으면 다른 병에 담아 탄산에 섞어드셔도 된답니다', 'image_url': 'https://recipe1.ezmember.co.kr/cache/recipe/2020/08/14/dc554b059458ec25c9d60eec54dc4cb81.jpg'}]"
59180,디저트,간식,과일류,조림,복숭아조림:버려지는냐 먹히느냐(시원한 음식),복숭아조림,https://recipe1.ezmember.co.kr/cache/recipe/2020/09/03/e9e07be331b8126f36e84ec81a976bf11.jpg,900,15분 이내,초급,4인분,"[('복숭아', '3개'), ('물', '1.5컵'), ('유기원당', '1/2컵'), ('레몬즙', '1큰술'), ('소금', '1/2작은술')]",폭우에 단맛을 잃은 복숭아를 달게 만들어주고 그 시럽까지 시원하게 먹을 수 있는 복숭아조림레시피에요.,"[{'step_number': 1, 'description': '복숭아 껍질을 벗기고 적당한 크기로 썬다\n복숭아조림은 과육이 단단한게 좋은데 전 그냥 물렁한 맛없는 복숭아로 만들었어요.', 'image_url': 'https://recipe1.ezmember.co.kr/cache/recipe/2020/09/03/963c39d7981faa816f93c145187079411.jpg'}, {'step_number': 2, 'description': '물과 설탕을 넣어 젓지않고 설탕이 녹을 때까지 끓여 시럽을 만든다.\n보통 시럽의 1:1보다는 설탕양을 대폭 줄여서 물과 설탕 비율을 3:1정도로 해주었어요.\n색상을 예쁘게 하려면 백설탕을 사용하세요.', 'image_url': 'https://recipe1.ezmember.co.kr/cache/recipe/2020/09/03/3d9dfdcc16d3de5a747351d7ff321cc61.jpg'}, {'step_number': 3, 'description': '시럽이 만들어지면 복숭아를 넣어 끓인다.\n중간중간 거품을 걷어내주세요', 'image_url': 'https://recipe1.ezmember.co.kr/cache/recipe/2020/09/03/e51a0d7d961921fef1f7db21c8add9d91.jpg'}, {'step_number': 4, 'description': '시럽이 자작하게 졸아들 때까지 조린다', 'image_url': 'https://recipe1.ezmember.co.kr/cache/recipe/2020/09/03/17316bee59d6a1968ca420143476af551.jpg'}, {'step_number': 5, 'description': '소독한 병에 담고 냉장보관 한다.\n대량생산할 경우엔 복숭아를 소독한 병에 담아 꼭 닫은 후 병째 물에 넣어 끓이면 진공상태가 되어 오래 보관할 수 있어요.', 'image_url': 'https://recipe1.ezmember.co.kr/cache/recipe/2020/09/03/f57753f20bb0e1c3afcd51d5ead3b4f51.jpg'}, {'step_number': 6, 'description': '그릇에 담고 얼음을 넣어 서빙한다', 'image_url': 'https://recipe1.ezmember.co.kr/cache/recipe/2020/09/03/85b8b8c21079ea49ce75cc1f35ce40711.jpg'}]"
