index,종류별,상황별,재료별,방법별,글 제목,레시피이름,레시피이미지,조회수,조리시간,난이도,인분,재료,소개글,조리순서
48003,국/탕,일상,건어물류,끓이기,콩나물북어국 황금레시피,콩나물북어국,https://recipe1.ezmember.co.kr/cache/recipe/2016/02/15/b8c3f5d8b6c138852d75a15a24cc365a1.jpg,"133,195",15분 이내,초급,4인분,"[('콩나물', ''), ('북어', ''), ('계란', ''), ('디포리육수', ''), ('대파', ''), ('간장', ''), ('새우젓', ''), ('맛술', ''), ('참기름', '')]",국이 없으면 밥이 안 넘어간다는 아들 땜에 국은 항상 끓이고 있답니다. 오늘은 집밥 백선생 콩나물북어국으로 끓여봤는데 좀 더 쉽고 맛있게 되더라고요. 어린아이들 국으로도 좋아요. 콩나물북어국 끓이기도 아주 쉽답니다. 콩나물북어국 황금레시피 알려드릴게요.,"[{'step_number': 1, 'description': '콩나물북어국 기본 재료들이랍니다. 여기에 두부도 추가로 넣어줘도 좋아요! 평소에는 북어 먼저 참기름에 볶아서 끓였었는데요. 집밥 백선생 콩나물북어국 끓이는법 보니까 북어를 물에 살짝 불려서 좀 더 쉽게 끓이시더라고요.', 'image_url': 'https://recipe1.ezmember.co.kr/cache/recipe/2016/02/26/1506660dc57a4de7c17f77b22ee4b9441.jpg'}, {'step_number': 2, 'description': '북어는 물에 5분 정도 불려두세요. 오래 불릴 필요 없어요. 북어는 물기 짠 뒤 담아뒀던 물 버리지 말고 육수로 사용해보세요.', 'image_url': 'https://recipe1.ezmember.co.kr/cache/recipe/2016/02/26/f4c300838d904462886c14931d4b00921.jpg'}, {'step_number': 3, 'description': '대파와 계란도 풀어서 준비했고요.', 'image_url': 'https://recipe1.ezmember.co.kr/cache/recipe/2016/02/26/0d4d35fad4660dc0762c58d761c735281.jpg'}, {'step_number': 4, 'description': '먼저 불린 북어에 들기름 넣고 달달달 볶아줬어요. (참기름,들기름 모두 사용 가능해요)', 'image_url': 'https://recipe1.ezmember.co.kr/cache/recipe/2016/02/26/7d1a16ee61b340b505985f9881c64c5e1.jpg'}, {'step_number': 5, 'description': '평소에 마른 북어로 볶아서 살짝 타기도 하고 마른 북어라 볶기 어려웠었는데 이렇게 쉬운 방법이 있었네요.', 'image_url': 'https://recipe1.ezmember.co.kr/cache/recipe/2016/02/26/c53f465f20c68f757c1e8361dd46a0481.jpg'}, {'step_number': 6, 'description': '디포리 육수인데 진하죠. 디포리와 다시멸치, 다시마 넉넉히 넣고 끓여서 국물이 진하게 나오더라고요. 음식 할 때 육수로 넣어주면 조미료가 필요 없답니다.', 'image_url': 'https://recipe1.ezmember.co.kr/cache/recipe/2016/02/26/61dbfc95391a7412d802ee7062d2aac01.jpg'}, {'step_number': 7, 'description': '북어 볶아준 뒤 디포리 육수 넣어줬어요. 저는 디포리육수 사용했는데요. 아까 북어 불려둔 물 넣거나 그냥 맹물, 혹은 멸치육수 넣어주셔도 돼요.', 'image_url': 'https://recipe1.ezmember.co.kr/cache/recipe/2016/02/26/f8a6e4eafbfdd29d7cd8f5040d9c55331.jpg'}, {'step_number': 8, 'description': '뚜껑 닫고 끓여주세요.', 'image_url': 'https://recipe1.ezmember.co.kr/cache/recipe/2016/02/26/c734742e2ad14e96ea75b985f45a1b321.jpg'}, {'step_number': 9, 'description': '국이 끓어오르면 콩나물 넣어주세요.', 'image_url': 'https://recipe1.ezmember.co.kr/cache/recipe/2016/02/26/4616347de47a6a7996726cc7b14e5fd31.jpg'}, {'step_number': 10, 'description': '콩나물 넣고는 오래 끓일 필요 없으니까 그전에 푹 끓여주는 게 좋겠죠.', 'image_url': 'https://recipe1.ezmember.co.kr/cache/recipe/2016/02/26/bc133c36e96c19fcf8e4031c143d12531.jpg'}, {'step_number': 11, 'description': '마지막으로 계란물 넣어주는데 젓지 마세요. 저어주면 국물이 탁해지더라고요.', 'image_url': 'https://recipe1.ezmember.co.kr/cache/recipe/2016/02/26/c866de527028b94ecc9d5f3e517f6da91.jpg'}, {'step_number': 12, 'description': '간은 새우젓 한수저와 진간장 한수저 넣어줬어요.(국간장 넣으라는데 없어서 진간장 넣어줬어요) 평소에는 소금간만 해서 간해주는데 확실히 새우젓으로 간을 하니 맛있네요.', 'image_url': 'https://recipe1.ezmember.co.kr/cache/recipe/2016/02/26/35d3cdeedc311101fb6111186c326fa21.jpg'}, {'step_number': 13, 'description': '대파 넣어서 센 불에서 한번 더 끓여주면 콩나물북어국 완성이네요.', 'image_url': 'https://recipe1.ezmember.co.kr/cache/recipe/2016/02/26/62dbcb28aecfe7cefaafeabd13f17fb71.jpg'}, {'step_number': 14, 'description': '두부 있으면 깍둑썰기해서 넣어줘도 좋아요.', 'image_url': 'https://recipe1.ezmember.co.kr/cache/recipe/2016/02/26/a6a2e851dc4e38a98be1664c366ec6791.jpg'}, {'step_number': 15, 'description': '국물이 진하니 맛있는 콩나물북어국 완성. 디포리육수 넣어줬더니 확실히 진한 게 맛있네요. 집밥 백선생 레시피대로 북어를 살짝 물에 불렸다가 볶아주니 북어국 끓이기도 훨씬 쉬웠고요. 새우젓으로 간을 해서 시원하면서도 맛있었어요.', 'image_url': 'https://recipe1.ezmember.co.kr/cache/recipe/2016/02/26/c57e44a2fa4ff5b3db4d91931769645e1.jpg'}]"
48004,국/탕,일상,건어물류,끓이기,미역국,미역국,https://recipe1.ezmember.co.kr/cache/recipe/2020/03/29/3a89ff5433bb8a23eddaa84d29da3bc51.jpg,"13,341",30분 이내,아무나,6인분 이상,"[('소고기', '300g'), ('건미역', ''), ('간장', ''), ('천일염', ''), ('참기름', '')]",미역국은 주재료인 미역이 맛있어야 끓여 놓아도 맛있습니다 무인도에서 캐서 해풍에 말린 미역 자연산 미역이라 미역국을 끓이면 아주 부드럽고 맛과 향이 좋습니다,"[{'step_number': 1, 'description': '자연산 미역이라 다소 거칠어 보입니다', 'image_url': 'https://recipe1.ezmember.co.kr/cache/recipe/2020/03/29/65e4a32175bd0dcc43e94d67daefa8931.jpg'}, {'step_number': 2, 'description': '자연산미역은 씻는 방법이 중요한데 오래 담궈놓으면 맛이 없기에 물에 살짝 담궈 바락바락 거품이 날때까지 주물러 여러번 행궈 줍니다 찬물에 담궈 두면 퍼져서 맛이 덜해요', 'image_url': 'https://recipe1.ezmember.co.kr/cache/recipe/2020/03/29/7a2125a6b896b22934ff321be7c0a8181.jpg'}, {'step_number': 3, 'description': '바락바락 주물러 소쿠리에 건져 둔 상태', 'image_url': 'https://recipe1.ezmember.co.kr/cache/recipe/2020/03/29/8ff210eb07801952cdfb328100aa60241.jpg'}, {'step_number': 4, 'description': '소고기는 국거리로 준비해 달군 냄비에 참기름 두루고 어느정도 볶다가 간장으로 밑간을 합니다 (탈수가 있어서 물을 조금 넣고 간을 했어요)', 'image_url': 'https://recipe1.ezmember.co.kr/cache/recipe/2020/03/29/472d38adfeaf6585a19b8aee48eebdf21.jpg'}, {'step_number': 5, 'description': '물을 붓고 끓이다가 소고기가 익었을때', 'image_url': 'https://recipe1.ezmember.co.kr/cache/recipe/2020/03/29/b2bebd5c98998bb8075c669ab7f3b7c61.jpg'}, {'step_number': 6, 'description': '씻어 건저논 미역을 넣고 끓입니다', 'image_url': 'https://recipe1.ezmember.co.kr/cache/recipe/2020/03/29/310027ad5685aca4d83ab127c05fd7351.jpg'}, {'step_number': 7, 'description': '간을 보고 모자란 간은 천일염으로 ~멸치원액이나 멸간장으로 간을 하면 더 맛있답니다', 'image_url': 'https://recipe1.ezmember.co.kr/cache/recipe/2020/03/29/4dedcd35a99057296dc82b8a985971d61.jpg'}, {'step_number': 8, 'description': '자연산 미역은 자연의 조건과 오묘한 조화가 있는 자연산 미역국 입니다', 'image_url': 'https://recipe1.ezmember.co.kr/cache/recipe/2020/03/29/56aea167413772f32731a8e1bc39a9b01.jpg'}]"
48005,국/탕,일상,건어물류,끓이기,소고기 미역국 끓이기 산모 미역국 끓이기 레시피,소고기미역국,https://recipe1.ezmember.co.kr/cache/recipe/2017/09/05/bca925a612a0e86d65b98dcdce64c9161.jpg,"24,717",30분 이내,아무나,6인분 이상,"[('산모용미역', '1/3장'), ('소고기', '600g'), ('마늘', '1T'), ('들기름', '3T'), ('국간장', '3T'), ('소금', '약간')]",우리집 며느리가 출산을 했어요 산후조리를 위해 맛있는 미역국 끓였어요. 빠른 회복을 기다리며~~~,"[{'step_number': 1, 'description': '산모용 미역을 찬물에 10분정도 담가요미역을 따뜻한 물에 담그면 미역이 풀어지니까 찬물에 담궈요', 'image_url': 'https://recipe1.ezmember.co.kr/cache/recipe/2017/09/05/8bc5d9950bb698cd536c54853531dbb51.jpg'}, {'step_number': 2, 'description': '미역을 박박 문질러 깨끗이 씻어 5cm길이로 썰어주고', 'image_url': 'https://recipe1.ezmember.co.kr/cache/recipe/2017/09/05/3de284bfa1b3e37cbbb6748ce94a292e1.jpg'}, {'step_number': 3, 'description': '큰솥에 소고기와 마늘 그리고 들기름을 넣고 볶다가', 'image_url': 'https://recipe1.ezmember.co.kr/cache/recipe/2017/09/05/c8e01789cca22d88c3588f4aa3bde44f1.jpg'}, {'step_number': 4, 'description': '고기가 어느정도 익었을때 준비해둔 미역을 넣고 센불에 끓이다가 끓기 시작하면 약불로 15정도 더 끓인다.\n이때 국간장을 넣고 싱거우면 기호에 따라 소금으로 간을 맞춘다', 'image_url': 'https://recipe1.ezmember.co.kr/cache/recipe/2017/09/05/bb88119a46d4cd6e62a5aa8a936656921.jpg'}, {'step_number': 5, 'description': '미역국을 끓일때 들기름을 넣고 끓이면 더 감칠맛이 있다', 'image_url': 'https://recipe1.ezmember.co.kr/cache/recipe/2017/09/05/61e8c3b3de71803768b0e2ec6195ff1b1.jpg'}]"
48006,국/탕,일상,건어물류,끓이기,조개살 된장미역국,조개살된장미역국,https://recipe1.ezmember.co.kr/cache/recipe/2015/07/28/e7aec15e822fa23033776d95c3150824.jpg,"14,124",30분 이내,초급,2인분,"[('조갯살', ''), ('미역', ''), ('된장', ''), ('소금', '')]",적당한 국거리가 없으면 단골로 끓여먹게 되는 된장국과 미역국~ 오늘은 둘다 합쳐서 조갯살 넣고 보글보글 끓여보았어요~,"[{'step_number': 1, 'description': '냉동실에 보관했던 조갯살과 미역을 꺼냈네요~물이 끓으면 해동된 미역을 넣어주세요.', 'image_url': 'https://recipe1.ezmember.co.kr/cache/recipe/2015/07/28/8de21877c69c350604b6f84e416b87b91.jpg'}, {'step_number': 2, 'description': '조갯살도 넣어주시구요. 조갯살 없으면 새우나 쇠고기 굴등~ 있는 재료 넣어주시면 되네요~', 'image_url': 'https://recipe1.ezmember.co.kr/cache/recipe/2015/07/28/152abc2aafa4493fd1418dcbaacfd2bb1.jpg'}, {'step_number': 3, 'description': '된장도 풀어주세요. 된장 안넣으실 분들은 소금으로 간맞추시면 되구요. 보글보글 끓여주시기만 하면 끝~', 'image_url': 'https://recipe1.ezmember.co.kr/cache/recipe/2015/07/28/5cb9f94622bc3c3ed13f3aade346599b1.jpg'}]"
48007,국/탕,일상,건어물류,끓이기,황태 미역국 만드는 방법,황태미역국,https://recipe1.ezmember.co.kr/cache/recipe/2015/08/10/3da6c4f525a3538dc28bb7125ec23f321.jpg,"83,731",None,None,None,"[('미역', ''), ('황태', ''), ('집간장', ''), ('들기름', '')]","강원도하면 또 황태를 빼놓을수 없자나요~ 깊은맛의 황태미역국, 숙취해소에도 좋고 이렇게 흐린 날씨에도 먹기좋은거같아요.","[{'step_number': 1, 'description': '미역은 먼저 물에 불려주세요. 마트에가니 요즘은 씻어나온 미역이 있더라구요. 씻어나온미역은 물에 불리지 않고 바로 국을 끓이셔야 영양소도 많이 안빠지고 맛있게 끓일수 있어요.', 'image_url': 'https://recipe1.ezmember.co.kr/cache/recipe/2015/04/29/0be2093a1c776fd8ca85527e2196375b1.jpg'}, {'step_number': 2, 'description': '저는 산모용 미역을 사용했어요. 산모용 미역은 물에 불려서 박박 문질러 한두번정도 씻어줍니다. 미역을 채취해 드대로 말린거라 먼지나 이물질이 있을수 있으니 세척을 해주시는게 좋아요~! 요즘 나오는 깔끔한 미역보다 손이 조금 가지만 영양소나 맛 면에서는 더 좋겠죠.', 'image_url': 'https://recipe1.ezmember.co.kr/cache/recipe/2015/04/29/9fa6005765bc5a39db2ec696f54c91f31.jpg'}, {'step_number': 3, 'description': '미역이 다 불었으면 잘게 잘라줍니다.', 'image_url': 'https://recipe1.ezmember.co.kr/cache/recipe/2015/04/29/b85893024b0ae6d899fa3739bcdd081b1.jpg'}, {'step_number': 4, 'description': '황태채도 손질해줄께요. 미역불리는 시간에 했어요. 황태는 고단백, 저지방 식품으로 콜레스테롤이 거의 없고 영양가가 높아 신진대사를 활성화시켜줘요. 특히 간을 보호해주는 메타오닌 등 아미노산이 풍부해 과음 후 숙취 해소에 탁월한 효과가 있다고 해요!', 'image_url': 'https://recipe1.ezmember.co.kr/cache/recipe/2015/04/29/df5c8ad682b4c159dc16fb27b872a1a01.jpg'}, {'step_number': 5, 'description': '북어는 가위로 2~3cm정도의 길이로 잘라줬어요.', 'image_url': 'https://recipe1.ezmember.co.kr/cache/recipe/2015/04/29/a7c04aae3d47f52b5d6d16c16df873c81.jpg'}, {'step_number': 6, 'description': '자른 황태에 물을 부어 황태가 촉촉해지게 해주세요. 저는 그릇의 밑바닥에 물이 살짝 남을정도로만 부어줬어요~ 황태가 스펀지처럼 물을 흡수해서 굳이 물을 많이 넣고 불릴필요가 없어요. 물을 많이 넣고 불리셨다면 불린물을 버리지말고 국끓일때 사용해주세요. 요즘은 황태를 깨끗하게 말리기때문에 굳이 씻지 않으셔도 됩니다. 씻는다고 불려서 물을 버리고 헹구시면 맛있는 맛성분이 다 빠져버려요~ 그래도 한번은 씻어주고 싶다면 물을 조금만 넣고 빠르게 주물러서 헹궈주세요.', 'image_url': 'https://recipe1.ezmember.co.kr/cache/recipe/2015/04/29/c5222f7161af6f82f48158eda4aec4ad1.jpg'}, {'step_number': 7, 'description': '냄비에 들기름을 둘러줍니다. 들기름두른 냄비에 달달 볶아주세요. 센불에서 하면 탈수있으니 약불에서 천천히~', 'image_url': 'https://recipe1.ezmember.co.kr/cache/recipe/2015/04/29/828600b5626ff13a25f066cd63674d6a1.jpg'}, {'step_number': 8, 'description': '미역넣고 다시한번 달달볶아준 후~ 미역이 푹잠길정도로 물을 넣고 끓여줍니다.', 'image_url': 'https://recipe1.ezmember.co.kr/cache/recipe/2015/04/29/59ca8918d6abd2949f33d8fc7665904e1.jpg'}, {'step_number': 9, 'description': '중불에서 천천히 오래끓이기만 하면되죠~ 다진마늘 한큰술넣어줬어요.', 'image_url': 'https://recipe1.ezmember.co.kr/cache/recipe/2015/04/29/a9f7bba4d2d251fd42e553ba66e41b8e1.jpg'}, {'step_number': 10, 'description': '40분정도 뭉근하게 끓여주니 완성~ 미역의 색도 진녹색으로 국물도 진하게 잘 우러나왔어요!', 'image_url': 'https://recipe1.ezmember.co.kr/cache/recipe/2015/04/29/5f6d28dd00d004c5e54ea5c2abce60371.jpg'}]"
48008,국/탕,일상,건어물류,끓이기,물김국 끓이기,김국,https://recipe1.ezmember.co.kr/cache/recipe/2015/11/18/e69dc231d743f08170ec560779c1743b1.jpg,"33,805",30분 이내,초급,4인분,"[('물김', ''), ('생굴', ''), ('국간장', ''), ('마늘', '')]","바다향이 물씬 풍기는 담백한 굴물김국입니다.
생굴이 들어가 아주 구수하고 맛나답니다.
생물김국은 아주 보들보들해서 목넘김이 아주 좋습니다.
뜻뜻환 물김국에 밥넣고 말아 먹으면 굿굿~ 최고이지요~ ​","[{'step_number': 1, 'description': '요게 생물김입니다.\n물김은 물과 만나면 2~3배나 불어나지요~\n그러니 큰그릇에다 넣고 씻어 주어야합니다.^^', 'image_url': 'https://recipe1.ezmember.co.kr/cache/recipe/2015/11/18/bb5d829a8df247d304917f0f723db6a91.jpg'}, {'step_number': 2, 'description': '다 씻은 물김은 가위로 한 3등분으로 잘라 줍니다.', 'image_url': 'https://recipe1.ezmember.co.kr/cache/recipe/2015/11/18/3c5031fbcc5680ad9718ef03a40f03ce1.jpg'}, {'step_number': 3, 'description': '냄비에 물김 넣고 굴, 다진 마늘, 물을 넣고 끓여줍니다.\n물은 한컵만!!', 'image_url': 'https://recipe1.ezmember.co.kr/cache/recipe/2015/11/18/2f898cc8c458923cb31eeec6100c0a661.jpg'}, {'step_number': 4, 'description': '물김은 아무리 물기를 뺀다고 해도 물을 많이 안고 있습니다.\n그러니 물한컵부터~\n끓이다보면 물이 엄청 생깁니다.', 'image_url': 'https://recipe1.ezmember.co.kr/cache/recipe/2015/11/18/51f01ccdf140a911717f2bf83c6c52661.jpg'}, {'step_number': 5, 'description': '물김색이 변할때까지 팔팔 끓여줍니다.', 'image_url': 'https://recipe1.ezmember.co.kr/cache/recipe/2015/11/18/962c6f874340d3a4fa760757448837aa1.jpg'}, {'step_number': 6, 'description': '중간중간 거품이나 불순물을 좀 제거해주셔도~', 'image_url': 'https://recipe1.ezmember.co.kr/cache/recipe/2015/11/18/5dc87921cddd0f00c69f89b70afd60d11.jpg'}, {'step_number': 7, 'description': '간은 국간장으로~', 'image_url': 'https://recipe1.ezmember.co.kr/cache/recipe/2015/11/18/9b3b2faca96f56360821b53ea517992f1.jpg'}]"
48009,국/탕,일상,건어물류,끓이기,오래끓여 진국인 소고기사태미역국,소고기사태미역국,https://recipe1.ezmember.co.kr/cache/recipe/2018/04/12/374a798d5b0b36054efde63b3cce1e291.jpg,"7,920",2시간 이상,아무나,6인분 이상,"[('미역', '5줌'), ('소고기사태', '400g'), ('쌀뜨물', '2.5L'), ('참기름', '2T'), ('소고기다시다                                                                                취향껏', '2T'), ('국간장', '6T'), ('마늘', '1T'), ('소금', '기호에맞게')]","저희집은 국중에서도 유난히 미역국을
젤 좋아해요
얘들이 어릴땐 한달에 한번정도는 
끓여줄만큼 좋아했죠
하지만 크면서 생일때 빼곤 안끓여
주게 되더라고요 

몇일전 뜸끔없이 아들이 미역국이 먹고 
싶다해서 잽싸게 끓였어요
아들이 드시고 싶다하시니 언능 해드려야죠ㅋ 

미역국은 누구나 쉽게 끓일수 있는
거지만 깊은맛을 내는건 흔치 않더라고요
특히 나가서 먹는 미역국은 물에 미역
넣고 후루룩 끓인맛^^;;
그건 생미역을 끓는물에 데친맛이라 
전 안먹게 되더라고요 

물론 갠적입맛 차이지만요
그래도 제가 여태 끓여본 미역국은 곰국 끓이듯 푹 끓여야 진국인 미역국이 되서 진짜 맛있는듯
해요
이번에도 너무 맛있어 하루 세끼를
다 먹었다는건 안비밀이죠ㅋㅋ 

간단하지만 쉽게 만드는 미역국이 아닌
진한 국물맛에 미역국
맛있게 끓여보세요 

오늘도 맛있는 주말되세요^^","[{'step_number': 1, 'description': '미역을 물에 불립니다', 'image_url': None}, {'step_number': 2, 'description': '고기와 미역을 볶은후 푹 끓입니다', 'image_url': None}, {'step_number': 3, 'description': '양념을 합니다', 'image_url': None}]"
48010,국/탕,일상,건어물류,끓이기,들깨미역국 만드는 법★ 들깨미역국 맛있게 끓이기~,들깨미역국,https://recipe1.ezmember.co.kr/cache/recipe/2015/10/06/dee7e7f79d9ace3b6a55257bec42e7af1.jpg,"146,248",30분 이내,초급,4인분,"[('미역', '300g'), ('들깨가루', '5~6T'), ('멸치다시육수', ''), ('들기름', '2T'), ('국간장', '2T'), ('소금', '약간'), ('다진마늘', '0.5T')]","소고기 미역국보다 황태나 북어 미역국을 더 좋아하는데요~
들깨가루 넣은 미역국을 한번 먹어보곤 너무 고소해서 한번 끓여봤어요~
아이도 좋아하는 들깨미역국이랍니다!","[{'step_number': 1, 'description': '미역을 물에 불려주시고~ 바락바락 문질러주세요!', 'image_url': 'https://recipe1.ezmember.co.kr/cache/recipe/2015/10/06/b57b3c8bb7a9aa07bb01ecaa1fe6c41e1.jpg'}, {'step_number': 2, 'description': '들기름 2번 두르고(취향껏)~', 'image_url': 'https://recipe1.ezmember.co.kr/cache/recipe/2015/10/06/9ff1b13620e52ee47c680c804f78578a1.jpg'}, {'step_number': 3, 'description': '마늘 반 스푼 넣고', 'image_url': 'https://recipe1.ezmember.co.kr/cache/recipe/2015/10/06/e8d3d3135485fc30c4991c235ad913991.jpg'}, {'step_number': 4, 'description': '달달 볶아주세요~', 'image_url': 'https://recipe1.ezmember.co.kr/cache/recipe/2015/10/06/25e4753c72d6cf03512c07a302852ff51.jpg'}, {'step_number': 5, 'description': '미역이 살짝 투명해지면 멸치다시육수를 붓고 끓여줍니다.', 'image_url': 'https://recipe1.ezmember.co.kr/cache/recipe/2015/10/06/6f22e42eb3bd27fc2fe6b07e1a87ad8c1.jpg'}, {'step_number': 6, 'description': '국간장 2스푼 넣고~', 'image_url': 'https://recipe1.ezmember.co.kr/cache/recipe/2015/10/06/3c8728bc97308ecf42bbcd9d4c9319421.jpg'}, {'step_number': 7, 'description': '(탈피) 들깨가루 5~6스푼 넣어줬답니다. ㅋㅋ\n이 정도는 넣어줘야 구수하더라고요.\n취향껏 넣으심 돼요. ㅎㅎㅎ 맛을 보고 가감하세요!', 'image_url': 'https://recipe1.ezmember.co.kr/cache/recipe/2015/10/06/5bc3209974dc1c5e36994640b6667c281.jpg'}, {'step_number': 8, 'description': '보글보글~\n2~30분 정도 푹 끓여주세요.\n미역국은 저녁에 끓여놓고 다음날 먹으면 더 맛나요. ㅎㅎ', 'image_url': 'https://recipe1.ezmember.co.kr/cache/recipe/2015/10/06/561770435f9acf0aed1fbf2fd6da525b1.jpg'}]"
48011,국/탕,일상,건어물류,끓이기,북엇국끓이기 - 백종원 북엇국,북어국,https://recipe1.ezmember.co.kr/cache/recipe/2017/02/28/5f382565d35a54c8c8c2af00724e6f011.jpg,"30,948",30분 이내,아무나,3인분,"[('북어', '2줌'), ('쌀뜨물', '4'), ('참기름', ''), ('새우젓', '1'), ('간마늘', '1'), ('국간장', '2'), ('파', ''), ('달걀', '1'), ('고추', '1')]",백종원레시피따라하기,"[{'step_number': 1, 'description': '그릇에 북어를 담고 물을 부어주세요.\n물에 불리는 것이 아니라 적신 뒤 바로 물기를 짜주세요.\n물은 버리지 마세요.', 'image_url': 'https://recipe1.ezmember.co.kr/cache/recipe/2017/02/28/c572fa06a0428b06ad588e97866aa3221.jpg'}, {'step_number': 2, 'description': '팬에 참기름을 두르고 북어를 볶아주세요.', 'image_url': 'https://recipe1.ezmember.co.kr/cache/recipe/2017/02/28/c4af5192c7d16ab4c61667b26867be691.jpg'}, {'step_number': 3, 'description': '냄비에 북어 헹군 물1 그리고 쌀뜨물4를 넣어주세요.', 'image_url': 'https://recipe1.ezmember.co.kr/cache/recipe/2017/02/28/991f2e8a651bc17c66351acba15dc9ef1.jpg'}, {'step_number': 4, 'description': '새우젓1', 'image_url': 'https://recipe1.ezmember.co.kr/cache/recipe/2017/02/28/9e1f06f0e3629bb87a5ddc51be6180201.jpg'}, {'step_number': 5, 'description': '국간장2', 'image_url': 'https://recipe1.ezmember.co.kr/cache/recipe/2017/02/28/1e1333fd135ce15d0e8a13325672711f1.jpg'}, {'step_number': 6, 'description': '다진마늘1을 넣고 보글 보글 끓여줍니다.', 'image_url': 'https://recipe1.ezmember.co.kr/cache/recipe/2017/02/28/be51666049dd1ff31ce1cdbaa329d4021.jpg'}, {'step_number': 7, 'description': '달걀1개를 풀어 넣어주세요.\n이때 간을 보시고 싱거우면 새우젓을 더 넣어주세요.\n아님 소금간도 괜찮아요.', 'image_url': 'https://recipe1.ezmember.co.kr/cache/recipe/2017/02/28/40de32d4f73b104e67cbd92be38bdb0f1.jpg'}, {'step_number': 8, 'description': '조금 더 끓이다', 'image_url': 'https://recipe1.ezmember.co.kr/cache/recipe/2017/02/28/cf7abe97936ae2e30bb317175e85026c1.jpg'}, {'step_number': 9, 'description': '대파,고추를 넣고 한소끔 끓여 마무리 합니다', 'image_url': 'https://recipe1.ezmember.co.kr/cache/recipe/2017/02/28/ec5aaf155149066aec3c83493e426f8c1.jpg'}, {'step_number': 10, 'description': '백종원북엇국완성 ^^', 'image_url': 'https://recipe1.ezmember.co.kr/cache/recipe/2017/02/28/b476ed73b508d00f7cc7e5ddcd62bfc91.jpg'}]"
