index,종류별,상황별,재료별,방법별,글 제목,레시피이름,레시피이미지,조회수,조리시간,난이도,인분,재료,소개글,조리순서
155807,양식,손님접대,돼지고기,볶음,돼지고기 찹스테이크,돼지고기찹스테이크,https://recipe1.ezmember.co.kr/cache/recipe/2015/05/10/388e09a2871567a1b629193768461a081.jpg,"12,461",30분 이내,초급,3인분,"[('돼지고기안심', '300~400g'), ('양파', '1/2개'), ('옥수수통조림', '3큰술'), ('떡볶이떡', '10개'), ('당근', '1/3개'), ('케찹', '3큰술'), ('스테이크소스', '3큰술'), ('설탕', '1/2큰술'), ('물', '1/2컵')]",모두의 입맛을 충족시키면서 맛있게 먹을수있는 ' 찹 스테이크 ',"[{'step_number': 1, 'description': '기름을 두른 후라이팬에 중불로 작게썬 당근을 볶아줍니다. \n당근은 중간정도 익었다 싶을 정도로만 볶아주시면 됩니다\n썬 양파를 넣어서 같이 1분정도만 섞어주듯 볶아줍니다.', 'image_url': 'https://recipe1.ezmember.co.kr/cache/recipe/2015/05/11/c749468aef2e7b5555e016c8d7b399161.jpg'}, {'step_number': 2, 'description': '잘 재워뒀던 고기를 가운데에 넣고 채소들은 둥그렇게 사이드로 빼준후 익힙니다.\n고기를 막 뒤적이면 고기가 지저분해지기 때문에 굽는다고 생각하시고 그냥 두시면 되세요.', 'image_url': 'https://recipe1.ezmember.co.kr/cache/recipe/2015/05/11/5d414ceef645fa7c558e46b3c75334031.jpg'}, {'step_number': 3, 'description': '한쪽면이 잘 구워지면 뒤집어서 가만히 둬서 또 굽고 양쪽면이 단단하게 구워지면 그때 불을 조금 줄여서 뒤적뒤적 해 주세요. \n그리고는 준비해뒀던 양념장을 넣어서 약불에서 잘 저어주면서 섞어준후 불에서 내려주시면 끝! (전 이 과정에서 떡볶이떡과 옥수수통조림을 넣었습니다)', 'image_url': 'https://recipe1.ezmember.co.kr/cache/recipe/2015/05/11/7bff7eab33ffa2aa2e64a4cc0d1f4d3a1.jpg'}, {'step_number': 4, 'description': ""윤기가 반지르르 하면서 숨이죽지않은 채소들과 떡이 아삭아삭 아주 맛있는 '찹스테이크' 가 완성되었어요."", 'image_url': 'https://recipe1.ezmember.co.kr/cache/recipe/2015/05/11/ae91da381241ea2a337a3cdfceef6fce1.jpg'}]"
155808,양식,손님접대,돼지고기,볶음,"짜투리 채소를 이용한 간단한 저녁반찬, 찹스테이크 만들기 (파프리카요리/돼지고기 요리)",파프리카찹스테이크,https://recipe1.ezmember.co.kr/cache/recipe/2016/09/03/5003dd0b0a34f2d6430cfc0dcc10d11d1.jpg,"14,986",15분 이내,아무나,3인분,"[('돼지고기목살', ''), ('피망', ''), ('파프리카', ''), ('양파', ''), ('버터', ''), ('다진마늘', ''), ('굴소스', ''), ('청양고추', ''), ('설탕', ''), ('후추', '')]",요리를 하고 남은 짜투리 채소. 자꾸 쌓여만 가기에 안되겠다 싶어서 오늘은 짜투리채소를 이용한 저녁반찬을 만들었다. 일명 짜투리찹스테이크!,"[{'step_number': 1, 'description': '남은 채소들(피망, 파프리카, 양파)를 먹기좋은 크기로 썬다.', 'image_url': 'https://recipe1.ezmember.co.kr/cache/recipe/2016/09/05/0612281674e52ef20d7a94c81d748f111.jpg'}, {'step_number': 2, 'description': '간장, 굴소스, 청량고추, 설탕을 섞어 양념을 만든다.', 'image_url': 'https://recipe1.ezmember.co.kr/cache/recipe/2016/09/05/51b239114af496e646f4d83abfbfa9a41.jpg'}, {'step_number': 3, 'description': '버터를 두른 팬에 채소들을 넣고 볶는다.', 'image_url': 'https://recipe1.ezmember.co.kr/cache/recipe/2016/09/05/108bf6ae40c8c1d65e2e21f6acf9d3a11.jpg'}, {'step_number': 4, 'description': '채소에 후추로 밑간을 한 돼지고기 목살과 만들어둔 양념장을 넣어서 볶아주면, 짜투리 찹스테이크 완성이다.', 'image_url': 'https://recipe1.ezmember.co.kr/cache/recipe/2016/09/05/98676e3d9604a00c2f5325fa7ee0ad4f1.jpg'}]"
155809,양식,손님접대,돼지고기,볶음,폭찹 스테이크 :: 부드럽고 달콤한 PORK CHOP STEAK 돼지고기 찹스테이크 만들기,폭찹스테이크,https://recipe1.ezmember.co.kr/cache/recipe/2016/02/29/14fe6f59ab438288b331883d525244251.jpg,"35,391",90분 이내,중급,6인분 이상,"[('돼지고기 목 등심', '1800g'), ('배', '1개'), ('진간장', '18큰술'), ('백설탕', '3큰술'), ('올리고당', '6큰술'), ('참기름', '1큰술'), ('통깨', '1큰술'), ('대파', '1대'), ('후추', '1/2큰술'), ('생강', '1/2개'), ('다진 마늘', '3큰술')]",담백하고 부드러운 돼지고기 등심으로 돼지고기 찹스테이크 만들어 볼게요. 달콤하고 부드러운 PORK CHOP STEAK 폭찹스테이크는 특히 아이들이 좋아하는 메뉴예요. 특별한 날 레드 와인을 필요로 하는 맛난 요리 시작해 봐요.,"[{'step_number': 1, 'description': '돼지고기는 조리 후 크기가 많이 줄어들어요. 목 등심은 길이 2cmx2cmx3.5cm 크기로 썰어주세요.', 'image_url': 'https://recipe1.ezmember.co.kr/cache/recipe/2016/02/29/c507971df52292d41ea3301afd45169a1.jpg'}, {'step_number': 2, 'description': '돼지고기 양념에 넣어 줄 배는 강판에 갈고 마늘, 생강은 곱게 다져주세요.', 'image_url': 'https://recipe1.ezmember.co.kr/cache/recipe/2016/02/29/5d6cc3e3d95d6430288d264480f530191.jpg'}, {'step_number': 3, 'description': '배에는 연육 효소가 있어 돼지고기 육질을 부드럽게 하는 작용을 해요.', 'image_url': 'https://recipe1.ezmember.co.kr/cache/recipe/2016/02/29/72e9c1b4c0ccd9bfed93ca91b22dabf61.jpg'}, {'step_number': 4, 'description': '대파 1/2대를 제외한 모든 양념 재료 진간장, 백설탕, 올리고당, 참기름, 배, 생강, 통깨, 후추, 마늘, 대파를 믹싱 볼에 넣고 잘 섞어주세요.', 'image_url': 'https://recipe1.ezmember.co.kr/cache/recipe/2016/02/29/c6f8779247dd71b6daf865ad1be859e81.jpg'}, {'step_number': 5, 'description': '손질한 돼지고기 등심에 양념을 넣고 양념이 고르게 배이도록 주물러주세요.', 'image_url': 'https://recipe1.ezmember.co.kr/cache/recipe/2016/02/29/f74a894ff216a65459129ed9ded6d6641.jpg'}, {'step_number': 6, 'description': '돼지고기가 양념에 충분히 덮여야 해요.', 'image_url': 'https://recipe1.ezmember.co.kr/cache/recipe/2016/02/29/29157ee0562428fba319f8e9a4c64c5d1.jpg'}, {'step_number': 7, 'description': '찹스테이크 양념에 재운 돼지고기는 랩으로 덮어 냉장에서 숙성시켜주세요. *냉장고에서 8시간에서 하루 반나절 동안 숙성시켜 사용하면 부드러워요.', 'image_url': 'https://recipe1.ezmember.co.kr/cache/recipe/2016/02/29/6cef6428ee1b1eedef8f2b2e789f46581.jpg'}, {'step_number': 8, 'description': '*프라이팬은 가장 센 불로 예열해요. 팬의 불이 약하면 돼지고기 육즙이 빠져나오니 센 불에서 볶아주세요. 양념이 고루 묻을 정도로 익혀주세요.', 'image_url': 'https://recipe1.ezmember.co.kr/cache/recipe/2016/02/29/0893180d2b56c3361bb20ce334b4e6e91.jpg'}, {'step_number': 9, 'description': '센 불로 볶다가 돼지고기가 단단해지면 곱게 다진 나머지 대파를 넣고 가볍게 버무려 마무리합니다. *돼지고기 찹스테이크는 번거롭더라도 소량으로 나눠 프라이팬에 구워주세요.', 'image_url': 'https://recipe1.ezmember.co.kr/cache/recipe/2016/02/29/d997767dcbe5fec51b13ed4d8904c8ac1.jpg'}, {'step_number': 10, 'description': '접시에 돼지고기 양념이 고르게 배어든 폭찹스테이크를 야채와 함께 소복하게 담아냅니다.', 'image_url': 'https://recipe1.ezmember.co.kr/cache/recipe/2016/02/29/d0538c958c63ca20594a6cd2e223a7811.jpg'}]"
155810,양식,손님접대,돼지고기,볶음,돼지고기목살 폭찹스테이크,목살폭찹스테이크,https://recipe1.ezmember.co.kr/cache/recipe/2015/07/08/7594a7ad62ddf6dbdfa98ce0d39c0340.jpg,"92,722",30분 이내,초급,2인분,"[('돼지고기 목살', '250g'), ('노랑 파프리카', '1/4개'), ('빨강 파프리카', '1/4개'), ('주황 파프리카', '1/4개'), ('양파', '1/4개'), ('마늘', '5알'), ('사과', '1/4개'), ('통조림 파인애플', '1개'), ('브로콜리', '1줌'), ('시즈닝 솔트', '1/2ts'), ('후추가루', '1/4ts'), ('레드와인', '1.5Ts'), ('스테이크소스', '2.5Ts'), ('토마토케첩', '2.5Ts'), ('레드와인', '1Ts'), ('설탕', '1ts'), ('물엿', '1/2Ts'), ('핫소스', '1.5Ts'), ('후춧가루', '약간')]",그냥 고기만 구워 먹는 것 보다는 다양한 야채와 과일의 맛을 즐길 수 있어서 더 좋은 요리랍니다. 특히 사과와 파인애플도 소스에 간이 배어 독특한 맛을 느낄 수 있답니다.,"[{'step_number': 1, 'description': '시즈닝솔트, 바질, 후춧가루를 고기에 뿌린 후 레드와인에 담가 두세요. 시즈닝솔트는 우리나라 제품으로 출시된 것을 사용했습니다. 허브와 소금 등이 혼합되어 있는 것으로 갈아서 사용하는 형태의 소금을 말합니다. 없으시면 허브솔트 등으로 대체하세요.', 'image_url': 'https://recipe1.ezmember.co.kr/cache/recipe/2015/07/09/ddaf04e1b26bb9d3bee56073a4d9f5dc1.jpg'}, {'step_number': 2, 'description': '노랑, 빨강, 주황 파프리카는 깨끗이 씻어 1/4도막을 낸 후 안의 흰부분을 제거하고 2cm 정도의 크기로 잘라 주세요. 양파와 사과도 2cm 크기로 잘라 주시고 파인애플도 다른 재료와 비슷한 크기로 잘라 주세요. 브로코리는 끓는 물에 소금 1/4ts 넣고 살짝 데쳐서 준비해 주세요. 마늘은 슬라이스 해서 준비해 주세요.', 'image_url': 'https://recipe1.ezmember.co.kr/cache/recipe/2015/07/09/68ab9c5ca48082017cff3277f3b935c41.jpg'}, {'step_number': 3, 'description': '분량의 소스를 넣고 잘 섞어 주세요.', 'image_url': 'https://recipe1.ezmember.co.kr/cache/recipe/2015/07/09/b62439326dad996b0970f17c079775d01.jpg'}, {'step_number': 4, 'description': '중불에서 달군 팬에 재운 돼지고기 목살을 올려서 구워 주세요.', 'image_url': 'https://recipe1.ezmember.co.kr/cache/recipe/2015/07/09/0fe28ebd2320b63174320f797c4531811.jpg'}, {'step_number': 5, 'description': '뒤집어서 고기가 어느정도 익으면 가위로 먹기 좋은 크기로 잘라서 완전히 익혀 주세요.', 'image_url': 'https://recipe1.ezmember.co.kr/cache/recipe/2015/07/09/793cae77b6d8bcacb866cb67130f6a771.jpg'}, {'step_number': 6, 'description': '양파와 마늘 레드와인 1큰술을 넣고 와인을 날릴 정도로 볶아 주세요.', 'image_url': 'https://recipe1.ezmember.co.kr/cache/recipe/2015/07/09/6ee5291fdf7e6d2f7d639b5a322ebb9f1.jpg'}, {'step_number': 7, 'description': '소스를 넣고 어느 돼지고기에 간이 배일 정도로 졸여 주세요.', 'image_url': 'https://recipe1.ezmember.co.kr/cache/recipe/2015/07/09/79fa5fefec99cf2cec88881b25c6ecd71.jpg'}, {'step_number': 8, 'description': '소스가 졸아들면 사과, 파인애플, 파프리카를 넣고 볶아 주세요. 마지막으로 데친 브로코리를 넣고 살짝 섞은 후 불을 꺼 주세요.', 'image_url': 'https://recipe1.ezmember.co.kr/cache/recipe/2015/07/09/f64ca134fbe37a5707db6b10a89d08fc1.jpg'}]"
155811,양식,손님접대,돼지고기,볶음,"데리야끼소스 베이스로 만든 
마늘목살 찹스테이크",목살찹스테이크,https://recipe1.ezmember.co.kr/cache/recipe/2016/11/27/cd324c23eeb28e1b5930eccefd7e35021.jpg,"13,391",60분 이내,초급,2인분,"[('돼지고기목살', '500g'), ('양파', '1개'), ('마늘', '12쪽'), ('데리야끼소스', '5T'), ('쓰리라차소스', '2T'), ('맛술', '4T'), ('간장', '1T'), ('파', '약간'), ('통깨', '약간'), ('후추', '약간')]","찹스테이크 하면 보통 한우 등심으로
하는걸 생각하죠
근데 우리돼지고기 한돈인 목살로 하면
한우 찹스테이크 못지 않는 비쥬얼과 맛으로
고급스런 스테이크가 되요
전 고기를 시러해서 그나마 소고기를좀더
선호하는데 이런 목살 찹스테이크는
한우도 따라올수 없는 맛으로 소스맛과 너무
잘어울러지네요 
특히 쓰리라차소스를 조금 가미 하니 은은히
매운맛이 고기에 풍미를 더해주는것 같아요
어제 같이 눈오는날이나 특별한날 
잘어울리는 와인과 함께할 명품안주로 
어울리겠죠^^","[{'step_number': 1, 'description': '한돈500g을 준비합니다', 'image_url': 'https://recipe1.ezmember.co.kr/cache/recipe/2016/11/27/a76e66b23f0236fa81a6f24747ecc7141.jpg'}, {'step_number': 2, 'description': '목살로 합니다', 'image_url': 'https://recipe1.ezmember.co.kr/cache/recipe/2016/11/27/b21be06fd4163ac354aa8352f9e05d161.jpg'}, {'step_number': 3, 'description': '쌀뜨물에 소주조금을 넣고 고기를 담가놓습니다 \n30분후에 물에 헹궈 꼭 짭니다', 'image_url': 'https://recipe1.ezmember.co.kr/cache/recipe/2016/11/27/5a65f594b4bdf884ef6f3eb40e9d78ea1.jpg'}, {'step_number': 4, 'description': '목살 끝부분에 비계는 제거하고 조금 크게 썰어놓습니다', 'image_url': 'https://recipe1.ezmember.co.kr/cache/recipe/2016/11/27/4ac532ac09beedf960484fe8bd51c05a1.jpg'}, {'step_number': 5, 'description': '양파는 크게 썰어 놓고 마늘을 준비합니다', 'image_url': 'https://recipe1.ezmember.co.kr/cache/recipe/2016/11/27/27fc441f9ae9c066b90511225acbea7b1.jpg'}, {'step_number': 6, 'description': '팬에 고기 마늘 맛술을 넣고 볶습니다 \n물이 생기면 다 버립니다', 'image_url': 'https://recipe1.ezmember.co.kr/cache/recipe/2016/11/27/22e49dcd1f315cffa5e9464a0c91ac1c1.jpg'}, {'step_number': 7, 'description': '목살이 반쯤 익으면 양파를 넣고 볶습니다', 'image_url': 'https://recipe1.ezmember.co.kr/cache/recipe/2016/11/27/a842846d3fc7a644416dc70ad2ebe3ad1.jpg'}, {'step_number': 8, 'description': '데리야끼소스를 준비합니다', 'image_url': 'https://recipe1.ezmember.co.kr/cache/recipe/2016/11/27/f87080f711d1f327698d1eb79d4946811.jpg'}, {'step_number': 9, 'description': '쓰리라차소스를 준비합니다', 'image_url': 'https://recipe1.ezmember.co.kr/cache/recipe/2016/11/27/256743a8e4a6d164f112ecd98020d1441.jpg'}, {'step_number': 10, 'description': '소스를 넣고 볶습니다', 'image_url': 'https://recipe1.ezmember.co.kr/cache/recipe/2016/11/27/9c5e782d109df8139bdb5b6d171fc6181.jpg'}, {'step_number': 11, 'description': '모자라는간은 기호에 맞게 간장으로 한후\n센불로 빨리 볶아 익힌후 불을 끄고 파 통깨 후추톡톡 넣고 예열로 섞어 놓습니다', 'image_url': 'https://recipe1.ezmember.co.kr/cache/recipe/2016/11/27/6a9c3ee3e8082db083bff397d1e286b31.jpg'}, {'step_number': 12, 'description': '가열된 스테이크팬에 담아냅니다', 'image_url': 'https://recipe1.ezmember.co.kr/cache/recipe/2016/11/27/5022174ceb84117cef62a2e831d0e3db1.jpg'}]"
155812,양식,손님접대,돼지고기,볶음,찹 스테이크,None,https://recipe1.ezmember.co.kr/cache/recipe/2016/11/11/eb5c9b841c30825b5f0bc35ab2bc2244.jpg,470,None,None,None,"[('돼지등심', ''), ('피망', ''), ('양송이버섯', ''), ('양파', ''), ('다진마늘', ''), ('올리브유', ''), ('소금', ''), ('후추', '')]",,[]
155813,양식,손님접대,돼지고기,볶음,돼지고기 찹스테이크,돼지고기찹스테이크,https://recipe1.ezmember.co.kr/cache/recipe/2018/03/09/daa089f3e0ff62514077b69cbaf7c92c1.jpg,"2,957",60분 이내,아무나,3인분,"[('돼지고기', ''), ('파프리카', '2개'), ('양파', '1개'), ('소금', '조금'), ('후추', '조금'), ('맛술', '2큰술'), ('돈가스소스', '6큰술'), ('굴소스', '2큰술'), ('케첩', '2큰술'), ('설탕', '1큰술'), ('다진마늘', '1큰술')]",돼지고기 찹스테이크,"[{'step_number': 1, 'description': '돼지고기는 먹기 좋게 썰어주신 뒤, 소금, 후추 조금, 맛술 2큰술에 재워주세요.', 'image_url': 'https://recipe1.ezmember.co.kr/cache/recipe/2018/03/09/cc0c9f1f7554fb3d9f271c141ad081b41.jpg'}, {'step_number': 2, 'description': '파프리카와 양파도 먹기 좋게 썰어주세요.', 'image_url': 'https://recipe1.ezmember.co.kr/cache/recipe/2018/03/09/9ac7447f7dda10811191ace4827626fd1.jpg'}, {'step_number': 3, 'description': '팬에 올리브유를 두르고 다진마늘을 볶아주세요. 마늘향이 올라올때까지.', 'image_url': 'https://recipe1.ezmember.co.kr/cache/recipe/2018/03/09/b0f28de49e5e632e5db9b43a0d9f3dea1.jpg'}, {'step_number': 4, 'description': '볶은 마늘에 돼지고기를 넣어 볶아주세요.', 'image_url': 'https://recipe1.ezmember.co.kr/cache/recipe/2018/03/09/a1c7f9c404a27fc6b27b3dc757f27bde1.jpg'}, {'step_number': 5, 'description': '돼지고기가 어느정도 익으면 양파도 넣어 같이 볶아줍니다.', 'image_url': 'https://recipe1.ezmember.co.kr/cache/recipe/2018/03/09/dc40a31d5021fb90925d3cd4a9868fc91.jpg'}, {'step_number': 6, 'description': '양파가 투명해지면 파프리카와 돈가스소스6큰술, 굴소스2큰술, 케첩2큰술, 설탕 1큰술을 넣어 볶아주세요.\n(저는 돈가스소스 대신 스테이크 소스를 사용햇어요)', 'image_url': 'https://recipe1.ezmember.co.kr/cache/recipe/2018/03/09/088047a0e313595d6d59821fd136891f1.jpg'}, {'step_number': 7, 'description': '양념이 잘 베이게 볶아주시면 끝입니다.', 'image_url': 'https://recipe1.ezmember.co.kr/cache/recipe/2018/03/09/d6e13a6fd6172498c5f76f8fda857dd41.jpg'}]"
155814,양식,손님접대,돼지고기,볶음,누구나 손쉽게 만드는 초간단 대패삼겹살파스타,대패삼겹살파스타,https://recipe1.ezmember.co.kr/cache/recipe/2020/06/28/822c42ea236f0aea28a9104bc668d5901.jpg,"4,993",30분 이내,아무나,1인분,"[('대패삼겹살', '100g'), ('슬라이스마늘', '15조각'), ('다진마늘', '2T'), ('다진파', '2T'), ('청양고추', '1개'), ('크러쉬드레드페퍼', '0.5T'), ('오일', '3T'), ('파스타면', '80g'), ('굵은소금', '1T'), ('면수                                                                                또는 물', '100ml'), ('후추', '톡톡'), ('파슬리가루', '톡톡'), ('간장', '1.5T'), ('설탕', '1T'), ('물', '6T')]","갑자기 파스타가 땡기는날 소스 사러 마트 가기는 귀찮을때, 집에 있는 재료로 손쉽게 만들어볼 수 있는 파스타에요 ! 
분위기 내고싶을 때나, 손님 초대 할때에도 물론 유용하게 쓰이는 레시피랍니다 ^-^","[{'step_number': 1, 'description': '간장 1.5T, 설탕1T, 물6T를 넣고 소스를 먼저 만들어주세요\n* 단거 싫어하시면 설탕 조절해주세요!', 'image_url': 'https://recipe1.ezmember.co.kr/cache/recipe/2020/06/28/7ce09f0d01c092c20f5f512e33700c7d1.jpg'}, {'step_number': 2, 'description': '굵은소금 1T를 넣고 파스타면 80g을 삶아주세요\n* tip! 면수 넉넉히 90ml는 남겨주세요', 'image_url': 'https://recipe1.ezmember.co.kr/cache/recipe/2020/06/28/cd68c07b9ffe419852c77d86394537bb1.jpg'}, {'step_number': 3, 'description': '면이 삶아질동안 팬에 오일을 둘러 다진마늘2T, 슬라이스마늘을 볶다가 다진 파 2T도 함께 볶아 파기름을 만든 후, 대패삼겹살 100g을 넣고 볶아주세요', 'image_url': 'https://recipe1.ezmember.co.kr/cache/recipe/2020/06/28/6d1a302dbe02f34ac23d18022773f4611.jpg'}, {'step_number': 4, 'description': '면이 삶아졌으면 볶아진 대패삼겹살에 면을 넣고, 만들어 둔 소스를 부어서 끓여주세요\n* 약간 뻑뻑한 느낌이 든다면 남겨둔 면수를 적당히 추가해주세요', 'image_url': 'https://recipe1.ezmember.co.kr/cache/recipe/2020/06/28/c8e27ef37dbeecd75536b6a02b9a2a0a1.jpg'}, {'step_number': 5, 'description': '썰어둔 청양고추를 넣은 후, 소스와 면이 어우러지도록 충분히 볶다가 마지막에 후추 톡톡 !\n* 베트남고추,페퍼론치노,크러쉬드레드페퍼 등 추가해서 넣어주셔도 좋아요', 'image_url': 'https://recipe1.ezmember.co.kr/cache/recipe/2020/06/28/10558c9fb974b8e6bfb9c09d0524b9701.jpg'}, {'step_number': 6, 'description': '접시에 예쁘게 담은 후 파슬리 가루 톡톡 뿌려 마무리 해주면 맛있고 간단한 대패삼겹살파스타 완성!\n* 파마산치즈가루 뿌려서 먹으면 더욱 맛있어요', 'image_url': None}]"
155815,양식,손님접대,돼지고기,볶음,꿀처 목살 찹스테이크,목살찹스테이크,https://recipe1.ezmember.co.kr/cache/recipe/2017/08/08/ae2f26ae1b30d571787fbcaad03681951.jpg,"6,022",60분 이내,중급,1인분,"[('돼지목살', '150g'), ('양파', '1/4개'), ('양송이', '2개'), ('새송이', '1/2개'), ('가지', '1/5개'), ('호박', '1/5개'), ('빨강파프리카', '1/6개'), ('청피망', '1/6개'), ('파인애플 슬라이스', '1개'), ('양파', '1/4개'), ('케찹', '2'), ('우스터소스', '2'), ('흑설탕', '1'), ('버터', '2'), ('마늘가루', '0.5'), ('양파가루', '0.5'), ('통후추', '10알'), ('핫소스', '1'), ('레드와인', '2')]","안녕하세요, 꿀처예요~♡
오늘은,, 냉장고안에 여러 종류의
야채들이 조금씩 남아있어서
요걸로 근사한 요리를 한번 만들어보려해요~
어른들 안주로도 좋고, 애들 
간식으로도 영양만점인 
돼지고기 목살 찹 스테이크!!
수제로 스테이크 소스까지 
아주 건강하게~
그럼 바로 요리 시작해볼께용~♡","[{'step_number': 1, 'description': '재료는 깨끗이 세척후 레시피의 양대로 준비해주세요~', 'image_url': 'https://recipe1.ezmember.co.kr/cache/recipe/2017/08/08/e159fea97f8f6027189dcfd704f1610d1.jpg'}, {'step_number': 2, 'description': '먼저 고기는 사방 2cm정도로 깍둑썰기하여 올리브오일(1), 후춧가루(0.1), 소금(0.1)을 넣고 재어놔주세요~\n(꿀처팁- 고기를 올리브오일에 재어두는건 연육작용과 누린내제거, 수분이 유출되는걸 방지하기 위함이고요, 꼭 올리브유가 아니어도 아보카도 오일이나 카놀라유로도 대체 가능하세요)', 'image_url': 'https://recipe1.ezmember.co.kr/cache/recipe/2017/08/08/0841c9f6b34649aba379913ad2b01ae71.jpg'}, {'step_number': 3, 'description': '씻어놓은 야채 역시도 고기 싸이즈와 비슷하게 사방 2cm정도로 깍둑썰기 해주시고요, 소스에 들어가는 파인애플만 다져서 준비해놔주세요~', 'image_url': 'https://recipe1.ezmember.co.kr/cache/recipe/2017/08/08/584b26ff389d6f23fa034ebf090664681.jpg'}, {'step_number': 4, 'description': '양파(1/4개)를 아주 얇게 채썰어서 버터(2)와 함께 약한불에서 볶아 카라멜라이징 해줄껀데요~', 'image_url': 'https://recipe1.ezmember.co.kr/cache/recipe/2017/08/08/a54f5e9a9cb1e544a10da80ac14cf5c71.jpg'}, {'step_number': 5, 'description': '시중에파는 소스들은 거의다 색소가 들어가있어서,, 오늘은 스테이크 소스를 직접 수제로 만들어볼꺼예요~\n이때 가장 중요한 작업이 최대한 약한불로 양파를 타지않게 양파의 당분을 빼내는 작업인데요, 옆에 물한컵 떠놓으시고 탈만하면 아주 조금씩만 물을넣고 15분이상 색깔이 갈색으로 변할때까지만 볶아주세요~', 'image_url': 'https://recipe1.ezmember.co.kr/cache/recipe/2017/08/08/79a8bdfc593fc9fd33ea3ff2f1bc7c131.jpg'}, {'step_number': 6, 'description': '이제 볶아낸 양파와 다져놓은 파인애플 (천연의 신맛을 내주기위해), 케찹(2), 우스터소스(2), 흑설탕(1), 마늘가루(0.5), 양파가루(0.5), 으깬 통후추 (10알), 핫소스(1), 레드와인(2)을 믹서기에 넣고 갈아주신후 약 5분여간 끓여주세요~', 'image_url': 'https://recipe1.ezmember.co.kr/cache/recipe/2017/08/08/55c1ca0c890f07cca4a5ca1799af6c4a1.jpg'}, {'step_number': 7, 'description': '다음 고기를 볶아줄껀데요,, 후라이팬에 올리브오일(1.5)을 두른후 기름의 온도가 달아오르면 쎈불에서 고기가 2/3정도만 익게끔 볶아주세요 > 그리고 야채를 넣고 고기가 다 익을때까지 같이 볶아주세요~\n(꿀처팁- 이렇게 고기를 쎈불에서 볶게되면 육즙이 빠져나가는걸 방지하는 코팅효과와 고기의 사각면이 순간 익으면서 모양유지에도 도움이 된담니다^^)', 'image_url': 'https://recipe1.ezmember.co.kr/cache/recipe/2017/08/08/5fe3a8010d0975ad9ec961d595ba535d1.jpg'}, {'step_number': 8, 'description': '짜자잔,, 목살 찹 스테이크 완성~~\n시중에 파는 소스들은 사실 편리함으론 따라갈수없지만,, 수제소스는 맛과 건강 두가지를 다 잡을수있어서 우리 식구들 건강에는 훨씬 더 좋아요~절대 비교불가^^ \n그러니 시간되시면 꼭 한번 직접 만들어보셔요~♡', 'image_url': 'https://recipe1.ezmember.co.kr/cache/recipe/2017/08/08/84b3b0b1813fa77bf92381b7acfa9af51.jpg'}]"
