index,종류별,상황별,재료별,방법별,글 제목,레시피이름,레시피이미지,조회수,조리시간,난이도,인분,재료,소개글,조리순서
33965,메인반찬,손님접대,돼지고기,찜,돼지갈비찜 만드는법 찜갈비 레시피,돼지갈비찜,https://recipe1.ezmember.co.kr/cache/recipe/2020/12/18/2aecce7d290de2f2c9a895588eb022ac1.jpg,"11,138",90분 이내,아무나,4인분,"[('돼지갈비', '500g'), ('대파', '3대'), ('당근', '1/3개'), ('감자', '2알'), ('양파', '1개'), ('꽈리고추', '6개'), ('땡초', '2개'), ('진간장', '6국자'), ('간마늘', '1T'), ('설탕', '2국자'), ('올리고당', '조금'), ('간생강', '1T'), ('버섯', '2개'), ('불린당면', '1줌'), ('양파', '1개'), ('대파', '1대')]","돼지갈비가 싸게 나와서 만들어 보았습니다.
간단하게 쉬운방법이니 쉽게 만드실수 있을껍니다.","[{'step_number': 1, 'description': '돼지갈비는 500g을 사용하였습니다.\n물로 겉면을 씻어 주시고 먹기 좋은 \n크기로 잘라주세요.', 'image_url': 'https://recipe1.ezmember.co.kr/cache/recipe/2020/12/18/72e416485df62805950f1e2715fce2281.jpg'}, {'step_number': 2, 'description': '냄비에 물을 넣고 간생강0.5T 넣고 \n식초를 한바퀴 둘러주세요.\n이렇게 하면 불순물도 빼고\n생강과 식초로 잡냄새를 잡을수 있습니다.\n끓으면 10분간 끓여 익혀 줍니다.강불', 'image_url': 'https://recipe1.ezmember.co.kr/cache/recipe/2020/12/18/f50436ba9f7d2301c26077e928dfa7521.jpg'}, {'step_number': 3, 'description': '양념장 만드는법:)\n마늘0.5T, 설탕2국자, 진간장6T,\n올리고당 조금,', 'image_url': 'https://recipe1.ezmember.co.kr/cache/recipe/2020/12/18/f859bc2c57f229e87ab066ea95565a551.jpg'}, {'step_number': 4, 'description': '고기가 어느정도 익었다면 \n이제 찬물로 씻어주세요.\n뼈조각이나 불순물이 묻어 있으므로\n깨끗하게 헹궈내시면 됩니다.\n그리고', 'image_url': 'https://recipe1.ezmember.co.kr/cache/recipe/2020/12/18/4ff6d5dc9f4214d18f2f1a02c3ba16de1.jpg'}, {'step_number': 5, 'description': '국물내기용 야채를 잘라주세요.\n당근이나 감자는 큼직하게 썰어주시고\n대파와 꽈리고추, 양파도 큼직하게 \n썰어주세요.', 'image_url': 'https://recipe1.ezmember.co.kr/cache/recipe/2020/12/18/b82b66baef094de3bc5cbb86bb8a17531.jpg'}, {'step_number': 6, 'description': '익어갈때 넣을 야채들은\n불린당면과 버섯, 양파 입니다.', 'image_url': 'https://recipe1.ezmember.co.kr/cache/recipe/2020/12/18/4fa1e9157c2611201f45096d8eabd5ff1.jpg'}, {'step_number': 7, 'description': '이제 아까 만들어 두었던 양념장을 \n부워주세요.\n채에 받쳐 놓은 고기도 넣어주세요.', 'image_url': 'https://recipe1.ezmember.co.kr/cache/recipe/2020/12/18/d3a51756e0540fd027fc9d3708abf3901.jpg'}, {'step_number': 8, 'description': '국물내기용 야채도 넣고\n이제 야채가 잠길정도로 물을 부워주세요.\n두껑을 닫고 이제 강불로 끓이다가 \n중불로 바꾸어 50분간 끓여줍니다.압력솥이나 밥솥으로 끓이시면 더 빨리 됩니다.', 'image_url': 'https://recipe1.ezmember.co.kr/cache/recipe/2020/12/18/f69692a50797295867c68609d90895c91.jpg'}, {'step_number': 9, 'description': '이렇게 끓이다보면 이제 국물이 졸여집니다\n이때 당근과 감자 빼고 건더기는 모두 \n건져주세요.', 'image_url': 'https://recipe1.ezmember.co.kr/cache/recipe/2020/12/18/d5e452aebe5055fc7a21b7fe79372a4d1.jpg'}, {'step_number': 10, 'description': '고기를 맛보고 간이 안베였다면\n베일때 까지 물을 조금씩 붓고 저어줍니다.중불감자와 당근이 익었다면 잠시 빼주세요.', 'image_url': 'https://recipe1.ezmember.co.kr/cache/recipe/2020/12/18/15bce0c7367607bea8800b32c1b9af471.jpg'}, {'step_number': 11, 'description': '고기의 간이 베였다면 이제는\n당면과 버섯과 양파를 넣고 익을때까지\n조립니다.\n물의 양이 모자르다면 짜울테니\n물을 조금 더 부어 당면을 익혀줍니다.중불', 'image_url': 'https://recipe1.ezmember.co.kr/cache/recipe/2020/12/18/cd80c2e0dd4f3d042f0c095152978f1b1.jpg'}, {'step_number': 12, 'description': '당면과 양파가 익으면 이제 그릇에 \n담아줍니다.쪽파를 위에 뿌리면 더 맛있게 보입니다.', 'image_url': 'https://recipe1.ezmember.co.kr/cache/recipe/2020/12/18/72d1c187b65022972660dc097d7651981.jpg'}]"
33966,메인반찬,손님접대,돼지고기,찜,묵은지 돼지고기찜,묵은지돼지고기찜,https://recipe1.ezmember.co.kr/cache/recipe/2015/08/25/272428811fe80aecb55b122250081f80.jpg,"25,893",2시간 이상,초급,4인분,"[('돼지고기', ''), ('잘익은 김치', '2쪽'), ('김치국물', '0.5컵'), ('멸치다싯물', '2컵'), ('물', '2컵'), ('국간장', '0.5큰술'), ('설탕', '1큰술'), ('맛술', '2큰술'), ('다진마늘', '2큰술'), ('대파', '1/3대'), ('후춧가루', '약간')]","새콤,매콤한 묵은지와 야들야들 잘익은 돼지고기, 요거면 까잇꺼 밥두그릇 정도 먹는건 일도 아니죠.","[{'step_number': 1, 'description': '고기는 찬물에 담궈 핏물을 좀 빼주구요. 찬물에 1시간정도 담궈두면 됩니다.', 'image_url': 'https://recipe1.ezmember.co.kr/cache/recipe/2015/08/25/a98c1a5a067328f12a19c89f9c46b2d61.jpg'}, {'step_number': 2, 'description': '잘익은 김치는 양념을 좀 털어내고 너무 짜거나 양념이 많은김치는 살짝 씻어주세요. 저도 양념이 좀 많이 묻었길래 가볍게 씻어주었답니다. 김치에 설탕 1큰술을 넣어 밑간을 해줍니다. 냄비에 김치깔고 고기 얹고 고기에 후춧가루 약간뿌리고 국간장 0.5큰술 넣고 맛술 2큰술 넣고 밑간을 해준뒤 김치국물 0.5컵 부어주세요.', 'image_url': 'https://recipe1.ezmember.co.kr/cache/recipe/2015/08/25/a03acda1ba4512b76368b9794c9a54841.jpg'}, {'step_number': 3, 'description': '물 2컵 부어주고 멸치다싯물도 2컵 부어준뒤 끓여줍니다. 그냥 맹물만 4컵 넣어도 괜찮아요. 끓기시작하면 불을 줄여 40분~1시간 정도 푹 끓여줍니다. 요런거는 김치가 부들부들 해질때까지 푹익혀야 맛있답니다. 마지막에 다진마늘 2큰술과 어슷썬 대파를 넣어 잠시더 익혀주면 완성입니다.', 'image_url': 'https://recipe1.ezmember.co.kr/cache/recipe/2015/08/25/698a090d43abb0857bee1d710b1206731.jpg'}]"
33967,메인반찬,손님접대,돼지고기,찜,소갈비찜보다 맛있는 돼지등갈비찜 만드는 방법~,돼지등갈비찜,https://recipe1.ezmember.co.kr/cache/recipe/2018/12/05/46c69b830914032857b9a6a29b0c3afd1.jpg,"41,130",60분 이내,중급,4인분,"[('돼지등갈비', '1500g'), ('대파 다진거', '1개'), ('양파', '1/2개'), ('다진마늘', '3T'), ('배즙', '10T'), ('간장', '15T'), ('맛술(미림)', '4T'), ('올리고당', '4T'), ('참기름', '1.5T'), ('설탕', '1.5T'), ('깨', '1T'), ('후춧가루', '약간'), ('소주', '1/2컵')]","연말에 가족모임 많으시죠??
이럴때 소갈비찜보다 맛잇는 돼지등갈지찜으로 맛있게 한상 차려보세요!!!

***저의 계량은 밥숟가락 한 숟가락이 1T고요..종이컵 1컵이 1컵입니다.","[{'step_number': 1, 'description': '1. 돼지등갈비는 찬물에 담궈 1시간이상 핏물을 빼줍니다. (1시간에서 3시간정도 핏물을 빼면 적당합니다.)\n==> 핏물 빼는 중간에 찬물을 계속 갈아주세요..\n2. 핏물뺀 등갈비를 끓는물에 넣고 소주1/2컵을 넣어 20~30초정도만 데친후 바로 미지근한 물에 헹궈 등갈비에 붙은 핏기를 제거합니다.', 'image_url': 'https://recipe1.ezmember.co.kr/cache/recipe/2018/12/05/dd0fa58cd65c84e6a99ec95dba07729e1.jpg'}, {'step_number': 2, 'description': '3. 그릇에 살짝 데친 등갈비를 넣고 대파1개 다진거. 양파1/2개 다진거. 다진마늘3T. 배즙10T. 간장14~15T. \n맛술4T. 올리고당4T. 참기름1T반. 설탕1T반. 깨1T. 후추가루를 넣은후 살짝 버무린후 물1컵을 부어\n1시간~2시간정도 재워줍니다.\n==> 간장은 14T를 넣은후 나중에 조릴때 싱거우면 추가하세요.\n==> 재울때 물을 1컵 부어주셔야 너무 짜지 않게 재워집니다.\n==> 등갈비를 재울때 데치는 과정 생략하고 재워도 좋습니다.', 'image_url': 'https://recipe1.ezmember.co.kr/cache/recipe/2018/12/05/efe6ea99089c4aa78f88b01dc43f70611.jpg'}, {'step_number': 3, 'description': '4. 재운 등갈비에 물3컵을 더 부어 센불에서 끓으면 중불로 줄여 40~50분정도 졸이면 완성입니다.\n냄비뚜껑은 덮고 중간중간 뒤적이면서 졸이면 완성입니다.\n==> 가스불의 세기에 따라 불조절 잘하세요..', 'image_url': 'https://recipe1.ezmember.co.kr/cache/recipe/2018/12/05/d542a834871329735420489158c6d3fb1.jpg'}]"
33968,메인반찬,손님접대,돼지고기,찜,매운돼지갈비찜 황금레시피,매운돼지갈비찜,https://recipe1.ezmember.co.kr/cache/recipe/2016/02/28/b2276316ffed26f40967ee752246d4211.jpg,"207,568",2시간 이상,중급,4인분,"[('돼지갈비', '1kg'), ('감자', ''), ('당근', ''), ('양파', ''), ('대파', ''), ('청양고추', ''), ('고추장', '3스푼'), ('고춧가루', '4.5스푼'), ('간장', '6스푼'), ('다진마늘', '3스푼'), ('설탕', '1스푼'), ('굴소스', '1.5스푼'), ('매실액', '1스푼'), ('맛술', '2스푼'), ('후추', '톡톡'), ('양파', '1/4개'), ('청양고추', '')]",신랑생일상 메인으로 요리한 메뉴는 바로 매운돼지갈비찜. 요번에는 매운거 좋아하는 신랑입맛에 맞춰 화끈하게 만들어 보았어요.,"[{'step_number': 1, 'description': '먼저 냉동으로 사기 싫었는데 동네 정육점 가니 냉동밖에 없다고 해서 할수없이 냉동으로 구매했네요. 제가 요리한 고기의 양은 1200g이에요. 참고하세요. 뼈가 있기때문에 둘이먹기에 결코 많은 양이 아니더라구요.', 'image_url': 'https://recipe1.ezmember.co.kr/cache/recipe/2016/02/29/3408f22dee51697908378608969c1f351.jpg'}, {'step_number': 2, 'description': '냉동이니까 해동을 시키고 핏물을 빼기위해 30분~1시간 정도 물에 담궈주세요 저는 중간중간 물을 갈아주었어요.', 'image_url': 'https://recipe1.ezmember.co.kr/cache/recipe/2016/02/29/3682fcdb380488664d60cc4a4f54bb6b1.jpg'}, {'step_number': 3, 'description': '이제 양념장을 만들건데요 양파 4분의1과 적당한 청양고추를 같이 믹서에 갈아주세요 (매운거 좋아하시면 청양고추 팍팍) 그래야 더 매콤매콤 하더라구요.', 'image_url': 'https://recipe1.ezmember.co.kr/cache/recipe/2016/02/29/57410417342b28847d1f989b3cd81f8d1.jpg'}, {'step_number': 4, 'description': '각각 양에맞게 양념장을 만드신후 고추장 3스푼, 고춧가루 4.5스푼, 간장 6스푼, 다진마늘 3스푼, 설탕 1스푼, 굴소스 1.5스푼, 매실액 1스푼, 맛술 2스푼, 후추 톡톡', 'image_url': 'https://recipe1.ezmember.co.kr/cache/recipe/2016/02/29/f2cd60d43c852773701563d2c527651f1.jpg'}, {'step_number': 5, 'description': '쫌전에 갈았던 양파고추도 같이 섞어주세요.', 'image_url': 'https://recipe1.ezmember.co.kr/cache/recipe/2016/02/29/e1c813e246679dbbf1481f24919db9e01.jpg'}, {'step_number': 6, 'description': '핏물을 뺀 돼지갈비는 한번 깨끗히 씻은다음 중간에 콕콕 찔러 칼집을 내주시고', 'image_url': 'https://recipe1.ezmember.co.kr/cache/recipe/2016/02/29/f86f181083815bfb52bd53a000e2a5051.jpg'}, {'step_number': 7, 'description': '월계수잎을 넣어', 'image_url': 'https://recipe1.ezmember.co.kr/cache/recipe/2016/02/29/3755a4555b781efad8922ed4d0865b3b1.jpg'}, {'step_number': 8, 'description': '겉만 살짝 익을정도로 삶아주세요.', 'image_url': 'https://recipe1.ezmember.co.kr/cache/recipe/2016/02/29/c9d9c7dcda45ed88602afaa29939a8c11.jpg'}, {'step_number': 9, 'description': '살짝 삶아준 후 흐르는물에 한번 씻어줬더니 나름 깔끔해졌네요.', 'image_url': 'https://recipe1.ezmember.co.kr/cache/recipe/2016/02/29/88230e9a46da28773fbb7c4eea4e5c061.jpg'}, {'step_number': 10, 'description': '이제 만들어뒀던 양념장을 고기에 잘 베도록 조물조물 짧게는 1시간에서 2-3시간, 하루정도 냉장숙성 시켜주면 더 좋겠죠. 저는 전날 만들어두고 하루정도 숙성시켜 다음날 요리해 먹었어요.', 'image_url': 'https://recipe1.ezmember.co.kr/cache/recipe/2016/02/29/79802834aebe0ce461a2e097c16ce2b21.jpg'}, {'step_number': 11, 'description': '하루 숙성된 모습 아주 매콤매콤해 보이네요.', 'image_url': 'https://recipe1.ezmember.co.kr/cache/recipe/2016/02/29/a83c6d1f01143471f5a512babe4964e81.jpg'}, {'step_number': 12, 'description': '냄비에 숙성된 돼지갈비를 넣고 물 700ml정도를 부어 쎈불로 팔팔 끓여줍니다.', 'image_url': 'https://recipe1.ezmember.co.kr/cache/recipe/2016/02/29/bd4535260c7fb1c8dc4c64ab5b32dd7e1.jpg'}, {'step_number': 13, 'description': '그동안 야채 준비하기. 당근도 넣으면 좋은데 당근이 똑 딸어져서 못넣었네요. 각종 야채들은 먹기좋게 손질해주세요.당근 손질법 레시피\u200b', 'image_url': 'https://recipe1.ezmember.co.kr/cache/recipe/2016/02/29/7d76347bfacac3e023dd11ea8d07582d1.jpg'}, {'step_number': 14, 'description': '쎈불로 끓이다가 끓어오르면 중불로 좀 더 끓여주시고 감자,양파를 넣어 계속 끓여주세요.', 'image_url': 'https://recipe1.ezmember.co.kr/cache/recipe/2016/02/29/e328cb9d19451a824378ae986312f9381.jpg'}, {'step_number': 15, 'description': '보글보글 매콤한 냄새가 코를 찔러요.', 'image_url': 'https://recipe1.ezmember.co.kr/cache/recipe/2016/02/29/052946f53a1aa8363623034678c910ad1.jpg'}, {'step_number': 16, 'description': '열심히 보글보글 끓여주고 거의다 익었을때쯤 송송썰은 대파와 청양고추를 넣어 살짝 더 조려주세요.', 'image_url': 'https://recipe1.ezmember.co.kr/cache/recipe/2016/02/29/0008d41da33e0ed83c7cbcb64c1802cf1.jpg'}, {'step_number': 17, 'description': '짠 맛있는 매운돼지갈비찜 완성입니당. 너무 매콤한데 맛있게 된거에요. 매운거 땡기시는날, 매운돼지갈비찜 어떠신가요? 스트레스 팍팍 풀릴거에요.', 'image_url': 'https://recipe1.ezmember.co.kr/cache/recipe/2016/02/29/4d147baada6cd5046730aa97190d891d1.jpg'}]"
33969,메인반찬,손님접대,돼지고기,찜,매운돼지갈비찜 매운양념 만들기,매운돼지갈비찜,https://recipe1.ezmember.co.kr/cache/recipe/2016/12/14/86cb77b07d53209fa26b9972bd8cd5591.jpg,"216,620",60분 이내,아무나,6인분 이상,"[('돼지갈비', '1.5kg'), ('고구마', '2개'), ('대파', '1대'), ('양파', '1/2개'), ('당근', '1/3토막'), ('청양고추', '4개'), ('통깨', '약간'), ('', ''), ('간장', '4큰술'), ('맛술', '4큰술'), ('고추장', '2큰술'), ('청양 고춧가루', '2큰술'), ('매운 굴소스', '2큰술'), ('마늘', '약간'), ('생강가루', '약간'), ('설탕', '2큰술'), ('올리고당', '1큰술'), ('소금', '약간'), ('후추', '약간'), ('참기름', '약간')]",추운 날씨에 화끈하고 매운 음식 먹으면 좀 따뜻해진 것 같죠~ ​ 지난번처럼 입안이 얼얼할 정도는 아니지만 맛있게 매운 돼지갈비찜을 만들어봤답니다 ​ 요즘엔 다들 바빠서 같이 먹지는 못하고 각각 먹고 나서 가족 단톡방에 맛있다고 남겨준 거 있죠 ㅋㅋ ​ 겨울철 보양음식으로도 좋은 돼지갈비찜 매운맛으로 기분 좋게 하루를 시작해 보네요,"[{'step_number': 1, 'description': '고구마와 당근, 양파는 먹기 좋은 크기로 썰고 대파는 숭덩숭덩 큼직하게 썰고 청양고추도 어슷하게 썰어줍니다 모양은 특별히 상관없어요', 'image_url': 'https://recipe1.ezmember.co.kr/cache/recipe/2016/12/14/b7ac7bd7a269dffd18d25561b634c1c41.jpg'}, {'step_number': 2, 'description': '핏물을 뺀 돼지갈비는 끓는 물에 데쳐줍니다', 'image_url': 'https://recipe1.ezmember.co.kr/cache/recipe/2016/12/14/1e10ea034a54ab8259c2f6cbe9478df91.jpg'}, {'step_number': 3, 'description': '냄비에 물을 반정도 붓고 위의 양념인 간장, 고춧가루, 매운굴소스, 설탕, 올리고당, 소금 등을 넣고 끓으면 삶아놓은 돼지갈비를 넣고 뚜껑을 덮고 끓여줍니다 고기가 거의 다 익었으면 고구마, 당근, 양파, 대파, 청양고추를 넣고 국물이 자작해지도록 졸여낸 뒤 마지막에 참기름, 후추를 뿌려줍니다', 'image_url': 'https://recipe1.ezmember.co.kr/cache/recipe/2016/12/14/139a81e297d80ffe659f93a074d3e8af1.jpg'}, {'step_number': 4, 'description': '진한 양념이 잘 배인 돼지갈비를 수북하게 담아주었어요 통깨도 솔솔 뿌리고~ 돼지갈비는 뼈가 쏙 빠질 정도로 익어야 해서 시간이 조금 걸리긴 하지만 만들어 놓으면 푸짐하니 먹음직스럽고 좋죠~', 'image_url': 'https://recipe1.ezmember.co.kr/cache/recipe/2016/12/14/9ddf60aaf9682db476f61124137dab0f1.jpg'}]"
33970,메인반찬,손님접대,돼지고기,찜,등갈비찜 황금레시피 먹어보면 반할걸요???,등갈비찜,https://recipe1.ezmember.co.kr/cache/recipe/2016/06/16/720bb266a552ef4648672e0621c19da11.jpg,"293,440",90분 이내,중급,4인분,"[('등갈비', '1kg'), ('월계수잎', '5~6장'), ('통마늘', '4개'), ('통후추', '5~6알'), ('간장', '12스푼'), ('물엿                                                                                이나 올리고당', '3스푼'), ('설탕', '2스푼'), ('매실액', '2스푼'), ('맛술', '2스푼'), ('참기름', '1스푼'), ('다진마늘', '1스푼'), ('배', '1/2개'), ('양파', '1/2개')]","등갈비를 사놓은지 한참 되었는데 냉동고에 넣어 놓고 깜박 잊어버린거 있죠???
냉동고에 있는 만두를 꺼내다가 갑자기 눈에 띄여서 찜으로 만들어 보기로...
묵은지 넣고 김치찜해서 먹어도 맛있지만 우리집 고기돌이 아들과 함께 먹으려고 간장넣고 달작지근하게 만들어본 등갈비찜!!!
황금레시피로 만들어서 더 맛있는 조리법 지금부터 알려 드릴께요.","[{'step_number': 1, 'description': '갈비는 1시간이상 담궈 핏물을 제거해 주세요. 전 3시간정도 담궈 줬고 중간중간 물을 갈아 주었어요. 다음으로 등갈비찜 황금레시피의 양념을 만들어 볼께요.', 'image_url': 'https://recipe1.ezmember.co.kr/cache/recipe/2016/06/16/64d493c297f94150d310abaeb12344cc1.jpg'}, {'step_number': 2, 'description': '간장 12스푼', 'image_url': 'https://recipe1.ezmember.co.kr/cache/recipe/2016/06/16/79ee8c5144bbbc1366e780697f22e4d91.jpg'}, {'step_number': 3, 'description': '설탕 2스푼 간장을 넣고 설탕을 넣으면 잘 녹기 때문에 간장을 넣은후 설탕을 넣어 주세요.', 'image_url': 'https://recipe1.ezmember.co.kr/cache/recipe/2016/06/16/d682de91290409c0c263f8bce1c913f51.jpg'}, {'step_number': 4, 'description': '돼지고기 특유의 잡내를 잡아주면서 감칠맛을 더해주는 매실액 2스푼', 'image_url': 'https://recipe1.ezmember.co.kr/cache/recipe/2016/06/16/fbbf4f9710e029dced6b0c11fb30bc691.jpg'}, {'step_number': 5, 'description': '맛술 2스푼', 'image_url': 'https://recipe1.ezmember.co.kr/cache/recipe/2016/06/16/a135ad543e1fdd202a56ea4baea5b7651.jpg'}, {'step_number': 6, 'description': '물엿이나 올리고당 3스푼 저희식구는 달달하게 먹는것을 좋아하지만 평소 단것을 즐기지 않으신다면 2스푼정도로 줄이셔도 되요.', 'image_url': 'https://recipe1.ezmember.co.kr/cache/recipe/2016/06/16/da08bcb0d298cee6121c7c1917966a191.jpg'}, {'step_number': 7, 'description': '다진마늘 1스푼 전 생강이 없어서 생략했는데 생강이 있으시면 생강즙을 1스푼 추가로 넣으셔도 되요.', 'image_url': 'https://recipe1.ezmember.co.kr/cache/recipe/2016/06/16/6694e3414ef90bdef3605adde8f223b21.jpg'}, {'step_number': 8, 'description': '배와 양파는 강판에 갈아서 넣어 주시고 분량의 재료를 잘 섞어주시면 양념 완성!!!', 'image_url': 'https://recipe1.ezmember.co.kr/cache/recipe/2016/06/16/b4640bf9f94e54e874c8c4db6a64763c1.jpg'}, {'step_number': 9, 'description': '다음으로 핏물을 제거한 갈비를 흐르는 물에 깨끗히 씻은 후 월계수잎 5~6장, 통마늘 4개, 통후추 5~6알을 넣고 5분정도 삶아 주세요.', 'image_url': 'https://recipe1.ezmember.co.kr/cache/recipe/2016/06/16/521ebd5b848cf2afca9fc0ba74d747e61.jpg'}, {'step_number': 10, 'description': '거품이 정말 많이 올라오죠??? 이과정을 거치면 좀 더 깔끔하게 찜을 완성시킬 수 있답니다.', 'image_url': 'https://recipe1.ezmember.co.kr/cache/recipe/2016/06/16/3a1ae4ceb3ba0536f9f42c098d1896331.jpg'}, {'step_number': 11, 'description': '5분정도 삶은 갈비는 물에 한번 헹궈서 볼에 넣어 주신뒤 양념을 골고루 부어 주세요. 시간적 여유가 있으시다면 몇시간 재우시는것을 추천드려요.', 'image_url': 'https://recipe1.ezmember.co.kr/cache/recipe/2016/06/16/26578a06ca648151f93f1cbc1f45ea2d1.jpg'}, {'step_number': 12, 'description': '양념에 재운 갈비를 넣고 갈비가 잠길정도로 물을 부어 주세요.', 'image_url': 'https://recipe1.ezmember.co.kr/cache/recipe/2016/06/16/34d3c22349a262848ce096795242a3771.jpg'}, {'step_number': 13, 'description': '약 20분정도 센불로 팔팔 끓이다가 중약불로 낮추고 졸여 주시면 되는데 생각보다 시간이 오래 걸리더라구요. 저는 약 1시간정도 걸린듯 해요.', 'image_url': 'https://recipe1.ezmember.co.kr/cache/recipe/2016/06/16/c2db8ad3aaea20e088d701d60a9d6a2c1.jpg'}, {'step_number': 14, 'description': '중간중간 뚜껑을 열어서 양념이 고루 베일 수 있도록 뒤집어 가면서 졸여 주세요.', 'image_url': 'https://recipe1.ezmember.co.kr/cache/recipe/2016/06/16/c7d3d85a2542969e3b129fd2d3fb11f41.jpg'}, {'step_number': 15, 'description': '국물이 자작하게 남았을때 고소함을 더해줄 참기름 1스푼을 넣어 주면 완성', 'image_url': 'https://recipe1.ezmember.co.kr/cache/recipe/2016/06/16/754a0e6711d2d0e20fcf6be75f7108401.jpg'}, {'step_number': 16, 'description': '보통 돼지갈비찜에는 밤이나 대추 감자등 야채를 넣는데 전 등갈비찜은 깔끔하게 갈비만 넣고 만드는게 좋더라구요. 황금레시피로 만든 짭조름하면서도 달달한 내사랑 갈비!!! 갈비는 뭐니뭐니해도 손으로 잡고 뜯는 맛이 최고죠~손에 묻은 양념 쪽쪽 빨아가면서 말이죠. 갈비를 한번 데쳐내고 조리해서 그런지 훨씬더 국물이 깔끔하고 푹 조려서 그런지 살이 정말 부드러워요. 남은 국물에 밥비벼서 따닥따닥 소리나게 볶은뒤 김가루 솔솔 뿌려서 먹으면 그게 또 별미!!! 씹고 뜯고 맛보고 즐기는 재미가 있는 등갈비찜!!! 황금레시피로 맛깔나게 만들어 보세요.', 'image_url': 'https://recipe1.ezmember.co.kr/cache/recipe/2016/06/16/562b4a12012c6937f6542a4bec04727d1.jpg'}]"
