index,종류별,상황별,재료별,방법별,글 제목,레시피이름,레시피이미지,조회수,조리시간,난이도,인분,재료,소개글,조리순서
56166,디저트,간식,소고기,굽기,육즙팡팡! 겉바속촉! 미트파이,미트파이,https://recipe1.ezmember.co.kr/cache/recipe/2020/04/09/461c001bbd12cc2623387ad7ca4c59a21.png,"12,670",30분 이내,초급,2인분,"[('소고기 다짐육', '150g'), ('만두피', '10장'), ('양파', '1/4개'), ('피망', '1/4개'), ('토마토소스', '7큰술'), ('올리브오일', '1큰술'), ('식용유', '2큰술')]","겉은 바삭, 속은 촉촉, 육즙은 팡팡! 
만두피와 건강한 호주청정우를 활용해서
이제 누구나 집에서도 손쉽게 소고기 미트파이 만들어봐요.
한입에 쏙 들어가니까 간식으로도, 홈파티 핑거푸드으로도 안성맞춤!","[{'step_number': 1, 'description': '만두피에 식용유를 골고루 발라주세요.', 'image_url': 'https://recipe1.ezmember.co.kr/cache/recipe/2020/04/09/457dd8f0c30e86ba89bbff3407398b861.jpg'}, {'step_number': 2, 'description': '머핀틀에 만두피를 넣고 모양을 만든 후 180도 오븐에서 10분간 구워주세요.오븐 , 머핀틀오븐 대신 에어프라이어를 활용해도 좋아요.', 'image_url': 'https://recipe1.ezmember.co.kr/cache/recipe/2020/04/09/977e7d1f0b3c9a13e270edfbf9f7bf581.jpg'}, {'step_number': 3, 'description': '양파는 채썬 후 굵게 다져주고 피망도 비슷한 크기로 손질해주세요.피망 손질법 레시피', 'image_url': 'https://recipe1.ezmember.co.kr/cache/recipe/2020/04/09/1be58525de13aafc333740f798e116aa1.jpg'}, {'step_number': 4, 'description': '예열된 팬에 올리브유를 두른 후 손질한 양파를 넣고 볶아주세요. 단맛이 나오도록 충분히 볶아주세요.팬', 'image_url': 'https://recipe1.ezmember.co.kr/cache/recipe/2020/04/09/43e7f2e4190b258c3fb7faa10931f0131.jpg'}, {'step_number': 5, 'description': '양파가 투명해지면 소고기 다짐육을 넣어주세요.\n뭉치지 않도록 젓가락으로 저어가며 볶아주세요.젓가락', 'image_url': 'https://recipe1.ezmember.co.kr/cache/recipe/2020/04/09/4d20cb783224b8a81dbde569140271471.jpg'}, {'step_number': 6, 'description': '소고기가 알맞게 익으면 피망을 넣어주세요.', 'image_url': 'https://recipe1.ezmember.co.kr/cache/recipe/2020/04/09/7882b0dfcd9eed8f3913a4a26b72d4171.jpg'}, {'step_number': 7, 'description': '볶은 재료에 토마토소스를 넣고 소스가 자작해지도록 끓여주세요. 불을 끄고 한김 식혀주세요.', 'image_url': 'https://recipe1.ezmember.co.kr/cache/recipe/2020/04/09/34f7bd2979921b4013ffe2c37aaedc971.jpg'}, {'step_number': 8, 'description': '구운 만두피에 볶은 고기를 채워주세요.', 'image_url': 'https://recipe1.ezmember.co.kr/cache/recipe/2020/04/09/a71a4c6ce7c00ffeefd99296a3e436331.jpg'}, {'step_number': 9, 'description': '겉바속촉 만두피 미트파이 완성~!만두피 볼을 만들기 어려울 경우 담백한 크래커에 올려 먹어도 좋아요.', 'image_url': 'https://recipe1.ezmember.co.kr/cache/recipe/2020/04/09/dcca564387556b72c059e221d923f8d71.jpg'}]"
56167,디저트,간식,소고기,굽기,쇠고기안심 꼬치구이,쇠고기안심꼬치구이,https://recipe1.ezmember.co.kr/cache/recipe/2018/05/23/ace5102ca194677938c8d334b83c85881.jpg,"3,056",60분 이내,아무나,2인분,"[('꿀', '1큰술'), ('화이트 와인', '3큰술'), ('대파', '1/2개'), ('설탕', '1작은술'), ('참기름', '약간'), ('후추', '약간'), ('꿀', '1큰술'), ('화이트 와인', '3큰술'), ('대파', '1/2개'), ('설탕', '1작은술'), ('참기름', '약간'), ('후추', '약간'), ('쇠고기 안심', '300g'), ('양송이', '2개'), ('빨간 파프리카', '1/2개'), ('노란 파프리카', '1/2개'), ('초록 파프리카', '1/2개'), ('배즙', '1.5컵'), ('양파즙', '2큰술'), ('간장', '4큰술'), ('통깨', '1큰술'), ('미림', '2큰술'), ('다진 마늘', '1큰술'), ('꿀', '1큰술'), ('화이트 와인', '3큰술'), ('대파', '1/2개'), ('설탕', '1작은술'), ('참기름', '약간'), ('후추', '약간')]","아빠 안주에도, 아이들 간식에도 OK!
영양만점 우리집 먹거리~","[{'step_number': 1, 'description': '안심은 먹기 좋은 크기로 잘라 핏물을 키친타올로 살짝 제거하고\n양송이버섯은 사등분, 피망은 양송이버섯과 비슷한 크기로 자른다.', 'image_url': 'https://recipe1.ezmember.co.kr/cache/recipe/2018/05/23/94f7a1c4713331547ce84a2e0313eb771.jpg'}, {'step_number': 2, 'description': '대파를 어슷썬 후 ❶의 재료와 재움장 재료를 함께 섞는다.', 'image_url': 'https://recipe1.ezmember.co.kr/cache/recipe/2018/05/23/1e2faf9dd03b947b61cf776706c4a79c1.jpg'}, {'step_number': 3, 'description': '❷의 재료를 냉장고에서 하룻밤 재운다.', 'image_url': 'https://recipe1.ezmember.co.kr/cache/recipe/2018/05/23/cf9e33468dadacfaa6d26e7f322c4a311.jpg'}, {'step_number': 4, 'description': '굽기 직전에 재움장에 참기름을 넣고\n고기, 버섯, 파프리카 순으로 석쇠에 올려 앞, 뒤로 살짝 굽는다.', 'image_url': 'https://recipe1.ezmember.co.kr/cache/recipe/2018/05/23/8e8c4946bae66d0c5a9f745889fe72941.jpg'}, {'step_number': 5, 'description': '살짝 구워진 고기를 꼬치에 끼워 다시 한 번 구워준다.', 'image_url': 'https://recipe1.ezmember.co.kr/cache/recipe/2018/05/23/63d01c444cef90d4c623c21ac9ba45861.jpg'}]"
56168,디저트,간식,소고기,굽기,불고기 퀘사디아 또띠아로 굽기,불고기퀘사디아,https://recipe1.ezmember.co.kr/cache/recipe/2020/03/04/99f6a749c1d225a2684d8d876102d84a1.jpg,"2,088",30분 이내,초급,2인분,"[('또띠아', '2장'), ('양념불고기', '1인분'), ('피자소스', '3T'), ('파프리카 노랑', '1/4개'), ('크래미', '2개'), ('모짜렐라', '50g')]",불고기를 해먹고 어정쩡하게 남은 양이 있어서 불고기 퀘사디아를 에어프라이어 (에프) 구웠어요. 후라이팬에 구워도 되지만 에프로 쉽고 빠르게 만들었답니다.,"[{'step_number': 1, 'description': '양념 해 놓은 불고기입니다. 낮에 아이랑 구워 먹고 저녁에 짝꿍이 해주고 1인분 정도가 남았기에 후라이팬에 구워서 익혔습니다.', 'image_url': 'https://recipe1.ezmember.co.kr/cache/recipe/2020/03/06/b6de1b8ef505b72c9b2ab492be44df281.jpg'}, {'step_number': 2, 'description': '또띠아를 놓고 위에 피자소스를 펴 발랐어요. 2T만 넣어도 될 거 같은데 피자소스가 수제라서 어서 먹어치워야 하기에 넉넉하게 3T를 넣었더니 양이 좀 많네요.', 'image_url': 'https://recipe1.ezmember.co.kr/cache/recipe/2020/03/06/d47a3633ad824f10ac6f3ddd4881e9481.jpg'}, {'step_number': 3, 'description': '부재료를 넣어야 하는데 냉장고에 넣을 것이 별로 없네요. 늘 있던 비엔나소시지도 없고 버섯도 없고.... 크래미와 파프리카 노란색만 남아있어서 두개만 넣었어요.', 'image_url': 'https://recipe1.ezmember.co.kr/cache/recipe/2020/03/06/847998bab3ffe8427fecef04749d51bd1.jpg'}, {'step_number': 4, 'description': '피자소스 위에 불고기를 펼치고 파프리카와 크래미도 올려주고 모짜렐라 치즈를 올렸어요.', 'image_url': 'https://recipe1.ezmember.co.kr/cache/recipe/2020/03/06/f0959e2e8ea8025f96d2fb9311bae2571.jpg'}, {'step_number': 5, 'description': '또띠아 한 장을 위에 덮어줬어요. 전에는 후라이팬에 앞뒤로 뒤집으면서 구웠지만 지금은 에프가 있잖아요~', 'image_url': 'https://recipe1.ezmember.co.kr/cache/recipe/2020/03/06/7a9c3b2412b8cc8b1693cd12399b5d391.jpg'}, {'step_number': 6, 'description': '180도에 7분을 구웠어요. 불고기가 다 익은 상태이니 모짜렐라 치즈만 녹으면 되니 5~7분이면 될 거 같아요. 에어프라이어', 'image_url': 'https://recipe1.ezmember.co.kr/cache/recipe/2020/03/06/ef8b6c41c2a03ce49e4817a46bffa0e41.jpg'}, {'step_number': 7, 'description': '이쁘게 자르고 싶었는데 에프에 구워서 위에 또띠아가 바삭해서 그런지 부서지네요. ^^;; 먹기 좋은 크기로 잘라서 드시면 됩니다. 불고기 퀘사디아 완성입니다. 너무 쉽고 간단하죠?', 'image_url': 'https://recipe1.ezmember.co.kr/cache/recipe/2020/03/06/a463aadd2994ded442e44a0eec405f121.jpg'}]"
56169,디저트,간식,소고기,굽기,육우떡갈비 꼬치,떡갈비꼬치,https://recipe1.ezmember.co.kr/cache/recipe/2015/09/03/0e2b1189b0e306982b000e5b750f0060.jpg,"2,110",30분 이내,초급,3인분,"[('육우 양지', '300g'), ('떡볶이떡                                                                                이나가래떡', ''), ('간장', '1.5큰술'), ('설탕', '1큰술'), ('꿀', '1큰술'), ('다진 마늘', '1작은술'), ('참기름', '1작은술'), ('후추', '약간'), ('전분', '1작은술'), ('허니 머스타드 소스', '적당량'), ('올리브유', '적당량')]",요즘 떡갈비가 인기기 있는거 같아요. 남들 하는 비슷한 떡갈비에 꽂이 하나 꽂아 주니 색다르네요.,"[{'step_number': 1, 'description': '육우는 칼로 곱게 다져 주세요. 정육점에서 갈아오는것도 편리하지만 떡갈비는 칼로 직접 다지는 것이 식감도 좋을뿐 아니라 공기층이 생겨 잘 익어요.', 'image_url': 'https://recipe1.ezmember.co.kr/cache/recipe/2015/09/04/cd31873291b8e481a8a2b0a27c56c4621.jpg'}, {'step_number': 2, 'description': '다진 고기에 양념 넣고 조물 조물 주물어 양념이 충분히 스미게 합니다.', 'image_url': 'https://recipe1.ezmember.co.kr/cache/recipe/2015/09/04/16c79d513e26b8cb2346d700d87482bc1.jpg'}, {'step_number': 3, 'description': '종이호일을 떡크기와 비슷한 폭으로 잘라 깔고 다진 고기를 넓게 편후 떡을 올려주세요.', 'image_url': 'https://recipe1.ezmember.co.kr/cache/recipe/2015/09/04/a43799700dd84eda57a2894c478011ac1.jpg'}, {'step_number': 4, 'description': '호일을 이용해 김밥말듯이 꼭꼭 말아 주세요.', 'image_url': 'https://recipe1.ezmember.co.kr/cache/recipe/2015/09/04/1ec61d3daa7a1362dea686277b6d68381.jpg'}, {'step_number': 5, 'description': '오일을 두르고 약불에서 은근하게 익혀 줍니다.', 'image_url': 'https://recipe1.ezmember.co.kr/cache/recipe/2015/09/04/9a49b95c1f93e4c51191964b951ebdd21.jpg'}, {'step_number': 6, 'description': '알맞는 크기로 잘라 꼬지를 끼운뒤 머스타드 소스를 뿌려줍니다.', 'image_url': 'https://recipe1.ezmember.co.kr/cache/recipe/2015/09/04/42396b1b244288559c278e2c0ac175881.jpg'}]"
56170,디저트,간식,소고기,굽기,소 불고기 퀘사디아 만들기 남은 소불고기 또띠아 요리 아이간식추천,소불고기또띠아,https://recipe1.ezmember.co.kr/cache/recipe/2024/06/05/761b9a6858f1695955c3f78e43dd0c991.jpg,282,10분 이내,아무나,1인분,"[('소불고기                                                                                취향껏 준비', '50~100g'), ('또띠아', '1장'), ('모짜렐라치즈', '소량'), ('스위트콘', '소량'), ('양파', '소량'), ('곁들일 과일', '조금'), ('마요네즈', '1T'), ('스리라차 소스', '1T')]","요즘 마트에 가면 볶아서 바로 먹을수 있는 소불고기가 가격도 저렴하면서 1+1 행사도 많이 하는것 같아요.시판제품 소불고기가 남았을때 간단한 한끼 식사나 아이들 간식용으로 먹기 좋은 소 불고기 퀘사디아를 만들어 봤어요.

​","[{'step_number': 1, 'description': '소불고기를 바싹 볶아 주세요. *볶아 놓은 소 불고기가 있다면 생략소불고기 50g~100g (취향껏 준비)프라이팬 , 요리스푼고기많이 준비했다면 또띠아 1장더 준비해주세요.', 'image_url': 'https://recipe1.ezmember.co.kr/cache/recipe/2024/06/05/a049ebb4ff8343f07d4378896514c8b41.jpg'}, {'step_number': 2, 'description': '마른팬에 또띠아를 올리고 약불로 구워준후 뒤집어 주고 마요네즈1T, 스리라차1T를 또띠아에 발라주세요.마요네즈1T, 스리라차1T,또띠아 1장프라이팬약불사용소스는 시판용 토마토 스파게티 소스, 크림 소스등 취향껏 선택해주세요.', 'image_url': 'https://recipe1.ezmember.co.kr/cache/recipe/2024/06/05/105c846437d9cb34228de08921953a2a1.jpg'}, {'step_number': 3, 'description': '(양파는 최대한 잘게 잘라 준비해주세요) 소스의 반대 편에 소불고기 -스위트콘 - 잘게 자른 생양파 - 모짜렐라 치즈를 올려주세요. 양파를 잘게 잘라 올리면 먹었을때 식감이 좋아서 저는 생으로 올려요 취향껏 소불고기랑 살짝 볶아서 준비 해도 좋아요.모짜렐라 치즈 ,스위트콘, 양파 소량도마 , 조리용나이프약불사용또띠아에 재료를 올릴때 바깥쪽 말고 안쪽으로 재료를 충분히 넣어 주세요.\n\n재료를 안쪽으로 넣어야 나중에 반으로 접을때나, 먹었을때도 많이 흘러 내리지 않아\n\n먹기 편해요.\n\n\u200b양파 손질법', 'image_url': 'https://recipe1.ezmember.co.kr/cache/recipe/2024/06/05/403f45095765b48867964989f20af9b01.jpg'}, {'step_number': 4, 'description': '모든 재료를 넣은 또띠아를 반으로 접어 마무리 해주세요. 취향껏 과일소량과 함께 곁들여 먹기 좋아요.뒤집개 , 접시', 'image_url': 'https://recipe1.ezmember.co.kr/cache/recipe/2024/06/05/7f5086b9bf22a9f56207307a2e0e7f851.jpg'}]"
56171,디저트,간식,소고기,굽기,"간식,브런치로 최고..불고기케사디야",불고기케사디야,https://recipe1.ezmember.co.kr/cache/recipe/2019/07/03/4b1516ad8b992f734f7a5cef64e65e581.jpg,"1,657",30분 이내,아무나,4인분,"[('다진소고기', '1컵'), ('양파', '1/2개'), ('또띠아', '4장'), ('모짜렐라치즈', '2컵'), ('간장', '2큰술'), ('물엿', '1큰술'), ('후추', '조금')]","바삭한 또띠아사이에 단짠 불고기, 고소한 치즈는 꿀조합이죠?^^","[{'step_number': 1, 'description': '다진 소고기에 간장2큰술,물엿1큰술,후추조금 넣고 밑간해요.', 'image_url': 'https://recipe1.ezmember.co.kr/cache/recipe/2019/07/03/5ee67449e2900327f4448793a76c12541.jpg'}, {'step_number': 2, 'description': '양파 반개도 다져서 준비하시구요', 'image_url': 'https://recipe1.ezmember.co.kr/cache/recipe/2019/07/03/2466b4556cb83e833417fdb701635ad51.jpg'}, {'step_number': 3, 'description': '팬에 소고기와 양파를 넣고 볶아요.', 'image_url': 'https://recipe1.ezmember.co.kr/cache/recipe/2019/07/03/3bbe4d0323b31085723fac025e4c4fc51.jpg'}, {'step_number': 4, 'description': '수분이 거의 없을정도로 고슬하게 볶아야해요..안그러면 케사디야만들 때 수분이 주욱~~나와서 눅눅해져요.', 'image_url': 'https://recipe1.ezmember.co.kr/cache/recipe/2019/07/03/694b8d542357be891402ab57789d1cc11.jpg'}, {'step_number': 5, 'description': '팬에 또띠아 한장 놓고 치즈1/2컵을 고루 얹어요..더 넣으셔도 덜 넣으셔도 되요..취향껏~~^^', 'image_url': 'https://recipe1.ezmember.co.kr/cache/recipe/2019/07/03/e097c82c78be86166432aae01ead4a661.jpg'}, {'step_number': 6, 'description': '볶은 소고기를 반쪽에만 올려요', 'image_url': 'https://recipe1.ezmember.co.kr/cache/recipe/2019/07/03/eb9b003148bb899de6327d30e0cf20491.jpg'}, {'step_number': 7, 'description': '꼭 약불로 또띠아를 구우면서 치즈도 녹여요. 안그럼 치즈 녹기전에 또띠아가 타요.ㅜㅜ', 'image_url': 'https://recipe1.ezmember.co.kr/cache/recipe/2019/07/03/89cd2fc3d2dea67dea33e6045b69f1641.jpg'}, {'step_number': 8, 'description': '치즈만 있는 쪽을 들어 반 접어요', 'image_url': 'https://recipe1.ezmember.co.kr/cache/recipe/2019/07/03/843789e698ab70b057f843b4c0a3c44d1.jpg'}, {'step_number': 9, 'description': '먹기 좋게3등분해요.', 'image_url': 'https://recipe1.ezmember.co.kr/cache/recipe/2019/07/03/bad0b27ee64c09786c4f11d3768a0ab01.jpg'}]"
