index,종류별,상황별,재료별,방법별,글 제목,레시피이름,레시피이미지,조회수,조리시간,난이도,인분,재료,소개글,조리순서
46750,국/탕,일상,해물류,끓이기,얼큰한 오징어 새우 무 국,오징어새우무국,https://recipe1.ezmember.co.kr/cache/recipe/2021/06/03/f7c01b4ec9c48e0157dc3fb3ea173f321.jpg,"2,151",30분 이내,아무나,2인분,"[('오징어', '1마리'), ('냉동 새우', '5-6마리'), ('다진 마늘', '1큰술'), ('참기름', '1큰술'), ('포도씨유', '1/2큰술'), ('물', '1L'), ('국 간장', '1큰술'), ('액젓', '1작은술'), ('굴 소스', '1큰술'), ('소금', '1/2작은술'), ('파', '1대')]","보통은 아들과 둘이 서로의 끼니는 각자 알아서 만들어 먹거나 챙겨 먹는다．

방학이 되어 딸랭이가 돌아오고 나니 자꾸 무얼 만들어야 한다．이 아이는 나이만 먹었지 아무것도 할 줄 모른다. 숟가락 통만 들어 있는 유치원 가방까지 아줌마가 들어 주며 우쭈쭈 키운 탓에 이 아이는 하이스쿨에 들어간 후에야 겨우 라면을 끓일 줄 알게 되었고 유니벌시티에 들어 간 후에야 계란 후라이를 할 수 있게 되었다. 그것도 라면의 경우 라면물을 재는 대접이 앞에 있다는 가정하에 말이다．

​

​

제 오빠와는 딴판 다른 식성을 가진 이 아이는 한식을 좋아한다．그래서 국을 자꾸 끓여 주어야 한다．

​

오늘 이 아이가 원하는 국은 오징어 무국！남보다 적게 갖고 있어도 모성은 모성 이라며 나는 한국 마트로 달려가 얼른 무 ２개를 사 들고 돌아 온다．

​","[{'step_number': 1, 'description': '참기름１큰술과 포도씨 유를 살짝 달궈', 'image_url': 'https://recipe1.ezmember.co.kr/cache/recipe/2021/06/03/93f3170d4390389de5accc5a49ab53531.jpg'}, {'step_number': 2, 'description': '다진 마늘, 고추가루를 넣고', 'image_url': 'https://recipe1.ezmember.co.kr/cache/recipe/2021/06/03/33b430e9488b62add7cce163c1a9c86c1.jpg'}, {'step_number': 3, 'description': '볶아 고추기름을 내 준다.', 'image_url': 'https://recipe1.ezmember.co.kr/cache/recipe/2021/06/03/3bb9cd26cb46f3b47fa8491814737fe31.jpg'}, {'step_number': 4, 'description': '무를 넣고 볶아 준다.', 'image_url': 'https://recipe1.ezmember.co.kr/cache/recipe/2021/06/03/cd945d2155a6b528cdbcfe41fe8b16621.jpg'}, {'step_number': 5, 'description': '분량의 물을 넣고 끓여 준다.', 'image_url': 'https://recipe1.ezmember.co.kr/cache/recipe/2021/06/03/d6ea31141d735ea3683d4ba3077e78101.jpg'}, {'step_number': 6, 'description': '분량의 양념을 넣어 준다.', 'image_url': 'https://recipe1.ezmember.co.kr/cache/recipe/2021/06/03/9e9a6684f9fb1231311c580af0797e9c1.jpg'}, {'step_number': 7, 'description': '오징어와 새우를 넣고 끓여 준다.', 'image_url': 'https://recipe1.ezmember.co.kr/cache/recipe/2021/06/03/8220f500621f6835100594d9274378771.jpg'}, {'step_number': 8, 'description': '파를 넣어 마무리 한다.', 'image_url': 'https://recipe1.ezmember.co.kr/cache/recipe/2021/06/03/f4942a2d715e442f41b1b3f6d04063e11.jpg'}]"
46751,국/탕,일상,해물류,끓이기,오징어 무국/시원하고 맛있게 끓이기,오징어무국,https://recipe1.ezmember.co.kr/cache/recipe/2016/11/04/5f487f8f83ec316166a18968693a6b611.jpg,"19,652",30분 이내,아무나,4인분,"[('무', '1국대접'), ('오징어', '1~2마리'), ('감자                                                                                생략가능', '2개'), ('양파', '1/4개'), ('청양고추', '1개'), ('홍고추', '1/2개'), ('쪽파                                                                                대파 1/2대', '5뿌리'), ('다진마늘', '1큰술'), ('다진생강', '약간'), ('보리새우', '2큰술'), ('고춧가루', '2큰술'), ('국간장', '2큰술'), ('멸치액젓', '2큰술'), ('참치액젓', '1큰술'), ('고추장', '1큰술'), ('소금', '약간'), ('황태육수', '4컵'), ('쌀뜨물', '3컵')]","쌀쌀한 날씨에는 뜨끈한 국물요리가 최고지요~
가을무는 인삼보다 좋다고 하네요 채소들은 대부분 텃밭에서 수확해서 먹는데요 김장 무가 어찌나 크고 맛있던지요 시원하고 얼큰한 뭇국 끓여드세요","[{'step_number': 1, 'description': '무는 껍질을 벗기고 나박나박 썰어줍니다', 'image_url': 'https://recipe1.ezmember.co.kr/cache/recipe/2016/11/04/cce0a806559fe5516bce29092bd3cf841.jpg'}, {'step_number': 2, 'description': '감자는 도톰하게 썰고 양파 쪽파 고추 송송 썰고 다진마늘 다진 생강도 준비합니다', 'image_url': 'https://recipe1.ezmember.co.kr/cache/recipe/2016/11/04/d188c8c96d38a8802f37fc581090966e1.jpg'}, {'step_number': 3, 'description': '오징어는 껍질을 벗기고 먹기좋은 크기로 썰어준비합니다', 'image_url': 'https://recipe1.ezmember.co.kr/cache/recipe/2016/11/04/c336874558f9091aba6fda88da8886081.jpg'}, {'step_number': 4, 'description': '끓이기-냄비에 무와 감자 보리새우를 넣고 육수 부어 끓여주세요', 'image_url': 'https://recipe1.ezmember.co.kr/cache/recipe/2016/11/04/62624710ec4499b69d82b047f5977ae21.jpg'}, {'step_number': 5, 'description': '육수에 분량의 (고추장)을 뺀 양념을 넣고 약5분정도 중불에 끓여주세요', 'image_url': 'https://recipe1.ezmember.co.kr/cache/recipe/2016/11/04/6dbcf0cffba1f06df9b33c4a0bae3a7f1.jpg'}, {'step_number': 6, 'description': '5분간 끓인 육수에 고추장과 오징어를 넣고 조금 더 끓였어요', 'image_url': 'https://recipe1.ezmember.co.kr/cache/recipe/2016/11/04/3356ca045c493935059ef521a8df60661.jpg'}, {'step_number': 7, 'description': '마지막에 고추와 쪽파를 넣고 한번 끓이고 불을 끕니다', 'image_url': 'https://recipe1.ezmember.co.kr/cache/recipe/2016/11/04/4280bf7c020b96678640e57d6bbf05ba1.jpg'}]"
46752,국/탕,일상,해물류,끓이기,가장 기초가 되는 한식 요리 오징어뭇국,오징어무국,https://recipe1.ezmember.co.kr/cache/recipe/2016/09/26/891daf03bc9c637fef67dee2c390b2c91.png,"67,128",30분 이내,아무나,4인분,"[('오징어', '2마리'), ('무', '150g'), ('두부                                                                                150g', '1/2모'), ('양파', '2/3개'), ('대파', '10cm'), ('청고추', '1개'), ('홍고추', '1개'), ('국물용 멸치', '10마리'), ('다시마                                                                                5x5cm', '1장'), ('쌀뜨물                                                                                1L', '5C'), ('고춧가루', '1.5T'), ('된장', '1.5T'), ('국간장', '1/2T'), ('다진 마늘', '1T')]","바다향기가 물씬!!
시원한 오징어뭇국♥

세상의 모든 레시피 만개의레시피","[{'step_number': 1, 'description': '냄비에 육수 재료를 넣고 중불에서 15분간 끓인다.[육수재료] 국물용 멸치 10마리, 다시마(5x5cm) 1장, 쌀뜨물 5C(1L)냄비', 'image_url': 'https://recipe1.ezmember.co.kr/cache/recipe/2016/09/26/b756c6b7e58ddcb0f85e34d7db1053ac1.png'}, {'step_number': 2, 'description': '육수 건더기를 건지고 채 썬 무를 넣고 중불로 끓인다.무 150g중불', 'image_url': 'https://recipe1.ezmember.co.kr/cache/recipe/2016/09/26/ae5f4cd6ea362cf8fed86897be161e9c1.png'}, {'step_number': 3, 'description': '무가 투명해지기 시작하면 된장을 풀고 오징어, 양파, 고춧가루를 넣고 끓인다.오징어 2마리, 양파 2/3개, 고춧가루 1+1/2T, 된장 1+1/2T', 'image_url': 'https://recipe1.ezmember.co.kr/cache/recipe/2016/09/26/365efc45f9c27030cefd53b3eb7121a61.png'}, {'step_number': 4, 'description': '끓어오르면 다진 마늘을 넣고 두부와 대파, 고추를 얹어 한소끔 더 끓인다. 다진 마늘 1T, 두부 1/2모(150g), 대파 10cm, 청고추 1개, 홍고추 1개', 'image_url': 'https://recipe1.ezmember.co.kr/cache/recipe/2016/09/26/04e0b17edc98eb2860c0abbe20b733341.png'}, {'step_number': 5, 'description': '부족한 간을 국간장으로 맞춰 불을 끈다.국간장 1/2T', 'image_url': 'https://recipe1.ezmember.co.kr/cache/recipe/2016/09/26/9d014b2a816d2a107ea29f12f98bbc891.png'}]"
46753,국/탕,일상,해물류,끓이기,시원한 오징어 감자국,오징어감자국,https://recipe1.ezmember.co.kr/cache/recipe/2015/04/09/2a2615fe5cdbb75f7fd03e066ba3f6fa1.jpg,"50,081",30분 이내,초급,4인분,"[('오징어', '1마리'), ('감자', '1개'), ('풋고추', '1개'), ('홍고추', '1개'), ('애호박', '1/4개'), ('대파', '1/2대'), ('멸치다시마국물', '5컵'), ('된장', '1큰술'), ('다진마늘', '1큰술'), ('국간장', '1/2큰술'), ('고춧가루', '1작은술'), ('소금', '약간')]","가격도 저렴하고 만만한 찬거리인 오징어와 감자 애호박을 넣어, 시원한 오징어 감자국을 끓여보세요~","[{'step_number': 1, 'description': '멸치 다시마 육수를 만들어 주세요. 전 집에 남아 있는 무도 넣고 넉넉하게 만들어 냉동보관했다가 필요시 꺼내 사용합니다.', 'image_url': 'https://recipe1.ezmember.co.kr/cache/recipe/2015/04/09/2cbea6d844df7303a84f0fa8a24db2871.jpg'}, {'step_number': 2, 'description': '손질한 오징어, 애호박, 감자, 풋고추, 홍고추, 대파, 마늘을 준비해 주세요.', 'image_url': 'https://recipe1.ezmember.co.kr/cache/recipe/2015/04/09/8b500708704fde57a46df016b0450e7d1.jpg'}, {'step_number': 3, 'description': '오징어는 껍질을 벗긴 후 몸통 안쪽에서 사선으로 촘촘하게 칼집을 넣어 한 입 크기로 잘라 주세요. 예쁘게 하려고 칼집을 넣은 것인데.. 그냥 자르셔도 됩니다.^^', 'image_url': 'https://recipe1.ezmember.co.kr/cache/recipe/2015/04/09/34d090c8efb3ca22f9ba078ed7a36fe81.jpg'}, {'step_number': 4, 'description': '애호박과 감자는 먹기 좋은 크기로 잘라 주세요. 홍고추, 풋고추, 대파는 어슷썰기 해 주세요.', 'image_url': 'https://recipe1.ezmember.co.kr/cache/recipe/2015/04/09/123eea3384a11e98e4231de75d6e91bc1.jpg'}, {'step_number': 5, 'description': '멸치 다시마 육수에 고춧가루와 된장을 넣고 끓여 주세요.', 'image_url': 'https://recipe1.ezmember.co.kr/cache/recipe/2015/04/09/437b8e3b55bfb5b9f1ceec934cb293451.jpg'}, {'step_number': 6, 'description': '감자를 넣어 주세요.', 'image_url': 'https://recipe1.ezmember.co.kr/cache/recipe/2015/04/09/8240c40226323247001b0a4723396e321.jpg'}, {'step_number': 7, 'description': '감자가 반쯤 익었을 때 애호박과 오징어를 넣어 주세요.', 'image_url': 'https://recipe1.ezmember.co.kr/cache/recipe/2015/04/09/28533982f2c1c1d49d44785201806f291.jpg'}, {'step_number': 8, 'description': '끓어 오르면 대파와 고추를 넣고 다진 마늘과 국간장, 소금으로 간을 맞춰 주세요.', 'image_url': 'https://recipe1.ezmember.co.kr/cache/recipe/2015/04/09/5327980b3713632498109280305b08221.jpg'}]"
46754,국/탕,일상,해물류,끓이기,오징어무국 레시피 맑은 오징어무국 만드는법 오징어 국끓이기,오징어무국,https://recipe1.ezmember.co.kr/cache/recipe/2023/12/01/c8745a991d221825d5f0e2743db470eb1.jpg,"2,448",30분 이내,아무나,4인분,"[('오징어', '1마리'), ('무', '1/4토막'), ('액젓', '2~3숟갈'), ('국간장', '1숟갈'), ('다진마늘', '1/2숟갈'), ('대파', '1대')]",간단하면서 쉽게 만들 수 있는 오징어 국끓이기입니다:),"[{'step_number': 1, 'description': '무는 먹기 좋은 크기로 썰어요. 숟가락에 떠서 한 입에 먹기 좋은 크기로 살짝 도톰하게 썰었어요. 무가 들어가면 국물 맛이 시원해지니 넉넉하게 넣었어요~ 도마 , 조리용나이프', 'image_url': 'https://recipe1.ezmember.co.kr/cache/recipe/2023/12/01/adb3876a74de2be39a45044a5f5458121.jpg'}, {'step_number': 2, 'description': '오징어 1마리도 먹기 좋게 썰어줍니다. 칼집을 넣어서 모양을 내도 좋구요, 그냥 썰어도 좋아요. 저는 몸통을 길게 4등분해서 잘라 주었어요.', 'image_url': 'https://recipe1.ezmember.co.kr/cache/recipe/2023/12/01/68ddfa81dbd55cccd5d965a7fac3eb861.jpg'}, {'step_number': 3, 'description': '냄비에 무를 모두 넣고 물을 부어줍니다. 물은 1.2리터 정도 넣었구요, 육수를 넣어도 좋지만 맹물을 넣어 끓여도 국물 맛이 잘 우러나서 맛있어요~ 무에 미리 액젓 1스푼 넣고 살짝 볶다가 물을 넣어도 좋아요.냄비', 'image_url': 'https://recipe1.ezmember.co.kr/cache/recipe/2023/12/01/a4d5db9bdf3324ac1ee2c193c3b1ecbd1.jpg'}, {'step_number': 4, 'description': '물이 끓고 무가 어느정도 익었다면 오징어를 넣어줍니다. 오징어를 너무 오래 끓이면 질겨질 수 있으니 무가 적당히 익었을 때 넣어요.', 'image_url': 'https://recipe1.ezmember.co.kr/cache/recipe/2023/12/01/935fac2bc21c705a5caabb0af45ee4d41.jpg'}, {'step_number': 5, 'description': '국간장 1큰술 정도 넣고, 액젓 2~3큰술 넣어서 간을 맞춰줍니다. 국간장을 너무 많이 넣으면 국물 색이 탁해지니 조금만 넣어서 감칠맛을 더해요:) 액젓 양은 간을 봐가며 조절해요~요리스푼', 'image_url': 'https://recipe1.ezmember.co.kr/cache/recipe/2023/12/01/bc539338e81dbbc5d8f1e97458ce458c1.jpg'}, {'step_number': 6, 'description': '다진마늘 1/2큰술, 대파 1대 썰어서 넣고 한소끔 끓여주면 끝! 맑은 오징어무국 완성이에요~', 'image_url': 'https://recipe1.ezmember.co.kr/cache/recipe/2023/12/01/09b6fc6418c53b53aac9a1a9c1a870741.jpg'}, {'step_number': 7, 'description': '무를 넉넉히 넣어서 국물 맛이 시원하구요, 오징어에서 맛있는 맛이 우러나 육수없이도 충분히 맛있어요. 간단하고 쉽게 끓이는 오징어무국 레시피, 맑은 오징어무국 끓이기로 맛있고 시원하게 만들어 보세요~^^', 'image_url': 'https://recipe1.ezmember.co.kr/cache/recipe/2023/12/01/2b7d78b79e33fa660c114ba47961fdee1.jpg'}]"
46755,국/탕,일상,해물류,끓이기,"광어 매운탕 : 3,000원대 광어 서더리로 만든 광어 매운탕",광어매운탕,https://recipe1.ezmember.co.kr/cache/recipe/2020/09/02/add3d7348af6b62de27875db2e18fc6a1.png,"39,776",60분 이내,아무나,3인분,"[('광어 서더리', '1팩'), ('대파', '1/2개'), ('청양고추', '2개'), ('무', '1/3개'), ('팽이버섯', '적당히'), ('깻잎', '3장'), ('쑥갓', '적당히'), ('물', '1.2L'), ('진간장', '3.5T'), ('멸치액젓', '5T'), ('다진마늘', '1T'), ('고춧가루', '3.5T'), ('소금', ''), ('후추', '1꼬집'), ('맛술', '1.5T')]",밖에서 비싸게 사먹는 것 보다 집에서 해먹는게 더 싼 광어 매운탕 : ),"[{'step_number': 1, 'description': '1) 광어 서더리를 한번 더 씻어주세요.\n완벽하게 다 씻겨져서 준비되어 있는게 아니기 때문에 한번 더 흐르는 물에 세세하게 씻어주시고 준비해주세요 : )생선 피가 들어가게 되면 쓰고 떫은 맛이 생겨버리기 때문에 최대한 피를 빼준다고 생각하시면 됩니다 !', 'image_url': 'https://recipe1.ezmember.co.kr/cache/recipe/2020/09/02/ed1b5c66aed00df4d238c8e7a4e7c9811.jpg'}, {'step_number': 2, 'description': '2) 매운탕 양념장을 준비해주세요.\n최대한 고춧가루가 양념을 먹을 수 있게 잘 저어주세요 !진간장3.5T, 멸치액젓5T, 고춧가루 3.5T, 다진마늘 1T, 소금, 후추 한꼬집, 맛술 1.5T멸치액젓을 넣으면 넣을수록 감칠맛이 살기 때문에 저는 많이 넣는 편 이예요 : )', 'image_url': 'https://recipe1.ezmember.co.kr/cache/recipe/2020/09/02/73569e9cdc29b767f3e378b14b8caf261.jpg'}, {'step_number': 3, 'description': '3) 매운탕에 들어간 재료를 손질해주세요.\n좋아하는 재료가 있다면 더 넣으셔도 되니까 원하시는 대로 대파와 깻잎은 어슷썰고, 청양고추는 씹힐때 맵지 않게끔 작게 잘라주시고, 나머지는 간단하게 반씩만 자르시면 될 것 같아요 : )대파 1/2개, 깻잎 3장 정도, 팽이 버섯 적당히, 쑥갓 적당히, 청양고추 2개저는 쑥갓이 있어야지 매운탕의 특유의 맛이 나기 때문에 되게 중요하다고 생각하고 있습니다 !', 'image_url': 'https://recipe1.ezmember.co.kr/cache/recipe/2020/09/02/243164c9d079dd5239653cce5e1734861.jpg'}, {'step_number': 4, 'description': '4) 무를 밑에 깐 후, 광어 서더리를 넣고 끓여주세요.\n무를 먹기 좋게 잘라 밑에 깔아주고, 그 위에 씻어놓은 광어 서더리와 물 1.2L 를 넣고 푹 끓여줍니다.무 1/3개, 광어 서더리 한팩, 물 1.2L강불~중불끓이면서 중간에 생기는 거품들을 제거 해주면서 푹 끓여주세요 : )', 'image_url': 'https://recipe1.ezmember.co.kr/cache/recipe/2020/09/02/6a742c782cc57032a210889dcf17bf481.jpg'}, {'step_number': 5, 'description': '5) 중간에 양념장을 풀어주고, 대파 넣고 끓여주세요.\n10분 정도 끓여주다가, 양념장을 넣어 풀어준 후 대파를 넣고 한번 더 끓여주세요.중불', 'image_url': 'https://recipe1.ezmember.co.kr/cache/recipe/2020/09/02/a46581c571228714c7017d40998e14401.jpg'}, {'step_number': 6, 'description': '6) 충분히 끓인 후, 고명 얹이고 마무리로 끓여주세요.\n또 10분 정도 끓여주다가, 마지막으로 푹 끓이기 전에 쑥갓, 팽이 버섯, 깻잎, 고추를 넣고 5~10분 정도 더 끓여주시면 끝 : )쑥갓 적당히, 팽이 버섯 적당히, 깻잎 3장 정도, 청양고추 2개중불', 'image_url': 'https://recipe1.ezmember.co.kr/cache/recipe/2020/09/02/c8d2685f441fe2c0f62876b4353baa461.jpg'}, {'step_number': 7, 'description': '너무 맛있었지만 가장 좋았던건 집에서 싸게 먹을 수 있다는 것, 밖에서 사먹는 거랑 다를 게 없었다는 것 ! 너무 맛있으니까 꼭 해드셔보세요 ♥', 'image_url': 'https://recipe1.ezmember.co.kr/cache/recipe/2020/09/02/e2014d437a544a70d91183b1f1faf3971.jpg'}]"
46756,국/탕,일상,해물류,끓이기,꽃게 된장국 얼큰해요,꽃게된장국,https://recipe1.ezmember.co.kr/cache/recipe/2015/06/16/387ef467a82d842741d947d8dc31ee601.jpg,"10,678",30분 이내,초급,3인분,"[('팽이버섯', '1봉지'), ('애호박', '1/2개'), ('두부', '1/2모'), ('꽃게 집게', '4개'), ('된장', '1t'), ('다진마늘', '1/2t'), ('고춧가루', '1/2t'), ('국간장', '1t')]","색다르게 꽃게를 넣어 건강에도 좋고 맛도 좋은 된장국
딱딱하고 먹기 힘든 간장게장 집게발을 이용해서 만들어요!","[{'step_number': 1, 'description': '먹기 좋게 두부와 야채를 썰어주고 \n꽃게 집게발 4개 준비하세요.', 'image_url': 'https://recipe1.ezmember.co.kr/cache/recipe/2015/06/16/28e479779a4f37dbe47db54b876b4e3d1.jpg'}, {'step_number': 2, 'description': '끓는 물에 된장 한큰술 넣어 주세요.\n저는 재래식 된장을 사용했어요^^', 'image_url': 'https://recipe1.ezmember.co.kr/cache/recipe/2015/06/16/b589c2426ce79b947df17f481a9612471.jpg'}, {'step_number': 3, 'description': '어느정도 된장이 풀어지면 약한 불로 줄인 후 꽃게 집게발 넣어서 끓여 주세요.', 'image_url': 'https://recipe1.ezmember.co.kr/cache/recipe/2015/06/16/d865f8e31177735c78634de5ef643d261.jpg'}, {'step_number': 4, 'description': '다진마늘 반 큰술 넣어주세요. 꽃게의 비린 맛을 잡아주고 국물 맛이 시원해지면서 깔끔진답니다.', 'image_url': 'https://recipe1.ezmember.co.kr/cache/recipe/2015/06/16/42226c6e3af12a0afef0e53d504cb2c61.jpg'}, {'step_number': 5, 'description': '양파를 넣고 고춧가루 1/3큰술 넣어주세요. 아이와 같이 드신다면 고춧가루는 생락 하셔도 된답니다.', 'image_url': 'https://recipe1.ezmember.co.kr/cache/recipe/2015/06/16/30d7c1051a77123d044d17b820fa6bc01.jpg'}, {'step_number': 6, 'description': '팽이버섯과 애호박도 넣어주고 보글보글~ 맛있는 된장국 냄새~ 거품은 안 걷어내야 더 깊은 맛 나는 거 아시죠?', 'image_url': 'https://recipe1.ezmember.co.kr/cache/recipe/2015/06/16/35e78e33f1658b842630eebd2aa9d5841.jpg'}, {'step_number': 7, 'description': '두부와 국간장 한큰술 넣고 5분정도 끓여주세요.', 'image_url': 'https://recipe1.ezmember.co.kr/cache/recipe/2015/06/16/78abd6f63dedcdf865782e57301a06481.jpg'}, {'step_number': 8, 'description': '맛있고 국물도 얼큰하면서 비주얼 좋은 시원한 꽃게 된장국 완성 되었습니다.', 'image_url': 'https://recipe1.ezmember.co.kr/cache/recipe/2015/06/16/41773962d5e3c11c5eb6541f5a42b6fb1.jpg'}]"
46757,국/탕,일상,해물류,끓이기,매콤한 황태콩나물국,황태콩나물국,https://recipe1.ezmember.co.kr/cache/recipe/2020/09/19/1cf78dd5cf11ce4ab4d44fb82aa60c3e1.jpg,"2,824",20분 이내,초급,5인분,"[('콩나물', '250g'), ('황태채', '1줌'), ('양파', '1/4개'), ('풋고추', '1개'), ('다진마늘', '1T'), ('새우젓', '1T'), ('멸치액젓', '2T'), ('고추가루', '1T')]","아침 저녁으로 찬바람이 부는 가을 햇살이 따뜻한 요즘입니다
콩나물과 황태채를 넣고 매콤 깔끔한 맛의 콩나물국을 끓였어요","[{'step_number': 1, 'description': '재료 : 콩나물 250g, 황태채 한줌, 양파 1/4개, 풋고추 1개\n양념 : 다진마늘 1T, 새우젓 1T, 멸치액젓 2T, 고추가루 1T', 'image_url': 'https://recipe1.ezmember.co.kr/cache/recipe/2020/09/19/aa2378b818aed1c6a765853b91f5083f1.jpg'}, {'step_number': 2, 'description': '황태채를 흐르는 물에 가볍게 씻어 주세요', 'image_url': 'https://recipe1.ezmember.co.kr/cache/recipe/2020/09/19/cd9307b145cf111ffd820fb6789050821.jpg'}, {'step_number': 3, 'description': '황태채를 2cm 길이로 잘라서 남비에 넣고 남비의 반정도 물을 넣고 끓여주세요', 'image_url': 'https://recipe1.ezmember.co.kr/cache/recipe/2020/09/19/30d59751b72a513929efe574d85a707d1.jpg'}, {'step_number': 4, 'description': '콩나물을 씻어서 물기를 빼주세요', 'image_url': 'https://recipe1.ezmember.co.kr/cache/recipe/2020/09/19/53988ac62cd2fdd6eb69c1454678f3f21.jpg'}, {'step_number': 5, 'description': '황태채 냄새가 너무 좋으네요 바글바글 끓으면 3분간 더 끓여주세요', 'image_url': 'https://recipe1.ezmember.co.kr/cache/recipe/2020/09/19/1d342e5958daee444c21da3acff101a21.jpg'}, {'step_number': 6, 'description': '콩나물과 채썬 양파를 넣고 센불에 끓여 줍니다', 'image_url': 'https://recipe1.ezmember.co.kr/cache/recipe/2020/09/19/17fc3515896a00fb31b5bdd3aeed1f301.jpg'}, {'step_number': 7, 'description': '국이 끓으면 다진마늘 1T, 새우젓 1T, 멸치액젓 2T 를 넣고 골고루 섞어주세요', 'image_url': 'https://recipe1.ezmember.co.kr/cache/recipe/2020/09/19/f424104b40e76da3eb5ac5bb19d7c4361.jpg'}, {'step_number': 8, 'description': '국물이 진하게 우러나도록 끓여주세요', 'image_url': 'https://recipe1.ezmember.co.kr/cache/recipe/2020/09/19/e4fa76eedc6bfaf77fb89dca437bfc7d1.jpg'}, {'step_number': 9, 'description': '고추가루 1T, 채썬 풋고추를 넣고 골고루 섞어주세요', 'image_url': 'https://recipe1.ezmember.co.kr/cache/recipe/2020/09/19/9f34f4ac22cb0512ffcdcf7d72ae2df31.jpg'}]"
