index,종류별,상황별,재료별,방법별,글 제목,레시피이름,레시피이미지,조회수,조리시간,난이도,인분,재료,소개글,조리순서
42377,메인반찬,영양식,해물류,끓이기,새우를 품은 양배추롤,새우양배추롤,https://recipe1.ezmember.co.kr/cache/recipe/2018/06/09/81d916c4a3ecef9290f82b875775e77a1.jpg,"3,540",30분 이내,초급,2인분,"[('새우', '10마리'), ('양배추 큰거', '1/4쪽'), ('양파', '1/2개'), ('전분', '1T'), ('소금', '2꼬집'), ('후추', '2꼬집'), ('밀가루', '1T'), ('토마토', '2개'), ('다진양파', '2T'), ('다진마늘', '1T'), ('케첩', '2T'), ('소금', '1t'), ('설탐', '1t'), ('후추', '1꼬집'), ('고춧가루', '1/2T')]",양배추안에 새우를 넣고 말은 양배추롤을 토마토소스와 곁들여 먹는 요리입니다. 새우와 양배추 토마토를 이용하여 건강에 좋은 영양식이며 칼로리가 높지않아 다이어트식으로도 좋습니다.,"[{'step_number': 1, 'description': '새우는 머리, 껍질, 내장을 제거해서 준비합니다.새우는 손질해서 먹을만큼 소분해서 냉동보관하면 그때그때 꺼내쓰기좋아요:)', 'image_url': 'https://recipe1.ezmember.co.kr/cache/recipe/2018/06/09/de91e6e96038a3ec79f2de8585f657941.jpg'}, {'step_number': 2, 'description': '양배추를 2~3분 정도 데쳐셔 찬물에 헹군뒤 식혀줍니다. 양배추를 말아야 하기 때문에 너무 두꺼운 부분은 칼로 저며주세요!', 'image_url': 'https://recipe1.ezmember.co.kr/cache/recipe/2018/06/09/8f78b9dd19b6ed17ddf46a3e668a60e81.jpg'}, {'step_number': 3, 'description': '다진 새우와 다진 양파, 전분 1스푼을 넣고 치댑니다.저는 새우 식감이 살아있게 굵직하게 다졌어요!', 'image_url': 'https://recipe1.ezmember.co.kr/cache/recipe/2018/06/09/496b0f496964c6ef84f6a0b93e9442461.jpg'}, {'step_number': 4, 'description': '양배추에 (3)를 넣고 돌돌 말아줍니다.양배추를 말아준 뒤 잘 풀리지않도록 이쑤시개로 고정해주면 편해요', 'image_url': 'https://recipe1.ezmember.co.kr/cache/recipe/2018/06/09/c29c66956d32051eeb1bb1ecf6a1b72e1.jpg'}, {'step_number': 5, 'description': '양배추롤에 밀가루를 얇게 묻혀줍니다.', 'image_url': 'https://recipe1.ezmember.co.kr/cache/recipe/2018/06/09/71c52f0984170905a32064db5cb9f4d11.jpg'}, {'step_number': 6, 'description': '팬에 버터를 두르고 약불에서 양배추롤을 노릇하게 구워줍니다.', 'image_url': 'https://recipe1.ezmember.co.kr/cache/recipe/2018/06/09/f28c4246a3996963a3f9d9a9abf48bd01.jpg'}, {'step_number': 7, 'description': '기름 살짤 두르고 다진마늘1T 넣고 볶다가 토마토2개 갈은것, 케첩2T, 다진양파2T, 소금, 설탕, 후추, 고춧가루 넣고 졸여서 토마토소스를 만듭니다.시판 토마토소스나 크림소스 이용하시면 더 맛있게 간단하게 요리하실 수 있어요! 저는 토마토소스가 없어서 급하게 만들었습니다', 'image_url': 'https://recipe1.ezmember.co.kr/cache/recipe/2018/06/09/5eb7368bbe52f670aee260969781d5181.jpg'}, {'step_number': 8, 'description': '토마토소스에 물 반컵 넣고 양배추롤을 4~5분 정도 끓여주면 완성입니다.', 'image_url': 'https://recipe1.ezmember.co.kr/cache/recipe/2018/06/09/52f66fc65445a45b16e396967ec87d361.jpg'}]"
42378,메인반찬,영양식,해물류,끓이기,고등어랑 카레랑 노라조,고등어카레,https://recipe1.ezmember.co.kr/cache/recipe/2018/06/10/5cf4020231472dd3b2965226726654c21.jpg,544,30분 이내,중급,3인분,"[('카레분말', '100g'), ('로즈마리', '2g'), ('감자', '3개'), ('당근', '1개'), ('순살 고등어', '1마리'), ('물', '500ml'), ('우유', '500ml'), ('버터', '40g'), ('새송이버섯', '1개'), ('통후추', '약간'), ('양파', '1/4개')]","일반적으로 닭고기,돼지고기를 사용하는 카레 요리에 생선을 대입시켜 보았습니다.
일본식 카레가 아닌, 인도식 크림카레로 비린내를 최소화하여 없애고, 아이들도 좋아하는 카레에 생선을 넣어 위화감을 줄이도록 노력했습니다.","[{'step_number': 1, 'description': '재료를 알맞게 준비합니다.', 'image_url': 'https://recipe1.ezmember.co.kr/cache/recipe/2018/06/10/0d958356e93997bd3803eae7b4d30afe1.jpg'}, {'step_number': 2, 'description': '당근과 감자를 원하는 크기로 썰어주시고\n양파와 새송이버섯은 슬라이스 해주세요.', 'image_url': 'https://recipe1.ezmember.co.kr/cache/recipe/2018/06/10/0d85ced1cfaf468cfa6d15f475e6e3161.jpg'}, {'step_number': 3, 'description': '버터를 녹인 팬에 야채를 달달 볶아줍니다.\n* 감자와 당근에서 물기가 나와야만 합니다.', 'image_url': 'https://recipe1.ezmember.co.kr/cache/recipe/2018/06/10/680648a15eae0b5bf27acce6758a3e241.jpg'}, {'step_number': 4, 'description': '우유에 로즈마리를 넣고, 순살 고등어를 재워둡니다.', 'image_url': 'https://recipe1.ezmember.co.kr/cache/recipe/2018/06/10/ec73c127b94396268ae6ede51182851b1.jpg'}, {'step_number': 5, 'description': '재워둔 고등어를 건져 낸 뒤, 3번에 물과 우유를 넣고 끓이다, 고등어도 같이 넣고 같이 끓여 줍니다.', 'image_url': 'https://recipe1.ezmember.co.kr/cache/recipe/2018/06/10/6146b0cbb1025f886ae3c91f5142cc141.jpg'}, {'step_number': 6, 'description': '적당히 끓었을때, 카레를 넣고 조금 더 졸여줍니다.', 'image_url': 'https://recipe1.ezmember.co.kr/cache/recipe/2018/06/10/2e2e3ff439d4d70ff8d0b5105d3cce421.jpg'}, {'step_number': 7, 'description': '카레와 고등어를 접시에 담아 냅니다.', 'image_url': 'https://recipe1.ezmember.co.kr/cache/recipe/2018/06/10/3aa447e965bfbd21e6a4648b9de6fd901.jpg'}]"
42379,메인반찬,영양식,해물류,끓이기,홍게철이 끝나기 전에 홍게 맛있게 쪄 먹는 방법,홍게,https://recipe1.ezmember.co.kr/cache/recipe/2016/03/22/7674893744863c1a5ac069903823ccfb1.jpg,"10,712",60분 이내,초급,2인분,"[('홍게', '3kg')]",인터넷으로 3키로를 주문했어요. 홍게를 맛있게 쪄서 먹었어요.,"[{'step_number': 1, 'description': '홍게를 준비합니다.\n저는 인터넷으로 3키로 구매 했으며 14마리 정도 얼음속에 들어서 배송왔습니다.', 'image_url': 'https://recipe1.ezmember.co.kr/cache/recipe/2016/03/22/5badc66c196738dd2ff3c0e8193fad481.jpg'}, {'step_number': 2, 'description': '손질방법을 안내 드릴께요 홍게의 입부분을 가위로 잘라주세요. \n위험할 수 있으니 장갑을 끼세요. 가위 또는 칼로 하셔도 됩니다.', 'image_url': 'https://recipe1.ezmember.co.kr/cache/recipe/2016/03/22/5a3ea75e7748100f838bd65042fdb7af1.jpg'}, {'step_number': 3, 'description': '입에서 홍게에 베어있는 짠맛이 빠지도록\n담구어 놓았어요:)\n물에 30분 정도 담궈서 짠 물을 빼줍니다.', 'image_url': 'https://recipe1.ezmember.co.kr/cache/recipe/2016/03/22/d7f7f568a1d6ebc8fbe23fd541ac54ad1.jpg'}, {'step_number': 4, 'description': '홍게를 찔 수 있는 팬을 준비합니다.(집에서 제일 큰 궁중팬이에여)\n물을 팔팔 끓여주세요.\n(찜기가 있으면 사용하세요 테클 사절입니다. 자취생집에 찜기는 없어요 ㅠㅠ)', 'image_url': 'https://recipe1.ezmember.co.kr/cache/recipe/2016/03/22/1d5fbd29aa391d0b24a5bab7c5cc304d1.jpg'}, {'step_number': 5, 'description': '채반에 홍게를 배가 하늘을 가도록 올려주세요.', 'image_url': 'https://recipe1.ezmember.co.kr/cache/recipe/2016/03/22/d58b84df00e12af94a6f50548457f4431.jpg'}, {'step_number': 6, 'description': '뚜껑을 닫고 25분간 쪄줍니다.\n저는 발이 삐져 나와서 시간이 오래 걸렸어요\n그릇이 작으면 그냥 가위로 다리만 잘라서 쪄주시면 됩니다.\n그리도 가스렌지에 5분정도 두시고 뜸을 들여주세요.', 'image_url': 'https://recipe1.ezmember.co.kr/cache/recipe/2016/03/22/c6e3e4ea685b5e14ac9cde479327ee441.jpg'}, {'step_number': 7, 'description': '완성입니다.', 'image_url': 'https://recipe1.ezmember.co.kr/cache/recipe/2016/03/22/b21e9a9868c442913b5f2d18e473c17b1.jpg'}]"
42380,메인반찬,영양식,해물류,끓이기,"문어 숙회, 명월초 샐러드",명월초샐러드,https://recipe1.ezmember.co.kr/cache/recipe/2015/06/08/5924fe3a9fad35090796aa6f390ce4b11.jpg,"13,683",15분 이내,아무나,2인분,"[('문어', '5마리'), ('무', '약간'), ('비트', '1/2개'), ('초고추장', ''), ('명월초잎', '약간')]","단백질이 풍부한 문어로 더운 여름을 이겨볼까요. 낙지과에 속하는 통영 청정지역의 문어는 쫄깃하고 단맛이 있어 데쳐 먹으면 맛이 담백하고 해독작용과 피로회복에 상당히 효과가 있다고 하네요. 여름 보양식으로 낙지와 함께 문어 숙회로 드시면 조리 과정도 없고 맛있게 드실 수 있어요. '규합총서'에 "" 문어알은 머리 배 보혈에 귀한 약이며 토하고 설사하는데 유익하다'고했어요. 쇠고기 먹고 체한 데는 문어 대가리를 고아 먹으면 낫는다고 해요.","[{'step_number': 1, 'description': '문어 빨판이 지저분한데 밀가루 1큰술 넣고 바락바락 거품이 나게 문질러서 물에 헹궈서 깨끗이 씻어주세요.', 'image_url': 'https://recipe1.ezmember.co.kr/cache/recipe/2015/06/19/ec6666f7ff03c56ea6fcf52d5431faa81.jpg'}, {'step_number': 2, 'description': '문어 맛있게 하는 달인은 문어 손질할 때 무를 사용하는걸 봤는데 부드럽고 문어 맛이 좋다고 해요. 냄비에 무를 넣고 끓으면 씻은 문어를 넣고 삶는데 양에 따라 시간을 조절하세요. 저는 숙회용으로 보들보들하게 먹으려고 작은 걸 샀는데 5마리를 7분 정도 삶았어요. 문어대가리부터 물에 넣고 7분 정도 삶아 채반에 건져 주세요.', 'image_url': 'https://recipe1.ezmember.co.kr/cache/recipe/2015/06/19/711d07ac437693e04b59335b5c33ba2f1.jpg'}, {'step_number': 3, 'description': '무도 투명하게 잘 익을 정도의 시간이면 문어도 먹기 좋게 잘 삶아 져요. 문어 삶은 물은 버리지 말고 마시면 좋아요.', 'image_url': 'https://recipe1.ezmember.co.kr/cache/recipe/2015/06/19/e1d74182ccc17fd1f152a5eacfeefcec1.jpg'}, {'step_number': 4, 'description': '건져 내니까 탱글탱글 부드럽고 통통해요.', 'image_url': 'https://recipe1.ezmember.co.kr/cache/recipe/2015/06/19/16f769250a230caddafb49d514e8936a1.jpg'}, {'step_number': 5, 'description': '먹기 좋게 삶아진 보들보들한 문어', 'image_url': 'https://recipe1.ezmember.co.kr/cache/recipe/2015/06/19/d2b0d7bb1b2e447268c84c450666f09d1.jpg'}, {'step_number': 6, 'description': '문어는 어슷하게 얇팍하게 썬 문어는 접시에 돌려 담아요. 비트를 반으로 잘라 수쿱으로 속을 파내고 고추장 그릇으로 사용하면 예뻐요. 큰 문어는 질겨서 아주 얇게 썰어야 하지만 작은 문어는 대충 썰어 드셔도 쫄깃하고 맛있어요', 'image_url': 'https://recipe1.ezmember.co.kr/cache/recipe/2015/06/19/e3353b842e95b70839bfd6c219c72e3b1.jpg'}, {'step_number': 7, 'description': '명월초 잎도 씻어 준비하고요. 문어랑 같이 먹으니 향과 맛이 괜찮네요. 당뇨에 좋다는 명월초의 여린 잎은 아삭아삭하고 향과 맛이 좋아서 샐러드로 드셔도 좋아요. 마침 블친 도덕마을님이 보내준 명월초를 곁들이니 싱그러워 보이고 예쁘네요.', 'image_url': 'https://recipe1.ezmember.co.kr/cache/recipe/2015/06/19/0fa2dde6207b48fead5fe36d6831710c1.jpg'}, {'step_number': 8, 'description': '명월초잎을 돌려 담고 고추장 담은 비트를 가운데 놓았어요.', 'image_url': 'https://recipe1.ezmember.co.kr/cache/recipe/2015/06/19/c1d5ba3d350af5b379582582fa3a25af1.jpg'}, {'step_number': 9, 'description': '쫄깃하고 맛난 문어 문어와 전복 등을 넣어 끓인 것을 회춘탕이라고 하는데 정력에도 좋대요.', 'image_url': 'https://recipe1.ezmember.co.kr/cache/recipe/2015/06/19/99211a459d8a49de27d24e4beebd76b91.jpg'}]"
42381,메인반찬,영양식,해물류,끓이기,#봄제철요리 #새조개샤브샤브만들기 #키조개관자요리 #새조개관자샤브샤브만들기,새조개샤브샤브,https://recipe1.ezmember.co.kr/cache/recipe/2024/02/22/178b6db7e12930f39c68742d2022d50a1.jpg,"2,075",30분 이내,아무나,2인분,"[('새조개', '500g'), ('키조개관자', '500g'), ('시금치', '300g'), ('조개멸치 육수', '3알'), ('멸치액젓', '3큰술'), ('다진마늘', '1큰술'), ('물', '1L'), ('밥', '2공기'), ('계란', '1개'), ('참기름', '2큰술')]","새조개의 계절이 찾아 왔습니다. 봄이 되면 먹어야 하는 것 중에 하나가 새조개인데, 새조개를 구입해서는 샤브샤브를 해서 먹었습니다. ​ 2kg 중량에 껍데기를 제외하고 살만 발라내면 500g 입니다. 새조개의 양이 적기 때문에 냉동 키조개관자를 구입해서 함께 넣어서 만든 새조개관자샤브샤브이지요. ​ 육수는 조개멸치육수에 멸치액젓으로 간을 해 준 것이 다 입니다. 새조개샤브샤브에는 시금치와 냉이가 들어가야 제맛인데, 이번에는 시금치만 넣어서 만들었고, 나중에 죽을 먹었습니다. ​ 새조개관자 샤브샤브 한번 드셔보세요. ^^","[{'step_number': 1, 'description': '시금치를 다듬어 준 후 씻어 주고는 물기를 빼 줍니다.믹싱볼 , 채반', 'image_url': 'https://recipe1.ezmember.co.kr/cache/recipe/2024/02/22/fb371b46fff434bcce9f039bea15e2131.jpg'}, {'step_number': 2, 'description': '새조개와 관자도 찬물에 씻어서 준비해 놓았습니다.', 'image_url': 'https://recipe1.ezmember.co.kr/cache/recipe/2024/02/22/96ca1a518a6ac83644e28b919ce42e821.jpg'}, {'step_number': 3, 'description': '샤브샤브이니만큼 육수가 필요하니, 조개멸치육수 3알과 다진마늘, 멸치액젓에 물을 넣어서는 기본 육수를 만들어 줍니다. 된장국을 좋아하시는 분이라면 멸치액젓 대신에 된장을 풀어서 샤브샤브 국물을 만들어 주셔도 좋습니다.냄비', 'image_url': 'https://recipe1.ezmember.co.kr/cache/recipe/2024/02/22/b2bc80b97ea264d3795625ba5d261a711.jpg'}, {'step_number': 4, 'description': '찍어 먹을 소스는 하나는 쌈장, 하나는 초고추장을 준비하고 맛간장에 와사비를 풀어서 만든 와사비간장을 준비했습니다.분리접시', 'image_url': 'https://recipe1.ezmember.co.kr/cache/recipe/2024/02/22/751a7550e62b7494f3584b97c12353951.jpg'}, {'step_number': 5, 'description': '고추는 찍어 먹을 것이고 시금치와 새조개, 그리고 키조개관자입니다. 이제 육수가 끓으면 관자와 새조개를 넣어 드시면 됩니다.', 'image_url': 'https://recipe1.ezmember.co.kr/cache/recipe/2024/02/22/b7b58e466985a56a36a42bff87ad7c181.jpg'}, {'step_number': 6, 'description': '오늘의 밥상은 키조개샤브샤브 밥상입니다. 육수를 끓여 줍니다.', 'image_url': 'https://recipe1.ezmember.co.kr/cache/recipe/2024/02/22/9a6c0cdeb6bf3ccea01bdc6934b1e8751.jpg'}, {'step_number': 7, 'description': '가장 먼저 시금치부터 넣어 줍니다.', 'image_url': 'https://recipe1.ezmember.co.kr/cache/recipe/2024/02/22/6dd5c03b14a453dd2111143955102ec71.jpg'}, {'step_number': 8, 'description': '그리고 키조개관자와 새조개를 조금 넣어 줍니다. 새조개는 딱 10초면 됩니다. 더 익히게 되면 질겨 집니다. 키조개관자는 조금더 익혀 주시는 것이 좋습니다.', 'image_url': 'https://recipe1.ezmember.co.kr/cache/recipe/2024/02/22/c93286b9add43c97fb0d8beca0d98dff1.jpg'}, {'step_number': 9, 'description': '새의 부리를 닮았다고 해서 이름이 붙여진 새조개!! 진짜 새부리같지요. 원하는 소스에 찍어서 드시면 됩니다. 초고추장이나 와사비간장, 아니면 쌈장에 찍어 드시면 되겠죠.', 'image_url': 'https://recipe1.ezmember.co.kr/cache/recipe/2024/02/22/48db6b0290a65c15d851c18b3b1c27e61.jpg'}, {'step_number': 10, 'description': '마지막은 라면을 넣는 것도 있고, 아니면 죽으로 만들어 먹을 수도 있습니다. 라면은 별로 선호하지 않아서 죽으로 만들었습니다. 밥은 먹어야하니까요. 밥을 넣어 주고는 계란과 참기름을 둘러 주고 계란을 풀면서 줄을 쒀 줍니다. 육수가 많이 남아서 덜어낸 것입니다.', 'image_url': 'https://recipe1.ezmember.co.kr/cache/recipe/2024/02/22/fa1eeb3184bac2734b84b66150258acc1.jpg'}]"
42382,메인반찬,영양식,해물류,끓이기,#장어요리 #여름보양식 #여름제철요리 #파김치장어만들기 #파김치에 구운 장어가 들어간 색다른 장어요리!!!,파김치장어,https://recipe1.ezmember.co.kr/cache/recipe/2018/07/11/e0ae43ce2511d90d4d04a22f1dbd6aa81.jpg,"6,922",60분 이내,초급,2인분,"[('장어(소)', '4마리'), ('우유', '500cc'), ('소금', '1t'), ('후추', '1t'), ('파김치', '1사발'), ('묵은지', '1컵'), ('김칫국물', '2컵'), ('물', '1컵'), ('다진마늘', '2큰술'), ('생강가루', '1작은술'), ('청주', '2큰술'), ('통깨', '1작은술'), ('장어', '1마리'), ('소금', '1t'), ('후추', '1t'), ('생강', '1톨'), ('다진마늘', '2큰술'), ('버터', '1큰술')]","예전 오늘뭐먹지에서 신동엽과 성시경이 서산에 있는 
파김치장어 맛집에 갔었지요. 
파김치를 담궜는데 아껴서 푹 익게 만들어 놓고 
여름 제철음식이고 보양식인 장어를 구입해서는 파김치장어를 만들었습니다. 

장어는 소금과 후추로 밑간을 해주고 에어프라이어에 한번 구워 준 것을
파김치와 묵은지에 넣고 팔팔 끓여내는 것이죠. 
파김치와 장어가 아주 잘 어울린다고 하니 장어의 느끼한 맛도 잡아 주고
얼큰하면서도 끓여면 끓일수록 장어에서 나오는 진한 맛이 좋은
파김치장어입니다. 나중에 밥을 볶아서 먹으면 마무리로 끝내주지요.","[{'step_number': 1, 'description': '장어를 구입했는데 장어가 그리 크지 않는 관계로 몇마리는 그냥 구워서 먹고 남은 것으로 파김치장어를 할려고 했는데 살도 많지 않아서 그냥 딱 한마리만 구워주고는 모두 파김치장어로 사용했어요.', 'image_url': 'https://recipe1.ezmember.co.kr/cache/recipe/2018/07/11/4c82e9c48d05f71767b86cfa9d36ef5a1.jpg'}, {'step_number': 2, 'description': '손질된 장어이기 때문에 한번 씻어 주고는 우유에 담궈 주었습니다. 잡내와 비린맛을 잡기 위해서요.', 'image_url': 'https://recipe1.ezmember.co.kr/cache/recipe/2018/07/11/a389d1fabe75ddf2f82b8d43673db06b1.jpg'}, {'step_number': 3, 'description': '30분정도 우유에 담궈 놓았던 장어를 꺼내어서 한번 맑은물에 씻어 준 후 물기를 제거하고 소금과 후추를 넣고 밑간을 해 줍니다.', 'image_url': 'https://recipe1.ezmember.co.kr/cache/recipe/2018/07/11/e2f0626cdd97601e3652e216085728631.jpg'}, {'step_number': 4, 'description': '통깨로 구우면 좋겠지만 팬에도 다 안들어가고 해서 큼지막하게 등분을 해 주었어요. 에어프라이로 구워주려고요.', 'image_url': 'https://recipe1.ezmember.co.kr/cache/recipe/2018/07/11/007ad077117dc24c1db714e048f2e0841.jpg'}, {'step_number': 5, 'description': '장어자체에 기름이 많기 때문에 다른 기름을 넣지 않고 장어를 구워 주었어요. 160도 온도에서 5분 돌리고 확인하고 5분 돌리고 확인하면 뒤집어 주고요. 총 10분이 걸렸습니다. 온도가 너무 높으면 탈 수 있으니 너무 높은 온도에서 굽지 않으시는 것이 좋아요.에어프라이어', 'image_url': 'https://recipe1.ezmember.co.kr/cache/recipe/2018/07/11/7cec9c7fdab604f7e742b12f8d79d9721.jpg'}, {'step_number': 6, 'description': '장어가 구워지는 동안에 파김치와 묵은지를 넣어 줍니다. 파김치는 그냥 썰지 않고 통째로 넣어주고 묵은지는 썰어서 넣어 주었습니다. 그리고 물, 김칫국물을 넣어 줍니다. 장어에서 진한 맛이 나오기 때문에 따로 육수를 넣지 않았습니다.', 'image_url': 'https://recipe1.ezmember.co.kr/cache/recipe/2018/07/11/629e16ea1234a15a79ab073e088dba9d1.jpg'}, {'step_number': 7, 'description': '다진마늘과 생강가루를 넣어 줍니다. 생강가루는 장어의 비린맛도 잡아 주고 장어와 생강은 아주 잘 어울리기도 하죠.', 'image_url': 'https://recipe1.ezmember.co.kr/cache/recipe/2018/07/11/a2ca16deca4e9f0161ed1b9f5af0574b1.jpg'}, {'step_number': 8, 'description': '장어가 다 구워졌습니다. 어차피 초벌로만 굽는 것이기 때문에 너무 많이 굽지 않으시는 것이 좋아요.', 'image_url': 'https://recipe1.ezmember.co.kr/cache/recipe/2018/07/11/3f4f56868475b51a01014c39698f85481.jpg'}, {'step_number': 9, 'description': '초벌구이를 한 장어를 파김치에 투하합니다. 그리고는 센불에서 팔팔 끓여주세요. 팔팔 끓어오르면 잠시 더 끓이다가는 중불에서 은근하게 국물을 졸여 줍니다. 파김치에서도 진한 맛이 나와야하고 장어에서 국물에 진한 맛을 내어 주어야 하니까요.', 'image_url': 'https://recipe1.ezmember.co.kr/cache/recipe/2018/07/11/46e26b0f26ca837d8f7a8f54e3130fbb1.jpg'}, {'step_number': 10, 'description': '처음보다 국물이 많이 줄어 들었고 점점 국물이 진해져가네요.', 'image_url': 'https://recipe1.ezmember.co.kr/cache/recipe/2018/07/11/5da3ff80535f62a06743a1db2c752d7a1.jpg'}, {'step_number': 11, 'description': '나머지 한마리는 에어프라이어에서 굽고 있습니다. 장어가 컸다면 이 마늘소스를 발라가면서 구울려고 했는데 아쉽게도 작고 살도 많지 않아서 그냥 소스로 활용하려고 만들었습니다. 달궈진 팬에 다진마늘과 버터를 넣고 볶아주었어요. 중불에서 볶아 줍니다. 그럼 마늘소스가 되는 것이죠.', 'image_url': 'https://recipe1.ezmember.co.kr/cache/recipe/2018/07/11/dffcfb956ba6f763ecef4daf2049392b1.jpg'}, {'step_number': 12, 'description': '구운장어와 함께 먹을 마늘소스와 생강을 채썰어서 준비해 놓고요. 참 장어 지나치게 실하지요. 너무 실해서 멸치같아 보이네요.', 'image_url': 'https://recipe1.ezmember.co.kr/cache/recipe/2018/07/11/94b7c75eeb67465c9a104f11dc36f96c1.jpg'}, {'step_number': 13, 'description': '국물이 자작자작해질때까지 졸여서 완성그릇에 담아 내놓아 줍니다. 통깨를 마지막에 솔솔 뿌려 주시고요. 그럼 서산 파김치장어맛집을 따라해 본 파김치장어 완성입니다.', 'image_url': 'https://recipe1.ezmember.co.kr/cache/recipe/2018/07/11/d725ad0f2338cf4a42430a8e852a514b1.jpg'}]"
