index,종류별,상황별,재료별,방법별,글 제목,레시피이름,레시피이미지,조회수,조리시간,난이도,인분,재료,소개글,조리순서
150000,퓨전,일상,소고기,볶음,고소하고 든든한 고기스파게티 우삼겹파스타 만들기,우삼겹파스타,https://recipe1.ezmember.co.kr/cache/recipe/2021/08/08/bc9585f21c8f574d45a3ba520e2e7a9b1.jpg,"17,216",30분 이내,아무나,2인분,"[('스파게티면', ''), ('우삼겹', ''), ('페퍼론치노', ''), ('슬라이스마늘', ''), ('파', ''), ('소금', ''), ('후추', ''), ('올리브오일', ''), ('미림', ''), ('간장', ''), ('설탕', '')]",만화카페에서 먹었던 기억을 떠올리며 만들어본 고기 스파게티,"[{'step_number': 1, 'description': '고기 밑간 단계입니다.\n좀 더 깔끔하게 고기의 고소한 맛을 느끼고 싶으시면 고기 밑간을 소금,후추 약간 + 맛술2스푼\n한국적 소고기 맛을 느끼고 싶으시면 간장1스푼 + 설탕1스푼으로 밑간 해주세요.', 'image_url': 'https://recipe1.ezmember.co.kr/cache/recipe/2021/08/08/2ce5140173f702f08b326593730d90051.jpg'}, {'step_number': 2, 'description': '면을 삶아주세요. \n소금과 올리브유를 넣고 삶는 스파게티면은 9분이 가장 좋다고 하지만 프라이팬에서 볶는 시간도 있으니 8분 정도가 가장 적당하지 않을까 싶어요.', 'image_url': 'https://recipe1.ezmember.co.kr/cache/recipe/2021/08/08/1d3000d48caa43a3042165a096bc98511.jpg'}, {'step_number': 3, 'description': '먼저 후라이팬을 달군 후 올리브유를 적당히 넣어주세요. 우삼겹이 기름이 많은 부위라 저는 올리브유를 많이 넣지 않았어요.', 'image_url': 'https://recipe1.ezmember.co.kr/cache/recipe/2021/08/08/008e78edb1a014941a743d5c19881db71.jpg'}, {'step_number': 4, 'description': '기름이 달궈지면 마늘-아스파라거스-양송이-파, 페퍼론치노 순으로 넣고 볶으면서 소금간을 살짝 해주었어요.', 'image_url': 'https://recipe1.ezmember.co.kr/cache/recipe/2021/08/08/7034c9a4930e4dca3ecdc5868a0960221.jpg'}, {'step_number': 5, 'description': '양념이 벤 우삼겹을 넣고 빠르게 살짝 볶아줍니다. 얇아서 금방 익고 금방 질겨지기 때문에 빨간기가 없어질 정도로만 살짝쿵 익혀주세요.', 'image_url': 'https://recipe1.ezmember.co.kr/cache/recipe/2021/08/08/622cb48f4ffe0eecf0888f6dba91b1861.jpg'}, {'step_number': 6, 'description': '다 익은 면을 면수와 함께 넣고 조금 더 볶아주면서 입맛에 맞게 소금간을 조절해주면 완성입니다~♪', 'image_url': 'https://recipe1.ezmember.co.kr/cache/recipe/2021/08/08/2bca1032368971769c27fe378dbc3d741.jpg'}, {'step_number': 7, 'description': '파마산 치즈를 갈아서 올려주시면 더 예쁘고 풍미있는 스파게티가 완성됩니다.\n약간 심심하고 순한 맛입니다.\n고기가 많이 들어가 한 그릇이면 배고픔을 거의 느끼지 않는 든든한 하루를 보내실 수 있어요~ :)', 'image_url': 'https://recipe1.ezmember.co.kr/cache/recipe/2021/08/08/3ef9ace761223bc02b685ceebf903a981.jpg'}]"
150001,퓨전,일상,소고기,볶음,[무드앤쿡#.44] 이색 파스타 시리즈 2편 : 밥과 함께 먹는 카레는 이제 그만! 깔끔한 맛의 <비프&카레 파스타,카레파스타,https://recipe1.ezmember.co.kr/cache/recipe/2021/08/11/fa90365a43cdbc88a8a8792a1e76e1261.jpg,511,30분 이내,아무나,1인분,"[('푸실리', '1인분'), ('다진 소고기', '100g'), ('양파', '1/3개'), ('마늘', '2개'), ('카레 가루', '1큰술'), ('치킨 육수', '200ml')]",[이색 파스타 시리즈 2편] 드라이한 카레 가루로 만든 깔끔한 맛의 파스타입니다 :) 식어도 맛있게 먹을 수 있으니 시도해 보세요 !,"[{'step_number': 1, 'description': '다진 양파와 마늘을 기름을 두른 팬에서 볶는다.', 'image_url': 'https://recipe1.ezmember.co.kr/cache/recipe/2021/08/11/cc263be3777ab9aff8fd647a1caa2d901.jpg'}, {'step_number': 2, 'description': '다진 소고기를 넣고 소금, 후추 간을 하면서 볶는다.', 'image_url': 'https://recipe1.ezmember.co.kr/cache/recipe/2021/08/11/7d11b62b670bc86fa6dd4bc5f01221451.jpg'}, {'step_number': 3, 'description': '치킨 육수 소량과 카레가루를 넣고 볶는다. 농도는 기호에 맞게 조절한다.치킨 육수가 없다면 면수로 대체해도 좋다.', 'image_url': 'https://recipe1.ezmember.co.kr/cache/recipe/2021/08/11/9b5c7cff8356b22a346f26deb731e4871.jpg'}, {'step_number': 4, 'description': '삶은 파스타 면을 넣고 잘 섞어서 완성한다.', 'image_url': 'https://recipe1.ezmember.co.kr/cache/recipe/2021/08/11/3349388ffe3ad678965d13b4e8130e5c1.jpg'}]"
150002,퓨전,일상,소고기,볶음,[차돌박이파스타] 탄단지 영양 꽉찬 일품요리 건강식,차돌박이파스타,https://recipe1.ezmember.co.kr/cache/recipe/2024/04/01/96661a47b96a1130e9f81d474eb760361.jpg,206,20분 이내,초급,1인분,"[('차돌박이', '50g'), ('세발나물', '50g'), ('파스타면', '50g'), ('마늘', '2톨'), ('양파', '약간'), ('크래쉬드 레드페퍼', '1tsp'), ('소금', '적당량'), ('진간장', '1tsp'), ('요리당', '1tsp'), ('맛술', '1tsp'), ('굴소스', '1tsp'), ('참치액', '5ml')]","몸이 허할 땐 저도 모르게 육류가 땡기죠. 이럴 때 냉동실에서 바로 꺼내 요리할 수 있는 차돌박이만 있으면 일품 보양식을 금방 차릴 수 있죠^^ 
차돌박이는 냉동해 두었다 조금씩 꺼내 먹기 정말 좋은 것 같아요. 해동할 필요도 없고 냉동에서 오는 식감의 변화도 거의 없으니까요. 
왠지 몸이 허하고 육류가 땡기는 날 차돌박이에 파스타 면을 더해 퓨전 보양식으로 즐길만한 레시피를 공유해봅니다 :) 
차돌박이의 단백질, 파스타 면의 탄수화물과 더불어 세발나물의 식이섬유까지 필요한 요소를 모두 갖춘 영양 꽉~찬 일품요리랍니다.","[{'step_number': 1, 'description': '먼저 재료를 꺼내 씻을 건 씻고 계량해 주었어요. \n차돌박이, 세발나물, 면... 각각 캐릭터 확실한 재료들이네요. \n저는 보통 면을 50g만 했는데 일반적인 1인분보다 적은 양이니 참고하셔요. \n고기도 마찬가지입니다. 1인분 치고 작은 양이지만 포만감을 느끼게 해주는 세발나물까지 합쳐지니 저는 이 정도 양이 맞더라구요.', 'image_url': 'https://recipe1.ezmember.co.kr/cache/recipe/2024/04/01/b7f18234df054bb45eaf44b22849f6661.jpg'}, {'step_number': 2, 'description': '오늘은 세 가지를 한 접시에 올려놓아야 해서 따뜻하게 즐기기 위해서는 시간이 생명. \n세발나물도 미리 깨끗하게 씻어 체에 밭쳐 준비해놓습니다.볼 , 채반', 'image_url': 'https://recipe1.ezmember.co.kr/cache/recipe/2024/04/01/0416256c28b4bea2593ef4954856037d1.jpg'}, {'step_number': 3, 'description': '면부터 삶기 위해 1L정도의 물을 올립니다. \n넓은 샤브샤브 냄비를 이용하면 면을 푹 잠기게 삶기 좋더라구요. \n물이 팔팔 끓기 시작하면 파스타 면을 넣어주고 삶는 동안 다른 재료들을 만들어줄 게요. \n파스타 면은 종류에 따라 삶는 시간이 다르니 포장을 확인하셔서 그대로 삶아주시면 돼요. \n면을 삶을 때 소금을 약간 넣으셔도 되고 생략해도 됩니다. 생략하셔도 나중에 면을 볶아 최종 간을 맞추면 되거든요.냄비 , 요리젓가락', 'image_url': 'https://recipe1.ezmember.co.kr/cache/recipe/2024/04/01/2134537a75af6a2d393e822de36de3ce1.jpg'}, {'step_number': 4, 'description': '면이 익는 동안 작은 유리볼에 위의 재료 비율대로 간장을 미리 만들어두면 편해요. \n볶기 시작하면서 만들면 면이 불 수도 있거든요.소스볼 , 계량스푼', 'image_url': 'https://recipe1.ezmember.co.kr/cache/recipe/2024/04/01/f46b7d595f0e684890231fae42505de31.jpg'}, {'step_number': 5, 'description': '이제 볶아줄 차례인데요, 중불로 달군 팬에 올리브유를 넉넉하게 뿌리고 마늘과 양파를 채 썰어 넣어 마늘 향을 입혀주세요. \n올리브유의 독특한 향이 싫은 분은 그냥 식용유를 사용하셔도 됩니다.프라이팬 , 요리스푼스텐팬은 사용전 약불로 달구어 물방울을 떨어뜨려보고 또르르~ 구를 때 기름을 두르고 사용하시면 눌어붙는 게 덜합니다.', 'image_url': 'https://recipe1.ezmember.co.kr/cache/recipe/2024/04/01/5a5d3fca3a6b36906363dfdf54853f231.jpg'}, {'step_number': 6, 'description': '마늘이 노릇하게 익을무렵 삶은 면을 넣어 기름에 코팅하듯 한번 더 볶아주고 매운맛 담당 크러쉬드 레드 페퍼도 듬뿍 넣어주었어요. \n이렇게 하면 면은 완성됩니다. \n완성된 면은 접시 가운데 먼저 담아주세요. 젓가락으로 돌돌 말아 길게 올려놓으시면 됩니다.', 'image_url': 'https://recipe1.ezmember.co.kr/cache/recipe/2024/04/01/30a382f1cf5778107e10327e709a1eb51.jpg'}, {'step_number': 7, 'description': '이제 달군 팬에 차돌박이를 넣고 구워줍니다. \n차돌박이엔 기름기가 많아 식용유를 따로 두르지 않았어요.', 'image_url': 'https://recipe1.ezmember.co.kr/cache/recipe/2024/04/01/d5c5ac209d14fca00777bade9345a14a1.jpg'}, {'step_number': 8, 'description': '반 이상 익었을 때 준비해두었던 양념을 넣어주세요. \n처음부터 넣으면 양념이 탈 수도 있고 너무 스며들어 짤 수 있거든요.', 'image_url': 'https://recipe1.ezmember.co.kr/cache/recipe/2024/04/01/9c756b62db2b0dab2d431a08e17f39211.jpg'}, {'step_number': 9, 'description': '이렇게 고기가 완전히 익으면 접시 위에 아까 올려둔 파스타 면 옆에 놓아주세요.', 'image_url': 'https://recipe1.ezmember.co.kr/cache/recipe/2024/04/01/6745a959b2e90d65a9a83354300334ac1.jpg'}, {'step_number': 10, 'description': '이 부분이 중요해요! 팬에 간장 양념이 남은 게 보이시죠? \n꺼뒀던 팬을 다시 약불로 올려 세발나물을 넣고 두세 번 섞어주며 10초만 익혀주세요. \n남아있던 간장 양념이 묻어 간이 되며 세발나물이 식감 좋게 한풀 죽습니다.', 'image_url': 'https://recipe1.ezmember.co.kr/cache/recipe/2024/04/01/df596bd394413c95ba2627a3b219fe1d1.jpg'}, {'step_number': 11, 'description': '파스타면, 차돌박이와 세발나물까지 순서대로 올려 완성되었요. \n만들어진 순서대로 심플하게 플레이팅 했는데 보기 괜찮네요 ^^ \n저는 삼박자를 고루 갖춘 이 차돌박이파스타 한접시면 힘이 불끈 나는데, 한번 만들어서 즐겨보셔요! ^^플레이팅접시', 'image_url': 'https://recipe1.ezmember.co.kr/cache/recipe/2024/04/01/2ce6a72daa2dba55d74c540be20814731.jpg'}]"
150003,퓨전,일상,소고기,볶음,레스토랑 비주얼 저탄수화물 식단 아스파라거스 말이 브런치 만들기,아스파라거스말이,https://recipe1.ezmember.co.kr/cache/recipe/2022/05/06/e0ff19a62898c18c30f06244d117c8081.jpg,401,30분 이내,아무나,1인분,"[('아스파라거스', '3개'), ('아보카도', '1/2개'), ('계란', '1개'), ('팽이버섯', '1개'), ('새송이버섯', '1개'), ('샐러드채소', '약간'), ('얇은 소고기                                                                                또는 베이컨', '약간'), ('소금', '약간'), ('후추', '약간'), ('양파', '1/2개'), ('식초', '1티스푼'), ('버터                                                                                또는 올리브유', '약간')]",오늘은 아스파라거스 말이 레시피를 알려드릴게요,"[{'step_number': 1, 'description': '재료는 기호에 맞게 양을 조절해주세요', 'image_url': 'https://recipe1.ezmember.co.kr/cache/recipe/2022/05/06/72bf5db26450c71ca71d0a4c44c396b41.jpg'}, {'step_number': 2, 'description': '손질 할 수 있는 재료는 먹기 좋게 썰어서 준비해주세요! 양파도 먹기 좋은 크기로 썰어주세요', 'image_url': 'https://recipe1.ezmember.co.kr/cache/recipe/2022/05/06/ee806c327199529e3cc088eca1cafd351.jpg'}, {'step_number': 3, 'description': '아스파라거스도 먹기 편하게 반으로 썰어주었어요! 뾰족한 부분은 채칼로 제거해주셔도 됩니다.', 'image_url': 'https://recipe1.ezmember.co.kr/cache/recipe/2022/05/06/da44b7229838327b6a1d6d87b4f509a51.jpg'}, {'step_number': 4, 'description': '우선\n아스파라거스에 돌돌 고기를 말아주세요~\n저는 집에 다진 육이 있어서 그냥 사용했는데\n대패나 베이컨으로 만드시길 추천합니다!\n버터나 올리브유를 두르고 아스파라거스까지 익을 수 있도록\n프라이팬에 뚜껑을 닫고 익혀주세요~', 'image_url': 'https://recipe1.ezmember.co.kr/cache/recipe/2022/05/06/b08deb5ceca8aaf13dd76e0887b438e71.jpg'}, {'step_number': 5, 'description': '먹기 좋게 썰은 버섯과 양파는 후추와 소금으로 간을 맞추신 후\n기름을 두르지 않고 볶아줍니다!!\n아보카도는 반만 썰어서 장식해 주세요 :)', 'image_url': 'https://recipe1.ezmember.co.kr/cache/recipe/2022/05/06/fa86ffca8ebc80cf5a8dceac0eb333561.jpg'}, {'step_number': 6, 'description': '수란 만들기\n끓는 냄비에 식초 1티스푼을 넣고\n물이 끓어오를 때 젓가락 또는 작은 우유 거품기로 회오리를\n만들어 주신 후 재빨리 계란을 최대한 물에 가까이 해서 풀어주세요!\n3분 있다가 꺼내시면 맛있는 수란 완성입니당 ㅎㅎ', 'image_url': 'https://recipe1.ezmember.co.kr/cache/recipe/2022/05/06/972dea1c18b740a271339974f58d796c1.jpg'}, {'step_number': 7, 'description': '깨끗하게 씻은 야채까지 올려주면\n완성입니다.!!\n너무 맛있었어요 ㅠㅠ', 'image_url': 'https://recipe1.ezmember.co.kr/cache/recipe/2022/05/06/b674564bb5ce5f4db61e6e81aa009b881.jpg'}]"
150004,퓨전,일상,소고기,볶음,소고기 요리 / 소고기 라이스페이퍼 말이,소고기라이스페이퍼말이,https://recipe1.ezmember.co.kr/cache/recipe/2021/01/16/0485ea8737afe56eb884cb11422ed63b1.jpg,"4,806",20분 이내,초급,1인분,"[('소고기', '100g'), ('라이스페이퍼', '4장'), ('다진 마늘', '1/2Ts'), ('설탕', '1Ts'), ('액젓', '1Ts')]","안녕하세요? 오늘은 애매하게 남은 자투리 소고기를 이용하여 맛있는 요리를 한번 만들어 보겠습니다. 소고기 부위는 상관없이 사용하시면 됩니다.

02:31초 부터 보세요.","[{'step_number': 1, 'description': '소고기는 다져 준다.', 'image_url': 'https://recipe1.ezmember.co.kr/cache/recipe/2021/01/16/700fd0d2775e9b1533b786e6f77004f81.jpg'}, {'step_number': 2, 'description': '라이스페이퍼를 준비한다.', 'image_url': 'https://recipe1.ezmember.co.kr/cache/recipe/2021/01/16/3d9e5c148d082ef8480f7972d84c38cf1.jpg'}, {'step_number': 3, 'description': '고기에 다진 마늘, 설탕, 액젓을 넣고 버무린다.', 'image_url': 'https://recipe1.ezmember.co.kr/cache/recipe/2021/01/16/153231dfdf32f9d0836ff9d6241c112e1.jpg'}, {'step_number': 4, 'description': '라이스페이퍼는 물에 적셔 준다.', 'image_url': 'https://recipe1.ezmember.co.kr/cache/recipe/2021/01/16/51bf398d222a74d3cbc0c315cd51243f1.jpg'}, {'step_number': 5, 'description': '물에 적신 라이스페이퍼 위에 고기를 올려준다.', 'image_url': 'https://recipe1.ezmember.co.kr/cache/recipe/2021/01/16/15957271b05d0c7edf6679f9cb1c61661.jpg'}, {'step_number': 6, 'description': '라이스페이퍼는 동그랗게 말아 준다.', 'image_url': 'https://recipe1.ezmember.co.kr/cache/recipe/2021/01/16/c75d86801568b85d7863db260c625bf61.jpg'}, {'step_number': 7, 'description': '프라이팬에 약불로 기름 없이 라이스페이퍼를 굽는다.', 'image_url': 'https://recipe1.ezmember.co.kr/cache/recipe/2021/01/16/c0a7355a7e1150d7aaa08931f39c51ad1.jpg'}]"
150005,퓨전,일상,소고기,볶음,양배추 요리 쇠고기장조림 볶음밥 레시피 장조림 양배추볶음,쇠고기장조림볶음밥,https://recipe1.ezmember.co.kr/cache/recipe/2024/10/02/3dbb16bfac067467102c7a694f61afcf1.jpg,35,30분 이내,초급,1인분,"[('쇠고기장조림', '적당히'), ('밥', '1공기'), ('식용유', '1'), ('쪽파', '약간'), ('양배추', '1줌'), ('당근', '약간'), ('간장 소스                                                                                장조림', '2'), ('식용유', '1')]",쇠고기장조림 간장소스 활용 요리 쇠고기장조림 간장소스에는 소고기와 다양한 재료를 오랜 시간 동안 끓여 만든 감칠맛 나는 맛이 농축되어 있어요. 이 간장 소스를 다른 요리에 활용해 보세요. 남은 장조림 소스 버릴 때마다 아깝다고 생각했는데 양배추볶음 그리고 쇠고기 장조림 볶음밥 만들어 먹으니 재료비 절약도 되고 음식물 쓰레기를 줄일 수 있어요. 장조림 간장소스와 밥을 볶아 쇠고기장조림 볶음밥만 만들어 먹어도 좋지만 부족한 듯한 느낌이 들어 양배추와 당근을 장조림 간장소스에 볶아 볶음밥과 같이 즐겼어요. ​그랬더니 영양 밸런스가 맞혀지는 거 같고 볶음밥 양도 푸짐하죠!,"[{'step_number': 1, 'description': '장조림 고기는 가위로 잘게 다져주세요.볼 , 주방가위', 'image_url': 'https://recipe1.ezmember.co.kr/cache/recipe/2024/10/02/b0b31f9b76370d9ca1adde94eecc3d3b1.jpg'}, {'step_number': 2, 'description': '양배추는 물에 담가 흐르는 물에 씻고 채를 썰어요. 당근도 채 썰어 주세요.도마 , 조리용나이프양배추 손질법', 'image_url': 'https://recipe1.ezmember.co.kr/cache/recipe/2024/10/02/fec1229220153ff3d0eb8761038ec68e1.jpg'}, {'step_number': 3, 'description': '쪽파는 송송 썰어줍니다. 쪽파 생략 가능해요.도마 , 조리용나이프', 'image_url': 'https://recipe1.ezmember.co.kr/cache/recipe/2024/10/02/bffbf8876231f4835b363676bbaca33d1.jpg'}, {'step_number': 4, 'description': '먼저 팬에 기름을 두르고 양배추와 당근을 볶아요.프라이팬 , 조리주걱', 'image_url': 'https://recipe1.ezmember.co.kr/cache/recipe/2024/10/02/e7ce2b8232b0da37c8a80d9d7dc5bbba1.jpg'}, {'step_number': 5, 'description': '숨이 어느 정도 죽으면 장조림 소스 2스푼 넣고 양배추를 볶아주세요. 양배추가 익었다면 그릇에 담아주세요.접시', 'image_url': 'https://recipe1.ezmember.co.kr/cache/recipe/2024/10/02/04e9f7154b53f3fc0bb750becaf73d3c1.jpg'}, {'step_number': 6, 'description': '양배추를 볶은 팬을 키친타월로 정리하고 쇠고기 장조림을 넣어요. 장조림이 끓기 시작하면 약불로 줄이세요.키친타올', 'image_url': 'https://recipe1.ezmember.co.kr/cache/recipe/2024/10/02/b1982c7459010597a0388448c3e50a351.jpg'}, {'step_number': 7, 'description': '밥 한 공기를 장조림과 함께 볶아요. 이때 장조림 소스가 모자란다 싶으면 진간장 더 추가로 넣어주세요. 볶음밥이 탈 거 같으면 물을 조금 넣어 볶아요. 장조림이 밥에 골고루 묻히게 뒤적뒤적 해주세요.', 'image_url': 'https://recipe1.ezmember.co.kr/cache/recipe/2024/10/02/121a42d65fd4b9a23acb123105fd553b1.jpg'}, {'step_number': 8, 'description': '그릇에 양배추 볶음을 담고 그 위에', 'image_url': 'https://recipe1.ezmember.co.kr/cache/recipe/2024/10/02/6a1276eee74c8350f6f03866c798ae2f1.jpg'}, {'step_number': 9, 'description': '쇠고기장조림 볶음밥을 올려요.', 'image_url': 'https://recipe1.ezmember.co.kr/cache/recipe/2024/10/02/06a8634a4bd578a17bb65829fe265bbf1.jpg'}, {'step_number': 10, 'description': '마지막으로 쪽파 올려주면 장조림 양배추볶음 쇠고기장조림 볶음밥 레시피 END', 'image_url': 'https://recipe1.ezmember.co.kr/cache/recipe/2024/10/02/c72b18f638a4723ff7d9561d85b252911.jpg'}]"
150006,퓨전,일상,소고기,볶음,편스토랑 기태영 한국식 파히타 도전 강추♡ 대박 맛나요,None,https://recipe1.ezmember.co.kr/cache/recipe/2021/09/01/855b774fce57dc9b5f6dc0343132d0851.jpg,"1,038",None,None,None,"[('소고기불고기용', '300g'), ('고추장', '3T'), ('고춧가루', '2.5T'), ('맛간장', '2T'), ('설탕', '2T'), ('다진 마늘', '1T'), ('참기름', '1t'), ('통마늘', '5개'), ('쪽파', '1.5T'), ('올리브유', '1T'), ('새우', '10마리'), ('훈제 파프리카가루', '약간'), ('볶은 천일염', '약간'), ('모둠 허브', '약간'), ('올리브유', '1T'), ('버터', '10g'), ('후추', '약간'), ('다진마늘', '2T'), ('소금', '0.3t'), ('레몬즙', '1.5T'), ('올리브오일', '30ml')]",,[]
150007,퓨전,일상,소고기,볶음,마카로니 까르보나라,마카로니까르보나라,https://recipe1.ezmember.co.kr/cache/recipe/2021/07/01/d6fa0a4ac94a934a49d4222eda0fc9d11.jpg,"1,281",15분 이내,초급,2인분,"[('마카로니', '1컵'), ('소고기', '1덩어리'), ('양파', '1/2개'), ('느타리버섯', '5개'), ('피망', '1/6개'), ('마늘', '1개'), ('모짜렐라 치즈', '적당량'), ('슬라이스 치즈', '1장'), ('소금', '톡톡'), ('후춧가루', '톡톡'), ('올리브유', '2T'), ('크림 스파게티소스', '15T'), ('바질가루', '톡톡')]",크림소스로 간단하게 만들었어요,"[{'step_number': 1, 'description': '마카로니를 준비합니다', 'image_url': 'https://recipe1.ezmember.co.kr/cache/recipe/2021/07/01/e0bcb1d56da2b270d33298918a6566421.jpg'}, {'step_number': 2, 'description': '물 3~4컵 넣고 10분 정도 끓여주세요', 'image_url': 'https://recipe1.ezmember.co.kr/cache/recipe/2021/07/01/6d7519c97511e25ba8eb68a9c457161d1.jpg'}, {'step_number': 3, 'description': '소고기를 네모로 썰어 소금 후추를 뿌려 주세요', 'image_url': 'https://recipe1.ezmember.co.kr/cache/recipe/2021/07/01/741afeaedeebf3eb2987ef7fbfa555581.jpg'}, {'step_number': 4, 'description': '양파 느타리버섯 피망을 네모로 썰어 주세요', 'image_url': 'https://recipe1.ezmember.co.kr/cache/recipe/2021/07/01/1ec75dfd9f58b525c4ae50acf562ae3c1.jpg'}, {'step_number': 5, 'description': '마늘을 납작하게 썰고 올리브유와 크림소스를 준비합니다', 'image_url': 'https://recipe1.ezmember.co.kr/cache/recipe/2021/07/01/bc1b021c82b70c78a35c8b39d4b701d61.jpg'}, {'step_number': 6, 'description': '팬에 올리브유를 두르고 예열한 후 고기와 마늘을 넣고 볶아주세요', 'image_url': 'https://recipe1.ezmember.co.kr/cache/recipe/2021/07/01/9c958433720c9ba4320f9c0381087d2f1.jpg'}, {'step_number': 7, 'description': '고기를 익힌 다음 야채를 모두 넣고 볶아주세요', 'image_url': 'https://recipe1.ezmember.co.kr/cache/recipe/2021/07/01/ac479e2da4721be7aa7d705d3fe3b8cf1.jpg'}, {'step_number': 8, 'description': '삶아진 마카로니를 건져서 넣어요', 'image_url': 'https://recipe1.ezmember.co.kr/cache/recipe/2021/07/01/01e2f0101c62a653d07a81af6d9a61791.jpg'}, {'step_number': 9, 'description': '크림소스를 넣고 골고루 섞어서 졸여 주세요', 'image_url': 'https://recipe1.ezmember.co.kr/cache/recipe/2021/07/01/310f0f0915a997f971b10df1b60f8aba1.jpg'}, {'step_number': 10, 'description': '치즈를 넣고 한번 휘저은 다음 불을 끄고', 'image_url': 'https://recipe1.ezmember.co.kr/cache/recipe/2021/07/01/3dc266bf77eb0a1dd23962982088212a1.jpg'}, {'step_number': 11, 'description': '바질가루를 뿌려 주세요', 'image_url': 'https://recipe1.ezmember.co.kr/cache/recipe/2021/07/01/2fffe820f295100e8ad0feeca07495271.jpg'}]"
