index,종류별,상황별,재료별,방법별,글 제목,레시피이름,레시피이미지,조회수,조리시간,난이도,인분,재료,소개글,조리순서
150617,퓨전,손님접대,돼지고기,조림,초간단 베트남 돼지고기 조림 팃 코 따우(Thit kho tau),돼지고기조림,https://recipe1.ezmember.co.kr/cache/recipe/2022/02/21/db61f7c210a463251b7a2f9ebff11ab81.jpg,"2,974",30분 이내,초급,4인분,"[('돼지고기 삼겹살', '400g'), ('계란', '5개'), ('코코넛밀크', '1컵'), ('샬롯', '1개'), ('마늘', '2개'), ('피쉬소스', '2큰술'), ('맛간장', '2큰술'), ('흑설탕', '1큰술')]","베트남의 국민 돼지고기 장조림 팃 코 따우를 한국식으로 재해석한 요리에요. 
설탕을 카라멜로 만들어 고기를 졸여야 하는 오리지널 레시피는 다소 어렵고 번거로워요. 설탕이 타기 시작하면 이 요리는 완전히 새로 시작해야 하거든요. 
그래서 태울 걱정 없는 게다가 절차도 아주 간단한 레시피를 만들어 봤어요. 
맛요? 두말하면 잔소리지요. 끝내준답니다. 
한국 사람에 입맛에 맞도록 간장을 추가한 팃 코 따우로 가족이나 지인들과 따뜻하고 즐거운 한 끼를 즐겨보세요.","[{'step_number': 1, 'description': '[재료준비] \n1. 삽겹살은 먹기 좋게 한 입 크기로 썰어주세요.\n코코넛우유는 코코넛워터 혹은 생수로 대체가능해요.\n2. 샬롯은 신선한 것이 제일 좋아요. 풍미가 훨씬 깊어져요. 저는 편의상 튀긴 샬롯을 사용했어요. 냉동 샬롯을 사용하셔도 괜찮아요.\n3. 마늘은 편(슬라이스)이 정석이지만 저처럼 다진 마늘을 사용하셔도 괜찮아요.\n4. 맛간장은 일반 진간장으로 대체 가능해요.삼겹살 400g, 코코넛우유 1컵, 샬롯 1개, 마늘 2개, 맛간장 2큰술▷ 오리지널 팃코따우는 통삼겹살을 사용해요. 여기에서는 조리시간을 졸이기 위해 얇은 삼겹살을 사용해요. 통삼겹살을 사용하시면 뭉텅뭉텅 크게 썰어주세요. \n▷ 오리지널 레시피는 코코넛워터를 사용해요. 코코넛우유는 잘 익은 코코넛의 흰 속살로 만들기 때문에 코코넛워터보다 점도가 높고 불투명해요. 그래서 코코넛워터로 만든 팃코따우는 투명한 갈색을 띄지만 코코넛우유로 만든 팃코따우는 불투명한 갈색을 띄어요. 맛도 좀 더 묵직하구요 가벼운 식감을 원하신다면 코코넛워터를 사용하시기를 권해요. (코코넛워터는 편의점 한 켠에서 쉽게 구매하실 수 있어요. Zico 같은 음료가 보인다면 냉큼 집어 오시면 돼요.)', 'image_url': 'https://recipe1.ezmember.co.kr/cache/recipe/2022/02/21/adfa87fc640a9282e402a31e9ce1772c1.jpg'}, {'step_number': 2, 'description': '[계란삶기] \n1. 물에 소금을 한 꼬집 넣고 강불에 계란을 삶아요.\n2. 물이 끓으면 중불로 불을 낮추고 8분 더 삶아요. (완전 반숙)\n3. 삶은 계란은 곧장 얼음물이나 차가운 물에 담궈요.\n4. 숟가락이나 젓가락을 이용해 껍데기를 제거해 주세요.계란 5개강불 -> 중불 (8분)▷ 요리 1시간 전 냉장고에서 계란을 빼 냉기를 식히면 터짐 없는 예쁜 삶은 계란을 만들 수 있어요. \n▷완전 반숙으로 익혀야 나중에 반숙으로 드실 수 있어요. 돼지고기와 함께 조리니까요. 완숙을 선호하시는 분들은 반숙(10분)으로 익혀 완숙으로 드시면 돼요.', 'image_url': 'https://recipe1.ezmember.co.kr/cache/recipe/2022/02/22/df8413f0929195e8ac95a8c9637e1fbe1.jpg'}, {'step_number': 3, 'description': '[돼지고기 불순물 제거하기] \n1. 계란을 삶는 동안 돼지고기를 삶을 냄비를 준비해요.\n2. 냄비에 돼지고기가 잠길 정도의 물을 붓고 강불에 10분 정도 삶아요.\n3. 한번 삶고 난 돼지고기는 흐르는 찬물에 두 번 헹궈주세요.삼겹살 400g▷ 미림이나 청주를 넣고 삶으면 잡내 제거에 좋아요.', 'image_url': 'https://recipe1.ezmember.co.kr/cache/recipe/2022/02/22/4c46fbaa6491da9ed0c2403869a57adc1.jpg'}, {'step_number': 4, 'description': '[돼지고기 조리기] \n1. 약불로 후라이팬을 달궈요.\n2. 팬이 달궈지면 마늘을 볶아요. 생샬롯이나 냉동샬롯을 사용하시면 이 때 샬롯도 함께 볶아요. (1-2분)\n3. 마늘 & 샬롯 향이 한 껏 올라오면 코코넛우유, 피쉬소스, 맛간장, 흑설탕, 튀긴 샬롯을 팬에 넣고 함께 끓을 때까지 중불로 조려요.\n4. 한 입 크기로 잘라 놓은 삼겹살을 3의 팬에 부어요. 이 때 소스가 모자르면(삼겹살을 충분히 적실 정도) 코코넛밀크를 추가해요. 불은 약불로 줄이고 뚜껑은 살짝 열어둔 채 15분 동안 조립니다.코코넛우유 1컵, 피쉬소스 2큰술, 맛간장 2큰술, 흑설탕 1큰술, 샬롯 1개, 마늘 2개약불(1~2분) -> 중불 -> 약불(15분)▷오리지널 팃코따우는 중불에 녹여 만든 카라멜화된 설탕에 돼지고기를 코팅시켜 볶아서 만들어요. 본래의 팃코따우를 즐기시고 싶으신 분들은 양념을 한꺼번에 모두 붓지 마시고 설탕 카라멜라이징을 먼저 꼭 해주세요.', 'image_url': 'https://recipe1.ezmember.co.kr/cache/recipe/2022/02/22/dd88b54d3f751f5a2de87ca6f10d1b731.jpg'}, {'step_number': 5, 'description': '[계란 추가하기] \n1. 15분 동안 졸인 돼지고기 조림에 삶은 계란을 더해요. 이때도 마찬가지로 뚜껑을 살짝 열어둔 채 10~15분 동안 조려요.\n2. 소스가 부족해서 계란을 적실 정도가 되지 않으면 졸이는 중간에 계란을 위 아래로 뒤집어 색이 골고루 배도록 합니다.깐 계란 5개약불(10~15분)', 'image_url': 'https://recipe1.ezmember.co.kr/cache/recipe/2022/02/22/024327994f01226d912f6e00550fa6051.jpg'}, {'step_number': 6, 'description': '[접시에 담기] \n1. 오목한 접시에 돼지고기를 가운데 올리고 소스도 충분할 정도로 함께 부어요.\n2. 삶은 계란은 반으로 나눠 고기 주변에 예쁘게 장식합니다.\n3. 쪽파와 깨를 뿌려 올려 놓으면 더욱 먹음직스러운 요리가 됩니다.', 'image_url': 'https://recipe1.ezmember.co.kr/cache/recipe/2022/02/22/ba51465d96eaac34aa707fc9c6a25c7e1.jpg'}]"
150618,퓨전,손님접대,돼지고기,조림,집들이 음식/ 손님 초대 요리/ 치즈 등갈비,치즈등갈비,https://recipe1.ezmember.co.kr/cache/recipe/2020/11/17/94f40304d64c5736d325d34c33186e031.jpg,"1,014",90분 이내,초급,2인분,"[('등 갈비', '1팩'), ('술', '1/2C'), ('대파', '1줄기'), ('양파 중간크기', '1/2개'), ('된장', '1ts'), ('새우젓', '1ts'), ('커피', '1/2ts'), ('물                                                                                등갈비 잠길 정도', ''), ('고춧가루', '2T'), ('간장', '3T'), ('소주', '2T'), ('매실 진액', '1T'), ('후추', '톡톡'), ('다진 마늘', '1T'), ('고추장', '1T'), ('매운 갈비 양념', '1T'), ('피자치즈', '식성대로')]","고기 요리를 좋아하는 아들들을 위하여 만든 음식.
젊은 층이 좋아 할만한 음식으로 내가 알고 있는 상식을 
총동원하여 만들어 보았는데 손님 초대 요리에도
 손색이 없을 것 같아서 정리해 본다.","[{'step_number': 1, 'description': '구매한 등 갈비는 찬물에 1시강 가량\n핏물을 빼준다. 중간에 한 번 물을 \n갈아 주면 더 좋다.', 'image_url': 'https://recipe1.ezmember.co.kr/cache/recipe/2020/11/17/c0d011a78f2a3e0129229635634882381.jpg'}, {'step_number': 2, 'description': '핏물 빼준 등 갈비는 애벌 스르륵 \n삶아서 불순물을 제거해 준다.', 'image_url': 'https://recipe1.ezmember.co.kr/cache/recipe/2020/11/17/67b18e443ea10ae76a9e2ced5745242f1.jpg'}, {'step_number': 3, 'description': '삶은 등 갈비는 찬물에 씻어 주는데\n뼈 사이에 들어있는 고여있는 피와 불순물을\n깨끗이 닦아주어야 누린내가 나지 않는다.', 'image_url': 'https://recipe1.ezmember.co.kr/cache/recipe/2020/11/17/c7e5d10c54e736a1c5f1ae9808fad3801.jpg'}, {'step_number': 4, 'description': '샤워를 시킨 등 갈비는 술 1/2C, 대파 1줄기,\n양파 중간 크기로 1/2개, 된장 1ts, 새우젓 1ts, \n커피 1/2ts 에 등 갈비가 잠길정도의 물을 붓고 \n한시간 가량 익혀 준다.', 'image_url': 'https://recipe1.ezmember.co.kr/cache/recipe/2020/11/17/9f0c8d25ff1964492ec9da0dd2b0717d1.jpg'}, {'step_number': 5, 'description': '등 갈비가 익을 동안 양념을 만든다.\n매운 양념 재료로는 고춧가루 2T, 간장 3T, \n소주 2T, 매실 진액 1T, 후추 톡톡, 다진 마늘 1T, \n고추장 1T, 매운 갈비 양념 1T로 골고루 섞어준다.', 'image_url': 'https://recipe1.ezmember.co.kr/cache/recipe/2020/11/17/d7c7ca1c1254ebf93a064f8bee8b23c71.jpg'}, {'step_number': 6, 'description': '부재료들은 건져 내고 매운 양념을 넣어 \n끼얹어 주면서 등 갈비를 졸여준다.', 'image_url': 'https://recipe1.ezmember.co.kr/cache/recipe/2020/11/17/56ae804da5725cc5eed6a4ae606eb0ef1.jpg'}, {'step_number': 7, 'description': '나중에 접시에 담을 때 모양이 흐트러질 까봐\n상에 내놓을 접시에 등 갈비를 올리고\n피자 치즈를 식성대로 올려준다.\n전자레인지에 2분가량 돌리니까\n피자치즈가 잘 녹았다.전자레인지', 'image_url': 'https://recipe1.ezmember.co.kr/cache/recipe/2020/11/17/c2fe28f07b5520d21ba228e2baea97421.jpg'}]"
