index,종류별,상황별,재료별,방법별,글 제목,레시피이름,레시피이미지,조회수,조리시간,난이도,인분,재료,소개글,조리순서
159659,샐러드,다이어트,해물류,회,생연어샐러드,연어샐러드,https://recipe1.ezmember.co.kr/cache/recipe/2015/09/25/9492b5cb1558984a49e12f0b972320a21.jpg,"12,762",15분 이내,초급,3인분,"[('생연어', '1토막'), ('양상추', ''), ('치커리', ''), ('베이비채소', ''), ('파프리카', ''), ('오이', ''), ('엑스트라버진 올리브오일', '5큰술'), ('발사믹식초', '5큰술'), ('올리고당', '2큰술'), ('소금', ''), ('후추', ''), ('바질', ''), ('레드페퍼', '')]",아삭한 샐러드 채소에 부드러우면서 담백한 싱싱한 연어를 넣어 만들었습니다. 드레싱도 올리브오일과 발사믹식초를 이용한 가벼운 드레싱으로 다이어트식으로 좋은 연어샐러드입니다.,"[{'step_number': 1, 'description': '생연어의 껍질을 칼로 걷어낸 다음', 'image_url': 'https://recipe1.ezmember.co.kr/cache/recipe/2015/09/30/bb0388c4b9f324f758cf34187e8c318a1.jpg'}, {'step_number': 2, 'description': '먹기 좋은 크기로 썰어주었어요.', 'image_url': 'https://recipe1.ezmember.co.kr/cache/recipe/2015/09/30/6da6d448c183162b368fd8eff11632af1.jpg'}, {'step_number': 3, 'description': '채소들은 적당한 크기로 뜯어주었어요. 좋아하는 채소를 준비하면 된답니다.', 'image_url': 'https://recipe1.ezmember.co.kr/cache/recipe/2015/09/30/d07879e6d23e0a0908931d9480226e631.jpg'}, {'step_number': 4, 'description': '접시에 채소를 고루 섞어 담은 후 연어를 보기좋게 펼쳐 담고 위에 베이비채소를 소복이 얹어주면 끝.', 'image_url': 'https://recipe1.ezmember.co.kr/cache/recipe/2015/09/30/85f5191ef8377f4d9c9896eddafe97d21.jpg'}, {'step_number': 5, 'description': '위의 드레싱 소스를 모두 섞어 소스 그릇에 담아주었어요 소스의 짠맛이나 단맛은 기호에 따라 소금이나 올리고당 또는 꿀, 설탕 등으로 조절해주면 된답니다. 올리브유와 발사믹 비율도 저는 5:5로 했는데 이것도 식성대로 넣어주세요.', 'image_url': 'https://recipe1.ezmember.co.kr/cache/recipe/2015/09/30/2006321760cbe517142f449d1122e5071.jpg'}, {'step_number': 6, 'description': '완성입니다.', 'image_url': 'https://recipe1.ezmember.co.kr/cache/recipe/2015/09/30/63d86f0b66666080fd7fd82272778d761.jpg'}]"
159660,샐러드,다이어트,해물류,회,한끼 식사로 충분한 '광어(광어자조금) 라이스페이퍼 샐러드',광어샐러드,https://recipe1.ezmember.co.kr/cache/recipe/2021/09/28/b3cbe925937ace8e48e4a7519157debc1.jpg,853,30분 이내,초급,2인분,"[('광어 회', '200g'), ('현미 라이스페이퍼', '4장'), ('어린잎 채소', '60g'), ('상추', '40g'), ('식용유', '1/2종이컵'), ('유자잼                                                                                또는 유자청', '2T'), ('양파', '2T'), ('올리브오일', '4T'), ('식초', '6T'), ('소금', '1/2t')]",다이어트 중에도 맛있게 광어를 즐길 수 있는 방법을 고민해 보다 광어회를 이용해 샐러드를 만들게 되었습니다. 광어회와 함께 씹는 식감도 즐겁고 포만감이 느껴 지도록 현미 라이스페이퍼를 튀겨서 올려 주고 상큼한 유자드레싱을 함께 곁들어 보았습니다.,"[{'step_number': 1, 'description': '샐러드 재료를 준비하는 동안 광어회는 신선도를 위해 냉장고에 보관해 주세요.\n다이어트를 위해 라이스페이퍼도 현미로 만든 것을 준비하면 더 좋겠죠.^^\n어린잎 채소 60g과 상추 40g을 씻어서 물기를 제거해 주세요.', 'image_url': 'https://recipe1.ezmember.co.kr/cache/recipe/2021/09/27/66eb03940e69ee07dacdea181a050bf91.jpg'}, {'step_number': 2, 'description': '[국내산 광어 구입인증]국내산 광어를 구입했습니다!', 'image_url': 'https://recipe1.ezmember.co.kr/cache/recipe/2021/09/27/43b3b5e5e61dd4f83783cc04c68917c71.jpg'}, {'step_number': 3, 'description': '라이스페이퍼 4장을 꺼내서 4등분해서 자릅니다.', 'image_url': 'https://recipe1.ezmember.co.kr/cache/recipe/2021/09/27/ca49169ea6b2ffa6c96871008ccaec931.jpg'}, {'step_number': 4, 'description': '후라이팬을 약불에서 달구고 식용유 1/2컵(종이컵)을 부워 주세요.\n자른 라이스페이퍼를 2~3장씩 튀겨 주세요.\n순식간에 부풀어 오르니 빠르게 튀겨 주셔야 합니다.\n*상단의 동영상을 참고해 주세요!라이스페이퍼가 많이 얇야서 불이 세면 탈 수 있어요.튀긴 라이스페이퍼에 맛소금을 조금 뿌져주면 술안주나 아이들 간식으로도 좋아요!', 'image_url': 'https://recipe1.ezmember.co.kr/cache/recipe/2021/09/27/9ebd619f8f5c287ee8485087418dff7a1.jpg'}, {'step_number': 5, 'description': '라이스페이퍼가 식을 동안 유자드레싱을 만들어 줍니다.\n유자잼 또는 유자청 2T, 양파 2T, 올리브오일 4T, 식초 6T, 소금 1/2t를 넣고 잘 섞어주세요.양파의 매운 맛이 싫으시면 10분정도 찬물에 담궜다가 쓰세요.', 'image_url': 'https://recipe1.ezmember.co.kr/cache/recipe/2021/09/27/3d47b99b16d4409e5e66572c2e4464f61.jpg'}, {'step_number': 6, 'description': '라이스페이퍼가 식으면 접시에 예쁘게 깔아주세요.', 'image_url': 'https://recipe1.ezmember.co.kr/cache/recipe/2021/09/27/6d1bf11d92cffd3ea40d6dcaa49abbbb1.jpg'}, {'step_number': 7, 'description': '그 위에 어린잎 채소와 상추를 올려 주세요.상추는 빼시고 어린잎 채소만 준비하셔도 됩니다.', 'image_url': 'https://recipe1.ezmember.co.kr/cache/recipe/2021/09/27/7bb05cfe54303033d15fdab85519caa81.jpg'}, {'step_number': 8, 'description': '그 위에 광어를 한점씩 올려 주세요.', 'image_url': 'https://recipe1.ezmember.co.kr/cache/recipe/2021/09/27/bb633f7c627d2bb3e9547ad0286c62691.jpg'}, {'step_number': 9, 'description': '미리 만들어 둔 유자드레싱을 올려 주시면 완성입니다!', 'image_url': 'https://recipe1.ezmember.co.kr/cache/recipe/2021/09/27/c8a19ab34738f9703af8c055527c86961.jpg'}, {'step_number': 10, 'description': '위 플레이팅처럼 한입에 먹기 좋게 플레이팅하시거나 어린잎 채소와 상추를 먼저 깔고 그 위에 튀긴 라이스페이퍼를 놓고 그 위에 광어회를 올리고 유자드레싱을 뿌려서 플레이팅 하는 방법도 있습니다.', 'image_url': 'https://recipe1.ezmember.co.kr/cache/recipe/2021/09/27/19ceb153ec7fdfe89adba05b216d22051.jpg'}]"
159661,샐러드,다이어트,해물류,회,연어샐러드 만들기 생연어로 신선한 샐러드와 오리엔탈 드레싱 레시피,연어샐러드,https://recipe1.ezmember.co.kr/cache/recipe/2020/09/23/5bd1cbb88e64b58667cb87dcd8cbf8591.jpg,"11,757",15분 이내,아무나,2인분,"[('연어', '160g'), ('양상추', '2줌'), ('케이퍼', '약간'), ('홀스래디쉬소스', '약간'), ('다진 양파', '1큰술'), ('올리브오일', '2큰술'), ('샴페인 비네거', '1큰술'), ('맛간장', '1큰술'), ('후추', '약간')]",생연어를 사서 먹고 남은 연어로 간단한 한끼 식사나 안주로도 좋아요.,"[{'step_number': 1, 'description': '샐러드용 채소를 씻어 물기를 빼두어요.', 'image_url': 'https://recipe1.ezmember.co.kr/cache/recipe/2020/09/23/0d41d88d856c9ec571c0b3b4d3b8e7891.jpg'}, {'step_number': 2, 'description': '생연어라면 슬라이스해요.', 'image_url': 'https://recipe1.ezmember.co.kr/cache/recipe/2020/09/23/3bc0ecc2ebea90829559bccbaaf400231.jpg'}, {'step_number': 3, 'description': '연어를 돌돌 말아요.', 'image_url': 'https://recipe1.ezmember.co.kr/cache/recipe/2020/09/23/ef62bafd154913b9058d716a0b0a13171.jpg'}, {'step_number': 4, 'description': '물기 뺀 채소를 접시에 담아요.', 'image_url': 'https://recipe1.ezmember.co.kr/cache/recipe/2020/09/23/f819b023ab03e1feb2fd9b639100cbd01.jpg'}, {'step_number': 5, 'description': '돌돌 만 연어를 접시에 담고요. 홀스래디쉬소스와 케이퍼를 조금씩 올려요.', 'image_url': 'https://recipe1.ezmember.co.kr/cache/recipe/2020/09/23/db660a6cc73daabe0dbde3718933926b1.jpg'}, {'step_number': 6, 'description': '오리엔탈 소스 재료를 볼에 넣고 섞여 드레싱을 만들어요. 양파는 곱게 다져서 넣으세요.', 'image_url': None}]"
159662,샐러드,다이어트,해물류,회,"훈제연어샐러드 & 유자드레싱 레시피 - 건강한 다이어트식단, 손님접대",훈제연어샐러드,https://recipe1.ezmember.co.kr/cache/recipe/2022/02/16/209e2df7626a7e8cd50748d482b871621.jpg,"2,051",30분 이내,아무나,2인분,"[('훈제연어', '150g'), ('샐러드야채', '150g'), ('토마토', '1개'), ('오이', '1개'), ('삶은계란', '4개'), ('리코타치즈', '2큰술'), ('크랜베리', '50g'), ('블랙올리브', '8개'), ('유자청', '1큰술'), ('매실청', '2큰술'), ('허니머스터드', '1큰술'), ('레몬즙', '2큰술'), ('고추냉이', '1작은술')]","새해들어 다이어트 좀 해보자! 하고 만들어먹은 샐러드입니다.
훈제연어와 계란, 야채를 골고루 먹을 수 있어 참 좋아요.
상큼한 유자드레싱과 잘 어울린답니다.","[{'step_number': 1, 'description': '훈제연어샐러드 만들 재료 준비했어요.\n냉장고 속 남은 야채를 이용하시면 좋아요.', 'image_url': 'https://recipe1.ezmember.co.kr/cache/recipe/2022/02/16/6de1e82b1bb746eb3725cf18eab2f8e31.jpg'}, {'step_number': 2, 'description': '샐러드야채는 식초 2큰술 탄 물에 5분 담구었다가 세번 헹구어서 채반에 받쳐 물기를 빼주었어요', 'image_url': 'https://recipe1.ezmember.co.kr/cache/recipe/2022/02/16/d781bac7e8bbad022dc8f73283421a581.jpg'}, {'step_number': 3, 'description': '삶은 계란은 4등분하고 토마토는 깍둑썰기, 오이는 1센치 두께로 썰어주었어요.\n가스불 절약해서 원하는 타입으로 계란삶는 팁 링크 올려드릴께요.\n★계란 삶는 법:  @6974022', 'image_url': 'https://recipe1.ezmember.co.kr/cache/recipe/2022/02/16/bbb43750dd49f8029436d33f5f972b3b1.jpg'}, {'step_number': 4, 'description': '분량의 양념을 넣고 유자드레싱 만들거예요유자청 1큰술, 매실청 2큰술, 허니머스타드 1큰술, 레몬즙 2큰술, 마요네즈 1큰술, 고추냉이 1작은술', 'image_url': 'https://recipe1.ezmember.co.kr/cache/recipe/2022/02/16/cf4a637ec6cb1d2b4642f9ac607071941.jpg'}, {'step_number': 5, 'description': '잘 저어서 유자드레싱 만들어주세요.\n상큼달달한 유자드레싱은 샐러드와 잘 어울린답니다.', 'image_url': 'https://recipe1.ezmember.co.kr/cache/recipe/2022/02/16/e1421b07dbddcd85cd32893bec78641f1.jpg'}, {'step_number': 6, 'description': '접시에 야채를 넣어주세요', 'image_url': 'https://recipe1.ezmember.co.kr/cache/recipe/2022/02/16/1d7025bc7921a3c2f6e8e6063d855b961.jpg'}, {'step_number': 7, 'description': '훈제연어는 10센치 길이로 썰어서 돌돌 말아서 올려주세요', 'image_url': 'https://recipe1.ezmember.co.kr/cache/recipe/2022/02/16/9b9b5da0bbbbc64a0c7f4e6fe7e6dfbf1.jpg'}, {'step_number': 8, 'description': '삶은 계란은 가장자리에 돌려담아 주었어요', 'image_url': 'https://recipe1.ezmember.co.kr/cache/recipe/2022/02/16/52a2c8c321f556f5c1db4b4bfdecc9031.jpg'}, {'step_number': 9, 'description': '오이와 크랜베리를 적당히 올려주고', 'image_url': 'https://recipe1.ezmember.co.kr/cache/recipe/2022/02/16/de6c6f3c935bb760009e164f28aa91771.jpg'}, {'step_number': 10, 'description': '리코타치즈는 스푼으로 떠서 올렸습니다.\n다이어트식단으로도 좋고 손님접대용으로도 아주 좋아요.\n상큼달달한 유자드레싱 곁들여서 맛있게 드세요.', 'image_url': 'https://recipe1.ezmember.co.kr/cache/recipe/2022/02/16/d109409e26927eb7d5f44a23122081e41.jpg'}]"
159663,샐러드,다이어트,해물류,회,"맛과 영양은 기본, 아삭~ 새콤~ 생참치 야채샐러드",참치야채샐러드,https://recipe1.ezmember.co.kr/cache/recipe/2016/02/09/3adc325c2b31edef607d53550951120d1.jpg,"5,122",30분 이내,아무나,2인분,"[('참치                                                                                등살-아카미', '200g'), ('적양파', '1/2개'), ('파프리카(노랑)', '1/4개'), ('파프리카(빨강)', '1/4개'), ('오이', '1/2개'), ('새잎', '약간'), ('새싹', '약간'), ('발사믹드레싱', '적당량')]","얼리지 않은 생참치는 참치 본래의 영양(DHA, EPA, 오메가6지방산, 셀레늄, 비타민, 철분, 아미노산 등)이 살아있이며, 고단백-저지방-저칼로리의 뛰어난 다이어트 식품입니다. 또한 생참치는 야채(채소)와 잘어우러지기 때문에 다양한 식감과 색상의 각종 야채를 소재로 한 생참치 야채샐러드는 술안주, 또는 다이어트에 좋은 메뉴가 될 것입니다. 이에 생참치 전문 쇼핑몰 참치온라인에서는 남녀노소 누구에게나 좋고 간편하게 만들 수 있는 생참치 야채샐러드를 소개합니다.","[{'step_number': 1, 'description': '얼리지 않고 산지 항공 냉장직송으로 공수한 생참치 등살(아카미) 500g 블럭입니다.\n(생참치는 생참치 전문 쇼핑몰 참치온라인에서 구매하실 수 있습니다.)', 'image_url': 'https://recipe1.ezmember.co.kr/cache/recipe/2016/02/09/44b3176277ca571e166f6924e522af321.jpg'}, {'step_number': 2, 'description': '진공비닐포장으로 벗기면 생참치의 탱글탱글한 속살이 드러납니다~ 더불어 생참치 특유의 드립도 있습니다.', 'image_url': 'https://recipe1.ezmember.co.kr/cache/recipe/2016/02/09/a8d6211745a017b638958b21fa3c8ba51.jpg'}, {'step_number': 3, 'description': '식수건(또는 면포)이나 키친타올 등으로 가볍게 눌러 드립을 닦아 냅니다.', 'image_url': 'https://recipe1.ezmember.co.kr/cache/recipe/2016/02/09/89060c2acf07206792cf00a1b32a2ae71.jpg'}, {'step_number': 4, 'description': '필요한 양만큼 생참치를 잘라 냅니다.', 'image_url': 'https://recipe1.ezmember.co.kr/cache/recipe/2016/02/09/638def6e328e544b8fd598d2f6ae8f681.jpg'}, {'step_number': 5, 'description': '샐러드에 적합하게 생참치 회크기로 잘라 잠시 냉장실에 넣어 둡니다. 이렇게 하면 숙성이 진행되며 아름답게 발색이 나옵니다.(발색이란 참치의 속살이 산소와 만나면서 본래의 색을 발현하는 과정을 말합니다.)', 'image_url': 'https://recipe1.ezmember.co.kr/cache/recipe/2016/02/09/1d5ef1dc34dd7f739e56f7fbfb0263811.jpg'}, {'step_number': 6, 'description': '자 이제 샐러드 준비를 해 볼까요? 새싹과 새잎을 씻어서 채에 받칩니다.', 'image_url': 'https://recipe1.ezmember.co.kr/cache/recipe/2016/02/09/6415c7f513797e749f598f4834dd3b111.jpg'}, {'step_number': 7, 'description': '오이는 부드러운 식감을 위해서 껍질을 벗기고, 얇게 썰어 줍니다~', 'image_url': 'https://recipe1.ezmember.co.kr/cache/recipe/2016/02/09/80ac0800621040486739177f1de80b121.jpg'}, {'step_number': 8, 'description': '그냥 양파도 좋지만 오늘은 혈액순환과 다이어트 효과가 뛰어난 적양파를 사용하겠습니다. 적양파를 다듬고 씻어 줍니다.', 'image_url': 'https://recipe1.ezmember.co.kr/cache/recipe/2016/02/09/9153dcdfd50bc9ee78325a619f8cd80d1.jpg'}, {'step_number': 9, 'description': '적양파를 얇게 썰어 주세요.', 'image_url': 'https://recipe1.ezmember.co.kr/cache/recipe/2016/02/09/fa98ed56b2708eb8917eae1ba6a543f21.jpg'}, {'step_number': 10, 'description': '파프리카는 빨강과 노랑으로 색을 맞춰서 씨를 긁어 낸 후 얇게 썰어 줍니다. 파프리카의 아삭한 식감은 이 샐러드의 흥미로운 요소입니다.', 'image_url': 'https://recipe1.ezmember.co.kr/cache/recipe/2016/02/09/9a431fd177d212cd41749d9a15b1ae231.jpg'}, {'step_number': 11, 'description': '야채가 모두 준비되었으면 볼에 가지런히 담아 줍니다.', 'image_url': 'https://recipe1.ezmember.co.kr/cache/recipe/2016/02/09/f96c3b5d9ebc8f2a60c464a59f8da5871.jpg'}, {'step_number': 12, 'description': '접시의 가운데 샐러드를 컬러풀하게 얹어주시고, 생참치로 둘레를 채워줍니다.', 'image_url': 'https://recipe1.ezmember.co.kr/cache/recipe/2016/02/09/871aa8c0803642699f1c2eb279aa13001.jpg'}, {'step_number': 13, 'description': '샐러드 위에 발사믹드레싱을 적당히 뿌려 주세요.', 'image_url': 'https://recipe1.ezmember.co.kr/cache/recipe/2016/02/09/12676d7659428cbb2e72ea7f0523128f1.jpg'}, {'step_number': 14, 'description': '생참치는 특유의 찰진 식감과 감칠맛으로 야채와 아주 잘 어울립니다.', 'image_url': 'https://recipe1.ezmember.co.kr/cache/recipe/2016/02/09/bd2b32c6887c48e42ef0611d189f0ab11.jpg'}]"
159664,샐러드,다이어트,해물류,회,맛있다!건강하다!! 다이어터들을 위한!!! <광어 카르파쵸 두부 파스타>,카르파쵸파스타,https://recipe1.ezmember.co.kr/cache/recipe/2021/09/30/79a56b0809ca64f7e11ee6cd7d7f6b531.jpg,"1,494",60분 이내,초급,1인분,"[('국내산 광어', '150g'), ('올리브오일', '2T'), ('레몬즙', '2T'), ('소금', '약간'), ('후추', '약간'), ('오리엔탈 드레싱', '3T'), ('스위트칠리소스', '1T'), ('발사믹 식초', '1T'), ('케찹', '1t'), ('머스타드', '1t'), ('소금', '약간'), ('후추', '약간'), ('샐러드 채소', '50g'), ('두부면', '100g'), ('양파', '1/4개'), ('노랑 파프리카', '1/4개'), ('빨강 파프리카', '1/4개')]","365일 내내 다이어트중인 우리들...
세상 모든 다이어터분들을 위하여 건강하고 맛까지 좋은 광어 카르파쵸 두부 파스타를 만들어 봤어요:) 
싱싱한 국내산 광어와 단백질 만땅 두부면의 새콤달콤 하모니!! 우리 같이 그 매력에 빠져봐요~","[{'step_number': 1, 'description': '[광어 카르파쵸]\n국내산 광어를 준비해 주세요.', 'image_url': 'https://recipe1.ezmember.co.kr/cache/recipe/2021/09/30/fbd7f4ad7aa9e1a45e6b8815a41f2ef41.jpg'}, {'step_number': 2, 'description': '준비한 광어를 사선으로 얇게 편을 썰어주고 소금, 후추로 간을 해줍니다.\n간을 한 광어에 올리브유와 레몬즙을 뿌려 냉장고에 넣고 20분간 숙성 시킵니다.', 'image_url': 'https://recipe1.ezmember.co.kr/cache/recipe/2021/09/30/9a4d7a0ed48c381fde523dae47367ea41.jpg'}, {'step_number': 3, 'description': '[샐러드 채소]\n양파는 얇게 슬라이스 해서 찬물에 담궈 매운기를 빼줍니다.\n파프리카는 4cm 정도의 스틱모양으로 썰어주고 샐러드 채소는 흐르는물에 깨끗이 씻어 물기를 제거하고 준비해 둡니다.취향에 따라 샐러드 채소는 변경 가능합니다!\n저는 어린잎 샐러드 채소를 사용했어요.', 'image_url': 'https://recipe1.ezmember.co.kr/cache/recipe/2021/09/30/f1861d7b584e02ef5de79837fc7033071.jpg'}, {'step_number': 4, 'description': '[샐러드 드레싱]\n오리엔탈드레싱, 발사믹식초, 스위트칠리소스, 케찹, 머스타드를 넣고 섞어줍니다.\n기호에 맞게 소금과 후추를 넣어 간을 맞춰줍니다.사용하는 소스는 시판 소스로 시중에서 쉽게 구할 수 있습니다.', 'image_url': 'https://recipe1.ezmember.co.kr/cache/recipe/2021/09/30/6faa50a8521fdf5a8901fef9fddc35ee1.jpg'}, {'step_number': 5, 'description': '[두부면]\n두부면은 끓는 물에 20초 정도 삶은 뒤 흐르는 찬물에 빠르게 헹궈주세요.두부면을 30초이상 삶으면 면이 퍼질 수 있으니 주의하세요!', 'image_url': 'https://recipe1.ezmember.co.kr/cache/recipe/2021/09/30/7b0455385659ec2e75147bb07125c5eb1.jpg'}, {'step_number': 6, 'description': '[샐러드 믹스]\n볼에 물기를 제거한 양파, 파프리카, 샐러드채소, 두부면, 준비해둔 광어 카르파쵸와 드레싱을 기호에 맞게 넣고 잘 섞어주세요.광어 카르파쵸는 레몬즙의 산 성분에 의하여 겉면이 살짝 익습니다. \n광어의 겉 표면이 불투명해졌다면 요리가 잘 진행되고 있는것이니 안심하세요!', 'image_url': 'https://recipe1.ezmember.co.kr/cache/recipe/2021/09/30/b6437f0f2a291ff85107acead15834dd1.jpg'}, {'step_number': 7, 'description': '[플레이팅]\n완성된 요리를 접시나 파스타 볼에 예쁘게 담아줍니다.파마지아노 치즈가루더 강한 풍미를 위해 파마산과 같은 치즈가루를 뿌려주시면 더욱 더 맛있게 즐기실 수 있습니다. 저는 파마지아노 치즈를 강판에 갈아 뿌려주었습니다!', 'image_url': 'https://recipe1.ezmember.co.kr/cache/recipe/2021/09/30/2f38483129783b96f6fd7ad24d6405631.jpg'}]"
159665,샐러드,다이어트,해물류,회,[살 빠지는 레시피] 약 464Kcal 훈제연어채소롤 어버이날 홈파티 음식,훈제연어채소롤,https://recipe1.ezmember.co.kr/cache/recipe/2023/05/08/1b5d2b56f91ba58b44f6bed1a4ca28851.jpg,"1,085",30분 이내,초급,1인분,"[('훈제연어', '80g'), ('양파', '1/2개'), ('적양배추', '40g'), ('당근', '50g'), ('아삭이고추', '1개'), ('크림치즈', '1수저'), ('마요네즈', '1수저'), ('꿀', '1수저'), ('레몬주스', '1')]","살 빠지는 레시피로 다이어트 중 루나에요. '아침은 왕처럼, 저녁은 거지처럼'이란 말 한 번쯤 들어보셨죠? 아주 다른 말은 아니지만 극단적인 식단은 피해야 합니다. 아침은 다이어트 중 질 좋은 탄수화물을 충분히 섭취해야 하는 아침입니다. 점심은 외부 활동이 많으니 과하지 않은 탄수화물과 충분한 단백질로 남은 하루에 에너지와 생기를 불어넣어 줄 한 그릇이 필요해요. 저녁은 다이어트 기간 중 최대의 고비, 낮에 탄수화물을 먹었으니 저녁에는 탄수화물을 최대한 줄여서 드셔보세요. 오늘은 탄수화물이 없는 다이어트레시피 들고 왔어요. 맛있는 훈제 연어와 다양한 채소가 입안 가득 씹히는 별미 훈제연어채소롤입니다. 훈제연어에 채소 넣어서 돌돌 말러 가볼까요?","[{'step_number': 1, 'description': '양파는 얇게 슬라이스하고 찬물에 10분 이상 담가 매운맛을 뺀 뒤 물기를 제거해 주세요. 적양배추도 얇게 슬라이스하고 물에 담가 주었다가 깨끗이 씻어주세요.', 'image_url': 'https://recipe1.ezmember.co.kr/cache/recipe/2023/05/08/18d2bae7b75dfd727ab37c97bd22536e1.jpg'}, {'step_number': 2, 'description': '당근, 아삭이고추는 길게 채 썰어주세요.', 'image_url': 'https://recipe1.ezmember.co.kr/cache/recipe/2023/05/08/443ac789257ec258c0068982062978331.jpg'}, {'step_number': 3, 'description': '저는 크린베리 크림치즈를 사용하여 색깔이 분홍색이에요. 작은 볼에 크림치즈, 마요네즈, 꿀, 레몬주스를 넣고 잘 섞어 소스를 만듭니다.', 'image_url': 'https://recipe1.ezmember.co.kr/cache/recipe/2023/05/08/137d6849ff40907954f588ed9a5966bf1.jpg'}, {'step_number': 4, 'description': '도마에 훈제연어를 깔고 그 위에 적양배추, 양파, 아삭이고추, 당근을 순서대로 겹쳐 올려줘요. 훈제연어를 돌돌 말아 감싸 훈제연어채소롤을 만듭니다.', 'image_url': 'https://recipe1.ezmember.co.kr/cache/recipe/2023/05/08/2c402b8bc371097faac4ebb65c28bcb11.jpg'}, {'step_number': 5, 'description': '접시에 훈제연어채소롤을 담고 소스, 파슬리가루를 뿌려주세요.', 'image_url': 'https://recipe1.ezmember.co.kr/cache/recipe/2023/05/08/cb1f1c10d716be611a148128a1f9c72b1.jpg'}]"
159666,샐러드,다이어트,해물류,회,키토제닉 식단: 연어 샐러드,연어샐러드,https://recipe1.ezmember.co.kr/cache/recipe/2020/10/23/9a23fc2761a1f52ed329fe4c5a86ddb41.jpg,"2,187",30분 이내,아무나,2인분,"[('횟감용 연어', '400g'), ('아보카도', '1개'), ('토마토', ''), ('오이', ''), ('로메인상추', '')]","요즘 저는

키토제닉 식단

에 관심을 가지고 있어요.

​

12월에 건강검진 예약을 해 놓은 상태고

이번 기회에

6주 동안

키토제닉 식단에 집중 해 본 후

건강검진 결과를 보고 싶은 맘이 생겼습니다.

​

키토제닉 식단에 관심 있으신

이웃님들께

작은 나눔이 되었으면 좋겠습니다.","[{'step_number': 1, 'description': '연어\n로메인 상추\n방울 토마토\n오이\n아보카도\n양파\n※냉장고에 있는 채소들을 활용해주세요.', 'image_url': 'https://recipe1.ezmember.co.kr/cache/recipe/2020/10/23/c708bd11e5df713499ac32df4032a04e1.jpg'}, {'step_number': 2, 'description': '연어는 먹기 좋게\n깍뚝 썰기를 해줍니다.', 'image_url': 'https://recipe1.ezmember.co.kr/cache/recipe/2020/10/23/e1fc550bd893453bc0c983c0bf1b06781.jpg'}, {'step_number': 3, 'description': '소스는 간단하게\n간장1:\n식초1:\n육수(또는 물)1\n천연 감미료로 단맛을 조절합니다.\n※키토제닉 식단에서 설탕은 완전하게 빼야합니다.', 'image_url': 'https://recipe1.ezmember.co.kr/cache/recipe/2020/10/23/1df347a275a56cd7fe7c8f74a95c59f91.jpg'}, {'step_number': 4, 'description': '원하는 만큼 소스를 넣고\n재료들과 잘 섞어줍니다.', 'image_url': 'https://recipe1.ezmember.co.kr/cache/recipe/2020/10/23/892c8c476083afc9e54f40505e8120361.jpg'}, {'step_number': 5, 'description': '토마토,연어,오이,아보카도,로메인상추,양파\n재료들의 어우러짐이\n참 맛있어요.', 'image_url': 'https://recipe1.ezmember.co.kr/cache/recipe/2020/10/23/7d55fd8115e2ac671971eb1ceef031a51.jpg'}]"
