index,종류별,상황별,재료별,방법별,글 제목,레시피이름,레시피이미지,조회수,조리시간,난이도,인분,재료,소개글,조리순서
155999,양식,손님접대,육류,볶음,갈릭 찹스테이크,갈릭찹스테이크,https://recipe1.ezmember.co.kr/cache/recipe/2015/04/02/8444f66a3167b13a499ff1d12c25a0df1.jpg,"90,615",None,None,None,"[('소고기안심', '300g'), ('마늘', '10톨'), ('양파', '1/4개'), ('파프리카', '약간'), ('피망', '약간'), ('파슬리가루', ''), ('올리브오일', '2숟갈'), ('소금', '약간'), ('후추', '약간'), ('스테이크소스', '3숟갈'), ('케첩', '3숟갈'), ('핫소스', '1숟갈'), ('굴소스', '1/3숟갈'), ('조청', '1숟갈'), ('후추', '약간')]",고급 외식메뉴인 갈릭찹스테이크~ 먹기좋게 썰어서 야채랑 함께 소스에 볶아만든 찹스테이크는 먹기도 편해서 특히 아이들이 좋아한답니다,"[{'step_number': 1, 'description': '찹스테이크에 사용할 고기로는 한우 안심으로 준비했어요~ \n한우 안심은 한입크기로 잘라주세요~', 'image_url': 'https://recipe1.ezmember.co.kr/cache/recipe/2015/04/02/ef94386c3f813806a47ebbe31e1e79b91.jpg'}, {'step_number': 2, 'description': '고기밑간 재료들(올리브오일 2숟갈, 소금, 후추 약간씩)을 넣고 조물조물 버무려서 30분정도 재워둡니다~', 'image_url': 'https://recipe1.ezmember.co.kr/cache/recipe/2015/04/02/cfa2b6567deccede7b8bde73f5216dba1.jpg'}, {'step_number': 3, 'description': '함께 볶아줄 채소는 먹기좋은 크기로 썰어주시구여 마늘은 듬뿍 준비해서 도톰하게 반으로 슬라이스해주었어요~~', 'image_url': 'https://recipe1.ezmember.co.kr/cache/recipe/2015/04/02/30380e24c6a7fd556c4878f85c285abb1.jpg'}, {'step_number': 4, 'description': '찹스테이크소스도 미리 만들어 준비해주세요~', 'image_url': 'https://recipe1.ezmember.co.kr/cache/recipe/2015/04/02/6c21f2e1676c4ab28cea3ba1b4ef9dd51.jpg'}, {'step_number': 5, 'description': '달군팬에 오일을 한숟갈 두른후 마늘부터 넣고 달달 볶아 향긋한 마늘향을 내어줍니다~~', 'image_url': 'https://recipe1.ezmember.co.kr/cache/recipe/2015/04/02/6ae7db28a9f033cf4fe08cb759b45d5a1.jpg'}, {'step_number': 6, 'description': '마늘이 노릇하게 익어 고소한 냄새가 나면 소고기를 넣고 센불에서 고기의 육즙이 빠지지 않도록 재빨리 볶아줍니다', 'image_url': 'https://recipe1.ezmember.co.kr/cache/recipe/2015/04/02/d93a7b0a187349cf5e62868f98a900561.jpg'}, {'step_number': 7, 'description': '고기가 절반정도 익었을때.. 채소들도 모두 넣고 볶아줍니다', 'image_url': 'https://recipe1.ezmember.co.kr/cache/recipe/2015/04/02/0b7af8405764d481303c5f8e8d8e0af31.jpg'}, {'step_number': 8, 'description': '마지막에 스테이크소스를 모두 넣고 역시 재빨리 볶아주세요', 'image_url': 'https://recipe1.ezmember.co.kr/cache/recipe/2015/04/02/960267a2c3af3b1428e4ebfce13acca71.jpg'}, {'step_number': 9, 'description': '레스토랑보다 훨씬 맛있는 갈릭찹스테이크가 완성되었답니다', 'image_url': 'https://recipe1.ezmember.co.kr/cache/recipe/2015/04/02/b434702e53de287051d91e9762d0b0a41.jpg'}]"
156000,양식,손님접대,육류,볶음,양고기챱스테이크,양고기챱스테이크,https://recipe1.ezmember.co.kr/cache/recipe/2020/11/27/e57770e45f92bde71ae3e02143f188a41.jpg,"8,724",15분 이내,아무나,2인분,"[('양고기', '400g'), ('양파', '200g'), ('브로컬리', '100g'), ('방울토마토', '100g'), ('올리브오일', '2큰술'), ('소금', '1작은술'), ('후추', '1/2작은술'), ('허브', '1작은술')]","꼬치집에서 쯔란 찍어 먹는 걸로 인기있는 양고기를 집에서 맛있게 크리스마스요리로 즐겨보아요

재료: 양목심400g, 양파200g, 브로컬리100g, 방울토마토100g
양념: 올리브오일2큰술, 소금1작은술, 후추1/2작은술, 허브가루1작은술

양고기를 2cm 두께로 깍뚝썰기한 다음 양념의 반을 뿌려 재워요
양파, 브로컬리, 방울토마토를 깍뚝썰기해놓아요
팬에 양파, 올리브오일을 두르고 센불에 볶다가 고기를 넣어 익혀요
브로컬리를 넣고 같이 볶다가 나머지 양념을 뿌려요
방울토마토를 넣고 1~2분 더 볶다가 불을 끄고 접시에 내면 완성!!!","[{'step_number': 1, 'description': '양고기는 목심살로 준비해 2cm 두께로 깍뚝썰어요', 'image_url': 'https://recipe1.ezmember.co.kr/cache/recipe/2020/11/27/be5856db753d494d987823b7a8695f391.jpg'}, {'step_number': 2, 'description': '양념의 반을 넣어 밑간양념해요', 'image_url': 'https://recipe1.ezmember.co.kr/cache/recipe/2020/11/27/fb1f912457ff714c6f92ec936412eeba1.jpg'}, {'step_number': 3, 'description': '양파, 브로커리, 방울토마토도 깍뚝썰어요', 'image_url': 'https://recipe1.ezmember.co.kr/cache/recipe/2020/11/27/ae913ddfe28b9a87abc7bcb4a5c0b5471.jpg'}, {'step_number': 4, 'description': '올리브오일을 두른팬에 양파, 양고기를 넣어 볶아요불은 센불에서 고기가 안익으면 좀 줄여요', 'image_url': 'https://recipe1.ezmember.co.kr/cache/recipe/2020/11/27/f7fe882dbeab55cfd36922f0428d83b31.jpg'}, {'step_number': 5, 'description': '브로컬리를 넣고 나머지 양념을 뿌리고 익혀요중불', 'image_url': 'https://recipe1.ezmember.co.kr/cache/recipe/2020/11/27/2e1ee8d6cdf3fe9370d8391a62c744851.jpg'}, {'step_number': 6, 'description': '고기가 익어가면 불을 세게 올려요', 'image_url': 'https://recipe1.ezmember.co.kr/cache/recipe/2020/11/27/83817db8288f79691eb081bcc3d7775b1.jpg'}, {'step_number': 7, 'description': '마지막으로 방울토마토를 넣고 1~2분 정도 더 볶다가 접시에 냅니다', 'image_url': 'https://recipe1.ezmember.co.kr/cache/recipe/2020/11/27/94c9769314af3097c6ee07e3ede50ad81.jpg'}]"
156001,양식,손님접대,육류,볶음,갈릭 찹스테이크,갈릭찹스테이크,https://recipe1.ezmember.co.kr/cache/recipe/2015/07/10/01def8dbd1b1e049e1643dd6d7c02fd2.jpg,"5,962",30분 이내,초급,2인분,"[('스테이크용 채끝살', '360g'), ('마늘칩용 마늘', '10~15쪽'), ('해바라기씨유', '약간'), ('후춧가루', '약간'), ('굴소스', '1작은술'), ('참기름', '1큰술'), ('다진마늘', '1큰술'), ('맛술', '5큰술'), ('생수', '3큰술'), ('버터', '1큰술'), ('소금', '약간'), ('굴소스', '1작은술')]",마늘소스가 들어가 향이 좋은 갈릭 찹스테이크입니다.,"[{'step_number': 1, 'description': '신선한 고기를 먼저 준비해시주시고, 먹기 적당한 크기로 썰어주세요.', 'image_url': 'https://recipe1.ezmember.co.kr/cache/recipe/2015/07/10/0e4a85ca3239e0f769b4620fa23863531.jpg'}, {'step_number': 2, 'description': '적당한 크기로 썰어둔 고기는 제시해둔 분량의 양념에 미리 밑간을 해둡니다.', 'image_url': 'https://recipe1.ezmember.co.kr/cache/recipe/2015/07/10/7f4c4ef9da94e4711f30872568f6cd7f1.jpg'}, {'step_number': 3, 'description': '얇게 썰어둔 마늘 편은 해바라기씨유를 자작하게 두른 팬에 바삭바삭 튀겨주시면 된답니다.', 'image_url': 'https://recipe1.ezmember.co.kr/cache/recipe/2015/07/10/78f6bf81dfdb5111a1757ebcd4a9c93d1.jpg'}, {'step_number': 4, 'description': '튀겨낸 마늘은 키친타올 위에 올려 기름기를 쫙 빼주세요.', 'image_url': 'https://recipe1.ezmember.co.kr/cache/recipe/2015/07/10/6c4bfd08eab4be5588aaeccf8bade93d1.jpg'}, {'step_number': 5, 'description': '팬에 소스용 다진마늘을 넣고 중약불에서 2분 볶아준 뒤 약한불로 줄이고 분량의 맛술과 생수, 굴소스를 넣고 5분간 끓여준 뒤 버터와 소금을 넣고 빨리 저어가면서 녹인 다음 불을 꺼주시면 됩니다.', 'image_url': 'https://recipe1.ezmember.co.kr/cache/recipe/2015/07/10/155f385d650d4409bcfc70efb24571e41.jpg'}, {'step_number': 6, 'description': '팬에 해바라기씨유를 살짝 두르고, 밑간 해둔 고기를 갈색이 되도록 적당히 익혀주세요. 접시위에 구운 고기를 올려주고, 마늘 소스를 뿌려준 뒤 기름 쏙 뺀 마늘 칩을 솔솔 뿌려주면 완성입니다.', 'image_url': 'https://recipe1.ezmember.co.kr/cache/recipe/2015/07/10/cecf488d85ccde4e2a06b753e48ba8b41.jpg'}]"
156002,양식,손님접대,육류,볶음,알록달록 매력적인 홈파티 음식 파인애플 소고기볶음 만드는 법,파인애플소고기볶음,https://recipe1.ezmember.co.kr/cache/recipe/2023/12/07/1bcd3ddd232ff168f42c3e229f39a9ec1.jpg,359,30분 이내,아무나,2인분,"[('소안심', '400g'), ('파인애플', '200g'), ('마늘', '5개'), ('양파', '1/2개'), ('피망', '1/2개'), ('빨간 파프리카', '1/2개'), ('당근', '1/4개'), ('스테이크 소스', '5T'), ('식용유', '3T'), ('소금', '2꼬집'), ('후춧가루', '2꼬집'), ('파슬리가루', '1꼬집')]","벌써 2023년이 지나가고 2024년이 찾아오고 있습니다. 돈 주고 살 수 없는 것 중에 한 가지가 시간이라고 생각합니다. 흘러가는 시간은 막을 수가 없다는 것이 정말 슬픈데요, 2023년도 이렇게 잘 보내줘야 2024년도 반갑게 맞이할 수 있지 않을까요? 오늘은 크리스마스, 연말, 연초 등 홈파티를 계획하고 계신 분들을 위해서 홈파티 음식을 만들었습니다. 홈파티 음식은 맛은 기본 시각적으로 보기 좋게 만들면 사람들에게 주목받을 수 있습니다. 그래서 오늘은 홈파티 음식으로 적합한 파인애플 소고기볶음을 만들었습니다. 저는 파인애플, 소고기 외 각종 채소를 사용해서 알록달록하게 만들었습니다. 그럼 지금 바로 파인애플 소고기볶음 만드는 법을 알려드립니다.","[{'step_number': 1, 'description': '마늘은 반으로 썰어 준비합니다.도마 , 조리용나이프', 'image_url': 'https://recipe1.ezmember.co.kr/cache/recipe/2023/12/07/56cd392d47c3a33d3c4fc8e4cb810fd51.jpg'}, {'step_number': 2, 'description': '양파, 피망, 빨간 파프리카는 2x2cm 간격으로 썰어 준비합니다.', 'image_url': 'https://recipe1.ezmember.co.kr/cache/recipe/2023/12/07/767107ead0772889ee199f3e129ae0031.jpg'}, {'step_number': 3, 'description': '당근은 반달 모양으로 0.3m 간격으로 썰어 준비합니다.', 'image_url': 'https://recipe1.ezmember.co.kr/cache/recipe/2023/12/07/15bc3ee9580e240794476afacd9ebd321.jpg'}, {'step_number': 4, 'description': '파인애플은 먹기 좋은 크기로 썰어 준비합니다.', 'image_url': 'https://recipe1.ezmember.co.kr/cache/recipe/2023/12/07/9a87621f5af3aecd70c6d4e545e408e31.jpg'}, {'step_number': 5, 'description': '소안심은 먹기 좋은 크기로 썰고', 'image_url': 'https://recipe1.ezmember.co.kr/cache/recipe/2023/12/07/58b6b1298b551e855644eb74fba35a0b1.jpg'}, {'step_number': 6, 'description': '볼에 소고기, 소금 2꼬집, 후춧가루 2꼬집을 넣고 골고루 섞어 밑간을 합니다.믹싱볼', 'image_url': 'https://recipe1.ezmember.co.kr/cache/recipe/2023/12/07/0e58f20921b40738e36e6d9f8392dd4d1.jpg'}, {'step_number': 7, 'description': '예열된 팬에 식용유 3T를 두르고 소안심을 넣어 볶습니다.궁중팬 , 조리용스푼', 'image_url': 'https://recipe1.ezmember.co.kr/cache/recipe/2023/12/07/9cd26fae68f6a4eac5dc5be01214dc251.jpg'}, {'step_number': 8, 'description': '소안심이 알맞게 익었을 때 마늘, 양파, 피망, 빨간 파프리카, 당근, 파인애플을 넣어 볶습니다.', 'image_url': 'https://recipe1.ezmember.co.kr/cache/recipe/2023/12/07/8e28baff484a073a6c1d047e93815c891.jpg'}, {'step_number': 9, 'description': '마늘, 양파, 피망, 빨간 파프리카, 당근, 파인애플이 알맞게 익었을 때 스테이크 소스 5T를 넣어 볶습니다.', 'image_url': 'https://recipe1.ezmember.co.kr/cache/recipe/2023/12/07/7b4a50a073829940788b6938b15ded2e1.jpg'}, {'step_number': 10, 'description': '모든 재료가 알맞게 익었을 때 파슬리가루 1꼬집을 뿌리면 파인애플 소고기볶음 완성.', 'image_url': 'https://recipe1.ezmember.co.kr/cache/recipe/2023/12/07/a86fbdcb3424c2b72b803895401b5bd51.jpg'}]"
156003,양식,손님접대,육류,볶음,소고기등심찹스테이크 만들기 백종원 찹스테이크 소스,소고기등심찹스테이크,https://recipe1.ezmember.co.kr/cache/recipe/2023/12/12/0d81b11bce28045d2621799f8c1065e01.jpg,"3,296",20분 이내,아무나,2인분,"[('소고기등심', '200g'), ('양파', '1/2개'), ('피망', '1/2개'), ('돈가스소스', '4스푼'), ('굴소스', '1스푼'), ('케첩', '1스푼'), ('올리고당', '1스푼'), ('물', '1스푼'), ('후추', '조금'), ('버터', '조금'), ('파슬리가루', '조금')]",홈파티에 어울리는 맛있는 소고기등심찹스테이크 만드는 방법 소개해 드릴게요~,"[{'step_number': 1, 'description': '피망, 양파는 깨끗이 씻은 후에 깍뚝썰기 해주세요.도마 , 조리용나이프', 'image_url': 'https://recipe1.ezmember.co.kr/cache/recipe/2023/12/12/d3007c9521bdc9c4a150906a4a9c704a1.jpg'}, {'step_number': 2, 'description': '소고기는 키친타월로 핏물을 제거한 뒤 먹기 좋은 크기로 깍뚝썰어주세요.키친타올', 'image_url': 'https://recipe1.ezmember.co.kr/cache/recipe/2023/12/12/93e942bb81ebcd2d5bcf1a61f75060111.jpg'}, {'step_number': 3, 'description': '돈가스소스4스푼, 굴소스 1스푼, 설탕 1스푼, 올리고당 1스푼, 물1스푼 넣고 섞어주세요.볼', 'image_url': 'https://recipe1.ezmember.co.kr/cache/recipe/2023/12/12/6d4e798f6b40b915302e01d1ab72d7df1.jpg'}, {'step_number': 4, 'description': '버터 넣고 소고기 넣고 볶아주세요.볶음팬 , 요리스푼', 'image_url': 'https://recipe1.ezmember.co.kr/cache/recipe/2023/12/12/c0b5f25ddb3623ffa534d63f0deca5531.jpg'}, {'step_number': 5, 'description': '소고기가 반정도 익으면 후추 넣고 야채도 넣어주세요.', 'image_url': 'https://recipe1.ezmember.co.kr/cache/recipe/2023/12/12/6a42d16ffc01f290a32a267adbab37ca1.jpg'}, {'step_number': 6, 'description': '미리 만들어둔 찹스테이크소스 넣고 한번 더 볶아주세요.', 'image_url': 'https://recipe1.ezmember.co.kr/cache/recipe/2023/12/12/8741bc5d91693fbc1da840765eae2c231.jpg'}]"
156004,양식,손님접대,육류,볶음,파인애플 찹스테이크,파인애플찹스테이크,https://recipe1.ezmember.co.kr/cache/recipe/2015/04/29/e27e2abc2a19b95da76ea22d11d6fd581.jpg,"5,172",30분 이내,중급,2인분,"[('와규안심', '360g'), ('파인애플', '1통'), ('노란파프리카', ''), ('빨간파프리카', ''), ('양파', ''), ('새송이버섯', ''), ('브로콜리', ''), ('허브솔트', ''), ('케찹', '1큰술'), ('요리당', '1큰술'), ('스테이크소스', '5~6큰술'), ('파슬리가루', '약간')]",주말에 뭐해먹지?? 하다가 와규 안심으로 파인애플 찹스테이크를 만들어보았어요. 그냥 스테이크만들기 할까?? 하다가 맛도 좋고 보기에도 좋은 파인애플 찹스테이크로 결정!! 만들기도 의외로 간단하다구요~,"[{'step_number': 1, 'description': '안심은 허브솔트를 뿌려 잠시 두세요. 그리고 찹스테이크를 만들 파인애플 그릇을 만들어볼께요.', 'image_url': 'https://recipe1.ezmember.co.kr/cache/recipe/2015/04/29/5d2b6730a08aec22aa164f97311594d11.jpg'}, {'step_number': 2, 'description': '파인애플을 잘라서 그릇을 만들어 주세요. 스테이크에 들어갈 파인애플은 과도를 이용하여 자르고 나머지 울퉁불퉁한 부분을 수저로 긁어내면 좋아요.', 'image_url': 'https://recipe1.ezmember.co.kr/cache/recipe/2015/04/29/232674988db28ebccbbc0a665f3b65cd1.jpg'}, {'step_number': 3, 'description': '파프리카는 노랑색, 빨강색으로 깍뚝썰기 해주세요. 양파와 새송이버섯은 채를 썰어 준비하고 브로콜리는 알맞은 크기로 잘라 둡니다.', 'image_url': 'https://recipe1.ezmember.co.kr/cache/recipe/2015/04/29/3da803acc015d0a6c4b04f92651c38f11.jpg'}, {'step_number': 4, 'description': '소스만들기 첫번째, 올리브유를 약간 두른 팬에 양파부터 볶아주세요. 약간의 허브솔트를 곁들여주면 좋아요. 양파가 어느 정도 숨이 죽으면 채썰어놓은 새송이버섯을 넣고 볶다가 시중에서 판매하는 스테이크소스 5~6스푼 케찹1스푼, 물 약간, 달달한 요리당 1스푼을 넣고 끓여줍니다.', 'image_url': 'https://recipe1.ezmember.co.kr/cache/recipe/2015/04/29/1eeb56cf59c0dbaeb28214e04dec42b71.jpg'}, {'step_number': 5, 'description': '소스가 끓여지면 준비해둔 파프리카, 파인애플, 브로콜리와 와규 안심을 먹기좋게 잘라서 넣고 볶아주세요. 기준은 고기가 먹기좋게 익을때까지....! 각자 소고기를 먹는 스타일이 다르겠지만 저희집은 핏기없이 온전히 익혀먹는걸 좋아해요. 그러면 소고기 질겨지는거 아니냐 하실테지만 프리미엄 와규 안심은 결코 질기지 않답니다.', 'image_url': 'https://recipe1.ezmember.co.kr/cache/recipe/2015/04/29/1bb87bd26df3b9aea3128d986386bc801.jpg'}, {'step_number': 6, 'description': '완성이 되었다면 파인애플 그릇에 담고 마무리로 파슬리 가루를 솔솔 뿌려주면 끝~', 'image_url': 'https://recipe1.ezmember.co.kr/cache/recipe/2015/04/29/91100da8d22bf2befe25413c9e8fbfe01.jpg'}]"
156005,양식,손님접대,육류,볶음,갈릭 찹스테이크 만들기,갈릭찹스테이크,https://recipe1.ezmember.co.kr/cache/recipe/2015/05/14/0977a813b0fca4733d90fcf54ca9274e1.jpg,"3,942",10분 이내,아무나,1인분,"[('스테이크', '250g'), ('마늘', '2~3개'), ('간장', '1T'), ('후추', '1/3T'), ('올리브유', '1T')]","남은 스테이크를 활용한 무척 간단한 요리 레시피로, 그윽한 마늘 향이 다시금 우리의 입맛을 살려주는, 매력적인 갈릭 찹스테이크 입니다.","[{'step_number': 1, 'description': '마늘은 1인분기준으로 2~3개 정도 편썰면충분히 넉넉한 양이랍니다.', 'image_url': 'https://recipe1.ezmember.co.kr/cache/recipe/2015/05/14/657d1eb267e6aebb366bb20904d5233c1.jpg'}, {'step_number': 2, 'description': '먹기 좋은 크기로 썰어주세요.', 'image_url': 'https://recipe1.ezmember.co.kr/cache/recipe/2015/05/14/4287c8d60fe7bfff1b3d693d0aaf51811.jpg'}, {'step_number': 3, 'description': '넉넉한 기름에마늘을 볶아 충분한 향을 내는게 포인트! 그리고 강불로 올린 다음에 고기를 넣도록 하겠습니다.', 'image_url': 'https://recipe1.ezmember.co.kr/cache/recipe/2015/05/14/3ba30499532c9c29e49f292942a140211.jpg'}, {'step_number': 4, 'description': '간장과 후추로 살짝만 간을 맞추었는데 나중에 먹을 때 마늘 향과간장의 풍미가 잘 어울렸어요!', 'image_url': 'https://recipe1.ezmember.co.kr/cache/recipe/2015/05/14/c6875ce082f6d17222daa4a97d3066fb1.jpg'}]"
