index,종류별,상황별,재료별,방법별,글 제목,레시피이름,레시피이미지,조회수,조리시간,난이도,인분,재료,소개글,조리순서
21539,메인반찬,일상,돼지고기,삶기,세상에서 가장 쉬운 수육 : 단 3가지 재료로 잡내없이 촉촉하게 만들어요~,수육,https://recipe1.ezmember.co.kr/cache/recipe/2020/11/22/2f21da88982543a8409d26d356024cbe1.jpg,"1,222",60분 이내,아무나,2인분,"[('수육용 돼지앞다리살', '600~700g'), ('집된장                                                                                듬뿍', '1큰술'), ('소주', '3큰술'), ('알커피', '0.5큰술'), ('마늘                                                                                선택사항', ''), ('월계수잎                                                                                선택사항', ''), ('생강                                                                                선택사항', '')]","시험삼아 재료를 아주 간소화해서 삶아봤는데 기대 이상으로 결과물이 괜찮더라구요~
물론 재료가 충분할 땐 이것저것 넣어주시면 더 맛있게 드실 수 있겠지만 가끔은 초간단 레시피로 추천드려요:)","[{'step_number': 1, 'description': '고기가 충분히 잠길 만큼 냄비에 물을 넉넉히 붓고 된장, 커피, 소주를 넣어주세요. \n* 마늘, 월계수잎, 생강은 선택사항입니다^^', 'image_url': 'https://recipe1.ezmember.co.kr/cache/recipe/2020/11/22/ac3d19e4d362cb381b996dbc68cb631a1.jpg'}, {'step_number': 2, 'description': '팔팔 끓기 시작하면 고기 넣고 뚜껑 덮고 약불에서 40~45분간 삶아주세요.', 'image_url': 'https://recipe1.ezmember.co.kr/cache/recipe/2020/11/22/21a991295abcfa8f71b1601c31732ce51.jpg'}, {'step_number': 3, 'description': '불을 끄고 10분간 뜸을 들였다가 고기를 꺼내주세요. \n* 고기 두께에 따라 익는 속도가 다르니 중간을 썰어보고 설 익은 경우 조금 더 삶아주세요.', 'image_url': 'https://recipe1.ezmember.co.kr/cache/recipe/2020/11/22/faf44821273bb13e65789b7c042fd1351.jpg'}, {'step_number': 4, 'description': '먹기 좋게 썰어 쌈장, 새우젓, 겉절이 등을 곁들여 맛있게 드세요:)', 'image_url': 'https://recipe1.ezmember.co.kr/cache/recipe/2020/11/22/a529527be70507190f9db9c3d05b69cf1.jpg'}]"
21540,메인반찬,일상,돼지고기,삶기,메인요리인 앞다리살을 활용해서 만든 [수육] 입니다.,수육,https://recipe1.ezmember.co.kr/cache/recipe/2020/12/01/b359df9d036ebdf009ca103afb414e721.jpg,"1,210",60분 이내,초급,2인분,"[('돼지고기앞다리살', '1팩'), ('된장', '2큰술'), ('생강청', '1큰술'), ('커피가루', '2봉지')]","김장김치 얻어서 함께 먹으면 좋은 수육 만들어 봤어요~!! ^^*
집에 있는 걸로 이용해서 냄새제거 한 것이니 참고하세용~!!ㅎㅎ","[{'step_number': 1, 'description': '냄비에 물 500ml를 넣고,물 500ml.', 'image_url': 'https://recipe1.ezmember.co.kr/cache/recipe/2020/12/01/f68193e6ac408d7d4d14c06b7482aa961.jpg'}, {'step_number': 2, 'description': '물이 끓을때 돼지고기 앞다리살 1팩 넣어주면 됩니다!!돼지고기 앞다리살 1팩.돼지고기 앞다리살이 물에 잠길때까지 물을 넣어주시면 됩니다~!!', 'image_url': 'https://recipe1.ezmember.co.kr/cache/recipe/2020/12/01/60109ae9a439d726638c6b8952f25c2e1.jpg'}, {'step_number': 3, 'description': '된장 2큰술 넣고,된장 2큰술.', 'image_url': 'https://recipe1.ezmember.co.kr/cache/recipe/2020/12/01/bab814e46790d9507b7d8fd622c143c31.jpg'}, {'step_number': 4, 'description': '생강청 1큰술 넣고,생강청 1큰술.', 'image_url': 'https://recipe1.ezmember.co.kr/cache/recipe/2020/12/01/184103c9b5933f7e93cae8c5c943c86a1.jpg'}, {'step_number': 5, 'description': '커피 2봉지 넣어줍니다~!!커피 2봉지.', 'image_url': 'https://recipe1.ezmember.co.kr/cache/recipe/2020/12/01/39a0e14c2df38c2798804944602b5feb1.jpg'}, {'step_number': 6, 'description': '물이 쎈불로 5분 정도 끓이다가,쎈불.', 'image_url': 'https://recipe1.ezmember.co.kr/cache/recipe/2020/12/01/3cad6ebde3c701b4e0bcf369a673473a1.jpg'}, {'step_number': 7, 'description': '중불로 1시간 정도 끓여줍니다!!중불.', 'image_url': 'https://recipe1.ezmember.co.kr/cache/recipe/2020/12/01/7e4e267bce87a5e06acf75bbdd0990591.jpg'}, {'step_number': 8, 'description': '젓가락으로 찔러서 잘 익었는지 확인해보\n고 됩니다~!!', 'image_url': 'https://recipe1.ezmember.co.kr/cache/recipe/2020/12/01/d40f84c6de62299cf0bb34facf6f62d81.jpg'}, {'step_number': 9, 'description': '맛있게 익은 수육은 먹기 좋게 잘라주면 완성됩니다~!!', 'image_url': 'https://recipe1.ezmember.co.kr/cache/recipe/2020/12/01/58bd9aa8603be35973614ff4f6c1ff061.jpg'}, {'step_number': 10, 'description': '김장김치와 수육 모습입니다~!!', 'image_url': 'https://recipe1.ezmember.co.kr/cache/recipe/2020/12/01/7cfb2d16742a67b50caedee6a7f1aa541.jpg'}]"
21541,메인반찬,일상,돼지고기,삶기,돼지고기 삼겹살 맛있게 삶는법 통삼겹살 수육 만들기,수육,https://recipe1.ezmember.co.kr/cache/recipe/2022/12/23/350701fa988fbd079b16b4f492cccfa21.jpg,"8,618",90분 이내,아무나,3인분,"[('통삼겹살', '900g'), ('통마늘', '38g'), ('슬라이스 생강', '7g'), ('대파', '1대'), ('양파', '1/2개'), ('월계수잎', '3장'), ('된장', '1큰술'), ('커피가루', '0.2g'), ('소주', '3큰술'), ('물', '1200ml')]",겉절이랑 함께 먹으면 맛있을거 같아서 통삼겹살 수육을 만들어봤어요. 돼지고기 수육은 언제 먹어도 질리지 않고 예전에 수육 삶는 방법을 조금 바꿔서 삶아봤는데 고기의 육질도 연하면서 부들부들하여 맛잇게 먹었습니다.^^,"[{'step_number': 1, 'description': '▶통삼겹살 900g을 준비합니다.900g', 'image_url': 'https://recipe1.ezmember.co.kr/cache/recipe/2022/12/23/d5a19ea5dfd37ace3641b84f9b6901161.jpg'}, {'step_number': 2, 'description': '▶흐르는 물에 가볍게 돼지고기 통삼겹살을 헹궈줍니다. (헹구지 않고 삶아도 됩니다.)', 'image_url': 'https://recipe1.ezmember.co.kr/cache/recipe/2022/12/23/f9d9fe60c51bbb8690b9c911bbe9c9971.jpg'}, {'step_number': 3, 'description': '▶헹군 돼지고기 삼겹살을 툭툭 털어서 물기를 털어내거나 키친타올로 살짝 눌러서 물기를 제거 해줍니다.', 'image_url': 'https://recipe1.ezmember.co.kr/cache/recipe/2022/12/23/7697de06d85080a27110444390b9c3031.jpg'}, {'step_number': 4, 'description': '▶된장 1큰술을 나눠서 통삼겹살에 골고루 발라줍니다.(직접 물에 풀어도 상관없어요.)된장 1큰술', 'image_url': 'https://recipe1.ezmember.co.kr/cache/recipe/2022/12/23/93192beab42c6f6a23bf2805186554f51.jpg'}, {'step_number': 5, 'description': '▶\ufeff대파83g, 슬라이스 생강 7g, 통마늘 38g, 양파 1/2개, 월계수잎 3장을 준비합니다.\n\ufeff\ufeff 대파83g, 슬라이스 생강 7g, 통마늘 38g, 양파 1/2개, 월계수잎 3장', 'image_url': 'https://recipe1.ezmember.co.kr/cache/recipe/2022/12/23/2800d2fe64cd0342e55936fd87db1b751.jpg'}, {'step_number': 6, 'description': '▶센불에서 물 1200ml를 넣고, 물이 끓어오르기 시작하면 준비한 재료를 넣고 팔팔 끓여주면서 재료를 우려내줍니다.물 1200ml', 'image_url': 'https://recipe1.ezmember.co.kr/cache/recipe/2022/12/23/e3359228bc44e5c66b5c5d472f8f651a1.jpg'}, {'step_number': 7, 'description': '▶물이 보글보글 끓어오르면 된장을 바른 통삼겹살을 넣어줍니다.', 'image_url': 'https://recipe1.ezmember.co.kr/cache/recipe/2022/12/23/5d771fa3e339a3ff1a6d86bd5a4787f61.jpg'}, {'step_number': 8, 'description': '▶잡내와 누린내를 줄여 줄 소주 3큰술을 넣어줍니다.소주 3큰술', 'image_url': 'https://recipe1.ezmember.co.kr/cache/recipe/2022/12/23/67518419b6ebd888c9624a529bd7cb131.jpg'}, {'step_number': 9, 'description': '▶삼겹살의 겉면이 살짝 익은 상태로 변하면 뒤집어줍니다.', 'image_url': 'https://recipe1.ezmember.co.kr/cache/recipe/2022/12/23/509f0194cdfa5c4a785e74a41d25d9c31.jpg'}, {'step_number': 10, 'description': '▶커피가루 0.2g을 넣어줍니다.커피가루 0.2g', 'image_url': 'https://recipe1.ezmember.co.kr/cache/recipe/2022/12/23/cb82c48a8667485386e030d24f6049481.jpg'}, {'step_number': 11, 'description': '▶뚜껑을 살짝만 열어 둔 상태에서 40분 ~ 1시간 정도 삶아줍니다.', 'image_url': 'https://recipe1.ezmember.co.kr/cache/recipe/2022/12/23/5dee34591c71528917f63edf0aa29e641.jpg'}, {'step_number': 12, 'description': '▶40분 후 뚜껑을 열어 돼지고기의 가장 두꺼운 부분을 적가락으로 찔러보고 3~5초 정도 지났을 때 핏물이 나오지 않는지 확인합니다.\n▶돼지고기가 익었으면 가스불을 끄고, 채반에 담아 한 김 식혀줍니다.', 'image_url': 'https://recipe1.ezmember.co.kr/cache/recipe/2022/12/23/7eb0cf58ad8beee7c742307d00bf93701.jpg'}, {'step_number': 13, 'description': '▶한 김 식은 돼지고기를 먹기 좋은 두께와 크기로 잘라서 그릇에 옮겨 담으면 잡내와 누린내 없는 돼지고기 통삼겹살 수육 삶는법 완성입니다.^^', 'image_url': 'https://recipe1.ezmember.co.kr/cache/recipe/2022/12/23/850dd93a0fb8ade42843081a12c308da1.jpg'}, {'step_number': 14, 'description': '▶겉절이나, 배추김치, 파김치, 새우젓, 쌈장 등 입맛에 맞게 맛있게 드셔보세요.', 'image_url': 'https://recipe1.ezmember.co.kr/cache/recipe/2022/12/23/3f7c2f744a603171e42b1ca36a5a06421.jpg'}]"
21542,메인반찬,일상,돼지고기,삶기,#돼지고기요리 #수육만들기 #수육삶기 #수육배추김치쌈 #김치소배추쌈 #김장김치배추쌈,수육,https://recipe1.ezmember.co.kr/cache/recipe/2022/12/26/3e2828a89557a898865ddb657df56bd61.jpg,"2,379",120분 이내,아무나,4인분,"[('삼겹살', '1kg'), ('팔각', '5개'), ('된장', '1큰술'), ('절임 배추', '1/2포기'), ('김치소', '300g'), ('새우젓', '1작은술')]","#돼지고기요리 #수육만들기 #수육삶기

#수육배추김치쌈 #김치소배추쌈

#김장김치수육배추쌈 #굴보쌈 #보쌈만들기 #김장김치소

#절임배추쌈 #김장김치소쌈

​

김장김치를 하고 절임배추를 속대 중심으로 남겨 놓았습니다.

그리고 김치소도 남겨 놓았고요.

김치소는 언제나 많이 남겨 놓는 편입니다.

​

그런데 이번에는 양이 많지 않네요.

그래도 그것으로 삼겹살수육을 만들어서 김장김치소쌈을 했습니다.

삼겹살과 절임배추, 그리고 김치소!!! 그거면

김장할때에 고된 힘듬이 살아지는 한입이 됩니다.","[{'step_number': 1, 'description': '돼지고기 삼겹살 수육용 입니다.', 'image_url': 'https://recipe1.ezmember.co.kr/cache/recipe/2022/12/26/a738a9bd54748953f70f303d1b377bac1.jpg'}, {'step_number': 2, 'description': '들통에 된장 1큰술 넣어 줍니다.', 'image_url': 'https://recipe1.ezmember.co.kr/cache/recipe/2022/12/26/93dd416a54b5efb6c1dfda67f1d0360d1.jpg'}, {'step_number': 3, 'description': '돼지고기 수육용 삼겹살을 통으로 넣어 줍니다. 그리고 팔각도 넣어 줍니다. 저는 월계수잎이 아닌 팔각을 사용했습니다.', 'image_url': 'https://recipe1.ezmember.co.kr/cache/recipe/2022/12/26/612e1e0a4e1abd70bcd37942e389d88e1.jpg'}, {'step_number': 4, 'description': '물을 넣어 주고 된장을 잘 풀어 준 후 센불에서 팔팔 끓여 줍니다. 사실 팔각이나 월계수잎, 통마늘, 대파 이런 것이 없이 된장만 넣어도 고기의 잡내는 충분히 잡을 수 있습니다. 총 2시간을 삶아 주었습니다.', 'image_url': 'https://recipe1.ezmember.co.kr/cache/recipe/2022/12/26/8bbe83d184c785928cfc695c62a307541.jpg'}, {'step_number': 5, 'description': '다 삶아낸 돼지고기 삼겹살수육을 쿠킹호일에 올려 놓아 줍니다.', 'image_url': 'https://recipe1.ezmember.co.kr/cache/recipe/2022/12/26/c10f957c46125bd24deca94d1866daaa1.jpg'}, {'step_number': 6, 'description': '그리고 호일을 감싸 줍니다. 이렇게 다 식을때까지 30-40분 시간을 보냅니다. 그래야 육즙도 갖워 놓고, 또하나 흐트러짐없이 썰 수 있습니다. 오늘은매울지도몰라 한석규가 알려 준 방법이지요.', 'image_url': 'https://recipe1.ezmember.co.kr/cache/recipe/2022/12/26/09e4d3b9b3fd7ee99268475d738febb31.jpg'}, {'step_number': 7, 'description': '새우젓을 준비합니다. 김장김치할때 쓰고 남은 육젓입니다. 통통하니 육젓만의 향과 단맛을 주지요.', 'image_url': 'https://recipe1.ezmember.co.kr/cache/recipe/2022/12/26/073ef7d4dd0468e8ec7f53c4d59757e81.jpg'}, {'step_number': 8, 'description': '김장김치할때에 만들어 놓았던 김치소입니다. 원래 김치소를 많이 만들어 놓거든요. 그 이유는 김치소찜을 해서 먹으려고 늘상 그렇게 넉넉하게 김장김치소를 만듭니다. 김치소찜은 또 다른 별미거든요. 밥에 비벼서 먹어도 맛있고 쌈에 싸서 먹어도 맛있고요. 김장할때에 절임배추를 남겨 놓으면 나중에 일주일 정도는 두고두고 배추쌈을 먹을 수 있어서 좋습니다.', 'image_url': 'https://recipe1.ezmember.co.kr/cache/recipe/2022/12/26/408e9a385a52a3a94f2cabb2354152291.jpg'}, {'step_number': 9, 'description': '절임배추 대부분 속대 중심으로 빼 놓았던 것을 담아 줍니다. 그리고 김치소를 한켠에 담아 줍니다.', 'image_url': 'https://recipe1.ezmember.co.kr/cache/recipe/2022/12/26/124172aa67be06d90a1eb08c3a8170991.jpg'}, {'step_number': 10, 'description': '잘 식혀진 삼겹살수육을 썰어 줍니다. 취향에 맞게 얇게,,,아니면 두껍게.....', 'image_url': 'https://recipe1.ezmember.co.kr/cache/recipe/2022/12/26/9dca423bc71b24df7efe4938027736b31.jpg'}, {'step_number': 11, 'description': '썬 수육을 나머지 완성접시 한켠에 담아 줍니다. 그럼 김장김치할때에 반드시 먹어 주는 배추김치소보쌈이 완성됩니다.', 'image_url': 'https://recipe1.ezmember.co.kr/cache/recipe/2022/12/26/19ab0f870835e463312aae06b2a367751.jpg'}]"
21543,메인반찬,일상,돼지고기,삶기,오늘의요리] 통삼겹 수육..부드럽고 담백하게 삶기 비법 tip,None,https://recipe1.ezmember.co.kr/cache/recipe/2023/01/06/baaa0bae01cf86d72e0f4eb5ff6a4a4a1.jpg,647,None,None,None,"[('통삼겹살', '1kg'), ('물', '1.8L'), ('집된장', '2T'), ('인스턴트커피', '1T'), ('월계수잎', '1장'), ('무', '3cm'), ('양파', '1/2개'), ('통마늘', '5알'), ('생강', '1톨')]",,[]
21544,메인반찬,일상,돼지고기,삶기,수육 맛있게 삶는 방법,수육,https://recipe1.ezmember.co.kr/cache/recipe/2022/11/10/1c6f29c9664be58b7397742ad3a1204e1.jpg,"3,223",60분 이내,아무나,2인분,"[('돼지고기', '500g'), ('마늘', '1스푼'), ('된장', '1/2스푼'), ('생강가루', '약간'), ('후추', '약간')]","김장철이 되면서 수육삶기를 많이 할것같은데요
수육 맛있게 삶는 방법을 
알려 드릴께요","[{'step_number': 1, 'description': '\ufeff\n수육 삶는 돼지고기는\n부위도 정해진 건 아니다\n기름기 좋아하면 삼겹 부위를 선택하면 되고\n나는 비계 떼고 먹는 스타일이라\n그냥 목살로 선택했다\n이건 취향대로 고르면 된다\n둘 다 좋으면 두 덩어리 사서\n넉넉하게 삶아서 먹는 것도 좋다\n나는 목살로 구입해서 삶아 보았다\n\ufeff', 'image_url': 'https://recipe1.ezmember.co.kr/cache/recipe/2022/11/10/3808df6486017ada32187d7e74843bc31.jpg'}, {'step_number': 2, 'description': '\ufeff\n수육 삶는 법은\n먼저 고기가 잠기도록 물을 부은 뒤에\n된장 반 스푼 정도 풀고\n\ufeff', 'image_url': 'https://recipe1.ezmember.co.kr/cache/recipe/2022/11/10/d74cfb3efb4e04599fc2aae607a1209c1.jpg'}, {'step_number': 3, 'description': '다진 마늘 한 스푼 정도 넣고\n생강가루와 후추를 조금 뿌린 뒤에\n삶아주면 된다\n생강가루는 없으면 생략 가능하다\n\ufeff', 'image_url': 'https://recipe1.ezmember.co.kr/cache/recipe/2022/11/10/a853b0980cfdda31d34b71ed00e920e81.jpg'}, {'step_number': 4, 'description': '\ufeff수육 삶는 법을 어려워하는 이유가\n아마도 삶는 시간일 거다\n보통 40분에서 1시간 정도\n삶는 게 평균적인 시간이지만\n고기의 종류나 두께에 따라 달라지니깐\n확인을 하면서 삶아주는 게 가장 정확하다\n\ufeff확인하는 방법은\n30~40분 정도 삶았을 때\n젓가락으로 고기를 찔러보면\n찌른 부위로 피가 흘러나오면 아직\n덜 익은 상태이다 몇 군데 찔러보고\n피가 안 나오면 그 뒤로 10분 정도\n더 삶으면 딱 맞게 익는다\n두꺼운 부분을 찔러보는 게 가장 정확하니깐\n몇 군데 찔러보고 확인하도록 하자\n\ufeff\n\ufeff', 'image_url': 'https://recipe1.ezmember.co.kr/cache/recipe/2022/11/10/42ca004cdf85a620d2a9c09ddb233aae1.jpg'}, {'step_number': 5, 'description': '잘익은 고기를 건져서 \n먹기 좋게 썰어내면 끝\n\ufeff', 'image_url': 'https://recipe1.ezmember.co.kr/cache/recipe/2022/11/10/856429e443bf1fcf8f6bfde7e1fa2e0b1.jpg'}]"
21545,메인반찬,일상,돼지고기,삶기,수육 맛있게 삶는 법 쌍화탕 넣었더니 초대박,수육,https://recipe1.ezmember.co.kr/cache/recipe/2022/11/18/58e157b43f3399ac8bdb3281858bb8b41.jpg,"4,318",60분 이내,아무나,2인분,"[('통삼겹살', '600g'), ('물', '500ml'), ('양파', '1개'), ('대파', '2대'), ('마늘', '5~6쪽'), ('통후추', '1T'), ('쌍화탕', '2병')]",김장하는 날 빠지면 섭한게 바로 수육이죠. 쌍화탕 넣어 삶았더니 귀한 한약재 잔뜩 넣어 삶은마냥 너무 고급지고 맛있네요. 초간단 착한 재료로 최고의 맛을 내 보세요^^,"[{'step_number': 1, 'description': '통고기를 준비 해 주세요. 보통 통삼겹을 많이 쓰지만 저는 오겹살로 준비했어요. 더 부드럽고 맛나더라구요. 핵심재료 쌍화탕도 2병 준비합니다.', 'image_url': 'https://recipe1.ezmember.co.kr/cache/recipe/2022/11/18/d5844aa237d9cf3dfd4ebda905ec899d1.jpg'}, {'step_number': 2, 'description': '냄비에 물 500ml 부어주세요.물 500ml', 'image_url': 'https://recipe1.ezmember.co.kr/cache/recipe/2022/11/18/6d9ddd807526216c62d9a8e33adaa6ff1.jpg'}, {'step_number': 3, 'description': '채소들을 넣고 쌍화탕도 두 병 부은 후 끓여주세요.양파 1개, 대파 2대, 통마늘 5~6쪽, 통후추 1큰술, 쌍화탕 2병', 'image_url': 'https://recipe1.ezmember.co.kr/cache/recipe/2022/11/18/78d7807d5cdc02f48d54ea6f58e0dc5a1.jpg'}, {'step_number': 4, 'description': '물이 끓어오르면 통고기를 넣어줍니다.센불', 'image_url': 'https://recipe1.ezmember.co.kr/cache/recipe/2022/11/18/b0dac0b23616d0949fdb8371dcd0a3df1.jpg'}, {'step_number': 5, 'description': '뚜껑 닫고 30분 푹 삶아주고 뒤집어서 15분 더 삶아주세요.센불', 'image_url': 'https://recipe1.ezmember.co.kr/cache/recipe/2022/11/18/0c3e462f428baeaff2d454e8c978ad941.jpg'}, {'step_number': 6, 'description': '귀한 한방향 솔솔 나는 야들야들 맛난 수육 완성이에요!!', 'image_url': 'https://recipe1.ezmember.co.kr/cache/recipe/2022/11/18/9ae7d2a2a265cc3e8a673e24ecce30cd1.jpg'}]"
21546,메인반찬,일상,돼지고기,삶기,백종원 수육 백패커 레시피 찰떡 맛궁합 마늘소스,수육,https://recipe1.ezmember.co.kr/cache/recipe/2022/11/07/a5824fbf79e5f7cbdb0c693a0d39f1441.jpg,"1,776",60분 이내,초급,4인분,"[('돼지고기 앞다리살', '600g'), ('양파', '1.5개'), ('물', '적당량'), ('된장', '1숟가락'), ('백설탕', '300ml'), ('물', '100ml'), ('월계수잎', '2장'), ('다진 마늘', '1숟가락'), ('다진 양배추', '4숟가락'), ('진간장', '1.5숟가락'), ('올리고당', '1숟가락')]","최근 몸이 안좋아 기력 보강을 위해 만든 수육 레시피입니다. 삶은 돼지고기는 단백질과 비타민B가 많이 함유되어 있어 일본 장수마을의 어르신들이 즐겨 먹는 요리라고 해요. 설탕시럽의 캐러멜라이징으로 누린내를 잡고 마늘소스로 맛의 꿀조합인 백종원 레시피, 김장철 수육으로 추천드려요!!","[{'step_number': 1, 'description': '시간이 오래 걸리므로 제일 먼저 설탕 300 물 100을 냄비에 넣고 캐러멜라이징소스 만들기. 결정이 생기므로 절대 젓지말고 중불에서 끓이기', 'image_url': 'https://recipe1.ezmember.co.kr/cache/recipe/2022/11/07/8d6408abf78d18844cfc97aff7d4fb911.jpg'}, {'step_number': 2, 'description': '노란색 황갈색으로 변하는데 이때 한순간에 갈색으로 변하므로 지켜봐야함. 갈색이 되면 불을 끄고 한 김 식히기', 'image_url': 'https://recipe1.ezmember.co.kr/cache/recipe/2022/11/07/5b958a674659828d6e772f1326e111b91.jpg'}, {'step_number': 3, 'description': '돼지고기는 찬물에 10분 정도 담궈 핏물제거후 빨리 있도록 작게 잘라주기', 'image_url': 'https://recipe1.ezmember.co.kr/cache/recipe/2022/11/07/41a2646f94a355cd3550261cd08a8ad11.jpg'}, {'step_number': 4, 'description': '냄비에 고기가 잠길 정도로 물을 붓고 양파 1.5개 월계수잎 2장을 넣어 강불에서 뚜껑을 덮고 10분 삶아 주며 불순물 제거', 'image_url': 'https://recipe1.ezmember.co.kr/cache/recipe/2022/11/07/c17f5b7c59a746023542a391b3d24c9c1.jpg'}, {'step_number': 5, 'description': '골고루 있도록 한 번씩 고기 뒤집기', 'image_url': 'https://recipe1.ezmember.co.kr/cache/recipe/2022/11/07/4f1fbc7c9bcdbd5e0cff0c227181d92c1.jpg'}, {'step_number': 6, 'description': '수육이 반 정도 익으면 준비한 캐러멜라이징소스와', 'image_url': 'https://recipe1.ezmember.co.kr/cache/recipe/2022/11/07/c757c5a0aaf52fe0f56bfcd3f4ea4ee21.jpg'}, {'step_number': 7, 'description': '된장 1을 넣어 졸여준다는 느낌으로 삶기', 'image_url': 'https://recipe1.ezmember.co.kr/cache/recipe/2022/11/07/36687eb4fe7f8850577aa0f1cb9620381.jpg'}, {'step_number': 8, 'description': '한 번씩 고기를 뒤집어주고 국물이 바특해지면서 고기에 골고루 색과 간이 배이도록 삶기', 'image_url': 'https://recipe1.ezmember.co.kr/cache/recipe/2022/11/07/bcdaae885cc0ca47c5da2f272c235b3c1.jpg'}, {'step_number': 9, 'description': '믹서나 블랜더에 준비한 마늘을 갈고', 'image_url': 'https://recipe1.ezmember.co.kr/cache/recipe/2022/11/07/96e77967004d2f6d7338f4483ad846be1.jpg'}, {'step_number': 10, 'description': '양배추를 넣어 함께 갈아주기', 'image_url': 'https://recipe1.ezmember.co.kr/cache/recipe/2022/11/07/25e824d22e2d46cc535bad2e960adfb41.jpg'}, {'step_number': 11, 'description': '다진 채소에 진간장 1.5 올리고당 1을 넣고 버무리면 간단하게 마늘보쌈소스 완성', 'image_url': 'https://recipe1.ezmember.co.kr/cache/recipe/2022/11/07/59c3bec01f3e5918ac041d970d97ee241.jpg'}]"
