index,종류별,상황별,재료별,방법별,글 제목,레시피이름,레시피이미지,조회수,조리시간,난이도,인분,재료,소개글,조리순서
71447,밥/죽/떡,일상,해물류,볶음,#각종해물과 채소가 들어간 잡탕밥만들기 #중국집에서 시켜먹는 그 잡탕밥~~ 더욱 푸짐하게 집에서 해먹자!!,잡탕밥,https://recipe1.ezmember.co.kr/cache/recipe/2017/03/26/6edb30002ea7911bb7c1d415be6acd4b1.jpg,"14,502",30분 이내,초급,2인분,"[('자숙문어', '1컵'), ('냉동새우', '10개'), ('해삼', '1봉지'), ('양파', '1/2개'), ('브로콜리', '1/4개'), ('양송이버섯', '1개'), ('애기새송이버섯', '3개'), ('당근', '조금'), ('파프리카', '2개'), ('배춧잎', '5장'), ('돼지호박', '조금'), ('마늘', '2개'), ('대파', '1/2뿌리'), ('쥐똥고추', '1개'), ('간장', '1큰술'), ('청주', '1큰술'), ('설탕', '1작은술'), ('굴소스', '3큰술'), ('후추', '조금'), ('전분물', '적당량'), ('참기름', '2바퀴')]",집에 있는 오징어를 활용하셔도 좋고요. 요즘에는 냉동으로 모둠해물도 나오더라구요. 그것으로 활용해서 냉장고 정리할겸~~ 각종 채소 다 넣고는 만드시면 한접시의 식사인 잡탕밥이 되지요.,"[{'step_number': 1, 'description': '배추가 들어가면 훨씬 국물이 시원해지니까 알배기배추의 배춧잎도 썰어서 준비하고 양송이버섯, 양파, 애기새송이버섯, 미니파프리카, 브로콜린도 썰어서 준비해 놓습니다. 양파도 채썰어서 준비해주시고요. 당근과 돼지호박은 그냥 냉장고에 자투리가 있어서 넣어 주었으니 신경쓰지 마시고 집 냉장고에 있는 채소로 활용하세요.', 'image_url': 'https://recipe1.ezmember.co.kr/cache/recipe/2017/03/26/c3a86a7c7b64e245b7e25c15c08df3301.jpg'}, {'step_number': 2, 'description': '해산물은 냉동새우, 자숙문어, 그리고 해삼을 준비했습니다. 해삼은 마트에서 장보면서 구미가 땡겨서 구입했는데 솔직히 볶음요리에는 건해삼이 제격이긴 해요. 그래도 해삼을 넣으면 국물맛이 달라지니까 일단은 썰어서 준비해 놓았습니다. 역시 해산물도 집에서 손쉽게 구할 수 있는 재료들을 활용하시면 됩니다. 오징어만 두마리 정도 넣어도 충분하기도 해요.', 'image_url': 'https://recipe1.ezmember.co.kr/cache/recipe/2017/03/26/53966ecd5176ab9fb3e8d66515425b6b1.jpg'}, {'step_number': 3, 'description': '재료 준비가 되었으니 이제 쌘불에서 후다닥 볶아주기만 하면 됩니다. 먼제 팬에 기름을 두르고 편마늘, 대파, 쥐똥고추를 넣고는 볶아 줍니다. 기름에서 마늘과 파향이 나게 되면 간장을 팬 주위에 돌려가면서 넣어 주세요. 그럼 훨씬 풍미가 좋아 집니다. 그리고 같이 볶아 줍니다. 매콤한 쥐똥고추가 들어가면 느끼한 맛을 잡아주면서 약간의 칼칼한 맛을 주기도 하죠~~ 기호에 따라 매운 것을 좋아하시면 더 넣으시고요. 쥐똥고추가 없으시면 페페론치노나 건고추를 활용하시면 되지요. 그것도 없으시면 고춧가루 조금 넣어서 고춧기름을 내셔도 됩니다.', 'image_url': 'https://recipe1.ezmember.co.kr/cache/recipe/2017/03/26/4743d5d818e4d6566f4276baca90ca9d1.jpg'}, {'step_number': 4, 'description': '이제 향이 제대로 올라왔으니 각종 해물들을 넣어서 같이 볶아 줍니다.', 'image_url': 'https://recipe1.ezmember.co.kr/cache/recipe/2017/03/26/6bce982658a990ce1655c2fc75729f4c1.jpg'}, {'step_number': 5, 'description': '해물의 비린맛을 잡아 주기 위해서 청주를 넣어서 같이 볶아 주세요. 청주가 없으시면 화이트와인도 좋고요. 대신 소주는 쓴맛이 나서 안되고요. 혹!!! 고량주가 있으시면 더욱 향이 짙은 잡탕밥을 만드실 수 있기도 해요 ~~~', 'image_url': 'https://recipe1.ezmember.co.kr/cache/recipe/2017/03/26/4a78ad3b3ff9480a506f91cf366698961.jpg'}, {'step_number': 6, 'description': '볶다가 후추를 넣어 줍니다. 잡탕에는 육수를 넣지 않아요. 자연적으로 채소에서 물이 나오기 때문에요.', 'image_url': 'https://recipe1.ezmember.co.kr/cache/recipe/2017/03/26/ef43a48d39ba6fd9e3df46b41a4e22581.jpg'}, {'step_number': 7, 'description': '이제 드디어 준비해 놓았던 각종 채소와 버섯들을 모두 넣어 줍니다.', 'image_url': 'https://recipe1.ezmember.co.kr/cache/recipe/2017/03/26/0c021e11bbc5f200cad002920c31ece61.jpg'}, {'step_number': 8, 'description': '설탕 아주 소량을 넣고는 쌘불에서 빠르게 볶아 주세요. 브로콜린을 데쳐서 넣으시면 더 좋기는한데 그럼 금방 물러지더라구요. 사각사각한 식감이 별로 나지 않아서 그냥 넣어 주었습니다. 대신 잘게 잘게 썰어서 넣어 주었어요.', 'image_url': 'https://recipe1.ezmember.co.kr/cache/recipe/2017/03/26/dd0829ac174ce025aeff2ac26b842d731.jpg'}, {'step_number': 9, 'description': '해산물도 모두 익고 채소들도 모두 숨이 죽어가면서 국물이 진하게 나오고 있지요. 육수는 전혀 넣지 않았는데도요.', 'image_url': 'https://recipe1.ezmember.co.kr/cache/recipe/2017/03/26/513081bc378041465a24e495fbe255c31.jpg'}, {'step_number': 10, 'description': '간은 굴소스로 해주시면 됩니다. 굴소스 투하하고는 잘 섞이도록 저어가면서 볶아 주세요.', 'image_url': 'https://recipe1.ezmember.co.kr/cache/recipe/2017/03/26/5ae4195411585e7dd7c4c6e181ac2a311.jpg'}, {'step_number': 11, 'description': '국물이 이만큼 나왔어요. 그러니 굳이 육수를 넣을 필요가 없는 것이지요. 만약 치킨스톡이 있으시면 굴소스의 양을 조절해서 치킨스톡을 넣어 주세요. 치킨스톡도 꽤 간이 있는 편이니까요.', 'image_url': 'https://recipe1.ezmember.co.kr/cache/recipe/2017/03/26/728f9fc2cf43e266b14344d12ceed6331.jpg'}, {'step_number': 12, 'description': '걸쭉하게 농도를 맞춰 주기 위해서 전분물을 넣어 줍니다. 잘 저어가면서 볶아 주세요. 그럼 점점 걸쭉한 상태가 됩니다.', 'image_url': 'https://recipe1.ezmember.co.kr/cache/recipe/2017/03/26/f15831b824349693d713be70eaa9d5081.jpg'}, {'step_number': 13, 'description': '그리고 불을 끄고는 참기름 2바퀴를 둘러서 잘 섞어주시면 고소한 향이 물씬 나는 잡탕이 완성됩니다.', 'image_url': 'https://recipe1.ezmember.co.kr/cache/recipe/2017/03/26/42ef5742a2e3e98817a427247da71e841.jpg'}, {'step_number': 14, 'description': '잡탕밥이니까 완성접시에 밥 듬뿍 담아 주시고요. 거기에 함께 먹을 샐러드나 과일이 있다면 올려 주셔도 좋겠지요. 양배추를 채썰어서 마요+케찹 섞어서 뿌려 주셔도 좋지요.', 'image_url': 'https://recipe1.ezmember.co.kr/cache/recipe/2017/03/26/f0ab8d440055f38e2122811de94c99931.jpg'}, {'step_number': 15, 'description': '그리고 푸짐하게 잡탕을 올려서 통깨 솔솔 뿌려 중국집에서 시켜 먹었던 그 잡탕밥이 완성됩니다. 집 냉장고도 정리하고 일석이조의 배부른 한접시의 덮밥이지요.', 'image_url': 'https://recipe1.ezmember.co.kr/cache/recipe/2017/03/26/f25eaa95b12228fe050341a55e4ccfd81.jpg'}]"
71448,밥/죽/떡,일상,해물류,볶음,연어볶음밥 맛있게 만드는 법,연어볶음밥,https://recipe1.ezmember.co.kr/cache/recipe/2015/06/19/5b57cec43f5a5e73362a8a79daea28ed.jpg,"27,606",15분 이내,아무나,2인분,"[('연어구이', '1/2토막'), ('양파', '1/2개'), ('쪽파', '5줄기'), ('식용유', '적당량'), ('달걀', '2개'), ('밥', '2공기'), ('후추', '조금'), ('참기름', '약간'), ('간장', '1큰술')]",남은 연어구이를 활용해 만드는 연어 볶음밥입니다.,"[{'step_number': 1, 'description': '재료를 준비해주세요. 남은 연어구운것은 손으로 찢고 양파와 쪽파는 송송 썰어둡니다.', 'image_url': 'https://recipe1.ezmember.co.kr/cache/recipe/2015/06/22/f92d04b78f4b070c4b7f54404172b95c1.jpg'}, {'step_number': 2, 'description': '달군 팬에 식용유를 두르고 달걀을 스크램블로 만들어 따로 덜어두세요.', 'image_url': 'https://recipe1.ezmember.co.kr/cache/recipe/2015/06/22/9372be028516bac14ca1f8431ef8cdc91.jpg'}, {'step_number': 3, 'description': '달걀 팬에 식용유를 조금 더 두르고 손으로 찢은 연어를 달달 볶다가 양파를 같이 넣고 볶다가 후추를 약간 뿌려주세요. 양파가 투명해지면 밥을 넣어줍니다.', 'image_url': 'https://recipe1.ezmember.co.kr/cache/recipe/2015/06/22/127a482034282c7bceeb31612bd0b6e11.jpg'}, {'step_number': 4, 'description': '밥을 넣고 골고루 잘 섞어주다가 스크램블 해 둔 달걀을 넣어주세요.', 'image_url': 'https://recipe1.ezmember.co.kr/cache/recipe/2015/06/22/d72af62888ef26fb8425e12291f9e04f1.jpg'}, {'step_number': 5, 'description': '쪽파도 넣어주고 간장을 한큰술 넣고 고루 잘 섞어주고 마지막에 참기름을 둘러서 섞어주면 끝이에요.', 'image_url': 'https://recipe1.ezmember.co.kr/cache/recipe/2015/06/22/fd16f498afc27201642b3315933ba7421.jpg'}]"
71449,밥/죽/떡,일상,해물류,볶음,달큰하고 짭짤한 간장소스 오징어 볶음밥,오징어볶음밥,https://recipe1.ezmember.co.kr/cache/recipe/2015/09/04/3c93fe4baa24e126dbdec009893bf776.jpg,"14,473",15분 이내,초급,2인분,"[('생물 오징어 큰것', '1마리'), ('양파 큰것', '1/2개'), ('데친 브로콜리', '1줌'), ('찬밥', '2공기'), ('완두콩', '2큰술'), ('통조림 옥수수', '2큰술'), ('포도씨유', '1큰술'), ('간장', '2.5큰술'), ('설탕', '1.5큰술'), ('굴소스', '1.5큰술'), ('다진마늘', '1작은술'), ('후춧가루', '1/2작은술'), ('참기름', '약간')]",오징어를 달큰하고 짭짤하게 조려서 밑반찬으로 먹곤 하는데 볶고나면 팬에 소스가 많이 뭍어 있더라구요. 어느날 소스가 너무 많이 남았길래 마침 배도 너무 고팠고 찬밥도 있어서 그냥 그 소스에 밥을 슥슥 비벼 먹었더니 너무 맛있는 거예요. 그때부터 아예 볶음밥으로 해먹자 싶어서 해먹게 된 메뉴랍니다.,"[{'step_number': 1, 'description': '먼저 분량의 간장, 설탕, 마늘, 굴소스, 후춧가루를 넣고 섞어 소스를 만들어 둡니다. 오징어와 야채는 먹기 좋은 크기로 썰어서 준비 합니다.', 'image_url': 'https://recipe1.ezmember.co.kr/cache/recipe/2015/09/04/1f4fbecb548d5dc72c9381743d4131e91.jpg'}, {'step_number': 2, 'description': '달군팬에 썰어둔 오징어를 넣고 기름을 둘러 살짝 볶아 줍니다. 오징어가 살짝 익으면 준비한 소스를 넣고 오징어를 졸여 줍니다. 오징어가 어느정도 졸여지면 준비한 야채를 넣어 줍니다.', 'image_url': 'https://recipe1.ezmember.co.kr/cache/recipe/2015/09/04/b6c23359b792994036f6c1014f8f17231.jpg'}, {'step_number': 3, 'description': '소스와 야채들이 잘 섞이면 찬밥을 넣고 잘 섞이도록 볶아 줍니다. 밥을 볶다가 완두콩과 옥수수를 넣고 밥알이 톡톡 튀도록 센불에서 타지 않게 재빨리 볶아 줍니다.(중간에 간을 보시고 모자라는 간은 간장이나 굴소스로 맞춰 주세요) 마지막에 참기름을 약간만 넣어 향을 내주면 완성.', 'image_url': 'https://recipe1.ezmember.co.kr/cache/recipe/2015/09/04/64aa8730f60753144800593e8c9996211.jpg'}, {'step_number': 4, 'description': '쫄깃쫄깃 짭짤하고 달큰한 간장소스 오징어 볶음밥 완성. 간장소스가 적당히 배인 쫄깃한 오징어와 볶음밥의 조화가의외로 잘 어울린답니다. 요건 좀 달큰하고 짭짤한 맛으로 먹는 볶음밥이니 좀 달달하고 짭짤하다싶을 정도로 소스를 만들어 오징어를 충분히 졸여서 만드는게 맛있어요. 그냥 집에 있는 야채를 활용 하셔서 만드시면 좋을것 같아요. 모듬해물을 넣고 볶으면 더 훌륭한 볶음밥이 될것 같구요.', 'image_url': 'https://recipe1.ezmember.co.kr/cache/recipe/2015/09/04/17eab276ea13d64b262c25edf7780da41.jpg'}]"
71450,밥/죽/떡,일상,해물류,볶음,입맛 당기는 매콤한 낙지덮밥,낙지덮밥,https://recipe1.ezmember.co.kr/cache/recipe/2015/07/31/c12e840a3a56649ad76f5622dc9f1034.jpg,"19,950",60분 이내,초급,2인분,"[('낙지', '2마리'), ('멥쌀', ''), ('양파', '1개'), ('홍고추', '1개'), ('청양고추', '3개'), ('당근', ''), ('양배추', ''), ('부추', '약간'), ('참기름', ''), ('식용유', '1큰술'), ('밀가루', '2큰술'), ('송송썬부추', '약간'), ('통깨', '약간'), ('녹말가루', '1큰술'), ('물', '적당량'), ('맛술', '1큰술'), ('고추장', '3큰술'), ('고추가루', '2큰술'), ('매실청', '1큰술'), ('올리고당', '2큰술'), ('다진마늘', '1큰술'), ('맛술', '1큰술'), ('천일염', '약간'), ('후춧가루', '약간')]",비린 맛도 전혀 없고 깔끔하면서도 매콤하고 부드러운 식감이 어우러져 맛이 좋은 낙지덮밥입니다.,"[{'step_number': 1, 'description': '양파와 당근은 껍질을 벗겨 씻은 후 양파는 채 썰고 당근은 반달썰기 합니다. 홍고추와 청양고추는 꼭지를 제거하고 흐르는 물에 씻은 후 어슷 썰어 줍니다. 양배추는 흐르는 물에 씻은 후 적당한 크기로 썰고 부추는 다듬어서 씻은 후 3Cm 정도 길이로 썰어 줍니다.', 'image_url': 'https://recipe1.ezmember.co.kr/cache/recipe/2015/07/31/6787006fb5db5fbc93e615733c05a0311.jpg'}, {'step_number': 2, 'description': '분량의 양념장 재료를 넣어 고루 섞어 줍니다.', 'image_url': 'https://recipe1.ezmember.co.kr/cache/recipe/2015/07/31/9dc522f8d36d5db2ef8446c27338648b1.jpg'}, {'step_number': 3, 'description': '낙지는 밀가루를 뿌려 바락바락 문질러서 씻은 후 내장을 제거하고 다시 한 번 흐르는 물에 깨끗하게 씻어서 먹기 좋은 크기로 썰어 줍니다.', 'image_url': 'https://recipe1.ezmember.co.kr/cache/recipe/2015/07/31/6ffe285a598b27af1e7090446024edad1.jpg'}, {'step_number': 4, 'description': '끓는 물에 맛술을 넣은 후 낙지를 넣어 살짝 데친 다음 체에 밭쳐 물기를 제거하고 양념장을 넣어 고루 버무려 줍니다. 비린 맛을 제거하기 위해 맛술을 이용해 보았는데 청주나 레몬 껍질을 이용하셔도 좋아요.', 'image_url': 'https://recipe1.ezmember.co.kr/cache/recipe/2015/07/31/b34d2d5cd732c6b0591a9b1d19bf664a1.jpg'}, {'step_number': 5, 'description': '달군 프라이팬에 식용유를 두르고 홍고추, 청양고추를 넣고 볶다가 당근, 양파, 양배추, 부추 순으로 넣어서 함께 볶아 주고 양념장에 버무린 낙지를 넣어 함께 볶아 줍니다.', 'image_url': 'https://recipe1.ezmember.co.kr/cache/recipe/2015/07/31/2ee52780b77958e1dfd056c2bbc23b731.jpg'}, {'step_number': 6, 'description': '녹말 물을 뿌려 고루 섞어 주고 참기름으로 마무리 한 다음 불에서 내려요.', 'image_url': 'https://recipe1.ezmember.co.kr/cache/recipe/2015/07/31/d61daaad0394badb190ffac2ae13c8351.jpg'}, {'step_number': 7, 'description': '멥쌀은 문질러서 씻은 후 쌀을 불린 다음 밥을 지어요. 그릇에 밥과 낙지볶음을 담고 고명으로 송송 썬 부추와 통깨를 살짝 뿌려 냅니다.', 'image_url': 'https://recipe1.ezmember.co.kr/cache/recipe/2015/07/31/7d270a00e0033df51685487ad0b8399c1.jpg'}]"
71451,밥/죽/떡,일상,해물류,볶음,낙지볶음 황금 레시피만 알면 쉽게 만들 수 있는 낙지덮밥 만드는 법,낙지덮밥,https://recipe1.ezmember.co.kr/cache/recipe/2019/06/04/5ebfb7864d209296b138ec367f904f981.jpg,"10,804",30분 이내,아무나,1인분,"[('낙지', '2마리'), ('청양고추', '1개'), ('홍고추', '1개'), ('대파', '1/2뿌리'), ('당근', '1/3개'), ('애호박', '1/3개'), ('양파', '1/2개'), ('양배추', '1/6개'), ('참기름', '1T'), ('볶은 참깨', '1T'), ('고춧가루', '3T'), ('고추장', '2T'), ('간장', '2T'), ('설탕', '2T'), ('물                                                                                낙지데친물', '2T'), ('올리고당', '1T'), ('다진 마늘', '1T')]","제가 자주 가는 수산물 시장 속 단골 아주머니께 새우살과 바지락살을 구입했는데 낙지 두 마리를 덤으로 받았습니다.

팔고 남은 거라고 따로 챙겨 주셨는데 어찌나 감사하던지 

아주머니께서 안 팔리는 낙지 모아서 집에서 낙지볶음 만들어 먹을 생각으로 가지고 계셨는데 저를 보더니 주고 싶어졌다고 했습니다. 

처음에는 최소 만 원 이상에 판매해도 잘 팔릴 것만 같은 양을 저에게 주셔서 아니다고 아니다고 너무 많다고 거듭 강조를 해서 두 마리만 받았습니다.

한 마리든 두 마리든 저를 생각해서 주셨다는 것에 감사함을 느끼고 있는데 그래도 이것이 바로 시장의 정이 아니겠습니까, 그래서 단골을 만들면 좋다고 말을 하는 듯합니다.

시장에서 장을 보는 날이라 두 손 무겁게 집으로 들어와 정리를 하고 낚지덮밥을 만들어 먹었습니다.

시장에서 장을 봤지만 집에서 어떤 음식을 만들어 먹을까 생각을 하지 않았는데 단골 아주머니께서 주신 낙지로 낙지덮밥을 만들어 먹어서 고민하지 않고 맛있게 한 끼를 해결할 수 있었습니다.

두 마리 받아서 아버지와 어머니와 나눠 먹기에는 조금 적은 양이었는데 아버지와 어머니 두 분 모두 일을 가셔서 집에 저 혼자 있었습니다.

그래서 눈치 보지 않고 저 혼자 맛있게 만들어 먹었습니다.

낙지볶음 황금레시피만 알고 있으면 낙지덮밥은 식은 죽 먹기로 쉽게 만들 수 있는데 친한 친구에게도 알려주기 싫은 낙지볶음 황금레시피! 특별히 여러분에게만 알려드립니다.","[{'step_number': 1, 'description': '대파는 4cm 간격으로 썬 후 반으로 가르고, 양파는 0.5cm 간격으로 채 썰고 애호박은 반으로 가른 후 0.5cm 간격으로 썰고, 당근은 원형 모양을 살려 0.3cm 간격으로 썬다.', 'image_url': 'https://recipe1.ezmember.co.kr/cache/recipe/2019/06/04/1b8bb9020cd80d0a133153468c04c0181.jpg'}, {'step_number': 2, 'description': '양배추는 먹기 좋은 크기로 썰고 청양고추와 홍고추는 어슷 썬다.', 'image_url': 'https://recipe1.ezmember.co.kr/cache/recipe/2019/06/04/404a844b5ce746ae44220f9f74048abc1.jpg'}, {'step_number': 3, 'description': '깨끗하게 손질한 낙지는 끓는 물에 20초 정도 데친다.낙지를 끓는 물에 데치면 볶을 때 물이 나오지 않아 더 맛있는 낙지덮밥을 만들 수 있습니다.', 'image_url': 'https://recipe1.ezmember.co.kr/cache/recipe/2019/06/04/ffda72dde4ab16a4aed8b7dbc8acf7ab1.jpg'}, {'step_number': 4, 'description': '팬에 기름을 두르고 양파와 대파를 볶는다.', 'image_url': 'https://recipe1.ezmember.co.kr/cache/recipe/2019/06/04/366df6fd1ce570614897e2b6a4148ab41.jpg'}, {'step_number': 5, 'description': '양파와 대파의 향이 올라오면 당근, 양배추, 애호박을 넣고 볶는다.', 'image_url': 'https://recipe1.ezmember.co.kr/cache/recipe/2019/06/04/faf4fe287a9e1466629b352ef75edc131.jpg'}, {'step_number': 6, 'description': '채소가 어느 정도 익었으면 낙지, 청양고추, 홍고추, 양념장을 넣어 볶는데 낙지는 데쳤기 때문에 오랫동안 볶을 필요 없습니다.', 'image_url': 'https://recipe1.ezmember.co.kr/cache/recipe/2019/06/04/1fc4ce2fca364f3896fbcb9c119c8f731.jpg'}, {'step_number': 7, 'description': '낙지와 채소가 알맞게 다 익었으면 불을 끄고 참기름 1T, 볶은 참깨 1T를 넣고 남은 잔열로 볶는다.', 'image_url': 'https://recipe1.ezmember.co.kr/cache/recipe/2019/06/04/24d8e2b2a99a32bb5a34c159e27e20a11.jpg'}, {'step_number': 8, 'description': '그리고 그릇에 밥을 담고 그 위에 낙지볶음을 먹기 좋게 담으면 낙지덮밥 완성.밥 위에 낙지볶음을 담을 때 밥이 조금 보이게 담아야 낙지덮밥이라는 사실을 알 수 있겠죠?\n\n이 정도 센스는 여러분도 잘 알고 계실 듯하지만 혹시 모르는 분을 위해 알려드리는 예쁘게 담는 아주 소소한 팁입니다.', 'image_url': 'https://recipe1.ezmember.co.kr/cache/recipe/2019/06/04/46aa71e1f282e3ca885b661ca5c32e4a1.jpg'}]"
71452,밥/죽/떡,일상,해물류,볶음,연어장 덮밥,연어장덮밥,https://recipe1.ezmember.co.kr/cache/recipe/2019/08/01/c2228fe1d722ba2638da1aaa9d2093211.jpg,"3,765",10분 이내,초급,2인분,"[('연어장', '2/3컵'), ('달걀', '2개'), ('밥', '2공기'), ('들기름', '3큰술'), ('맛술', '5큰술'), ('녹말가루', '1작은술'), ('물', '4큰술'), ('올리브유', '2큰술')]","연어장을 맛나게 먹다가 미쳐 못먹고 4~5일 지나버렸네요. 김치냉장고에 있는 연어장으로 오늘은 다른 반찬 필요 없은 덮밥을 만들어 봤습니다.
*참고로 연어장 레시피입니다.
( @6910577 )","[{'step_number': 1, 'description': '연어장 입니다.\n연어는 작은 크기로 썰어 주세요.', 'image_url': 'https://recipe1.ezmember.co.kr/cache/recipe/2019/08/01/c828a39b2bfb414365c1e36ef412b1ae1.jpg'}, {'step_number': 2, 'description': ""'녹말가루에 물을 넣고 저어 녹말물을 만들어 주세요.\n연어장에 같이 담겨있는 청양고추와 양파도 건져 주세요.연어랑 같이 볶을것입니다"", 'image_url': 'https://recipe1.ezmember.co.kr/cache/recipe/2019/08/01/01bd122b9047b31553fb98c043a305aa1.jpg'}, {'step_number': 3, 'description': '팬에 올리브유를 두르고, 연어와 야채를 모두 넣고 볶아 주세요. (1~2분 정도)', 'image_url': 'https://recipe1.ezmember.co.kr/cache/recipe/2019/08/01/fc35000be7d8ded9220f6480c8b30b381.jpg'}, {'step_number': 4, 'description': '달걀물을 넣고 끓어 오르면 저어 주세요.', 'image_url': 'https://recipe1.ezmember.co.kr/cache/recipe/2019/08/01/48d403a6514969c7b38250f838581b6d1.jpg'}, {'step_number': 5, 'description': '녹말물을 고루 붓으면서 저어 주세요.', 'image_url': 'https://recipe1.ezmember.co.kr/cache/recipe/2019/08/01/0c232a7818b4dc92f7dd57ea94f20cde1.jpg'}, {'step_number': 6, 'description': '밥위에 담아 주세요.', 'image_url': 'https://recipe1.ezmember.co.kr/cache/recipe/2019/08/01/09e73336d073e32ecbfc3f9f155e7b501.jpg'}]"
71453,밥/죽/떡,일상,해물류,볶음,샤프란이 없어도 걱정NONO!! 카레가루면 OK! 해물빠에야★,해물빠에야,https://recipe1.ezmember.co.kr/cache/recipe/2017/06/29/00414af1c9787c49801f9f71c54c18bc1.png,"60,863",30분 이내,아무나,2인분,"[('불린 쌀', '1cup'), ('새우', '7마리'), ('오징어(몸통)', '1마리'), ('홍합', '250g'), ('청피망', '1/2개'), ('방울 토마토', '5개'), ('다진 마늘', '1T'), ('다진 양파', '2T'), ('카레가루', '3T'), ('물                                                                                200ml', '1cup'), ('소금', '약간'), ('후추', '약간'), ('파슬리가루', '약간')]","한숟갈 뜰 때마다 홍합,새우,오징어가 뚜둥!!
해물의 풍미와 카레향 입은 쌀도 함께 함냐함냐~
세상의 모든 레시피 만개의레시피","[{'step_number': 1, 'description': '청피망과 양파는 작게 다지고 방울토마토는 4등분 하고 오징어는 링으로 썰어 준비한다.청피망 1/2개, 방울 토마토 5개, 오징어(몸통) 1마리', 'image_url': 'https://recipe1.ezmember.co.kr/cache/recipe/2016/11/18/61574f16ed98656010c5afe6800cfc231.jpg'}, {'step_number': 2, 'description': '카레가루는 물에 잘 섞어 준비한다.카레가루 3T, 물 1cup(200ml)', 'image_url': 'https://recipe1.ezmember.co.kr/cache/recipe/2016/11/18/f96263d372dc4c4aeae028bb640d7d7c1.png'}, {'step_number': 3, 'description': '팬에 올리브유, 다진 마늘, 다진양파, 청피망, 방울토마토를 넣고 소금, 후추로 간을 해 볶는다.다진 마늘 1T, 다진 양파 2T, 소금 약간, 후추 약간팬', 'image_url': 'https://recipe1.ezmember.co.kr/cache/recipe/2016/11/18/bf75be0e7a4dc88864f04f287cf384211.png'}, {'step_number': 4, 'description': '3번에 불린 쌀을 넣고 쌀이 투명해질 때까지 볶는다.불린 쌀 1cup', 'image_url': 'https://recipe1.ezmember.co.kr/cache/recipe/2016/11/18/6cccad92cd46d0614cbfa22bd83188691.png'}, {'step_number': 5, 'description': '4번에 준비한 해물을 넣고 볶다가 카레 물을 조금씩 넣어가며 끓인다.새우 7마리, , 홍합 250g카레 물을 한번에 넣지 않고 2~3번 나누어 넣어 농도를 맞춘다.', 'image_url': 'https://recipe1.ezmember.co.kr/cache/recipe/2016/11/18/bf22388d3d6736705daad157666df9251.png'}, {'step_number': 6, 'description': '쌀알이 너무 불지 않게 해야 하며 볶음밥 정도가 되면 파슬리 가루를 뿌려 완성한다.파슬리가루 약간', 'image_url': 'https://recipe1.ezmember.co.kr/cache/recipe/2016/11/18/4c772f0769562b99b91cf1e48e5882911.png'}]"
