index,종류별,상황별,재료별,방법별,글 제목,레시피이름,레시피이미지,조회수,조리시간,난이도,인분,재료,소개글,조리순서
35319,메인반찬,손님접대,닭고기,굽기,마늘버터에 빠진 갈릭치킨스테이크 만들기 ★,갈릭치킨스테이크,https://recipe1.ezmember.co.kr/cache/recipe/2020/11/27/bc806eb17e02ff03d238faebd722b61c1.jpg,"11,047",30분 이내,아무나,2인분,"[('닭다리살', '400g'), ('버터', '3숟가락'), ('통마늘', '5개'), ('다진 마늘', '2숟가락'), ('로즈마리', '2줄'), ('간장', '1숟가락'), ('설탕', '1/2숟가락'), ('소금', '1/4숟가락'), ('후추', '약간'), ('돈까스소스', '4숟가락'), ('우스타소스', '2숟가락'), ('케찹', '3숟가락'), ('양파', '1/2개'), ('올리브유', '약간'), ('다진 마늘', '1/2숟가락'), ('소금', '약간'), ('후추', '약간')]","마늘버터와 로즈마리로 재운 닭다리살! 
노릇노릇하게 익혀 버섯소스와 곁들인 찐맛 스테이크! 
오늘 저녁엔 어디가지말고 
갈릭치킨스테이크로 칼질하면서 분위기 내자! 
세상의모든레시피 만개의레시피","[{'step_number': 1, 'description': '소스재료의 양파를 채 썬다.', 'image_url': 'https://recipe1.ezmember.co.kr/cache/recipe/2020/11/27/38c2f2b2787ea090617e289072fc2b7d1.jpg'}, {'step_number': 2, 'description': '닭고기의 두꺼운 살코기 부분은 저미고, 껍질은 칼 끝으로 두드려 칼집을 낸다.', 'image_url': 'https://recipe1.ezmember.co.kr/cache/recipe/2020/11/27/4c1d5df23313ee11f88a0810d80cee501.jpg'}, {'step_number': 3, 'description': '손질한 닭다리살에 버터, 다진마늘, 로즈마리, 간장, 설탕, 소금, 후추 넣고 마리네이드한다.', 'image_url': 'https://recipe1.ezmember.co.kr/cache/recipe/2020/11/27/9a62cd5bb695a3c418ecc49263ff85401.jpg'}, {'step_number': 4, 'description': '냄비에 올리브유를 둘러 양파를 넣고 볶다가 나머지 소스재료를 넣고 바글바글 끓여 소스를 만든다.냄비', 'image_url': 'https://recipe1.ezmember.co.kr/cache/recipe/2020/11/27/70728ad49c3317f61a7079cf60ef24ad1.jpg'}, {'step_number': 5, 'description': '팬을 충분히 달군 후 올리브유르 두르고 중약불로 닭다리살을 앞뒤로 노릇하게 굽는다.팬', 'image_url': 'https://recipe1.ezmember.co.kr/cache/recipe/2020/11/27/7a3f9593328fa2fc0c73b8847b41b74b1.jpg'}, {'step_number': 6, 'description': '통마늘도 함께 굽는다.', 'image_url': 'https://recipe1.ezmember.co.kr/cache/recipe/2020/11/27/566ea50c3b851ed2fe7a0c7f12177d891.jpg'}, {'step_number': 7, 'description': '치킨스테이크에 만든 소스를 뿌려 완성한다.', 'image_url': 'https://recipe1.ezmember.co.kr/cache/recipe/2020/11/27/405806892431c4e7d88cef7818e2fff91.jpg'}]"
35320,메인반찬,손님접대,닭고기,굽기,"압력오븐 통닭구이, 오븐 치킨구이",오븐치킨구이,https://recipe1.ezmember.co.kr/cache/recipe/2020/07/29/b20578b2c200282b872565c673ff5dcf1.jpg,"2,834",60분 이내,초급,3인분,"[('닭 1마리', '800g'), ('다진 마늘', '2T'), ('올리브오일', '2T'), ('소금', '1T'), ('후추', '0.5T'), ('로즈마리', ''), ('월계수잎', '약간'), ('양송이버섯', '적당량'), ('파프리카', '적당량'), ('통마늘', '적당량'), ('아스파라거스', '적당량')]","# 오븐 치킨구이와 함께 하는 홈캉스(feat. 생맥)

신개념 오븐, “오쿠 압력 오븐“ 치킨 요리를 소개합니다.

""오쿠 압력 오븐 요리의 특징!""

하나, 로티세리를 이용한 360도 회전으로 기름기 쫙!
둘, 압력을 이용한 요리시간 단축!
셋, 겉은 바삭하고 속은 촉촉!","[{'step_number': 1, 'description': '닭, 양념 재료, 곁들이는 채소를 준비합니다.닭은 약 800g짜리가 적당하며, 더 크거나 작을 경우 조리 시간을 조절하세요.', 'image_url': 'https://recipe1.ezmember.co.kr/cache/recipe/2020/07/30/fb9b38e74e5e581b7b3009f7966cd1171.jpg'}, {'step_number': 2, 'description': '닭은 기름기 많은 부분을 정리한 후 깨끗이 씻고 키친타월로 물기를 제거해 줍니다. 꽁지와 타기 쉬운 날개 끝도 잘라주세요.', 'image_url': 'https://recipe1.ezmember.co.kr/cache/recipe/2020/07/30/5f4255b4c0bd00568e7a0fe441b271e51.jpg'}, {'step_number': 3, 'description': '올리브오일, 다진 마늘, 소금, 후추를 섞어 닭에 바를 양념을 만들어 주세요.소금과 후추는 시판 허브솔트를 사용하시면 간편해요.', 'image_url': 'https://recipe1.ezmember.co.kr/cache/recipe/2020/07/30/ef6b5cf9c570451b266c3301b41314b81.jpg'}, {'step_number': 4, 'description': '만들어진 양념을 닭의 앞, 뒤, 속까지 골고루 마사지하듯 발라줍니다.', 'image_url': 'https://recipe1.ezmember.co.kr/cache/recipe/2020/07/30/c4a64b52ee1328dfcc04969914e40c631.jpg'}, {'step_number': 5, 'description': '냉장고에서 1시간 이상 숙성 시켜주면 간이 잘 배어 맛이 더 좋아요.숙성시킬 때 로즈마리나 월계수잎 같은 향신 재료를 같이 넣어주면 잡내를 잡는데 도움이 돼요.', 'image_url': 'https://recipe1.ezmember.co.kr/cache/recipe/2020/07/30/ec9160067af8303a37591feeed1942f91.jpg'}, {'step_number': 6, 'description': '로티세리 스틱에 닭을 꽂고 포크와 나사로 고정시켜줍니다.', 'image_url': 'https://recipe1.ezmember.co.kr/cache/recipe/2020/07/30/6754e9627623c1569a1cd6c754f7853d1.jpg'}, {'step_number': 7, 'description': '닭이 미끄러워 고정이 잘되지 않을 수 있어요. 그럴 때는 이쑤시개나 실을 이용해서 날개와 다리를 묶어주세요.', 'image_url': 'https://recipe1.ezmember.co.kr/cache/recipe/2020/07/30/990059168886747c277e1db9fcff58d21.jpg'}, {'step_number': 8, 'description': '로티세리 스틱의 방향을 확인한 후 홈에 잘 꽂아주세요.', 'image_url': 'https://recipe1.ezmember.co.kr/cache/recipe/2020/07/30/4af590a8e91c0cbc79dc1dcbdd0741621.jpg'}, {'step_number': 9, 'description': '248℃로 예열된 오븐에서 압력으로 30분 조리합니다.오븐조리시간은 닭 크기에 따라 조절해 주세요. 예열은 10분 이상 시켜주세요.', 'image_url': 'https://recipe1.ezmember.co.kr/cache/recipe/2020/07/30/50a1edb384298c82b0125da85913218a1.jpg'}, {'step_number': 10, 'description': '기름기가 아래로 빠지며, 닭이 맛있게 익어가고 있어요.', 'image_url': 'https://recipe1.ezmember.co.kr/cache/recipe/2020/07/30/7271e7cf15c08ea7462a9247aba65ab41.jpg'}, {'step_number': 11, 'description': '\ufeff1차 조리가 끝나면 베이킹용 쟁반에 종이호일을 깐 후 곁들이는 채소를 넣어 주세요. 채소 양념은 닭에 바르고 남은 것을 사용하시면 좋아요.\ufeff곁들이는 채소는 기호에 따라 선택하시면 되며, 닭만 조리해서 드실 경우 이 과정은 생략하셔도 됩니다.', 'image_url': 'https://recipe1.ezmember.co.kr/cache/recipe/2020/07/30/834dca95efefbc2291a05898efae17d91.jpg'}, {'step_number': 12, 'description': '\ufeff온도를 220℃로 낮추고 약 10~20분간 더 조리해 줍니다. 이때 바삭한 식감을 주기 위해 압력은 해제해 주세요.\ufeff\ufeff온도 및 시간은 닭 크기에 따라 색을 봐가며 조금씩 조절해 주는 것이 좋아요.', 'image_url': 'https://recipe1.ezmember.co.kr/cache/recipe/2020/07/30/61f550c44f3208c32ffdfe88d00de19a1.jpg'}, {'step_number': 13, 'description': '조리가 끝나면 로티세리 제거용 손잡이를 이용해 닭을 꺼내주세요.', 'image_url': 'https://recipe1.ezmember.co.kr/cache/recipe/2020/07/30/8b66749ed04c53ec5372af4738acc5b11.jpg'}, {'step_number': 14, 'description': '\ufeff스틱에서 닭을 조심스럽게 분리한 후 접시에 예쁘게 담아 맛있게 드세요.\ufeff조리가 끝난 로티세리 스틱은 많이 뜨거우니 조심하세요.', 'image_url': 'https://recipe1.ezmember.co.kr/cache/recipe/2020/07/30/94939086e9b2154731e97ab8ab0cb1f81.jpg'}, {'step_number': 15, 'description': '채소와 함께 예쁘게 접시에 담아 취향에 맞는 소스도 곁들여 드실 수 있어요.', 'image_url': 'https://recipe1.ezmember.co.kr/cache/recipe/2020/07/30/90eed98928919482331544c3c4abf2fe1.jpg'}]"
35321,메인반찬,손님접대,닭고기,굽기,닭다리살로 매콤하고 불맛나는 오븐구이만들기,닭다리살오븐구이,https://recipe1.ezmember.co.kr/cache/recipe/2016/04/24/75a57946a68c2479bc932b948036f2271.jpg,"8,869",90분 이내,중급,2인분,"[('닭다리살', ''), ('소금', ''), ('후추', ''), ('월계수잎', ''), ('로즈마리', ''), ('설탕', ''), ('달래', ''), ('사과', ''), ('고추장', ''), ('고춧가루', ''), ('간장', ''), ('소금', ''), ('후추', ''), ('다진마늘', ''), ('올리브유', ''), ('유자소스', ''), ('설탕', '')]",닭다리살로만 불맛나게 만드는 나만의 레시피!!!,"[{'step_number': 1, 'description': '먼저 양념장부터 만들어 줍니다.\n고추장과 고춧가루 들어가고 각각 1:1 비율로 들어가면 될 것 같고요.\n여기에 사과를 갈아서 넣어 주세요. 단맛은 자연스럽게 사과가 주겠죠.', 'image_url': 'https://recipe1.ezmember.co.kr/cache/recipe/2016/04/24/bf53b1179db1883a355d1906a62797be1.jpg'}, {'step_number': 2, 'description': '고춧가루도 들어가는 취향에 따라 고추장과 고춧가루의 비율을\n변경하시면 됩니다. 좀더 매콤한 맛을 원하시면 고춧가루의 양을 더 많이 넣어 주시고\n달달하면서도 고추장의 진득한 맛을 원하시면 고추장을 조금 더 넣어주시면 될 것 같아요.\n저는 같은 비율로 넣어 주었습니다.', 'image_url': 'https://recipe1.ezmember.co.kr/cache/recipe/2016/04/24/aede3309bc349a322b3ec7f42b1cd9271.jpg'}, {'step_number': 3, 'description': '여기에 생강가루, 후추, 설탕이나 유자소스를 넣어 주시고\n간장도 넣어 주세요. 간장은 한큰술 넣으시면 됩니다.', 'image_url': 'https://recipe1.ezmember.co.kr/cache/recipe/2016/04/24/fc3c15eb84924ae70a879a13ef7836d31.jpg'}, {'step_number': 4, 'description': '잘 섞어주세요. 마지막으로 다진마늘 넣어주시면 완성!!!\n이러면 양념장은 모두 완성입니다.', 'image_url': 'https://recipe1.ezmember.co.kr/cache/recipe/2016/04/24/70a4a5e99e6ae37716f357dc037b251e1.jpg'}, {'step_number': 5, 'description': '만들어 놓은 양념장을 냉장고에 넣어 두었다가 사용하시면 더 좋지요.\n숙성단계가 있으면 좋겠죠.', 'image_url': 'https://recipe1.ezmember.co.kr/cache/recipe/2016/04/24/0842626a3cd0565a8eba65cd3b27d54f1.jpg'}, {'step_number': 6, 'description': '이제 중요한 다리살을 준비해 주고요.', 'image_url': 'https://recipe1.ezmember.co.kr/cache/recipe/2016/04/24/87ca6ef276c8ea5a0e0af3df6b6abecb1.jpg'}, {'step_number': 7, 'description': '다리살은 칼집을 내어 주어서 좀더 부드럽게 만들어 주시고요.', 'image_url': 'https://recipe1.ezmember.co.kr/cache/recipe/2016/04/24/a0cfcf139ed38777ebd30c190eaec6f61.jpg'}, {'step_number': 8, 'description': '냉장고에 넣어서 숙성시켜 놓았던 양념장을 꺼내어서\n골고루 양념장을 다리살에 입혀 주세요.', 'image_url': 'https://recipe1.ezmember.co.kr/cache/recipe/2016/04/24/903451555a43bfd486c1ced4758998971.jpg'}, {'step_number': 9, 'description': '여기에 향을 추가해 주시기 위해서 월계수입과\n로즈마리를 넣어 주었습니다.\n잠시 냉장고에서 대기!!!!\n양념이 잘 베이도록 넣어 두세요.', 'image_url': 'https://recipe1.ezmember.co.kr/cache/recipe/2016/04/24/bca41d099d3b11176afdb3ab9ae76f5c1.jpg'}, {'step_number': 10, 'description': '이제 구워줄 차례인데요.\n불맛이 좀더 나고 향신료의 향이 제대로 나게 하기 위해서\n오븐팬 아래에 구이용 호일을 깔아 주고\n거기에 설탕을 깔아 줍니다.\n그리고 향신료들을 채워 주세요.\n로즈마리, 월계수잎, 뭐 바질이 있다면 넣어 주시고요.', 'image_url': 'https://recipe1.ezmember.co.kr/cache/recipe/2016/04/24/768d1f7e1c9c534488832b054955e5771.jpg'}, {'step_number': 11, 'description': '이제 고기 올리고요\n200도로 예열한 오븐에 40분 구워 줍니다.\n중간 중간에 보시면서 뒤집어 주시고요.\n설탕이 잘 녹고 있는지도 보면 좋겠쥬~~~~~~오븐', 'image_url': 'https://recipe1.ezmember.co.kr/cache/recipe/2016/04/24/087cf2e99ca161b2b4f5aa87fc4b909d1.jpg'}, {'step_number': 12, 'description': '설탕이 잘 녹았죠.\n고기도 제법 타지 않게 잘 구워졌습니다.\n각종 향신료 향도 물씬 풍기고 무엇보다 설탕의 단맛이 확 올라오네요.', 'image_url': 'https://recipe1.ezmember.co.kr/cache/recipe/2016/04/24/7e60125ced277180e5668403b69dd7261.jpg'}, {'step_number': 13, 'description': '세팅준비를 합니다. 먼저 고기는 먹음직스러운 크기로 썰어 주고\n완성 접시에 둘러 줍니다.', 'image_url': 'https://recipe1.ezmember.co.kr/cache/recipe/2016/04/24/47defcf43c259ec97e7c8b33ac74ad861.jpg'}, {'step_number': 14, 'description': '바로 그 가운데에는 바로 달래를 올려 줍니다.\n구운 매콤한 닭다리살구이와 함께 신선한 달래랑 같이 먹는 스타일이죠~~', 'image_url': 'https://recipe1.ezmember.co.kr/cache/recipe/2016/04/24/4d3da5bdb88eb47f26fee3f2541b03fe1.jpg'}]"
35322,메인반찬,손님접대,닭고기,굽기,#타이식 매콤새콤 치킨 타이 구이#,치킨구이,https://recipe1.ezmember.co.kr/cache/recipe/2016/05/01/5950d52fd7dc558bbe3a42f451ff476c1.jpg,"5,204",60분 이내,초급,4인분,"[('치킨타이(넙적살)', ''), ('간장', ''), ('설탕', ''), ('레몬즙', ''), ('생강가루', ''), ('마늘가루', ''), ('케얀                                                                                매운맥시코고추고운가루', ''), ('페페론치노가루(이테리매운고추)', ''), ('양배추', '')]","음식명이 길지요 보기는 치킨테리야키 
같이보이지만 맛은 천지차이 입니다
레몬그라스 라임. 타이매운고추가 들어가는데 저는 간단하게 양념을 가루로 넣었습니다 
맛은 거의비슷 했습니다","[{'step_number': 1, 'description': '닭넙적살 마늘가루 생강가루 어니언가루 케얀가루 페페론치노가루 간장\n레몬즙 .설탕을 준비합니다', 'image_url': 'https://recipe1.ezmember.co.kr/cache/recipe/2016/05/01/a6c539718742dc4961f86b3ebf34f7eb1.jpg'}, {'step_number': 2, 'description': '닭살에 레몬즙을 제외하고 몬든 양념을 썩어줍니다', 'image_url': 'https://recipe1.ezmember.co.kr/cache/recipe/2016/05/01/e1b238129d0e7a4dd9a8b600de8bb5981.jpg'}, {'step_number': 3, 'description': '후라이팬이 아주 뜨거워지면 치킨을굽습니다 그릴에 구울때는 숯이다핀다음에 올려 놓고 굽습니다', 'image_url': 'https://recipe1.ezmember.co.kr/cache/recipe/2016/05/01/352e195d3f1cb924d60927d6f256e3311.jpg'}, {'step_number': 4, 'description': '닭이 앞 뒤가잘구워젔으면 레몬즙을 넣습니다', 'image_url': 'https://recipe1.ezmember.co.kr/cache/recipe/2016/05/01/310dc4abbb0c8f80d78b17558b1b006f1.jpg'}, {'step_number': 5, 'description': '4를 졸여줍니다', 'image_url': 'https://recipe1.ezmember.co.kr/cache/recipe/2016/05/01/fc291aa3c093ac43f50da5735de1115f1.jpg'}, {'step_number': 6, 'description': '닭이 바삭하게 잘구워젔습니다', 'image_url': 'https://recipe1.ezmember.co.kr/cache/recipe/2016/05/01/507d2d48d84c30c3c8f0269b04a3456d1.jpg'}, {'step_number': 7, 'description': '양배추는 채를 썰어 놓습니다', 'image_url': 'https://recipe1.ezmember.co.kr/cache/recipe/2016/05/01/f38a6245385b15b930088463afac5eb21.jpg'}, {'step_number': 8, 'description': '7을 얼음물에 담굽니다', 'image_url': 'https://recipe1.ezmember.co.kr/cache/recipe/2016/05/01/9860135b0be9cef03d72e470c1ce2d281.jpg'}, {'step_number': 9, 'description': '양배추는소스를 따로 만들지안고 닭에 매콤하고 새콤달콤함이\n어우러저서닭과 같이 먹으면 환상의궁합 입니다', 'image_url': 'https://recipe1.ezmember.co.kr/cache/recipe/2016/05/01/3c9791c60272747950ab03ed40d910a21.jpg'}]"
35323,메인반찬,손님접대,닭고기,굽기,닭통구이만드는방법! 저녁메뉴강추해요~,닭통구이,https://recipe1.ezmember.co.kr/cache/recipe/2016/05/20/2f0019acab9ebf50f65180d295bd30751.jpg,"13,885",60분 이내,초급,2인분,"[('닭                                                                                작은거', '1마리'), ('버터', '200g'), ('다진마늘', '1스푼'), ('로즈마리컷', '1스푼'), ('허브솔트', '1스푼')]","며칠전 마트에 갔다가 남편이랑
같이 닭고기 구경중에 통닭으로 구이해먹어보자해서
시작하게된 저녁만찬 닭통구이!!
너무 간단해서 당황...ㅋㅋㅋㅋ","[{'step_number': 1, 'description': '생닭은 얼리지 않았으면\n그냥 사용하시고 얼린닭을 사용시\n우유로 잡내를 제거후에 사용해주세요\n깨끗히 씻은 생닭은 배, 등으로 칼집을 내주세요~', 'image_url': 'https://recipe1.ezmember.co.kr/cache/recipe/2016/05/20/6df2d491704b03f4a3f0d19cf296518e1.jpg'}, {'step_number': 2, 'description': '버터 200g은 전자레인지에 녹여주셔야해요~전자레인지', 'image_url': 'https://recipe1.ezmember.co.kr/cache/recipe/2016/05/20/451ddf664b27a9273ae7ead190c021211.jpg'}, {'step_number': 3, 'description': '그리고 다진마늘 1스푼을 넣어주세요', 'image_url': 'https://recipe1.ezmember.co.kr/cache/recipe/2016/05/20/c8b825473eb30ce41a440b97a1fcb5981.jpg'}, {'step_number': 4, 'description': '그다음 로즈마리컷1스푼', 'image_url': 'https://recipe1.ezmember.co.kr/cache/recipe/2016/05/20/60c4975bcacce7b6aeff77d19cd4e1d71.jpg'}, {'step_number': 5, 'description': '허브맛솔트1스푼을 넣고 섞어주세요~', 'image_url': 'https://recipe1.ezmember.co.kr/cache/recipe/2016/05/20/a8a3ea7d63c99aa5f7e33471ccb3e9651.jpg'}, {'step_number': 6, 'description': '골고루 섞여진 소스는 닭고기에 골고루 발라주세요\n껍찔이 정말 구우면 맛있기때문에\n골고루 잘발라주세용~\n그다음 오븐에 구워주시는데 200도에 50분정도 구워주세요~\n여기서 팁은\n저처럼 꽂아서 돌릴수있는 오븐이면상관없는데\n그게 아닌경우 오븐팬에 할경우에는\n25분 구운뒤 다시 뒤집어서 25분 구워주세요~\n오븐팬은 어느거든 상관없어요오븐', 'image_url': 'https://recipe1.ezmember.co.kr/cache/recipe/2016/05/20/1c7b45e90e733bc3b57d1f4828a0728c1.jpg'}, {'step_number': 7, 'description': '그럼 이렇게 부들부들 기름기가 쫙 빠진 통닭구이가 완성됩니다!!\n색이 너무 이쁘지용??\n아 여기서 잠깐 설명에 없었는데\n닭을 굽기전에 배속에\n1회용 백숙용 약초? 그 백숙에 들어가는 1회용팩이 있잖아요\n그걸 반만 넣어서 구워주세요', 'image_url': 'https://recipe1.ezmember.co.kr/cache/recipe/2016/05/20/89070502900fe6c2cbeb8f2e30072e011.jpg'}]"
35324,메인반찬,손님접대,닭고기,굽기,오곡밥 맛밤 통닭구이,통닭구이,https://recipe1.ezmember.co.kr/cache/recipe/2018/08/06/84ad51d879b631fb6c653ddc66ab4246.jpg,"1,467",120분 이내,중급,4인분,"[('통닭', '1 마리'), ('즉석밥', '1 개'), ('맛밤', '1 개'), ('당근', '1/4 개'), ('양파', '1/4 개'), ('사과', '1/4 개'), ('버터', '1 큰술'), ('올리브유', '적당량'), ('허브맛솔트', '약간'), ('소금', '약간'), ('후추', '약간')]",통닭 안에 고소한 오곡밥과 달콤한 맛밤을 듬뿍 넣은 로스트 치킨이다. 밥을 짓거나 밤 껍질을 벗길 필요가 없어 쉽고 빠르게 만들 수 있다는 점이 가장 매력적. 겉은 바삭바삭 속은 촉촉한 치킨과 다양한 곡물이 맛있는 조화를 이룬다.,"[{'step_number': 1, 'description': '맛밤과 당근, 양파, 사과는 2.5cm 크기의 주사위 모양으로 썰고 닭은 기름기를 제거한다. 햇반 오곡밥은 전자레인지에 약 2분 데운다. 오븐을 180℃로 예열해 둔다.', 'image_url': 'https://recipe1.ezmember.co.kr/cache/recipe/2018/08/06/93927e6ca961bab8440abc494584d893.jpg'}, {'step_number': 2, 'description': '달군 팬에 버터(1/2큰술)를 녹인 후 사과를 넣어 볶아둔다.', 'image_url': 'https://recipe1.ezmember.co.kr/cache/recipe/2018/08/06/fc09ae2a33d7437b62519b94f1ae1bc9.jpg'}, {'step_number': 3, 'description': '나머지 버터를 녹인 후 당근과 양파를 넣어 소금, 후추로 간 해 볶는다.', 'image_url': 'https://recipe1.ezmember.co.kr/cache/recipe/2018/08/06/d0e07a3fc516855281002a82be8b48df.jpg'}, {'step_number': 4, 'description': '볶은 재료에 햇반 오곡밥과 맛밤을 넣고 섞어 속을 만든다.', 'image_url': 'https://recipe1.ezmember.co.kr/cache/recipe/2018/08/06/62cdc464309b83f3a6ea7f19eff76980.jpg'}, {'step_number': 5, 'description': '닭 안에 만들어 둔 속을 채워 넣고 다리를 모아 고정한다.', 'image_url': 'https://recipe1.ezmember.co.kr/cache/recipe/2018/08/06/91d11e490b36bfe4cb641605b52897cd.jpg'}, {'step_number': 6, 'description': '겉면에 올리브유를 고루 바른 뒤 허브맛 솔트를 뿌려 예열된 오븐에서 1시간 30분 구워낸다.', 'image_url': 'https://recipe1.ezmember.co.kr/cache/recipe/2018/08/06/022799b11e598e1edf9a7980f494f17e.jpg'}]"
35325,메인반찬,손님접대,닭고기,굽기,데리야끼소스 닭날개구이만들기,데리야끼닭날개구이,https://recipe1.ezmember.co.kr/cache/recipe/2016/01/05/6e84b97c25caeb537aacefd2640492d11.jpg,"8,169",60분 이내,초급,4인분,"[('닭날개', '1팩'), ('화이트와인', '1컵'), ('통마늘', '7개'), ('로즈마리', '조금'), ('올리브유', '조금'), ('데리야끼소스', '4큰술'), ('물', '2큰술'), ('꿀', '1큰술'), ('대파', '1t'), ('다진마늘', '1t'), ('레몬즙', '조금')]",짭쪼름한 데리야끼소스로 구워낸 담백한 닭날개구이,"[{'step_number': 1, 'description': '먼저 닭날개를 깨끗이 씻어 주고\n화이트와인에 하루 정도 재워 줍니다. 누린내도 잡아주는 역할도 하고\n연하게 하는 작용도 해주겠지요.', 'image_url': 'https://recipe1.ezmember.co.kr/cache/recipe/2016/01/05/fc6f2146048c7dbf1dc670390aa1c7df1.jpg'}, {'step_number': 2, 'description': '그렇게 재워 둔 닭날개에 물기를 빼주시고\n달궈진 팬에 올리브유 넣고 닭날개를 구워 줍니다. \n통마늘도 곳곳에 넣어서 같이 구워 줍니다.', 'image_url': 'https://recipe1.ezmember.co.kr/cache/recipe/2016/01/05/cde2a0c565c28012ada5b53ebd46762c1.jpg'}, {'step_number': 3, 'description': '여기에 잡내를 잡아 주고 향도 내어 주는 로즈마리도 넣어 주었습니다.\n뚜껑을 닫고 구워 주세요. 앞뒤로 돌려 가면서 1차로 가스불에 구워 줍니다. \n겉면에 노릇노릇해지면 1차 굽는 것은 완성입니다.', 'image_url': 'https://recipe1.ezmember.co.kr/cache/recipe/2016/01/05/a05311bb2d72d4c396e0c42a74fbaa141.jpg'}, {'step_number': 4, 'description': '겉면이 노릇노릇하게 구워 졌으면 \n일단 키친타올에 올려서 기름을 빼주시고요.', 'image_url': 'https://recipe1.ezmember.co.kr/cache/recipe/2016/01/05/ac4787a8162f36ff32143424fd7a78e41.jpg'}, {'step_number': 5, 'description': '오븐은 200도에 20분 정도 예열을 해 둡니다.\n그 사이에 데리야끼소스를 완성합니다. \n시판용 데리야끼소스를 사용했는데 여기에 좀더 맛을 추가해 주기 위해서\n다진마늘, 다진파, 여기에 꿀을 넣어 주었습니다.오븐', 'image_url': 'https://recipe1.ezmember.co.kr/cache/recipe/2016/01/05/af10fc9cfe842e79b917a900c04da4b11.jpg'}, {'step_number': 6, 'description': '그리고 데리야끼소스를 넣어 주고는\n육수가 있으시면 육수를 넣어 주시고 없으시면 그냥 생수를 넣어주시면 됩니다. \n데리야끼소스2 : 물1 비율로 넣어 주세요.', 'image_url': 'https://recipe1.ezmember.co.kr/cache/recipe/2016/01/05/35aa5dd4b137eb7467dfd7470027594e1.jpg'}, {'step_number': 7, 'description': '만든 데리야끼소스를 닭날개에 뿌려서 양념을 입혀 주세요. \n큰 볼에 1차로 구운 닭날개를 넣고 거기에 소스를 뿌려서 잘 섞어주셔도 되고요.\n아니면 붓을 이용해서 닭날개에 소스를 발라주셔도 됩니다.', 'image_url': 'https://recipe1.ezmember.co.kr/cache/recipe/2016/01/05/1ee73007bab26b2625f1d677ec1f51691.jpg'}, {'step_number': 8, 'description': '유산지를 팬에 깔고 그 위에 닭날개를 올려서 \n예열된 오븐에 넣고는 약 10~15분정도 2차로 구워주시면 됩니다. \n닭날개는 금방 익기 때문에 굽는데에는 오랜 시간이 걸리지 않아도 됩니다.', 'image_url': 'https://recipe1.ezmember.co.kr/cache/recipe/2016/01/05/7a4c45784f0ff5db9da0149e1f3c82bb1.jpg'}, {'step_number': 9, 'description': '데리야끼소스가 잘 입혀져서\n갈색빛이 나게 잘 구워졌습니다. 통마늘도 같이 구워서 같이 먹는 맛도 있네요. \n처음부터 데리야끼소스를 입히지 않고 1차로 구웠기 때문에\n약간의 짭조름한 맛있고 간이 쌔지 않아서 좋았습니다.', 'image_url': 'https://recipe1.ezmember.co.kr/cache/recipe/2016/01/05/06075ace21dbcbc12a393e7aa81c34e31.jpg'}, {'step_number': 10, 'description': '마지막으로 플레이팅을 해줍니다. \n닭날개를 옆으로 하나씩 세워서 나란히 나란히 접시에 담아 주시고\n통마늘도 같이 올려 주시면 데리야끼소스로 맛을 낸 닭날개구이가 완성됩니다.', 'image_url': 'https://recipe1.ezmember.co.kr/cache/recipe/2016/01/05/28f1f1edfa0eb9c888e03d61eec9a5141.jpg'}]"
