index,종류별,상황별,재료별,방법별,글 제목,레시피이름,레시피이미지,조회수,조리시간,난이도,인분,재료,소개글,조리순서
17281,밑반찬,명절,채소류,볶음,추석 삼색나물,삼색나물,https://recipe1.ezmember.co.kr/cache/recipe/2020/09/21/9d8fe91d72f1203f5ff6a1dd91adfec31.jpg,"2,805",30분 이내,아무나,2인분,"[('시금치', '1단'), ('다진 대파', '1큰술'), ('다진 마늘', '1큰술'), ('소금', '1/2작은술'), ('참기름', '1큰술'), ('통깨', '1큰술'), ('도라지', '150g'), ('멸치다시마육수', '4큰술'), ('들기름', '1큰술'), ('카놀라유', '1큰술'), ('소금', '약간'), ('다진 마늘', '1/2큰술'), ('통깨', '1큰술'), ('고사리', '150g'), ('다진 대파', '2큰술'), ('다진 마늘', '1큰술'), ('국간장', '1작은술'), ('들기름', '1큰술'), ('멸치다시마육수', '1/2컵'), ('통깨', '1큰술')]","안녕하세요? 밥심은 국력입니다. 추석에 빠지지 않는 요리가 삼색나물인데요. 보통 삼색 나물이라고 하면 흰색 나물, 갈색 나물, 푸른색 나물이 기본이지요. 차례상에는 나물 무칠 때 파, 마늘을 쓰지 않는다고 하는데 정석대로 만드실 분들은 파, 마늘 양념은 빼고 만드세요. 그럼 추석 삼색나물을 만들어 볼게요.","[{'step_number': 1, 'description': '고사리, 도라지, 시금치 나물을 준비해요. 흰색 나물로 도라지 나물 대신 무나물을 만드는 집도 있어요.', 'image_url': 'https://recipe1.ezmember.co.kr/cache/recipe/2020/09/23/67390b73cf7d21dc1125ca6bd80b8c5f1.jpg'}, {'step_number': 2, 'description': '도라지는 꽃소금 1큰술과 물을 조금 넣고 바락바락 문질러 도라지의 아린 맛을 제거해요. 그런 다음 찬물에 헹궈주어요.', 'image_url': 'https://recipe1.ezmember.co.kr/cache/recipe/2020/09/23/3f7d82121a22e4d1db40d9e094f8fedd1.jpg'}, {'step_number': 3, 'description': '물기를 꼭 짜요.', 'image_url': 'https://recipe1.ezmember.co.kr/cache/recipe/2020/09/23/9f6c2ad96aa41a5cb69f6515e797f9621.jpg'}, {'step_number': 4, 'description': '볼에 도라지를 넣고 들기름 1큰술과 다진 마늘 반 큰술을 넣고 밑간을 해요', 'image_url': 'https://recipe1.ezmember.co.kr/cache/recipe/2020/09/23/6be342e29da50b4e5aa663f41e1de5d31.jpg'}, {'step_number': 5, 'description': '찬물 두 컵에 멸치다시마 1팩을 넣고 색이 나도록 우려주어요. 끓여도 되지만, 끓이지 않았어요. 1시간 정도 우린 상태랍니다. 마른 국멸치와 다시마, 무 등을 넣고 끓여서 만들어도 되구요.', 'image_url': 'https://recipe1.ezmember.co.kr/cache/recipe/2020/09/23/d79bf1ee769759f44297063aae2b2c8d1.jpg'}, {'step_number': 6, 'description': '팬을 달군 뒤 카놀라유 1큰술을 넣고 밑간한 도라지를 볶다가 멸치다시마 육수 4큰술을 넣어 국물이 없어질 때끼지 볶아주어요. 소금 간을 약간 하고 통깨를 뿌려주어요.', 'image_url': 'https://recipe1.ezmember.co.kr/cache/recipe/2020/09/23/bc2f6e3fce91c78912939f9d6df1e61c1.jpg'}, {'step_number': 7, 'description': '불린 고사리를 구입했는데, 끓는 물에 1분 정도 살짝 데쳐주어요. 찬물에 헹궈 물기를 제거하고요.', 'image_url': 'https://recipe1.ezmember.co.kr/cache/recipe/2020/09/23/691acc68ca067a989855768c2773001d1.jpg'}, {'step_number': 8, 'description': '볼에 고사리를 넣고 국간장 1작은술, 다진 마늘 1큰술, 다진 대파 2큰술을 넣고 밑간을 하고 잘버무려 줍니다.', 'image_url': 'https://recipe1.ezmember.co.kr/cache/recipe/2020/09/23/ad5d7df116749b90bdb6e47624649e871.jpg'}, {'step_number': 9, 'description': '팬에 들기름 1큰술을 넣고 볶아주다가 멸치다시마 육수 반 컵을 넣어서 국물이 없어질 때까지 볶아줍니다.', 'image_url': 'https://recipe1.ezmember.co.kr/cache/recipe/2020/09/23/6e711f54727efd5e884c04df0f7af72b1.jpg'}, {'step_number': 10, 'description': '통깨 1큰술을 넣어 마무리합니다.', 'image_url': 'https://recipe1.ezmember.co.kr/cache/recipe/2020/09/23/b996b2dc77704b2e16ae1a30e1d380b01.jpg'}, {'step_number': 11, 'description': '시금치는 찬물에 10분 정도 담궈서 흙이나 이물질을 제거하고 물기를 제거해요. 이 때 시금치 뿌리에도 영양이 많으므로 자르지 말고 그대로 사용하세요.', 'image_url': 'https://recipe1.ezmember.co.kr/cache/recipe/2020/09/23/d16591b92783221d0e2f5eed13ab62e51.jpg'}, {'step_number': 12, 'description': '끓는 물에 소금 2큰술을 넣고 뿌리부분부터 익히고 잎사귀를 데쳐줍니다. 데치는 시간은 총 30~40초입니다. 시금치는 절대 오래 데치지 마세요. 곤죽이 되거든요. 소금을 넣고 데쳐야 색이 파랗게 데쳐지구요.', 'image_url': 'https://recipe1.ezmember.co.kr/cache/recipe/2020/09/23/4d6811eb01fcf86ca58717ced1a16c9d1.jpg'}, {'step_number': 13, 'description': '찬물에 여러 번 헹궈서 시금치의 열기를 빼줍니다. 길이를 2등분하고 물기를 꼭 짜주어요.', 'image_url': 'https://recipe1.ezmember.co.kr/cache/recipe/2020/09/23/74a2a45d92ba657f7e134700b4d431dd1.jpg'}, {'step_number': 14, 'description': '볼에 데친 시금치를 담고 다진대파 1큰술, 다진 마늘 1큰술, 소금 1/2작은술, 참기름 1큰술, 통깨 1큰술 등을 넣고 무쳐요.', 'image_url': 'https://recipe1.ezmember.co.kr/cache/recipe/2020/09/23/3c43b94ba8c1f2e4d62c279fed44efeb1.jpg'}, {'step_number': 15, 'description': '소금 대신 까나리 액젓이나 멸치액젓을 넣기도 해요.', 'image_url': 'https://recipe1.ezmember.co.kr/cache/recipe/2020/09/23/a1aa32421d610a1555dd20d2feb86d331.jpg'}]"
17282,밑반찬,명절,채소류,볶음,삼색나물~명절음식/제사상나물,삼색나물,https://recipe1.ezmember.co.kr/cache/recipe/2021/02/09/5fcae7333b281dfa36d04f3e9b8bfafd1.jpg,"9,977",30분 이내,아무나,4인분,"[('노지시금치                                                                                섬초 포항초', '500g'), ('깐 도라지', '350g'), ('삶은 고사리', '250g'), ('설탕', '1큰술'), ('소금', '1작은술'), ('국간장', '2큰술'), ('가는소금', '3~4꼬집'), ('다진파', '1큰술'), ('다진마늘', '3티스푼'), ('참기름', '1큰술'), ('곱게갈은 깨', '1큰술'), ('해바라기유', '2큰술')]","설,추석,제사상에 꼭 빠지면 안되는 기본 삼색나물 쉽고간단하게 만들어 보세요
쓴맛없는 도라지볶음~꿀팁이 담겨져있어요","[{'step_number': 1, 'description': '깐도라지를 준비후에 설탕1큰술을 넣고 잘 비벼준후 10분을 재워두셨다가 찬물에서 2번을 비벼 씻어주세요', 'image_url': 'https://recipe1.ezmember.co.kr/cache/recipe/2021/02/09/81bd1a941b3d28faa5384c7cd85f14211.jpg'}, {'step_number': 2, 'description': '위에 씻은 도라지를 물기를 털어내주시고 소금1작은술을 넣고 잘섞어 다시 10분을 재워두셨다가 1번만 씻어주신후 물기를 꼭짜주시고 팬에 해바라기유1큰술/다진마늘을 넣고 3~5분을 볶아주시고 곱게 갈아준깨와 참기름을 넣어 마무리하시면 쓴맛없는 도라지볶음이 완성이 되네요\n*싱거우시면 볶으실때 소금을 조금만 뿌려주세요', 'image_url': 'https://recipe1.ezmember.co.kr/cache/recipe/2021/02/10/7d1e3cab1f8cd7d8a3824d9038ba06841.jpg'}, {'step_number': 3, 'description': '삶아진 고사리를 준비후에 찬물에서 씻어주시면서 너무 풀어지게 삶아져서 뭉그러지는 것들은 빼주세요\n먹기좋은 길이로 자른후 팬에 해바라기유를1큰술/다진마늘을 넣고 중불에서 볶아주시면서 국간장을 넣어 밑간을 해주시고 3~5분을 볶아주시다가 고운깨/참기름을 넣어서 완성하세요', 'image_url': 'https://recipe1.ezmember.co.kr/cache/recipe/2021/02/09/1dc680df74c6781791faa1e0a86936e41.jpg'}, {'step_number': 4, 'description': '노지시금치(포항초/섬초)를 준비후에 무른잎이나 누런잎을 제거후에 펄펄 끓는물에 소금1작은술을 넣고 1분만 데쳐주신후 찬물에서 2~3번을 씻어 먹기좋은 크기로 찢어주시고 물기를 꼭짜주신후 \n다진파/다진마늘/가는소금/고운깨/참기름을 넣고 잘 무쳐주시면 완성이네요\n처음부터 소금을 다넣지마시고 조금씩 넣어가시면서 입맛에 맛게 간을 조절하세요', 'image_url': 'https://recipe1.ezmember.co.kr/cache/recipe/2021/02/09/9012c5926c7596a0912092f1a4bfcb8e1.jpg'}, {'step_number': 5, 'description': '제사상에 올리는 명절에도 빠질수없는 삼색나물이 완성이 되었어요', 'image_url': 'https://recipe1.ezmember.co.kr/cache/recipe/2021/02/09/52b36c780de5490f241e19a648c0e7d91.jpg'}]"
17283,밑반찬,명절,채소류,볶음,도라지나물볶음 만드는법 제사명절음식 밑반찬,도라지나물볶음,https://recipe1.ezmember.co.kr/cache/recipe/2022/07/28/88202f6568063ad8ff84f7686722550d1.jpg,509,10분 이내,아무나,2인분,"[('도라지', '1팩'), ('소금', '1/2t'), ('설탕', '1/2t'), ('통깨', '1t'), ('파', '1움큼'), ('빨간파프리카', '1움큼'), ('들기름', '2t')]",밥반찬으로 좋은 도라지나물 쓴맛없이 볶는법 소개 해드릴께요.,"[{'step_number': 1, 'description': '도라지나물볶음 황금레시피 그럼 시작 해 볼께요.', 'image_url': 'https://recipe1.ezmember.co.kr/cache/recipe/2022/07/28/342a3b99a6a60ceb116caa437088220f1.jpg'}, {'step_number': 2, 'description': '물기있는 상태의 담가서 쓴맛을 뺏던\n도라지에 설탕과 소금을 넣고 조물 조물 주물러 주세요.\n그럼 약간 뽀얀 국물이 나온답니다.\n그럼 물에 한번 더 헹구어 주세요.', 'image_url': 'https://recipe1.ezmember.co.kr/cache/recipe/2022/07/28/9da04a283e0be77b2ca92cfc9254c4d51.jpg'}, {'step_number': 3, 'description': '들기름을 두르고 도라지를 넣고 살살 볶아 주세요.살짝 볶다가 얇게 채를 썰어둔 홍파프리카와 파도 한움큼.간마늘도 넣어 주시구요\n통깨도 넣고 소금과 설탕으로 간을 맞추어 주세요.', 'image_url': 'https://recipe1.ezmember.co.kr/cache/recipe/2022/07/28/bdb29ba73255efd737f09555f96b927a1.jpg'}, {'step_number': 4, 'description': '그럼 비빔밥에 넣어서 먹어도 맛있고 밥반찬으로 너무 맛있는 도라지볶음 완성이랍니다.', 'image_url': 'https://recipe1.ezmember.co.kr/cache/recipe/2022/07/28/2e5c7bd5ff955e3cd1b090c1c03bedbb1.jpg'}]"
17284,밑반찬,명절,채소류,볶음,"[궁채나물]추석음식,오독오독한 식감이 좋은 들깨 궁채나물(줄기 상추 나물) 한번 먹고 나면 자꾸 생각나요",궁채나물들깨볶음,https://recipe1.ezmember.co.kr/cache/recipe/2022/09/03/e56c6b7f4fdb124916886416d21074f31.jpg,"2,106",30분 이내,아무나,4인분,"[('궁채나물', '250g'), ('들깨가루', '8T'), ('포도씨유', '2T'), ('홍고추', '1개'), ('육수', '200cc'), ('통깨', ''), ('월계수잎', '3장'), ('기름', '2T'), ('다진마늘', '2T'), ('대파', '2개'), ('국간장', '1T'), ('참치액젓', '2T'), ('치킨파우더', '2T'), ('들깨가루', '8T'), ('참기름', '1T'), ('통깨', '약간')]",안녕하세요? 난이입니다 한때 유명했던 궁채(줄기상추)~ 궁채 장아찌로만 만들어 먹다가 추석 명절이 다가와서 나물로도 만들어 봤어요 생소하신 이웃님들도 계시겠지만 한번 드시고 나면 자꾸만 생각이 나서 찾게 될 거예요 추석 나물로 추천 해 봅니다,"[{'step_number': 1, 'description': '마른 궁채 (줄기상추)를 250g 준비합니다', 'image_url': 'https://recipe1.ezmember.co.kr/cache/recipe/2022/09/03/94356708c07e07d44acecf307b99ce781.jpg'}, {'step_number': 2, 'description': '말린 궁채(줄기상추)를 물에 넣고 씻어줍니다갈색 물이 맑은 물이 나올 때까지 주물주물 씻어주세요', 'image_url': 'https://recipe1.ezmember.co.kr/cache/recipe/2022/09/03/5bd94763e5a293fee13d1e5bd7fe2bc21.jpg'}, {'step_number': 3, 'description': '씻은 궁채(줄기상추)에 물을 붓고 월계수 잎 3장을 넣고 10시간 이상 불려줍니다 궁채(줄기상추)을 불리면 4~6배 정도로 커져요월계수 잎을 넣는 이유는 궁채(줄기상추)의 특유의 냄새를 제거 하기 위해서 입니다', 'image_url': 'https://recipe1.ezmember.co.kr/cache/recipe/2022/09/03/f683cca91a1683fbea6a52b7231567141.jpg'}, {'step_number': 4, 'description': '궁채(줄기상추)는 팔팔 끓은 물에 소금을 약간 넣고 살짝(2분 정도) 데쳐 줍니다', 'image_url': 'https://recipe1.ezmember.co.kr/cache/recipe/2022/09/03/cd73169f5924ff863696dd7d44a1f4681.jpg'}, {'step_number': 5, 'description': '데친 궁채(줄기상추)는 빠르게 찬물로 씻어서 체반에 넣어 물기를 빼 줍니다', 'image_url': 'https://recipe1.ezmember.co.kr/cache/recipe/2022/09/03/d1c8930885caa0d858b1bb99e14b72cb1.jpg'}, {'step_number': 6, 'description': '궁채(줄기상추)를 긴 상태로\n불려서 먹기 좋은 크기\n3~4cm크기로 잘라 줍니다', 'image_url': 'https://recipe1.ezmember.co.kr/cache/recipe/2022/09/03/04f4231b99175437e695329e382768eb1.jpg'}, {'step_number': 7, 'description': '그릇에 기름 2T 두르고 다진 마늘 2T과 준비한 대파를 넣고 파,마늘을 볶아줍니다', 'image_url': 'https://recipe1.ezmember.co.kr/cache/recipe/2022/09/03/309d0d06d09bec38f0893c85abef3c7b1.jpg'}, {'step_number': 8, 'description': '준비한 궁채(줄기상추)를 넣고 국간장 2T를 넣고 볶아줍니다 3분 정도 볶다가 생수(육수) 200ml를 붓고 뚜껑을 닫고 중불로 줄인 후 끓여줍니다', 'image_url': 'https://recipe1.ezmember.co.kr/cache/recipe/2022/09/03/29237bbce24f1af93edb1e3c270b83301.jpg'}, {'step_number': 9, 'description': '치킨 파우더를 2T를 넣고 볶아줍니다치킨 파우더는 선택 사항이에요', 'image_url': 'https://recipe1.ezmember.co.kr/cache/recipe/2022/09/03/2ae4bf969a5a864694317e63133383a91.jpg'}, {'step_number': 10, 'description': '참치 액젓 2스푼 넣어 줍니다치킨 파우더를 사용하지 않다면 참치 액젓 양을 늘리시면 된답니다', 'image_url': 'https://recipe1.ezmember.co.kr/cache/recipe/2022/09/03/eb7093b228b7df27bd63b0310e9a1e871.jpg'}, {'step_number': 11, 'description': '들깨가루 8T를 넣고 잘 섞은 후 자작 자작하게 7분 정도 끓여줍니다 들깨를 넣어서 궁채(줄기상추)나물이 걸쭉해지면 육수나 생수를 넣어서 농도를 맞춰줍니다국물은 자박자박 한 정도가 좋아요', 'image_url': 'https://recipe1.ezmember.co.kr/cache/recipe/2022/09/03/7485f21706c611a5e8d66b92e953f4621.jpg'}, {'step_number': 12, 'description': '궁채(줄기상추)와 들깨가루가 잘 섞이도록 뒤적거려주고 불을 약불로 줄인 후 참기름 1T를 넣은 후 5분 정도 끓여줍니다', 'image_url': 'https://recipe1.ezmember.co.kr/cache/recipe/2022/09/03/86185845b29d168b51eeafc6374c4a661.jpg'}, {'step_number': 13, 'description': '고명으로 홍고추를 넣고 뒤적거려 준 후 통깨 뿌려서 완성합니다', 'image_url': 'https://recipe1.ezmember.co.kr/cache/recipe/2022/09/03/0ef81e8f30bcd31f3316c867d7de4d371.jpg'}, {'step_number': 14, 'description': '오독오독한 식감과 들깨와 고소함이 어우러져 자꾸만 손이 가는 궁채(줄기상추) 입니다 오독오독한소리가 너무 좋아서 자꾸만 먹게 된답니다 추석명절나물로 추천하고 싶은 나물 이네요 꼭 ! 만들어 보세요', 'image_url': 'https://recipe1.ezmember.co.kr/cache/recipe/2022/09/03/d87639aaf1b7dd789c09f1288eeb3c171.jpg'}]"
17285,밑반찬,명절,채소류,볶음,고사리나물볶음:겨울에 먹으면 더 좋은 건나물요리,고사리나물볶음,https://recipe1.ezmember.co.kr/cache/recipe/2023/01/15/43c036aac98124c31fa51fb6466efefa1.jpg,"1,197",30분 이내,초급,6인분 이상,"[('건고사리', '100g'), ('다진마늘', '1.5큰술'), ('국간장', '3큰술'), ('대게백간장', '1큰술'), ('참기름', '2큰술'), ('황태육수', '2국자'), ('다진파', '2~3큰술'), ('들깨가루', '2~3큰술'), ('들기름', '1큰술')]","꼭 명절이 아니어도
겨울은 건나물로 영양챙기는 계절이니
건고사리 맛있게 볶아서
맛도 건강도 잘 챙기세요.
건고사리를 독성없이 불려서 삶는 방법은
아래 링크를 걸러둘게요.

​","[{'step_number': 1, 'description': '삶은 고사리를 먹기 좋은 크기로 자른 후 다진마늘,간장,참기름 넣어 버무린다.팬에 불을 켜고 볶는다볶음팬(웍)에 삶은 고사리와 갖은 양념 넣어\n서로 맛이 잘 어우러지게 무친 후 그대로\n볶으면 편해요.\u200b\n\n\u200b', 'image_url': 'https://recipe1.ezmember.co.kr/cache/recipe/2023/01/15/ce1c775de24a0faabd6e7956d3bf026a1.jpg'}, {'step_number': 2, 'description': '황태육수를 넣고 조리듯 촉촉하게 볶는다.황태육수,멸치육수,채수 다 좋은데\n따뜻한 상태 육수를 넣으면 더 좋아요.', 'image_url': 'https://recipe1.ezmember.co.kr/cache/recipe/2023/01/15/a16c04d757c847a43085b171861c10341.jpg'}, {'step_number': 3, 'description': '다진파 넉넉히 넣고 뒤적인 후 불을 끈다.파는 흰대부분을 많이 넣어야 맛있어요.', 'image_url': 'https://recipe1.ezmember.co.kr/cache/recipe/2023/01/15/9cf4fa436190ea2f005c998e892f34ab1.jpg'}, {'step_number': 4, 'description': '거피한 들깨가루 넣고 -', 'image_url': 'https://recipe1.ezmember.co.kr/cache/recipe/2023/01/15/2f796db5a4154aeb8bf53417fdf828081.jpg'}, {'step_number': 5, 'description': '들기름도 넣고 섞는다.\n*들깨가루와 들기름은 불을 끄고 넣어주세요.', 'image_url': 'https://recipe1.ezmember.co.kr/cache/recipe/2023/01/15/d9fabde5ac4db2bede7bfeaa9c8d5c3f1.jpg'}]"
17286,밑반찬,명절,채소류,볶음,삶은 고사리나물볶음 만들기...,고사리나물볶음,https://recipe1.ezmember.co.kr/cache/recipe/2023/01/17/39da80eddae5d493e3bf4e14c481246e1.jpg,"3,973",30분 이내,아무나,6인분 이상,"[('삶은 고사리', '250g'), ('대파', '1/3대'), ('들기름', '3T'), ('국간장', '2T'), ('마늘', '1T'), ('설탕', '1t'), ('물', '1/2컵'), ('깨', '약간')]",고사리 특유의 비린맛 없이 맛있게 고사리나물 만드는 레시피입니다.,"[{'step_number': 1, 'description': '삶은고사리는 물에 서너번 헹궈\n먹기 좋은 크기로 잘라요.', 'image_url': 'https://recipe1.ezmember.co.kr/cache/recipe/2023/01/17/47bff2c2efa072d974a9b28ed8be556a1.jpg'}, {'step_number': 2, 'description': '대파는 작게 송송송 썰어요.', 'image_url': 'https://recipe1.ezmember.co.kr/cache/recipe/2023/01/17/f3e3dcbdd6944e40b44ff037723aa7df1.jpg'}, {'step_number': 3, 'description': ""팬에 들기름 3T.'대파 넣어 볶아요.\n대파가 노골노골해지면"", 'image_url': 'https://recipe1.ezmember.co.kr/cache/recipe/2023/01/17/d59642887319ed8d32bf584c71d4af061.jpg'}, {'step_number': 4, 'description': '고사.마늘 1T넣어 5분정도 볶아요.', 'image_url': 'https://recipe1.ezmember.co.kr/cache/recipe/2023/01/17/fc45f0a7347f806df01abda80998ff251.jpg'}, {'step_number': 5, 'description': '물 1/2컵.국간장 2T.설탕 1t 넣어 국물이 없어질때까지 볶고\n깨 솔솔 뿌려 마무리해요.', 'image_url': 'https://recipe1.ezmember.co.kr/cache/recipe/2023/01/17/0e979cd07a76f53d252fd8c3805847f91.jpg'}]"
