index,종류별,상황별,재료별,방법별,글 제목,레시피이름,레시피이미지,조회수,조리시간,난이도,인분,재료,소개글,조리순서
5168,밑반찬,일상,해물류,볶음,부드러운 고추장 일미볶음 황금레시피,일미볶음,https://recipe1.ezmember.co.kr/cache/recipe/2020/10/08/3b7fc000d37a71cf44593d5f67891fb41.jpg,"24,175",60분 이내,아무나,2인분,"[('홍진미', ''), ('고추장', ''), ('참기름', ''), ('다진마늘', ''), ('올리고당', ''), ('깨소금', ''), ('마요네즈', '')]",요즘 밑반찬으로 뭐 해 드시나요?? 마트에 가서 장을 봐도 별 특별한게 없이 늘 똑같은 메뉴의 반복이더라구요.ㅠ.ㅠ 식상한 식단!! 밑반찬도 매일 만들려고 하니 힘들고 고민스러워요. 그래서 쟁여놓고 먹을 수 있는 밑반찬이 무엇이 있을까?? 고민하다가 제가 잊고 있었던 밑반찬이 하나 생각나더라구요. 바로 고추장 일미볶음입니다. 매콤한 고추장 일미볶음 하나면 밥 한그릇 그냥 뚝딱할 수 있더라구요. 홍진미로 선택했어요. 제가 산 일미입니다. 전 백진미보다 이렇게 홍진미를 선택해요. 오징어 껍질채로 말린 홍진미가 더 맛있더라구요.,"[{'step_number': 1, 'description': '먼저, 적당량의 일미를 덜어내어주세요. 일미의 양의 따라 고추장 소스의 양도 좌우되기 때문에 어느정도 하실건가가 중요합니다. 전 쟁여놓고 먹을거라 넉넉히 꺼내놓았어요.^^', 'image_url': 'https://recipe1.ezmember.co.kr/cache/recipe/2020/10/08/b5bc8da27721a0abd5cd9f46087a3caf1.jpg'}, {'step_number': 2, 'description': '가공식품이긴 하나 그래도 위생적으로 한번 더 헹궈주는게 좋더라구요. 마요네즈 묻혀 숙성시킬 때도 촉촉한 일미가 더욱 좋아요.^^', 'image_url': 'https://recipe1.ezmember.co.kr/cache/recipe/2020/10/08/04347249475317f0b5897ee87746a3351.jpg'}, {'step_number': 3, 'description': '촉촉하게 젖은 홍진미가 더 부드러워진 것 같죠!!', 'image_url': 'https://recipe1.ezmember.co.kr/cache/recipe/2020/10/08/38b8a2af9e45945d47c3ac0153169b011.jpg'}, {'step_number': 4, 'description': '마요네즈를 넣고 버무려주세요. 촉촉하게 젖은 일미에 마요네즈를 넣어주세요. 마요네즈가 일미가 딱딱하게 굳어지는 것을 방지하는 역할을 하기때문에 골고루 스며들게 하셔야 해요. 넘 많이 넣으면 칼로리가 높아져요. 그래서 일미의 양에 따라 다른데.... 전 큰 3스푼의 양을 넣어주었답니다.', 'image_url': 'https://recipe1.ezmember.co.kr/cache/recipe/2020/10/08/09b962355375fb0b6eaee3c9fd39ea901.jpg'}, {'step_number': 5, 'description': '마요네즈로 일미가 촉촉하게 버무려질 정도로 넣어주시면 됩니다. 마요네즈가 일미에 골고루 버무려진 모습입니다.', 'image_url': 'https://recipe1.ezmember.co.kr/cache/recipe/2020/10/08/ba45f5e82fdcfda99709a98a19e8a1e91.jpg'}, {'step_number': 6, 'description': '그럼 이렇게 마요네즈로 버무려진 일미를 랩을 씌워 냉장고에서 30분~1시간 숙성시켜주세요. 마요네즈가 일미에 고루 베이면 더욱 촉촉한 고추장 일미볶음이 된답니다.^^', 'image_url': 'https://recipe1.ezmember.co.kr/cache/recipe/2020/10/08/8f61fc1f28724d833cc659000599f88a1.jpg'}, {'step_number': 7, 'description': '소스맛이 요리의 맛의 반은 차지하기 때문에 소스만들기가 중요해요. 먼저, 고추장을 일미의 양에 맞춰서 준비하시면 됩니다. 저는 저는 큰 스푼으로 6~7스푼정도 준비했어요. 소스는 조금 넉넉하게 만들어 놓으셔도 담에 사용할 수 있으니 모자라지 않게 넉넉하게 준비해 주세요. 부족해서 다시 만들면 똑같은 맛을 내기가 쉽지 않더라구요. ㅎㅎㅎㅎ', 'image_url': 'https://recipe1.ezmember.co.kr/cache/recipe/2020/10/08/7cbba561b33360165ca4d10d47e314d81.jpg'}, {'step_number': 8, 'description': '그리고 다진 마늘 큰 1스푼을 넣어주세요.', 'image_url': 'https://recipe1.ezmember.co.kr/cache/recipe/2020/10/08/004f41f2797cdf973a978e5b7724b0141.jpg'}, {'step_number': 9, 'description': '전 요리에 설탕을 잘 사용하지 않아요. 단맛이 필요할 땐 올리고당이나 요리당을 이용하여 맛을 낸답니다. 올리고당은 소주잔으로 한 컵정도 넣어주세요. 간을 보고 단맛이 부족하면 조금 더 넣어주셔도 됩니다.^^', 'image_url': 'https://recipe1.ezmember.co.kr/cache/recipe/2020/10/08/9f3aed36238258c61852bb1d24f0cdc01.jpg'}, {'step_number': 10, 'description': '그리고 고소한 참기름을 적당히 넣어주세요. 고소한 감칠맛만 낼 정도로 넣어주시면 됩니다. 넘 많이 넣으면 마요네즈의 고소함맛과 부딪혀서 격할 수 있으니 고추장 소스에서 약간의 고소함맛만 감미될 정도로만 넣어주세요.^^', 'image_url': 'https://recipe1.ezmember.co.kr/cache/recipe/2020/10/08/7c71d7e62b772e1f399d317173e847381.jpg'}, {'step_number': 11, 'description': '마요네즈로 버무려진 숙성된 일미를 냉장고에서 꺼내주세요. 골고루 마요네즈가 베인 일미가 더욱 촉촉해진 것이 보이실 겁니다.^^', 'image_url': 'https://recipe1.ezmember.co.kr/cache/recipe/2020/10/08/860793974a7a8334244c5bd3b716b5021.jpg'}, {'step_number': 12, 'description': '먹기좋은 적당한 길이로 잘라주세요. 촉촉해진 일미라 자르기가 쉬워요!!', 'image_url': 'https://recipe1.ezmember.co.kr/cache/recipe/2020/10/08/d0d32003aaa13adbd5a56f74d4800d631.jpg'}, {'step_number': 13, 'description': '잘라진 일미를 스탠 후라이팬에 올려놓고 볶겠습니다. 젤 첫음에 헹궜잖아요. 수돗물에 헹궸기때문에 수돗물이 날아갈 정도로만 골고루 볶아주시면 됩니다. 1분정도로 볶아주세요. 마요네즈에 숙성시켜서 타지 않아요.^^', 'image_url': 'https://recipe1.ezmember.co.kr/cache/recipe/2020/10/08/9dea96d90c258e0ae3e752c4fb02fa0b1.jpg'}, {'step_number': 14, 'description': '그리고 준비한 고추장 소스를 넣어주시면 됩니다. 고추장 소스가 골고루 간이 베이도록 뿌려주세요. ㅎㅎㅎㅎ', 'image_url': 'https://recipe1.ezmember.co.kr/cache/recipe/2020/10/08/576838453255bdd116aa1f347c0eb4821.jpg'}, {'step_number': 15, 'description': '고추장 소스를 넣고 볶다보면 누를 수 있거든요. 그때, 소주잔의 1/2정도 물을 넣어주시면 눌지 않고 맛있게 볶아진답니다. 마지막으로 깨소금을 뿌려서 골고루 버무려주세요.', 'image_url': 'https://recipe1.ezmember.co.kr/cache/recipe/2020/10/08/c1ed44a713e845cb90270bad87f572651.jpg'}]"
5169,밑반찬,일상,해물류,볶음,멸치마늘볶음 만드는법 밑반찬 멸치볶음 레시피,멸치마늘볶음,https://recipe1.ezmember.co.kr/cache/recipe/2024/02/05/4ac783d60f104e5b000f2d43985b51641.jpg,"4,107",15분 이내,아무나,6인분 이상,"[('잔멸치', '100g'), ('마늘', '8알'), ('식용유', '조금'), ('간장', '1스푼'), ('올리고당', '3스푼'), ('통깨', '')]",멸치볶음 만들 때 마늘을 편썰어 넣어 함께 볶아 만드는 멸치마늘볶음입니다. 마늘이 들어가 풍미도 좋으면서 쫀득하게 씹히는 편마늘이 너무 맛있는 멸치마늘볶음 만들어 드세요 :),"[{'step_number': 1, 'description': '멸치 100g을 기름 두르지 않은 팬에 볶아 줍니다.프라이팬 , 요리스푼약불노릇하게 볶으실 필요는 없고 비린내를 날리며 고소한 향이 올라올 때까지 볶아 줍니다.', 'image_url': 'https://recipe1.ezmember.co.kr/cache/recipe/2024/02/05/6d33ba7b4178f088241ff7ea7f23ce961.jpg'}, {'step_number': 2, 'description': '볶아진 멸치는 접시에 넓게 펼쳐 한 김 식혀 줍니다.접시이렇게 해 주면 바삭하고 비린내 없는 멸치볶음을 만드실 수 있습니다.\n\n\u200b', 'image_url': 'https://recipe1.ezmember.co.kr/cache/recipe/2024/02/05/779f00fda5561a4655070d76e18a61101.jpg'}, {'step_number': 3, 'description': '마늘은 꼭지를 떼고 씻은 뒤 마늘 1알을 4등분 해 편 썰어 주세요.도마 , 조리용나이프', 'image_url': 'https://recipe1.ezmember.co.kr/cache/recipe/2024/02/05/45b9511d9ba44426bc36344739c1b9b01.jpg'}, {'step_number': 4, 'description': '멸치 볶은 팬에 남은 멸치가루를 정리한 뒤 중약불로 달구어 기름을 두른 뒤 편마늘을 넣어 볶아 줍니다.중약불', 'image_url': 'https://recipe1.ezmember.co.kr/cache/recipe/2024/02/05/06a788abfcad5b59748f3bb26f98af661.jpg'}, {'step_number': 5, 'description': '마늘이 노릇하게 익으면서 마늘향이 올라오면 불을 줄이고 볶아둔 멸치를 모두 넣어 기름이 멸치에 코팅되로록 볶아 줍니다.', 'image_url': 'https://recipe1.ezmember.co.kr/cache/recipe/2024/02/05/e5347f8b45eb59875682d0702f919f321.jpg'}, {'step_number': 6, 'description': '멸치와 마늘을 함께 볶아주다 팬 앞부분을 비워 내고 간장 1스푼을 넣어 끓여 줍니다.', 'image_url': 'https://recipe1.ezmember.co.kr/cache/recipe/2024/02/05/1d65d88535a9291d7b3b23ef2c4129de1.jpg'}, {'step_number': 7, 'description': '간장이 바글바글 끓으면서 불향을 내면 볶은 멸치와 마늘에 올리고당 3스푼을 넣은 뒤 간장과 고루 섞어 줍니다.', 'image_url': 'https://recipe1.ezmember.co.kr/cache/recipe/2024/02/05/404f04c8c8e499978a202410445b8e651.jpg'}, {'step_number': 8, 'description': '올리고당이 멸치와 마늘에 고루 묻을 정도로 섞어준 뒤 불을 끄고 통깨를 넣어 한 번 더 섞어 멸치 마늘 볶음 완성합니다.', 'image_url': 'https://recipe1.ezmember.co.kr/cache/recipe/2024/02/05/779bdcfaf68b09d6f8a6c0db7aeb84fd1.jpg'}]"
5170,밑반찬,일상,해물류,볶음,다시마 채 볶음,다시마볶음,https://recipe1.ezmember.co.kr/cache/recipe/2015/09/29/3c9c8b8132e04e116d49633e21f9d4f2.jpg,"37,296",15분 이내,초급,2인분,"[('다시마채', ''), ('참치', ''), ('다진 마늘', '1큰술'), ('액젓', '')]",영양가득 다시마 채 볶음입니다.,"[{'step_number': 1, 'description': '깨끗하게 씻어서 물기를 뺀 다시마 채는 기름 두른 프라이팬에 볶습니다.', 'image_url': 'https://recipe1.ezmember.co.kr/cache/recipe/2015/09/30/3a0c752891816ede48f95251ebd779c81.jpg'}, {'step_number': 2, 'description': '살짝 볶다가 다진 마늘 1큰술, 참치를 같이 넣고 볶아 줍니다.', 'image_url': 'https://recipe1.ezmember.co.kr/cache/recipe/2015/09/30/a46ea8c7eb1350c034c666654b07c5341.jpg'}, {'step_number': 3, 'description': '간은 액젓으로 했어요. 불을 끄고 참기름을 조금 떨어 뜨려 골고루 석은 후, 접시에 담아 냅니다.', 'image_url': 'https://recipe1.ezmember.co.kr/cache/recipe/2015/09/30/3f8e62f8145de67be7bec59f0c220a7f1.jpg'}]"
5171,밑반찬,일상,해물류,볶음,견과류 멸치볶음 만들기 간장 잔멸치볶음 레시피,견과류멸치볶음,https://recipe1.ezmember.co.kr/cache/recipe/2024/08/11/70c81d9df67b103be514e6a918b6bd201.jpg,"1,713",10분 이내,아무나,6인분 이상,"[('잔멸치', '100g'), ('견과류', '80g'), ('식용유', '3스푼'), ('다진마늘', '1/2스푼'), ('간장', '2스푼'), ('올리고당', '3스푼'), ('통깨', '1스푼')]","고소한 견과류 듬뿍 넣은 견과류 멸치볶음입니다. 달콤 짭조롬한 맛에 아이들에게도 사랑받는 밑반찬, 딱딱하지 않게 만드는 레시피로 맛있는 멸치볶음 만들어 드세요 :)","[{'step_number': 1, 'description': '약불로 달군 마른 팬에 견과류가 바삭해지도록 한번 볶아 준 뒤 그릇에 담아 한 김 식혀 주세요.\n후라이팬 , 조리주걱약불', 'image_url': 'https://recipe1.ezmember.co.kr/cache/recipe/2024/08/11/0410d8fd1ca7086d65736b3c00150dc71.jpg'}, {'step_number': 2, 'description': '잔멸치도 마른 팬에 볶아 수분과 비린내를 날리며 가볍게 볶아 줍니다.잔멸치 손질법', 'image_url': 'https://recipe1.ezmember.co.kr/cache/recipe/2024/08/11/afac69a5052fc5ef8ecce5897ec100781.jpg'}, {'step_number': 3, 'description': '볶은 멸치를 체에 밭쳐 가루를 털어 주면 더 깔끔한 멸치볶음을 만들 수 있습니다.채반', 'image_url': 'https://recipe1.ezmember.co.kr/cache/recipe/2024/08/11/342d65ce9c3ff92372205224852270751.jpg'}, {'step_number': 4, 'description': '멸치볶음 양념은 다진마늘 1/2스푼 , 간장 1스푼 , 올리고당 3스푼을 넣어 잘 섞어 주세요.소스볼 , 숟가락', 'image_url': 'https://recipe1.ezmember.co.kr/cache/recipe/2024/08/11/4a74fdb399296be0653c21e276fcb4c51.jpg'}, {'step_number': 5, 'description': '중약불로 달군 팬에 식용유 3스푼을 두른 뒤 볶아둔 견과류와 잔멸치를 넣어 볶아 주세요.후라이팬중약불', 'image_url': 'https://recipe1.ezmember.co.kr/cache/recipe/2024/08/11/d7dd8f3f818c692f4acd24c55fd5f8301.jpg'}, {'step_number': 6, 'description': '볶다가 팬 한쪽을 비운 뒤 만들어둔 양념을 넣어 주세요. 양념이 바글바글 끓어오르면 견과류와 잔멸치에 양념을 빠르게 고루 섞어주세요.멸치 염도에 따라 부족한 단맛은 올리고당을 소량 추가해 주세요.', 'image_url': 'https://recipe1.ezmember.co.kr/cache/recipe/2024/08/11/95f1050bb77f55097d287c21a6f783071.jpg'}, {'step_number': 7, 'description': '양념이 재료에 고루 묻을 정도로 가볍게 볶아준 뒤 불을 끄고 통깨를 넣어 한 번 더 볶아 마무리합니다.', 'image_url': 'https://recipe1.ezmember.co.kr/cache/recipe/2024/08/11/6f3590aa75bd5f33b7e286fd705831e21.jpg'}]"
5172,밑반찬,일상,해물류,볶음,보리 새우 볶음,보리새우볶음,https://recipe1.ezmember.co.kr/cache/recipe/2015/06/08/43323b61ded0e9a414c280215bb04bcb.jpg,"95,822",15분 이내,초급,2인분,"[('마른보리새우', '50g'), ('실깨', '1작은술'), ('간장', '1/2작은술'), ('설탕', '1큰술'), ('물엿', '1작은술'), ('물', '2큰술'), ('식용유', '약간')]",궁중전통요리인 보리새우볶음 만들기,"[{'step_number': 1, 'description': '보리새우는 마른팬에 넣고 바삭하게 볶아줍니다. 불은 중강으로 해서 타지않게 빨리 저어가며 볶아주세요', 'image_url': 'https://recipe1.ezmember.co.kr/cache/recipe/2015/06/17/60eb1abce0eeff248a8114ee95fd1adb1.jpg'}, {'step_number': 2, 'description': '다 볶아진 새우는 가시를 없애기 위해서 마른행주에 부어서 비벼주고 체에 한번 받쳐주면 가시가 없어진답니다.', 'image_url': 'https://recipe1.ezmember.co.kr/cache/recipe/2015/06/17/816edd864076c23caabb7649278f0b1c1.jpg'}, {'step_number': 3, 'description': '팬에 식용유를 약간 두르고 약불에서 볶아주세요. 기름이 고루 스며들 정도로만 볶아서 덜어내둡니다.', 'image_url': 'https://recipe1.ezmember.co.kr/cache/recipe/2015/06/17/31e94dc763635fc3e785d6436c6437e11.jpg'}, {'step_number': 4, 'description': '팬에 간장1/2작은술,설탕1큰술,물엿1작은술, 물2큰술을 넣고 살짝 끓여주는데요. 거품이 오르면서 끓는다고 불을 빨리 꺼시면 보리새우가 딱딱해진답니다. 불은 타지않게 중불로해서 숟가락으로 흘려봐서 농도가 너무 묽게도 아니고 너무 짙게도 아닐때 불을 끄고 새우를 넣고 빨리 섞어주세요.', 'image_url': 'https://recipe1.ezmember.co.kr/cache/recipe/2015/06/17/cfd066bf2f02a2ede6426d02e75140491.jpg'}, {'step_number': 5, 'description': '마지막에 실깨를 살짝 뿌려주시면 완성입니다', 'image_url': 'https://recipe1.ezmember.co.kr/cache/recipe/2015/06/17/5e8fd0659868e2ef7fb353cf0f1134221.jpg'}]"
5173,밑반찬,일상,해물류,볶음,염장미역줄기볶음,미역줄기볶음,https://recipe1.ezmember.co.kr/cache/recipe/2016/01/09/3504e736c11b1733f70bd7e1708c25de1.jpg,"14,033",30분 이내,초급,2인분,"[('염장 미역', '250g'), ('양파', '1/4개'), ('포도씨유', '2큰술'), ('채썬 당근', '약간'), ('다진 파', '1/2개'), ('참기름', '1큰술'), ('후추', '약간'), ('통깨', '1큰술'), ('다진 마늘', '1/2큰술')]","오늘 사용할 미역은 염장 미역인데, 염장 미역은 생미역을 자숙한 후 ( 데친 후에 ) 물로 급랭시키고 이에 소금을 가하고 탈수한 미역을 말합니다. 염장이라서 소금을 넣지 않고 요리해도 간간한 맛으로 먹을 수 있어 좋구요. 미역이나 다시마 같은 해조류에 함유된 알긴산과 라미닌은 심장병은 물론 뇌졸중, 비만 등의 성인병을 예방하므로 많이 드시는 게 좋답니다. 그럼 만들어 보겠습니다.~~","[{'step_number': 1, 'description': '염장 미역줄기 한 팩을 준비합니다. 천원을 주고 구매하였으니 정말 저렴하지요?', 'image_url': 'https://recipe1.ezmember.co.kr/cache/recipe/2016/01/15/170771df97e631211e9602304facdc891.jpg'}, {'step_number': 2, 'description': '소금기를 털어내고 볼에 찬물을 넣고 30분 정도 짠맛을 제거합니다. 너무 조금 담가두면 짜고, 너무 오래 담가두면 오히려 싱거워져 맛이 없답니다. 두번 정도 헹궈서 물기를 제거해둡니다. 한 줄기 먹어보면 짠지, 싱거운지 알 수가 있구요.', 'image_url': 'https://recipe1.ezmember.co.kr/cache/recipe/2016/01/15/c1afbbbd08df6c593bdb2a61cf78eacc1.jpg'}, {'step_number': 3, 'description': '도마에 놓고 3등분 정도 먹기 좋게 잘라줍니다. 너무 길면 먹을 때 엉키고 불편하기 때문이죠.~~', 'image_url': 'https://recipe1.ezmember.co.kr/cache/recipe/2016/01/15/28e23a1bcb3a262ff70863b58abbb13d1.jpg'}, {'step_number': 4, 'description': '양파는 채썰어주고 당근은 색감을 위해 조금만 채썰어둡니다. 대파는 2등분해서 칼로 갈라준 뒤에 잘라주면 다지기가 훨씬 편하답니다.', 'image_url': 'https://recipe1.ezmember.co.kr/cache/recipe/2016/01/15/22a274e7f63cd4762913541c7568e24d1.jpg'}, {'step_number': 5, 'description': '팬을 먼저 달군 다음에 포도씨유를 둘러줍니다. 그래야 기름이 타지 않는답니다. 처음부터 기름넣고 불을 켜면 기름이 탈 수 있답니다. 다진 마늘부터 넣어서 마늘향을 내주고 양파를 볶아줍니다. 양파가 투명해지기 시작하면 당근 채도 넣어 볶아줍니다. 당근은 되도록 가늘게 채썰어주는 것이 익히기가 쉽답니다.', 'image_url': 'https://recipe1.ezmember.co.kr/cache/recipe/2016/01/15/0ec8b4af4ccd99170a7162dd2fac49f71.jpg'}, {'step_number': 6, 'description': '다진 파를 넣어주고 볶아주다가 참기름, 통깨를 넣어 완성합니다. 후추를 잊고 안 넣어서 마지막에 후추를 넣어주었습니다. 후추는 다진 파 넣기 전에 넣어주시면 좋구요. 후추를 너무 일찍 넣어주면 후추향이 날아가기 때문에 나중에 넣는 것도 방법이긴 합니다.', 'image_url': 'https://recipe1.ezmember.co.kr/cache/recipe/2016/01/15/d10a558133c18bf55e4e912eb157130c1.jpg'}, {'step_number': 7, 'description': '어때요? 만들기 쉽지요? 염장 미역의 자체 간 때문에 소금을 안 넣었지만, 물에 오래 담가서 싱거워지면 소금을 조금 넣어서 완성하세요.~~ 너무 조금 물에 담가서 짜면 양파 양을 늘리고 참기름을 조금 더 넣어주시구요.', 'image_url': 'https://recipe1.ezmember.co.kr/cache/recipe/2016/01/15/27594203bd501fe71d7b0f1772f147b01.jpg'}, {'step_number': 8, 'description': '미역줄기 볶음이 완성되었습니다. 파란 색감이 아주 예쁘지요? 밥반찬으로 바로 볶아드시면 아주 좋답니다. 당근이나 양파를 넣어서 색감에 조화를 주었구요. 바다향이 나는 미역줄기 볶음, 한번 만들어 보세요~~', 'image_url': 'https://recipe1.ezmember.co.kr/cache/recipe/2016/01/15/97b3674e3c25616049ff19322a9a3f6b1.jpg'}]"
5174,밑반찬,일상,해물류,볶음,간편한 꼴뚜기요리! 마른 꼴뚜기볶음 만들기,꼴뚜기볶음,https://recipe1.ezmember.co.kr/cache/recipe/2023/03/26/6973ddd5ea6a6d501a6aeb37375d81741.jpg,"2,440",60분 이내,초급,6인분 이상,"[('꼴뚜기', '200g'), ('청양고추', '1개'), ('식용유', '1T'), ('술', '2~3T'), ('다진마늘', '1T'), ('진간장', '3T'), ('올리고당', '2T'), ('참기름', '1T'), ('통깨', '1T')]",오늘은 마트에서 발견한 마른 꼴뚜기를 가지고 간편하게 볶아서 밑반찬을 만들어 봤어요. 고소하게 먹기 좋은 요리입니다.,"[{'step_number': 1, 'description': '마른꼴뚜기를 약 20분간 물에 불려주세요.', 'image_url': 'https://recipe1.ezmember.co.kr/cache/recipe/2023/03/26/dadcb5c0aef7f4ddaedfddb264b4c6201.jpg'}, {'step_number': 2, 'description': '청양고추 1개를 송송 썰어서 준비해 주세요.', 'image_url': 'https://recipe1.ezmember.co.kr/cache/recipe/2023/03/26/2d57ccfa3af4ffdd88497b1769759f2f1.jpg'}, {'step_number': 3, 'description': '다 불린 꼴뚜기를 팬에 넣고 식용유 약 1T와 술 약 2~3T를 넣고 볶아주세요. 꼴뚜기는 살짝 비린내가 날 수 있기 때문에 술을 넣어서 비린내를 잡아 주세요.', 'image_url': 'https://recipe1.ezmember.co.kr/cache/recipe/2023/03/26/033198d1783265637926711a94335ce01.jpg'}, {'step_number': 4, 'description': '다진마늘 1T, 썰어 놓은 청양고추와 진간장 3T를 넣고 양념이 골고루 배도록 볶아줍니다.', 'image_url': 'https://recipe1.ezmember.co.kr/cache/recipe/2023/03/26/2125842a14cca873b41eb9b6a733c4bd1.jpg'}, {'step_number': 5, 'description': '올리고당 2T를 넣고 30초 정도만 살짝 볶아줍니다.', 'image_url': 'https://recipe1.ezmember.co.kr/cache/recipe/2023/03/26/84bdfa8000a5ac1c233e4ec0ab4d0c111.jpg'}, {'step_number': 6, 'description': '불을 끄고 마지막으로 참기름 1T와 통깨 1T를 넣고 골고루 섞어주세요.', 'image_url': 'https://recipe1.ezmember.co.kr/cache/recipe/2023/03/26/eb22a2c78c766682ed9fb3597f2b48291.jpg'}, {'step_number': 7, 'description': '고소하고 짭쪼름한 마른 꼴뚜기볶음 완성이에요.', 'image_url': 'https://recipe1.ezmember.co.kr/cache/recipe/2023/03/26/d557352b085c2415a64e4116be606e9f1.jpg'}]"
