index,종류별,상황별,재료별,방법별,글 제목,레시피이름,레시피이미지,조회수,조리시간,난이도,인분,재료,소개글,조리순서
63546,면/만두,일상,밀가루,끓이기,친정엄마 레시피 잔치국수 만드는법,잔치국수,https://recipe1.ezmember.co.kr/cache/recipe/2016/09/09/39a1f0b096cc7464c49bd4e379f590011.jpg,"8,121",15분 이내,아무나,1인분,"[('국수(소면)', ''), ('멸치(국내기)', ''), ('말린 대파뿌리', '6개'), ('양파', '1/2개'), ('계란', '3개'), ('오이', '1/2개'), ('식용유', '조금'), ('굵은소금', ''), ('멸치액젓', ''), ('육수다시팩', '2개')]","어제는 낮에 온 가족이 모였길래, 오랜만에 잔치국수를 만들어봤어요. 여름에는 시원하게 즐기는 매콤 새콤 비빔국수가 제 맛인데 아이들은 유독 국수만큼은 잔치국수를 더 좋아하더라고요. 친정엄마한테 배운 레시피 그대로, 깔끔하게 만들어본 국수였는데 아이들이 잘 먹어서 기분 짱짱!","[{'step_number': 1, 'description': '국내기용 멸치와 잘 말린 대파 뿌리를 다시 팩에 넣어주세요.', 'image_url': 'https://recipe1.ezmember.co.kr/cache/recipe/2016/09/12/e406ce4bfe88c3d6a90692f83ffe08831.jpg'}, {'step_number': 2, 'description': '넉넉히 넣어준 다음에 커버를 부착하여 덮어주시고', 'image_url': 'https://recipe1.ezmember.co.kr/cache/recipe/2016/09/12/95a8a99cba7c6a5f23e0c49d3b1f5b6a1.jpg'}, {'step_number': 3, 'description': '찬 물에 다시 팩 2개와 양파 1/2개를 넣어주시고 폭폭 끓여주세요. (대파 뿌리는 흙을 제거하고 잘 말려주신 다음, 육수낼 때 사용하시면 좋아요. 친정엄마 레시피 중 하나!)', 'image_url': 'https://recipe1.ezmember.co.kr/cache/recipe/2016/09/12/a5c71f0b2a1c53c1dc35d43b02842ae11.jpg'}, {'step_number': 4, 'description': '10 여분 이상 잘 끓여준 다음에 다시 팩과 양파를 건져주시고 멸치 액젓을 넣어 간맞춰주세요.', 'image_url': 'https://recipe1.ezmember.co.kr/cache/recipe/2016/09/12/3ec7986841efbe5dc751704e2617ef731.jpg'}, {'step_number': 5, 'description': '육수의 모자란 간은 굵은 소금을 넣어 맞춰주시고요. (국간장이나 멸치액젓 + 소금으로 간맞춰주시면 그 맛이 더 좋아요.)', 'image_url': 'https://recipe1.ezmember.co.kr/cache/recipe/2016/09/12/ce95ebb74611f1fcaa6d9a3dc563aa5f1.jpg'}, {'step_number': 6, 'description': '달걀은 흰 자와 노른 자로 나눠 각각 지단을 부쳐 한 김식힌 후에 길게 썰어주세요.', 'image_url': 'https://recipe1.ezmember.co.kr/cache/recipe/2016/09/12/6569d199145d5e0a1ed1268217d573d41.jpg'}, {'step_number': 7, 'description': '오이는 동글동글 얇게 썰어주고 굵은 소금을 뿌려 살짝 재워주세요.', 'image_url': 'https://recipe1.ezmember.co.kr/cache/recipe/2016/09/12/14cd02dd97588f00675e6346d00dfa6c1.jpg'}, {'step_number': 8, 'description': '팬을 잘 달궈준 다음에 식용유를 뿌려주시고 5분 정도 절여주고 꼭 짜낸 오이를 넣고 달달 볶아주세요.', 'image_url': 'https://recipe1.ezmember.co.kr/cache/recipe/2016/09/12/81fe8fdc9101cd3b25bdcdccb15cf8ee1.jpg'}, {'step_number': 9, 'description': '팔팔 끓는 물에 소면을 넣고 삶아주시고 포르르 끓어 오르면, 찬 물을 한 컵붓고 더 끓여주세요.', 'image_url': 'https://recipe1.ezmember.co.kr/cache/recipe/2016/09/12/eb101603576ebc6f1a7ae5f4211f807b1.jpg'}, {'step_number': 10, 'description': '삶아낸 국수는 바로 찬물을 붓고 바락 바락 씻어주세요.\n미끈덩 밀가루 기가 확 빠져야 맛있는 소면이 완성되거든요.', 'image_url': 'https://recipe1.ezmember.co.kr/cache/recipe/2016/09/12/c10253277d5a8fa21c75c5956fe08cb51.jpg'}, {'step_number': 11, 'description': '체에 받쳐 물기를 제거한 국수를 그릇에 담고 팔팔 끓는 육수를 넣어주세요.\n더 따뜻하게 드시려면, 육수에 국수를 담았다 꺼내는 토렴 방식으로 해주셔도 좋아요.', 'image_url': 'https://recipe1.ezmember.co.kr/cache/recipe/2016/09/12/c33da5e0dc40a98eb55c6717b91c1b7f1.jpg'}, {'step_number': 12, 'description': '국수 - 육수 그리고 그 위에 계란 지단과 볶은 오이를 올려주세요. 먹을 때, 후춧가루를 조금 넣어주시면 더 맛있겠죠? 구운 김가루를 넣어주셔도 맛나요.', 'image_url': 'https://recipe1.ezmember.co.kr/cache/recipe/2016/09/12/acc153c34dcc1d68f3705100daeeab111.jpg'}]"
63547,면/만두,일상,밀가루,끓이기,수제비만들기 김치국물넣은 감자 수제비,감자수제비,https://recipe1.ezmember.co.kr/cache/recipe/2022/01/20/9f16231edc6a210f3c15dbdf3ea769001.jpg,"2,291",60분 이내,중급,2인분,"[('밀가루 중력분', '400g'), ('김치국물', '8Ts'), ('감자', '1개'), ('양파', '1/2개'), ('호박', '조금'), ('당근', ''), ('닭가슴살', '100g'), ('파', '1대'), ('청량고추', '1개'), ('김치국물', '8~9Ts'), ('달걀', '1개'), ('식용유', '1Ts'), ('소금', '1ts'), ('다시 육수', '1L'), ('다진마늘', '1Ts'), ('국간장', '2Ts'), ('참치액젓', '1Ts'), ('소금', '약간')]","김치국물로 반죽하여 빛깔이 고운, 김치국물 반죽 수제비와
채소로 든든한 한 끼를 챙겨 봅니다.","[{'step_number': 1, 'description': '볼에 종이컵 중력분 2컵 200g을 넣은 후에,김치국물 8Ts, 달걀1, 식용유1Ts, 소금\n1ts 을 넣어 반죽을 해 주세요.\n(반죽농도는 기호에 맞게 조절해 주세요)밀가루,김치국물,식용유,소금,달걀볼주물러 주세요.', 'image_url': 'https://recipe1.ezmember.co.kr/cache/recipe/2022/01/20/2018520308792bf2d2cd97ac66abbcee1.jpg'}, {'step_number': 2, 'description': '찰지게 주물러서 둥그렇게 뭉쳐서 \n비닐봉지에 담아,냉장고에 30분 넣어서 휴지 시켜주세요.수제비 반죽비닐봉지하루 미리 반죽해도 좋음', 'image_url': 'https://recipe1.ezmember.co.kr/cache/recipe/2022/01/20/fb75963af44631aa338f8b1b56dc192c1.jpg'}, {'step_number': 3, 'description': '감자1,양파1/2, 호박과 당근은 있으면\n사용하여 반달 썰기를 해 주세요.\n파는 어슷썰기 해 주세요.\n청량고추는 다지듯 썰어 주세요\n(없어서 부추를 사용함)감자,양파,호박,당근,파,청량고추칼 , 도마 , 접시같은 굵기로 채소를 썰어 주세요.', 'image_url': 'https://recipe1.ezmember.co.kr/cache/recipe/2022/01/20/e83dcb03dee6bb19decc2cf5f9475ec11.jpg'}, {'step_number': 4, 'description': '익힌 닭가슴살 팩이 있어서 단백질 \n보충으로 100g에,진간장 1Ts을 넣어서\n1분가량 볶아 주있네요(생략 가능함)훈제 닭가슴살 ,진간장,식용유1/2Ts,프라이팬중불생략 가능함', 'image_url': 'https://recipe1.ezmember.co.kr/cache/recipe/2022/01/20/cd33ba076b6c4e5fd09676f3c49ab5d31.jpg'}, {'step_number': 5, 'description': '냉장고에서 수제비 반죽을 꺼내어 주세요.\n(냉장고에 두었다가 사용하면 더 쫀득한\n식감의 수제비가 되겠네요)수제비 반죽', 'image_url': 'https://recipe1.ezmember.co.kr/cache/recipe/2022/01/20/1eb22077714d35dd0e6e13a5c97c37631.jpg'}, {'step_number': 6, 'description': '냄비에 육수를 1L가량 붓고 중불에\n끓기 시작하면 수제비 반죽을 얇게 떠서\n넣어 주세요.중간에 한번씩 저어 주세요.다시 육수,수제비냄비 , 나무 스푼중불물을 떠놓고 손에 묻히면서 수제비를 떠 주세요.', 'image_url': 'https://recipe1.ezmember.co.kr/cache/recipe/2022/01/20/bc0828df84a9802fec71e2118b81a65d1.jpg'}, {'step_number': 7, 'description': '이어서 채소를 넣고,다진마늘1Ts, 국간장\n2Ts, 참치액젓 1Ts,으로 간을 하고 끓여\n주세요.\n(채소 넣고 수제비가 떠오르는 시간까지 \n5~6분 걸림)채소,국간장, 다진마늘,참치액젓냄비중불저어가며 수제비 떠오를 때까지 끓여 주세요.', 'image_url': 'https://recipe1.ezmember.co.kr/cache/recipe/2022/01/20/1802b1e94addd9ca3b59a7749592d5141.jpg'}, {'step_number': 8, 'description': '청량고추와 파 썰은 것을 넣고 불을 끄고\n참기름 1Ts두른 후에 국그릇에 담고,\n고명으로 볶은 닭 가슴살을 얹으면,\n색도 고운 김치국물 반죽 수제비가 완성\n되었네요.청량고추,파,참기름국그릇다 끓인 후에 참기름을 둘러 주세요.', 'image_url': 'https://recipe1.ezmember.co.kr/cache/recipe/2022/01/20/aa8dc4be69a9b1a1523c5bdd1f7f4a7d1.jpg'}]"
63548,면/만두,일상,밀가루,끓이기,잔치국수 구수하게 끓이기,잔치국수,https://recipe1.ezmember.co.kr/cache/recipe/2015/06/08/b8380f5393b4447e49cfd9f94b8a32bd.jpg,"77,135",30분 이내,초급,1인분,"[('소면', '1줌'), ('물', '7컵'), ('당근', '1/4개'), ('호박', '1/4개'), ('다진김치', '1/2컵'), ('다진마늘', '1작은술'), ('소금', ''), ('후춧가루', ''), ('국물용멸치', ''), ('다시마', ''), ('북어', '조금')]","혼자 점심 저녁을 자주 먹는 요즘, 매끼 밥보다는 구수한 육수 끓여서 잔치국수를 자주 만들어 먹어요.","[{'step_number': 1, 'description': '뚝배기에 재료 넣고 바글바글 끓여서 진한 육수를 만들어요.', 'image_url': 'https://recipe1.ezmember.co.kr/cache/recipe/2015/07/29/6332ef6db82be97294f6c1b69eede0fb1.jpg'}, {'step_number': 2, 'description': '그사이 야채는 가늘게 채썰어 준비하고요.', 'image_url': 'https://recipe1.ezmember.co.kr/cache/recipe/2015/07/29/a3fb4716f5442ffbe7faa57f5a1807ef1.jpg'}, {'step_number': 3, 'description': '가늘게 채썬 야채는 올리브유를 살짝만 두르로 살짝 볶아냅니다. 소금이나 후추로 간을 살짝 하셔도 좋아요 ~', 'image_url': 'https://recipe1.ezmember.co.kr/cache/recipe/2015/07/29/1ff90c8b577e5e08e158ac8251822c661.jpg'}, {'step_number': 4, 'description': '김치는 잘게 다져 야채 볶은팬에 올리브유를 살짝 두르고 그냥 볶았어요.', 'image_url': 'https://recipe1.ezmember.co.kr/cache/recipe/2015/07/29/46d0b86641917a6d50258f56ffc8e69b1.jpg'}, {'step_number': 5, 'description': '육수재료는 모두 건져내고 다진마늘과 파를 넣어 끓여주면 육수는 완성이예요.', 'image_url': 'https://recipe1.ezmember.co.kr/cache/recipe/2015/07/29/41103cb2daa8789b14424c3f85c65d471.jpg'}, {'step_number': 6, 'description': '소면은 삶아 찬물에 헹궈 물기를 쪽~~ 빼주고요.', 'image_url': 'https://recipe1.ezmember.co.kr/cache/recipe/2015/07/29/4f3f130909cc9c4e79296940ec5f97ca1.jpg'}, {'step_number': 7, 'description': '물기뺀 소면을 돌돌 말아 그릇에 담고 볶아낸 야채를 올려 줍니다.', 'image_url': 'https://recipe1.ezmember.co.kr/cache/recipe/2015/07/29/2b63c46336103a8e0085ad782dc8bfcc1.jpg'}, {'step_number': 8, 'description': '뜨거운 육수를 부어 드시기만 하면 되죠.', 'image_url': 'https://recipe1.ezmember.co.kr/cache/recipe/2015/07/29/1f3e00dbd172f4ca6b6ac888e43fac3b.jpg'}]"
63549,면/만두,일상,밀가루,끓이기,쉬워도 너무 쉬운 간장국수,간장국수,https://recipe1.ezmember.co.kr/cache/recipe/2018/08/31/3377875fa1ae997818e05fd3e2ce143a1.jpg,"10,360",10분 이내,아무나,1인분,"[('국수', '1인분'), ('토마토', '1개'), ('오이', '1/5개'), ('진간장', '1숟가락'), ('깨소금', '약간'), ('참기름', '약간')]","쉬워도 너무 쉬운 간장국수 갑자기 들어서는 막내 삼촌, 밥이 없어 열무물김치로 국수 말아주고 밥맛도 없는데 굶을까 생각했는데 삶고 보니 1인분이 남는다. 할 수 없이 혼자 후다닥 간장국수를 만들어 먹었습니다.","[{'step_number': 1, 'description': '방울토마토, 오이는 먹기 좋게 썰어주고 계란도 삶아 준비한다.', 'image_url': 'https://recipe1.ezmember.co.kr/cache/recipe/2018/09/04/cafb64885cfa20c82cc1496aa5b628e01.jpg'}, {'step_number': 2, 'description': '국수도 삶아 찬물에 헹구어 물기를 빼둔다.', 'image_url': 'https://recipe1.ezmember.co.kr/cache/recipe/2018/09/04/30567ca16e5536a65d32c925c053bfb51.jpg'}, {'step_number': 3, 'description': '간장, 깨소금, 참기름을 넣고 조물조물 무쳐준 후 그릇에 정갈하게 담고 고명을 올려 완성한다.', 'image_url': 'https://recipe1.ezmember.co.kr/cache/recipe/2018/09/04/8cfbf058325b3b4dadf3f750e491254a1.jpg'}]"
63550,면/만두,일상,밀가루,끓이기,멸치육수 칼국수,멸치육수칼국수,https://recipe1.ezmember.co.kr/cache/recipe/2015/07/24/be100291ae381cfd169f5bb789fb855e1.jpg,"15,533",30분 이내,초급,1인분,"[('칼국수 면', '1.5인분'), ('애호박', '1/3개'), ('당근', ''), ('표고버섯', '1송이'), ('양파', '1/2개'), ('다진마늘', '1/2스푼'), ('국간장', '1.5스푼'), ('국물내기용 멸치', '1줌'), ('파뿌리', '2개'), ('물', '1L')]",멸치육수 면요리가 생각나는 날. 국물맛이 깔끔한 칼국수 소개합니다.,"[{'step_number': 1, 'description': '육수는 국물내기용 멸치 한줌 또는 한컵(=200ml)과 파뿌리 2개, 물 1L를 넣고 끓여주세요. 이후에 육수가 끓여지면 다시마 3장을 넣고 약 5분정도 끓여주신후에 재료는 걷어내주세요.', 'image_url': 'https://recipe1.ezmember.co.kr/cache/recipe/2015/07/24/a61c55462d2a671cacbb840b93ad74171.jpg'}, {'step_number': 2, 'description': '야채는 애호박, 당근, 양파, 표고버섯을 준배했어요.', 'image_url': 'https://recipe1.ezmember.co.kr/cache/recipe/2015/07/24/0a84c0b17b96868e56a71f762fa0e5e81.jpg'}, {'step_number': 3, 'description': '면은 미리 끓는물에 데쳐주시는데요. 약 4분정도 데쳐주시면 되세요.', 'image_url': 'https://recipe1.ezmember.co.kr/cache/recipe/2015/07/24/8cff698d018dd4ed5839f0159896c0f81.jpg'}, {'step_number': 4, 'description': '재료를 걷어낸 육수에 먼저 야채를 넣고 끓여주시다가 야채가 어느정도 익어지면 면을 넣고 끓여주세요. 간은 다진마늘 1/2스푼과 국간장으로 해주시는데요. 전 국간장 1½스푼을 넣고 끓였어요.', 'image_url': 'https://recipe1.ezmember.co.kr/cache/recipe/2015/07/24/3b99566f1f78d5da1a21a03770a9d3851.jpg'}, {'step_number': 5, 'description': '멸치칼국수 완성입니다.', 'image_url': 'https://recipe1.ezmember.co.kr/cache/recipe/2015/07/24/d1996631ffd0571f91c3364d9efacc051.jpg'}]"
63551,면/만두,일상,밀가루,끓이기,간단한레시피 - 잔치국수,잔치국수,https://recipe1.ezmember.co.kr/cache/recipe/2016/03/16/afa5dee9dd0c6395a1f36e7b3a7086a81.jpg,"11,859",15분 이내,아무나,1인분,"[('쌀소면', ''), ('양파', ''), ('당근', ''), ('김치', ''), ('호박', ''), ('김가루', ''), ('계란', ''), ('굵은소금', ''), ('후추', ''), ('발효조미료', ''), ('멸치가루', '')]","잔치국수 쉬운것 같아 대충 만들면 맛이 없죠.
쉽게 만들면서 감칠만 나는 맛있는 잔치국수 비법 알려드릴게요.","[{'step_number': 1, 'description': '호박, 양파, 당근을 모두 채썰어서 기름에 적당히 볶아주세요\n김치는 잘게 다져주세요', 'image_url': 'https://recipe1.ezmember.co.kr/cache/recipe/2016/03/16/cf5abc1253efe05d01ed97835a1e4b851.jpg'}, {'step_number': 2, 'description': '육수끓이기\n(멸치가루, 양파, 연두(발효조미료) , 후추, 굵은소금) 20분도 끓이고 달걀을 풀어서 끓을때 넣어줍니다', 'image_url': 'https://recipe1.ezmember.co.kr/cache/recipe/2016/03/16/0d5a7002b73b9e747e65830a32a2cda21.jpg'}, {'step_number': 3, 'description': '면을 삶아요 (전 쌀국수로 샀습니다)', 'image_url': 'https://recipe1.ezmember.co.kr/cache/recipe/2016/03/16/68b6a11a6f66f40c8f1f0367f9dec4921.jpg'}, {'step_number': 4, 'description': '베트남식 쌀국수가 아니라 잔치국수용이라서 밀가루 소면과 맛에서 거의 차이가 없습니다', 'image_url': 'https://recipe1.ezmember.co.kr/cache/recipe/2016/03/16/b003947f1cf02607d1ef2e45f7bc29fb1.jpg'}, {'step_number': 5, 'description': '소면을 찬물에 헹구어 줍니다', 'image_url': 'https://recipe1.ezmember.co.kr/cache/recipe/2016/03/16/5f1b292ff8bfa833c9f8eec0d8ea5f621.jpg'}, {'step_number': 6, 'description': '김가루 까지 올려주고 , 육수 부으면 끝!\n맛있게 드세요!!!\n(싱거울땐, 간장+참기름)\n미즈매거진 - http://blog.naver.com/suman2552', 'image_url': 'https://recipe1.ezmember.co.kr/cache/recipe/2016/03/16/c4f70409116133537716608aac71762f1.jpg'}]"
63552,면/만두,일상,밀가루,끓이기,콩나물 해물 칼국수 와 밑반찬 만들기~^,None,https://recipe1.ezmember.co.kr/cache/recipe/2015/06/08/9c855c3fad72717ca409bfa556611aa4.jpg,"6,178",None,None,None,[],,[]
63553,면/만두,일상,밀가루,끓이기,초보자도 쉽게하는 직접 반죽해 더 맛있는 손칼국수 만들기.,칼국수,https://recipe1.ezmember.co.kr/cache/recipe/2015/04/02/9a8cd435f812f6563295372e1f3d51011.jpg,"84,249",None,None,None,"[('멸치', ''), ('다시마', ''), ('표고버섯', ''), ('애호박', ''), ('양파', ''), ('감자', ''), ('당근', ''), ('계란', ''), ('밀가루', '4'), ('물', '1'), ('소금', ''), ('물', '')]",한그릇 따뜻하게 끓여내면 다른반찬도 필요없는 맛있는 손칼국수,"[{'step_number': 1, 'description': '멸치, 다시마, 표고버섯을 넣고 육수는 넉넉하게 끓여주세요~', 'image_url': 'https://recipe1.ezmember.co.kr/cache/recipe/2015/04/02/a0c2cb57a475adc2376a0cfcfca592c21.jpg'}, {'step_number': 2, 'description': '손칼국수 반죽은 비율이 제일 중요해요. 전 밀가루 4 : 물 1 의 비율로 늘 칼국수 반죽을 만든답니다. 그리고 소금 조금 넣어주면 되는데요. 물은 익반죽을 해줄꺼니 물을 데워서 사용하세요^^ 익반죽을 해주어야 더욱 면이 쫄깃하답니다.', 'image_url': 'https://recipe1.ezmember.co.kr/cache/recipe/2015/04/02/9d499df34df5b0cb9511ad5ba6da6bab1.jpg'}, {'step_number': 3, 'description': '처음부터 무조건 손으로 반죽하시는 분들 있으시죠? 처음에는 숟가락으로 물이랑 밀가루를 섞어주듯이 먼저 살살 뭉쳐주시고 난뒤~ 손으로 반죽을 하면 손에 들러 붙지 않는 깔끔한 반죽을 할수 있답니다!', 'image_url': 'https://recipe1.ezmember.co.kr/cache/recipe/2015/04/02/8c7a222e35f2273873ab2499268add911.jpg'}, {'step_number': 4, 'description': '비닐봉지에 넣어 냉장고에서 숙성시켜줍니다. 보통 1시간정도 시켜주면 좋다고 알고 있답니다.', 'image_url': 'https://recipe1.ezmember.co.kr/cache/recipe/2015/04/02/66e31ddbf966e573c4f3b300006c45201.jpg'}, {'step_number': 5, 'description': '반죽 밀기전에 계란지단 예쁘게 구워 썰어놓구요~', 'image_url': 'https://recipe1.ezmember.co.kr/cache/recipe/2015/04/02/ed1f79e19d62b2cf0e174641674db9e61.jpg'}, {'step_number': 6, 'description': '육수뽑은 표고도 꺼내서 채썰어주세요~', 'image_url': 'https://recipe1.ezmember.co.kr/cache/recipe/2015/04/02/bfae06e239692579644283070c2ecaed1.jpg'}, {'step_number': 7, 'description': '육수물에 당근, 양파, 감자를 미리넣어 한번더 보글보글 끓여주세요!', 'image_url': 'https://recipe1.ezmember.co.kr/cache/recipe/2015/04/02/5a31e4f31ac9757a7c5ff822d6b834971.jpg'}, {'step_number': 8, 'description': '도마에 밀가루 발라주고 위에 반죽 뜯어 놓아줘요~ 그리고 얇게 펴주세요~ 반죽을 얇게 밀어 밀가루룰 뭍혀가면서 계란말이 말듯이 말아주세요.', 'image_url': 'https://recipe1.ezmember.co.kr/cache/recipe/2015/04/02/b59422df4e212294421454e97a8540b91.jpg'}, {'step_number': 9, 'description': '칼로 일정한 두께로 썰어주시면 되요.', 'image_url': 'https://recipe1.ezmember.co.kr/cache/recipe/2015/04/02/49ae568c61a8f4d21aae77719eb5ccc91.jpg'}, {'step_number': 10, 'description': '썰어놓은 칼국수는 손으로 펴가며 밀가루를 중간중간 뭍혀주셔야 들러붙지 않아요', 'image_url': 'https://recipe1.ezmember.co.kr/cache/recipe/2015/04/02/1424efb65516bfc898db29ba341d72da1.jpg'}, {'step_number': 11, 'description': '양파, 감자, 당근이 익은 육수에 국간장 조금과 소금으로 간을 해줍니다. 국간장 2스푼과 소금 조금 넣었는데 간이 딱~좋았답니다!', 'image_url': 'https://recipe1.ezmember.co.kr/cache/recipe/2015/04/02/9d093244fe0c128b850df75d30fa05681.jpg'}, {'step_number': 12, 'description': '그리고 냄비하나를 더 꺼내서 물을 보글보글 끓여주세요. 이 냄비가 너무 걸쭉하지 않은 밀가루 처리를 해주는 아주 중요한 냄비랍니다.ㅋㅋ 밀가루 면을 한번 미리 삶아? 데쳐 주는 역할을 해서 손칼국수 육수가 너무 걸쭉하지 않고 맑은 육수가 되어 텁텁하지 않고 맛있어요. 귀찮아도 요 과정 꼭. 해주세요^^', 'image_url': 'https://recipe1.ezmember.co.kr/cache/recipe/2015/04/02/9f7a3ce392c5f9d22d80a756b4010f5f1.jpg'}, {'step_number': 13, 'description': '건져낸 손칼국수 면발을 육수에 넣고 애호박도 같이 넣어 끓여주세요~', 'image_url': 'https://recipe1.ezmember.co.kr/cache/recipe/2015/04/02/206b5c7228367c20321a63136b7fe8341.jpg'}, {'step_number': 14, 'description': '따끈한 손칼국수가 완성이 되면 그릇에 칼국수를 소복하게 담아주고 육수를 가득담아 지단으로 만들어두었던 계란지단을 올려주고 김치를 곁들여주면 끝.', 'image_url': 'https://recipe1.ezmember.co.kr/cache/recipe/2015/04/02/11a6e3e046aa5ab41ebe368eaf032b3f1.jpg'}]"
63554,면/만두,일상,밀가루,끓이기,이 세상 잔치국수 중 제일 맛난 '엄마표 잔치국수',잔치국수,https://recipe1.ezmember.co.kr/cache/recipe/2018/08/31/2f93adf98f368812a86f9d55e5c5c1e21.jpg,"26,551",60분 이내,아무나,2인분,"[('국수', '2줌'), ('호박 볶음', '적당량'), ('부추 볶음', '적당량'), ('계란지단', ''), ('단무지', ''), ('김치', ''), ('김', ''), ('통깨', ''), ('무', '1/4개'), ('양파', '1개'), ('파                                                                                또는 부추', '2대'), ('마른 표고버섯', '4개'), ('다시 멸치', '1줌'), ('마른새우', '1줌'), ('다시마                                                                                10*10', '2장'), ('물                                                                                10컵', '2L'), ('피쉬소스(멸치액젓)', ''), ('소금', ''), ('간장', '')]","딸아이는 이 세상 잔치국수 중에서 
엄마표 잔치국숙가 제일 맛나다고 해요.
저 역시 친정엄마 잔치국수가 제일 맛있는데^^","[{'step_number': 1, 'description': '무,양파,파,부추,마른표고버섯을 넣고 10분 끓이다가\n멸치와 마른새우를 넣고 20분 더 끓여주고\n불을 끈 다음 \n다시마를 넣고 30분 우려주면 \n잔치국수 국물이 완성됩니다.\n간은 피쉬액젓과 소금,간장으로 맞춰줍니다.육수는 4인분 정도의 양입니다.', 'image_url': 'https://recipe1.ezmember.co.kr/cache/recipe/2018/08/31/cdd2217a46a7c61133cb74f1419fbe571.jpg'}, {'step_number': 2, 'description': '흰색,노란색 계란지단을 채썰고요.\n부추랑 호박은 새우젓 넣고 볶아주고요.\n김치와 단무지는 채 썰어 줍니다.\n육수에 들어 있는 다시마와 표고버섯도 채 썰어줍니다.', 'image_url': 'https://recipe1.ezmember.co.kr/cache/recipe/2018/08/31/255005b651a3d5ba3d35fc44c6e352401.jpg'}, {'step_number': 3, 'description': '국수를 맛있게 삶아 담고\n뜨근한 육수를 붓고\n고명을 올려줍니다.\n마지막으로 통깨와 김을 올려 장식합니다.', 'image_url': 'https://recipe1.ezmember.co.kr/cache/recipe/2018/08/31/093df5279a32ec863df2aee4888a8ea91.jpg'}]"
