index,종류별,상황별,재료별,방법별,글 제목,레시피이름,레시피이미지,조회수,조리시간,난이도,인분,재료,소개글,조리순서
12091,밑반찬,초스피드,채소류,볶음,단호박간장조림 단짠단짠 간단하게 단호박 밑반찬 만들기,단호박간장조림,https://recipe1.ezmember.co.kr/cache/recipe/2023/09/24/08fd5b46585ad180536179b38f120acf1.jpg,542,15분 이내,아무나,2인분,"[('단호박', '1개'), ('양파', '1/3'), ('대파', '2스푼'), ('간마늘', '1티스푼'), ('간장', '2스푼'), ('굴소스', '1스푼'), ('조청', '3스푼'), ('후추', '약간'), ('참기름', '1스푼'), ('통깨', '약간')]",요즘 단호박이 제철이죠~ 간식으로 그만인 달콤한 단호박으로 단짠단짠한 밑반찬 만들었어요 최소한의 양념만으로 간단하게 만들수 있는 단호박 간장조림입니다,"[{'step_number': 1, 'description': '단호박1개를 4등분하고 씨를 빼고(씨 제거후 250g) 껍질까서 작게 잘라주세요도마 , 조리용나이프', 'image_url': 'https://recipe1.ezmember.co.kr/cache/recipe/2023/09/24/4a1d089efc94eb8f6f4178d3b4abb5d01.jpg'}, {'step_number': 2, 'description': '비닐봉지에 단호박을 넣고 식용유 넣고 골고루 묻혀주세요비닐백', 'image_url': 'https://recipe1.ezmember.co.kr/cache/recipe/2023/09/24/eeae2fcae412fb9c21c6d31732600f1f1.jpg'}, {'step_number': 3, 'description': '에어프라이어에 종이호일깔고 180도 5분 익혀주세요 이렇게 하면 단호박을 볶을때 잘 부서지지 않고 거의 익은상태라 살짝만 볶으면 되요종이호일 , 에어프라이어', 'image_url': 'https://recipe1.ezmember.co.kr/cache/recipe/2023/09/24/2644b592d9d43114e21380e574f832211.jpg'}, {'step_number': 4, 'description': '대파와 양파를 단호박과 같은 크기로 썰어주세요', 'image_url': 'https://recipe1.ezmember.co.kr/cache/recipe/2023/09/24/06240d566c06b9d280e2c8a94bdaa77f1.jpg'}, {'step_number': 5, 'description': '간장2 굴소스1 조청3 들어갔구요 조청대신 올리고당이나 물엿을 넣을때는 2스푼 넣주세요소스볼 , 숟가락', 'image_url': 'https://recipe1.ezmember.co.kr/cache/recipe/2023/09/24/249a2b74989221afea72919c7192cd4b1.jpg'}, {'step_number': 6, 'description': '팬을 달구고 식용유 살짝만 두르고 단호박과 양파 대파 마늘을 넣고 쎈불에 볶아주면서볶음팬 , 요리스푼', 'image_url': 'https://recipe1.ezmember.co.kr/cache/recipe/2023/09/24/e540e070d02c594e5cb79f644498b7301.jpg'}, {'step_number': 7, 'description': '양념장을 넣고 쎈불에 조리듯이 볶아주세요', 'image_url': 'https://recipe1.ezmember.co.kr/cache/recipe/2023/09/24/c9f6a02056717998927c0a0bd7a08bb01.jpg'}, {'step_number': 8, 'description': '채소들이 익었으면 불을 꺼주세요', 'image_url': 'https://recipe1.ezmember.co.kr/cache/recipe/2023/09/24/d56ed4f00d7825953e0db9d1adc213701.jpg'}, {'step_number': 9, 'description': '단호박 간장조림 완성입니다플레이팅접시', 'image_url': 'https://recipe1.ezmember.co.kr/cache/recipe/2023/09/24/d7905214bf98c890159996f93f1ca7331.jpg'}]"
12092,밑반찬,초스피드,채소류,볶음,스팸 감자채 볶음 만드는법,스팸감자채볶음,https://recipe1.ezmember.co.kr/cache/recipe/2023/09/26/dd7a5ccdadae7c3639e27ad83db04eab1.jpg,792,None,None,None,"[('감자', ''), ('스팸', ''), ('식용유', ''), ('맛소금', ''), ('후추', ''), ('통깨', '')]",스팸 감자채 볶음 만드는법,"[{'step_number': 1, 'description': '감자 채썰기~ 아주 얇게 썰었습니다 얇게 썰면 조리시간도 단축 되고 두꺼운 것 보다는 간도 쏙쏙 배어 저는 좋은데 감자 식감을 좋아 하시는 분들은 약간 두께감 있어도 관계는 없어요 기호대로 취향대로 편하게 하세요 ~도마 , 조리용나이프', 'image_url': 'https://recipe1.ezmember.co.kr/cache/recipe/2023/09/26/4b0c68a068cce46accc226bb42e29c641.jpg'}, {'step_number': 2, 'description': '스팸은 200g 작은캔 인데 이것도 반만 쓸께요 슬라이스 하니 4조각 나오네요 스팸은 너무 얇게 썰면 부서 지니까 감자 보다는 두께감 있게 할거예요', 'image_url': 'https://recipe1.ezmember.co.kr/cache/recipe/2023/09/26/2f88726f6fe1146eeeb7b62a8ee1e5351.jpg'}, {'step_number': 3, 'description': '준비 한 양을 보시면 감자2:스팸1 정도로 보이시죠? 요맨치 준비 하시면 됩니다 그리고 감자 채썰고 전분끼 뺀다고 물에 담그시는분들도 계신데 저는 오히려 약간 끈적 거리는 느낌이 좋아서 바로 할거예요 포슬포슬 하게 하시고 싶은 분들은 찬물에 담갔다 물기 제거 하고 하시면 됩니다', 'image_url': 'https://recipe1.ezmember.co.kr/cache/recipe/2023/09/26/2059e02c47f1fd60559796afd23a96a31.jpg'}, {'step_number': 4, 'description': '팬에 식용유를 두르고 예열을 조금 합니다 식용유 양이 중요 하겠죠? 기름이 너무 많아도 너무 적어도 난감 하니까 ㅎㅎ 저는 조맨치 했는데 밥숟갈 두숟갈 정도 되겠네요 처음 부터 너무 많이 안넣으면 되겠네요 하다가 부족 하면 더 넣으면 되죠뭐 ㅎㅎ 살짝 달군 팬에 (연기 나도록 달구면 안되요 !! ) 채썬감자를 먼저 넣어요~프라이팬 , 요리스푼', 'image_url': 'https://recipe1.ezmember.co.kr/cache/recipe/2023/09/26/4d4891f5cdb3c3c85bc1f568fe933ca01.jpg'}, {'step_number': 5, 'description': '채썬 감자를 먼저 넣고 맛소금 조맨치 넣습니다 음.. 티스푼 반스푼 정도 되겠네요 아!!맛소금 없으면 꽃소금 넣으셔도 되요 맛소금 사러 뛰어가고 있을까봐요 ㅎㅎ 중불 에서 맛소금을 넣고 몇번만 휘적이면 감자가 숨이 죽습니다 시간 으로 말씀 드리면 1~2분 안되는 시간 이예요 보이시죠 축 늘어진거~~', 'image_url': 'https://recipe1.ezmember.co.kr/cache/recipe/2023/09/26/a39221547a5fbd412259a6524068baf81.jpg'}, {'step_number': 6, 'description': '감자가 숨이 죽으면 음.. 약간 반투명 해지면 채썬 스팸을 넣고 볶아 주시면 됩니다 이때 시간은 감자의 두께에 따라 다른데 저는 중불 에서 대략 2분 정도 볶았습니다', 'image_url': 'https://recipe1.ezmember.co.kr/cache/recipe/2023/09/26/21f48e870226203e9bcd8192737dc5271.jpg'}, {'step_number': 7, 'description': '거의 완성 단계 입니다 다 익었을때 마무리 단계에서 저는 후추가루 탈탈 두번 넣었어요 후추 뿌리고 센불 에서 수분기를 쪼매 날려 주느라 찌짐 뒤집 듯이 괴롭히면서 섞어 줍니다', 'image_url': 'https://recipe1.ezmember.co.kr/cache/recipe/2023/09/26/cb40949fd3bc7970f426371fb865fb991.jpg'}, {'step_number': 8, 'description': '불을끄고 남은불로 통깨 뿌려 마무리 합니다플레이팅접시', 'image_url': 'https://recipe1.ezmember.co.kr/cache/recipe/2023/09/26/903547acdd403350b85a7b96195e2ddd1.jpg'}]"
12093,밑반찬,초스피드,채소류,볶음,간단한 밑반찬 애호박볶음 만들기,애호박볶음,https://recipe1.ezmember.co.kr/cache/recipe/2023/10/09/3730674dde93a4cf1a280c03e1f7f2d61.jpg,701,15분 이내,아무나,2인분,"[('애호박', '1개'), ('양파', '1/2개'), ('진간장', '1숟갈'), ('참치액', '2티스푼'), ('소금', '3꼬집'), ('식용유', '2숟갈')]",아침엔 부담이 없고 먹기도 좋은 반찬을 선호하는데요. 애호박은 아침에 먹어도 부담도 없고 맛있어서 자주 아침 반찬으로 올린답니다. 그래서 간단하게 볶아낸 애호박볶음 만들기입니다.,"[{'step_number': 1, 'description': '애호박은 반달썰기로 썰어줍니다. 이때 너무 두꺼우면 익는데 시간이 걸리니까 조금 얇게 썰어주는게 좋아요.', 'image_url': 'https://recipe1.ezmember.co.kr/cache/recipe/2023/10/09/847a12e5b3dcbbe96b0613b592fb98131.jpg'}, {'step_number': 2, 'description': '양파는 깍둑썰기로 썰어주세요. 크기는 애호박과 비슷하면 좋습니다.', 'image_url': 'https://recipe1.ezmember.co.kr/cache/recipe/2023/10/09/fd5d21d2bd8a80a4ac2c6803e3511a6b1.jpg'}, {'step_number': 3, 'description': '본격적으로 볶아볼게요. 식용유를 두른 팬에 양파를 넣고 가볍게 코팅시켜준다는 느낌으로만 중불에서 볶아주세요.중불', 'image_url': 'https://recipe1.ezmember.co.kr/cache/recipe/2023/10/09/084925d35981f68f812427573f5446a81.jpg'}, {'step_number': 4, 'description': '양파에 전체적으로 식용유가 코팅되면 바로 애호박을 넣고 애호박이 숨이 죽을때까지 볶아줍니다.중불', 'image_url': 'https://recipe1.ezmember.co.kr/cache/recipe/2023/10/09/4f0455cff0fe63f3c6960c34b28042321.jpg'}, {'step_number': 5, 'description': '애호박 숨이 죽으면 간을 해줄건데요. 먼저 소금을 넣어 기본적인 간을 맞춰주세요. 처음부터 다 넣진 마시고 한두꼬집만 먼저 넣어줍니다.중불', 'image_url': 'https://recipe1.ezmember.co.kr/cache/recipe/2023/10/09/538082a77368a40458c72eb7710325e11.jpg'}, {'step_number': 6, 'description': '그리고 진간장을 넣어서 색과 감칠맛을 올려주세요.', 'image_url': 'https://recipe1.ezmember.co.kr/cache/recipe/2023/10/09/64074e5367cc2ce1bf98f468b098420b1.jpg'}, {'step_number': 7, 'description': '그리고 저는 감칠맛을 더욱 올려주기 위해서 참치액을 사용했는데 없으면 빼셔도 됩니다. 액젓이 있다면 액젓으로 대체가능합니다.중불', 'image_url': 'https://recipe1.ezmember.co.kr/cache/recipe/2023/10/09/0ba7bd745ae08142039d12bc1da55c1e1.jpg'}, {'step_number': 8, 'description': '마지막으로 간이 골고루 배이도록 2분간 달달 볶아주시면 됩니다. 마지막으로 간 보시고 심심하면 소금만 더 추가해주세요.중불', 'image_url': 'https://recipe1.ezmember.co.kr/cache/recipe/2023/10/09/7ad3b4065357c7810a744de579ec596c1.jpg'}, {'step_number': 9, 'description': '완성~!', 'image_url': 'https://recipe1.ezmember.co.kr/cache/recipe/2023/10/09/4243dc2b43e444c3c7191b51e2da75681.jpg'}]"
12094,밑반찬,초스피드,채소류,볶음,활용도 높은 양파볶음 만들기,양파볶음,https://recipe1.ezmember.co.kr/cache/recipe/2023/10/10/b94008690efa0741c58529c38f123ee01.jpg,"2,498",15분 이내,아무나,2인분,"[('양파', '2개'), ('간장', '1큰술'), ('참치액젓', '1큰술'), ('다진마늘', '1/2큰술'), ('참깨', '1큰술')]",반찬이 없을때 만들어 그냥 먹어도 맛있고 활용도 가능한 양파볶음 레시피입니다.,"[{'step_number': 1, 'description': '큼지막한 양파 2개를 손질 한 후 사진과 같이 채 썰어 준비해주세요.양파 손질법 레시피\u200b', 'image_url': 'https://recipe1.ezmember.co.kr/cache/recipe/2023/10/10/aca5fc20db8e3ca13d59bd7365e4c05d1.jpg'}, {'step_number': 2, 'description': '식용유 두른 팬에 양파를 넣고 양파가 살짝 투명해질때까지 볶아 주세요.(*약불 필수*)약불', 'image_url': 'https://recipe1.ezmember.co.kr/cache/recipe/2023/10/10/7e9dbd132958d2360b9ef529afd910181.jpg'}, {'step_number': 3, 'description': '투명해진 양파에 간장 1큰술, 참치액젓 1큰술, 다진마늘 1/2큰술을 넣고 볶아주세요.', 'image_url': 'https://recipe1.ezmember.co.kr/cache/recipe/2023/10/10/5e5d665c82bac3b581908f6e7720fdde1.jpg'}, {'step_number': 4, 'description': '양파가 물컹해지면 불을 끄고 마지막으로 깨를 뿌려주면 완성입니다.참깨는 생략 가능', 'image_url': 'https://recipe1.ezmember.co.kr/cache/recipe/2023/10/10/53cd4da175c85c44f97b6dd94362fc1b1.jpg'}]"
12095,밑반찬,초스피드,채소류,볶음,[아이들 반찬] 건새우를 이용한 애호박 볶음,애호박볶음,https://recipe1.ezmember.co.kr/cache/recipe/2023/10/11/73bca3b98953ad17db67ab28dc8213b61.jpg,201,None,None,None,"[('애호박', '1/2개'), ('양파', '1/4개'), ('건새우', '1줌'), ('소금', '약간'), ('치킨스톡', '1/2스푼'), ('통깨', '')]",건새우를 이용한 애호박 볶음,"[{'step_number': 1, 'description': '모든 재료는 채썰어서 준비했어요 큐브로 자르거나 반달모양도 좋아요', 'image_url': 'https://recipe1.ezmember.co.kr/cache/recipe/2023/10/17/496d09740714ff667182c2b107e89fe71.jpg'}, {'step_number': 2, 'description': '새우는 먹을 때 아이들 입에 찔릴까봐 머리쪽에 뿔만 똑 부러트려 제거해 주었답니다', 'image_url': 'https://recipe1.ezmember.co.kr/cache/recipe/2023/10/17/cbeb31fc18a171072cf023468a3de0ba1.jpg'}, {'step_number': 3, 'description': '팬에 기름을 두르고 양파가 투명해질 때까지 가열해주세요', 'image_url': 'https://recipe1.ezmember.co.kr/cache/recipe/2023/10/17/d61fa8d7722a23e20ce3a0f94d234ede1.jpg'}, {'step_number': 4, 'description': '그 다음 애호박 투하!! 이 때 소금간을 약간 해주었어요 적당히 익었다면 새우도 한주먹 정도 함께 볶아줍니다', 'image_url': 'https://recipe1.ezmember.co.kr/cache/recipe/2023/10/17/2cd95fd73a09a5646436599caf781b8a1.jpg'}, {'step_number': 5, 'description': '감칠맛을 더해줄 치킨스톡 반스푼 정도 넣었고요', 'image_url': 'https://recipe1.ezmember.co.kr/cache/recipe/2023/10/17/23310a27cf9333547e5a27185f00d1a21.jpg'}, {'step_number': 6, 'description': '섞어주며 볶다가 호박이 다 익으면 간단하게 완성된답니다 참 쉽쥬? 통깨를 뿌려서 마무리했어요', 'image_url': 'https://recipe1.ezmember.co.kr/cache/recipe/2023/10/17/229f8a05eb835cd5f6ed863b2271264b1.jpg'}, {'step_number': 7, 'description': '아이들이 어릴때는 입자를 작게 하고 건어물은 갈아서 쓰곤 했는데요 이제는 많이 커서 큼지막하게 요리해주는 편이랍니다 식감이 있는 재료가 더해지니까 음식이 더욱 풍부해지더라고요', 'image_url': 'https://recipe1.ezmember.co.kr/cache/recipe/2023/10/17/061b81982d57c76e90b250427c47a37c1.jpg'}]"
12096,밑반찬,초스피드,채소류,볶음,둥근애호박새송이버섯볶음!,둥근애호박새송이버섯볶음,https://recipe1.ezmember.co.kr/cache/recipe/2023/10/17/d9ee4378e8186e3ed5bfb098860376a61.jpg,667,10분 이내,아무나,4인분,"[('애호박', '1개'), ('새송이버섯', '2개'), ('대파', '1개'), ('청양고추', '2개'), ('소금', '1큰술'), ('올리브유', '2큰술'), ('다진마늘', '1작은술'), ('맛소금', '조금'), ('참기름', '1큰술'), ('통깨', '조금')]",칭구가 나눔해준 조선호박(둥근애호박)을 새송이버섯과 함께 볶아봤어요,"[{'step_number': 1, 'description': '둥근애호박(조선애호박)을 준비후에 깨끗하게 씻어주신후 앞뒤꼭지를 제거해주시고 너무 얇지않게 채를 썰어주세요도마 , 조리용나이프', 'image_url': 'https://recipe1.ezmember.co.kr/cache/recipe/2023/10/19/ff79462fd3abf48e309afab2f43593a01.jpg'}, {'step_number': 2, 'description': '소금1큰술을 넣고 조심히 섞어서 5~7분정도를 절여주세요볼', 'image_url': 'https://recipe1.ezmember.co.kr/cache/recipe/2023/10/19/df9c4318abf5532f2ae554aa365f89601.jpg'}, {'step_number': 3, 'description': '새송이버섯을 애호박크기와 비슷하게 채를 썰어주세요', 'image_url': 'https://recipe1.ezmember.co.kr/cache/recipe/2023/10/19/d72e5c09dfee27ecb30194bc11d766f31.jpg'}, {'step_number': 4, 'description': '청양고추,대파를 쫑쫑썰어서 준비해주세요', 'image_url': 'https://recipe1.ezmember.co.kr/cache/recipe/2023/10/19/9bf909dc528da685d0f926f077811e6d1.jpg'}, {'step_number': 5, 'description': '팬에 올리브유를 넣고 절여진 둥근애호박을 생긴국물은 버리고 넣어주시고 다진마늘을 넣어 살살 볶아주세요 *센불조리프라이팬 , 요리스푼', 'image_url': 'https://recipe1.ezmember.co.kr/cache/recipe/2023/10/19/4c3554e0b5993116d90df8d85fb474d21.jpg'}, {'step_number': 6, 'description': '썰어준 새송이버섯,청양고추,대파자른것을 넣어주시고 볶아주세요 *센불조리', 'image_url': 'https://recipe1.ezmember.co.kr/cache/recipe/2023/10/19/0662ebe95e875d2587648c0528033e931.jpg'}, {'step_number': 7, 'description': '센불에서 4~5분을 볶아주신후 밑간을 보시고 부족하신경우 소금을 추가해주시고 가스불을 꺼주시고 참기름과 통깨를 뿌려주시면 완성이네요', 'image_url': 'https://recipe1.ezmember.co.kr/cache/recipe/2023/10/19/992e06a0e3e236cf0b65c011ddaab9f41.jpg'}, {'step_number': 8, 'description': '둥근애호박은 부드러운맛~새송이버섯은 쫄깃한맛이 잘어우러진 볶음반찬이 완성이 되었네요', 'image_url': 'https://recipe1.ezmember.co.kr/cache/recipe/2023/10/19/0bd5418aa9da82cde2f833ef3fc5dc761.jpg'}]"
12097,밑반찬,초스피드,채소류,볶음,발사믹 식초 버섯볶음,발사믹식초버섯볶음,https://recipe1.ezmember.co.kr/cache/recipe/2024/01/09/e5e6d2b995ce627170bc2cb47a183b501.jpg,414,5분 이내,아무나,2인분,"[('버섯', '넉넉히'), ('올리브 오일', '조금'), ('발사믹 식초', '2바퀴'), ('메이플 시럽', '1큰술'), ('굴소스', '2/3큰술'), ('깨', '조금')]",초간단 레시피로 만든 밑반찬 발사믹 휘리릭 넣은 버섯 볶음 만들어 볼게요,"[{'step_number': 1, 'description': '흙만 턴다는 느낌으로 물에 휘리릭~도마 , 조리용나이프 , 믹싱볼', 'image_url': 'https://recipe1.ezmember.co.kr/cache/recipe/2024/01/09/eadd95e3d2f66210997a4c908996d46a1.jpg'}, {'step_number': 2, 'description': '준비한 버섯을 웍에 담아 주세요웍', 'image_url': 'https://recipe1.ezmember.co.kr/cache/recipe/2024/01/09/52ef8d9f804c518c2ad1d40146ea91531.jpg'}, {'step_number': 3, 'description': '센불에 올리브유를 살짝 두르고', 'image_url': 'https://recipe1.ezmember.co.kr/cache/recipe/2024/01/09/d55e7845febd94527b15aeeebfe150d41.jpg'}, {'step_number': 4, 'description': '꾸덕한 크림 형태의 발사믹 식초를 두바퀴요리스푼', 'image_url': 'https://recipe1.ezmember.co.kr/cache/recipe/2024/01/09/a0b56e214b45ff6d9eb5a55b5f42252b1.jpg'}, {'step_number': 5, 'description': '메이플 시럽 1큰술', 'image_url': 'https://recipe1.ezmember.co.kr/cache/recipe/2024/01/09/b25d7a89973558e30f2f42cccd6e666d1.jpg'}, {'step_number': 6, 'description': '굴소스 2/3큰술', 'image_url': 'https://recipe1.ezmember.co.kr/cache/recipe/2024/01/09/a1d865864fdd2713d6e718163289e6191.jpg'}, {'step_number': 7, 'description': '부글부글? 한번 끓여주면 완성', 'image_url': 'https://recipe1.ezmember.co.kr/cache/recipe/2024/01/09/663c07a20f5e39d2e7884b0dab5b99b61.jpg'}, {'step_number': 8, 'description': '발사믹 식초를 넣은 버섯볶음', 'image_url': 'https://recipe1.ezmember.co.kr/cache/recipe/2024/01/09/55a4b642ed26c927f85af7c5c1cb4be21.jpg'}, {'step_number': 9, 'description': '그릇에 담아 주세요완성접시', 'image_url': 'https://recipe1.ezmember.co.kr/cache/recipe/2024/01/09/cfd206801d89177311ab67114331dd0c1.jpg'}, {'step_number': 10, 'description': '깨를 뿌려 마무리~ 맛있게 만들어 드세요', 'image_url': 'https://recipe1.ezmember.co.kr/cache/recipe/2024/01/09/2b754e9577827251475d040a7e89a4d31.jpg'}]"
12098,밑반찬,초스피드,채소류,볶음,버섯통마늘볶음 레시피 한끼반찬 마늘볶음 버섯요리,버섯통마늘볶음,https://recipe1.ezmember.co.kr/cache/recipe/2024/01/12/550564244557cd962038ca959ede3bb21.jpg,495,10분 이내,초급,2인분,"[('미니새송이버섯', '2줌'), ('마늘', '20알'), ('버터', '10g'), ('맛소금', '1꼬집'), ('진간장', '0.5T'), ('통깨', '')]",간단 반찬입니다. 버섯과 마늘을 가볍게 볶아서 건강에 좋은 반찬으로 올렸어요.,"[{'step_number': 1, 'description': '미니 새송이버섯을 사용했는데 다른 버섯도 상관없어요. 버섯은 밑동을 제거하고 젖은 수건으로 버섯을 닦아주거나 물에 재빨리 헹궈 물기를 빼주세요. 물에 오래 담궈 씻으면 버섯이 수분을 흡수해버립니다.', 'image_url': 'https://recipe1.ezmember.co.kr/cache/recipe/2024/01/12/42df419a153ed4d1ca26fbafae684b6e1.jpg'}, {'step_number': 2, 'description': '마늘을 통으로 준비해줍니다.', 'image_url': 'https://recipe1.ezmember.co.kr/cache/recipe/2024/01/12/eaafc90c08dbeb1e2b02a9b2fb27510f1.jpg'}, {'step_number': 3, 'description': '사진처럼 끝에 꼭지부분은 칼로 잘라내줍니다.도마 , 조리용나이프', 'image_url': 'https://recipe1.ezmember.co.kr/cache/recipe/2024/01/12/f72744b3cdc019b20bce0c6c7ed64e391.jpg'}, {'step_number': 4, 'description': '전자렌지 사용가능한 접시에 손질한 마늘을 담고 전자렌지에 1분정도 돌려주면 나중에 볶을때 후다닥 볶아낼 수있어요.내열접시 , 전자레인지', 'image_url': 'https://recipe1.ezmember.co.kr/cache/recipe/2024/01/12/d857c9498e06b0e8efba5640786ddca21.jpg'}, {'step_number': 5, 'description': '팬에 버터를 둘러주고프라이팬', 'image_url': 'https://recipe1.ezmember.co.kr/cache/recipe/2024/01/12/b2f11bce4b11d7bb233ddeb09f75c7241.jpg'}, {'step_number': 6, 'description': '버터가 녹으면 마늘을 먼저 넣고 중불에서 볶아줍니다.요리스푼', 'image_url': 'https://recipe1.ezmember.co.kr/cache/recipe/2024/01/12/5e6d2ab41ce0aa3e8bc81f55869111861.jpg'}, {'step_number': 7, 'description': '마늘겉면이 노릇하게 잘 익으면 버섯을 넣고 중불에서 재빨리 섞어주며 볶아줍니다.', 'image_url': 'https://recipe1.ezmember.co.kr/cache/recipe/2024/01/12/3875e52879ba2a9b9cbb38a75160682b1.jpg'}, {'step_number': 8, 'description': '맛소금 1꼬집 정도 흩어서 뿌려주고', 'image_url': 'https://recipe1.ezmember.co.kr/cache/recipe/2024/01/12/73953973f17db7e037252d610af959551.jpg'}, {'step_number': 9, 'description': '팬에 공간을 만들어 진간장 0.5T 넣고 살짝 끓여준 후 가볍게 재료들과 볶아줍니다.', 'image_url': 'https://recipe1.ezmember.co.kr/cache/recipe/2024/01/12/b31da3d890ef44d703f3f4181b45d3531.jpg'}, {'step_number': 10, 'description': '그리고 마무리로 통깨 뿌려주면 간단 반찬 버섯통마늘볶음이 완성됩니다.', 'image_url': 'https://recipe1.ezmember.co.kr/cache/recipe/2024/01/12/ac3b95d4a1b01ccf1c2704bfdddc91791.jpg'}, {'step_number': 11, 'description': '몸에 좋고 맛도 좋은 버섯통마늘볶음 맛있게 드세요.접시', 'image_url': 'https://recipe1.ezmember.co.kr/cache/recipe/2024/01/12/c3ee9e6655c3c44e2b55e3652dfb18b31.jpg'}]"
12099,밑반찬,초스피드,채소류,볶음,햄감자채볶음 만들기,햄감자채볶음,https://recipe1.ezmember.co.kr/cache/recipe/2024/03/28/079138c2f83dc12e8a8774e6962e68681.jpg,285,15분 이내,아무나,3인분,"[('감자', '2개'), ('통조림햄 작은것', '1캔'), ('당근', '조금'), ('양파', '1/4개'), ('소금', '1/2t'), ('통깨', '조금')]",감자채볶음은 밑반찬에서 빠질 수 없죠! 뚝딱 만들어두면 자꾸만 젓가락이 가는 마성의 반찬중 하나인 것 같아요. 통조림햄을 추가해서 더욱 풍미가 올라가요~,"[{'step_number': 1, 'description': '감자는 6~7mm크기로 채썰어서 5분가량 물에 담궈 전분기를 뺀 후 건져내서 물기를 빼주세요도마 , 조리용나이프감자 손질법 레시피', 'image_url': 'https://recipe1.ezmember.co.kr/cache/recipe/2024/03/28/e88d60f4a54237a07339e4527f19f5bc1.jpg'}, {'step_number': 2, 'description': '당근도 감자와 비슷한 두께로 채썰어주세요.당근 손질법 레시피', 'image_url': 'https://recipe1.ezmember.co.kr/cache/recipe/2024/03/28/dd80e5eafdcb29bdb83cfd6d791dd7e71.jpg'}, {'step_number': 3, 'description': '양파는 식감을 위해 감자보다 조금 더 두껍게 채썰어주세요.양파 손질법 레시피', 'image_url': 'https://recipe1.ezmember.co.kr/cache/recipe/2024/03/28/6334c3e04cf0dba2d0652a818117e13e1.jpg'}, {'step_number': 4, 'description': '통조림햄은 부서지기 쉬우니 1센티 크기로 두껍게 썰어주세요', 'image_url': 'https://recipe1.ezmember.co.kr/cache/recipe/2024/03/28/a3d889df7ff1f06bc2cd85f198d049931.jpg'}, {'step_number': 5, 'description': '예열된 팬에 식용유를 두르고 감자채를 볶다가 소금 1/2t 넣고 중약불을 유지하며 볶아주세요프라이팬 , 요리스푼중약불감자를 계속해서 뒤집으면 부서질 수 있어요. 타지않을 정도로만 놔뒀다가 한번씩 뒤집어가며 볶아주세요.', 'image_url': 'https://recipe1.ezmember.co.kr/cache/recipe/2024/03/28/4d4d523ccab914b9c8179727af4f31a31.jpg'}, {'step_number': 6, 'description': '감자가 반정도 익으면 통조림햄을 넣고 볶아주세요중약불감자가 전체적으로 기름에 코팅되고 살짝 투명함을 띄면 햄을 넣어주세요', 'image_url': 'https://recipe1.ezmember.co.kr/cache/recipe/2024/03/28/3e046a9f85e3545c7a311557c6353e301.jpg'}, {'step_number': 7, 'description': '당근, 양파도 넣고 볶아주세요.당근 양파는 1분 가량 짧게 볶아줍니다.', 'image_url': 'https://recipe1.ezmember.co.kr/cache/recipe/2024/03/28/91f3a5ab4b08145a170b7f31418b9af11.jpg'}, {'step_number': 8, 'description': '감자가 익으면 불을 끄고 통깨 솔솔 뿌려주세요.', 'image_url': 'https://recipe1.ezmember.co.kr/cache/recipe/2024/03/28/0c4e0fb2657a75885c161bd03fb555301.jpg'}]"
