index,종류별,상황별,재료별,방법별,글 제목,레시피이름,레시피이미지,조회수,조리시간,난이도,인분,재료,소개글,조리순서
37528,메인반찬,술안주,돼지고기,볶음,푸짐한 한 끼 쇼가야키 레시피,쇼가야키,https://recipe1.ezmember.co.kr/cache/recipe/2016/02/15/5daa17a661c50c3dfe83eafa79a8f2971.jpg,"5,590",30분 이내,초급,2인분,"[('돼지목살', '280g'), ('대파', ''), ('양배추', ''), ('마늘                                                                                편썬 것', ''), ('간장', '2숟가락'), ('생강즙', '1/2숟가락'), ('미림', '2숟가락'), ('후추가루', ''), ('소금', '')]",집에서 간단히 만들어 먹을 수 있는 푸짐한 한끼. 쇼가야키를 만들어 보도록 할게요. 쇼가야키는 돼지 목살을 이용한 요리인데요. 밥 반찬은 물론 술안주로도 좋으니 한번 따라해보세요.,"[{'step_number': 1, 'description': '먼저, 돼지 목살을 도톰한 걸로 준비하고, 소금, 후추, 생강즙으로 밑간부터해주세요. 생강즙이 없다면 마늘즙으로 활용해도 좋습니다. 견과유를 1/2숟가락 뿌려주고 재워두면 육즙이 나가는 것을 막을 수 있어요.', 'image_url': 'https://recipe1.ezmember.co.kr/cache/recipe/2016/02/16/0ea6906b1af4322b024f5777d10421a31.jpg'}, {'step_number': 2, 'description': '다음으로는 같이 먹을 양배추를 얇게 채 썬 뒤에 얼음 물에 넣어주세요. 아삭거리는 식감의 양배추를 같이 먹으면 훨씬 좋습니다.', 'image_url': 'https://recipe1.ezmember.co.kr/cache/recipe/2016/02/16/c57d2f9e5dcb48b7e9f447dccc20720c1.jpg'}, {'step_number': 3, 'description': '오일을 살짝 팬에 두른 뒤, 마늘 편(마늘 3개 분량), 다진 파를 1숟가락 넣고 볶아주세요.', 'image_url': 'https://recipe1.ezmember.co.kr/cache/recipe/2016/02/16/d09b1fa338ba23edef00439ffa5c299b1.jpg'}, {'step_number': 4, 'description': '볶은 뒤에, 재워둔 목살도 넣고 볶아주세요.', 'image_url': 'https://recipe1.ezmember.co.kr/cache/recipe/2016/02/16/3839c752fca6204a68ac10c55430129e1.jpg'}, {'step_number': 5, 'description': '고기가 두껍다 보니 겉에 색을 낸 뒤에 뚜껑을 덮고 속까지 익혀주세요. 약한 불보다는 중간 불로 볶아주세요.', 'image_url': 'https://recipe1.ezmember.co.kr/cache/recipe/2016/02/16/36c0aca4c9bfa448a9fddb2ca67206971.jpg'}, {'step_number': 6, 'description': '고기가 어느 정도 익어가면 여기에 간장, 미림을 넣고 졸여준다는 느낌으로 볶아내세요.', 'image_url': 'https://recipe1.ezmember.co.kr/cache/recipe/2016/02/16/18566c972dd142f0804cdcc5690f72971.jpg'}, {'step_number': 7, 'description': '고기에 간이 충분히 배어들게 볶아주세요.', 'image_url': 'https://recipe1.ezmember.co.kr/cache/recipe/2016/02/16/5a32a04bb04c025ab00fe49c5edf8cbe1.jpg'}, {'step_number': 8, 'description': '푸짐한 한 끼 쇼가야키 완성. 어떤가요. 보기만 해도 맛있어 보이는데요. 아이들도 함께 먹을 수 있고 어른돌도 술안주로 하기 좋은 쇼가야키 바로 도전해 보세요.', 'image_url': 'https://recipe1.ezmember.co.kr/cache/recipe/2016/02/16/4d0f36d0e7d84ad3dde6f9f6fb6a8de61.jpg'}]"
37529,메인반찬,술안주,돼지고기,볶음,제육볶음!,제육볶음,https://recipe1.ezmember.co.kr/cache/recipe/2015/10/12/5f1340c3a0f083dfb70dcec9b82702d21.jpg,"5,251",30분 이내,중급,2인분,"[('돼지고기', '500~600g'), ('양파', '1/2개'), ('대파', '2개'), ('땡초', '2~3개'), ('마늘', '5알'), ('고춧가루', '2큰술'), ('간장', '2~3큰술'), ('물엿', '1큰술'), ('설탕', '2큰술'), ('다진마늘', '2큰술'), ('굴소스', '1큰술'), ('소금', '약간'), ('후춧가루', '약간')]","백종원, 차승원레시피를 조금씩 썩어서 만든 제육볶음입니다.","[{'step_number': 1, 'description': '양파는 먹기좋은 크기로 썰어주고요.', 'image_url': 'https://recipe1.ezmember.co.kr/cache/recipe/2015/10/14/a7dc69c6e04a139246211edc5857407b1.jpg'}, {'step_number': 2, 'description': '파도 먹기 좋은 크기로 썰어주세요.', 'image_url': 'https://recipe1.ezmember.co.kr/cache/recipe/2015/10/14/b05a569e880ad28c1a50ead9d1196ce51.jpg'}, {'step_number': 3, 'description': '땡초도 총총 썰어주고', 'image_url': 'https://recipe1.ezmember.co.kr/cache/recipe/2015/10/14/aa42aafc94fe202ff2a7d8625a9cb81b1.jpg'}, {'step_number': 4, 'description': '마늘은 편으로 두툼하게 썰어주세요.', 'image_url': 'https://recipe1.ezmember.co.kr/cache/recipe/2015/10/14/2b65c9752321156ce3be46fe7c13f95f1.jpg'}, {'step_number': 5, 'description': '프라이팬에 돼지고기를 구울 건데요. 백종원씨는 나중에 양념이 잘 배도록 구울때 설탕을 뿌려서 구우라고 했죠. 엄청 듬뿍 넣으시던데 전 살짝만 뿌렸어요.', 'image_url': 'https://recipe1.ezmember.co.kr/cache/recipe/2015/10/14/6bff13fd7733d797819e104a5442775d1.jpg'}, {'step_number': 6, 'description': '차승원 레시피대로 하자면 생고기에 미리 다진마늘과 간장, 참기름 등등으로 밑간을 해서 굽던데 전 그냥 구우면서 밑간을 했구요. 후춧가루 듬뿍 뿌리고요. 얼린고기를 해동시킨 거라 잡내가 날 것 같아 다진마늘도 듬뿍 넣어 구웠어요.', 'image_url': 'https://recipe1.ezmember.co.kr/cache/recipe/2015/10/14/155124e799895ee2a7fb37b4bcc4f1311.jpg'}, {'step_number': 7, 'description': '두툼한 생고기라 구우면서 잘라줘야 타지 않고 속까지 잘 익어요. 다진마늘이 탈 수 있으니 뒤적뒤적 잘 뒤집어줘요.', 'image_url': 'https://recipe1.ezmember.co.kr/cache/recipe/2015/10/14/e7f96df80177139b7361158e80e1f6561.jpg'}, {'step_number': 8, 'description': '백종원 레시피엔 양념을 모두 하고 마지막에 야채를 넣어 볶으라고 했는데 전 야채가 조금 익은 게 좋아서 야채를 먼저 넣고 바로 양념을 했어요.', 'image_url': 'https://recipe1.ezmember.co.kr/cache/recipe/2015/10/14/f072a384a36bfbe0320e763e7014106b1.jpg'}, {'step_number': 9, 'description': '고춧가루와 간장, 각종 양념을 모두 넣어요.', 'image_url': 'https://recipe1.ezmember.co.kr/cache/recipe/2015/10/14/af3e2af9f8922324853e35c115e80cff1.jpg'}, {'step_number': 10, 'description': '이제부터는 타기 전에 후다닥 볶아주고 마지막에 살짝 모자라다 싶으면 소금으로 간을 해요.', 'image_url': 'https://recipe1.ezmember.co.kr/cache/recipe/2015/10/14/227525792a0c51c4748d6ef57bebfc3b1.jpg'}]"
37530,메인반찬,술안주,돼지고기,볶음,매콤달콤 제육볶음 만들기,제육볶음,https://recipe1.ezmember.co.kr/cache/recipe/2015/05/11/f9078804b2bdf1c2cd11dc67a7db70f41.jpg,"10,114",30분 이내,초급,4인분,"[('돼지고기                                                                                불고기', '2근'), ('대파 굵은것', '1대'), ('양파                                                                                갈은것', '1개'), ('청양고추                                                                                다진것', '5개'), ('마늘', ''), ('생강', ''), ('통깨', ''), ('고추장', '4큰술'), ('간장', '1큰술'), ('맛술', ''), ('올리고당', '2큰술'), ('설탕', '1큰술'), ('소금', '조금'), ('참기름', ''), ('탄산수', '3~4큰술')]",주말 요리로 식구들이 좋아하는 제육볶음을 만들어봤어요~ 가끔 매운 음식을 먹으면 기분 좋잖아요. 특히나 돼지불고기는 매워야 제맛이라 고기 사오자마자 양념 만들어 숙성할 틈도 없이 볶아 먹었답니다.,"[{'step_number': 1, 'description': '돼지고기를 볼에 담아주세요. 청양고추는 작게 썰어 넣고 위의 양념을 모두 넣고 고루 섞어주세요.', 'image_url': 'https://recipe1.ezmember.co.kr/cache/recipe/2015/05/11/78dd8a197496397ebf0e332cd6daf1861.jpg'}, {'step_number': 2, 'description': '고루 섞인 양념장에 탄산수를 서너 큰 술 정도 넣고 주르르 흐를 정도로 농도를 맞춰주세요. 돼지고기에 양념을 넣고 잘 배도록 버무려주세요', 'image_url': 'https://recipe1.ezmember.co.kr/cache/recipe/2015/05/11/4636f1d57cea9b0b7e4cac5ee2494e071.jpg'}, {'step_number': 3, 'description': '팬에 양념 돼지고기와 대파를 넣고 볶아주세요. 이때 대파는 길게 썰어 반을 갈라서 너무 숨이 죽지 않게 볶아주세요.', 'image_url': 'https://recipe1.ezmember.co.kr/cache/recipe/2015/05/11/3a0dfd7c5b969d859d6d95321d31cebd1.jpg'}]"
37531,메인반찬,술안주,돼지고기,볶음,기관지에 좋은 돼지불고기,돼지불고기,https://recipe1.ezmember.co.kr/cache/recipe/2015/07/15/2f7bc9c2d94463e86c66e6070bcfc2b6.jpg,"15,650",60분 이내,초급,2인분,"[('돼지고기', '250g'), ('대파', '2대'), ('양파', '1/2개'), ('배', '1/2개'), ('된장', '1.5큰술'), ('대파', '2대'), ('청양고추', '1개'), ('물엿', '1.5큰술'), ('매실액', '2큰술'), ('후춧가루', '조금'), ('청주', '1큰술'), ('다진마늘', '1큰술'), ('참기름', '1작은술'), ('물', '1/3컵'), ('고춧가루', '1작은술'), ('설탕', '1t'), ('간장', '1t'), ('식초', '1.5큰술'), ('통깨', '약간')]",돼지고기요리는 황사에도 좋아서 돼지고기의 기름기가 목과 기관지에 쌓인 먼지와 모래를 싹 ~ 씻어 준다하니 황사가 극성일때 몸을 보호하기 위해 먹어주면 좋겠지요~,"[{'step_number': 1, 'description': '분량의 양념을 다 섞어서 준비해주세요.', 'image_url': 'https://recipe1.ezmember.co.kr/cache/recipe/2015/07/15/3124a8281174b8d735fc3df0b8e4f6561.jpg'}, {'step_number': 2, 'description': '야채를 썰어 준비해주세요.', 'image_url': 'https://recipe1.ezmember.co.kr/cache/recipe/2015/07/15/b5b3d1f038fe89b50f5b975d3af627b21.jpg'}, {'step_number': 3, 'description': '준비해둔 양념을 돼지고기에 앞, 뒤로 고루 발라준 후 반나절 정도 냉장고에 넣어 간이 고루 들게 해두었어요.', 'image_url': 'https://recipe1.ezmember.co.kr/cache/recipe/2015/07/15/47fcd48d38173388e1b35793920f20511.jpg'}, {'step_number': 4, 'description': '중-약불에서 구워 주세요.', 'image_url': 'https://recipe1.ezmember.co.kr/cache/recipe/2015/07/15/cf0405c4ebd7b75091a1f296e028a5631.jpg'}, {'step_number': 5, 'description': '파채를 버무려 고기밑에 깔아주고, 고기와 함께 먹으면 됩니다.', 'image_url': 'https://recipe1.ezmember.co.kr/cache/recipe/2015/07/15/84b5f5cf7985cc4d935c22bbb57f52731.jpg'}]"
37532,메인반찬,술안주,돼지고기,볶음,꼬들 꼬들하고 피부 미용에도 좋은 돼지껍데기 볶음~,돼지껍데기볶음,https://recipe1.ezmember.co.kr/cache/recipe/2015/06/08/d2dfca34995d29255e442ba299de9c51.jpg,"28,806",30분 이내,중급,2인분,"[('돼지껍데기', '2롤'), ('양파', '1/2개'), ('대파', '1/2개'), ('청양고추', '2개'), ('양파', '1개'), ('대파', '1개'), ('마늘', '5알'), ('생강', '3~4개'), ('된장', '1큰술'), ('고추장', '3큰술'), ('간장', '3큰술'), ('올리고당', '1.5큰술'), ('양파', '1/2개'), ('다진 마늘', '1큰술'), ('참기름', '조금'), ('깨소금', '조금')]",비린내가 나지않게 잘 삶아준 돼지껍데기에 갖가지 양념을 무쳐 볶아낸 돼지껍데기 볶음이예요.,"[{'step_number': 1, 'description': '먼저 돼지껍데기 2롤을 냄비에 담고 물을 자작하게 부은 후 양파 1개, 대파 1개, 마늘 5알,생강 3~4개, 된장 1큰술을 넣고 30분 동안 데쳐주세요... (들어가는 재료가 다소 많지만 그래야 누린내가 안나요~) 껍데기 데치는 동안 양파 1/2개는 채썰고 대파 1/2개와 청양고추 2개는 어슷썰기 해주세요. 분량대로 양념장도 만들어 놓습니다. 껍데기가 다 데쳐졌으면 먹기 좋게 길쭉하게 썰어주세요.', 'image_url': 'https://recipe1.ezmember.co.kr/cache/recipe/2015/09/30/4773b7f2c08dac1d5c5e75ec686ec8371.jpg'}, {'step_number': 2, 'description': '닥터쉐프에 데친 돼지껍데기와 손질해둔 야채들을 한꺼번에 넣고 양념장을 골고루 비벼주신 후 뚜껑을 닫고 20분간 가열하면 끝입니다.(마지막에 통깨 뿌려주시구요.) 보통 돼지껍데기 볶음을 할땐 눌러붙지 않도록 옆에 붙어서 뒤적거려줘야 하는데 무척 손쉽지요. 닥터쉐프이기에 가능하다고 생각되요.돼지껍데기 손질법 레시피', 'image_url': 'https://recipe1.ezmember.co.kr/cache/recipe/2015/09/30/5d4f74254123d27f336ba69998d952961.jpg'}, {'step_number': 3, 'description': '완성입니다.', 'image_url': 'https://recipe1.ezmember.co.kr/cache/recipe/2015/09/30/2a02af764491ba175028e41b4c63b7671.jpg'}]"
37533,메인반찬,술안주,돼지고기,볶음,#고추장돼지불고기를 이용한 쭈삼불고기만들기,쭈삼불고기,https://recipe1.ezmember.co.kr/cache/recipe/2018/04/23/97f2a064fd3fe658dc2a8925039f95c31.jpg,"3,750",30분 이내,아무나,4인분,"[('돼지고기                                                                                불고기', '500g'), ('쭈꾸미', '6개'), ('대파', '1대'), ('편마늘', '2큰술'), ('고춧가루', '1큰술'), ('상추', '10장'), ('깻잎', '20장'), ('콩나물무침', '2컵'), ('통깨', '1작은술')]",고추장 양념된 돼지불고기가 남았다면 쭈꾸미를 넣고 콩나물무침을 올려서 깻잎쌈에 싸서 드시면 쫄깃하고 매콤한 식감의 쭈삼불고기를 드실 수 있어요.,"[{'step_number': 1, 'description': '깻잎이랑 상추를 씻어서 체에 받쳐 주고요. 물기를 빼주려고요.', 'image_url': 'https://recipe1.ezmember.co.kr/cache/recipe/2018/04/23/c7c3d0a16c7709f08c0087d3e176006e1.jpg'}, {'step_number': 2, 'description': '팬에 파, 고춧가루를 넣어 주고요. 양념된 고추장돼지불고기가 단맛이 강하기 때문에 거기에 쭈꾸미가 추가로 들어가서 고춧가루를 더 넣어 주었습니다.', 'image_url': 'https://recipe1.ezmember.co.kr/cache/recipe/2018/04/23/1e7b0875d741c8bd0fd54c1fedde06751.jpg'}, {'step_number': 3, 'description': '마늘은 편으로 썰어서 넣어 주고는 약간의 기름을 두르고 볶아 줍니다.', 'image_url': 'https://recipe1.ezmember.co.kr/cache/recipe/2018/04/23/3df541ee18fde4e16c1b36ee8e15900e1.jpg'}, {'step_number': 4, 'description': '쭈꾸미는 냉동쭈꾸미를 사용해서 찬물에 해동시켜서 체에 걸러서 물기를 빼주었어요.', 'image_url': 'https://recipe1.ezmember.co.kr/cache/recipe/2018/04/23/30bf311b0fc10eefa0874b35dd91a4c71.jpg'}, {'step_number': 5, 'description': '파기름이 나왔다면 이제 고추장양념돼지불고기를 볶아 줍니다. 뭉쳐지지 않도록 젓가락을 사용해서 마구마구 저어가면서 익혀 주세요.', 'image_url': 'https://recipe1.ezmember.co.kr/cache/recipe/2018/04/23/ce8176a988ffad698a75811e97478d501.jpg'}, {'step_number': 6, 'description': '고기 표면이 회색빛이 돌면서 익으면 쭈꾸미를 넣고는 함께 볶아 줍니다.', 'image_url': 'https://recipe1.ezmember.co.kr/cache/recipe/2018/04/23/0e83522fee0d91b66f7ce74d0ce454151.jpg'}, {'step_number': 7, 'description': '매콤한 향이 폴폴 풍기면서 단맛도 있는 쭈삼불고기 완성입니다.', 'image_url': 'https://recipe1.ezmember.co.kr/cache/recipe/2018/04/23/aab4f442839fa859e65fd7787811e31f1.jpg'}, {'step_number': 8, 'description': '완성 접시에 담아 주시고요. 위에 통깨로 마무리~~~ 쌈에 싸서 드시면 더욱 맛있고요. 남은 쭈삼불고기에 밥 넣고 김가루 넣어서 볶음밥으로 드셔도 아주 맛있습니다.', 'image_url': 'https://recipe1.ezmember.co.kr/cache/recipe/2018/04/23/7ed17dc47c1f8a62fd7d98436c62297b1.jpg'}, {'step_number': 9, 'description': '콩나물무침을 준비한 이유가 바로 위에 올려서 먹기 위해서 입니다. 매운 맛도 잡아주고요. 아삭한 식감도 더해 주기 때문이지요.', 'image_url': 'https://recipe1.ezmember.co.kr/cache/recipe/2018/04/23/c555cad355eeedf10ed306712a8fa46a1.jpg'}, {'step_number': 10, 'description': '쭈삼불고기에 콩나물을 듬뿍 올려 주세요. 약간의 소금과 참기름만 넣고 만든 콩나물무침이기 때문에 매운맛을 충분히 잡아주지요. 함께 먹으면 고기의 식감과 더불어 아삭하고 신선한 느낌을 함께 느끼실 수 있어요.', 'image_url': 'https://recipe1.ezmember.co.kr/cache/recipe/2018/04/23/d4e1b1e7d8ab6bf473fefea52624776d1.jpg'}]"
37534,메인반찬,술안주,돼지고기,볶음,돼지고기볶음 파채요리~ 언제나 사랑이라지요.,돼지고기볶음,https://recipe1.ezmember.co.kr/cache/recipe/2018/04/29/567e0f7c83bba5affabc9c8c058c86571.jpg,"3,332",30분 이내,아무나,4인분,"[('돼지고기목살', '600g'), ('대파', '2대'), ('청양고추', '2개'), ('당근', '약간'), ('고춧가루', '2큰술'), ('고추장', '2큰술'), ('진간장', '2큰술'), ('올리고당', '2큰술'), ('설탕', '1큰술'), ('매실청', '1큰술'), ('참기름', '1큰술')]","지난번 먹다 남은 명이나물에 한 쌈 했다지요.
돼지고기 볶아서 
파채 듬뿍 올려서~","[{'step_number': 1, 'description': '먼저 대파 손질했어요.\n대파는 속대는 빼고요.대파 손질법 레시피', 'image_url': 'https://recipe1.ezmember.co.kr/cache/recipe/2018/04/29/1de6997371203868bdc88869b35c5aaf1.jpg'}, {'step_number': 2, 'description': '대파 속대는 2cm 정도로 자르고요.\n당근은 은행잎 모양으로\n청양고추는 쫑쫑!', 'image_url': 'https://recipe1.ezmember.co.kr/cache/recipe/2018/04/29/4068590a9c388183494c20432fbee7941.jpg'}, {'step_number': 3, 'description': '대파 겉대는 사선으로 채를 썰고요.', 'image_url': 'https://recipe1.ezmember.co.kr/cache/recipe/2018/04/29/dafc5e12690a15ff59b8083f31872c241.jpg'}, {'step_number': 4, 'description': '물에 15분 정도 담가서\n매운 기를 빼주고요.', 'image_url': 'https://recipe1.ezmember.co.kr/cache/recipe/2018/04/29/21d207da417f3b8d11871e4d4a461d821.jpg'}, {'step_number': 5, 'description': '팬에 돼지고기와 마늘 2큰술, 설탕 1큰술, \n대파 속대 썬 것 흰부분을 넣고 달달 볶아줍니다.\n당근도 넣고요.', 'image_url': 'https://recipe1.ezmember.co.kr/cache/recipe/2018/04/29/7c172669ef716ff9a1dfe5abd4cbafe01.jpg'}, {'step_number': 6, 'description': '하얗게 당근이 익으면\n고춧가루 2큰술, 고추장 2큰술, \n진간장 2큰술, 올리고당 2큰술\n매실청을 넣고 \n잘 섞은 후 볶아주고요.\n양념 넣을 땐 불을 꺼도 됩니다.', 'image_url': 'https://recipe1.ezmember.co.kr/cache/recipe/2018/04/29/5adf39e064c8342bc08d891ebe586b141.jpg'}, {'step_number': 7, 'description': '대파 속대 파란 부분을 넣고\n달달~', 'image_url': 'https://recipe1.ezmember.co.kr/cache/recipe/2018/04/29/1100cff9fd203c2f1b3095c5214758d01.jpg'}, {'step_number': 8, 'description': '지글지글~ \n양념이 맛나게 조려질 때까지 볶으면 되는데요.\n마지막에 참기름 두르고요.', 'image_url': 'https://recipe1.ezmember.co.kr/cache/recipe/2018/04/29/1fbc7321439837195c9515e797fa1f561.jpg'}, {'step_number': 9, 'description': '접시에 대파 채 썬 것을 올리고\n고기 담고\n청양고추 썬 것으로 데코하고요.', 'image_url': 'https://recipe1.ezmember.co.kr/cache/recipe/2018/04/29/af414cabea6bd974ff33f2c76a76c3f31.jpg'}, {'step_number': 10, 'description': '통깨 솔솔 뿌리고\n돼지고기 목살이라 \n고기가 야들야들 아주 맛이 좋더라고요.', 'image_url': 'https://recipe1.ezmember.co.kr/cache/recipe/2018/04/29/581930135b4a2984ef66cfc264375d981.jpg'}]"
37535,메인반찬,술안주,돼지고기,볶음,두부김치 만들기 막걸리 안주로 최고!,두부김치,https://recipe1.ezmember.co.kr/cache/recipe/2021/10/12/e67b1babbf0e56cd68a589ce260268531.jpg,"2,434",15분 이내,아무나,2인분,"[('두부 1모', '300g'), ('익은김치', '1/4포기'), ('고추', '1개'), ('대패삼겹살', '200g'), ('양파', '1/4개'), ('대파', '1줌'), ('고춧가루', '1.5큰술'), ('설탕', '2/3큰술'), ('진간장', '3.5큰술'), ('다진마늘', '1큰술'), ('참기름', '1큰술')]",막걸리 안주라고하면 생각나는 몇가지가 있지요! 하나는 전 요리고 하나는 바로 이 두부김치가 아닐까 생각해요 두부 김치를 자주 해 먹는 건 아니지만 오랜만에 한번 볶아서 먹어 봤어요 두부김치 만들기 알려 드릴게요,"[{'step_number': 1, 'description': '대패 삼겹살을 먹기 좋은 크기로 썰어서 팬에 담고 설탕 2/3큰술을 넣어 조물조물 섞어준 후 핏기가 가실 정도로 잘 볶아 익혀주세요', 'image_url': 'https://recipe1.ezmember.co.kr/cache/recipe/2021/10/12/35e28b26d20ceb9f0ac0684107a92c6a1.jpg'}, {'step_number': 2, 'description': '대패삼겹살의 핏기가 가시면 물 반컵과 고춧가루 1큰술 반 진간장 3큰술 반, 다진 마늘 1큰술 넣어주세요', 'image_url': 'https://recipe1.ezmember.co.kr/cache/recipe/2021/10/12/70681c72a7cc3e1159b357b5fc88f2ac1.jpg'}, {'step_number': 3, 'description': '김치 1/4 포기도 먹기 좋은 크기로 썰어서 넣어주고 양파 1/4도 채썰어서 넣어 약한 불로 오래 볶아주세요 김치 숨이 완전히 죽는게 포인트에요', 'image_url': 'https://recipe1.ezmember.co.kr/cache/recipe/2021/10/12/7e61f2ebc3c959a4c6fed62ece134c081.jpg'}, {'step_number': 4, 'description': '김치가 잘 익었다면 대파 한 줌을 넣고 썰은 고추 한 개도 넣고 참기름 1큰술 둘러 가볍게 볶아주고 마무리해 주세요', 'image_url': 'https://recipe1.ezmember.co.kr/cache/recipe/2021/10/12/094bed801fddf680403fb507bf6c4e401.jpg'}, {'step_number': 5, 'description': '두부는 물에 완전히 잠기게 담가서 삶아 주세요 저는 두부를 좋아해서 500g에 두부 한 모를 이용했어요', 'image_url': 'https://recipe1.ezmember.co.kr/cache/recipe/2021/10/12/f6ad615aedfdb50327077b1e1dbe12471.jpg'}, {'step_number': 6, 'description': '마지막으로 본인의 취향대로 접시에 담아 먹기 좋게 놓아 주세요', 'image_url': 'https://recipe1.ezmember.co.kr/cache/recipe/2021/10/12/776ac95785fe31db11c61d1767c34c0f1.jpg'}]"
37536,메인반찬,술안주,돼지고기,볶음,#훈제삼겹살요리 #냉이요리 #훈제삼겹살냉이볶음만들기 #술안주 #건강식 #봄제철냉이요리,훈제삼겹살볶음,https://recipe1.ezmember.co.kr/cache/recipe/2022/04/04/7f2865a51754ecc39ae00dae632dac771.jpg,931,30분 이내,아무나,4인분,"[('훈제삼겹살', '600g'), ('냉이', '200g'), ('쪽파', '4줄기'), ('다진마늘', '1작은술'), ('마늘허브소금', '1큰술')]","지난번에 냉이를 가지고 훈제오리냉이볶음을 만들었지요.

이번에는 장작불에서 훈연한 삼겹살을 넣고는

만든 장작훈제삼겹살냉이구이입니다.

볶음이 맞을지도 모르겠네요.

​

처음에는 고기를 구워 주고, 나중에 냉이를 넣어서

볶듯이 구워 주는 것이죠. 고기 자체에 간이 되어져 있어서

마늘허브소금 조금만 넣고 초간단하게 만든 훈제삼겹살냉이볶음입니다.

​

냉이와 함께 드시면 더욱 맛있습니다. 건강하게 고기 먹는 방법이기도 하지요.","[{'step_number': 1, 'description': '씻어서 준비해 놓은 냉이와 쪽파입니다. 쪽파는 3-4cm정도의 길이로 썰어 주시면 됩니다.', 'image_url': 'https://recipe1.ezmember.co.kr/cache/recipe/2022/04/04/bd5a0fc3ce27cc3a78664a6a85e7608d1.jpg'}, {'step_number': 2, 'description': '장작훈제삼겹살입니다. 썰어 주어야겠지요.', 'image_url': 'https://recipe1.ezmember.co.kr/cache/recipe/2022/04/04/6bed8edbd4a5c07cb56110e182d3db701.jpg'}, {'step_number': 3, 'description': '편으로 썰어 줍니다. 취향에 맞게 두툼한 고기를 원하시면 두툼하게, 얇은 고기를 원하시면 얇게 썰어 주시면 됩니다.', 'image_url': 'https://recipe1.ezmember.co.kr/cache/recipe/2022/04/04/b911937e8b69afecf49a316e9fceb2fa1.jpg'}, {'step_number': 4, 'description': '팬에 먼저 고기와 다진마늘 넣어서 같이 구워 줍니다.', 'image_url': 'https://recipe1.ezmember.co.kr/cache/recipe/2022/04/04/b75d54fcb1fa1b6fc7d82ad745f442c71.jpg'}, {'step_number': 5, 'description': '고기은 거의 익은 상태의 고기이기 때문에, 고기가 뜨거워지면 거기에 냉이를 넣어서 같이 볶듯이 구워 줍니', 'image_url': 'https://recipe1.ezmember.co.kr/cache/recipe/2022/04/04/32a4ab2bb8b6c0ca4f8045a577585a1b1.jpg'}, {'step_number': 6, 'description': '냉이가 숨이 죽게 되면 이제 마지막으로 쪽파를 넣어 주고 간은 마늘허브소금으로 해 주빈다. 잘 섞어가면서 볶듯이 구워 줍니다.', 'image_url': 'https://recipe1.ezmember.co.kr/cache/recipe/2022/04/04/44d6f4f90017f40e5207528e5dff69b41.jpg'}, {'step_number': 7, 'description': '후추 조금 뿌리고 잘 섞어 주면 마무리 끝입니다. 간단하지요.', 'image_url': 'https://recipe1.ezmember.co.kr/cache/recipe/2022/04/04/5a517f1db83f3ecd273ff47189e109521.jpg'}, {'step_number': 8, 'description': '훈제삼겹살을 이용해서 만든 냉이훈제삼겹구이 완성입니다. 냉이와 함께 겨자소스에 찍어 드시거나, 새우젓을 올려서 드셔도 맛있습니다. \n느끼한 것을 원하지 않으시면 새우젓!! 훈제의 향을 느끼고 싶으시다면 겨자소스입니다. 참고로 겨자소스는 냉채겨자소스를 사용했습니다. 아니면 머스터드소스를 올려서 드셔도 좋습니다.', 'image_url': 'https://recipe1.ezmember.co.kr/cache/recipe/2022/04/04/379fc540ea2508fd332efc6ad9e3c8781.jpg'}]"
