index,종류별,상황별,재료별,방법별,글 제목,레시피이름,레시피이미지,조회수,조리시간,난이도,인분,재료,소개글,조리순서
168720,과자,간식,밀가루,굽기,코코넛 쿠키,코코넛쿠키,https://recipe1.ezmember.co.kr/cache/recipe/2015/09/02/d200840532806292f1c89ac1ce118c0b.jpg,"11,687",60분 이내,중급,6인분 이상,"[('계란', '1개'), ('설탕', '50g'), ('생크림', '20g'), ('박력분', '30g'), ('아몬드가루', '30g'), ('코코넛가루', '80g')]","베이킹 재료중 좋아하는 재료를 묻는다면, 코코넛이라고 말할수 있어요. 아삭아삭하게 씹히면서 향긋하고, 오븐에 구우면 바삭함과 고소함이 배로 되는 코코넛은 좋아하는 재료 중 하나에요. 그 코코넛 가루는 듬뿍넣고, 버터대신 생크림을 넣은 coconut cookie. 재료도 과정도 아주 착한 그런 쿠키에요.","[{'step_number': 1, 'description': '볼에 계란을 넣고 설탕을 넣어 섞어주세요. 제누와즈처럼 거품을 올릴 필요없이, 설탕이 잘 녹을 정도로만 섞어주심 되요.', 'image_url': 'https://recipe1.ezmember.co.kr/cache/recipe/2015/09/02/1c11a2135ccb69db07d50c590e2f78751.jpg'}, {'step_number': 2, 'description': '생크림을 넣고 부드럽게 잘 섞은후에', 'image_url': 'https://recipe1.ezmember.co.kr/cache/recipe/2015/09/02/7b502e6a2f63cf4bf9a4a24aae59793a1.jpg'}, {'step_number': 3, 'description': '가루류를 체쳐 넣고 (아몬드 가루나, 코코넛가루는 체쳐 넣지 않아도 되요) 주걱으로 마른 가루류가 보이지 않도록 잘 섞어주세요.', 'image_url': 'https://recipe1.ezmember.co.kr/cache/recipe/2015/09/02/cebc83aa158595e19a8fd5362a61ecd11.jpg'}, {'step_number': 4, 'description': ""손에 물을 묻혀가며, 동글동글 슈가볼 모양으로 만들어주세요. 다른 납작한 모양으로 만들어도 좋고, 취향따라 맘에 드는 모양으로 만들면 되어요. 190'c에서 15~20분정도 노릇노릇하게 구워주세요."", 'image_url': 'https://recipe1.ezmember.co.kr/cache/recipe/2015/09/02/7c76b21631791b31415b3bd4337084f21.jpg'}, {'step_number': 5, 'description': '윗면이 노릿노릿하게 구워져 나온 코코넛 쿠키. 코코넛가루의 오돌오돌한 모양이 잘 살아나 먹음직 먹음직 스러운 쿠키는 절 괴롭게 해요. 자꾸 자꾸 먹고싶지만, 자꾸 먹을수는 없는 아이러니함. 코코넛가루 들어간 쿠키는 다 향긋하고 바삭해요. 아몬드 가루도 듬뿍 들어가서 고소하고 촉촉하고. 바삭한 쿠키는 바삭한 쿠키대로, 이렇게 촉촉한 쿠키는 촉촉한 대로 먹는 맛이 있어요. 제일 맛있는 거라면 겉은 바삭한데, 속은 촉촉한 쿠키, 코코넛 쿠키에요.', 'image_url': 'https://recipe1.ezmember.co.kr/cache/recipe/2015/09/02/90957b8ab457e3d8b475fa7faee809de1.jpg'}]"
168721,과자,간식,밀가루,굽기,딸기타르트,딸기타르트,https://recipe1.ezmember.co.kr/cache/recipe/2016/01/26/b6307ababb53e889660d579758d52f0d1.png,"15,506",2시간 이상,초급,2인분,"[('버터', '80g'), ('슈가파우더', '45g'), ('바닐라설탕', '1개'), ('소금', '1/8작은술'), ('달걀노른자', '1개'), ('박력분', '125g'), ('크림치즈', '100g'), ('사워크림', '35g'), ('설탕', '35g'), ('생크림', '50ml'), ('딸기', '12~14개'), ('블루베리', '50g')]",빨간 딸기가 촘촘히 박힌 매력적인 딸기타르트~ 산뜻한 타르트 한 조각이면 추위에 움츠러들었던 마음도 활짝 피어날 거예요^^ 동영상으로 함께 만들어보세요~ 어렵다고 생각했던 베이킹과도 친해질 수 있답니다. 오늘의 맛있는 디저트로 딸기타르트를 추천해요!,"[{'step_number': 1, 'description': '-재료 준비-\n1. 딸기와 블루베리는 세척 후 물기가 남아 있지 않도록 물기를 완전히 제거해주세요.\n2. 버터, 달걀, 크림치즈, 사워크림은 1시간 전에 실온에 꺼내두세요.', 'image_url': None}, {'step_number': 2, 'description': '-타르트시트 만들기-\n버터는 핸드믹서 거품기로 풀어주고 슈가파우더, 바닐라설탕을 넣고 거품기를 저속으로 돌려 가루가 보이지 않을 때까지 섞어주세요.', 'image_url': None}, {'step_number': 3, 'description': '소금, 달걀노른자 1개를 넣고 핸드믹서 거품기로 30초간 섞어주세요.', 'image_url': None}, {'step_number': 4, 'description': '달걀이 완전히 풀어지고 소금이 녹으면 박력분을 넣고 스패츌러로 덩어리가 되도록 뭉친 후 비닐에 담아 냉장고에서 1시간 정도 휴지시켜주세요.', 'image_url': None}, {'step_number': 5, 'description': '타르트시트 반죽의 아래위에 비닐을 깔고 덧밀가루를 뿌려가며 0.3cm가 되도록 밀대로 밀어주세요.', 'image_url': None}, {'step_number': 6, 'description': '반죽을 타르트틀에 올린 후 모서리 부분을 손가락으로 살살 눌러 틀에 밀착시키고 여분의 반죽은 떼어내주세요.', 'image_url': None}, {'step_number': 7, 'description': '포크로 바닥과 가장자리에 구멍을 내고 180도로 예열한 오븐에서 12~15분간 구워주세요.오븐', 'image_url': None}, {'step_number': 8, 'description': '-필링만들기-\n1.큰 볼에 크림치즈를 넣고 핸드믹서 거품기를 가장 약하게 돌려 풀어준 후 사워크림과 설탕을 넣고 설탕이 녹을 때까지 충분히 섞어주세요.\n2. 다른 볼에 생크림을 넣고 핸드믹서 거품기를 가장 세게 돌려 휘핑한 후 1/3정도만 덜어서 1번에 넣고 거품기로 살짝 섞어주세요. 생크림이 잘 섞이면 남은 생크림 2/3 분량을 모두 넣고 스패츌러로 들어올리듯이 살짝 섞어주세요.', 'image_url': None}, {'step_number': 9, 'description': '-마무리-\n1.타르트시트가 완전히 식으면 만들어 놓은 필링을 구운 타르트시트에 채워주세요.\n2. 딸기와 블루베리를 올려 취향대로 예쁘게 꾸며주세요. 딸기로 장식할 때는 바람개비 모양으로 돌려가며 얹어주세요.\n3. 에프리코트혼당을 물과 2:1로 섞은 후 끓여서 타르트에 발라주면 더 먹음직스러워요.(제과용품 전문점이나 온.오프라인 베이킹 관련 숍에서 구입할 수 있어요.)', 'image_url': None}]"
168722,과자,간식,밀가루,굽기,더 주세요! 스모어 쿠키,스모어쿠키,https://recipe1.ezmember.co.kr/cache/recipe/2019/10/14/8c53ee2fc1550f2843738c3edb2c5d631.jpg,"8,802",120분 이내,초급,4인분,"[('실온 무염버터', '85g'), ('황설탕', '70g'), ('흰설탕', '50g'), ('계란', '1개'), ('바닐라익스트랙트', '1/2tsp'), ('중력분', '140g'), ('베이킹 소다', '1/2tsp'), ('옥수수 전분', '1/2tsp'), ('소금', '1/4tsp'), ('초코칩', '70g'), ('미니마시멜로우', '약간'), ('로투스', '약간'), ('초콜릿', '약간')]",부드럽고 쫀득한 식감에 그을린 마시멜로우와 부드럽게 녹은 초콜릿의 만남! 거기에 바삭한 로투스까지!,"[{'step_number': 1, 'description': '실온 무염버터와 설탕을 넣고 반죽이 뽀얗게 될 때까지 섞어 주세요', 'image_url': 'https://recipe1.ezmember.co.kr/cache/recipe/2019/10/16/83f1583386a90466fb9929332aa1326b1.jpg'}, {'step_number': 2, 'description': '계란과 바닐라 익스트랙트를 넣고 잘 섞어 주세요', 'image_url': 'https://recipe1.ezmember.co.kr/cache/recipe/2019/10/16/0ed524eb734f7f7f5e94e0e2e0e3b5631.jpg'}, {'step_number': 3, 'description': '중력분, 베이킹소다, 전분, 소금을 함께 체 쳐서 넣어 주세요', 'image_url': 'https://recipe1.ezmember.co.kr/cache/recipe/2019/10/16/9f83b593ef6ce76f199a523b2d4b10c61.jpg'}, {'step_number': 4, 'description': '스패츌라로 날가루가 보이지 않을 때까지 반죽을 가르듯이 섞어 주세요', 'image_url': 'https://recipe1.ezmember.co.kr/cache/recipe/2019/10/16/94c66235f7a11251d453ab95bc2b73e21.jpg'}, {'step_number': 5, 'description': '초코칩을 넣고 가볍게 섞어 주세요', 'image_url': 'https://recipe1.ezmember.co.kr/cache/recipe/2019/10/16/3dd62ffd2fcbdd53cde15ddd566bdecd1.jpg'}, {'step_number': 6, 'description': '반죽을 랩으로 싸서 1시간 동안 냉장 휴지시켜 주세요', 'image_url': 'https://recipe1.ezmember.co.kr/cache/recipe/2019/10/16/822b65a4b511e954ae6971fda6d10da41.jpg'}, {'step_number': 7, 'description': '냉장 휴지하는 동안, 로투스와 초콜릿 바를 부수어 조각내 주세요', 'image_url': 'https://recipe1.ezmember.co.kr/cache/recipe/2019/10/16/7905a5f2712a4f94831899651ec7b6751.jpg'}, {'step_number': 8, 'description': '오븐을 180°C로 예열한 후, 냉장고에서 반죽을 꺼내 주세요오븐', 'image_url': 'https://recipe1.ezmember.co.kr/cache/recipe/2019/10/16/bfc82e32e51794f48dc26791da2982e01.jpg'}, {'step_number': 9, 'description': '지름 5cm 스쿱으로 반죽을 퍼 주세요', 'image_url': 'https://recipe1.ezmember.co.kr/cache/recipe/2019/10/16/4d1033368aaba122c760fc380e60152b1.jpg'}, {'step_number': 10, 'description': '간격을 띄워 팬에 반죽을 올려 주세요(쿠키가 퍼지기 때문에 간격을 충분히 두세요)', 'image_url': 'https://recipe1.ezmember.co.kr/cache/recipe/2019/10/16/0862b790bf61bc13f918627143dbc4ec1.jpg'}, {'step_number': 11, 'description': '175°C 에서 10분 간 구워 주세요', 'image_url': 'https://recipe1.ezmember.co.kr/cache/recipe/2019/10/16/84f420a772cef55eb862056660a5102d1.jpg'}, {'step_number': 12, 'description': '10분 후, 오븐에서 팬을 꺼내 미니 마시멜로우, 로투스, 초콜릿을 올려 주세요', 'image_url': 'https://recipe1.ezmember.co.kr/cache/recipe/2019/10/16/2464b1d95e7faef1cdaa398c855d9aaf1.jpg'}, {'step_number': 13, 'description': '다시 오븐에 넣고 2~3분 간 더 구워 주세요', 'image_url': 'https://recipe1.ezmember.co.kr/cache/recipe/2019/10/16/7d1004a7b99c62f61626f93e2470088f1.jpg'}, {'step_number': 14, 'description': '오븐에서 꺼내 팬에 5분 간 그대로 둔 후, 식힘망으로 옮겨 식혀 주세요', 'image_url': 'https://recipe1.ezmember.co.kr/cache/recipe/2019/10/16/da0f15dd7693810020900a6e7c1d4af01.jpg'}, {'step_number': 15, 'description': '맛있게 드세요!', 'image_url': 'https://recipe1.ezmember.co.kr/cache/recipe/2019/10/16/27358ae670f49f945be4cf9db6558d0a1.jpg'}]"
168723,과자,간식,밀가루,굽기,크림치즈 쿠키,크림치즈쿠키,https://recipe1.ezmember.co.kr/cache/recipe/2015/06/02/584b57385d03f210be4d1e6c816ca3941.jpg,"11,571",90분 이내,중급,6인분 이상,"[('버터', '90g'), ('크림치즈', '100g'), ('계란 노른자', '1개'), ('설탕', '70g'), ('소금', '1꼬집'), ('바닐라에센스', '4방울'), ('파슬리가루', '약간'), ('박력분', '170g'), ('아몬드가루', '20g')]",아이부터 어른까지 좋아하는 고소하고 부드러운 크림치즈 쿠키입니다.,"[{'step_number': 1, 'description': '볼에 실온에 미리 꺼내놓았던 버터와 크림치즈를 거품기로 크림화 시켜줍니다. 설탕과 소금을 넣고 다시 크림화 시켜줍니다. 설탕 대신 슈가파우더를 많이들 사용하시더라구요. 계란 노른자를 넣고 다시 크림화를 시켜주고 바닐라에센스도 3~4방울 넣고 섞어주세요.', 'image_url': 'https://recipe1.ezmember.co.kr/cache/recipe/2015/06/03/93aee28fed9251ad8b3ac8195dc03f311.jpg'}, {'step_number': 2, 'description': '박력분과 아몬드가루를 체에 쳐서 넣어줍니다. 파슬리가루도 넣어주고 주걱으로 자르듯이 #자로 대충 섞어줍니다. 날가루가 살짝 보일랑말랑하게 섞어주세요.', 'image_url': 'https://recipe1.ezmember.co.kr/cache/recipe/2015/06/03/d01bbe61da0b0dfcf7f400c79e26248c1.jpg'}, {'step_number': 3, 'description': '납작하게 지퍼백에 담아서 휴지 시켜도 좋고요. 이렇게 돌돌말아서 비닐에 담은 뒤 냉장고에서 1시간 정도 휴지 시켜줍니다.', 'image_url': 'https://recipe1.ezmember.co.kr/cache/recipe/2015/06/03/916bbcdcdf42a40df4ab4dd9b03d04db1.jpg'}, {'step_number': 4, 'description': '냉장고에서 꺼낸 뒤 0,5cm 정도의 두께로 잘라줍니다. 팬에 적당한 간격으로 팬닝해줍니다.', 'image_url': 'https://recipe1.ezmember.co.kr/cache/recipe/2015/06/03/4825d1faee8507e6fc6053095e4ca0f01.jpg'}, {'step_number': 5, 'description': '오븐은 미리 예열시켜놓고 180도에서 15분 설정을 해줍니다.오븐', 'image_url': 'https://recipe1.ezmember.co.kr/cache/recipe/2015/06/03/4eb0d8cef2944004d4895694a1407fc31.jpg'}, {'step_number': 6, 'description': '오븐에서 꺼낸 뒤에 식힘망에 식혀주면 더~맛있는 고소한 쿠키를 만날 수 있습니다.', 'image_url': 'https://recipe1.ezmember.co.kr/cache/recipe/2015/06/03/33713572a9fcf95eca3b4b8fc9d0314c1.jpg'}]"
168724,과자,간식,밀가루,굽기,부드러운 어메리칸스타일 초코칩 쿠키!!,초코칩쿠키,https://recipe1.ezmember.co.kr/cache/recipe/2020/05/31/310df57501b77dc99723abd99d2da4a91.jpg,"1,610",90분 이내,초급,6인분 이상,"[('녹인무염 버터', '226g'), ('황설탕', '1컵'), ('흰설탕', '1/2컵'), ('달걀', '2'), ('박력분', '3컵'), ('바닐라익스트랙', '2ts'), ('베이킹파우더', '1ts'), ('소금', '1/2ts'), ('초코칩', '2컵')]",겉은바삭 속은촉촉한 어메리칸 스타일의 초코칩쿠키를 만들었답니다. 재료준비 어렵지않고 초보자도 쉽게 만들수있으니 꼭 도전해보시고 맛나게 드세요^^,"[{'step_number': 1, 'description': '상온에 30분이상 꺼내놓은 버터.황설탕.흰설탕을 볼에 넣고 2~3분정도 휘핑해줍니다.', 'image_url': 'https://recipe1.ezmember.co.kr/cache/recipe/2020/05/31/2bdbace61d42c5673cf2d8ab27faec211.jpg'}, {'step_number': 2, 'description': '달걀을 두번에 나누어서 2~3분 정도 휘핑 해줍니다.', 'image_url': 'https://recipe1.ezmember.co.kr/cache/recipe/2020/05/31/c39ac3cf57078bdec4f01d701f35b94b1.jpg'}, {'step_number': 3, 'description': '바닐라익스트램을 2ts 섞어줍니다', 'image_url': 'https://recipe1.ezmember.co.kr/cache/recipe/2020/05/31/f5b6c03451761ce5ac3abaf318360d221.jpg'}, {'step_number': 4, 'description': '어느정도 반죽이 부드러워지면 박력분.베이킹파우더.소금을 채에 쳐서 두번에 나누어 섞어줍니다.', 'image_url': 'https://recipe1.ezmember.co.kr/cache/recipe/2020/05/31/6c5fb5419b087e64809c3302d37a752c1.jpg'}, {'step_number': 5, 'description': '밀가루가 보이지않을정도로 섞어주시고 초코칩을 넣습니다.', 'image_url': 'https://recipe1.ezmember.co.kr/cache/recipe/2020/05/31/27da20d85ee342efd047e1af1737b60d1.jpg'}, {'step_number': 6, 'description': '아이스크림 스푼으로 한스푼씩 모양을 만들어 팬에 놓습니다.', 'image_url': 'https://recipe1.ezmember.co.kr/cache/recipe/2020/05/31/6a3d90839c286795878188bbf252ad561.jpg'}, {'step_number': 7, 'description': '200도로 10분예열한뒤 12~15분 구워주세요. 쿠키 색깔이 갈색으로 구워졌는지 확인하시고 시간은 조절해주세요.오븐', 'image_url': 'https://recipe1.ezmember.co.kr/cache/recipe/2020/05/31/bc215ddc5a01d462702aadd395ac25bf1.jpg'}, {'step_number': 8, 'description': '오븐에서 꺼내서 식혀주시면 겉은 바삭 속은 촉촉한 초코칩쿠키 완성입니다 ~', 'image_url': 'https://recipe1.ezmember.co.kr/cache/recipe/2020/05/31/b631eae8d5871edc23e2430f445669051.jpg'}]"
168725,과자,간식,밀가루,굽기,크랜베리 아몬드 비스코티 만들기,크랜베리아몬드비스코티,https://recipe1.ezmember.co.kr/cache/recipe/2015/09/04/30e9e925b1a5fd8c640b4ddbe6f0eec51.jpg,"12,949",60분 이내,중급,6인분 이상,"[('밀가루 박력분', '100g'), ('아몬드가루', '40g'), ('베이킹파우더', '1/2작은술'), ('황설탕', '70g'), ('버터', '30g'), ('달걀', '1개'), ('바닐라오일', '1/4작은술'), ('통 아몬드', '50g'), ('크랜베리', '30g')]",크랜베리와 아몬드를 넣어 새콤달콤한 맛과 고소한 맛이 좋고 오독오독 씹히는 맛이 좋은데요. 요건 커피와 먹어야 제맛이거든요. 비가 한 번씩 내릴 때마다 더욱 깊어지는 가을에 진한 커피와 함께 드시길 권해드리고 싶네요.,"[{'step_number': 1, 'description': '거품기로 달걀을 풀어지면 황설탕을 넣고 녹을때까지 섞은 후 설탕이 모두 녹으면 바닐라오일을 넣고 섞어주세요.', 'image_url': 'https://recipe1.ezmember.co.kr/cache/recipe/2015/09/04/aa75a2a60f807df16620bb8101bfe6ae1.jpg'}, {'step_number': 2, 'description': '체 친 가루를 넣고', 'image_url': 'https://recipe1.ezmember.co.kr/cache/recipe/2015/09/04/249002be5ec886bb46b70e129bad3c501.jpg'}, {'step_number': 3, 'description': '통아몬드와 크랜베리를 넣고 주걱으로 가볍게 섞어주세요.', 'image_url': 'https://recipe1.ezmember.co.kr/cache/recipe/2015/09/04/59c61139fabf2e6b8cc40e04c7fe54841.jpg'}, {'step_number': 4, 'description': '녹인 버터를 넣고 주걱으로 섞어 한 덩어리로 만들어주세요.', 'image_url': 'https://recipe1.ezmember.co.kr/cache/recipe/2015/09/04/46f711db4466cc1e6aba83dd499677a61.jpg'}, {'step_number': 5, 'description': '밀가루를 조금 뿌리고 반죽을 납작한 모양으로 만들어', 'image_url': 'https://recipe1.ezmember.co.kr/cache/recipe/2015/09/04/018aa97814930e8ff42e30ee793184431.jpg'}, {'step_number': 6, 'description': '예열된 오븐 170도 20~25분간 구워주세요.오븐', 'image_url': 'https://recipe1.ezmember.co.kr/cache/recipe/2015/09/04/029ff95aac6a88af08e6779ca95d3b9d1.jpg'}, {'step_number': 7, 'description': '구워진 비스코티는 한 김 식으면 1.5cm 두께로 썬 후', 'image_url': 'https://recipe1.ezmember.co.kr/cache/recipe/2015/09/04/8d593622a3da0fa637da14625f8b5ce01.jpg'}, {'step_number': 8, 'description': '팬에 다시 담고 170도 오븐에 10~15분간 구워주세요. 각자 오븐 상태에 따라 온도를 맞춰주세요.', 'image_url': 'https://recipe1.ezmember.co.kr/cache/recipe/2015/09/04/3769a8eb142a6f5885009d80a63a001f1.jpg'}]"
168726,과자,간식,밀가루,굽기,코코넛 오트밀 쿠키,코코넛오트밀쿠키,https://recipe1.ezmember.co.kr/cache/recipe/2015/08/10/e1557c30139bd24b27b563c726f29eca.jpg,"14,779",60분 이내,초급,6인분 이상,"[('통밀가루', '150g'), ('코코넛 가루', '65g'), ('오트밀', '90g'), ('bs', '1/4t'), ('소금', '약간'), ('황설탕', '20g'), ('계란', '1개'), ('포도씨유', '50g'), ('꿀', '90g')]",통밀가루가 들어가 고소하면서도 오트밀 씹히는 느낌 또한 너무나도 좋은 쿠키~,"[{'step_number': 1, 'description': '볼에 계란을 풀어 설탕과 소금 오일류를 넣어 섞어주세요.', 'image_url': 'https://recipe1.ezmember.co.kr/cache/recipe/2015/08/12/6af7eac65e3bd01a3b4ffee6558f908b1.jpg'}, {'step_number': 2, 'description': '섞여지면 체친 통밀가루와 베이킹소다, 코코넛가루를 넣어 섞어줍니다.', 'image_url': 'https://recipe1.ezmember.co.kr/cache/recipe/2015/08/12/1b3eca4629ee882feba5940b4a9ebd5e1.jpg'}, {'step_number': 3, 'description': '반즈음 섞이면 오트밀을 넣어 주걱으로 자르듯이 마저 섞어주세요.', 'image_url': 'https://recipe1.ezmember.co.kr/cache/recipe/2015/08/12/1ca57bb8769e108b61fd561d70c732bb1.jpg'}, {'step_number': 4, 'description': '한덩이가 되면 한수저씩 퍼서 팬닝하여 살짝 눌려 둥근 모양을 잡아주세요. 모양이 잡아지면 170℃~180℃에 13분 구워줍니다.', 'image_url': 'https://recipe1.ezmember.co.kr/cache/recipe/2015/08/12/8c60296a1558cff6fc5cbcba5a1588481.jpg'}]"
168727,과자,간식,밀가루,굽기,귤 타르트 만들기,귤타르트,https://recipe1.ezmember.co.kr/cache/recipe/2018/02/08/289509a40ddc2cfbbbec1f18473f3f241.jpg,"11,918",60분 이내,아무나,3인분,"[('박력분', '120g'), ('차가운 버터', '50g'), ('설탕', '15g'), ('달걀 흰자', '1개'), ('차가운 물', '2ts'), ('노른자', '1개'), ('설탕', '30g'), ('옥수수 전분', '10g'), ('우유', '100g'), ('바닐라 빈', '1/2개'), ('버터', '12g'), ('생크림', '100g'), ('귤통조림', '1개'), ('나빠주', '약간')]","바삭한 파트 브리제에 바닐라 빈을 넣은 디플로매트 크림, 그리고 그 위에 올린 귤. 이 셋의 조합이 좋았던 타르트에요~ 특히 바닐라빈을 넣고 만든 디플로매트 크림이 넘 맛있었어요~ 귤까지 제철 귤을 껍질을 까서 만들면 참 좋았겠지만 거기까진 여력이 안되서 통조림 사용했어요~ 그래도 부드럽고 진한 디플로매트 크림과 귤의 조합이 넘 맛있었던 귤 타르트~! 만들어보아요~","[{'step_number': 1, 'description': '먼저 타르트지를 만들어요~ 커터기에 밀가루와 설탕을 넣고 가볍게 섞어주세요. 여기에 깍둑 썬 차가운 버터를 넣고 부슬하게 섞어줍니다. 달걀 흰자 한개와 분량의 차가운 물을 넣고 잘 섞어주세요.', 'image_url': 'https://recipe1.ezmember.co.kr/cache/recipe/2018/02/08/000389cbaafbfb920ce5ace5440767df1.jpg'}, {'step_number': 2, 'description': '한덩어리가된 반죽은 넓게 펴서 비닐 봉투에 넣고, 두시간 정도 냉장 휴지합니다. 비정제 코코넛 설탕을 사용해서 거뭇거뭇해 보여요~', 'image_url': 'https://recipe1.ezmember.co.kr/cache/recipe/2018/02/08/6ddd10a1060820bee81e6685a4b7d5541.jpg'}, {'step_number': 3, 'description': '타르트지가 휴지하는 동안 귤을 전처리 하고 디플로 매트 크림을 만들어요~ 먼저 귤을 전처리 합니다. 통조림 귤을 체에 받쳐 물기를 빼고 키친 타월로 꼼꼼하게 물기를 제거해주세요. 물기를 제거한 후에는 덮개로 덮어 너무 건조 해지지 않게 둡니다.', 'image_url': 'https://recipe1.ezmember.co.kr/cache/recipe/2018/02/08/5f74cd08e542590d88b958b916eca5bc1.jpg'}, {'step_number': 4, 'description': '디플로 매트 크림을 만들어요~ 디플로 매트 크림은 커스터드 크림과 생크림을 섞은걸 말해요~ 먼저 커스터드 크림을 만들어요~ 볼에 노른자와 설탕, 옥수수 전분을 넣고 거품기로 잘 섞어주세요.', 'image_url': 'https://recipe1.ezmember.co.kr/cache/recipe/2018/02/08/b33b09a1a1837ba4e29f518043fc36111.jpg'}, {'step_number': 5, 'description': '소스팬에 분량의 우유에 반 갈라 씨를 긁은 바닐라빈을, 깍지와 씨를 함께 넣고 약불로 데워주세요. 소스팬 주변이 보글거리면 불에서 내려 노른자 반죽에 조금씩 넣어가며 잘 섞어주세요.', 'image_url': 'https://recipe1.ezmember.co.kr/cache/recipe/2018/02/08/f8e5b742aa2be2c44f08d0f28c4ad01a1.jpg'}, {'step_number': 6, 'description': '잘 섞은 우유 반죽을 체에 한번 걸러 불순물이나 덩어리를 제거하고, 소스팬에 넣어 약불에서 저어가며 뭉글하게 끓여주세요.', 'image_url': 'https://recipe1.ezmember.co.kr/cache/recipe/2018/02/08/e5d68b0b0eea10cd78709ab2eb3cc9391.jpg'}, {'step_number': 7, 'description': '계속 젓다가 보면 어느순간 걸쭉해지는 시점이 있어요~ 거기서 조금 더 끓여 불에서 내려주세요. 따뜻할때 분량의 버터를 넣고 잘 섞어주세요. 완성된 커스터드 크림은 밀착되게 랩을 씌운 후 차가운 곳에서 식혀줍니다.', 'image_url': 'https://recipe1.ezmember.co.kr/cache/recipe/2018/02/08/5cd72f7a9f27e73e0bad5d7ce327629f1.jpg'}, {'step_number': 8, 'description': '생크림은 단단하게 휘핑해주세요.', 'image_url': 'https://recipe1.ezmember.co.kr/cache/recipe/2018/02/08/fd06c320eb96dcd0c04c8857132f6c311.jpg'}, {'step_number': 9, 'description': '차갑게 식힌 커스터드 크림을 부드럽게 푼 후, 단단하게 올린 생크림을 커스터드 크림에 조금씩 넣어가며 잘 섞어주세요. 완성된 크림은 짤주머니에 넣고 차가운곳에서 잠시 대기.', 'image_url': 'https://recipe1.ezmember.co.kr/cache/recipe/2018/02/08/867c763879d620de6f7487e2c58e6f9a1.jpg'}, {'step_number': 10, 'description': '휴지가 완료된 타르트지를 완성합니다. 휴지가 완료된 타르트지는 4~5mm 두께로 밀어펴, 틀에 맞게 팬닝 한 후 포크로 구멍을 내주세요.', 'image_url': 'https://recipe1.ezmember.co.kr/cache/recipe/2018/02/08/c2f8557e67b4d45bb38d3e5f7ff5ff091.jpg'}, {'step_number': 11, 'description': '유산지를 깐 후 위에 누름돌을 올리고, 170~180도로 예열된 오븐에서 20~25분 정도를 구워주세요. 굽기 시작 15분 정도가 지났을때 유산지와 누름돌을 치우고 나머지를 노릇하게 구워주세요. 완전히 식으면 화이트 초콜릿을 중탕으로 녹여 발라주심 좋아요~ 좀더 오래 바삭하게 먹을수 있습니다~ 저는 금방 먹을거라 생략했습니다~오븐', 'image_url': 'https://recipe1.ezmember.co.kr/cache/recipe/2018/02/08/a5b5850e5f02b3590823f2e0778682871.jpg'}, {'step_number': 12, 'description': '타트트지, 디플로매트 크림, 귤을 조립해요~ 타르트지에 디플로매트 크림을 넉넉히 올리고 귤을 차근히 올려주세요.', 'image_url': 'https://recipe1.ezmember.co.kr/cache/recipe/2018/02/08/3e42673e140d60b71fa359abe2e454b11.jpg'}, {'step_number': 13, 'description': '나빠주 발라주면 완성~!', 'image_url': 'https://recipe1.ezmember.co.kr/cache/recipe/2018/02/08/c3683003a2deae3c24ce264d608846bd1.jpg'}]"
