index,종류별,상황별,재료별,방법별,글 제목,레시피이름,레시피이미지,조회수,조리시간,난이도,인분,재료,소개글,조리순서
156224,양식,손님접대,해물류,끓이기,[크리스마스 연말파티 메뉴] 따스한 국물이 끝내주는 그리스식 맑은 홍합스튜,홍합스튜,https://recipe1.ezmember.co.kr/cache/recipe/2022/12/21/1c6a29234abd18286c3a5ae26017c60b1.jpg,"1,570",15분 이내,초급,2인분,"[('홍합', '20개'), ('마른고추', '1/2개'), ('양파', '1/3개'), ('무                                                                                4cm', '1조각'), ('화이트와인', '1/2국자'), ('홍합육수', '5-6국자'), ('소금', '약간'), ('후추', '약간'), ('허브가루', '약간'), ('올리브유', '약간'), ('송송 썬 파', '1/2줄기'), ('다진 허브', '1밥숟가락'), ('실고추', '1꼬집')]","한파가 계속되는 크리스마스 시즌,
꽁꽁 언 속을 따스하게 채울 제철 홍합스튜를 끓여 봅니다.
이전에 레시피를 올린 프로방스식 홍합스튜와 또 다른 변주,
와인을 플랑베 한 육수에 무와 양파를 우려낸 따스한 국물이 
한국인 입맛에 잘 맞는 맑은 국물의 시원한 홍합스튜..
<그리스식 맑은 홍합스튜>
따끈하게 끓여 호록 호록 마시다보면
겨울식탁에도 훈기가 돌고 속을 따스하게 달래줍니다.","[{'step_number': 1, 'description': '1. 홍합손질\n→ 홍합은 수염을 잘라내고 솔로 껍데기를 잘 씻어서 준비합니다.홍합 손질법 레시피', 'image_url': 'https://recipe1.ezmember.co.kr/cache/recipe/2022/12/21/b431a5eca1c3959c97107c54af3d42ae1.jpg'}, {'step_number': 2, 'description': '2. 홍합 삶고 육수내기\n→ 소금(손끝으로 조금) 넣은 끓는 물(냄비의 2/3분량)에 씻은 홍합을 애벌로 살짝 데쳐냅니다. 홍합이 입을 벌리고 1분 30초 정도 더 끓인 뒤 홍합을 건져냅니다.\n→ 남은 육수는 버리지 말고 한소끔(약 30초 정도 더) 파르륵 끓여 체에 걸러 따로 준비해 주세요.', 'image_url': 'https://recipe1.ezmember.co.kr/cache/recipe/2022/12/21/1e6c5ebc10d4def824380f4e5df56b381.jpg'}, {'step_number': 3, 'description': '3. 무와 양파는 채썰어둡니다', 'image_url': 'https://recipe1.ezmember.co.kr/cache/recipe/2022/12/21/5c20cd9a476cd4c991faf68fbb1ceb031.jpg'}, {'step_number': 4, 'description': '4. 스튜 끓이기-1\n→ 냄비에 올리브유를 충분히 두르고 어슷 썬 마른 고추(기호에 따라 마늘 추가가능) 를 넣어 향을 낸 뒤,\n→ 홍합을 넣고 1-2분간 뚜껑을 닫고 끓여 주세요.', 'image_url': 'https://recipe1.ezmember.co.kr/cache/recipe/2022/12/21/49b6816b813d06ee075f7fd7b7e0d6931.jpg'}, {'step_number': 5, 'description': '5. 스튜 끓이기-2\n→ 홍합이 다갈다갈 끓기 시작하면 뚜껑 열고 \n와인 1/2국자, 육수 5국자, 채 썬 무와 양파를 넣어 4-5분간 더 끓여 소금, 후추, 허브 가루로 간을 합니다. (와인은 없으면 추가육수로 대체 가능)', 'image_url': 'https://recipe1.ezmember.co.kr/cache/recipe/2022/12/21/21a52fc77cf0a7ad94487732894e73071.jpg'}, {'step_number': 6, 'description': '6. 고명준비\n고명으로 올릴 송송 썬 파, 다진 허브, 실고추 등을 준비해 그릇에 담은 뒤 예쁘게 올려 향을 돋워줍니다.', 'image_url': 'https://recipe1.ezmember.co.kr/cache/recipe/2022/12/21/5bc67e915c2112333a1594a7ee8a4a931.jpg'}, {'step_number': 7, 'description': '완성샷입니다.\n맑은 육수 국물을 넉넉하게 준비하면 홍합탕처럼 담백하고 시원한 국물이 일품입니다. \n양식과도 어울리고 밥&김치와도 잘 어울린답니다.ㅎㅎ', 'image_url': 'https://recipe1.ezmember.co.kr/cache/recipe/2022/12/21/013bb4e5187a9926a81228dd540698291.jpg'}]"
156225,양식,손님접대,해물류,끓이기,쉬운 감바스 알 아히요(스페인요리)만들기,감바스알아히요,https://recipe1.ezmember.co.kr/cache/recipe/2017/09/30/3bdce217388d1d1f3498253e8584ecba1.jpg,"117,371",30분 이내,초급,2인분,"[('새우', '30개'), ('편마늘', '25개'), ('올리브유', '1종이컵'), ('소금', '2t'), ('식빵', '3장'), ('바질', '1t'), ('후추', '1t'), ('페퍼론치노', '2-3개')]",제가 집들이를 하면서 손님접대용으로 샹그리아와 함께 만들게 된 감바스입니다!! 쉽고 간편하면서 와인과 함께 분위기를 낼 수 있어서 정말 좋은 거 같아요^^ 쉬우니깐 한번 만들어 먹어보세요~~~! 스페인 요리 감바스 알 아하요!!,"[{'step_number': 1, 'description': '저는 마트에서 파는 새우를 사왔는데 칵테일 새우로도 대체 가능해요! 마늘은 5-6개 정도를 편으로 썰어주셔도 되고 편마늘을 구매하셔서 바로 요리에 쓰셔도 됩니다.', 'image_url': 'https://recipe1.ezmember.co.kr/cache/recipe/2017/09/30/70028a17b093fbc5611d34c2f5a94e6e1.jpg'}, {'step_number': 2, 'description': '새우 껍질을 까준 다음에 후추를 뿌려서 조물주물 재워줍니다! 통후추를 써주시면 좋은데 일반 후추도 상관 없어요~', 'image_url': 'https://recipe1.ezmember.co.kr/cache/recipe/2017/09/30/37fa1517273b52e13b7006f89cd9e62d1.jpg'}, {'step_number': 3, 'description': '10분 정도 재워주시면 됩니다.', 'image_url': 'https://recipe1.ezmember.co.kr/cache/recipe/2017/09/30/f5a073056ff05d739e6245186dd06e101.jpg'}, {'step_number': 4, 'description': '그 사이 올리브유 종이컵 1.5컵정도를 후라이팬에 \n부어주고 편마늘과 새우머리, 페퍼론치노를 튀겨줍니다!냄비크기에 따라 올리브유를 조절해주세요. 재료가 잠길 정도로 부어주시면 됩니다.', 'image_url': 'https://recipe1.ezmember.co.kr/cache/recipe/2017/09/30/88940c2ab787019a817c20a03a6178821.jpg'}, {'step_number': 5, 'description': '페퍼론치노가 없다면 청양고추로 괜찮아요!\n불온도는 센불로 했다가 끓기 시작하면 중불로 바꿔주세요.', 'image_url': 'https://recipe1.ezmember.co.kr/cache/recipe/2017/09/30/8b046b6514bb830b9378b462fa7963141.jpg'}, {'step_number': 6, 'description': '바닥에 눌러 붙을 수 있기 때문에 수저로 저어주면서 튀겨주세요~ 새우머리와 마늘이 노릇노릇 익어 갈때 즈음 소금 1t 조금씩 넣어가며 올리브유 간을 해줍니다! 후추를 살짝 톡톡 넣어주시면 좋아요!', 'image_url': 'https://recipe1.ezmember.co.kr/cache/recipe/2017/09/30/5940a096b00d846d5c1f0f916d773de41.jpg'}, {'step_number': 7, 'description': '마늘이 노릇해지면 이제 재워뒀던 새우를 넣어줍니다!', 'image_url': 'https://recipe1.ezmember.co.kr/cache/recipe/2017/09/30/230d21d4a61f67cee2ca81d892bad3da1.jpg'}, {'step_number': 8, 'description': '새우를 익히면서 올리브유 맛을 보며 간을 맞춰주세여!\n올리브유는 빵이랑 함께 먹어서 중요중요합니다.', 'image_url': 'https://recipe1.ezmember.co.kr/cache/recipe/2017/09/30/029b9e2034eb368d7f657a35af50420a1.jpg'}, {'step_number': 9, 'description': '새우살이 익으면 그룻에 이쁘게 담아준 다음 위에 바질을 1t 솔솔 뿌려줍니다. 올리브유에 식빵을 찍어 먹을거라서\n올리브유도 한 가득 담아주세요!', 'image_url': 'https://recipe1.ezmember.co.kr/cache/recipe/2017/09/30/8cefe15688cfa3a66feed54a082993311.jpg'}, {'step_number': 10, 'description': '식빵을 토스트기에 구워줍니다! \n바게트나 마늘바게트와 먹어도 맛있어요!', 'image_url': 'https://recipe1.ezmember.co.kr/cache/recipe/2017/09/30/035231e40d8cf7b5eee9b8785de4b63a1.jpg'}, {'step_number': 11, 'description': '노릇노릇해질때까지!\n저는 온도를 3으로 맞춰 놓고 구웠어요!', 'image_url': 'https://recipe1.ezmember.co.kr/cache/recipe/2017/09/30/34ebd1317f333e1d994570f5a5b96e8f1.jpg'}, {'step_number': 12, 'description': '취향에 따라서 부드럽게 드실려면 살짝 구워드셔도 돼요', 'image_url': 'https://recipe1.ezmember.co.kr/cache/recipe/2017/09/30/1a6bb4eeee3db7156896ff535d8a8a6d1.jpg'}, {'step_number': 13, 'description': '저는 바삭바삭한게 좋아서 이정도로 노릇해질 때까지\n구워줬어요.', 'image_url': 'https://recipe1.ezmember.co.kr/cache/recipe/2017/09/30/1cf3c13ddf9b0d98f01c05552b59a03a1.jpg'}, {'step_number': 14, 'description': '식빵을 간이 된 올리브유에 잔뜩 적셔준 다음 마늘과 새우와함께 먹어주면 기가 막히게 맛있는 \n감바스 완성입니다^^\n저는 샹그리아와 먹어줬는데\n와인안주로 최고인거 같아요\n쉽고 간편한 감바스 꼭 만들어 드셔보세여~~', 'image_url': 'https://recipe1.ezmember.co.kr/cache/recipe/2017/09/30/7e00ae5eee398b042949842e68c27ba51.jpg'}]"
156226,양식,손님접대,해물류,끓이기,감바스 알 아히요 - 간단하면서 고급져보이는 홈파티 메뉴로 어떠신가요?,감바스알아히요,https://recipe1.ezmember.co.kr/cache/recipe/2018/12/08/acaa66907b7b15dce51f5b4b68dee67a1.jpg,"26,177",30분 이내,초급,2인분,"[('새우', '12마리'), ('바지락', '10개'), ('마늘', '5~6알'), ('청양고추', '1개'), ('바게트빵', '1개'), ('소금', '약간'), ('후추', '약간')]","오늘은 감바스! 감바스 알 아히요 를 만들어봤습니다.
흔히들 감바스로 많이들 알고 계시는데요.
감바스는 스페인어로 새우를 뜻하구요. 알 아히요는 마늘을 뜻 합니다.
주재료가 새우와 올리브유, 마늘이다 보니깐 이런 이름이 붙은거 같습니다.
일반적으로 바게트빵과 함께 먹는데요. 
굳이 식빵이 있다면 토스트해서 함께 곁들여도되구요
만들기도 간단하고, 은근히 고급져 보이는 음식이라 
손님 초대할때 가볍게 쓱 만들기도 좋구요.
한번 먹으면 가끔 생각나는 맛이에요.","[{'step_number': 1, 'description': '먼저 마늘을 5알-6알 정도 얇게 슬라이스 해주시구요.', 'image_url': 'https://recipe1.ezmember.co.kr/cache/recipe/2018/12/05/2a5ac2c3c9c37c874f1db51f164bb89c1.png'}, {'step_number': 2, 'description': '페퍼론치노가 있으시다면 잘게 다져주시구요. \n저는 없어서 청양고추 1개를 잘게 다졌습니다. \n매운맛 싫어하신 분들도 1개 넣어주시면 좋아요. \n기름에 튀기면 그렇게 많이 안맵고, \n느끼한 맛을 싸악 잡아주거든요.', 'image_url': 'https://recipe1.ezmember.co.kr/cache/recipe/2018/12/05/d1633e266b5facf6a6c775d2e4e724731.png'}, {'step_number': 3, 'description': '그 다음 바지락은 깨끗하게 씻어서 준비해주시구요.\n넣으면 더 맛있긴 하지만...없으면 안넣으셔도 되구, \n껍질 까진거 넣으셔도 됩니다.', 'image_url': 'https://recipe1.ezmember.co.kr/cache/recipe/2018/12/05/7f350181088083ba6696ac2c083d76c01.png'}, {'step_number': 4, 'description': '\ufeff새우는 머리와 껍질을 까줍니다. \n껍질 깔 때는 새우 뿔에 손이 찔리지 않게 \n항상 조심하시구요.', 'image_url': 'https://recipe1.ezmember.co.kr/cache/recipe/2018/12/05/8936d002a456f35391367af6a7bb6fd81.png'}, {'step_number': 5, 'description': '냄비에 재료가 어느정도 잠길정도로 \n올리브유를 부어주어주시고\n(넉넉하게 넣어주세요)\n기름이 달궈지면 마늘과 고추를 넣고 한번 볶아주시구요.\n(2-3분가량)', 'image_url': 'https://recipe1.ezmember.co.kr/cache/recipe/2018/12/05/c53dbe40615ec46e1850c77bada64d951.png'}, {'step_number': 6, 'description': '마늘이 어느정도 튀겨졌다 싶으면 새우와, \n바지락을 넣고 익혀주세요.\n새우가 붉게 익고, 바지락 입이 다 벌어지면 \n다 익은거예요.', 'image_url': 'https://recipe1.ezmember.co.kr/cache/recipe/2018/12/05/fcb490f637c46bcb8f98446c35e0ffc31.png'}, {'step_number': 7, 'description': '재료들이 다 익으면\n소금과 후추로 간을 맞춰주세요. \n감바스는 조금 짭조름한게 맛있어요. \n그래서 은근히 소금이 많이 들어가는데요.\n한번에 많이 넣지 마시고, \n조금씩 간을 맞추면서 넣으셔야 됩니다.왜냐면 한꺼번에 넣으면 아래에 소금이 가라앉아서 먹다보면 짜질수 있거든요..이점 주의하시구요.', 'image_url': 'https://recipe1.ezmember.co.kr/cache/recipe/2018/12/05/81ddc121e0b4421f9aa1ffb3a437ab031.png'}, {'step_number': 8, 'description': '이렇게 바게트와 함께 먹으면...\n어우..진짜 맛있습니다..\n이렇게 레시피 쓸 때마다 또 먹고싶어서\n너무 곤욕스럽네요..ㅜㅠ\n기름과 빵 그리고 새우의 조화는 환상적인 맛입니다..\n매번 하는 말 같은데 이것도 꼭 해드세요! \n진짜진짜 맛있습니다..', 'image_url': 'https://recipe1.ezmember.co.kr/cache/recipe/2018/12/05/43256096035f93c09c874da3e8fb89ae1.jpg'}]"
156227,양식,손님접대,해물류,끓이기,통통튀는 새우가 치즈속에 @_@ 새우퐁듀치즈 ★,새우퐁듀치즈,https://recipe1.ezmember.co.kr/cache/recipe/2019/05/24/01d7fb749cf367b6277384df46a4b1b21.jpg,"24,581",20분 이내,아무나,2인분,"[('새우', '1종이컵'), ('소금', '약간'), ('후추', '약간'), ('마늘', '3알'), ('올리브유', '약간'), ('페퍼론치노', '3개'), ('크림치즈', '1종이컵'), ('우유', '1종이컵'), ('피자치즈', '2종이컵')]","탱글탱글 보기만해도 기분좋아지는 새우 ★
크림치즈와 피자치즈에 풍덩 고소한 맛에 홀릭 ★
세상의 모든 레시피 만개의레시피","[{'step_number': 1, 'description': '마늘을 슬라이스한다.', 'image_url': 'https://recipe1.ezmember.co.kr/cache/recipe/2019/05/24/4291baf1949f4eda160f3146e3c09c981.png'}, {'step_number': 2, 'description': '팬에 오일을 두르고 마늘을 볶다가 새우를 볶는다.팬', 'image_url': 'https://recipe1.ezmember.co.kr/cache/recipe/2019/05/24/2d7c62ba3c659e9c63667f4dae1949dc1.png'}, {'step_number': 3, 'description': '페퍼론치노, 소금, 후추를 넣는다.', 'image_url': 'https://recipe1.ezmember.co.kr/cache/recipe/2019/05/24/bd916f2703196417ec9a85cce60cdd7f1.png'}, {'step_number': 4, 'description': '크림치즈퐁듀재료를 고루 섞어 전자레인지에 3분간 돌린다.전자레인지', 'image_url': 'https://recipe1.ezmember.co.kr/cache/recipe/2019/05/24/2be4a63bd56ad167e786e677f79bdbad1.png'}, {'step_number': 5, 'description': '새우가 구워진 팬에 녹인 크림치즈퐁듀를 넣고 약불로 자글자글 끓여 완성한다.팬', 'image_url': 'https://recipe1.ezmember.co.kr/cache/recipe/2019/05/24/0cb6ba0574dc618086d98593d5f5c6131.png'}]"
156228,양식,손님접대,해물류,끓이기,"새우감바스, 간단한 홈파티 음식, 바질페스토만 넣으면 감바스 완성",새우감바스,https://recipe1.ezmember.co.kr/cache/recipe/2021/12/30/1ad939578acd2ca778be6e4f3b16d7ee1.jpg,"5,209",30분 이내,아무나,3인분,"[('냉동 새우', '12마리'), ('마늘', '20개'), ('올리브유', '180ml'), ('페페론치노', '6개'), ('바질페스토', '1T'), ('맛술', '1T'), ('소금', '약간'), ('후추', '약간')]","연말이지만 외출은 자제해야 하니 홈파티 음식을 찾게 되네요~ 연말에 홈파티 음식으로 간단하면서도 맛보장인 새우감바스 소개해 드릴게요. 
빵에 새우 하나, 마늘 몇 조각 올려서 오일에 푹 담가 먹으면 너무 맛있어요. 이번에 소개드리는 감바스는 바질페스토만 넣고 간단하게 맛을 낼 수 있는 방법이라 요린이도 도전해 보기 좋은 메뉴입니다. 비주얼도 좋고, 맛 보장이라 손님상차림, 홈파티 메뉴로 강추드려요~","[{'step_number': 1, 'description': '냉동새우는 해동 후 껍질을 까서 준비해 주세요. 손질한 새우에 맛술, 소금, 후추를 뿌려서 밑간을 해 주세요.새우 12마리, 맛술 1T, 소금 약간, 후추 약간새우 손질 할때 꼬리를 남겨 놓으면 훨씬 먹음직스러워 보여요.새우 손질법 레시피', 'image_url': 'https://recipe1.ezmember.co.kr/cache/recipe/2021/12/30/173d933cf3f2eb2f6f1627ca692d8d661.jpg'}, {'step_number': 2, 'description': '마늘은 편으로 썰어서 준비해 주었어요.마늘 20개마늘을 거의 튀기듯이 익혀줄 거라서 풍미가 좋아서 마늘 좋아하시면 좀 많다 싶게 준비하셔도 좋아요~', 'image_url': 'https://recipe1.ezmember.co.kr/cache/recipe/2021/12/30/95545587eb4eb52da98ecd010cf691a31.jpg'}, {'step_number': 3, 'description': '마늘은 키친타월로 물기와 마늘 진액을 닦아 주세요. 그래야 마늘이 눅눅하지 않게 맛있게 익어요^^', 'image_url': 'https://recipe1.ezmember.co.kr/cache/recipe/2021/12/30/7d9b417297b01392093125c0210e51661.jpg'}, {'step_number': 4, 'description': '이번에 만드는 감바스는 바질페스토 하나 넣고 간을 맞추는 초간단 버전이에요.바질페스토 없으시면 바질 or 허브가루 넣고, 파마산 치즈로 간을 맞춰주셔도 좋아요~', 'image_url': 'https://recipe1.ezmember.co.kr/cache/recipe/2021/12/30/085704fbfd478ca7947087e617dc6a8d1.jpg'}, {'step_number': 5, 'description': '팬에 올리브오일 180ml 넣고 물기를 제거한 마늘을 넣고 튀기듯이 익혀 주세요. \n오일은 재료가 잠길 정도만 준비해 주고 모자란다 싶으면 추가해 주세요.올리브오일 180ml마늘은 생각보다 금방 탈수 있어요. 잘 지켜보면서 어느 정도 익으면 약불로 줄여주세요.', 'image_url': 'https://recipe1.ezmember.co.kr/cache/recipe/2021/12/30/7615b548391ffd4a77dbf9b6f69f40301.jpg'}, {'step_number': 6, 'description': '밑간 한 새우는 키친타월로 물기를 제거 후 넣어주세요.', 'image_url': 'https://recipe1.ezmember.co.kr/cache/recipe/2021/12/30/de2301553eed3929ce835f0bd43e15c21.jpg'}, {'step_number': 7, 'description': '매콤한 맛을 좋아해서 페페론치노 부셔서 넣어 주었어요. 매운 거 싫어하시면 생략하셔도 괜찮아요.페페론치노 6개', 'image_url': 'https://recipe1.ezmember.co.kr/cache/recipe/2021/12/30/92eb4b4374b163e2ce789e8bc0bf4bbf1.jpg'}, {'step_number': 8, 'description': '새우가 어느 정도 익었으면 바질페스토 1T를 넣고 간을 해 주세요. 바질페스토가 짤 수 있으니 조금씩 넣으면서을 간을 맞춰주세요.끓고 있는 기름이니 간 보실 때 주의하셔야 해요^^', 'image_url': 'https://recipe1.ezmember.co.kr/cache/recipe/2021/12/30/830036d2fc371a8e61d8f7920d426d001.jpg'}, {'step_number': 9, 'description': '그릇에 옮겨 담고 빵과 곁들여 내면 새우감바스 완성~', 'image_url': 'https://recipe1.ezmember.co.kr/cache/recipe/2021/12/30/665d7784035cb7d53077e22031bc8da11.jpg'}]"
156229,양식,손님접대,해물류,끓이기,까수엘라만들기-집밥 백선생의 만능오일,까수엘라,https://recipe1.ezmember.co.kr/cache/recipe/2016/08/22/8d66f4cb97b9526ce56e1a2d9770a79d1.jpg,"3,596",30분 이내,아무나,4인분,"[('새우', '15마리'), ('오징어몸통', '1마리'), ('양송이버섯', '8개'), ('만능오일', '3국자'), ('올리브오일', '1/3컵'), ('소금', '1/2수저')]",까수엘라~! 스페인 요리라는데~ 술안주로 좋다는데~!! 임신과 출산... 모유 수유 때문에 술을 입에 안 댄 지 어~언 3년... 저녁 메뉴로 내놓았더니 처음 남편 반응은 영 ㅋㅋㅋ 그래도 맛을 보더니 하트 뿅뿅 하시더라^^,"[{'step_number': 1, 'description': '자숙 새우 사면 될 것을... 이왕이면 생새우가 저 맛 좋을 것 같아 사서 고생한 불량주부 ㅡㅡ;;; 새우는 천일염 넣어 여러 번 씻어내고 머리를 때고 껍질을 벗겨 준비. 이쑤시개로 내장 제거~!', 'image_url': 'https://recipe1.ezmember.co.kr/cache/recipe/2016/08/22/7c0079013af8a21e401161a7ffad35611.jpg'}, {'step_number': 2, 'description': '오징어는 껍질 벗겨 몸통만 먹기 좋은 크기로 썰어 준비해주고 양송이버섯도 썰어 준비~!', 'image_url': 'https://recipe1.ezmember.co.kr/cache/recipe/2016/08/22/223ca7a5eee690124e0df6468472af1c1.jpg'}, {'step_number': 3, 'description': '만능 오일 3국자와', 'image_url': 'https://recipe1.ezmember.co.kr/cache/recipe/2016/08/22/2e71fee07f4b19c69c1bd120ec1b4da71.jpg'}, {'step_number': 4, 'description': '올리브오일 1/3컵을 추가해주고 소금 1/2수저도 넣어 저어 주었다.', 'image_url': 'https://recipe1.ezmember.co.kr/cache/recipe/2016/08/22/9c6805eaabc04fa70d359bb596b800fd1.jpg'}, {'step_number': 5, 'description': '재료들을 뚝배기에 담고 약불로 끓이기 시작~!', 'image_url': 'https://recipe1.ezmember.co.kr/cache/recipe/2016/08/22/9f77c7d782de503461cb3264ff29acbf1.jpg'}, {'step_number': 6, 'description': '해물이라 금방 익어가고~! 마늘향이 솔솔~! 완성된 까수엘라~!', 'image_url': 'https://recipe1.ezmember.co.kr/cache/recipe/2016/08/22/6cac7ec547c114f15eef54e558fe4bf11.jpg'}, {'step_number': 7, 'description': '집에 있던 식빵, 모닝빵, 미니 크루아상을 접시에 담아 함께 먹기~! 오일 요리인데 먹는 동안 느끼하다고 느끼지 못하고 매콤 담백 적당히 짭짤한 맛이 완전 내 스타일~!남편도 밥 안 주고 빵 준다고 좋지 않은 표정이었는데 먹어보더니 바뀌는 표정 ㅎㅎㅎ 맛있다며 연신 빵을 찍어먹더라~! 버섯도 맛있지만 새우가 젤 맛나더라는^^남편님아~ 나 아님 너 어디 가서 이런 거 먹어보겠누? 감사하며 살아봅시다 ㅋㅋㅋ 손님 접대용으로도 간단하고 폼나는 요리일듯하다~! 널 애정 하겠어!', 'image_url': 'https://recipe1.ezmember.co.kr/cache/recipe/2016/08/22/f23cddd86f544a01a07784bac3a9e4481.jpg'}]"
156230,양식,손님접대,해물류,끓이기,감바스 알 아히요 만들기,감바스알아히요,https://recipe1.ezmember.co.kr/cache/recipe/2018/02/08/c725f3d5da7d74995b80140189fefaab1.jpg,"849,525",15분 이내,초급,3인분,"[('새우', '3컵'), ('올리브오일', '1.5컵'), ('마늘', '1/2컵'), ('페페론치노', '4~5개'), ('소금', '톡톡'), ('후추', '톡톡'), ('바게트빵', '')]",감바스 알 아히요 만들기 오일 파스타가 먹고 싶을 때 만들면 좋은 감바스 알 아히요~ 올리브오일에 익힌 새우를 바게트 빵과 맛있게 먹고 남은 올리브오일로 파스타를 만들어 먹을 수 있다,"[{'step_number': 1, 'description': '마늘은 편으로 썰어서 준비', 'image_url': 'https://recipe1.ezmember.co.kr/cache/recipe/2018/03/02/dc02132d7e8953c1617b00795dc186321.jpg'}, {'step_number': 2, 'description': '새우는 소금과 후추를 넣어 준비 소금은 1/3 t 정도가 적당하다', 'image_url': 'https://recipe1.ezmember.co.kr/cache/recipe/2018/03/02/d85e7b97534842b89f830bac45d1f9c71.jpg'}, {'step_number': 3, 'description': '페페론치노를 넣어 오일의 느끼함을 잡아준다 페페론치노는 잘게 잘라 줄수록 매운맛이 더 난다', 'image_url': 'https://recipe1.ezmember.co.kr/cache/recipe/2018/03/02/ac2e0f96dc9ad2d82b6be298944e7ba61.jpg'}, {'step_number': 4, 'description': '작은 팬을 사용 올리브오일을 넣고 끓여준 뒤 페페론치와 마늘을 넣어 튀겨준다', 'image_url': 'https://recipe1.ezmember.co.kr/cache/recipe/2018/03/02/a698d0ded00b6132799723789a6df6701.jpg'}, {'step_number': 5, 'description': '소금과 후추로 밑간을 한 새우를 같이 넣고 튀겨준다', 'image_url': 'https://recipe1.ezmember.co.kr/cache/recipe/2018/03/02/7ab3e626f635ba646f0421bce8ed62e61.jpg'}, {'step_number': 6, 'description': '좋아하는 허브를 같이 넣어 줘도 좋다 하지만 향이 강한 허브를 넣어 줬더니 마늘향을 못 느끼겠더라는^^;;', 'image_url': 'https://recipe1.ezmember.co.kr/cache/recipe/2018/03/02/42d371eab7b185ce8a0b8fe4ea0aa83c1.jpg'}, {'step_number': 7, 'description': '새우가 익으면 조리 과정은 끝이 난다 바게트빵과 같이 먹고 남은 올리브오일은 스파게티 면만 익혀서 넣어 주면 오일파스타가 만들어진다', 'image_url': 'https://recipe1.ezmember.co.kr/cache/recipe/2018/03/02/b48eb5fdaa90caf20faa6ff2ff8841601.jpg'}]"
