index,종류별,상황별,재료별,방법별,글 제목,레시피이름,레시피이미지,조회수,조리시간,난이도,인분,재료,소개글,조리순서
47985,국/탕,일상,건어물류,끓이기,귀빠진 날 먹는 소고기 미역국,소고기미역국,https://recipe1.ezmember.co.kr/cache/recipe/2015/10/27/1b7116e95183a4dbb74ce6d43f98ec21.jpg,"7,685",30분 이내,초급,3인분,"[('건미역', '10g'), ('소고기(국거리)', '100g'), ('생수                                                                                1컵: 200ml', '5컵'), ('참기름', '1T'), ('집간장', '1T'), ('다진 마늘', '1/2Ts'), ('꽃소금                                                                                취향껏', '1Ts')]",쉽지만 맛은 담백하고 구수한 소고기 미역국입니다.,"[{'step_number': 1, 'description': '먼저 건미역을 30분 정도 물에 불립니다. 불리면 양이 7~10배 정도 늘어나니까 아주 조금만 불리세요. 위의 분량은 손으로 잡았을 때 반 줌도 채 안되는 양이니까 참고하세요.', 'image_url': 'https://recipe1.ezmember.co.kr/cache/recipe/2015/10/29/f36d7569fa559a3d506a978b737c1a1e1.jpg'}, {'step_number': 2, 'description': '불어난 미역은 몇 번 바락바락 주물러 씻어서 찬물에 헹궈서 물기를 빼요. 그리고 먹기좋은 크기로 잘라요. 요즘 미역은 깨끗하지만 혹시 불순물이 있으면 이때 제거해 주세요.', 'image_url': 'https://recipe1.ezmember.co.kr/cache/recipe/2015/10/29/5115fea5f9c3fcbefbdaa2f7888b136f1.jpg'}, {'step_number': 3, 'description': '냄비에 참기름을 두르고 미역을 중간불에 타지않게 볶아요. 미역이 녹색빛을 띨 정도로 볶다가 소고기를 넣고 같이 볶아요.', 'image_url': 'https://recipe1.ezmember.co.kr/cache/recipe/2015/10/29/2e5c6ef276ba69b4a1b79faba56e9d991.jpg'}, {'step_number': 4, 'description': '소고기가 거의 다 익으면 물을 붓고 센불에 팔팔 끓여요. 15~20분 정도 팔팔 끓이다가 집간장과 소금으로 간을 하고 다진마늘도 넣은 후 한소끔 끓으면 중간불~약불로 낮춰서 10분 정도 뭉근한 불에 끓여요. 미역국은 국물이 뽀얗게 되도록 오래 끓여야 맛있어요.', 'image_url': 'https://recipe1.ezmember.co.kr/cache/recipe/2015/10/29/45deb78cb87307ec72ade8e51691df9f1.jpg'}, {'step_number': 5, 'description': '부족한 간은 소금으로 취향껏 간을 맞추세요. 참고로 저는 집간장으로만 간을 하면 색이 너무 진해지고 소금으로만 간하면 미역국은 맛이 안나기 때문에 집간장 한 큰술과 꽃소금 한 작은술을 넣었어요.', 'image_url': 'https://recipe1.ezmember.co.kr/cache/recipe/2015/10/29/092db76ce585dbafe1f321941e2022f01.jpg'}]"
47986,국/탕,일상,건어물류,끓이기,미역국 맛있게 끓이기 위한 7가지 조건~멸치미역국,멸치미역국,https://recipe1.ezmember.co.kr/cache/recipe/2018/03/08/1cdf2785e63528ba52686d3fc4c1486c1.jpg,"15,650",30분 이내,중급,4인분,"[('건미역', '30g'), ('쌀뜨물', '5~6컵'), ('멸치', '적당량'), ('다시마', '적당량'), ('참기름 + 들기름', '1큰술'), ('국간장', '1큰술'), ('소금', '간맞추기'), ('다진마늘', '1/2큰술'), ('들깨가루', '적당량')]","누구나 끓이는 미역국이지만
조금만 신경쓰면 
소고기나 해물 등을 넣지 않고도
더 맛있는 미역국을 끓일 수 있어요
(요리팁에 7가지 조건을 첨부해 두었어요)","[{'step_number': 1, 'description': '마른 미역을 물에 씻은 후 생수에 담궈 불린다\n이때 미역을 국물 양에 비해 조금 많다 싶게 준비한다\n미역이 많이 들어가야 그 자체에서 우러나오는 맛으로 국물맛이 더 맛있어진다', 'image_url': 'https://recipe1.ezmember.co.kr/cache/recipe/2018/03/08/640538bd0e69fd159b75363eaae9d22a1.jpg'}, {'step_number': 2, 'description': '쌀뜨물을 받아 다시마를 두어장 담가둔다', 'image_url': 'https://recipe1.ezmember.co.kr/cache/recipe/2018/03/08/acef0140f3a8eb3d245a53c4d6eb820d1.jpg'}, {'step_number': 3, 'description': '냄비에 참기름과 들기름을 넣고 마늘을 타지않게 볶는다음,', 'image_url': 'https://recipe1.ezmember.co.kr/cache/recipe/2018/03/08/f796186bbe0e45b16441c7c01aa861c31.jpg'}, {'step_number': 4, 'description': '미역이 다 불어나면 꼭 짠 후 4-5등분으로 잘라 국간장과 함께 볶는다\n( 미역불린 물도 버리지 말고\n국물 끓이는데 넣어준다)', 'image_url': 'https://recipe1.ezmember.co.kr/cache/recipe/2018/03/08/93d0c670e1d5bd328ec274977ba9988e1.jpg'}, {'step_number': 5, 'description': '미역을 볶는 동안 step2의 쌀뜨물에 다시멸치를 넉넉히 넣고 은근한 불에서 끓여 다시국물을 만든다', 'image_url': 'https://recipe1.ezmember.co.kr/cache/recipe/2018/03/08/2c904f227856f09cd0f34521892115141.jpg'}, {'step_number': 6, 'description': '미역이 어느 정도 볶아지고 다시국물도 우러나면 \n다시국물의 1/3쯤 넣어 미역국을 바글바글 끓인다', 'image_url': 'https://recipe1.ezmember.co.kr/cache/recipe/2018/03/08/2901f670d7734f8f887f7c5cdafdec861.jpg'}, {'step_number': 7, 'description': '미역국이 팔팔 끓으면 다시국물을 1/3쯤 더 넣고 끓이고\n또 팔팔 끓으면 다시국물을 다 넣고 한번 더 끓인다\n마지막에 간을 보아 천일염을 넣어 간을 맞춘다', 'image_url': 'https://recipe1.ezmember.co.kr/cache/recipe/2018/03/08/d0d8771b5e1e0325f6746c10f9c81a411.jpg'}, {'step_number': 8, 'description': '대접에 미역국을 떠서 그대로 먹어도 좋고 들깨가루를 조금 넣어 먹으면\n들깨미역국과는 다른 시원하고 구수한 맛을 함께 맛볼 수 있다', 'image_url': 'https://recipe1.ezmember.co.kr/cache/recipe/2018/03/08/10dc2f8a59a1be1c0357755dd3b7bb781.jpg'}]"
47987,국/탕,일상,건어물류,끓이기,소고기 없이 미역국 끓이기,미역국,https://recipe1.ezmember.co.kr/cache/recipe/2023/02/04/f712d525d3379af2ba0a0be3f3e0eb2b1.jpg,"12,948",30분 이내,아무나,2인분,"[('미역', '15g'), ('들기름', '0.5T'), ('참기름', '0.5T'), ('국간장', '1T'), ('다진마늘', '1t'), ('물', '1L'), ('멸치액젓', '0.8T')]","미역은 혈액순환 개선에 도움을 주는데요
소고기나 바지락을 넣어 끓여도 맛있지만
아무 재료도 넣지 않고 맛있는게 미역국이랍니다

집에 미역만 있으신 분들
소고기 없이 미역국 끓이기 해보아요","[{'step_number': 1, 'description': '2인분 미역국 미역 양은\n10~15g으로 준비해 주세요미역 15g저는 15g 사용했는데 생각보다 양이 적죠?\n물에 불리면 많아진답니다', 'image_url': 'https://recipe1.ezmember.co.kr/cache/recipe/2023/02/04/788d0082ddeca69f3b25049dc92e6d591.jpg'}, {'step_number': 2, 'description': '미역을 차가운 물에 15분간 불려주세요', 'image_url': 'https://recipe1.ezmember.co.kr/cache/recipe/2023/02/04/87feff43dd6e6b719b396ac69bda5d391.jpg'}, {'step_number': 3, 'description': '아까 그 적어 보였던 미역 양이\n물에 불리면 이렇게 많아진답니다', 'image_url': 'https://recipe1.ezmember.co.kr/cache/recipe/2023/02/04/1654c5452183e5c957e1834f41d9c4ac1.jpg'}, {'step_number': 4, 'description': '이건 선택사항이지만\n저는 미역줄기의 식감을 안 좋아해서\n전부 가위로 자르는 편이에요불린 미역의 길이를 보시고\n길이가 길다면\n먹기 좋은 크기로 잘라주세요 :)', 'image_url': 'https://recipe1.ezmember.co.kr/cache/recipe/2023/02/04/0e375746d6975bf33bbd2152a407b47c1.jpg'}, {'step_number': 5, 'description': '미역 손질 후에는\n흐르는 물에 미역을 3번 깨끗하게 씻어주세요미역을 헹궈주지 않을 경우\n미역국에서 비린내 날 수 있어요', 'image_url': 'https://recipe1.ezmember.co.kr/cache/recipe/2023/02/04/53e30a0c9d37d5d1377b95ae21a4974f1.jpg'}, {'step_number': 6, 'description': '씻은 미역은 두 손으로 꼭 짠 후\n체에 밭쳐서 물기를 빼주세요', 'image_url': 'https://recipe1.ezmember.co.kr/cache/recipe/2023/02/04/54c9d195b5113318a227b3289e55e61f1.jpg'}, {'step_number': 7, 'description': '불세기를 중불로 올려주시고\n들기름 0.5T 넣어주세요들기름 0.5T중불', 'image_url': 'https://recipe1.ezmember.co.kr/cache/recipe/2023/02/04/e2a6a0bfe9407ca9f25a54a52245f2fd1.jpg'}, {'step_number': 8, 'description': '참기름 0.5T 넣어주세요참기름 0.5T들기름과 참기름 둘 다 넣고 볶으면\n맛과 향이 더 고소해진답니다', 'image_url': 'https://recipe1.ezmember.co.kr/cache/recipe/2023/02/04/c87099bd961175f3da022cdb32e8b2e31.jpg'}, {'step_number': 9, 'description': '냄비에 열이 오르면\n물기를 짠 미역을 넣고 볶아주세요\n미역에 들기름과 참기름의\n맛이 벨 수 있도록 4~5번 뒤적여주세요', 'image_url': 'https://recipe1.ezmember.co.kr/cache/recipe/2023/02/04/588035168f1b2d219640fbfbf54bb6ee1.jpg'}, {'step_number': 10, 'description': '국간장 1T 넣어주세요국간장 1T', 'image_url': 'https://recipe1.ezmember.co.kr/cache/recipe/2023/02/04/4e54aa504fb4d35d215d33f169462add1.jpg'}, {'step_number': 11, 'description': '다진 마늘 1t 넣어주세요다진 마늘 1t미역에 간을 먼저 하고 국을 끓이면\n미역국 맛이 더욱 진하고 깊어진답니다', 'image_url': 'https://recipe1.ezmember.co.kr/cache/recipe/2023/02/04/d276787c43c5e408a35821da6fc5762b1.jpg'}, {'step_number': 12, 'description': '미역에 간이 벨 수 있도록 8분간 볶아주세요미역을 오래 볶으면\n미역국 국물이 맑고 깨끗해져요', 'image_url': 'https://recipe1.ezmember.co.kr/cache/recipe/2023/02/04/15821de34ebb7337c484bfdacab808f21.jpg'}, {'step_number': 13, 'description': '8분 후에는 물 200ml를 넣고\n2분간 추가로 더 끓여주세요물 200ml', 'image_url': 'https://recipe1.ezmember.co.kr/cache/recipe/2023/02/04/166724ea7a1e0abe60b849b248ccb19c1.jpg'}, {'step_number': 14, 'description': '멸치 액젓 0.8T 넣어주세요멸치 액젓 0.8T 까나리액젓이나 참치 액젓을\n멸치 액젓 대신 사용하셔도 좋아요', 'image_url': 'https://recipe1.ezmember.co.kr/cache/recipe/2023/02/04/81ed08e65dc678c402eb93e6848420da1.jpg'}, {'step_number': 15, 'description': '물 500ml를 넣고 한소끔 끓여주세요\n보글보글 끓어오르면 간을 보고\n부족한 간은 소금으로 맞춰주세요물 500ml액젓이나 국간장을 계속 넣으면\n국물 색이 어두워져서 안 예뻐요', 'image_url': 'https://recipe1.ezmember.co.kr/cache/recipe/2023/02/04/1fda68883b7e875d0bd31c8cde68f9941.jpg'}, {'step_number': 16, 'description': '미역국 표면에 뜨는 거품은\n수저로 떠서 버려주시면 됩니다한소끔 끓고 간도 딱 맞는다면\n불을 꺼주세요 완성이에요\n미역국 끓이기 정말 쉽죠?', 'image_url': 'https://recipe1.ezmember.co.kr/cache/recipe/2023/02/04/a64f719697ab2bc2ef0492b3f4f634091.jpg'}]"
47988,국/탕,일상,건어물류,끓이기,[북어국]집밥 백선생 북어국 끓이기,북어국,https://recipe1.ezmember.co.kr/cache/recipe/2015/10/15/f4f5f25435ad496118bdcac4a409b8d21.jpg,"48,863",30분 이내,아무나,3인분,"[('북어채', '60g'), ('무', '100g'), ('콩나물', '100g'), ('마늘', '6알'), ('대파', '1개'), ('청양고추', '3개'), ('두부', '1모'), ('계란', '2개'), ('참기름', '4T'), ('쌀뜨물', ''), ('국간장', '1~2T'), ('새우젓', '1~2T')]","10월13일에 집밥 백선생 프로그램에서 방영되었던 북어국 입니다, 백선생님이 끓이신거에서 몇가지 재료를 추가했습니다. 북어국은 해장으로도 좋고 술안주로도 좋아요.","[{'step_number': 1, 'description': '북어는 물에 살짝 담구고 물기를 짜주세요. 너무 꽉 안짜도 됩니다. 물기를 짠 북어물은 버리지 마세요.', 'image_url': 'https://recipe1.ezmember.co.kr/cache/recipe/2015/10/15/1936dd0e4907295b38e3b980900e16a01.jpg'}, {'step_number': 2, 'description': '콩나물은 깨끗이 씻어주세요. 무는 채썰어주세요. 마늘은 편으로 썰어주세요. 고추는 어슷썰기로 썰어주세요. 파는 송송 썰어주세요. 어슷썰기 해도 됩니다. 두부는 먹기 좋은 크기로 취향것 잘라주세요.\n*집밥 백선생님께서는 파, 고추, 마늘만 사용하셨어요. 하지만 무와 콩나물이 들어가면 국물이 더 시원합니다.\n*그리고 집밥 백선생님께서는 간마늘을 사용하셨는데 간마늘은 국물이 지져분해질수 있어서 저는 편마늘을 사용했어요.', 'image_url': 'https://recipe1.ezmember.co.kr/cache/recipe/2015/10/15/18562a139bbd40b1a03188834d71466b1.jpg'}, {'step_number': 3, 'description': '계란은 완전히 잘 풀지 마시고 대충 풀어주세요. 그래야 흰자와 노른자가 잘 섞이지 않아서 보기가 더 좋아요.', 'image_url': 'https://recipe1.ezmember.co.kr/cache/recipe/2015/10/15/74be2382327f03abda33d3eee3433e5a1.jpg'}, {'step_number': 4, 'description': '쌀을 씻고 쌀뜨물을 버리지 마세요. 첫번째와 두번째 씻은 물은 버려주세요. 농약때문에 버려주시는게 좋아요. 세번째 씻은 물은 버리지 마세요.', 'image_url': 'https://recipe1.ezmember.co.kr/cache/recipe/2015/10/15/49661684fc5320d7ac06db0aa2ae3c3c1.jpg'}, {'step_number': 5, 'description': '냄비에 참기름 4T를 넣고 북어와 무를 볶아주세요. 충분히 볶아 주세요. 마른 북어채를 볶아주면 타기때문에 꼭 물에 적셔주셔야 합니다. Step1 참조.', 'image_url': 'https://recipe1.ezmember.co.kr/cache/recipe/2015/10/15/856bf1900a3a4b870999196e2f63068e1.jpg'}, {'step_number': 6, 'description': '무와 북어채를 잘 볶아주셨으면 쌀뜨물과 북어 담궈두었던 물을 부어주세요. 쌀뜨물과 북어 담궈둔 물의 비율은 상관없어요. 인원수 양에 맞게 조절해서 물양을 맞추면 됩니다.', 'image_url': 'https://recipe1.ezmember.co.kr/cache/recipe/2015/10/15/59a882a6df5944c44601641d3f688e371.jpg'}, {'step_number': 7, 'description': '물이 끓기 시작하면 콩나물과 마늘을 넣어주세요. 그리고 국간장 1-2T를 넣어주세요. 국간장으로 간을 맞추는게 아니고 향을 내기 위한겁니다. 많이 넣으면 국물이 까맣게 됩니다. 간은 새우젓으로 해주세요. 한번에 1-2T를 넣지 마시고 조금씩 넣어가면서 취향것 간을 맞추세요. 새우젓이 싫으시면 소금으로 간을 맞춰도 됩니다.', 'image_url': 'https://recipe1.ezmember.co.kr/cache/recipe/2015/10/15/71be05fd4b5b06a8945456d03c8b0e2f1.jpg'}, {'step_number': 8, 'description': '재료들이 다 익으면 계란물을 원을 그리면서 부어주세요. 한번에 한곳에 다 부어버리면 계란이 뭉칩니다.', 'image_url': 'https://recipe1.ezmember.co.kr/cache/recipe/2015/10/15/26b52f69de71a7309cfe79407cfaf82e1.jpg'}, {'step_number': 9, 'description': '계란물을 붓고 보글보글 끓으면 파, 고추 두부를 넣고 한소끔 끓여주세요. 두부와 파, 고추가 들어가서 간이 싱거워졌을수도 있으니 마지막으로 간을 보시고 취향것 새우젓을 추가해주시면 완성~~', 'image_url': 'https://recipe1.ezmember.co.kr/cache/recipe/2015/10/15/808ddfe51865247396a70848e1c850da1.jpg'}]"
47989,국/탕,일상,건어물류,끓이기,미역 감자국 만들기,미역감자국,https://recipe1.ezmember.co.kr/cache/recipe/2015/07/16/0fa5d6d2fd8fec393ab3adb54050c254.jpg,"18,134",30분 이내,초급,2인분,"[('불린 미역', '1줌'), ('감자 중간크기', '2개'), ('바지락살', '2줌'), ('쌀뜨물', '2~2.5L'), ('국간장', '2큰술'), ('소금', '조금')]",미역과 감자를 넣은 간단한 국 끓이는 법 소개해드립니다.,"[{'step_number': 1, 'description': '건미역을 불려 준비합니다.', 'image_url': 'https://recipe1.ezmember.co.kr/cache/recipe/2015/07/16/7453d70be1868625da2c0da37cd72aae1.jpg'}, {'step_number': 2, 'description': '감자는 도톰하게 썰어 준비해주세요.', 'image_url': 'https://recipe1.ezmember.co.kr/cache/recipe/2015/07/16/4c1ff30842c81af1581c1ab178a017c41.jpg'}, {'step_number': 3, 'description': '쌀뜨물을 넣고 팔팔 끓이시다가, 바지락살을 넣어주세요.', 'image_url': 'https://recipe1.ezmember.co.kr/cache/recipe/2015/07/16/edb66b62b9a469478ace2d0c3252277b1.jpg'}, {'step_number': 4, 'description': '불린 미역의 물기를 꽉 짠후 넣어 끓입니다.', 'image_url': 'https://recipe1.ezmember.co.kr/cache/recipe/2015/07/16/9e9fb04ede2d7ce1e411e6d34c5ea93a1.jpg'}, {'step_number': 5, 'description': '국간장 2큰술을 넣어 다시 끓여주세요.', 'image_url': 'https://recipe1.ezmember.co.kr/cache/recipe/2015/07/16/1eee665f0831aa714486bfb479bdb78e1.jpg'}, {'step_number': 6, 'description': '감자를 넣어 팔팔 끓입니다.', 'image_url': 'https://recipe1.ezmember.co.kr/cache/recipe/2015/07/16/6c05ab0b653dc3b44dceb7c953bce7631.jpg'}, {'step_number': 7, 'description': '모든 재료가 잘 익으면 소금으로 간을 하고 한소끔 더 끓이면 완성입니다.', 'image_url': 'https://recipe1.ezmember.co.kr/cache/recipe/2015/07/16/3902a29b63cf6bf56e6ac24ec8bed6b41.jpg'}, {'step_number': 8, 'description': '포실포실 감자와 미역이 어우러진 국이예요. 미역 감자국 완성입니다.', 'image_url': 'https://recipe1.ezmember.co.kr/cache/recipe/2015/07/16/cb56fc87fa1879a3375500def50a2af81.jpg'}]"
47990,국/탕,일상,건어물류,끓이기,미역국 맛있게 끓이는법 - 고기없이 쌀뜨물로,미역국,https://recipe1.ezmember.co.kr/cache/recipe/2016/06/05/45e203bdc6d81993212a4e10a94243181.jpg,"25,388",60분 이내,중급,4인분,"[('미역', ''), ('쌀뜨물', ''), ('참기름', ''), ('국간장', ''), ('소금', '')]","오랜만에 고기없이 미역국 맛있게 끓이는법 해봤
어요~~

쌀뜨물과 멸치육수로 끓여서 담백하고 구수하답
니다","[{'step_number': 1, 'description': '멸치육수를 매번 우려내기 힘드시죠?~저는 그래\n서 멸치엑기스를 사서 쓴답니다^^\n육수내셔도 되고 편하게 저처럼 사쓰셔도 좋아요', 'image_url': 'https://recipe1.ezmember.co.kr/cache/recipe/2016/06/05/888a6b3aef4206695b8e3e10c47228081.jpg'}, {'step_number': 2, 'description': '건미역은 우선 다들 아시다시피 물에 불려야죠~\n물에 너무 오래 불리진 마세요!\n오래 두게되면 좋은 성분까지 녹아든다고 하더라\n구요~^^\n끓이면서 어차피 불어나니 5분 안으로 불리세요\n전 건미역 20인분 뜯어서 전부 불렸는데요\n많긴 하지만 막상 끓여서 먹어보면 20인분은 안\n되는거 같아요. .\n작은 국그릇으로 측정한듯. .ㅎㅎ\n잡채도 그렇고. .만들어보면 얼마 안되는.. .^^;\n\xa0\n무튼 미역은 불어나니 참고하시고 불리세요', 'image_url': 'https://recipe1.ezmember.co.kr/cache/recipe/2016/06/05/c16c1cde9ef8820e7c83b1660eb935851.jpg'}, {'step_number': 3, 'description': '쌀뜨물은 쌀을 씻을때 나오는 물인거 아시죠^^\n처음 번에껀 설렁설렁 버리고 두번째 세번째 헹\n굼 물을 받아서 쓰면 되요~\n이걸 넣게되면 미역국이 맹물 넣은거 보다 엄청 구수하답니다~~\n대신 들깨가루 약간 넣어도 맛있어요', 'image_url': 'https://recipe1.ezmember.co.kr/cache/recipe/2016/06/05/2e41f930c63e6d8f19f043b6ec9cf22d1.jpg'}, {'step_number': 4, 'description': '냄비에 참기름을 약간 두르고 불린 미역을 잘 볶\n아 주세요\n참기름은 되도록 소량을 쓰는게 좋은게 기름이 많이 뜨게 되면 담백함이 덜하거든요~', 'image_url': 'https://recipe1.ezmember.co.kr/cache/recipe/2016/06/05/387e6d066d8acfa7440751903673746f1.jpg'}, {'step_number': 5, 'description': '받아놓은 쌀뜨물을 넣고 멸치육수나 생수를 충분\n히 넣어줍니다\n물양은 정해진거 없어요~국물이 많은게 좋으면 많이~~!\n건더기 많은게 좋으면 적게 입맛에 맞게 조절 하\n세요~~\n산모들 미역국은 참고로 국물양이 엄청 많죠ㅎ', 'image_url': 'https://recipe1.ezmember.co.kr/cache/recipe/2016/06/05/f43f6e6198a80f77323fe9178c9c43a11.jpg'}, {'step_number': 6, 'description': '불을 줄이고 은근히 미역국을 보글보글 끓여 주\n세요~~\n간은 국간장과 소금으로 하는데요\n저는 멸치엑기스를 넣었기 때문에 국물 색이 탁\n해질듯 해서 나머진 소금으로 간했어요\n쌀뜨물과 생수만으로 끓이신다면 국간장 약간으\n로 맛과 색을 내주세요\n국간장은 많이 넣으면 국물 색이 안좋아요\n적당히 넣고 소금으로 간하세요\n마늘을 넣기도 하고 안넣기도 하는데,\n저는 미역국엔 안넣어요~취향껏', 'image_url': 'https://recipe1.ezmember.co.kr/cache/recipe/2016/06/05/548a60d2f658431bc191113041f738611.jpg'}]"
47991,국/탕,일상,건어물류,끓이기,볶지않고 푸~욱 끓여서 담백해요 - 황태미역국,None,https://recipe1.ezmember.co.kr/cache/recipe/2015/06/05/59e44d123f1462dd1778e9e6943255aa.jpg,"10,451",None,None,None,[],,[]
47992,국/탕,일상,건어물류,끓이기,매일 먹어도 맛있는 국~~들기름으로 끓인 미역국,들기름미역국,https://recipe1.ezmember.co.kr/cache/recipe/2017/06/14/2ac8de8a50c55187693f07d1ab8eac501.jpg,"6,057",60분 이내,초급,4인분,"[('대합조개', '1개'), ('미역', '200g'), ('들기름', '2큰술'), ('정종(소주)', '1큰술'), ('치킨스톡', '2개'), ('소금', '약간'), ('조선간장', '1작은술'), ('생수', '10컵')]","들기름으로 고소한맛을 낸 맛있는 미역국
오늘 저녁에 만들어보세요","[{'step_number': 1, 'description': '미역은 충분히 물에 불린후 깨끗이 씻어 먹기좋은 크기로 잘라주시고 조개는 손질한뒤 잘게 잘라주세요', 'image_url': 'https://recipe1.ezmember.co.kr/cache/recipe/2017/06/14/9d70fd623be60a14378cf3a358995ecd1.jpg'}, {'step_number': 2, 'description': '조개비린내를 없애기위해 정종을 1큰술 넣어 볶아주세요(정종대신 소주를 넣어도됩니다)', 'image_url': 'https://recipe1.ezmember.co.kr/cache/recipe/2017/06/14/1b13e4d07889ac1dba5dfdeb6bab3a321.jpg'}, {'step_number': 3, 'description': '들기름을 넣고 센불에서 볶아주세요', 'image_url': 'https://recipe1.ezmember.co.kr/cache/recipe/2017/06/14/1e3e9cbfccaeea9c833bcf176f6e58a31.jpg'}, {'step_number': 4, 'description': '멸치육수가 있으면 생수대신 육수를 사용하시고 없는경우 조미료를 넣으셔도 됩니다(전 치킨스톡을 사다놓고 사용해요)', 'image_url': 'https://recipe1.ezmember.co.kr/cache/recipe/2017/06/14/430ba933e7a0a3ce9a4b7703f592420b1.jpg'}, {'step_number': 5, 'description': '조개가 익고 미역이 부드러워지면 물을 부어주세요', 'image_url': 'https://recipe1.ezmember.co.kr/cache/recipe/2017/06/14/f5e12cdd9dacdc2ec0d15d3dc8f67c7b1.jpg'}, {'step_number': 6, 'description': '센불에서 끓여 국물이 진하게 우러나게 해주세요', 'image_url': 'https://recipe1.ezmember.co.kr/cache/recipe/2017/06/14/0ff6bab5f45cc82a3273fa4f64ea06d41.jpg'}, {'step_number': 7, 'description': '조선간장을 넣어준뒤 나머지간은 소금으로 맞춰주세요', 'image_url': 'https://recipe1.ezmember.co.kr/cache/recipe/2017/06/14/7f38ff6b2f0822c701c6c2092afdd3331.jpg'}]"
47993,국/탕,일상,건어물류,끓이기,남은 안주로 초간단 계란국 먹태계란국,먹태계란국,https://recipe1.ezmember.co.kr/cache/recipe/2018/04/12/0b75663871237bf1f2f3823506d6fbbb1.jpg,"8,049",60분 이내,아무나,3인분,"[('먹태', '2컵'), ('물', '3대접'), ('계란', '2개'), ('소고기다시다                                                                                취향껏', '1t'), ('소금', '1t'), ('참기름', '1T'), ('파', '약간')]","칭구가 저번에 마른안주를 싸주더니
이번엔 먹태를가방속에 얌전히 넣어주셨네요ㅋㅋ
저야 넘 고맙죠 

제가 뭘 가져와도 과일이 아님 
뭘해도 먹는다는걸 이젠 알았나봐요^^ 

그래서 속도 풀겸 초간단으로 
먹태계란국을 끓였어요 

사실 먹태는 구워서 나오는거라
국물맛에 좀 탄맛과 잘우러나오지 않을것
같은 느낌적인 느낌을 받았지만 걍 끓였지요 

근데 다행인게 탄맛이 전혀 없었고요
단지 국물맛이 북어보단 진하진 않아 아쉽
하지만 나름 깔끔하니 맛있었어요 

먹태는 대부분 배부를때 시키는 안주라
거의 남는게 태반일듯 해요
이럴땐 가져오셔서 담날 해장국으로
초간단 계란국 어떠세요
속도 풀이고 맛도 짱이랍니다^^ 

오늘도 맛있는 주말되세요~♡ 

제가 동영상 올리는게 아직도 미흡하지만
잘 올릴려고 노력중이니 많이 봐주세요
보강될점 있으면 말씀해주시면 더없이
감사드려요^^","[{'step_number': 1, 'description': '먹태를 준비합니다', 'image_url': None}, {'step_number': 2, 'description': '참기름 먹태를 넣고 약불로 볶습니다', 'image_url': None}, {'step_number': 3, 'description': '물을 넣고 은근히 끓입니다', 'image_url': None}, {'step_number': 4, 'description': '육수가 우러나오면 먹태를 건집니다', 'image_url': None}, {'step_number': 5, 'description': '계란에 밑간을 하고 풉니다', 'image_url': None}, {'step_number': 6, 'description': '계란을 넣습니다', 'image_url': None}, {'step_number': 7, 'description': '파를 넣습니다', 'image_url': None}]"
